MULTIHOP BFD PACKET CAPTURE EVIDENCE
============================================================

Showing BFDv1 Multihop packets between 10.0.82.3 and 10.0.14.2

20:06:52.086866 IP 10.0.14.3.45160 > 10.0.14.2.3784: BFDv1, Control, State Up, Flags: [none], length: 24
20:06:52.094797 IP 10.0.82.3.36616 > 10.0.14.2.4784: BFDv1, Multihop, State Up, Flags: [none], length: 24
20:06:52.117232 IP 10.0.14.2.47117 > 10.0.82.3.4784: BFDv1, Multihop, State Up, Flags: [none], length: 24
20:06:52.128799 IP 10.0.14.2.54259 > 10.0.14.3.3784: BFDv1, Control, State Up, Flags: [none], length: 24
20:06:52.174370 IP 10.0.14.3.45160 > 10.0.14.2.3784: BFDv1, Control, State Up, Flags: [none], length: 24
20:06:52.178650 IP 10.0.82.3.36616 > 10.0.14.2.4784: BFDv1, Multihop, State Up, Flags: [none], length: 24
20:06:52.196938 IP 10.0.14.2.47117 > 10.0.82.3.4784: BFDv1, Multihop, State Up, Flags: [none], length: 24
20:06:52.211317 IP 10.0.14.2.54259 > 10.0.14.3.3784: BFDv1, Control, State Up, Flags: [none], length: 24
20:06:52.260497 IP 10.0.14.3.45160 > 10.0.14.2.3784: BFDv1, Control, State Up, Flags: [none], length: 24
20:06:52.263032 IP 10.0.82.3.36616 > 10.0.14.2.4784: BFDv1, Multihop, State Up, Flags: [none], length: 24
20:06:52.278443 IP 10.0.14.2.47117 > 10.0.82.3.4784: BFDv1, Multihop, State Up, Flags: [none], length: 24
20:06:52.291329 IP 10.0.14.2.54259 > 10.0.14.3.3784: BFDv1, Control, State Up, Flags: [none], length: 24
