tcpdump: data link type LINUX_SLL2
tcpdump: verbose output suppressed, use -v[v]... for full protocol decode
listening on any, link-type LINUX_SLL2 (Linux cooked v2), snapshot length 262144 bytes
 00:00:00.000000 eth3  In  IP 10.0.34.3.52215 > 10.0.34.2.3784: BFDv1, Control, State Up, Flags: [none], length: 24
 00:00:00.011171 eth2  In  IP 10.0.23.2.41179 > 10.0.23.3.3784: BFDv1, Control, State Up, Flags: [none], length: 24
 00:00:00.012348 eth2  Out IP 10.0.23.3.59324 > 10.0.23.2.3784: BFDv1, Control, State Up, Flags: [none], length: 24
 00:00:00.020515 eth0  Out IP 10.0.35.2.59307 > 10.0.35.3.3784: BFDv1, Control, State Up, Flags: [none], length: 24
 00:00:00.026664 eth1  Out IP 10.0.13.3.42552 > 10.0.13.2.3784: BFDv1, Control, State Up, Flags: [none], length: 24
 00:00:00.032264 eth1  In  IP 10.0.13.2.32837 > 10.0.13.3.3784: BFDv1, Control, State Up, Flags: [none], length: 24
 00:00:00.054435 eth3  Out IP 10.0.34.2.40088 > 10.0.34.3.3784: BFDv1, Control, State Up, Flags: [none], length: 24
 00:00:00.060205 eth0  In  IP 10.0.35.3.48498 > 10.0.35.2.3784: BFDv1, Control, State Up, Flags: [none], length: 24
 00:00:00.084008 eth3  In  IP 10.0.34.3.52215 > 10.0.34.2.3784: BFDv1, Control, State Up, Flags: [none], length: 24
 00:00:00.094429 eth2  In  IP 10.0.23.2.41179 > 10.0.23.3.3784: BFDv1, Control, State Up, Flags: [none], length: 24
 00:00:00.097624 eth2  Out IP 10.0.23.3.59324 > 10.0.23.2.3784: BFDv1, Control, State Up, Flags: [none], length: 24
 00:00:00.102813 eth0  Out IP 10.0.35.2.59307 > 10.0.35.3.3784: BFDv1, Control, State Up, Flags: [none], length: 24
 00:00:00.102859 eth1  Out IP 10.0.13.3.42552 > 10.0.13.2.3784: BFDv1, Control, State Up, Flags: [none], length: 24
 00:00:00.113998 eth1  In  IP 10.0.13.2.32837 > 10.0.13.3.3784: BFDv1, Control, State Up, Flags: [none], length: 24
 00:00:00.138273 eth3  Out IP 10.0.34.2.40088 > 10.0.34.3.3784: BFDv1, Control, State Up, Flags: [none], length: 24
 00:00:00.149269 eth0  In  IP 10.0.35.3.48498 > 10.0.35.2.3784: BFDv1, Control, State Up, Flags: [none], length: 24
 00:00:00.164068 eth3  In  IP 10.0.34.3.52215 > 10.0.34.2.3784: BFDv1, Control, State Up, Flags: [none], length: 24
 00:00:00.172778 eth2  In  IP 10.0.23.2.41179 > 10.0.23.3.3784: BFDv1, Control, State Up, Flags: [none], length: 24
 00:00:00.181006 eth2  Out IP 10.0.23.3.59324 > 10.0.23.2.3784: BFDv1, Control, State Up, Flags: [none], length: 24
 00:00:00.181080 eth0  Out IP 10.0.35.2.59307 > 10.0.35.3.3784: BFDv1, Control, State Up, Flags: [none], length: 24
 00:00:00.190770 eth1  In  IP 10.0.13.2.32837 > 10.0.13.3.3784: BFDv1, Control, State Up, Flags: [none], length: 24
 00:00:00.190885 eth1  Out IP 10.0.13.3.42552 > 10.0.13.2.3784: BFDv1, Control, State Up, Flags: [none], length: 24
 00:00:00.218045 eth3  Out IP 10.0.34.2.40088 > 10.0.34.3.3784: BFDv1, Control, State Up, Flags: [none], length: 24
 00:00:00.237562 eth0  In  IP 10.0.35.3.48498 > 10.0.35.2.3784: BFDv1, Control, State Up, Flags: [none], length: 24
 00:00:00.252697 eth2  In  IP 10.0.23.2.41179 > 10.0.23.3.3784: BFDv1, Control, State Up, Flags: [none], length: 24
 00:00:00.252705 eth3  In  IP 10.0.34.3.52215 > 10.0.34.2.3784: BFDv1, Control, State Up, Flags: [none], length: 24
 00:00:00.258886 eth2  Out IP 10.0.23.3.59324 > 10.0.23.2.3784: BFDv1, Control, State Up, Flags: [none], length: 24
 00:00:00.264032 eth0  Out IP 10.0.35.2.59307 > 10.0.35.3.3784: BFDv1, Control, State Up, Flags: [none], length: 24
 00:00:00.273733 eth1  In  IP 10.0.13.2.32837 > 10.0.13.3.3784: BFDv1, Control, State Up, Flags: [none], length: 24
 00:00:00.278929 eth1  Out IP 10.0.13.3.42552 > 10.0.13.2.3784: BFDv1, Control, State Up, Flags: [none], length: 24
 00:00:00.307080 eth3  Out IP 10.0.34.2.40088 > 10.0.34.3.3784: BFDv1, Control, State Up, Flags: [none], length: 24
 00:00:00.324983 eth0  In  IP 10.0.35.3.48498 > 10.0.35.2.3784: BFDv1, Control, State Up, Flags: [none], length: 24
 00:00:00.333875 eth2  In  IP 10.0.23.2.41179 > 10.0.23.3.3784: BFDv1, Control, State Up, Flags: [none], length: 24
 00:00:00.337916 eth3  In  IP 10.0.34.3.52215 > 10.0.34.2.3784: BFDv1, Control, State Up, Flags: [none], length: 24
 00:00:00.338016 eth2  Out IP 10.0.23.3.59324 > 10.0.23.2.3784: BFDv1, Control, State Up, Flags: [none], length: 24
 00:00:00.350155 eth0  Out IP 10.0.35.2.59307 > 10.0.35.3.3784: BFDv1, Control, State Up, Flags: [none], length: 24
 00:00:00.358915 eth1  In  IP 10.0.13.2.32837 > 10.0.13.3.3784: BFDv1, Control, State Up, Flags: [none], length: 24
 00:00:00.362085 eth1  Out IP 10.0.13.3.42552 > 10.0.13.2.3784: BFDv1, Control, State Up, Flags: [none], length: 24
 00:00:00.386315 eth3  Out IP 10.0.34.2.40088 > 10.0.34.3.3784: BFDv1, Control, State Up, Flags: [none], length: 24
 00:00:00.409037 eth0  In  IP 10.0.35.3.48498 > 10.0.35.2.3784: BFDv1, Control, State Up, Flags: [none], length: 24
 00:00:00.412073 eth2  In  IP 10.0.23.2.41179 > 10.0.23.3.3784: BFDv1, Control, State Up, Flags: [none], length: 24
 00:00:00.413225 eth2  Out IP 10.0.23.3.59324 > 10.0.23.2.3784: BFDv1, Control, State Up, Flags: [none], length: 24
 00:00:00.417139 eth3  In  IP 10.0.34.3.52215 > 10.0.34.2.3784: BFDv1, Control, State Up, Flags: [none], length: 24
 00:00:00.436389 eth0  Out IP 10.0.35.2.59307 > 10.0.35.3.3784: BFDv1, Control, State Up, Flags: [none], length: 24
 00:00:00.442622 eth1  Out IP 10.0.13.3.42552 > 10.0.13.2.3784: BFDv1, Control, State Up, Flags: [none], length: 24
 00:00:00.446824 eth1  In  IP 10.0.13.2.32837 > 10.0.13.3.3784: BFDv1, Control, State Up, Flags: [none], length: 24
 00:00:00.476111 eth3  Out IP 10.0.34.2.40088 > 10.0.34.3.3784: BFDv1, Control, State Up, Flags: [none], length: 24
 00:00:00.491479 eth0  In  IP 10.0.35.3.48498 > 10.0.35.2.3784: BFDv1, Control, State Up, Flags: [none], length: 24
 00:00:00.498681 eth2  Out IP 10.0.23.3.59324 > 10.0.23.2.3784: BFDv1, Control, State Up, Flags: [none], length: 24
 00:00:00.498755 eth2  In  IP 10.0.23.2.41179 > 10.0.23.3.3784: BFDv1, Control, State Up, Flags: [none], length: 24
 00:00:00.502344 eth3  In  IP 10.0.34.3.52215 > 10.0.34.2.3784: BFDv1, Control, State Up, Flags: [none], length: 24
 00:00:00.523596 eth0  Out IP 10.0.35.2.59307 > 10.0.35.3.3784: BFDv1, Control, State Up, Flags: [none], length: 24
 00:00:00.525214 eth1  In  IP 10.0.13.2.32837 > 10.0.13.3.3784: BFDv1, Control, State Up, Flags: [none], length: 24
 00:00:00.530440 eth1  Out IP 10.0.13.3.42552 > 10.0.13.2.3784: BFDv1, Control, State Up, Flags: [none], length: 24
 00:00:00.551633 eth3  Out IP 10.0.34.2.40088 > 10.0.34.3.3784: BFDv1, Control, State Up, Flags: [none], length: 24
 00:00:00.578928 eth0  In  IP 10.0.35.3.48498 > 10.0.35.2.3784: BFDv1, Control, State Up, Flags: [none], length: 24
 00:00:00.583320 eth2  Out IP 10.0.23.3.59324 > 10.0.23.2.3784: BFDv1, Control, State Up, Flags: [none], length: 24
 00:00:00.585471 eth2  In  IP 10.0.23.2.41179 > 10.0.23.3.3784: BFDv1, Control, State Up, Flags: [none], length: 24
 00:00:00.591244 eth3  In  IP 10.0.34.3.52215 > 10.0.34.2.3784: BFDv1, Control, State Up, Flags: [none], length: 24
 00:00:00.603466 eth0  Out IP 10.0.35.2.59307 > 10.0.35.3.3784: BFDv1, Control, State Up, Flags: [none], length: 24
 00:00:00.606178 eth1  In  IP 10.0.13.2.32837 > 10.0.13.3.3784: BFDv1, Control, State Up, Flags: [none], length: 24
 00:00:00.613364 eth1  Out IP 10.0.13.3.42552 > 10.0.13.2.3784: BFDv1, Control, State Up, Flags: [none], length: 24
 00:00:00.641521 eth3  Out IP 10.0.34.2.40088 > 10.0.34.3.3784: BFDv1, Control, State Up, Flags: [none], length: 24
 00:00:00.654504 eth0  In  IP 10.0.35.3.48498 > 10.0.35.2.3784: BFDv1, Control, State Up, Flags: [none], length: 24
 00:00:00.661182 eth2  Out IP 10.0.23.3.59324 > 10.0.23.2.3784: BFDv1, Control, State Up, Flags: [none], length: 24
 00:00:00.668743 eth2  In  IP 10.0.23.2.41179 > 10.0.23.3.3784: BFDv1, Control, State Up, Flags: [none], length: 24
 00:00:00.669768 eth3  In  IP 10.0.34.3.52215 > 10.0.34.2.3784: BFDv1, Control, State Up, Flags: [none], length: 24
 00:00:00.691968 eth0  Out IP 10.0.35.2.59307 > 10.0.35.3.3784: BFDv1, Control, State Up, Flags: [none], length: 24
 00:00:00.692015 eth1  Out IP 10.0.13.3.42552 > 10.0.13.2.3784: BFDv1, Control, State Up, Flags: [none], length: 24
 00:00:00.692080 eth1  In  IP 10.0.13.2.32837 > 10.0.13.3.3784: BFDv1, Control, State Up, Flags: [none], length: 24
 00:00:00.730260 eth3  Out IP 10.0.34.2.40088 > 10.0.34.3.3784: BFDv1, Control, State Up, Flags: [none], length: 24
 00:00:00.741062 eth0  In  IP 10.0.35.3.48498 > 10.0.35.2.3784: BFDv1, Control, State Up, Flags: [none], length: 24
 00:00:00.741174 eth2  Out IP 10.0.23.3.59324 > 10.0.23.2.3784: BFDv1, Control, State Up, Flags: [none], length: 24
 00:00:00.744592 eth3  In  IP 10.0.34.3.52215 > 10.0.34.2.3784: BFDv1, Control, State Up, Flags: [none], length: 24
 00:00:00.753801 eth2  In  IP 10.0.23.2.41179 > 10.0.23.3.3784: BFDv1, Control, State Up, Flags: [none], length: 24
 00:00:00.772045 eth0  Out IP 10.0.35.2.59307 > 10.0.35.3.3784: BFDv1, Control, State Up, Flags: [none], length: 24
 00:00:00.774125 eth1  Out IP 10.0.13.3.42552 > 10.0.13.2.3784: BFDv1, Control, State Up, Flags: [none], length: 24
 00:00:00.777238 eth1  In  IP 10.0.13.2.32837 > 10.0.13.3.3784: BFDv1, Control, State Up, Flags: [none], length: 24
 00:00:00.819475 eth3  Out IP 10.0.34.2.40088 > 10.0.34.3.3784: BFDv1, Control, State Up, Flags: [none], length: 24
 00:00:00.820636 eth3  In  IP 10.0.34.3.52215 > 10.0.34.2.3784: BFDv1, Control, State Up, Flags: [none], length: 24
 00:00:00.824484 eth0  In  IP 10.0.35.3.48498 > 10.0.35.2.3784: BFDv1, Control, State Up, Flags: [none], length: 24
 00:00:00.825734 eth2  Out IP 10.0.23.3.59324 > 10.0.23.2.3784: BFDv1, Control, State Up, Flags: [none], length: 24
 00:00:00.828441 eth2  In  IP 10.0.23.2.41179 > 10.0.23.3.3784: BFDv1, Control, State Up, Flags: [none], length: 24
 00:00:00.851682 eth0  Out IP 10.0.35.2.59307 > 10.0.35.3.3784: BFDv1, Control, State Up, Flags: [none], length: 24
 00:00:00.853842 eth1  Out IP 10.0.13.3.42552 > 10.0.13.2.3784: BFDv1, Control, State Up, Flags: [none], length: 24
 00:00:00.855055 eth1  In  IP 10.0.13.2.32837 > 10.0.13.3.3784: BFDv1, Control, State Up, Flags: [none], length: 24
 00:00:00.905305 eth3  Out IP 10.0.34.2.40088 > 10.0.34.3.3784: BFDv1, Control, State Up, Flags: [none], length: 24
 00:00:00.906478 eth3  In  IP 10.0.34.3.52215 > 10.0.34.2.3784: BFDv1, Control, State Up, Flags: [none], length: 24
 00:00:00.909926 eth0  In  IP 10.0.35.3.48498 > 10.0.35.2.3784: BFDv1, Control, State Up, Flags: [none], length: 24
 00:00:00.913152 eth2  Out IP 10.0.23.3.59324 > 10.0.23.2.3784: BFDv1, Control, State Up, Flags: [none], length: 24
 00:00:00.918292 eth2  In  IP 10.0.23.2.41179 > 10.0.23.3.3784: BFDv1, Control, State Up, Flags: [none], length: 24
 00:00:00.929432 eth0  Out IP 10.0.35.2.59307 > 10.0.35.3.3784: BFDv1, Control, State Up, Flags: [none], length: 24
 00:00:00.933628 eth1  In  IP 10.0.13.2.32837 > 10.0.13.3.3784: BFDv1, Control, State Up, Flags: [none], length: 24
 00:00:00.938828 eth1  Out IP 10.0.13.3.42552 > 10.0.13.2.3784: BFDv1, Control, State Up, Flags: [none], length: 24
 00:00:00.982985 eth3  Out IP 10.0.34.2.40088 > 10.0.34.3.3784: BFDv1, Control, State Up, Flags: [none], length: 24
 00:00:00.984134 eth3  In  IP 10.0.34.3.52215 > 10.0.34.2.3784: BFDv1, Control, State Up, Flags: [none], length: 24
 00:00:00.992401 eth0  In  IP 10.0.35.3.48498 > 10.0.35.2.3784: BFDv1, Control, State Up, Flags: [none], length: 24
 00:00:01.001582 eth2  Out IP 10.0.23.3.59324 > 10.0.23.2.3784: BFDv1, Control, State Up, Flags: [none], length: 24
 00:00:01.004704 eth2  In  IP 10.0.23.2.41179 > 10.0.23.3.3784: BFDv1, Control, State Up, Flags: [none], length: 24
 00:00:01.007856 eth0  Out IP 10.0.35.2.59307 > 10.0.35.3.3784: BFDv1, Control, State Up, Flags: [none], length: 24
 00:00:01.018997 eth1  Out IP 10.0.13.3.42552 > 10.0.13.2.3784: BFDv1, Control, State Up, Flags: [none], length: 24
 00:00:01.022183 eth1  In  IP 10.0.13.2.32837 > 10.0.13.3.3784: BFDv1, Control, State Up, Flags: [none], length: 24
 00:00:01.069902 eth0  In  IP 10.0.35.3.48498 > 10.0.35.2.3784: BFDv1, Control, State Up, Flags: [none], length: 24
 00:00:01.069999 eth3  Out IP 10.0.34.2.40088 > 10.0.34.3.3784: BFDv1, Control, State Up, Flags: [none], length: 24
 00:00:01.073181 eth3  In  IP 10.0.34.3.52215 > 10.0.34.2.3784: BFDv1, Control, State Up, Flags: [none], length: 24
 00:00:01.084131 eth2  In  IP 10.0.23.2.41179 > 10.0.23.3.3784: BFDv1, Control, State Up, Flags: [none], length: 24
 00:00:01.089347 eth2  Out IP 10.0.23.3.59324 > 10.0.23.2.3784: BFDv1, Control, State Up, Flags: [none], length: 24
 00:00:01.092526 eth0  Out IP 10.0.35.2.59307 > 10.0.35.3.3784: BFDv1, Control, State Up, Flags: [none], length: 24
 00:00:01.097046 eth1  In  IP 10.0.13.2.32837 > 10.0.13.3.3784: BFDv1, Control, State Up, Flags: [none], length: 24
 00:00:01.106264 eth1  Out IP 10.0.13.3.42552 > 10.0.13.2.3784: BFDv1, Control, State Up, Flags: [none], length: 24
 00:00:01.146386 eth0  In  IP 10.0.35.3.48498 > 10.0.35.2.3784: BFDv1, Control, State Up, Flags: [none], length: 24
 00:00:01.152629 eth3  Out IP 10.0.34.2.40088 > 10.0.34.3.3784: BFDv1, Control, State Up, Flags: [none], length: 24
 00:00:01.162323 eth3  In  IP 10.0.34.3.52215 > 10.0.34.2.3784: BFDv1, Control, State Up, Flags: [none], length: 24
 00:00:01.171217 eth2  In  IP 10.0.23.2.41179 > 10.0.23.3.3784: BFDv1, Control, State Up, Flags: [none], length: 24
 00:00:01.172422 eth2  Out IP 10.0.23.3.59324 > 10.0.23.2.3784: BFDv1, Control, State Up, Flags: [none], length: 24
 00:00:01.173328 eth1  In  IP 10.0.13.2.32837 > 10.0.13.3.3784: BFDv1, Control, State Up, Flags: [none], length: 24
 00:00:01.177508 eth0  Out IP 10.0.35.2.59307 > 10.0.35.3.3784: BFDv1, Control, State Up, Flags: [none], length: 24
 00:00:01.188684 eth1  Out IP 10.0.13.3.42552 > 10.0.13.2.3784: BFDv1, Control, State Up, Flags: [none], length: 24
 00:00:01.222027 eth0  In  IP 10.0.35.3.48498 > 10.0.35.2.3784: BFDv1, Control, State Up, Flags: [none], length: 24
 00:00:01.229247 eth3  Out IP 10.0.34.2.40088 > 10.0.34.3.3784: BFDv1, Control, State Up, Flags: [none], length: 24
 00:00:01.248620 eth3  In  IP 10.0.34.3.52215 > 10.0.34.2.3784: BFDv1, Control, State Up, Flags: [none], length: 24
 00:00:01.252829 eth0  Out IP 10.0.35.2.59307 > 10.0.35.3.3784: BFDv1, Control, State Up, Flags: [none], length: 24
 00:00:01.256732 eth2  In  IP 10.0.23.2.41179 > 10.0.23.3.3784: BFDv1, Control, State Up, Flags: [none], length: 24
 00:00:01.257851 eth1  In  IP 10.0.13.2.32837 > 10.0.13.3.3784: BFDv1, Control, State Up, Flags: [none], length: 24
 00:00:01.260995 eth2  Out IP 10.0.23.3.59324 > 10.0.23.2.3784: BFDv1, Control, State Up, Flags: [none], length: 24
 00:00:01.265144 eth1  Out IP 10.0.13.3.42552 > 10.0.13.2.3784: BFDv1, Control, State Up, Flags: [none], length: 24
 00:00:01.303504 eth0  In  IP 10.0.35.3.48498 > 10.0.35.2.3784: BFDv1, Control, State Up, Flags: [none], length: 24
 00:00:01.306662 eth3  Out IP 10.0.34.2.40088 > 10.0.34.3.3784: BFDv1, Control, State Up, Flags: [none], length: 24
 00:00:01.329697 eth3  In  IP 10.0.34.3.52215 > 10.0.34.2.3784: BFDv1, Control, State Up, Flags: [none], length: 24
 00:00:01.336700 eth2  In  IP 10.0.23.2.41179 > 10.0.23.3.3784: BFDv1, Control, State Up, Flags: [none], length: 24
 00:00:01.341704 eth1  In  IP 10.0.13.2.32837 > 10.0.13.3.3784: BFDv1, Control, State Up, Flags: [none], length: 24
 00:00:01.341829 eth2  Out IP 10.0.23.3.59324 > 10.0.23.2.3784: BFDv1, Control, State Up, Flags: [none], length: 24
 00:00:01.341889 eth0  Out IP 10.0.35.2.59307 > 10.0.35.3.3784: BFDv1, Control, State Up, Flags: [none], length: 24
 00:00:01.355037 eth1  Out IP 10.0.13.3.42552 > 10.0.13.2.3784: BFDv1, Control, State Up, Flags: [none], length: 24
 00:00:01.380979 eth0  In  IP 10.0.35.3.48498 > 10.0.35.2.3784: BFDv1, Control, State Up, Flags: [none], length: 24
 00:00:01.386316 eth3  Out IP 10.0.34.2.40088 > 10.0.34.3.3784: BFDv1, Control, State Up, Flags: [none], length: 24
 00:00:01.409856 eth3  In  IP 10.0.34.3.52215 > 10.0.34.2.3784: BFDv1, Control, State Up, Flags: [none], length: 24
 00:00:01.415392 eth2  In  IP 10.0.23.2.41179 > 10.0.23.3.3784: BFDv1, Control, State Up, Flags: [none], length: 24
 00:00:01.423588 eth0  Out IP 10.0.35.2.59307 > 10.0.35.3.3784: BFDv1, Control, State Up, Flags: [none], length: 24
 00:00:01.426456 eth1  In  IP 10.0.13.2.32837 > 10.0.13.3.3784: BFDv1, Control, State Up, Flags: [none], length: 24
 00:00:01.426583 eth2  Out IP 10.0.23.3.59324 > 10.0.23.2.3784: BFDv1, Control, State Up, Flags: [none], length: 24
 00:00:01.434709 eth1  Out IP 10.0.13.3.42552 > 10.0.13.2.3784: BFDv1, Control, State Up, Flags: [none], length: 24
 00:00:01.459443 eth0  In  IP 10.0.35.3.48498 > 10.0.35.2.3784: BFDv1, Control, State Up, Flags: [none], length: 24
 00:00:01.465652 eth3  Out IP 10.0.34.2.40088 > 10.0.34.3.3784: BFDv1, Control, State Up, Flags: [none], length: 24
 00:00:01.491494 eth3  In  IP 10.0.34.3.52215 > 10.0.34.2.3784: BFDv1, Control, State Up, Flags: [none], length: 24
 00:00:01.495383 eth2  In  IP 10.0.23.2.41179 > 10.0.23.3.3784: BFDv1, Control, State Up, Flags: [none], length: 24
 00:00:01.503665 eth1  In  IP 10.0.13.2.32837 > 10.0.13.3.3784: BFDv1, Control, State Up, Flags: [none], length: 24
 00:00:01.509874 eth1  Out IP 10.0.13.3.42552 > 10.0.13.2.3784: BFDv1, Control, State Up, Flags: [none], length: 24
 00:00:01.509937 eth0  Out IP 10.0.35.2.59307 > 10.0.35.3.3784: BFDv1, Control, State Up, Flags: [none], length: 24
 00:00:01.510027 eth2  Out IP 10.0.23.3.59324 > 10.0.23.2.3784: BFDv1, Control, State Up, Flags: [none], length: 24
 00:00:01.539874 eth0  In  IP 10.0.35.3.48498 > 10.0.35.2.3784: BFDv1, Control, State Up, Flags: [none], length: 24
 00:00:01.549053 eth3  Out IP 10.0.34.2.40088 > 10.0.34.3.3784: BFDv1, Control, State Up, Flags: [none], length: 24
 00:00:01.578144 eth3  In  IP 10.0.34.3.52215 > 10.0.34.2.3784: BFDv1, Control, State Up, Flags: [none], length: 24
 00:00:01.581967 eth2  In  IP 10.0.23.2.41179 > 10.0.23.3.3784: BFDv1, Control, State Up, Flags: [none], length: 24
 00:00:01.582155 eth1  In  IP 10.0.13.2.32837 > 10.0.13.3.3784: BFDv1, Control, State Up, Flags: [none], length: 24
 00:00:01.594374 eth0  Out IP 10.0.35.2.59307 > 10.0.35.3.3784: BFDv1, Control, State Up, Flags: [none], length: 24
 00:00:01.595489 eth1  Out IP 10.0.13.3.42552 > 10.0.13.2.3784: BFDv1, Control, State Up, Flags: [none], length: 24
 00:00:01.595506 eth2  Out IP 10.0.23.3.59324 > 10.0.23.2.3784: BFDv1, Control, State Up, Flags: [none], length: 24
 00:00:01.621505 eth0  In  IP 10.0.35.3.48498 > 10.0.35.2.3784: BFDv1, Control, State Up, Flags: [none], length: 24
 00:00:01.632728 eth3  Out IP 10.0.34.2.40088 > 10.0.34.3.3784: BFDv1, Control, State Up, Flags: [none], length: 24
 00:00:01.664250 eth2  In  IP 10.0.23.2.41179 > 10.0.23.3.3784: BFDv1, Control, State Up, Flags: [none], length: 24
 00:00:01.666068 eth3  In  IP 10.0.34.3.52215 > 10.0.34.2.3784: BFDv1, Control, State Up, Flags: [none], length: 24
 00:00:01.668280 eth1  In  IP 10.0.13.2.32837 > 10.0.13.3.3784: BFDv1, Control, State Up, Flags: [none], length: 24
 00:00:01.677498 eth2  Out IP 10.0.23.3.59324 > 10.0.23.2.3784: BFDv1, Control, State Up, Flags: [none], length: 24
 00:00:01.681685 eth0  Out IP 10.0.35.2.59307 > 10.0.35.3.3784: BFDv1, Control, State Up, Flags: [none], length: 24
 00:00:01.684816 eth1  Out IP 10.0.13.3.42552 > 10.0.13.2.3784: BFDv1, Control, State Up, Flags: [none], length: 24
 00:00:01.701870 eth0  In  IP 10.0.35.3.48498 > 10.0.35.2.3784: BFDv1, Control, State Up, Flags: [none], length: 24
 00:00:01.718128 eth3  Out IP 10.0.34.2.40088 > 10.0.34.3.3784: BFDv1, Control, State Up, Flags: [none], length: 24
 00:00:01.743918 eth1  In  IP 10.0.13.2.32837 > 10.0.13.3.3784: BFDv1, Control, State Up, Flags: [none], length: 24
 00:00:01.750795 eth3  In  IP 10.0.34.3.52215 > 10.0.34.2.3784: BFDv1, Control, State Up, Flags: [none], length: 24
 00:00:01.750880 eth2  In  IP 10.0.23.2.41179 > 10.0.23.3.3784: BFDv1, Control, State Up, Flags: [none], length: 24
 00:00:01.760093 eth0  Out IP 10.0.35.2.59307 > 10.0.35.3.3784: BFDv1, Control, State Up, Flags: [none], length: 24
 00:00:01.762269 eth1  Out IP 10.0.13.3.42552 > 10.0.13.2.3784: BFDv1, Control, State Up, Flags: [none], length: 24
 00:00:01.762318 eth2  Out IP 10.0.23.3.59324 > 10.0.23.2.3784: BFDv1, Control, State Up, Flags: [none], length: 24
 00:00:01.782366 eth0  In  IP 10.0.35.3.48498 > 10.0.35.2.3784: BFDv1, Control, State Up, Flags: [none], length: 24
 00:00:01.795587 eth3  Out IP 10.0.34.2.40088 > 10.0.34.3.3784: BFDv1, Control, State Up, Flags: [none], length: 24
 00:00:01.824172 eth1  In  IP 10.0.13.2.32837 > 10.0.13.3.3784: BFDv1, Control, State Up, Flags: [none], length: 24
 00:00:01.830116 eth2  In  IP 10.0.23.2.41179 > 10.0.23.3.3784: BFDv1, Control, State Up, Flags: [none], length: 24
 00:00:01.836038 eth3  In  IP 10.0.34.3.52215 > 10.0.34.2.3784: BFDv1, Control, State Up, Flags: [none], length: 24
 00:00:01.841296 eth2  Out IP 10.0.23.3.59324 > 10.0.23.2.3784: BFDv1, Control, State Up, Flags: [none], length: 24
 00:00:01.846478 eth1  Out IP 10.0.13.3.42552 > 10.0.13.2.3784: BFDv1, Control, State Up, Flags: [none], length: 24
 00:00:01.847653 eth0  Out IP 10.0.35.2.59307 > 10.0.35.3.3784: BFDv1, Control, State Up, Flags: [none], length: 24
 00:00:01.866899 eth0  In  IP 10.0.35.3.48498 > 10.0.35.2.3784: BFDv1, Control, State Up, Flags: [none], length: 24
 00:00:01.882146 eth3  Out IP 10.0.34.2.40088 > 10.0.34.3.3784: BFDv1, Control, State Up, Flags: [none], length: 24
 00:00:01.910186 eth2  In  IP 10.0.23.2.41179 > 10.0.23.3.3784: BFDv1, Control, State Up, Flags: [none], length: 24
 00:00:01.912288 eth1  In  IP 10.0.13.2.32837 > 10.0.13.3.3784: BFDv1, Control, State Up, Flags: [none], length: 24
 00:00:01.917337 eth3  In  IP 10.0.34.3.52215 > 10.0.34.2.3784: BFDv1, Control, State Up, Flags: [none], length: 24
 00:00:01.926587 eth2  Out IP 10.0.23.3.59324 > 10.0.23.2.3784: BFDv1, Control, State Up, Flags: [none], length: 24
 00:00:01.926645 eth1  Out IP 10.0.13.3.42552 > 10.0.13.2.3784: BFDv1, Control, State Up, Flags: [none], length: 24
 00:00:01.935802 eth0  Out IP 10.0.35.2.59307 > 10.0.35.3.3784: BFDv1, Control, State Up, Flags: [none], length: 24
 00:00:01.954301 eth0  In  IP 10.0.35.3.48498 > 10.0.35.2.3784: BFDv1, Control, State Up, Flags: [none], length: 24
 00:00:01.965539 eth3  Out IP 10.0.34.2.40088 > 10.0.34.3.3784: BFDv1, Control, State Up, Flags: [none], length: 24
 00:00:01.986493 eth2  In  IP 10.0.23.2.41179 > 10.0.23.3.3784: BFDv1, Control, State Up, Flags: [none], length: 24
 00:00:01.996695 eth1  In  IP 10.0.13.2.32837 > 10.0.13.3.3784: BFDv1, Control, State Up, Flags: [none], length: 24
 00:00:02.006596 eth3  In  IP 10.0.34.3.52215 > 10.0.34.2.3784: BFDv1, Control, State Up, Flags: [none], length: 24
 00:00:02.011815 eth2  Out IP 10.0.23.3.59324 > 10.0.23.2.3784: BFDv1, Control, State Up, Flags: [none], length: 24
 00:00:02.015006 eth1  Out IP 10.0.13.3.42552 > 10.0.13.2.3784: BFDv1, Control, State Up, Flags: [none], length: 24
 00:00:02.024218 eth0  Out IP 10.0.35.2.59307 > 10.0.35.3.3784: BFDv1, Control, State Up, Flags: [none], length: 24
 00:00:02.041379 eth0  In  IP 10.0.35.3.48498 > 10.0.35.2.3784: BFDv1, Control, State Up, Flags: [none], length: 24
 00:00:02.063962 eth2  In  IP 10.0.23.2.41179 > 10.0.23.3.3784: BFDv1, Control, State Up, Flags: [none], length: 24
 00:00:02.082431 eth1  In  IP 10.0.13.2.32837 > 10.0.13.3.3784: BFDv1, Control, State Up, Flags: [none], length: 24
 00:00:02.091655 eth2  Out IP 10.0.23.3.59324 > 10.0.23.2.3784: BFDv1, Control, State Up, Flags: [none], length: 24
 00:00:02.091710 eth1  Out IP 10.0.13.3.42552 > 10.0.13.2.3784: BFDv1, Control, State Up, Flags: [none], length: 24
 00:00:02.093177 eth3  In  IP 10.0.34.3.52215 > 10.0.34.2.3784: BFDv1, Control, State Up, Flags: [none], length: 24
 00:00:02.108376 eth0  Out IP 10.0.35.2.59307 > 10.0.35.3.3784: BFDv1, Control, State Up, Flags: [none], length: 24
 00:00:02.117588 eth0  In  IP 10.0.35.3.48498 > 10.0.35.2.3784: BFDv1, Control, State Up, Flags: [none], length: 24
 00:00:02.141634 eth2  In  IP 10.0.23.2.41179 > 10.0.23.3.3784: BFDv1, Control, State Up, Flags: [none], length: 24
 00:00:02.170214 eth1  In  IP 10.0.13.2.32837 > 10.0.13.3.3784: BFDv1, Control, State Up, Flags: [none], length: 24
 00:00:02.176438 eth1  Out IP 10.0.13.3.42552 > 10.0.13.2.3784: BFDv1, Control, State Up, Flags: [none], length: 24
 00:00:02.176479 eth2  Out IP 10.0.23.3.59324 > 10.0.23.2.3784: BFDv1, Control, State Up, Flags: [none], length: 24
 00:00:02.191629 eth0  Out IP 10.0.35.2.59307 > 10.0.35.3.3784: BFDv1, Control, State Up, Flags: [none], length: 24
 00:00:02.200836 eth0  In  IP 10.0.35.3.48498 > 10.0.35.2.3784: BFDv1, Control, State Up, Flags: [none], length: 24
 00:00:02.224079 eth2  In  IP 10.0.23.2.41179 > 10.0.23.3.3784: BFDv1, Control, State Up, Flags: [none], length: 24
 00:00:02.246565 eth1  In  IP 10.0.13.2.32837 > 10.0.13.3.3784: BFDv1, Control, State Up, Flags: [none], length: 24
 00:00:02.254775 eth2  Out IP 10.0.23.3.59324 > 10.0.23.2.3784: BFDv1, Control, State Up, Flags: [none], length: 24
 00:00:02.254824 eth1  Out IP 10.0.13.3.42552 > 10.0.13.2.3784: BFDv1, Control, State Up, Flags: [none], length: 24
 00:00:02.280954 eth0  Out IP 10.0.35.2.59307 > 10.0.35.3.3784: BFDv1, Control, State Up, Flags: [none], length: 24
 00:00:02.289204 eth0  In  IP 10.0.35.3.48498 > 10.0.35.2.3784: BFDv1, Control, State Up, Flags: [none], length: 24
 00:00:02.301667 eth2  In  IP 10.0.23.2.41179 > 10.0.23.3.3784: BFDv1, Control, State Up, Flags: [none], length: 24
 00:00:02.331163 eth1  In  IP 10.0.13.2.32837 > 10.0.13.3.3784: BFDv1, Control, State Up, Flags: [none], length: 24
 00:00:02.332368 eth2  Out IP 10.0.23.3.59324 > 10.0.23.2.3784: BFDv1, Control, State Up, Flags: [none], length: 24
 00:00:02.335535 eth1  Out IP 10.0.13.3.42552 > 10.0.13.2.3784: BFDv1, Control, State Up, Flags: [none], length: 24
 00:00:02.365715 eth0  Out IP 10.0.35.2.59307 > 10.0.35.3.3784: BFDv1, Control, State Up, Flags: [none], length: 24
 00:00:02.366913 eth0  In  IP 10.0.35.3.48498 > 10.0.35.2.3784: BFDv1, Control, State Up, Flags: [none], length: 24
 00:00:02.382219 eth2  In  IP 10.0.23.2.41179 > 10.0.23.3.3784: BFDv1, Control, State Up, Flags: [none], length: 24
 00:00:02.407698 eth1  In  IP 10.0.13.2.32837 > 10.0.13.3.3784: BFDv1, Control, State Up, Flags: [none], length: 24
 00:00:02.415970 eth2  Out IP 10.0.23.3.59324 > 10.0.23.2.3784: BFDv1, Control, State Up, Flags: [none], length: 24
 00:00:02.422185 eth1  Out IP 10.0.13.3.42552 > 10.0.13.2.3784: BFDv1, Control, State Up, Flags: [none], length: 24
 00:00:02.455368 eth0  Out IP 10.0.35.2.59307 > 10.0.35.3.3784: BFDv1, Control, State Up, Flags: [none], length: 24
 00:00:02.455464 eth0  In  IP 10.0.35.3.48498 > 10.0.35.2.3784: BFDv1, Control, State Up, Flags: [none], length: 24
 00:00:02.465711 eth2  In  IP 10.0.23.2.41179 > 10.0.23.3.3784: BFDv1, Control, State Up, Flags: [none], length: 24
 00:00:02.489390 eth1  In  IP 10.0.13.2.32837 > 10.0.13.3.3784: BFDv1, Control, State Up, Flags: [none], length: 24
 00:00:02.497677 eth2  Out IP 10.0.23.3.59324 > 10.0.23.2.3784: BFDv1, Control, State Up, Flags: [none], length: 24
 00:00:02.500860 eth1  Out IP 10.0.13.3.42552 > 10.0.13.2.3784: BFDv1, Control, State Up, Flags: [none], length: 24
 00:00:02.533069 eth0  Out IP 10.0.35.2.59307 > 10.0.35.3.3784: BFDv1, Control, State Up, Flags: [none], length: 24
 00:00:02.536280 eth0  In  IP 10.0.35.3.48498 > 10.0.35.2.3784: BFDv1, Control, State Up, Flags: [none], length: 24
 00:00:02.553418 eth2  In  IP 10.0.23.2.41179 > 10.0.23.3.3784: BFDv1, Control, State Up, Flags: [none], length: 24
 00:00:02.565717 eth1  In  IP 10.0.13.2.32837 > 10.0.13.3.3784: BFDv1, Control, State Up, Flags: [none], length: 24
 00:00:02.576909 eth1  Out IP 10.0.13.3.42552 > 10.0.13.2.3784: BFDv1, Control, State Up, Flags: [none], length: 24
 00:00:02.581083 eth2  Out IP 10.0.23.3.59324 > 10.0.23.2.3784: BFDv1, Control, State Up, Flags: [none], length: 24
 00:00:02.613810 eth0  In  IP 10.0.35.3.48498 > 10.0.35.2.3784: BFDv1, Control, State Up, Flags: [none], length: 24
 00:00:02.618093 eth0  Out IP 10.0.35.2.59307 > 10.0.35.3.3784: BFDv1, Control, State Up, Flags: [none], length: 24
 00:00:02.637857 eth2  In  IP 10.0.23.2.41179 > 10.0.23.3.3784: BFDv1, Control, State Up, Flags: [none], length: 24
 00:00:02.646316 eth1  In  IP 10.0.13.2.32837 > 10.0.13.3.3784: BFDv1, Control, State Up, Flags: [none], length: 24
 00:00:02.664723 eth1  Out IP 10.0.13.3.42552 > 10.0.13.2.3784: BFDv1, Control, State Up, Flags: [none], length: 24
 00:00:02.664765 eth2  Out IP 10.0.23.3.59324 > 10.0.23.2.3784: BFDv1, Control, State Up, Flags: [none], length: 24
 00:00:02.695666 eth0  In  IP 10.0.35.3.48498 > 10.0.35.2.3784: BFDv1, Control, State Up, Flags: [none], length: 24
 00:00:02.695783 eth0  Out IP 10.0.35.2.59307 > 10.0.35.3.3784: BFDv1, Control, State Up, Flags: [none], length: 24
 00:00:02.724279 eth1  In  IP 10.0.13.2.32837 > 10.0.13.3.3784: BFDv1, Control, State Up, Flags: [none], length: 24
 00:00:02.724463 eth2  In  IP 10.0.23.2.41179 > 10.0.23.3.3784: BFDv1, Control, State Up, Flags: [none], length: 24
 00:00:02.743676 eth2  Out IP 10.0.23.3.59324 > 10.0.23.2.3784: BFDv1, Control, State Up, Flags: [none], length: 24
 00:00:02.750868 eth1  Out IP 10.0.13.3.42552 > 10.0.13.2.3784: BFDv1, Control, State Up, Flags: [none], length: 24
 00:00:02.772040 eth0  Out IP 10.0.35.2.59307 > 10.0.35.3.3784: BFDv1, Control, State Up, Flags: [none], length: 24
 00:00:02.779263 eth0  In  IP 10.0.35.3.48498 > 10.0.35.2.3784: BFDv1, Control, State Up, Flags: [none], length: 24
 00:00:02.804544 eth1  In  IP 10.0.13.2.32837 > 10.0.13.3.3784: BFDv1, Control, State Up, Flags: [none], length: 24
 00:00:02.813936 eth2  In  IP 10.0.23.2.41179 > 10.0.23.3.3784: BFDv1, Control, State Up, Flags: [none], length: 24
 00:00:02.825235 eth2  Out IP 10.0.23.3.59324 > 10.0.23.2.3784: BFDv1, Control, State Up, Flags: [none], length: 24
 00:00:02.838439 eth1  Out IP 10.0.13.3.42552 > 10.0.13.2.3784: BFDv1, Control, State Up, Flags: [none], length: 24
 00:00:02.857625 eth0  Out IP 10.0.35.2.59307 > 10.0.35.3.3784: BFDv1, Control, State Up, Flags: [none], length: 24
 00:00:02.862826 eth0  In  IP 10.0.35.3.48498 > 10.0.35.2.3784: BFDv1, Control, State Up, Flags: [none], length: 24
 00:00:02.884048 eth1  In  IP 10.0.13.2.32837 > 10.0.13.3.3784: BFDv1, Control, State Up, Flags: [none], length: 24
 00:00:02.895280 eth2  In  IP 10.0.23.2.41179 > 10.0.23.3.3784: BFDv1, Control, State Up, Flags: [none], length: 24
 00:00:02.912497 eth2  Out IP 10.0.23.3.59324 > 10.0.23.2.3784: BFDv1, Control, State Up, Flags: [none], length: 24
 00:00:02.914657 eth1  Out IP 10.0.13.3.42552 > 10.0.13.2.3784: BFDv1, Control, State Up, Flags: [none], length: 24
 00:00:02.944848 eth0  Out IP 10.0.35.2.59307 > 10.0.35.3.3784: BFDv1, Control, State Up, Flags: [none], length: 24
 00:00:02.948125 eth0  In  IP 10.0.35.3.48498 > 10.0.35.2.3784: BFDv1, Control, State Up, Flags: [none], length: 24
 00:00:02.964987 eth1  In  IP 10.0.13.2.32837 > 10.0.13.3.3784: BFDv1, Control, State Up, Flags: [none], length: 24
 00:00:02.980177 eth2  In  IP 10.0.23.2.41179 > 10.0.23.3.3784: BFDv1, Control, State Up, Flags: [none], length: 24
 00:00:02.990391 eth1  Out IP 10.0.13.3.42552 > 10.0.13.2.3784: BFDv1, Control, State Up, Flags: [none], length: 24
 00:00:02.998537 eth2  Out IP 10.0.23.3.59324 > 10.0.23.2.3784: BFDv1, Control, State Up, Flags: [none], length: 24
 00:00:03.033699 eth0  Out IP 10.0.35.2.59307 > 10.0.35.3.3784: BFDv1, Control, State Up, Flags: [none], length: 24
 00:00:03.036983 eth0  In  IP 10.0.35.3.48498 > 10.0.35.2.3784: BFDv1, Control, State Up, Flags: [none], length: 24
 00:00:03.047147 eth1  In  IP 10.0.13.2.32837 > 10.0.13.3.3784: BFDv1, Control, State Up, Flags: [none], length: 24
 00:00:03.061252 eth2  In  IP 10.0.23.2.41179 > 10.0.23.3.3784: BFDv1, Control, State Up, Flags: [none], length: 24
 00:00:03.068469 eth1  Out IP 10.0.13.3.42552 > 10.0.13.2.3784: BFDv1, Control, State Up, Flags: [none], length: 24
 00:00:03.084641 eth2  Out IP 10.0.23.3.59324 > 10.0.23.2.3784: BFDv1, Control, State Up, Flags: [none], length: 24
 00:00:03.119812 eth0  Out IP 10.0.35.2.59307 > 10.0.35.3.3784: BFDv1, Control, State Up, Flags: [none], length: 24
 00:00:03.120987 eth0  In  IP 10.0.35.3.48498 > 10.0.35.2.3784: BFDv1, Control, State Up, Flags: [none], length: 24
 00:00:03.135618 eth1  In  IP 10.0.13.2.32837 > 10.0.13.3.3784: BFDv1, Control, State Up, Flags: [none], length: 24
 00:00:03.137208 eth2  In  IP 10.0.23.2.41179 > 10.0.23.3.3784: BFDv1, Control, State Up, Flags: [none], length: 24
 00:00:03.154372 eth1  Out IP 10.0.13.3.42552 > 10.0.13.2.3784: BFDv1, Control, State Up, Flags: [none], length: 24
 00:00:03.166555 eth2  Out IP 10.0.23.3.59324 > 10.0.23.2.3784: BFDv1, Control, State Up, Flags: [none], length: 24
 00:00:03.205750 eth0  Out IP 10.0.35.2.59307 > 10.0.35.3.3784: BFDv1, Control, State Up, Flags: [none], length: 24
 00:00:03.207968 eth0  In  IP 10.0.35.3.48498 > 10.0.35.2.3784: BFDv1, Control, State Up, Flags: [none], length: 24
 00:00:03.214568 eth1  In  IP 10.0.13.2.32837 > 10.0.13.3.3784: BFDv1, Control, State Up, Flags: [none], length: 24
 00:00:03.222247 eth2  In  IP 10.0.23.2.41179 > 10.0.23.3.3784: BFDv1, Control, State Up, Flags: [none], length: 24
 00:00:03.231434 eth1  Out IP 10.0.13.3.42552 > 10.0.13.2.3784: BFDv1, Control, State Up, Flags: [none], length: 24
 00:00:03.255579 eth2  Out IP 10.0.23.3.59324 > 10.0.23.2.3784: BFDv1, Control, State Up, Flags: [none], length: 24
 00:00:03.285975 eth0  In  IP 10.0.35.3.48498 > 10.0.35.2.3784: BFDv1, Control, State Up, Flags: [none], length: 24
 00:00:03.294904 eth1  In  IP 10.0.13.2.32837 > 10.0.13.3.3784: BFDv1, Control, State Up, Flags: [none], length: 24
 00:00:03.294998 eth0  Out IP 10.0.35.2.59307 > 10.0.35.3.3784: BFDv1, Control, State Up, Flags: [none], length: 24
 00:00:03.297012 eth2  In  IP 10.0.23.2.41179 > 10.0.23.3.3784: BFDv1, Control, State Up, Flags: [none], length: 24
 00:00:03.311898 eth1  Out IP 10.0.13.3.42552 > 10.0.13.2.3784: BFDv1, Control, State Up, Flags: [none], length: 24
 00:00:03.345074 eth2  Out IP 10.0.23.3.59324 > 10.0.23.2.3784: BFDv1, Control, State Up, Flags: [none], length: 24
 00:00:03.375257 eth0  In  IP 10.0.35.3.48498 > 10.0.35.2.3784: BFDv1, Control, State Up, Flags: [none], length: 24
 00:00:03.377407 eth0  Out IP 10.0.35.2.59307 > 10.0.35.3.3784: BFDv1, Control, State Up, Flags: [none], length: 24
 00:00:03.377818 eth2  In  IP 10.0.23.2.41179 > 10.0.23.3.3784: BFDv1, Control, State Up, Flags: [none], length: 24
 00:00:03.384633 eth1  In  IP 10.0.13.2.32837 > 10.0.13.3.3784: BFDv1, Control, State Up, Flags: [none], length: 24
 00:00:03.391835 eth1  Out IP 10.0.13.3.42552 > 10.0.13.2.3784: BFDv1, Control, State Up, Flags: [none], length: 24
 00:00:03.429057 eth2  Out IP 10.0.23.3.59324 > 10.0.23.2.3784: BFDv1, Control, State Up, Flags: [none], length: 24
 00:00:03.454455 eth2  In  IP 10.0.23.2.41179 > 10.0.23.3.3784: BFDv1, Control, State Up, Flags: [none], length: 24
 00:00:03.462621 eth0  In  IP 10.0.35.3.48498 > 10.0.35.2.3784: BFDv1, Control, State Up, Flags: [none], length: 24
 00:00:03.463803 eth0  Out IP 10.0.35.2.59307 > 10.0.35.3.3784: BFDv1, Control, State Up, Flags: [none], length: 24
 00:00:03.470961 eth1  Out IP 10.0.13.3.42552 > 10.0.13.2.3784: BFDv1, Control, State Up, Flags: [none], length: 24
 00:00:03.472167 eth1  In  IP 10.0.13.2.32837 > 10.0.13.3.3784: BFDv1, Control, State Up, Flags: [none], length: 24
 00:00:03.507360 eth2  Out IP 10.0.23.3.59324 > 10.0.23.2.3784: BFDv1, Control, State Up, Flags: [none], length: 24
 00:00:03.538349 eth2  In  IP 10.0.23.2.41179 > 10.0.23.3.3784: BFDv1, Control, State Up, Flags: [none], length: 24
 00:00:03.543564 eth0  Out IP 10.0.35.2.59307 > 10.0.35.3.3784: BFDv1, Control, State Up, Flags: [none], length: 24
 00:00:03.545710 eth0  In  IP 10.0.35.3.48498 > 10.0.35.2.3784: BFDv1, Control, State Up, Flags: [none], length: 24
 00:00:03.549542 eth1  In  IP 10.0.13.2.32837 > 10.0.13.3.3784: BFDv1, Control, State Up, Flags: [none], length: 24
 00:00:03.551751 eth1  Out IP 10.0.13.3.42552 > 10.0.13.2.3784: BFDv1, Control, State Up, Flags: [none], length: 24
 00:00:03.594933 eth2  Out IP 10.0.23.3.59324 > 10.0.23.2.3784: BFDv1, Control, State Up, Flags: [none], length: 24
 00:00:03.622274 eth2  In  IP 10.0.23.2.41179 > 10.0.23.3.3784: BFDv1, Control, State Up, Flags: [none], length: 24
 00:00:03.627466 eth0  Out IP 10.0.35.2.59307 > 10.0.35.3.3784: BFDv1, Control, State Up, Flags: [none], length: 24
 00:00:03.627581 eth1  In  IP 10.0.13.2.32837 > 10.0.13.3.3784: BFDv1, Control, State Up, Flags: [none], length: 24
 00:00:03.630634 eth0  In  IP 10.0.35.3.48498 > 10.0.35.2.3784: BFDv1, Control, State Up, Flags: [none], length: 24
 00:00:03.633822 eth1  Out IP 10.0.13.3.42552 > 10.0.13.2.3784: BFDv1, Control, State Up, Flags: [none], length: 24
 00:00:03.674964 eth2  Out IP 10.0.23.3.59324 > 10.0.23.2.3784: BFDv1, Control, State Up, Flags: [none], length: 24
 00:00:03.707290 eth2  In  IP 10.0.23.2.41179 > 10.0.23.3.3784: BFDv1, Control, State Up, Flags: [none], length: 24
 00:00:03.708470 eth0  Out IP 10.0.35.2.59307 > 10.0.35.3.3784: BFDv1, Control, State Up, Flags: [none], length: 24
 00:00:03.710597 eth1  Out IP 10.0.13.3.42552 > 10.0.13.2.3784: BFDv1, Control, State Up, Flags: [none], length: 24
 00:00:03.710633 eth0  In  IP 10.0.35.3.48498 > 10.0.35.2.3784: BFDv1, Control, State Up, Flags: [none], length: 24
 00:00:03.712765 eth1  In  IP 10.0.13.2.32837 > 10.0.13.3.3784: BFDv1, Control, State Up, Flags: [none], length: 24
 00:00:03.749981 eth2  Out IP 10.0.23.3.59324 > 10.0.23.2.3784: BFDv1, Control, State Up, Flags: [none], length: 24
 00:00:03.784919 eth2  In  IP 10.0.23.2.41179 > 10.0.23.3.3784: BFDv1, Control, State Up, Flags: [none], length: 24
 00:00:03.789073 eth1  In  IP 10.0.13.2.32837 > 10.0.13.3.3784: BFDv1, Control, State Up, Flags: [none], length: 24
 00:00:03.791271 eth0  Out IP 10.0.35.2.59307 > 10.0.35.3.3784: BFDv1, Control, State Up, Flags: [none], length: 24
 00:00:03.799429 eth1  Out IP 10.0.13.3.42552 > 10.0.13.2.3784: BFDv1, Control, State Up, Flags: [none], length: 24
 00:00:03.799441 eth0  In  IP 10.0.35.3.48498 > 10.0.35.2.3784: BFDv1, Control, State Up, Flags: [none], length: 24
 00:00:03.837631 eth2  Out IP 10.0.23.3.59324 > 10.0.23.2.3784: BFDv1, Control, State Up, Flags: [none], length: 24
 00:00:03.867781 eth1  In  IP 10.0.13.2.32837 > 10.0.13.3.3784: BFDv1, Control, State Up, Flags: [none], length: 24
 00:00:03.870823 eth2  In  IP 10.0.23.2.41179 > 10.0.23.3.3784: BFDv1, Control, State Up, Flags: [none], length: 24
 00:00:03.874047 eth0  Out IP 10.0.35.2.59307 > 10.0.35.3.3784: BFDv1, Control, State Up, Flags: [none], length: 24
 00:00:03.887183 eth1  Out IP 10.0.13.3.42552 > 10.0.13.2.3784: BFDv1, Control, State Up, Flags: [none], length: 24
 00:00:03.888249 eth0  In  IP 10.0.35.3.48498 > 10.0.35.2.3784: BFDv1, Control, State Up, Flags: [none], length: 24
 00:00:03.927406 eth2  Out IP 10.0.23.3.59324 > 10.0.23.2.3784: BFDv1, Control, State Up, Flags: [none], length: 24
 00:00:03.944533 eth1  In  IP 10.0.13.2.32837 > 10.0.13.3.3784: BFDv1, Control, State Up, Flags: [none], length: 24
 00:00:03.947885 eth2  In  IP 10.0.23.2.41179 > 10.0.23.3.3784: BFDv1, Control, State Up, Flags: [none], length: 24
 00:00:03.952046 eth0  Out IP 10.0.35.2.59307 > 10.0.35.3.3784: BFDv1, Control, State Up, Flags: [none], length: 24
 00:00:03.964234 eth0  In  IP 10.0.35.3.48498 > 10.0.35.2.3784: BFDv1, Control, State Up, Flags: [none], length: 24
 00:00:03.972473 eth1  Out IP 10.0.13.3.42552 > 10.0.13.2.3784: BFDv1, Control, State Up, Flags: [none], length: 24
 00:00:04.011639 eth2  Out IP 10.0.23.3.59324 > 10.0.23.2.3784: BFDv1, Control, State Up, Flags: [none], length: 24
 00:00:04.019786 eth1  In  IP 10.0.13.2.32837 > 10.0.13.3.3784: BFDv1, Control, State Up, Flags: [none], length: 24
