tcpdump: data link type LINUX_SLL2
tcpdump: verbose output suppressed, use -v[v]... for full protocol decode
listening on any, link-type LINUX_SLL2 (Linux cooked v2), snapshot length 262144 bytes
 00:00:00.000000 eth2  Out IP 10.0.29.2.57861 > 10.0.29.3.3784: BFDv1, Control, State Up, Flags: [none], length: 24
 00:00:00.048124 eth2  In  IP 10.0.29.3.50828 > 10.0.29.2.3784: BFDv1, Control, State Up, Flags: [none], length: 24
 00:00:00.082419 eth2  Out IP 10.0.29.2.57861 > 10.0.29.3.3784: BFDv1, Control, State Up, Flags: [none], length: 24
 00:00:00.123990 eth2  In  IP 10.0.29.3.50828 > 10.0.29.2.3784: BFDv1, Control, State Up, Flags: [none], length: 24
 00:00:00.161365 eth2  Out IP 10.0.29.2.57861 > 10.0.29.3.3784: BFDv1, Control, State Up, Flags: [none], length: 24
 00:00:00.206772 eth2  In  IP 10.0.29.3.50828 > 10.0.29.2.3784: BFDv1, Control, State Up, Flags: [none], length: 24
 00:00:00.237735 eth2  Out IP 10.0.29.2.57861 > 10.0.29.3.3784: BFDv1, Control, State Up, Flags: [none], length: 24
 00:00:00.288517 eth2  In  IP 10.0.29.3.50828 > 10.0.29.2.3784: BFDv1, Control, State Up, Flags: [none], length: 24
 00:00:00.317985 eth2  Out IP 10.0.29.2.57861 > 10.0.29.3.3784: BFDv1, Control, State Up, Flags: [none], length: 24
 00:00:00.376209 eth2  In  IP 10.0.29.3.50828 > 10.0.29.2.3784: BFDv1, Control, State Up, Flags: [none], length: 24
 00:00:00.407617 eth2  Out IP 10.0.29.2.57861 > 10.0.29.3.3784: BFDv1, Control, State Up, Flags: [none], length: 24
 00:00:00.464155 eth2  In  IP 10.0.29.3.50828 > 10.0.29.2.3784: BFDv1, Control, State Up, Flags: [none], length: 24
 00:00:00.489431 eth2  Out IP 10.0.29.2.57861 > 10.0.29.3.3784: BFDv1, Control, State Up, Flags: [none], length: 24
 00:00:00.543776 eth2  In  IP 10.0.29.3.50828 > 10.0.29.2.3784: BFDv1, Control, State Up, Flags: [none], length: 24
 00:00:00.579183 eth2  Out IP 10.0.29.2.57861 > 10.0.29.3.3784: BFDv1, Control, State Up, Flags: [none], length: 24
 00:00:00.625597 eth2  In  IP 10.0.29.3.50828 > 10.0.29.2.3784: BFDv1, Control, State Up, Flags: [none], length: 24
 00:00:00.666899 eth2  Out IP 10.0.29.2.57861 > 10.0.29.3.3784: BFDv1, Control, State Up, Flags: [none], length: 24
 00:00:00.712372 eth2  In  IP 10.0.29.3.50828 > 10.0.29.2.3784: BFDv1, Control, State Up, Flags: [none], length: 24
 00:00:00.748811 eth2  Out IP 10.0.29.2.57861 > 10.0.29.3.3784: BFDv1, Control, State Up, Flags: [none], length: 24
 00:00:00.801568 eth2  In  IP 10.0.29.3.50828 > 10.0.29.2.3784: BFDv1, Control, State Up, Flags: [none], length: 24
 00:00:00.832874 eth2  Out IP 10.0.29.2.57861 > 10.0.29.3.3784: BFDv1, Control, State Up, Flags: [none], length: 24
 00:00:00.882387 eth2  In  IP 10.0.29.3.50828 > 10.0.29.2.3784: BFDv1, Control, State Up, Flags: [none], length: 24
 00:00:00.917777 eth2  Out IP 10.0.29.2.57861 > 10.0.29.3.3784: BFDv1, Control, State Up, Flags: [none], length: 24
 00:00:00.958725 eth2  In  IP 10.0.29.3.50828 > 10.0.29.2.3784: BFDv1, Control, State Up, Flags: [none], length: 24
 00:00:00.996204 eth2  Out IP 10.0.29.2.57861 > 10.0.29.3.3784: BFDv1, Control, State Up, Flags: [none], length: 24
 00:00:01.039568 eth2  In  IP 10.0.29.3.50828 > 10.0.29.2.3784: BFDv1, Control, State Up, Flags: [none], length: 24
 00:00:01.079882 eth2  Out IP 10.0.29.2.57861 > 10.0.29.3.3784: BFDv1, Control, State Up, Flags: [none], length: 24
 00:00:01.118300 eth2  In  IP 10.0.29.3.50828 > 10.0.29.2.3784: BFDv1, Control, State Up, Flags: [none], length: 24
 00:00:01.164691 eth2  Out IP 10.0.29.2.57861 > 10.0.29.3.3784: BFDv1, Control, State Up, Flags: [none], length: 24
 00:00:01.201079 eth2  In  IP 10.0.29.3.50828 > 10.0.29.2.3784: BFDv1, Control, State Up, Flags: [none], length: 24
 00:00:01.252751 eth2  Out IP 10.0.29.2.57861 > 10.0.29.3.3784: BFDv1, Control, State Up, Flags: [none], length: 24
 00:00:01.286309 eth2  In  IP 10.0.29.3.50828 > 10.0.29.2.3784: BFDv1, Control, State Up, Flags: [none], length: 24
 00:00:01.337632 eth2  Out IP 10.0.29.2.57861 > 10.0.29.3.3784: BFDv1, Control, State Up, Flags: [none], length: 24
 00:00:01.364115 eth2  In  IP 10.0.29.3.50828 > 10.0.29.2.3784: BFDv1, Control, State Up, Flags: [none], length: 24
 00:00:01.423497 eth2  Out IP 10.0.29.2.57861 > 10.0.29.3.3784: BFDv1, Control, State Up, Flags: [none], length: 24
 00:00:01.453976 eth2  In  IP 10.0.29.3.50828 > 10.0.29.2.3784: BFDv1, Control, State Up, Flags: [none], length: 24
 00:00:01.513325 eth2  Out IP 10.0.29.2.57861 > 10.0.29.3.3784: BFDv1, Control, State Up, Flags: [none], length: 24
 00:00:01.531999 eth2  In  IP 10.0.29.3.50828 > 10.0.29.2.3784: BFDv1, Control, State Up, Flags: [none], length: 24
 00:00:01.589337 eth2  Out IP 10.0.29.2.57861 > 10.0.29.3.3784: BFDv1, Control, State Up, Flags: [none], length: 24
 00:00:01.607838 eth2  In  IP 10.0.29.3.50828 > 10.0.29.2.3784: BFDv1, Control, State Up, Flags: [none], length: 24
 00:00:01.677255 eth2  Out IP 10.0.29.2.57861 > 10.0.29.3.3784: BFDv1, Control, State Up, Flags: [none], length: 24
 00:00:01.687008 eth2  In  IP 10.0.29.3.50828 > 10.0.29.2.3784: BFDv1, Control, State Up, Flags: [none], length: 24
 00:00:01.760488 eth2  Out IP 10.0.29.2.57861 > 10.0.29.3.3784: BFDv1, Control, State Up, Flags: [none], length: 24
 00:00:01.767778 eth2  In  IP 10.0.29.3.50828 > 10.0.29.2.3784: BFDv1, Control, State Up, Flags: [none], length: 24
 00:00:01.844127 eth2  Out IP 10.0.29.2.57861 > 10.0.29.3.3784: BFDv1, Control, State Up, Flags: [none], length: 24
 00:00:01.855615 eth2  In  IP 10.0.29.3.50828 > 10.0.29.2.3784: BFDv1, Control, State Up, Flags: [none], length: 24
 00:00:01.919954 eth2  Out IP 10.0.29.2.57861 > 10.0.29.3.3784: BFDv1, Control, State Up, Flags: [none], length: 24
 00:00:01.939654 eth2  In  IP 10.0.29.3.50828 > 10.0.29.2.3784: BFDv1, Control, State Up, Flags: [none], length: 24
 00:00:02.006059 eth2  Out IP 10.0.29.2.57861 > 10.0.29.3.3784: BFDv1, Control, State Up, Flags: [none], length: 24
 00:00:02.027392 eth2  In  IP 10.0.29.3.50828 > 10.0.29.2.3784: BFDv1, Control, State Up, Flags: [none], length: 24
 00:00:02.078936 eth3  Out IP 10.0.29.2.179 > 10.0.29.3.38299: Flags [P.], seq 3316223972:3316223993, ack 476888637, win 64, options [nop,nop,TS val 2352646422 ecr 562930015], length 21: BGP
 00:00:02.079065 eth3  Out IP 10.0.29.2.179 > 10.0.29.3.38299: Flags [F.], seq 21, ack 1, win 64, options [nop,nop,TS val 2352646422 ecr 562930015], length 0
 00:00:02.079110 eth3  Out IP 10.0.12.3.179 > 10.0.12.2.45004: Flags [P.], seq 3222603467:3222603502, ack 3815833537, win 64, options [nop,nop,TS val 4271302640 ecr 2663464839], length 35: BGP
 00:00:02.079153 eth3  In  IP 10.0.12.2.45004 > 10.0.12.3.179: Flags [.], ack 35, win 63, options [nop,nop,TS val 2663469795 ecr 4271302640], length 0
 00:00:02.079180 eth3  Out IP 10.0.12.3.179 > 10.0.12.2.45004: Flags [P.], seq 35:80, ack 1, win 64, options [nop,nop,TS val 4271302640 ecr 2663469795], length 45: BGP
 00:00:02.079191 eth3  In  IP 10.0.12.2.45004 > 10.0.12.3.179: Flags [.], ack 80, win 63, options [nop,nop,TS val 2663469795 ecr 4271302640], length 0
 00:00:02.080053 eth3  In  IP 10.0.12.2.45004 > 10.0.12.3.179: Flags [P.], seq 1:55, ack 80, win 63, options [nop,nop,TS val 2663469796 ecr 4271302640], length 54: BGP
 00:00:02.080087 eth3  Out IP 10.0.12.3.179 > 10.0.12.2.45004: Flags [.], ack 55, win 64, options [nop,nop,TS val 4271302641 ecr 2663469796], length 0
 00:00:02.088579 eth3  Out IP 10.0.29.2.179 > 10.0.29.3.38299: Flags [F.], seq 21, ack 1, win 64, options [nop,nop,TS val 2352646432 ecr 562930015], length 0
 00:00:02.298573 eth3  Out IP 10.0.29.2.179 > 10.0.29.3.38299: Flags [FP.], seq 0:21, ack 1, win 64, options [nop,nop,TS val 2352646642 ecr 562930015], length 21: BGP
 00:00:02.705559 eth3  Out IP 10.0.29.2.179 > 10.0.29.3.38299: Flags [FP.], seq 0:21, ack 1, win 64, options [nop,nop,TS val 2352647049 ecr 562930015], length 21: BGP
 00:00:03.545563 eth3  Out IP 10.0.29.2.179 > 10.0.29.3.38299: Flags [FP.], seq 0:21, ack 1, win 64, options [nop,nop,TS val 2352647889 ecr 562930015], length 21: BGP
 00:00:05.210568 eth3  Out IP 10.0.29.2.179 > 10.0.29.3.38299: Flags [FP.], seq 0:21, ack 1, win 64, options [nop,nop,TS val 2352649554 ecr 562930015], length 21: BGP
 00:00:06.581640 eth3  In  IP 10.0.12.2.45004 > 10.0.12.3.179: Flags [P.], seq 55:74, ack 80, win 63, options [nop,nop,TS val 2663474298 ecr 4271302641], length 19: BGP
 00:00:06.581675 eth3  Out IP 10.0.12.3.179 > 10.0.12.2.45004: Flags [.], ack 74, win 64, options [nop,nop,TS val 4271307143 ecr 2663474298], length 0
 00:00:08.473676 eth3  Out IP 10.0.29.2.179 > 10.0.29.3.38299: Flags [FP.], seq 0:21, ack 1, win 64, options [nop,nop,TS val 2352652817 ecr 562930015], length 21: BGP
 00:00:10.161962 eth3  Out IP 10.0.12.3.179 > 10.0.12.2.45004: Flags [P.], seq 80:128, ack 74, win 64, options [nop,nop,TS val 4271310723 ecr 2663474298], length 48: BGP
 00:00:10.162337 eth3  In  IP 10.0.12.2.45004 > 10.0.12.3.179: Flags [P.], seq 74:101, ack 128, win 63, options [nop,nop,TS val 2663477878 ecr 4271310723], length 27: BGP
 00:00:10.162366 eth3  Out IP 10.0.12.3.179 > 10.0.12.2.45004: Flags [.], ack 101, win 64, options [nop,nop,TS val 4271310723 ecr 2663477878], length 0
 00:00:10.162764 eth2  Out IP 10.0.29.2.40049 > 10.0.29.3.3784: BFDv1, Control, State Down, Flags: [none], length: 24
 00:00:10.165969 eth3  Out IP 10.0.12.3.179 > 10.0.12.2.45004: Flags [P.], seq 128:173, ack 101, win 64, options [nop,nop,TS val 4271310727 ecr 2663477878], length 45: BGP
 00:00:10.206586 eth3  In  IP 10.0.12.2.45004 > 10.0.12.3.179: Flags [.], ack 173, win 63, options [nop,nop,TS val 2663477923 ecr 4271310727], length 0
 00:00:10.582489 eth2  In  IP 10.0.29.3.41545 > 10.0.29.2.3784: BFDv1, Control, State Init, Flags: [none], length: 24
 00:00:10.582829 eth2  Out IP 10.0.29.2.40049 > 10.0.29.3.3784: BFDv1, Control, State Up, Flags: [Poll], length: 24
 00:00:10.583058 eth2  In  IP 10.0.29.3.41545 > 10.0.29.2.3784: BFDv1, Control, State Up, Flags: [Final], length: 24
 00:00:10.583107 eth2  In  IP 10.0.29.3.41545 > 10.0.29.2.3784: BFDv1, Control, State Up, Flags: [Poll], length: 24
 00:00:10.583304 eth2  Out IP 10.0.29.2.40049 > 10.0.29.3.3784: BFDv1, Control, State Up, Flags: [Final], length: 24
 00:00:10.663638 eth2  Out IP 10.0.29.2.40049 > 10.0.29.3.3784: BFDv1, Control, State Up, Flags: [none], length: 24
 00:00:10.670912 eth2  In  IP 10.0.29.3.41545 > 10.0.29.2.3784: BFDv1, Control, State Up, Flags: [none], length: 24
 00:00:10.742275 eth2  Out IP 10.0.29.2.40049 > 10.0.29.3.3784: BFDv1, Control, State Up, Flags: [none], length: 24
 00:00:10.752589 eth2  In  IP 10.0.29.3.41545 > 10.0.29.2.3784: BFDv1, Control, State Up, Flags: [none], length: 24
 00:00:10.826895 eth2  Out IP 10.0.29.2.40049 > 10.0.29.3.3784: BFDv1, Control, State Up, Flags: [none], length: 24
 00:00:10.832239 eth2  In  IP 10.0.29.3.41545 > 10.0.29.2.3784: BFDv1, Control, State Up, Flags: [none], length: 24
 00:00:10.904571 eth2  Out IP 10.0.29.2.40049 > 10.0.29.3.3784: BFDv1, Control, State Up, Flags: [none], length: 24
 00:00:10.908879 eth2  In  IP 10.0.29.3.41545 > 10.0.29.2.3784: BFDv1, Control, State Up, Flags: [none], length: 24
 00:00:10.990284 eth2  Out IP 10.0.29.2.40049 > 10.0.29.3.3784: BFDv1, Control, State Up, Flags: [none], length: 24
 00:00:10.990517 eth2  In  IP 10.0.29.3.41545 > 10.0.29.2.3784: BFDv1, Control, State Up, Flags: [none], length: 24
 00:00:11.068884 eth2  Out IP 10.0.29.2.40049 > 10.0.29.3.3784: BFDv1, Control, State Up, Flags: [none], length: 24
 00:00:11.072171 eth2  In  IP 10.0.29.3.41545 > 10.0.29.2.3784: BFDv1, Control, State Up, Flags: [none], length: 24
 00:00:11.150944 eth2  In  IP 10.0.29.3.41545 > 10.0.29.2.3784: BFDv1, Control, State Up, Flags: [none], length: 24
 00:00:11.154516 eth2  Out IP 10.0.29.2.40049 > 10.0.29.3.3784: BFDv1, Control, State Up, Flags: [none], length: 24
 00:00:11.235631 eth2  In  IP 10.0.29.3.41545 > 10.0.29.2.3784: BFDv1, Control, State Up, Flags: [none], length: 24
 00:00:11.243952 eth2  Out IP 10.0.29.2.40049 > 10.0.29.3.3784: BFDv1, Control, State Up, Flags: [none], length: 24
 00:00:11.320325 eth2  In  IP 10.0.29.3.41545 > 10.0.29.2.3784: BFDv1, Control, State Up, Flags: [none], length: 24
 00:00:11.330765 eth2  Out IP 10.0.29.2.40049 > 10.0.29.3.3784: BFDv1, Control, State Up, Flags: [none], length: 24
 00:00:11.404856 eth2  In  IP 10.0.29.3.41545 > 10.0.29.2.3784: BFDv1, Control, State Up, Flags: [none], length: 24
 00:00:11.411277 eth2  Out IP 10.0.29.2.40049 > 10.0.29.3.3784: BFDv1, Control, State Up, Flags: [none], length: 24
 00:00:11.483653 eth2  In  IP 10.0.29.3.41545 > 10.0.29.2.3784: BFDv1, Control, State Up, Flags: [none], length: 24
 00:00:11.497800 eth2  Out IP 10.0.29.2.40049 > 10.0.29.3.3784: BFDv1, Control, State Up, Flags: [none], length: 24
 00:00:11.563430 eth2  In  IP 10.0.29.3.41545 > 10.0.29.2.3784: BFDv1, Control, State Up, Flags: [none], length: 24
 00:00:11.580940 eth2  Out IP 10.0.29.2.40049 > 10.0.29.3.3784: BFDv1, Control, State Up, Flags: [none], length: 24
 00:00:11.648579 eth2  In  IP 10.0.29.3.41545 > 10.0.29.2.3784: BFDv1, Control, State Up, Flags: [none], length: 24
 00:00:11.657910 eth2  Out IP 10.0.29.2.40049 > 10.0.29.3.3784: BFDv1, Control, State Up, Flags: [none], length: 24
 00:00:11.737733 eth2  In  IP 10.0.29.3.41545 > 10.0.29.2.3784: BFDv1, Control, State Up, Flags: [none], length: 24
 00:00:11.743043 eth2  Out IP 10.0.29.2.40049 > 10.0.29.3.3784: BFDv1, Control, State Up, Flags: [none], length: 24
 00:00:11.820888 eth2  In  IP 10.0.29.3.41545 > 10.0.29.2.3784: BFDv1, Control, State Up, Flags: [none], length: 24
 00:00:11.827173 eth2  Out IP 10.0.29.2.40049 > 10.0.29.3.3784: BFDv1, Control, State Up, Flags: [none], length: 24
 00:00:11.901080 eth2  In  IP 10.0.29.3.41545 > 10.0.29.2.3784: BFDv1, Control, State Up, Flags: [none], length: 24
 00:00:11.917369 eth2  Out IP 10.0.29.2.40049 > 10.0.29.3.3784: BFDv1, Control, State Up, Flags: [none], length: 24
 00:00:11.986587 eth2  In  IP 10.0.29.3.41545 > 10.0.29.2.3784: BFDv1, Control, State Up, Flags: [none], length: 24
 00:00:11.994955 eth2  Out IP 10.0.29.2.40049 > 10.0.29.3.3784: BFDv1, Control, State Up, Flags: [none], length: 24
 00:00:12.061512 eth2  In  IP 10.0.29.3.41545 > 10.0.29.2.3784: BFDv1, Control, State Up, Flags: [none], length: 24
 00:00:12.072780 eth2  Out IP 10.0.29.2.40049 > 10.0.29.3.3784: BFDv1, Control, State Up, Flags: [none], length: 24
 00:00:12.148643 eth2  In  IP 10.0.29.3.41545 > 10.0.29.2.3784: BFDv1, Control, State Up, Flags: [none], length: 24
 00:00:12.148807 eth2  Out IP 10.0.29.2.40049 > 10.0.29.3.3784: BFDv1, Control, State Up, Flags: [none], length: 24
 00:00:12.238111 eth2  Out IP 10.0.29.2.40049 > 10.0.29.3.3784: BFDv1, Control, State Up, Flags: [none], length: 24
 00:00:12.238258 eth2  In  IP 10.0.29.3.41545 > 10.0.29.2.3784: BFDv1, Control, State Up, Flags: [none], length: 24
 00:00:12.323541 eth2  Out IP 10.0.29.2.40049 > 10.0.29.3.3784: BFDv1, Control, State Up, Flags: [none], length: 24
 00:00:12.326767 eth2  In  IP 10.0.29.3.41545 > 10.0.29.2.3784: BFDv1, Control, State Up, Flags: [none], length: 24
 00:00:12.403712 eth2  In  IP 10.0.29.3.41545 > 10.0.29.2.3784: BFDv1, Control, State Up, Flags: [none], length: 24
 00:00:12.405279 eth2  Out IP 10.0.29.2.40049 > 10.0.29.3.3784: BFDv1, Control, State Up, Flags: [none], length: 24
 00:00:12.485782 eth2  In  IP 10.0.29.3.41545 > 10.0.29.2.3784: BFDv1, Control, State Up, Flags: [none], length: 24
 00:00:12.490101 eth2  Out IP 10.0.29.2.40049 > 10.0.29.3.3784: BFDv1, Control, State Up, Flags: [none], length: 24
 00:00:12.573763 eth2  In  IP 10.0.29.3.41545 > 10.0.29.2.3784: BFDv1, Control, State Up, Flags: [none], length: 24
 00:00:12.573950 eth2  Out IP 10.0.29.2.40049 > 10.0.29.3.3784: BFDv1, Control, State Up, Flags: [none], length: 24
 00:00:12.652199 eth2  Out IP 10.0.29.2.40049 > 10.0.29.3.3784: BFDv1, Control, State Up, Flags: [none], length: 24
 00:00:12.654651 eth2  In  IP 10.0.29.3.41545 > 10.0.29.2.3784: BFDv1, Control, State Up, Flags: [none], length: 24
 00:00:12.735736 eth2  In  IP 10.0.29.3.41545 > 10.0.29.2.3784: BFDv1, Control, State Up, Flags: [none], length: 24
 00:00:12.739488 eth2  Out IP 10.0.29.2.40049 > 10.0.29.3.3784: BFDv1, Control, State Up, Flags: [none], length: 24
 00:00:12.812288 eth2  In  IP 10.0.29.3.41545 > 10.0.29.2.3784: BFDv1, Control, State Up, Flags: [none], length: 24
 00:00:12.818835 eth2  Out IP 10.0.29.2.40049 > 10.0.29.3.3784: BFDv1, Control, State Up, Flags: [none], length: 24
 00:00:12.889646 eth2  In  IP 10.0.29.3.41545 > 10.0.29.2.3784: BFDv1, Control, State Up, Flags: [none], length: 24
 00:00:12.901965 eth2  Out IP 10.0.29.2.40049 > 10.0.29.3.3784: BFDv1, Control, State Up, Flags: [none], length: 24
 00:00:12.976495 eth2  In  IP 10.0.29.3.41545 > 10.0.29.2.3784: BFDv1, Control, State Up, Flags: [none], length: 24
 00:00:12.979926 eth2  Out IP 10.0.29.2.40049 > 10.0.29.3.3784: BFDv1, Control, State Up, Flags: [none], length: 24
 00:00:13.054930 eth2  In  IP 10.0.29.3.41545 > 10.0.29.2.3784: BFDv1, Control, State Up, Flags: [none], length: 24
 00:00:13.055118 eth2  Out IP 10.0.29.2.40049 > 10.0.29.3.3784: BFDv1, Control, State Up, Flags: [none], length: 24
 00:00:13.134380 eth2  Out IP 10.0.29.2.40049 > 10.0.29.3.3784: BFDv1, Control, State Up, Flags: [none], length: 24
 00:00:13.143633 eth2  In  IP 10.0.29.3.41545 > 10.0.29.2.3784: BFDv1, Control, State Up, Flags: [none], length: 24
 00:00:13.216979 eth2  Out IP 10.0.29.2.40049 > 10.0.29.3.3784: BFDv1, Control, State Up, Flags: [none], length: 24
 00:00:13.229497 eth2  In  IP 10.0.29.3.41545 > 10.0.29.2.3784: BFDv1, Control, State Up, Flags: [none], length: 24
 00:00:13.295922 eth2  Out IP 10.0.29.2.40049 > 10.0.29.3.3784: BFDv1, Control, State Up, Flags: [none], length: 24
 00:00:13.308203 eth2  In  IP 10.0.29.3.41545 > 10.0.29.2.3784: BFDv1, Control, State Up, Flags: [none], length: 24
 00:00:13.383770 eth2  Out IP 10.0.29.2.40049 > 10.0.29.3.3784: BFDv1, Control, State Up, Flags: [none], length: 24
 00:00:13.392184 eth2  In  IP 10.0.29.3.41545 > 10.0.29.2.3784: BFDv1, Control, State Up, Flags: [none], length: 24
 00:00:13.468630 eth2  Out IP 10.0.29.2.40049 > 10.0.29.3.3784: BFDv1, Control, State Up, Flags: [none], length: 24
 00:00:13.478943 eth2  In  IP 10.0.29.3.41545 > 10.0.29.2.3784: BFDv1, Control, State Up, Flags: [none], length: 24
 00:00:13.557725 eth2  In  IP 10.0.29.3.41545 > 10.0.29.2.3784: BFDv1, Control, State Up, Flags: [none], length: 24
 00:00:13.557906 eth2  Out IP 10.0.29.2.40049 > 10.0.29.3.3784: BFDv1, Control, State Up, Flags: [none], length: 24
 00:00:13.634148 eth2  Out IP 10.0.29.2.40049 > 10.0.29.3.3784: BFDv1, Control, State Up, Flags: [none], length: 24
 00:00:13.646429 eth2  In  IP 10.0.29.3.41545 > 10.0.29.2.3784: BFDv1, Control, State Up, Flags: [none], length: 24
 00:00:13.715837 eth2  Out IP 10.0.29.2.40049 > 10.0.29.3.3784: BFDv1, Control, State Up, Flags: [none], length: 24
 00:00:13.734140 eth2  In  IP 10.0.29.3.41545 > 10.0.29.2.3784: BFDv1, Control, State Up, Flags: [none], length: 24
 00:00:13.803476 eth2  Out IP 10.0.29.2.40049 > 10.0.29.3.3784: BFDv1, Control, State Up, Flags: [none], length: 24
 00:00:13.810815 eth2  In  IP 10.0.29.3.41545 > 10.0.29.2.3784: BFDv1, Control, State Up, Flags: [none], length: 24
 00:00:13.892131 eth2  Out IP 10.0.29.2.40049 > 10.0.29.3.3784: BFDv1, Control, State Up, Flags: [none], length: 24
 00:00:13.894377 eth2  In  IP 10.0.29.3.41545 > 10.0.29.2.3784: BFDv1, Control, State Up, Flags: [none], length: 24
 00:00:13.970730 eth2  In  IP 10.0.29.3.41545 > 10.0.29.2.3784: BFDv1, Control, State Up, Flags: [none], length: 24
 00:00:13.979027 eth2  Out IP 10.0.29.2.40049 > 10.0.29.3.3784: BFDv1, Control, State Up, Flags: [none], length: 24
 00:00:14.047266 eth2  In  IP 10.0.29.3.41545 > 10.0.29.2.3784: BFDv1, Control, State Up, Flags: [none], length: 24
 00:00:14.063605 eth2  Out IP 10.0.29.2.40049 > 10.0.29.3.3784: BFDv1, Control, State Up, Flags: [none], length: 24
 00:00:14.130752 eth2  In  IP 10.0.29.3.41545 > 10.0.29.2.3784: BFDv1, Control, State Up, Flags: [none], length: 24
 00:00:14.143087 eth2  Out IP 10.0.29.2.40049 > 10.0.29.3.3784: BFDv1, Control, State Up, Flags: [none], length: 24
 00:00:14.219829 eth2  In  IP 10.0.29.3.41545 > 10.0.29.2.3784: BFDv1, Control, State Up, Flags: [none], length: 24
 00:00:14.232118 eth2  Out IP 10.0.29.2.40049 > 10.0.29.3.3784: BFDv1, Control, State Up, Flags: [none], length: 24
 00:00:14.298295 eth2  Out IP 10.0.29.2.39195 > 10.0.29.3.179: Flags [S], seq 3965121191, win 64240, options [mss 1460,sackOK,TS val 2352658641 ecr 0,nop,wscale 10], length 0
 00:00:14.298359 eth2  In  IP 10.0.29.3.179 > 10.0.29.2.39195: Flags [S.], seq 1539560622, ack 3965121192, win 65160, options [mss 1460,sackOK,TS val 562958377 ecr 2352658641,nop,wscale 10], length 0
 00:00:14.298382 eth2  Out IP 10.0.29.2.39195 > 10.0.29.3.179: Flags [.], ack 1, win 63, options [nop,nop,TS val 2352658641 ecr 562958377], length 0
 00:00:14.298448 eth2  Out IP 10.0.29.2.39195 > 10.0.29.3.179: Flags [P.], seq 1:65, ack 1, win 63, options [nop,nop,TS val 2352658641 ecr 562958377], length 64: BGP
 00:00:14.298490 eth2  In  IP 10.0.29.3.179 > 10.0.29.2.39195: Flags [.], ack 65, win 64, options [nop,nop,TS val 562958377 ecr 2352658641], length 0
 00:00:14.298560 eth2  In  IP 10.0.29.3.179 > 10.0.29.2.39195: Flags [R.], seq 1, ack 65, win 64, options [nop,nop,TS val 562958378 ecr 2352658641], length 0
 00:00:14.298875 eth2  In  IP 10.0.29.3.41545 > 10.0.29.2.3784: BFDv1, Control, State Up, Flags: [none], length: 24
 00:00:14.311156 eth2  Out IP 10.0.29.2.40049 > 10.0.29.3.3784: BFDv1, Control, State Up, Flags: [none], length: 24
 00:00:14.383986 eth2  In  IP 10.0.29.3.41545 > 10.0.29.2.3784: BFDv1, Control, State Up, Flags: [none], length: 24
 00:00:14.388247 eth2  Out IP 10.0.29.2.40049 > 10.0.29.3.3784: BFDv1, Control, State Up, Flags: [none], length: 24
 00:00:14.468952 eth2  In  IP 10.0.29.3.41545 > 10.0.29.2.3784: BFDv1, Control, State Up, Flags: [none], length: 24
 00:00:14.476255 eth2  Out IP 10.0.29.2.40049 > 10.0.29.3.3784: BFDv1, Control, State Up, Flags: [none], length: 24
 00:00:14.555407 eth2  In  IP 10.0.29.3.41545 > 10.0.29.2.3784: BFDv1, Control, State Up, Flags: [none], length: 24
 00:00:14.556677 eth2  Out IP 10.0.29.2.40049 > 10.0.29.3.3784: BFDv1, Control, State Up, Flags: [none], length: 24
 00:00:14.630387 eth2  In  IP 10.0.29.3.41545 > 10.0.29.2.3784: BFDv1, Control, State Up, Flags: [none], length: 24
 00:00:14.643674 eth2  Out IP 10.0.29.2.40049 > 10.0.29.3.3784: BFDv1, Control, State Up, Flags: [none], length: 24
 00:00:14.705405 eth2  In  IP 10.0.29.3.41545 > 10.0.29.2.3784: BFDv1, Control, State Up, Flags: [none], length: 24
 00:00:14.723753 eth2  Out IP 10.0.29.2.40049 > 10.0.29.3.3784: BFDv1, Control, State Up, Flags: [none], length: 24
 00:00:14.793501 eth2  In  IP 10.0.29.3.41545 > 10.0.29.2.3784: BFDv1, Control, State Up, Flags: [none], length: 24
 00:00:14.798748 eth2  Out IP 10.0.29.2.40049 > 10.0.29.3.3784: BFDv1, Control, State Up, Flags: [none], length: 24
 00:00:14.875819 eth2  In  IP 10.0.29.3.41545 > 10.0.29.2.3784: BFDv1, Control, State Up, Flags: [none], length: 24
 00:00:14.881217 eth2  Out IP 10.0.29.2.40049 > 10.0.29.3.3784: BFDv1, Control, State Up, Flags: [none], length: 24
 00:00:14.960940 eth2  In  IP 10.0.29.3.41545 > 10.0.29.2.3784: BFDv1, Control, State Up, Flags: [none], length: 24
 00:00:14.963182 eth2  Out IP 10.0.29.2.40049 > 10.0.29.3.3784: BFDv1, Control, State Up, Flags: [none], length: 24
 00:00:15.036935 eth2  In  IP 10.0.29.3.41545 > 10.0.29.2.3784: BFDv1, Control, State Up, Flags: [none], length: 24
 00:00:15.050290 eth2  Out IP 10.0.29.2.40049 > 10.0.29.3.3784: BFDv1, Control, State Up, Flags: [none], length: 24
 00:00:15.126955 eth2  In  IP 10.0.29.3.41545 > 10.0.29.2.3784: BFDv1, Control, State Up, Flags: [none], length: 24
 00:00:15.136234 eth2  Out IP 10.0.29.2.40049 > 10.0.29.3.3784: BFDv1, Control, State Up, Flags: [none], length: 24
 00:00:15.205928 eth2  In  IP 10.0.29.3.41545 > 10.0.29.2.3784: BFDv1, Control, State Up, Flags: [none], length: 24
 00:00:15.212196 eth2  Out IP 10.0.29.2.40049 > 10.0.29.3.3784: BFDv1, Control, State Up, Flags: [none], length: 24
 00:00:15.287798 eth2  In  IP 10.0.29.3.41545 > 10.0.29.2.3784: BFDv1, Control, State Up, Flags: [none], length: 24
 00:00:15.301076 eth2  Out IP 10.0.29.2.40049 > 10.0.29.3.3784: BFDv1, Control, State Up, Flags: [none], length: 24
 00:00:15.321664 eth2  Out IP 10.0.29.2.179 > 10.0.29.3.38299: Flags [FP.], seq 0:21, ack 1, win 64, options [nop,nop,TS val 2352659665 ecr 562930015], length 21: BGP
 00:00:15.321848 eth2  In  IP 10.0.29.3.38299 > 10.0.29.2.179: Flags [R], seq 476888637, win 0, length 0
 00:00:15.366699 eth2  In  IP 10.0.29.3.41545 > 10.0.29.2.3784: BFDv1, Control, State Up, Flags: [none], length: 24
 00:00:15.386905 eth2  Out IP 10.0.29.2.40049 > 10.0.29.3.3784: BFDv1, Control, State Up, Flags: [none], length: 24
 00:00:15.449593 eth2  In  IP 10.0.29.3.41545 > 10.0.29.2.3784: BFDv1, Control, State Up, Flags: [none], length: 24
 00:00:15.465820 eth2  Out IP 10.0.29.2.40049 > 10.0.29.3.3784: BFDv1, Control, State Up, Flags: [none], length: 24
 00:00:15.530560 eth2  In  IP 10.0.29.3.41545 > 10.0.29.2.3784: BFDv1, Control, State Up, Flags: [none], length: 24
 00:00:15.547835 eth2  Out IP 10.0.29.2.40049 > 10.0.29.3.3784: BFDv1, Control, State Up, Flags: [none], length: 24
 00:00:15.609594 eth2  In  IP 10.0.29.3.41545 > 10.0.29.2.3784: BFDv1, Control, State Up, Flags: [none], length: 24
 00:00:15.636882 eth2  Out IP 10.0.29.2.40049 > 10.0.29.3.3784: BFDv1, Control, State Up, Flags: [none], length: 24
 00:00:15.698589 eth2  In  IP 10.0.29.3.41545 > 10.0.29.2.3784: BFDv1, Control, State Up, Flags: [none], length: 24
 00:00:15.713901 eth2  Out IP 10.0.29.2.40049 > 10.0.29.3.3784: BFDv1, Control, State Up, Flags: [none], length: 24
 00:00:15.777733 eth2  In  IP 10.0.29.3.41545 > 10.0.29.2.3784: BFDv1, Control, State Up, Flags: [none], length: 24
 00:00:15.791022 eth2  Out IP 10.0.29.2.40049 > 10.0.29.3.3784: BFDv1, Control, State Up, Flags: [none], length: 24
 00:00:15.866739 eth2  In  IP 10.0.29.3.41545 > 10.0.29.2.3784: BFDv1, Control, State Up, Flags: [none], length: 24
 00:00:15.879968 eth2  Out IP 10.0.29.2.40049 > 10.0.29.3.3784: BFDv1, Control, State Up, Flags: [none], length: 24
 00:00:15.941761 eth2  In  IP 10.0.29.3.41545 > 10.0.29.2.3784: BFDv1, Control, State Up, Flags: [none], length: 24
 00:00:15.957090 eth2  Out IP 10.0.29.2.40049 > 10.0.29.3.3784: BFDv1, Control, State Up, Flags: [none], length: 24
 00:00:16.018773 eth2  In  IP 10.0.29.3.41545 > 10.0.29.2.3784: BFDv1, Control, State Up, Flags: [none], length: 24
 00:00:16.040015 eth2  Out IP 10.0.29.2.40049 > 10.0.29.3.3784: BFDv1, Control, State Up, Flags: [none], length: 24
 00:00:16.096392 eth2  In  IP 10.0.29.3.41545 > 10.0.29.2.3784: BFDv1, Control, State Up, Flags: [none], length: 24
 00:00:16.125654 eth2  Out IP 10.0.29.2.40049 > 10.0.29.3.3784: BFDv1, Control, State Up, Flags: [none], length: 24
 00:00:16.180235 eth2  In  IP 10.0.29.3.41545 > 10.0.29.2.3784: BFDv1, Control, State Up, Flags: [none], length: 24
 00:00:16.201647 eth2  Out IP 10.0.29.2.40049 > 10.0.29.3.3784: BFDv1, Control, State Up, Flags: [none], length: 24
 00:00:16.268034 eth2  In  IP 10.0.29.3.41545 > 10.0.29.2.3784: BFDv1, Control, State Up, Flags: [none], length: 24
 00:00:16.281251 eth2  Out IP 10.0.29.2.40049 > 10.0.29.3.3784: BFDv1, Control, State Up, Flags: [none], length: 24
 00:00:16.351846 eth2  In  IP 10.0.29.3.41545 > 10.0.29.2.3784: BFDv1, Control, State Up, Flags: [none], length: 24
 00:00:16.361054 eth2  Out IP 10.0.29.2.40049 > 10.0.29.3.3784: BFDv1, Control, State Up, Flags: [none], length: 24
 00:00:16.430092 eth2  In  IP 10.0.29.3.41545 > 10.0.29.2.3784: BFDv1, Control, State Up, Flags: [none], length: 24
 00:00:16.442325 eth2  Out IP 10.0.29.2.40049 > 10.0.29.3.3784: BFDv1, Control, State Up, Flags: [none], length: 24
 00:00:16.518589 eth2  In  IP 10.0.29.3.41545 > 10.0.29.2.3784: BFDv1, Control, State Up, Flags: [none], length: 24
 00:00:16.520834 eth2  Out IP 10.0.29.2.40049 > 10.0.29.3.3784: BFDv1, Control, State Up, Flags: [none], length: 24
 00:00:16.595074 eth2  In  IP 10.0.29.3.41545 > 10.0.29.2.3784: BFDv1, Control, State Up, Flags: [none], length: 24
 00:00:16.604328 eth2  Out IP 10.0.29.2.40049 > 10.0.29.3.3784: BFDv1, Control, State Up, Flags: [none], length: 24
 00:00:16.672590 eth2  In  IP 10.0.29.3.41545 > 10.0.29.2.3784: BFDv1, Control, State Up, Flags: [none], length: 24
 00:00:16.684820 eth2  Out IP 10.0.29.2.40049 > 10.0.29.3.3784: BFDv1, Control, State Up, Flags: [none], length: 24
 00:00:16.756276 eth2  In  IP 10.0.29.3.41545 > 10.0.29.2.3784: BFDv1, Control, State Up, Flags: [none], length: 24
 00:00:16.760589 eth2  Out IP 10.0.29.2.40049 > 10.0.29.3.3784: BFDv1, Control, State Up, Flags: [none], length: 24
 00:00:16.832745 eth2  In  IP 10.0.29.3.41545 > 10.0.29.2.3784: BFDv1, Control, State Up, Flags: [none], length: 24
 00:00:16.836017 eth2  Out IP 10.0.29.2.40049 > 10.0.29.3.3784: BFDv1, Control, State Up, Flags: [none], length: 24
 00:00:16.918238 eth2  Out IP 10.0.29.2.40049 > 10.0.29.3.3784: BFDv1, Control, State Up, Flags: [none], length: 24
 00:00:16.918353 eth2  In  IP 10.0.29.3.41545 > 10.0.29.2.3784: BFDv1, Control, State Up, Flags: [none], length: 24
 00:00:16.996815 eth2  In  IP 10.0.29.3.41545 > 10.0.29.2.3784: BFDv1, Control, State Up, Flags: [none], length: 24
 00:00:17.007026 eth2  Out IP 10.0.29.2.40049 > 10.0.29.3.3784: BFDv1, Control, State Up, Flags: [none], length: 24
 00:00:17.076678 eth2  In  IP 10.0.29.3.41545 > 10.0.29.2.3784: BFDv1, Control, State Up, Flags: [none], length: 24
 00:00:17.087902 eth2  Out IP 10.0.29.2.40049 > 10.0.29.3.3784: BFDv1, Control, State Up, Flags: [none], length: 24
 00:00:17.160463 eth2  In  IP 10.0.29.3.41545 > 10.0.29.2.3784: BFDv1, Control, State Up, Flags: [none], length: 24
 00:00:17.167667 eth2  Out IP 10.0.29.2.40049 > 10.0.29.3.3784: BFDv1, Control, State Up, Flags: [none], length: 24
 00:00:17.244858 eth2  Out IP 10.0.29.2.40049 > 10.0.29.3.3784: BFDv1, Control, State Up, Flags: [none], length: 24
 00:00:17.249031 eth2  In  IP 10.0.29.3.41545 > 10.0.29.2.3784: BFDv1, Control, State Up, Flags: [none], length: 24
 00:00:17.326302 eth2  Out IP 10.0.29.2.40049 > 10.0.29.3.3784: BFDv1, Control, State Up, Flags: [none], length: 24
 00:00:17.334649 eth2  In  IP 10.0.29.3.41545 > 10.0.29.2.3784: BFDv1, Control, State Up, Flags: [none], length: 24
 00:00:17.411949 eth2  Out IP 10.0.29.2.40049 > 10.0.29.3.3784: BFDv1, Control, State Up, Flags: [none], length: 24
 00:00:17.419159 eth2  In  IP 10.0.29.3.41545 > 10.0.29.2.3784: BFDv1, Control, State Up, Flags: [none], length: 24
 00:00:17.497382 eth2  Out IP 10.0.29.2.40049 > 10.0.29.3.3784: BFDv1, Control, State Up, Flags: [none], length: 24
 00:00:17.498621 eth2  In  IP 10.0.29.3.41545 > 10.0.29.2.3784: BFDv1, Control, State Up, Flags: [none], length: 24
 00:00:17.574830 eth2  Out IP 10.0.29.2.40049 > 10.0.29.3.3784: BFDv1, Control, State Up, Flags: [none], length: 24
 00:00:17.574947 eth2  In  IP 10.0.29.3.41545 > 10.0.29.2.3784: BFDv1, Control, State Up, Flags: [none], length: 24
 00:00:17.657182 eth2  Out IP 10.0.29.2.40049 > 10.0.29.3.3784: BFDv1, Control, State Up, Flags: [none], length: 24
 00:00:17.664487 eth2  In  IP 10.0.29.3.41545 > 10.0.29.2.3784: BFDv1, Control, State Up, Flags: [none], length: 24
 00:00:17.742873 eth2  Out IP 10.0.29.2.40049 > 10.0.29.3.3784: BFDv1, Control, State Up, Flags: [none], length: 24
 00:00:17.742980 eth2  In  IP 10.0.29.3.41545 > 10.0.29.2.3784: BFDv1, Control, State Up, Flags: [none], length: 24
 00:00:17.819208 eth2  Out IP 10.0.29.2.40049 > 10.0.29.3.3784: BFDv1, Control, State Up, Flags: [none], length: 24
 00:00:17.829381 eth2  In  IP 10.0.29.3.41545 > 10.0.29.2.3784: BFDv1, Control, State Up, Flags: [none], length: 24
 00:00:17.896661 eth2  Out IP 10.0.29.2.40049 > 10.0.29.3.3784: BFDv1, Control, State Up, Flags: [none], length: 24
 00:00:17.916903 eth2  In  IP 10.0.29.3.41545 > 10.0.29.2.3784: BFDv1, Control, State Up, Flags: [none], length: 24
 00:00:17.985308 eth2  Out IP 10.0.29.2.40049 > 10.0.29.3.3784: BFDv1, Control, State Up, Flags: [none], length: 24
 00:00:18.002569 eth2  In  IP 10.0.29.3.41545 > 10.0.29.2.3784: BFDv1, Control, State Up, Flags: [none], length: 24
 00:00:18.069840 eth2  Out IP 10.0.29.2.40049 > 10.0.29.3.3784: BFDv1, Control, State Up, Flags: [none], length: 24
 00:00:18.082063 eth2  In  IP 10.0.29.3.41545 > 10.0.29.2.3784: BFDv1, Control, State Up, Flags: [none], length: 24
 00:00:18.146327 eth2  Out IP 10.0.29.2.40049 > 10.0.29.3.3784: BFDv1, Control, State Up, Flags: [none], length: 24
 00:00:18.166569 eth2  In  IP 10.0.29.3.41545 > 10.0.29.2.3784: BFDv1, Control, State Up, Flags: [none], length: 24
 00:00:18.221806 eth2  Out IP 10.0.29.2.40049 > 10.0.29.3.3784: BFDv1, Control, State Up, Flags: [none], length: 24
 00:00:18.254977 eth2  In  IP 10.0.29.3.41545 > 10.0.29.2.3784: BFDv1, Control, State Up, Flags: [none], length: 24
 00:00:18.308219 eth2  Out IP 10.0.29.2.40049 > 10.0.29.3.3784: BFDv1, Control, State Up, Flags: [none], length: 24
 00:00:18.337434 eth2  In  IP 10.0.29.3.41545 > 10.0.29.2.3784: BFDv1, Control, State Up, Flags: [none], length: 24
 00:00:18.396712 eth2  Out IP 10.0.29.2.40049 > 10.0.29.3.3784: BFDv1, Control, State Up, Flags: [none], length: 24
 00:00:18.423899 eth2  In  IP 10.0.29.3.41545 > 10.0.29.2.3784: BFDv1, Control, State Up, Flags: [none], length: 24
 00:00:18.476166 eth2  Out IP 10.0.29.2.40049 > 10.0.29.3.3784: BFDv1, Control, State Up, Flags: [none], length: 24
 00:00:18.511391 eth2  In  IP 10.0.29.3.41545 > 10.0.29.2.3784: BFDv1, Control, State Up, Flags: [none], length: 24
 00:00:18.554612 eth2  Out IP 10.0.29.2.40049 > 10.0.29.3.3784: BFDv1, Control, State Up, Flags: [none], length: 24
 00:00:18.593794 eth2  In  IP 10.0.29.3.41545 > 10.0.29.2.3784: BFDv1, Control, State Up, Flags: [none], length: 24
 00:00:18.640027 eth2  Out IP 10.0.29.2.40049 > 10.0.29.3.3784: BFDv1, Control, State Up, Flags: [none], length: 24
 00:00:18.675250 eth2  In  IP 10.0.29.3.41545 > 10.0.29.2.3784: BFDv1, Control, State Up, Flags: [none], length: 24
 00:00:18.718757 eth2  Out IP 10.0.29.2.40049 > 10.0.29.3.3784: BFDv1, Control, State Up, Flags: [none], length: 24
 00:00:18.760752 eth2  In  IP 10.0.29.3.41545 > 10.0.29.2.3784: BFDv1, Control, State Up, Flags: [none], length: 24
 00:00:18.801992 eth2  Out IP 10.0.29.2.40049 > 10.0.29.3.3784: BFDv1, Control, State Up, Flags: [none], length: 24
 00:00:18.844364 eth2  In  IP 10.0.29.3.41545 > 10.0.29.2.3784: BFDv1, Control, State Up, Flags: [none], length: 24
 00:00:18.891634 eth2  Out IP 10.0.29.2.40049 > 10.0.29.3.3784: BFDv1, Control, State Up, Flags: [none], length: 24
 00:00:18.910287 eth2  Out IP 10.0.29.2.54861 > 10.0.29.3.179: Flags [S], seq 3209690928, win 64240, options [mss 1460,sackOK,TS val 2352663253 ecr 0,nop,wscale 10], length 0
 00:00:18.910348 eth2  In  IP 10.0.29.3.179 > 10.0.29.2.54861: Flags [S.], seq 3136351246, ack 3209690929, win 65160, options [mss 1460,sackOK,TS val 562962989 ecr 2352663253,nop,wscale 10], length 0
 00:00:18.910372 eth2  Out IP 10.0.29.2.54861 > 10.0.29.3.179: Flags [.], ack 1, win 63, options [nop,nop,TS val 2352663253 ecr 562962989], length 0
 00:00:18.910458 eth2  Out IP 10.0.29.2.54861 > 10.0.29.3.179: Flags [P.], seq 1:65, ack 1, win 63, options [nop,nop,TS val 2352663253 ecr 562962989], length 64: BGP
 00:00:18.910480 eth2  In  IP 10.0.29.3.179 > 10.0.29.2.54861: Flags [F.], seq 1, ack 1, win 64, options [nop,nop,TS val 562962989 ecr 2352663253], length 0
 00:00:18.910540 eth2  Out IP 10.0.29.2.54861 > 10.0.29.3.179: Flags [.], ack 2, win 63, options [nop,nop,TS val 2352663254 ecr 562962989], length 0
 00:00:18.910547 eth2  In  IP 10.0.29.3.179 > 10.0.29.2.54861: Flags [R], seq 3136351247, win 0, length 0
 00:00:18.910550 eth2  Out IP 10.0.29.2.54861 > 10.0.29.3.179: Flags [F.], seq 65, ack 2, win 63, options [nop,nop,TS val 2352663254 ecr 562962989], length 0
 00:00:18.910565 eth2  In  IP 10.0.29.3.179 > 10.0.29.2.54861: Flags [R], seq 3136351248, win 0, length 0
 00:00:18.910570 eth2  In  IP 10.0.29.3.179 > 10.0.29.2.54861: Flags [R], seq 3136351248, win 0, length 0
 00:00:18.931943 eth2  In  IP 10.0.29.3.41545 > 10.0.29.2.3784: BFDv1, Control, State Up, Flags: [none], length: 24
 00:00:18.977201 eth2  Out IP 10.0.29.2.40049 > 10.0.29.3.3784: BFDv1, Control, State Up, Flags: [none], length: 24
 00:00:19.014680 eth2  In  IP 10.0.29.3.41545 > 10.0.29.2.3784: BFDv1, Control, State Up, Flags: [none], length: 24
 00:00:19.062926 eth2  Out IP 10.0.29.2.40049 > 10.0.29.3.3784: BFDv1, Control, State Up, Flags: [none], length: 24
 00:00:19.094293 eth2  In  IP 10.0.29.3.41545 > 10.0.29.2.3784: BFDv1, Control, State Up, Flags: [none], length: 24
 00:00:19.145569 eth2  Out IP 10.0.29.2.40049 > 10.0.29.3.3784: BFDv1, Control, State Up, Flags: [none], length: 24
 00:00:19.170585 eth2  In  IP 10.0.29.3.41545 > 10.0.29.2.3784: BFDv1, Control, State Up, Flags: [none], length: 24
 00:00:19.228809 eth2  Out IP 10.0.29.2.40049 > 10.0.29.3.3784: BFDv1, Control, State Up, Flags: [none], length: 24
 00:00:19.257084 eth2  In  IP 10.0.29.3.41545 > 10.0.29.2.3784: BFDv1, Control, State Up, Flags: [none], length: 24
 00:00:19.313350 eth2  Out IP 10.0.29.2.40049 > 10.0.29.3.3784: BFDv1, Control, State Up, Flags: [none], length: 24
 00:00:19.338614 eth2  In  IP 10.0.29.3.41545 > 10.0.29.2.3784: BFDv1, Control, State Up, Flags: [none], length: 24
 00:00:19.401935 eth2  Out IP 10.0.29.2.40049 > 10.0.29.3.3784: BFDv1, Control, State Up, Flags: [none], length: 24
 00:00:19.414007 eth2  In  IP 10.0.29.3.41545 > 10.0.29.2.3784: BFDv1, Control, State Up, Flags: [none], length: 24
 00:00:19.490312 eth2  Out IP 10.0.29.2.40049 > 10.0.29.3.3784: BFDv1, Control, State Up, Flags: [none], length: 24
 00:00:19.494599 eth2  In  IP 10.0.29.3.41545 > 10.0.29.2.3784: BFDv1, Control, State Up, Flags: [none], length: 24
 00:00:19.576864 eth2  Out IP 10.0.29.2.40049 > 10.0.29.3.3784: BFDv1, Control, State Up, Flags: [none], length: 24
 00:00:19.584177 eth2  In  IP 10.0.29.3.41545 > 10.0.29.2.3784: BFDv1, Control, State Up, Flags: [none], length: 24
 00:00:19.655842 eth2  Out IP 10.0.29.2.40049 > 10.0.29.3.3784: BFDv1, Control, State Up, Flags: [none], length: 24
 00:00:19.668277 eth2  In  IP 10.0.29.3.41545 > 10.0.29.2.3784: BFDv1, Control, State Up, Flags: [none], length: 24
 00:00:19.739639 eth2  Out IP 10.0.29.2.40049 > 10.0.29.3.3784: BFDv1, Control, State Up, Flags: [none], length: 24
 00:00:19.748893 eth2  In  IP 10.0.29.3.41545 > 10.0.29.2.3784: BFDv1, Control, State Up, Flags: [none], length: 24
 00:00:19.821235 eth2  Out IP 10.0.29.2.40049 > 10.0.29.3.3784: BFDv1, Control, State Up, Flags: [none], length: 24
 00:00:19.828422 eth2  In  IP 10.0.29.3.41545 > 10.0.29.2.3784: BFDv1, Control, State Up, Flags: [none], length: 24
 00:00:19.902632 eth2  Out IP 10.0.29.2.40049 > 10.0.29.3.3784: BFDv1, Control, State Up, Flags: [none], length: 24
 00:00:19.914852 eth2  In  IP 10.0.29.3.41545 > 10.0.29.2.3784: BFDv1, Control, State Up, Flags: [none], length: 24
 00:00:19.978164 eth2  Out IP 10.0.29.2.40049 > 10.0.29.3.3784: BFDv1, Control, State Up, Flags: [none], length: 24
 00:00:19.998403 eth2  In  IP 10.0.29.3.41545 > 10.0.29.2.3784: BFDv1, Control, State Up, Flags: [none], length: 24
 00:00:20.054635 eth2  Out IP 10.0.29.2.40049 > 10.0.29.3.3784: BFDv1, Control, State Up, Flags: [none], length: 24
 00:00:20.082048 eth2  In  IP 10.0.29.3.41545 > 10.0.29.2.3784: BFDv1, Control, State Up, Flags: [none], length: 24
 00:00:20.138285 eth2  Out IP 10.0.29.2.40049 > 10.0.29.3.3784: BFDv1, Control, State Up, Flags: [none], length: 24
 00:00:20.161676 eth2  In  IP 10.0.29.3.41545 > 10.0.29.2.3784: BFDv1, Control, State Up, Flags: [none], length: 24
 00:00:20.215952 eth2  Out IP 10.0.29.2.40049 > 10.0.29.3.3784: BFDv1, Control, State Up, Flags: [none], length: 24
 00:00:20.247416 eth2  In  IP 10.0.29.3.41545 > 10.0.29.2.3784: BFDv1, Control, State Up, Flags: [none], length: 24
 00:00:20.291699 eth2  Out IP 10.0.29.2.40049 > 10.0.29.3.3784: BFDv1, Control, State Up, Flags: [none], length: 24
 00:00:20.336099 eth2  In  IP 10.0.29.3.41545 > 10.0.29.2.3784: BFDv1, Control, State Up, Flags: [none], length: 24
 00:00:20.368399 eth2  Out IP 10.0.29.2.40049 > 10.0.29.3.3784: BFDv1, Control, State Up, Flags: [none], length: 24
 00:00:20.416502 eth2  In  IP 10.0.29.3.41545 > 10.0.29.2.3784: BFDv1, Control, State Up, Flags: [none], length: 24
 00:00:20.446824 eth2  Out IP 10.0.29.2.40049 > 10.0.29.3.3784: BFDv1, Control, State Up, Flags: [none], length: 24
 00:00:20.494938 eth2  In  IP 10.0.29.3.41545 > 10.0.29.2.3784: BFDv1, Control, State Up, Flags: [none], length: 24
 00:00:20.523288 eth2  Out IP 10.0.29.2.40049 > 10.0.29.3.3784: BFDv1, Control, State Up, Flags: [none], length: 24
 00:00:20.573422 eth2  In  IP 10.0.29.3.41545 > 10.0.29.2.3784: BFDv1, Control, State Up, Flags: [none], length: 24
 00:00:20.611724 eth2  Out IP 10.0.29.2.40049 > 10.0.29.3.3784: BFDv1, Control, State Up, Flags: [none], length: 24
 00:00:20.658814 eth2  In  IP 10.0.29.3.41545 > 10.0.29.2.3784: BFDv1, Control, State Up, Flags: [none], length: 24
 00:00:20.688124 eth2  Out IP 10.0.29.2.40049 > 10.0.29.3.3784: BFDv1, Control, State Up, Flags: [none], length: 24
 00:00:20.748336 eth2  In  IP 10.0.29.3.41545 > 10.0.29.2.3784: BFDv1, Control, State Up, Flags: [none], length: 24
 00:00:20.768607 eth2  Out IP 10.0.29.2.40049 > 10.0.29.3.3784: BFDv1, Control, State Up, Flags: [none], length: 24
 00:00:20.826008 eth2  In  IP 10.0.29.3.41545 > 10.0.29.2.3784: BFDv1, Control, State Up, Flags: [none], length: 24
 00:00:20.845279 eth2  Out IP 10.0.29.2.40049 > 10.0.29.3.3784: BFDv1, Control, State Up, Flags: [none], length: 24
 00:00:20.909409 eth2  In  IP 10.0.29.3.41545 > 10.0.29.2.3784: BFDv1, Control, State Up, Flags: [none], length: 24
 00:00:20.931627 eth2  Out IP 10.0.29.2.40049 > 10.0.29.3.3784: BFDv1, Control, State Up, Flags: [none], length: 24
 00:00:20.996822 eth2  In  IP 10.0.29.3.41545 > 10.0.29.2.3784: BFDv1, Control, State Up, Flags: [none], length: 24
 00:00:21.016061 eth2  Out IP 10.0.29.2.40049 > 10.0.29.3.3784: BFDv1, Control, State Up, Flags: [none], length: 24
 00:00:21.073148 eth2  In  IP 10.0.29.3.41545 > 10.0.29.2.3784: BFDv1, Control, State Up, Flags: [none], length: 24
 00:00:21.100386 eth2  Out IP 10.0.29.2.40049 > 10.0.29.3.3784: BFDv1, Control, State Up, Flags: [none], length: 24
 00:00:21.157745 eth2  In  IP 10.0.29.3.41545 > 10.0.29.2.3784: BFDv1, Control, State Up, Flags: [none], length: 24
 00:00:21.185079 eth2  Out IP 10.0.29.2.40049 > 10.0.29.3.3784: BFDv1, Control, State Up, Flags: [none], length: 24
 00:00:21.246575 eth2  In  IP 10.0.29.3.41545 > 10.0.29.2.3784: BFDv1, Control, State Up, Flags: [none], length: 24
 00:00:21.264798 eth2  Out IP 10.0.29.2.40049 > 10.0.29.3.3784: BFDv1, Control, State Up, Flags: [none], length: 24
 00:00:21.326033 eth2  In  IP 10.0.29.3.41545 > 10.0.29.2.3784: BFDv1, Control, State Up, Flags: [none], length: 24
 00:00:21.345275 eth2  Out IP 10.0.29.2.40049 > 10.0.29.3.3784: BFDv1, Control, State Up, Flags: [none], length: 24
 00:00:21.404472 eth2  In  IP 10.0.29.3.41545 > 10.0.29.2.3784: BFDv1, Control, State Up, Flags: [none], length: 24
 00:00:21.422786 eth2  Out IP 10.0.29.2.40049 > 10.0.29.3.3784: BFDv1, Control, State Up, Flags: [none], length: 24
 00:00:21.488960 eth2  In  IP 10.0.29.3.41545 > 10.0.29.2.3784: BFDv1, Control, State Up, Flags: [none], length: 24
 00:00:21.503297 eth2  Out IP 10.0.29.2.40049 > 10.0.29.3.3784: BFDv1, Control, State Up, Flags: [none], length: 24
 00:00:21.564464 eth2  In  IP 10.0.29.3.41545 > 10.0.29.2.3784: BFDv1, Control, State Up, Flags: [none], length: 24
 00:00:21.578728 eth2  Out IP 10.0.29.2.40049 > 10.0.29.3.3784: BFDv1, Control, State Up, Flags: [none], length: 24
 00:00:21.653976 eth2  In  IP 10.0.29.3.41545 > 10.0.29.2.3784: BFDv1, Control, State Up, Flags: [none], length: 24
 00:00:21.663275 eth2  Out IP 10.0.29.2.40049 > 10.0.29.3.3784: BFDv1, Control, State Up, Flags: [none], length: 24
 00:00:21.733435 eth2  In  IP 10.0.29.3.41545 > 10.0.29.2.3784: BFDv1, Control, State Up, Flags: [none], length: 24
 00:00:21.751797 eth2  Out IP 10.0.29.2.40049 > 10.0.29.3.3784: BFDv1, Control, State Up, Flags: [none], length: 24
 00:00:21.817267 eth2  In  IP 10.0.29.3.41545 > 10.0.29.2.3784: BFDv1, Control, State Up, Flags: [none], length: 24
 00:00:21.837502 eth2  Out IP 10.0.29.2.40049 > 10.0.29.3.3784: BFDv1, Control, State Up, Flags: [none], length: 24
 00:00:21.902933 eth2  In  IP 10.0.29.3.41545 > 10.0.29.2.3784: BFDv1, Control, State Up, Flags: [none], length: 24
 00:00:21.920194 eth2  Out IP 10.0.29.2.40049 > 10.0.29.3.3784: BFDv1, Control, State Up, Flags: [none], length: 24
 00:00:21.991585 eth2  In  IP 10.0.29.3.41545 > 10.0.29.2.3784: BFDv1, Control, State Up, Flags: [none], length: 24
 00:00:22.006798 eth2  Out IP 10.0.29.2.40049 > 10.0.29.3.3784: BFDv1, Control, State Up, Flags: [none], length: 24
 00:00:22.069914 eth2  In  IP 10.0.29.3.41545 > 10.0.29.2.3784: BFDv1, Control, State Up, Flags: [none], length: 24
 00:00:22.089119 eth2  Out IP 10.0.29.2.40049 > 10.0.29.3.3784: BFDv1, Control, State Up, Flags: [none], length: 24
 00:00:22.153209 eth2  In  IP 10.0.29.3.41545 > 10.0.29.2.3784: BFDv1, Control, State Up, Flags: [none], length: 24
 00:00:22.175407 eth2  Out IP 10.0.29.2.40049 > 10.0.29.3.3784: BFDv1, Control, State Up, Flags: [none], length: 24
 00:00:22.240597 eth2  In  IP 10.0.29.3.41545 > 10.0.29.2.3784: BFDv1, Control, State Up, Flags: [none], length: 24
 00:00:22.255847 eth2  Out IP 10.0.29.2.40049 > 10.0.29.3.3784: BFDv1, Control, State Up, Flags: [none], length: 24
 00:00:22.324897 eth2  In  IP 10.0.29.3.41545 > 10.0.29.2.3784: BFDv1, Control, State Up, Flags: [none], length: 24
 00:00:22.344104 eth2  Out IP 10.0.29.2.40049 > 10.0.29.3.3784: BFDv1, Control, State Up, Flags: [none], length: 24
 00:00:22.410553 eth2  In  IP 10.0.29.3.41545 > 10.0.29.2.3784: BFDv1, Control, State Up, Flags: [none], length: 24
 00:00:22.421793 eth2  Out IP 10.0.29.2.40049 > 10.0.29.3.3784: BFDv1, Control, State Up, Flags: [none], length: 24
 00:00:22.494835 eth2  In  IP 10.0.29.3.41545 > 10.0.29.2.3784: BFDv1, Control, State Up, Flags: [none], length: 24
 00:00:22.502111 eth2  Out IP 10.0.29.2.40049 > 10.0.29.3.3784: BFDv1, Control, State Up, Flags: [none], length: 24
 00:00:22.575288 eth2  In  IP 10.0.29.3.41545 > 10.0.29.2.3784: BFDv1, Control, State Up, Flags: [none], length: 24
 00:00:22.591612 eth2  Out IP 10.0.29.2.40049 > 10.0.29.3.3784: BFDv1, Control, State Up, Flags: [none], length: 24
 00:00:22.659100 eth2  In  IP 10.0.29.3.41545 > 10.0.29.2.3784: BFDv1, Control, State Up, Flags: [none], length: 24
 00:00:22.677561 eth2  Out IP 10.0.29.2.40049 > 10.0.29.3.3784: BFDv1, Control, State Up, Flags: [none], length: 24
 00:00:22.742116 eth2  In  IP 10.0.29.3.41545 > 10.0.29.2.3784: BFDv1, Control, State Up, Flags: [none], length: 24
 00:00:22.760412 eth2  Out IP 10.0.29.2.40049 > 10.0.29.3.3784: BFDv1, Control, State Up, Flags: [none], length: 24
 00:00:22.824857 eth2  In  IP 10.0.29.3.41545 > 10.0.29.2.3784: BFDv1, Control, State Up, Flags: [none], length: 24
 00:00:22.835087 eth2  Out IP 10.0.29.2.40049 > 10.0.29.3.3784: BFDv1, Control, State Up, Flags: [none], length: 24
 00:00:22.910377 eth2  In  IP 10.0.29.3.41545 > 10.0.29.2.3784: BFDv1, Control, State Up, Flags: [none], length: 24
 00:00:22.922871 eth2  Out IP 10.0.29.2.40049 > 10.0.29.3.3784: BFDv1, Control, State Up, Flags: [none], length: 24
 00:00:22.997887 eth2  In  IP 10.0.29.3.41545 > 10.0.29.2.3784: BFDv1, Control, State Up, Flags: [none], length: 24
 00:00:23.008222 eth2  Out IP 10.0.29.2.40049 > 10.0.29.3.3784: BFDv1, Control, State Up, Flags: [none], length: 24
 00:00:23.082762 eth2  In  IP 10.0.29.3.41545 > 10.0.29.2.3784: BFDv1, Control, State Up, Flags: [none], length: 24
 00:00:23.085051 eth2  Out IP 10.0.29.2.40049 > 10.0.29.3.3784: BFDv1, Control, State Up, Flags: [none], length: 24
 00:00:23.166250 eth2  In  IP 10.0.29.3.41545 > 10.0.29.2.3784: BFDv1, Control, State Up, Flags: [none], length: 24
 00:00:23.170571 eth2  Out IP 10.0.29.2.40049 > 10.0.29.3.3784: BFDv1, Control, State Up, Flags: [none], length: 24
 00:00:23.250199 eth2  In  IP 10.0.29.3.41545 > 10.0.29.2.3784: BFDv1, Control, State Up, Flags: [none], length: 24
 00:00:23.256533 eth2  Out IP 10.0.29.2.40049 > 10.0.29.3.3784: BFDv1, Control, State Up, Flags: [none], length: 24
 00:00:23.325695 eth2  In  IP 10.0.29.3.41545 > 10.0.29.2.3784: BFDv1, Control, State Up, Flags: [none], length: 24
 00:00:23.337993 eth2  Out IP 10.0.29.2.40049 > 10.0.29.3.3784: BFDv1, Control, State Up, Flags: [none], length: 24
 00:00:23.408364 eth2  In  IP 10.0.29.3.41545 > 10.0.29.2.3784: BFDv1, Control, State Up, Flags: [none], length: 24
 00:00:23.424642 eth2  Out IP 10.0.29.2.40049 > 10.0.29.3.3784: BFDv1, Control, State Up, Flags: [none], length: 24
 00:00:23.491048 eth2  In  IP 10.0.29.3.41545 > 10.0.29.2.3784: BFDv1, Control, State Up, Flags: [none], length: 24
 00:00:23.508408 eth2  Out IP 10.0.29.2.40049 > 10.0.29.3.3784: BFDv1, Control, State Up, Flags: [none], length: 24
 00:00:23.566500 eth2  In  IP 10.0.29.3.41545 > 10.0.29.2.3784: BFDv1, Control, State Up, Flags: [none], length: 24
 00:00:23.583843 eth2  Out IP 10.0.29.2.40049 > 10.0.29.3.3784: BFDv1, Control, State Up, Flags: [none], length: 24
 00:00:23.595525 eth2  Out IP 10.0.29.2.54891 > 10.0.29.3.179: Flags [S], seq 3252564971, win 64240, options [mss 1460,sackOK,TS val 2352667938 ecr 0,nop,wscale 10], length 0
 00:00:23.595614 eth2  In  IP 10.0.29.3.179 > 10.0.29.2.54891: Flags [S.], seq 1281223351, ack 3252564972, win 65160, options [mss 1460,sackOK,TS val 562967675 ecr 2352667938,nop,wscale 10], length 0
 00:00:23.595682 eth2  Out IP 10.0.29.2.54891 > 10.0.29.3.179: Flags [.], ack 1, win 63, options [nop,nop,TS val 2352667939 ecr 562967675], length 0
 00:00:23.595781 eth2  Out IP 10.0.29.2.54891 > 10.0.29.3.179: Flags [P.], seq 1:65, ack 1, win 63, options [nop,nop,TS val 2352667939 ecr 562967675], length 64: BGP
 00:00:23.595798 eth2  In  IP 10.0.29.3.179 > 10.0.29.2.54891: Flags [.], ack 65, win 64, options [nop,nop,TS val 562967675 ecr 2352667939], length 0
 00:00:23.595861 eth2  In  IP 10.0.29.3.179 > 10.0.29.2.54891: Flags [R.], seq 1, ack 65, win 64, options [nop,nop,TS val 562967675 ecr 2352667939], length 0
 00:00:23.642355 eth2  In  IP 10.0.29.3.41545 > 10.0.29.2.3784: BFDv1, Control, State Up, Flags: [none], length: 24
 00:00:23.664827 eth2  Out IP 10.0.29.2.40049 > 10.0.29.3.3784: BFDv1, Control, State Up, Flags: [none], length: 24
 00:00:23.724006 eth2  In  IP 10.0.29.3.41545 > 10.0.29.2.3784: BFDv1, Control, State Up, Flags: [none], length: 24
 00:00:23.746328 eth2  Out IP 10.0.29.2.40049 > 10.0.29.3.3784: BFDv1, Control, State Up, Flags: [none], length: 24
 00:00:23.803662 eth2  In  IP 10.0.29.3.41545 > 10.0.29.2.3784: BFDv1, Control, State Up, Flags: [none], length: 24
 00:00:23.832045 eth2  Out IP 10.0.29.2.40049 > 10.0.29.3.3784: BFDv1, Control, State Up, Flags: [none], length: 24
 00:00:23.886250 eth2  In  IP 10.0.29.3.41545 > 10.0.29.2.3784: BFDv1, Control, State Up, Flags: [none], length: 24
 00:00:23.917836 eth2  Out IP 10.0.29.2.40049 > 10.0.29.3.3784: BFDv1, Control, State Up, Flags: [none], length: 24
 00:00:23.967762 eth2  In  IP 10.0.29.3.41545 > 10.0.29.2.3784: BFDv1, Control, State Up, Flags: [none], length: 24
 00:00:23.993079 eth2  Out IP 10.0.29.2.40049 > 10.0.29.3.3784: BFDv1, Control, State Up, Flags: [none], length: 24
 00:00:24.044020 eth2  In  IP 10.0.29.3.41545 > 10.0.29.2.3784: BFDv1, Control, State Up, Flags: [none], length: 24
 00:00:24.077417 eth2  Out IP 10.0.29.2.40049 > 10.0.29.3.3784: BFDv1, Control, State Up, Flags: [none], length: 24
 00:00:24.119281 eth2  In  IP 10.0.29.3.41545 > 10.0.29.2.3784: BFDv1, Control, State Up, Flags: [none], length: 24
 00:00:24.157697 eth2  Out IP 10.0.29.2.40049 > 10.0.29.3.3784: BFDv1, Control, State Up, Flags: [none], length: 24
 00:00:24.205491 eth2  In  IP 10.0.29.3.41545 > 10.0.29.2.3784: BFDv1, Control, State Up, Flags: [none], length: 24
 00:00:24.241038 eth2  Out IP 10.0.29.2.40049 > 10.0.29.3.3784: BFDv1, Control, State Up, Flags: [none], length: 24
 00:00:24.284302 eth2  In  IP 10.0.29.3.41545 > 10.0.29.2.3784: BFDv1, Control, State Up, Flags: [none], length: 24
 00:00:24.321749 eth2  Out IP 10.0.29.2.40049 > 10.0.29.3.3784: BFDv1, Control, State Up, Flags: [none], length: 24
 00:00:24.361110 eth2  In  IP 10.0.29.3.41545 > 10.0.29.2.3784: BFDv1, Control, State Up, Flags: [none], length: 24
 00:00:24.408409 eth2  Out IP 10.0.29.2.40049 > 10.0.29.3.3784: BFDv1, Control, State Up, Flags: [none], length: 24
 00:00:24.440771 eth2  In  IP 10.0.29.3.41545 > 10.0.29.2.3784: BFDv1, Control, State Up, Flags: [none], length: 24
 00:00:24.488144 eth2  Out IP 10.0.29.2.40049 > 10.0.29.3.3784: BFDv1, Control, State Up, Flags: [none], length: 24
 00:00:24.519746 eth2  In  IP 10.0.29.3.41545 > 10.0.29.2.3784: BFDv1, Control, State Up, Flags: [none], length: 24
 00:00:24.573059 eth2  Out IP 10.0.29.2.40049 > 10.0.29.3.3784: BFDv1, Control, State Up, Flags: [none], length: 24
 00:00:24.601439 eth2  In  IP 10.0.29.3.41545 > 10.0.29.2.3784: BFDv1, Control, State Up, Flags: [none], length: 24
 00:00:24.657847 eth2  Out IP 10.0.29.2.40049 > 10.0.29.3.3784: BFDv1, Control, State Up, Flags: [none], length: 24
 00:00:24.679132 eth2  In  IP 10.0.29.3.41545 > 10.0.29.2.3784: BFDv1, Control, State Up, Flags: [none], length: 24
 00:00:24.739458 eth2  Out IP 10.0.29.2.40049 > 10.0.29.3.3784: BFDv1, Control, State Up, Flags: [none], length: 24
 00:00:24.762073 eth2  In  IP 10.0.29.3.41545 > 10.0.29.2.3784: BFDv1, Control, State Up, Flags: [none], length: 24
 00:00:24.814478 eth2  Out IP 10.0.29.2.40049 > 10.0.29.3.3784: BFDv1, Control, State Up, Flags: [none], length: 24
 00:00:24.839764 eth2  In  IP 10.0.29.3.41545 > 10.0.29.2.3784: BFDv1, Control, State Up, Flags: [none], length: 24
 00:00:24.899056 eth2  Out IP 10.0.29.2.40049 > 10.0.29.3.3784: BFDv1, Control, State Up, Flags: [none], length: 24
 00:00:24.920578 eth2  In  IP 10.0.29.3.41545 > 10.0.29.2.3784: BFDv1, Control, State Up, Flags: [none], length: 24
 00:00:24.976984 eth2  Out IP 10.0.29.2.40049 > 10.0.29.3.3784: BFDv1, Control, State Up, Flags: [none], length: 24
 00:00:24.997269 eth2  In  IP 10.0.29.3.41545 > 10.0.29.2.3784: BFDv1, Control, State Up, Flags: [none], length: 24
 00:00:25.059781 eth2  Out IP 10.0.29.2.40049 > 10.0.29.3.3784: BFDv1, Control, State Up, Flags: [none], length: 24
 00:00:25.075353 eth2  In  IP 10.0.29.3.41545 > 10.0.29.2.3784: BFDv1, Control, State Up, Flags: [none], length: 24
 00:00:25.143660 eth2  Out IP 10.0.29.2.40049 > 10.0.29.3.3784: BFDv1, Control, State Up, Flags: [none], length: 24
 00:00:25.156952 eth2  In  IP 10.0.29.3.41545 > 10.0.29.2.3784: BFDv1, Control, State Up, Flags: [none], length: 24
 00:00:25.219273 eth2  Out IP 10.0.29.2.40049 > 10.0.29.3.3784: BFDv1, Control, State Up, Flags: [none], length: 24
 00:00:25.238543 eth2  In  IP 10.0.29.3.41545 > 10.0.29.2.3784: BFDv1, Control, State Up, Flags: [none], length: 24
 00:00:25.295851 eth2  Out IP 10.0.29.2.40049 > 10.0.29.3.3784: BFDv1, Control, State Up, Flags: [none], length: 24
 00:00:25.314118 eth2  In  IP 10.0.29.3.41545 > 10.0.29.2.3784: BFDv1, Control, State Up, Flags: [none], length: 24
 00:00:25.381534 eth2  Out IP 10.0.29.2.40049 > 10.0.29.3.3784: BFDv1, Control, State Up, Flags: [none], length: 24
 00:00:25.400826 eth2  In  IP 10.0.29.3.41545 > 10.0.29.2.3784: BFDv1, Control, State Up, Flags: [none], length: 24
 00:00:25.467176 eth2  Out IP 10.0.29.2.40049 > 10.0.29.3.3784: BFDv1, Control, State Up, Flags: [none], length: 24
 00:00:25.490626 eth2  In  IP 10.0.29.3.41545 > 10.0.29.2.3784: BFDv1, Control, State Up, Flags: [none], length: 24
 00:00:25.556008 eth2  Out IP 10.0.29.2.40049 > 10.0.29.3.3784: BFDv1, Control, State Up, Flags: [none], length: 24
 00:00:25.571587 eth2  In  IP 10.0.29.3.41545 > 10.0.29.2.3784: BFDv1, Control, State Up, Flags: [none], length: 24
 00:00:25.632893 eth2  Out IP 10.0.29.2.40049 > 10.0.29.3.3784: BFDv1, Control, State Up, Flags: [none], length: 24
 00:00:25.657265 eth2  In  IP 10.0.29.3.41545 > 10.0.29.2.3784: BFDv1, Control, State Up, Flags: [none], length: 24
 00:00:25.715822 eth2  Out IP 10.0.29.2.40049 > 10.0.29.3.3784: BFDv1, Control, State Up, Flags: [none], length: 24
 00:00:25.739091 eth2  In  IP 10.0.29.3.41545 > 10.0.29.2.3784: BFDv1, Control, State Up, Flags: [none], length: 24
 00:00:25.797372 eth2  Out IP 10.0.29.2.40049 > 10.0.29.3.3784: BFDv1, Control, State Up, Flags: [none], length: 24
 00:00:25.819641 eth2  In  IP 10.0.29.3.41545 > 10.0.29.2.3784: BFDv1, Control, State Up, Flags: [none], length: 24
 00:00:25.873935 eth2  Out IP 10.0.29.2.40049 > 10.0.29.3.3784: BFDv1, Control, State Up, Flags: [none], length: 24
 00:00:25.909425 eth2  In  IP 10.0.29.3.41545 > 10.0.29.2.3784: BFDv1, Control, State Up, Flags: [none], length: 24
 00:00:25.961789 eth2  Out IP 10.0.29.2.40049 > 10.0.29.3.3784: BFDv1, Control, State Up, Flags: [none], length: 24
 00:00:25.985180 eth2  In  IP 10.0.29.3.41545 > 10.0.29.2.3784: BFDv1, Control, State Up, Flags: [none], length: 24
 00:00:26.046556 eth2  Out IP 10.0.29.2.40049 > 10.0.29.3.3784: BFDv1, Control, State Up, Flags: [none], length: 24
 00:00:26.073866 eth2  In  IP 10.0.29.3.41545 > 10.0.29.2.3784: BFDv1, Control, State Up, Flags: [none], length: 24
 00:00:26.128166 eth2  Out IP 10.0.29.2.40049 > 10.0.29.3.3784: BFDv1, Control, State Up, Flags: [none], length: 24
 00:00:26.150455 eth2  In  IP 10.0.29.3.41545 > 10.0.29.2.3784: BFDv1, Control, State Up, Flags: [none], length: 24
 00:00:26.210873 eth2  Out IP 10.0.29.2.40049 > 10.0.29.3.3784: BFDv1, Control, State Up, Flags: [none], length: 24
 00:00:26.227169 eth2  In  IP 10.0.29.3.41545 > 10.0.29.2.3784: BFDv1, Control, State Up, Flags: [none], length: 24
 00:00:26.285486 eth2  Out IP 10.0.29.2.40049 > 10.0.29.3.3784: BFDv1, Control, State Up, Flags: [none], length: 24
 00:00:26.304783 eth2  In  IP 10.0.29.3.41545 > 10.0.29.2.3784: BFDv1, Control, State Up, Flags: [none], length: 24
 00:00:26.362105 eth2  Out IP 10.0.29.2.40049 > 10.0.29.3.3784: BFDv1, Control, State Up, Flags: [none], length: 24
 00:00:26.385382 eth2  In  IP 10.0.29.3.41545 > 10.0.29.2.3784: BFDv1, Control, State Up, Flags: [none], length: 24
 00:00:26.441732 eth2  Out IP 10.0.29.2.40049 > 10.0.29.3.3784: BFDv1, Control, State Up, Flags: [none], length: 24
 00:00:26.464122 eth2  In  IP 10.0.29.3.41545 > 10.0.29.2.3784: BFDv1, Control, State Up, Flags: [none], length: 24
 00:00:26.516506 eth2  Out IP 10.0.29.2.40049 > 10.0.29.3.3784: BFDv1, Control, State Up, Flags: [none], length: 24
 00:00:26.552069 eth2  In  IP 10.0.29.3.41545 > 10.0.29.2.3784: BFDv1, Control, State Up, Flags: [none], length: 24
 00:00:26.602380 eth2  Out IP 10.0.29.2.40049 > 10.0.29.3.3784: BFDv1, Control, State Up, Flags: [none], length: 24
 00:00:26.630800 eth2  In  IP 10.0.29.3.41545 > 10.0.29.2.3784: BFDv1, Control, State Up, Flags: [none], length: 24
 00:00:26.686100 eth2  Out IP 10.0.29.2.40049 > 10.0.29.3.3784: BFDv1, Control, State Up, Flags: [none], length: 24
 00:00:26.706618 eth2  In  IP 10.0.29.3.41545 > 10.0.29.2.3784: BFDv1, Control, State Up, Flags: [none], length: 24
 00:00:26.770017 eth2  Out IP 10.0.29.2.40049 > 10.0.29.3.3784: BFDv1, Control, State Up, Flags: [none], length: 24
 00:00:26.791417 eth2  In  IP 10.0.29.3.41545 > 10.0.29.2.3784: BFDv1, Control, State Up, Flags: [none], length: 24
 00:00:26.845804 eth2  Out IP 10.0.29.2.40049 > 10.0.29.3.3784: BFDv1, Control, State Up, Flags: [none], length: 24
 00:00:26.869285 eth2  In  IP 10.0.29.3.41545 > 10.0.29.2.3784: BFDv1, Control, State Up, Flags: [none], length: 24
 00:00:26.926544 eth2  Out IP 10.0.29.2.40049 > 10.0.29.3.3784: BFDv1, Control, State Up, Flags: [none], length: 24
 00:00:26.945916 eth2  In  IP 10.0.29.3.41545 > 10.0.29.2.3784: BFDv1, Control, State Up, Flags: [none], length: 24
 00:00:27.014305 eth2  Out IP 10.0.29.2.40049 > 10.0.29.3.3784: BFDv1, Control, State Up, Flags: [none], length: 24
 00:00:27.024767 eth2  In  IP 10.0.29.3.41545 > 10.0.29.2.3784: BFDv1, Control, State Up, Flags: [none], length: 24
 00:00:27.099235 eth2  Out IP 10.0.29.2.40049 > 10.0.29.3.3784: BFDv1, Control, State Up, Flags: [none], length: 24
 00:00:27.108878 eth2  In  IP 10.0.29.3.41545 > 10.0.29.2.3784: BFDv1, Control, State Up, Flags: [none], length: 24
 00:00:27.175391 eth2  Out IP 10.0.29.2.40049 > 10.0.29.3.3784: BFDv1, Control, State Up, Flags: [none], length: 24
 00:00:27.198510 eth2  In  IP 10.0.29.3.41545 > 10.0.29.2.3784: BFDv1, Control, State Up, Flags: [none], length: 24
 00:00:27.254855 eth2  Out IP 10.0.29.2.40049 > 10.0.29.3.3784: BFDv1, Control, State Up, Flags: [none], length: 24
 00:00:27.284150 eth2  In  IP 10.0.29.3.41545 > 10.0.29.2.3784: BFDv1, Control, State Up, Flags: [none], length: 24
 00:00:27.340589 eth2  Out IP 10.0.29.2.40049 > 10.0.29.3.3784: BFDv1, Control, State Up, Flags: [none], length: 24
 00:00:27.371097 eth2  In  IP 10.0.29.3.41545 > 10.0.29.2.3784: BFDv1, Control, State Up, Flags: [none], length: 24
 00:00:27.425000 eth2  Out IP 10.0.29.2.40049 > 10.0.29.3.3784: BFDv1, Control, State Up, Flags: [none], length: 24
 00:00:27.447886 eth2  In  IP 10.0.29.3.41545 > 10.0.29.2.3784: BFDv1, Control, State Up, Flags: [none], length: 24
 00:00:27.507230 eth2  Out IP 10.0.29.2.40049 > 10.0.29.3.3784: BFDv1, Control, State Up, Flags: [none], length: 24
 00:00:27.523515 eth2  In  IP 10.0.29.3.41545 > 10.0.29.2.3784: BFDv1, Control, State Up, Flags: [none], length: 24
 00:00:27.583938 eth2  Out IP 10.0.29.2.40049 > 10.0.29.3.3784: BFDv1, Control, State Up, Flags: [none], length: 24
 00:00:27.602192 eth2  In  IP 10.0.29.3.41545 > 10.0.29.2.3784: BFDv1, Control, State Up, Flags: [none], length: 24
 00:00:27.662496 eth2  Out IP 10.0.29.2.40049 > 10.0.29.3.3784: BFDv1, Control, State Up, Flags: [none], length: 24
 00:00:27.682156 eth2  In  IP 10.0.29.3.41545 > 10.0.29.2.3784: BFDv1, Control, State Up, Flags: [none], length: 24
 00:00:27.745612 eth2  Out IP 10.0.29.2.40049 > 10.0.29.3.3784: BFDv1, Control, State Up, Flags: [none], length: 24
 00:00:27.763013 eth2  In  IP 10.0.29.3.41545 > 10.0.29.2.3784: BFDv1, Control, State Up, Flags: [none], length: 24
 00:00:27.824320 eth2  Out IP 10.0.29.2.40049 > 10.0.29.3.3784: BFDv1, Control, State Up, Flags: [none], length: 24
 00:00:27.847747 eth2  In  IP 10.0.29.3.41545 > 10.0.29.2.3784: BFDv1, Control, State Up, Flags: [none], length: 24
 00:00:27.913045 eth2  Out IP 10.0.29.2.40049 > 10.0.29.3.3784: BFDv1, Control, State Up, Flags: [none], length: 24
 00:00:27.928460 eth2  In  IP 10.0.29.3.41545 > 10.0.29.2.3784: BFDv1, Control, State Up, Flags: [none], length: 24
 00:00:27.991763 eth2  Out IP 10.0.29.2.40049 > 10.0.29.3.3784: BFDv1, Control, State Up, Flags: [none], length: 24
 00:00:28.014230 eth2  In  IP 10.0.29.3.41545 > 10.0.29.2.3784: BFDv1, Control, State Up, Flags: [none], length: 24
 00:00:28.069532 eth2  Out IP 10.0.29.2.40049 > 10.0.29.3.3784: BFDv1, Control, State Up, Flags: [none], length: 24
 00:00:28.091688 eth2  In  IP 10.0.29.3.41545 > 10.0.29.2.3784: BFDv1, Control, State Up, Flags: [none], length: 24
 00:00:28.158045 eth2  Out IP 10.0.29.2.40049 > 10.0.29.3.3784: BFDv1, Control, State Up, Flags: [none], length: 24
 00:00:28.177429 eth2  In  IP 10.0.29.3.41545 > 10.0.29.2.3784: BFDv1, Control, State Up, Flags: [none], length: 24
 00:00:28.244699 eth2  Out IP 10.0.29.2.40049 > 10.0.29.3.3784: BFDv1, Control, State Up, Flags: [none], length: 24
 00:00:28.254182 eth2  Out IP 10.0.29.2.33979 > 10.0.29.3.179: Flags [S], seq 2364571651, win 64240, options [mss 1460,sackOK,TS val 2352672597 ecr 0,nop,wscale 10], length 0
 00:00:28.254249 eth2  In  IP 10.0.29.3.179 > 10.0.29.2.33979: Flags [S.], seq 2523547353, ack 2364571652, win 65160, options [mss 1460,sackOK,TS val 562972333 ecr 2352672597,nop,wscale 10], length 0
 00:00:28.254271 eth2  Out IP 10.0.29.2.33979 > 10.0.29.3.179: Flags [.], ack 1, win 63, options [nop,nop,TS val 2352672597 ecr 562972333], length 0
 00:00:28.254340 eth2  Out IP 10.0.29.2.33979 > 10.0.29.3.179: Flags [P.], seq 1:65, ack 1, win 63, options [nop,nop,TS val 2352672597 ecr 562972333], length 64: BGP
 00:00:28.254355 eth2  In  IP 10.0.29.3.179 > 10.0.29.2.33979: Flags [.], ack 65, win 64, options [nop,nop,TS val 562972333 ecr 2352672597], length 0
 00:00:28.254404 eth2  In  IP 10.0.29.3.179 > 10.0.29.2.33979: Flags [R.], seq 1, ack 65, win 64, options [nop,nop,TS val 562972333 ecr 2352672597], length 0
 00:00:28.255907 eth2  In  IP 10.0.29.3.41545 > 10.0.29.2.3784: BFDv1, Control, State Up, Flags: [none], length: 24
 00:00:28.328200 eth2  Out IP 10.0.29.2.40049 > 10.0.29.3.3784: BFDv1, Control, State Up, Flags: [none], length: 24
 00:00:28.338478 eth2  In  IP 10.0.29.3.41545 > 10.0.29.2.3784: BFDv1, Control, State Up, Flags: [none], length: 24
 00:00:28.409777 eth2  Out IP 10.0.29.2.40049 > 10.0.29.3.3784: BFDv1, Control, State Up, Flags: [none], length: 24
 00:00:28.426089 eth2  In  IP 10.0.29.3.41545 > 10.0.29.2.3784: BFDv1, Control, State Up, Flags: [none], length: 24
 00:00:28.487441 eth2  Out IP 10.0.29.2.40049 > 10.0.29.3.3784: BFDv1, Control, State Up, Flags: [none], length: 24
 00:00:28.512743 eth2  In  IP 10.0.29.3.41545 > 10.0.29.2.3784: BFDv1, Control, State Up, Flags: [none], length: 24
 00:00:28.564094 eth2  Out IP 10.0.29.2.40049 > 10.0.29.3.3784: BFDv1, Control, State Up, Flags: [none], length: 24
 00:00:28.591378 eth2  In  IP 10.0.29.3.41545 > 10.0.29.2.3784: BFDv1, Control, State Up, Flags: [none], length: 24
 00:00:28.647673 eth2  Out IP 10.0.29.2.40049 > 10.0.29.3.3784: BFDv1, Control, State Up, Flags: [none], length: 24
 00:00:28.671892 eth2  In  IP 10.0.29.3.41545 > 10.0.29.2.3784: BFDv1, Control, State Up, Flags: [none], length: 24
 00:00:28.727175 eth2  Out IP 10.0.29.2.40049 > 10.0.29.3.3784: BFDv1, Control, State Up, Flags: [none], length: 24
 00:00:28.751453 eth2  In  IP 10.0.29.3.41545 > 10.0.29.2.3784: BFDv1, Control, State Up, Flags: [none], length: 24
 00:00:28.804774 eth2  Out IP 10.0.29.2.40049 > 10.0.29.3.3784: BFDv1, Control, State Up, Flags: [none], length: 24
 00:00:28.827074 eth2  In  IP 10.0.29.3.41545 > 10.0.29.2.3784: BFDv1, Control, State Up, Flags: [none], length: 24
 00:00:28.884356 eth2  Out IP 10.0.29.2.40049 > 10.0.29.3.3784: BFDv1, Control, State Up, Flags: [none], length: 24
 00:00:28.908728 eth2  In  IP 10.0.29.3.41545 > 10.0.29.2.3784: BFDv1, Control, State Up, Flags: [none], length: 24
 00:00:28.973063 eth2  Out IP 10.0.29.2.40049 > 10.0.29.3.3784: BFDv1, Control, State Up, Flags: [none], length: 24
 00:00:28.992347 eth2  In  IP 10.0.29.3.41545 > 10.0.29.2.3784: BFDv1, Control, State Up, Flags: [none], length: 24
 00:00:29.058647 eth2  Out IP 10.0.29.2.40049 > 10.0.29.3.3784: BFDv1, Control, State Up, Flags: [none], length: 24
 00:00:29.074897 eth2  In  IP 10.0.29.3.41545 > 10.0.29.2.3784: BFDv1, Control, State Up, Flags: [none], length: 24
 00:00:29.138199 eth2  Out IP 10.0.29.2.40049 > 10.0.29.3.3784: BFDv1, Control, State Up, Flags: [none], length: 24
 00:00:29.157473 eth2  In  IP 10.0.29.3.41545 > 10.0.29.2.3784: BFDv1, Control, State Up, Flags: [none], length: 24
 00:00:29.217785 eth2  Out IP 10.0.29.2.40049 > 10.0.29.3.3784: BFDv1, Control, State Up, Flags: [none], length: 24
 00:00:29.237991 eth2  In  IP 10.0.29.3.41545 > 10.0.29.2.3784: BFDv1, Control, State Up, Flags: [none], length: 24
 00:00:29.301333 eth2  Out IP 10.0.29.2.40049 > 10.0.29.3.3784: BFDv1, Control, State Up, Flags: [none], length: 24
 00:00:29.318619 eth2  In  IP 10.0.29.3.41545 > 10.0.29.2.3784: BFDv1, Control, State Up, Flags: [none], length: 24
 00:00:29.389917 eth2  Out IP 10.0.29.2.40049 > 10.0.29.3.3784: BFDv1, Control, State Up, Flags: [none], length: 24
 00:00:29.398183 eth2  In  IP 10.0.29.3.41545 > 10.0.29.2.3784: BFDv1, Control, State Up, Flags: [none], length: 24
 00:00:29.469488 eth2  Out IP 10.0.29.2.40049 > 10.0.29.3.3784: BFDv1, Control, State Up, Flags: [none], length: 24
 00:00:29.479737 eth2  In  IP 10.0.29.3.41545 > 10.0.29.2.3784: BFDv1, Control, State Up, Flags: [none], length: 24
 00:00:29.558097 eth2  Out IP 10.0.29.2.40049 > 10.0.29.3.3784: BFDv1, Control, State Up, Flags: [none], length: 24
 00:00:29.560398 eth2  In  IP 10.0.29.3.41545 > 10.0.29.2.3784: BFDv1, Control, State Up, Flags: [none], length: 24
 00:00:29.639896 eth2  In  IP 10.0.29.3.41545 > 10.0.29.2.3784: BFDv1, Control, State Up, Flags: [none], length: 24
 00:00:29.641102 eth2  Out IP 10.0.29.2.40049 > 10.0.29.3.3784: BFDv1, Control, State Up, Flags: [none], length: 24
 00:00:29.721731 eth2  In  IP 10.0.29.3.41545 > 10.0.29.2.3784: BFDv1, Control, State Up, Flags: [none], length: 24
 00:00:29.730130 eth2  Out IP 10.0.29.2.40049 > 10.0.29.3.3784: BFDv1, Control, State Up, Flags: [none], length: 24
 00:00:29.807960 eth2  In  IP 10.0.29.3.41545 > 10.0.29.2.3784: BFDv1, Control, State Up, Flags: [none], length: 24
 00:00:29.811302 eth2  Out IP 10.0.29.2.40049 > 10.0.29.3.3784: BFDv1, Control, State Up, Flags: [none], length: 24
 00:00:29.892413 eth2  In  IP 10.0.29.3.41545 > 10.0.29.2.3784: BFDv1, Control, State Up, Flags: [none], length: 24
 00:00:29.895837 eth2  Out IP 10.0.29.2.40049 > 10.0.29.3.3784: BFDv1, Control, State Up, Flags: [none], length: 24
 00:00:29.973341 eth2  Out IP 10.0.29.2.40049 > 10.0.29.3.3784: BFDv1, Control, State Up, Flags: [none], length: 24
 00:00:29.978644 eth2  In  IP 10.0.29.3.41545 > 10.0.29.2.3784: BFDv1, Control, State Up, Flags: [none], length: 24
 00:00:30.058426 eth2  In  IP 10.0.29.3.41545 > 10.0.29.2.3784: BFDv1, Control, State Up, Flags: [none], length: 24
 00:00:30.062769 eth2  Out IP 10.0.29.2.40049 > 10.0.29.3.3784: BFDv1, Control, State Up, Flags: [none], length: 24
 00:00:30.133465 eth2  In  IP 10.0.29.3.41545 > 10.0.29.2.3784: BFDv1, Control, State Up, Flags: [none], length: 24
 00:00:30.149805 eth2  Out IP 10.0.29.2.40049 > 10.0.29.3.3784: BFDv1, Control, State Up, Flags: [none], length: 24
 00:00:30.211955 eth2  In  IP 10.0.29.3.41545 > 10.0.29.2.3784: BFDv1, Control, State Up, Flags: [none], length: 24
 00:00:30.225249 eth2  Out IP 10.0.29.2.40049 > 10.0.29.3.3784: BFDv1, Control, State Up, Flags: [none], length: 24
 00:00:30.294875 eth2  In  IP 10.0.29.3.41545 > 10.0.29.2.3784: BFDv1, Control, State Up, Flags: [none], length: 24
 00:00:30.303219 eth2  Out IP 10.0.29.2.40049 > 10.0.29.3.3784: BFDv1, Control, State Up, Flags: [none], length: 24

587 packets captured
589 packets received by filter
0 packets dropped by kernel
