tcpdump: data link type LINUX_SLL2
tcpdump: verbose output suppressed, use -v[v]... for full protocol decode
listening on any, link-type LINUX_SLL2 (Linux cooked v2), snapshot length 262144 bytes
 00:00:00.000000 eth2  In  IP 10.0.29.3.49090 > 10.0.29.2.3784: BFDv1, Control, State Up, Flags: [none], length: 24
 00:00:00.008037 eth2  Out IP 10.0.29.2.37716 > 10.0.29.3.3784: BFDv1, Control, State Up, Flags: [none], length: 24
 00:00:00.083754 eth2  In  IP 10.0.29.3.49090 > 10.0.29.2.3784: BFDv1, Control, State Up, Flags: [none], length: 24
 00:00:00.094087 eth2  Out IP 10.0.29.2.37716 > 10.0.29.3.3784: BFDv1, Control, State Up, Flags: [none], length: 24
 00:00:00.165001 eth2  In  IP 10.0.29.3.49090 > 10.0.29.2.3784: BFDv1, Control, State Up, Flags: [none], length: 24
 00:00:00.172380 eth2  Out IP 10.0.29.2.37716 > 10.0.29.3.3784: BFDv1, Control, State Up, Flags: [none], length: 24
 00:00:00.247432 eth2  In  IP 10.0.29.3.49090 > 10.0.29.2.3784: BFDv1, Control, State Up, Flags: [none], length: 24
 00:00:00.257730 eth2  Out IP 10.0.29.2.37716 > 10.0.29.3.3784: BFDv1, Control, State Up, Flags: [none], length: 24
 00:00:00.336555 eth2  In  IP 10.0.29.3.49090 > 10.0.29.2.3784: BFDv1, Control, State Up, Flags: [none], length: 24
 00:00:00.342014 eth2  Out IP 10.0.29.2.37716 > 10.0.29.3.3784: BFDv1, Control, State Up, Flags: [none], length: 24
 00:00:00.421267 eth2  Out IP 10.0.29.2.37716 > 10.0.29.3.3784: BFDv1, Control, State Up, Flags: [none], length: 24
 00:00:00.426545 eth2  In  IP 10.0.29.3.49090 > 10.0.29.2.3784: BFDv1, Control, State Up, Flags: [none], length: 24
 00:00:00.505109 eth2  In  IP 10.0.29.3.49090 > 10.0.29.2.3784: BFDv1, Control, State Up, Flags: [none], length: 24
 00:00:00.509552 eth2  Out IP 10.0.29.2.37716 > 10.0.29.3.3784: BFDv1, Control, State Up, Flags: [none], length: 24
 00:00:00.581385 eth2  In  IP 10.0.29.3.49090 > 10.0.29.2.3784: BFDv1, Control, State Up, Flags: [none], length: 24
 00:00:00.592939 eth2  Out IP 10.0.29.2.37716 > 10.0.29.3.3784: BFDv1, Control, State Up, Flags: [none], length: 24
 00:00:00.670099 eth2  In  IP 10.0.29.3.49090 > 10.0.29.2.3784: BFDv1, Control, State Up, Flags: [none], length: 24
 00:00:00.677408 eth2  Out IP 10.0.29.2.37716 > 10.0.29.3.3784: BFDv1, Control, State Up, Flags: [none], length: 24
 00:00:00.750909 eth2  In  IP 10.0.29.3.49090 > 10.0.29.2.3784: BFDv1, Control, State Up, Flags: [none], length: 24
 00:00:00.752237 eth2  Out IP 10.0.29.2.37716 > 10.0.29.3.3784: BFDv1, Control, State Up, Flags: [none], length: 24
 00:00:00.830471 eth2  Out IP 10.0.29.2.37716 > 10.0.29.3.3784: BFDv1, Control, State Up, Flags: [none], length: 24
 00:00:00.832729 eth2  In  IP 10.0.29.3.49090 > 10.0.29.2.3784: BFDv1, Control, State Up, Flags: [none], length: 24
 00:00:00.916309 eth2  In  IP 10.0.29.3.49090 > 10.0.29.2.3784: BFDv1, Control, State Up, Flags: [none], length: 24
 00:00:00.920595 eth2  Out IP 10.0.29.2.37716 > 10.0.29.3.3784: BFDv1, Control, State Up, Flags: [none], length: 24
 00:00:00.995632 eth2  In  IP 10.0.29.3.49090 > 10.0.29.2.3784: BFDv1, Control, State Up, Flags: [none], length: 24
 00:00:01.002278 eth2  Out IP 10.0.29.2.37716 > 10.0.29.3.3784: BFDv1, Control, State Up, Flags: [none], length: 24
 00:00:01.073428 eth2  In  IP 10.0.29.3.49090 > 10.0.29.2.3784: BFDv1, Control, State Up, Flags: [none], length: 24
 00:00:01.079757 eth2  Out IP 10.0.29.2.37716 > 10.0.29.3.3784: BFDv1, Control, State Up, Flags: [none], length: 24
 00:00:01.162171 eth2  In  IP 10.0.29.3.49090 > 10.0.29.2.3784: BFDv1, Control, State Up, Flags: [none], length: 24
 00:00:01.164578 eth2  Out IP 10.0.29.2.37716 > 10.0.29.3.3784: BFDv1, Control, State Up, Flags: [none], length: 24
 00:00:01.237674 eth2  In  IP 10.0.29.3.49090 > 10.0.29.2.3784: BFDv1, Control, State Up, Flags: [none], length: 24
 00:00:01.240975 eth2  Out IP 10.0.29.2.37716 > 10.0.29.3.3784: BFDv1, Control, State Up, Flags: [none], length: 24
 00:00:01.315866 eth2  In  IP 10.0.29.3.49090 > 10.0.29.2.3784: BFDv1, Control, State Up, Flags: [none], length: 24
 00:00:01.316070 eth2  Out IP 10.0.29.2.37716 > 10.0.29.3.3784: BFDv1, Control, State Up, Flags: [none], length: 24
 00:00:01.395842 eth2  In  IP 10.0.29.3.49090 > 10.0.29.2.3784: BFDv1, Control, State Up, Flags: [none], length: 24
 00:00:01.397146 eth2  Out IP 10.0.29.2.37716 > 10.0.29.3.3784: BFDv1, Control, State Up, Flags: [none], length: 24
 00:00:01.472411 eth2  Out IP 10.0.29.2.37716 > 10.0.29.3.3784: BFDv1, Control, State Up, Flags: [none], length: 24
 00:00:01.476694 eth2  In  IP 10.0.29.3.49090 > 10.0.29.2.3784: BFDv1, Control, State Up, Flags: [none], length: 24
 00:00:01.552003 eth2  Out IP 10.0.29.2.37716 > 10.0.29.3.3784: BFDv1, Control, State Up, Flags: [none], length: 24
 00:00:01.563258 eth2  In  IP 10.0.29.3.49090 > 10.0.29.2.3784: BFDv1, Control, State Up, Flags: [none], length: 24
 00:00:01.636656 eth2  Out IP 10.0.29.2.37716 > 10.0.29.3.3784: BFDv1, Control, State Up, Flags: [none], length: 24
 00:00:01.646937 eth2  In  IP 10.0.29.3.49090 > 10.0.29.2.3784: BFDv1, Control, State Up, Flags: [none], length: 24
 00:00:01.723355 eth2  Out IP 10.0.29.2.37716 > 10.0.29.3.3784: BFDv1, Control, State Up, Flags: [none], length: 24
 00:00:01.726699 eth2  In  IP 10.0.29.3.49090 > 10.0.29.2.3784: BFDv1, Control, State Up, Flags: [none], length: 24
 00:00:01.805076 eth2  Out IP 10.0.29.2.37716 > 10.0.29.3.3784: BFDv1, Control, State Up, Flags: [none], length: 24
 00:00:01.812392 eth2  In  IP 10.0.29.3.49090 > 10.0.29.2.3784: BFDv1, Control, State Up, Flags: [none], length: 24
 00:00:01.882749 eth2  Out IP 10.0.29.2.37716 > 10.0.29.3.3784: BFDv1, Control, State Up, Flags: [none], length: 24
 00:00:01.890022 eth2  In  IP 10.0.29.3.49090 > 10.0.29.2.3784: BFDv1, Control, State Up, Flags: [none], length: 24
 00:00:01.966636 eth2  In  IP 10.0.29.3.49090 > 10.0.29.2.3784: BFDv1, Control, State Up, Flags: [none], length: 24
 00:00:01.966851 eth2  Out IP 10.0.29.2.37716 > 10.0.29.3.3784: BFDv1, Control, State Up, Flags: [none], length: 24
 00:00:02.045099 eth2  In  IP 10.0.29.3.49090 > 10.0.29.2.3784: BFDv1, Control, State Up, Flags: [none], length: 24
 00:00:02.045198 eth2  Out IP 10.0.29.2.37716 > 10.0.29.3.3784: BFDv1, Control, State Up, Flags: [none], length: 24
 00:00:02.085879 eth3  Out IP 10.0.12.3.179 > 10.0.12.2.45004: Flags [P.], seq 3222602054:3222602089, ack 3815833099, win 64, options [nop,nop,TS val 4270872380 ecr 2663022749], length 35: BGP
 00:00:02.085959 eth3  In  IP 10.0.12.2.45004 > 10.0.12.3.179: Flags [.], ack 35, win 63, options [nop,nop,TS val 2663039536 ecr 4270872380], length 0
 00:00:02.086106 eth3  In  IP 10.0.12.2.45004 > 10.0.12.3.179: Flags [P.], seq 1:55, ack 35, win 63, options [nop,nop,TS val 2663039536 ecr 4270872380], length 54: BGP
 00:00:02.086115 eth3  Out IP 10.0.12.3.179 > 10.0.12.2.45004: Flags [.], ack 55, win 64, options [nop,nop,TS val 4270872381 ecr 2663039536], length 0
 00:00:02.086306 eth3  Out IP 10.0.12.3.179 > 10.0.12.2.45004: Flags [P.], seq 35:80, ack 55, win 64, options [nop,nop,TS val 4270872381 ecr 2663039536], length 45: BGP
 00:00:02.127064 eth3  In  IP 10.0.12.2.45004 > 10.0.12.3.179: Flags [.], ack 80, win 63, options [nop,nop,TS val 2663039577 ecr 4270872381], length 0
 00:00:03.742982 eth3  In  IP 10.0.12.2.45004 > 10.0.12.3.179: Flags [P.], seq 55:74, ack 80, win 63, options [nop,nop,TS val 2663041193 ecr 4270872381], length 19: BGP
 00:00:03.785095 eth3  Out IP 10.0.12.3.179 > 10.0.12.2.45004: Flags [.], ack 74, win 64, options [nop,nop,TS val 4270874080 ecr 2663041193], length 0
 00:00:10.182397 eth3  Out IP 10.0.12.3.179 > 10.0.12.2.45004: Flags [P.], seq 80:128, ack 74, win 64, options [nop,nop,TS val 4270880477 ecr 2663041193], length 48: BGP
 00:00:10.182470 eth3  In  IP 10.0.12.2.45004 > 10.0.12.3.179: Flags [.], ack 128, win 63, options [nop,nop,TS val 2663047632 ecr 4270880477], length 0
 00:00:10.182589 eth2  Out IP 10.0.29.2.49201 > 10.0.29.3.3784: BFDv1, Control, State Down, Flags: [none], length: 24
 00:00:10.182616 eth3  In  IP 10.0.12.2.45004 > 10.0.12.3.179: Flags [P.], seq 74:101, ack 128, win 63, options [nop,nop,TS val 2663047632 ecr 4270880477], length 27: BGP
 00:00:10.182632 eth3  Out IP 10.0.12.3.179 > 10.0.12.2.45004: Flags [.], ack 101, win 64, options [nop,nop,TS val 4270880477 ecr 2663047632], length 0
 00:00:10.183520 eth3  Out IP 10.0.12.3.179 > 10.0.12.2.45004: Flags [P.], seq 128:173, ack 101, win 64, options [nop,nop,TS val 4270880478 ecr 2663047632], length 45: BGP
 00:00:10.224945 eth3  In  IP 10.0.12.2.45004 > 10.0.12.3.179: Flags [.], ack 173, win 63, options [nop,nop,TS val 2663047675 ecr 4270880478], length 0
 00:00:10.694866 eth2  In  IP 10.0.29.3.58076 > 10.0.29.2.3784: BFDv1, Control, State Init, Flags: [none], length: 24
 00:00:10.695095 eth2  Out IP 10.0.29.2.49201 > 10.0.29.3.3784: BFDv1, Control, State Up, Flags: [Poll], length: 24
 00:00:10.695155 eth2  In  IP 10.0.29.3.58076 > 10.0.29.2.3784: BFDv1, Control, State Up, Flags: [Final], length: 24
 00:00:10.695168 eth2  In  IP 10.0.29.3.58076 > 10.0.29.2.3784: BFDv1, Control, State Up, Flags: [Poll], length: 24
 00:00:10.695212 eth2  Out IP 10.0.29.2.49201 > 10.0.29.3.3784: BFDv1, Control, State Up, Flags: [Final], length: 24
 00:00:10.771417 eth2  In  IP 10.0.29.3.58076 > 10.0.29.2.3784: BFDv1, Control, State Up, Flags: [none], length: 24
 00:00:10.777678 eth2  Out IP 10.0.29.2.49201 > 10.0.29.3.3784: BFDv1, Control, State Up, Flags: [none], length: 24
 00:00:10.860014 eth2  In  IP 10.0.29.3.58076 > 10.0.29.2.3784: BFDv1, Control, State Up, Flags: [none], length: 24
 00:00:10.867314 eth2  Out IP 10.0.29.2.49201 > 10.0.29.3.3784: BFDv1, Control, State Up, Flags: [none], length: 24
 00:00:10.948968 eth2  In  IP 10.0.29.3.58076 > 10.0.29.2.3784: BFDv1, Control, State Up, Flags: [none], length: 24
 00:00:10.957264 eth2  Out IP 10.0.29.2.49201 > 10.0.29.3.3784: BFDv1, Control, State Up, Flags: [none], length: 24
 00:00:11.026605 eth2  In  IP 10.0.29.3.58076 > 10.0.29.2.3784: BFDv1, Control, State Up, Flags: [none], length: 24
 00:00:11.038942 eth2  Out IP 10.0.29.2.49201 > 10.0.29.3.3784: BFDv1, Control, State Up, Flags: [none], length: 24
 00:00:11.105627 eth2  In  IP 10.0.29.3.58076 > 10.0.29.2.3784: BFDv1, Control, State Up, Flags: [none], length: 24
 00:00:11.116956 eth2  Out IP 10.0.29.2.49201 > 10.0.29.3.3784: BFDv1, Control, State Up, Flags: [none], length: 24
 00:00:11.194965 eth2  In  IP 10.0.29.3.58076 > 10.0.29.2.3784: BFDv1, Control, State Up, Flags: [none], length: 24
 00:00:11.206227 eth2  Out IP 10.0.29.2.49201 > 10.0.29.3.3784: BFDv1, Control, State Up, Flags: [none], length: 24
 00:00:11.279931 eth2  In  IP 10.0.29.3.58076 > 10.0.29.2.3784: BFDv1, Control, State Up, Flags: [none], length: 24
 00:00:11.295224 eth2  Out IP 10.0.29.2.49201 > 10.0.29.3.3784: BFDv1, Control, State Up, Flags: [none], length: 24
 00:00:11.366999 eth2  In  IP 10.0.29.3.58076 > 10.0.29.2.3784: BFDv1, Control, State Up, Flags: [none], length: 24
 00:00:11.375232 eth2  Out IP 10.0.29.2.49201 > 10.0.29.3.3784: BFDv1, Control, State Up, Flags: [none], length: 24
 00:00:11.450397 eth2  In  IP 10.0.29.3.58076 > 10.0.29.2.3784: BFDv1, Control, State Up, Flags: [none], length: 24
 00:00:11.458675 eth2  Out IP 10.0.29.2.49201 > 10.0.29.3.3784: BFDv1, Control, State Up, Flags: [none], length: 24
 00:00:11.536417 eth2  In  IP 10.0.29.3.58076 > 10.0.29.2.3784: BFDv1, Control, State Up, Flags: [none], length: 24
 00:00:11.548726 eth2  Out IP 10.0.29.2.49201 > 10.0.29.3.3784: BFDv1, Control, State Up, Flags: [none], length: 24
 00:00:11.617622 eth2  In  IP 10.0.29.3.58076 > 10.0.29.2.3784: BFDv1, Control, State Up, Flags: [none], length: 24
 00:00:11.628940 eth2  Out IP 10.0.29.2.49201 > 10.0.29.3.3784: BFDv1, Control, State Up, Flags: [none], length: 24
 00:00:11.700068 eth2  In  IP 10.0.29.3.58076 > 10.0.29.2.3784: BFDv1, Control, State Up, Flags: [none], length: 24
 00:00:11.717371 eth2  Out IP 10.0.29.2.49201 > 10.0.29.3.3784: BFDv1, Control, State Up, Flags: [none], length: 24
 00:00:11.781005 eth2  In  IP 10.0.29.3.58076 > 10.0.29.2.3784: BFDv1, Control, State Up, Flags: [none], length: 24
 00:00:11.807302 eth2  Out IP 10.0.29.2.49201 > 10.0.29.3.3784: BFDv1, Control, State Up, Flags: [none], length: 24
 00:00:11.867537 eth2  In  IP 10.0.29.3.58076 > 10.0.29.2.3784: BFDv1, Control, State Up, Flags: [none], length: 24
 00:00:11.890900 eth2  Out IP 10.0.29.2.49201 > 10.0.29.3.3784: BFDv1, Control, State Up, Flags: [none], length: 24
 00:00:11.946183 eth2  In  IP 10.0.29.3.58076 > 10.0.29.2.3784: BFDv1, Control, State Up, Flags: [none], length: 24
 00:00:11.974533 eth2  Out IP 10.0.29.2.49201 > 10.0.29.3.3784: BFDv1, Control, State Up, Flags: [none], length: 24
 00:00:12.023783 eth2  In  IP 10.0.29.3.58076 > 10.0.29.2.3784: BFDv1, Control, State Up, Flags: [none], length: 24
 00:00:12.060084 eth2  Out IP 10.0.29.2.49201 > 10.0.29.3.3784: BFDv1, Control, State Up, Flags: [none], length: 24
 00:00:12.101320 eth2  In  IP 10.0.29.3.58076 > 10.0.29.2.3784: BFDv1, Control, State Up, Flags: [none], length: 24
 00:00:12.137589 eth2  Out IP 10.0.29.2.49201 > 10.0.29.3.3784: BFDv1, Control, State Up, Flags: [none], length: 24
 00:00:12.184816 eth2  In  IP 10.0.29.3.58076 > 10.0.29.2.3784: BFDv1, Control, State Up, Flags: [none], length: 24
 00:00:12.223118 eth2  Out IP 10.0.29.2.49201 > 10.0.29.3.3784: BFDv1, Control, State Up, Flags: [none], length: 24
 00:00:12.268366 eth2  In  IP 10.0.29.3.58076 > 10.0.29.2.3784: BFDv1, Control, State Up, Flags: [none], length: 24
 00:00:12.303643 eth2  Out IP 10.0.29.2.49201 > 10.0.29.3.3784: BFDv1, Control, State Up, Flags: [none], length: 24
 00:00:12.347904 eth2  In  IP 10.0.29.3.58076 > 10.0.29.2.3784: BFDv1, Control, State Up, Flags: [none], length: 24
 00:00:12.382141 eth2  Out IP 10.0.29.2.49201 > 10.0.29.3.3784: BFDv1, Control, State Up, Flags: [none], length: 24
 00:00:12.431391 eth2  In  IP 10.0.29.3.58076 > 10.0.29.2.3784: BFDv1, Control, State Up, Flags: [none], length: 24
 00:00:12.459614 eth2  Out IP 10.0.29.2.49201 > 10.0.29.3.3784: BFDv1, Control, State Up, Flags: [none], length: 24
 00:00:12.516940 eth2  In  IP 10.0.29.3.58076 > 10.0.29.2.3784: BFDv1, Control, State Up, Flags: [none], length: 24
 00:00:12.541171 eth2  Out IP 10.0.29.2.49201 > 10.0.29.3.3784: BFDv1, Control, State Up, Flags: [none], length: 24
 00:00:12.600355 eth2  In  IP 10.0.29.3.58076 > 10.0.29.2.3784: BFDv1, Control, State Up, Flags: [none], length: 24
 00:00:12.620572 eth2  Out IP 10.0.29.2.49201 > 10.0.29.3.3784: BFDv1, Control, State Up, Flags: [none], length: 24
 00:00:12.682863 eth2  In  IP 10.0.29.3.58076 > 10.0.29.2.3784: BFDv1, Control, State Up, Flags: [none], length: 24
 00:00:12.700119 eth2  Out IP 10.0.29.2.49201 > 10.0.29.3.3784: BFDv1, Control, State Up, Flags: [none], length: 24
 00:00:12.763534 eth2  In  IP 10.0.29.3.58076 > 10.0.29.2.3784: BFDv1, Control, State Up, Flags: [none], length: 24
 00:00:12.778779 eth2  Out IP 10.0.29.2.49201 > 10.0.29.3.3784: BFDv1, Control, State Up, Flags: [none], length: 24
 00:00:12.842114 eth2  In  IP 10.0.29.3.58076 > 10.0.29.2.3784: BFDv1, Control, State Up, Flags: [none], length: 24
 00:00:12.857340 eth2  Out IP 10.0.29.2.49201 > 10.0.29.3.3784: BFDv1, Control, State Up, Flags: [none], length: 24
 00:00:12.918752 eth2  In  IP 10.0.29.3.58076 > 10.0.29.2.3784: BFDv1, Control, State Up, Flags: [none], length: 24
 00:00:12.934049 eth2  Out IP 10.0.29.2.49201 > 10.0.29.3.3784: BFDv1, Control, State Up, Flags: [none], length: 24
 00:00:12.998393 eth2  In  IP 10.0.29.3.58076 > 10.0.29.2.3784: BFDv1, Control, State Up, Flags: [none], length: 24
 00:00:13.014657 eth2  Out IP 10.0.29.2.49201 > 10.0.29.3.3784: BFDv1, Control, State Up, Flags: [none], length: 24
 00:00:13.087348 eth2  In  IP 10.0.29.3.58076 > 10.0.29.2.3784: BFDv1, Control, State Up, Flags: [none], length: 24
 00:00:13.101594 eth2  Out IP 10.0.29.2.49201 > 10.0.29.3.3784: BFDv1, Control, State Up, Flags: [none], length: 24
 00:00:13.172240 eth2  In  IP 10.0.29.3.58076 > 10.0.29.2.3784: BFDv1, Control, State Up, Flags: [none], length: 24
 00:00:13.185458 eth2  Out IP 10.0.29.2.49201 > 10.0.29.3.3784: BFDv1, Control, State Up, Flags: [none], length: 24
 00:00:13.251843 eth2  In  IP 10.0.29.3.58076 > 10.0.29.2.3784: BFDv1, Control, State Up, Flags: [none], length: 24
 00:00:13.272146 eth2  Out IP 10.0.29.2.49201 > 10.0.29.3.3784: BFDv1, Control, State Up, Flags: [none], length: 24
 00:00:13.339777 eth2  In  IP 10.0.29.3.58076 > 10.0.29.2.3784: BFDv1, Control, State Up, Flags: [none], length: 24
 00:00:13.351087 eth2  Out IP 10.0.29.2.49201 > 10.0.29.3.3784: BFDv1, Control, State Up, Flags: [none], length: 24
 00:00:13.416716 eth2  In  IP 10.0.29.3.58076 > 10.0.29.2.3784: BFDv1, Control, State Up, Flags: [none], length: 24
 00:00:13.433988 eth2  Out IP 10.0.29.2.49201 > 10.0.29.3.3784: BFDv1, Control, State Up, Flags: [none], length: 24
 00:00:13.500611 eth2  In  IP 10.0.29.3.58076 > 10.0.29.2.3784: BFDv1, Control, State Up, Flags: [none], length: 24
 00:00:13.519951 eth2  Out IP 10.0.29.2.49201 > 10.0.29.3.3784: BFDv1, Control, State Up, Flags: [none], length: 24
 00:00:13.576324 eth2  In  IP 10.0.29.3.58076 > 10.0.29.2.3784: BFDv1, Control, State Up, Flags: [none], length: 24
 00:00:13.604577 eth2  Out IP 10.0.29.2.49201 > 10.0.29.3.3784: BFDv1, Control, State Up, Flags: [none], length: 24
 00:00:13.660982 eth2  In  IP 10.0.29.3.58076 > 10.0.29.2.3784: BFDv1, Control, State Up, Flags: [none], length: 24
 00:00:13.690221 eth2  Out IP 10.0.29.2.49201 > 10.0.29.3.3784: BFDv1, Control, State Up, Flags: [none], length: 24
 00:00:13.745628 eth2  In  IP 10.0.29.3.58076 > 10.0.29.2.3784: BFDv1, Control, State Up, Flags: [none], length: 24
 00:00:13.774856 eth2  Out IP 10.0.29.2.49201 > 10.0.29.3.3784: BFDv1, Control, State Up, Flags: [none], length: 24
 00:00:13.829259 eth2  In  IP 10.0.29.3.58076 > 10.0.29.2.3784: BFDv1, Control, State Up, Flags: [none], length: 24
 00:00:13.859509 eth2  Out IP 10.0.29.2.49201 > 10.0.29.3.3784: BFDv1, Control, State Up, Flags: [none], length: 24
 00:00:13.918934 eth2  In  IP 10.0.29.3.58076 > 10.0.29.2.3784: BFDv1, Control, State Up, Flags: [none], length: 24
 00:00:13.934198 eth2  Out IP 10.0.29.2.49201 > 10.0.29.3.3784: BFDv1, Control, State Up, Flags: [none], length: 24
 00:00:13.994575 eth2  In  IP 10.0.29.3.58076 > 10.0.29.2.3784: BFDv1, Control, State Up, Flags: [none], length: 24
 00:00:14.012858 eth2  Out IP 10.0.29.2.49201 > 10.0.29.3.3784: BFDv1, Control, State Up, Flags: [none], length: 24
 00:00:14.080315 eth2  In  IP 10.0.29.3.58076 > 10.0.29.2.3784: BFDv1, Control, State Up, Flags: [none], length: 24
 00:00:14.096538 eth2  Out IP 10.0.29.2.49201 > 10.0.29.3.3784: BFDv1, Control, State Up, Flags: [none], length: 24
 00:00:14.158999 eth2  In  IP 10.0.29.3.58076 > 10.0.29.2.3784: BFDv1, Control, State Up, Flags: [none], length: 24
 00:00:14.168367 eth2  Out IP 10.0.29.2.60923 > 10.0.29.3.179: Flags [S], seq 3408580286, win 64240, options [mss 1460,sackOK,TS val 2352228245 ecr 0,nop,wscale 10], length 0
 00:00:14.168450 eth2  In  IP 10.0.29.3.179 > 10.0.29.2.60923: Flags [S.], seq 1964647948, ack 3408580287, win 65160, options [mss 1460,sackOK,TS val 562527981 ecr 2352228245,nop,wscale 10], length 0
 00:00:14.168482 eth2  Out IP 10.0.29.2.60923 > 10.0.29.3.179: Flags [.], ack 1, win 63, options [nop,nop,TS val 2352228245 ecr 562527981], length 0
 00:00:14.168577 eth2  Out IP 10.0.29.2.60923 > 10.0.29.3.179: Flags [P.], seq 1:65, ack 1, win 63, options [nop,nop,TS val 2352228245 ecr 562527981], length 64: BGP
 00:00:14.168612 eth2  In  IP 10.0.29.3.179 > 10.0.29.2.60923: Flags [F.], seq 1, ack 1, win 64, options [nop,nop,TS val 562527981 ecr 2352228245], length 0
 00:00:14.168673 eth2  In  IP 10.0.29.3.179 > 10.0.29.2.60923: Flags [R], seq 1964647949, win 0, length 0
 00:00:14.168674 eth2  Out IP 10.0.29.2.60923 > 10.0.29.3.179: Flags [F.], seq 65, ack 2, win 63, options [nop,nop,TS val 2352228245 ecr 562527981], length 0
 00:00:14.168696 eth2  In  IP 10.0.29.3.179 > 10.0.29.2.60923: Flags [R], seq 1964647950, win 0, length 0
 00:00:14.176282 eth2  Out IP 10.0.29.2.49201 > 10.0.29.3.3784: BFDv1, Control, State Up, Flags: [none], length: 24
 00:00:14.248640 eth2  In  IP 10.0.29.3.58076 > 10.0.29.2.3784: BFDv1, Control, State Up, Flags: [none], length: 24
 00:00:14.260919 eth2  Out IP 10.0.29.2.49201 > 10.0.29.3.3784: BFDv1, Control, State Up, Flags: [none], length: 24
 00:00:14.327595 eth2  In  IP 10.0.29.3.58076 > 10.0.29.2.3784: BFDv1, Control, State Up, Flags: [none], length: 24
 00:00:14.339802 eth2  Out IP 10.0.29.2.49201 > 10.0.29.3.3784: BFDv1, Control, State Up, Flags: [none], length: 24
 00:00:14.411300 eth2  In  IP 10.0.29.3.58076 > 10.0.29.2.3784: BFDv1, Control, State Up, Flags: [none], length: 24
 00:00:14.414608 eth2  Out IP 10.0.29.2.49201 > 10.0.29.3.3784: BFDv1, Control, State Up, Flags: [none], length: 24
 00:00:14.488969 eth2  In  IP 10.0.29.3.58076 > 10.0.29.2.3784: BFDv1, Control, State Up, Flags: [none], length: 24
 00:00:14.496219 eth2  Out IP 10.0.29.2.49201 > 10.0.29.3.3784: BFDv1, Control, State Up, Flags: [none], length: 24
 00:00:14.572615 eth2  In  IP 10.0.29.3.58076 > 10.0.29.2.3784: BFDv1, Control, State Up, Flags: [none], length: 24
 00:00:14.578918 eth2  Out IP 10.0.29.2.49201 > 10.0.29.3.3784: BFDv1, Control, State Up, Flags: [none], length: 24
 00:00:14.653277 eth2  In  IP 10.0.29.3.58076 > 10.0.29.2.3784: BFDv1, Control, State Up, Flags: [none], length: 24
 00:00:14.657537 eth2  Out IP 10.0.29.2.49201 > 10.0.29.3.3784: BFDv1, Control, State Up, Flags: [none], length: 24
 00:00:14.734625 eth2  In  IP 10.0.29.3.58076 > 10.0.29.2.3784: BFDv1, Control, State Up, Flags: [none], length: 24
 00:00:14.741849 eth2  Out IP 10.0.29.2.49201 > 10.0.29.3.3784: BFDv1, Control, State Up, Flags: [none], length: 24
 00:00:14.813467 eth2  In  IP 10.0.29.3.58076 > 10.0.29.2.3784: BFDv1, Control, State Up, Flags: [none], length: 24
 00:00:14.830706 eth2  Out IP 10.0.29.2.49201 > 10.0.29.3.3784: BFDv1, Control, State Up, Flags: [none], length: 24
 00:00:14.902474 eth2  In  IP 10.0.29.3.58076 > 10.0.29.2.3784: BFDv1, Control, State Up, Flags: [none], length: 24
 00:00:14.912858 eth2  Out IP 10.0.29.2.49201 > 10.0.29.3.3784: BFDv1, Control, State Up, Flags: [none], length: 24
 00:00:14.980428 eth2  In  IP 10.0.29.3.58076 > 10.0.29.2.3784: BFDv1, Control, State Up, Flags: [none], length: 24
 00:00:14.996002 eth2  Out IP 10.0.29.2.36637 > 10.0.29.3.179: Flags [FP.], seq 4101698002:4101698023, ack 2498162914, win 63, options [nop,nop,TS val 2352229073 ecr 562499112], length 21: BGP
 00:00:14.996090 eth2  In  IP 10.0.29.3.179 > 10.0.29.2.36637: Flags [R], seq 2498162914, win 0, length 0
 00:00:15.000672 eth2  Out IP 10.0.29.2.49201 > 10.0.29.3.3784: BFDv1, Control, State Up, Flags: [none], length: 24
 00:00:15.058309 eth2  In  IP 10.0.29.3.58076 > 10.0.29.2.3784: BFDv1, Control, State Up, Flags: [none], length: 24
 00:00:15.078560 eth2  Out IP 10.0.29.2.49201 > 10.0.29.3.3784: BFDv1, Control, State Up, Flags: [none], length: 24
 00:00:15.142576 eth2  In  IP 10.0.29.3.58076 > 10.0.29.2.3784: BFDv1, Control, State Up, Flags: [none], length: 24
 00:00:15.164832 eth2  Out IP 10.0.29.2.49201 > 10.0.29.3.3784: BFDv1, Control, State Up, Flags: [none], length: 24
 00:00:15.229661 eth2  In  IP 10.0.29.3.58076 > 10.0.29.2.3784: BFDv1, Control, State Up, Flags: [none], length: 24
 00:00:15.252918 eth2  Out IP 10.0.29.2.49201 > 10.0.29.3.3784: BFDv1, Control, State Up, Flags: [none], length: 24
 00:00:15.311585 eth2  In  IP 10.0.29.3.58076 > 10.0.29.2.3784: BFDv1, Control, State Up, Flags: [none], length: 24
 00:00:15.336845 eth2  Out IP 10.0.29.2.49201 > 10.0.29.3.3784: BFDv1, Control, State Up, Flags: [none], length: 24
 00:00:15.399426 eth2  In  IP 10.0.29.3.58076 > 10.0.29.2.3784: BFDv1, Control, State Up, Flags: [none], length: 24
 00:00:15.419709 eth2  Out IP 10.0.29.2.49201 > 10.0.29.3.3784: BFDv1, Control, State Up, Flags: [none], length: 24
 00:00:15.478450 eth2  In  IP 10.0.29.3.58076 > 10.0.29.2.3784: BFDv1, Control, State Up, Flags: [none], length: 24
 00:00:15.500771 eth2  Out IP 10.0.29.2.49201 > 10.0.29.3.3784: BFDv1, Control, State Up, Flags: [none], length: 24
 00:00:15.556151 eth2  In  IP 10.0.29.3.58076 > 10.0.29.2.3784: BFDv1, Control, State Up, Flags: [none], length: 24
 00:00:15.580397 eth2  Out IP 10.0.29.2.49201 > 10.0.29.3.3784: BFDv1, Control, State Up, Flags: [none], length: 24
 00:00:15.643733 eth2  In  IP 10.0.29.3.58076 > 10.0.29.2.3784: BFDv1, Control, State Up, Flags: [none], length: 24
 00:00:15.665977 eth2  Out IP 10.0.29.2.49201 > 10.0.29.3.3784: BFDv1, Control, State Up, Flags: [none], length: 24
 00:00:15.724387 eth2  In  IP 10.0.29.3.58076 > 10.0.29.2.3784: BFDv1, Control, State Up, Flags: [none], length: 24
 00:00:15.754636 eth2  Out IP 10.0.29.2.49201 > 10.0.29.3.3784: BFDv1, Control, State Up, Flags: [none], length: 24
 00:00:15.809021 eth2  In  IP 10.0.29.3.58076 > 10.0.29.2.3784: BFDv1, Control, State Up, Flags: [none], length: 24
 00:00:15.830299 eth2  Out IP 10.0.29.2.49201 > 10.0.29.3.3784: BFDv1, Control, State Up, Flags: [none], length: 24
 00:00:15.897802 eth2  In  IP 10.0.29.3.58076 > 10.0.29.2.3784: BFDv1, Control, State Up, Flags: [none], length: 24
 00:00:15.912034 eth2  Out IP 10.0.29.2.49201 > 10.0.29.3.3784: BFDv1, Control, State Up, Flags: [none], length: 24
 00:00:15.981295 eth2  In  IP 10.0.29.3.58076 > 10.0.29.2.3784: BFDv1, Control, State Up, Flags: [none], length: 24
 00:00:15.996630 eth2  Out IP 10.0.29.2.49201 > 10.0.29.3.3784: BFDv1, Control, State Up, Flags: [none], length: 24
 00:00:16.057069 eth2  In  IP 10.0.29.3.58076 > 10.0.29.2.3784: BFDv1, Control, State Up, Flags: [none], length: 24
 00:00:16.081372 eth2  Out IP 10.0.29.2.49201 > 10.0.29.3.3784: BFDv1, Control, State Up, Flags: [none], length: 24
 00:00:16.143755 eth2  In  IP 10.0.29.3.58076 > 10.0.29.2.3784: BFDv1, Control, State Up, Flags: [none], length: 24
 00:00:16.156024 eth2  Out IP 10.0.29.2.49201 > 10.0.29.3.3784: BFDv1, Control, State Up, Flags: [none], length: 24
 00:00:16.229404 eth2  In  IP 10.0.29.3.58076 > 10.0.29.2.3784: BFDv1, Control, State Up, Flags: [none], length: 24
 00:00:16.240724 eth2  Out IP 10.0.29.2.49201 > 10.0.29.3.3784: BFDv1, Control, State Up, Flags: [none], length: 24
 00:00:16.310706 eth2  In  IP 10.0.29.3.58076 > 10.0.29.2.3784: BFDv1, Control, State Up, Flags: [none], length: 24
 00:00:16.327990 eth2  Out IP 10.0.29.2.49201 > 10.0.29.3.3784: BFDv1, Control, State Up, Flags: [none], length: 24
 00:00:16.398349 eth2  In  IP 10.0.29.3.58076 > 10.0.29.2.3784: BFDv1, Control, State Up, Flags: [none], length: 24
 00:00:16.411610 eth2  Out IP 10.0.29.2.49201 > 10.0.29.3.3784: BFDv1, Control, State Up, Flags: [none], length: 24
 00:00:16.473838 eth2  In  IP 10.0.29.3.58076 > 10.0.29.2.3784: BFDv1, Control, State Up, Flags: [none], length: 24
 00:00:16.501083 eth2  Out IP 10.0.29.2.49201 > 10.0.29.3.3784: BFDv1, Control, State Up, Flags: [none], length: 24
 00:00:16.556502 eth2  In  IP 10.0.29.3.58076 > 10.0.29.2.3784: BFDv1, Control, State Up, Flags: [none], length: 24
 00:00:16.590754 eth2  Out IP 10.0.29.2.49201 > 10.0.29.3.3784: BFDv1, Control, State Up, Flags: [none], length: 24
 00:00:16.637958 eth2  In  IP 10.0.29.3.58076 > 10.0.29.2.3784: BFDv1, Control, State Up, Flags: [none], length: 24
 00:00:16.667201 eth2  Out IP 10.0.29.2.49201 > 10.0.29.3.3784: BFDv1, Control, State Up, Flags: [none], length: 24
 00:00:16.720507 eth2  In  IP 10.0.29.3.58076 > 10.0.29.2.3784: BFDv1, Control, State Up, Flags: [none], length: 24
 00:00:16.753730 eth2  Out IP 10.0.29.2.49201 > 10.0.29.3.3784: BFDv1, Control, State Up, Flags: [none], length: 24
 00:00:16.801148 eth2  In  IP 10.0.29.3.58076 > 10.0.29.2.3784: BFDv1, Control, State Up, Flags: [none], length: 24
 00:00:16.839388 eth2  Out IP 10.0.29.2.49201 > 10.0.29.3.3784: BFDv1, Control, State Up, Flags: [none], length: 24
 00:00:16.878621 eth2  In  IP 10.0.29.3.58076 > 10.0.29.2.3784: BFDv1, Control, State Up, Flags: [none], length: 24
 00:00:16.918867 eth2  Out IP 10.0.29.2.49201 > 10.0.29.3.3784: BFDv1, Control, State Up, Flags: [none], length: 24
 00:00:16.956108 eth2  In  IP 10.0.29.3.58076 > 10.0.29.2.3784: BFDv1, Control, State Up, Flags: [none], length: 24
 00:00:17.005362 eth2  Out IP 10.0.29.2.49201 > 10.0.29.3.3784: BFDv1, Control, State Up, Flags: [none], length: 24
 00:00:17.034585 eth2  In  IP 10.0.29.3.58076 > 10.0.29.2.3784: BFDv1, Control, State Up, Flags: [none], length: 24
 00:00:17.080853 eth2  Out IP 10.0.29.2.49201 > 10.0.29.3.3784: BFDv1, Control, State Up, Flags: [none], length: 24
 00:00:17.117088 eth2  In  IP 10.0.29.3.58076 > 10.0.29.2.3784: BFDv1, Control, State Up, Flags: [none], length: 24
 00:00:17.168320 eth2  Out IP 10.0.29.2.49201 > 10.0.29.3.3784: BFDv1, Control, State Up, Flags: [none], length: 24
 00:00:17.192503 eth2  In  IP 10.0.29.3.58076 > 10.0.29.2.3784: BFDv1, Control, State Up, Flags: [none], length: 24
 00:00:17.243758 eth2  Out IP 10.0.29.2.49201 > 10.0.29.3.3784: BFDv1, Control, State Up, Flags: [none], length: 24
 00:00:17.277964 eth2  In  IP 10.0.29.3.58076 > 10.0.29.2.3784: BFDv1, Control, State Up, Flags: [none], length: 24
 00:00:17.328199 eth2  Out IP 10.0.29.2.49201 > 10.0.29.3.3784: BFDv1, Control, State Up, Flags: [none], length: 24
 00:00:17.362434 eth2  In  IP 10.0.29.3.58076 > 10.0.29.2.3784: BFDv1, Control, State Up, Flags: [none], length: 24
 00:00:17.414689 eth2  Out IP 10.0.29.2.49201 > 10.0.29.3.3784: BFDv1, Control, State Up, Flags: [none], length: 24
 00:00:17.439081 eth2  In  IP 10.0.29.3.58076 > 10.0.29.2.3784: BFDv1, Control, State Up, Flags: [none], length: 24
 00:00:17.497339 eth2  Out IP 10.0.29.2.49201 > 10.0.29.3.3784: BFDv1, Control, State Up, Flags: [none], length: 24
 00:00:17.516576 eth2  In  IP 10.0.29.3.58076 > 10.0.29.2.3784: BFDv1, Control, State Up, Flags: [none], length: 24
 00:00:17.578840 eth2  Out IP 10.0.29.2.49201 > 10.0.29.3.3784: BFDv1, Control, State Up, Flags: [none], length: 24
 00:00:17.605064 eth2  In  IP 10.0.29.3.58076 > 10.0.29.2.3784: BFDv1, Control, State Up, Flags: [none], length: 24
 00:00:17.668339 eth2  Out IP 10.0.29.2.49201 > 10.0.29.3.3784: BFDv1, Control, State Up, Flags: [none], length: 24
 00:00:17.691560 eth2  In  IP 10.0.29.3.58076 > 10.0.29.2.3784: BFDv1, Control, State Up, Flags: [none], length: 24
 00:00:17.746790 eth2  Out IP 10.0.29.2.49201 > 10.0.29.3.3784: BFDv1, Control, State Up, Flags: [none], length: 24
 00:00:17.780975 eth2  In  IP 10.0.29.3.58076 > 10.0.29.2.3784: BFDv1, Control, State Up, Flags: [none], length: 24
 00:00:17.825226 eth2  Out IP 10.0.29.2.49201 > 10.0.29.3.3784: BFDv1, Control, State Up, Flags: [none], length: 24
 00:00:17.864446 eth2  In  IP 10.0.29.3.58076 > 10.0.29.2.3784: BFDv1, Control, State Up, Flags: [none], length: 24
 00:00:17.907693 eth2  Out IP 10.0.29.2.49201 > 10.0.29.3.3784: BFDv1, Control, State Up, Flags: [none], length: 24
 00:00:17.942918 eth2  In  IP 10.0.29.3.58076 > 10.0.29.2.3784: BFDv1, Control, State Up, Flags: [none], length: 24
 00:00:17.994213 eth2  Out IP 10.0.29.2.49201 > 10.0.29.3.3784: BFDv1, Control, State Up, Flags: [none], length: 24
 00:00:18.022463 eth2  In  IP 10.0.29.3.58076 > 10.0.29.2.3784: BFDv1, Control, State Up, Flags: [none], length: 24
 00:00:18.078824 eth2  Out IP 10.0.29.2.49201 > 10.0.29.3.3784: BFDv1, Control, State Up, Flags: [none], length: 24
 00:00:18.105053 eth2  In  IP 10.0.29.3.58076 > 10.0.29.2.3784: BFDv1, Control, State Up, Flags: [none], length: 24
 00:00:18.166320 eth2  Out IP 10.0.29.2.49201 > 10.0.29.3.3784: BFDv1, Control, State Up, Flags: [none], length: 24
 00:00:18.185573 eth2  In  IP 10.0.29.3.58076 > 10.0.29.2.3784: BFDv1, Control, State Up, Flags: [none], length: 24
 00:00:18.248833 eth2  Out IP 10.0.29.2.49201 > 10.0.29.3.3784: BFDv1, Control, State Up, Flags: [none], length: 24
 00:00:18.266079 eth2  In  IP 10.0.29.3.58076 > 10.0.29.2.3784: BFDv1, Control, State Up, Flags: [none], length: 24
 00:00:18.332383 eth2  Out IP 10.0.29.2.49201 > 10.0.29.3.3784: BFDv1, Control, State Up, Flags: [none], length: 24
 00:00:18.352696 eth2  In  IP 10.0.29.3.58076 > 10.0.29.2.3784: BFDv1, Control, State Up, Flags: [none], length: 24
 00:00:18.420003 eth2  Out IP 10.0.29.2.49201 > 10.0.29.3.3784: BFDv1, Control, State Up, Flags: [none], length: 24
 00:00:18.437250 eth2  In  IP 10.0.29.3.58076 > 10.0.29.2.3784: BFDv1, Control, State Up, Flags: [none], length: 24
 00:00:18.477192 eth2  Out IP 10.0.29.2.60273 > 10.0.29.3.179: Flags [S], seq 4087419492, win 64240, options [mss 1460,sackOK,TS val 2352232554 ecr 0,nop,wscale 10], length 0
 00:00:18.477300 eth2  In  IP 10.0.29.3.179 > 10.0.29.2.60273: Flags [S.], seq 1948455375, ack 4087419493, win 65160, options [mss 1460,sackOK,TS val 562532290 ecr 2352232554,nop,wscale 10], length 0
 00:00:18.477335 eth2  Out IP 10.0.29.2.60273 > 10.0.29.3.179: Flags [.], ack 1, win 63, options [nop,nop,TS val 2352232554 ecr 562532290], length 0
 00:00:18.477453 eth2  Out IP 10.0.29.2.60273 > 10.0.29.3.179: Flags [P.], seq 1:65, ack 1, win 63, options [nop,nop,TS val 2352232554 ecr 562532290], length 64: BGP
 00:00:18.477478 eth2  In  IP 10.0.29.3.179 > 10.0.29.2.60273: Flags [.], ack 65, win 64, options [nop,nop,TS val 562532290 ecr 2352232554], length 0
 00:00:18.477534 eth2  In  IP 10.0.29.3.179 > 10.0.29.2.60273: Flags [R.], seq 1, ack 65, win 64, options [nop,nop,TS val 562532290 ecr 2352232554], length 0
 00:00:18.508571 eth2  Out IP 10.0.29.2.49201 > 10.0.29.3.3784: BFDv1, Control, State Up, Flags: [none], length: 24
 00:00:18.518864 eth2  In  IP 10.0.29.3.58076 > 10.0.29.2.3784: BFDv1, Control, State Up, Flags: [none], length: 24
 00:00:18.595570 eth2  In  IP 10.0.29.3.58076 > 10.0.29.2.3784: BFDv1, Control, State Up, Flags: [none], length: 24
 00:00:18.595727 eth2  Out IP 10.0.29.2.49201 > 10.0.29.3.3784: BFDv1, Control, State Up, Flags: [none], length: 24
 00:00:18.675987 eth2  Out IP 10.0.29.2.49201 > 10.0.29.3.3784: BFDv1, Control, State Up, Flags: [none], length: 24
 00:00:18.682530 eth2  In  IP 10.0.29.3.58076 > 10.0.29.2.3784: BFDv1, Control, State Up, Flags: [none], length: 24
 00:00:18.758857 eth2  Out IP 10.0.29.2.49201 > 10.0.29.3.3784: BFDv1, Control, State Up, Flags: [none], length: 24
 00:00:18.764190 eth2  In  IP 10.0.29.3.58076 > 10.0.29.2.3784: BFDv1, Control, State Up, Flags: [none], length: 24
 00:00:18.843009 eth2  In  IP 10.0.29.3.58076 > 10.0.29.2.3784: BFDv1, Control, State Up, Flags: [none], length: 24
 00:00:18.843164 eth2  Out IP 10.0.29.2.49201 > 10.0.29.3.3784: BFDv1, Control, State Up, Flags: [none], length: 24
 00:00:18.917859 eth2  In  IP 10.0.29.3.58076 > 10.0.29.2.3784: BFDv1, Control, State Up, Flags: [none], length: 24
 00:00:18.922166 eth2  Out IP 10.0.29.2.49201 > 10.0.29.3.3784: BFDv1, Control, State Up, Flags: [none], length: 24
 00:00:18.995638 eth2  In  IP 10.0.29.3.58076 > 10.0.29.2.3784: BFDv1, Control, State Up, Flags: [none], length: 24
 00:00:19.006934 eth2  Out IP 10.0.29.2.49201 > 10.0.29.3.3784: BFDv1, Control, State Up, Flags: [none], length: 24
 00:00:19.074453 eth2  In  IP 10.0.29.3.58076 > 10.0.29.2.3784: BFDv1, Control, State Up, Flags: [none], length: 24
 00:00:19.088756 eth2  Out IP 10.0.29.2.49201 > 10.0.29.3.3784: BFDv1, Control, State Up, Flags: [none], length: 24
 00:00:19.155270 eth2  In  IP 10.0.29.3.58076 > 10.0.29.2.3784: BFDv1, Control, State Up, Flags: [none], length: 24
 00:00:19.177543 eth2  Out IP 10.0.29.2.49201 > 10.0.29.3.3784: BFDv1, Control, State Up, Flags: [none], length: 24
 00:00:19.241055 eth2  In  IP 10.0.29.3.58076 > 10.0.29.2.3784: BFDv1, Control, State Up, Flags: [none], length: 24
 00:00:19.265355 eth2  Out IP 10.0.29.2.49201 > 10.0.29.3.3784: BFDv1, Control, State Up, Flags: [none], length: 24
 00:00:19.317771 eth2  In  IP 10.0.29.3.58076 > 10.0.29.2.3784: BFDv1, Control, State Up, Flags: [none], length: 24
 00:00:19.344094 eth2  Out IP 10.0.29.2.49201 > 10.0.29.3.3784: BFDv1, Control, State Up, Flags: [none], length: 24
 00:00:19.394571 eth2  In  IP 10.0.29.3.58076 > 10.0.29.2.3784: BFDv1, Control, State Up, Flags: [none], length: 24
 00:00:19.432922 eth2  Out IP 10.0.29.2.49201 > 10.0.29.3.3784: BFDv1, Control, State Up, Flags: [none], length: 24
 00:00:19.482224 eth2  In  IP 10.0.29.3.58076 > 10.0.29.2.3784: BFDv1, Control, State Up, Flags: [none], length: 24
 00:00:19.518483 eth2  Out IP 10.0.29.2.49201 > 10.0.29.3.3784: BFDv1, Control, State Up, Flags: [none], length: 24
 00:00:19.556779 eth2  In  IP 10.0.29.3.58076 > 10.0.29.2.3784: BFDv1, Control, State Up, Flags: [none], length: 24
 00:00:19.597116 eth2  Out IP 10.0.29.2.49201 > 10.0.29.3.3784: BFDv1, Control, State Up, Flags: [none], length: 24
 00:00:19.636362 eth2  In  IP 10.0.29.3.58076 > 10.0.29.2.3784: BFDv1, Control, State Up, Flags: [none], length: 24
 00:00:19.679659 eth2  Out IP 10.0.29.2.49201 > 10.0.29.3.3784: BFDv1, Control, State Up, Flags: [none], length: 24
 00:00:19.689716 eth3  Out IP 10.0.12.3.179 > 10.0.12.2.45004: Flags [P.], seq 173:192, ack 101, win 64, options [nop,nop,TS val 4270889984 ecr 2663047675], length 19: BGP
 00:00:19.689773 eth3  In  IP 10.0.12.2.45004 > 10.0.12.3.179: Flags [.], ack 192, win 63, options [nop,nop,TS val 2663057139 ecr 4270889984], length 0
 00:00:19.717122 eth2  In  IP 10.0.29.3.58076 > 10.0.29.2.3784: BFDv1, Control, State Up, Flags: [none], length: 24
 00:00:19.761421 eth2  Out IP 10.0.29.2.49201 > 10.0.29.3.3784: BFDv1, Control, State Up, Flags: [none], length: 24
 00:00:19.806903 eth2  In  IP 10.0.29.3.58076 > 10.0.29.2.3784: BFDv1, Control, State Up, Flags: [none], length: 24
 00:00:19.850167 eth2  Out IP 10.0.29.2.49201 > 10.0.29.3.3784: BFDv1, Control, State Up, Flags: [none], length: 24
 00:00:19.892370 eth2  In  IP 10.0.29.3.58076 > 10.0.29.2.3784: BFDv1, Control, State Up, Flags: [none], length: 24
 00:00:19.930643 eth2  Out IP 10.0.29.2.49201 > 10.0.29.3.3784: BFDv1, Control, State Up, Flags: [none], length: 24
 00:00:19.976092 eth2  In  IP 10.0.29.3.58076 > 10.0.29.2.3784: BFDv1, Control, State Up, Flags: [none], length: 24
 00:00:20.019507 eth2  Out IP 10.0.29.2.49201 > 10.0.29.3.3784: BFDv1, Control, State Up, Flags: [none], length: 24
 00:00:20.063775 eth2  In  IP 10.0.29.3.58076 > 10.0.29.2.3784: BFDv1, Control, State Up, Flags: [none], length: 24
 00:00:20.097198 eth2  Out IP 10.0.29.2.49201 > 10.0.29.3.3784: BFDv1, Control, State Up, Flags: [none], length: 24
 00:00:20.143773 eth2  In  IP 10.0.29.3.58076 > 10.0.29.2.3784: BFDv1, Control, State Up, Flags: [none], length: 24
 00:00:20.185102 eth2  Out IP 10.0.29.2.49201 > 10.0.29.3.3784: BFDv1, Control, State Up, Flags: [none], length: 24
 00:00:20.231505 eth2  In  IP 10.0.29.3.58076 > 10.0.29.2.3784: BFDv1, Control, State Up, Flags: [none], length: 24
 00:00:20.270906 eth2  Out IP 10.0.29.2.49201 > 10.0.29.3.3784: BFDv1, Control, State Up, Flags: [none], length: 24
 00:00:20.320138 eth2  In  IP 10.0.29.3.58076 > 10.0.29.2.3784: BFDv1, Control, State Up, Flags: [none], length: 24
 00:00:20.357412 eth2  Out IP 10.0.29.2.49201 > 10.0.29.3.3784: BFDv1, Control, State Up, Flags: [none], length: 24
 00:00:20.397700 eth2  In  IP 10.0.29.3.58076 > 10.0.29.2.3784: BFDv1, Control, State Up, Flags: [none], length: 24
 00:00:20.443008 eth2  Out IP 10.0.29.2.49201 > 10.0.29.3.3784: BFDv1, Control, State Up, Flags: [none], length: 24
 00:00:20.482271 eth2  In  IP 10.0.29.3.58076 > 10.0.29.2.3784: BFDv1, Control, State Up, Flags: [none], length: 24
 00:00:20.520548 eth2  Out IP 10.0.29.2.49201 > 10.0.29.3.3784: BFDv1, Control, State Up, Flags: [none], length: 24
 00:00:20.569803 eth2  In  IP 10.0.29.3.58076 > 10.0.29.2.3784: BFDv1, Control, State Up, Flags: [none], length: 24
 00:00:20.600143 eth2  Out IP 10.0.29.2.49201 > 10.0.29.3.3784: BFDv1, Control, State Up, Flags: [none], length: 24
 00:00:20.645380 eth2  In  IP 10.0.29.3.58076 > 10.0.29.2.3784: BFDv1, Control, State Up, Flags: [none], length: 24
 00:00:20.682660 eth2  Out IP 10.0.29.2.49201 > 10.0.29.3.3784: BFDv1, Control, State Up, Flags: [none], length: 24
 00:00:20.723084 eth2  In  IP 10.0.29.3.58076 > 10.0.29.2.3784: BFDv1, Control, State Up, Flags: [none], length: 24
 00:00:20.760374 eth2  Out IP 10.0.29.2.49201 > 10.0.29.3.3784: BFDv1, Control, State Up, Flags: [none], length: 24
 00:00:20.803898 eth2  In  IP 10.0.29.3.58076 > 10.0.29.2.3784: BFDv1, Control, State Up, Flags: [none], length: 24
 00:00:20.842221 eth2  Out IP 10.0.29.2.49201 > 10.0.29.3.3784: BFDv1, Control, State Up, Flags: [none], length: 24
 00:00:20.886662 eth2  In  IP 10.0.29.3.58076 > 10.0.29.2.3784: BFDv1, Control, State Up, Flags: [none], length: 24
 00:00:20.931036 eth2  Out IP 10.0.29.2.49201 > 10.0.29.3.3784: BFDv1, Control, State Up, Flags: [none], length: 24
 00:00:20.973466 eth2  In  IP 10.0.29.3.58076 > 10.0.29.2.3784: BFDv1, Control, State Up, Flags: [none], length: 24
 00:00:21.006769 eth2  Out IP 10.0.29.2.49201 > 10.0.29.3.3784: BFDv1, Control, State Up, Flags: [none], length: 24
 00:00:21.053964 eth2  In  IP 10.0.29.3.58076 > 10.0.29.2.3784: BFDv1, Control, State Up, Flags: [none], length: 24
 00:00:21.085265 eth2  Out IP 10.0.29.2.49201 > 10.0.29.3.3784: BFDv1, Control, State Up, Flags: [none], length: 24
 00:00:21.133456 eth2  In  IP 10.0.29.3.58076 > 10.0.29.2.3784: BFDv1, Control, State Up, Flags: [none], length: 24
 00:00:21.163806 eth2  Out IP 10.0.29.2.49201 > 10.0.29.3.3784: BFDv1, Control, State Up, Flags: [none], length: 24
 00:00:21.216842 eth2  In  IP 10.0.29.3.58076 > 10.0.29.2.3784: BFDv1, Control, State Up, Flags: [none], length: 24
 00:00:21.248194 eth2  Out IP 10.0.29.2.49201 > 10.0.29.3.3784: BFDv1, Control, State Up, Flags: [none], length: 24
 00:00:21.293315 eth2  In  IP 10.0.29.3.58076 > 10.0.29.2.3784: BFDv1, Control, State Up, Flags: [none], length: 24
 00:00:21.335584 eth2  Out IP 10.0.29.2.49201 > 10.0.29.3.3784: BFDv1, Control, State Up, Flags: [none], length: 24
 00:00:21.378340 eth2  In  IP 10.0.29.3.58076 > 10.0.29.2.3784: BFDv1, Control, State Up, Flags: [none], length: 24
 00:00:21.418593 eth2  Out IP 10.0.29.2.49201 > 10.0.29.3.3784: BFDv1, Control, State Up, Flags: [none], length: 24
 00:00:21.457831 eth2  In  IP 10.0.29.3.58076 > 10.0.29.2.3784: BFDv1, Control, State Up, Flags: [none], length: 24
 00:00:21.495173 eth2  Out IP 10.0.29.2.49201 > 10.0.29.3.3784: BFDv1, Control, State Up, Flags: [none], length: 24
 00:00:21.546664 eth2  In  IP 10.0.29.3.58076 > 10.0.29.2.3784: BFDv1, Control, State Up, Flags: [none], length: 24
 00:00:21.574998 eth2  Out IP 10.0.29.2.49201 > 10.0.29.3.3784: BFDv1, Control, State Up, Flags: [none], length: 24
 00:00:21.630197 eth2  In  IP 10.0.29.3.58076 > 10.0.29.2.3784: BFDv1, Control, State Up, Flags: [none], length: 24
 00:00:21.656592 eth2  Out IP 10.0.29.2.49201 > 10.0.29.3.3784: BFDv1, Control, State Up, Flags: [none], length: 24
 00:00:21.710509 eth2  In  IP 10.0.29.3.58076 > 10.0.29.2.3784: BFDv1, Control, State Up, Flags: [none], length: 24
 00:00:21.745789 eth2  Out IP 10.0.29.2.49201 > 10.0.29.3.3784: BFDv1, Control, State Up, Flags: [none], length: 24
 00:00:21.799566 eth2  In  IP 10.0.29.3.58076 > 10.0.29.2.3784: BFDv1, Control, State Up, Flags: [none], length: 24
 00:00:21.828914 eth2  Out IP 10.0.29.2.49201 > 10.0.29.3.3784: BFDv1, Control, State Up, Flags: [none], length: 24
 00:00:21.888720 eth2  In  IP 10.0.29.3.58076 > 10.0.29.2.3784: BFDv1, Control, State Up, Flags: [none], length: 24
 00:00:21.909432 eth2  Out IP 10.0.29.2.49201 > 10.0.29.3.3784: BFDv1, Control, State Up, Flags: [none], length: 24
 00:00:21.966007 eth2  In  IP 10.0.29.3.58076 > 10.0.29.2.3784: BFDv1, Control, State Up, Flags: [none], length: 24
 00:00:21.993801 eth2  Out IP 10.0.29.2.49201 > 10.0.29.3.3784: BFDv1, Control, State Up, Flags: [none], length: 24
 00:00:22.052672 eth2  In  IP 10.0.29.3.58076 > 10.0.29.2.3784: BFDv1, Control, State Up, Flags: [none], length: 24
 00:00:22.080142 eth2  Out IP 10.0.29.2.49201 > 10.0.29.3.3784: BFDv1, Control, State Up, Flags: [none], length: 24
 00:00:22.131989 eth2  In  IP 10.0.29.3.58076 > 10.0.29.2.3784: BFDv1, Control, State Up, Flags: [none], length: 24
 00:00:22.167270 eth2  Out IP 10.0.29.2.49201 > 10.0.29.3.3784: BFDv1, Control, State Up, Flags: [none], length: 24
 00:00:22.209743 eth2  In  IP 10.0.29.3.58076 > 10.0.29.2.3784: BFDv1, Control, State Up, Flags: [none], length: 24
 00:00:22.243207 eth2  Out IP 10.0.29.2.49201 > 10.0.29.3.3784: BFDv1, Control, State Up, Flags: [none], length: 24
 00:00:22.285500 eth2  In  IP 10.0.29.3.58076 > 10.0.29.2.3784: BFDv1, Control, State Up, Flags: [none], length: 24
 00:00:22.325994 eth2  Out IP 10.0.29.2.49201 > 10.0.29.3.3784: BFDv1, Control, State Up, Flags: [none], length: 24
 00:00:22.374395 eth2  In  IP 10.0.29.3.58076 > 10.0.29.2.3784: BFDv1, Control, State Up, Flags: [none], length: 24
 00:00:22.411730 eth2  Out IP 10.0.29.2.49201 > 10.0.29.3.3784: BFDv1, Control, State Up, Flags: [none], length: 24
 00:00:22.457252 eth2  In  IP 10.0.29.3.58076 > 10.0.29.2.3784: BFDv1, Control, State Up, Flags: [none], length: 24
 00:00:22.492660 eth2  Out IP 10.0.29.2.49201 > 10.0.29.3.3784: BFDv1, Control, State Up, Flags: [none], length: 24
 00:00:22.534158 eth2  In  IP 10.0.29.3.58076 > 10.0.29.2.3784: BFDv1, Control, State Up, Flags: [none], length: 24
 00:00:22.575478 eth2  Out IP 10.0.29.2.49201 > 10.0.29.3.3784: BFDv1, Control, State Up, Flags: [none], length: 24
 00:00:22.622272 eth2  In  IP 10.0.29.3.58076 > 10.0.29.2.3784: BFDv1, Control, State Up, Flags: [none], length: 24
 00:00:22.662697 eth2  Out IP 10.0.29.2.49201 > 10.0.29.3.3784: BFDv1, Control, State Up, Flags: [none], length: 24
 00:00:22.697001 eth2  In  IP 10.0.29.3.58076 > 10.0.29.2.3784: BFDv1, Control, State Up, Flags: [none], length: 24
 00:00:22.742395 eth2  Out IP 10.0.29.2.49201 > 10.0.29.3.3784: BFDv1, Control, State Up, Flags: [none], length: 24
 00:00:22.775738 eth2  In  IP 10.0.29.3.58076 > 10.0.29.2.3784: BFDv1, Control, State Up, Flags: [none], length: 24
 00:00:22.819011 eth2  Out IP 10.0.29.2.49201 > 10.0.29.3.3784: BFDv1, Control, State Up, Flags: [none], length: 24
 00:00:22.854245 eth2  In  IP 10.0.29.3.58076 > 10.0.29.2.3784: BFDv1, Control, State Up, Flags: [none], length: 24
 00:00:22.903584 eth2  Out IP 10.0.29.2.49201 > 10.0.29.3.3784: BFDv1, Control, State Up, Flags: [none], length: 24
 00:00:22.930107 eth2  In  IP 10.0.29.3.58076 > 10.0.29.2.3784: BFDv1, Control, State Up, Flags: [none], length: 24
 00:00:22.993435 eth2  Out IP 10.0.29.2.49201 > 10.0.29.3.3784: BFDv1, Control, State Up, Flags: [none], length: 24
 00:00:23.005715 eth2  In  IP 10.0.29.3.58076 > 10.0.29.2.3784: BFDv1, Control, State Up, Flags: [none], length: 24
 00:00:23.073010 eth2  Out IP 10.0.29.2.49201 > 10.0.29.3.3784: BFDv1, Control, State Up, Flags: [none], length: 24
 00:00:23.092490 eth2  In  IP 10.0.29.3.58076 > 10.0.29.2.3784: BFDv1, Control, State Up, Flags: [none], length: 24
 00:00:23.160914 eth2  Out IP 10.0.29.2.49201 > 10.0.29.3.3784: BFDv1, Control, State Up, Flags: [none], length: 24
 00:00:23.179574 eth2  In  IP 10.0.29.3.58076 > 10.0.29.2.3784: BFDv1, Control, State Up, Flags: [none], length: 24
 00:00:23.242955 eth2  Out IP 10.0.29.2.49201 > 10.0.29.3.3784: BFDv1, Control, State Up, Flags: [none], length: 24
 00:00:23.255232 eth2  In  IP 10.0.29.3.58076 > 10.0.29.2.3784: BFDv1, Control, State Up, Flags: [none], length: 24
 00:00:23.324581 eth2  Out IP 10.0.29.2.49201 > 10.0.29.3.3784: BFDv1, Control, State Up, Flags: [none], length: 24
 00:00:23.339100 eth2  In  IP 10.0.29.3.58076 > 10.0.29.2.3784: BFDv1, Control, State Up, Flags: [none], length: 24
 00:00:23.405388 eth2  Out IP 10.0.29.2.49201 > 10.0.29.3.3784: BFDv1, Control, State Up, Flags: [none], length: 24
 00:00:23.426793 eth2  In  IP 10.0.29.3.58076 > 10.0.29.2.3784: BFDv1, Control, State Up, Flags: [none], length: 24
 00:00:23.464334 eth2  Out IP 10.0.29.2.42563 > 10.0.29.3.179: Flags [S], seq 1003251736, win 64240, options [mss 1460,sackOK,TS val 2352237541 ecr 0,nop,wscale 10], length 0
 00:00:23.464403 eth2  In  IP 10.0.29.3.179 > 10.0.29.2.42563: Flags [S.], seq 2547786418, ack 1003251737, win 65160, options [mss 1460,sackOK,TS val 562537277 ecr 2352237541,nop,wscale 10], length 0
 00:00:23.464428 eth2  Out IP 10.0.29.2.42563 > 10.0.29.3.179: Flags [.], ack 1, win 63, options [nop,nop,TS val 2352237541 ecr 562537277], length 0
 00:00:23.464500 eth2  Out IP 10.0.29.2.42563 > 10.0.29.3.179: Flags [P.], seq 1:65, ack 1, win 63, options [nop,nop,TS val 2352237541 ecr 562537277], length 64: BGP
 00:00:23.464511 eth2  In  IP 10.0.29.3.179 > 10.0.29.2.42563: Flags [.], ack 65, win 64, options [nop,nop,TS val 562537277 ecr 2352237541], length 0
 00:00:23.464588 eth2  In  IP 10.0.29.3.179 > 10.0.29.2.42563: Flags [R.], seq 1, ack 65, win 64, options [nop,nop,TS val 562537277 ecr 2352237541], length 0
 00:00:23.485081 eth2  Out IP 10.0.29.2.49201 > 10.0.29.3.3784: BFDv1, Control, State Up, Flags: [none], length: 24
 00:00:23.507750 eth2  In  IP 10.0.29.3.58076 > 10.0.29.2.3784: BFDv1, Control, State Up, Flags: [none], length: 24
 00:00:23.561020 eth2  Out IP 10.0.29.2.49201 > 10.0.29.3.3784: BFDv1, Control, State Up, Flags: [none], length: 24
 00:00:23.583338 eth2  In  IP 10.0.29.3.58076 > 10.0.29.2.3784: BFDv1, Control, State Up, Flags: [none], length: 24
 00:00:23.642635 eth2  Out IP 10.0.29.2.49201 > 10.0.29.3.3784: BFDv1, Control, State Up, Flags: [none], length: 24
 00:00:23.662910 eth2  In  IP 10.0.29.3.58076 > 10.0.29.2.3784: BFDv1, Control, State Up, Flags: [none], length: 24
 00:00:23.719228 eth2  Out IP 10.0.29.2.49201 > 10.0.29.3.3784: BFDv1, Control, State Up, Flags: [none], length: 24
 00:00:23.746474 eth2  In  IP 10.0.29.3.58076 > 10.0.29.2.3784: BFDv1, Control, State Up, Flags: [none], length: 24
 00:00:23.795698 eth2  Out IP 10.0.29.2.49201 > 10.0.29.3.3784: BFDv1, Control, State Up, Flags: [none], length: 24
 00:00:23.824953 eth2  In  IP 10.0.29.3.58076 > 10.0.29.2.3784: BFDv1, Control, State Up, Flags: [none], length: 24
 00:00:23.881275 eth2  Out IP 10.0.29.2.49201 > 10.0.29.3.3784: BFDv1, Control, State Up, Flags: [none], length: 24
 00:00:23.908755 eth2  In  IP 10.0.29.3.58076 > 10.0.29.2.3784: BFDv1, Control, State Up, Flags: [none], length: 24
 00:00:23.964146 eth2  Out IP 10.0.29.2.49201 > 10.0.29.3.3784: BFDv1, Control, State Up, Flags: [none], length: 24
 00:00:23.994583 eth2  In  IP 10.0.29.3.58076 > 10.0.29.2.3784: BFDv1, Control, State Up, Flags: [none], length: 24
 00:00:24.040922 eth2  Out IP 10.0.29.2.49201 > 10.0.29.3.3784: BFDv1, Control, State Up, Flags: [none], length: 24
 00:00:24.072372 eth2  In  IP 10.0.29.3.58076 > 10.0.29.2.3784: BFDv1, Control, State Up, Flags: [none], length: 24
 00:00:24.119703 eth2  Out IP 10.0.29.2.49201 > 10.0.29.3.3784: BFDv1, Control, State Up, Flags: [none], length: 24
 00:00:24.162194 eth2  In  IP 10.0.29.3.58076 > 10.0.29.2.3784: BFDv1, Control, State Up, Flags: [none], length: 24
 00:00:24.207529 eth2  Out IP 10.0.29.2.49201 > 10.0.29.3.3784: BFDv1, Control, State Up, Flags: [none], length: 24
 00:00:24.244973 eth2  In  IP 10.0.29.3.58076 > 10.0.29.2.3784: BFDv1, Control, State Up, Flags: [none], length: 24
 00:00:24.293241 eth2  Out IP 10.0.29.2.49201 > 10.0.29.3.3784: BFDv1, Control, State Up, Flags: [none], length: 24
 00:00:24.321658 eth2  In  IP 10.0.29.3.58076 > 10.0.29.2.3784: BFDv1, Control, State Up, Flags: [none], length: 24
 00:00:24.368954 eth2  Out IP 10.0.29.2.49201 > 10.0.29.3.3784: BFDv1, Control, State Up, Flags: [none], length: 24
 00:00:24.410422 eth2  In  IP 10.0.29.3.58076 > 10.0.29.2.3784: BFDv1, Control, State Up, Flags: [none], length: 24
 00:00:24.453738 eth2  Out IP 10.0.29.2.49201 > 10.0.29.3.3784: BFDv1, Control, State Up, Flags: [none], length: 24
 00:00:24.487148 eth2  In  IP 10.0.29.3.58076 > 10.0.29.2.3784: BFDv1, Control, State Up, Flags: [none], length: 24
 00:00:24.540394 eth2  Out IP 10.0.29.2.49201 > 10.0.29.3.3784: BFDv1, Control, State Up, Flags: [none], length: 24
 00:00:24.568861 eth2  In  IP 10.0.29.3.58076 > 10.0.29.2.3784: BFDv1, Control, State Up, Flags: [none], length: 24
 00:00:24.623196 eth2  Out IP 10.0.29.2.49201 > 10.0.29.3.3784: BFDv1, Control, State Up, Flags: [none], length: 24
 00:00:24.648759 eth2  In  IP 10.0.29.3.58076 > 10.0.29.2.3784: BFDv1, Control, State Up, Flags: [none], length: 24
 00:00:24.703159 eth2  Out IP 10.0.29.2.49201 > 10.0.29.3.3784: BFDv1, Control, State Up, Flags: [none], length: 24
 00:00:24.725676 eth2  In  IP 10.0.29.3.58076 > 10.0.29.2.3784: BFDv1, Control, State Up, Flags: [none], length: 24
 00:00:24.780988 eth2  Out IP 10.0.29.2.49201 > 10.0.29.3.3784: BFDv1, Control, State Up, Flags: [none], length: 24
 00:00:24.802256 eth2  In  IP 10.0.29.3.58076 > 10.0.29.2.3784: BFDv1, Control, State Up, Flags: [none], length: 24
 00:00:24.871553 eth2  Out IP 10.0.29.2.49201 > 10.0.29.3.3784: BFDv1, Control, State Up, Flags: [none], length: 24
 00:00:24.879797 eth2  In  IP 10.0.29.3.58076 > 10.0.29.2.3784: BFDv1, Control, State Up, Flags: [none], length: 24
 00:00:24.949124 eth2  Out IP 10.0.29.2.49201 > 10.0.29.3.3784: BFDv1, Control, State Up, Flags: [none], length: 24
 00:00:24.959422 eth2  In  IP 10.0.29.3.58076 > 10.0.29.2.3784: BFDv1, Control, State Up, Flags: [none], length: 24
 00:00:25.030776 eth2  Out IP 10.0.29.2.49201 > 10.0.29.3.3784: BFDv1, Control, State Up, Flags: [none], length: 24
 00:00:25.044058 eth2  In  IP 10.0.29.3.58076 > 10.0.29.2.3784: BFDv1, Control, State Up, Flags: [none], length: 24
 00:00:25.107371 eth2  Out IP 10.0.29.2.49201 > 10.0.29.3.3784: BFDv1, Control, State Up, Flags: [none], length: 24
 00:00:25.132659 eth2  In  IP 10.0.29.3.58076 > 10.0.29.2.3784: BFDv1, Control, State Up, Flags: [none], length: 24
 00:00:25.195017 eth2  Out IP 10.0.29.2.49201 > 10.0.29.3.3784: BFDv1, Control, State Up, Flags: [none], length: 24
 00:00:25.215363 eth2  In  IP 10.0.29.3.58076 > 10.0.29.2.3784: BFDv1, Control, State Up, Flags: [none], length: 24
 00:00:25.275670 eth2  Out IP 10.0.29.2.49201 > 10.0.29.3.3784: BFDv1, Control, State Up, Flags: [none], length: 24
 00:00:25.304992 eth2  In  IP 10.0.29.3.58076 > 10.0.29.2.3784: BFDv1, Control, State Up, Flags: [none], length: 24
 00:00:25.357291 eth2  Out IP 10.0.29.2.49201 > 10.0.29.3.3784: BFDv1, Control, State Up, Flags: [none], length: 24
 00:00:25.383561 eth2  In  IP 10.0.29.3.58076 > 10.0.29.2.3784: BFDv1, Control, State Up, Flags: [none], length: 24
 00:00:25.441889 eth2  Out IP 10.0.29.2.49201 > 10.0.29.3.3784: BFDv1, Control, State Up, Flags: [none], length: 24
 00:00:25.469152 eth2  In  IP 10.0.29.3.58076 > 10.0.29.2.3784: BFDv1, Control, State Up, Flags: [none], length: 24
 00:00:25.529423 eth2  Out IP 10.0.29.2.49201 > 10.0.29.3.3784: BFDv1, Control, State Up, Flags: [none], length: 24
 00:00:25.550676 eth2  In  IP 10.0.29.3.58076 > 10.0.29.2.3784: BFDv1, Control, State Up, Flags: [none], length: 24
 00:00:25.618021 eth2  Out IP 10.0.29.2.49201 > 10.0.29.3.3784: BFDv1, Control, State Up, Flags: [none], length: 24
 00:00:25.631266 eth2  In  IP 10.0.29.3.58076 > 10.0.29.2.3784: BFDv1, Control, State Up, Flags: [none], length: 24
 00:00:25.692555 eth2  Out IP 10.0.29.2.49201 > 10.0.29.3.3784: BFDv1, Control, State Up, Flags: [none], length: 24
 00:00:25.716792 eth2  In  IP 10.0.29.3.58076 > 10.0.29.2.3784: BFDv1, Control, State Up, Flags: [none], length: 24
 00:00:25.771154 eth2  Out IP 10.0.29.2.49201 > 10.0.29.3.3784: BFDv1, Control, State Up, Flags: [none], length: 24
 00:00:25.803370 eth2  In  IP 10.0.29.3.58076 > 10.0.29.2.3784: BFDv1, Control, State Up, Flags: [none], length: 24
 00:00:25.850565 eth2  Out IP 10.0.29.2.49201 > 10.0.29.3.3784: BFDv1, Control, State Up, Flags: [none], length: 24
 00:00:25.889814 eth2  In  IP 10.0.29.3.58076 > 10.0.29.2.3784: BFDv1, Control, State Up, Flags: [none], length: 24
 00:00:25.934022 eth2  Out IP 10.0.29.2.49201 > 10.0.29.3.3784: BFDv1, Control, State Up, Flags: [none], length: 24
 00:00:25.978061 eth2  In  IP 10.0.29.3.58076 > 10.0.29.2.3784: BFDv1, Control, State Up, Flags: [none], length: 24
 00:00:26.021249 eth2  Out IP 10.0.29.2.49201 > 10.0.29.3.3784: BFDv1, Control, State Up, Flags: [none], length: 24
 00:00:26.060548 eth2  In  IP 10.0.29.3.58076 > 10.0.29.2.3784: BFDv1, Control, State Up, Flags: [none], length: 24
 00:00:26.100784 eth2  Out IP 10.0.29.2.49201 > 10.0.29.3.3784: BFDv1, Control, State Up, Flags: [none], length: 24
 00:00:26.136995 eth2  In  IP 10.0.29.3.58076 > 10.0.29.2.3784: BFDv1, Control, State Up, Flags: [none], length: 24
 00:00:26.191176 eth2  Out IP 10.0.29.2.49201 > 10.0.29.3.3784: BFDv1, Control, State Up, Flags: [none], length: 24
 00:00:26.219367 eth2  In  IP 10.0.29.3.58076 > 10.0.29.2.3784: BFDv1, Control, State Up, Flags: [none], length: 24
 00:00:26.279594 eth2  Out IP 10.0.29.2.49201 > 10.0.29.3.3784: BFDv1, Control, State Up, Flags: [none], length: 24
 00:00:26.300761 eth2  In  IP 10.0.29.3.58076 > 10.0.29.2.3784: BFDv1, Control, State Up, Flags: [none], length: 24
 00:00:26.360973 eth2  Out IP 10.0.29.2.49201 > 10.0.29.3.3784: BFDv1, Control, State Up, Flags: [none], length: 24
 00:00:26.388757 eth2  In  IP 10.0.29.3.58076 > 10.0.29.2.3784: BFDv1, Control, State Up, Flags: [none], length: 24
 00:00:26.446118 eth2  Out IP 10.0.29.2.49201 > 10.0.29.3.3784: BFDv1, Control, State Up, Flags: [none], length: 24
 00:00:26.469309 eth2  In  IP 10.0.29.3.58076 > 10.0.29.2.3784: BFDv1, Control, State Up, Flags: [none], length: 24
 00:00:26.527510 eth2  Out IP 10.0.29.2.49201 > 10.0.29.3.3784: BFDv1, Control, State Up, Flags: [none], length: 24
 00:00:26.549731 eth2  In  IP 10.0.29.3.58076 > 10.0.29.2.3784: BFDv1, Control, State Up, Flags: [none], length: 24
 00:00:26.609992 eth2  Out IP 10.0.29.2.49201 > 10.0.29.3.3784: BFDv1, Control, State Up, Flags: [none], length: 24
 00:00:26.625193 eth2  In  IP 10.0.29.3.58076 > 10.0.29.2.3784: BFDv1, Control, State Up, Flags: [none], length: 24
 00:00:26.684445 eth2  Out IP 10.0.29.2.49201 > 10.0.29.3.3784: BFDv1, Control, State Up, Flags: [none], length: 24
 00:00:26.703681 eth2  In  IP 10.0.29.3.58076 > 10.0.29.2.3784: BFDv1, Control, State Up, Flags: [none], length: 24
 00:00:26.762936 eth2  Out IP 10.0.29.2.49201 > 10.0.29.3.3784: BFDv1, Control, State Up, Flags: [none], length: 24
 00:00:26.778208 eth2  In  IP 10.0.29.3.58076 > 10.0.29.2.3784: BFDv1, Control, State Up, Flags: [none], length: 24
 00:00:26.840482 eth2  Out IP 10.0.29.2.49201 > 10.0.29.3.3784: BFDv1, Control, State Up, Flags: [none], length: 24
 00:00:26.858734 eth2  In  IP 10.0.29.3.58076 > 10.0.29.2.3784: BFDv1, Control, State Up, Flags: [none], length: 24
 00:00:26.916041 eth2  Out IP 10.0.29.2.49201 > 10.0.29.3.3784: BFDv1, Control, State Up, Flags: [none], length: 24
 00:00:26.937286 eth2  In  IP 10.0.29.3.58076 > 10.0.29.2.3784: BFDv1, Control, State Up, Flags: [none], length: 24
 00:00:27.003539 eth2  Out IP 10.0.29.2.49201 > 10.0.29.3.3784: BFDv1, Control, State Up, Flags: [none], length: 24
 00:00:27.023768 eth2  In  IP 10.0.29.3.58076 > 10.0.29.2.3784: BFDv1, Control, State Up, Flags: [none], length: 24
 00:00:27.092070 eth2  Out IP 10.0.29.2.49201 > 10.0.29.3.3784: BFDv1, Control, State Up, Flags: [none], length: 24
 00:00:27.107334 eth2  In  IP 10.0.29.3.58076 > 10.0.29.2.3784: BFDv1, Control, State Up, Flags: [none], length: 24
 00:00:27.176580 eth2  Out IP 10.0.29.2.49201 > 10.0.29.3.3784: BFDv1, Control, State Up, Flags: [none], length: 24
 00:00:27.187793 eth2  In  IP 10.0.29.3.58076 > 10.0.29.2.3784: BFDv1, Control, State Up, Flags: [none], length: 24
 00:00:27.252963 eth2  Out IP 10.0.29.2.49201 > 10.0.29.3.3784: BFDv1, Control, State Up, Flags: [none], length: 24
 00:00:27.269169 eth2  In  IP 10.0.29.3.58076 > 10.0.29.2.3784: BFDv1, Control, State Up, Flags: [none], length: 24
 00:00:27.330465 eth2  Out IP 10.0.29.2.49201 > 10.0.29.3.3784: BFDv1, Control, State Up, Flags: [none], length: 24
 00:00:27.345693 eth2  In  IP 10.0.29.3.58076 > 10.0.29.2.3784: BFDv1, Control, State Up, Flags: [none], length: 24
 00:00:27.412951 eth2  Out IP 10.0.29.2.49201 > 10.0.29.3.3784: BFDv1, Control, State Up, Flags: [none], length: 24
 00:00:27.428189 eth2  In  IP 10.0.29.3.58076 > 10.0.29.2.3784: BFDv1, Control, State Up, Flags: [none], length: 24
 00:00:27.492476 eth2  Out IP 10.0.29.2.49201 > 10.0.29.3.3784: BFDv1, Control, State Up, Flags: [none], length: 24
 00:00:27.514792 eth2  In  IP 10.0.29.3.58076 > 10.0.29.2.3784: BFDv1, Control, State Up, Flags: [none], length: 24
 00:00:27.576052 eth2  Out IP 10.0.29.2.49201 > 10.0.29.3.3784: BFDv1, Control, State Up, Flags: [none], length: 24
 00:00:27.600285 eth2  In  IP 10.0.29.3.58076 > 10.0.29.2.3784: BFDv1, Control, State Up, Flags: [none], length: 24
 00:00:27.660545 eth2  Out IP 10.0.29.2.49201 > 10.0.29.3.3784: BFDv1, Control, State Up, Flags: [none], length: 24
 00:00:27.677736 eth2  In  IP 10.0.29.3.58076 > 10.0.29.2.3784: BFDv1, Control, State Up, Flags: [none], length: 24
 00:00:27.737139 eth2  Out IP 10.0.29.2.49201 > 10.0.29.3.3784: BFDv1, Control, State Up, Flags: [none], length: 24
 00:00:27.753410 eth2  In  IP 10.0.29.3.58076 > 10.0.29.2.3784: BFDv1, Control, State Up, Flags: [none], length: 24
 00:00:27.826757 eth2  Out IP 10.0.29.2.49201 > 10.0.29.3.3784: BFDv1, Control, State Up, Flags: [none], length: 24
 00:00:27.833950 eth2  In  IP 10.0.29.3.58076 > 10.0.29.2.3784: BFDv1, Control, State Up, Flags: [none], length: 24
 00:00:27.902200 eth2  Out IP 10.0.29.2.49201 > 10.0.29.3.3784: BFDv1, Control, State Up, Flags: [none], length: 24
 00:00:27.911429 eth2  In  IP 10.0.29.3.58076 > 10.0.29.2.3784: BFDv1, Control, State Up, Flags: [none], length: 24
 00:00:27.987702 eth2  Out IP 10.0.29.2.49201 > 10.0.29.3.3784: BFDv1, Control, State Up, Flags: [none], length: 24
 00:00:27.996884 eth2  In  IP 10.0.29.3.58076 > 10.0.29.2.3784: BFDv1, Control, State Up, Flags: [none], length: 24
 00:00:28.047577 eth2  Out IP 10.0.29.2.32863 > 10.0.29.3.179: Flags [S], seq 2469395325, win 64240, options [mss 1460,sackOK,TS val 2352242124 ecr 0,nop,wscale 10], length 0
 00:00:28.047646 eth2  In  IP 10.0.29.3.179 > 10.0.29.2.32863: Flags [S.], seq 2114836034, ack 2469395326, win 65160, options [mss 1460,sackOK,TS val 562541860 ecr 2352242124,nop,wscale 10], length 0
 00:00:28.047675 eth2  Out IP 10.0.29.2.32863 > 10.0.29.3.179: Flags [.], ack 1, win 63, options [nop,nop,TS val 2352242124 ecr 562541860], length 0
 00:00:28.047767 eth2  Out IP 10.0.29.2.32863 > 10.0.29.3.179: Flags [P.], seq 1:65, ack 1, win 63, options [nop,nop,TS val 2352242124 ecr 562541860], length 64: BGP
 00:00:28.047791 eth2  In  IP 10.0.29.3.179 > 10.0.29.2.32863: Flags [.], ack 65, win 64, options [nop,nop,TS val 562541860 ecr 2352242124], length 0
 00:00:28.047851 eth2  In  IP 10.0.29.3.179 > 10.0.29.2.32863: Flags [R.], seq 1, ack 65, win 64, options [nop,nop,TS val 562541860 ecr 2352242124], length 0
 00:00:28.074598 eth2  In  IP 10.0.29.3.58076 > 10.0.29.2.3784: BFDv1, Control, State Up, Flags: [none], length: 24
 00:00:28.074730 eth2  Out IP 10.0.29.2.49201 > 10.0.29.3.3784: BFDv1, Control, State Up, Flags: [none], length: 24
 00:00:28.152988 eth2  Out IP 10.0.29.2.49201 > 10.0.29.3.3784: BFDv1, Control, State Up, Flags: [none], length: 24
 00:00:28.158216 eth2  In  IP 10.0.29.3.58076 > 10.0.29.2.3784: BFDv1, Control, State Up, Flags: [none], length: 24
 00:00:28.232511 eth2  Out IP 10.0.29.2.49201 > 10.0.29.3.3784: BFDv1, Control, State Up, Flags: [none], length: 24
 00:00:28.233738 eth2  In  IP 10.0.29.3.58076 > 10.0.29.2.3784: BFDv1, Control, State Up, Flags: [none], length: 24
 00:00:28.313778 eth2  In  IP 10.0.29.3.58076 > 10.0.29.2.3784: BFDv1, Control, State Up, Flags: [none], length: 24
 00:00:28.319370 eth2  Out IP 10.0.29.2.49201 > 10.0.29.3.3784: BFDv1, Control, State Up, Flags: [none], length: 24
 00:00:28.400165 eth2  In  IP 10.0.29.3.58076 > 10.0.29.2.3784: BFDv1, Control, State Up, Flags: [none], length: 24
 00:00:28.401406 eth2  Out IP 10.0.29.2.49201 > 10.0.29.3.3784: BFDv1, Control, State Up, Flags: [none], length: 24
 00:00:28.475877 eth2  In  IP 10.0.29.3.58076 > 10.0.29.2.3784: BFDv1, Control, State Up, Flags: [none], length: 24
 00:00:28.481140 eth2  Out IP 10.0.29.2.49201 > 10.0.29.3.3784: BFDv1, Control, State Up, Flags: [none], length: 24
 00:00:28.559820 eth2  In  IP 10.0.29.3.58076 > 10.0.29.2.3784: BFDv1, Control, State Up, Flags: [none], length: 24
 00:00:28.566097 eth2  Out IP 10.0.29.2.49201 > 10.0.29.3.3784: BFDv1, Control, State Up, Flags: [none], length: 24
 00:00:28.643684 eth2  In  IP 10.0.29.3.58076 > 10.0.29.2.3784: BFDv1, Control, State Up, Flags: [none], length: 24
 00:00:28.654008 eth2  Out IP 10.0.29.2.49201 > 10.0.29.3.3784: BFDv1, Control, State Up, Flags: [none], length: 24
 00:00:28.728677 eth2  In  IP 10.0.29.3.58076 > 10.0.29.2.3784: BFDv1, Control, State Up, Flags: [none], length: 24
 00:00:28.743937 eth2  Out IP 10.0.29.2.49201 > 10.0.29.3.3784: BFDv1, Control, State Up, Flags: [none], length: 24
 00:00:28.817574 eth2  In  IP 10.0.29.3.58076 > 10.0.29.2.3784: BFDv1, Control, State Up, Flags: [none], length: 24
 00:00:28.819834 eth2  Out IP 10.0.29.2.49201 > 10.0.29.3.3784: BFDv1, Control, State Up, Flags: [none], length: 24
 00:00:28.893447 eth2  In  IP 10.0.29.3.58076 > 10.0.29.2.3784: BFDv1, Control, State Up, Flags: [none], length: 24
 00:00:28.899656 eth2  Out IP 10.0.29.2.49201 > 10.0.29.3.3784: BFDv1, Control, State Up, Flags: [none], length: 24
 00:00:28.974433 eth2  In  IP 10.0.29.3.58076 > 10.0.29.2.3784: BFDv1, Control, State Up, Flags: [none], length: 24
 00:00:28.989654 eth2  Out IP 10.0.29.2.49201 > 10.0.29.3.3784: BFDv1, Control, State Up, Flags: [none], length: 24
 00:00:29.058263 eth2  In  IP 10.0.29.3.58076 > 10.0.29.2.3784: BFDv1, Control, State Up, Flags: [none], length: 24
 00:00:29.068559 eth2  Out IP 10.0.29.2.49201 > 10.0.29.3.3784: BFDv1, Control, State Up, Flags: [none], length: 24
 00:00:29.148173 eth2  In  IP 10.0.29.3.58076 > 10.0.29.2.3784: BFDv1, Control, State Up, Flags: [none], length: 24
 00:00:29.151408 eth2  Out IP 10.0.29.2.49201 > 10.0.29.3.3784: BFDv1, Control, State Up, Flags: [none], length: 24
 00:00:29.225624 eth2  Out IP 10.0.29.2.49201 > 10.0.29.3.3784: BFDv1, Control, State Up, Flags: [none], length: 24
 00:00:29.228841 eth2  In  IP 10.0.29.3.58076 > 10.0.29.2.3784: BFDv1, Control, State Up, Flags: [none], length: 24
 00:00:29.301139 eth2  Out IP 10.0.29.2.49201 > 10.0.29.3.3784: BFDv1, Control, State Up, Flags: [none], length: 24
 00:00:29.316355 eth2  In  IP 10.0.29.3.58076 > 10.0.29.2.3784: BFDv1, Control, State Up, Flags: [none], length: 24
 00:00:29.382605 eth2  Out IP 10.0.29.2.49201 > 10.0.29.3.3784: BFDv1, Control, State Up, Flags: [none], length: 24
 00:00:29.400920 eth2  In  IP 10.0.29.3.58076 > 10.0.29.2.3784: BFDv1, Control, State Up, Flags: [none], length: 24
 00:00:29.466188 eth2  Out IP 10.0.29.2.49201 > 10.0.29.3.3784: BFDv1, Control, State Up, Flags: [none], length: 24
 00:00:29.489591 eth2  In  IP 10.0.29.3.58076 > 10.0.29.2.3784: BFDv1, Control, State Up, Flags: [none], length: 24
 00:00:29.542861 eth2  Out IP 10.0.29.2.49201 > 10.0.29.3.3784: BFDv1, Control, State Up, Flags: [none], length: 24
 00:00:29.575131 eth2  In  IP 10.0.29.3.58076 > 10.0.29.2.3784: BFDv1, Control, State Up, Flags: [none], length: 24
 00:00:29.626367 eth2  Out IP 10.0.29.2.49201 > 10.0.29.3.3784: BFDv1, Control, State Up, Flags: [none], length: 24
 00:00:29.652674 eth2  In  IP 10.0.29.3.58076 > 10.0.29.2.3784: BFDv1, Control, State Up, Flags: [none], length: 24
 00:00:29.701938 eth2  Out IP 10.0.29.2.49201 > 10.0.29.3.3784: BFDv1, Control, State Up, Flags: [none], length: 24
 00:00:29.742165 eth2  In  IP 10.0.29.3.58076 > 10.0.29.2.3784: BFDv1, Control, State Up, Flags: [none], length: 24
 00:00:29.783430 eth2  Out IP 10.0.29.2.49201 > 10.0.29.3.3784: BFDv1, Control, State Up, Flags: [none], length: 24
 00:00:29.824724 eth2  In  IP 10.0.29.3.58076 > 10.0.29.2.3784: BFDv1, Control, State Up, Flags: [none], length: 24
 00:00:29.860977 eth2  Out IP 10.0.29.2.49201 > 10.0.29.3.3784: BFDv1, Control, State Up, Flags: [none], length: 24
 00:00:29.905423 eth2  In  IP 10.0.29.3.58076 > 10.0.29.2.3784: BFDv1, Control, State Up, Flags: [none], length: 24
 00:00:29.946644 eth2  Out IP 10.0.29.2.49201 > 10.0.29.3.3784: BFDv1, Control, State Up, Flags: [none], length: 24
 00:00:29.981694 eth2  In  IP 10.0.29.3.58076 > 10.0.29.2.3784: BFDv1, Control, State Up, Flags: [none], length: 24
 00:00:30.027921 eth2  Out IP 10.0.29.2.49201 > 10.0.29.3.3784: BFDv1, Control, State Up, Flags: [none], length: 24
 00:00:30.063199 eth2  In  IP 10.0.29.3.58076 > 10.0.29.2.3784: BFDv1, Control, State Up, Flags: [none], length: 24
 00:00:30.104443 eth2  Out IP 10.0.29.2.49201 > 10.0.29.3.3784: BFDv1, Control, State Up, Flags: [none], length: 24
 00:00:30.144774 eth2  In  IP 10.0.29.3.58076 > 10.0.29.2.3784: BFDv1, Control, State Up, Flags: [none], length: 24
 00:00:30.191107 eth2  Out IP 10.0.29.2.49201 > 10.0.29.3.3784: BFDv1, Control, State Up, Flags: [none], length: 24
 00:00:30.226190 eth2  In  IP 10.0.29.3.58076 > 10.0.29.2.3784: BFDv1, Control, State Up, Flags: [none], length: 24
 00:00:30.268462 eth2  Out IP 10.0.29.2.49201 > 10.0.29.3.3784: BFDv1, Control, State Up, Flags: [none], length: 24
 00:00:30.308808 eth2  In  IP 10.0.29.3.58076 > 10.0.29.2.3784: BFDv1, Control, State Up, Flags: [none], length: 24
578 packets captured
580 packets received by filter
0 packets dropped by kernel

