tcpdump: data link type LINUX_SLL2
tcpdump: verbose output suppressed, use -v[v]... for full protocol decode
listening on any, link-type LINUX_SLL2 (Linux cooked v2), snapshot length 262144 bytes
 00:00:00.000000 eth1  In  IP 10.0.29.3.34325 > 10.0.29.2.3784: BFDv1, Control, State Up, Flags: [none], length: 24
 00:00:00.014336 eth1  Out IP 10.0.29.2.58197 > 10.0.29.3.3784: BFDv1, Control, State Up, Flags: [none], length: 24
 00:00:00.081370 eth1  In  IP 10.0.29.3.34325 > 10.0.29.2.3784: BFDv1, Control, State Up, Flags: [none], length: 24
 00:00:00.098731 eth1  Out IP 10.0.29.2.58197 > 10.0.29.3.3784: BFDv1, Control, State Up, Flags: [none], length: 24
 00:00:00.167174 eth1  In  IP 10.0.29.3.34325 > 10.0.29.2.3784: BFDv1, Control, State Up, Flags: [none], length: 24
 00:00:00.185628 eth1  Out IP 10.0.29.2.58197 > 10.0.29.3.3784: BFDv1, Control, State Up, Flags: [none], length: 24
 00:00:00.245039 eth1  In  IP 10.0.29.3.34325 > 10.0.29.2.3784: BFDv1, Control, State Up, Flags: [none], length: 24
 00:00:00.267475 eth1  Out IP 10.0.29.2.58197 > 10.0.29.3.3784: BFDv1, Control, State Up, Flags: [none], length: 24
 00:00:00.332939 eth1  In  IP 10.0.29.3.34325 > 10.0.29.2.3784: BFDv1, Control, State Up, Flags: [none], length: 24
 00:00:00.354246 eth1  Out IP 10.0.29.2.58197 > 10.0.29.3.3784: BFDv1, Control, State Up, Flags: [none], length: 24
 00:00:00.418479 eth1  In  IP 10.0.29.3.34325 > 10.0.29.2.3784: BFDv1, Control, State Up, Flags: [none], length: 24
 00:00:00.431792 eth1  Out IP 10.0.29.2.58197 > 10.0.29.3.3784: BFDv1, Control, State Up, Flags: [none], length: 24
 00:00:00.500312 eth1  In  IP 10.0.29.3.34325 > 10.0.29.2.3784: BFDv1, Control, State Up, Flags: [none], length: 24
 00:00:00.508625 eth1  Out IP 10.0.29.2.58197 > 10.0.29.3.3784: BFDv1, Control, State Up, Flags: [none], length: 24
 00:00:00.587912 eth1  In  IP 10.0.29.3.34325 > 10.0.29.2.3784: BFDv1, Control, State Up, Flags: [none], length: 24
 00:00:00.597252 eth1  Out IP 10.0.29.2.58197 > 10.0.29.3.3784: BFDv1, Control, State Up, Flags: [none], length: 24
 00:00:00.670123 eth1  In  IP 10.0.29.3.34325 > 10.0.29.2.3784: BFDv1, Control, State Up, Flags: [none], length: 24
 00:00:00.674375 eth1  Out IP 10.0.29.2.58197 > 10.0.29.3.3784: BFDv1, Control, State Up, Flags: [none], length: 24
 00:00:00.750626 eth1  Out IP 10.0.29.2.58197 > 10.0.29.3.3784: BFDv1, Control, State Up, Flags: [none], length: 24
 00:00:00.759858 eth1  In  IP 10.0.29.3.34325 > 10.0.29.2.3784: BFDv1, Control, State Up, Flags: [none], length: 24
 00:00:00.830110 eth1  Out IP 10.0.29.2.58197 > 10.0.29.3.3784: BFDv1, Control, State Up, Flags: [none], length: 24
 00:00:00.847354 eth1  In  IP 10.0.29.3.34325 > 10.0.29.2.3784: BFDv1, Control, State Up, Flags: [none], length: 24
 00:00:00.919628 eth1  Out IP 10.0.29.2.58197 > 10.0.29.3.3784: BFDv1, Control, State Up, Flags: [none], length: 24
 00:00:00.930870 eth1  In  IP 10.0.29.3.34325 > 10.0.29.2.3784: BFDv1, Control, State Up, Flags: [none], length: 24
 00:00:00.996227 eth1  Out IP 10.0.29.2.58197 > 10.0.29.3.3784: BFDv1, Control, State Up, Flags: [none], length: 24
 00:00:01.007501 eth1  In  IP 10.0.29.3.34325 > 10.0.29.2.3784: BFDv1, Control, State Up, Flags: [none], length: 24
 00:00:01.084844 eth1  Out IP 10.0.29.2.58197 > 10.0.29.3.3784: BFDv1, Control, State Up, Flags: [none], length: 24
 00:00:01.092196 eth1  In  IP 10.0.29.3.34325 > 10.0.29.2.3784: BFDv1, Control, State Up, Flags: [none], length: 24
 00:00:01.163811 eth1  Out IP 10.0.29.2.58197 > 10.0.29.3.3784: BFDv1, Control, State Up, Flags: [none], length: 24
 00:00:01.177008 eth1  In  IP 10.0.29.3.34325 > 10.0.29.2.3784: BFDv1, Control, State Up, Flags: [none], length: 24
 00:00:01.253228 eth1  Out IP 10.0.29.2.58197 > 10.0.29.3.3784: BFDv1, Control, State Up, Flags: [none], length: 24
 00:00:01.260413 eth1  In  IP 10.0.29.3.34325 > 10.0.29.2.3784: BFDv1, Control, State Up, Flags: [none], length: 24
 00:00:01.333748 eth1  Out IP 10.0.29.2.58197 > 10.0.29.3.3784: BFDv1, Control, State Up, Flags: [none], length: 24
 00:00:01.347944 eth1  In  IP 10.0.29.3.34325 > 10.0.29.2.3784: BFDv1, Control, State Up, Flags: [none], length: 24
 00:00:01.422224 eth1  Out IP 10.0.29.2.58197 > 10.0.29.3.3784: BFDv1, Control, State Up, Flags: [none], length: 24
 00:00:01.429356 eth1  In  IP 10.0.29.3.34325 > 10.0.29.2.3784: BFDv1, Control, State Up, Flags: [none], length: 24
 00:00:01.499643 eth1  Out IP 10.0.29.2.58197 > 10.0.29.3.3784: BFDv1, Control, State Up, Flags: [none], length: 24
 00:00:01.507309 eth1  In  IP 10.0.29.3.34325 > 10.0.29.2.3784: BFDv1, Control, State Up, Flags: [none], length: 24
 00:00:01.577626 eth1  Out IP 10.0.29.2.58197 > 10.0.29.3.3784: BFDv1, Control, State Up, Flags: [none], length: 24
 00:00:01.588800 eth1  In  IP 10.0.29.3.34325 > 10.0.29.2.3784: BFDv1, Control, State Up, Flags: [none], length: 24
 00:00:01.660117 eth1  Out IP 10.0.29.2.58197 > 10.0.29.3.3784: BFDv1, Control, State Up, Flags: [none], length: 24
 00:00:01.666371 eth1  In  IP 10.0.29.3.34325 > 10.0.29.2.3784: BFDv1, Control, State Up, Flags: [none], length: 24
 00:00:01.743988 eth1  In  IP 10.0.29.3.34325 > 10.0.29.2.3784: BFDv1, Control, State Up, Flags: [none], length: 24
 00:00:01.748229 eth1  Out IP 10.0.29.2.58197 > 10.0.29.3.3784: BFDv1, Control, State Up, Flags: [none], length: 24
 00:00:01.823798 eth1  In  IP 10.0.29.3.34325 > 10.0.29.2.3784: BFDv1, Control, State Up, Flags: [none], length: 24
 00:00:01.835267 eth1  Out IP 10.0.29.2.58197 > 10.0.29.3.3784: BFDv1, Control, State Up, Flags: [none], length: 24
 00:00:01.900036 eth1  In  IP 10.0.29.3.34325 > 10.0.29.2.3784: BFDv1, Control, State Up, Flags: [none], length: 24
 00:00:01.919454 eth1  Out IP 10.0.29.2.58197 > 10.0.29.3.3784: BFDv1, Control, State Up, Flags: [none], length: 24
 00:00:01.982109 eth1  In  IP 10.0.29.3.34325 > 10.0.29.2.3784: BFDv1, Control, State Up, Flags: [none], length: 24
 00:00:02.006406 eth1  Out IP 10.0.29.2.58197 > 10.0.29.3.3784: BFDv1, Control, State Up, Flags: [none], length: 24
 00:00:02.053776 eth2  Out IP 10.0.29.2.179 > 10.0.29.3.42589: Flags [P.], seq 3281529546:3281529567, ack 3387037597, win 64, options [nop,nop,TS val 1876955813 ecr 3829694163], length 21: BGP
 00:00:02.053851 eth2  Out IP 10.0.29.2.179 > 10.0.29.3.42589: Flags [F.], seq 21, ack 1, win 64, options [nop,nop,TS val 1876955813 ecr 3829694163], length 0
 00:00:02.053891 eth2  Out IP 10.0.12.3.51192 > 10.0.12.2.179: Flags [P.], seq 221769271:221769306, ack 3568889896, win 63, options [nop,nop,TS val 627313203 ecr 398147893], length 35: BGP
 00:00:02.053920 eth2  In  IP 10.0.12.2.179 > 10.0.12.3.51192: Flags [.], ack 35, win 64, options [nop,nop,TS val 398164559 ecr 627313203], length 0
 00:00:02.054085 eth2  In  IP 10.0.12.2.179 > 10.0.12.3.51192: Flags [P.], seq 1:55, ack 35, win 64, options [nop,nop,TS val 398164559 ecr 627313203], length 54: BGP
 00:00:02.054093 eth2  Out IP 10.0.12.3.51192 > 10.0.12.2.179: Flags [.], ack 55, win 63, options [nop,nop,TS val 627313203 ecr 398164559], length 0
 00:00:02.054333 eth2  Out IP 10.0.12.3.51192 > 10.0.12.2.179: Flags [P.], seq 35:80, ack 55, win 63, options [nop,nop,TS val 627313204 ecr 398164559], length 45: BGP
 00:00:02.075248 eth2  Out IP 10.0.29.2.179 > 10.0.29.3.42589: Flags [F.], seq 21, ack 1, win 64, options [nop,nop,TS val 1876955835 ecr 3829694163], length 0
 00:00:02.096145 eth2  In  IP 10.0.12.2.179 > 10.0.12.3.51192: Flags [.], ack 80, win 64, options [nop,nop,TS val 398164602 ecr 627313204], length 0
 00:00:02.291186 eth2  Out IP 10.0.29.2.179 > 10.0.29.3.42589: Flags [FP.], seq 0:21, ack 1, win 64, options [nop,nop,TS val 1876956051 ecr 3829694163], length 21: BGP
 00:00:02.715293 eth2  Out IP 10.0.29.2.179 > 10.0.29.3.42589: Flags [FP.], seq 0:21, ack 1, win 64, options [nop,nop,TS val 1876956475 ecr 3829694163], length 21: BGP
 00:00:03.571157 eth2  Out IP 10.0.29.2.179 > 10.0.29.3.42589: Flags [FP.], seq 0:21, ack 1, win 64, options [nop,nop,TS val 1876957331 ecr 3829694163], length 21: BGP
 00:00:05.300159 eth2  Out IP 10.0.29.2.179 > 10.0.29.3.42589: Flags [FP.], seq 0:21, ack 1, win 64, options [nop,nop,TS val 1876959060 ecr 3829694163], length 21: BGP
 00:00:08.691161 eth2  Out IP 10.0.29.2.179 > 10.0.29.3.42589: Flags [FP.], seq 0:21, ack 1, win 64, options [nop,nop,TS val 1876962451 ecr 3829694163], length 21: BGP
 00:00:10.116997 eth2  Out IP 10.0.12.3.51192 > 10.0.12.2.179: Flags [P.], seq 80:128, ack 55, win 63, options [nop,nop,TS val 627321266 ecr 398164602], length 48: BGP
 00:00:10.117032 eth2  In  IP 10.0.12.2.179 > 10.0.12.3.51192: Flags [.], ack 128, win 64, options [nop,nop,TS val 398172622 ecr 627321266], length 0
 00:00:10.117268 eth2  In  IP 10.0.12.2.179 > 10.0.12.3.51192: Flags [P.], seq 55:82, ack 128, win 64, options [nop,nop,TS val 398172623 ecr 627321266], length 27: BGP
 00:00:10.117662 eth2  Out IP 10.0.12.3.51192 > 10.0.12.2.179: Flags [P.], seq 128:173, ack 82, win 63, options [nop,nop,TS val 627321267 ecr 398172623], length 45: BGP
 00:00:10.119311 eth1  Out IP 10.0.29.2.56421 > 10.0.29.3.3784: BFDv1, Control, State Down, Flags: [none], length: 24
 00:00:10.159149 eth2  In  IP 10.0.12.2.179 > 10.0.12.3.51192: Flags [.], ack 173, win 64, options [nop,nop,TS val 398172665 ecr 627321267], length 0
 00:00:10.655849 eth1  In  IP 10.0.29.3.53522 > 10.0.29.2.3784: BFDv1, Control, State Init, Flags: [none], length: 24
 00:00:10.655990 eth1  Out IP 10.0.29.2.56421 > 10.0.29.3.3784: BFDv1, Control, State Up, Flags: [Poll], length: 24
 00:00:10.656038 eth1  In  IP 10.0.29.3.53522 > 10.0.29.2.3784: BFDv1, Control, State Up, Flags: [Final], length: 24
 00:00:10.656055 eth1  In  IP 10.0.29.3.53522 > 10.0.29.2.3784: BFDv1, Control, State Up, Flags: [Poll], length: 24
 00:00:10.656092 eth1  Out IP 10.0.29.2.56421 > 10.0.29.3.3784: BFDv1, Control, State Up, Flags: [Final], length: 24
 00:00:10.732047 eth1  In  IP 10.0.29.3.53522 > 10.0.29.2.3784: BFDv1, Control, State Up, Flags: [none], length: 24
 00:00:10.738324 eth1  Out IP 10.0.29.2.56421 > 10.0.29.3.3784: BFDv1, Control, State Up, Flags: [none], length: 24
 00:00:10.813660 eth1  Out IP 10.0.29.2.56421 > 10.0.29.3.3784: BFDv1, Control, State Up, Flags: [none], length: 24
 00:00:10.813744 eth1  In  IP 10.0.29.3.53522 > 10.0.29.2.3784: BFDv1, Control, State Up, Flags: [none], length: 24
 00:00:10.894426 eth1  In  IP 10.0.29.3.53522 > 10.0.29.2.3784: BFDv1, Control, State Up, Flags: [none], length: 24
 00:00:10.899673 eth1  Out IP 10.0.29.2.56421 > 10.0.29.3.3784: BFDv1, Control, State Up, Flags: [none], length: 24
 00:00:10.975420 eth1  In  IP 10.0.29.3.53522 > 10.0.29.2.3784: BFDv1, Control, State Up, Flags: [none], length: 24
 00:00:10.978662 eth1  Out IP 10.0.29.2.56421 > 10.0.29.3.3784: BFDv1, Control, State Up, Flags: [none], length: 24
 00:00:11.055892 eth1  Out IP 10.0.29.2.56421 > 10.0.29.3.3784: BFDv1, Control, State Up, Flags: [none], length: 24
 00:00:11.057234 eth1  In  IP 10.0.29.3.53522 > 10.0.29.2.3784: BFDv1, Control, State Up, Flags: [none], length: 24
 00:00:11.137688 eth1  In  IP 10.0.29.3.53522 > 10.0.29.2.3784: BFDv1, Control, State Up, Flags: [none], length: 24
 00:00:11.142952 eth1  Out IP 10.0.29.2.56421 > 10.0.29.3.3784: BFDv1, Control, State Up, Flags: [none], length: 24
 00:00:11.213508 eth1  In  IP 10.0.29.3.53522 > 10.0.29.2.3784: BFDv1, Control, State Up, Flags: [none], length: 24
 00:00:11.226764 eth1  Out IP 10.0.29.2.56421 > 10.0.29.3.3784: BFDv1, Control, State Up, Flags: [none], length: 24
 00:00:11.298280 eth1  In  IP 10.0.29.3.53522 > 10.0.29.2.3784: BFDv1, Control, State Up, Flags: [none], length: 24
 00:00:11.303604 eth1  Out IP 10.0.29.2.56421 > 10.0.29.3.3784: BFDv1, Control, State Up, Flags: [none], length: 24
 00:00:11.379137 eth1  In  IP 10.0.29.3.53522 > 10.0.29.2.3784: BFDv1, Control, State Up, Flags: [none], length: 24
 00:00:11.391752 eth1  Out IP 10.0.29.2.56421 > 10.0.29.3.3784: BFDv1, Control, State Up, Flags: [none], length: 24
 00:00:11.454464 eth1  In  IP 10.0.29.3.53522 > 10.0.29.2.3784: BFDv1, Control, State Up, Flags: [none], length: 24
 00:00:11.473740 eth1  Out IP 10.0.29.2.56421 > 10.0.29.3.3784: BFDv1, Control, State Up, Flags: [none], length: 24
 00:00:11.537411 eth1  In  IP 10.0.29.3.53522 > 10.0.29.2.3784: BFDv1, Control, State Up, Flags: [none], length: 24
 00:00:11.553722 eth1  Out IP 10.0.29.2.56421 > 10.0.29.3.3784: BFDv1, Control, State Up, Flags: [none], length: 24
 00:00:11.622281 eth1  In  IP 10.0.29.3.53522 > 10.0.29.2.3784: BFDv1, Control, State Up, Flags: [none], length: 24
 00:00:11.641557 eth1  Out IP 10.0.29.2.56421 > 10.0.29.3.3784: BFDv1, Control, State Up, Flags: [none], length: 24
 00:00:11.707153 eth1  In  IP 10.0.29.3.53522 > 10.0.29.2.3784: BFDv1, Control, State Up, Flags: [none], length: 24
 00:00:11.728435 eth1  Out IP 10.0.29.2.56421 > 10.0.29.3.3784: BFDv1, Control, State Up, Flags: [none], length: 24
 00:00:11.788152 eth1  In  IP 10.0.29.3.53522 > 10.0.29.2.3784: BFDv1, Control, State Up, Flags: [none], length: 24
 00:00:11.807477 eth1  Out IP 10.0.29.2.56421 > 10.0.29.3.3784: BFDv1, Control, State Up, Flags: [none], length: 24
 00:00:11.865860 eth1  In  IP 10.0.29.3.53522 > 10.0.29.2.3784: BFDv1, Control, State Up, Flags: [none], length: 24
 00:00:11.897303 eth1  Out IP 10.0.29.2.56421 > 10.0.29.3.3784: BFDv1, Control, State Up, Flags: [none], length: 24
 00:00:11.952980 eth1  In  IP 10.0.29.3.53522 > 10.0.29.2.3784: BFDv1, Control, State Up, Flags: [none], length: 24
 00:00:11.986324 eth1  Out IP 10.0.29.2.56421 > 10.0.29.3.3784: BFDv1, Control, State Up, Flags: [none], length: 24
 00:00:12.030716 eth1  In  IP 10.0.29.3.53522 > 10.0.29.2.3784: BFDv1, Control, State Up, Flags: [none], length: 24
 00:00:12.072963 eth1  Out IP 10.0.29.2.56421 > 10.0.29.3.3784: BFDv1, Control, State Up, Flags: [none], length: 24
 00:00:12.113166 eth1  In  IP 10.0.29.3.53522 > 10.0.29.2.3784: BFDv1, Control, State Up, Flags: [none], length: 24
 00:00:12.160437 eth1  Out IP 10.0.29.2.56421 > 10.0.29.3.3784: BFDv1, Control, State Up, Flags: [none], length: 24
 00:00:12.190684 eth1  In  IP 10.0.29.3.53522 > 10.0.29.2.3784: BFDv1, Control, State Up, Flags: [none], length: 24
 00:00:12.245942 eth1  Out IP 10.0.29.2.56421 > 10.0.29.3.3784: BFDv1, Control, State Up, Flags: [none], length: 24
 00:00:12.274165 eth1  In  IP 10.0.29.3.53522 > 10.0.29.2.3784: BFDv1, Control, State Up, Flags: [none], length: 24
 00:00:12.327429 eth1  Out IP 10.0.29.2.56421 > 10.0.29.3.3784: BFDv1, Control, State Up, Flags: [none], length: 24
 00:00:12.351757 eth1  In  IP 10.0.29.3.53522 > 10.0.29.2.3784: BFDv1, Control, State Up, Flags: [none], length: 24
 00:00:12.411041 eth1  Out IP 10.0.29.2.56421 > 10.0.29.3.3784: BFDv1, Control, State Up, Flags: [none], length: 24
 00:00:12.440305 eth1  In  IP 10.0.29.3.53522 > 10.0.29.2.3784: BFDv1, Control, State Up, Flags: [none], length: 24
 00:00:12.500574 eth1  Out IP 10.0.29.2.56421 > 10.0.29.3.3784: BFDv1, Control, State Up, Flags: [none], length: 24
 00:00:12.521280 eth1  In  IP 10.0.29.3.53522 > 10.0.29.2.3784: BFDv1, Control, State Up, Flags: [none], length: 24
 00:00:12.579548 eth1  Out IP 10.0.29.2.56421 > 10.0.29.3.3784: BFDv1, Control, State Up, Flags: [none], length: 24
 00:00:12.608773 eth1  In  IP 10.0.29.3.53522 > 10.0.29.2.3784: BFDv1, Control, State Up, Flags: [none], length: 24
 00:00:12.664150 eth1  Out IP 10.0.29.2.56421 > 10.0.29.3.3784: BFDv1, Control, State Up, Flags: [none], length: 24
 00:00:12.688461 eth1  In  IP 10.0.29.3.53522 > 10.0.29.2.3784: BFDv1, Control, State Up, Flags: [none], length: 24
 00:00:12.750757 eth1  Out IP 10.0.29.2.56421 > 10.0.29.3.3784: BFDv1, Control, State Up, Flags: [none], length: 24
 00:00:12.774061 eth1  In  IP 10.0.29.3.53522 > 10.0.29.2.3784: BFDv1, Control, State Up, Flags: [none], length: 24
 00:00:12.830353 eth1  Out IP 10.0.29.2.56421 > 10.0.29.3.3784: BFDv1, Control, State Up, Flags: [none], length: 24
 00:00:12.856530 eth1  In  IP 10.0.29.3.53522 > 10.0.29.2.3784: BFDv1, Control, State Up, Flags: [none], length: 24
 00:00:12.915853 eth1  Out IP 10.0.29.2.56421 > 10.0.29.3.3784: BFDv1, Control, State Up, Flags: [none], length: 24
 00:00:12.946104 eth1  In  IP 10.0.29.3.53522 > 10.0.29.2.3784: BFDv1, Control, State Up, Flags: [none], length: 24
 00:00:13.005513 eth1  Out IP 10.0.29.2.56421 > 10.0.29.3.3784: BFDv1, Control, State Up, Flags: [none], length: 24
 00:00:13.024742 eth1  In  IP 10.0.29.3.53522 > 10.0.29.2.3784: BFDv1, Control, State Up, Flags: [none], length: 24
 00:00:13.094029 eth1  Out IP 10.0.29.2.56421 > 10.0.29.3.3784: BFDv1, Control, State Up, Flags: [none], length: 24
 00:00:13.100183 eth1  In  IP 10.0.29.3.53522 > 10.0.29.2.3784: BFDv1, Control, State Up, Flags: [none], length: 24
 00:00:13.177461 eth1  Out IP 10.0.29.2.56421 > 10.0.29.3.3784: BFDv1, Control, State Up, Flags: [none], length: 24
 00:00:13.182633 eth1  In  IP 10.0.29.3.53522 > 10.0.29.2.3784: BFDv1, Control, State Up, Flags: [none], length: 24
 00:00:13.260958 eth1  Out IP 10.0.29.2.56421 > 10.0.29.3.3784: BFDv1, Control, State Up, Flags: [none], length: 24
 00:00:13.263206 eth1  In  IP 10.0.29.3.53522 > 10.0.29.2.3784: BFDv1, Control, State Up, Flags: [none], length: 24
 00:00:13.339109 eth1  In  IP 10.0.29.3.53522 > 10.0.29.2.3784: BFDv1, Control, State Up, Flags: [none], length: 24
 00:00:13.340471 eth1  Out IP 10.0.29.2.56421 > 10.0.29.3.3784: BFDv1, Control, State Up, Flags: [none], length: 24
 00:00:13.417890 eth1  In  IP 10.0.29.3.53522 > 10.0.29.2.3784: BFDv1, Control, State Up, Flags: [none], length: 24
 00:00:13.424286 eth1  Out IP 10.0.29.2.56421 > 10.0.29.3.3784: BFDv1, Control, State Up, Flags: [none], length: 24
 00:00:13.502544 eth1  Out IP 10.0.29.2.56421 > 10.0.29.3.3784: BFDv1, Control, State Up, Flags: [none], length: 24
 00:00:13.503724 eth1  In  IP 10.0.29.3.53522 > 10.0.29.2.3784: BFDv1, Control, State Up, Flags: [none], length: 24
 00:00:13.587083 eth1  Out IP 10.0.29.2.56421 > 10.0.29.3.3784: BFDv1, Control, State Up, Flags: [none], length: 24
 00:00:13.589366 eth1  In  IP 10.0.29.3.53522 > 10.0.29.2.3784: BFDv1, Control, State Up, Flags: [none], length: 24
 00:00:13.672683 eth1  Out IP 10.0.29.2.56421 > 10.0.29.3.3784: BFDv1, Control, State Up, Flags: [none], length: 24
 00:00:13.674919 eth1  In  IP 10.0.29.3.53522 > 10.0.29.2.3784: BFDv1, Control, State Up, Flags: [none], length: 24
 00:00:13.748243 eth1  Out IP 10.0.29.2.56421 > 10.0.29.3.3784: BFDv1, Control, State Up, Flags: [none], length: 24
 00:00:13.752432 eth1  In  IP 10.0.29.3.53522 > 10.0.29.2.3784: BFDv1, Control, State Up, Flags: [none], length: 24
 00:00:13.825782 eth1  Out IP 10.0.29.2.56421 > 10.0.29.3.3784: BFDv1, Control, State Up, Flags: [none], length: 24
 00:00:13.828041 eth1  In  IP 10.0.29.3.53522 > 10.0.29.2.3784: BFDv1, Control, State Up, Flags: [none], length: 24
 00:00:13.912536 eth1  Out IP 10.0.29.2.56421 > 10.0.29.3.3784: BFDv1, Control, State Up, Flags: [none], length: 24
 00:00:13.916913 eth1  In  IP 10.0.29.3.53522 > 10.0.29.2.3784: BFDv1, Control, State Up, Flags: [none], length: 24
 00:00:14.001460 eth1  Out IP 10.0.29.2.56421 > 10.0.29.3.3784: BFDv1, Control, State Up, Flags: [none], length: 24
 00:00:14.004745 eth1  In  IP 10.0.29.3.53522 > 10.0.29.2.3784: BFDv1, Control, State Up, Flags: [none], length: 24
 00:00:14.081662 eth1  In  IP 10.0.29.3.53522 > 10.0.29.2.3784: BFDv1, Control, State Up, Flags: [none], length: 24
 00:00:14.086044 eth1  Out IP 10.0.29.2.56421 > 10.0.29.3.3784: BFDv1, Control, State Up, Flags: [none], length: 24
 00:00:14.100266 eth1  Out IP 10.0.29.2.43855 > 10.0.29.3.179: Flags [S], seq 2994906630, win 64240, options [mss 1460,sackOK,TS val 1876967860 ecr 0,nop,wscale 10], length 0
 00:00:14.100343 eth1  In  IP 10.0.29.3.179 > 10.0.29.2.43855: Flags [S.], seq 4171919842, ack 2994906631, win 65160, options [mss 1460,sackOK,TS val 3829722834 ecr 1876967860,nop,wscale 10], length 0
 00:00:14.100377 eth1  Out IP 10.0.29.2.43855 > 10.0.29.3.179: Flags [.], ack 1, win 63, options [nop,nop,TS val 1876967860 ecr 3829722834], length 0
 00:00:14.100508 eth1  Out IP 10.0.29.2.43855 > 10.0.29.3.179: Flags [P.], seq 1:65, ack 1, win 63, options [nop,nop,TS val 1876967860 ecr 3829722834], length 64: BGP
 00:00:14.100570 eth1  In  IP 10.0.29.3.179 > 10.0.29.2.43855: Flags [F.], seq 1, ack 1, win 64, options [nop,nop,TS val 3829722834 ecr 1876967860], length 0
 00:00:14.100675 eth1  Out IP 10.0.29.2.43855 > 10.0.29.3.179: Flags [F.], seq 65, ack 2, win 63, options [nop,nop,TS val 1876967860 ecr 3829722834], length 0
 00:00:14.100675 eth1  In  IP 10.0.29.3.179 > 10.0.29.2.43855: Flags [R], seq 4171919843, win 0, length 0
 00:00:14.100707 eth1  In  IP 10.0.29.3.179 > 10.0.29.2.43855: Flags [R], seq 4171919844, win 0, length 0
 00:00:14.162323 eth1  Out IP 10.0.29.2.56421 > 10.0.29.3.3784: BFDv1, Control, State Up, Flags: [none], length: 24
 00:00:14.170626 eth1  In  IP 10.0.29.3.53522 > 10.0.29.2.3784: BFDv1, Control, State Up, Flags: [none], length: 24
 00:00:14.249048 eth1  Out IP 10.0.29.2.56421 > 10.0.29.3.3784: BFDv1, Control, State Up, Flags: [none], length: 24
 00:00:14.253353 eth1  In  IP 10.0.29.3.53522 > 10.0.29.2.3784: BFDv1, Control, State Up, Flags: [none], length: 24
 00:00:14.328776 eth1  Out IP 10.0.29.2.56421 > 10.0.29.3.3784: BFDv1, Control, State Up, Flags: [none], length: 24
 00:00:14.334041 eth1  In  IP 10.0.29.3.53522 > 10.0.29.2.3784: BFDv1, Control, State Up, Flags: [none], length: 24
 00:00:14.406442 eth1  Out IP 10.0.29.2.56421 > 10.0.29.3.3784: BFDv1, Control, State Up, Flags: [none], length: 24
 00:00:14.415731 eth1  In  IP 10.0.29.3.53522 > 10.0.29.2.3784: BFDv1, Control, State Up, Flags: [none], length: 24
 00:00:14.489110 eth1  Out IP 10.0.29.2.56421 > 10.0.29.3.3784: BFDv1, Control, State Up, Flags: [none], length: 24
 00:00:14.496339 eth1  In  IP 10.0.29.3.53522 > 10.0.29.2.3784: BFDv1, Control, State Up, Flags: [none], length: 24
 00:00:14.578660 eth1  Out IP 10.0.29.2.56421 > 10.0.29.3.3784: BFDv1, Control, State Up, Flags: [none], length: 24
 00:00:14.578803 eth1  In  IP 10.0.29.3.53522 > 10.0.29.2.3784: BFDv1, Control, State Up, Flags: [none], length: 24
 00:00:14.662178 eth1  Out IP 10.0.29.2.56421 > 10.0.29.3.3784: BFDv1, Control, State Up, Flags: [none], length: 24
 00:00:14.664455 eth1  In  IP 10.0.29.3.53522 > 10.0.29.2.3784: BFDv1, Control, State Up, Flags: [none], length: 24
 00:00:14.738884 eth1  Out IP 10.0.29.2.56421 > 10.0.29.3.3784: BFDv1, Control, State Up, Flags: [none], length: 24
 00:00:14.748287 eth1  In  IP 10.0.29.3.53522 > 10.0.29.2.3784: BFDv1, Control, State Up, Flags: [none], length: 24
 00:00:14.827738 eth1  Out IP 10.0.29.2.56421 > 10.0.29.3.3784: BFDv1, Control, State Up, Flags: [none], length: 24
 00:00:14.829016 eth1  In  IP 10.0.29.3.53522 > 10.0.29.2.3784: BFDv1, Control, State Up, Flags: [none], length: 24
 00:00:14.911032 eth1  In  IP 10.0.29.3.53522 > 10.0.29.2.3784: BFDv1, Control, State Up, Flags: [none], length: 24
 00:00:14.914611 eth1  Out IP 10.0.29.2.56421 > 10.0.29.3.3784: BFDv1, Control, State Up, Flags: [none], length: 24
 00:00:14.997665 eth1  In  IP 10.0.29.3.53522 > 10.0.29.2.3784: BFDv1, Control, State Up, Flags: [none], length: 24
 00:00:15.000023 eth1  Out IP 10.0.29.2.56421 > 10.0.29.3.3784: BFDv1, Control, State Up, Flags: [none], length: 24
 00:00:15.076156 eth1  In  IP 10.0.29.3.53522 > 10.0.29.2.3784: BFDv1, Control, State Up, Flags: [none], length: 24
 00:00:15.086720 eth1  Out IP 10.0.29.2.56421 > 10.0.29.3.3784: BFDv1, Control, State Up, Flags: [none], length: 24
 00:00:15.159624 eth1  In  IP 10.0.29.3.53522 > 10.0.29.2.3784: BFDv1, Control, State Up, Flags: [none], length: 24
 00:00:15.162030 eth1  Out IP 10.0.29.2.56421 > 10.0.29.3.3784: BFDv1, Control, State Up, Flags: [none], length: 24
 00:00:15.236099 eth1  In  IP 10.0.29.3.53522 > 10.0.29.2.3784: BFDv1, Control, State Up, Flags: [none], length: 24
 00:00:15.243521 eth1  Out IP 10.0.29.2.56421 > 10.0.29.3.3784: BFDv1, Control, State Up, Flags: [none], length: 24
 00:00:15.322656 eth1  In  IP 10.0.29.3.53522 > 10.0.29.2.3784: BFDv1, Control, State Up, Flags: [none], length: 24
 00:00:15.328960 eth1  Out IP 10.0.29.2.56421 > 10.0.29.3.3784: BFDv1, Control, State Up, Flags: [none], length: 24
 00:00:15.408164 eth1  In  IP 10.0.29.3.53522 > 10.0.29.2.3784: BFDv1, Control, State Up, Flags: [none], length: 24
 00:00:15.417542 eth1  Out IP 10.0.29.2.56421 > 10.0.29.3.3784: BFDv1, Control, State Up, Flags: [none], length: 24
 00:00:15.486671 eth1  In  IP 10.0.29.3.53522 > 10.0.29.2.3784: BFDv1, Control, State Up, Flags: [none], length: 24
 00:00:15.507049 eth1  Out IP 10.0.29.2.56421 > 10.0.29.3.3784: BFDv1, Control, State Up, Flags: [none], length: 24
 00:00:15.573274 eth1  In  IP 10.0.29.3.53522 > 10.0.29.2.3784: BFDv1, Control, State Up, Flags: [none], length: 24
 00:00:15.584663 eth1  Out IP 10.0.29.2.56421 > 10.0.29.3.3784: BFDv1, Control, State Up, Flags: [none], length: 24
 00:00:15.659673 eth1  In  IP 10.0.29.3.53522 > 10.0.29.2.3784: BFDv1, Control, State Up, Flags: [none], length: 24
 00:00:15.664059 eth1  Out IP 10.0.29.2.56421 > 10.0.29.3.3784: BFDv1, Control, State Up, Flags: [none], length: 24
 00:00:15.741245 eth1  In  IP 10.0.29.3.53522 > 10.0.29.2.3784: BFDv1, Control, State Up, Flags: [none], length: 24
 00:00:15.746631 eth1  Out IP 10.0.29.2.56421 > 10.0.29.3.3784: BFDv1, Control, State Up, Flags: [none], length: 24
 00:00:15.817036 eth1  In  IP 10.0.29.3.53522 > 10.0.29.2.3784: BFDv1, Control, State Up, Flags: [none], length: 24
 00:00:15.828427 eth1  Out IP 10.0.29.2.56421 > 10.0.29.3.3784: BFDv1, Control, State Up, Flags: [none], length: 24
 00:00:15.859174 eth1  Out IP 10.0.29.2.179 > 10.0.29.3.42589: Flags [FP.], seq 0:21, ack 1, win 64, options [nop,nop,TS val 1876969619 ecr 3829694163], length 21: BGP
 00:00:15.859277 eth1  In  IP 10.0.29.3.42589 > 10.0.29.2.179: Flags [R], seq 3387037597, win 0, length 0
 00:00:15.899640 eth1  In  IP 10.0.29.3.53522 > 10.0.29.2.3784: BFDv1, Control, State Up, Flags: [none], length: 24
 00:00:15.915960 eth1  Out IP 10.0.29.2.56421 > 10.0.29.3.3784: BFDv1, Control, State Up, Flags: [none], length: 24
 00:00:15.983168 eth1  In  IP 10.0.29.3.53522 > 10.0.29.2.3784: BFDv1, Control, State Up, Flags: [none], length: 24
 00:00:15.994581 eth1  Out IP 10.0.29.2.56421 > 10.0.29.3.3784: BFDv1, Control, State Up, Flags: [none], length: 24
 00:00:16.061661 eth1  In  IP 10.0.29.3.53522 > 10.0.29.2.3784: BFDv1, Control, State Up, Flags: [none], length: 24
 00:00:16.076078 eth1  Out IP 10.0.29.2.56421 > 10.0.29.3.3784: BFDv1, Control, State Up, Flags: [none], length: 24
 00:00:16.140232 eth1  In  IP 10.0.29.3.53522 > 10.0.29.2.3784: BFDv1, Control, State Up, Flags: [none], length: 24
 00:00:16.165651 eth1  Out IP 10.0.29.2.56421 > 10.0.29.3.3784: BFDv1, Control, State Up, Flags: [none], length: 24
 00:00:16.215740 eth1  In  IP 10.0.29.3.53522 > 10.0.29.2.3784: BFDv1, Control, State Up, Flags: [none], length: 24
 00:00:16.255231 eth1  Out IP 10.0.29.2.56421 > 10.0.29.3.3784: BFDv1, Control, State Up, Flags: [none], length: 24
 00:00:16.295318 eth1  In  IP 10.0.29.3.53522 > 10.0.29.2.3784: BFDv1, Control, State Up, Flags: [none], length: 24
 00:00:16.335657 eth1  Out IP 10.0.29.2.56421 > 10.0.29.3.3784: BFDv1, Control, State Up, Flags: [none], length: 24
 00:00:16.381772 eth1  In  IP 10.0.29.3.53522 > 10.0.29.2.3784: BFDv1, Control, State Up, Flags: [none], length: 24
 00:00:16.420174 eth1  Out IP 10.0.29.2.56421 > 10.0.29.3.3784: BFDv1, Control, State Up, Flags: [none], length: 24
 00:00:16.463424 eth1  In  IP 10.0.29.3.53522 > 10.0.29.2.3784: BFDv1, Control, State Up, Flags: [none], length: 24
 00:00:16.495832 eth1  Out IP 10.0.29.2.56421 > 10.0.29.3.3784: BFDv1, Control, State Up, Flags: [none], length: 24
 00:00:16.540861 eth1  In  IP 10.0.29.3.53522 > 10.0.29.2.3784: BFDv1, Control, State Up, Flags: [none], length: 24
 00:00:16.573290 eth1  Out IP 10.0.29.2.56421 > 10.0.29.3.3784: BFDv1, Control, State Up, Flags: [none], length: 24
 00:00:16.616367 eth1  In  IP 10.0.29.3.53522 > 10.0.29.2.3784: BFDv1, Control, State Up, Flags: [none], length: 24
 00:00:16.662711 eth1  Out IP 10.0.29.2.56421 > 10.0.29.3.3784: BFDv1, Control, State Up, Flags: [none], length: 24
 00:00:16.704472 eth1  In  IP 10.0.29.3.53522 > 10.0.29.2.3784: BFDv1, Control, State Up, Flags: [none], length: 24
 00:00:16.743845 eth1  Out IP 10.0.29.2.56421 > 10.0.29.3.3784: BFDv1, Control, State Up, Flags: [none], length: 24
 00:00:16.780045 eth1  In  IP 10.0.29.3.53522 > 10.0.29.2.3784: BFDv1, Control, State Up, Flags: [none], length: 24
 00:00:16.831837 eth1  Out IP 10.0.29.2.56421 > 10.0.29.3.3784: BFDv1, Control, State Up, Flags: [none], length: 24
 00:00:16.867555 eth1  In  IP 10.0.29.3.53522 > 10.0.29.2.3784: BFDv1, Control, State Up, Flags: [none], length: 24
 00:00:16.910929 eth1  Out IP 10.0.29.2.56421 > 10.0.29.3.3784: BFDv1, Control, State Up, Flags: [none], length: 24
 00:00:16.953403 eth1  In  IP 10.0.29.3.53522 > 10.0.29.2.3784: BFDv1, Control, State Up, Flags: [none], length: 24
 00:00:16.994912 eth1  Out IP 10.0.29.2.56421 > 10.0.29.3.3784: BFDv1, Control, State Up, Flags: [none], length: 24
 00:00:17.041459 eth1  In  IP 10.0.29.3.53522 > 10.0.29.2.3784: BFDv1, Control, State Up, Flags: [none], length: 24
 00:00:17.073872 eth1  Out IP 10.0.29.2.56421 > 10.0.29.3.3784: BFDv1, Control, State Up, Flags: [none], length: 24
 00:00:17.120929 eth1  In  IP 10.0.29.3.53522 > 10.0.29.2.3784: BFDv1, Control, State Up, Flags: [none], length: 24
 00:00:17.153269 eth1  Out IP 10.0.29.2.56421 > 10.0.29.3.3784: BFDv1, Control, State Up, Flags: [none], length: 24
 00:00:17.203443 eth1  In  IP 10.0.29.3.53522 > 10.0.29.2.3784: BFDv1, Control, State Up, Flags: [none], length: 24
 00:00:17.230223 eth1  Out IP 10.0.29.2.56421 > 10.0.29.3.3784: BFDv1, Control, State Up, Flags: [none], length: 24
 00:00:17.283969 eth1  In  IP 10.0.29.3.53522 > 10.0.29.2.3784: BFDv1, Control, State Up, Flags: [none], length: 24
 00:00:17.311437 eth1  Out IP 10.0.29.2.56421 > 10.0.29.3.3784: BFDv1, Control, State Up, Flags: [none], length: 24
 00:00:17.370418 eth1  In  IP 10.0.29.3.53522 > 10.0.29.2.3784: BFDv1, Control, State Up, Flags: [none], length: 24
 00:00:17.388821 eth1  Out IP 10.0.29.2.56421 > 10.0.29.3.3784: BFDv1, Control, State Up, Flags: [none], length: 24
 00:00:17.450715 eth1  In  IP 10.0.29.3.53522 > 10.0.29.2.3784: BFDv1, Control, State Up, Flags: [none], length: 24
 00:00:17.477100 eth1  Out IP 10.0.29.2.56421 > 10.0.29.3.3784: BFDv1, Control, State Up, Flags: [none], length: 24
 00:00:17.537415 eth1  In  IP 10.0.29.3.53522 > 10.0.29.2.3784: BFDv1, Control, State Up, Flags: [none], length: 24
 00:00:17.553788 eth1  Out IP 10.0.29.2.56421 > 10.0.29.3.3784: BFDv1, Control, State Up, Flags: [none], length: 24
 00:00:17.613703 eth1  In  IP 10.0.29.3.53522 > 10.0.29.2.3784: BFDv1, Control, State Up, Flags: [none], length: 24
 00:00:17.643098 eth1  Out IP 10.0.29.2.56421 > 10.0.29.3.3784: BFDv1, Control, State Up, Flags: [none], length: 24
 00:00:17.694501 eth1  In  IP 10.0.29.3.53522 > 10.0.29.2.3784: BFDv1, Control, State Up, Flags: [none], length: 24
 00:00:17.731908 eth1  Out IP 10.0.29.2.56421 > 10.0.29.3.3784: BFDv1, Control, State Up, Flags: [none], length: 24
 00:00:17.777204 eth1  In  IP 10.0.29.3.53522 > 10.0.29.2.3784: BFDv1, Control, State Up, Flags: [none], length: 24
 00:00:17.814607 eth1  Out IP 10.0.29.2.56421 > 10.0.29.3.3784: BFDv1, Control, State Up, Flags: [none], length: 24
 00:00:17.860802 eth1  In  IP 10.0.29.3.53522 > 10.0.29.2.3784: BFDv1, Control, State Up, Flags: [none], length: 24
 00:00:17.898310 eth1  Out IP 10.0.29.2.56421 > 10.0.29.3.3784: BFDv1, Control, State Up, Flags: [none], length: 24
 00:00:17.939664 eth1  In  IP 10.0.29.3.53522 > 10.0.29.2.3784: BFDv1, Control, State Up, Flags: [none], length: 24
 00:00:17.986987 eth1  Out IP 10.0.29.2.56421 > 10.0.29.3.3784: BFDv1, Control, State Up, Flags: [none], length: 24
 00:00:18.022184 eth1  In  IP 10.0.29.3.53522 > 10.0.29.2.3784: BFDv1, Control, State Up, Flags: [none], length: 24
 00:00:18.068515 eth1  Out IP 10.0.29.2.56421 > 10.0.29.3.3784: BFDv1, Control, State Up, Flags: [none], length: 24
 00:00:18.103988 eth1  In  IP 10.0.29.3.53522 > 10.0.29.2.3784: BFDv1, Control, State Up, Flags: [none], length: 24
 00:00:18.155338 eth1  Out IP 10.0.29.2.56421 > 10.0.29.3.3784: BFDv1, Control, State Up, Flags: [none], length: 24
 00:00:18.182565 eth1  In  IP 10.0.29.3.53522 > 10.0.29.2.3784: BFDv1, Control, State Up, Flags: [none], length: 24
 00:00:18.231986 eth1  Out IP 10.0.29.2.56421 > 10.0.29.3.3784: BFDv1, Control, State Up, Flags: [none], length: 24
 00:00:18.268233 eth1  In  IP 10.0.29.3.53522 > 10.0.29.2.3784: BFDv1, Control, State Up, Flags: [none], length: 24
 00:00:18.321612 eth1  Out IP 10.0.29.2.56421 > 10.0.29.3.3784: BFDv1, Control, State Up, Flags: [none], length: 24
 00:00:18.344877 eth1  In  IP 10.0.29.3.53522 > 10.0.29.2.3784: BFDv1, Control, State Up, Flags: [none], length: 24
 00:00:18.399251 eth1  Out IP 10.0.29.2.56421 > 10.0.29.3.3784: BFDv1, Control, State Up, Flags: [none], length: 24
 00:00:18.434675 eth1  In  IP 10.0.29.3.53522 > 10.0.29.2.3784: BFDv1, Control, State Up, Flags: [none], length: 24
 00:00:18.488082 eth1  Out IP 10.0.29.2.56421 > 10.0.29.3.3784: BFDv1, Control, State Up, Flags: [none], length: 24
 00:00:18.521379 eth1  In  IP 10.0.29.3.53522 > 10.0.29.2.3784: BFDv1, Control, State Up, Flags: [none], length: 24
 00:00:18.564749 eth1  Out IP 10.0.29.2.56421 > 10.0.29.3.3784: BFDv1, Control, State Up, Flags: [none], length: 24
 00:00:18.584938 eth1  Out IP 10.0.29.2.44055 > 10.0.29.3.179: Flags [S], seq 3981571087, win 64240, options [mss 1460,sackOK,TS val 1876972344 ecr 0,nop,wscale 10], length 0
 00:00:18.585009 eth1  In  IP 10.0.29.3.179 > 10.0.29.2.44055: Flags [S.], seq 2908616211, ack 3981571088, win 65160, options [mss 1460,sackOK,TS val 3829727318 ecr 1876972344,nop,wscale 10], length 0
 00:00:18.585036 eth1  Out IP 10.0.29.2.44055 > 10.0.29.3.179: Flags [.], ack 1, win 63, options [nop,nop,TS val 1876972344 ecr 3829727318], length 0
 00:00:18.585126 eth1  Out IP 10.0.29.2.44055 > 10.0.29.3.179: Flags [P.], seq 1:65, ack 1, win 63, options [nop,nop,TS val 1876972345 ecr 3829727318], length 64: BGP
 00:00:18.585143 eth1  In  IP 10.0.29.3.179 > 10.0.29.2.44055: Flags [.], ack 65, win 64, options [nop,nop,TS val 3829727319 ecr 1876972345], length 0
 00:00:18.585202 eth1  In  IP 10.0.29.3.179 > 10.0.29.2.44055: Flags [R.], seq 1, ack 65, win 64, options [nop,nop,TS val 3829727319 ecr 1876972345], length 0
 00:00:18.608205 eth1  In  IP 10.0.29.3.53522 > 10.0.29.2.3784: BFDv1, Control, State Up, Flags: [none], length: 24
 00:00:18.650654 eth1  Out IP 10.0.29.2.56421 > 10.0.29.3.3784: BFDv1, Control, State Up, Flags: [none], length: 24
 00:00:18.688905 eth1  In  IP 10.0.29.3.53522 > 10.0.29.2.3784: BFDv1, Control, State Up, Flags: [none], length: 24
 00:00:18.731295 eth1  Out IP 10.0.29.2.56421 > 10.0.29.3.3784: BFDv1, Control, State Up, Flags: [none], length: 24
 00:00:18.777783 eth1  In  IP 10.0.29.3.53522 > 10.0.29.2.3784: BFDv1, Control, State Up, Flags: [none], length: 24
 00:00:18.809173 eth1  Out IP 10.0.29.2.56421 > 10.0.29.3.3784: BFDv1, Control, State Up, Flags: [none], length: 24
 00:00:18.860622 eth1  In  IP 10.0.29.3.53522 > 10.0.29.2.3784: BFDv1, Control, State Up, Flags: [none], length: 24
 00:00:18.885983 eth1  Out IP 10.0.29.2.56421 > 10.0.29.3.3784: BFDv1, Control, State Up, Flags: [none], length: 24
 00:00:18.941475 eth1  In  IP 10.0.29.3.53522 > 10.0.29.2.3784: BFDv1, Control, State Up, Flags: [none], length: 24
 00:00:18.966848 eth1  Out IP 10.0.29.2.56421 > 10.0.29.3.3784: BFDv1, Control, State Up, Flags: [none], length: 24
 00:00:19.029941 eth1  In  IP 10.0.29.3.53522 > 10.0.29.2.3784: BFDv1, Control, State Up, Flags: [none], length: 24
 00:00:19.050345 eth1  Out IP 10.0.29.2.56421 > 10.0.29.3.3784: BFDv1, Control, State Up, Flags: [none], length: 24
 00:00:19.110806 eth1  In  IP 10.0.29.3.53522 > 10.0.29.2.3784: BFDv1, Control, State Up, Flags: [none], length: 24
 00:00:19.140097 eth1  Out IP 10.0.29.2.56421 > 10.0.29.3.3784: BFDv1, Control, State Up, Flags: [none], length: 24
 00:00:19.199565 eth1  In  IP 10.0.29.3.53522 > 10.0.29.2.3784: BFDv1, Control, State Up, Flags: [none], length: 24
 00:00:19.223888 eth1  Out IP 10.0.29.2.56421 > 10.0.29.3.3784: BFDv1, Control, State Up, Flags: [none], length: 24
 00:00:19.274323 eth1  In  IP 10.0.29.3.53522 > 10.0.29.2.3784: BFDv1, Control, State Up, Flags: [none], length: 24
 00:00:19.301704 eth1  Out IP 10.0.29.2.56421 > 10.0.29.3.3784: BFDv1, Control, State Up, Flags: [none], length: 24
 00:00:19.352946 eth1  In  IP 10.0.29.3.53522 > 10.0.29.2.3784: BFDv1, Control, State Up, Flags: [none], length: 24
 00:00:19.380204 eth1  Out IP 10.0.29.2.56421 > 10.0.29.3.3784: BFDv1, Control, State Up, Flags: [none], length: 24
 00:00:19.438280 eth1  In  IP 10.0.29.3.53522 > 10.0.29.2.3784: BFDv1, Control, State Up, Flags: [none], length: 24
 00:00:19.468650 eth1  Out IP 10.0.29.2.56421 > 10.0.29.3.3784: BFDv1, Control, State Up, Flags: [none], length: 24
 00:00:19.526050 eth1  In  IP 10.0.29.3.53522 > 10.0.29.2.3784: BFDv1, Control, State Up, Flags: [none], length: 24
 00:00:19.547434 eth1  Out IP 10.0.29.2.56421 > 10.0.29.3.3784: BFDv1, Control, State Up, Flags: [none], length: 24
 00:00:19.607861 eth1  In  IP 10.0.29.3.53522 > 10.0.29.2.3784: BFDv1, Control, State Up, Flags: [none], length: 24
 00:00:19.632138 eth1  Out IP 10.0.29.2.56421 > 10.0.29.3.3784: BFDv1, Control, State Up, Flags: [none], length: 24
 00:00:19.688477 eth1  In  IP 10.0.29.3.53522 > 10.0.29.2.3784: BFDv1, Control, State Up, Flags: [none], length: 24
 00:00:19.707745 eth1  Out IP 10.0.29.2.56421 > 10.0.29.3.3784: BFDv1, Control, State Up, Flags: [none], length: 24
 00:00:19.766782 eth1  In  IP 10.0.29.3.53522 > 10.0.29.2.3784: BFDv1, Control, State Up, Flags: [none], length: 24
 00:00:19.785050 eth1  Out IP 10.0.29.2.56421 > 10.0.29.3.3784: BFDv1, Control, State Up, Flags: [none], length: 24
 00:00:19.851110 eth1  In  IP 10.0.29.3.53522 > 10.0.29.2.3784: BFDv1, Control, State Up, Flags: [none], length: 24
 00:00:19.871402 eth1  Out IP 10.0.29.2.56421 > 10.0.29.3.3784: BFDv1, Control, State Up, Flags: [none], length: 24
 00:00:19.935568 eth1  In  IP 10.0.29.3.53522 > 10.0.29.2.3784: BFDv1, Control, State Up, Flags: [none], length: 24
 00:00:19.959916 eth1  Out IP 10.0.29.2.56421 > 10.0.29.3.3784: BFDv1, Control, State Up, Flags: [none], length: 24
 00:00:20.022326 eth1  In  IP 10.0.29.3.53522 > 10.0.29.2.3784: BFDv1, Control, State Up, Flags: [none], length: 24
 00:00:20.037218 eth1  Out IP 10.0.29.2.56421 > 10.0.29.3.3784: BFDv1, Control, State Up, Flags: [none], length: 24
 00:00:20.097544 eth1  In  IP 10.0.29.3.53522 > 10.0.29.2.3784: BFDv1, Control, State Up, Flags: [none], length: 24
 00:00:20.113898 eth1  Out IP 10.0.29.2.56421 > 10.0.29.3.3784: BFDv1, Control, State Up, Flags: [none], length: 24
 00:00:20.176938 eth1  In  IP 10.0.29.3.53522 > 10.0.29.2.3784: BFDv1, Control, State Up, Flags: [none], length: 24
 00:00:20.197320 eth1  Out IP 10.0.29.2.56421 > 10.0.29.3.3784: BFDv1, Control, State Up, Flags: [none], length: 24
 00:00:20.254232 eth1  In  IP 10.0.29.3.53522 > 10.0.29.2.3784: BFDv1, Control, State Up, Flags: [none], length: 24
 00:00:20.286442 eth1  Out IP 10.0.29.2.56421 > 10.0.29.3.3784: BFDv1, Control, State Up, Flags: [none], length: 24
 00:00:20.328532 eth1  In  IP 10.0.29.3.53522 > 10.0.29.2.3784: BFDv1, Control, State Up, Flags: [none], length: 24
 00:00:20.370764 eth1  Out IP 10.0.29.2.56421 > 10.0.29.3.3784: BFDv1, Control, State Up, Flags: [none], length: 24
 00:00:20.414931 eth1  In  IP 10.0.29.3.53522 > 10.0.29.2.3784: BFDv1, Control, State Up, Flags: [none], length: 24
 00:00:20.449306 eth1  Out IP 10.0.29.2.56421 > 10.0.29.3.3784: BFDv1, Control, State Up, Flags: [none], length: 24
 00:00:20.494440 eth1  In  IP 10.0.29.3.53522 > 10.0.29.2.3784: BFDv1, Control, State Up, Flags: [none], length: 24
 00:00:20.524791 eth1  Out IP 10.0.29.2.56421 > 10.0.29.3.3784: BFDv1, Control, State Up, Flags: [none], length: 24
 00:00:20.572654 eth1  In  IP 10.0.29.3.53522 > 10.0.29.2.3784: BFDv1, Control, State Up, Flags: [none], length: 24
 00:00:20.608904 eth1  Out IP 10.0.29.2.56421 > 10.0.29.3.3784: BFDv1, Control, State Up, Flags: [none], length: 24
 00:00:20.655188 eth1  In  IP 10.0.29.3.53522 > 10.0.29.2.3784: BFDv1, Control, State Up, Flags: [none], length: 24
 00:00:20.690457 eth1  Out IP 10.0.29.2.56421 > 10.0.29.3.3784: BFDv1, Control, State Up, Flags: [none], length: 24
 00:00:20.743714 eth1  In  IP 10.0.29.3.53522 > 10.0.29.2.3784: BFDv1, Control, State Up, Flags: [none], length: 24
 00:00:20.780009 eth1  Out IP 10.0.29.2.56421 > 10.0.29.3.3784: BFDv1, Control, State Up, Flags: [none], length: 24
 00:00:20.827317 eth1  In  IP 10.0.29.3.53522 > 10.0.29.2.3784: BFDv1, Control, State Up, Flags: [none], length: 24
 00:00:20.865630 eth1  Out IP 10.0.29.2.56421 > 10.0.29.3.3784: BFDv1, Control, State Up, Flags: [none], length: 24
 00:00:20.908904 eth1  In  IP 10.0.29.3.53522 > 10.0.29.2.3784: BFDv1, Control, State Up, Flags: [none], length: 24
 00:00:20.942209 eth1  Out IP 10.0.29.2.56421 > 10.0.29.3.3784: BFDv1, Control, State Up, Flags: [none], length: 24
 00:00:20.992550 eth1  In  IP 10.0.29.3.53522 > 10.0.29.2.3784: BFDv1, Control, State Up, Flags: [none], length: 24
 00:00:21.028876 eth1  Out IP 10.0.29.2.56421 > 10.0.29.3.3784: BFDv1, Control, State Up, Flags: [none], length: 24
 00:00:21.069146 eth1  In  IP 10.0.29.3.53522 > 10.0.29.2.3784: BFDv1, Control, State Up, Flags: [none], length: 24
 00:00:21.115372 eth1  Out IP 10.0.29.2.56421 > 10.0.29.3.3784: BFDv1, Control, State Up, Flags: [none], length: 24
 00:00:21.157705 eth1  In  IP 10.0.29.3.53522 > 10.0.29.2.3784: BFDv1, Control, State Up, Flags: [none], length: 24
 00:00:21.193053 eth1  Out IP 10.0.29.2.56421 > 10.0.29.3.3784: BFDv1, Control, State Up, Flags: [none], length: 24
 00:00:21.236336 eth1  In  IP 10.0.29.3.53522 > 10.0.29.2.3784: BFDv1, Control, State Up, Flags: [none], length: 24
 00:00:21.270586 eth1  Out IP 10.0.29.2.56421 > 10.0.29.3.3784: BFDv1, Control, State Up, Flags: [none], length: 24
 00:00:21.321972 eth1  In  IP 10.0.29.3.53522 > 10.0.29.2.3784: BFDv1, Control, State Up, Flags: [none], length: 24
 00:00:21.360456 eth1  Out IP 10.0.29.2.56421 > 10.0.29.3.3784: BFDv1, Control, State Up, Flags: [none], length: 24
 00:00:21.410465 eth1  In  IP 10.0.29.3.53522 > 10.0.29.2.3784: BFDv1, Control, State Up, Flags: [none], length: 24
 00:00:21.416457 eth2  Out IP 10.0.12.3.51192 > 10.0.12.2.179: Flags [P.], seq 173:192, ack 82, win 63, options [nop,nop,TS val 627332566 ecr 398172665], length 19: BGP
 00:00:21.416485 eth2  In  IP 10.0.12.2.179 > 10.0.12.3.51192: Flags [.], ack 192, win 64, options [nop,nop,TS val 398183922 ecr 627332566], length 0
 00:00:21.438694 eth1  Out IP 10.0.29.2.56421 > 10.0.29.3.3784: BFDv1, Control, State Up, Flags: [none], length: 24
 00:00:21.492907 eth1  In  IP 10.0.29.3.53522 > 10.0.29.2.3784: BFDv1, Control, State Up, Flags: [none], length: 24
 00:00:21.521177 eth1  Out IP 10.0.29.2.56421 > 10.0.29.3.3784: BFDv1, Control, State Up, Flags: [none], length: 24
 00:00:21.568347 eth1  In  IP 10.0.29.3.53522 > 10.0.29.2.3784: BFDv1, Control, State Up, Flags: [none], length: 24
 00:00:21.599603 eth1  Out IP 10.0.29.2.56421 > 10.0.29.3.3784: BFDv1, Control, State Up, Flags: [none], length: 24
 00:00:21.648849 eth1  In  IP 10.0.29.3.53522 > 10.0.29.2.3784: BFDv1, Control, State Up, Flags: [none], length: 24
 00:00:21.677123 eth1  Out IP 10.0.29.2.56421 > 10.0.29.3.3784: BFDv1, Control, State Up, Flags: [none], length: 24
 00:00:21.729300 eth1  In  IP 10.0.29.3.53522 > 10.0.29.2.3784: BFDv1, Control, State Up, Flags: [none], length: 24
 00:00:21.762534 eth1  Out IP 10.0.29.2.56421 > 10.0.29.3.3784: BFDv1, Control, State Up, Flags: [none], length: 24
 00:00:21.815855 eth1  In  IP 10.0.29.3.53522 > 10.0.29.2.3784: BFDv1, Control, State Up, Flags: [none], length: 24
 00:00:21.844130 eth1  Out IP 10.0.29.2.56421 > 10.0.29.3.3784: BFDv1, Control, State Up, Flags: [none], length: 24
 00:00:21.896323 eth1  In  IP 10.0.29.3.53522 > 10.0.29.2.3784: BFDv1, Control, State Up, Flags: [none], length: 24
 00:00:21.933605 eth1  Out IP 10.0.29.2.56421 > 10.0.29.3.3784: BFDv1, Control, State Up, Flags: [none], length: 24
 00:00:21.984443 eth1  In  IP 10.0.29.3.53522 > 10.0.29.2.3784: BFDv1, Control, State Up, Flags: [none], length: 24
 00:00:22.023760 eth1  Out IP 10.0.29.2.56421 > 10.0.29.3.3784: BFDv1, Control, State Up, Flags: [none], length: 24
 00:00:22.062467 eth1  In  IP 10.0.29.3.53522 > 10.0.29.2.3784: BFDv1, Control, State Up, Flags: [none], length: 24
 00:00:22.099826 eth1  Out IP 10.0.29.2.56421 > 10.0.29.3.3784: BFDv1, Control, State Up, Flags: [none], length: 24
 00:00:22.144080 eth1  In  IP 10.0.29.3.53522 > 10.0.29.2.3784: BFDv1, Control, State Up, Flags: [none], length: 24
 00:00:22.189380 eth1  Out IP 10.0.29.2.56421 > 10.0.29.3.3784: BFDv1, Control, State Up, Flags: [none], length: 24
 00:00:22.222536 eth1  In  IP 10.0.29.3.53522 > 10.0.29.2.3784: BFDv1, Control, State Up, Flags: [none], length: 24
 00:00:22.266835 eth1  Out IP 10.0.29.2.56421 > 10.0.29.3.3784: BFDv1, Control, State Up, Flags: [none], length: 24
 00:00:22.311202 eth1  In  IP 10.0.29.3.53522 > 10.0.29.2.3784: BFDv1, Control, State Up, Flags: [none], length: 24
 00:00:22.352500 eth1  Out IP 10.0.29.2.56421 > 10.0.29.3.3784: BFDv1, Control, State Up, Flags: [none], length: 24
 00:00:22.398150 eth1  In  IP 10.0.29.3.53522 > 10.0.29.2.3784: BFDv1, Control, State Up, Flags: [none], length: 24
 00:00:22.441433 eth1  Out IP 10.0.29.2.56421 > 10.0.29.3.3784: BFDv1, Control, State Up, Flags: [none], length: 24
 00:00:22.487003 eth1  In  IP 10.0.29.3.53522 > 10.0.29.2.3784: BFDv1, Control, State Up, Flags: [none], length: 24
 00:00:22.519286 eth1  Out IP 10.0.29.2.56421 > 10.0.29.3.3784: BFDv1, Control, State Up, Flags: [none], length: 24
 00:00:22.575290 eth1  In  IP 10.0.29.3.53522 > 10.0.29.2.3784: BFDv1, Control, State Up, Flags: [none], length: 24
 00:00:22.608591 eth1  Out IP 10.0.29.2.56421 > 10.0.29.3.3784: BFDv1, Control, State Up, Flags: [none], length: 24
 00:00:22.659533 eth1  In  IP 10.0.29.3.53522 > 10.0.29.2.3784: BFDv1, Control, State Up, Flags: [none], length: 24
 00:00:22.689833 eth1  Out IP 10.0.29.2.56421 > 10.0.29.3.3784: BFDv1, Control, State Up, Flags: [none], length: 24
 00:00:22.742409 eth1  In  IP 10.0.29.3.53522 > 10.0.29.2.3784: BFDv1, Control, State Up, Flags: [none], length: 24
 00:00:22.766696 eth1  Out IP 10.0.29.2.56421 > 10.0.29.3.3784: BFDv1, Control, State Up, Flags: [none], length: 24
 00:00:22.829318 eth1  In  IP 10.0.29.3.53522 > 10.0.29.2.3784: BFDv1, Control, State Up, Flags: [none], length: 24
 00:00:22.850752 eth1  Out IP 10.0.29.2.56421 > 10.0.29.3.3784: BFDv1, Control, State Up, Flags: [none], length: 24
 00:00:22.908290 eth1  In  IP 10.0.29.3.53522 > 10.0.29.2.3784: BFDv1, Control, State Up, Flags: [none], length: 24
 00:00:22.935635 eth1  Out IP 10.0.29.2.56421 > 10.0.29.3.3784: BFDv1, Control, State Up, Flags: [none], length: 24
 00:00:22.946844 eth1  Out IP 10.0.29.2.38225 > 10.0.29.3.179: Flags [S], seq 3913472260, win 64240, options [mss 1460,sackOK,TS val 1876976706 ecr 0,nop,wscale 10], length 0
 00:00:22.946916 eth1  In  IP 10.0.29.3.179 > 10.0.29.2.38225: Flags [S.], seq 65522258, ack 3913472261, win 65160, options [mss 1460,sackOK,TS val 3829731680 ecr 1876976706,nop,wscale 10], length 0
 00:00:22.946944 eth1  Out IP 10.0.29.2.38225 > 10.0.29.3.179: Flags [.], ack 1, win 63, options [nop,nop,TS val 1876976706 ecr 3829731680], length 0
 00:00:22.947053 eth1  In  IP 10.0.29.3.179 > 10.0.29.2.38225: Flags [F.], seq 1, ack 1, win 64, options [nop,nop,TS val 3829731680 ecr 1876976706], length 0
 00:00:22.947239 eth1  Out IP 10.0.29.2.38225 > 10.0.29.3.179: Flags [P.], seq 1:65, ack 2, win 63, options [nop,nop,TS val 1876976707 ecr 3829731680], length 64: BGP
 00:00:22.947276 eth1  In  IP 10.0.29.3.179 > 10.0.29.2.38225: Flags [R], seq 65522260, win 0, length 0
 00:00:22.990629 eth1  In  IP 10.0.29.3.53522 > 10.0.29.2.3784: BFDv1, Control, State Up, Flags: [none], length: 24
 00:00:23.011928 eth1  Out IP 10.0.29.2.56421 > 10.0.29.3.3784: BFDv1, Control, State Up, Flags: [none], length: 24
 00:00:23.067512 eth1  In  IP 10.0.29.3.53522 > 10.0.29.2.3784: BFDv1, Control, State Up, Flags: [none], length: 24
 00:00:23.099738 eth1  Out IP 10.0.29.2.56421 > 10.0.29.3.3784: BFDv1, Control, State Up, Flags: [none], length: 24
 00:00:23.154446 eth1  In  IP 10.0.29.3.53522 > 10.0.29.2.3784: BFDv1, Control, State Up, Flags: [none], length: 24
 00:00:23.177728 eth1  Out IP 10.0.29.2.56421 > 10.0.29.3.3784: BFDv1, Control, State Up, Flags: [none], length: 24
 00:00:23.233316 eth1  In  IP 10.0.29.3.53522 > 10.0.29.2.3784: BFDv1, Control, State Up, Flags: [none], length: 24
 00:00:23.264601 eth1  Out IP 10.0.29.2.56421 > 10.0.29.3.3784: BFDv1, Control, State Up, Flags: [none], length: 24
 00:00:23.318176 eth1  In  IP 10.0.29.3.53522 > 10.0.29.2.3784: BFDv1, Control, State Up, Flags: [none], length: 24
 00:00:23.348910 eth1  Out IP 10.0.29.2.56421 > 10.0.29.3.3784: BFDv1, Control, State Up, Flags: [none], length: 24
 00:00:23.400701 eth1  In  IP 10.0.29.3.53522 > 10.0.29.2.3784: BFDv1, Control, State Up, Flags: [none], length: 24
 00:00:23.427971 eth1  Out IP 10.0.29.2.56421 > 10.0.29.3.3784: BFDv1, Control, State Up, Flags: [none], length: 24
 00:00:23.489687 eth1  In  IP 10.0.29.3.53522 > 10.0.29.2.3784: BFDv1, Control, State Up, Flags: [none], length: 24
 00:00:23.502957 eth1  Out IP 10.0.29.2.56421 > 10.0.29.3.3784: BFDv1, Control, State Up, Flags: [none], length: 24
 00:00:23.565477 eth1  In  IP 10.0.29.3.53522 > 10.0.29.2.3784: BFDv1, Control, State Up, Flags: [none], length: 24
 00:00:23.586821 eth1  Out IP 10.0.29.2.56421 > 10.0.29.3.3784: BFDv1, Control, State Up, Flags: [none], length: 24
 00:00:23.643258 eth1  In  IP 10.0.29.3.53522 > 10.0.29.2.3784: BFDv1, Control, State Up, Flags: [none], length: 24
 00:00:23.668591 eth1  Out IP 10.0.29.2.56421 > 10.0.29.3.3784: BFDv1, Control, State Up, Flags: [none], length: 24
 00:00:23.725260 eth1  In  IP 10.0.29.3.53522 > 10.0.29.2.3784: BFDv1, Control, State Up, Flags: [none], length: 24
 00:00:23.752622 eth1  Out IP 10.0.29.2.56421 > 10.0.29.3.3784: BFDv1, Control, State Up, Flags: [none], length: 24
 00:00:23.808495 eth1  In  IP 10.0.29.3.53522 > 10.0.29.2.3784: BFDv1, Control, State Up, Flags: [none], length: 24
 00:00:23.828926 eth1  Out IP 10.0.29.2.56421 > 10.0.29.3.3784: BFDv1, Control, State Up, Flags: [none], length: 24
 00:00:23.885444 eth1  In  IP 10.0.29.3.53522 > 10.0.29.2.3784: BFDv1, Control, State Up, Flags: [none], length: 24
 00:00:23.912852 eth1  Out IP 10.0.29.2.56421 > 10.0.29.3.3784: BFDv1, Control, State Up, Flags: [none], length: 24
 00:00:23.962327 eth1  In  IP 10.0.29.3.53522 > 10.0.29.2.3784: BFDv1, Control, State Up, Flags: [none], length: 24
 00:00:23.998740 eth1  Out IP 10.0.29.2.56421 > 10.0.29.3.3784: BFDv1, Control, State Up, Flags: [none], length: 24
 00:00:24.038258 eth1  In  IP 10.0.29.3.53522 > 10.0.29.2.3784: BFDv1, Control, State Up, Flags: [none], length: 24
 00:00:24.085665 eth1  Out IP 10.0.29.2.56421 > 10.0.29.3.3784: BFDv1, Control, State Up, Flags: [none], length: 24
 00:00:24.124239 eth1  In  IP 10.0.29.3.53522 > 10.0.29.2.3784: BFDv1, Control, State Up, Flags: [none], length: 24
 00:00:24.161619 eth1  Out IP 10.0.29.2.56421 > 10.0.29.3.3784: BFDv1, Control, State Up, Flags: [none], length: 24
 00:00:24.203122 eth1  In  IP 10.0.29.3.53522 > 10.0.29.2.3784: BFDv1, Control, State Up, Flags: [none], length: 24
 00:00:24.246485 eth1  Out IP 10.0.29.2.56421 > 10.0.29.3.3784: BFDv1, Control, State Up, Flags: [none], length: 24
 00:00:24.288959 eth1  In  IP 10.0.29.3.53522 > 10.0.29.2.3784: BFDv1, Control, State Up, Flags: [none], length: 24
 00:00:24.333455 eth1  Out IP 10.0.29.2.56421 > 10.0.29.3.3784: BFDv1, Control, State Up, Flags: [none], length: 24
 00:00:24.373970 eth1  In  IP 10.0.29.3.53522 > 10.0.29.2.3784: BFDv1, Control, State Up, Flags: [none], length: 24
 00:00:24.409351 eth1  Out IP 10.0.29.2.56421 > 10.0.29.3.3784: BFDv1, Control, State Up, Flags: [none], length: 24
 00:00:24.461090 eth1  In  IP 10.0.29.3.53522 > 10.0.29.2.3784: BFDv1, Control, State Up, Flags: [none], length: 24
 00:00:24.494517 eth1  Out IP 10.0.29.2.56421 > 10.0.29.3.3784: BFDv1, Control, State Up, Flags: [none], length: 24
 00:00:24.543402 eth1  In  IP 10.0.29.3.53522 > 10.0.29.2.3784: BFDv1, Control, State Up, Flags: [none], length: 24
 00:00:24.582531 eth1  Out IP 10.0.29.2.56421 > 10.0.29.3.3784: BFDv1, Control, State Up, Flags: [none], length: 24
 00:00:24.628359 eth1  In  IP 10.0.29.3.53522 > 10.0.29.2.3784: BFDv1, Control, State Up, Flags: [none], length: 24
 00:00:24.670707 eth1  Out IP 10.0.29.2.56421 > 10.0.29.3.3784: BFDv1, Control, State Up, Flags: [none], length: 24
 00:00:24.712819 eth1  In  IP 10.0.29.3.53522 > 10.0.29.2.3784: BFDv1, Control, State Up, Flags: [none], length: 24
 00:00:24.754269 eth1  Out IP 10.0.29.2.56421 > 10.0.29.3.3784: BFDv1, Control, State Up, Flags: [none], length: 24
 00:00:24.794196 eth1  In  IP 10.0.29.3.53522 > 10.0.29.2.3784: BFDv1, Control, State Up, Flags: [none], length: 24
 00:00:24.829682 eth1  Out IP 10.0.29.2.56421 > 10.0.29.3.3784: BFDv1, Control, State Up, Flags: [none], length: 24
 00:00:24.880650 eth1  In  IP 10.0.29.3.53522 > 10.0.29.2.3784: BFDv1, Control, State Up, Flags: [none], length: 24
 00:00:24.917067 eth1  Out IP 10.0.29.2.56421 > 10.0.29.3.3784: BFDv1, Control, State Up, Flags: [none], length: 24
 00:00:24.963926 eth1  In  IP 10.0.29.3.53522 > 10.0.29.2.3784: BFDv1, Control, State Up, Flags: [none], length: 24
 00:00:25.005402 eth1  Out IP 10.0.29.2.56421 > 10.0.29.3.3784: BFDv1, Control, State Up, Flags: [none], length: 24
 00:00:25.048737 eth1  In  IP 10.0.29.3.53522 > 10.0.29.2.3784: BFDv1, Control, State Up, Flags: [none], length: 24
 00:00:25.083159 eth1  Out IP 10.0.29.2.56421 > 10.0.29.3.3784: BFDv1, Control, State Up, Flags: [none], length: 24
 00:00:25.131490 eth1  In  IP 10.0.29.3.53522 > 10.0.29.2.3784: BFDv1, Control, State Up, Flags: [none], length: 24
 00:00:25.163840 eth1  Out IP 10.0.29.2.56421 > 10.0.29.3.3784: BFDv1, Control, State Up, Flags: [none], length: 24
 00:00:25.209647 eth1  In  IP 10.0.29.3.53522 > 10.0.29.2.3784: BFDv1, Control, State Up, Flags: [none], length: 24
 00:00:25.247017 eth1  Out IP 10.0.29.2.56421 > 10.0.29.3.3784: BFDv1, Control, State Up, Flags: [none], length: 24
 00:00:25.289651 eth1  In  IP 10.0.29.3.53522 > 10.0.29.2.3784: BFDv1, Control, State Up, Flags: [none], length: 24
 00:00:25.327067 eth1  Out IP 10.0.29.2.56421 > 10.0.29.3.3784: BFDv1, Control, State Up, Flags: [none], length: 24
 00:00:25.373002 eth1  In  IP 10.0.29.3.53522 > 10.0.29.2.3784: BFDv1, Control, State Up, Flags: [none], length: 24
 00:00:25.410372 eth1  Out IP 10.0.29.2.56421 > 10.0.29.3.3784: BFDv1, Control, State Up, Flags: [none], length: 24
 00:00:25.456038 eth1  In  IP 10.0.29.3.53522 > 10.0.29.2.3784: BFDv1, Control, State Up, Flags: [none], length: 24
 00:00:25.493414 eth1  Out IP 10.0.29.2.56421 > 10.0.29.3.3784: BFDv1, Control, State Up, Flags: [none], length: 24
 00:00:25.534755 eth1  In  IP 10.0.29.3.53522 > 10.0.29.2.3784: BFDv1, Control, State Up, Flags: [none], length: 24
 00:00:25.574191 eth1  Out IP 10.0.29.2.56421 > 10.0.29.3.3784: BFDv1, Control, State Up, Flags: [none], length: 24
 00:00:25.613428 eth1  In  IP 10.0.29.3.53522 > 10.0.29.2.3784: BFDv1, Control, State Up, Flags: [none], length: 24
 00:00:25.653807 eth1  Out IP 10.0.29.2.56421 > 10.0.29.3.3784: BFDv1, Control, State Up, Flags: [none], length: 24
 00:00:25.697776 eth1  In  IP 10.0.29.3.53522 > 10.0.29.2.3784: BFDv1, Control, State Up, Flags: [none], length: 24
 00:00:25.740210 eth1  Out IP 10.0.29.2.56421 > 10.0.29.3.3784: BFDv1, Control, State Up, Flags: [none], length: 24
 00:00:25.787042 eth1  In  IP 10.0.29.3.53522 > 10.0.29.2.3784: BFDv1, Control, State Up, Flags: [none], length: 24
 00:00:25.818424 eth1  Out IP 10.0.29.2.56421 > 10.0.29.3.3784: BFDv1, Control, State Up, Flags: [none], length: 24
 00:00:25.868236 eth1  In  IP 10.0.29.3.53522 > 10.0.29.2.3784: BFDv1, Control, State Up, Flags: [none], length: 24
 00:00:25.906835 eth1  Out IP 10.0.29.2.56421 > 10.0.29.3.3784: BFDv1, Control, State Up, Flags: [none], length: 24
 00:00:25.957653 eth1  In  IP 10.0.29.3.53522 > 10.0.29.2.3784: BFDv1, Control, State Up, Flags: [none], length: 24
 00:00:25.997226 eth1  Out IP 10.0.29.2.56421 > 10.0.29.3.3784: BFDv1, Control, State Up, Flags: [none], length: 24
 00:00:26.036050 eth1  In  IP 10.0.29.3.53522 > 10.0.29.2.3784: BFDv1, Control, State Up, Flags: [none], length: 24
 00:00:26.074447 eth1  Out IP 10.0.29.2.56421 > 10.0.29.3.3784: BFDv1, Control, State Up, Flags: [none], length: 24
 00:00:26.120223 eth1  In  IP 10.0.29.3.53522 > 10.0.29.2.3784: BFDv1, Control, State Up, Flags: [none], length: 24
 00:00:26.156601 eth1  Out IP 10.0.29.2.56421 > 10.0.29.3.3784: BFDv1, Control, State Up, Flags: [none], length: 24
 00:00:26.210367 eth1  In  IP 10.0.29.3.53522 > 10.0.29.2.3784: BFDv1, Control, State Up, Flags: [none], length: 24
 00:00:26.238751 eth1  Out IP 10.0.29.2.56421 > 10.0.29.3.3784: BFDv1, Control, State Up, Flags: [none], length: 24
 00:00:26.287524 eth1  In  IP 10.0.29.3.53522 > 10.0.29.2.3784: BFDv1, Control, State Up, Flags: [none], length: 24
 00:00:26.324891 eth1  Out IP 10.0.29.2.56421 > 10.0.29.3.3784: BFDv1, Control, State Up, Flags: [none], length: 24
 00:00:26.365691 eth1  In  IP 10.0.29.3.53522 > 10.0.29.2.3784: BFDv1, Control, State Up, Flags: [none], length: 24
 00:00:26.408100 eth1  Out IP 10.0.29.2.56421 > 10.0.29.3.3784: BFDv1, Control, State Up, Flags: [none], length: 24
 00:00:26.445730 eth1  In  IP 10.0.29.3.53522 > 10.0.29.2.3784: BFDv1, Control, State Up, Flags: [none], length: 24
 00:00:26.484161 eth1  Out IP 10.0.29.2.56421 > 10.0.29.3.3784: BFDv1, Control, State Up, Flags: [none], length: 24
 00:00:26.523929 eth1  In  IP 10.0.29.3.53522 > 10.0.29.2.3784: BFDv1, Control, State Up, Flags: [none], length: 24
 00:00:26.565239 eth1  Out IP 10.0.29.2.56421 > 10.0.29.3.3784: BFDv1, Control, State Up, Flags: [none], length: 24
 00:00:26.609899 eth1  In  IP 10.0.29.3.53522 > 10.0.29.2.3784: BFDv1, Control, State Up, Flags: [none], length: 24
 00:00:26.645270 eth1  Out IP 10.0.29.2.56421 > 10.0.29.3.3784: BFDv1, Control, State Up, Flags: [none], length: 24
 00:00:26.693945 eth1  In  IP 10.0.29.3.53522 > 10.0.29.2.3784: BFDv1, Control, State Up, Flags: [none], length: 24
 00:00:26.722323 eth1  Out IP 10.0.29.2.56421 > 10.0.29.3.3784: BFDv1, Control, State Up, Flags: [none], length: 24
 00:00:26.778095 eth1  In  IP 10.0.29.3.53522 > 10.0.29.2.3784: BFDv1, Control, State Up, Flags: [none], length: 24
 00:00:26.798460 eth1  Out IP 10.0.29.2.56421 > 10.0.29.3.3784: BFDv1, Control, State Up, Flags: [none], length: 24
 00:00:26.860604 eth1  In  IP 10.0.29.3.53522 > 10.0.29.2.3784: BFDv1, Control, State Up, Flags: [none], length: 24
 00:00:26.874048 eth1  Out IP 10.0.29.2.56421 > 10.0.29.3.3784: BFDv1, Control, State Up, Flags: [none], length: 24
 00:00:26.946787 eth1  In  IP 10.0.29.3.53522 > 10.0.29.2.3784: BFDv1, Control, State Up, Flags: [none], length: 24
 00:00:26.953137 eth1  Out IP 10.0.29.2.56421 > 10.0.29.3.3784: BFDv1, Control, State Up, Flags: [none], length: 24
 00:00:27.032956 eth1  In  IP 10.0.29.3.53522 > 10.0.29.2.3784: BFDv1, Control, State Up, Flags: [none], length: 24
 00:00:27.039231 eth1  Out IP 10.0.29.2.56421 > 10.0.29.3.3784: BFDv1, Control, State Up, Flags: [none], length: 24
 00:00:27.109037 eth1  In  IP 10.0.29.3.53522 > 10.0.29.2.3784: BFDv1, Control, State Up, Flags: [none], length: 24
 00:00:27.127582 eth1  Out IP 10.0.29.2.56421 > 10.0.29.3.3784: BFDv1, Control, State Up, Flags: [none], length: 24
 00:00:27.190515 eth1  In  IP 10.0.29.3.53522 > 10.0.29.2.3784: BFDv1, Control, State Up, Flags: [none], length: 24
 00:00:27.203879 eth1  Out IP 10.0.29.2.56421 > 10.0.29.3.3784: BFDv1, Control, State Up, Flags: [none], length: 24
 00:00:27.266331 eth1  In  IP 10.0.29.3.53522 > 10.0.29.2.3784: BFDv1, Control, State Up, Flags: [none], length: 24
 00:00:27.282749 eth1  Out IP 10.0.29.2.56421 > 10.0.29.3.3784: BFDv1, Control, State Up, Flags: [none], length: 24
 00:00:27.348396 eth1  In  IP 10.0.29.3.53522 > 10.0.29.2.3784: BFDv1, Control, State Up, Flags: [none], length: 24
 00:00:27.370763 eth1  Out IP 10.0.29.2.56421 > 10.0.29.3.3784: BFDv1, Control, State Up, Flags: [none], length: 24
 00:00:27.426357 eth1  Out IP 10.0.29.2.53361 > 10.0.29.3.179: Flags [S], seq 2527682260, win 64240, options [mss 1460,sackOK,TS val 1876981186 ecr 0,nop,wscale 10], length 0
 00:00:27.426458 eth1  In  IP 10.0.29.3.179 > 10.0.29.2.53361: Flags [S.], seq 3261893487, ack 2527682261, win 65160, options [mss 1460,sackOK,TS val 3829736160 ecr 1876981186,nop,wscale 10], length 0
 00:00:27.426496 eth1  Out IP 10.0.29.2.53361 > 10.0.29.3.179: Flags [.], ack 1, win 63, options [nop,nop,TS val 1876981186 ecr 3829736160], length 0
 00:00:27.426651 eth1  Out IP 10.0.29.2.53361 > 10.0.29.3.179: Flags [P.], seq 1:65, ack 1, win 63, options [nop,nop,TS val 1876981186 ecr 3829736160], length 64: BGP
 00:00:27.426659 eth1  In  IP 10.0.29.3.179 > 10.0.29.2.53361: Flags [F.], seq 1, ack 1, win 64, options [nop,nop,TS val 3829736160 ecr 1876981186], length 0
 00:00:27.426734 eth1  In  IP 10.0.29.3.179 > 10.0.29.2.53361: Flags [R], seq 3261893488, win 0, length 0
 00:00:27.426742 eth1  Out IP 10.0.29.2.53361 > 10.0.29.3.179: Flags [F.], seq 65, ack 2, win 63, options [nop,nop,TS val 1876981186 ecr 3829736160], length 0
 00:00:27.426765 eth1  In  IP 10.0.29.3.179 > 10.0.29.2.53361: Flags [R], seq 3261893489, win 0, length 0
 00:00:27.431281 eth1  In  IP 10.0.29.3.53522 > 10.0.29.2.3784: BFDv1, Control, State Up, Flags: [none], length: 24
 00:00:27.459663 eth1  Out IP 10.0.29.2.56421 > 10.0.29.3.3784: BFDv1, Control, State Up, Flags: [none], length: 24
 00:00:27.518366 eth1  In  IP 10.0.29.3.53522 > 10.0.29.2.3784: BFDv1, Control, State Up, Flags: [none], length: 24
 00:00:27.543773 eth1  Out IP 10.0.29.2.56421 > 10.0.29.3.3784: BFDv1, Control, State Up, Flags: [none], length: 24
 00:00:27.607943 eth1  In  IP 10.0.29.3.53522 > 10.0.29.2.3784: BFDv1, Control, State Up, Flags: [none], length: 24
 00:00:27.625251 eth1  Out IP 10.0.29.2.56421 > 10.0.29.3.3784: BFDv1, Control, State Up, Flags: [none], length: 24
 00:00:27.687878 eth1  In  IP 10.0.29.3.53522 > 10.0.29.2.3784: BFDv1, Control, State Up, Flags: [none], length: 24
 00:00:27.712261 eth1  Out IP 10.0.29.2.56421 > 10.0.29.3.3784: BFDv1, Control, State Up, Flags: [none], length: 24
 00:00:27.769976 eth1  In  IP 10.0.29.3.53522 > 10.0.29.2.3784: BFDv1, Control, State Up, Flags: [none], length: 24
 00:00:27.790397 eth1  Out IP 10.0.29.2.56421 > 10.0.29.3.3784: BFDv1, Control, State Up, Flags: [none], length: 24
 00:00:27.857255 eth1  In  IP 10.0.29.3.53522 > 10.0.29.2.3784: BFDv1, Control, State Up, Flags: [none], length: 24
 00:00:27.877627 eth1  Out IP 10.0.29.2.56421 > 10.0.29.3.3784: BFDv1, Control, State Up, Flags: [none], length: 24
 00:00:27.938621 eth1  In  IP 10.0.29.3.53522 > 10.0.29.2.3784: BFDv1, Control, State Up, Flags: [none], length: 24
 00:00:27.953248 eth1  Out IP 10.0.29.2.56421 > 10.0.29.3.3784: BFDv1, Control, State Up, Flags: [none], length: 24
 00:00:28.019108 eth1  In  IP 10.0.29.3.53522 > 10.0.29.2.3784: BFDv1, Control, State Up, Flags: [none], length: 24
 00:00:28.042553 eth1  Out IP 10.0.29.2.56421 > 10.0.29.3.3784: BFDv1, Control, State Up, Flags: [none], length: 24
 00:00:28.097253 eth1  In  IP 10.0.29.3.53522 > 10.0.29.2.3784: BFDv1, Control, State Up, Flags: [none], length: 24
 00:00:28.117679 eth1  Out IP 10.0.29.2.56421 > 10.0.29.3.3784: BFDv1, Control, State Up, Flags: [none], length: 24
 00:00:28.184538 eth1  In  IP 10.0.29.3.53522 > 10.0.29.2.3784: BFDv1, Control, State Up, Flags: [none], length: 24
 00:00:28.206900 eth1  Out IP 10.0.29.2.56421 > 10.0.29.3.3784: BFDv1, Control, State Up, Flags: [none], length: 24
 00:00:28.270710 eth1  In  IP 10.0.29.3.53522 > 10.0.29.2.3784: BFDv1, Control, State Up, Flags: [none], length: 24
 00:00:28.295173 eth1  Out IP 10.0.29.2.56421 > 10.0.29.3.3784: BFDv1, Control, State Up, Flags: [none], length: 24
 00:00:28.357985 eth1  In  IP 10.0.29.3.53522 > 10.0.29.2.3784: BFDv1, Control, State Up, Flags: [none], length: 24
 00:00:28.372352 eth1  Out IP 10.0.29.2.56421 > 10.0.29.3.3784: BFDv1, Control, State Up, Flags: [none], length: 24
 00:00:28.441046 eth1  In  IP 10.0.29.3.53522 > 10.0.29.2.3784: BFDv1, Control, State Up, Flags: [none], length: 24
 00:00:28.454743 eth1  Out IP 10.0.29.2.56421 > 10.0.29.3.3784: BFDv1, Control, State Up, Flags: [none], length: 24
 00:00:28.529649 eth1  In  IP 10.0.29.3.53522 > 10.0.29.2.3784: BFDv1, Control, State Up, Flags: [none], length: 24
 00:00:28.534133 eth1  Out IP 10.0.29.2.56421 > 10.0.29.3.3784: BFDv1, Control, State Up, Flags: [none], length: 24
 00:00:28.616909 eth1  In  IP 10.0.29.3.53522 > 10.0.29.2.3784: BFDv1, Control, State Up, Flags: [none], length: 24
 00:00:28.622355 eth1  Out IP 10.0.29.2.56421 > 10.0.29.3.3784: BFDv1, Control, State Up, Flags: [none], length: 24
 00:00:28.695298 eth1  In  IP 10.0.29.3.53522 > 10.0.29.2.3784: BFDv1, Control, State Up, Flags: [none], length: 24
 00:00:28.711659 eth1  Out IP 10.0.29.2.56421 > 10.0.29.3.3784: BFDv1, Control, State Up, Flags: [none], length: 24
 00:00:28.780605 eth1  In  IP 10.0.29.3.53522 > 10.0.29.2.3784: BFDv1, Control, State Up, Flags: [none], length: 24
 00:00:28.793146 eth1  Out IP 10.0.29.2.56421 > 10.0.29.3.3784: BFDv1, Control, State Up, Flags: [none], length: 24
 00:00:28.857166 eth1  In  IP 10.0.29.3.53522 > 10.0.29.2.3784: BFDv1, Control, State Up, Flags: [none], length: 24
 00:00:28.871525 eth1  Out IP 10.0.29.2.56421 > 10.0.29.3.3784: BFDv1, Control, State Up, Flags: [none], length: 24
 00:00:28.946533 eth1  In  IP 10.0.29.3.53522 > 10.0.29.2.3784: BFDv1, Control, State Up, Flags: [none], length: 24
 00:00:28.949867 eth1  Out IP 10.0.29.2.56421 > 10.0.29.3.3784: BFDv1, Control, State Up, Flags: [none], length: 24
 00:00:29.034151 eth1  Out IP 10.0.29.2.56421 > 10.0.29.3.3784: BFDv1, Control, State Up, Flags: [none], length: 24
 00:00:29.034280 eth1  In  IP 10.0.29.3.53522 > 10.0.29.2.3784: BFDv1, Control, State Up, Flags: [none], length: 24
 00:00:29.110005 eth1  In  IP 10.0.29.3.53522 > 10.0.29.2.3784: BFDv1, Control, State Up, Flags: [none], length: 24
 00:00:29.113445 eth1  Out IP 10.0.29.2.56421 > 10.0.29.3.3784: BFDv1, Control, State Up, Flags: [none], length: 24
 00:00:29.191716 eth1  Out IP 10.0.29.2.56421 > 10.0.29.3.3784: BFDv1, Control, State Up, Flags: [none], length: 24
 00:00:29.193901 eth1  In  IP 10.0.29.3.53522 > 10.0.29.2.3784: BFDv1, Control, State Up, Flags: [none], length: 24
 00:00:29.269890 eth1  In  IP 10.0.29.3.53522 > 10.0.29.2.3784: BFDv1, Control, State Up, Flags: [none], length: 24
 00:00:29.279398 eth1  Out IP 10.0.29.2.56421 > 10.0.29.3.3784: BFDv1, Control, State Up, Flags: [none], length: 24
 00:00:29.350446 eth1  In  IP 10.0.29.3.53522 > 10.0.29.2.3784: BFDv1, Control, State Up, Flags: [none], length: 24
 00:00:29.354797 eth1  Out IP 10.0.29.2.56421 > 10.0.29.3.3784: BFDv1, Control, State Up, Flags: [none], length: 24
 00:00:29.431074 eth1  Out IP 10.0.29.2.56421 > 10.0.29.3.3784: BFDv1, Control, State Up, Flags: [none], length: 24
 00:00:29.435346 eth1  In  IP 10.0.29.3.53522 > 10.0.29.2.3784: BFDv1, Control, State Up, Flags: [none], length: 24
 00:00:29.517175 eth1  In  IP 10.0.29.3.53522 > 10.0.29.2.3784: BFDv1, Control, State Up, Flags: [none], length: 24
 00:00:29.519489 eth1  Out IP 10.0.29.2.56421 > 10.0.29.3.3784: BFDv1, Control, State Up, Flags: [none], length: 24
 00:00:29.598789 eth1  Out IP 10.0.29.2.56421 > 10.0.29.3.3784: BFDv1, Control, State Up, Flags: [none], length: 24
 00:00:29.600106 eth1  In  IP 10.0.29.3.53522 > 10.0.29.2.3784: BFDv1, Control, State Up, Flags: [none], length: 24
 00:00:29.678824 eth1  In  IP 10.0.29.3.53522 > 10.0.29.2.3784: BFDv1, Control, State Up, Flags: [none], length: 24
 00:00:29.688203 eth1  Out IP 10.0.29.2.56421 > 10.0.29.3.3784: BFDv1, Control, State Up, Flags: [none], length: 24
 00:00:29.760836 eth1  In  IP 10.0.29.3.53522 > 10.0.29.2.3784: BFDv1, Control, State Up, Flags: [none], length: 24
 00:00:29.775195 eth1  Out IP 10.0.29.2.56421 > 10.0.29.3.3784: BFDv1, Control, State Up, Flags: [none], length: 24
 00:00:29.846053 eth1  In  IP 10.0.29.3.53522 > 10.0.29.2.3784: BFDv1, Control, State Up, Flags: [none], length: 24
 00:00:29.856553 eth1  Out IP 10.0.29.2.56421 > 10.0.29.3.3784: BFDv1, Control, State Up, Flags: [none], length: 24
 00:00:29.926245 eth1  In  IP 10.0.29.3.53522 > 10.0.29.2.3784: BFDv1, Control, State Up, Flags: [none], length: 24
 00:00:29.932678 eth1  Out IP 10.0.29.2.56421 > 10.0.29.3.3784: BFDv1, Control, State Up, Flags: [none], length: 24
 00:00:30.007959 eth1  Out IP 10.0.29.2.56421 > 10.0.29.3.3784: BFDv1, Control, State Up, Flags: [none], length: 24
 00:00:30.011211 eth1  In  IP 10.0.29.3.53522 > 10.0.29.2.3784: BFDv1, Control, State Up, Flags: [none], length: 24
 00:00:30.083560 eth1  Out IP 10.0.29.2.56421 > 10.0.29.3.3784: BFDv1, Control, State Up, Flags: [none], length: 24
 00:00:30.098754 eth1  In  IP 10.0.29.3.53522 > 10.0.29.2.3784: BFDv1, Control, State Up, Flags: [none], length: 24
 00:00:30.166077 eth1  Out IP 10.0.29.2.56421 > 10.0.29.3.3784: BFDv1, Control, State Up, Flags: [none], length: 24
 00:00:30.182334 eth1  In  IP 10.0.29.3.53522 > 10.0.29.2.3784: BFDv1, Control, State Up, Flags: [none], length: 24

580 packets captured
582 packets received by filter
0 packets dropped by kernel
