tcpdump: data link type LINUX_SLL2
tcpdump: verbose output suppressed, use -v[v]... for full protocol decode
listening on any, link-type LINUX_SLL2 (Linux cooked v2), snapshot length 262144 bytes
 00:00:00.000000 eth2  Out IP 10.0.34.2.54773 > 10.0.34.3.3784: BFDv1, Control, State Up, Flags: [none], length: 24
 00:00:00.009790 eth1  In  IP 10.0.23.2.57325 > 10.0.23.3.3784: BFDv1, Control, State Up, Flags: [none], length: 24
 00:00:00.017707 eth0  In  IP 10.0.13.2.57029 > 10.0.13.3.3784: BFDv1, Control, State Up, Flags: [none], length: 24
 00:00:00.027635 eth2  In  IP 10.0.34.3.40444 > 10.0.34.2.3784: BFDv1, Control, State Up, Flags: [none], length: 24
 00:00:00.039365 eth1  Out IP 10.0.23.3.33242 > 10.0.23.2.3784: BFDv1, Control, State Up, Flags: [none], length: 24
 00:00:00.041479 eth3  In  IP 10.0.35.3.46520 > 10.0.35.2.3784: BFDv1, Control, State Up, Flags: [none], length: 24
 00:00:00.055046 eth3  Out IP 10.0.35.2.60297 > 10.0.35.3.3784: BFDv1, Control, State Up, Flags: [none], length: 24
 00:00:00.055137 eth0  Out IP 10.0.13.3.41618 > 10.0.13.2.3784: BFDv1, Control, State Up, Flags: [none], length: 24
 00:00:00.079708 eth2  Out IP 10.0.34.2.54773 > 10.0.34.3.3784: BFDv1, Control, State Up, Flags: [none], length: 24
 00:00:00.095071 eth1  In  IP 10.0.23.2.57325 > 10.0.23.3.3784: BFDv1, Control, State Up, Flags: [none], length: 24
 00:00:00.105023 eth0  In  IP 10.0.13.2.57029 > 10.0.13.3.3784: BFDv1, Control, State Up, Flags: [none], length: 24
 00:00:00.106502 eth2  In  IP 10.0.34.3.40444 > 10.0.34.2.3784: BFDv1, Control, State Up, Flags: [none], length: 24
 00:00:00.126810 eth1  Out IP 10.0.23.3.33242 > 10.0.23.2.3784: BFDv1, Control, State Up, Flags: [none], length: 24
 00:00:00.128885 eth3  In  IP 10.0.35.3.46520 > 10.0.35.2.3784: BFDv1, Control, State Up, Flags: [none], length: 24
 00:00:00.134236 eth3  Out IP 10.0.35.2.60297 > 10.0.35.3.3784: BFDv1, Control, State Up, Flags: [none], length: 24
 00:00:00.134315 eth0  Out IP 10.0.13.3.41618 > 10.0.13.2.3784: BFDv1, Control, State Up, Flags: [none], length: 24
 00:00:00.166612 eth2  Out IP 10.0.34.2.54773 > 10.0.34.3.3784: BFDv1, Control, State Up, Flags: [none], length: 24
 00:00:00.180174 eth1  In  IP 10.0.23.2.57325 > 10.0.23.3.3784: BFDv1, Control, State Up, Flags: [none], length: 24
 00:00:00.190818 eth0  In  IP 10.0.13.2.57029 > 10.0.13.3.3784: BFDv1, Control, State Up, Flags: [none], length: 24
 00:00:00.190882 eth2  In  IP 10.0.34.3.40444 > 10.0.34.2.3784: BFDv1, Control, State Up, Flags: [none], length: 24
 00:00:00.204998 eth3  In  IP 10.0.35.3.46520 > 10.0.35.2.3784: BFDv1, Control, State Up, Flags: [none], length: 24
 00:00:00.208358 eth1  Out IP 10.0.23.3.33242 > 10.0.23.2.3784: BFDv1, Control, State Up, Flags: [none], length: 24
 00:00:00.209571 eth0  Out IP 10.0.13.3.41618 > 10.0.13.2.3784: BFDv1, Control, State Up, Flags: [none], length: 24
 00:00:00.216831 eth3  Out IP 10.0.35.2.60297 > 10.0.35.3.3784: BFDv1, Control, State Up, Flags: [none], length: 24
 00:00:00.249303 eth2  Out IP 10.0.34.2.54773 > 10.0.34.3.3784: BFDv1, Control, State Up, Flags: [none], length: 24
 00:00:00.261225 eth1  In  IP 10.0.23.2.57325 > 10.0.23.3.3784: BFDv1, Control, State Up, Flags: [none], length: 24
 00:00:00.267370 eth0  In  IP 10.0.13.2.57029 > 10.0.13.3.3784: BFDv1, Control, State Up, Flags: [none], length: 24
 00:00:00.267828 eth2  In  IP 10.0.34.3.40444 > 10.0.34.2.3784: BFDv1, Control, State Up, Flags: [none], length: 24
 00:00:00.285518 eth3  In  IP 10.0.35.3.46520 > 10.0.35.2.3784: BFDv1, Control, State Up, Flags: [none], length: 24
 00:00:00.287870 eth1  Out IP 10.0.23.3.33242 > 10.0.23.2.3784: BFDv1, Control, State Up, Flags: [none], length: 24
 00:00:00.290112 eth0  Out IP 10.0.13.3.41618 > 10.0.13.2.3784: BFDv1, Control, State Up, Flags: [none], length: 24
 00:00:00.303386 eth3  Out IP 10.0.35.2.60297 > 10.0.35.3.3784: BFDv1, Control, State Up, Flags: [none], length: 24
 00:00:00.337122 eth2  Out IP 10.0.34.2.54773 > 10.0.34.3.3784: BFDv1, Control, State Up, Flags: [none], length: 24
 00:00:00.343559 eth1  In  IP 10.0.23.2.57325 > 10.0.23.3.3784: BFDv1, Control, State Up, Flags: [none], length: 24
 00:00:00.345530 eth0  In  IP 10.0.13.2.57029 > 10.0.13.3.3784: BFDv1, Control, State Up, Flags: [none], length: 24
 00:00:00.352736 eth2  In  IP 10.0.34.3.40444 > 10.0.34.2.3784: BFDv1, Control, State Up, Flags: [none], length: 24
 00:00:00.363129 eth3  In  IP 10.0.35.3.46520 > 10.0.35.2.3784: BFDv1, Control, State Up, Flags: [none], length: 24
 00:00:00.369470 eth0  Out IP 10.0.13.3.41618 > 10.0.13.2.3784: BFDv1, Control, State Up, Flags: [none], length: 24
 00:00:00.376700 eth1  Out IP 10.0.23.3.33242 > 10.0.23.2.3784: BFDv1, Control, State Up, Flags: [none], length: 24
 00:00:00.380881 eth3  Out IP 10.0.35.2.60297 > 10.0.35.3.3784: BFDv1, Control, State Up, Flags: [none], length: 24
 00:00:00.418116 eth2  Out IP 10.0.34.2.54773 > 10.0.34.3.3784: BFDv1, Control, State Up, Flags: [none], length: 24
 00:00:00.429830 eth0  In  IP 10.0.13.2.57029 > 10.0.13.3.3784: BFDv1, Control, State Up, Flags: [none], length: 24
 00:00:00.430298 eth2  In  IP 10.0.34.3.40444 > 10.0.34.2.3784: BFDv1, Control, State Up, Flags: [none], length: 24
 00:00:00.432323 eth1  In  IP 10.0.23.2.57325 > 10.0.23.3.3784: BFDv1, Control, State Up, Flags: [none], length: 24
 00:00:00.441563 eth3  In  IP 10.0.35.3.46520 > 10.0.35.2.3784: BFDv1, Control, State Up, Flags: [none], length: 24
 00:00:00.455890 eth3  Out IP 10.0.35.2.60297 > 10.0.35.3.3784: BFDv1, Control, State Up, Flags: [none], length: 24
 00:00:00.457215 eth0  Out IP 10.0.13.3.41618 > 10.0.13.2.3784: BFDv1, Control, State Up, Flags: [none], length: 24
 00:00:00.459423 eth1  Out IP 10.0.23.3.33242 > 10.0.23.2.3784: BFDv1, Control, State Up, Flags: [none], length: 24
 00:00:00.500648 eth2  Out IP 10.0.34.2.54773 > 10.0.34.3.3784: BFDv1, Control, State Up, Flags: [none], length: 24
 00:00:00.511947 eth1  In  IP 10.0.23.2.57325 > 10.0.23.3.3784: BFDv1, Control, State Up, Flags: [none], length: 24
 00:00:00.512603 eth0  In  IP 10.0.13.2.57029 > 10.0.13.3.3784: BFDv1, Control, State Up, Flags: [none], length: 24
 00:00:00.516881 eth2  In  IP 10.0.34.3.40444 > 10.0.34.2.3784: BFDv1, Control, State Up, Flags: [none], length: 24
 00:00:00.529846 eth3  In  IP 10.0.35.3.46520 > 10.0.35.2.3784: BFDv1, Control, State Up, Flags: [none], length: 24
 00:00:00.537311 eth0  Out IP 10.0.13.3.41618 > 10.0.13.2.3784: BFDv1, Control, State Up, Flags: [none], length: 24
 00:00:00.543523 eth1  Out IP 10.0.23.3.33242 > 10.0.23.2.3784: BFDv1, Control, State Up, Flags: [none], length: 24
 00:00:00.543596 eth3  Out IP 10.0.35.2.60297 > 10.0.35.3.3784: BFDv1, Control, State Up, Flags: [none], length: 24
 00:00:00.586879 eth2  Out IP 10.0.34.2.54773 > 10.0.34.3.3784: BFDv1, Control, State Up, Flags: [none], length: 24
 00:00:00.587476 eth0  In  IP 10.0.13.2.57029 > 10.0.13.3.3784: BFDv1, Control, State Up, Flags: [none], length: 24
 00:00:00.599238 eth2  In  IP 10.0.34.3.40444 > 10.0.34.2.3784: BFDv1, Control, State Up, Flags: [none], length: 24
 00:00:00.599881 eth1  In  IP 10.0.23.2.57325 > 10.0.23.3.3784: BFDv1, Control, State Up, Flags: [none], length: 24
 00:00:00.615492 eth3  In  IP 10.0.35.3.46520 > 10.0.35.2.3784: BFDv1, Control, State Up, Flags: [none], length: 24
 00:00:00.615710 eth0  Out IP 10.0.13.3.41618 > 10.0.13.2.3784: BFDv1, Control, State Up, Flags: [none], length: 24
 00:00:00.623975 eth3  Out IP 10.0.35.2.60297 > 10.0.35.3.3784: BFDv1, Control, State Up, Flags: [none], length: 24
 00:00:00.629214 eth1  Out IP 10.0.23.3.33242 > 10.0.23.2.3784: BFDv1, Control, State Up, Flags: [none], length: 24
 00:00:00.666669 eth0  In  IP 10.0.13.2.57029 > 10.0.13.3.3784: BFDv1, Control, State Up, Flags: [none], length: 24
 00:00:00.671029 eth2  Out IP 10.0.34.2.54773 > 10.0.34.3.3784: BFDv1, Control, State Up, Flags: [none], length: 24
 00:00:00.685820 eth1  In  IP 10.0.23.2.57325 > 10.0.23.3.3784: BFDv1, Control, State Up, Flags: [none], length: 24
 00:00:00.685820 eth2  In  IP 10.0.34.3.40444 > 10.0.34.2.3784: BFDv1, Control, State Up, Flags: [none], length: 24
 00:00:00.701370 eth0  Out IP 10.0.13.3.41618 > 10.0.13.2.3784: BFDv1, Control, State Up, Flags: [none], length: 24
 00:00:00.702989 eth3  In  IP 10.0.35.3.46520 > 10.0.35.2.3784: BFDv1, Control, State Up, Flags: [none], length: 24
 00:00:00.705254 eth3  Out IP 10.0.35.2.60297 > 10.0.35.3.3784: BFDv1, Control, State Up, Flags: [none], length: 24
 00:00:00.718487 eth1  Out IP 10.0.23.3.33242 > 10.0.23.2.3784: BFDv1, Control, State Up, Flags: [none], length: 24
 00:00:00.748322 eth0  In  IP 10.0.13.2.57029 > 10.0.13.3.3784: BFDv1, Control, State Up, Flags: [none], length: 24
 00:00:00.753691 eth2  Out IP 10.0.34.2.54773 > 10.0.34.3.3784: BFDv1, Control, State Up, Flags: [none], length: 24
 00:00:00.771906 eth1  In  IP 10.0.23.2.57325 > 10.0.23.3.3784: BFDv1, Control, State Up, Flags: [none], length: 24
 00:00:00.773379 eth2  In  IP 10.0.34.3.40444 > 10.0.34.2.3784: BFDv1, Control, State Up, Flags: [none], length: 24
 00:00:00.782732 eth3  Out IP 10.0.35.2.60297 > 10.0.35.3.3784: BFDv1, Control, State Up, Flags: [none], length: 24
 00:00:00.784997 eth0  Out IP 10.0.13.3.41618 > 10.0.13.2.3784: BFDv1, Control, State Up, Flags: [none], length: 24
 00:00:00.786996 eth3  In  IP 10.0.35.3.46520 > 10.0.35.2.3784: BFDv1, Control, State Up, Flags: [none], length: 24
 00:00:00.797311 eth1  Out IP 10.0.23.3.33242 > 10.0.23.2.3784: BFDv1, Control, State Up, Flags: [none], length: 24
 00:00:00.829350 eth0  In  IP 10.0.13.2.57029 > 10.0.13.3.3784: BFDv1, Control, State Up, Flags: [none], length: 24
 00:00:00.829580 eth2  Out IP 10.0.34.2.54773 > 10.0.34.3.3784: BFDv1, Control, State Up, Flags: [none], length: 24
 00:00:00.855949 eth1  In  IP 10.0.23.2.57325 > 10.0.23.3.3784: BFDv1, Control, State Up, Flags: [none], length: 24
 00:00:00.858875 eth2  In  IP 10.0.34.3.40444 > 10.0.34.2.3784: BFDv1, Control, State Up, Flags: [none], length: 24
 00:00:00.865210 eth0  Out IP 10.0.13.3.41618 > 10.0.13.2.3784: BFDv1, Control, State Up, Flags: [none], length: 24
 00:00:00.867463 eth3  Out IP 10.0.35.2.60297 > 10.0.35.3.3784: BFDv1, Control, State Up, Flags: [none], length: 24
 00:00:00.872712 eth3  In  IP 10.0.35.3.46520 > 10.0.35.2.3784: BFDv1, Control, State Up, Flags: [none], length: 24
 00:00:00.880111 eth1  Out IP 10.0.23.3.33242 > 10.0.23.2.3784: BFDv1, Control, State Up, Flags: [none], length: 24
 00:00:00.905390 eth2  Out IP 10.0.34.2.54773 > 10.0.34.3.3784: BFDv1, Control, State Up, Flags: [none], length: 24
 00:00:00.906693 eth0  In  IP 10.0.13.2.57029 > 10.0.13.3.3784: BFDv1, Control, State Up, Flags: [none], length: 24
 00:00:00.939308 eth1  In  IP 10.0.23.2.57325 > 10.0.23.3.3784: BFDv1, Control, State Up, Flags: [none], length: 24
 00:00:00.941988 eth2  In  IP 10.0.34.3.40444 > 10.0.34.2.3784: BFDv1, Control, State Up, Flags: [none], length: 24
 00:00:00.946608 eth3  Out IP 10.0.35.2.60297 > 10.0.35.3.3784: BFDv1, Control, State Up, Flags: [none], length: 24
 00:00:00.949925 eth3  In  IP 10.0.35.3.46520 > 10.0.35.2.3784: BFDv1, Control, State Up, Flags: [none], length: 24
 00:00:00.950369 eth0  Out IP 10.0.13.3.41618 > 10.0.13.2.3784: BFDv1, Control, State Up, Flags: [none], length: 24
 00:00:00.968660 eth1  Out IP 10.0.23.3.33242 > 10.0.23.2.3784: BFDv1, Control, State Up, Flags: [none], length: 24
 00:00:00.987901 eth2  Out IP 10.0.34.2.54773 > 10.0.34.3.3784: BFDv1, Control, State Up, Flags: [none], length: 24
 00:00:00.994443 eth0  In  IP 10.0.13.2.57029 > 10.0.13.3.3784: BFDv1, Control, State Up, Flags: [none], length: 24
 00:00:01.024848 eth1  In  IP 10.0.23.2.57325 > 10.0.23.3.3784: BFDv1, Control, State Up, Flags: [none], length: 24
 00:00:01.025891 eth3  In  IP 10.0.35.3.46520 > 10.0.35.2.3784: BFDv1, Control, State Up, Flags: [none], length: 24
 00:00:01.026071 eth0  Out IP 10.0.13.3.41618 > 10.0.13.2.3784: BFDv1, Control, State Up, Flags: [none], length: 24
 00:00:01.029266 eth3  Out IP 10.0.35.2.60297 > 10.0.35.3.3784: BFDv1, Control, State Up, Flags: [none], length: 24
 00:00:01.030700 eth2  In  IP 10.0.34.3.40444 > 10.0.34.2.3784: BFDv1, Control, State Up, Flags: [none], length: 24
 00:00:01.057966 eth1  Out IP 10.0.23.3.33242 > 10.0.23.2.3784: BFDv1, Control, State Up, Flags: [none], length: 24
 00:00:01.068228 eth2  Out IP 10.0.34.2.54773 > 10.0.34.3.3784: BFDv1, Control, State Up, Flags: [none], length: 24
 00:00:01.082801 eth0  In  IP 10.0.13.2.57029 > 10.0.13.3.3784: BFDv1, Control, State Up, Flags: [none], length: 24
 00:00:01.099454 eth1  In  IP 10.0.23.2.57325 > 10.0.23.3.3784: BFDv1, Control, State Up, Flags: [none], length: 24
 00:00:01.108831 eth0  Out IP 10.0.13.3.41618 > 10.0.13.2.3784: BFDv1, Control, State Up, Flags: [none], length: 24
 00:00:01.113281 eth3  In  IP 10.0.35.3.46520 > 10.0.35.2.3784: BFDv1, Control, State Up, Flags: [none], length: 24
 00:00:01.116217 eth2  In  IP 10.0.34.3.40444 > 10.0.34.2.3784: BFDv1, Control, State Up, Flags: [none], length: 24
 00:00:01.118561 eth3  Out IP 10.0.35.2.60297 > 10.0.35.3.3784: BFDv1, Control, State Up, Flags: [none], length: 24
 00:00:01.144838 eth1  Out IP 10.0.23.3.33242 > 10.0.23.2.3784: BFDv1, Control, State Up, Flags: [none], length: 24
 00:00:01.149155 eth2  Out IP 10.0.34.2.54773 > 10.0.34.3.3784: BFDv1, Control, State Up, Flags: [none], length: 24
 00:00:01.158716 eth0  In  IP 10.0.13.2.57029 > 10.0.13.3.3784: BFDv1, Control, State Up, Flags: [none], length: 24
 00:00:01.174964 eth1  In  IP 10.0.23.2.57325 > 10.0.23.3.3784: BFDv1, Control, State Up, Flags: [none], length: 24
 00:00:01.188356 eth0  Out IP 10.0.13.3.41618 > 10.0.13.2.3784: BFDv1, Control, State Up, Flags: [none], length: 24
 00:00:01.199779 eth3  Out IP 10.0.35.2.60297 > 10.0.35.3.3784: BFDv1, Control, State Up, Flags: [none], length: 24
 00:00:01.201222 eth3  In  IP 10.0.35.3.46520 > 10.0.35.2.3784: BFDv1, Control, State Up, Flags: [none], length: 24
 00:00:01.202759 eth2  In  IP 10.0.34.3.40444 > 10.0.34.2.3784: BFDv1, Control, State Up, Flags: [none], length: 24
 00:00:01.221438 eth1  Out IP 10.0.23.3.33242 > 10.0.23.2.3784: BFDv1, Control, State Up, Flags: [none], length: 24
 00:00:01.230713 eth2  Out IP 10.0.34.2.54773 > 10.0.34.3.3784: BFDv1, Control, State Up, Flags: [none], length: 24
 00:00:01.246721 eth0  In  IP 10.0.13.2.57029 > 10.0.13.3.3784: BFDv1, Control, State Up, Flags: [none], length: 24
 00:00:01.258583 eth1  In  IP 10.0.23.2.57325 > 10.0.23.3.3784: BFDv1, Control, State Up, Flags: [none], length: 24
 00:00:01.264175 eth0  Out IP 10.0.13.3.41618 > 10.0.13.2.3784: BFDv1, Control, State Up, Flags: [none], length: 24
 00:00:01.280411 eth3  Out IP 10.0.35.2.60297 > 10.0.35.3.3784: BFDv1, Control, State Up, Flags: [none], length: 24
 00:00:01.286646 eth2  In  IP 10.0.34.3.40444 > 10.0.34.2.3784: BFDv1, Control, State Up, Flags: [none], length: 24
 00:00:01.290642 eth3  In  IP 10.0.35.3.46520 > 10.0.35.2.3784: BFDv1, Control, State Up, Flags: [none], length: 24
 00:00:01.298001 eth1  Out IP 10.0.23.3.33242 > 10.0.23.2.3784: BFDv1, Control, State Up, Flags: [none], length: 24
 00:00:01.317255 eth2  Out IP 10.0.34.2.54773 > 10.0.34.3.3784: BFDv1, Control, State Up, Flags: [none], length: 24
 00:00:01.328130 eth0  In  IP 10.0.13.2.57029 > 10.0.13.3.3784: BFDv1, Control, State Up, Flags: [none], length: 24
 00:00:01.337750 eth1  In  IP 10.0.23.2.57325 > 10.0.23.3.3784: BFDv1, Control, State Up, Flags: [none], length: 24
 00:00:01.350178 eth0  Out IP 10.0.13.3.41618 > 10.0.13.2.3784: BFDv1, Control, State Up, Flags: [none], length: 24
 00:00:01.356380 eth3  Out IP 10.0.35.2.60297 > 10.0.35.3.3784: BFDv1, Control, State Up, Flags: [none], length: 24
 00:00:01.369136 eth2  In  IP 10.0.34.3.40444 > 10.0.34.2.3784: BFDv1, Control, State Up, Flags: [none], length: 24
 00:00:01.369266 eth3  In  IP 10.0.35.3.46520 > 10.0.35.2.3784: BFDv1, Control, State Up, Flags: [none], length: 24
 00:00:01.376556 eth1  Out IP 10.0.23.3.33242 > 10.0.23.2.3784: BFDv1, Control, State Up, Flags: [none], length: 24
 00:00:01.397796 eth2  Out IP 10.0.34.2.54773 > 10.0.34.3.3784: BFDv1, Control, State Up, Flags: [none], length: 24
 00:00:01.415348 eth0  In  IP 10.0.13.2.57029 > 10.0.13.3.3784: BFDv1, Control, State Up, Flags: [none], length: 24
 00:00:01.421424 eth1  In  IP 10.0.23.2.57325 > 10.0.23.3.3784: BFDv1, Control, State Up, Flags: [none], length: 24
 00:00:01.428822 eth0  Out IP 10.0.13.3.41618 > 10.0.13.2.3784: BFDv1, Control, State Up, Flags: [none], length: 24
 00:00:01.439200 eth3  Out IP 10.0.35.2.60297 > 10.0.35.3.3784: BFDv1, Control, State Up, Flags: [none], length: 24
 00:00:01.447501 eth2  In  IP 10.0.34.3.40444 > 10.0.34.2.3784: BFDv1, Control, State Up, Flags: [none], length: 24
 00:00:01.456797 eth1  Out IP 10.0.23.3.33242 > 10.0.23.2.3784: BFDv1, Control, State Up, Flags: [none], length: 24
 00:00:01.457937 eth3  In  IP 10.0.35.3.46520 > 10.0.35.2.3784: BFDv1, Control, State Up, Flags: [none], length: 24
 00:00:01.486354 eth2  Out IP 10.0.34.2.54773 > 10.0.34.3.3784: BFDv1, Control, State Up, Flags: [none], length: 24
 00:00:01.499802 eth1  In  IP 10.0.23.2.57325 > 10.0.23.3.3784: BFDv1, Control, State Up, Flags: [none], length: 24
 00:00:01.501620 eth0  In  IP 10.0.13.2.57029 > 10.0.13.3.3784: BFDv1, Control, State Up, Flags: [none], length: 24
 00:00:01.516934 eth0  Out IP 10.0.13.3.41618 > 10.0.13.2.3784: BFDv1, Control, State Up, Flags: [none], length: 24
 00:00:01.527168 eth3  Out IP 10.0.35.2.60297 > 10.0.35.3.3784: BFDv1, Control, State Up, Flags: [none], length: 24
 00:00:01.528439 eth2  In  IP 10.0.34.3.40444 > 10.0.34.2.3784: BFDv1, Control, State Up, Flags: [none], length: 24
 00:00:01.536488 eth3  In  IP 10.0.35.3.46520 > 10.0.35.2.3784: BFDv1, Control, State Up, Flags: [none], length: 24
 00:00:01.545891 eth1  Out IP 10.0.23.3.33242 > 10.0.23.2.3784: BFDv1, Control, State Up, Flags: [none], length: 24
 00:00:01.569198 eth2  Out IP 10.0.34.2.54773 > 10.0.34.3.3784: BFDv1, Control, State Up, Flags: [none], length: 24
 00:00:01.579465 eth0  In  IP 10.0.13.2.57029 > 10.0.13.3.3784: BFDv1, Control, State Up, Flags: [none], length: 24
 00:00:01.585771 eth1  In  IP 10.0.23.2.57325 > 10.0.23.3.3784: BFDv1, Control, State Up, Flags: [none], length: 24
 00:00:01.593133 eth0  Out IP 10.0.13.3.41618 > 10.0.13.2.3784: BFDv1, Control, State Up, Flags: [none], length: 24
 00:00:01.609148 eth2  In  IP 10.0.34.3.40444 > 10.0.34.2.3784: BFDv1, Control, State Up, Flags: [none], length: 24
 00:00:01.614360 eth3  In  IP 10.0.35.3.46520 > 10.0.35.2.3784: BFDv1, Control, State Up, Flags: [none], length: 24
 00:00:01.614460 eth3  Out IP 10.0.35.2.60297 > 10.0.35.3.3784: BFDv1, Control, State Up, Flags: [none], length: 24
 00:00:01.621743 eth1  Out IP 10.0.23.3.33242 > 10.0.23.2.3784: BFDv1, Control, State Up, Flags: [none], length: 24
 00:00:01.652279 eth2  Out IP 10.0.34.2.54773 > 10.0.34.3.3784: BFDv1, Control, State Up, Flags: [none], length: 24
 00:00:01.657107 eth0  In  IP 10.0.13.2.57029 > 10.0.13.3.3784: BFDv1, Control, State Up, Flags: [none], length: 24
 00:00:01.674293 eth1  In  IP 10.0.23.2.57325 > 10.0.23.3.3784: BFDv1, Control, State Up, Flags: [none], length: 24
 00:00:01.679619 eth0  Out IP 10.0.13.3.41618 > 10.0.13.2.3784: BFDv1, Control, State Up, Flags: [none], length: 24
 00:00:01.690482 eth2  In  IP 10.0.34.3.40444 > 10.0.34.2.3784: BFDv1, Control, State Up, Flags: [none], length: 24
 00:00:01.702280 eth3  In  IP 10.0.35.3.46520 > 10.0.35.2.3784: BFDv1, Control, State Up, Flags: [none], length: 24
 00:00:01.703608 eth3  Out IP 10.0.35.2.60297 > 10.0.35.3.3784: BFDv1, Control, State Up, Flags: [none], length: 24
 00:00:01.709882 eth1  Out IP 10.0.23.3.33242 > 10.0.23.2.3784: BFDv1, Control, State Up, Flags: [none], length: 24
 00:00:01.732192 eth2  Out IP 10.0.34.2.54773 > 10.0.34.3.3784: BFDv1, Control, State Up, Flags: [none], length: 24
 00:00:01.743826 eth0  In  IP 10.0.13.2.57029 > 10.0.13.3.3784: BFDv1, Control, State Up, Flags: [none], length: 24
 00:00:01.761270 eth1  In  IP 10.0.23.2.57325 > 10.0.23.3.3784: BFDv1, Control, State Up, Flags: [none], length: 24
 00:00:01.766078 eth2  In  IP 10.0.34.3.40444 > 10.0.34.2.3784: BFDv1, Control, State Up, Flags: [none], length: 24
 00:00:01.767401 eth0  Out IP 10.0.13.3.41618 > 10.0.13.2.3784: BFDv1, Control, State Up, Flags: [none], length: 24
 00:00:01.778285 eth3  In  IP 10.0.35.3.46520 > 10.0.35.2.3784: BFDv1, Control, State Up, Flags: [none], length: 24
 00:00:01.787584 eth3  Out IP 10.0.35.2.60297 > 10.0.35.3.3784: BFDv1, Control, State Up, Flags: [none], length: 24
 00:00:01.795822 eth1  Out IP 10.0.23.3.33242 > 10.0.23.2.3784: BFDv1, Control, State Up, Flags: [none], length: 24
 00:00:01.809108 eth2  Out IP 10.0.34.2.54773 > 10.0.34.3.3784: BFDv1, Control, State Up, Flags: [none], length: 24
 00:00:01.827795 eth0  In  IP 10.0.13.2.57029 > 10.0.13.3.3784: BFDv1, Control, State Up, Flags: [none], length: 24
 00:00:01.843184 eth0  Out IP 10.0.13.3.41618 > 10.0.13.2.3784: BFDv1, Control, State Up, Flags: [none], length: 24
 00:00:01.845075 eth2  In  IP 10.0.34.3.40444 > 10.0.34.2.3784: BFDv1, Control, State Up, Flags: [none], length: 24
 00:00:01.850226 eth1  In  IP 10.0.23.2.57325 > 10.0.23.3.3784: BFDv1, Control, State Up, Flags: [none], length: 24
 00:00:01.867345 eth3  In  IP 10.0.35.3.46520 > 10.0.35.2.3784: BFDv1, Control, State Up, Flags: [none], length: 24
 00:00:01.874911 eth3  Out IP 10.0.35.2.60297 > 10.0.35.3.3784: BFDv1, Control, State Up, Flags: [none], length: 24
 00:00:01.879250 eth1  Out IP 10.0.23.3.33242 > 10.0.23.2.3784: BFDv1, Control, State Up, Flags: [none], length: 24
 00:00:01.885482 eth2  Out IP 10.0.34.2.54773 > 10.0.34.3.3784: BFDv1, Control, State Up, Flags: [none], length: 24
 00:00:01.910342 eth0  In  IP 10.0.13.2.57029 > 10.0.13.3.3784: BFDv1, Control, State Up, Flags: [none], length: 24
 00:00:01.920723 eth0  Out IP 10.0.13.3.41618 > 10.0.13.2.3784: BFDv1, Control, State Up, Flags: [none], length: 24
 00:00:01.928895 eth2  In  IP 10.0.34.3.40444 > 10.0.34.2.3784: BFDv1, Control, State Up, Flags: [none], length: 24
 00:00:01.937280 eth1  In  IP 10.0.23.2.57325 > 10.0.23.3.3784: BFDv1, Control, State Up, Flags: [none], length: 24
 00:00:01.954809 eth3  In  IP 10.0.35.3.46520 > 10.0.35.2.3784: BFDv1, Control, State Up, Flags: [none], length: 24
 00:00:01.960184 eth3  Out IP 10.0.35.2.60297 > 10.0.35.3.3784: BFDv1, Control, State Up, Flags: [none], length: 24
 00:00:01.966510 eth1  Out IP 10.0.23.3.33242 > 10.0.23.2.3784: BFDv1, Control, State Up, Flags: [none], length: 24
 00:00:01.986594 eth0  In  IP 10.0.13.2.57029 > 10.0.13.3.3784: BFDv1, Control, State Up, Flags: [none], length: 24
 00:00:02.006929 eth0  Out IP 10.0.13.3.41618 > 10.0.13.2.3784: BFDv1, Control, State Up, Flags: [none], length: 24
 00:00:02.019078 eth1  In  IP 10.0.23.2.57325 > 10.0.23.3.3784: BFDv1, Control, State Up, Flags: [none], length: 24
 00:00:02.033283 eth3  In  IP 10.0.35.3.46520 > 10.0.35.2.3784: BFDv1, Control, State Up, Flags: [none], length: 24
 00:00:02.035582 eth3  Out IP 10.0.35.2.60297 > 10.0.35.3.3784: BFDv1, Control, State Up, Flags: [none], length: 24
 00:00:02.044763 eth1  Out IP 10.0.23.3.33242 > 10.0.23.2.3784: BFDv1, Control, State Up, Flags: [none], length: 24
 00:00:02.063973 eth0  In  IP 10.0.13.2.57029 > 10.0.13.3.3784: BFDv1, Control, State Up, Flags: [none], length: 24
 00:00:02.094657 eth1  In  IP 10.0.23.2.57325 > 10.0.23.3.3784: BFDv1, Control, State Up, Flags: [none], length: 24
 00:00:02.094881 eth0  Out IP 10.0.13.3.41618 > 10.0.13.2.3784: BFDv1, Control, State Up, Flags: [none], length: 24
 00:00:02.116242 eth3  In  IP 10.0.35.3.46520 > 10.0.35.2.3784: BFDv1, Control, State Up, Flags: [none], length: 24
 00:00:02.118501 eth3  Out IP 10.0.35.2.60297 > 10.0.35.3.3784: BFDv1, Control, State Up, Flags: [none], length: 24
 00:00:02.129719 eth1  Out IP 10.0.23.3.33242 > 10.0.23.2.3784: BFDv1, Control, State Up, Flags: [none], length: 24
 00:00:02.139856 eth0  In  IP 10.0.13.2.57029 > 10.0.13.3.3784: BFDv1, Control, State Up, Flags: [none], length: 24
 00:00:02.182270 eth0  Out IP 10.0.13.3.41618 > 10.0.13.2.3784: BFDv1, Control, State Up, Flags: [none], length: 24
 00:00:02.182497 eth1  In  IP 10.0.23.2.57325 > 10.0.23.3.3784: BFDv1, Control, State Up, Flags: [none], length: 24
 00:00:02.199811 eth3  Out IP 10.0.35.2.60297 > 10.0.35.3.3784: BFDv1, Control, State Up, Flags: [none], length: 24
 00:00:02.201076 eth3  In  IP 10.0.35.3.46520 > 10.0.35.2.3784: BFDv1, Control, State Up, Flags: [none], length: 24
 00:00:02.211519 eth1  Out IP 10.0.23.3.33242 > 10.0.23.2.3784: BFDv1, Control, State Up, Flags: [none], length: 24
 00:00:02.216147 eth0  In  IP 10.0.13.2.57029 > 10.0.13.3.3784: BFDv1, Control, State Up, Flags: [none], length: 24
 00:00:02.259960 eth1  In  IP 10.0.23.2.57325 > 10.0.23.3.3784: BFDv1, Control, State Up, Flags: [none], length: 24
 00:00:02.268352 eth0  Out IP 10.0.13.3.41618 > 10.0.13.2.3784: BFDv1, Control, State Up, Flags: [none], length: 24
 00:00:02.285697 eth3  In  IP 10.0.35.3.46520 > 10.0.35.2.3784: BFDv1, Control, State Up, Flags: [none], length: 24
 00:00:02.289042 eth3  Out IP 10.0.35.2.60297 > 10.0.35.3.3784: BFDv1, Control, State Up, Flags: [none], length: 24
 00:00:02.294523 eth1  Out IP 10.0.23.3.33242 > 10.0.23.2.3784: BFDv1, Control, State Up, Flags: [none], length: 24
 00:00:02.298198 eth0  In  IP 10.0.13.2.57029 > 10.0.13.3.3784: BFDv1, Control, State Up, Flags: [none], length: 24
 00:00:02.335855 eth1  In  IP 10.0.23.2.57325 > 10.0.23.3.3784: BFDv1, Control, State Up, Flags: [none], length: 24
 00:00:02.350335 eth0  Out IP 10.0.13.3.41618 > 10.0.13.2.3784: BFDv1, Control, State Up, Flags: [none], length: 24
 00:00:02.364813 eth3  In  IP 10.0.35.3.46520 > 10.0.35.2.3784: BFDv1, Control, State Up, Flags: [none], length: 24
 00:00:02.370226 eth1  Out IP 10.0.23.3.33242 > 10.0.23.2.3784: BFDv1, Control, State Up, Flags: [none], length: 24
 00:00:02.377592 eth3  Out IP 10.0.35.2.60297 > 10.0.35.3.3784: BFDv1, Control, State Up, Flags: [none], length: 24
 00:00:02.383292 eth0  In  IP 10.0.13.2.57029 > 10.0.13.3.3784: BFDv1, Control, State Up, Flags: [none], length: 24
 00:00:02.425350 eth1  In  IP 10.0.23.2.57325 > 10.0.23.3.3784: BFDv1, Control, State Up, Flags: [none], length: 24
 00:00:02.429686 eth0  Out IP 10.0.13.3.41618 > 10.0.13.2.3784: BFDv1, Control, State Up, Flags: [none], length: 24
 00:00:02.451411 eth3  In  IP 10.0.35.3.46520 > 10.0.35.2.3784: BFDv1, Control, State Up, Flags: [none], length: 24
 00:00:02.457727 eth1  Out IP 10.0.23.3.33242 > 10.0.23.2.3784: BFDv1, Control, State Up, Flags: [none], length: 24
 00:00:02.464524 eth0  In  IP 10.0.13.2.57029 > 10.0.13.3.3784: BFDv1, Control, State Up, Flags: [none], length: 24
 00:00:02.464717 eth3  Out IP 10.0.35.2.60297 > 10.0.35.3.3784: BFDv1, Control, State Up, Flags: [none], length: 24
 00:00:02.513145 eth1  In  IP 10.0.23.2.57325 > 10.0.23.3.3784: BFDv1, Control, State Up, Flags: [none], length: 24
 00:00:02.514495 eth0  Out IP 10.0.13.3.41618 > 10.0.13.2.3784: BFDv1, Control, State Up, Flags: [none], length: 24
 00:00:02.530463 eth3  In  IP 10.0.35.3.46520 > 10.0.35.2.3784: BFDv1, Control, State Up, Flags: [none], length: 24
 00:00:02.541301 eth0  In  IP 10.0.13.2.57029 > 10.0.13.3.3784: BFDv1, Control, State Up, Flags: [none], length: 24
 00:00:02.543746 eth1  Out IP 10.0.23.3.33242 > 10.0.23.2.3784: BFDv1, Control, State Up, Flags: [none], length: 24
 00:00:02.546962 eth3  Out IP 10.0.35.2.60297 > 10.0.35.3.3784: BFDv1, Control, State Up, Flags: [none], length: 24
 00:00:02.592403 eth1  In  IP 10.0.23.2.57325 > 10.0.23.3.3784: BFDv1, Control, State Up, Flags: [none], length: 24
 00:00:02.593738 eth0  Out IP 10.0.13.3.41618 > 10.0.13.2.3784: BFDv1, Control, State Up, Flags: [none], length: 24
 00:00:02.619651 eth3  In  IP 10.0.35.3.46520 > 10.0.35.2.3784: BFDv1, Control, State Up, Flags: [none], length: 24
 00:00:02.627847 eth0  In  IP 10.0.13.2.57029 > 10.0.13.3.3784: BFDv1, Control, State Up, Flags: [none], length: 24
 00:00:02.629202 eth3  Out IP 10.0.35.2.60297 > 10.0.35.3.3784: BFDv1, Control, State Up, Flags: [none], length: 24
 00:00:02.630468 eth1  Out IP 10.0.23.3.33242 > 10.0.23.2.3784: BFDv1, Control, State Up, Flags: [none], length: 24
 00:00:02.669787 eth0  Out IP 10.0.13.3.41618 > 10.0.13.2.3784: BFDv1, Control, State Up, Flags: [none], length: 24
 00:00:02.681338 eth1  In  IP 10.0.23.2.57325 > 10.0.23.3.3784: BFDv1, Control, State Up, Flags: [none], length: 24
 00:00:02.702025 eth3  In  IP 10.0.35.3.46520 > 10.0.35.2.3784: BFDv1, Control, State Up, Flags: [none], length: 24
 00:00:02.705326 eth0  In  IP 10.0.13.2.57029 > 10.0.13.3.3784: BFDv1, Control, State Up, Flags: [none], length: 24
 00:00:02.710627 eth3  Out IP 10.0.35.2.60297 > 10.0.35.3.3784: BFDv1, Control, State Up, Flags: [none], length: 24
 00:00:02.714831 eth1  Out IP 10.0.23.3.33242 > 10.0.23.2.3784: BFDv1, Control, State Up, Flags: [none], length: 24
 00:00:02.748094 eth0  Out IP 10.0.13.3.41618 > 10.0.13.2.3784: BFDv1, Control, State Up, Flags: [none], length: 24
 00:00:02.766930 eth1  In  IP 10.0.23.2.57325 > 10.0.23.3.3784: BFDv1, Control, State Up, Flags: [none], length: 24
 00:00:02.782831 eth0  In  IP 10.0.13.2.57029 > 10.0.13.3.3784: BFDv1, Control, State Up, Flags: [none], length: 24
 00:00:02.786254 eth3  Out IP 10.0.35.2.60297 > 10.0.35.3.3784: BFDv1, Control, State Up, Flags: [none], length: 24
 00:00:02.786328 eth3  In  IP 10.0.35.3.46520 > 10.0.35.2.3784: BFDv1, Control, State Up, Flags: [none], length: 24
 00:00:02.794661 eth1  Out IP 10.0.23.3.33242 > 10.0.23.2.3784: BFDv1, Control, State Up, Flags: [none], length: 24
 00:00:02.823934 eth0  Out IP 10.0.13.3.41618 > 10.0.13.2.3784: BFDv1, Control, State Up, Flags: [none], length: 24
 00:00:02.849709 eth1  In  IP 10.0.23.2.57325 > 10.0.23.3.3784: BFDv1, Control, State Up, Flags: [none], length: 24
 00:00:02.859900 eth0  In  IP 10.0.13.2.57029 > 10.0.13.3.3784: BFDv1, Control, State Up, Flags: [none], length: 24
 00:00:02.863891 eth3  In  IP 10.0.35.3.46520 > 10.0.35.2.3784: BFDv1, Control, State Up, Flags: [none], length: 24
 00:00:02.872190 eth3  Out IP 10.0.35.2.60297 > 10.0.35.3.3784: BFDv1, Control, State Up, Flags: [none], length: 24
 00:00:02.875454 eth1  Out IP 10.0.23.3.33242 > 10.0.23.2.3784: BFDv1, Control, State Up, Flags: [none], length: 24
 00:00:02.904714 eth0  Out IP 10.0.13.3.41618 > 10.0.13.2.3784: BFDv1, Control, State Up, Flags: [none], length: 24
 00:00:02.937211 eth1  In  IP 10.0.23.2.57325 > 10.0.23.3.3784: BFDv1, Control, State Up, Flags: [none], length: 24
 00:00:02.940924 eth3  In  IP 10.0.35.3.46520 > 10.0.35.2.3784: BFDv1, Control, State Up, Flags: [none], length: 24
 00:00:02.941923 eth0  In  IP 10.0.13.2.57029 > 10.0.13.3.3784: BFDv1, Control, State Up, Flags: [none], length: 24
 00:00:02.956363 eth3  Out IP 10.0.35.2.60297 > 10.0.35.3.3784: BFDv1, Control, State Up, Flags: [none], length: 24
 00:00:02.964636 eth1  Out IP 10.0.23.3.33242 > 10.0.23.2.3784: BFDv1, Control, State Up, Flags: [none], length: 24
 00:00:02.994888 eth0  Out IP 10.0.13.3.41618 > 10.0.13.2.3784: BFDv1, Control, State Up, Flags: [none], length: 24
 00:00:03.016239 eth3  In  IP 10.0.35.3.46520 > 10.0.35.2.3784: BFDv1, Control, State Up, Flags: [none], length: 24
 00:00:03.018690 eth0  In  IP 10.0.13.2.57029 > 10.0.13.3.3784: BFDv1, Control, State Up, Flags: [none], length: 24
 00:00:03.019745 eth1  In  IP 10.0.23.2.57325 > 10.0.23.3.3784: BFDv1, Control, State Up, Flags: [none], length: 24
 00:00:03.038114 eth3  Out IP 10.0.35.2.60297 > 10.0.35.3.3784: BFDv1, Control, State Up, Flags: [none], length: 24
 00:00:03.044428 eth1  Out IP 10.0.23.3.33242 > 10.0.23.2.3784: BFDv1, Control, State Up, Flags: [none], length: 24
 00:00:03.076684 eth0  Out IP 10.0.13.3.41618 > 10.0.13.2.3784: BFDv1, Control, State Up, Flags: [none], length: 24
 00:00:03.096705 eth0  In  IP 10.0.13.2.57029 > 10.0.13.3.3784: BFDv1, Control, State Up, Flags: [none], length: 24
 00:00:03.102733 eth1  In  IP 10.0.23.2.57325 > 10.0.23.3.3784: BFDv1, Control, State Up, Flags: [none], length: 24
 00:00:03.104009 eth3  In  IP 10.0.35.3.46520 > 10.0.35.2.3784: BFDv1, Control, State Up, Flags: [none], length: 24
 00:00:03.115281 eth3  Out IP 10.0.35.2.60297 > 10.0.35.3.3784: BFDv1, Control, State Up, Flags: [none], length: 24
 00:00:03.123482 eth1  Out IP 10.0.23.3.33242 > 10.0.23.2.3784: BFDv1, Control, State Up, Flags: [none], length: 24
 00:00:03.165740 eth0  Out IP 10.0.13.3.41618 > 10.0.13.2.3784: BFDv1, Control, State Up, Flags: [none], length: 24
 00:00:03.181697 eth0  In  IP 10.0.13.2.57029 > 10.0.13.3.3784: BFDv1, Control, State Up, Flags: [none], length: 24
 00:00:03.188740 eth1  In  IP 10.0.23.2.57325 > 10.0.23.3.3784: BFDv1, Control, State Up, Flags: [none], length: 24
 00:00:03.193048 eth3  In  IP 10.0.35.3.46520 > 10.0.35.2.3784: BFDv1, Control, State Up, Flags: [none], length: 24
 00:00:03.199369 eth3  Out IP 10.0.35.2.60297 > 10.0.35.3.3784: BFDv1, Control, State Up, Flags: [none], length: 24
 00:00:03.199463 eth1  Out IP 10.0.23.3.33242 > 10.0.23.2.3784: BFDv1, Control, State Up, Flags: [none], length: 24
 00:00:03.254678 eth0  Out IP 10.0.13.3.41618 > 10.0.13.2.3784: BFDv1, Control, State Up, Flags: [none], length: 24
 00:00:03.261062 eth0  In  IP 10.0.13.2.57029 > 10.0.13.3.3784: BFDv1, Control, State Up, Flags: [none], length: 24
 00:00:03.277219 eth1  In  IP 10.0.23.2.57325 > 10.0.23.3.3784: BFDv1, Control, State Up, Flags: [none], length: 24
 00:00:03.279079 eth3  In  IP 10.0.35.3.46520 > 10.0.35.2.3784: BFDv1, Control, State Up, Flags: [none], length: 24
 00:00:03.287365 eth3  Out IP 10.0.35.2.60297 > 10.0.35.3.3784: BFDv1, Control, State Up, Flags: [none], length: 24
 00:00:03.288604 eth1  Out IP 10.0.23.3.33242 > 10.0.23.2.3784: BFDv1, Control, State Up, Flags: [none], length: 24
 00:00:03.340874 eth0  Out IP 10.0.13.3.41618 > 10.0.13.2.3784: BFDv1, Control, State Up, Flags: [none], length: 24
 00:00:03.345165 eth0  In  IP 10.0.13.2.57029 > 10.0.13.3.3784: BFDv1, Control, State Up, Flags: [none], length: 24
 00:00:03.357423 eth1  In  IP 10.0.23.2.57325 > 10.0.23.3.3784: BFDv1, Control, State Up, Flags: [none], length: 24
 00:00:03.368245 eth3  In  IP 10.0.35.3.46520 > 10.0.35.2.3784: BFDv1, Control, State Up, Flags: [none], length: 24
 00:00:03.368377 eth3  Out IP 10.0.35.2.60297 > 10.0.35.3.3784: BFDv1, Control, State Up, Flags: [none], length: 24
 00:00:03.373577 eth1  Out IP 10.0.23.3.33242 > 10.0.23.2.3784: BFDv1, Control, State Up, Flags: [none], length: 24
 00:00:03.419847 eth0  Out IP 10.0.13.3.41618 > 10.0.13.2.3784: BFDv1, Control, State Up, Flags: [none], length: 24
 00:00:03.423111 eth0  In  IP 10.0.13.2.57029 > 10.0.13.3.3784: BFDv1, Control, State Up, Flags: [none], length: 24
 00:00:03.440976 eth1  In  IP 10.0.23.2.57325 > 10.0.23.3.3784: BFDv1, Control, State Up, Flags: [none], length: 24
 00:00:03.446146 eth3  In  IP 10.0.35.3.46520 > 10.0.35.2.3784: BFDv1, Control, State Up, Flags: [none], length: 24
 00:00:03.455516 eth3  Out IP 10.0.35.2.60297 > 10.0.35.3.3784: BFDv1, Control, State Up, Flags: [none], length: 24
 00:00:03.455623 eth1  Out IP 10.0.23.3.33242 > 10.0.23.2.3784: BFDv1, Control, State Up, Flags: [none], length: 24
 00:00:03.504845 eth0  Out IP 10.0.13.3.41618 > 10.0.13.2.3784: BFDv1, Control, State Up, Flags: [none], length: 24
 00:00:03.508079 eth0  In  IP 10.0.13.2.57029 > 10.0.13.3.3784: BFDv1, Control, State Up, Flags: [none], length: 24
 00:00:03.517335 eth1  In  IP 10.0.23.2.57325 > 10.0.23.3.3784: BFDv1, Control, State Up, Flags: [none], length: 24
 00:00:03.534349 eth3  In  IP 10.0.35.3.46520 > 10.0.35.2.3784: BFDv1, Control, State Up, Flags: [none], length: 24
 00:00:03.542704 eth3  Out IP 10.0.35.2.60297 > 10.0.35.3.3784: BFDv1, Control, State Up, Flags: [none], length: 24
 00:00:03.542795 eth1  Out IP 10.0.23.3.33242 > 10.0.23.2.3784: BFDv1, Control, State Up, Flags: [none], length: 24
 00:00:03.583075 eth0  Out IP 10.0.13.3.41618 > 10.0.13.2.3784: BFDv1, Control, State Up, Flags: [none], length: 24
 00:00:03.586316 eth0  In  IP 10.0.13.2.57029 > 10.0.13.3.3784: BFDv1, Control, State Up, Flags: [none], length: 24
 00:00:03.602746 eth1  In  IP 10.0.23.2.57325 > 10.0.23.3.3784: BFDv1, Control, State Up, Flags: [none], length: 24
 00:00:03.612446 eth3  In  IP 10.0.35.3.46520 > 10.0.35.2.3784: BFDv1, Control, State Up, Flags: [none], length: 24
 00:00:03.629762 eth1  Out IP 10.0.23.3.33242 > 10.0.23.2.3784: BFDv1, Control, State Up, Flags: [none], length: 24
 00:00:03.631938 eth3  Out IP 10.0.35.2.60297 > 10.0.35.3.3784: BFDv1, Control, State Up, Flags: [none], length: 24
 00:00:03.666131 eth0  Out IP 10.0.13.3.41618 > 10.0.13.2.3784: BFDv1, Control, State Up, Flags: [none], length: 24
 00:00:03.668382 eth0  In  IP 10.0.13.2.57029 > 10.0.13.3.3784: BFDv1, Control, State Up, Flags: [none], length: 24
 00:00:03.684270 eth1  In  IP 10.0.23.2.57325 > 10.0.23.3.3784: BFDv1, Control, State Up, Flags: [none], length: 24
 00:00:03.691086 eth3  In  IP 10.0.35.3.46520 > 10.0.35.2.3784: BFDv1, Control, State Up, Flags: [none], length: 24
 00:00:03.706615 eth1  Out IP 10.0.23.3.33242 > 10.0.23.2.3784: BFDv1, Control, State Up, Flags: [none], length: 24
 00:00:03.714900 eth3  Out IP 10.0.35.2.60297 > 10.0.35.3.3784: BFDv1, Control, State Up, Flags: [none], length: 24
 00:00:03.744191 eth0  In  IP 10.0.13.2.57029 > 10.0.13.3.3784: BFDv1, Control, State Up, Flags: [none], length: 24
 00:00:03.755557 eth0  Out IP 10.0.13.3.41618 > 10.0.13.2.3784: BFDv1, Control, State Up, Flags: [none], length: 24
 00:00:03.770517 eth1  In  IP 10.0.23.2.57325 > 10.0.23.3.3784: BFDv1, Control, State Up, Flags: [none], length: 24
 00:00:03.770707 eth3  In  IP 10.0.35.3.46520 > 10.0.35.2.3784: BFDv1, Control, State Up, Flags: [none], length: 24
 00:00:03.787935 eth1  Out IP 10.0.23.3.33242 > 10.0.23.2.3784: BFDv1, Control, State Up, Flags: [none], length: 24
 00:00:03.793186 eth3  Out IP 10.0.35.2.60297 > 10.0.35.3.3784: BFDv1, Control, State Up, Flags: [none], length: 24
 00:00:03.830578 eth0  In  IP 10.0.13.2.57029 > 10.0.13.3.3784: BFDv1, Control, State Up, Flags: [none], length: 24
 00:00:03.842931 eth0  Out IP 10.0.13.3.41618 > 10.0.13.2.3784: BFDv1, Control, State Up, Flags: [none], length: 24
 00:00:03.855523 eth1  In  IP 10.0.23.2.57325 > 10.0.23.3.3784: BFDv1, Control, State Up, Flags: [none], length: 24
 00:00:03.856302 eth3  In  IP 10.0.35.3.46520 > 10.0.35.2.3784: BFDv1, Control, State Up, Flags: [none], length: 24
 00:00:03.869568 eth1  Out IP 10.0.23.3.33242 > 10.0.23.2.3784: BFDv1, Control, State Up, Flags: [none], length: 24
 00:00:03.876805 eth3  Out IP 10.0.35.2.60297 > 10.0.35.3.3784: BFDv1, Control, State Up, Flags: [none], length: 24
 00:00:03.919307 eth0  In  IP 10.0.13.2.57029 > 10.0.13.3.3784: BFDv1, Control, State Up, Flags: [none], length: 24
 00:00:03.920625 eth0  Out IP 10.0.13.3.41618 > 10.0.13.2.3784: BFDv1, Control, State Up, Flags: [none], length: 24
 00:00:03.936025 eth1  In  IP 10.0.23.2.57325 > 10.0.23.3.3784: BFDv1, Control, State Up, Flags: [none], length: 24
 00:00:03.942977 eth3  In  IP 10.0.35.3.46520 > 10.0.35.2.3784: BFDv1, Control, State Up, Flags: [none], length: 24
 00:00:03.957327 eth1  Out IP 10.0.23.3.33242 > 10.0.23.2.3784: BFDv1, Control, State Up, Flags: [none], length: 24
 00:00:03.962578 eth3  Out IP 10.0.35.2.60297 > 10.0.35.3.3784: BFDv1, Control, State Up, Flags: [none], length: 24
 00:00:04.001819 eth0  Out IP 10.0.13.3.41618 > 10.0.13.2.3784: BFDv1, Control, State Up, Flags: [none], length: 24
 00:00:04.006081 eth0  In  IP 10.0.13.2.57029 > 10.0.13.3.3784: BFDv1, Control, State Up, Flags: [none], length: 24
 00:00:04.024657 eth3  In  IP 10.0.35.3.46520 > 10.0.35.2.3784: BFDv1, Control, State Up, Flags: [none], length: 24
 00:00:04.025562 eth1  In  IP 10.0.23.2.57325 > 10.0.23.3.3784: BFDv1, Control, State Up, Flags: [none], length: 24
 00:00:04.041818 eth3  Out IP 10.0.35.2.60297 > 10.0.35.3.3784: BFDv1, Control, State Up, Flags: [none], length: 24
 00:00:04.044021 eth1  Out IP 10.0.23.3.33242 > 10.0.23.2.3784: BFDv1, Control, State Up, Flags: [none], length: 24
