tcpdump: data link type LINUX_SLL2
tcpdump: verbose output suppressed, use -v[v]... for full protocol decode
listening on any, link-type LINUX_SLL2 (Linux cooked v2), snapshot length 262144 bytes
 00:00:00.000000 eth1  Out IP 10.0.13.3.42552 > 10.0.13.2.3784: BFDv1, Control, State Up, Flags: [none], length: 24
 00:00:00.018151 eth2  Out IP 10.0.23.3.59324 > 10.0.23.2.3784: BFDv1, Control, State Up, Flags: [none], length: 24
 00:00:00.030912 eth3  In  IP 10.0.34.3.56678 > 10.0.34.2.3784: BFDv1, Control, State Up, Flags: [none], length: 24
 00:00:00.042073 eth0  In  IP 10.0.35.3.48498 > 10.0.35.2.3784: BFDv1, Control, State Up, Flags: [none], length: 24
 00:00:00.056009 eth1  In  IP 10.0.13.2.32837 > 10.0.13.3.3784: BFDv1, Control, State Up, Flags: [none], length: 24
 00:00:00.057242 eth3  Out IP 10.0.34.2.38216 > 10.0.34.3.3784: BFDv1, Control, State Up, Flags: [none], length: 24
 00:00:00.064425 eth0  Out IP 10.0.35.2.59307 > 10.0.35.3.3784: BFDv1, Control, State Up, Flags: [none], length: 24
 00:00:00.067321 eth2  In  IP 10.0.23.2.41179 > 10.0.23.3.3784: BFDv1, Control, State Up, Flags: [none], length: 24
 00:00:00.081537 eth1  Out IP 10.0.13.3.42552 > 10.0.13.2.3784: BFDv1, Control, State Up, Flags: [none], length: 24
 00:00:00.101716 eth2  Out IP 10.0.23.3.59324 > 10.0.23.2.3784: BFDv1, Control, State Up, Flags: [none], length: 24
 00:00:00.116233 eth3  In  IP 10.0.34.3.56678 > 10.0.34.2.3784: BFDv1, Control, State Up, Flags: [none], length: 24
 00:00:00.118636 eth0  In  IP 10.0.35.3.48498 > 10.0.35.2.3784: BFDv1, Control, State Up, Flags: [none], length: 24
 00:00:00.133207 eth1  In  IP 10.0.13.2.32837 > 10.0.13.3.3784: BFDv1, Control, State Up, Flags: [none], length: 24
 00:00:00.138419 eth3  Out IP 10.0.34.2.38216 > 10.0.34.3.3784: BFDv1, Control, State Up, Flags: [none], length: 24
 00:00:00.145583 eth0  Out IP 10.0.35.2.59307 > 10.0.35.3.3784: BFDv1, Control, State Up, Flags: [none], length: 24
 00:00:00.148423 eth2  In  IP 10.0.23.2.41179 > 10.0.23.3.3784: BFDv1, Control, State Up, Flags: [none], length: 24
 00:00:00.165651 eth1  Out IP 10.0.13.3.42552 > 10.0.13.2.3784: BFDv1, Control, State Up, Flags: [none], length: 24
 00:00:00.190851 eth2  Out IP 10.0.23.3.59324 > 10.0.23.2.3784: BFDv1, Control, State Up, Flags: [none], length: 24
 00:00:00.198768 eth0  In  IP 10.0.35.3.48498 > 10.0.35.2.3784: BFDv1, Control, State Up, Flags: [none], length: 24
 00:00:00.203508 eth3  In  IP 10.0.34.3.56678 > 10.0.34.2.3784: BFDv1, Control, State Up, Flags: [none], length: 24
 00:00:00.208530 eth1  In  IP 10.0.13.2.32837 > 10.0.13.3.3784: BFDv1, Control, State Up, Flags: [none], length: 24
 00:00:00.222685 eth3  Out IP 10.0.34.2.38216 > 10.0.34.3.3784: BFDv1, Control, State Up, Flags: [none], length: 24
 00:00:00.224239 eth2  In  IP 10.0.23.2.41179 > 10.0.23.3.3784: BFDv1, Control, State Up, Flags: [none], length: 24
 00:00:00.227401 eth0  Out IP 10.0.35.2.59307 > 10.0.35.3.3784: BFDv1, Control, State Up, Flags: [none], length: 24
 00:00:00.247656 eth1  Out IP 10.0.13.3.42552 > 10.0.13.2.3784: BFDv1, Control, State Up, Flags: [none], length: 24
 00:00:00.270877 eth2  Out IP 10.0.23.3.59324 > 10.0.23.2.3784: BFDv1, Control, State Up, Flags: [none], length: 24
 00:00:00.281262 eth0  In  IP 10.0.35.3.48498 > 10.0.35.2.3784: BFDv1, Control, State Up, Flags: [none], length: 24
 00:00:00.292286 eth3  In  IP 10.0.34.3.56678 > 10.0.34.2.3784: BFDv1, Control, State Up, Flags: [none], length: 24
 00:00:00.298318 eth1  In  IP 10.0.13.2.32837 > 10.0.13.3.3784: BFDv1, Control, State Up, Flags: [none], length: 24
 00:00:00.300792 eth2  In  IP 10.0.23.2.41179 > 10.0.23.3.3784: BFDv1, Control, State Up, Flags: [none], length: 24
 00:00:00.309011 eth0  Out IP 10.0.35.2.59307 > 10.0.35.3.3784: BFDv1, Control, State Up, Flags: [none], length: 24
 00:00:00.309068 eth3  Out IP 10.0.34.2.38216 > 10.0.34.3.3784: BFDv1, Control, State Up, Flags: [none], length: 24
 00:00:00.323214 eth1  Out IP 10.0.13.3.42552 > 10.0.13.2.3784: BFDv1, Control, State Up, Flags: [none], length: 24
 00:00:00.354387 eth2  Out IP 10.0.23.3.59324 > 10.0.23.2.3784: BFDv1, Control, State Up, Flags: [none], length: 24
 00:00:00.362454 eth0  In  IP 10.0.35.3.48498 > 10.0.35.2.3784: BFDv1, Control, State Up, Flags: [none], length: 24
 00:00:00.373137 eth3  In  IP 10.0.34.3.56678 > 10.0.34.2.3784: BFDv1, Control, State Up, Flags: [none], length: 24
 00:00:00.378176 eth1  In  IP 10.0.13.2.32837 > 10.0.13.3.3784: BFDv1, Control, State Up, Flags: [none], length: 24
 00:00:00.381917 eth2  In  IP 10.0.23.2.41179 > 10.0.23.3.3784: BFDv1, Control, State Up, Flags: [none], length: 24
 00:00:00.385143 eth0  Out IP 10.0.35.2.59307 > 10.0.35.3.3784: BFDv1, Control, State Up, Flags: [none], length: 24
 00:00:00.394322 eth3  Out IP 10.0.34.2.38216 > 10.0.34.3.3784: BFDv1, Control, State Up, Flags: [none], length: 24
 00:00:00.406481 eth1  Out IP 10.0.13.3.42552 > 10.0.13.2.3784: BFDv1, Control, State Up, Flags: [none], length: 24
 00:00:00.443845 eth2  Out IP 10.0.23.3.59324 > 10.0.23.2.3784: BFDv1, Control, State Up, Flags: [none], length: 24
 00:00:00.448071 eth0  In  IP 10.0.35.3.48498 > 10.0.35.2.3784: BFDv1, Control, State Up, Flags: [none], length: 24
 00:00:00.461756 eth3  In  IP 10.0.34.3.56678 > 10.0.34.2.3784: BFDv1, Control, State Up, Flags: [none], length: 24
 00:00:00.461765 eth1  In  IP 10.0.13.2.32837 > 10.0.13.3.3784: BFDv1, Control, State Up, Flags: [none], length: 24
 00:00:00.469980 eth0  Out IP 10.0.35.2.59307 > 10.0.35.3.3784: BFDv1, Control, State Up, Flags: [none], length: 24
 00:00:00.471339 eth2  In  IP 10.0.23.2.41179 > 10.0.23.3.3784: BFDv1, Control, State Up, Flags: [none], length: 24
 00:00:00.472507 eth3  Out IP 10.0.34.2.38216 > 10.0.34.3.3784: BFDv1, Control, State Up, Flags: [none], length: 24
 00:00:00.487652 eth1  Out IP 10.0.13.3.42552 > 10.0.13.2.3784: BFDv1, Control, State Up, Flags: [none], length: 24
 00:00:00.527620 eth0  In  IP 10.0.35.3.48498 > 10.0.35.2.3784: BFDv1, Control, State Up, Flags: [none], length: 24
 00:00:00.531817 eth2  Out IP 10.0.23.3.59324 > 10.0.23.2.3784: BFDv1, Control, State Up, Flags: [none], length: 24
 00:00:00.539206 eth3  In  IP 10.0.34.3.56678 > 10.0.34.2.3784: BFDv1, Control, State Up, Flags: [none], length: 24
 00:00:00.548127 eth2  In  IP 10.0.23.2.41179 > 10.0.23.3.3784: BFDv1, Control, State Up, Flags: [none], length: 24
 00:00:00.548238 eth3  Out IP 10.0.34.2.38216 > 10.0.34.3.3784: BFDv1, Control, State Up, Flags: [none], length: 24
 00:00:00.550946 eth1  In  IP 10.0.13.2.32837 > 10.0.13.3.3784: BFDv1, Control, State Up, Flags: [none], length: 24
 00:00:00.557105 eth0  Out IP 10.0.35.2.59307 > 10.0.35.3.3784: BFDv1, Control, State Up, Flags: [none], length: 24
 00:00:00.570893 eth1  Out IP 10.0.13.3.42552 > 10.0.13.2.3784: BFDv1, Control, State Up, Flags: [none], length: 24
 00:00:00.609156 eth0  In  IP 10.0.35.3.48498 > 10.0.35.2.3784: BFDv1, Control, State Up, Flags: [none], length: 24
 00:00:00.609244 eth2  Out IP 10.0.23.3.59324 > 10.0.23.2.3784: BFDv1, Control, State Up, Flags: [none], length: 24
 00:00:00.626728 eth3  In  IP 10.0.34.3.56678 > 10.0.34.2.3784: BFDv1, Control, State Up, Flags: [none], length: 24
 00:00:00.631739 eth2  In  IP 10.0.23.2.41179 > 10.0.23.3.3784: BFDv1, Control, State Up, Flags: [none], length: 24
 00:00:00.632358 eth1  In  IP 10.0.13.2.32837 > 10.0.13.3.3784: BFDv1, Control, State Up, Flags: [none], length: 24
 00:00:00.637586 eth3  Out IP 10.0.34.2.38216 > 10.0.34.3.3784: BFDv1, Control, State Up, Flags: [none], length: 24
 00:00:00.641774 eth0  Out IP 10.0.35.2.59307 > 10.0.35.3.3784: BFDv1, Control, State Up, Flags: [none], length: 24
 00:00:00.656922 eth1  Out IP 10.0.13.3.42552 > 10.0.13.2.3784: BFDv1, Control, State Up, Flags: [none], length: 24
 00:00:00.686085 eth2  Out IP 10.0.23.3.59324 > 10.0.23.2.3784: BFDv1, Control, State Up, Flags: [none], length: 24
 00:00:00.690656 eth0  In  IP 10.0.35.3.48498 > 10.0.35.2.3784: BFDv1, Control, State Up, Flags: [none], length: 24
 00:00:00.707659 eth2  In  IP 10.0.23.2.41179 > 10.0.23.3.3784: BFDv1, Control, State Up, Flags: [none], length: 24
 00:00:00.710289 eth1  In  IP 10.0.13.2.32837 > 10.0.13.3.3784: BFDv1, Control, State Up, Flags: [none], length: 24
 00:00:00.711951 eth3  In  IP 10.0.34.3.56678 > 10.0.34.2.3784: BFDv1, Control, State Up, Flags: [none], length: 24
 00:00:00.719186 eth0  Out IP 10.0.35.2.59307 > 10.0.35.3.3784: BFDv1, Control, State Up, Flags: [none], length: 24
 00:00:00.722377 eth3  Out IP 10.0.34.2.38216 > 10.0.34.3.3784: BFDv1, Control, State Up, Flags: [none], length: 24
 00:00:00.741557 eth1  Out IP 10.0.13.3.42552 > 10.0.13.2.3784: BFDv1, Control, State Up, Flags: [none], length: 24
 00:00:00.761703 eth2  Out IP 10.0.23.3.59324 > 10.0.23.2.3784: BFDv1, Control, State Up, Flags: [none], length: 24
 00:00:00.765099 eth0  In  IP 10.0.35.3.48498 > 10.0.35.2.3784: BFDv1, Control, State Up, Flags: [none], length: 24
 00:00:00.787476 eth1  In  IP 10.0.13.2.32837 > 10.0.13.3.3784: BFDv1, Control, State Up, Flags: [none], length: 24
 00:00:00.789686 eth2  In  IP 10.0.23.2.41179 > 10.0.23.3.3784: BFDv1, Control, State Up, Flags: [none], length: 24
 00:00:00.799752 eth3  In  IP 10.0.34.3.56678 > 10.0.34.2.3784: BFDv1, Control, State Up, Flags: [none], length: 24
 00:00:00.800979 eth3  Out IP 10.0.34.2.38216 > 10.0.34.3.3784: BFDv1, Control, State Up, Flags: [none], length: 24
 00:00:00.803112 eth0  Out IP 10.0.35.2.59307 > 10.0.35.3.3784: BFDv1, Control, State Up, Flags: [none], length: 24
 00:00:00.830330 eth1  Out IP 10.0.13.3.42552 > 10.0.13.2.3784: BFDv1, Control, State Up, Flags: [none], length: 24
 00:00:00.839464 eth2  Out IP 10.0.23.3.59324 > 10.0.23.2.3784: BFDv1, Control, State Up, Flags: [none], length: 24
 00:00:00.847742 eth0  In  IP 10.0.35.3.48498 > 10.0.35.2.3784: BFDv1, Control, State Up, Flags: [none], length: 24
 00:00:00.873939 eth1  In  IP 10.0.13.2.32837 > 10.0.13.3.3784: BFDv1, Control, State Up, Flags: [none], length: 24
 00:00:00.877122 eth3  In  IP 10.0.34.3.56678 > 10.0.34.2.3784: BFDv1, Control, State Up, Flags: [none], length: 24
 00:00:00.879113 eth2  In  IP 10.0.23.2.41179 > 10.0.23.3.3784: BFDv1, Control, State Up, Flags: [none], length: 24
 00:00:00.883313 eth0  Out IP 10.0.35.2.59307 > 10.0.35.3.3784: BFDv1, Control, State Up, Flags: [none], length: 24
 00:00:00.886476 eth3  Out IP 10.0.34.2.38216 > 10.0.34.3.3784: BFDv1, Control, State Up, Flags: [none], length: 24
 00:00:00.913698 eth1  Out IP 10.0.13.3.42552 > 10.0.13.2.3784: BFDv1, Control, State Up, Flags: [none], length: 24
 00:00:00.921834 eth2  Out IP 10.0.23.3.59324 > 10.0.23.2.3784: BFDv1, Control, State Up, Flags: [none], length: 24
 00:00:00.934228 eth0  In  IP 10.0.35.3.48498 > 10.0.35.2.3784: BFDv1, Control, State Up, Flags: [none], length: 24
 00:00:00.949357 eth1  In  IP 10.0.13.2.32837 > 10.0.13.3.3784: BFDv1, Control, State Up, Flags: [none], length: 24
 00:00:00.955689 eth2  In  IP 10.0.23.2.41179 > 10.0.23.3.3784: BFDv1, Control, State Up, Flags: [none], length: 24
 00:00:00.961845 eth3  In  IP 10.0.34.3.56678 > 10.0.34.2.3784: BFDv1, Control, State Up, Flags: [none], length: 24
 00:00:00.970067 eth0  Out IP 10.0.35.2.59307 > 10.0.35.3.3784: BFDv1, Control, State Up, Flags: [none], length: 24
 00:00:00.970130 eth3  Out IP 10.0.34.2.38216 > 10.0.34.3.3784: BFDv1, Control, State Up, Flags: [none], length: 24
 00:00:01.003299 eth1  Out IP 10.0.13.3.42552 > 10.0.13.2.3784: BFDv1, Control, State Up, Flags: [none], length: 24
 00:00:01.008450 eth2  Out IP 10.0.23.3.59324 > 10.0.23.2.3784: BFDv1, Control, State Up, Flags: [none], length: 24
 00:00:01.013703 eth0  In  IP 10.0.35.3.48498 > 10.0.35.2.3784: BFDv1, Control, State Up, Flags: [none], length: 24
 00:00:01.025687 eth1  In  IP 10.0.13.2.32837 > 10.0.13.3.3784: BFDv1, Control, State Up, Flags: [none], length: 24
 00:00:01.040967 eth2  In  IP 10.0.23.2.41179 > 10.0.23.3.3784: BFDv1, Control, State Up, Flags: [none], length: 24
 00:00:01.045946 eth3  In  IP 10.0.34.3.56678 > 10.0.34.2.3784: BFDv1, Control, State Up, Flags: [none], length: 24
 00:00:01.049187 eth0  Out IP 10.0.35.2.59307 > 10.0.35.3.3784: BFDv1, Control, State Up, Flags: [none], length: 24
 00:00:01.053358 eth3  Out IP 10.0.34.2.38216 > 10.0.34.3.3784: BFDv1, Control, State Up, Flags: [none], length: 24
 00:00:01.089547 eth1  Out IP 10.0.13.3.42552 > 10.0.13.2.3784: BFDv1, Control, State Up, Flags: [none], length: 24
 00:00:01.097782 eth2  Out IP 10.0.23.3.59324 > 10.0.23.2.3784: BFDv1, Control, State Up, Flags: [none], length: 24
 00:00:01.101266 eth0  In  IP 10.0.35.3.48498 > 10.0.35.2.3784: BFDv1, Control, State Up, Flags: [none], length: 24
 00:00:01.111261 eth1  In  IP 10.0.13.2.32837 > 10.0.13.3.3784: BFDv1, Control, State Up, Flags: [none], length: 24
 00:00:01.120420 eth2  In  IP 10.0.23.2.41179 > 10.0.23.3.3784: BFDv1, Control, State Up, Flags: [none], length: 24
 00:00:01.130770 eth3  Out IP 10.0.34.2.38216 > 10.0.34.3.3784: BFDv1, Control, State Up, Flags: [none], length: 24
 00:00:01.131912 eth3  In  IP 10.0.34.3.56678 > 10.0.34.2.3784: BFDv1, Control, State Up, Flags: [none], length: 24
 00:00:01.134087 eth0  Out IP 10.0.35.2.59307 > 10.0.35.3.3784: BFDv1, Control, State Up, Flags: [none], length: 24
 00:00:01.177752 eth1  Out IP 10.0.13.3.42552 > 10.0.13.2.3784: BFDv1, Control, State Up, Flags: [none], length: 24
 00:00:01.177777 eth0  In  IP 10.0.35.3.48498 > 10.0.35.2.3784: BFDv1, Control, State Up, Flags: [none], length: 24
 00:00:01.180031 eth2  Out IP 10.0.23.3.59324 > 10.0.23.2.3784: BFDv1, Control, State Up, Flags: [none], length: 24
 00:00:01.187096 eth1  In  IP 10.0.13.2.32837 > 10.0.13.3.3784: BFDv1, Control, State Up, Flags: [none], length: 24
 00:00:01.204486 eth2  In  IP 10.0.23.2.41179 > 10.0.23.3.3784: BFDv1, Control, State Up, Flags: [none], length: 24
 00:00:01.208703 eth3  Out IP 10.0.34.2.38216 > 10.0.34.3.3784: BFDv1, Control, State Up, Flags: [none], length: 24
 00:00:01.211871 eth3  In  IP 10.0.34.3.56678 > 10.0.34.2.3784: BFDv1, Control, State Up, Flags: [none], length: 24
 00:00:01.215086 eth0  Out IP 10.0.35.2.59307 > 10.0.35.3.3784: BFDv1, Control, State Up, Flags: [none], length: 24
 00:00:01.257264 eth2  Out IP 10.0.23.3.59324 > 10.0.23.2.3784: BFDv1, Control, State Up, Flags: [none], length: 24
 00:00:01.260284 eth0  In  IP 10.0.35.3.48498 > 10.0.35.2.3784: BFDv1, Control, State Up, Flags: [none], length: 24
 00:00:01.261582 eth1  Out IP 10.0.13.3.42552 > 10.0.13.2.3784: BFDv1, Control, State Up, Flags: [none], length: 24
 00:00:01.277128 eth1  In  IP 10.0.13.2.32837 > 10.0.13.3.3784: BFDv1, Control, State Up, Flags: [none], length: 24
 00:00:01.287288 eth2  In  IP 10.0.23.2.41179 > 10.0.23.3.3784: BFDv1, Control, State Up, Flags: [none], length: 24
 00:00:01.295568 eth0  Out IP 10.0.35.2.59307 > 10.0.35.3.3784: BFDv1, Control, State Up, Flags: [none], length: 24
 00:00:01.296236 eth3  In  IP 10.0.34.3.56678 > 10.0.34.2.3784: BFDv1, Control, State Up, Flags: [none], length: 24
 00:00:01.298427 eth3  Out IP 10.0.34.2.38216 > 10.0.34.3.3784: BFDv1, Control, State Up, Flags: [none], length: 24
 00:00:01.335598 eth2  Out IP 10.0.23.3.59324 > 10.0.23.2.3784: BFDv1, Control, State Up, Flags: [none], length: 24
 00:00:01.345749 eth1  Out IP 10.0.13.3.42552 > 10.0.13.2.3784: BFDv1, Control, State Up, Flags: [none], length: 24
 00:00:01.349856 eth0  In  IP 10.0.35.3.48498 > 10.0.35.2.3784: BFDv1, Control, State Up, Flags: [none], length: 24
 00:00:01.363618 eth1  In  IP 10.0.13.2.32837 > 10.0.13.3.3784: BFDv1, Control, State Up, Flags: [none], length: 24
 00:00:01.365025 eth2  In  IP 10.0.23.2.41179 > 10.0.23.3.3784: BFDv1, Control, State Up, Flags: [none], length: 24
 00:00:01.378280 eth0  Out IP 10.0.35.2.59307 > 10.0.35.3.3784: BFDv1, Control, State Up, Flags: [none], length: 24
 00:00:01.383032 eth3  In  IP 10.0.34.3.56678 > 10.0.34.2.3784: BFDv1, Control, State Up, Flags: [none], length: 24
 00:00:01.386296 eth3  Out IP 10.0.34.2.38216 > 10.0.34.3.3784: BFDv1, Control, State Up, Flags: [none], length: 24
 00:00:01.420471 eth2  Out IP 10.0.23.3.59324 > 10.0.23.2.3784: BFDv1, Control, State Up, Flags: [none], length: 24
 00:00:01.421605 eth1  Out IP 10.0.13.3.42552 > 10.0.13.2.3784: BFDv1, Control, State Up, Flags: [none], length: 24
 00:00:01.431302 eth0  In  IP 10.0.35.3.48498 > 10.0.35.2.3784: BFDv1, Control, State Up, Flags: [none], length: 24
 00:00:01.440871 eth1  In  IP 10.0.13.2.32837 > 10.0.13.3.3784: BFDv1, Control, State Up, Flags: [none], length: 24
 00:00:01.445390 eth2  In  IP 10.0.23.2.41179 > 10.0.23.3.3784: BFDv1, Control, State Up, Flags: [none], length: 24
 00:00:01.454601 eth0  Out IP 10.0.35.2.59307 > 10.0.35.3.3784: BFDv1, Control, State Up, Flags: [none], length: 24
 00:00:01.459365 eth3  In  IP 10.0.34.3.56678 > 10.0.34.2.3784: BFDv1, Control, State Up, Flags: [none], length: 24
 00:00:01.468683 eth3  Out IP 10.0.34.2.38216 > 10.0.34.3.3784: BFDv1, Control, State Up, Flags: [none], length: 24
 00:00:01.498888 eth2  Out IP 10.0.23.3.59324 > 10.0.23.2.3784: BFDv1, Control, State Up, Flags: [none], length: 24
 00:00:01.508091 eth1  Out IP 10.0.13.3.42552 > 10.0.13.2.3784: BFDv1, Control, State Up, Flags: [none], length: 24
 00:00:01.517744 eth1  In  IP 10.0.13.2.32837 > 10.0.13.3.3784: BFDv1, Control, State Up, Flags: [none], length: 24
 00:00:01.518774 eth0  In  IP 10.0.35.3.48498 > 10.0.35.2.3784: BFDv1, Control, State Up, Flags: [none], length: 24
 00:00:01.522220 eth2  In  IP 10.0.23.2.41179 > 10.0.23.3.3784: BFDv1, Control, State Up, Flags: [none], length: 24
 00:00:01.542504 eth0  Out IP 10.0.35.2.59307 > 10.0.35.3.3784: BFDv1, Control, State Up, Flags: [none], length: 24
 00:00:01.546365 eth3  In  IP 10.0.34.3.56678 > 10.0.34.2.3784: BFDv1, Control, State Up, Flags: [none], length: 24
 00:00:01.555564 eth3  Out IP 10.0.34.2.38216 > 10.0.34.3.3784: BFDv1, Control, State Up, Flags: [none], length: 24
 00:00:01.577769 eth2  Out IP 10.0.23.3.59324 > 10.0.23.2.3784: BFDv1, Control, State Up, Flags: [none], length: 24
 00:00:01.591913 eth1  Out IP 10.0.13.3.42552 > 10.0.13.2.3784: BFDv1, Control, State Up, Flags: [none], length: 24
 00:00:01.600417 eth2  In  IP 10.0.23.2.41179 > 10.0.23.3.3784: BFDv1, Control, State Up, Flags: [none], length: 24
 00:00:01.603322 eth0  In  IP 10.0.35.3.48498 > 10.0.35.2.3784: BFDv1, Control, State Up, Flags: [none], length: 24
 00:00:01.605203 eth1  In  IP 10.0.13.2.32837 > 10.0.13.3.3784: BFDv1, Control, State Up, Flags: [none], length: 24
 00:00:01.621409 eth0  Out IP 10.0.35.2.59307 > 10.0.35.3.3784: BFDv1, Control, State Up, Flags: [none], length: 24
 00:00:01.627766 eth3  In  IP 10.0.34.3.56678 > 10.0.34.2.3784: BFDv1, Control, State Up, Flags: [none], length: 24
 00:00:01.632962 eth3  Out IP 10.0.34.2.38216 > 10.0.34.3.3784: BFDv1, Control, State Up, Flags: [none], length: 24
 00:00:01.658115 eth2  Out IP 10.0.23.3.59324 > 10.0.23.2.3784: BFDv1, Control, State Up, Flags: [none], length: 24
 00:00:01.675254 eth1  Out IP 10.0.13.3.42552 > 10.0.13.2.3784: BFDv1, Control, State Up, Flags: [none], length: 24
 00:00:01.684172 eth2  In  IP 10.0.23.2.41179 > 10.0.23.3.3784: BFDv1, Control, State Up, Flags: [none], length: 24
 00:00:01.684471 eth1  In  IP 10.0.13.2.32837 > 10.0.13.3.3784: BFDv1, Control, State Up, Flags: [none], length: 24
 00:00:01.687813 eth0  In  IP 10.0.35.3.48498 > 10.0.35.2.3784: BFDv1, Control, State Up, Flags: [none], length: 24
 00:00:01.706805 eth3  In  IP 10.0.34.3.56678 > 10.0.34.2.3784: BFDv1, Control, State Up, Flags: [none], length: 24
 00:00:01.706946 eth0  Out IP 10.0.35.2.59307 > 10.0.35.3.3784: BFDv1, Control, State Up, Flags: [none], length: 24
 00:00:01.710136 eth3  Out IP 10.0.34.2.38216 > 10.0.34.3.3784: BFDv1, Control, State Up, Flags: [none], length: 24
 00:00:01.740315 eth2  Out IP 10.0.23.3.59324 > 10.0.23.2.3784: BFDv1, Control, State Up, Flags: [none], length: 24
 00:00:01.756495 eth1  Out IP 10.0.13.3.42552 > 10.0.13.2.3784: BFDv1, Control, State Up, Flags: [none], length: 24
 00:00:01.762995 eth2  In  IP 10.0.23.2.41179 > 10.0.23.3.3784: BFDv1, Control, State Up, Flags: [none], length: 24
 00:00:01.770398 eth0  In  IP 10.0.35.3.48498 > 10.0.35.2.3784: BFDv1, Control, State Up, Flags: [none], length: 24
 00:00:01.771781 eth1  In  IP 10.0.13.2.32837 > 10.0.13.3.3784: BFDv1, Control, State Up, Flags: [none], length: 24
 00:00:01.785950 eth0  Out IP 10.0.35.2.59307 > 10.0.35.3.3784: BFDv1, Control, State Up, Flags: [none], length: 24
 00:00:01.790072 eth3  Out IP 10.0.34.2.38216 > 10.0.34.3.3784: BFDv1, Control, State Up, Flags: [none], length: 24
 00:00:01.792275 eth3  In  IP 10.0.34.3.56678 > 10.0.34.2.3784: BFDv1, Control, State Up, Flags: [none], length: 24
 00:00:01.828561 eth2  Out IP 10.0.23.3.59324 > 10.0.23.2.3784: BFDv1, Control, State Up, Flags: [none], length: 24
 00:00:01.838761 eth1  Out IP 10.0.13.3.42552 > 10.0.13.2.3784: BFDv1, Control, State Up, Flags: [none], length: 24
 00:00:01.846482 eth0  In  IP 10.0.35.3.48498 > 10.0.35.2.3784: BFDv1, Control, State Up, Flags: [none], length: 24
 00:00:01.851705 eth2  In  IP 10.0.23.2.41179 > 10.0.23.3.3784: BFDv1, Control, State Up, Flags: [none], length: 24
 00:00:01.852133 eth1  In  IP 10.0.13.2.32837 > 10.0.13.3.3784: BFDv1, Control, State Up, Flags: [none], length: 24
 00:00:01.868004 eth3  In  IP 10.0.34.3.56678 > 10.0.34.2.3784: BFDv1, Control, State Up, Flags: [none], length: 24
 00:00:01.871397 eth0  Out IP 10.0.35.2.59307 > 10.0.35.3.3784: BFDv1, Control, State Up, Flags: [none], length: 24
 00:00:01.872810 eth3  Out IP 10.0.34.2.38216 > 10.0.34.3.3784: BFDv1, Control, State Up, Flags: [none], length: 24
 00:00:01.912964 eth2  Out IP 10.0.23.3.59324 > 10.0.23.2.3784: BFDv1, Control, State Up, Flags: [none], length: 24
 00:00:01.924131 eth1  Out IP 10.0.13.3.42552 > 10.0.13.2.3784: BFDv1, Control, State Up, Flags: [none], length: 24
 00:00:01.930279 eth1  In  IP 10.0.13.2.32837 > 10.0.13.3.3784: BFDv1, Control, State Up, Flags: [none], length: 24
 00:00:01.934975 eth0  In  IP 10.0.35.3.48498 > 10.0.35.2.3784: BFDv1, Control, State Up, Flags: [none], length: 24
 00:00:01.938291 eth2  In  IP 10.0.23.2.41179 > 10.0.23.3.3784: BFDv1, Control, State Up, Flags: [none], length: 24
 00:00:01.951345 eth3  In  IP 10.0.34.3.56678 > 10.0.34.2.3784: BFDv1, Control, State Up, Flags: [none], length: 24
 00:00:01.959520 eth3  Out IP 10.0.34.2.38216 > 10.0.34.3.3784: BFDv1, Control, State Up, Flags: [none], length: 24
 00:00:01.959542 eth0  Out IP 10.0.35.2.59307 > 10.0.35.3.3784: BFDv1, Control, State Up, Flags: [none], length: 24
 00:00:01.991767 eth2  Out IP 10.0.23.3.59324 > 10.0.23.2.3784: BFDv1, Control, State Up, Flags: [none], length: 24
 00:00:02.005032 eth1  Out IP 10.0.13.3.42552 > 10.0.13.2.3784: BFDv1, Control, State Up, Flags: [none], length: 24
 00:00:02.011359 eth0  In  IP 10.0.35.3.48498 > 10.0.35.2.3784: BFDv1, Control, State Up, Flags: [none], length: 24
 00:00:02.019191 eth1  In  IP 10.0.13.2.32837 > 10.0.13.3.3784: BFDv1, Control, State Up, Flags: [none], length: 24
 00:00:02.021146 eth2  In  IP 10.0.23.2.41179 > 10.0.23.3.3784: BFDv1, Control, State Up, Flags: [none], length: 24
 00:00:02.030173 eth3  In  IP 10.0.34.3.56678 > 10.0.34.2.3784: BFDv1, Control, State Up, Flags: [none], length: 24
 00:00:02.044377 eth3  Out IP 10.0.34.2.38216 > 10.0.34.3.3784: BFDv1, Control, State Up, Flags: [none], length: 24
 00:00:02.046504 eth0  Out IP 10.0.35.2.59307 > 10.0.35.3.3784: BFDv1, Control, State Up, Flags: [none], length: 24
 00:00:02.073670 eth2  Out IP 10.0.23.3.59324 > 10.0.23.2.3784: BFDv1, Control, State Up, Flags: [none], length: 24
 00:00:02.090868 eth1  Out IP 10.0.13.3.42552 > 10.0.13.2.3784: BFDv1, Control, State Up, Flags: [none], length: 24
 00:00:02.097728 eth0  In  IP 10.0.35.3.48498 > 10.0.35.2.3784: BFDv1, Control, State Up, Flags: [none], length: 24
 00:00:02.098860 eth2  In  IP 10.0.23.2.41179 > 10.0.23.3.3784: BFDv1, Control, State Up, Flags: [none], length: 24
 00:00:02.106059 eth1  In  IP 10.0.13.2.32837 > 10.0.13.3.3784: BFDv1, Control, State Up, Flags: [none], length: 24
 00:00:02.111859 eth3  In  IP 10.0.34.3.56678 > 10.0.34.2.3784: BFDv1, Control, State Up, Flags: [none], length: 24
 00:00:02.132282 eth0  Out IP 10.0.35.2.59307 > 10.0.35.3.3784: BFDv1, Control, State Up, Flags: [none], length: 24
 00:00:02.155447 eth2  Out IP 10.0.23.3.59324 > 10.0.23.2.3784: BFDv1, Control, State Up, Flags: [none], length: 24
 00:00:02.166602 eth1  Out IP 10.0.13.3.42552 > 10.0.13.2.3784: BFDv1, Control, State Up, Flags: [none], length: 24
 00:00:02.177542 eth2  In  IP 10.0.23.2.41179 > 10.0.23.3.3784: BFDv1, Control, State Up, Flags: [none], length: 24
 00:00:02.184225 eth0  In  IP 10.0.35.3.48498 > 10.0.35.2.3784: BFDv1, Control, State Up, Flags: [none], length: 24
 00:00:02.188810 eth1  In  IP 10.0.13.2.32837 > 10.0.13.3.3784: BFDv1, Control, State Up, Flags: [none], length: 24
 00:00:02.218918 eth0  Out IP 10.0.35.2.59307 > 10.0.35.3.3784: BFDv1, Control, State Up, Flags: [none], length: 24
 00:00:02.240109 eth2  Out IP 10.0.23.3.59324 > 10.0.23.2.3784: BFDv1, Control, State Up, Flags: [none], length: 24
 00:00:02.253287 eth1  Out IP 10.0.13.3.42552 > 10.0.13.2.3784: BFDv1, Control, State Up, Flags: [none], length: 24
 00:00:02.259087 eth0  In  IP 10.0.35.3.48498 > 10.0.35.2.3784: BFDv1, Control, State Up, Flags: [none], length: 24
 00:00:02.263920 eth2  In  IP 10.0.23.2.41179 > 10.0.23.3.3784: BFDv1, Control, State Up, Flags: [none], length: 24
 00:00:02.277286 eth1  In  IP 10.0.13.2.32837 > 10.0.13.3.3784: BFDv1, Control, State Up, Flags: [none], length: 24
 00:00:02.293520 eth0  Out IP 10.0.35.2.59307 > 10.0.35.3.3784: BFDv1, Control, State Up, Flags: [none], length: 24
 00:00:02.319760 eth2  Out IP 10.0.23.3.59324 > 10.0.23.2.3784: BFDv1, Control, State Up, Flags: [none], length: 24
 00:00:02.334626 eth0  In  IP 10.0.35.3.48498 > 10.0.35.2.3784: BFDv1, Control, State Up, Flags: [none], length: 24
 00:00:02.336875 eth1  Out IP 10.0.13.3.42552 > 10.0.13.2.3784: BFDv1, Control, State Up, Flags: [none], length: 24
 00:00:02.344971 eth2  In  IP 10.0.23.2.41179 > 10.0.23.3.3784: BFDv1, Control, State Up, Flags: [none], length: 24
 00:00:02.358409 eth1  In  IP 10.0.13.2.32837 > 10.0.13.3.3784: BFDv1, Control, State Up, Flags: [none], length: 24
 00:00:02.370616 eth0  Out IP 10.0.35.2.59307 > 10.0.35.3.3784: BFDv1, Control, State Up, Flags: [none], length: 24
 00:00:02.394931 eth2  Out IP 10.0.23.3.59324 > 10.0.23.2.3784: BFDv1, Control, State Up, Flags: [none], length: 24
 00:00:02.414166 eth0  In  IP 10.0.35.3.48498 > 10.0.35.2.3784: BFDv1, Control, State Up, Flags: [none], length: 24
 00:00:02.417360 eth1  Out IP 10.0.13.3.42552 > 10.0.13.2.3784: BFDv1, Control, State Up, Flags: [none], length: 24
 00:00:02.424792 eth2  In  IP 10.0.23.2.41179 > 10.0.23.3.3784: BFDv1, Control, State Up, Flags: [none], length: 24
 00:00:02.439450 eth1  In  IP 10.0.13.2.32837 > 10.0.13.3.3784: BFDv1, Control, State Up, Flags: [none], length: 24
 00:00:02.446678 eth0  Out IP 10.0.35.2.59307 > 10.0.35.3.3784: BFDv1, Control, State Up, Flags: [none], length: 24
 00:00:02.481975 eth2  Out IP 10.0.23.3.59324 > 10.0.23.2.3784: BFDv1, Control, State Up, Flags: [none], length: 24
 00:00:02.500224 eth0  In  IP 10.0.35.3.48498 > 10.0.35.2.3784: BFDv1, Control, State Up, Flags: [none], length: 24
 00:00:02.500801 eth2  In  IP 10.0.23.2.41179 > 10.0.23.3.3784: BFDv1, Control, State Up, Flags: [none], length: 24
 00:00:02.503925 eth1  Out IP 10.0.13.3.42552 > 10.0.13.2.3784: BFDv1, Control, State Up, Flags: [none], length: 24
 00:00:02.526383 eth1  In  IP 10.0.13.2.32837 > 10.0.13.3.3784: BFDv1, Control, State Up, Flags: [none], length: 24
 00:00:02.527613 eth0  Out IP 10.0.35.2.59307 > 10.0.35.3.3784: BFDv1, Control, State Up, Flags: [none], length: 24
 00:00:02.563196 eth2  Out IP 10.0.23.3.59324 > 10.0.23.2.3784: BFDv1, Control, State Up, Flags: [none], length: 24
 00:00:02.583520 eth1  Out IP 10.0.13.3.42552 > 10.0.13.2.3784: BFDv1, Control, State Up, Flags: [none], length: 24
 00:00:02.585824 eth2  In  IP 10.0.23.2.41179 > 10.0.23.3.3784: BFDv1, Control, State Up, Flags: [none], length: 24
 00:00:02.590595 eth0  In  IP 10.0.35.3.48498 > 10.0.35.2.3784: BFDv1, Control, State Up, Flags: [none], length: 24
 00:00:02.604907 eth0  Out IP 10.0.35.2.59307 > 10.0.35.3.3784: BFDv1, Control, State Up, Flags: [none], length: 24
 00:00:02.605083 eth1  In  IP 10.0.13.2.32837 > 10.0.13.3.3784: BFDv1, Control, State Up, Flags: [none], length: 24
 00:00:02.648523 eth2  Out IP 10.0.23.3.59324 > 10.0.23.2.3784: BFDv1, Control, State Up, Flags: [none], length: 24
 00:00:02.661703 eth2  In  IP 10.0.23.2.41179 > 10.0.23.3.3784: BFDv1, Control, State Up, Flags: [none], length: 24
 00:00:02.669899 eth1  Out IP 10.0.13.3.42552 > 10.0.13.2.3784: BFDv1, Control, State Up, Flags: [none], length: 24
 00:00:02.670941 eth0  In  IP 10.0.35.3.48498 > 10.0.35.2.3784: BFDv1, Control, State Up, Flags: [none], length: 24
 00:00:02.686151 eth0  Out IP 10.0.35.2.59307 > 10.0.35.3.3784: BFDv1, Control, State Up, Flags: [none], length: 24
 00:00:02.686828 eth1  In  IP 10.0.13.2.32837 > 10.0.13.3.3784: BFDv1, Control, State Up, Flags: [none], length: 24
 00:00:02.730061 eth2  Out IP 10.0.23.3.59324 > 10.0.23.2.3784: BFDv1, Control, State Up, Flags: [none], length: 24
 00:00:02.744640 eth2  In  IP 10.0.23.2.41179 > 10.0.23.3.3784: BFDv1, Control, State Up, Flags: [none], length: 24
 00:00:02.755882 eth1  Out IP 10.0.13.3.42552 > 10.0.13.2.3784: BFDv1, Control, State Up, Flags: [none], length: 24
 00:00:02.760284 eth0  In  IP 10.0.35.3.48498 > 10.0.35.2.3784: BFDv1, Control, State Up, Flags: [none], length: 24
 00:00:02.773560 eth0  Out IP 10.0.35.2.59307 > 10.0.35.3.3784: BFDv1, Control, State Up, Flags: [none], length: 24
 00:00:02.773670 eth1  In  IP 10.0.13.2.32837 > 10.0.13.3.3784: BFDv1, Control, State Up, Flags: [none], length: 24
 00:00:02.817895 eth2  Out IP 10.0.23.3.59324 > 10.0.23.2.3784: BFDv1, Control, State Up, Flags: [none], length: 24
 00:00:02.819112 eth2  In  IP 10.0.23.2.41179 > 10.0.23.3.3784: BFDv1, Control, State Up, Flags: [none], length: 24
 00:00:02.839944 eth0  In  IP 10.0.35.3.48498 > 10.0.35.2.3784: BFDv1, Control, State Up, Flags: [none], length: 24
 00:00:02.842199 eth1  Out IP 10.0.13.3.42552 > 10.0.13.2.3784: BFDv1, Control, State Up, Flags: [none], length: 24
 00:00:02.852409 eth0  Out IP 10.0.35.2.59307 > 10.0.35.3.3784: BFDv1, Control, State Up, Flags: [none], length: 24
 00:00:02.859399 eth1  In  IP 10.0.13.2.32837 > 10.0.13.3.3784: BFDv1, Control, State Up, Flags: [none], length: 24
 00:00:02.900712 eth2  Out IP 10.0.23.3.59324 > 10.0.23.2.3784: BFDv1, Control, State Up, Flags: [none], length: 24
 00:00:02.904862 eth2  In  IP 10.0.23.2.41179 > 10.0.23.3.3784: BFDv1, Control, State Up, Flags: [none], length: 24
 00:00:02.921359 eth0  In  IP 10.0.35.3.48498 > 10.0.35.2.3784: BFDv1, Control, State Up, Flags: [none], length: 24
 00:00:02.923563 eth1  Out IP 10.0.13.3.42552 > 10.0.13.2.3784: BFDv1, Control, State Up, Flags: [none], length: 24
 00:00:02.938116 eth1  In  IP 10.0.13.2.32837 > 10.0.13.3.3784: BFDv1, Control, State Up, Flags: [none], length: 24
 00:00:02.942302 eth0  Out IP 10.0.35.2.59307 > 10.0.35.3.3784: BFDv1, Control, State Up, Flags: [none], length: 24
 00:00:02.981310 eth2  In  IP 10.0.23.2.41179 > 10.0.23.3.3784: BFDv1, Control, State Up, Flags: [none], length: 24
 00:00:02.981409 eth2  Out IP 10.0.23.3.59324 > 10.0.23.2.3784: BFDv1, Control, State Up, Flags: [none], length: 24
 00:00:03.005569 eth1  Out IP 10.0.13.3.42552 > 10.0.13.2.3784: BFDv1, Control, State Up, Flags: [none], length: 24
 00:00:03.010707 eth0  In  IP 10.0.35.3.48498 > 10.0.35.2.3784: BFDv1, Control, State Up, Flags: [none], length: 24
 00:00:03.020905 eth0  Out IP 10.0.35.2.59307 > 10.0.35.3.3784: BFDv1, Control, State Up, Flags: [none], length: 24
 00:00:03.022613 eth1  In  IP 10.0.13.2.32837 > 10.0.13.3.3784: BFDv1, Control, State Up, Flags: [none], length: 24
 00:00:03.069631 eth2  In  IP 10.0.23.2.41179 > 10.0.23.3.3784: BFDv1, Control, State Up, Flags: [none], length: 24
 00:00:03.071835 eth2  Out IP 10.0.23.3.59324 > 10.0.23.2.3784: BFDv1, Control, State Up, Flags: [none], length: 24
 00:00:03.087983 eth1  Out IP 10.0.13.3.42552 > 10.0.13.2.3784: BFDv1, Control, State Up, Flags: [none], length: 24
 00:00:03.097071 eth0  In  IP 10.0.35.3.48498 > 10.0.35.2.3784: BFDv1, Control, State Up, Flags: [none], length: 24
 00:00:03.097136 eth0  Out IP 10.0.35.2.59307 > 10.0.35.3.3784: BFDv1, Control, State Up, Flags: [none], length: 24
 00:00:03.109941 eth1  In  IP 10.0.13.2.32837 > 10.0.13.3.3784: BFDv1, Control, State Up, Flags: [none], length: 24
 00:00:03.156383 eth2  In  IP 10.0.23.2.41179 > 10.0.23.3.3784: BFDv1, Control, State Up, Flags: [none], length: 24
 00:00:03.160596 eth2  Out IP 10.0.23.3.59324 > 10.0.23.2.3784: BFDv1, Control, State Up, Flags: [none], length: 24
 00:00:03.173792 eth0  Out IP 10.0.35.2.59307 > 10.0.35.3.3784: BFDv1, Control, State Up, Flags: [none], length: 24
 00:00:03.175952 eth1  Out IP 10.0.13.3.42552 > 10.0.13.2.3784: BFDv1, Control, State Up, Flags: [none], length: 24
 00:00:03.184987 eth0  In  IP 10.0.35.3.48498 > 10.0.35.2.3784: BFDv1, Control, State Up, Flags: [none], length: 24
 00:00:03.199977 eth1  In  IP 10.0.13.2.32837 > 10.0.13.3.3784: BFDv1, Control, State Up, Flags: [none], length: 24
 00:00:03.232335 eth2  In  IP 10.0.23.2.41179 > 10.0.23.3.3784: BFDv1, Control, State Up, Flags: [none], length: 24
 00:00:03.248596 eth2  Out IP 10.0.23.3.59324 > 10.0.23.2.3784: BFDv1, Control, State Up, Flags: [none], length: 24
 00:00:03.258786 eth0  Out IP 10.0.35.2.59307 > 10.0.35.3.3784: BFDv1, Control, State Up, Flags: [none], length: 24
 00:00:03.263931 eth1  Out IP 10.0.13.3.42552 > 10.0.13.2.3784: BFDv1, Control, State Up, Flags: [none], length: 24
 00:00:03.266946 eth0  In  IP 10.0.35.3.48498 > 10.0.35.2.3784: BFDv1, Control, State Up, Flags: [none], length: 24
 00:00:03.277954 eth1  In  IP 10.0.13.2.32837 > 10.0.13.3.3784: BFDv1, Control, State Up, Flags: [none], length: 24
 00:00:03.311203 eth2  In  IP 10.0.23.2.41179 > 10.0.23.3.3784: BFDv1, Control, State Up, Flags: [none], length: 24
 00:00:03.327493 eth2  Out IP 10.0.23.3.59324 > 10.0.23.2.3784: BFDv1, Control, State Up, Flags: [none], length: 24
 00:00:03.343844 eth1  Out IP 10.0.13.3.42552 > 10.0.13.2.3784: BFDv1, Control, State Up, Flags: [none], length: 24
 00:00:03.347997 eth0  Out IP 10.0.35.2.59307 > 10.0.35.3.3784: BFDv1, Control, State Up, Flags: [none], length: 24
 00:00:03.350198 eth0  In  IP 10.0.35.3.48498 > 10.0.35.2.3784: BFDv1, Control, State Up, Flags: [none], length: 24
 00:00:03.362954 eth1  In  IP 10.0.13.2.32837 > 10.0.13.3.3784: BFDv1, Control, State Up, Flags: [none], length: 24
 00:00:03.389038 eth2  In  IP 10.0.23.2.41179 > 10.0.23.3.3784: BFDv1, Control, State Up, Flags: [none], length: 24
 00:00:03.410233 eth2  Out IP 10.0.23.3.59324 > 10.0.23.2.3784: BFDv1, Control, State Up, Flags: [none], length: 24
 00:00:03.420394 eth1  Out IP 10.0.13.3.42552 > 10.0.13.2.3784: BFDv1, Control, State Up, Flags: [none], length: 24
 00:00:03.431631 eth0  In  IP 10.0.35.3.48498 > 10.0.35.2.3784: BFDv1, Control, State Up, Flags: [none], length: 24
 00:00:03.436858 eth0  Out IP 10.0.35.2.59307 > 10.0.35.3.3784: BFDv1, Control, State Up, Flags: [none], length: 24
 00:00:03.445604 eth1  In  IP 10.0.13.2.32837 > 10.0.13.3.3784: BFDv1, Control, State Up, Flags: [none], length: 24
 00:00:03.468799 eth2  In  IP 10.0.23.2.41179 > 10.0.23.3.3784: BFDv1, Control, State Up, Flags: [none], length: 24
 00:00:03.488007 eth2  Out IP 10.0.23.3.59324 > 10.0.23.2.3784: BFDv1, Control, State Up, Flags: [none], length: 24
 00:00:03.508193 eth1  Out IP 10.0.13.3.42552 > 10.0.13.2.3784: BFDv1, Control, State Up, Flags: [none], length: 24
 00:00:03.517318 eth0  Out IP 10.0.35.2.59307 > 10.0.35.3.3784: BFDv1, Control, State Up, Flags: [none], length: 24
 00:00:03.517362 eth0  In  IP 10.0.35.3.48498 > 10.0.35.2.3784: BFDv1, Control, State Up, Flags: [none], length: 24
 00:00:03.530490 eth1  In  IP 10.0.13.2.32837 > 10.0.13.3.3784: BFDv1, Control, State Up, Flags: [none], length: 24
 00:00:03.548598 eth2  In  IP 10.0.23.2.41179 > 10.0.23.3.3784: BFDv1, Control, State Up, Flags: [none], length: 24
 00:00:03.566795 eth2  Out IP 10.0.23.3.59324 > 10.0.23.2.3784: BFDv1, Control, State Up, Flags: [none], length: 24
 00:00:03.586992 eth1  Out IP 10.0.13.3.42552 > 10.0.13.2.3784: BFDv1, Control, State Up, Flags: [none], length: 24
 00:00:03.592169 eth0  Out IP 10.0.35.2.59307 > 10.0.35.3.3784: BFDv1, Control, State Up, Flags: [none], length: 24
 00:00:03.597366 eth0  In  IP 10.0.35.3.48498 > 10.0.35.2.3784: BFDv1, Control, State Up, Flags: [none], length: 24
 00:00:03.608396 eth1  In  IP 10.0.13.2.32837 > 10.0.13.3.3784: BFDv1, Control, State Up, Flags: [none], length: 24
 00:00:03.628507 eth2  In  IP 10.0.23.2.41179 > 10.0.23.3.3784: BFDv1, Control, State Up, Flags: [none], length: 24
 00:00:03.642795 eth2  Out IP 10.0.23.3.59324 > 10.0.23.2.3784: BFDv1, Control, State Up, Flags: [none], length: 24
 00:00:03.665471 eth1  Out IP 10.0.13.3.42552 > 10.0.13.2.3784: BFDv1, Control, State Up, Flags: [none], length: 24
 00:00:03.675659 eth0  In  IP 10.0.35.3.48498 > 10.0.35.2.3784: BFDv1, Control, State Up, Flags: [none], length: 24
 00:00:03.678925 eth0  Out IP 10.0.35.2.59307 > 10.0.35.3.3784: BFDv1, Control, State Up, Flags: [none], length: 24
 00:00:03.693421 eth1  In  IP 10.0.13.2.32837 > 10.0.13.3.3784: BFDv1, Control, State Up, Flags: [none], length: 24
 00:00:03.710601 eth2  In  IP 10.0.23.2.41179 > 10.0.23.3.3784: BFDv1, Control, State Up, Flags: [none], length: 24
 00:00:03.721852 eth2  Out IP 10.0.23.3.59324 > 10.0.23.2.3784: BFDv1, Control, State Up, Flags: [none], length: 24
 00:00:03.748009 eth1  Out IP 10.0.13.3.42552 > 10.0.13.2.3784: BFDv1, Control, State Up, Flags: [none], length: 24
 00:00:03.757174 eth0  Out IP 10.0.35.2.59307 > 10.0.35.3.3784: BFDv1, Control, State Up, Flags: [none], length: 24
 00:00:03.762398 eth0  In  IP 10.0.35.3.48498 > 10.0.35.2.3784: BFDv1, Control, State Up, Flags: [none], length: 24
 00:00:03.770467 eth1  In  IP 10.0.13.2.32837 > 10.0.13.3.3784: BFDv1, Control, State Up, Flags: [none], length: 24
 00:00:03.794583 eth2  In  IP 10.0.23.2.41179 > 10.0.23.3.3784: BFDv1, Control, State Up, Flags: [none], length: 24
 00:00:03.800772 eth2  Out IP 10.0.23.3.59324 > 10.0.23.2.3784: BFDv1, Control, State Up, Flags: [none], length: 24
 00:00:03.837916 eth1  Out IP 10.0.13.3.42552 > 10.0.13.2.3784: BFDv1, Control, State Up, Flags: [none], length: 24
 00:00:03.841077 eth0  Out IP 10.0.35.2.59307 > 10.0.35.3.3784: BFDv1, Control, State Up, Flags: [none], length: 24
 00:00:03.844284 eth0  In  IP 10.0.35.3.48498 > 10.0.35.2.3784: BFDv1, Control, State Up, Flags: [none], length: 24
 00:00:03.847080 eth1  In  IP 10.0.13.2.32837 > 10.0.13.3.3784: BFDv1, Control, State Up, Flags: [none], length: 24
 00:00:03.883539 eth2  In  IP 10.0.23.2.41179 > 10.0.23.3.3784: BFDv1, Control, State Up, Flags: [none], length: 24
 00:00:03.883639 eth2  Out IP 10.0.23.3.59324 > 10.0.23.2.3784: BFDv1, Control, State Up, Flags: [none], length: 24
 00:00:03.918768 eth0  Out IP 10.0.35.2.59307 > 10.0.35.3.3784: BFDv1, Control, State Up, Flags: [none], length: 24
 00:00:03.926948 eth1  Out IP 10.0.13.3.42552 > 10.0.13.2.3784: BFDv1, Control, State Up, Flags: [none], length: 24
 00:00:03.927982 eth0  In  IP 10.0.35.3.48498 > 10.0.35.2.3784: BFDv1, Control, State Up, Flags: [none], length: 24
 00:00:03.930160 eth1  In  IP 10.0.13.2.32837 > 10.0.13.3.3784: BFDv1, Control, State Up, Flags: [none], length: 24
 00:00:03.962760 eth2  In  IP 10.0.23.2.41179 > 10.0.23.3.3784: BFDv1, Control, State Up, Flags: [none], length: 24
 00:00:03.967966 eth2  Out IP 10.0.23.3.59324 > 10.0.23.2.3784: BFDv1, Control, State Up, Flags: [none], length: 24
 00:00:04.002125 eth1  Out IP 10.0.13.3.42552 > 10.0.13.2.3784: BFDv1, Control, State Up, Flags: [none], length: 24
 00:00:04.006190 eth0  In  IP 10.0.35.3.48498 > 10.0.35.2.3784: BFDv1, Control, State Up, Flags: [none], length: 24
