tcpdump: data link type LINUX_SLL2
tcpdump: verbose output suppressed, use -v[v]... for full protocol decode
listening on any, link-type LINUX_SLL2 (Linux cooked v2), snapshot length 262144 bytes
 00:00:00.000000 eth2  In  IP 10.0.29.3.41893 > 10.0.29.2.3784: BFDv1, Control, State Up, Flags: [none], length: 24
 00:00:00.023326 eth2  Out IP 10.0.29.2.60400 > 10.0.29.3.3784: BFDv1, Control, State Up, Flags: [none], length: 24
 00:00:00.082972 eth2  In  IP 10.0.29.3.41893 > 10.0.29.2.3784: BFDv1, Control, State Up, Flags: [none], length: 24
 00:00:00.099223 eth2  Out IP 10.0.29.2.60400 > 10.0.29.3.3784: BFDv1, Control, State Up, Flags: [none], length: 24
 00:00:00.169895 eth2  In  IP 10.0.29.3.41893 > 10.0.29.2.3784: BFDv1, Control, State Up, Flags: [none], length: 24
 00:00:00.182215 eth2  Out IP 10.0.29.2.60400 > 10.0.29.3.3784: BFDv1, Control, State Up, Flags: [none], length: 24
 00:00:00.257144 eth2  In  IP 10.0.29.3.41893 > 10.0.29.2.3784: BFDv1, Control, State Up, Flags: [none], length: 24
 00:00:00.267546 eth2  Out IP 10.0.29.2.60400 > 10.0.29.3.3784: BFDv1, Control, State Up, Flags: [none], length: 24
 00:00:00.341410 eth2  In  IP 10.0.29.3.41893 > 10.0.29.2.3784: BFDv1, Control, State Up, Flags: [none], length: 24
 00:00:00.357733 eth2  Out IP 10.0.29.2.60400 > 10.0.29.3.3784: BFDv1, Control, State Up, Flags: [none], length: 24
 00:00:00.425813 eth2  In  IP 10.0.29.3.41893 > 10.0.29.2.3784: BFDv1, Control, State Up, Flags: [none], length: 24
 00:00:00.446254 eth2  Out IP 10.0.29.2.60400 > 10.0.29.3.3784: BFDv1, Control, State Up, Flags: [none], length: 24
 00:00:00.513133 eth2  In  IP 10.0.29.3.41893 > 10.0.29.2.3784: BFDv1, Control, State Up, Flags: [none], length: 24
 00:00:00.527531 eth2  Out IP 10.0.29.2.60400 > 10.0.29.3.3784: BFDv1, Control, State Up, Flags: [none], length: 24
 00:00:00.592701 eth2  In  IP 10.0.29.3.41893 > 10.0.29.2.3784: BFDv1, Control, State Up, Flags: [none], length: 24
 00:00:00.604001 eth2  Out IP 10.0.29.2.60400 > 10.0.29.3.3784: BFDv1, Control, State Up, Flags: [none], length: 24
 00:00:00.669029 eth2  In  IP 10.0.29.3.41893 > 10.0.29.2.3784: BFDv1, Control, State Up, Flags: [none], length: 24
 00:00:00.692412 eth2  Out IP 10.0.29.2.60400 > 10.0.29.3.3784: BFDv1, Control, State Up, Flags: [none], length: 24
 00:00:00.755158 eth2  In  IP 10.0.29.3.41893 > 10.0.29.2.3784: BFDv1, Control, State Up, Flags: [none], length: 24
 00:00:00.767497 eth2  Out IP 10.0.29.2.60400 > 10.0.29.3.3784: BFDv1, Control, State Up, Flags: [none], length: 24
 00:00:00.829520 eth2  In  IP 10.0.29.3.41893 > 10.0.29.2.3784: BFDv1, Control, State Up, Flags: [none], length: 24
 00:00:00.849879 eth2  Out IP 10.0.29.2.60400 > 10.0.29.3.3784: BFDv1, Control, State Up, Flags: [none], length: 24
 00:00:00.908683 eth2  In  IP 10.0.29.3.41893 > 10.0.29.2.3784: BFDv1, Control, State Up, Flags: [none], length: 24
 00:00:00.940002 eth2  Out IP 10.0.29.2.60400 > 10.0.29.3.3784: BFDv1, Control, State Up, Flags: [none], length: 24
 00:00:00.995582 eth2  In  IP 10.0.29.3.41893 > 10.0.29.2.3784: BFDv1, Control, State Up, Flags: [none], length: 24
 00:00:01.025995 eth2  Out IP 10.0.29.2.60400 > 10.0.29.3.3784: BFDv1, Control, State Up, Flags: [none], length: 24
 00:00:01.083623 eth2  In  IP 10.0.29.3.41893 > 10.0.29.2.3784: BFDv1, Control, State Up, Flags: [none], length: 24
 00:00:01.106084 eth2  Out IP 10.0.29.2.60400 > 10.0.29.3.3784: BFDv1, Control, State Up, Flags: [none], length: 24
 00:00:01.170753 eth2  In  IP 10.0.29.3.41893 > 10.0.29.2.3784: BFDv1, Control, State Up, Flags: [none], length: 24
 00:00:01.183096 eth2  Out IP 10.0.29.2.60400 > 10.0.29.3.3784: BFDv1, Control, State Up, Flags: [none], length: 24
 00:00:01.246742 eth2  In  IP 10.0.29.3.41893 > 10.0.29.2.3784: BFDv1, Control, State Up, Flags: [none], length: 24
 00:00:01.263998 eth2  Out IP 10.0.29.2.60400 > 10.0.29.3.3784: BFDv1, Control, State Up, Flags: [none], length: 24
 00:00:01.333676 eth2  In  IP 10.0.29.3.41893 > 10.0.29.2.3784: BFDv1, Control, State Up, Flags: [none], length: 24
 00:00:01.345149 eth2  Out IP 10.0.29.2.60400 > 10.0.29.3.3784: BFDv1, Control, State Up, Flags: [none], length: 24
 00:00:01.412070 eth2  In  IP 10.0.29.3.41893 > 10.0.29.2.3784: BFDv1, Control, State Up, Flags: [none], length: 24
 00:00:01.431634 eth2  Out IP 10.0.29.2.60400 > 10.0.29.3.3784: BFDv1, Control, State Up, Flags: [none], length: 24
 00:00:01.502107 eth2  In  IP 10.0.29.3.41893 > 10.0.29.2.3784: BFDv1, Control, State Up, Flags: [none], length: 24
 00:00:01.510538 eth2  Out IP 10.0.29.2.60400 > 10.0.29.3.3784: BFDv1, Control, State Up, Flags: [none], length: 24
 00:00:01.585997 eth2  In  IP 10.0.29.3.41893 > 10.0.29.2.3784: BFDv1, Control, State Up, Flags: [none], length: 24
 00:00:01.599279 eth2  Out IP 10.0.29.2.60400 > 10.0.29.3.3784: BFDv1, Control, State Up, Flags: [none], length: 24
 00:00:01.670045 eth2  In  IP 10.0.29.3.41893 > 10.0.29.2.3784: BFDv1, Control, State Up, Flags: [none], length: 24
 00:00:01.675346 eth2  Out IP 10.0.29.2.60400 > 10.0.29.3.3784: BFDv1, Control, State Up, Flags: [none], length: 24
 00:00:01.751535 eth2  In  IP 10.0.29.3.41893 > 10.0.29.2.3784: BFDv1, Control, State Up, Flags: [none], length: 24
 00:00:01.762148 eth2  Out IP 10.0.29.2.60400 > 10.0.29.3.3784: BFDv1, Control, State Up, Flags: [none], length: 24
 00:00:01.837170 eth2  In  IP 10.0.29.3.41893 > 10.0.29.2.3784: BFDv1, Control, State Up, Flags: [none], length: 24
 00:00:01.841479 eth2  Out IP 10.0.29.2.60400 > 10.0.29.3.3784: BFDv1, Control, State Up, Flags: [none], length: 24
 00:00:01.919051 eth2  In  IP 10.0.29.3.41893 > 10.0.29.2.3784: BFDv1, Control, State Up, Flags: [none], length: 24
 00:00:01.919305 eth2  Out IP 10.0.29.2.60400 > 10.0.29.3.3784: BFDv1, Control, State Up, Flags: [none], length: 24
 00:00:02.001690 eth2  Out IP 10.0.29.2.60400 > 10.0.29.3.3784: BFDv1, Control, State Up, Flags: [none], length: 24
 00:00:02.006966 eth2  In  IP 10.0.29.3.41893 > 10.0.29.2.3784: BFDv1, Control, State Up, Flags: [none], length: 24
 00:00:02.016429 eth3  Out IP 10.0.12.3.179 > 10.0.12.2.45004: Flags [P.], seq 3222601715:3222601750, ack 3815832999, win 64, options [nop,nop,TS val 4270765757 ecr 2662920289], length 35: BGP
 00:00:02.016516 eth3  In  IP 10.0.12.2.45004 > 10.0.12.3.179: Flags [.], ack 35, win 63, options [nop,nop,TS val 2662932912 ecr 4270765757], length 0
 00:00:02.016635 eth3  Out IP 10.0.12.3.179 > 10.0.12.2.45004: Flags [P.], seq 35:80, ack 1, win 64, options [nop,nop,TS val 4270765757 ecr 2662932912], length 45: BGP
 00:00:02.016660 eth3  In  IP 10.0.12.2.45004 > 10.0.12.3.179: Flags [.], ack 80, win 63, options [nop,nop,TS val 2662932912 ecr 4270765757], length 0
 00:00:02.016665 eth3  In  IP 10.0.12.2.45004 > 10.0.12.3.179: Flags [P.], seq 1:55, ack 80, win 63, options [nop,nop,TS val 2662932912 ecr 4270765757], length 54: BGP
 00:00:02.016678 eth3  Out IP 10.0.12.3.179 > 10.0.12.2.45004: Flags [.], ack 55, win 64, options [nop,nop,TS val 4270765757 ecr 2662932912], length 0
 00:00:10.108311 eth3  Out IP 10.0.12.3.179 > 10.0.12.2.45004: Flags [P.], seq 80:128, ack 55, win 64, options [nop,nop,TS val 4270773849 ecr 2662932912], length 48: BGP
 00:00:10.108396 eth2  Out IP 10.0.29.2.53466 > 10.0.29.3.3784: BFDv1, Control, State Down, Flags: [none], length: 24
 00:00:10.108568 eth3  In  IP 10.0.12.2.45004 > 10.0.12.3.179: Flags [P.], seq 55:82, ack 128, win 63, options [nop,nop,TS val 2662941004 ecr 4270773849], length 27: BGP
 00:00:10.108598 eth3  Out IP 10.0.12.3.179 > 10.0.12.2.45004: Flags [P.], seq 128:173, ack 82, win 64, options [nop,nop,TS val 4270773849 ecr 2662941004], length 45: BGP
 00:00:10.149017 eth3  In  IP 10.0.12.2.45004 > 10.0.12.3.179: Flags [.], ack 173, win 63, options [nop,nop,TS val 2662941045 ecr 4270773849], length 0
 00:00:10.787325 eth2  In  IP 10.0.29.3.59003 > 10.0.29.2.3784: BFDv1, Control, State Init, Flags: [none], length: 24
 00:00:10.787508 eth2  Out IP 10.0.29.2.53466 > 10.0.29.3.3784: BFDv1, Control, State Up, Flags: [Poll], length: 24
 00:00:10.787572 eth2  In  IP 10.0.29.3.59003 > 10.0.29.2.3784: BFDv1, Control, State Up, Flags: [Final], length: 24
 00:00:10.787594 eth2  In  IP 10.0.29.3.59003 > 10.0.29.2.3784: BFDv1, Control, State Up, Flags: [Poll], length: 24
 00:00:10.787654 eth2  Out IP 10.0.29.2.53466 > 10.0.29.3.3784: BFDv1, Control, State Up, Flags: [Final], length: 24
 00:00:10.868918 eth2  Out IP 10.0.29.2.53466 > 10.0.29.3.3784: BFDv1, Control, State Up, Flags: [none], length: 24
 00:00:10.871192 eth2  In  IP 10.0.29.3.59003 > 10.0.29.2.3784: BFDv1, Control, State Up, Flags: [none], length: 24
 00:00:10.947527 eth2  Out IP 10.0.29.2.53466 > 10.0.29.3.3784: BFDv1, Control, State Up, Flags: [none], length: 24
 00:00:10.960051 eth2  In  IP 10.0.29.3.59003 > 10.0.29.2.3784: BFDv1, Control, State Up, Flags: [none], length: 24
 00:00:11.024503 eth2  Out IP 10.0.29.2.53466 > 10.0.29.3.3784: BFDv1, Control, State Up, Flags: [none], length: 24
 00:00:11.036787 eth2  In  IP 10.0.29.3.59003 > 10.0.29.2.3784: BFDv1, Control, State Up, Flags: [none], length: 24
 00:00:11.106245 eth2  Out IP 10.0.29.2.53466 > 10.0.29.3.3784: BFDv1, Control, State Up, Flags: [none], length: 24
 00:00:11.119612 eth2  In  IP 10.0.29.3.59003 > 10.0.29.2.3784: BFDv1, Control, State Up, Flags: [none], length: 24
 00:00:11.183103 eth2  Out IP 10.0.29.2.53466 > 10.0.29.3.3784: BFDv1, Control, State Up, Flags: [none], length: 24
 00:00:11.197354 eth2  In  IP 10.0.29.3.59003 > 10.0.29.2.3784: BFDv1, Control, State Up, Flags: [none], length: 24
 00:00:11.260648 eth2  Out IP 10.0.29.2.53466 > 10.0.29.3.3784: BFDv1, Control, State Up, Flags: [none], length: 24
 00:00:11.285344 eth2  In  IP 10.0.29.3.59003 > 10.0.29.2.3784: BFDv1, Control, State Up, Flags: [none], length: 24
 00:00:11.349667 eth2  Out IP 10.0.29.2.53466 > 10.0.29.3.3784: BFDv1, Control, State Up, Flags: [none], length: 24
 00:00:11.363224 eth2  In  IP 10.0.29.3.59003 > 10.0.29.2.3784: BFDv1, Control, State Up, Flags: [none], length: 24
 00:00:11.425532 eth2  Out IP 10.0.29.2.53466 > 10.0.29.3.3784: BFDv1, Control, State Up, Flags: [none], length: 24
 00:00:11.448065 eth2  In  IP 10.0.29.3.59003 > 10.0.29.2.3784: BFDv1, Control, State Up, Flags: [none], length: 24
 00:00:11.513503 eth2  Out IP 10.0.29.2.53466 > 10.0.29.3.3784: BFDv1, Control, State Up, Flags: [none], length: 24
 00:00:11.537743 eth2  In  IP 10.0.29.3.59003 > 10.0.29.2.3784: BFDv1, Control, State Up, Flags: [none], length: 24
 00:00:11.593079 eth2  Out IP 10.0.29.2.53466 > 10.0.29.3.3784: BFDv1, Control, State Up, Flags: [none], length: 24
 00:00:11.620558 eth2  In  IP 10.0.29.3.59003 > 10.0.29.2.3784: BFDv1, Control, State Up, Flags: [none], length: 24
 00:00:11.671922 eth2  Out IP 10.0.29.2.53466 > 10.0.29.3.3784: BFDv1, Control, State Up, Flags: [none], length: 24
 00:00:11.709191 eth2  In  IP 10.0.29.3.59003 > 10.0.29.2.3784: BFDv1, Control, State Up, Flags: [none], length: 24
 00:00:11.749543 eth2  Out IP 10.0.29.2.53466 > 10.0.29.3.3784: BFDv1, Control, State Up, Flags: [none], length: 24
 00:00:11.786908 eth2  In  IP 10.0.29.3.59003 > 10.0.29.2.3784: BFDv1, Control, State Up, Flags: [none], length: 24
 00:00:11.834217 eth2  Out IP 10.0.29.2.53466 > 10.0.29.3.3784: BFDv1, Control, State Up, Flags: [none], length: 24
 00:00:11.864623 eth2  In  IP 10.0.29.3.59003 > 10.0.29.2.3784: BFDv1, Control, State Up, Flags: [none], length: 24
 00:00:11.909932 eth2  Out IP 10.0.29.2.53466 > 10.0.29.3.3784: BFDv1, Control, State Up, Flags: [none], length: 24
 00:00:11.940309 eth2  In  IP 10.0.29.3.59003 > 10.0.29.2.3784: BFDv1, Control, State Up, Flags: [none], length: 24
 00:00:11.991620 eth2  Out IP 10.0.29.2.53466 > 10.0.29.3.3784: BFDv1, Control, State Up, Flags: [none], length: 24
 00:00:12.016955 eth2  In  IP 10.0.29.3.59003 > 10.0.29.2.3784: BFDv1, Control, State Up, Flags: [none], length: 24
 00:00:12.075257 eth2  Out IP 10.0.29.2.53466 > 10.0.29.3.3784: BFDv1, Control, State Up, Flags: [none], length: 24
 00:00:12.092679 eth2  In  IP 10.0.29.3.59003 > 10.0.29.2.3784: BFDv1, Control, State Up, Flags: [none], length: 24
 00:00:12.151011 eth2  Out IP 10.0.29.2.53466 > 10.0.29.3.3784: BFDv1, Control, State Up, Flags: [none], length: 24
 00:00:12.171294 eth2  In  IP 10.0.29.3.59003 > 10.0.29.2.3784: BFDv1, Control, State Up, Flags: [none], length: 24
 00:00:12.229548 eth2  Out IP 10.0.29.2.53466 > 10.0.29.3.3784: BFDv1, Control, State Up, Flags: [none], length: 24
 00:00:12.253960 eth2  In  IP 10.0.29.3.59003 > 10.0.29.2.3784: BFDv1, Control, State Up, Flags: [none], length: 24
 00:00:12.317225 eth2  Out IP 10.0.29.2.53466 > 10.0.29.3.3784: BFDv1, Control, State Up, Flags: [none], length: 24
 00:00:12.332693 eth2  In  IP 10.0.29.3.59003 > 10.0.29.2.3784: BFDv1, Control, State Up, Flags: [none], length: 24
 00:00:12.395164 eth2  Out IP 10.0.29.2.53466 > 10.0.29.3.3784: BFDv1, Control, State Up, Flags: [none], length: 24
 00:00:12.411425 eth2  In  IP 10.0.29.3.59003 > 10.0.29.2.3784: BFDv1, Control, State Up, Flags: [none], length: 24
 00:00:12.479802 eth2  Out IP 10.0.29.2.53466 > 10.0.29.3.3784: BFDv1, Control, State Up, Flags: [none], length: 24
 00:00:12.495694 eth2  In  IP 10.0.29.3.59003 > 10.0.29.2.3784: BFDv1, Control, State Up, Flags: [none], length: 24
 00:00:12.554975 eth2  Out IP 10.0.29.2.53466 > 10.0.29.3.3784: BFDv1, Control, State Up, Flags: [none], length: 24
 00:00:12.584358 eth2  In  IP 10.0.29.3.59003 > 10.0.29.2.3784: BFDv1, Control, State Up, Flags: [none], length: 24
 00:00:12.640635 eth2  Out IP 10.0.29.2.53466 > 10.0.29.3.3784: BFDv1, Control, State Up, Flags: [none], length: 24
 00:00:12.663956 eth2  In  IP 10.0.29.3.59003 > 10.0.29.2.3784: BFDv1, Control, State Up, Flags: [none], length: 24
 00:00:12.727244 eth2  Out IP 10.0.29.2.53466 > 10.0.29.3.3784: BFDv1, Control, State Up, Flags: [none], length: 24
 00:00:12.743569 eth2  In  IP 10.0.29.3.59003 > 10.0.29.2.3784: BFDv1, Control, State Up, Flags: [none], length: 24
 00:00:12.804852 eth2  Out IP 10.0.29.2.53466 > 10.0.29.3.3784: BFDv1, Control, State Up, Flags: [none], length: 24
 00:00:12.826295 eth2  In  IP 10.0.29.3.59003 > 10.0.29.2.3784: BFDv1, Control, State Up, Flags: [none], length: 24
 00:00:12.880546 eth2  Out IP 10.0.29.2.53466 > 10.0.29.3.3784: BFDv1, Control, State Up, Flags: [none], length: 24
 00:00:12.910984 eth2  In  IP 10.0.29.3.59003 > 10.0.29.2.3784: BFDv1, Control, State Up, Flags: [none], length: 24
 00:00:12.965288 eth2  Out IP 10.0.29.2.53466 > 10.0.29.3.3784: BFDv1, Control, State Up, Flags: [none], length: 24
 00:00:12.986549 eth2  In  IP 10.0.29.3.59003 > 10.0.29.2.3784: BFDv1, Control, State Up, Flags: [none], length: 24
 00:00:13.042841 eth2  Out IP 10.0.29.2.53466 > 10.0.29.3.3784: BFDv1, Control, State Up, Flags: [none], length: 24
 00:00:13.074271 eth2  In  IP 10.0.29.3.59003 > 10.0.29.2.3784: BFDv1, Control, State Up, Flags: [none], length: 24
 00:00:13.123545 eth2  Out IP 10.0.29.2.53466 > 10.0.29.3.3784: BFDv1, Control, State Up, Flags: [none], length: 24
 00:00:13.159829 eth2  In  IP 10.0.29.3.59003 > 10.0.29.2.3784: BFDv1, Control, State Up, Flags: [none], length: 24
 00:00:13.199302 eth2  Out IP 10.0.29.2.53466 > 10.0.29.3.3784: BFDv1, Control, State Up, Flags: [none], length: 24
 00:00:13.238794 eth2  In  IP 10.0.29.3.59003 > 10.0.29.2.3784: BFDv1, Control, State Up, Flags: [none], length: 24
 00:00:13.287130 eth2  Out IP 10.0.29.2.53466 > 10.0.29.3.3784: BFDv1, Control, State Up, Flags: [none], length: 24
 00:00:13.327623 eth2  In  IP 10.0.29.3.59003 > 10.0.29.2.3784: BFDv1, Control, State Up, Flags: [none], length: 24
 00:00:13.373058 eth2  Out IP 10.0.29.2.53466 > 10.0.29.3.3784: BFDv1, Control, State Up, Flags: [none], length: 24
 00:00:13.411472 eth2  In  IP 10.0.29.3.59003 > 10.0.29.2.3784: BFDv1, Control, State Up, Flags: [none], length: 24
 00:00:13.451828 eth2  Out IP 10.0.29.2.53466 > 10.0.29.3.3784: BFDv1, Control, State Up, Flags: [none], length: 24
 00:00:13.487304 eth2  In  IP 10.0.29.3.59003 > 10.0.29.2.3784: BFDv1, Control, State Up, Flags: [none], length: 24
 00:00:13.541647 eth2  Out IP 10.0.29.2.53466 > 10.0.29.3.3784: BFDv1, Control, State Up, Flags: [none], length: 24
 00:00:13.569985 eth2  In  IP 10.0.29.3.59003 > 10.0.29.2.3784: BFDv1, Control, State Up, Flags: [none], length: 24
 00:00:13.619321 eth2  Out IP 10.0.29.2.53466 > 10.0.29.3.3784: BFDv1, Control, State Up, Flags: [none], length: 24
 00:00:13.646627 eth2  In  IP 10.0.29.3.59003 > 10.0.29.2.3784: BFDv1, Control, State Up, Flags: [none], length: 24
 00:00:13.699934 eth2  Out IP 10.0.29.2.53466 > 10.0.29.3.3784: BFDv1, Control, State Up, Flags: [none], length: 24
 00:00:13.732284 eth2  In  IP 10.0.29.3.59003 > 10.0.29.2.3784: BFDv1, Control, State Up, Flags: [none], length: 24
 00:00:13.776616 eth2  Out IP 10.0.29.2.53466 > 10.0.29.3.3784: BFDv1, Control, State Up, Flags: [none], length: 24
 00:00:13.818085 eth2  In  IP 10.0.29.3.59003 > 10.0.29.2.3784: BFDv1, Control, State Up, Flags: [none], length: 24
 00:00:13.852345 eth2  Out IP 10.0.29.2.53466 > 10.0.29.3.3784: BFDv1, Control, State Up, Flags: [none], length: 24
 00:00:13.901704 eth2  In  IP 10.0.29.3.59003 > 10.0.29.2.3784: BFDv1, Control, State Up, Flags: [none], length: 24
 00:00:13.934982 eth2  Out IP 10.0.29.2.53466 > 10.0.29.3.3784: BFDv1, Control, State Up, Flags: [none], length: 24
 00:00:13.978358 eth2  In  IP 10.0.29.3.59003 > 10.0.29.2.3784: BFDv1, Control, State Up, Flags: [none], length: 24
 00:00:14.023593 eth2  Out IP 10.0.29.2.53466 > 10.0.29.3.3784: BFDv1, Control, State Up, Flags: [none], length: 24
 00:00:14.056989 eth2  In  IP 10.0.29.3.59003 > 10.0.29.2.3784: BFDv1, Control, State Up, Flags: [none], length: 24
 00:00:14.104202 eth2  Out IP 10.0.29.2.53466 > 10.0.29.3.3784: BFDv1, Control, State Up, Flags: [none], length: 24
 00:00:14.140793 eth2  In  IP 10.0.29.3.59003 > 10.0.29.2.3784: BFDv1, Control, State Up, Flags: [none], length: 24
 00:00:14.190073 eth2  Out IP 10.0.29.2.53466 > 10.0.29.3.3784: BFDv1, Control, State Up, Flags: [none], length: 24
 00:00:14.217442 eth2  In  IP 10.0.29.3.59003 > 10.0.29.2.3784: BFDv1, Control, State Up, Flags: [none], length: 24
 00:00:14.266780 eth2  Out IP 10.0.29.2.53466 > 10.0.29.3.3784: BFDv1, Control, State Up, Flags: [none], length: 24
 00:00:14.303209 eth2  In  IP 10.0.29.3.59003 > 10.0.29.2.3784: BFDv1, Control, State Up, Flags: [none], length: 24
 00:00:14.357452 eth2  Out IP 10.0.29.2.53466 > 10.0.29.3.3784: BFDv1, Control, State Up, Flags: [none], length: 24
 00:00:14.388945 eth2  In  IP 10.0.29.3.59003 > 10.0.29.2.3784: BFDv1, Control, State Up, Flags: [none], length: 24
 00:00:14.443180 eth2  Out IP 10.0.29.2.53466 > 10.0.29.3.3784: BFDv1, Control, State Up, Flags: [none], length: 24
 00:00:14.474541 eth2  In  IP 10.0.29.3.59003 > 10.0.29.2.3784: BFDv1, Control, State Up, Flags: [none], length: 24
 00:00:14.525766 eth2  Out IP 10.0.29.2.53466 > 10.0.29.3.3784: BFDv1, Control, State Up, Flags: [none], length: 24
 00:00:14.555191 eth2  In  IP 10.0.29.3.59003 > 10.0.29.2.3784: BFDv1, Control, State Up, Flags: [none], length: 24
 00:00:14.609435 eth2  Out IP 10.0.29.2.53466 > 10.0.29.3.3784: BFDv1, Control, State Up, Flags: [none], length: 24
 00:00:14.631809 eth2  In  IP 10.0.29.3.59003 > 10.0.29.2.3784: BFDv1, Control, State Up, Flags: [none], length: 24
 00:00:14.690251 eth2  Out IP 10.0.29.2.47207 > 10.0.29.3.179: Flags [S], seq 3697385669, win 64240, options [mss 1460,sackOK,TS val 2352122213 ecr 0,nop,wscale 10], length 0
 00:00:14.690320 eth2  In  IP 10.0.29.3.179 > 10.0.29.2.47207: Flags [S.], seq 2375486317, ack 3697385670, win 65160, options [mss 1460,sackOK,TS val 562421949 ecr 2352122213,nop,wscale 10], length 0
 00:00:14.690348 eth2  Out IP 10.0.29.2.47207 > 10.0.29.3.179: Flags [.], ack 1, win 63, options [nop,nop,TS val 2352122213 ecr 562421949], length 0
 00:00:14.690451 eth2  Out IP 10.0.29.2.47207 > 10.0.29.3.179: Flags [P.], seq 1:65, ack 1, win 63, options [nop,nop,TS val 2352122213 ecr 562421949], length 64: BGP
 00:00:14.690480 eth2  In  IP 10.0.29.3.179 > 10.0.29.2.47207: Flags [F.], seq 1, ack 1, win 64, options [nop,nop,TS val 562421949 ecr 2352122213], length 0
 00:00:14.690534 eth2  In  IP 10.0.29.3.179 > 10.0.29.2.47207: Flags [R], seq 2375486318, win 0, length 0
 00:00:14.690540 eth2  Out IP 10.0.29.2.47207 > 10.0.29.3.179: Flags [F.], seq 65, ack 2, win 63, options [nop,nop,TS val 2352122213 ecr 562421949], length 0
 00:00:14.690560 eth2  In  IP 10.0.29.3.179 > 10.0.29.2.47207: Flags [R], seq 2375486319, win 0, length 0
 00:00:14.695063 eth2  Out IP 10.0.29.2.53466 > 10.0.29.3.3784: BFDv1, Control, State Up, Flags: [none], length: 24
 00:00:14.718287 eth2  In  IP 10.0.29.3.59003 > 10.0.29.2.3784: BFDv1, Control, State Up, Flags: [none], length: 24
 00:00:14.777518 eth2  Out IP 10.0.29.2.53466 > 10.0.29.3.3784: BFDv1, Control, State Up, Flags: [none], length: 24
 00:00:14.807929 eth2  In  IP 10.0.29.3.59003 > 10.0.29.2.3784: BFDv1, Control, State Up, Flags: [none], length: 24
 00:00:14.858131 eth2  Out IP 10.0.29.2.53466 > 10.0.29.3.3784: BFDv1, Control, State Up, Flags: [none], length: 24
 00:00:14.891512 eth2  In  IP 10.0.29.3.59003 > 10.0.29.2.3784: BFDv1, Control, State Up, Flags: [none], length: 24
 00:00:14.941751 eth2  Out IP 10.0.29.2.53466 > 10.0.29.3.3784: BFDv1, Control, State Up, Flags: [none], length: 24
 00:00:14.967131 eth2  In  IP 10.0.29.3.59003 > 10.0.29.2.3784: BFDv1, Control, State Up, Flags: [none], length: 24
 00:00:15.020405 eth2  Out IP 10.0.29.2.53466 > 10.0.29.3.3784: BFDv1, Control, State Up, Flags: [none], length: 24
 00:00:15.051804 eth2  In  IP 10.0.29.3.59003 > 10.0.29.2.3784: BFDv1, Control, State Up, Flags: [none], length: 24
 00:00:15.103169 eth2  Out IP 10.0.29.2.53466 > 10.0.29.3.3784: BFDv1, Control, State Up, Flags: [none], length: 24
 00:00:15.138589 eth2  In  IP 10.0.29.3.59003 > 10.0.29.2.3784: BFDv1, Control, State Up, Flags: [none], length: 24
 00:00:15.187917 eth2  Out IP 10.0.29.2.53466 > 10.0.29.3.3784: BFDv1, Control, State Up, Flags: [none], length: 24
 00:00:15.224365 eth2  In  IP 10.0.29.3.59003 > 10.0.29.2.3784: BFDv1, Control, State Up, Flags: [none], length: 24
 00:00:15.275667 eth2  Out IP 10.0.29.2.53466 > 10.0.29.3.3784: BFDv1, Control, State Up, Flags: [none], length: 24
 00:00:15.300052 eth2  In  IP 10.0.29.3.59003 > 10.0.29.2.3784: BFDv1, Control, State Up, Flags: [none], length: 24
 00:00:15.360313 eth2  Out IP 10.0.29.2.53466 > 10.0.29.3.3784: BFDv1, Control, State Up, Flags: [none], length: 24
 00:00:15.383668 eth2  In  IP 10.0.29.3.59003 > 10.0.29.2.3784: BFDv1, Control, State Up, Flags: [none], length: 24
 00:00:15.434972 eth2  Out IP 10.0.29.2.53466 > 10.0.29.3.3784: BFDv1, Control, State Up, Flags: [none], length: 24
 00:00:15.470387 eth2  In  IP 10.0.29.3.59003 > 10.0.29.2.3784: BFDv1, Control, State Up, Flags: [none], length: 24
 00:00:15.522650 eth2  Out IP 10.0.29.2.53466 > 10.0.29.3.3784: BFDv1, Control, State Up, Flags: [none], length: 24
 00:00:15.548068 eth2  In  IP 10.0.29.3.59003 > 10.0.29.2.3784: BFDv1, Control, State Up, Flags: [none], length: 24
 00:00:15.565901 eth2  Out IP 10.0.29.2.50841 > 10.0.29.3.179: Flags [FP.], seq 1295060264:1295060285, ack 1032495769, win 63, options [nop,nop,TS val 2352123089 ecr 562382963], length 21: BGP
 00:00:15.565936 eth2  In  IP 10.0.29.3.179 > 10.0.29.2.50841: Flags [FP.], seq 1:22, ack 0, win 64, options [nop,nop,TS val 562422825 ecr 2352083186], length 21: BGP
 00:00:15.565994 eth2  Out IP 10.0.29.2.50841 > 10.0.29.3.179: Flags [R], seq 1295060264, win 0, length 0
 00:00:15.566927 eth2  In  IP 10.0.29.3.179 > 10.0.29.2.50841: Flags [R], seq 1032495769, win 0, length 0
 00:00:15.605315 eth2  Out IP 10.0.29.2.53466 > 10.0.29.3.3784: BFDv1, Control, State Up, Flags: [none], length: 24
 00:00:15.630668 eth2  In  IP 10.0.29.3.59003 > 10.0.29.2.3784: BFDv1, Control, State Up, Flags: [none], length: 24
 00:00:15.690890 eth2  Out IP 10.0.29.2.53466 > 10.0.29.3.3784: BFDv1, Control, State Up, Flags: [none], length: 24
 00:00:15.720234 eth2  In  IP 10.0.29.3.59003 > 10.0.29.2.3784: BFDv1, Control, State Up, Flags: [none], length: 24
 00:00:15.768497 eth2  Out IP 10.0.29.2.53466 > 10.0.29.3.3784: BFDv1, Control, State Up, Flags: [none], length: 24
 00:00:15.807962 eth2  In  IP 10.0.29.3.59003 > 10.0.29.2.3784: BFDv1, Control, State Up, Flags: [none], length: 24
 00:00:15.850209 eth2  Out IP 10.0.29.2.53466 > 10.0.29.3.3784: BFDv1, Control, State Up, Flags: [none], length: 24
 00:00:15.895587 eth2  In  IP 10.0.29.3.59003 > 10.0.29.2.3784: BFDv1, Control, State Up, Flags: [none], length: 24
 00:00:15.937846 eth2  Out IP 10.0.29.2.53466 > 10.0.29.3.3784: BFDv1, Control, State Up, Flags: [none], length: 24
 00:00:15.973280 eth2  In  IP 10.0.29.3.59003 > 10.0.29.2.3784: BFDv1, Control, State Up, Flags: [none], length: 24
 00:00:16.019568 eth2  Out IP 10.0.29.2.53466 > 10.0.29.3.3784: BFDv1, Control, State Up, Flags: [none], length: 24
 00:00:16.050958 eth2  In  IP 10.0.29.3.59003 > 10.0.29.2.3784: BFDv1, Control, State Up, Flags: [none], length: 24
 00:00:16.103253 eth2  Out IP 10.0.29.2.53466 > 10.0.29.3.3784: BFDv1, Control, State Up, Flags: [none], length: 24
 00:00:16.138662 eth2  In  IP 10.0.29.3.59003 > 10.0.29.2.3784: BFDv1, Control, State Up, Flags: [none], length: 24
 00:00:16.191890 eth2  Out IP 10.0.29.2.53466 > 10.0.29.3.3784: BFDv1, Control, State Up, Flags: [none], length: 24
 00:00:16.215182 eth2  In  IP 10.0.29.3.59003 > 10.0.29.2.3784: BFDv1, Control, State Up, Flags: [none], length: 24
 00:00:16.280423 eth2  Out IP 10.0.29.2.53466 > 10.0.29.3.3784: BFDv1, Control, State Up, Flags: [none], length: 24
 00:00:16.303830 eth2  In  IP 10.0.29.3.59003 > 10.0.29.2.3784: BFDv1, Control, State Up, Flags: [none], length: 24
 00:00:16.363264 eth2  Out IP 10.0.29.2.53466 > 10.0.29.3.3784: BFDv1, Control, State Up, Flags: [none], length: 24
 00:00:16.386912 eth2  In  IP 10.0.29.3.59003 > 10.0.29.2.3784: BFDv1, Control, State Up, Flags: [none], length: 24
 00:00:16.441213 eth2  Out IP 10.0.29.2.53466 > 10.0.29.3.3784: BFDv1, Control, State Up, Flags: [none], length: 24
 00:00:16.462447 eth2  In  IP 10.0.29.3.59003 > 10.0.29.2.3784: BFDv1, Control, State Up, Flags: [none], length: 24
 00:00:16.526744 eth2  Out IP 10.0.29.2.53466 > 10.0.29.3.3784: BFDv1, Control, State Up, Flags: [none], length: 24
 00:00:16.540997 eth2  In  IP 10.0.29.3.59003 > 10.0.29.2.3784: BFDv1, Control, State Up, Flags: [none], length: 24
 00:00:16.610249 eth2  Out IP 10.0.29.2.53466 > 10.0.29.3.3784: BFDv1, Control, State Up, Flags: [none], length: 24
 00:00:16.617251 eth2  In  IP 10.0.29.3.59003 > 10.0.29.2.3784: BFDv1, Control, State Up, Flags: [none], length: 24
 00:00:16.688515 eth2  Out IP 10.0.29.2.53466 > 10.0.29.3.3784: BFDv1, Control, State Up, Flags: [none], length: 24
 00:00:16.692704 eth2  In  IP 10.0.29.3.59003 > 10.0.29.2.3784: BFDv1, Control, State Up, Flags: [none], length: 24
 00:00:16.768243 eth2  In  IP 10.0.29.3.59003 > 10.0.29.2.3784: BFDv1, Control, State Up, Flags: [none], length: 24
 00:00:16.769434 eth2  Out IP 10.0.29.2.53466 > 10.0.29.3.3784: BFDv1, Control, State Up, Flags: [none], length: 24
 00:00:16.845659 eth2  Out IP 10.0.29.2.53466 > 10.0.29.3.3784: BFDv1, Control, State Up, Flags: [none], length: 24
 00:00:16.854910 eth2  In  IP 10.0.29.3.59003 > 10.0.29.2.3784: BFDv1, Control, State Up, Flags: [none], length: 24
 00:00:16.932637 eth2  In  IP 10.0.29.3.59003 > 10.0.29.2.3784: BFDv1, Control, State Up, Flags: [none], length: 24
 00:00:16.932771 eth2  Out IP 10.0.29.2.53466 > 10.0.29.3.3784: BFDv1, Control, State Up, Flags: [none], length: 24
 00:00:17.009010 eth2  Out IP 10.0.29.2.53466 > 10.0.29.3.3784: BFDv1, Control, State Up, Flags: [none], length: 24
 00:00:17.014270 eth2  In  IP 10.0.29.3.59003 > 10.0.29.2.3784: BFDv1, Control, State Up, Flags: [none], length: 24
 00:00:17.095884 eth2  In  IP 10.0.29.3.59003 > 10.0.29.2.3784: BFDv1, Control, State Up, Flags: [none], length: 24
 00:00:17.097135 eth2  Out IP 10.0.29.2.53466 > 10.0.29.3.3784: BFDv1, Control, State Up, Flags: [none], length: 24
 00:00:17.173199 eth2  In  IP 10.0.29.3.59003 > 10.0.29.2.3784: BFDv1, Control, State Up, Flags: [none], length: 24
 00:00:17.174426 eth2  Out IP 10.0.29.2.53466 > 10.0.29.3.3784: BFDv1, Control, State Up, Flags: [none], length: 24
 00:00:17.262040 eth2  In  IP 10.0.29.3.59003 > 10.0.29.2.3784: BFDv1, Control, State Up, Flags: [none], length: 24
 00:00:17.264258 eth2  Out IP 10.0.29.2.53466 > 10.0.29.3.3784: BFDv1, Control, State Up, Flags: [none], length: 24
 00:00:17.343483 eth2  Out IP 10.0.29.2.53466 > 10.0.29.3.3784: BFDv1, Control, State Up, Flags: [none], length: 24
 00:00:17.345651 eth2  In  IP 10.0.29.3.59003 > 10.0.29.2.3784: BFDv1, Control, State Up, Flags: [none], length: 24
 00:00:17.426908 eth2  Out IP 10.0.29.2.53466 > 10.0.29.3.3784: BFDv1, Control, State Up, Flags: [none], length: 24
 00:00:17.430143 eth2  In  IP 10.0.29.3.59003 > 10.0.29.2.3784: BFDv1, Control, State Up, Flags: [none], length: 24
 00:00:17.506656 eth2  In  IP 10.0.29.3.59003 > 10.0.29.2.3784: BFDv1, Control, State Up, Flags: [none], length: 24
 00:00:17.509830 eth2  Out IP 10.0.29.2.53466 > 10.0.29.3.3784: BFDv1, Control, State Up, Flags: [none], length: 24
 00:00:17.584372 eth2  In  IP 10.0.29.3.59003 > 10.0.29.2.3784: BFDv1, Control, State Up, Flags: [none], length: 24
 00:00:17.592635 eth2  Out IP 10.0.29.2.53466 > 10.0.29.3.3784: BFDv1, Control, State Up, Flags: [none], length: 24
 00:00:17.668953 eth2  Out IP 10.0.29.2.53466 > 10.0.29.3.3784: BFDv1, Control, State Up, Flags: [none], length: 24
 00:00:17.673165 eth2  In  IP 10.0.29.3.59003 > 10.0.29.2.3784: BFDv1, Control, State Up, Flags: [none], length: 24
 00:00:17.745468 eth2  Out IP 10.0.29.2.53466 > 10.0.29.3.3784: BFDv1, Control, State Up, Flags: [none], length: 24
 00:00:17.761661 eth2  In  IP 10.0.29.3.59003 > 10.0.29.2.3784: BFDv1, Control, State Up, Flags: [none], length: 24
 00:00:17.825928 eth2  Out IP 10.0.29.2.53466 > 10.0.29.3.3784: BFDv1, Control, State Up, Flags: [none], length: 24
 00:00:17.842139 eth2  In  IP 10.0.29.3.59003 > 10.0.29.2.3784: BFDv1, Control, State Up, Flags: [none], length: 24
 00:00:17.911432 eth2  Out IP 10.0.29.2.53466 > 10.0.29.3.3784: BFDv1, Control, State Up, Flags: [none], length: 24
 00:00:17.921676 eth2  In  IP 10.0.29.3.59003 > 10.0.29.2.3784: BFDv1, Control, State Up, Flags: [none], length: 24
 00:00:17.987960 eth2  Out IP 10.0.29.2.53466 > 10.0.29.3.3784: BFDv1, Control, State Up, Flags: [none], length: 24
 00:00:18.004194 eth2  In  IP 10.0.29.3.59003 > 10.0.29.2.3784: BFDv1, Control, State Up, Flags: [none], length: 24
 00:00:18.066500 eth2  Out IP 10.0.29.2.53466 > 10.0.29.3.3784: BFDv1, Control, State Up, Flags: [none], length: 24
 00:00:18.081752 eth2  In  IP 10.0.29.3.59003 > 10.0.29.2.3784: BFDv1, Control, State Up, Flags: [none], length: 24
 00:00:18.144063 eth2  Out IP 10.0.29.2.53466 > 10.0.29.3.3784: BFDv1, Control, State Up, Flags: [none], length: 24
 00:00:18.168262 eth2  In  IP 10.0.29.3.59003 > 10.0.29.2.3784: BFDv1, Control, State Up, Flags: [none], length: 24
 00:00:18.230503 eth2  Out IP 10.0.29.2.53466 > 10.0.29.3.3784: BFDv1, Control, State Up, Flags: [none], length: 24
 00:00:18.256727 eth2  In  IP 10.0.29.3.59003 > 10.0.29.2.3784: BFDv1, Control, State Up, Flags: [none], length: 24
 00:00:18.309971 eth2  Out IP 10.0.29.2.53466 > 10.0.29.3.3784: BFDv1, Control, State Up, Flags: [none], length: 24
 00:00:18.343193 eth2  In  IP 10.0.29.3.59003 > 10.0.29.2.3784: BFDv1, Control, State Up, Flags: [none], length: 24
 00:00:18.394514 eth2  Out IP 10.0.29.2.53466 > 10.0.29.3.3784: BFDv1, Control, State Up, Flags: [none], length: 24
 00:00:18.431771 eth2  In  IP 10.0.29.3.59003 > 10.0.29.2.3784: BFDv1, Control, State Up, Flags: [none], length: 24
 00:00:18.479088 eth2  Out IP 10.0.29.2.53466 > 10.0.29.3.3784: BFDv1, Control, State Up, Flags: [none], length: 24
 00:00:18.518334 eth2  In  IP 10.0.29.3.59003 > 10.0.29.2.3784: BFDv1, Control, State Up, Flags: [none], length: 24
 00:00:18.564612 eth2  Out IP 10.0.29.2.53466 > 10.0.29.3.3784: BFDv1, Control, State Up, Flags: [none], length: 24
 00:00:18.602828 eth2  In  IP 10.0.29.3.59003 > 10.0.29.2.3784: BFDv1, Control, State Up, Flags: [none], length: 24
 00:00:18.642080 eth2  Out IP 10.0.29.2.53466 > 10.0.29.3.3784: BFDv1, Control, State Up, Flags: [none], length: 24
 00:00:18.689282 eth2  In  IP 10.0.29.3.59003 > 10.0.29.2.3784: BFDv1, Control, State Up, Flags: [none], length: 24
 00:00:18.724612 eth2  Out IP 10.0.29.2.53466 > 10.0.29.3.3784: BFDv1, Control, State Up, Flags: [none], length: 24
 00:00:18.772933 eth2  In  IP 10.0.29.3.59003 > 10.0.29.2.3784: BFDv1, Control, State Up, Flags: [none], length: 24
 00:00:18.810261 eth2  Out IP 10.0.29.2.53466 > 10.0.29.3.3784: BFDv1, Control, State Up, Flags: [none], length: 24
 00:00:18.856509 eth2  In  IP 10.0.29.3.59003 > 10.0.29.2.3784: BFDv1, Control, State Up, Flags: [none], length: 24
 00:00:18.894790 eth2  Out IP 10.0.29.2.53466 > 10.0.29.3.3784: BFDv1, Control, State Up, Flags: [none], length: 24
 00:00:18.942129 eth2  In  IP 10.0.29.3.59003 > 10.0.29.2.3784: BFDv1, Control, State Up, Flags: [none], length: 24
 00:00:18.980408 eth2  Out IP 10.0.29.2.53466 > 10.0.29.3.3784: BFDv1, Control, State Up, Flags: [none], length: 24
 00:00:19.026611 eth2  In  IP 10.0.29.3.59003 > 10.0.29.2.3784: BFDv1, Control, State Up, Flags: [none], length: 24
 00:00:19.059809 eth2  Out IP 10.0.29.2.53466 > 10.0.29.3.3784: BFDv1, Control, State Up, Flags: [none], length: 24
 00:00:19.109378 eth2  In  IP 10.0.29.3.59003 > 10.0.29.2.3784: BFDv1, Control, State Up, Flags: [none], length: 24
 00:00:19.138635 eth2  Out IP 10.0.29.2.53466 > 10.0.29.3.3784: BFDv1, Control, State Up, Flags: [none], length: 24
 00:00:19.192050 eth2  In  IP 10.0.29.3.59003 > 10.0.29.2.3784: BFDv1, Control, State Up, Flags: [none], length: 24
 00:00:19.227318 eth2  Out IP 10.0.29.2.53466 > 10.0.29.3.3784: BFDv1, Control, State Up, Flags: [none], length: 24
 00:00:19.274593 eth2  In  IP 10.0.29.3.59003 > 10.0.29.2.3784: BFDv1, Control, State Up, Flags: [none], length: 24
 00:00:19.312832 eth2  Out IP 10.0.29.2.53466 > 10.0.29.3.3784: BFDv1, Control, State Up, Flags: [none], length: 24
 00:00:19.350461 eth2  In  IP 10.0.29.3.59003 > 10.0.29.2.3784: BFDv1, Control, State Up, Flags: [none], length: 24
 00:00:19.392709 eth2  Out IP 10.0.29.2.53466 > 10.0.29.3.3784: BFDv1, Control, State Up, Flags: [none], length: 24
 00:00:19.429152 eth2  In  IP 10.0.29.3.59003 > 10.0.29.2.3784: BFDv1, Control, State Up, Flags: [none], length: 24
 00:00:19.477431 eth2  Out IP 10.0.29.2.53466 > 10.0.29.3.3784: BFDv1, Control, State Up, Flags: [none], length: 24
 00:00:19.505679 eth2  In  IP 10.0.29.3.59003 > 10.0.29.2.3784: BFDv1, Control, State Up, Flags: [none], length: 24
 00:00:19.563957 eth2  Out IP 10.0.29.2.53466 > 10.0.29.3.3784: BFDv1, Control, State Up, Flags: [none], length: 24
 00:00:19.595162 eth2  In  IP 10.0.29.3.59003 > 10.0.29.2.3784: BFDv1, Control, State Up, Flags: [none], length: 24
 00:00:19.641416 eth2  Out IP 10.0.29.2.53466 > 10.0.29.3.3784: BFDv1, Control, State Up, Flags: [none], length: 24
 00:00:19.673324 eth2  Out IP 10.0.29.2.56677 > 10.0.29.3.179: Flags [S], seq 120381944, win 64240, options [mss 1460,sackOK,TS val 2352127196 ecr 0,nop,wscale 10], length 0
 00:00:19.673381 eth2  In  IP 10.0.29.3.179 > 10.0.29.2.56677: Flags [S.], seq 4192589649, ack 120381945, win 65160, options [mss 1460,sackOK,TS val 562426932 ecr 2352127196,nop,wscale 10], length 0
 00:00:19.673402 eth2  Out IP 10.0.29.2.56677 > 10.0.29.3.179: Flags [.], ack 1, win 63, options [nop,nop,TS val 2352127196 ecr 562426932], length 0
 00:00:19.673466 eth2  Out IP 10.0.29.2.56677 > 10.0.29.3.179: Flags [P.], seq 1:65, ack 1, win 63, options [nop,nop,TS val 2352127196 ecr 562426932], length 64: BGP
 00:00:19.673478 eth2  In  IP 10.0.29.3.179 > 10.0.29.2.56677: Flags [.], ack 65, win 64, options [nop,nop,TS val 562426932 ecr 2352127196], length 0
 00:00:19.673615 eth2  In  IP 10.0.29.3.179 > 10.0.29.2.56677: Flags [R.], seq 1, ack 65, win 64, options [nop,nop,TS val 562426932 ecr 2352127196], length 0
 00:00:19.677749 eth2  In  IP 10.0.29.3.59003 > 10.0.29.2.3784: BFDv1, Control, State Up, Flags: [none], length: 24
 00:00:19.728046 eth2  Out IP 10.0.29.2.53466 > 10.0.29.3.3784: BFDv1, Control, State Up, Flags: [none], length: 24
 00:00:19.763408 eth2  In  IP 10.0.29.3.59003 > 10.0.29.2.3784: BFDv1, Control, State Up, Flags: [none], length: 24
 00:00:19.805724 eth2  Out IP 10.0.29.2.53466 > 10.0.29.3.3784: BFDv1, Control, State Up, Flags: [none], length: 24
 00:00:19.847145 eth2  In  IP 10.0.29.3.59003 > 10.0.29.2.3784: BFDv1, Control, State Up, Flags: [none], length: 24
 00:00:19.881429 eth2  Out IP 10.0.29.2.53466 > 10.0.29.3.3784: BFDv1, Control, State Up, Flags: [none], length: 24
 00:00:19.930754 eth2  In  IP 10.0.29.3.59003 > 10.0.29.2.3784: BFDv1, Control, State Up, Flags: [none], length: 24
 00:00:19.962083 eth2  Out IP 10.0.29.2.53466 > 10.0.29.3.3784: BFDv1, Control, State Up, Flags: [none], length: 24
 00:00:20.012564 eth2  In  IP 10.0.29.3.59003 > 10.0.29.2.3784: BFDv1, Control, State Up, Flags: [none], length: 24
 00:00:20.040887 eth2  Out IP 10.0.29.2.53466 > 10.0.29.3.3784: BFDv1, Control, State Up, Flags: [none], length: 24
 00:00:20.090452 eth2  In  IP 10.0.29.3.59003 > 10.0.29.2.3784: BFDv1, Control, State Up, Flags: [none], length: 24
 00:00:20.121880 eth2  Out IP 10.0.29.2.53466 > 10.0.29.3.3784: BFDv1, Control, State Up, Flags: [none], length: 24
 00:00:20.178659 eth2  In  IP 10.0.29.3.59003 > 10.0.29.2.3784: BFDv1, Control, State Up, Flags: [none], length: 24
 00:00:20.196989 eth2  Out IP 10.0.29.2.53466 > 10.0.29.3.3784: BFDv1, Control, State Up, Flags: [none], length: 24
 00:00:20.259759 eth2  In  IP 10.0.29.3.59003 > 10.0.29.2.3784: BFDv1, Control, State Up, Flags: [none], length: 24
 00:00:20.278084 eth2  Out IP 10.0.29.2.53466 > 10.0.29.3.3784: BFDv1, Control, State Up, Flags: [none], length: 24
 00:00:20.341883 eth2  In  IP 10.0.29.3.59003 > 10.0.29.2.3784: BFDv1, Control, State Up, Flags: [none], length: 24
 00:00:20.361186 eth2  Out IP 10.0.29.2.53466 > 10.0.29.3.3784: BFDv1, Control, State Up, Flags: [none], length: 24
 00:00:20.424028 eth2  In  IP 10.0.29.3.59003 > 10.0.29.2.3784: BFDv1, Control, State Up, Flags: [none], length: 24
 00:00:20.439370 eth2  Out IP 10.0.29.2.53466 > 10.0.29.3.3784: BFDv1, Control, State Up, Flags: [none], length: 24
 00:00:20.510180 eth2  In  IP 10.0.29.3.59003 > 10.0.29.2.3784: BFDv1, Control, State Up, Flags: [none], length: 24
 00:00:20.516456 eth2  Out IP 10.0.29.2.53466 > 10.0.29.3.3784: BFDv1, Control, State Up, Flags: [none], length: 24
 00:00:20.599088 eth2  In  IP 10.0.29.3.59003 > 10.0.29.2.3784: BFDv1, Control, State Up, Flags: [none], length: 24
 00:00:20.603352 eth2  Out IP 10.0.29.2.53466 > 10.0.29.3.3784: BFDv1, Control, State Up, Flags: [none], length: 24
 00:00:20.684087 eth2  In  IP 10.0.29.3.59003 > 10.0.29.2.3784: BFDv1, Control, State Up, Flags: [none], length: 24
 00:00:20.691335 eth2  Out IP 10.0.29.2.53466 > 10.0.29.3.3784: BFDv1, Control, State Up, Flags: [none], length: 24
 00:00:20.766970 eth2  In  IP 10.0.29.3.59003 > 10.0.29.2.3784: BFDv1, Control, State Up, Flags: [none], length: 24
 00:00:20.778182 eth2  Out IP 10.0.29.2.53466 > 10.0.29.3.3784: BFDv1, Control, State Up, Flags: [none], length: 24
 00:00:20.847791 eth2  In  IP 10.0.29.3.59003 > 10.0.29.2.3784: BFDv1, Control, State Up, Flags: [none], length: 24
 00:00:20.861222 eth2  Out IP 10.0.29.2.53466 > 10.0.29.3.3784: BFDv1, Control, State Up, Flags: [none], length: 24
 00:00:20.929931 eth2  In  IP 10.0.29.3.59003 > 10.0.29.2.3784: BFDv1, Control, State Up, Flags: [none], length: 24
 00:00:20.950195 eth2  Out IP 10.0.29.2.53466 > 10.0.29.3.3784: BFDv1, Control, State Up, Flags: [none], length: 24
 00:00:21.010182 eth2  In  IP 10.0.29.3.59003 > 10.0.29.2.3784: BFDv1, Control, State Up, Flags: [none], length: 24
 00:00:21.029484 eth2  Out IP 10.0.29.2.53466 > 10.0.29.3.3784: BFDv1, Control, State Up, Flags: [none], length: 24
 00:00:21.086664 eth2  In  IP 10.0.29.3.59003 > 10.0.29.2.3784: BFDv1, Control, State Up, Flags: [none], length: 24
 00:00:21.107686 eth2  Out IP 10.0.29.2.53466 > 10.0.29.3.3784: BFDv1, Control, State Up, Flags: [none], length: 24
 00:00:21.167131 eth2  In  IP 10.0.29.3.59003 > 10.0.29.2.3784: BFDv1, Control, State Up, Flags: [none], length: 24
 00:00:21.191381 eth2  Out IP 10.0.29.2.53466 > 10.0.29.3.3784: BFDv1, Control, State Up, Flags: [none], length: 24
 00:00:21.246559 eth2  In  IP 10.0.29.3.59003 > 10.0.29.2.3784: BFDv1, Control, State Up, Flags: [none], length: 24
 00:00:21.280854 eth2  Out IP 10.0.29.2.53466 > 10.0.29.3.3784: BFDv1, Control, State Up, Flags: [none], length: 24
 00:00:21.334052 eth2  In  IP 10.0.29.3.59003 > 10.0.29.2.3784: BFDv1, Control, State Up, Flags: [none], length: 24
 00:00:21.363333 eth2  Out IP 10.0.29.2.53466 > 10.0.29.3.3784: BFDv1, Control, State Up, Flags: [none], length: 24
 00:00:21.420085 eth2  In  IP 10.0.29.3.59003 > 10.0.29.2.3784: BFDv1, Control, State Up, Flags: [none], length: 24
 00:00:21.450275 eth2  Out IP 10.0.29.2.53466 > 10.0.29.3.3784: BFDv1, Control, State Up, Flags: [none], length: 24
 00:00:21.501538 eth2  In  IP 10.0.29.3.59003 > 10.0.29.2.3784: BFDv1, Control, State Up, Flags: [none], length: 24
 00:00:21.537934 eth2  Out IP 10.0.29.2.53466 > 10.0.29.3.3784: BFDv1, Control, State Up, Flags: [none], length: 24
 00:00:21.578940 eth2  In  IP 10.0.29.3.59003 > 10.0.29.2.3784: BFDv1, Control, State Up, Flags: [none], length: 24
 00:00:21.615258 eth2  Out IP 10.0.29.2.53466 > 10.0.29.3.3784: BFDv1, Control, State Up, Flags: [none], length: 24
 00:00:21.668570 eth2  In  IP 10.0.29.3.59003 > 10.0.29.2.3784: BFDv1, Control, State Up, Flags: [none], length: 24
 00:00:21.692900 eth2  Out IP 10.0.29.2.53466 > 10.0.29.3.3784: BFDv1, Control, State Up, Flags: [none], length: 24
 00:00:21.756110 eth2  In  IP 10.0.29.3.59003 > 10.0.29.2.3784: BFDv1, Control, State Up, Flags: [none], length: 24
 00:00:21.774539 eth2  Out IP 10.0.29.2.53466 > 10.0.29.3.3784: BFDv1, Control, State Up, Flags: [none], length: 24
 00:00:21.839677 eth2  In  IP 10.0.29.3.59003 > 10.0.29.2.3784: BFDv1, Control, State Up, Flags: [none], length: 24
 00:00:21.862994 eth2  Out IP 10.0.29.2.53466 > 10.0.29.3.3784: BFDv1, Control, State Up, Flags: [none], length: 24
 00:00:21.920437 eth2  In  IP 10.0.29.3.59003 > 10.0.29.2.3784: BFDv1, Control, State Up, Flags: [none], length: 24
 00:00:21.942787 eth2  Out IP 10.0.29.2.53466 > 10.0.29.3.3784: BFDv1, Control, State Up, Flags: [none], length: 24
 00:00:21.998109 eth2  In  IP 10.0.29.3.59003 > 10.0.29.2.3784: BFDv1, Control, State Up, Flags: [none], length: 24
 00:00:22.021433 eth2  Out IP 10.0.29.2.53466 > 10.0.29.3.3784: BFDv1, Control, State Up, Flags: [none], length: 24
 00:00:22.084637 eth2  In  IP 10.0.29.3.59003 > 10.0.29.2.3784: BFDv1, Control, State Up, Flags: [none], length: 24
 00:00:22.104949 eth2  Out IP 10.0.29.2.53466 > 10.0.29.3.3784: BFDv1, Control, State Up, Flags: [none], length: 24
 00:00:22.164395 eth2  In  IP 10.0.29.3.59003 > 10.0.29.2.3784: BFDv1, Control, State Up, Flags: [none], length: 24
 00:00:22.191027 eth2  Out IP 10.0.29.2.53466 > 10.0.29.3.3784: BFDv1, Control, State Up, Flags: [none], length: 24
 00:00:22.243908 eth2  In  IP 10.0.29.3.59003 > 10.0.29.2.3784: BFDv1, Control, State Up, Flags: [none], length: 24
 00:00:22.275234 eth2  Out IP 10.0.29.2.53466 > 10.0.29.3.3784: BFDv1, Control, State Up, Flags: [none], length: 24
 00:00:22.325582 eth2  In  IP 10.0.29.3.59003 > 10.0.29.2.3784: BFDv1, Control, State Up, Flags: [none], length: 24
 00:00:22.360986 eth2  Out IP 10.0.29.2.53466 > 10.0.29.3.3784: BFDv1, Control, State Up, Flags: [none], length: 24
 00:00:22.408149 eth2  In  IP 10.0.29.3.59003 > 10.0.29.2.3784: BFDv1, Control, State Up, Flags: [none], length: 24
 00:00:22.446430 eth2  Out IP 10.0.29.2.53466 > 10.0.29.3.3784: BFDv1, Control, State Up, Flags: [none], length: 24
 00:00:22.484509 eth2  In  IP 10.0.29.3.59003 > 10.0.29.2.3784: BFDv1, Control, State Up, Flags: [none], length: 24
 00:00:22.535855 eth2  Out IP 10.0.29.2.53466 > 10.0.29.3.3784: BFDv1, Control, State Up, Flags: [none], length: 24
 00:00:22.572115 eth2  In  IP 10.0.29.3.59003 > 10.0.29.2.3784: BFDv1, Control, State Up, Flags: [none], length: 24
 00:00:22.611539 eth2  Out IP 10.0.29.2.53466 > 10.0.29.3.3784: BFDv1, Control, State Up, Flags: [none], length: 24
 00:00:22.659964 eth2  In  IP 10.0.29.3.59003 > 10.0.29.2.3784: BFDv1, Control, State Up, Flags: [none], length: 24
 00:00:22.688295 eth2  Out IP 10.0.29.2.53466 > 10.0.29.3.3784: BFDv1, Control, State Up, Flags: [none], length: 24
 00:00:22.742531 eth2  In  IP 10.0.29.3.59003 > 10.0.29.2.3784: BFDv1, Control, State Up, Flags: [none], length: 24
 00:00:22.777938 eth2  Out IP 10.0.29.2.53466 > 10.0.29.3.3784: BFDv1, Control, State Up, Flags: [none], length: 24
 00:00:22.823191 eth2  In  IP 10.0.29.3.59003 > 10.0.29.2.3784: BFDv1, Control, State Up, Flags: [none], length: 24
 00:00:22.858476 eth2  Out IP 10.0.29.2.53466 > 10.0.29.3.3784: BFDv1, Control, State Up, Flags: [none], length: 24
 00:00:22.906784 eth2  In  IP 10.0.29.3.59003 > 10.0.29.2.3784: BFDv1, Control, State Up, Flags: [none], length: 24
 00:00:22.942102 eth2  Out IP 10.0.29.2.53466 > 10.0.29.3.3784: BFDv1, Control, State Up, Flags: [none], length: 24
 00:00:22.986240 eth2  In  IP 10.0.29.3.59003 > 10.0.29.2.3784: BFDv1, Control, State Up, Flags: [none], length: 24
 00:00:23.020608 eth2  Out IP 10.0.29.2.53466 > 10.0.29.3.3784: BFDv1, Control, State Up, Flags: [none], length: 24
 00:00:23.075793 eth2  In  IP 10.0.29.3.59003 > 10.0.29.2.3784: BFDv1, Control, State Up, Flags: [none], length: 24
 00:00:23.103133 eth2  Out IP 10.0.29.2.53466 > 10.0.29.3.3784: BFDv1, Control, State Up, Flags: [none], length: 24
 00:00:23.153157 eth2  In  IP 10.0.29.3.59003 > 10.0.29.2.3784: BFDv1, Control, State Up, Flags: [none], length: 24
 00:00:23.184480 eth2  Out IP 10.0.29.2.53466 > 10.0.29.3.3784: BFDv1, Control, State Up, Flags: [none], length: 24
 00:00:23.229644 eth2  In  IP 10.0.29.3.59003 > 10.0.29.2.3784: BFDv1, Control, State Up, Flags: [none], length: 24
 00:00:23.259061 eth2  Out IP 10.0.29.2.53466 > 10.0.29.3.3784: BFDv1, Control, State Up, Flags: [none], length: 24
 00:00:23.308426 eth2  In  IP 10.0.29.3.59003 > 10.0.29.2.3784: BFDv1, Control, State Up, Flags: [none], length: 24
 00:00:23.338756 eth2  Out IP 10.0.29.2.53466 > 10.0.29.3.3784: BFDv1, Control, State Up, Flags: [none], length: 24
 00:00:23.396154 eth2  In  IP 10.0.29.3.59003 > 10.0.29.2.3784: BFDv1, Control, State Up, Flags: [none], length: 24
 00:00:23.426447 eth2  Out IP 10.0.29.2.53466 > 10.0.29.3.3784: BFDv1, Control, State Up, Flags: [none], length: 24
 00:00:23.474592 eth2  In  IP 10.0.29.3.59003 > 10.0.29.2.3784: BFDv1, Control, State Up, Flags: [none], length: 24
 00:00:23.515884 eth2  Out IP 10.0.29.2.53466 > 10.0.29.3.3784: BFDv1, Control, State Up, Flags: [none], length: 24
 00:00:23.550326 eth2  In  IP 10.0.29.3.59003 > 10.0.29.2.3784: BFDv1, Control, State Up, Flags: [none], length: 24
 00:00:23.599606 eth2  Out IP 10.0.29.2.53466 > 10.0.29.3.3784: BFDv1, Control, State Up, Flags: [none], length: 24
 00:00:23.633923 eth2  In  IP 10.0.29.3.59003 > 10.0.29.2.3784: BFDv1, Control, State Up, Flags: [none], length: 24
 00:00:23.675219 eth2  Out IP 10.0.29.2.53466 > 10.0.29.3.3784: BFDv1, Control, State Up, Flags: [none], length: 24
 00:00:23.717702 eth2  In  IP 10.0.29.3.59003 > 10.0.29.2.3784: BFDv1, Control, State Up, Flags: [none], length: 24
 00:00:23.759018 eth2  Out IP 10.0.29.2.53466 > 10.0.29.3.3784: BFDv1, Control, State Up, Flags: [none], length: 24
 00:00:23.797969 eth2  In  IP 10.0.29.3.59003 > 10.0.29.2.3784: BFDv1, Control, State Up, Flags: [none], length: 24
 00:00:23.840288 eth2  Out IP 10.0.29.2.53466 > 10.0.29.3.3784: BFDv1, Control, State Up, Flags: [none], length: 24
 00:00:23.886666 eth2  In  IP 10.0.29.3.59003 > 10.0.29.2.3784: BFDv1, Control, State Up, Flags: [none], length: 24
 00:00:23.923967 eth2  Out IP 10.0.29.2.53466 > 10.0.29.3.3784: BFDv1, Control, State Up, Flags: [none], length: 24
 00:00:23.964226 eth2  In  IP 10.0.29.3.59003 > 10.0.29.2.3784: BFDv1, Control, State Up, Flags: [none], length: 24
 00:00:24.004718 eth2  Out IP 10.0.29.2.53466 > 10.0.29.3.3784: BFDv1, Control, State Up, Flags: [none], length: 24
 00:00:24.052220 eth2  In  IP 10.0.29.3.59003 > 10.0.29.2.3784: BFDv1, Control, State Up, Flags: [none], length: 24
 00:00:24.083544 eth2  Out IP 10.0.29.2.53466 > 10.0.29.3.3784: BFDv1, Control, State Up, Flags: [none], length: 24
 00:00:24.136054 eth2  In  IP 10.0.29.3.59003 > 10.0.29.2.3784: BFDv1, Control, State Up, Flags: [none], length: 24
 00:00:24.169373 eth2  Out IP 10.0.29.2.53466 > 10.0.29.3.3784: BFDv1, Control, State Up, Flags: [none], length: 24
 00:00:24.222927 eth2  In  IP 10.0.29.3.59003 > 10.0.29.2.3784: BFDv1, Control, State Up, Flags: [none], length: 24
 00:00:24.251204 eth2  Out IP 10.0.29.2.53466 > 10.0.29.3.3784: BFDv1, Control, State Up, Flags: [none], length: 24
 00:00:24.301456 eth2  In  IP 10.0.29.3.59003 > 10.0.29.2.3784: BFDv1, Control, State Up, Flags: [none], length: 24
 00:00:24.336841 eth2  Out IP 10.0.29.2.53466 > 10.0.29.3.3784: BFDv1, Control, State Up, Flags: [none], length: 24
 00:00:24.387165 eth2  In  IP 10.0.29.3.59003 > 10.0.29.2.3784: BFDv1, Control, State Up, Flags: [none], length: 24
 00:00:24.420512 eth2  Out IP 10.0.29.2.53466 > 10.0.29.3.3784: BFDv1, Control, State Up, Flags: [none], length: 24
 00:00:24.437037 eth2  Out IP 10.0.29.2.38149 > 10.0.29.3.179: Flags [S], seq 637348534, win 64240, options [mss 1460,sackOK,TS val 2352131960 ecr 0,nop,wscale 10], length 0
 00:00:24.437106 eth2  In  IP 10.0.29.3.179 > 10.0.29.2.38149: Flags [S.], seq 4256405607, ack 637348535, win 65160, options [mss 1460,sackOK,TS val 562431696 ecr 2352131960,nop,wscale 10], length 0
 00:00:24.437132 eth2  Out IP 10.0.29.2.38149 > 10.0.29.3.179: Flags [.], ack 1, win 63, options [nop,nop,TS val 2352131960 ecr 562431696], length 0
 00:00:24.437210 eth2  Out IP 10.0.29.2.38149 > 10.0.29.3.179: Flags [P.], seq 1:65, ack 1, win 63, options [nop,nop,TS val 2352131960 ecr 562431696], length 64: BGP
 00:00:24.437223 eth2  In  IP 10.0.29.3.179 > 10.0.29.2.38149: Flags [.], ack 65, win 64, options [nop,nop,TS val 562431696 ecr 2352131960], length 0
 00:00:24.437329 eth2  In  IP 10.0.29.3.179 > 10.0.29.2.38149: Flags [R.], seq 1, ack 65, win 64, options [nop,nop,TS val 562431696 ecr 2352131960], length 0
 00:00:24.469134 eth2  In  IP 10.0.29.3.59003 > 10.0.29.2.3784: BFDv1, Control, State Up, Flags: [none], length: 24
 00:00:24.506537 eth2  Out IP 10.0.29.2.53466 > 10.0.29.3.3784: BFDv1, Control, State Up, Flags: [none], length: 24
 00:00:24.555051 eth2  In  IP 10.0.29.3.59003 > 10.0.29.2.3784: BFDv1, Control, State Up, Flags: [none], length: 24
 00:00:24.589410 eth2  Out IP 10.0.29.2.53466 > 10.0.29.3.3784: BFDv1, Control, State Up, Flags: [none], length: 24
 00:00:24.639909 eth2  In  IP 10.0.29.3.59003 > 10.0.29.2.3784: BFDv1, Control, State Up, Flags: [none], length: 24
 00:00:24.678225 eth2  Out IP 10.0.29.2.53466 > 10.0.29.3.3784: BFDv1, Control, State Up, Flags: [none], length: 24
 00:00:24.724738 eth2  In  IP 10.0.29.3.59003 > 10.0.29.2.3784: BFDv1, Control, State Up, Flags: [none], length: 24
 00:00:24.756258 eth2  Out IP 10.0.29.2.53466 > 10.0.29.3.3784: BFDv1, Control, State Up, Flags: [none], length: 24
 00:00:24.806841 eth2  In  IP 10.0.29.3.59003 > 10.0.29.2.3784: BFDv1, Control, State Up, Flags: [none], length: 24
 00:00:24.837143 eth2  Out IP 10.0.29.2.53466 > 10.0.29.3.3784: BFDv1, Control, State Up, Flags: [none], length: 24
 00:00:24.887637 eth2  In  IP 10.0.29.3.59003 > 10.0.29.2.3784: BFDv1, Control, State Up, Flags: [none], length: 24
 00:00:24.926000 eth2  Out IP 10.0.29.2.53466 > 10.0.29.3.3784: BFDv1, Control, State Up, Flags: [none], length: 24
 00:00:24.966271 eth2  In  IP 10.0.29.3.59003 > 10.0.29.2.3784: BFDv1, Control, State Up, Flags: [none], length: 24
 00:00:25.003602 eth2  Out IP 10.0.29.2.53466 > 10.0.29.3.3784: BFDv1, Control, State Up, Flags: [none], length: 24
 00:00:25.051984 eth2  In  IP 10.0.29.3.59003 > 10.0.29.2.3784: BFDv1, Control, State Up, Flags: [none], length: 24
 00:00:25.085326 eth2  Out IP 10.0.29.2.53466 > 10.0.29.3.3784: BFDv1, Control, State Up, Flags: [none], length: 24
 00:00:25.136608 eth2  In  IP 10.0.29.3.59003 > 10.0.29.2.3784: BFDv1, Control, State Up, Flags: [none], length: 24
 00:00:25.163996 eth2  Out IP 10.0.29.2.53466 > 10.0.29.3.3784: BFDv1, Control, State Up, Flags: [none], length: 24
 00:00:25.222606 eth2  In  IP 10.0.29.3.59003 > 10.0.29.2.3784: BFDv1, Control, State Up, Flags: [none], length: 24
 00:00:25.250905 eth2  Out IP 10.0.29.2.53466 > 10.0.29.3.3784: BFDv1, Control, State Up, Flags: [none], length: 24
 00:00:25.308082 eth2  In  IP 10.0.29.3.59003 > 10.0.29.2.3784: BFDv1, Control, State Up, Flags: [none], length: 24
 00:00:25.335431 eth2  Out IP 10.0.29.2.53466 > 10.0.29.3.3784: BFDv1, Control, State Up, Flags: [none], length: 24
 00:00:25.386570 eth2  In  IP 10.0.29.3.59003 > 10.0.29.2.3784: BFDv1, Control, State Up, Flags: [none], length: 24
 00:00:25.421960 eth2  Out IP 10.0.29.2.53466 > 10.0.29.3.3784: BFDv1, Control, State Up, Flags: [none], length: 24
 00:00:25.465406 eth2  In  IP 10.0.29.3.59003 > 10.0.29.2.3784: BFDv1, Control, State Up, Flags: [none], length: 24
 00:00:25.499786 eth2  Out IP 10.0.29.2.53466 > 10.0.29.3.3784: BFDv1, Control, State Up, Flags: [none], length: 24
 00:00:25.540100 eth2  In  IP 10.0.29.3.59003 > 10.0.29.2.3784: BFDv1, Control, State Up, Flags: [none], length: 24
 00:00:25.583631 eth2  Out IP 10.0.29.2.53466 > 10.0.29.3.3784: BFDv1, Control, State Up, Flags: [none], length: 24
 00:00:25.624801 eth2  In  IP 10.0.29.3.59003 > 10.0.29.2.3784: BFDv1, Control, State Up, Flags: [none], length: 24
 00:00:25.659135 eth2  Out IP 10.0.29.2.53466 > 10.0.29.3.3784: BFDv1, Control, State Up, Flags: [none], length: 24
 00:00:25.712941 eth2  In  IP 10.0.29.3.59003 > 10.0.29.2.3784: BFDv1, Control, State Up, Flags: [none], length: 24
 00:00:25.735284 eth2  Out IP 10.0.29.2.53466 > 10.0.29.3.3784: BFDv1, Control, State Up, Flags: [none], length: 24
 00:00:25.796977 eth2  In  IP 10.0.29.3.59003 > 10.0.29.2.3784: BFDv1, Control, State Up, Flags: [none], length: 24
 00:00:25.818277 eth2  Out IP 10.0.29.2.53466 > 10.0.29.3.3784: BFDv1, Control, State Up, Flags: [none], length: 24
 00:00:25.886596 eth2  In  IP 10.0.29.3.59003 > 10.0.29.2.3784: BFDv1, Control, State Up, Flags: [none], length: 24
 00:00:25.900919 eth2  Out IP 10.0.29.2.53466 > 10.0.29.3.3784: BFDv1, Control, State Up, Flags: [none], length: 24
 00:00:25.964486 eth2  In  IP 10.0.29.3.59003 > 10.0.29.2.3784: BFDv1, Control, State Up, Flags: [none], length: 24
 00:00:25.977995 eth2  Out IP 10.0.29.2.53466 > 10.0.29.3.3784: BFDv1, Control, State Up, Flags: [none], length: 24
 00:00:26.040372 eth2  In  IP 10.0.29.3.59003 > 10.0.29.2.3784: BFDv1, Control, State Up, Flags: [none], length: 24
 00:00:26.054666 eth2  Out IP 10.0.29.2.53466 > 10.0.29.3.3784: BFDv1, Control, State Up, Flags: [none], length: 24
 00:00:26.124461 eth2  In  IP 10.0.29.3.59003 > 10.0.29.2.3784: BFDv1, Control, State Up, Flags: [none], length: 24
 00:00:26.143817 eth2  Out IP 10.0.29.2.53466 > 10.0.29.3.3784: BFDv1, Control, State Up, Flags: [none], length: 24
 00:00:26.208036 eth2  In  IP 10.0.29.3.59003 > 10.0.29.2.3784: BFDv1, Control, State Up, Flags: [none], length: 24
 00:00:26.228337 eth2  Out IP 10.0.29.2.53466 > 10.0.29.3.3784: BFDv1, Control, State Up, Flags: [none], length: 24
 00:00:26.284612 eth2  In  IP 10.0.29.3.59003 > 10.0.29.2.3784: BFDv1, Control, State Up, Flags: [none], length: 24
 00:00:26.309965 eth2  Out IP 10.0.29.2.53466 > 10.0.29.3.3784: BFDv1, Control, State Up, Flags: [none], length: 24
 00:00:26.372648 eth2  In  IP 10.0.29.3.59003 > 10.0.29.2.3784: BFDv1, Control, State Up, Flags: [none], length: 24
 00:00:26.388040 eth2  Out IP 10.0.29.2.53466 > 10.0.29.3.3784: BFDv1, Control, State Up, Flags: [none], length: 24
 00:00:26.457756 eth2  In  IP 10.0.29.3.59003 > 10.0.29.2.3784: BFDv1, Control, State Up, Flags: [none], length: 24
 00:00:26.469009 eth2  Out IP 10.0.29.2.53466 > 10.0.29.3.3784: BFDv1, Control, State Up, Flags: [none], length: 24
 00:00:26.539912 eth2  In  IP 10.0.29.3.59003 > 10.0.29.2.3784: BFDv1, Control, State Up, Flags: [none], length: 24
 00:00:26.557340 eth2  Out IP 10.0.29.2.53466 > 10.0.29.3.3784: BFDv1, Control, State Up, Flags: [none], length: 24
 00:00:26.627036 eth2  In  IP 10.0.29.3.59003 > 10.0.29.2.3784: BFDv1, Control, State Up, Flags: [none], length: 24
 00:00:26.645401 eth2  Out IP 10.0.29.2.53466 > 10.0.29.3.3784: BFDv1, Control, State Up, Flags: [none], length: 24
 00:00:26.710236 eth2  In  IP 10.0.29.3.59003 > 10.0.29.2.3784: BFDv1, Control, State Up, Flags: [none], length: 24
 00:00:26.734531 eth2  Out IP 10.0.29.2.53466 > 10.0.29.3.3784: BFDv1, Control, State Up, Flags: [none], length: 24
 00:00:26.795327 eth2  In  IP 10.0.29.3.59003 > 10.0.29.2.3784: BFDv1, Control, State Up, Flags: [none], length: 24
 00:00:26.818699 eth2  Out IP 10.0.29.2.53466 > 10.0.29.3.3784: BFDv1, Control, State Up, Flags: [none], length: 24
 00:00:26.883411 eth2  In  IP 10.0.29.3.59003 > 10.0.29.2.3784: BFDv1, Control, State Up, Flags: [none], length: 24
 00:00:26.905693 eth2  Out IP 10.0.29.2.53466 > 10.0.29.3.3784: BFDv1, Control, State Up, Flags: [none], length: 24
 00:00:26.965502 eth2  In  IP 10.0.29.3.59003 > 10.0.29.2.3784: BFDv1, Control, State Up, Flags: [none], length: 24
 00:00:26.982818 eth2  Out IP 10.0.29.2.53466 > 10.0.29.3.3784: BFDv1, Control, State Up, Flags: [none], length: 24
 00:00:27.043980 eth2  In  IP 10.0.29.3.59003 > 10.0.29.2.3784: BFDv1, Control, State Up, Flags: [none], length: 24
 00:00:27.058326 eth2  Out IP 10.0.29.2.53466 > 10.0.29.3.3784: BFDv1, Control, State Up, Flags: [none], length: 24
 00:00:27.130426 eth2  In  IP 10.0.29.3.59003 > 10.0.29.2.3784: BFDv1, Control, State Up, Flags: [none], length: 24
 00:00:27.138746 eth2  Out IP 10.0.29.2.53466 > 10.0.29.3.3784: BFDv1, Control, State Up, Flags: [none], length: 24
 00:00:27.209012 eth2  In  IP 10.0.29.3.59003 > 10.0.29.2.3784: BFDv1, Control, State Up, Flags: [none], length: 24
 00:00:27.227312 eth2  Out IP 10.0.29.2.53466 > 10.0.29.3.3784: BFDv1, Control, State Up, Flags: [none], length: 24
 00:00:27.295423 eth2  In  IP 10.0.29.3.59003 > 10.0.29.2.3784: BFDv1, Control, State Up, Flags: [none], length: 24
 00:00:27.305783 eth2  Out IP 10.0.29.2.53466 > 10.0.29.3.3784: BFDv1, Control, State Up, Flags: [none], length: 24
 00:00:27.379085 eth2  In  IP 10.0.29.3.59003 > 10.0.29.2.3784: BFDv1, Control, State Up, Flags: [none], length: 24
 00:00:27.392428 eth2  Out IP 10.0.29.2.53466 > 10.0.29.3.3784: BFDv1, Control, State Up, Flags: [none], length: 24
 00:00:27.462514 eth2  In  IP 10.0.29.3.59003 > 10.0.29.2.3784: BFDv1, Control, State Up, Flags: [none], length: 24
 00:00:27.479843 eth2  Out IP 10.0.29.2.53466 > 10.0.29.3.3784: BFDv1, Control, State Up, Flags: [none], length: 24
 00:00:27.545072 eth2  In  IP 10.0.29.3.59003 > 10.0.29.2.3784: BFDv1, Control, State Up, Flags: [none], length: 24
 00:00:27.560388 eth2  Out IP 10.0.29.2.53466 > 10.0.29.3.3784: BFDv1, Control, State Up, Flags: [none], length: 24
 00:00:27.619624 eth2  In  IP 10.0.29.3.59003 > 10.0.29.2.3784: BFDv1, Control, State Up, Flags: [none], length: 24
 00:00:27.637946 eth2  Out IP 10.0.29.2.53466 > 10.0.29.3.3784: BFDv1, Control, State Up, Flags: [none], length: 24
 00:00:27.700183 eth2  In  IP 10.0.29.3.59003 > 10.0.29.2.3784: BFDv1, Control, State Up, Flags: [none], length: 24
 00:00:27.714489 eth2  Out IP 10.0.29.2.53466 > 10.0.29.3.3784: BFDv1, Control, State Up, Flags: [none], length: 24
 00:00:27.788730 eth2  In  IP 10.0.29.3.59003 > 10.0.29.2.3784: BFDv1, Control, State Up, Flags: [none], length: 24
 00:00:27.792995 eth2  Out IP 10.0.29.2.53466 > 10.0.29.3.3784: BFDv1, Control, State Up, Flags: [none], length: 24
 00:00:27.877268 eth2  In  IP 10.0.29.3.59003 > 10.0.29.2.3784: BFDv1, Control, State Up, Flags: [none], length: 24
 00:00:27.879534 eth2  Out IP 10.0.29.2.53466 > 10.0.29.3.3784: BFDv1, Control, State Up, Flags: [none], length: 24
 00:00:27.959711 eth2  In  IP 10.0.29.3.59003 > 10.0.29.2.3784: BFDv1, Control, State Up, Flags: [none], length: 24
 00:00:27.967079 eth2  Out IP 10.0.29.2.53466 > 10.0.29.3.3784: BFDv1, Control, State Up, Flags: [none], length: 24
 00:00:28.048170 eth2  In  IP 10.0.29.3.59003 > 10.0.29.2.3784: BFDv1, Control, State Up, Flags: [none], length: 24
 00:00:28.048315 eth2  Out IP 10.0.29.2.53466 > 10.0.29.3.3784: BFDv1, Control, State Up, Flags: [none], length: 24
 00:00:28.124763 eth2  In  IP 10.0.29.3.59003 > 10.0.29.2.3784: BFDv1, Control, State Up, Flags: [none], length: 24
 00:00:28.128025 eth2  Out IP 10.0.29.2.53466 > 10.0.29.3.3784: BFDv1, Control, State Up, Flags: [none], length: 24
 00:00:28.207979 eth2  In  IP 10.0.29.3.59003 > 10.0.29.2.3784: BFDv1, Control, State Up, Flags: [none], length: 24
 00:00:28.215337 eth2  Out IP 10.0.29.2.53466 > 10.0.29.3.3784: BFDv1, Control, State Up, Flags: [none], length: 24
 00:00:28.292921 eth2  In  IP 10.0.29.3.59003 > 10.0.29.2.3784: BFDv1, Control, State Up, Flags: [none], length: 24
 00:00:28.297250 eth2  Out IP 10.0.29.2.53466 > 10.0.29.3.3784: BFDv1, Control, State Up, Flags: [none], length: 24
 00:00:28.376437 eth2  In  IP 10.0.29.3.59003 > 10.0.29.2.3784: BFDv1, Control, State Up, Flags: [none], length: 24
 00:00:28.384714 eth2  Out IP 10.0.29.2.53466 > 10.0.29.3.3784: BFDv1, Control, State Up, Flags: [none], length: 24
 00:00:28.464062 eth2  In  IP 10.0.29.3.59003 > 10.0.29.2.3784: BFDv1, Control, State Up, Flags: [none], length: 24
 00:00:28.465288 eth2  Out IP 10.0.29.2.53466 > 10.0.29.3.3784: BFDv1, Control, State Up, Flags: [none], length: 24
 00:00:28.545721 eth2  In  IP 10.0.29.3.59003 > 10.0.29.2.3784: BFDv1, Control, State Up, Flags: [none], length: 24
 00:00:28.548989 eth2  Out IP 10.0.29.2.53466 > 10.0.29.3.3784: BFDv1, Control, State Up, Flags: [none], length: 24
 00:00:28.635161 eth2  In  IP 10.0.29.3.59003 > 10.0.29.2.3784: BFDv1, Control, State Up, Flags: [none], length: 24
 00:00:28.637458 eth2  Out IP 10.0.29.2.53466 > 10.0.29.3.3784: BFDv1, Control, State Up, Flags: [none], length: 24
 00:00:28.717698 eth2  Out IP 10.0.29.2.53466 > 10.0.29.3.3784: BFDv1, Control, State Up, Flags: [none], length: 24
 00:00:28.718938 eth2  In  IP 10.0.29.3.59003 > 10.0.29.2.3784: BFDv1, Control, State Up, Flags: [none], length: 24
 00:00:28.750054 eth2  Out IP 10.0.29.2.55435 > 10.0.29.3.179: Flags [S], seq 2579133311, win 64240, options [mss 1460,sackOK,TS val 2352136273 ecr 0,nop,wscale 10], length 0
 00:00:28.750120 eth2  In  IP 10.0.29.3.179 > 10.0.29.2.55435: Flags [S.], seq 75443036, ack 2579133312, win 65160, options [mss 1460,sackOK,TS val 562436009 ecr 2352136273,nop,wscale 10], length 0
 00:00:28.750147 eth2  Out IP 10.0.29.2.55435 > 10.0.29.3.179: Flags [.], ack 1, win 63, options [nop,nop,TS val 2352136273 ecr 562436009], length 0
 00:00:28.750216 eth2  Out IP 10.0.29.2.55435 > 10.0.29.3.179: Flags [P.], seq 1:65, ack 1, win 63, options [nop,nop,TS val 2352136273 ecr 562436009], length 64: BGP
 00:00:28.750232 eth2  In  IP 10.0.29.3.179 > 10.0.29.2.55435: Flags [.], ack 65, win 64, options [nop,nop,TS val 562436009 ecr 2352136273], length 0
 00:00:28.750280 eth2  In  IP 10.0.29.3.179 > 10.0.29.2.55435: Flags [R.], seq 1, ack 65, win 64, options [nop,nop,TS val 562436009 ecr 2352136273], length 0
 00:00:28.795189 eth2  In  IP 10.0.29.3.59003 > 10.0.29.2.3784: BFDv1, Control, State Up, Flags: [none], length: 24
 00:00:28.795222 eth2  Out IP 10.0.29.2.53466 > 10.0.29.3.3784: BFDv1, Control, State Up, Flags: [none], length: 24
 00:00:28.872490 eth2  Out IP 10.0.29.2.53466 > 10.0.29.3.3784: BFDv1, Control, State Up, Flags: [none], length: 24
 00:00:28.873711 eth2  In  IP 10.0.29.3.59003 > 10.0.29.2.3784: BFDv1, Control, State Up, Flags: [none], length: 24
 00:00:28.954000 eth2  Out IP 10.0.29.2.53466 > 10.0.29.3.3784: BFDv1, Control, State Up, Flags: [none], length: 24
 00:00:28.957326 eth2  In  IP 10.0.29.3.59003 > 10.0.29.2.3784: BFDv1, Control, State Up, Flags: [none], length: 24
 00:00:29.035755 eth2  Out IP 10.0.29.2.53466 > 10.0.29.3.3784: BFDv1, Control, State Up, Flags: [none], length: 24
 00:00:29.043159 eth2  In  IP 10.0.29.3.59003 > 10.0.29.2.3784: BFDv1, Control, State Up, Flags: [none], length: 24
 00:00:29.122567 eth2  Out IP 10.0.29.2.53466 > 10.0.29.3.3784: BFDv1, Control, State Up, Flags: [none], length: 24
 00:00:29.123779 eth2  In  IP 10.0.29.3.59003 > 10.0.29.2.3784: BFDv1, Control, State Up, Flags: [none], length: 24
 00:00:29.199371 eth2  In  IP 10.0.29.3.59003 > 10.0.29.2.3784: BFDv1, Control, State Up, Flags: [none], length: 24
 00:00:29.201810 eth2  Out IP 10.0.29.2.53466 > 10.0.29.3.3784: BFDv1, Control, State Up, Flags: [none], length: 24
 00:00:29.275955 eth2  In  IP 10.0.29.3.59003 > 10.0.29.2.3784: BFDv1, Control, State Up, Flags: [none], length: 24
 00:00:29.284269 eth2  Out IP 10.0.29.2.53466 > 10.0.29.3.3784: BFDv1, Control, State Up, Flags: [none], length: 24
 00:00:29.364560 eth2  In  IP 10.0.29.3.59003 > 10.0.29.2.3784: BFDv1, Control, State Up, Flags: [none], length: 24
 00:00:29.370910 eth2  Out IP 10.0.29.2.53466 > 10.0.29.3.3784: BFDv1, Control, State Up, Flags: [none], length: 24
 00:00:29.450142 eth2  In  IP 10.0.29.3.59003 > 10.0.29.2.3784: BFDv1, Control, State Up, Flags: [none], length: 24
 00:00:29.454535 eth2  Out IP 10.0.29.2.53466 > 10.0.29.3.3784: BFDv1, Control, State Up, Flags: [none], length: 24
 00:00:29.535834 eth2  In  IP 10.0.29.3.59003 > 10.0.29.2.3784: BFDv1, Control, State Up, Flags: [none], length: 24
 00:00:29.537134 eth2  Out IP 10.0.29.2.53466 > 10.0.29.3.3784: BFDv1, Control, State Up, Flags: [none], length: 24
 00:00:29.613420 eth2  In  IP 10.0.29.3.59003 > 10.0.29.2.3784: BFDv1, Control, State Up, Flags: [none], length: 24
 00:00:29.626758 eth2  Out IP 10.0.29.2.53466 > 10.0.29.3.3784: BFDv1, Control, State Up, Flags: [none], length: 24
 00:00:29.701148 eth2  In  IP 10.0.29.3.59003 > 10.0.29.2.3784: BFDv1, Control, State Up, Flags: [none], length: 24
 00:00:29.706450 eth2  Out IP 10.0.29.2.53466 > 10.0.29.3.3784: BFDv1, Control, State Up, Flags: [none], length: 24
 00:00:29.786715 eth2  Out IP 10.0.29.2.53466 > 10.0.29.3.3784: BFDv1, Control, State Up, Flags: [none], length: 24
 00:00:29.789973 eth2  In  IP 10.0.29.3.59003 > 10.0.29.2.3784: BFDv1, Control, State Up, Flags: [none], length: 24
 00:00:29.867288 eth2  Out IP 10.0.29.2.53466 > 10.0.29.3.3784: BFDv1, Control, State Up, Flags: [none], length: 24
 00:00:29.873654 eth2  In  IP 10.0.29.3.59003 > 10.0.29.2.3784: BFDv1, Control, State Up, Flags: [none], length: 24
 00:00:29.949014 eth2  Out IP 10.0.29.2.53466 > 10.0.29.3.3784: BFDv1, Control, State Up, Flags: [none], length: 24
 00:00:29.952296 eth2  In  IP 10.0.29.3.59003 > 10.0.29.2.3784: BFDv1, Control, State Up, Flags: [none], length: 24
 00:00:30.029730 eth2  Out IP 10.0.29.2.53466 > 10.0.29.3.3784: BFDv1, Control, State Up, Flags: [none], length: 24
 00:00:30.034223 eth2  In  IP 10.0.29.3.59003 > 10.0.29.2.3784: BFDv1, Control, State Up, Flags: [none], length: 24
 00:00:30.111061 eth2  In  IP 10.0.29.3.59003 > 10.0.29.2.3784: BFDv1, Control, State Up, Flags: [none], length: 24
 00:00:30.113407 eth2  Out IP 10.0.29.2.53466 > 10.0.29.3.3784: BFDv1, Control, State Up, Flags: [none], length: 24
 00:00:30.190689 eth2  Out IP 10.0.29.2.53466 > 10.0.29.3.3784: BFDv1, Control, State Up, Flags: [none], length: 24
 00:00:30.191989 eth2  In  IP 10.0.29.3.59003 > 10.0.29.2.3784: BFDv1, Control, State Up, Flags: [none], length: 24
 00:00:30.269300 eth2  Out IP 10.0.29.2.53466 > 10.0.29.3.3784: BFDv1, Control, State Up, Flags: [none], length: 24
 00:00:30.270583 eth2  In  IP 10.0.29.3.59003 > 10.0.29.2.3784: BFDv1, Control, State Up, Flags: [none], length: 24

569 packets captured
569 packets received by filter
0 packets dropped by kernel
