tcpdump: data link type LINUX_SLL2
tcpdump: verbose output suppressed, use -v[v]... for full protocol decode
listening on any, link-type LINUX_SLL2 (Linux cooked v2), snapshot length 262144 bytes
 00:00:00.000000 eth1  In  IP 10.0.23.2.57018 > 10.0.23.3.3784: BFDv1, Control, State Up, Flags: [none], length: 24
 00:00:00.002598 eth3  In  IP 10.0.35.3.35105 > 10.0.35.2.3784: BFDv1, Control, State Up, Flags: [none], length: 24
 00:00:00.007980 eth3  Out IP 10.0.35.2.50865 > 10.0.35.3.3784: BFDv1, Control, State Up, Flags: [none], length: 24
 00:00:00.020505 eth0  In  IP 10.0.13.2.37532 > 10.0.13.3.3784: BFDv1, Control, State Up, Flags: [none], length: 24
 00:00:00.026891 eth2  Out IP 10.0.34.2.37778 > 10.0.34.3.3784: BFDv1, Control, State Up, Flags: [none], length: 24
 00:00:00.045667 eth2  In  IP 10.0.34.3.60380 > 10.0.34.2.3784: BFDv1, Control, State Up, Flags: [none], length: 24
 00:00:00.055038 eth0  Out IP 10.0.13.3.36570 > 10.0.13.2.3784: BFDv1, Control, State Up, Flags: [none], length: 24
 00:00:00.061341 eth1  Out IP 10.0.23.3.33100 > 10.0.23.2.3784: BFDv1, Control, State Up, Flags: [none], length: 24
 00:00:00.079642 eth3  In  IP 10.0.35.3.35105 > 10.0.35.2.3784: BFDv1, Control, State Up, Flags: [none], length: 24
 00:00:00.085026 eth3  Out IP 10.0.35.2.50865 > 10.0.35.3.3784: BFDv1, Control, State Up, Flags: [none], length: 24
 00:00:00.085892 eth1  In  IP 10.0.23.2.57018 > 10.0.23.3.3784: BFDv1, Control, State Up, Flags: [none], length: 24
 00:00:00.098271 eth0  In  IP 10.0.13.2.37532 > 10.0.13.3.3784: BFDv1, Control, State Up, Flags: [none], length: 24
 00:00:00.106612 eth2  Out IP 10.0.34.2.37778 > 10.0.34.3.3784: BFDv1, Control, State Up, Flags: [none], length: 24
 00:00:00.132026 eth2  In  IP 10.0.34.3.60380 > 10.0.34.2.3784: BFDv1, Control, State Up, Flags: [none], length: 24
 00:00:00.144483 eth0  Out IP 10.0.13.3.36570 > 10.0.13.2.3784: BFDv1, Control, State Up, Flags: [none], length: 24
 00:00:00.144598 eth1  Out IP 10.0.23.3.33100 > 10.0.23.2.3784: BFDv1, Control, State Up, Flags: [none], length: 24
 00:00:00.165614 eth3  In  IP 10.0.35.3.35105 > 10.0.35.2.3784: BFDv1, Control, State Up, Flags: [none], length: 24
 00:00:00.170416 eth1  In  IP 10.0.23.2.57018 > 10.0.23.3.3784: BFDv1, Control, State Up, Flags: [none], length: 24
 00:00:00.173990 eth0  In  IP 10.0.13.2.37532 > 10.0.13.3.3784: BFDv1, Control, State Up, Flags: [none], length: 24
 00:00:00.182462 eth3  Out IP 10.0.35.2.50865 > 10.0.35.3.3784: BFDv1, Control, State Up, Flags: [none], length: 24
 00:00:00.185726 eth2  Out IP 10.0.34.2.37778 > 10.0.34.3.3784: BFDv1, Control, State Up, Flags: [none], length: 24
 00:00:00.213687 eth2  In  IP 10.0.34.3.60380 > 10.0.34.2.3784: BFDv1, Control, State Up, Flags: [none], length: 24
 00:00:00.228111 eth0  Out IP 10.0.13.3.36570 > 10.0.13.2.3784: BFDv1, Control, State Up, Flags: [none], length: 24
 00:00:00.231363 eth1  Out IP 10.0.23.3.33100 > 10.0.23.2.3784: BFDv1, Control, State Up, Flags: [none], length: 24
 00:00:00.249905 eth3  In  IP 10.0.35.3.35105 > 10.0.35.2.3784: BFDv1, Control, State Up, Flags: [none], length: 24
 00:00:00.252281 eth3  Out IP 10.0.35.2.50865 > 10.0.35.3.3784: BFDv1, Control, State Up, Flags: [none], length: 24
 00:00:00.255309 eth0  In  IP 10.0.13.2.37532 > 10.0.13.3.3784: BFDv1, Control, State Up, Flags: [none], length: 24
 00:00:00.258401 eth1  In  IP 10.0.23.2.57018 > 10.0.23.3.3784: BFDv1, Control, State Up, Flags: [none], length: 24
 00:00:00.263650 eth2  Out IP 10.0.34.2.37778 > 10.0.34.3.3784: BFDv1, Control, State Up, Flags: [none], length: 24
 00:00:00.296324 eth2  In  IP 10.0.34.3.60380 > 10.0.34.2.3784: BFDv1, Control, State Up, Flags: [none], length: 24
 00:00:00.306775 eth0  Out IP 10.0.13.3.36570 > 10.0.13.2.3784: BFDv1, Control, State Up, Flags: [none], length: 24
 00:00:00.314109 eth1  Out IP 10.0.23.3.33100 > 10.0.23.2.3784: BFDv1, Control, State Up, Flags: [none], length: 24
 00:00:00.328507 eth3  In  IP 10.0.35.3.35105 > 10.0.35.2.3784: BFDv1, Control, State Up, Flags: [none], length: 24
 00:00:00.333125 eth0  In  IP 10.0.13.2.37532 > 10.0.13.3.3784: BFDv1, Control, State Up, Flags: [none], length: 24
 00:00:00.334443 eth3  Out IP 10.0.35.2.50865 > 10.0.35.3.3784: BFDv1, Control, State Up, Flags: [none], length: 24
 00:00:00.342357 eth1  In  IP 10.0.23.2.57018 > 10.0.23.3.3784: BFDv1, Control, State Up, Flags: [none], length: 24
 00:00:00.352711 eth2  Out IP 10.0.34.2.37778 > 10.0.34.3.3784: BFDv1, Control, State Up, Flags: [none], length: 24
 00:00:00.376330 eth2  In  IP 10.0.34.3.60380 > 10.0.34.2.3784: BFDv1, Control, State Up, Flags: [none], length: 24
 00:00:00.395753 eth0  Out IP 10.0.13.3.36570 > 10.0.13.2.3784: BFDv1, Control, State Up, Flags: [none], length: 24
 00:00:00.398002 eth1  Out IP 10.0.23.3.33100 > 10.0.23.2.3784: BFDv1, Control, State Up, Flags: [none], length: 24
 00:00:00.406078 eth3  In  IP 10.0.35.3.35105 > 10.0.35.2.3784: BFDv1, Control, State Up, Flags: [none], length: 24
 00:00:00.412422 eth3  Out IP 10.0.35.2.50865 > 10.0.35.3.3784: BFDv1, Control, State Up, Flags: [none], length: 24
 00:00:00.414610 eth0  In  IP 10.0.13.2.37532 > 10.0.13.3.3784: BFDv1, Control, State Up, Flags: [none], length: 24
 00:00:00.421155 eth1  In  IP 10.0.23.2.57018 > 10.0.23.3.3784: BFDv1, Control, State Up, Flags: [none], length: 24
 00:00:00.440514 eth2  Out IP 10.0.34.2.37778 > 10.0.34.3.3784: BFDv1, Control, State Up, Flags: [none], length: 24
 00:00:00.458794 eth2  In  IP 10.0.34.3.60380 > 10.0.34.2.3784: BFDv1, Control, State Up, Flags: [none], length: 24
 00:00:00.473223 eth0  Out IP 10.0.13.3.36570 > 10.0.13.2.3784: BFDv1, Control, State Up, Flags: [none], length: 24
 00:00:00.481840 eth1  Out IP 10.0.23.3.33100 > 10.0.23.2.3784: BFDv1, Control, State Up, Flags: [none], length: 24
 00:00:00.489748 eth3  In  IP 10.0.35.3.35105 > 10.0.35.2.3784: BFDv1, Control, State Up, Flags: [none], length: 24
 00:00:00.490714 eth0  In  IP 10.0.13.2.37532 > 10.0.13.3.3784: BFDv1, Control, State Up, Flags: [none], length: 24
 00:00:00.493064 eth3  Out IP 10.0.35.2.50865 > 10.0.35.3.3784: BFDv1, Control, State Up, Flags: [none], length: 24
 00:00:00.498465 eth1  In  IP 10.0.23.2.57018 > 10.0.23.3.3784: BFDv1, Control, State Up, Flags: [none], length: 24
 00:00:00.518861 eth2  Out IP 10.0.34.2.37778 > 10.0.34.3.3784: BFDv1, Control, State Up, Flags: [none], length: 24
 00:00:00.545094 eth2  In  IP 10.0.34.3.60380 > 10.0.34.2.3784: BFDv1, Control, State Up, Flags: [none], length: 24
 00:00:00.558436 eth0  Out IP 10.0.13.3.36570 > 10.0.13.2.3784: BFDv1, Control, State Up, Flags: [none], length: 24
 00:00:00.567322 eth3  In  IP 10.0.35.3.35105 > 10.0.35.2.3784: BFDv1, Control, State Up, Flags: [none], length: 24
 00:00:00.570664 eth1  Out IP 10.0.23.3.33100 > 10.0.23.2.3784: BFDv1, Control, State Up, Flags: [none], length: 24
 00:00:00.571682 eth0  In  IP 10.0.13.2.37532 > 10.0.13.3.3784: BFDv1, Control, State Up, Flags: [none], length: 24
 00:00:00.574030 eth1  In  IP 10.0.23.2.57018 > 10.0.23.3.3784: BFDv1, Control, State Up, Flags: [none], length: 24
 00:00:00.579374 eth3  Out IP 10.0.35.2.50865 > 10.0.35.3.3784: BFDv1, Control, State Up, Flags: [none], length: 24
 00:00:00.605636 eth2  Out IP 10.0.34.2.37778 > 10.0.34.3.3784: BFDv1, Control, State Up, Flags: [none], length: 24
 00:00:00.624917 eth2  In  IP 10.0.34.3.60380 > 10.0.34.2.3784: BFDv1, Control, State Up, Flags: [none], length: 24
 00:00:00.642908 eth3  In  IP 10.0.35.3.35105 > 10.0.35.2.3784: BFDv1, Control, State Up, Flags: [none], length: 24
 00:00:00.646212 eth0  Out IP 10.0.13.3.36570 > 10.0.13.2.3784: BFDv1, Control, State Up, Flags: [none], length: 24
 00:00:00.658471 eth1  Out IP 10.0.23.3.33100 > 10.0.23.2.3784: BFDv1, Control, State Up, Flags: [none], length: 24
 00:00:00.658468 eth0  In  IP 10.0.13.2.37532 > 10.0.13.3.3784: BFDv1, Control, State Up, Flags: [none], length: 24
 00:00:00.659715 eth1  In  IP 10.0.23.2.57018 > 10.0.23.3.3784: BFDv1, Control, State Up, Flags: [none], length: 24
 00:00:00.663149 eth3  Out IP 10.0.35.2.50865 > 10.0.35.3.3784: BFDv1, Control, State Up, Flags: [none], length: 24
 00:00:00.686527 eth2  Out IP 10.0.34.2.37778 > 10.0.34.3.3784: BFDv1, Control, State Up, Flags: [none], length: 24
 00:00:00.701151 eth2  In  IP 10.0.34.3.60380 > 10.0.34.2.3784: BFDv1, Control, State Up, Flags: [none], length: 24
 00:00:00.731710 eth3  In  IP 10.0.35.3.35105 > 10.0.35.2.3784: BFDv1, Control, State Up, Flags: [none], length: 24
 00:00:00.735030 eth0  Out IP 10.0.13.3.36570 > 10.0.13.2.3784: BFDv1, Control, State Up, Flags: [none], length: 24
 00:00:00.742786 eth1  In  IP 10.0.23.2.57018 > 10.0.23.3.3784: BFDv1, Control, State Up, Flags: [none], length: 24
 00:00:00.744083 eth1  Out IP 10.0.23.3.33100 > 10.0.23.2.3784: BFDv1, Control, State Up, Flags: [none], length: 24
 00:00:00.745954 eth0  In  IP 10.0.13.2.37532 > 10.0.13.3.3784: BFDv1, Control, State Up, Flags: [none], length: 24
 00:00:00.747194 eth3  Out IP 10.0.35.2.50865 > 10.0.35.3.3784: BFDv1, Control, State Up, Flags: [none], length: 24
 00:00:00.774426 eth2  Out IP 10.0.34.2.37778 > 10.0.34.3.3784: BFDv1, Control, State Up, Flags: [none], length: 24
 00:00:00.777687 eth2  In  IP 10.0.34.3.60380 > 10.0.34.2.3784: BFDv1, Control, State Up, Flags: [none], length: 24
 00:00:00.812287 eth3  In  IP 10.0.35.3.35105 > 10.0.35.2.3784: BFDv1, Control, State Up, Flags: [none], length: 24
 00:00:00.812518 eth0  Out IP 10.0.13.3.36570 > 10.0.13.2.3784: BFDv1, Control, State Up, Flags: [none], length: 24
 00:00:00.824791 eth3  Out IP 10.0.35.2.50865 > 10.0.35.3.3784: BFDv1, Control, State Up, Flags: [none], length: 24
 00:00:00.824925 eth1  Out IP 10.0.23.3.33100 > 10.0.23.2.3784: BFDv1, Control, State Up, Flags: [none], length: 24
 00:00:00.825767 eth0  In  IP 10.0.13.2.37532 > 10.0.13.3.3784: BFDv1, Control, State Up, Flags: [none], length: 24
 00:00:00.826128 eth1  In  IP 10.0.23.2.57018 > 10.0.23.3.3784: BFDv1, Control, State Up, Flags: [none], length: 24
 00:00:00.860429 eth2  Out IP 10.0.34.2.37778 > 10.0.34.3.3784: BFDv1, Control, State Up, Flags: [none], length: 24
 00:00:00.864702 eth2  In  IP 10.0.34.3.60380 > 10.0.34.2.3784: BFDv1, Control, State Up, Flags: [none], length: 24
 00:00:00.890124 eth0  Out IP 10.0.13.3.36570 > 10.0.13.2.3784: BFDv1, Control, State Up, Flags: [none], length: 24
 00:00:00.894930 eth3  In  IP 10.0.35.3.35105 > 10.0.35.2.3784: BFDv1, Control, State Up, Flags: [none], length: 24
 00:00:00.907332 eth3  Out IP 10.0.35.2.50865 > 10.0.35.3.3784: BFDv1, Control, State Up, Flags: [none], length: 24
 00:00:00.909843 eth0  In  IP 10.0.13.2.37532 > 10.0.13.3.3784: BFDv1, Control, State Up, Flags: [none], length: 24
 00:00:00.910313 eth1  In  IP 10.0.23.2.57018 > 10.0.23.3.3784: BFDv1, Control, State Up, Flags: [none], length: 24
 00:00:00.913629 eth1  Out IP 10.0.23.3.33100 > 10.0.23.2.3784: BFDv1, Control, State Up, Flags: [none], length: 24
 00:00:00.940870 eth2  Out IP 10.0.34.2.37778 > 10.0.34.3.3784: BFDv1, Control, State Up, Flags: [none], length: 24
 00:00:00.942506 eth2  In  IP 10.0.34.3.60380 > 10.0.34.2.3784: BFDv1, Control, State Up, Flags: [none], length: 24
 00:00:00.976312 eth3  In  IP 10.0.35.3.35105 > 10.0.35.2.3784: BFDv1, Control, State Up, Flags: [none], length: 24
 00:00:00.980596 eth0  Out IP 10.0.13.3.36570 > 10.0.13.2.3784: BFDv1, Control, State Up, Flags: [none], length: 24
 00:00:00.987651 eth1  In  IP 10.0.23.2.57018 > 10.0.23.3.3784: BFDv1, Control, State Up, Flags: [none], length: 24
 00:00:00.987755 eth3  Out IP 10.0.35.2.50865 > 10.0.35.3.3784: BFDv1, Control, State Up, Flags: [none], length: 24
 00:00:00.987891 eth0  In  IP 10.0.13.2.37532 > 10.0.13.3.3784: BFDv1, Control, State Up, Flags: [none], length: 24
 00:00:00.993112 eth1  Out IP 10.0.23.3.33100 > 10.0.23.2.3784: BFDv1, Control, State Up, Flags: [none], length: 24
 00:00:01.030117 eth2  In  IP 10.0.34.3.60380 > 10.0.34.2.3784: BFDv1, Control, State Up, Flags: [none], length: 24
 00:00:01.030318 eth2  Out IP 10.0.34.2.37778 > 10.0.34.3.3784: BFDv1, Control, State Up, Flags: [none], length: 24
 00:00:01.062834 eth3  In  IP 10.0.35.3.35105 > 10.0.35.2.3784: BFDv1, Control, State Up, Flags: [none], length: 24
 00:00:01.070175 eth0  Out IP 10.0.13.3.36570 > 10.0.13.2.3784: BFDv1, Control, State Up, Flags: [none], length: 24
 00:00:01.071416 eth3  Out IP 10.0.35.2.50865 > 10.0.35.3.3784: BFDv1, Control, State Up, Flags: [none], length: 24
 00:00:01.071663 eth1  In  IP 10.0.23.2.57018 > 10.0.23.3.3784: BFDv1, Control, State Up, Flags: [none], length: 24
 00:00:01.076623 eth0  In  IP 10.0.13.2.37532 > 10.0.13.3.3784: BFDv1, Control, State Up, Flags: [none], length: 24
 00:00:01.080112 eth1  Out IP 10.0.23.3.33100 > 10.0.23.2.3784: BFDv1, Control, State Up, Flags: [none], length: 24
 00:00:01.105407 eth2  In  IP 10.0.34.3.60380 > 10.0.34.2.3784: BFDv1, Control, State Up, Flags: [none], length: 24
 00:00:01.107763 eth2  Out IP 10.0.34.2.37778 > 10.0.34.3.3784: BFDv1, Control, State Up, Flags: [none], length: 24
 00:00:01.147026 eth0  Out IP 10.0.13.3.36570 > 10.0.13.2.3784: BFDv1, Control, State Up, Flags: [none], length: 24
 00:00:01.148288 eth3  Out IP 10.0.35.2.50865 > 10.0.35.3.3784: BFDv1, Control, State Up, Flags: [none], length: 24
 00:00:01.151516 eth3  In  IP 10.0.35.3.35105 > 10.0.35.2.3784: BFDv1, Control, State Up, Flags: [none], length: 24
 00:00:01.159871 eth1  Out IP 10.0.23.3.33100 > 10.0.23.2.3784: BFDv1, Control, State Up, Flags: [none], length: 24
 00:00:01.159962 eth1  In  IP 10.0.23.2.57018 > 10.0.23.3.3784: BFDv1, Control, State Up, Flags: [none], length: 24
 00:00:01.161229 eth0  In  IP 10.0.13.2.37532 > 10.0.13.3.3784: BFDv1, Control, State Up, Flags: [none], length: 24
 00:00:01.191350 eth2  In  IP 10.0.34.3.60380 > 10.0.34.2.3784: BFDv1, Control, State Up, Flags: [none], length: 24
 00:00:01.193736 eth2  Out IP 10.0.34.2.37778 > 10.0.34.3.3784: BFDv1, Control, State Up, Flags: [none], length: 24
 00:00:01.224332 eth3  Out IP 10.0.35.2.50865 > 10.0.35.3.3784: BFDv1, Control, State Up, Flags: [none], length: 24
 00:00:01.231587 eth3  In  IP 10.0.35.3.35105 > 10.0.35.2.3784: BFDv1, Control, State Up, Flags: [none], length: 24
 00:00:01.236899 eth0  Out IP 10.0.13.3.36570 > 10.0.13.2.3784: BFDv1, Control, State Up, Flags: [none], length: 24
 00:00:01.242086 eth1  In  IP 10.0.23.2.57018 > 10.0.23.3.3784: BFDv1, Control, State Up, Flags: [none], length: 24
 00:00:01.243282 eth1  Out IP 10.0.23.3.33100 > 10.0.23.2.3784: BFDv1, Control, State Up, Flags: [none], length: 24
 00:00:01.250378 eth0  In  IP 10.0.13.2.37532 > 10.0.13.3.3784: BFDv1, Control, State Up, Flags: [none], length: 24
 00:00:01.274610 eth2  In  IP 10.0.34.3.60380 > 10.0.34.2.3784: BFDv1, Control, State Up, Flags: [none], length: 24
 00:00:01.282034 eth2  Out IP 10.0.34.2.37778 > 10.0.34.3.3784: BFDv1, Control, State Up, Flags: [none], length: 24
 00:00:01.310351 eth3  In  IP 10.0.35.3.35105 > 10.0.35.2.3784: BFDv1, Control, State Up, Flags: [none], length: 24
 00:00:01.312684 eth0  Out IP 10.0.13.3.36570 > 10.0.13.2.3784: BFDv1, Control, State Up, Flags: [none], length: 24
 00:00:01.313911 eth3  Out IP 10.0.35.2.50865 > 10.0.35.3.3784: BFDv1, Control, State Up, Flags: [none], length: 24
 00:00:01.322144 eth1  Out IP 10.0.23.3.33100 > 10.0.23.2.3784: BFDv1, Control, State Up, Flags: [none], length: 24
 00:00:01.327010 eth0  In  IP 10.0.13.2.37532 > 10.0.13.3.3784: BFDv1, Control, State Up, Flags: [none], length: 24
 00:00:01.328378 eth1  In  IP 10.0.23.2.57018 > 10.0.23.3.3784: BFDv1, Control, State Up, Flags: [none], length: 24
 00:00:01.359513 eth2  In  IP 10.0.34.3.60380 > 10.0.34.2.3784: BFDv1, Control, State Up, Flags: [none], length: 24
 00:00:01.370967 eth2  Out IP 10.0.34.2.37778 > 10.0.34.3.3784: BFDv1, Control, State Up, Flags: [none], length: 24
 00:00:01.393911 eth3  In  IP 10.0.35.3.35105 > 10.0.35.2.3784: BFDv1, Control, State Up, Flags: [none], length: 24
 00:00:01.398295 eth0  Out IP 10.0.13.3.36570 > 10.0.13.2.3784: BFDv1, Control, State Up, Flags: [none], length: 24
 00:00:01.402528 eth3  Out IP 10.0.35.2.50865 > 10.0.35.3.3784: BFDv1, Control, State Up, Flags: [none], length: 24
 00:00:01.408121 eth0  In  IP 10.0.13.2.37532 > 10.0.13.3.3784: BFDv1, Control, State Up, Flags: [none], length: 24
 00:00:01.408300 eth1  Out IP 10.0.23.3.33100 > 10.0.23.2.3784: BFDv1, Control, State Up, Flags: [none], length: 24
 00:00:01.408397 eth1  In  IP 10.0.23.2.57018 > 10.0.23.3.3784: BFDv1, Control, State Up, Flags: [none], length: 24
 00:00:01.446208 eth2  In  IP 10.0.34.3.60380 > 10.0.34.2.3784: BFDv1, Control, State Up, Flags: [none], length: 24
 00:00:01.458592 eth2  Out IP 10.0.34.2.37778 > 10.0.34.3.3784: BFDv1, Control, State Up, Flags: [none], length: 24
 00:00:01.471422 eth3  In  IP 10.0.35.3.35105 > 10.0.35.2.3784: BFDv1, Control, State Up, Flags: [none], length: 24
 00:00:01.476800 eth0  Out IP 10.0.13.3.36570 > 10.0.13.2.3784: BFDv1, Control, State Up, Flags: [none], length: 24
 00:00:01.491135 eth3  Out IP 10.0.35.2.50865 > 10.0.35.3.3784: BFDv1, Control, State Up, Flags: [none], length: 24
 00:00:01.492575 eth1  Out IP 10.0.23.3.33100 > 10.0.23.2.3784: BFDv1, Control, State Up, Flags: [none], length: 24
 00:00:01.494007 eth1  In  IP 10.0.23.2.57018 > 10.0.23.3.3784: BFDv1, Control, State Up, Flags: [none], length: 24
 00:00:01.495993 eth0  In  IP 10.0.13.2.37532 > 10.0.13.3.3784: BFDv1, Control, State Up, Flags: [none], length: 24
 00:00:01.524931 eth2  In  IP 10.0.34.3.60380 > 10.0.34.2.3784: BFDv1, Control, State Up, Flags: [none], length: 24
 00:00:01.539268 eth2  Out IP 10.0.34.2.37778 > 10.0.34.3.3784: BFDv1, Control, State Up, Flags: [none], length: 24
 00:00:01.556505 eth0  Out IP 10.0.13.3.36570 > 10.0.13.2.3784: BFDv1, Control, State Up, Flags: [none], length: 24
 00:00:01.559952 eth3  In  IP 10.0.35.3.35105 > 10.0.35.2.3784: BFDv1, Control, State Up, Flags: [none], length: 24
 00:00:01.573271 eth3  Out IP 10.0.35.2.50865 > 10.0.35.3.3784: BFDv1, Control, State Up, Flags: [none], length: 24
 00:00:01.574222 eth1  In  IP 10.0.23.2.57018 > 10.0.23.3.3784: BFDv1, Control, State Up, Flags: [none], length: 24
 00:00:01.576077 eth0  In  IP 10.0.13.2.37532 > 10.0.13.3.3784: BFDv1, Control, State Up, Flags: [none], length: 24
 00:00:01.578364 eth1  Out IP 10.0.23.3.33100 > 10.0.23.2.3784: BFDv1, Control, State Up, Flags: [none], length: 24
 00:00:01.604202 eth2  In  IP 10.0.34.3.60380 > 10.0.34.2.3784: BFDv1, Control, State Up, Flags: [none], length: 24
 00:00:01.619531 eth2  Out IP 10.0.34.2.37778 > 10.0.34.3.3784: BFDv1, Control, State Up, Flags: [none], length: 24
 00:00:01.637924 eth3  In  IP 10.0.35.3.35105 > 10.0.35.2.3784: BFDv1, Control, State Up, Flags: [none], length: 24
 00:00:01.644192 eth0  Out IP 10.0.13.3.36570 > 10.0.13.2.3784: BFDv1, Control, State Up, Flags: [none], length: 24
 00:00:01.649395 eth3  Out IP 10.0.35.2.50865 > 10.0.35.3.3784: BFDv1, Control, State Up, Flags: [none], length: 24
 00:00:01.656953 eth1  In  IP 10.0.23.2.57018 > 10.0.23.3.3784: BFDv1, Control, State Up, Flags: [none], length: 24
 00:00:01.657098 eth1  Out IP 10.0.23.3.33100 > 10.0.23.2.3784: BFDv1, Control, State Up, Flags: [none], length: 24
 00:00:01.658264 eth0  In  IP 10.0.13.2.37532 > 10.0.13.3.3784: BFDv1, Control, State Up, Flags: [none], length: 24
 00:00:01.687071 eth2  In  IP 10.0.34.3.60380 > 10.0.34.2.3784: BFDv1, Control, State Up, Flags: [none], length: 24
 00:00:01.706477 eth2  Out IP 10.0.34.2.37778 > 10.0.34.3.3784: BFDv1, Control, State Up, Flags: [none], length: 24
 00:00:01.717275 eth3  In  IP 10.0.35.3.35105 > 10.0.35.2.3784: BFDv1, Control, State Up, Flags: [none], length: 24
 00:00:01.724657 eth3  Out IP 10.0.35.2.50865 > 10.0.35.3.3784: BFDv1, Control, State Up, Flags: [none], length: 24
 00:00:01.727907 eth0  Out IP 10.0.13.3.36570 > 10.0.13.2.3784: BFDv1, Control, State Up, Flags: [none], length: 24
 00:00:01.734386 eth1  In  IP 10.0.23.2.57018 > 10.0.23.3.3784: BFDv1, Control, State Up, Flags: [none], length: 24
 00:00:01.740146 eth0  In  IP 10.0.13.2.37532 > 10.0.13.3.3784: BFDv1, Control, State Up, Flags: [none], length: 24
 00:00:01.747457 eth1  Out IP 10.0.23.3.33100 > 10.0.23.2.3784: BFDv1, Control, State Up, Flags: [none], length: 24
 00:00:01.771832 eth2  In  IP 10.0.34.3.60380 > 10.0.34.2.3784: BFDv1, Control, State Up, Flags: [none], length: 24
 00:00:01.792134 eth2  Out IP 10.0.34.2.37778 > 10.0.34.3.3784: BFDv1, Control, State Up, Flags: [none], length: 24
 00:00:01.801442 eth3  Out IP 10.0.35.2.50865 > 10.0.35.3.3784: BFDv1, Control, State Up, Flags: [none], length: 24
 00:00:01.803769 eth3  In  IP 10.0.35.3.35105 > 10.0.35.2.3784: BFDv1, Control, State Up, Flags: [none], length: 24
 00:00:01.808081 eth0  Out IP 10.0.13.3.36570 > 10.0.13.2.3784: BFDv1, Control, State Up, Flags: [none], length: 24
 00:00:01.817950 eth1  In  IP 10.0.23.2.57018 > 10.0.23.3.3784: BFDv1, Control, State Up, Flags: [none], length: 24
 00:00:01.827322 eth0  In  IP 10.0.13.2.37532 > 10.0.13.3.3784: BFDv1, Control, State Up, Flags: [none], length: 24
 00:00:01.827560 eth1  Out IP 10.0.23.3.33100 > 10.0.23.2.3784: BFDv1, Control, State Up, Flags: [none], length: 24
 00:00:01.858881 eth2  In  IP 10.0.34.3.60380 > 10.0.34.2.3784: BFDv1, Control, State Up, Flags: [none], length: 24
 00:00:01.868267 eth2  Out IP 10.0.34.2.37778 > 10.0.34.3.3784: BFDv1, Control, State Up, Flags: [none], length: 24
 00:00:01.882543 eth3  Out IP 10.0.35.2.50865 > 10.0.35.3.3784: BFDv1, Control, State Up, Flags: [none], length: 24
 00:00:01.887931 eth3  In  IP 10.0.35.3.35105 > 10.0.35.2.3784: BFDv1, Control, State Up, Flags: [none], length: 24
 00:00:01.896337 eth0  Out IP 10.0.13.3.36570 > 10.0.13.2.3784: BFDv1, Control, State Up, Flags: [none], length: 24
 00:00:01.900930 eth1  In  IP 10.0.23.2.57018 > 10.0.23.3.3784: BFDv1, Control, State Up, Flags: [none], length: 24
 00:00:01.902626 eth0  In  IP 10.0.13.2.37532 > 10.0.13.3.3784: BFDv1, Control, State Up, Flags: [none], length: 24
 00:00:01.917961 eth1  Out IP 10.0.23.3.33100 > 10.0.23.2.3784: BFDv1, Control, State Up, Flags: [none], length: 24
 00:00:01.941617 eth2  In  IP 10.0.34.3.60380 > 10.0.34.2.3784: BFDv1, Control, State Up, Flags: [none], length: 24
 00:00:01.948879 eth2  Out IP 10.0.34.2.37778 > 10.0.34.3.3784: BFDv1, Control, State Up, Flags: [none], length: 24
 00:00:01.971909 eth3  In  IP 10.0.35.3.35105 > 10.0.35.2.3784: BFDv1, Control, State Up, Flags: [none], length: 24
 00:00:01.972066 eth3  Out IP 10.0.35.2.50865 > 10.0.35.3.3784: BFDv1, Control, State Up, Flags: [none], length: 24
 00:00:01.974260 eth0  Out IP 10.0.13.3.36570 > 10.0.13.2.3784: BFDv1, Control, State Up, Flags: [none], length: 24
 00:00:01.979408 eth1  In  IP 10.0.23.2.57018 > 10.0.23.3.3784: BFDv1, Control, State Up, Flags: [none], length: 24
 00:00:01.981584 eth0  In  IP 10.0.13.2.37532 > 10.0.13.3.3784: BFDv1, Control, State Up, Flags: [none], length: 24
 00:00:01.996015 eth1  Out IP 10.0.23.3.33100 > 10.0.23.2.3784: BFDv1, Control, State Up, Flags: [none], length: 24
 00:00:02.027174 eth2  In  IP 10.0.34.3.60380 > 10.0.34.2.3784: BFDv1, Control, State Up, Flags: [none], length: 24
 00:00:02.047840 eth3  Out IP 10.0.35.2.50865 > 10.0.35.3.3784: BFDv1, Control, State Up, Flags: [none], length: 24
 00:00:02.052071 eth3  In  IP 10.0.35.3.35105 > 10.0.35.2.3784: BFDv1, Control, State Up, Flags: [none], length: 24
 00:00:02.056726 eth1  In  IP 10.0.23.2.57018 > 10.0.23.3.3784: BFDv1, Control, State Up, Flags: [none], length: 24
 00:00:02.060749 eth0  In  IP 10.0.13.2.37532 > 10.0.13.3.3784: BFDv1, Control, State Up, Flags: [none], length: 24
 00:00:02.064062 eth0  Out IP 10.0.13.3.36570 > 10.0.13.2.3784: BFDv1, Control, State Up, Flags: [none], length: 24
 00:00:02.078292 eth1  Out IP 10.0.23.3.33100 > 10.0.23.2.3784: BFDv1, Control, State Up, Flags: [none], length: 24
 00:00:02.116361 eth2  In  IP 10.0.34.3.60380 > 10.0.34.2.3784: BFDv1, Control, State Up, Flags: [none], length: 24
 00:00:02.129228 eth3  In  IP 10.0.35.3.35105 > 10.0.35.2.3784: BFDv1, Control, State Up, Flags: [none], length: 24
 00:00:02.135606 eth3  Out IP 10.0.35.2.50865 > 10.0.35.3.3784: BFDv1, Control, State Up, Flags: [none], length: 24
 00:00:02.139590 eth1  In  IP 10.0.23.2.57018 > 10.0.23.3.3784: BFDv1, Control, State Up, Flags: [none], length: 24
 00:00:02.149941 eth0  In  IP 10.0.13.2.37532 > 10.0.13.3.3784: BFDv1, Control, State Up, Flags: [none], length: 24
 00:00:02.153208 eth0  Out IP 10.0.13.3.36570 > 10.0.13.2.3784: BFDv1, Control, State Up, Flags: [none], length: 24
 00:00:02.163445 eth1  Out IP 10.0.23.3.33100 > 10.0.23.2.3784: BFDv1, Control, State Up, Flags: [none], length: 24
 00:00:02.210527 eth3  In  IP 10.0.35.3.35105 > 10.0.35.2.3784: BFDv1, Control, State Up, Flags: [none], length: 24
 00:00:02.216767 eth3  Out IP 10.0.35.2.50865 > 10.0.35.3.3784: BFDv1, Control, State Up, Flags: [none], length: 24
 00:00:02.219198 eth1  In  IP 10.0.23.2.57018 > 10.0.23.3.3784: BFDv1, Control, State Up, Flags: [none], length: 24
 00:00:02.235488 eth0  Out IP 10.0.13.3.36570 > 10.0.13.2.3784: BFDv1, Control, State Up, Flags: [none], length: 24
 00:00:02.239684 eth0  In  IP 10.0.13.2.37532 > 10.0.13.3.3784: BFDv1, Control, State Up, Flags: [none], length: 24
 00:00:02.246963 eth1  Out IP 10.0.23.3.33100 > 10.0.23.2.3784: BFDv1, Control, State Up, Flags: [none], length: 24
 00:00:02.293857 eth1  In  IP 10.0.23.2.57018 > 10.0.23.3.3784: BFDv1, Control, State Up, Flags: [none], length: 24
 00:00:02.295997 eth3  In  IP 10.0.35.3.35105 > 10.0.35.2.3784: BFDv1, Control, State Up, Flags: [none], length: 24
 00:00:02.299240 eth3  Out IP 10.0.35.2.50865 > 10.0.35.3.3784: BFDv1, Control, State Up, Flags: [none], length: 24
 00:00:02.322475 eth0  Out IP 10.0.13.3.36570 > 10.0.13.2.3784: BFDv1, Control, State Up, Flags: [none], length: 24
 00:00:02.322572 eth1  Out IP 10.0.23.3.33100 > 10.0.23.2.3784: BFDv1, Control, State Up, Flags: [none], length: 24
 00:00:02.325726 eth0  In  IP 10.0.13.2.37532 > 10.0.13.3.3784: BFDv1, Control, State Up, Flags: [none], length: 24
 00:00:02.376410 eth1  In  IP 10.0.23.2.57018 > 10.0.23.3.3784: BFDv1, Control, State Up, Flags: [none], length: 24
 00:00:02.380426 eth3  In  IP 10.0.35.3.35105 > 10.0.35.2.3784: BFDv1, Control, State Up, Flags: [none], length: 24
 00:00:02.386830 eth3  Out IP 10.0.35.2.50865 > 10.0.35.3.3784: BFDv1, Control, State Up, Flags: [none], length: 24
 00:00:02.397110 eth0  Out IP 10.0.13.3.36570 > 10.0.13.2.3784: BFDv1, Control, State Up, Flags: [none], length: 24
 00:00:02.409372 eth1  Out IP 10.0.23.3.33100 > 10.0.23.2.3784: BFDv1, Control, State Up, Flags: [none], length: 24
 00:00:02.414405 eth0  In  IP 10.0.13.2.37532 > 10.0.13.3.3784: BFDv1, Control, State Up, Flags: [none], length: 24
 00:00:02.464299 eth3  In  IP 10.0.35.3.35105 > 10.0.35.2.3784: BFDv1, Control, State Up, Flags: [none], length: 24
 00:00:02.465637 eth3  Out IP 10.0.35.2.50865 > 10.0.35.3.3784: BFDv1, Control, State Up, Flags: [none], length: 24
 00:00:02.466584 eth1  In  IP 10.0.23.2.57018 > 10.0.23.3.3784: BFDv1, Control, State Up, Flags: [none], length: 24
 00:00:02.473958 eth0  Out IP 10.0.13.3.36570 > 10.0.13.2.3784: BFDv1, Control, State Up, Flags: [none], length: 24
 00:00:02.484244 eth1  Out IP 10.0.23.3.33100 > 10.0.23.2.3784: BFDv1, Control, State Up, Flags: [none], length: 24
 00:00:02.492010 eth0  In  IP 10.0.13.2.37532 > 10.0.13.3.3784: BFDv1, Control, State Up, Flags: [none], length: 24
 00:00:02.541200 eth3  Out IP 10.0.35.2.50865 > 10.0.35.3.3784: BFDv1, Control, State Up, Flags: [none], length: 24
 00:00:02.546932 eth1  In  IP 10.0.23.2.57018 > 10.0.23.3.3784: BFDv1, Control, State Up, Flags: [none], length: 24
 00:00:02.548430 eth3  In  IP 10.0.35.3.35105 > 10.0.35.2.3784: BFDv1, Control, State Up, Flags: [none], length: 24
 00:00:02.559726 eth1  Out IP 10.0.23.3.33100 > 10.0.23.2.3784: BFDv1, Control, State Up, Flags: [none], length: 24
 00:00:02.563971 eth0  Out IP 10.0.13.3.36570 > 10.0.13.2.3784: BFDv1, Control, State Up, Flags: [none], length: 24
 00:00:02.574443 eth0  In  IP 10.0.13.2.37532 > 10.0.13.3.3784: BFDv1, Control, State Up, Flags: [none], length: 24
 00:00:02.619225 eth3  Out IP 10.0.35.2.50865 > 10.0.35.3.3784: BFDv1, Control, State Up, Flags: [none], length: 24
 00:00:02.623027 eth1  In  IP 10.0.23.2.57018 > 10.0.23.3.3784: BFDv1, Control, State Up, Flags: [none], length: 24
 00:00:02.629597 eth3  In  IP 10.0.35.3.35105 > 10.0.35.2.3784: BFDv1, Control, State Up, Flags: [none], length: 24
 00:00:02.638911 eth1  Out IP 10.0.23.3.33100 > 10.0.23.2.3784: BFDv1, Control, State Up, Flags: [none], length: 24
 00:00:02.647137 eth0  Out IP 10.0.13.3.36570 > 10.0.13.2.3784: BFDv1, Control, State Up, Flags: [none], length: 24
 00:00:02.651370 eth0  In  IP 10.0.13.2.37532 > 10.0.13.3.3784: BFDv1, Control, State Up, Flags: [none], length: 24
 00:00:02.701620 eth1  In  IP 10.0.23.2.57018 > 10.0.23.3.3784: BFDv1, Control, State Up, Flags: [none], length: 24
 00:00:02.708907 eth3  Out IP 10.0.35.2.50865 > 10.0.35.3.3784: BFDv1, Control, State Up, Flags: [none], length: 24
 00:00:02.715122 eth3  In  IP 10.0.35.3.35105 > 10.0.35.2.3784: BFDv1, Control, State Up, Flags: [none], length: 24
 00:00:02.722577 eth1  Out IP 10.0.23.3.33100 > 10.0.23.2.3784: BFDv1, Control, State Up, Flags: [none], length: 24
 00:00:02.722643 eth0  Out IP 10.0.13.3.36570 > 10.0.13.2.3784: BFDv1, Control, State Up, Flags: [none], length: 24
 00:00:02.740056 eth0  In  IP 10.0.13.2.37532 > 10.0.13.3.3784: BFDv1, Control, State Up, Flags: [none], length: 24
 00:00:02.787051 eth1  In  IP 10.0.23.2.57018 > 10.0.23.3.3784: BFDv1, Control, State Up, Flags: [none], length: 24
 00:00:02.797405 eth3  Out IP 10.0.35.2.50865 > 10.0.35.3.3784: BFDv1, Control, State Up, Flags: [none], length: 24
 00:00:02.797527 eth3  In  IP 10.0.35.3.35105 > 10.0.35.2.3784: BFDv1, Control, State Up, Flags: [none], length: 24
 00:00:02.800752 eth1  Out IP 10.0.23.3.33100 > 10.0.23.2.3784: BFDv1, Control, State Up, Flags: [none], length: 24
 00:00:02.800837 eth0  Out IP 10.0.13.3.36570 > 10.0.13.2.3784: BFDv1, Control, State Up, Flags: [none], length: 24
 00:00:02.816236 eth0  In  IP 10.0.13.2.37532 > 10.0.13.3.3784: BFDv1, Control, State Up, Flags: [none], length: 24
 00:00:02.876210 eth1  In  IP 10.0.23.2.57018 > 10.0.23.3.3784: BFDv1, Control, State Up, Flags: [none], length: 24
 00:00:02.878566 eth3  Out IP 10.0.35.2.50865 > 10.0.35.3.3784: BFDv1, Control, State Up, Flags: [none], length: 24
 00:00:02.885914 eth3  In  IP 10.0.35.3.35105 > 10.0.35.2.3784: BFDv1, Control, State Up, Flags: [none], length: 24
 00:00:02.886023 eth1  Out IP 10.0.23.3.33100 > 10.0.23.2.3784: BFDv1, Control, State Up, Flags: [none], length: 24
 00:00:02.887298 eth0  Out IP 10.0.13.3.36570 > 10.0.13.2.3784: BFDv1, Control, State Up, Flags: [none], length: 24
 00:00:02.902643 eth0  In  IP 10.0.13.2.37532 > 10.0.13.3.3784: BFDv1, Control, State Up, Flags: [none], length: 24
 00:00:02.961938 eth1  Out IP 10.0.23.3.33100 > 10.0.23.2.3784: BFDv1, Control, State Up, Flags: [none], length: 24
 00:00:02.963148 eth3  Out IP 10.0.35.2.50865 > 10.0.35.3.3784: BFDv1, Control, State Up, Flags: [none], length: 24
 00:00:02.966149 eth1  In  IP 10.0.23.2.57018 > 10.0.23.3.3784: BFDv1, Control, State Up, Flags: [none], length: 24
 00:00:02.968350 eth3  In  IP 10.0.35.3.35105 > 10.0.35.2.3784: BFDv1, Control, State Up, Flags: [none], length: 24
 00:00:02.970657 eth0  Out IP 10.0.13.3.36570 > 10.0.13.2.3784: BFDv1, Control, State Up, Flags: [none], length: 24
 00:00:02.986910 eth0  In  IP 10.0.13.2.37532 > 10.0.13.3.3784: BFDv1, Control, State Up, Flags: [none], length: 24
 00:00:03.041282 eth3  Out IP 10.0.35.2.50865 > 10.0.35.3.3784: BFDv1, Control, State Up, Flags: [none], length: 24
 00:00:03.047579 eth1  Out IP 10.0.23.3.33100 > 10.0.23.2.3784: BFDv1, Control, State Up, Flags: [none], length: 24
 00:00:03.050577 eth3  In  IP 10.0.35.3.35105 > 10.0.35.2.3784: BFDv1, Control, State Up, Flags: [none], length: 24
 00:00:03.050771 eth0  Out IP 10.0.13.3.36570 > 10.0.13.2.3784: BFDv1, Control, State Up, Flags: [none], length: 24
 00:00:03.051839 eth1  In  IP 10.0.23.2.57018 > 10.0.23.3.3784: BFDv1, Control, State Up, Flags: [none], length: 24
 00:00:03.077259 eth0  In  IP 10.0.13.2.37532 > 10.0.13.3.3784: BFDv1, Control, State Up, Flags: [none], length: 24
 00:00:03.126563 eth3  Out IP 10.0.35.2.50865 > 10.0.35.3.3784: BFDv1, Control, State Up, Flags: [none], length: 24
 00:00:03.129829 eth0  Out IP 10.0.13.3.36570 > 10.0.13.2.3784: BFDv1, Control, State Up, Flags: [none], length: 24
 00:00:03.130976 eth1  In  IP 10.0.23.2.57018 > 10.0.23.3.3784: BFDv1, Control, State Up, Flags: [none], length: 24
 00:00:03.133848 eth3  In  IP 10.0.35.3.35105 > 10.0.35.2.3784: BFDv1, Control, State Up, Flags: [none], length: 24
 00:00:03.136164 eth1  Out IP 10.0.23.3.33100 > 10.0.23.2.3784: BFDv1, Control, State Up, Flags: [none], length: 24
 00:00:03.162688 eth0  In  IP 10.0.13.2.37532 > 10.0.13.3.3784: BFDv1, Control, State Up, Flags: [none], length: 24
 00:00:03.210860 eth3  In  IP 10.0.35.3.35105 > 10.0.35.2.3784: BFDv1, Control, State Up, Flags: [none], length: 24
 00:00:03.214131 eth1  Out IP 10.0.23.3.33100 > 10.0.23.2.3784: BFDv1, Control, State Up, Flags: [none], length: 24
 00:00:03.214224 eth1  In  IP 10.0.23.2.57018 > 10.0.23.3.3784: BFDv1, Control, State Up, Flags: [none], length: 24
 00:00:03.216455 eth3  Out IP 10.0.35.2.50865 > 10.0.35.3.3784: BFDv1, Control, State Up, Flags: [none], length: 24
 00:00:03.218667 eth0  Out IP 10.0.13.3.36570 > 10.0.13.2.3784: BFDv1, Control, State Up, Flags: [none], length: 24
 00:00:03.239231 eth0  In  IP 10.0.13.2.37532 > 10.0.13.3.3784: BFDv1, Control, State Up, Flags: [none], length: 24
 00:00:03.291241 eth3  In  IP 10.0.35.3.35105 > 10.0.35.2.3784: BFDv1, Control, State Up, Flags: [none], length: 24
 00:00:03.292163 eth1  In  IP 10.0.23.2.57018 > 10.0.23.3.3784: BFDv1, Control, State Up, Flags: [none], length: 24
 00:00:03.296414 eth0  Out IP 10.0.13.3.36570 > 10.0.13.2.3784: BFDv1, Control, State Up, Flags: [none], length: 24
 00:00:03.298606 eth1  Out IP 10.0.23.3.33100 > 10.0.23.2.3784: BFDv1, Control, State Up, Flags: [none], length: 24
 00:00:03.305822 eth3  Out IP 10.0.35.2.50865 > 10.0.35.3.3784: BFDv1, Control, State Up, Flags: [none], length: 24
 00:00:03.326077 eth0  In  IP 10.0.13.2.37532 > 10.0.13.3.3784: BFDv1, Control, State Up, Flags: [none], length: 24
 00:00:03.369608 eth3  In  IP 10.0.35.3.35105 > 10.0.35.2.3784: BFDv1, Control, State Up, Flags: [none], length: 24
 00:00:03.374786 eth1  In  IP 10.0.23.2.57018 > 10.0.23.3.3784: BFDv1, Control, State Up, Flags: [none], length: 24
 00:00:03.381082 eth0  Out IP 10.0.13.3.36570 > 10.0.13.2.3784: BFDv1, Control, State Up, Flags: [none], length: 24
 00:00:03.387293 eth3  Out IP 10.0.35.2.50865 > 10.0.35.3.3784: BFDv1, Control, State Up, Flags: [none], length: 24
 00:00:03.387354 eth1  Out IP 10.0.23.3.33100 > 10.0.23.2.3784: BFDv1, Control, State Up, Flags: [none], length: 24
 00:00:03.404991 eth0  In  IP 10.0.13.2.37532 > 10.0.13.3.3784: BFDv1, Control, State Up, Flags: [none], length: 24
 00:00:03.448113 eth3  In  IP 10.0.35.3.35105 > 10.0.35.2.3784: BFDv1, Control, State Up, Flags: [none], length: 24
 00:00:03.462965 eth1  In  IP 10.0.23.2.57018 > 10.0.23.3.3784: BFDv1, Control, State Up, Flags: [none], length: 24
 00:00:03.468290 eth3  Out IP 10.0.35.2.50865 > 10.0.35.3.3784: BFDv1, Control, State Up, Flags: [none], length: 24
 00:00:03.469494 eth0  Out IP 10.0.13.3.36570 > 10.0.13.2.3784: BFDv1, Control, State Up, Flags: [none], length: 24
 00:00:03.471720 eth1  Out IP 10.0.23.3.33100 > 10.0.23.2.3784: BFDv1, Control, State Up, Flags: [none], length: 24
 00:00:03.485774 eth0  In  IP 10.0.13.2.37532 > 10.0.13.3.3784: BFDv1, Control, State Up, Flags: [none], length: 24
 00:00:03.538421 eth3  In  IP 10.0.35.3.35105 > 10.0.35.2.3784: BFDv1, Control, State Up, Flags: [none], length: 24
 00:00:03.542789 eth1  In  IP 10.0.23.2.57018 > 10.0.23.3.3784: BFDv1, Control, State Up, Flags: [none], length: 24
 00:00:03.545095 eth3  Out IP 10.0.35.2.50865 > 10.0.35.3.3784: BFDv1, Control, State Up, Flags: [none], length: 24
 00:00:03.550309 eth1  Out IP 10.0.23.3.33100 > 10.0.23.2.3784: BFDv1, Control, State Up, Flags: [none], length: 24
 00:00:03.550370 eth0  Out IP 10.0.13.3.36570 > 10.0.13.2.3784: BFDv1, Control, State Up, Flags: [none], length: 24
 00:00:03.565038 eth0  In  IP 10.0.13.2.37532 > 10.0.13.3.3784: BFDv1, Control, State Up, Flags: [none], length: 24
 00:00:03.620864 eth1  In  IP 10.0.23.2.57018 > 10.0.23.3.3784: BFDv1, Control, State Up, Flags: [none], length: 24
 00:00:03.622141 eth3  Out IP 10.0.35.2.50865 > 10.0.35.3.3784: BFDv1, Control, State Up, Flags: [none], length: 24
 00:00:03.625335 eth3  In  IP 10.0.35.3.35105 > 10.0.35.2.3784: BFDv1, Control, State Up, Flags: [none], length: 24
 00:00:03.629583 eth1  Out IP 10.0.23.3.33100 > 10.0.23.2.3784: BFDv1, Control, State Up, Flags: [none], length: 24
 00:00:03.631769 eth0  Out IP 10.0.13.3.36570 > 10.0.13.2.3784: BFDv1, Control, State Up, Flags: [none], length: 24
 00:00:03.642957 eth0  In  IP 10.0.13.2.37532 > 10.0.13.3.3784: BFDv1, Control, State Up, Flags: [none], length: 24
 00:00:03.702470 eth3  Out IP 10.0.35.2.50865 > 10.0.35.3.3784: BFDv1, Control, State Up, Flags: [none], length: 24
 00:00:03.703868 eth1  In  IP 10.0.23.2.57018 > 10.0.23.3.3784: BFDv1, Control, State Up, Flags: [none], length: 24
 00:00:03.707044 eth0  Out IP 10.0.13.3.36570 > 10.0.13.2.3784: BFDv1, Control, State Up, Flags: [none], length: 24
 00:00:03.708666 eth3  In  IP 10.0.35.3.35105 > 10.0.35.2.3784: BFDv1, Control, State Up, Flags: [none], length: 24
 00:00:03.714929 eth1  Out IP 10.0.23.3.33100 > 10.0.23.2.3784: BFDv1, Control, State Up, Flags: [none], length: 24
 00:00:03.729319 eth0  In  IP 10.0.13.2.37532 > 10.0.13.3.3784: BFDv1, Control, State Up, Flags: [none], length: 24
 00:00:03.779677 eth3  Out IP 10.0.35.2.50865 > 10.0.35.3.3784: BFDv1, Control, State Up, Flags: [none], length: 24
 00:00:03.784828 eth1  In  IP 10.0.23.2.57018 > 10.0.23.3.3784: BFDv1, Control, State Up, Flags: [none], length: 24
 00:00:03.786102 eth0  Out IP 10.0.13.3.36570 > 10.0.13.2.3784: BFDv1, Control, State Up, Flags: [none], length: 24
 00:00:03.790928 eth3  In  IP 10.0.35.3.35105 > 10.0.35.2.3784: BFDv1, Control, State Up, Flags: [none], length: 24
 00:00:03.792270 eth1  Out IP 10.0.23.3.33100 > 10.0.23.2.3784: BFDv1, Control, State Up, Flags: [none], length: 24
 00:00:03.813491 eth0  In  IP 10.0.13.2.37532 > 10.0.13.3.3784: BFDv1, Control, State Up, Flags: [none], length: 24
 00:00:03.861963 eth0  Out IP 10.0.13.3.36570 > 10.0.13.2.3784: BFDv1, Control, State Up, Flags: [none], length: 24
 00:00:03.863228 eth3  Out IP 10.0.35.2.50865 > 10.0.35.3.3784: BFDv1, Control, State Up, Flags: [none], length: 24
 00:00:03.868460 eth3  In  IP 10.0.35.3.35105 > 10.0.35.2.3784: BFDv1, Control, State Up, Flags: [none], length: 24
 00:00:03.870779 eth1  Out IP 10.0.23.3.33100 > 10.0.23.2.3784: BFDv1, Control, State Up, Flags: [none], length: 24
 00:00:03.873015 eth1  In  IP 10.0.23.2.57018 > 10.0.23.3.3784: BFDv1, Control, State Up, Flags: [none], length: 24
 00:00:03.894765 eth0  In  IP 10.0.13.2.37532 > 10.0.13.3.3784: BFDv1, Control, State Up, Flags: [none], length: 24
 00:00:03.947054 eth1  Out IP 10.0.23.3.33100 > 10.0.23.2.3784: BFDv1, Control, State Up, Flags: [none], length: 24
 00:00:03.949231 eth3  Out IP 10.0.35.2.50865 > 10.0.35.3.3784: BFDv1, Control, State Up, Flags: [none], length: 24
 00:00:03.950388 eth0  Out IP 10.0.13.3.36570 > 10.0.13.2.3784: BFDv1, Control, State Up, Flags: [none], length: 24
 00:00:03.950408 eth3  In  IP 10.0.35.3.35105 > 10.0.35.2.3784: BFDv1, Control, State Up, Flags: [none], length: 24
 00:00:03.951243 eth1  In  IP 10.0.23.2.57018 > 10.0.23.3.3784: BFDv1, Control, State Up, Flags: [none], length: 24
 00:00:03.976584 eth0  In  IP 10.0.13.2.37532 > 10.0.13.3.3784: BFDv1, Control, State Up, Flags: [none], length: 24
 00:00:04.023875 eth1  Out IP 10.0.23.3.33100 > 10.0.23.2.3784: BFDv1, Control, State Up, Flags: [none], length: 24
