tcpdump: data link type LINUX_SLL2
tcpdump: verbose output suppressed, use -v[v]... for full protocol decode
listening on any, link-type LINUX_SLL2 (Linux cooked v2), snapshot length 262144 bytes
 00:00:00.000000 eth1  Out IP 10.0.29.2.60447 > 10.0.29.3.3784: BFDv1, Control, State Up, Flags: [none], length: 24
 00:00:00.045693 eth1  In  IP 10.0.29.3.36592 > 10.0.29.2.3784: BFDv1, Control, State Up, Flags: [none], length: 24
 00:00:00.079053 eth1  Out IP 10.0.29.2.60447 > 10.0.29.3.3784: BFDv1, Control, State Up, Flags: [none], length: 24
 00:00:00.127752 eth1  In  IP 10.0.29.3.36592 > 10.0.29.2.3784: BFDv1, Control, State Up, Flags: [none], length: 24
 00:00:00.158072 eth1  Out IP 10.0.29.2.60447 > 10.0.29.3.3784: BFDv1, Control, State Up, Flags: [none], length: 24
 00:00:00.213634 eth1  In  IP 10.0.29.3.36592 > 10.0.29.2.3784: BFDv1, Control, State Up, Flags: [none], length: 24
 00:00:00.246907 eth1  Out IP 10.0.29.2.60447 > 10.0.29.3.3784: BFDv1, Control, State Up, Flags: [none], length: 24
 00:00:00.297476 eth1  In  IP 10.0.29.3.36592 > 10.0.29.2.3784: BFDv1, Control, State Up, Flags: [none], length: 24
 00:00:00.333735 eth1  Out IP 10.0.29.2.60447 > 10.0.29.3.3784: BFDv1, Control, State Up, Flags: [none], length: 24
 00:00:00.379568 eth1  In  IP 10.0.29.3.36592 > 10.0.29.2.3784: BFDv1, Control, State Up, Flags: [none], length: 24
 00:00:00.408869 eth1  Out IP 10.0.29.2.60447 > 10.0.29.3.3784: BFDv1, Control, State Up, Flags: [none], length: 24
 00:00:00.463699 eth1  In  IP 10.0.29.3.36592 > 10.0.29.2.3784: BFDv1, Control, State Up, Flags: [none], length: 24
 00:00:00.489073 eth1  Out IP 10.0.29.2.60447 > 10.0.29.3.3784: BFDv1, Control, State Up, Flags: [none], length: 24
 00:00:00.538778 eth1  In  IP 10.0.29.3.36592 > 10.0.29.2.3784: BFDv1, Control, State Up, Flags: [none], length: 24
 00:00:00.569075 eth1  Out IP 10.0.29.2.60447 > 10.0.29.3.3784: BFDv1, Control, State Up, Flags: [none], length: 24
 00:00:00.621843 eth1  In  IP 10.0.29.3.36592 > 10.0.29.2.3784: BFDv1, Control, State Up, Flags: [none], length: 24
 00:00:00.653164 eth1  Out IP 10.0.29.2.60447 > 10.0.29.3.3784: BFDv1, Control, State Up, Flags: [none], length: 24
 00:00:00.696927 eth1  In  IP 10.0.29.3.36592 > 10.0.29.2.3784: BFDv1, Control, State Up, Flags: [none], length: 24
 00:00:00.738272 eth1  Out IP 10.0.29.2.60447 > 10.0.29.3.3784: BFDv1, Control, State Up, Flags: [none], length: 24
 00:00:00.778678 eth1  In  IP 10.0.29.3.36592 > 10.0.29.2.3784: BFDv1, Control, State Up, Flags: [none], length: 24
 00:00:00.815044 eth1  Out IP 10.0.29.2.60447 > 10.0.29.3.3784: BFDv1, Control, State Up, Flags: [none], length: 24
 00:00:00.869591 eth1  In  IP 10.0.29.3.36592 > 10.0.29.2.3784: BFDv1, Control, State Up, Flags: [none], length: 24
 00:00:00.893967 eth1  Out IP 10.0.29.2.60447 > 10.0.29.3.3784: BFDv1, Control, State Up, Flags: [none], length: 24
 00:00:00.956669 eth1  In  IP 10.0.29.3.36592 > 10.0.29.2.3784: BFDv1, Control, State Up, Flags: [none], length: 24
 00:00:00.974014 eth1  Out IP 10.0.29.2.60447 > 10.0.29.3.3784: BFDv1, Control, State Up, Flags: [none], length: 24
 00:00:01.041670 eth1  In  IP 10.0.29.3.36592 > 10.0.29.2.3784: BFDv1, Control, State Up, Flags: [none], length: 24
 00:00:01.062054 eth1  Out IP 10.0.29.2.60447 > 10.0.29.3.3784: BFDv1, Control, State Up, Flags: [none], length: 24
 00:00:01.124456 eth1  In  IP 10.0.29.3.36592 > 10.0.29.2.3784: BFDv1, Control, State Up, Flags: [none], length: 24
 00:00:01.138744 eth1  Out IP 10.0.29.2.60447 > 10.0.29.3.3784: BFDv1, Control, State Up, Flags: [none], length: 24
 00:00:01.212125 eth1  In  IP 10.0.29.3.36592 > 10.0.29.2.3784: BFDv1, Control, State Up, Flags: [none], length: 24
 00:00:01.215536 eth1  Out IP 10.0.29.2.60447 > 10.0.29.3.3784: BFDv1, Control, State Up, Flags: [none], length: 24
 00:00:01.300713 eth1  In  IP 10.0.29.3.36592 > 10.0.29.2.3784: BFDv1, Control, State Up, Flags: [none], length: 24
 00:00:01.302942 eth1  Out IP 10.0.29.2.60447 > 10.0.29.3.3784: BFDv1, Control, State Up, Flags: [none], length: 24
 00:00:01.381156 eth1  Out IP 10.0.29.2.60447 > 10.0.29.3.3784: BFDv1, Control, State Up, Flags: [none], length: 24
 00:00:01.385331 eth1  In  IP 10.0.29.3.36592 > 10.0.29.2.3784: BFDv1, Control, State Up, Flags: [none], length: 24
 00:00:01.462680 eth1  Out IP 10.0.29.2.60447 > 10.0.29.3.3784: BFDv1, Control, State Up, Flags: [none], length: 24
 00:00:01.474957 eth1  In  IP 10.0.29.3.36592 > 10.0.29.2.3784: BFDv1, Control, State Up, Flags: [none], length: 24
 00:00:01.550195 eth1  Out IP 10.0.29.2.60447 > 10.0.29.3.3784: BFDv1, Control, State Up, Flags: [none], length: 24
 00:00:01.557344 eth1  In  IP 10.0.29.3.36592 > 10.0.29.2.3784: BFDv1, Control, State Up, Flags: [none], length: 24
 00:00:01.633556 eth1  Out IP 10.0.29.2.60447 > 10.0.29.3.3784: BFDv1, Control, State Up, Flags: [none], length: 24
 00:00:01.645735 eth1  In  IP 10.0.29.3.36592 > 10.0.29.2.3784: BFDv1, Control, State Up, Flags: [none], length: 24
 00:00:01.716966 eth1  Out IP 10.0.29.2.60447 > 10.0.29.3.3784: BFDv1, Control, State Up, Flags: [none], length: 24
 00:00:01.731172 eth1  In  IP 10.0.29.3.36592 > 10.0.29.2.3784: BFDv1, Control, State Up, Flags: [none], length: 24
 00:00:01.804566 eth1  Out IP 10.0.29.2.60447 > 10.0.29.3.3784: BFDv1, Control, State Up, Flags: [none], length: 24
 00:00:01.809756 eth1  In  IP 10.0.29.3.36592 > 10.0.29.2.3784: BFDv1, Control, State Up, Flags: [none], length: 24
 00:00:01.880182 eth1  Out IP 10.0.29.2.60447 > 10.0.29.3.3784: BFDv1, Control, State Up, Flags: [none], length: 24
 00:00:01.896500 eth1  In  IP 10.0.29.3.36592 > 10.0.29.2.3784: BFDv1, Control, State Up, Flags: [none], length: 24
 00:00:01.960845 eth1  Out IP 10.0.29.2.60447 > 10.0.29.3.3784: BFDv1, Control, State Up, Flags: [none], length: 24
 00:00:01.975123 eth1  In  IP 10.0.29.3.36592 > 10.0.29.2.3784: BFDv1, Control, State Up, Flags: [none], length: 24
 00:00:02.048515 eth1  Out IP 10.0.29.2.60447 > 10.0.29.3.3784: BFDv1, Control, State Up, Flags: [none], length: 24
 00:00:02.054425 eth2  Out IP 10.0.12.3.51192 > 10.0.12.2.179: Flags [P.], seq 221769629:221769664, ack 3568889996, win 63, options [nop,nop,TS val 627420163 ecr 398256604], length 35: BGP
 00:00:02.054507 eth2  In  IP 10.0.12.2.179 > 10.0.12.3.51192: Flags [.], ack 35, win 64, options [nop,nop,TS val 398271519 ecr 627420163], length 0
 00:00:02.054548 eth2  Out IP 10.0.12.3.51192 > 10.0.12.2.179: Flags [P.], seq 35:80, ack 1, win 63, options [nop,nop,TS val 627420164 ecr 398271519], length 45: BGP
 00:00:02.054562 eth2  In  IP 10.0.12.2.179 > 10.0.12.3.51192: Flags [.], ack 80, win 64, options [nop,nop,TS val 398271520 ecr 627420164], length 0
 00:00:02.057047 eth2  In  IP 10.0.12.2.179 > 10.0.12.3.51192: Flags [P.], seq 1:55, ack 80, win 64, options [nop,nop,TS val 398271522 ecr 627420164], length 54: BGP
 00:00:02.057070 eth2  Out IP 10.0.12.3.51192 > 10.0.12.2.179: Flags [.], ack 55, win 63, options [nop,nop,TS val 627420166 ecr 398271522], length 0
 00:00:06.811440 eth2  In  IP 10.0.12.2.179 > 10.0.12.3.51192: Flags [P.], seq 55:74, ack 80, win 64, options [nop,nop,TS val 398276276 ecr 627420166], length 19: BGP
 00:00:06.811496 eth2  Out IP 10.0.12.3.51192 > 10.0.12.2.179: Flags [.], ack 74, win 63, options [nop,nop,TS val 627424920 ecr 398276276], length 0
 00:00:10.131316 eth2  Out IP 10.0.12.3.51192 > 10.0.12.2.179: Flags [P.], seq 80:128, ack 74, win 63, options [nop,nop,TS val 627428240 ecr 398276276], length 48: BGP
 00:00:10.131393 eth1  Out IP 10.0.29.2.55704 > 10.0.29.3.3784: BFDv1, Control, State Down, Flags: [none], length: 24
 00:00:10.131804 eth2  In  IP 10.0.12.2.179 > 10.0.12.3.51192: Flags [P.], seq 74:101, ack 128, win 64, options [nop,nop,TS val 398279597 ecr 627428240], length 27: BGP
 00:00:10.131820 eth2  Out IP 10.0.12.3.51192 > 10.0.12.2.179: Flags [.], ack 101, win 63, options [nop,nop,TS val 627428241 ecr 398279597], length 0
 00:00:10.132773 eth2  Out IP 10.0.12.3.51192 > 10.0.12.2.179: Flags [P.], seq 128:173, ack 101, win 63, options [nop,nop,TS val 627428242 ecr 398279597], length 45: BGP
 00:00:10.173528 eth2  In  IP 10.0.12.2.179 > 10.0.12.3.51192: Flags [.], ack 173, win 64, options [nop,nop,TS val 398279639 ecr 627428242], length 0
 00:00:10.758020 eth1  In  IP 10.0.29.3.44962 > 10.0.29.2.3784: BFDv1, Control, State Init, Flags: [none], length: 24
 00:00:10.758189 eth1  Out IP 10.0.29.2.55704 > 10.0.29.3.3784: BFDv1, Control, State Up, Flags: [Poll], length: 24
 00:00:10.758240 eth1  In  IP 10.0.29.3.44962 > 10.0.29.2.3784: BFDv1, Control, State Up, Flags: [Final], length: 24
 00:00:10.758256 eth1  In  IP 10.0.29.3.44962 > 10.0.29.2.3784: BFDv1, Control, State Up, Flags: [Poll], length: 24
 00:00:10.758314 eth1  Out IP 10.0.29.2.55704 > 10.0.29.3.3784: BFDv1, Control, State Up, Flags: [Final], length: 24
 00:00:10.835881 eth1  In  IP 10.0.29.3.44962 > 10.0.29.2.3784: BFDv1, Control, State Up, Flags: [none], length: 24
 00:00:10.845218 eth1  Out IP 10.0.29.2.55704 > 10.0.29.3.3784: BFDv1, Control, State Up, Flags: [none], length: 24
 00:00:10.914036 eth1  In  IP 10.0.29.3.44962 > 10.0.29.2.3784: BFDv1, Control, State Up, Flags: [none], length: 24
 00:00:10.923438 eth1  Out IP 10.0.29.2.55704 > 10.0.29.3.3784: BFDv1, Control, State Up, Flags: [none], length: 24
 00:00:10.998063 eth1  In  IP 10.0.29.3.44962 > 10.0.29.2.3784: BFDv1, Control, State Up, Flags: [none], length: 24
 00:00:11.010303 eth1  Out IP 10.0.29.2.55704 > 10.0.29.3.3784: BFDv1, Control, State Up, Flags: [none], length: 24
 00:00:11.075878 eth1  In  IP 10.0.29.3.44962 > 10.0.29.2.3784: BFDv1, Control, State Up, Flags: [none], length: 24
 00:00:11.092189 eth1  Out IP 10.0.29.2.55704 > 10.0.29.3.3784: BFDv1, Control, State Up, Flags: [none], length: 24
 00:00:11.160869 eth1  In  IP 10.0.29.3.44962 > 10.0.29.2.3784: BFDv1, Control, State Up, Flags: [none], length: 24
 00:00:11.172194 eth1  Out IP 10.0.29.2.55704 > 10.0.29.3.3784: BFDv1, Control, State Up, Flags: [none], length: 24
 00:00:11.243778 eth1  In  IP 10.0.29.3.44962 > 10.0.29.2.3784: BFDv1, Control, State Up, Flags: [none], length: 24
 00:00:11.247370 eth1  Out IP 10.0.29.2.55704 > 10.0.29.3.3784: BFDv1, Control, State Up, Flags: [none], length: 24
 00:00:11.321164 eth1  In  IP 10.0.29.3.44962 > 10.0.29.2.3784: BFDv1, Control, State Up, Flags: [none], length: 24
 00:00:11.334936 eth1  Out IP 10.0.29.2.55704 > 10.0.29.3.3784: BFDv1, Control, State Up, Flags: [none], length: 24
 00:00:11.398410 eth1  In  IP 10.0.29.3.44962 > 10.0.29.2.3784: BFDv1, Control, State Up, Flags: [none], length: 24
 00:00:11.410628 eth1  Out IP 10.0.29.2.55704 > 10.0.29.3.3784: BFDv1, Control, State Up, Flags: [none], length: 24
 00:00:11.481184 eth1  In  IP 10.0.29.3.44962 > 10.0.29.2.3784: BFDv1, Control, State Up, Flags: [none], length: 24
 00:00:11.488420 eth1  Out IP 10.0.29.2.55704 > 10.0.29.3.3784: BFDv1, Control, State Up, Flags: [none], length: 24
 00:00:11.566963 eth1  In  IP 10.0.29.3.44962 > 10.0.29.2.3784: BFDv1, Control, State Up, Flags: [none], length: 24
 00:00:11.577211 eth1  Out IP 10.0.29.2.55704 > 10.0.29.3.3784: BFDv1, Control, State Up, Flags: [none], length: 24
 00:00:11.652926 eth1  In  IP 10.0.29.3.44962 > 10.0.29.2.3784: BFDv1, Control, State Up, Flags: [none], length: 24
 00:00:11.665232 eth1  Out IP 10.0.29.2.55704 > 10.0.29.3.3784: BFDv1, Control, State Up, Flags: [none], length: 24
 00:00:11.740868 eth1  In  IP 10.0.29.3.44962 > 10.0.29.2.3784: BFDv1, Control, State Up, Flags: [none], length: 24
 00:00:11.746142 eth1  Out IP 10.0.29.2.55704 > 10.0.29.3.3784: BFDv1, Control, State Up, Flags: [none], length: 24
 00:00:11.826511 eth1  Out IP 10.0.29.2.55704 > 10.0.29.3.3784: BFDv1, Control, State Up, Flags: [none], length: 24
 00:00:11.826593 eth1  In  IP 10.0.29.3.44962 > 10.0.29.2.3784: BFDv1, Control, State Up, Flags: [none], length: 24
 00:00:11.905287 eth1  In  IP 10.0.29.3.44962 > 10.0.29.2.3784: BFDv1, Control, State Up, Flags: [none], length: 24
 00:00:11.911953 eth1  Out IP 10.0.29.2.55704 > 10.0.29.3.3784: BFDv1, Control, State Up, Flags: [none], length: 24
 00:00:11.986220 eth1  Out IP 10.0.29.2.55704 > 10.0.29.3.3784: BFDv1, Control, State Up, Flags: [none], length: 24
 00:00:11.987545 eth1  In  IP 10.0.29.3.44962 > 10.0.29.2.3784: BFDv1, Control, State Up, Flags: [none], length: 24
 00:00:12.073949 eth1  Out IP 10.0.29.2.55704 > 10.0.29.3.3784: BFDv1, Control, State Up, Flags: [none], length: 24
 00:00:12.076195 eth1  In  IP 10.0.29.3.44962 > 10.0.29.2.3784: BFDv1, Control, State Up, Flags: [none], length: 24
 00:00:12.156578 eth1  Out IP 10.0.29.2.55704 > 10.0.29.3.3784: BFDv1, Control, State Up, Flags: [none], length: 24
 00:00:12.159826 eth1  In  IP 10.0.29.3.44962 > 10.0.29.2.3784: BFDv1, Control, State Up, Flags: [none], length: 24
 00:00:12.232188 eth1  Out IP 10.0.29.2.55704 > 10.0.29.3.3784: BFDv1, Control, State Up, Flags: [none], length: 24
 00:00:12.247439 eth1  In  IP 10.0.29.3.44962 > 10.0.29.2.3784: BFDv1, Control, State Up, Flags: [none], length: 24
 00:00:12.309812 eth1  Out IP 10.0.29.2.55704 > 10.0.29.3.3784: BFDv1, Control, State Up, Flags: [none], length: 24
 00:00:12.323061 eth1  In  IP 10.0.29.3.44962 > 10.0.29.2.3784: BFDv1, Control, State Up, Flags: [none], length: 24
 00:00:12.389388 eth1  Out IP 10.0.29.2.55704 > 10.0.29.3.3784: BFDv1, Control, State Up, Flags: [none], length: 24
 00:00:12.406637 eth1  In  IP 10.0.29.3.44962 > 10.0.29.2.3784: BFDv1, Control, State Up, Flags: [none], length: 24
 00:00:12.474120 eth1  Out IP 10.0.29.2.55704 > 10.0.29.3.3784: BFDv1, Control, State Up, Flags: [none], length: 24
 00:00:12.494637 eth1  In  IP 10.0.29.3.44962 > 10.0.29.2.3784: BFDv1, Control, State Up, Flags: [none], length: 24
 00:00:12.559137 eth1  Out IP 10.0.29.2.55704 > 10.0.29.3.3784: BFDv1, Control, State Up, Flags: [none], length: 24
 00:00:12.582460 eth1  In  IP 10.0.29.3.44962 > 10.0.29.2.3784: BFDv1, Control, State Up, Flags: [none], length: 24
 00:00:12.637941 eth1  Out IP 10.0.29.2.55704 > 10.0.29.3.3784: BFDv1, Control, State Up, Flags: [none], length: 24
 00:00:12.663348 eth1  In  IP 10.0.29.3.44962 > 10.0.29.2.3784: BFDv1, Control, State Up, Flags: [none], length: 24
 00:00:12.719723 eth1  Out IP 10.0.29.2.55704 > 10.0.29.3.3784: BFDv1, Control, State Up, Flags: [none], length: 24
 00:00:12.746660 eth1  In  IP 10.0.29.3.44962 > 10.0.29.2.3784: BFDv1, Control, State Up, Flags: [none], length: 24
 00:00:12.804084 eth1  Out IP 10.0.29.2.55704 > 10.0.29.3.3784: BFDv1, Control, State Up, Flags: [none], length: 24
 00:00:12.826349 eth1  In  IP 10.0.29.3.44962 > 10.0.29.2.3784: BFDv1, Control, State Up, Flags: [none], length: 24
 00:00:12.890733 eth1  Out IP 10.0.29.2.55704 > 10.0.29.3.3784: BFDv1, Control, State Up, Flags: [none], length: 24
 00:00:12.916216 eth1  In  IP 10.0.29.3.44962 > 10.0.29.2.3784: BFDv1, Control, State Up, Flags: [none], length: 24
 00:00:12.972643 eth1  Out IP 10.0.29.2.55704 > 10.0.29.3.3784: BFDv1, Control, State Up, Flags: [none], length: 24
 00:00:13.003169 eth1  In  IP 10.0.29.3.44962 > 10.0.29.2.3784: BFDv1, Control, State Up, Flags: [none], length: 24
 00:00:13.060637 eth1  Out IP 10.0.29.2.55704 > 10.0.29.3.3784: BFDv1, Control, State Up, Flags: [none], length: 24
 00:00:13.088077 eth1  In  IP 10.0.29.3.44962 > 10.0.29.2.3784: BFDv1, Control, State Up, Flags: [none], length: 24
 00:00:13.139477 eth1  Out IP 10.0.29.2.55704 > 10.0.29.3.3784: BFDv1, Control, State Up, Flags: [none], length: 24
 00:00:13.166927 eth1  In  IP 10.0.29.3.44962 > 10.0.29.2.3784: BFDv1, Control, State Up, Flags: [none], length: 24
 00:00:13.218257 eth1  Out IP 10.0.29.2.55704 > 10.0.29.3.3784: BFDv1, Control, State Up, Flags: [none], length: 24
 00:00:13.256792 eth1  In  IP 10.0.29.3.44962 > 10.0.29.2.3784: BFDv1, Control, State Up, Flags: [none], length: 24
 00:00:13.294186 eth1  Out IP 10.0.29.2.55704 > 10.0.29.3.3784: BFDv1, Control, State Up, Flags: [none], length: 24
 00:00:13.331713 eth1  In  IP 10.0.29.3.44962 > 10.0.29.2.3784: BFDv1, Control, State Up, Flags: [none], length: 24
 00:00:13.370131 eth1  Out IP 10.0.29.2.55704 > 10.0.29.3.3784: BFDv1, Control, State Up, Flags: [none], length: 24
 00:00:13.409578 eth1  In  IP 10.0.29.3.44962 > 10.0.29.2.3784: BFDv1, Control, State Up, Flags: [none], length: 24
 00:00:13.450954 eth1  Out IP 10.0.29.2.55704 > 10.0.29.3.3784: BFDv1, Control, State Up, Flags: [none], length: 24
 00:00:13.491567 eth1  In  IP 10.0.29.3.44962 > 10.0.29.2.3784: BFDv1, Control, State Up, Flags: [none], length: 24
 00:00:13.538997 eth1  Out IP 10.0.29.2.55704 > 10.0.29.3.3784: BFDv1, Control, State Up, Flags: [none], length: 24
 00:00:13.567485 eth1  In  IP 10.0.29.3.44962 > 10.0.29.2.3784: BFDv1, Control, State Up, Flags: [none], length: 24
 00:00:13.620921 eth1  Out IP 10.0.29.2.55704 > 10.0.29.3.3784: BFDv1, Control, State Up, Flags: [none], length: 24
 00:00:13.656421 eth1  In  IP 10.0.29.3.44962 > 10.0.29.2.3784: BFDv1, Control, State Up, Flags: [none], length: 24
 00:00:13.706817 eth1  Out IP 10.0.29.2.55704 > 10.0.29.3.3784: BFDv1, Control, State Up, Flags: [none], length: 24
 00:00:13.736322 eth1  In  IP 10.0.29.3.44962 > 10.0.29.2.3784: BFDv1, Control, State Up, Flags: [none], length: 24
 00:00:13.795643 eth1  Out IP 10.0.29.2.55704 > 10.0.29.3.3784: BFDv1, Control, State Up, Flags: [none], length: 24
 00:00:13.820122 eth1  In  IP 10.0.29.3.44962 > 10.0.29.2.3784: BFDv1, Control, State Up, Flags: [none], length: 24
 00:00:13.874433 eth1  Out IP 10.0.29.2.55704 > 10.0.29.3.3784: BFDv1, Control, State Up, Flags: [none], length: 24
 00:00:13.898895 eth1  In  IP 10.0.29.3.44962 > 10.0.29.2.3784: BFDv1, Control, State Up, Flags: [none], length: 24
 00:00:13.960304 eth1  Out IP 10.0.29.2.55704 > 10.0.29.3.3784: BFDv1, Control, State Up, Flags: [none], length: 24
 00:00:13.986778 eth1  In  IP 10.0.29.3.44962 > 10.0.29.2.3784: BFDv1, Control, State Up, Flags: [none], length: 24
 00:00:14.036172 eth1  Out IP 10.0.29.2.55704 > 10.0.29.3.3784: BFDv1, Control, State Up, Flags: [none], length: 24
 00:00:14.076221 eth1  In  IP 10.0.29.3.44962 > 10.0.29.2.3784: BFDv1, Control, State Up, Flags: [none], length: 24
 00:00:14.113636 eth1  Out IP 10.0.29.2.55704 > 10.0.29.3.3784: BFDv1, Control, State Up, Flags: [none], length: 24
 00:00:14.152630 eth1  In  IP 10.0.29.3.44962 > 10.0.29.2.3784: BFDv1, Control, State Up, Flags: [none], length: 24
 00:00:14.197984 eth1  Out IP 10.0.29.2.55704 > 10.0.29.3.3784: BFDv1, Control, State Up, Flags: [none], length: 24
 00:00:14.227249 eth1  In  IP 10.0.29.3.44962 > 10.0.29.2.3784: BFDv1, Control, State Up, Flags: [none], length: 24
 00:00:14.280631 eth1  Out IP 10.0.29.2.55704 > 10.0.29.3.3784: BFDv1, Control, State Up, Flags: [none], length: 24
 00:00:14.303771 eth1  In  IP 10.0.29.3.44962 > 10.0.29.2.3784: BFDv1, Control, State Up, Flags: [none], length: 24
 00:00:14.362155 eth1  Out IP 10.0.29.2.55704 > 10.0.29.3.3784: BFDv1, Control, State Up, Flags: [none], length: 24
 00:00:14.383289 eth1  In  IP 10.0.29.3.44962 > 10.0.29.2.3784: BFDv1, Control, State Up, Flags: [none], length: 24
 00:00:14.439743 eth1  Out IP 10.0.29.2.55704 > 10.0.29.3.3784: BFDv1, Control, State Up, Flags: [none], length: 24
 00:00:14.469783 eth1  In  IP 10.0.29.3.44962 > 10.0.29.2.3784: BFDv1, Control, State Up, Flags: [none], length: 24
 00:00:14.523188 eth1  Out IP 10.0.29.2.55704 > 10.0.29.3.3784: BFDv1, Control, State Up, Flags: [none], length: 24
 00:00:14.557959 eth1  In  IP 10.0.29.3.44962 > 10.0.29.2.3784: BFDv1, Control, State Up, Flags: [none], length: 24
 00:00:14.601326 eth1  Out IP 10.0.29.2.55704 > 10.0.29.3.3784: BFDv1, Control, State Up, Flags: [none], length: 24
 00:00:14.647316 eth1  In  IP 10.0.29.3.44962 > 10.0.29.2.3784: BFDv1, Control, State Up, Flags: [none], length: 24
 00:00:14.687723 eth1  Out IP 10.0.29.2.55704 > 10.0.29.3.3784: BFDv1, Control, State Up, Flags: [none], length: 24
 00:00:14.734524 eth1  In  IP 10.0.29.3.44962 > 10.0.29.2.3784: BFDv1, Control, State Up, Flags: [none], length: 24
 00:00:14.770819 eth1  Out IP 10.0.29.2.55704 > 10.0.29.3.3784: BFDv1, Control, State Up, Flags: [none], length: 24
 00:00:14.814719 eth1  In  IP 10.0.29.3.44962 > 10.0.29.2.3784: BFDv1, Control, State Up, Flags: [none], length: 24
 00:00:14.851114 eth1  Out IP 10.0.29.2.55704 > 10.0.29.3.3784: BFDv1, Control, State Up, Flags: [none], length: 24
 00:00:14.883525 eth1  Out IP 10.0.29.2.48097 > 10.0.29.3.179: Flags [FP.], seq 234560660:234560681, ack 3719608279, win 63, options [nop,nop,TS val 1877075603 ecr 3829801178], length 21: BGP
 00:00:14.883603 eth1  In  IP 10.0.29.3.179 > 10.0.29.2.48097: Flags [R], seq 3719608279, win 0, length 0
 00:00:14.902964 eth1  In  IP 10.0.29.3.44962 > 10.0.29.2.3784: BFDv1, Control, State Up, Flags: [none], length: 24
 00:00:14.927385 eth1  Out IP 10.0.29.2.55704 > 10.0.29.3.3784: BFDv1, Control, State Up, Flags: [none], length: 24
 00:00:14.933253 eth1  Out IP 10.0.29.2.47943 > 10.0.29.3.179: Flags [S], seq 4279935346, win 64240, options [mss 1460,sackOK,TS val 1877075652 ecr 0,nop,wscale 10], length 0
 00:00:14.933322 eth1  In  IP 10.0.29.3.179 > 10.0.29.2.47943: Flags [S.], seq 1273013553, ack 4279935347, win 65160, options [mss 1460,sackOK,TS val 3829830626 ecr 1877075652,nop,wscale 10], length 0
 00:00:14.933348 eth1  Out IP 10.0.29.2.47943 > 10.0.29.3.179: Flags [.], ack 1, win 63, options [nop,nop,TS val 1877075652 ecr 3829830626], length 0
 00:00:14.933440 eth1  Out IP 10.0.29.2.47943 > 10.0.29.3.179: Flags [P.], seq 1:65, ack 1, win 63, options [nop,nop,TS val 1877075652 ecr 3829830626], length 64: BGP
 00:00:14.933453 eth1  In  IP 10.0.29.3.179 > 10.0.29.2.47943: Flags [.], ack 65, win 64, options [nop,nop,TS val 3829830626 ecr 1877075652], length 0
 00:00:14.933525 eth1  In  IP 10.0.29.3.179 > 10.0.29.2.47943: Flags [R.], seq 1, ack 65, win 64, options [nop,nop,TS val 3829830627 ecr 1877075652], length 0
 00:00:14.987161 eth1  In  IP 10.0.29.3.44962 > 10.0.29.2.3784: BFDv1, Control, State Up, Flags: [none], length: 24
 00:00:15.003561 eth1  Out IP 10.0.29.2.55704 > 10.0.29.3.3784: BFDv1, Control, State Up, Flags: [none], length: 24
 00:00:15.063256 eth1  In  IP 10.0.29.3.44962 > 10.0.29.2.3784: BFDv1, Control, State Up, Flags: [none], length: 24
 00:00:15.088648 eth1  Out IP 10.0.29.2.55704 > 10.0.29.3.3784: BFDv1, Control, State Up, Flags: [none], length: 24
 00:00:15.147303 eth1  In  IP 10.0.29.3.44962 > 10.0.29.2.3784: BFDv1, Control, State Up, Flags: [none], length: 24
 00:00:15.178731 eth1  Out IP 10.0.29.2.55704 > 10.0.29.3.3784: BFDv1, Control, State Up, Flags: [none], length: 24
 00:00:15.233402 eth1  In  IP 10.0.29.3.44962 > 10.0.29.2.3784: BFDv1, Control, State Up, Flags: [none], length: 24
 00:00:15.254755 eth1  Out IP 10.0.29.2.55704 > 10.0.29.3.3784: BFDv1, Control, State Up, Flags: [none], length: 24
 00:00:15.314425 eth1  In  IP 10.0.29.3.44962 > 10.0.29.2.3784: BFDv1, Control, State Up, Flags: [none], length: 24
 00:00:15.338134 eth1  Out IP 10.0.29.2.55704 > 10.0.29.3.3784: BFDv1, Control, State Up, Flags: [none], length: 24
 00:00:15.398324 eth1  In  IP 10.0.29.3.44962 > 10.0.29.2.3784: BFDv1, Control, State Up, Flags: [none], length: 24
 00:00:15.416762 eth1  Out IP 10.0.29.2.55704 > 10.0.29.3.3784: BFDv1, Control, State Up, Flags: [none], length: 24
 00:00:15.483896 eth1  In  IP 10.0.29.3.44962 > 10.0.29.2.3784: BFDv1, Control, State Up, Flags: [none], length: 24
 00:00:15.495352 eth1  Out IP 10.0.29.2.55704 > 10.0.29.3.3784: BFDv1, Control, State Up, Flags: [none], length: 24
 00:00:15.563982 eth1  In  IP 10.0.29.3.44962 > 10.0.29.2.3784: BFDv1, Control, State Up, Flags: [none], length: 24
 00:00:15.579392 eth1  Out IP 10.0.29.2.55704 > 10.0.29.3.3784: BFDv1, Control, State Up, Flags: [none], length: 24
 00:00:15.641059 eth1  In  IP 10.0.29.3.44962 > 10.0.29.2.3784: BFDv1, Control, State Up, Flags: [none], length: 24
 00:00:15.658346 eth1  Out IP 10.0.29.2.55704 > 10.0.29.3.3784: BFDv1, Control, State Up, Flags: [none], length: 24
 00:00:15.731033 eth1  In  IP 10.0.29.3.44962 > 10.0.29.2.3784: BFDv1, Control, State Up, Flags: [none], length: 24
 00:00:15.743328 eth1  Out IP 10.0.29.2.55704 > 10.0.29.3.3784: BFDv1, Control, State Up, Flags: [none], length: 24
 00:00:15.806791 eth1  In  IP 10.0.29.3.44962 > 10.0.29.2.3784: BFDv1, Control, State Up, Flags: [none], length: 24
 00:00:15.825122 eth1  Out IP 10.0.29.2.55704 > 10.0.29.3.3784: BFDv1, Control, State Up, Flags: [none], length: 24
 00:00:15.891070 eth1  In  IP 10.0.29.3.44962 > 10.0.29.2.3784: BFDv1, Control, State Up, Flags: [none], length: 24
 00:00:15.911413 eth1  Out IP 10.0.29.2.55704 > 10.0.29.3.3784: BFDv1, Control, State Up, Flags: [none], length: 24
 00:00:15.978624 eth1  In  IP 10.0.29.3.44962 > 10.0.29.2.3784: BFDv1, Control, State Up, Flags: [none], length: 24
 00:00:15.991631 eth1  Out IP 10.0.29.2.55704 > 10.0.29.3.3784: BFDv1, Control, State Up, Flags: [none], length: 24
 00:00:16.060100 eth1  In  IP 10.0.29.3.44962 > 10.0.29.2.3784: BFDv1, Control, State Up, Flags: [none], length: 24
 00:00:16.070419 eth1  Out IP 10.0.29.2.55704 > 10.0.29.3.3784: BFDv1, Control, State Up, Flags: [none], length: 24
 00:00:16.138968 eth1  In  IP 10.0.29.3.44962 > 10.0.29.2.3784: BFDv1, Control, State Up, Flags: [none], length: 24
 00:00:16.146349 eth1  Out IP 10.0.29.2.55704 > 10.0.29.3.3784: BFDv1, Control, State Up, Flags: [none], length: 24
 00:00:16.220228 eth1  In  IP 10.0.29.3.44962 > 10.0.29.2.3784: BFDv1, Control, State Up, Flags: [none], length: 24
 00:00:16.236590 eth1  Out IP 10.0.29.2.55704 > 10.0.29.3.3784: BFDv1, Control, State Up, Flags: [none], length: 24
 00:00:16.303273 eth1  In  IP 10.0.29.3.44962 > 10.0.29.2.3784: BFDv1, Control, State Up, Flags: [none], length: 24
 00:00:16.317593 eth1  Out IP 10.0.29.2.55704 > 10.0.29.3.3784: BFDv1, Control, State Up, Flags: [none], length: 24
 00:00:16.391666 eth1  In  IP 10.0.29.3.44962 > 10.0.29.2.3784: BFDv1, Control, State Up, Flags: [none], length: 24
 00:00:16.394988 eth1  Out IP 10.0.29.2.55704 > 10.0.29.3.3784: BFDv1, Control, State Up, Flags: [none], length: 24
 00:00:16.478255 eth1  Out IP 10.0.29.2.55704 > 10.0.29.3.3784: BFDv1, Control, State Up, Flags: [none], length: 24
 00:00:16.479478 eth1  In  IP 10.0.29.3.44962 > 10.0.29.2.3784: BFDv1, Control, State Up, Flags: [none], length: 24
 00:00:16.563201 eth1  In  IP 10.0.29.3.44962 > 10.0.29.2.3784: BFDv1, Control, State Up, Flags: [none], length: 24
 00:00:16.566534 eth1  Out IP 10.0.29.2.55704 > 10.0.29.3.3784: BFDv1, Control, State Up, Flags: [none], length: 24
 00:00:16.642182 eth1  In  IP 10.0.29.3.44962 > 10.0.29.2.3784: BFDv1, Control, State Up, Flags: [none], length: 24
 00:00:16.650478 eth1  Out IP 10.0.29.2.55704 > 10.0.29.3.3784: BFDv1, Control, State Up, Flags: [none], length: 24
 00:00:16.729165 eth1  In  IP 10.0.29.3.44962 > 10.0.29.2.3784: BFDv1, Control, State Up, Flags: [none], length: 24
 00:00:16.737508 eth1  Out IP 10.0.29.2.55704 > 10.0.29.3.3784: BFDv1, Control, State Up, Flags: [none], length: 24
 00:00:16.813073 eth1  In  IP 10.0.29.3.44962 > 10.0.29.2.3784: BFDv1, Control, State Up, Flags: [none], length: 24
 00:00:16.818382 eth1  Out IP 10.0.29.2.55704 > 10.0.29.3.3784: BFDv1, Control, State Up, Flags: [none], length: 24
 00:00:16.898058 eth1  In  IP 10.0.29.3.44962 > 10.0.29.2.3784: BFDv1, Control, State Up, Flags: [none], length: 24
 00:00:16.905375 eth1  Out IP 10.0.29.2.55704 > 10.0.29.3.3784: BFDv1, Control, State Up, Flags: [none], length: 24
 00:00:16.986923 eth1  In  IP 10.0.29.3.44962 > 10.0.29.2.3784: BFDv1, Control, State Up, Flags: [none], length: 24
 00:00:16.988185 eth1  Out IP 10.0.29.2.55704 > 10.0.29.3.3784: BFDv1, Control, State Up, Flags: [none], length: 24
 00:00:17.071698 eth1  In  IP 10.0.29.3.44962 > 10.0.29.2.3784: BFDv1, Control, State Up, Flags: [none], length: 24
 00:00:17.076009 eth1  Out IP 10.0.29.2.55704 > 10.0.29.3.3784: BFDv1, Control, State Up, Flags: [none], length: 24
 00:00:17.153160 eth1  In  IP 10.0.29.3.44962 > 10.0.29.2.3784: BFDv1, Control, State Up, Flags: [none], length: 24
 00:00:17.153299 eth1  Out IP 10.0.29.2.55704 > 10.0.29.3.3784: BFDv1, Control, State Up, Flags: [none], length: 24
 00:00:17.236711 eth1  Out IP 10.0.29.2.55704 > 10.0.29.3.3784: BFDv1, Control, State Up, Flags: [none], length: 24
 00:00:17.240936 eth1  In  IP 10.0.29.3.44962 > 10.0.29.2.3784: BFDv1, Control, State Up, Flags: [none], length: 24
 00:00:17.325510 eth1  In  IP 10.0.29.3.44962 > 10.0.29.2.3784: BFDv1, Control, State Up, Flags: [none], length: 24
 00:00:17.325659 eth1  Out IP 10.0.29.2.55704 > 10.0.29.3.3784: BFDv1, Control, State Up, Flags: [none], length: 24
 00:00:17.404880 eth1  Out IP 10.0.29.2.55704 > 10.0.29.3.3784: BFDv1, Control, State Up, Flags: [none], length: 24
 00:00:17.407105 eth1  In  IP 10.0.29.3.44962 > 10.0.29.2.3784: BFDv1, Control, State Up, Flags: [none], length: 24
 00:00:17.491408 eth1  Out IP 10.0.29.2.55704 > 10.0.29.3.3784: BFDv1, Control, State Up, Flags: [none], length: 24
 00:00:17.491552 eth1  In  IP 10.0.29.3.44962 > 10.0.29.2.3784: BFDv1, Control, State Up, Flags: [none], length: 24
 00:00:17.574832 eth1  Out IP 10.0.29.2.55704 > 10.0.29.3.3784: BFDv1, Control, State Up, Flags: [none], length: 24
 00:00:17.574953 eth1  In  IP 10.0.29.3.44962 > 10.0.29.2.3784: BFDv1, Control, State Up, Flags: [none], length: 24
 00:00:17.655641 eth1  In  IP 10.0.29.3.44962 > 10.0.29.2.3784: BFDv1, Control, State Up, Flags: [none], length: 24
 00:00:17.662929 eth1  Out IP 10.0.29.2.55704 > 10.0.29.3.3784: BFDv1, Control, State Up, Flags: [none], length: 24
 00:00:17.733730 eth1  In  IP 10.0.29.3.44962 > 10.0.29.2.3784: BFDv1, Control, State Up, Flags: [none], length: 24
 00:00:17.749308 eth1  Out IP 10.0.29.2.55704 > 10.0.29.3.3784: BFDv1, Control, State Up, Flags: [none], length: 24
 00:00:17.809036 eth1  In  IP 10.0.29.3.44962 > 10.0.29.2.3784: BFDv1, Control, State Up, Flags: [none], length: 24
 00:00:17.832408 eth1  Out IP 10.0.29.2.55704 > 10.0.29.3.3784: BFDv1, Control, State Up, Flags: [none], length: 24
 00:00:17.892104 eth1  In  IP 10.0.29.3.44962 > 10.0.29.2.3784: BFDv1, Control, State Up, Flags: [none], length: 24
 00:00:17.913434 eth1  Out IP 10.0.29.2.55704 > 10.0.29.3.3784: BFDv1, Control, State Up, Flags: [none], length: 24
 00:00:17.979307 eth1  In  IP 10.0.29.3.44962 > 10.0.29.2.3784: BFDv1, Control, State Up, Flags: [none], length: 24
 00:00:17.988623 eth1  Out IP 10.0.29.2.55704 > 10.0.29.3.3784: BFDv1, Control, State Up, Flags: [none], length: 24
 00:00:18.057397 eth1  In  IP 10.0.29.3.44962 > 10.0.29.2.3784: BFDv1, Control, State Up, Flags: [none], length: 24
 00:00:18.075858 eth1  Out IP 10.0.29.2.55704 > 10.0.29.3.3784: BFDv1, Control, State Up, Flags: [none], length: 24
 00:00:18.139617 eth1  In  IP 10.0.29.3.44962 > 10.0.29.2.3784: BFDv1, Control, State Up, Flags: [none], length: 24
 00:00:18.165010 eth1  Out IP 10.0.29.2.55704 > 10.0.29.3.3784: BFDv1, Control, State Up, Flags: [none], length: 24
 00:00:18.216883 eth1  In  IP 10.0.29.3.44962 > 10.0.29.2.3784: BFDv1, Control, State Up, Flags: [none], length: 24
 00:00:18.244279 eth1  Out IP 10.0.29.2.55704 > 10.0.29.3.3784: BFDv1, Control, State Up, Flags: [none], length: 24
 00:00:18.300116 eth1  In  IP 10.0.29.3.44962 > 10.0.29.2.3784: BFDv1, Control, State Up, Flags: [none], length: 24
 00:00:18.326423 eth1  Out IP 10.0.29.2.55704 > 10.0.29.3.3784: BFDv1, Control, State Up, Flags: [none], length: 24
 00:00:18.377077 eth1  In  IP 10.0.29.3.44962 > 10.0.29.2.3784: BFDv1, Control, State Up, Flags: [none], length: 24
 00:00:18.406400 eth1  Out IP 10.0.29.2.55704 > 10.0.29.3.3784: BFDv1, Control, State Up, Flags: [none], length: 24
 00:00:18.452994 eth1  In  IP 10.0.29.3.44962 > 10.0.29.2.3784: BFDv1, Control, State Up, Flags: [none], length: 24
 00:00:18.482283 eth1  Out IP 10.0.29.2.55704 > 10.0.29.3.3784: BFDv1, Control, State Up, Flags: [none], length: 24
 00:00:18.532037 eth1  In  IP 10.0.29.3.44962 > 10.0.29.2.3784: BFDv1, Control, State Up, Flags: [none], length: 24
 00:00:18.568356 eth1  Out IP 10.0.29.2.55704 > 10.0.29.3.3784: BFDv1, Control, State Up, Flags: [none], length: 24
 00:00:18.610037 eth1  In  IP 10.0.29.3.44962 > 10.0.29.2.3784: BFDv1, Control, State Up, Flags: [none], length: 24
 00:00:18.652417 eth1  Out IP 10.0.29.2.55704 > 10.0.29.3.3784: BFDv1, Control, State Up, Flags: [none], length: 24
 00:00:18.691939 eth1  In  IP 10.0.29.3.44962 > 10.0.29.2.3784: BFDv1, Control, State Up, Flags: [none], length: 24
 00:00:18.729269 eth1  Out IP 10.0.29.2.55704 > 10.0.29.3.3784: BFDv1, Control, State Up, Flags: [none], length: 24
 00:00:18.776276 eth1  In  IP 10.0.29.3.44962 > 10.0.29.2.3784: BFDv1, Control, State Up, Flags: [none], length: 24
 00:00:18.814609 eth1  Out IP 10.0.29.2.55704 > 10.0.29.3.3784: BFDv1, Control, State Up, Flags: [none], length: 24
 00:00:18.864480 eth1  In  IP 10.0.29.3.44962 > 10.0.29.2.3784: BFDv1, Control, State Up, Flags: [none], length: 24
 00:00:18.883938 eth1  Out IP 10.0.29.2.51141 > 10.0.29.3.179: Flags [S], seq 3951207976, win 64240, options [mss 1460,sackOK,TS val 1877079603 ecr 0,nop,wscale 10], length 0
 00:00:18.884019 eth1  In  IP 10.0.29.3.179 > 10.0.29.2.51141: Flags [S.], seq 852520750, ack 3951207977, win 65160, options [mss 1460,sackOK,TS val 3829834577 ecr 1877079603,nop,wscale 10], length 0
 00:00:18.884051 eth1  Out IP 10.0.29.2.51141 > 10.0.29.3.179: Flags [.], ack 1, win 63, options [nop,nop,TS val 1877079603 ecr 3829834577], length 0
 00:00:18.884162 eth1  Out IP 10.0.29.2.51141 > 10.0.29.3.179: Flags [P.], seq 1:65, ack 1, win 63, options [nop,nop,TS val 1877079603 ecr 3829834577], length 64: BGP
 00:00:18.884181 eth1  In  IP 10.0.29.3.179 > 10.0.29.2.51141: Flags [F.], seq 1, ack 1, win 64, options [nop,nop,TS val 3829834577 ecr 1877079603], length 0
 00:00:18.884235 eth1  In  IP 10.0.29.3.179 > 10.0.29.2.51141: Flags [R], seq 852520751, win 0, length 0
 00:00:18.904461 eth1  Out IP 10.0.29.2.55704 > 10.0.29.3.3784: BFDv1, Control, State Up, Flags: [none], length: 24
 00:00:18.946211 eth1  In  IP 10.0.29.3.44962 > 10.0.29.2.3784: BFDv1, Control, State Up, Flags: [none], length: 24
 00:00:18.992509 eth1  Out IP 10.0.29.2.55704 > 10.0.29.3.3784: BFDv1, Control, State Up, Flags: [none], length: 24
 00:00:19.024484 eth1  In  IP 10.0.29.3.44962 > 10.0.29.2.3784: BFDv1, Control, State Up, Flags: [none], length: 24
 00:00:19.068282 eth1  Out IP 10.0.29.2.55704 > 10.0.29.3.3784: BFDv1, Control, State Up, Flags: [none], length: 24
 00:00:19.111122 eth1  In  IP 10.0.29.3.44962 > 10.0.29.2.3784: BFDv1, Control, State Up, Flags: [none], length: 24
 00:00:19.145432 eth1  Out IP 10.0.29.2.55704 > 10.0.29.3.3784: BFDv1, Control, State Up, Flags: [none], length: 24
 00:00:19.197053 eth1  In  IP 10.0.29.3.44962 > 10.0.29.2.3784: BFDv1, Control, State Up, Flags: [none], length: 24
 00:00:19.231255 eth1  Out IP 10.0.29.2.55704 > 10.0.29.3.3784: BFDv1, Control, State Up, Flags: [none], length: 24
 00:00:19.285870 eth1  In  IP 10.0.29.3.44962 > 10.0.29.2.3784: BFDv1, Control, State Up, Flags: [none], length: 24
 00:00:19.314122 eth1  Out IP 10.0.29.2.55704 > 10.0.29.3.3784: BFDv1, Control, State Up, Flags: [none], length: 24
 00:00:19.361609 eth1  In  IP 10.0.29.3.44962 > 10.0.29.2.3784: BFDv1, Control, State Up, Flags: [none], length: 24
 00:00:19.388911 eth1  Out IP 10.0.29.2.55704 > 10.0.29.3.3784: BFDv1, Control, State Up, Flags: [none], length: 24
 00:00:19.450452 eth1  In  IP 10.0.29.3.44962 > 10.0.29.2.3784: BFDv1, Control, State Up, Flags: [none], length: 24
 00:00:19.477710 eth1  Out IP 10.0.29.2.55704 > 10.0.29.3.3784: BFDv1, Control, State Up, Flags: [none], length: 24
 00:00:19.534216 eth1  In  IP 10.0.29.3.44962 > 10.0.29.2.3784: BFDv1, Control, State Up, Flags: [none], length: 24
 00:00:19.552517 eth1  Out IP 10.0.29.2.55704 > 10.0.29.3.3784: BFDv1, Control, State Up, Flags: [none], length: 24
 00:00:19.623278 eth1  In  IP 10.0.29.3.44962 > 10.0.29.2.3784: BFDv1, Control, State Up, Flags: [none], length: 24
 00:00:19.641552 eth1  Out IP 10.0.29.2.55704 > 10.0.29.3.3784: BFDv1, Control, State Up, Flags: [none], length: 24
 00:00:19.705047 eth1  In  IP 10.0.29.3.44962 > 10.0.29.2.3784: BFDv1, Control, State Up, Flags: [none], length: 24
 00:00:19.718338 eth1  Out IP 10.0.29.2.55704 > 10.0.29.3.3784: BFDv1, Control, State Up, Flags: [none], length: 24
 00:00:19.789959 eth1  In  IP 10.0.29.3.44962 > 10.0.29.2.3784: BFDv1, Control, State Up, Flags: [none], length: 24
 00:00:19.804349 eth1  Out IP 10.0.29.2.55704 > 10.0.29.3.3784: BFDv1, Control, State Up, Flags: [none], length: 24
 00:00:19.874907 eth1  In  IP 10.0.29.3.44962 > 10.0.29.2.3784: BFDv1, Control, State Up, Flags: [none], length: 24
 00:00:19.887140 eth1  Out IP 10.0.29.2.55704 > 10.0.29.3.3784: BFDv1, Control, State Up, Flags: [none], length: 24
 00:00:19.955660 eth1  In  IP 10.0.29.3.44962 > 10.0.29.2.3784: BFDv1, Control, State Up, Flags: [none], length: 24
 00:00:19.975966 eth1  Out IP 10.0.29.2.55704 > 10.0.29.3.3784: BFDv1, Control, State Up, Flags: [none], length: 24
 00:00:20.040525 eth1  In  IP 10.0.29.3.44962 > 10.0.29.2.3784: BFDv1, Control, State Up, Flags: [none], length: 24
 00:00:20.058764 eth1  Out IP 10.0.29.2.55704 > 10.0.29.3.3784: BFDv1, Control, State Up, Flags: [none], length: 24
 00:00:20.117095 eth1  In  IP 10.0.29.3.44962 > 10.0.29.2.3784: BFDv1, Control, State Up, Flags: [none], length: 24
 00:00:20.134413 eth1  Out IP 10.0.29.2.55704 > 10.0.29.3.3784: BFDv1, Control, State Up, Flags: [none], length: 24
 00:00:20.205847 eth1  In  IP 10.0.29.3.44962 > 10.0.29.2.3784: BFDv1, Control, State Up, Flags: [none], length: 24
 00:00:20.214143 eth1  Out IP 10.0.29.2.55704 > 10.0.29.3.3784: BFDv1, Control, State Up, Flags: [none], length: 24
 00:00:20.289678 eth1  In  IP 10.0.29.3.44962 > 10.0.29.2.3784: BFDv1, Control, State Up, Flags: [none], length: 24
 00:00:20.298002 eth1  Out IP 10.0.29.2.55704 > 10.0.29.3.3784: BFDv1, Control, State Up, Flags: [none], length: 24
 00:00:20.364583 eth1  In  IP 10.0.29.3.44962 > 10.0.29.2.3784: BFDv1, Control, State Up, Flags: [none], length: 24
 00:00:20.385844 eth1  Out IP 10.0.29.2.55704 > 10.0.29.3.3784: BFDv1, Control, State Up, Flags: [none], length: 24
 00:00:20.450359 eth1  In  IP 10.0.29.3.44962 > 10.0.29.2.3784: BFDv1, Control, State Up, Flags: [none], length: 24
 00:00:20.463666 eth1  Out IP 10.0.29.2.55704 > 10.0.29.3.3784: BFDv1, Control, State Up, Flags: [none], length: 24
 00:00:20.540199 eth1  In  IP 10.0.29.3.44962 > 10.0.29.2.3784: BFDv1, Control, State Up, Flags: [none], length: 24
 00:00:20.551412 eth1  Out IP 10.0.29.2.55704 > 10.0.29.3.3784: BFDv1, Control, State Up, Flags: [none], length: 24
 00:00:20.625900 eth1  In  IP 10.0.29.3.44962 > 10.0.29.2.3784: BFDv1, Control, State Up, Flags: [none], length: 24
 00:00:20.631117 eth1  Out IP 10.0.29.2.55704 > 10.0.29.3.3784: BFDv1, Control, State Up, Flags: [none], length: 24
 00:00:20.713295 eth1  Out IP 10.0.29.2.55704 > 10.0.29.3.3784: BFDv1, Control, State Up, Flags: [none], length: 24
 00:00:20.715444 eth1  In  IP 10.0.29.3.44962 > 10.0.29.2.3784: BFDv1, Control, State Up, Flags: [none], length: 24
 00:00:20.791833 eth1  In  IP 10.0.29.3.44962 > 10.0.29.2.3784: BFDv1, Control, State Up, Flags: [none], length: 24
 00:00:20.802059 eth1  Out IP 10.0.29.2.55704 > 10.0.29.3.3784: BFDv1, Control, State Up, Flags: [none], length: 24
 00:00:20.867683 eth1  In  IP 10.0.29.3.44962 > 10.0.29.2.3784: BFDv1, Control, State Up, Flags: [none], length: 24
 00:00:20.877939 eth1  Out IP 10.0.29.2.55704 > 10.0.29.3.3784: BFDv1, Control, State Up, Flags: [none], length: 24
 00:00:20.947477 eth1  In  IP 10.0.29.3.44962 > 10.0.29.2.3784: BFDv1, Control, State Up, Flags: [none], length: 24
 00:00:20.952812 eth1  Out IP 10.0.29.2.55704 > 10.0.29.3.3784: BFDv1, Control, State Up, Flags: [none], length: 24
 00:00:21.029022 eth1  Out IP 10.0.29.2.55704 > 10.0.29.3.3784: BFDv1, Control, State Up, Flags: [none], length: 24
 00:00:21.037201 eth1  In  IP 10.0.29.3.44962 > 10.0.29.2.3784: BFDv1, Control, State Up, Flags: [none], length: 24
 00:00:21.113732 eth1  In  IP 10.0.29.3.44962 > 10.0.29.2.3784: BFDv1, Control, State Up, Flags: [none], length: 24
 00:00:21.115976 eth1  Out IP 10.0.29.2.55704 > 10.0.29.3.3784: BFDv1, Control, State Up, Flags: [none], length: 24
 00:00:21.200598 eth1  In  IP 10.0.29.3.44962 > 10.0.29.2.3784: BFDv1, Control, State Up, Flags: [none], length: 24
 00:00:21.205075 eth1  Out IP 10.0.29.2.55704 > 10.0.29.3.3784: BFDv1, Control, State Up, Flags: [none], length: 24
 00:00:21.285274 eth1  Out IP 10.0.29.2.55704 > 10.0.29.3.3784: BFDv1, Control, State Up, Flags: [none], length: 24
 00:00:21.287440 eth1  In  IP 10.0.29.3.44962 > 10.0.29.2.3784: BFDv1, Control, State Up, Flags: [none], length: 24
 00:00:21.359695 eth1  Out IP 10.0.29.2.55704 > 10.0.29.3.3784: BFDv1, Control, State Up, Flags: [none], length: 24
 00:00:21.368784 eth1  In  IP 10.0.29.3.44962 > 10.0.29.2.3784: BFDv1, Control, State Up, Flags: [none], length: 24
 00:00:21.446053 eth1  Out IP 10.0.29.2.55704 > 10.0.29.3.3784: BFDv1, Control, State Up, Flags: [none], length: 24
 00:00:21.457235 eth1  In  IP 10.0.29.3.44962 > 10.0.29.2.3784: BFDv1, Control, State Up, Flags: [none], length: 24
 00:00:21.524563 eth1  Out IP 10.0.29.2.55704 > 10.0.29.3.3784: BFDv1, Control, State Up, Flags: [none], length: 24
 00:00:21.538973 eth1  In  IP 10.0.29.3.44962 > 10.0.29.2.3784: BFDv1, Control, State Up, Flags: [none], length: 24
 00:00:21.614310 eth1  Out IP 10.0.29.2.55704 > 10.0.29.3.3784: BFDv1, Control, State Up, Flags: [none], length: 24
 00:00:21.619528 eth1  In  IP 10.0.29.3.44962 > 10.0.29.2.3784: BFDv1, Control, State Up, Flags: [none], length: 24
 00:00:21.702980 eth1  Out IP 10.0.29.2.55704 > 10.0.29.3.3784: BFDv1, Control, State Up, Flags: [none], length: 24
 00:00:21.707256 eth1  In  IP 10.0.29.3.44962 > 10.0.29.2.3784: BFDv1, Control, State Up, Flags: [none], length: 24
 00:00:21.784935 eth1  In  IP 10.0.29.3.44962 > 10.0.29.2.3784: BFDv1, Control, State Up, Flags: [none], length: 24
 00:00:21.791216 eth1  Out IP 10.0.29.2.55704 > 10.0.29.3.3784: BFDv1, Control, State Up, Flags: [none], length: 24
 00:00:21.870787 eth1  In  IP 10.0.29.3.44962 > 10.0.29.2.3784: BFDv1, Control, State Up, Flags: [none], length: 24
 00:00:21.873059 eth1  Out IP 10.0.29.2.55704 > 10.0.29.3.3784: BFDv1, Control, State Up, Flags: [none], length: 24
 00:00:21.956603 eth1  In  IP 10.0.29.3.44962 > 10.0.29.2.3784: BFDv1, Control, State Up, Flags: [none], length: 24
 00:00:21.961820 eth1  Out IP 10.0.29.2.55704 > 10.0.29.3.3784: BFDv1, Control, State Up, Flags: [none], length: 24
 00:00:22.039508 eth1  In  IP 10.0.29.3.44962 > 10.0.29.2.3784: BFDv1, Control, State Up, Flags: [none], length: 24
 00:00:22.048748 eth1  Out IP 10.0.29.2.55704 > 10.0.29.3.3784: BFDv1, Control, State Up, Flags: [none], length: 24
 00:00:22.119527 eth1  In  IP 10.0.29.3.44962 > 10.0.29.2.3784: BFDv1, Control, State Up, Flags: [none], length: 24
 00:00:22.130882 eth1  Out IP 10.0.29.2.55704 > 10.0.29.3.3784: BFDv1, Control, State Up, Flags: [none], length: 24
 00:00:22.204548 eth1  In  IP 10.0.29.3.44962 > 10.0.29.2.3784: BFDv1, Control, State Up, Flags: [none], length: 24
 00:00:22.218828 eth1  Out IP 10.0.29.2.55704 > 10.0.29.3.3784: BFDv1, Control, State Up, Flags: [none], length: 24
 00:00:22.294566 eth1  In  IP 10.0.29.3.44962 > 10.0.29.2.3784: BFDv1, Control, State Up, Flags: [none], length: 24
 00:00:22.306917 eth1  Out IP 10.0.29.2.55704 > 10.0.29.3.3784: BFDv1, Control, State Up, Flags: [none], length: 24
 00:00:22.377755 eth1  In  IP 10.0.29.3.44962 > 10.0.29.2.3784: BFDv1, Control, State Up, Flags: [none], length: 24
 00:00:22.386132 eth1  Out IP 10.0.29.2.55704 > 10.0.29.3.3784: BFDv1, Control, State Up, Flags: [none], length: 24
 00:00:22.457797 eth1  In  IP 10.0.29.3.44962 > 10.0.29.2.3784: BFDv1, Control, State Up, Flags: [none], length: 24
 00:00:22.466141 eth1  Out IP 10.0.29.2.55704 > 10.0.29.3.3784: BFDv1, Control, State Up, Flags: [none], length: 24
 00:00:22.539898 eth1  In  IP 10.0.29.3.44962 > 10.0.29.2.3784: BFDv1, Control, State Up, Flags: [none], length: 24
 00:00:22.552237 eth1  Out IP 10.0.29.2.55704 > 10.0.29.3.3784: BFDv1, Control, State Up, Flags: [none], length: 24
 00:00:22.626154 eth1  In  IP 10.0.29.3.44962 > 10.0.29.2.3784: BFDv1, Control, State Up, Flags: [none], length: 24
 00:00:22.639555 eth1  Out IP 10.0.29.2.55704 > 10.0.29.3.3784: BFDv1, Control, State Up, Flags: [none], length: 24
 00:00:22.716365 eth1  In  IP 10.0.29.3.44962 > 10.0.29.2.3784: BFDv1, Control, State Up, Flags: [none], length: 24
 00:00:22.719780 eth1  Out IP 10.0.29.2.55704 > 10.0.29.3.3784: BFDv1, Control, State Up, Flags: [none], length: 24
 00:00:22.792588 eth1  In  IP 10.0.29.3.44962 > 10.0.29.2.3784: BFDv1, Control, State Up, Flags: [none], length: 24
 00:00:22.795952 eth1  Out IP 10.0.29.2.55704 > 10.0.29.3.3784: BFDv1, Control, State Up, Flags: [none], length: 24
 00:00:22.801531 eth1  Out IP 10.0.29.2.39525 > 10.0.29.3.179: Flags [S], seq 1279413142, win 64240, options [mss 1460,sackOK,TS val 1877083521 ecr 0,nop,wscale 10], length 0
 00:00:22.801598 eth1  In  IP 10.0.29.3.179 > 10.0.29.2.39525: Flags [S.], seq 3178494916, ack 1279413143, win 65160, options [mss 1460,sackOK,TS val 3829838495 ecr 1877083521,nop,wscale 10], length 0
 00:00:22.801623 eth1  Out IP 10.0.29.2.39525 > 10.0.29.3.179: Flags [.], ack 1, win 63, options [nop,nop,TS val 1877083521 ecr 3829838495], length 0
 00:00:22.801729 eth1  Out IP 10.0.29.2.39525 > 10.0.29.3.179: Flags [P.], seq 1:65, ack 1, win 63, options [nop,nop,TS val 1877083521 ecr 3829838495], length 64: BGP
 00:00:22.801744 eth1  In  IP 10.0.29.3.179 > 10.0.29.2.39525: Flags [.], ack 65, win 64, options [nop,nop,TS val 3829838495 ecr 1877083521], length 0
 00:00:22.801787 eth1  In  IP 10.0.29.3.179 > 10.0.29.2.39525: Flags [R.], seq 1, ack 65, win 64, options [nop,nop,TS val 3829838495 ecr 1877083521], length 0
 00:00:22.870011 eth1  In  IP 10.0.29.3.44962 > 10.0.29.2.3784: BFDv1, Control, State Up, Flags: [none], length: 24
 00:00:22.875387 eth1  Out IP 10.0.29.2.55704 > 10.0.29.3.3784: BFDv1, Control, State Up, Flags: [none], length: 24
 00:00:22.957663 eth1  Out IP 10.0.29.2.55704 > 10.0.29.3.3784: BFDv1, Control, State Up, Flags: [none], length: 24
 00:00:22.957793 eth1  In  IP 10.0.29.3.44962 > 10.0.29.2.3784: BFDv1, Control, State Up, Flags: [none], length: 24
 00:00:23.041418 eth1  In  IP 10.0.29.3.44962 > 10.0.29.2.3784: BFDv1, Control, State Up, Flags: [none], length: 24
 00:00:23.042699 eth1  Out IP 10.0.29.2.55704 > 10.0.29.3.3784: BFDv1, Control, State Up, Flags: [none], length: 24
 00:00:23.119005 eth1  Out IP 10.0.29.2.55704 > 10.0.29.3.3784: BFDv1, Control, State Up, Flags: [none], length: 24
 00:00:23.126260 eth1  In  IP 10.0.29.3.44962 > 10.0.29.2.3784: BFDv1, Control, State Up, Flags: [none], length: 24
 00:00:23.202651 eth1  Out IP 10.0.29.2.55704 > 10.0.29.3.3784: BFDv1, Control, State Up, Flags: [none], length: 24
 00:00:23.214912 eth1  In  IP 10.0.29.3.44962 > 10.0.29.2.3784: BFDv1, Control, State Up, Flags: [none], length: 24
 00:00:23.287308 eth1  Out IP 10.0.29.2.55704 > 10.0.29.3.3784: BFDv1, Control, State Up, Flags: [none], length: 24
 00:00:23.304611 eth1  In  IP 10.0.29.3.44962 > 10.0.29.2.3784: BFDv1, Control, State Up, Flags: [none], length: 24
 00:00:23.362986 eth1  Out IP 10.0.29.2.55704 > 10.0.29.3.3784: BFDv1, Control, State Up, Flags: [none], length: 24
 00:00:23.380864 eth1  In  IP 10.0.29.3.44962 > 10.0.29.2.3784: BFDv1, Control, State Up, Flags: [none], length: 24
 00:00:23.443314 eth1  Out IP 10.0.29.2.55704 > 10.0.29.3.3784: BFDv1, Control, State Up, Flags: [none], length: 24
 00:00:23.455586 eth1  In  IP 10.0.29.3.44962 > 10.0.29.2.3784: BFDv1, Control, State Up, Flags: [none], length: 24
 00:00:23.527027 eth1  Out IP 10.0.29.2.55704 > 10.0.29.3.3784: BFDv1, Control, State Up, Flags: [none], length: 24
 00:00:23.543293 eth1  In  IP 10.0.29.3.44962 > 10.0.29.2.3784: BFDv1, Control, State Up, Flags: [none], length: 24
 00:00:23.607721 eth1  Out IP 10.0.29.2.55704 > 10.0.29.3.3784: BFDv1, Control, State Up, Flags: [none], length: 24
 00:00:23.624973 eth1  In  IP 10.0.29.3.44962 > 10.0.29.2.3784: BFDv1, Control, State Up, Flags: [none], length: 24
 00:00:23.687309 eth1  Out IP 10.0.29.2.55704 > 10.0.29.3.3784: BFDv1, Control, State Up, Flags: [none], length: 24
 00:00:23.700574 eth1  In  IP 10.0.29.3.44962 > 10.0.29.2.3784: BFDv1, Control, State Up, Flags: [none], length: 24
 00:00:23.766937 eth1  Out IP 10.0.29.2.55704 > 10.0.29.3.3784: BFDv1, Control, State Up, Flags: [none], length: 24
 00:00:23.786186 eth1  In  IP 10.0.29.3.44962 > 10.0.29.2.3784: BFDv1, Control, State Up, Flags: [none], length: 24
 00:00:23.850601 eth1  Out IP 10.0.29.2.55704 > 10.0.29.3.3784: BFDv1, Control, State Up, Flags: [none], length: 24
 00:00:23.872849 eth1  In  IP 10.0.29.3.44962 > 10.0.29.2.3784: BFDv1, Control, State Up, Flags: [none], length: 24
 00:00:23.930248 eth1  Out IP 10.0.29.2.55704 > 10.0.29.3.3784: BFDv1, Control, State Up, Flags: [none], length: 24
 00:00:23.952533 eth1  In  IP 10.0.29.3.44962 > 10.0.29.2.3784: BFDv1, Control, State Up, Flags: [none], length: 24
 00:00:24.007896 eth1  Out IP 10.0.29.2.55704 > 10.0.29.3.3784: BFDv1, Control, State Up, Flags: [none], length: 24
 00:00:24.029169 eth1  In  IP 10.0.29.3.44962 > 10.0.29.2.3784: BFDv1, Control, State Up, Flags: [none], length: 24
 00:00:24.091684 eth1  Out IP 10.0.29.2.55704 > 10.0.29.3.3784: BFDv1, Control, State Up, Flags: [none], length: 24
 00:00:24.106924 eth1  In  IP 10.0.29.3.44962 > 10.0.29.2.3784: BFDv1, Control, State Up, Flags: [none], length: 24
 00:00:24.177200 eth1  Out IP 10.0.29.2.55704 > 10.0.29.3.3784: BFDv1, Control, State Up, Flags: [none], length: 24
 00:00:24.194418 eth1  In  IP 10.0.29.3.44962 > 10.0.29.2.3784: BFDv1, Control, State Up, Flags: [none], length: 24
 00:00:24.253828 eth1  Out IP 10.0.29.2.55704 > 10.0.29.3.3784: BFDv1, Control, State Up, Flags: [none], length: 24
 00:00:24.271167 eth1  In  IP 10.0.29.3.44962 > 10.0.29.2.3784: BFDv1, Control, State Up, Flags: [none], length: 24
 00:00:24.332464 eth1  Out IP 10.0.29.2.55704 > 10.0.29.3.3784: BFDv1, Control, State Up, Flags: [none], length: 24
 00:00:24.346766 eth1  In  IP 10.0.29.3.44962 > 10.0.29.2.3784: BFDv1, Control, State Up, Flags: [none], length: 24
 00:00:24.411166 eth1  Out IP 10.0.29.2.55704 > 10.0.29.3.3784: BFDv1, Control, State Up, Flags: [none], length: 24
 00:00:24.431369 eth1  In  IP 10.0.29.3.44962 > 10.0.29.2.3784: BFDv1, Control, State Up, Flags: [none], length: 24
 00:00:24.499698 eth1  Out IP 10.0.29.2.55704 > 10.0.29.3.3784: BFDv1, Control, State Up, Flags: [none], length: 24
 00:00:24.507868 eth1  In  IP 10.0.29.3.44962 > 10.0.29.2.3784: BFDv1, Control, State Up, Flags: [none], length: 24
 00:00:24.575169 eth1  Out IP 10.0.29.2.55704 > 10.0.29.3.3784: BFDv1, Control, State Up, Flags: [none], length: 24
 00:00:24.590532 eth1  In  IP 10.0.29.3.44962 > 10.0.29.2.3784: BFDv1, Control, State Up, Flags: [none], length: 24
 00:00:24.656813 eth1  Out IP 10.0.29.2.55704 > 10.0.29.3.3784: BFDv1, Control, State Up, Flags: [none], length: 24
 00:00:24.677144 eth1  In  IP 10.0.29.3.44962 > 10.0.29.2.3784: BFDv1, Control, State Up, Flags: [none], length: 24
 00:00:24.736487 eth1  Out IP 10.0.29.2.55704 > 10.0.29.3.3784: BFDv1, Control, State Up, Flags: [none], length: 24
 00:00:24.765698 eth1  In  IP 10.0.29.3.44962 > 10.0.29.2.3784: BFDv1, Control, State Up, Flags: [none], length: 24
 00:00:24.824077 eth1  Out IP 10.0.29.2.55704 > 10.0.29.3.3784: BFDv1, Control, State Up, Flags: [none], length: 24
 00:00:24.847237 eth1  In  IP 10.0.29.3.44962 > 10.0.29.2.3784: BFDv1, Control, State Up, Flags: [none], length: 24
 00:00:24.901540 eth1  Out IP 10.0.29.2.55704 > 10.0.29.3.3784: BFDv1, Control, State Up, Flags: [none], length: 24
 00:00:24.922793 eth1  In  IP 10.0.29.3.44962 > 10.0.29.2.3784: BFDv1, Control, State Up, Flags: [none], length: 24
 00:00:24.986148 eth1  Out IP 10.0.29.2.55704 > 10.0.29.3.3784: BFDv1, Control, State Up, Flags: [none], length: 24
 00:00:25.012223 eth1  In  IP 10.0.29.3.44962 > 10.0.29.2.3784: BFDv1, Control, State Up, Flags: [none], length: 24
 00:00:25.074594 eth1  Out IP 10.0.29.2.55704 > 10.0.29.3.3784: BFDv1, Control, State Up, Flags: [none], length: 24
 00:00:25.101025 eth1  In  IP 10.0.29.3.44962 > 10.0.29.2.3784: BFDv1, Control, State Up, Flags: [none], length: 24
 00:00:25.156368 eth1  Out IP 10.0.29.2.55704 > 10.0.29.3.3784: BFDv1, Control, State Up, Flags: [none], length: 24
 00:00:25.177742 eth1  In  IP 10.0.29.3.44962 > 10.0.29.2.3784: BFDv1, Control, State Up, Flags: [none], length: 24
 00:00:25.243047 eth1  Out IP 10.0.29.2.55704 > 10.0.29.3.3784: BFDv1, Control, State Up, Flags: [none], length: 24
 00:00:25.260281 eth1  In  IP 10.0.29.3.44962 > 10.0.29.2.3784: BFDv1, Control, State Up, Flags: [none], length: 24
 00:00:25.319618 eth1  Out IP 10.0.29.2.55704 > 10.0.29.3.3784: BFDv1, Control, State Up, Flags: [none], length: 24
 00:00:25.344839 eth1  In  IP 10.0.29.3.44962 > 10.0.29.2.3784: BFDv1, Control, State Up, Flags: [none], length: 24
 00:00:25.404251 eth1  Out IP 10.0.29.2.55704 > 10.0.29.3.3784: BFDv1, Control, State Up, Flags: [none], length: 24
 00:00:25.425512 eth1  In  IP 10.0.29.3.44962 > 10.0.29.2.3784: BFDv1, Control, State Up, Flags: [none], length: 24
 00:00:25.483826 eth1  Out IP 10.0.29.2.55704 > 10.0.29.3.3784: BFDv1, Control, State Up, Flags: [none], length: 24
 00:00:25.511117 eth1  In  IP 10.0.29.3.44962 > 10.0.29.2.3784: BFDv1, Control, State Up, Flags: [none], length: 24
 00:00:25.569509 eth1  Out IP 10.0.29.2.55704 > 10.0.29.3.3784: BFDv1, Control, State Up, Flags: [none], length: 24
 00:00:25.599753 eth1  In  IP 10.0.29.3.44962 > 10.0.29.2.3784: BFDv1, Control, State Up, Flags: [none], length: 24
 00:00:25.654057 eth1  Out IP 10.0.29.2.55704 > 10.0.29.3.3784: BFDv1, Control, State Up, Flags: [none], length: 24
 00:00:25.678285 eth1  In  IP 10.0.29.3.44962 > 10.0.29.2.3784: BFDv1, Control, State Up, Flags: [none], length: 24
 00:00:25.742586 eth1  Out IP 10.0.29.2.55704 > 10.0.29.3.3784: BFDv1, Control, State Up, Flags: [none], length: 24
 00:00:25.763789 eth1  In  IP 10.0.29.3.44962 > 10.0.29.2.3784: BFDv1, Control, State Up, Flags: [none], length: 24
 00:00:25.823082 eth1  Out IP 10.0.29.2.55704 > 10.0.29.3.3784: BFDv1, Control, State Up, Flags: [none], length: 24
 00:00:25.840319 eth1  In  IP 10.0.29.3.44962 > 10.0.29.2.3784: BFDv1, Control, State Up, Flags: [none], length: 24
 00:00:25.908620 eth1  Out IP 10.0.29.2.55704 > 10.0.29.3.3784: BFDv1, Control, State Up, Flags: [none], length: 24
 00:00:25.922822 eth1  In  IP 10.0.29.3.44962 > 10.0.29.2.3784: BFDv1, Control, State Up, Flags: [none], length: 24
 00:00:25.986214 eth1  Out IP 10.0.29.2.55704 > 10.0.29.3.3784: BFDv1, Control, State Up, Flags: [none], length: 24
 00:00:26.005393 eth1  In  IP 10.0.29.3.44962 > 10.0.29.2.3784: BFDv1, Control, State Up, Flags: [none], length: 24
 00:00:26.074691 eth1  Out IP 10.0.29.2.55704 > 10.0.29.3.3784: BFDv1, Control, State Up, Flags: [none], length: 24
 00:00:26.089919 eth1  In  IP 10.0.29.3.44962 > 10.0.29.2.3784: BFDv1, Control, State Up, Flags: [none], length: 24
 00:00:26.150241 eth1  Out IP 10.0.29.2.55704 > 10.0.29.3.3784: BFDv1, Control, State Up, Flags: [none], length: 24
 00:00:26.174451 eth1  In  IP 10.0.29.3.44962 > 10.0.29.2.3784: BFDv1, Control, State Up, Flags: [none], length: 24
 00:00:26.232811 eth1  Out IP 10.0.29.2.55704 > 10.0.29.3.3784: BFDv1, Control, State Up, Flags: [none], length: 24
 00:00:26.255061 eth1  In  IP 10.0.29.3.44962 > 10.0.29.2.3784: BFDv1, Control, State Up, Flags: [none], length: 24
 00:00:26.310402 eth1  Out IP 10.0.29.2.55704 > 10.0.29.3.3784: BFDv1, Control, State Up, Flags: [none], length: 24
 00:00:26.333651 eth1  In  IP 10.0.29.3.44962 > 10.0.29.2.3784: BFDv1, Control, State Up, Flags: [none], length: 24
 00:00:26.395989 eth1  Out IP 10.0.29.2.55704 > 10.0.29.3.3784: BFDv1, Control, State Up, Flags: [none], length: 24
 00:00:26.413215 eth1  In  IP 10.0.29.3.44962 > 10.0.29.2.3784: BFDv1, Control, State Up, Flags: [none], length: 24
 00:00:26.483200 eth1  Out IP 10.0.29.2.55704 > 10.0.29.3.3784: BFDv1, Control, State Up, Flags: [none], length: 24
 00:00:26.496399 eth1  In  IP 10.0.29.3.44962 > 10.0.29.2.3784: BFDv1, Control, State Up, Flags: [none], length: 24
 00:00:26.562805 eth1  Out IP 10.0.29.2.55704 > 10.0.29.3.3784: BFDv1, Control, State Up, Flags: [none], length: 24
 00:00:26.579044 eth1  In  IP 10.0.29.3.44962 > 10.0.29.2.3784: BFDv1, Control, State Up, Flags: [none], length: 24
 00:00:26.640386 eth1  Out IP 10.0.29.2.55704 > 10.0.29.3.3784: BFDv1, Control, State Up, Flags: [none], length: 24
 00:00:26.660589 eth1  In  IP 10.0.29.3.44962 > 10.0.29.2.3784: BFDv1, Control, State Up, Flags: [none], length: 24
 00:00:26.722879 eth1  Out IP 10.0.29.2.55704 > 10.0.29.3.3784: BFDv1, Control, State Up, Flags: [none], length: 24
 00:00:26.747115 eth1  In  IP 10.0.29.3.44962 > 10.0.29.2.3784: BFDv1, Control, State Up, Flags: [none], length: 24
 00:00:26.804520 eth1  Out IP 10.0.29.2.55704 > 10.0.29.3.3784: BFDv1, Control, State Up, Flags: [none], length: 24
 00:00:26.826773 eth1  In  IP 10.0.29.3.44962 > 10.0.29.2.3784: BFDv1, Control, State Up, Flags: [none], length: 24
 00:00:26.885085 eth1  Out IP 10.0.29.2.55704 > 10.0.29.3.3784: BFDv1, Control, State Up, Flags: [none], length: 24
 00:00:26.912403 eth1  In  IP 10.0.29.3.44962 > 10.0.29.2.3784: BFDv1, Control, State Up, Flags: [none], length: 24
 00:00:26.915961 eth1  Out IP 10.0.29.2.37763 > 10.0.29.3.179: Flags [S], seq 51122916, win 64240, options [mss 1460,sackOK,TS val 1877087635 ecr 0,nop,wscale 10], length 0
 00:00:26.916003 eth1  In  IP 10.0.29.3.179 > 10.0.29.2.37763: Flags [S.], seq 385862249, ack 51122917, win 65160, options [mss 1460,sackOK,TS val 3829842609 ecr 1877087635,nop,wscale 10], length 0
 00:00:26.916025 eth1  Out IP 10.0.29.2.37763 > 10.0.29.3.179: Flags [.], ack 1, win 63, options [nop,nop,TS val 1877087635 ecr 3829842609], length 0
 00:00:26.916090 eth1  Out IP 10.0.29.2.37763 > 10.0.29.3.179: Flags [P.], seq 1:65, ack 1, win 63, options [nop,nop,TS val 1877087635 ecr 3829842609], length 64: BGP
 00:00:26.916102 eth1  In  IP 10.0.29.3.179 > 10.0.29.2.37763: Flags [.], ack 65, win 64, options [nop,nop,TS val 3829842609 ecr 1877087635], length 0
 00:00:26.916132 eth1  In  IP 10.0.29.3.179 > 10.0.29.2.37763: Flags [R.], seq 1, ack 65, win 64, options [nop,nop,TS val 3829842609 ecr 1877087635], length 0
 00:00:26.969852 eth1  Out IP 10.0.29.2.55704 > 10.0.29.3.3784: BFDv1, Control, State Up, Flags: [none], length: 24
 00:00:26.992168 eth1  In  IP 10.0.29.3.44962 > 10.0.29.2.3784: BFDv1, Control, State Up, Flags: [none], length: 24
 00:00:27.053514 eth1  Out IP 10.0.29.2.55704 > 10.0.29.3.3784: BFDv1, Control, State Up, Flags: [none], length: 24
 00:00:27.079755 eth1  In  IP 10.0.29.3.44962 > 10.0.29.2.3784: BFDv1, Control, State Up, Flags: [none], length: 24
 00:00:27.132072 eth1  Out IP 10.0.29.2.55704 > 10.0.29.3.3784: BFDv1, Control, State Up, Flags: [none], length: 24
 00:00:27.162396 eth1  In  IP 10.0.29.3.44962 > 10.0.29.2.3784: BFDv1, Control, State Up, Flags: [none], length: 24
 00:00:27.211747 eth1  Out IP 10.0.29.2.55704 > 10.0.29.3.3784: BFDv1, Control, State Up, Flags: [none], length: 24
 00:00:27.243001 eth1  In  IP 10.0.29.3.44962 > 10.0.29.2.3784: BFDv1, Control, State Up, Flags: [none], length: 24
 00:00:27.289397 eth1  Out IP 10.0.29.2.55704 > 10.0.29.3.3784: BFDv1, Control, State Up, Flags: [none], length: 24
 00:00:27.327627 eth1  In  IP 10.0.29.3.44962 > 10.0.29.2.3784: BFDv1, Control, State Up, Flags: [none], length: 24
 00:00:27.366548 eth1  Out IP 10.0.29.2.55704 > 10.0.29.3.3784: BFDv1, Control, State Up, Flags: [none], length: 24
 00:00:27.415812 eth1  In  IP 10.0.29.3.44962 > 10.0.29.2.3784: BFDv1, Control, State Up, Flags: [none], length: 24
 00:00:27.452162 eth1  Out IP 10.0.29.2.55704 > 10.0.29.3.3784: BFDv1, Control, State Up, Flags: [none], length: 24
 00:00:27.499881 eth1  In  IP 10.0.29.3.44962 > 10.0.29.2.3784: BFDv1, Control, State Up, Flags: [none], length: 24
 00:00:27.541232 eth1  Out IP 10.0.29.2.55704 > 10.0.29.3.3784: BFDv1, Control, State Up, Flags: [none], length: 24
 00:00:27.585439 eth1  In  IP 10.0.29.3.44962 > 10.0.29.2.3784: BFDv1, Control, State Up, Flags: [none], length: 24
 00:00:27.619763 eth1  Out IP 10.0.29.2.55704 > 10.0.29.3.3784: BFDv1, Control, State Up, Flags: [none], length: 24
 00:00:27.668968 eth1  In  IP 10.0.29.3.44962 > 10.0.29.2.3784: BFDv1, Control, State Up, Flags: [none], length: 24
 00:00:27.698275 eth1  Out IP 10.0.29.2.55704 > 10.0.29.3.3784: BFDv1, Control, State Up, Flags: [none], length: 24
 00:00:27.745497 eth1  In  IP 10.0.29.3.44962 > 10.0.29.2.3784: BFDv1, Control, State Up, Flags: [none], length: 24
 00:00:27.778793 eth1  Out IP 10.0.29.2.55704 > 10.0.29.3.3784: BFDv1, Control, State Up, Flags: [none], length: 24
 00:00:27.833012 eth1  In  IP 10.0.29.3.44962 > 10.0.29.2.3784: BFDv1, Control, State Up, Flags: [none], length: 24
 00:00:27.867260 eth1  Out IP 10.0.29.2.55704 > 10.0.29.3.3784: BFDv1, Control, State Up, Flags: [none], length: 24
 00:00:27.912459 eth1  In  IP 10.0.29.3.44962 > 10.0.29.2.3784: BFDv1, Control, State Up, Flags: [none], length: 24
 00:00:27.955755 eth1  Out IP 10.0.29.2.55704 > 10.0.29.3.3784: BFDv1, Control, State Up, Flags: [none], length: 24
 00:00:27.994022 eth1  In  IP 10.0.29.3.44962 > 10.0.29.2.3784: BFDv1, Control, State Up, Flags: [none], length: 24
 00:00:28.033324 eth1  Out IP 10.0.29.2.55704 > 10.0.29.3.3784: BFDv1, Control, State Up, Flags: [none], length: 24
 00:00:28.080702 eth1  In  IP 10.0.29.3.44962 > 10.0.29.2.3784: BFDv1, Control, State Up, Flags: [none], length: 24
 00:00:28.111969 eth1  Out IP 10.0.29.2.55704 > 10.0.29.3.3784: BFDv1, Control, State Up, Flags: [none], length: 24
 00:00:28.170343 eth1  In  IP 10.0.29.3.44962 > 10.0.29.2.3784: BFDv1, Control, State Up, Flags: [none], length: 24
 00:00:28.195704 eth1  Out IP 10.0.29.2.55704 > 10.0.29.3.3784: BFDv1, Control, State Up, Flags: [none], length: 24
 00:00:28.246117 eth1  In  IP 10.0.29.3.44962 > 10.0.29.2.3784: BFDv1, Control, State Up, Flags: [none], length: 24
 00:00:28.276477 eth1  Out IP 10.0.29.2.55704 > 10.0.29.3.3784: BFDv1, Control, State Up, Flags: [none], length: 24
 00:00:28.322905 eth1  In  IP 10.0.29.3.44962 > 10.0.29.2.3784: BFDv1, Control, State Up, Flags: [none], length: 24
 00:00:28.353219 eth1  Out IP 10.0.29.2.55704 > 10.0.29.3.3784: BFDv1, Control, State Up, Flags: [none], length: 24
 00:00:28.409651 eth1  In  IP 10.0.29.3.44962 > 10.0.29.2.3784: BFDv1, Control, State Up, Flags: [none], length: 24
 00:00:28.437930 eth1  Out IP 10.0.29.2.55704 > 10.0.29.3.3784: BFDv1, Control, State Up, Flags: [none], length: 24
 00:00:28.496354 eth1  In  IP 10.0.29.3.44962 > 10.0.29.2.3784: BFDv1, Control, State Up, Flags: [none], length: 24
 00:00:28.525724 eth1  Out IP 10.0.29.2.55704 > 10.0.29.3.3784: BFDv1, Control, State Up, Flags: [none], length: 24
 00:00:28.586160 eth1  In  IP 10.0.29.3.44962 > 10.0.29.2.3784: BFDv1, Control, State Up, Flags: [none], length: 24
 00:00:28.604646 eth1  Out IP 10.0.29.2.55704 > 10.0.29.3.3784: BFDv1, Control, State Up, Flags: [none], length: 24
 00:00:28.671007 eth1  In  IP 10.0.29.3.44962 > 10.0.29.2.3784: BFDv1, Control, State Up, Flags: [none], length: 24
 00:00:28.684230 eth1  Out IP 10.0.29.2.55704 > 10.0.29.3.3784: BFDv1, Control, State Up, Flags: [none], length: 24
 00:00:28.750394 eth1  In  IP 10.0.29.3.44962 > 10.0.29.2.3784: BFDv1, Control, State Up, Flags: [none], length: 24
 00:00:28.768613 eth1  Out IP 10.0.29.2.55704 > 10.0.29.3.3784: BFDv1, Control, State Up, Flags: [none], length: 24
 00:00:28.837896 eth1  In  IP 10.0.29.3.44962 > 10.0.29.2.3784: BFDv1, Control, State Up, Flags: [none], length: 24
 00:00:28.852235 eth1  Out IP 10.0.29.2.55704 > 10.0.29.3.3784: BFDv1, Control, State Up, Flags: [none], length: 24
 00:00:28.921277 eth1  In  IP 10.0.29.3.44962 > 10.0.29.2.3784: BFDv1, Control, State Up, Flags: [none], length: 24
 00:00:28.933623 eth1  Out IP 10.0.29.2.55704 > 10.0.29.3.3784: BFDv1, Control, State Up, Flags: [none], length: 24
 00:00:28.997659 eth1  In  IP 10.0.29.3.44962 > 10.0.29.2.3784: BFDv1, Control, State Up, Flags: [none], length: 24
 00:00:29.010887 eth1  Out IP 10.0.29.2.55704 > 10.0.29.3.3784: BFDv1, Control, State Up, Flags: [none], length: 24
 00:00:29.082988 eth1  In  IP 10.0.29.3.44962 > 10.0.29.2.3784: BFDv1, Control, State Up, Flags: [none], length: 24
 00:00:29.100242 eth1  Out IP 10.0.29.2.55704 > 10.0.29.3.3784: BFDv1, Control, State Up, Flags: [none], length: 24
 00:00:29.172370 eth1  In  IP 10.0.29.3.44962 > 10.0.29.2.3784: BFDv1, Control, State Up, Flags: [none], length: 24
 00:00:29.187680 eth1  Out IP 10.0.29.2.55704 > 10.0.29.3.3784: BFDv1, Control, State Up, Flags: [none], length: 24
 00:00:29.249735 eth1  In  IP 10.0.29.3.44962 > 10.0.29.2.3784: BFDv1, Control, State Up, Flags: [none], length: 24
 00:00:29.274986 eth1  Out IP 10.0.29.2.55704 > 10.0.29.3.3784: BFDv1, Control, State Up, Flags: [none], length: 24
 00:00:29.325189 eth1  In  IP 10.0.29.3.44962 > 10.0.29.2.3784: BFDv1, Control, State Up, Flags: [none], length: 24
 00:00:29.354446 eth1  Out IP 10.0.29.2.55704 > 10.0.29.3.3784: BFDv1, Control, State Up, Flags: [none], length: 24
 00:00:29.412509 eth1  In  IP 10.0.29.3.44962 > 10.0.29.2.3784: BFDv1, Control, State Up, Flags: [none], length: 24
 00:00:29.432759 eth1  Out IP 10.0.29.2.55704 > 10.0.29.3.3784: BFDv1, Control, State Up, Flags: [none], length: 24
 00:00:29.489805 eth1  In  IP 10.0.29.3.44962 > 10.0.29.2.3784: BFDv1, Control, State Up, Flags: [none], length: 24
 00:00:29.521084 eth1  Out IP 10.0.29.2.55704 > 10.0.29.3.3784: BFDv1, Control, State Up, Flags: [none], length: 24
 00:00:29.577538 eth1  In  IP 10.0.29.3.44962 > 10.0.29.2.3784: BFDv1, Control, State Up, Flags: [none], length: 24
 00:00:29.609462 eth1  Out IP 10.0.29.2.55704 > 10.0.29.3.3784: BFDv1, Control, State Up, Flags: [none], length: 24
 00:00:29.656812 eth1  In  IP 10.0.29.3.44962 > 10.0.29.2.3784: BFDv1, Control, State Up, Flags: [none], length: 24
 00:00:29.690451 eth1  Out IP 10.0.29.2.55704 > 10.0.29.3.3784: BFDv1, Control, State Up, Flags: [none], length: 24
 00:00:29.742040 eth1  In  IP 10.0.29.3.44962 > 10.0.29.2.3784: BFDv1, Control, State Up, Flags: [none], length: 24
 00:00:29.767315 eth1  Out IP 10.0.29.2.55704 > 10.0.29.3.3784: BFDv1, Control, State Up, Flags: [none], length: 24
 00:00:29.817670 eth1  In  IP 10.0.29.3.44962 > 10.0.29.2.3784: BFDv1, Control, State Up, Flags: [none], length: 24
 00:00:29.842949 eth1  Out IP 10.0.29.2.55704 > 10.0.29.3.3784: BFDv1, Control, State Up, Flags: [none], length: 24
 00:00:29.902139 eth1  In  IP 10.0.29.3.44962 > 10.0.29.2.3784: BFDv1, Control, State Up, Flags: [none], length: 24
 00:00:29.926593 eth1  Out IP 10.0.29.2.55704 > 10.0.29.3.3784: BFDv1, Control, State Up, Flags: [none], length: 24
 00:00:29.983735 eth1  In  IP 10.0.29.3.44962 > 10.0.29.2.3784: BFDv1, Control, State Up, Flags: [none], length: 24
 00:00:30.013968 eth1  Out IP 10.0.29.2.55704 > 10.0.29.3.3784: BFDv1, Control, State Up, Flags: [none], length: 24
 00:00:30.058936 eth1  In  IP 10.0.29.3.44962 > 10.0.29.2.3784: BFDv1, Control, State Up, Flags: [none], length: 24
 00:00:30.089239 eth1  Out IP 10.0.29.2.55704 > 10.0.29.3.3784: BFDv1, Control, State Up, Flags: [none], length: 24
 00:00:30.143501 eth1  In  IP 10.0.29.3.44962 > 10.0.29.2.3784: BFDv1, Control, State Up, Flags: [none], length: 24
 00:00:30.175758 eth1  Out IP 10.0.29.2.55704 > 10.0.29.3.3784: BFDv1, Control, State Up, Flags: [none], length: 24
 00:00:30.232448 eth1  In  IP 10.0.29.3.44962 > 10.0.29.2.3784: BFDv1, Control, State Up, Flags: [none], length: 24
566 packets captured
568 packets received by filter
0 packets dropped by kernel

