tcpdump: data link type LINUX_SLL2
tcpdump: verbose output suppressed, use -v[v]... for full protocol decode
listening on any, link-type LINUX_SLL2 (Linux cooked v2), snapshot length 262144 bytes
 00:00:00.000000 eth1  Out IP 10.0.23.3.33242 > 10.0.23.2.3784: BFDv1, Control, State Up, Flags: [none], length: 24
 00:00:00.009194 eth1  In  IP 10.0.23.2.57325 > 10.0.23.3.3784: BFDv1, Control, State Up, Flags: [none], length: 24
 00:00:00.020494 eth0  Out IP 10.0.13.3.41618 > 10.0.13.2.3784: BFDv1, Control, State Up, Flags: [none], length: 24
 00:00:00.025704 eth0  In  IP 10.0.13.2.57029 > 10.0.13.3.3784: BFDv1, Control, State Up, Flags: [none], length: 24
 00:00:00.028851 eth2  In  IP 10.0.34.3.49252 > 10.0.34.2.3784: BFDv1, Control, State Up, Flags: [none], length: 24
 00:00:00.029000 eth2  Out IP 10.0.34.2.47035 > 10.0.34.3.3784: BFDv1, Control, State Up, Flags: [none], length: 24
 00:00:00.035228 eth3  Out IP 10.0.35.2.60297 > 10.0.35.3.3784: BFDv1, Control, State Up, Flags: [none], length: 24
 00:00:00.046544 eth3  In  IP 10.0.35.3.46520 > 10.0.35.2.3784: BFDv1, Control, State Up, Flags: [none], length: 24
 00:00:00.082987 eth1  Out IP 10.0.23.3.33242 > 10.0.23.2.3784: BFDv1, Control, State Up, Flags: [none], length: 24
 00:00:00.098307 eth1  In  IP 10.0.23.2.57325 > 10.0.23.3.3784: BFDv1, Control, State Up, Flags: [none], length: 24
 00:00:00.105620 eth0  Out IP 10.0.13.3.41618 > 10.0.13.2.3784: BFDv1, Control, State Up, Flags: [none], length: 24
 00:00:00.113931 eth2  Out IP 10.0.34.2.47035 > 10.0.34.3.3784: BFDv1, Control, State Up, Flags: [none], length: 24
 00:00:00.114067 eth2  In  IP 10.0.34.3.49252 > 10.0.34.2.3784: BFDv1, Control, State Up, Flags: [none], length: 24
 00:00:00.115826 eth0  In  IP 10.0.13.2.57029 > 10.0.13.3.3784: BFDv1, Control, State Up, Flags: [none], length: 24
 00:00:00.122307 eth3  Out IP 10.0.35.2.60297 > 10.0.35.3.3784: BFDv1, Control, State Up, Flags: [none], length: 24
 00:00:00.132574 eth3  In  IP 10.0.35.3.46520 > 10.0.35.2.3784: BFDv1, Control, State Up, Flags: [none], length: 24
 00:00:00.164061 eth1  Out IP 10.0.23.3.33242 > 10.0.23.2.3784: BFDv1, Control, State Up, Flags: [none], length: 24
 00:00:00.179495 eth1  In  IP 10.0.23.2.57325 > 10.0.23.3.3784: BFDv1, Control, State Up, Flags: [none], length: 24
 00:00:00.188134 eth0  Out IP 10.0.13.3.41618 > 10.0.13.2.3784: BFDv1, Control, State Up, Flags: [none], length: 24
 00:00:00.192473 eth0  In  IP 10.0.13.2.57029 > 10.0.13.3.3784: BFDv1, Control, State Up, Flags: [none], length: 24
 00:00:00.196933 eth2  Out IP 10.0.34.2.47035 > 10.0.34.3.3784: BFDv1, Control, State Up, Flags: [none], length: 24
 00:00:00.198260 eth2  In  IP 10.0.34.3.49252 > 10.0.34.2.3784: BFDv1, Control, State Up, Flags: [none], length: 24
 00:00:00.202661 eth3  Out IP 10.0.35.2.60297 > 10.0.35.3.3784: BFDv1, Control, State Up, Flags: [none], length: 24
 00:00:00.208902 eth3  In  IP 10.0.35.3.46520 > 10.0.35.2.3784: BFDv1, Control, State Up, Flags: [none], length: 24
 00:00:00.251243 eth1  Out IP 10.0.23.3.33242 > 10.0.23.2.3784: BFDv1, Control, State Up, Flags: [none], length: 24
 00:00:00.264637 eth1  In  IP 10.0.23.2.57325 > 10.0.23.3.3784: BFDv1, Control, State Up, Flags: [none], length: 24
 00:00:00.272630 eth0  In  IP 10.0.13.2.57029 > 10.0.13.3.3784: BFDv1, Control, State Up, Flags: [none], length: 24
 00:00:00.272842 eth2  Out IP 10.0.34.2.47035 > 10.0.34.3.3784: BFDv1, Control, State Up, Flags: [none], length: 24
 00:00:00.275016 eth0  Out IP 10.0.13.3.41618 > 10.0.13.2.3784: BFDv1, Control, State Up, Flags: [none], length: 24
 00:00:00.276214 eth2  In  IP 10.0.34.3.49252 > 10.0.34.2.3784: BFDv1, Control, State Up, Flags: [none], length: 24
 00:00:00.282622 eth3  Out IP 10.0.35.2.60297 > 10.0.35.3.3784: BFDv1, Control, State Up, Flags: [none], length: 24
 00:00:00.297032 eth3  In  IP 10.0.35.3.46520 > 10.0.35.2.3784: BFDv1, Control, State Up, Flags: [none], length: 24
 00:00:00.334394 eth1  Out IP 10.0.23.3.33242 > 10.0.23.2.3784: BFDv1, Control, State Up, Flags: [none], length: 24
 00:00:00.347303 eth1  In  IP 10.0.23.2.57325 > 10.0.23.3.3784: BFDv1, Control, State Up, Flags: [none], length: 24
 00:00:00.354857 eth0  In  IP 10.0.13.2.57029 > 10.0.13.3.3784: BFDv1, Control, State Up, Flags: [none], length: 24
 00:00:00.361245 eth2  Out IP 10.0.34.2.47035 > 10.0.34.3.3784: BFDv1, Control, State Up, Flags: [none], length: 24
 00:00:00.362462 eth0  Out IP 10.0.13.3.41618 > 10.0.13.2.3784: BFDv1, Control, State Up, Flags: [none], length: 24
 00:00:00.363452 eth2  In  IP 10.0.34.3.49252 > 10.0.34.2.3784: BFDv1, Control, State Up, Flags: [none], length: 24
 00:00:00.365679 eth3  Out IP 10.0.35.2.60297 > 10.0.35.3.3784: BFDv1, Control, State Up, Flags: [none], length: 24
 00:00:00.376901 eth3  In  IP 10.0.35.3.46520 > 10.0.35.2.3784: BFDv1, Control, State Up, Flags: [none], length: 24
 00:00:00.413285 eth1  Out IP 10.0.23.3.33242 > 10.0.23.2.3784: BFDv1, Control, State Up, Flags: [none], length: 24
 00:00:00.425698 eth1  In  IP 10.0.23.2.57325 > 10.0.23.3.3784: BFDv1, Control, State Up, Flags: [none], length: 24
 00:00:00.434493 eth0  In  IP 10.0.13.2.57029 > 10.0.13.3.3784: BFDv1, Control, State Up, Flags: [none], length: 24
 00:00:00.441891 eth3  Out IP 10.0.35.2.60297 > 10.0.35.3.3784: BFDv1, Control, State Up, Flags: [none], length: 24
 00:00:00.441962 eth2  Out IP 10.0.34.2.47035 > 10.0.34.3.3784: BFDv1, Control, State Up, Flags: [none], length: 24
 00:00:00.444387 eth2  In  IP 10.0.34.3.49252 > 10.0.34.2.3784: BFDv1, Control, State Up, Flags: [none], length: 24
 00:00:00.450869 eth0  Out IP 10.0.13.3.41618 > 10.0.13.2.3784: BFDv1, Control, State Up, Flags: [none], length: 24
 00:00:00.460189 eth3  In  IP 10.0.35.3.46520 > 10.0.35.2.3784: BFDv1, Control, State Up, Flags: [none], length: 24
 00:00:00.491577 eth1  Out IP 10.0.23.3.33242 > 10.0.23.2.3784: BFDv1, Control, State Up, Flags: [none], length: 24
 00:00:00.510827 eth0  In  IP 10.0.13.2.57029 > 10.0.13.3.3784: BFDv1, Control, State Up, Flags: [none], length: 24
 00:00:00.515674 eth1  In  IP 10.0.23.2.57325 > 10.0.23.3.3784: BFDv1, Control, State Up, Flags: [none], length: 24
 00:00:00.525975 eth2  Out IP 10.0.34.2.47035 > 10.0.34.3.3784: BFDv1, Control, State Up, Flags: [none], length: 24
 00:00:00.529244 eth3  Out IP 10.0.35.2.60297 > 10.0.35.3.3784: BFDv1, Control, State Up, Flags: [none], length: 24
 00:00:00.530468 eth0  Out IP 10.0.13.3.41618 > 10.0.13.2.3784: BFDv1, Control, State Up, Flags: [none], length: 24
 00:00:00.534192 eth2  In  IP 10.0.34.3.49252 > 10.0.34.2.3784: BFDv1, Control, State Up, Flags: [none], length: 24
 00:00:00.538494 eth3  In  IP 10.0.35.3.46520 > 10.0.35.2.3784: BFDv1, Control, State Up, Flags: [none], length: 24
 00:00:00.576927 eth1  Out IP 10.0.23.3.33242 > 10.0.23.2.3784: BFDv1, Control, State Up, Flags: [none], length: 24
 00:00:00.595648 eth1  In  IP 10.0.23.2.57325 > 10.0.23.3.3784: BFDv1, Control, State Up, Flags: [none], length: 24
 00:00:00.596966 eth0  In  IP 10.0.13.2.57029 > 10.0.13.3.3784: BFDv1, Control, State Up, Flags: [none], length: 24
 00:00:00.602319 eth2  Out IP 10.0.34.2.47035 > 10.0.34.3.3784: BFDv1, Control, State Up, Flags: [none], length: 24
 00:00:00.605561 eth3  Out IP 10.0.35.2.60297 > 10.0.35.3.3784: BFDv1, Control, State Up, Flags: [none], length: 24
 00:00:00.613796 eth0  Out IP 10.0.13.3.41618 > 10.0.13.2.3784: BFDv1, Control, State Up, Flags: [none], length: 24
 00:00:00.621684 eth2  In  IP 10.0.34.3.49252 > 10.0.34.2.3784: BFDv1, Control, State Up, Flags: [none], length: 24
 00:00:00.627812 eth3  In  IP 10.0.35.3.46520 > 10.0.35.2.3784: BFDv1, Control, State Up, Flags: [none], length: 24
 00:00:00.656262 eth1  Out IP 10.0.23.3.33242 > 10.0.23.2.3784: BFDv1, Control, State Up, Flags: [none], length: 24
 00:00:00.678046 eth1  In  IP 10.0.23.2.57325 > 10.0.23.3.3784: BFDv1, Control, State Up, Flags: [none], length: 24
 00:00:00.682415 eth0  In  IP 10.0.13.2.57029 > 10.0.13.3.3784: BFDv1, Control, State Up, Flags: [none], length: 24
 00:00:00.686744 eth2  Out IP 10.0.34.2.47035 > 10.0.34.3.3784: BFDv1, Control, State Up, Flags: [none], length: 24
 00:00:00.694964 eth3  Out IP 10.0.35.2.60297 > 10.0.35.3.3784: BFDv1, Control, State Up, Flags: [none], length: 24
 00:00:00.697960 eth2  In  IP 10.0.34.3.49252 > 10.0.34.2.3784: BFDv1, Control, State Up, Flags: [none], length: 24
 00:00:00.700273 eth0  Out IP 10.0.13.3.41618 > 10.0.13.2.3784: BFDv1, Control, State Up, Flags: [none], length: 24
 00:00:00.710211 eth3  In  IP 10.0.35.3.46520 > 10.0.35.2.3784: BFDv1, Control, State Up, Flags: [none], length: 24
 00:00:00.734595 eth1  Out IP 10.0.23.3.33242 > 10.0.23.2.3784: BFDv1, Control, State Up, Flags: [none], length: 24
 00:00:00.756246 eth1  In  IP 10.0.23.2.57325 > 10.0.23.3.3784: BFDv1, Control, State Up, Flags: [none], length: 24
 00:00:00.766907 eth0  In  IP 10.0.13.2.57029 > 10.0.13.3.3784: BFDv1, Control, State Up, Flags: [none], length: 24
 00:00:00.771272 eth2  Out IP 10.0.34.2.47035 > 10.0.34.3.3784: BFDv1, Control, State Up, Flags: [none], length: 24
 00:00:00.772529 eth2  In  IP 10.0.34.3.49252 > 10.0.34.2.3784: BFDv1, Control, State Up, Flags: [none], length: 24
 00:00:00.777810 eth3  Out IP 10.0.35.2.60297 > 10.0.35.3.3784: BFDv1, Control, State Up, Flags: [none], length: 24
 00:00:00.785349 eth0  Out IP 10.0.13.3.41618 > 10.0.13.2.3784: BFDv1, Control, State Up, Flags: [none], length: 24
 00:00:00.798087 eth3  In  IP 10.0.35.3.46520 > 10.0.35.2.3784: BFDv1, Control, State Up, Flags: [none], length: 24
 00:00:00.811504 eth1  Out IP 10.0.23.3.33242 > 10.0.23.2.3784: BFDv1, Control, State Up, Flags: [none], length: 24
 00:00:00.838408 eth1  In  IP 10.0.23.2.57325 > 10.0.23.3.3784: BFDv1, Control, State Up, Flags: [none], length: 24
 00:00:00.846727 eth2  Out IP 10.0.34.2.47035 > 10.0.34.3.3784: BFDv1, Control, State Up, Flags: [none], length: 24
 00:00:00.851826 eth0  In  IP 10.0.13.2.57029 > 10.0.13.3.3784: BFDv1, Control, State Up, Flags: [none], length: 24
 00:00:00.853237 eth3  Out IP 10.0.35.2.60297 > 10.0.35.3.3784: BFDv1, Control, State Up, Flags: [none], length: 24
 00:00:00.858861 eth2  In  IP 10.0.34.3.49252 > 10.0.34.2.3784: BFDv1, Control, State Up, Flags: [none], length: 24
 00:00:00.873261 eth0  Out IP 10.0.13.3.41618 > 10.0.13.2.3784: BFDv1, Control, State Up, Flags: [none], length: 24
 00:00:00.879510 eth3  In  IP 10.0.35.3.46520 > 10.0.35.2.3784: BFDv1, Control, State Up, Flags: [none], length: 24
 00:00:00.899944 eth1  Out IP 10.0.23.3.33242 > 10.0.23.2.3784: BFDv1, Control, State Up, Flags: [none], length: 24
 00:00:00.917808 eth1  In  IP 10.0.23.2.57325 > 10.0.23.3.3784: BFDv1, Control, State Up, Flags: [none], length: 24
 00:00:00.923182 eth2  Out IP 10.0.34.2.47035 > 10.0.34.3.3784: BFDv1, Control, State Up, Flags: [none], length: 24
 00:00:00.930437 eth3  Out IP 10.0.35.2.60297 > 10.0.35.3.3784: BFDv1, Control, State Up, Flags: [none], length: 24
 00:00:00.935865 eth0  In  IP 10.0.13.2.57029 > 10.0.13.3.3784: BFDv1, Control, State Up, Flags: [none], length: 24
 00:00:00.942463 eth2  In  IP 10.0.34.3.49252 > 10.0.34.2.3784: BFDv1, Control, State Up, Flags: [none], length: 24
 00:00:00.954835 eth0  Out IP 10.0.13.3.41618 > 10.0.13.2.3784: BFDv1, Control, State Up, Flags: [none], length: 24
 00:00:00.966775 eth3  In  IP 10.0.35.3.46520 > 10.0.35.2.3784: BFDv1, Control, State Up, Flags: [none], length: 24
 00:00:00.989313 eth1  Out IP 10.0.23.3.33242 > 10.0.23.2.3784: BFDv1, Control, State Up, Flags: [none], length: 24
 00:00:01.005042 eth1  In  IP 10.0.23.2.57325 > 10.0.23.3.3784: BFDv1, Control, State Up, Flags: [none], length: 24
 00:00:01.006379 eth3  Out IP 10.0.35.2.60297 > 10.0.35.3.3784: BFDv1, Control, State Up, Flags: [none], length: 24
 00:00:01.012076 eth0  In  IP 10.0.13.2.57029 > 10.0.13.3.3784: BFDv1, Control, State Up, Flags: [none], length: 24
 00:00:01.012348 eth2  Out IP 10.0.34.2.47035 > 10.0.34.3.3784: BFDv1, Control, State Up, Flags: [none], length: 24
 00:00:01.020572 eth2  In  IP 10.0.34.3.49252 > 10.0.34.2.3784: BFDv1, Control, State Up, Flags: [none], length: 24
 00:00:01.033138 eth0  Out IP 10.0.13.3.41618 > 10.0.13.2.3784: BFDv1, Control, State Up, Flags: [none], length: 24
 00:00:01.055897 eth3  In  IP 10.0.35.3.46520 > 10.0.35.2.3784: BFDv1, Control, State Up, Flags: [none], length: 24
 00:00:01.069357 eth1  Out IP 10.0.23.3.33242 > 10.0.23.2.3784: BFDv1, Control, State Up, Flags: [none], length: 24
 00:00:01.088245 eth1  In  IP 10.0.23.2.57325 > 10.0.23.3.3784: BFDv1, Control, State Up, Flags: [none], length: 24
 00:00:01.091620 eth2  Out IP 10.0.34.2.47035 > 10.0.34.3.3784: BFDv1, Control, State Up, Flags: [none], length: 24
 00:00:01.093869 eth3  Out IP 10.0.35.2.60297 > 10.0.35.3.3784: BFDv1, Control, State Up, Flags: [none], length: 24
 00:00:01.096859 eth2  In  IP 10.0.34.3.49252 > 10.0.34.2.3784: BFDv1, Control, State Up, Flags: [none], length: 24
 00:00:01.101231 eth0  In  IP 10.0.13.2.57029 > 10.0.13.3.3784: BFDv1, Control, State Up, Flags: [none], length: 24
 00:00:01.116589 eth0  Out IP 10.0.13.3.41618 > 10.0.13.2.3784: BFDv1, Control, State Up, Flags: [none], length: 24
 00:00:01.143490 eth3  In  IP 10.0.35.3.46520 > 10.0.35.2.3784: BFDv1, Control, State Up, Flags: [none], length: 24
 00:00:01.154849 eth1  Out IP 10.0.23.3.33242 > 10.0.23.2.3784: BFDv1, Control, State Up, Flags: [none], length: 24
 00:00:01.172399 eth1  In  IP 10.0.23.2.57325 > 10.0.23.3.3784: BFDv1, Control, State Up, Flags: [none], length: 24
 00:00:01.177881 eth2  Out IP 10.0.34.2.47035 > 10.0.34.3.3784: BFDv1, Control, State Up, Flags: [none], length: 24
 00:00:01.179533 eth0  In  IP 10.0.13.2.57029 > 10.0.13.3.3784: BFDv1, Control, State Up, Flags: [none], length: 24
 00:00:01.182059 eth3  Out IP 10.0.35.2.60297 > 10.0.35.3.3784: BFDv1, Control, State Up, Flags: [none], length: 24
 00:00:01.186162 eth2  In  IP 10.0.34.3.49252 > 10.0.34.2.3784: BFDv1, Control, State Up, Flags: [none], length: 24
 00:00:01.196538 eth0  Out IP 10.0.13.3.41618 > 10.0.13.2.3784: BFDv1, Control, State Up, Flags: [none], length: 24
 00:00:01.229786 eth3  In  IP 10.0.35.3.46520 > 10.0.35.2.3784: BFDv1, Control, State Up, Flags: [none], length: 24
 00:00:01.243132 eth1  Out IP 10.0.23.3.33242 > 10.0.23.2.3784: BFDv1, Control, State Up, Flags: [none], length: 24
 00:00:01.258633 eth1  In  IP 10.0.23.2.57325 > 10.0.23.3.3784: BFDv1, Control, State Up, Flags: [none], length: 24
 00:00:01.260691 eth0  In  IP 10.0.13.2.57029 > 10.0.13.3.3784: BFDv1, Control, State Up, Flags: [none], length: 24
 00:00:01.267455 eth2  Out IP 10.0.34.2.47035 > 10.0.34.3.3784: BFDv1, Control, State Up, Flags: [none], length: 24
 00:00:01.269689 eth3  Out IP 10.0.35.2.60297 > 10.0.35.3.3784: BFDv1, Control, State Up, Flags: [none], length: 24
 00:00:01.273934 eth0  Out IP 10.0.13.3.41618 > 10.0.13.2.3784: BFDv1, Control, State Up, Flags: [none], length: 24
 00:00:01.274784 eth2  In  IP 10.0.34.3.49252 > 10.0.34.2.3784: BFDv1, Control, State Up, Flags: [none], length: 24
 00:00:01.318420 eth3  In  IP 10.0.35.3.46520 > 10.0.35.2.3784: BFDv1, Control, State Up, Flags: [none], length: 24
 00:00:01.325739 eth1  Out IP 10.0.23.3.33242 > 10.0.23.2.3784: BFDv1, Control, State Up, Flags: [none], length: 24
 00:00:01.336339 eth1  In  IP 10.0.23.2.57325 > 10.0.23.3.3784: BFDv1, Control, State Up, Flags: [none], length: 24
 00:00:01.349662 eth0  In  IP 10.0.13.2.57029 > 10.0.13.3.3784: BFDv1, Control, State Up, Flags: [none], length: 24
 00:00:01.353990 eth2  Out IP 10.0.34.2.47035 > 10.0.34.3.3784: BFDv1, Control, State Up, Flags: [none], length: 24
 00:00:01.358280 eth3  Out IP 10.0.35.2.60297 > 10.0.35.3.3784: BFDv1, Control, State Up, Flags: [none], length: 24
 00:00:01.359418 eth0  Out IP 10.0.13.3.41618 > 10.0.13.2.3784: BFDv1, Control, State Up, Flags: [none], length: 24
 00:00:01.360290 eth2  In  IP 10.0.34.3.49252 > 10.0.34.2.3784: BFDv1, Control, State Up, Flags: [none], length: 24
 00:00:01.401956 eth3  In  IP 10.0.35.3.46520 > 10.0.35.2.3784: BFDv1, Control, State Up, Flags: [none], length: 24
 00:00:01.407282 eth1  Out IP 10.0.23.3.33242 > 10.0.23.2.3784: BFDv1, Control, State Up, Flags: [none], length: 24
 00:00:01.423175 eth1  In  IP 10.0.23.2.57325 > 10.0.23.3.3784: BFDv1, Control, State Up, Flags: [none], length: 24
 00:00:01.434354 eth0  In  IP 10.0.13.2.57029 > 10.0.13.3.3784: BFDv1, Control, State Up, Flags: [none], length: 24
 00:00:01.435757 eth2  Out IP 10.0.34.2.47035 > 10.0.34.3.3784: BFDv1, Control, State Up, Flags: [none], length: 24
 00:00:01.439029 eth3  Out IP 10.0.35.2.60297 > 10.0.35.3.3784: BFDv1, Control, State Up, Flags: [none], length: 24
 00:00:01.439031 eth2  In  IP 10.0.34.3.49252 > 10.0.34.2.3784: BFDv1, Control, State Up, Flags: [none], length: 24
 00:00:01.442369 eth0  Out IP 10.0.13.3.41618 > 10.0.13.2.3784: BFDv1, Control, State Up, Flags: [none], length: 24
 00:00:01.479917 eth3  In  IP 10.0.35.3.46520 > 10.0.35.2.3784: BFDv1, Control, State Up, Flags: [none], length: 24
 00:00:01.489263 eth1  Out IP 10.0.23.3.33242 > 10.0.23.2.3784: BFDv1, Control, State Up, Flags: [none], length: 24
 00:00:01.510049 eth0  In  IP 10.0.13.2.57029 > 10.0.13.3.3784: BFDv1, Control, State Up, Flags: [none], length: 24
 00:00:01.510867 eth1  In  IP 10.0.23.2.57325 > 10.0.23.3.3784: BFDv1, Control, State Up, Flags: [none], length: 24
 00:00:01.517209 eth2  Out IP 10.0.34.2.47035 > 10.0.34.3.3784: BFDv1, Control, State Up, Flags: [none], length: 24
 00:00:01.519391 eth3  Out IP 10.0.35.2.60297 > 10.0.35.3.3784: BFDv1, Control, State Up, Flags: [none], length: 24
 00:00:01.522593 eth0  Out IP 10.0.13.3.41618 > 10.0.13.2.3784: BFDv1, Control, State Up, Flags: [none], length: 24
 00:00:01.528449 eth2  In  IP 10.0.34.3.49252 > 10.0.34.2.3784: BFDv1, Control, State Up, Flags: [none], length: 24
 00:00:01.560812 eth3  In  IP 10.0.35.3.46520 > 10.0.35.2.3784: BFDv1, Control, State Up, Flags: [none], length: 24
 00:00:01.571186 eth1  Out IP 10.0.23.3.33242 > 10.0.23.2.3784: BFDv1, Control, State Up, Flags: [none], length: 24
 00:00:01.593833 eth1  In  IP 10.0.23.2.57325 > 10.0.23.3.3784: BFDv1, Control, State Up, Flags: [none], length: 24
 00:00:01.595829 eth0  In  IP 10.0.13.2.57029 > 10.0.13.3.3784: BFDv1, Control, State Up, Flags: [none], length: 24
 00:00:01.599153 eth2  Out IP 10.0.34.2.47035 > 10.0.34.3.3784: BFDv1, Control, State Up, Flags: [none], length: 24
 00:00:01.604393 eth0  Out IP 10.0.13.3.41618 > 10.0.13.2.3784: BFDv1, Control, State Up, Flags: [none], length: 24
 00:00:01.605603 eth3  Out IP 10.0.35.2.60297 > 10.0.35.3.3784: BFDv1, Control, State Up, Flags: [none], length: 24
 00:00:01.606697 eth2  In  IP 10.0.34.3.49252 > 10.0.34.2.3784: BFDv1, Control, State Up, Flags: [none], length: 24
 00:00:01.639961 eth3  In  IP 10.0.35.3.46520 > 10.0.35.2.3784: BFDv1, Control, State Up, Flags: [none], length: 24
 00:00:01.654335 eth1  Out IP 10.0.23.3.33242 > 10.0.23.2.3784: BFDv1, Control, State Up, Flags: [none], length: 24
 00:00:01.672211 eth1  In  IP 10.0.23.2.57325 > 10.0.23.3.3784: BFDv1, Control, State Up, Flags: [none], length: 24
 00:00:01.682037 eth0  In  IP 10.0.13.2.57029 > 10.0.13.3.3784: BFDv1, Control, State Up, Flags: [none], length: 24
 00:00:01.686375 eth2  Out IP 10.0.34.2.47035 > 10.0.34.3.3784: BFDv1, Control, State Up, Flags: [none], length: 24
 00:00:01.689607 eth0  Out IP 10.0.13.3.41618 > 10.0.13.2.3784: BFDv1, Control, State Up, Flags: [none], length: 24
 00:00:01.689615 eth2  In  IP 10.0.34.3.49252 > 10.0.34.2.3784: BFDv1, Control, State Up, Flags: [none], length: 24
 00:00:01.693864 eth3  Out IP 10.0.35.2.60297 > 10.0.35.3.3784: BFDv1, Control, State Up, Flags: [none], length: 24
 00:00:01.723324 eth3  In  IP 10.0.35.3.46520 > 10.0.35.2.3784: BFDv1, Control, State Up, Flags: [none], length: 24
 00:00:01.738689 eth1  Out IP 10.0.23.3.33242 > 10.0.23.2.3784: BFDv1, Control, State Up, Flags: [none], length: 24
 00:00:01.759284 eth0  In  IP 10.0.13.2.57029 > 10.0.13.3.3784: BFDv1, Control, State Up, Flags: [none], length: 24
 00:00:01.760543 eth1  In  IP 10.0.23.2.57325 > 10.0.23.3.3784: BFDv1, Control, State Up, Flags: [none], length: 24
 00:00:01.768864 eth2  In  IP 10.0.34.3.49252 > 10.0.34.2.3784: BFDv1, Control, State Up, Flags: [none], length: 24
 00:00:01.770201 eth0  Out IP 10.0.13.3.41618 > 10.0.13.2.3784: BFDv1, Control, State Up, Flags: [none], length: 24
 00:00:01.772408 eth3  Out IP 10.0.35.2.60297 > 10.0.35.3.3784: BFDv1, Control, State Up, Flags: [none], length: 24
 00:00:01.774622 eth2  Out IP 10.0.34.2.47035 > 10.0.34.3.3784: BFDv1, Control, State Up, Flags: [none], length: 24
 00:00:01.804909 eth3  In  IP 10.0.35.3.46520 > 10.0.35.2.3784: BFDv1, Control, State Up, Flags: [none], length: 24
 00:00:01.823299 eth1  Out IP 10.0.23.3.33242 > 10.0.23.2.3784: BFDv1, Control, State Up, Flags: [none], length: 24
 00:00:01.837335 eth0  In  IP 10.0.13.2.57029 > 10.0.13.3.3784: BFDv1, Control, State Up, Flags: [none], length: 24
 00:00:01.843755 eth2  In  IP 10.0.34.3.49252 > 10.0.34.2.3784: BFDv1, Control, State Up, Flags: [none], length: 24
 00:00:01.844579 eth1  In  IP 10.0.23.2.57325 > 10.0.23.3.3784: BFDv1, Control, State Up, Flags: [none], length: 24
 00:00:01.848892 eth0  Out IP 10.0.13.3.41618 > 10.0.13.2.3784: BFDv1, Control, State Up, Flags: [none], length: 24
 00:00:01.857149 eth3  Out IP 10.0.35.2.60297 > 10.0.35.3.3784: BFDv1, Control, State Up, Flags: [none], length: 24
 00:00:01.857224 eth2  Out IP 10.0.34.2.47035 > 10.0.34.3.3784: BFDv1, Control, State Up, Flags: [none], length: 24
 00:00:01.883569 eth3  In  IP 10.0.35.3.46520 > 10.0.35.2.3784: BFDv1, Control, State Up, Flags: [none], length: 24
 00:00:01.900864 eth1  Out IP 10.0.23.3.33242 > 10.0.23.2.3784: BFDv1, Control, State Up, Flags: [none], length: 24
 00:00:01.921570 eth0  In  IP 10.0.13.2.57029 > 10.0.13.3.3784: BFDv1, Control, State Up, Flags: [none], length: 24
 00:00:01.929683 eth2  In  IP 10.0.34.3.49252 > 10.0.34.2.3784: BFDv1, Control, State Up, Flags: [none], length: 24
 00:00:01.929878 eth0  Out IP 10.0.13.3.41618 > 10.0.13.2.3784: BFDv1, Control, State Up, Flags: [none], length: 24
 00:00:01.930647 eth1  In  IP 10.0.23.2.57325 > 10.0.23.3.3784: BFDv1, Control, State Up, Flags: [none], length: 24
 00:00:01.942053 eth3  Out IP 10.0.35.2.60297 > 10.0.35.3.3784: BFDv1, Control, State Up, Flags: [none], length: 24
 00:00:01.942150 eth2  Out IP 10.0.34.2.47035 > 10.0.34.3.3784: BFDv1, Control, State Up, Flags: [none], length: 24
 00:00:01.962486 eth3  In  IP 10.0.35.3.46520 > 10.0.35.2.3784: BFDv1, Control, State Up, Flags: [none], length: 24
 00:00:01.978986 eth1  Out IP 10.0.23.3.33242 > 10.0.23.2.3784: BFDv1, Control, State Up, Flags: [none], length: 24
 00:00:01.999253 eth0  In  IP 10.0.13.2.57029 > 10.0.13.3.3784: BFDv1, Control, State Up, Flags: [none], length: 24
 00:00:02.013653 eth0  Out IP 10.0.13.3.41618 > 10.0.13.2.3784: BFDv1, Control, State Up, Flags: [none], length: 24
 00:00:02.016722 eth1  In  IP 10.0.23.2.57325 > 10.0.23.3.3784: BFDv1, Control, State Up, Flags: [none], length: 24
 00:00:02.022036 eth3  Out IP 10.0.35.2.60297 > 10.0.35.3.3784: BFDv1, Control, State Up, Flags: [none], length: 24
 00:00:02.039645 eth3  In  IP 10.0.35.3.46520 > 10.0.35.2.3784: BFDv1, Control, State Up, Flags: [none], length: 24
 00:00:02.068977 eth1  Out IP 10.0.23.3.33242 > 10.0.23.2.3784: BFDv1, Control, State Up, Flags: [none], length: 24
 00:00:02.084963 eth0  In  IP 10.0.13.2.57029 > 10.0.13.3.3784: BFDv1, Control, State Up, Flags: [none], length: 24
 00:00:02.098323 eth3  Out IP 10.0.35.2.60297 > 10.0.35.3.3784: BFDv1, Control, State Up, Flags: [none], length: 24
 00:00:02.099645 eth0  Out IP 10.0.13.3.41618 > 10.0.13.2.3784: BFDv1, Control, State Up, Flags: [none], length: 24
 00:00:02.102046 eth1  In  IP 10.0.23.2.57325 > 10.0.23.3.3784: BFDv1, Control, State Up, Flags: [none], length: 24
 00:00:02.124744 eth3  In  IP 10.0.35.3.46520 > 10.0.35.2.3784: BFDv1, Control, State Up, Flags: [none], length: 24
 00:00:02.151163 eth1  Out IP 10.0.23.3.33242 > 10.0.23.2.3784: BFDv1, Control, State Up, Flags: [none], length: 24
 00:00:02.167086 eth0  In  IP 10.0.13.2.57029 > 10.0.13.3.3784: BFDv1, Control, State Up, Flags: [none], length: 24
 00:00:02.176410 eth3  Out IP 10.0.35.2.60297 > 10.0.35.3.3784: BFDv1, Control, State Up, Flags: [none], length: 24
 00:00:02.181637 eth0  Out IP 10.0.13.3.41618 > 10.0.13.2.3784: BFDv1, Control, State Up, Flags: [none], length: 24
 00:00:02.190132 eth1  In  IP 10.0.23.2.57325 > 10.0.23.3.3784: BFDv1, Control, State Up, Flags: [none], length: 24
 00:00:02.210771 eth3  In  IP 10.0.35.3.46520 > 10.0.35.2.3784: BFDv1, Control, State Up, Flags: [none], length: 24
 00:00:02.238058 eth1  Out IP 10.0.23.3.33242 > 10.0.23.2.3784: BFDv1, Control, State Up, Flags: [none], length: 24
 00:00:02.244975 eth0  In  IP 10.0.13.2.57029 > 10.0.13.3.3784: BFDv1, Control, State Up, Flags: [none], length: 24
 00:00:02.260217 eth3  Out IP 10.0.35.2.60297 > 10.0.35.3.3784: BFDv1, Control, State Up, Flags: [none], length: 24
 00:00:02.270450 eth0  Out IP 10.0.13.3.41618 > 10.0.13.2.3784: BFDv1, Control, State Up, Flags: [none], length: 24
 00:00:02.273745 eth1  In  IP 10.0.23.2.57325 > 10.0.23.3.3784: BFDv1, Control, State Up, Flags: [none], length: 24
 00:00:02.294536 eth3  In  IP 10.0.35.3.46520 > 10.0.35.2.3784: BFDv1, Control, State Up, Flags: [none], length: 24
 00:00:02.321848 eth1  Out IP 10.0.23.3.33242 > 10.0.23.2.3784: BFDv1, Control, State Up, Flags: [none], length: 24
 00:00:02.325465 eth0  In  IP 10.0.13.2.57029 > 10.0.13.3.3784: BFDv1, Control, State Up, Flags: [none], length: 24
 00:00:02.335744 eth3  Out IP 10.0.35.2.60297 > 10.0.35.3.3784: BFDv1, Control, State Up, Flags: [none], length: 24
 00:00:02.351946 eth0  Out IP 10.0.13.3.41618 > 10.0.13.2.3784: BFDv1, Control, State Up, Flags: [none], length: 24
 00:00:02.360814 eth1  In  IP 10.0.23.2.57325 > 10.0.23.3.3784: BFDv1, Control, State Up, Flags: [none], length: 24
 00:00:02.371943 eth3  In  IP 10.0.35.3.46520 > 10.0.35.2.3784: BFDv1, Control, State Up, Flags: [none], length: 24
 00:00:02.402239 eth1  Out IP 10.0.23.3.33242 > 10.0.23.2.3784: BFDv1, Control, State Up, Flags: [none], length: 24
 00:00:02.407361 eth0  In  IP 10.0.13.2.57029 > 10.0.13.3.3784: BFDv1, Control, State Up, Flags: [none], length: 24
 00:00:02.421648 eth3  Out IP 10.0.35.2.60297 > 10.0.35.3.3784: BFDv1, Control, State Up, Flags: [none], length: 24
 00:00:02.430874 eth0  Out IP 10.0.13.3.41618 > 10.0.13.2.3784: BFDv1, Control, State Up, Flags: [none], length: 24
 00:00:02.443732 eth1  In  IP 10.0.23.2.57325 > 10.0.23.3.3784: BFDv1, Control, State Up, Flags: [none], length: 24
 00:00:02.452867 eth3  In  IP 10.0.35.3.46520 > 10.0.35.2.3784: BFDv1, Control, State Up, Flags: [none], length: 24
 00:00:02.484649 eth0  In  IP 10.0.13.2.57029 > 10.0.13.3.3784: BFDv1, Control, State Up, Flags: [none], length: 24
 00:00:02.492009 eth1  Out IP 10.0.23.3.33242 > 10.0.23.2.3784: BFDv1, Control, State Up, Flags: [none], length: 24
 00:00:02.505228 eth3  Out IP 10.0.35.2.60297 > 10.0.35.3.3784: BFDv1, Control, State Up, Flags: [none], length: 24
 00:00:02.515454 eth0  Out IP 10.0.13.3.41618 > 10.0.13.2.3784: BFDv1, Control, State Up, Flags: [none], length: 24
 00:00:02.519437 eth1  In  IP 10.0.23.2.57325 > 10.0.23.3.3784: BFDv1, Control, State Up, Flags: [none], length: 24
 00:00:02.540712 eth3  In  IP 10.0.35.3.46520 > 10.0.35.2.3784: BFDv1, Control, State Up, Flags: [none], length: 24
 00:00:02.570057 eth1  Out IP 10.0.23.3.33242 > 10.0.23.2.3784: BFDv1, Control, State Up, Flags: [none], length: 24
 00:00:02.571007 eth0  In  IP 10.0.13.2.57029 > 10.0.13.3.3784: BFDv1, Control, State Up, Flags: [none], length: 24
 00:00:02.584282 eth3  Out IP 10.0.35.2.60297 > 10.0.35.3.3784: BFDv1, Control, State Up, Flags: [none], length: 24
 00:00:02.601432 eth1  In  IP 10.0.23.2.57325 > 10.0.23.3.3784: BFDv1, Control, State Up, Flags: [none], length: 24
 00:00:02.602726 eth0  Out IP 10.0.13.3.41618 > 10.0.13.2.3784: BFDv1, Control, State Up, Flags: [none], length: 24
 00:00:02.615638 eth3  In  IP 10.0.35.3.46520 > 10.0.35.2.3784: BFDv1, Control, State Up, Flags: [none], length: 24
 00:00:02.656942 eth1  Out IP 10.0.23.3.33242 > 10.0.23.2.3784: BFDv1, Control, State Up, Flags: [none], length: 24
 00:00:02.657048 eth0  In  IP 10.0.13.2.57029 > 10.0.13.3.3784: BFDv1, Control, State Up, Flags: [none], length: 24
 00:00:02.669561 eth3  Out IP 10.0.35.2.60297 > 10.0.35.3.3784: BFDv1, Control, State Up, Flags: [none], length: 24
 00:00:02.684399 eth1  In  IP 10.0.23.2.57325 > 10.0.23.3.3784: BFDv1, Control, State Up, Flags: [none], length: 24
 00:00:02.691743 eth0  Out IP 10.0.13.3.41618 > 10.0.13.2.3784: BFDv1, Control, State Up, Flags: [none], length: 24
 00:00:02.701012 eth3  In  IP 10.0.35.3.46520 > 10.0.35.2.3784: BFDv1, Control, State Up, Flags: [none], length: 24
 00:00:02.735470 eth1  Out IP 10.0.23.3.33242 > 10.0.23.2.3784: BFDv1, Control, State Up, Flags: [none], length: 24
 00:00:02.744741 eth0  In  IP 10.0.13.2.57029 > 10.0.13.3.3784: BFDv1, Control, State Up, Flags: [none], length: 24
 00:00:02.751054 eth3  Out IP 10.0.35.2.60297 > 10.0.35.3.3784: BFDv1, Control, State Up, Flags: [none], length: 24
 00:00:02.772266 eth1  In  IP 10.0.23.2.57325 > 10.0.23.3.3784: BFDv1, Control, State Up, Flags: [none], length: 24
 00:00:02.775601 eth0  Out IP 10.0.13.3.41618 > 10.0.13.2.3784: BFDv1, Control, State Up, Flags: [none], length: 24
 00:00:02.784474 eth3  In  IP 10.0.35.3.46520 > 10.0.35.2.3784: BFDv1, Control, State Up, Flags: [none], length: 24
 00:00:02.817828 eth1  Out IP 10.0.23.3.33242 > 10.0.23.2.3784: BFDv1, Control, State Up, Flags: [none], length: 24
 00:00:02.821515 eth0  In  IP 10.0.13.2.57029 > 10.0.13.3.3784: BFDv1, Control, State Up, Flags: [none], length: 24
 00:00:02.839827 eth3  Out IP 10.0.35.2.60297 > 10.0.35.3.3784: BFDv1, Control, State Up, Flags: [none], length: 24
 00:00:02.856382 eth1  In  IP 10.0.23.2.57325 > 10.0.23.3.3784: BFDv1, Control, State Up, Flags: [none], length: 24
 00:00:02.863368 eth3  In  IP 10.0.35.3.46520 > 10.0.35.2.3784: BFDv1, Control, State Up, Flags: [none], length: 24
 00:00:02.864708 eth0  Out IP 10.0.13.3.41618 > 10.0.13.2.3784: BFDv1, Control, State Up, Flags: [none], length: 24
 00:00:02.892976 eth1  Out IP 10.0.23.3.33242 > 10.0.23.2.3784: BFDv1, Control, State Up, Flags: [none], length: 24
 00:00:02.909586 eth0  In  IP 10.0.13.2.57029 > 10.0.13.3.3784: BFDv1, Control, State Up, Flags: [none], length: 24
 00:00:02.928927 eth3  Out IP 10.0.35.2.60297 > 10.0.35.3.3784: BFDv1, Control, State Up, Flags: [none], length: 24
 00:00:02.936970 eth1  In  IP 10.0.23.2.57325 > 10.0.23.3.3784: BFDv1, Control, State Up, Flags: [none], length: 24
 00:00:02.944309 eth3  In  IP 10.0.35.3.46520 > 10.0.35.2.3784: BFDv1, Control, State Up, Flags: [none], length: 24
 00:00:02.949680 eth0  Out IP 10.0.13.3.41618 > 10.0.13.2.3784: BFDv1, Control, State Up, Flags: [none], length: 24
 00:00:02.969972 eth1  Out IP 10.0.23.3.33242 > 10.0.23.2.3784: BFDv1, Control, State Up, Flags: [none], length: 24
 00:00:02.993292 eth0  In  IP 10.0.13.2.57029 > 10.0.13.3.3784: BFDv1, Control, State Up, Flags: [none], length: 24
 00:00:03.009641 eth3  Out IP 10.0.35.2.60297 > 10.0.35.3.3784: BFDv1, Control, State Up, Flags: [none], length: 24
 00:00:03.019531 eth1  In  IP 10.0.23.2.57325 > 10.0.23.3.3784: BFDv1, Control, State Up, Flags: [none], length: 24
 00:00:03.034070 eth3  In  IP 10.0.35.3.46520 > 10.0.35.2.3784: BFDv1, Control, State Up, Flags: [none], length: 24
 00:00:03.036372 eth0  Out IP 10.0.13.3.41618 > 10.0.13.2.3784: BFDv1, Control, State Up, Flags: [none], length: 24
 00:00:03.053570 eth1  Out IP 10.0.23.3.33242 > 10.0.23.2.3784: BFDv1, Control, State Up, Flags: [none], length: 24
 00:00:03.074319 eth0  In  IP 10.0.13.2.57029 > 10.0.13.3.3784: BFDv1, Control, State Up, Flags: [none], length: 24
 00:00:03.087644 eth3  Out IP 10.0.35.2.60297 > 10.0.35.3.3784: BFDv1, Control, State Up, Flags: [none], length: 24
 00:00:03.102754 eth1  In  IP 10.0.23.2.57325 > 10.0.23.3.3784: BFDv1, Control, State Up, Flags: [none], length: 24
 00:00:03.119222 eth3  In  IP 10.0.35.3.46520 > 10.0.35.2.3784: BFDv1, Control, State Up, Flags: [none], length: 24
 00:00:03.119261 eth0  Out IP 10.0.13.3.41618 > 10.0.13.2.3784: BFDv1, Control, State Up, Flags: [none], length: 24
 00:00:03.136604 eth1  Out IP 10.0.23.3.33242 > 10.0.23.2.3784: BFDv1, Control, State Up, Flags: [none], length: 24
 00:00:03.154093 eth0  In  IP 10.0.13.2.57029 > 10.0.13.3.3784: BFDv1, Control, State Up, Flags: [none], length: 24
 00:00:03.173430 eth3  Out IP 10.0.35.2.60297 > 10.0.35.3.3784: BFDv1, Control, State Up, Flags: [none], length: 24
 00:00:03.184485 eth1  In  IP 10.0.23.2.57325 > 10.0.23.3.3784: BFDv1, Control, State Up, Flags: [none], length: 24
 00:00:03.193836 eth3  In  IP 10.0.35.3.46520 > 10.0.35.2.3784: BFDv1, Control, State Up, Flags: [none], length: 24
 00:00:03.200086 eth0  Out IP 10.0.13.3.41618 > 10.0.13.2.3784: BFDv1, Control, State Up, Flags: [none], length: 24
 00:00:03.224291 eth1  Out IP 10.0.23.3.33242 > 10.0.23.2.3784: BFDv1, Control, State Up, Flags: [none], length: 24
 00:00:03.237747 eth0  In  IP 10.0.13.2.57029 > 10.0.13.3.3784: BFDv1, Control, State Up, Flags: [none], length: 24
 00:00:03.250068 eth3  Out IP 10.0.35.2.60297 > 10.0.35.3.3784: BFDv1, Control, State Up, Flags: [none], length: 24
 00:00:03.269267 eth1  In  IP 10.0.23.2.57325 > 10.0.23.3.3784: BFDv1, Control, State Up, Flags: [none], length: 24
 00:00:03.276311 eth3  In  IP 10.0.35.3.46520 > 10.0.35.2.3784: BFDv1, Control, State Up, Flags: [none], length: 24
 00:00:03.277606 eth0  Out IP 10.0.13.3.41618 > 10.0.13.2.3784: BFDv1, Control, State Up, Flags: [none], length: 24
 00:00:03.301912 eth1  Out IP 10.0.23.3.33242 > 10.0.23.2.3784: BFDv1, Control, State Up, Flags: [none], length: 24
 00:00:03.325191 eth3  Out IP 10.0.35.2.60297 > 10.0.35.3.3784: BFDv1, Control, State Up, Flags: [none], length: 24
 00:00:03.326627 eth0  In  IP 10.0.13.2.57029 > 10.0.13.3.3784: BFDv1, Control, State Up, Flags: [none], length: 24
 00:00:03.354408 eth3  In  IP 10.0.35.3.46520 > 10.0.35.2.3784: BFDv1, Control, State Up, Flags: [none], length: 24
 00:00:03.358301 eth1  In  IP 10.0.23.2.57325 > 10.0.23.3.3784: BFDv1, Control, State Up, Flags: [none], length: 24
 00:00:03.362561 eth0  Out IP 10.0.13.3.41618 > 10.0.13.2.3784: BFDv1, Control, State Up, Flags: [none], length: 24
 00:00:03.387830 eth1  Out IP 10.0.23.3.33242 > 10.0.23.2.3784: BFDv1, Control, State Up, Flags: [none], length: 24
 00:00:03.403088 eth3  Out IP 10.0.35.2.60297 > 10.0.35.3.3784: BFDv1, Control, State Up, Flags: [none], length: 24
 00:00:03.416567 eth0  In  IP 10.0.13.2.57029 > 10.0.13.3.3784: BFDv1, Control, State Up, Flags: [none], length: 24
 00:00:03.431065 eth3  In  IP 10.0.35.3.46520 > 10.0.35.2.3784: BFDv1, Control, State Up, Flags: [none], length: 24
 00:00:03.436917 eth1  In  IP 10.0.23.2.57325 > 10.0.23.3.3784: BFDv1, Control, State Up, Flags: [none], length: 24
 00:00:03.451214 eth0  Out IP 10.0.13.3.41618 > 10.0.13.2.3784: BFDv1, Control, State Up, Flags: [none], length: 24
 00:00:03.471497 eth1  Out IP 10.0.23.3.33242 > 10.0.23.2.3784: BFDv1, Control, State Up, Flags: [none], length: 24
 00:00:03.492718 eth3  Out IP 10.0.35.2.60297 > 10.0.35.3.3784: BFDv1, Control, State Up, Flags: [none], length: 24
 00:00:03.493419 eth0  In  IP 10.0.13.2.57029 > 10.0.13.3.3784: BFDv1, Control, State Up, Flags: [none], length: 24
 00:00:03.512679 eth3  In  IP 10.0.35.3.46520 > 10.0.35.2.3784: BFDv1, Control, State Up, Flags: [none], length: 24
 00:00:03.513816 eth1  In  IP 10.0.23.2.57325 > 10.0.23.3.3784: BFDv1, Control, State Up, Flags: [none], length: 24
 00:00:03.536086 eth0  Out IP 10.0.13.3.41618 > 10.0.13.2.3784: BFDv1, Control, State Up, Flags: [none], length: 24
 00:00:03.554387 eth1  Out IP 10.0.23.3.33242 > 10.0.23.2.3784: BFDv1, Control, State Up, Flags: [none], length: 24
 00:00:03.571616 eth3  Out IP 10.0.35.2.60297 > 10.0.35.3.3784: BFDv1, Control, State Up, Flags: [none], length: 24
 00:00:03.583499 eth0  In  IP 10.0.13.2.57029 > 10.0.13.3.3784: BFDv1, Control, State Up, Flags: [none], length: 24
 00:00:03.593372 eth3  In  IP 10.0.35.3.46520 > 10.0.35.2.3784: BFDv1, Control, State Up, Flags: [none], length: 24
 00:00:03.598697 eth1  In  IP 10.0.23.2.57325 > 10.0.23.3.3784: BFDv1, Control, State Up, Flags: [none], length: 24
 00:00:03.611521 eth0  Out IP 10.0.13.3.41618 > 10.0.13.2.3784: BFDv1, Control, State Up, Flags: [none], length: 24
 00:00:03.629721 eth1  Out IP 10.0.23.3.33242 > 10.0.23.2.3784: BFDv1, Control, State Up, Flags: [none], length: 24
 00:00:03.656946 eth3  Out IP 10.0.35.2.60297 > 10.0.35.3.3784: BFDv1, Control, State Up, Flags: [none], length: 24
 00:00:03.665164 eth0  In  IP 10.0.13.2.57029 > 10.0.13.3.3784: BFDv1, Control, State Up, Flags: [none], length: 24
 00:00:03.681045 eth3  In  IP 10.0.35.3.46520 > 10.0.35.2.3784: BFDv1, Control, State Up, Flags: [none], length: 24
 00:00:03.683699 eth1  In  IP 10.0.23.2.57325 > 10.0.23.3.3784: BFDv1, Control, State Up, Flags: [none], length: 24
 00:00:03.701069 eth0  Out IP 10.0.13.3.41618 > 10.0.13.2.3784: BFDv1, Control, State Up, Flags: [none], length: 24
 00:00:03.719350 eth1  Out IP 10.0.23.3.33242 > 10.0.23.2.3784: BFDv1, Control, State Up, Flags: [none], length: 24
 00:00:03.742693 eth3  Out IP 10.0.35.2.60297 > 10.0.35.3.3784: BFDv1, Control, State Up, Flags: [none], length: 24
 00:00:03.754338 eth0  In  IP 10.0.13.2.57029 > 10.0.13.3.3784: BFDv1, Control, State Up, Flags: [none], length: 24
 00:00:03.764731 eth3  In  IP 10.0.35.3.46520 > 10.0.35.2.3784: BFDv1, Control, State Up, Flags: [none], length: 24
 00:00:03.773582 eth1  In  IP 10.0.23.2.57325 > 10.0.23.3.3784: BFDv1, Control, State Up, Flags: [none], length: 24
 00:00:03.789934 eth0  Out IP 10.0.13.3.41618 > 10.0.13.2.3784: BFDv1, Control, State Up, Flags: [none], length: 24
 00:00:03.804240 eth1  Out IP 10.0.23.3.33242 > 10.0.23.2.3784: BFDv1, Control, State Up, Flags: [none], length: 24
 00:00:03.830497 eth3  Out IP 10.0.35.2.60297 > 10.0.35.3.3784: BFDv1, Control, State Up, Flags: [none], length: 24
 00:00:03.840232 eth0  In  IP 10.0.13.2.57029 > 10.0.13.3.3784: BFDv1, Control, State Up, Flags: [none], length: 24
 00:00:03.853458 eth3  In  IP 10.0.35.3.46520 > 10.0.35.2.3784: BFDv1, Control, State Up, Flags: [none], length: 24
 00:00:03.857473 eth1  In  IP 10.0.23.2.57325 > 10.0.23.3.3784: BFDv1, Control, State Up, Flags: [none], length: 24
 00:00:03.868876 eth0  Out IP 10.0.13.3.41618 > 10.0.13.2.3784: BFDv1, Control, State Up, Flags: [none], length: 24
 00:00:03.886200 eth1  Out IP 10.0.23.3.33242 > 10.0.23.2.3784: BFDv1, Control, State Up, Flags: [none], length: 24
 00:00:03.911436 eth3  Out IP 10.0.35.2.60297 > 10.0.35.3.3784: BFDv1, Control, State Up, Flags: [none], length: 24
 00:00:03.926241 eth0  In  IP 10.0.13.2.57029 > 10.0.13.3.3784: BFDv1, Control, State Up, Flags: [none], length: 24
 00:00:03.934127 eth1  In  IP 10.0.23.2.57325 > 10.0.23.3.3784: BFDv1, Control, State Up, Flags: [none], length: 24
 00:00:03.939194 eth3  In  IP 10.0.35.3.46520 > 10.0.35.2.3784: BFDv1, Control, State Up, Flags: [none], length: 24
 00:00:03.949489 eth0  Out IP 10.0.13.3.41618 > 10.0.13.2.3784: BFDv1, Control, State Up, Flags: [none], length: 24
 00:00:03.973752 eth1  Out IP 10.0.23.3.33242 > 10.0.23.2.3784: BFDv1, Control, State Up, Flags: [none], length: 24
 00:00:03.998983 eth3  Out IP 10.0.35.2.60297 > 10.0.35.3.3784: BFDv1, Control, State Up, Flags: [none], length: 24
 00:00:04.010788 eth0  In  IP 10.0.13.2.57029 > 10.0.13.3.3784: BFDv1, Control, State Up, Flags: [none], length: 24
 00:00:04.017718 eth1  In  IP 10.0.23.2.57325 > 10.0.23.3.3784: BFDv1, Control, State Up, Flags: [none], length: 24
 00:00:04.019820 eth3  In  IP 10.0.35.3.46520 > 10.0.35.2.3784: BFDv1, Control, State Up, Flags: [none], length: 24
 00:00:04.027102 eth0  Out IP 10.0.13.3.41618 > 10.0.13.2.3784: BFDv1, Control, State Up, Flags: [none], length: 24
 00:00:04.053358 eth1  Out IP 10.0.23.3.33242 > 10.0.23.2.3784: BFDv1, Control, State Up, Flags: [none], length: 24
