tcpdump: data link type LINUX_SLL2
tcpdump: verbose output suppressed, use -v[v]... for full protocol decode
listening on any, link-type LINUX_SLL2 (Linux cooked v2), snapshot length 262144 bytes
 00:00:00.000000 eth1  Out IP 10.0.29.2.48911 > 10.0.29.3.3784: BFDv1, Control, State Up, Flags: [none], length: 24
 00:00:00.018240 eth1  In  IP 10.0.29.3.45346 > 10.0.29.2.3784: BFDv1, Control, State Up, Flags: [none], length: 24
 00:00:00.086614 eth1  Out IP 10.0.29.2.48911 > 10.0.29.3.3784: BFDv1, Control, State Up, Flags: [none], length: 24
 00:00:00.099859 eth1  In  IP 10.0.29.3.45346 > 10.0.29.2.3784: BFDv1, Control, State Up, Flags: [none], length: 24
 00:00:00.176375 eth1  Out IP 10.0.29.2.48911 > 10.0.29.3.3784: BFDv1, Control, State Up, Flags: [none], length: 24
 00:00:00.189728 eth1  In  IP 10.0.29.3.45346 > 10.0.29.2.3784: BFDv1, Control, State Up, Flags: [none], length: 24
 00:00:00.265148 eth1  Out IP 10.0.29.2.48911 > 10.0.29.3.3784: BFDv1, Control, State Up, Flags: [none], length: 24
 00:00:00.267417 eth1  In  IP 10.0.29.3.45346 > 10.0.29.2.3784: BFDv1, Control, State Up, Flags: [none], length: 24
 00:00:00.349762 eth1  Out IP 10.0.29.2.48911 > 10.0.29.3.3784: BFDv1, Control, State Up, Flags: [none], length: 24
 00:00:00.356028 eth1  In  IP 10.0.29.3.45346 > 10.0.29.2.3784: BFDv1, Control, State Up, Flags: [none], length: 24
 00:00:00.431681 eth1  In  IP 10.0.29.3.45346 > 10.0.29.2.3784: BFDv1, Control, State Up, Flags: [none], length: 24
 00:00:00.439004 eth1  Out IP 10.0.29.2.48911 > 10.0.29.3.3784: BFDv1, Control, State Up, Flags: [none], length: 24
 00:00:00.508871 eth1  In  IP 10.0.29.3.45346 > 10.0.29.2.3784: BFDv1, Control, State Up, Flags: [none], length: 24
 00:00:00.528214 eth1  Out IP 10.0.29.2.48911 > 10.0.29.3.3784: BFDv1, Control, State Up, Flags: [none], length: 24
 00:00:00.595060 eth1  In  IP 10.0.29.3.45346 > 10.0.29.2.3784: BFDv1, Control, State Up, Flags: [none], length: 24
 00:00:00.605459 eth1  Out IP 10.0.29.2.48911 > 10.0.29.3.3784: BFDv1, Control, State Up, Flags: [none], length: 24
 00:00:00.681251 eth1  In  IP 10.0.29.3.45346 > 10.0.29.2.3784: BFDv1, Control, State Up, Flags: [none], length: 24
 00:00:00.692711 eth1  Out IP 10.0.29.2.48911 > 10.0.29.3.3784: BFDv1, Control, State Up, Flags: [none], length: 24
 00:00:00.757832 eth1  In  IP 10.0.29.3.45346 > 10.0.29.2.3784: BFDv1, Control, State Up, Flags: [none], length: 24
 00:00:00.778266 eth1  Out IP 10.0.29.2.48911 > 10.0.29.3.3784: BFDv1, Control, State Up, Flags: [none], length: 24
 00:00:00.833070 eth1  In  IP 10.0.29.3.45346 > 10.0.29.2.3784: BFDv1, Control, State Up, Flags: [none], length: 24
 00:00:00.867712 eth1  Out IP 10.0.29.2.48911 > 10.0.29.3.3784: BFDv1, Control, State Up, Flags: [none], length: 24
 00:00:00.920024 eth1  In  IP 10.0.29.3.45346 > 10.0.29.2.3784: BFDv1, Control, State Up, Flags: [none], length: 24
 00:00:00.956470 eth1  Out IP 10.0.29.2.48911 > 10.0.29.3.3784: BFDv1, Control, State Up, Flags: [none], length: 24
 00:00:00.996927 eth1  In  IP 10.0.29.3.45346 > 10.0.29.2.3784: BFDv1, Control, State Up, Flags: [none], length: 24
 00:00:01.045373 eth1  Out IP 10.0.29.2.48911 > 10.0.29.3.3784: BFDv1, Control, State Up, Flags: [none], length: 24
 00:00:01.082647 eth1  In  IP 10.0.29.3.45346 > 10.0.29.2.3784: BFDv1, Control, State Up, Flags: [none], length: 24
 00:00:01.126098 eth1  Out IP 10.0.29.2.48911 > 10.0.29.3.3784: BFDv1, Control, State Up, Flags: [none], length: 24
 00:00:01.162614 eth1  In  IP 10.0.29.3.45346 > 10.0.29.2.3784: BFDv1, Control, State Up, Flags: [none], length: 24
 00:00:01.205068 eth1  Out IP 10.0.29.2.48911 > 10.0.29.3.3784: BFDv1, Control, State Up, Flags: [none], length: 24
 00:00:01.240334 eth1  In  IP 10.0.29.3.45346 > 10.0.29.2.3784: BFDv1, Control, State Up, Flags: [none], length: 24
 00:00:01.286718 eth1  Out IP 10.0.29.2.48911 > 10.0.29.3.3784: BFDv1, Control, State Up, Flags: [none], length: 24
 00:00:01.325069 eth1  In  IP 10.0.29.3.45346 > 10.0.29.2.3784: BFDv1, Control, State Up, Flags: [none], length: 24
 00:00:01.371502 eth1  Out IP 10.0.29.2.48911 > 10.0.29.3.3784: BFDv1, Control, State Up, Flags: [none], length: 24
 00:00:01.405798 eth1  In  IP 10.0.29.3.45346 > 10.0.29.2.3784: BFDv1, Control, State Up, Flags: [none], length: 24
 00:00:01.461205 eth1  Out IP 10.0.29.2.48911 > 10.0.29.3.3784: BFDv1, Control, State Up, Flags: [none], length: 24
 00:00:01.494492 eth1  In  IP 10.0.29.3.45346 > 10.0.29.2.3784: BFDv1, Control, State Up, Flags: [none], length: 24
 00:00:01.539828 eth1  Out IP 10.0.29.2.48911 > 10.0.29.3.3784: BFDv1, Control, State Up, Flags: [none], length: 24
 00:00:01.576045 eth1  In  IP 10.0.29.3.45346 > 10.0.29.2.3784: BFDv1, Control, State Up, Flags: [none], length: 24
 00:00:01.626505 eth1  Out IP 10.0.29.2.48911 > 10.0.29.3.3784: BFDv1, Control, State Up, Flags: [none], length: 24
 00:00:01.657763 eth1  In  IP 10.0.29.3.45346 > 10.0.29.2.3784: BFDv1, Control, State Up, Flags: [none], length: 24
 00:00:01.702216 eth1  Out IP 10.0.29.2.48911 > 10.0.29.3.3784: BFDv1, Control, State Up, Flags: [none], length: 24
 00:00:01.744574 eth1  In  IP 10.0.29.3.45346 > 10.0.29.2.3784: BFDv1, Control, State Up, Flags: [none], length: 24
 00:00:01.779912 eth1  Out IP 10.0.29.2.48911 > 10.0.29.3.3784: BFDv1, Control, State Up, Flags: [none], length: 24
 00:00:01.833125 eth1  In  IP 10.0.29.3.45346 > 10.0.29.2.3784: BFDv1, Control, State Up, Flags: [none], length: 24
 00:00:01.862571 eth1  Out IP 10.0.29.2.48911 > 10.0.29.3.3784: BFDv1, Control, State Up, Flags: [none], length: 24
 00:00:01.913779 eth1  In  IP 10.0.29.3.45346 > 10.0.29.2.3784: BFDv1, Control, State Up, Flags: [none], length: 24
 00:00:01.948124 eth1  Out IP 10.0.29.2.48911 > 10.0.29.3.3784: BFDv1, Control, State Up, Flags: [none], length: 24
 00:00:01.992371 eth1  In  IP 10.0.29.3.45346 > 10.0.29.2.3784: BFDv1, Control, State Up, Flags: [none], length: 24
 00:00:02.032826 eth1  Out IP 10.0.29.2.48911 > 10.0.29.3.3784: BFDv1, Control, State Up, Flags: [none], length: 24
 00:00:02.076948 eth2  Out IP 10.0.12.3.51192 > 10.0.12.2.179: Flags [P.], seq 221768574:221768609, ack 3568889677, win 63, options [nop,nop,TS val 627098337 ecr 397933088], length 35: BGP
 00:00:02.077032 eth2  In  IP 10.0.12.2.179 > 10.0.12.3.51192: Flags [.], ack 35, win 64, options [nop,nop,TS val 397949693 ecr 627098337], length 0
 00:00:02.077071 eth2  Out IP 10.0.12.3.51192 > 10.0.12.2.179: Flags [P.], seq 35:80, ack 1, win 63, options [nop,nop,TS val 627098337 ecr 397949693], length 45: BGP
 00:00:02.077083 eth2  In  IP 10.0.12.2.179 > 10.0.12.3.51192: Flags [.], ack 80, win 64, options [nop,nop,TS val 397949693 ecr 627098337], length 0
 00:00:02.077609 eth2  In  IP 10.0.12.2.179 > 10.0.12.3.51192: Flags [P.], seq 1:55, ack 80, win 64, options [nop,nop,TS val 397949694 ecr 627098337], length 54: BGP
 00:00:02.077633 eth2  Out IP 10.0.12.3.51192 > 10.0.12.2.179: Flags [.], ack 55, win 63, options [nop,nop,TS val 627098338 ecr 397949694], length 0
 00:00:09.836485 eth2  Out IP 10.0.12.3.51192 > 10.0.12.2.179: Flags [P.], seq 80:99, ack 55, win 63, options [nop,nop,TS val 627106097 ecr 397949694], length 19: BGP
 00:00:09.877441 eth2  In  IP 10.0.12.2.179 > 10.0.12.3.51192: Flags [.], ack 99, win 64, options [nop,nop,TS val 397957494 ecr 627106097], length 0
 00:00:10.182616 eth1  Out IP 10.0.29.2.54050 > 10.0.29.3.3784: BFDv1, Control, State Down, Flags: [none], length: 24
 00:00:10.182752 eth2  Out IP 10.0.12.3.51192 > 10.0.12.2.179: Flags [P.], seq 99:147, ack 55, win 63, options [nop,nop,TS val 627106443 ecr 397957494], length 48: BGP
 00:00:10.182807 eth2  In  IP 10.0.12.2.179 > 10.0.12.3.51192: Flags [.], ack 147, win 64, options [nop,nop,TS val 397957799 ecr 627106443], length 0
 00:00:10.183050 eth2  In  IP 10.0.12.2.179 > 10.0.12.3.51192: Flags [P.], seq 55:82, ack 147, win 64, options [nop,nop,TS val 397957799 ecr 627106443], length 27: BGP
 00:00:10.183060 eth2  Out IP 10.0.12.3.51192 > 10.0.12.2.179: Flags [.], ack 82, win 63, options [nop,nop,TS val 627106443 ecr 397957799], length 0
 00:00:10.183884 eth2  Out IP 10.0.12.3.51192 > 10.0.12.2.179: Flags [P.], seq 147:192, ack 82, win 63, options [nop,nop,TS val 627106444 ecr 397957799], length 45: BGP
 00:00:10.225453 eth2  In  IP 10.0.12.2.179 > 10.0.12.3.51192: Flags [.], ack 192, win 64, options [nop,nop,TS val 397957842 ecr 627106444], length 0
 00:00:10.862403 eth1  In  IP 10.0.29.3.40325 > 10.0.29.2.3784: BFDv1, Control, State Init, Flags: [none], length: 24
 00:00:10.862647 eth1  Out IP 10.0.29.2.54050 > 10.0.29.3.3784: BFDv1, Control, State Up, Flags: [Poll], length: 24
 00:00:10.862741 eth1  In  IP 10.0.29.3.40325 > 10.0.29.2.3784: BFDv1, Control, State Up, Flags: [Final], length: 24
 00:00:10.862762 eth1  In  IP 10.0.29.3.40325 > 10.0.29.2.3784: BFDv1, Control, State Up, Flags: [Poll], length: 24
 00:00:10.862888 eth1  Out IP 10.0.29.2.54050 > 10.0.29.3.3784: BFDv1, Control, State Up, Flags: [Final], length: 24
 00:00:10.940193 eth1  Out IP 10.0.29.2.54050 > 10.0.29.3.3784: BFDv1, Control, State Up, Flags: [none], length: 24
 00:00:10.951443 eth1  In  IP 10.0.29.3.40325 > 10.0.29.2.3784: BFDv1, Control, State Up, Flags: [none], length: 24
 00:00:11.022857 eth1  Out IP 10.0.29.2.54050 > 10.0.29.3.3784: BFDv1, Control, State Up, Flags: [none], length: 24
 00:00:11.038091 eth1  In  IP 10.0.29.3.40325 > 10.0.29.2.3784: BFDv1, Control, State Up, Flags: [none], length: 24
 00:00:11.099512 eth1  Out IP 10.0.29.2.54050 > 10.0.29.3.3784: BFDv1, Control, State Up, Flags: [none], length: 24
 00:00:11.123922 eth1  In  IP 10.0.29.3.40325 > 10.0.29.2.3784: BFDv1, Control, State Up, Flags: [none], length: 24
 00:00:11.188339 eth1  Out IP 10.0.29.2.54050 > 10.0.29.3.3784: BFDv1, Control, State Up, Flags: [none], length: 24
 00:00:11.207893 eth1  In  IP 10.0.29.3.40325 > 10.0.29.2.3784: BFDv1, Control, State Up, Flags: [none], length: 24
 00:00:11.267284 eth1  Out IP 10.0.29.2.54050 > 10.0.29.3.3784: BFDv1, Control, State Up, Flags: [none], length: 24
 00:00:11.286732 eth1  In  IP 10.0.29.3.40325 > 10.0.29.2.3784: BFDv1, Control, State Up, Flags: [none], length: 24
 00:00:11.343112 eth1  Out IP 10.0.29.2.54050 > 10.0.29.3.3784: BFDv1, Control, State Up, Flags: [none], length: 24
 00:00:11.363417 eth1  In  IP 10.0.29.3.40325 > 10.0.29.2.3784: BFDv1, Control, State Up, Flags: [none], length: 24
 00:00:11.429801 eth1  Out IP 10.0.29.2.54050 > 10.0.29.3.3784: BFDv1, Control, State Up, Flags: [none], length: 24
 00:00:11.445057 eth1  In  IP 10.0.29.3.40325 > 10.0.29.2.3784: BFDv1, Control, State Up, Flags: [none], length: 24
 00:00:11.508444 eth1  Out IP 10.0.29.2.54050 > 10.0.29.3.3784: BFDv1, Control, State Up, Flags: [none], length: 24
 00:00:11.532691 eth1  In  IP 10.0.29.3.40325 > 10.0.29.2.3784: BFDv1, Control, State Up, Flags: [none], length: 24
 00:00:11.589024 eth1  Out IP 10.0.29.2.54050 > 10.0.29.3.3784: BFDv1, Control, State Up, Flags: [none], length: 24
 00:00:11.609275 eth1  In  IP 10.0.29.3.40325 > 10.0.29.2.3784: BFDv1, Control, State Up, Flags: [none], length: 24
 00:00:11.664701 eth1  Out IP 10.0.29.2.54050 > 10.0.29.3.3784: BFDv1, Control, State Up, Flags: [none], length: 24
 00:00:11.684065 eth1  In  IP 10.0.29.3.40325 > 10.0.29.2.3784: BFDv1, Control, State Up, Flags: [none], length: 24
 00:00:11.749444 eth1  Out IP 10.0.29.2.54050 > 10.0.29.3.3784: BFDv1, Control, State Up, Flags: [none], length: 24
 00:00:11.766680 eth1  In  IP 10.0.29.3.40325 > 10.0.29.2.3784: BFDv1, Control, State Up, Flags: [none], length: 24
 00:00:11.825100 eth1  Out IP 10.0.29.2.54050 > 10.0.29.3.3784: BFDv1, Control, State Up, Flags: [none], length: 24
 00:00:11.846440 eth1  In  IP 10.0.29.3.40325 > 10.0.29.2.3784: BFDv1, Control, State Up, Flags: [none], length: 24
 00:00:11.914793 eth1  Out IP 10.0.29.2.54050 > 10.0.29.3.3784: BFDv1, Control, State Up, Flags: [none], length: 24
 00:00:11.929011 eth1  In  IP 10.0.29.3.40325 > 10.0.29.2.3784: BFDv1, Control, State Up, Flags: [none], length: 24
 00:00:12.002401 eth1  Out IP 10.0.29.2.54050 > 10.0.29.3.3784: BFDv1, Control, State Up, Flags: [none], length: 24
 00:00:12.017666 eth1  In  IP 10.0.29.3.40325 > 10.0.29.2.3784: BFDv1, Control, State Up, Flags: [none], length: 24
 00:00:12.090164 eth1  Out IP 10.0.29.2.54050 > 10.0.29.3.3784: BFDv1, Control, State Up, Flags: [none], length: 24
 00:00:12.099439 eth1  In  IP 10.0.29.3.40325 > 10.0.29.2.3784: BFDv1, Control, State Up, Flags: [none], length: 24
 00:00:12.165866 eth1  Out IP 10.0.29.2.54050 > 10.0.29.3.3784: BFDv1, Control, State Up, Flags: [none], length: 24
 00:00:12.181112 eth1  In  IP 10.0.29.3.40325 > 10.0.29.2.3784: BFDv1, Control, State Up, Flags: [none], length: 24
 00:00:12.241505 eth1  Out IP 10.0.29.2.54050 > 10.0.29.3.3784: BFDv1, Control, State Up, Flags: [none], length: 24
 00:00:12.255800 eth1  In  IP 10.0.29.3.40325 > 10.0.29.2.3784: BFDv1, Control, State Up, Flags: [none], length: 24
 00:00:12.321187 eth1  Out IP 10.0.29.2.54050 > 10.0.29.3.3784: BFDv1, Control, State Up, Flags: [none], length: 24
 00:00:12.333454 eth1  In  IP 10.0.29.3.40325 > 10.0.29.2.3784: BFDv1, Control, State Up, Flags: [none], length: 24
 00:00:12.405845 eth1  Out IP 10.0.29.2.54050 > 10.0.29.3.3784: BFDv1, Control, State Up, Flags: [none], length: 24
 00:00:12.420916 eth1  In  IP 10.0.29.3.40325 > 10.0.29.2.3784: BFDv1, Control, State Up, Flags: [none], length: 24
 00:00:12.492316 eth1  Out IP 10.0.29.2.54050 > 10.0.29.3.3784: BFDv1, Control, State Up, Flags: [none], length: 24
 00:00:12.501667 eth1  In  IP 10.0.29.3.40325 > 10.0.29.2.3784: BFDv1, Control, State Up, Flags: [none], length: 24
 00:00:12.572122 eth1  Out IP 10.0.29.2.54050 > 10.0.29.3.3784: BFDv1, Control, State Up, Flags: [none], length: 24
 00:00:12.581424 eth1  In  IP 10.0.29.3.40325 > 10.0.29.2.3784: BFDv1, Control, State Up, Flags: [none], length: 24
 00:00:12.660860 eth1  Out IP 10.0.29.2.54050 > 10.0.29.3.3784: BFDv1, Control, State Up, Flags: [none], length: 24
 00:00:12.668147 eth1  In  IP 10.0.29.3.40325 > 10.0.29.2.3784: BFDv1, Control, State Up, Flags: [none], length: 24
 00:00:12.741553 eth1  Out IP 10.0.29.2.54050 > 10.0.29.3.3784: BFDv1, Control, State Up, Flags: [none], length: 24
 00:00:12.752820 eth1  In  IP 10.0.29.3.40325 > 10.0.29.2.3784: BFDv1, Control, State Up, Flags: [none], length: 24
 00:00:12.817227 eth1  Out IP 10.0.29.2.54050 > 10.0.29.3.3784: BFDv1, Control, State Up, Flags: [none], length: 24
 00:00:12.828488 eth1  In  IP 10.0.29.3.40325 > 10.0.29.2.3784: BFDv1, Control, State Up, Flags: [none], length: 24
 00:00:12.901148 eth1  Out IP 10.0.29.2.54050 > 10.0.29.3.3784: BFDv1, Control, State Up, Flags: [none], length: 24
 00:00:12.905379 eth1  In  IP 10.0.29.3.40325 > 10.0.29.2.3784: BFDv1, Control, State Up, Flags: [none], length: 24
 00:00:12.980549 eth1  In  IP 10.0.29.3.40325 > 10.0.29.2.3784: BFDv1, Control, State Up, Flags: [none], length: 24
 00:00:12.985926 eth1  Out IP 10.0.29.2.54050 > 10.0.29.3.3784: BFDv1, Control, State Up, Flags: [none], length: 24
 00:00:13.067929 eth1  In  IP 10.0.29.3.40325 > 10.0.29.2.3784: BFDv1, Control, State Up, Flags: [none], length: 24
 00:00:13.071243 eth1  Out IP 10.0.29.2.54050 > 10.0.29.3.3784: BFDv1, Control, State Up, Flags: [none], length: 24
 00:00:13.155619 eth1  In  IP 10.0.29.3.40325 > 10.0.29.2.3784: BFDv1, Control, State Up, Flags: [none], length: 24
 00:00:13.161025 eth1  Out IP 10.0.29.2.54050 > 10.0.29.3.3784: BFDv1, Control, State Up, Flags: [none], length: 24
 00:00:13.238053 eth1  In  IP 10.0.29.3.40325 > 10.0.29.2.3784: BFDv1, Control, State Up, Flags: [none], length: 24
 00:00:13.248532 eth1  Out IP 10.0.29.2.54050 > 10.0.29.3.3784: BFDv1, Control, State Up, Flags: [none], length: 24
 00:00:13.315210 eth1  In  IP 10.0.29.3.40325 > 10.0.29.2.3784: BFDv1, Control, State Up, Flags: [none], length: 24
 00:00:13.327758 eth1  Out IP 10.0.29.2.54050 > 10.0.29.3.3784: BFDv1, Control, State Up, Flags: [none], length: 24
 00:00:13.401610 eth1  In  IP 10.0.29.3.40325 > 10.0.29.2.3784: BFDv1, Control, State Up, Flags: [none], length: 24
 00:00:13.402900 eth1  Out IP 10.0.29.2.54050 > 10.0.29.3.3784: BFDv1, Control, State Up, Flags: [none], length: 24
 00:00:13.482124 eth1  In  IP 10.0.29.3.40325 > 10.0.29.2.3784: BFDv1, Control, State Up, Flags: [none], length: 24
 00:00:13.491513 eth1  Out IP 10.0.29.2.54050 > 10.0.29.3.3784: BFDv1, Control, State Up, Flags: [none], length: 24
 00:00:13.566632 eth1  In  IP 10.0.29.3.40325 > 10.0.29.2.3784: BFDv1, Control, State Up, Flags: [none], length: 24
 00:00:13.578969 eth1  Out IP 10.0.29.2.54050 > 10.0.29.3.3784: BFDv1, Control, State Up, Flags: [none], length: 24
 00:00:13.650157 eth1  In  IP 10.0.29.3.40325 > 10.0.29.2.3784: BFDv1, Control, State Up, Flags: [none], length: 24
 00:00:13.655609 eth1  Out IP 10.0.29.2.54050 > 10.0.29.3.3784: BFDv1, Control, State Up, Flags: [none], length: 24
 00:00:13.733531 eth1  In  IP 10.0.29.3.40325 > 10.0.29.2.3784: BFDv1, Control, State Up, Flags: [none], length: 24
 00:00:13.741904 eth1  Out IP 10.0.29.2.54050 > 10.0.29.3.3784: BFDv1, Control, State Up, Flags: [none], length: 24
 00:00:13.810001 eth1  In  IP 10.0.29.3.40325 > 10.0.29.2.3784: BFDv1, Control, State Up, Flags: [none], length: 24
 00:00:13.818431 eth1  Out IP 10.0.29.2.54050 > 10.0.29.3.3784: BFDv1, Control, State Up, Flags: [none], length: 24
 00:00:13.894730 eth1  Out IP 10.0.29.2.54050 > 10.0.29.3.3784: BFDv1, Control, State Up, Flags: [none], length: 24
 00:00:13.894883 eth1  In  IP 10.0.29.3.40325 > 10.0.29.2.3784: BFDv1, Control, State Up, Flags: [none], length: 24
 00:00:13.979160 eth1  In  IP 10.0.29.3.40325 > 10.0.29.2.3784: BFDv1, Control, State Up, Flags: [none], length: 24
 00:00:13.979187 eth1  Out IP 10.0.29.2.54050 > 10.0.29.3.3784: BFDv1, Control, State Up, Flags: [none], length: 24
 00:00:14.057545 eth1  Out IP 10.0.29.2.54050 > 10.0.29.3.3784: BFDv1, Control, State Up, Flags: [none], length: 24
 00:00:14.060737 eth1  In  IP 10.0.29.3.40325 > 10.0.29.2.3784: BFDv1, Control, State Up, Flags: [none], length: 24
 00:00:14.135950 eth1  In  IP 10.0.29.3.40325 > 10.0.29.2.3784: BFDv1, Control, State Up, Flags: [none], length: 24
 00:00:14.140283 eth1  Out IP 10.0.29.2.54050 > 10.0.29.3.3784: BFDv1, Control, State Up, Flags: [none], length: 24
 00:00:14.219427 eth1  In  IP 10.0.29.3.40325 > 10.0.29.2.3784: BFDv1, Control, State Up, Flags: [none], length: 24
 00:00:14.223776 eth1  Out IP 10.0.29.2.54050 > 10.0.29.3.3784: BFDv1, Control, State Up, Flags: [none], length: 24
 00:00:14.297857 eth1  In  IP 10.0.29.3.40325 > 10.0.29.2.3784: BFDv1, Control, State Up, Flags: [none], length: 24
 00:00:14.312185 eth1  Out IP 10.0.29.2.54050 > 10.0.29.3.3784: BFDv1, Control, State Up, Flags: [none], length: 24
 00:00:14.378297 eth1  In  IP 10.0.29.3.40325 > 10.0.29.2.3784: BFDv1, Control, State Up, Flags: [none], length: 24
 00:00:14.395590 eth1  Out IP 10.0.29.2.54050 > 10.0.29.3.3784: BFDv1, Control, State Up, Flags: [none], length: 24
 00:00:14.463694 eth1  In  IP 10.0.29.3.40325 > 10.0.29.2.3784: BFDv1, Control, State Up, Flags: [none], length: 24
 00:00:14.479649 eth1  Out IP 10.0.29.2.54050 > 10.0.29.3.3784: BFDv1, Control, State Up, Flags: [none], length: 24
 00:00:14.548142 eth1  In  IP 10.0.29.3.40325 > 10.0.29.2.3784: BFDv1, Control, State Up, Flags: [none], length: 24
 00:00:14.565571 eth1  Out IP 10.0.29.2.54050 > 10.0.29.3.3784: BFDv1, Control, State Up, Flags: [none], length: 24
 00:00:14.634327 eth1  In  IP 10.0.29.3.40325 > 10.0.29.2.3784: BFDv1, Control, State Up, Flags: [none], length: 24
 00:00:14.646670 eth1  Out IP 10.0.29.2.54050 > 10.0.29.3.3784: BFDv1, Control, State Up, Flags: [none], length: 24
 00:00:14.659588 eth1  Out IP 10.0.29.2.37091 > 10.0.29.3.179: Flags [S], seq 2693581977, win 64240, options [mss 1460,sackOK,TS val 1876753530 ecr 0,nop,wscale 10], length 0
 00:00:14.659641 eth1  In  IP 10.0.29.3.179 > 10.0.29.2.37091: Flags [S.], seq 870095119, ack 2693581978, win 65160, options [mss 1460,sackOK,TS val 3829508504 ecr 1876753530,nop,wscale 10], length 0
 00:00:14.659658 eth1  Out IP 10.0.29.2.37091 > 10.0.29.3.179: Flags [.], ack 1, win 63, options [nop,nop,TS val 1876753530 ecr 3829508504], length 0
 00:00:14.659712 eth1  Out IP 10.0.29.2.37091 > 10.0.29.3.179: Flags [P.], seq 1:65, ack 1, win 63, options [nop,nop,TS val 1876753530 ecr 3829508504], length 64: BGP
 00:00:14.659719 eth1  In  IP 10.0.29.3.179 > 10.0.29.2.37091: Flags [.], ack 65, win 64, options [nop,nop,TS val 3829508504 ecr 1876753530], length 0
 00:00:14.659773 eth1  In  IP 10.0.29.3.179 > 10.0.29.2.37091: Flags [R.], seq 1, ack 65, win 64, options [nop,nop,TS val 3829508504 ecr 1876753530], length 0
 00:00:14.715089 eth1  In  IP 10.0.29.3.40325 > 10.0.29.2.3784: BFDv1, Control, State Up, Flags: [none], length: 24
 00:00:14.729659 eth1  Out IP 10.0.29.2.54050 > 10.0.29.3.3784: BFDv1, Control, State Up, Flags: [none], length: 24
 00:00:14.793036 eth1  In  IP 10.0.29.3.40325 > 10.0.29.2.3784: BFDv1, Control, State Up, Flags: [none], length: 24
 00:00:14.811396 eth1  Out IP 10.0.29.2.54050 > 10.0.29.3.3784: BFDv1, Control, State Up, Flags: [none], length: 24
 00:00:14.877687 eth1  In  IP 10.0.29.3.40325 > 10.0.29.2.3784: BFDv1, Control, State Up, Flags: [none], length: 24
 00:00:14.887022 eth1  Out IP 10.0.29.2.54050 > 10.0.29.3.3784: BFDv1, Control, State Up, Flags: [none], length: 24
 00:00:14.958151 eth1  In  IP 10.0.29.3.40325 > 10.0.29.2.3784: BFDv1, Control, State Up, Flags: [none], length: 24
 00:00:14.963421 eth1  Out IP 10.0.29.2.54050 > 10.0.29.3.3784: BFDv1, Control, State Up, Flags: [none], length: 24
 00:00:15.043816 eth1  In  IP 10.0.29.3.40325 > 10.0.29.2.3784: BFDv1, Control, State Up, Flags: [none], length: 24
 00:00:15.050203 eth1  Out IP 10.0.29.2.54050 > 10.0.29.3.3784: BFDv1, Control, State Up, Flags: [none], length: 24
 00:00:15.120200 eth1  In  IP 10.0.29.3.40325 > 10.0.29.2.3784: BFDv1, Control, State Up, Flags: [none], length: 24
 00:00:15.126453 eth1  Out IP 10.0.29.2.54050 > 10.0.29.3.3784: BFDv1, Control, State Up, Flags: [none], length: 24
 00:00:15.197387 eth1  Out IP 10.0.29.2.44627 > 10.0.29.3.179: Flags [FP.], seq 2330221779:2330221800, ack 1163947268, win 63, options [nop,nop,TS val 1876754068 ecr 3829479358], length 21: BGP
 00:00:15.197442 eth1  In  IP 10.0.29.3.179 > 10.0.29.2.44627: Flags [R], seq 1163947268, win 0, length 0
 00:00:15.199560 eth1  In  IP 10.0.29.3.40325 > 10.0.29.2.3784: BFDv1, Control, State Up, Flags: [none], length: 24
 00:00:15.211453 eth1  Out IP 10.0.29.2.54050 > 10.0.29.3.3784: BFDv1, Control, State Up, Flags: [none], length: 24
 00:00:15.284021 eth1  In  IP 10.0.29.3.40325 > 10.0.29.2.3784: BFDv1, Control, State Up, Flags: [none], length: 24
 00:00:15.292386 eth1  Out IP 10.0.29.2.54050 > 10.0.29.3.3784: BFDv1, Control, State Up, Flags: [none], length: 24
 00:00:15.361342 eth1  In  IP 10.0.29.3.40325 > 10.0.29.2.3784: BFDv1, Control, State Up, Flags: [none], length: 24
 00:00:15.379730 eth1  Out IP 10.0.29.2.54050 > 10.0.29.3.3784: BFDv1, Control, State Up, Flags: [none], length: 24
 00:00:15.441644 eth1  In  IP 10.0.29.3.40325 > 10.0.29.2.3784: BFDv1, Control, State Up, Flags: [none], length: 24
 00:00:15.463871 eth1  Out IP 10.0.29.2.54050 > 10.0.29.3.3784: BFDv1, Control, State Up, Flags: [none], length: 24
 00:00:15.528197 eth1  In  IP 10.0.29.3.40325 > 10.0.29.2.3784: BFDv1, Control, State Up, Flags: [none], length: 24
 00:00:15.541508 eth1  Out IP 10.0.29.2.54050 > 10.0.29.3.3784: BFDv1, Control, State Up, Flags: [none], length: 24
 00:00:15.610908 eth1  In  IP 10.0.29.3.40325 > 10.0.29.2.3784: BFDv1, Control, State Up, Flags: [none], length: 24
 00:00:15.618112 eth1  Out IP 10.0.29.2.54050 > 10.0.29.3.3784: BFDv1, Control, State Up, Flags: [none], length: 24
 00:00:15.693307 eth1  In  IP 10.0.29.3.40325 > 10.0.29.2.3784: BFDv1, Control, State Up, Flags: [none], length: 24
 00:00:15.701613 eth1  Out IP 10.0.29.2.54050 > 10.0.29.3.3784: BFDv1, Control, State Up, Flags: [none], length: 24
 00:00:15.776874 eth1  Out IP 10.0.29.2.54050 > 10.0.29.3.3784: BFDv1, Control, State Up, Flags: [none], length: 24
 00:00:15.781072 eth1  In  IP 10.0.29.3.40325 > 10.0.29.2.3784: BFDv1, Control, State Up, Flags: [none], length: 24
 00:00:15.865101 eth1  In  IP 10.0.29.3.40325 > 10.0.29.2.3784: BFDv1, Control, State Up, Flags: [none], length: 24
 00:00:15.865229 eth1  Out IP 10.0.29.2.54050 > 10.0.29.3.3784: BFDv1, Control, State Up, Flags: [none], length: 24
 00:00:15.948427 eth1  In  IP 10.0.29.3.40325 > 10.0.29.2.3784: BFDv1, Control, State Up, Flags: [none], length: 24
 00:00:15.950696 eth1  Out IP 10.0.29.2.54050 > 10.0.29.3.3784: BFDv1, Control, State Up, Flags: [none], length: 24
 00:00:16.033865 eth1  In  IP 10.0.29.3.40325 > 10.0.29.2.3784: BFDv1, Control, State Up, Flags: [none], length: 24
 00:00:16.038160 eth1  Out IP 10.0.29.2.54050 > 10.0.29.3.3784: BFDv1, Control, State Up, Flags: [none], length: 24
 00:00:16.122232 eth1  In  IP 10.0.29.3.40325 > 10.0.29.2.3784: BFDv1, Control, State Up, Flags: [none], length: 24
 00:00:16.127532 eth1  Out IP 10.0.29.2.54050 > 10.0.29.3.3784: BFDv1, Control, State Up, Flags: [none], length: 24
 00:00:16.204695 eth1  In  IP 10.0.29.3.40325 > 10.0.29.2.3784: BFDv1, Control, State Up, Flags: [none], length: 24
 00:00:16.214972 eth1  Out IP 10.0.29.2.54050 > 10.0.29.3.3784: BFDv1, Control, State Up, Flags: [none], length: 24
 00:00:16.287050 eth1  In  IP 10.0.29.3.40325 > 10.0.29.2.3784: BFDv1, Control, State Up, Flags: [none], length: 24
 00:00:16.295408 eth1  Out IP 10.0.29.2.54050 > 10.0.29.3.3784: BFDv1, Control, State Up, Flags: [none], length: 24
 00:00:16.372424 eth1  In  IP 10.0.29.3.40325 > 10.0.29.2.3784: BFDv1, Control, State Up, Flags: [none], length: 24
 00:00:16.373660 eth1  Out IP 10.0.29.2.54050 > 10.0.29.3.3784: BFDv1, Control, State Up, Flags: [none], length: 24
 00:00:16.453831 eth1  Out IP 10.0.29.2.54050 > 10.0.29.3.3784: BFDv1, Control, State Up, Flags: [none], length: 24
 00:00:16.455014 eth1  In  IP 10.0.29.3.40325 > 10.0.29.2.3784: BFDv1, Control, State Up, Flags: [none], length: 24
 00:00:16.533212 eth1  In  IP 10.0.29.3.40325 > 10.0.29.2.3784: BFDv1, Control, State Up, Flags: [none], length: 24
 00:00:16.542499 eth1  Out IP 10.0.29.2.54050 > 10.0.29.3.3784: BFDv1, Control, State Up, Flags: [none], length: 24
 00:00:16.617666 eth1  In  IP 10.0.29.3.40325 > 10.0.29.2.3784: BFDv1, Control, State Up, Flags: [none], length: 24
 00:00:16.618026 eth1  Out IP 10.0.29.2.54050 > 10.0.29.3.3784: BFDv1, Control, State Up, Flags: [none], length: 24
 00:00:16.703955 eth1  In  IP 10.0.29.3.40325 > 10.0.29.2.3784: BFDv1, Control, State Up, Flags: [none], length: 24
 00:00:16.706297 eth1  Out IP 10.0.29.2.54050 > 10.0.29.3.3784: BFDv1, Control, State Up, Flags: [none], length: 24
 00:00:16.782455 eth1  In  IP 10.0.29.3.40325 > 10.0.29.2.3784: BFDv1, Control, State Up, Flags: [none], length: 24
 00:00:16.788826 eth1  Out IP 10.0.29.2.54050 > 10.0.29.3.3784: BFDv1, Control, State Up, Flags: [none], length: 24
 00:00:16.862892 eth1  In  IP 10.0.29.3.40325 > 10.0.29.2.3784: BFDv1, Control, State Up, Flags: [none], length: 24
 00:00:16.875219 eth1  Out IP 10.0.29.2.54050 > 10.0.29.3.3784: BFDv1, Control, State Up, Flags: [none], length: 24
 00:00:16.945286 eth1  In  IP 10.0.29.3.40325 > 10.0.29.2.3784: BFDv1, Control, State Up, Flags: [none], length: 24
 00:00:16.954516 eth1  Out IP 10.0.29.2.54050 > 10.0.29.3.3784: BFDv1, Control, State Up, Flags: [none], length: 24
 00:00:17.021767 eth1  In  IP 10.0.29.3.40325 > 10.0.29.2.3784: BFDv1, Control, State Up, Flags: [none], length: 24
 00:00:17.044094 eth1  Out IP 10.0.29.2.54050 > 10.0.29.3.3784: BFDv1, Control, State Up, Flags: [none], length: 24
 00:00:17.112101 eth1  In  IP 10.0.29.3.40325 > 10.0.29.2.3784: BFDv1, Control, State Up, Flags: [none], length: 24
 00:00:17.126486 eth1  Out IP 10.0.29.2.54050 > 10.0.29.3.3784: BFDv1, Control, State Up, Flags: [none], length: 24
 00:00:17.199501 eth1  In  IP 10.0.29.3.40325 > 10.0.29.2.3784: BFDv1, Control, State Up, Flags: [none], length: 24
 00:00:17.215755 eth1  Out IP 10.0.29.2.54050 > 10.0.29.3.3784: BFDv1, Control, State Up, Flags: [none], length: 24
 00:00:17.285172 eth1  In  IP 10.0.29.3.40325 > 10.0.29.2.3784: BFDv1, Control, State Up, Flags: [none], length: 24
 00:00:17.293461 eth1  Out IP 10.0.29.2.54050 > 10.0.29.3.3784: BFDv1, Control, State Up, Flags: [none], length: 24
 00:00:17.363765 eth1  In  IP 10.0.29.3.40325 > 10.0.29.2.3784: BFDv1, Control, State Up, Flags: [none], length: 24
 00:00:17.383086 eth1  Out IP 10.0.29.2.54050 > 10.0.29.3.3784: BFDv1, Control, State Up, Flags: [none], length: 24
 00:00:17.450559 eth1  In  IP 10.0.29.3.40325 > 10.0.29.2.3784: BFDv1, Control, State Up, Flags: [none], length: 24
 00:00:17.457828 eth1  Out IP 10.0.29.2.54050 > 10.0.29.3.3784: BFDv1, Control, State Up, Flags: [none], length: 24
 00:00:17.535072 eth1  Out IP 10.0.29.2.54050 > 10.0.29.3.3784: BFDv1, Control, State Up, Flags: [none], length: 24
 00:00:17.538437 eth1  In  IP 10.0.29.3.40325 > 10.0.29.2.3784: BFDv1, Control, State Up, Flags: [none], length: 24
 00:00:17.621731 eth1  Out IP 10.0.29.2.54050 > 10.0.29.3.3784: BFDv1, Control, State Up, Flags: [none], length: 24
 00:00:17.627032 eth1  In  IP 10.0.29.3.40325 > 10.0.29.2.3784: BFDv1, Control, State Up, Flags: [none], length: 24
 00:00:17.698420 eth1  Out IP 10.0.29.2.54050 > 10.0.29.3.3784: BFDv1, Control, State Up, Flags: [none], length: 24
 00:00:17.714456 eth1  In  IP 10.0.29.3.40325 > 10.0.29.2.3784: BFDv1, Control, State Up, Flags: [none], length: 24
 00:00:17.784921 eth1  Out IP 10.0.29.2.54050 > 10.0.29.3.3784: BFDv1, Control, State Up, Flags: [none], length: 24
 00:00:17.796325 eth1  In  IP 10.0.29.3.40325 > 10.0.29.2.3784: BFDv1, Control, State Up, Flags: [none], length: 24
 00:00:17.862145 eth1  Out IP 10.0.29.2.54050 > 10.0.29.3.3784: BFDv1, Control, State Up, Flags: [none], length: 24
 00:00:17.879692 eth1  In  IP 10.0.29.3.40325 > 10.0.29.2.3784: BFDv1, Control, State Up, Flags: [none], length: 24
 00:00:17.950146 eth1  Out IP 10.0.29.2.54050 > 10.0.29.3.3784: BFDv1, Control, State Up, Flags: [none], length: 24
 00:00:17.961437 eth1  In  IP 10.0.29.3.40325 > 10.0.29.2.3784: BFDv1, Control, State Up, Flags: [none], length: 24
 00:00:18.030849 eth1  Out IP 10.0.29.2.54050 > 10.0.29.3.3784: BFDv1, Control, State Up, Flags: [none], length: 24
 00:00:18.050121 eth1  In  IP 10.0.29.3.40325 > 10.0.29.2.3784: BFDv1, Control, State Up, Flags: [none], length: 24
 00:00:18.109876 eth1  Out IP 10.0.29.2.54050 > 10.0.29.3.3784: BFDv1, Control, State Up, Flags: [none], length: 24
 00:00:18.137184 eth1  In  IP 10.0.29.3.40325 > 10.0.29.2.3784: BFDv1, Control, State Up, Flags: [none], length: 24
 00:00:18.199582 eth1  Out IP 10.0.29.2.54050 > 10.0.29.3.3784: BFDv1, Control, State Up, Flags: [none], length: 24
 00:00:18.225935 eth1  In  IP 10.0.29.3.40325 > 10.0.29.2.3784: BFDv1, Control, State Up, Flags: [none], length: 24
 00:00:18.288407 eth1  Out IP 10.0.29.2.54050 > 10.0.29.3.3784: BFDv1, Control, State Up, Flags: [none], length: 24
 00:00:18.303675 eth1  In  IP 10.0.29.3.40325 > 10.0.29.2.3784: BFDv1, Control, State Up, Flags: [none], length: 24
 00:00:18.368176 eth1  Out IP 10.0.29.2.54050 > 10.0.29.3.3784: BFDv1, Control, State Up, Flags: [none], length: 24
 00:00:18.385309 eth1  In  IP 10.0.29.3.40325 > 10.0.29.2.3784: BFDv1, Control, State Up, Flags: [none], length: 24
 00:00:18.455737 eth1  Out IP 10.0.29.2.54050 > 10.0.29.3.3784: BFDv1, Control, State Up, Flags: [none], length: 24
 00:00:18.464667 eth1  In  IP 10.0.29.3.40325 > 10.0.29.2.3784: BFDv1, Control, State Up, Flags: [none], length: 24
 00:00:18.541056 eth1  Out IP 10.0.29.2.54050 > 10.0.29.3.3784: BFDv1, Control, State Up, Flags: [none], length: 24
 00:00:18.543426 eth1  Out IP 10.0.29.2.60651 > 10.0.29.3.179: Flags [S], seq 1226189870, win 64240, options [mss 1460,sackOK,TS val 1876757414 ecr 0,nop,wscale 10], length 0
 00:00:18.543484 eth1  In  IP 10.0.29.3.179 > 10.0.29.2.60651: Flags [S.], seq 3743711597, ack 1226189871, win 65160, options [mss 1460,sackOK,TS val 3829512388 ecr 1876757414,nop,wscale 10], length 0
 00:00:18.543511 eth1  Out IP 10.0.29.2.60651 > 10.0.29.3.179: Flags [.], ack 1, win 63, options [nop,nop,TS val 1876757414 ecr 3829512388], length 0
 00:00:18.543606 eth1  Out IP 10.0.29.2.60651 > 10.0.29.3.179: Flags [P.], seq 1:65, ack 1, win 63, options [nop,nop,TS val 1876757414 ecr 3829512388], length 64: BGP
 00:00:18.543625 eth1  In  IP 10.0.29.3.179 > 10.0.29.2.60651: Flags [.], ack 65, win 64, options [nop,nop,TS val 3829512388 ecr 1876757414], length 0
 00:00:18.543684 eth1  In  IP 10.0.29.3.179 > 10.0.29.2.60651: Flags [R.], seq 1, ack 65, win 64, options [nop,nop,TS val 3829512388 ecr 1876757414], length 0
 00:00:18.549338 eth1  In  IP 10.0.29.3.40325 > 10.0.29.2.3784: BFDv1, Control, State Up, Flags: [none], length: 24
 00:00:18.616825 eth1  Out IP 10.0.29.2.54050 > 10.0.29.3.3784: BFDv1, Control, State Up, Flags: [none], length: 24
 00:00:18.636185 eth1  In  IP 10.0.29.3.40325 > 10.0.29.2.3784: BFDv1, Control, State Up, Flags: [none], length: 24
 00:00:18.692626 eth1  Out IP 10.0.29.2.54050 > 10.0.29.3.3784: BFDv1, Control, State Up, Flags: [none], length: 24
 00:00:18.712976 eth1  In  IP 10.0.29.3.40325 > 10.0.29.2.3784: BFDv1, Control, State Up, Flags: [none], length: 24
 00:00:18.778203 eth1  Out IP 10.0.29.2.54050 > 10.0.29.3.3784: BFDv1, Control, State Up, Flags: [none], length: 24
 00:00:18.796706 eth1  In  IP 10.0.29.3.40325 > 10.0.29.2.3784: BFDv1, Control, State Up, Flags: [none], length: 24
 00:00:18.859075 eth1  Out IP 10.0.29.2.54050 > 10.0.29.3.3784: BFDv1, Control, State Up, Flags: [none], length: 24
 00:00:18.884433 eth1  In  IP 10.0.29.3.40325 > 10.0.29.2.3784: BFDv1, Control, State Up, Flags: [none], length: 24
 00:00:18.934811 eth1  Out IP 10.0.29.2.54050 > 10.0.29.3.3784: BFDv1, Control, State Up, Flags: [none], length: 24
 00:00:18.966245 eth1  In  IP 10.0.29.3.40325 > 10.0.29.2.3784: BFDv1, Control, State Up, Flags: [none], length: 24
 00:00:19.017684 eth1  Out IP 10.0.29.2.54050 > 10.0.29.3.3784: BFDv1, Control, State Up, Flags: [none], length: 24
 00:00:19.055217 eth1  In  IP 10.0.29.3.40325 > 10.0.29.2.3784: BFDv1, Control, State Up, Flags: [none], length: 24
 00:00:19.104620 eth1  Out IP 10.0.29.2.54050 > 10.0.29.3.3784: BFDv1, Control, State Up, Flags: [none], length: 24
 00:00:19.139992 eth1  In  IP 10.0.29.3.40325 > 10.0.29.2.3784: BFDv1, Control, State Up, Flags: [none], length: 24
 00:00:19.193425 eth1  Out IP 10.0.29.2.54050 > 10.0.29.3.3784: BFDv1, Control, State Up, Flags: [none], length: 24
 00:00:19.228947 eth1  In  IP 10.0.29.3.40325 > 10.0.29.2.3784: BFDv1, Control, State Up, Flags: [none], length: 24
 00:00:19.280310 eth1  Out IP 10.0.29.2.54050 > 10.0.29.3.3784: BFDv1, Control, State Up, Flags: [none], length: 24
 00:00:19.316818 eth1  In  IP 10.0.29.3.40325 > 10.0.29.2.3784: BFDv1, Control, State Up, Flags: [none], length: 24
 00:00:19.366336 eth1  Out IP 10.0.29.2.54050 > 10.0.29.3.3784: BFDv1, Control, State Up, Flags: [none], length: 24
 00:00:19.399600 eth1  In  IP 10.0.29.3.40325 > 10.0.29.2.3784: BFDv1, Control, State Up, Flags: [none], length: 24
 00:00:19.447041 eth1  Out IP 10.0.29.2.54050 > 10.0.29.3.3784: BFDv1, Control, State Up, Flags: [none], length: 24
 00:00:19.475356 eth1  In  IP 10.0.29.3.40325 > 10.0.29.2.3784: BFDv1, Control, State Up, Flags: [none], length: 24
 00:00:19.532812 eth1  Out IP 10.0.29.2.54050 > 10.0.29.3.3784: BFDv1, Control, State Up, Flags: [none], length: 24
 00:00:19.561473 eth1  In  IP 10.0.29.3.40325 > 10.0.29.2.3784: BFDv1, Control, State Up, Flags: [none], length: 24
 00:00:19.620840 eth1  Out IP 10.0.29.2.54050 > 10.0.29.3.3784: BFDv1, Control, State Up, Flags: [none], length: 24
 00:00:19.647376 eth1  In  IP 10.0.29.3.40325 > 10.0.29.2.3784: BFDv1, Control, State Up, Flags: [none], length: 24
 00:00:19.700813 eth1  Out IP 10.0.29.2.54050 > 10.0.29.3.3784: BFDv1, Control, State Up, Flags: [none], length: 24
 00:00:19.731263 eth1  In  IP 10.0.29.3.40325 > 10.0.29.2.3784: BFDv1, Control, State Up, Flags: [none], length: 24
 00:00:19.786665 eth1  Out IP 10.0.29.2.54050 > 10.0.29.3.3784: BFDv1, Control, State Up, Flags: [none], length: 24
 00:00:19.820203 eth1  In  IP 10.0.29.3.40325 > 10.0.29.2.3784: BFDv1, Control, State Up, Flags: [none], length: 24
 00:00:19.861616 eth1  Out IP 10.0.29.2.54050 > 10.0.29.3.3784: BFDv1, Control, State Up, Flags: [none], length: 24
 00:00:19.899187 eth1  In  IP 10.0.29.3.40325 > 10.0.29.2.3784: BFDv1, Control, State Up, Flags: [none], length: 24
 00:00:19.937648 eth1  Out IP 10.0.29.2.54050 > 10.0.29.3.3784: BFDv1, Control, State Up, Flags: [none], length: 24
 00:00:19.976134 eth1  In  IP 10.0.29.3.40325 > 10.0.29.2.3784: BFDv1, Control, State Up, Flags: [none], length: 24
 00:00:20.025566 eth1  Out IP 10.0.29.2.54050 > 10.0.29.3.3784: BFDv1, Control, State Up, Flags: [none], length: 24
 00:00:20.057066 eth1  In  IP 10.0.29.3.40325 > 10.0.29.2.3784: BFDv1, Control, State Up, Flags: [none], length: 24
 00:00:20.112505 eth1  Out IP 10.0.29.2.54050 > 10.0.29.3.3784: BFDv1, Control, State Up, Flags: [none], length: 24
 00:00:20.142018 eth1  In  IP 10.0.29.3.40325 > 10.0.29.2.3784: BFDv1, Control, State Up, Flags: [none], length: 24
 00:00:20.189480 eth1  Out IP 10.0.29.2.54050 > 10.0.29.3.3784: BFDv1, Control, State Up, Flags: [none], length: 24
 00:00:20.225008 eth1  In  IP 10.0.29.3.40325 > 10.0.29.2.3784: BFDv1, Control, State Up, Flags: [none], length: 24
 00:00:20.275473 eth1  Out IP 10.0.29.2.54050 > 10.0.29.3.3784: BFDv1, Control, State Up, Flags: [none], length: 24
 00:00:20.311978 eth1  In  IP 10.0.29.3.40325 > 10.0.29.2.3784: BFDv1, Control, State Up, Flags: [none], length: 24
 00:00:20.352451 eth1  Out IP 10.0.29.2.54050 > 10.0.29.3.3784: BFDv1, Control, State Up, Flags: [none], length: 24
 00:00:20.399949 eth1  In  IP 10.0.29.3.40325 > 10.0.29.2.3784: BFDv1, Control, State Up, Flags: [none], length: 24
 00:00:20.434310 eth1  Out IP 10.0.29.2.54050 > 10.0.29.3.3784: BFDv1, Control, State Up, Flags: [none], length: 24
 00:00:20.480769 eth1  In  IP 10.0.29.3.40325 > 10.0.29.2.3784: BFDv1, Control, State Up, Flags: [none], length: 24
 00:00:20.519163 eth1  Out IP 10.0.29.2.54050 > 10.0.29.3.3784: BFDv1, Control, State Up, Flags: [none], length: 24
 00:00:20.569932 eth1  In  IP 10.0.29.3.40325 > 10.0.29.2.3784: BFDv1, Control, State Up, Flags: [none], length: 24
 00:00:20.595319 eth1  Out IP 10.0.29.2.54050 > 10.0.29.3.3784: BFDv1, Control, State Up, Flags: [none], length: 24
 00:00:20.654166 eth1  In  IP 10.0.29.3.40325 > 10.0.29.2.3784: BFDv1, Control, State Up, Flags: [none], length: 24
 00:00:20.681611 eth1  Out IP 10.0.29.2.54050 > 10.0.29.3.3784: BFDv1, Control, State Up, Flags: [none], length: 24
 00:00:20.733474 eth1  In  IP 10.0.29.3.40325 > 10.0.29.2.3784: BFDv1, Control, State Up, Flags: [none], length: 24
 00:00:20.763949 eth1  Out IP 10.0.29.2.54050 > 10.0.29.3.3784: BFDv1, Control, State Up, Flags: [none], length: 24
 00:00:20.810651 eth1  In  IP 10.0.29.3.40325 > 10.0.29.2.3784: BFDv1, Control, State Up, Flags: [none], length: 24
 00:00:20.849059 eth1  Out IP 10.0.29.2.54050 > 10.0.29.3.3784: BFDv1, Control, State Up, Flags: [none], length: 24
 00:00:20.888902 eth1  In  IP 10.0.29.3.40325 > 10.0.29.2.3784: BFDv1, Control, State Up, Flags: [none], length: 24
 00:00:20.936411 eth1  Out IP 10.0.29.2.54050 > 10.0.29.3.3784: BFDv1, Control, State Up, Flags: [none], length: 24
 00:00:20.971913 eth1  In  IP 10.0.29.3.40325 > 10.0.29.2.3784: BFDv1, Control, State Up, Flags: [none], length: 24
 00:00:21.017340 eth1  Out IP 10.0.29.2.54050 > 10.0.29.3.3784: BFDv1, Control, State Up, Flags: [none], length: 24
 00:00:21.058883 eth1  In  IP 10.0.29.3.40325 > 10.0.29.2.3784: BFDv1, Control, State Up, Flags: [none], length: 24
 00:00:21.093276 eth1  Out IP 10.0.29.2.54050 > 10.0.29.3.3784: BFDv1, Control, State Up, Flags: [none], length: 24
 00:00:21.147695 eth1  In  IP 10.0.29.3.40325 > 10.0.29.2.3784: BFDv1, Control, State Up, Flags: [none], length: 24
 00:00:21.171056 eth1  Out IP 10.0.29.2.54050 > 10.0.29.3.3784: BFDv1, Control, State Up, Flags: [none], length: 24
 00:00:21.233196 eth1  In  IP 10.0.29.3.40325 > 10.0.29.2.3784: BFDv1, Control, State Up, Flags: [none], length: 24
 00:00:21.252621 eth1  Out IP 10.0.29.2.54050 > 10.0.29.3.3784: BFDv1, Control, State Up, Flags: [none], length: 24
 00:00:21.322523 eth1  In  IP 10.0.29.3.40325 > 10.0.29.2.3784: BFDv1, Control, State Up, Flags: [none], length: 24
 00:00:21.339035 eth1  Out IP 10.0.29.2.54050 > 10.0.29.3.3784: BFDv1, Control, State Up, Flags: [none], length: 24
 00:00:21.402622 eth1  In  IP 10.0.29.3.40325 > 10.0.29.2.3784: BFDv1, Control, State Up, Flags: [none], length: 24
 00:00:21.420011 eth1  Out IP 10.0.29.2.54050 > 10.0.29.3.3784: BFDv1, Control, State Up, Flags: [none], length: 24
 00:00:21.484201 eth1  In  IP 10.0.29.3.40325 > 10.0.29.2.3784: BFDv1, Control, State Up, Flags: [none], length: 24
 00:00:21.503646 eth1  Out IP 10.0.29.2.54050 > 10.0.29.3.3784: BFDv1, Control, State Up, Flags: [none], length: 24
 00:00:21.567748 eth1  In  IP 10.0.29.3.40325 > 10.0.29.2.3784: BFDv1, Control, State Up, Flags: [none], length: 24
 00:00:21.583153 eth1  Out IP 10.0.29.2.54050 > 10.0.29.3.3784: BFDv1, Control, State Up, Flags: [none], length: 24
 00:00:21.650250 eth1  In  IP 10.0.29.3.40325 > 10.0.29.2.3784: BFDv1, Control, State Up, Flags: [none], length: 24
 00:00:21.661743 eth1  Out IP 10.0.29.2.54050 > 10.0.29.3.3784: BFDv1, Control, State Up, Flags: [none], length: 24
 00:00:21.728693 eth1  In  IP 10.0.29.3.40325 > 10.0.29.2.3784: BFDv1, Control, State Up, Flags: [none], length: 24
 00:00:21.743082 eth1  Out IP 10.0.29.2.54050 > 10.0.29.3.3784: BFDv1, Control, State Up, Flags: [none], length: 24
 00:00:21.810481 eth1  In  IP 10.0.29.3.40325 > 10.0.29.2.3784: BFDv1, Control, State Up, Flags: [none], length: 24
 00:00:21.818187 eth1  Out IP 10.0.29.2.54050 > 10.0.29.3.3784: BFDv1, Control, State Up, Flags: [none], length: 24
 00:00:21.891049 eth1  In  IP 10.0.29.3.40325 > 10.0.29.2.3784: BFDv1, Control, State Up, Flags: [none], length: 24
 00:00:21.907511 eth1  Out IP 10.0.29.2.54050 > 10.0.29.3.3784: BFDv1, Control, State Up, Flags: [none], length: 24
 00:00:21.967913 eth1  In  IP 10.0.29.3.40325 > 10.0.29.2.3784: BFDv1, Control, State Up, Flags: [none], length: 24
 00:00:21.994328 eth1  Out IP 10.0.29.2.54050 > 10.0.29.3.3784: BFDv1, Control, State Up, Flags: [none], length: 24
 00:00:22.046805 eth1  In  IP 10.0.29.3.40325 > 10.0.29.2.3784: BFDv1, Control, State Up, Flags: [none], length: 24
 00:00:22.081226 eth1  Out IP 10.0.29.2.54050 > 10.0.29.3.3784: BFDv1, Control, State Up, Flags: [none], length: 24
 00:00:22.125024 eth1  In  IP 10.0.29.3.40325 > 10.0.29.2.3784: BFDv1, Control, State Up, Flags: [none], length: 24
 00:00:22.167387 eth1  Out IP 10.0.29.2.54050 > 10.0.29.3.3784: BFDv1, Control, State Up, Flags: [none], length: 24
 00:00:22.206672 eth1  In  IP 10.0.29.3.40325 > 10.0.29.2.3784: BFDv1, Control, State Up, Flags: [none], length: 24
 00:00:22.244046 eth1  Out IP 10.0.29.2.54050 > 10.0.29.3.3784: BFDv1, Control, State Up, Flags: [none], length: 24
 00:00:22.291672 eth1  In  IP 10.0.29.3.40325 > 10.0.29.2.3784: BFDv1, Control, State Up, Flags: [none], length: 24
 00:00:22.327082 eth1  Out IP 10.0.29.2.54050 > 10.0.29.3.3784: BFDv1, Control, State Up, Flags: [none], length: 24
 00:00:22.380100 eth1  In  IP 10.0.29.3.40325 > 10.0.29.2.3784: BFDv1, Control, State Up, Flags: [none], length: 24
 00:00:22.413562 eth1  Out IP 10.0.29.2.54050 > 10.0.29.3.3784: BFDv1, Control, State Up, Flags: [none], length: 24
 00:00:22.456880 eth1  In  IP 10.0.29.3.40325 > 10.0.29.2.3784: BFDv1, Control, State Up, Flags: [none], length: 24
 00:00:22.491295 eth1  Out IP 10.0.29.2.54050 > 10.0.29.3.3784: BFDv1, Control, State Up, Flags: [none], length: 24
 00:00:22.545579 eth1  In  IP 10.0.29.3.40325 > 10.0.29.2.3784: BFDv1, Control, State Up, Flags: [none], length: 24
 00:00:22.570941 eth1  Out IP 10.0.29.2.54050 > 10.0.29.3.3784: BFDv1, Control, State Up, Flags: [none], length: 24
 00:00:22.626205 eth1  In  IP 10.0.29.3.40325 > 10.0.29.2.3784: BFDv1, Control, State Up, Flags: [none], length: 24
 00:00:22.653567 eth1  Out IP 10.0.29.2.54050 > 10.0.29.3.3784: BFDv1, Control, State Up, Flags: [none], length: 24
 00:00:22.703832 eth1  In  IP 10.0.29.3.40325 > 10.0.29.2.3784: BFDv1, Control, State Up, Flags: [none], length: 24
 00:00:22.712294 eth1  Out IP 10.0.29.2.60539 > 10.0.29.3.179: Flags [S], seq 642761813, win 64240, options [mss 1460,sackOK,TS val 1876761582 ecr 0,nop,wscale 10], length 0
 00:00:22.712406 eth1  In  IP 10.0.29.3.179 > 10.0.29.2.60539: Flags [S.], seq 3097678606, ack 642761814, win 65160, options [mss 1460,sackOK,TS val 3829516557 ecr 1876761582,nop,wscale 10], length 0
 00:00:22.712455 eth1  Out IP 10.0.29.2.60539 > 10.0.29.3.179: Flags [.], ack 1, win 63, options [nop,nop,TS val 1876761583 ecr 3829516557], length 0
 00:00:22.712617 eth1  In  IP 10.0.29.3.179 > 10.0.29.2.60539: Flags [F.], seq 1, ack 1, win 64, options [nop,nop,TS val 3829516557 ecr 1876761583], length 0
 00:00:22.712624 eth1  Out IP 10.0.29.2.60539 > 10.0.29.3.179: Flags [P.], seq 1:65, ack 1, win 63, options [nop,nop,TS val 1876761583 ecr 3829516557], length 64: BGP
 00:00:22.712684 eth1  In  IP 10.0.29.3.179 > 10.0.29.2.60539: Flags [R], seq 3097678607, win 0, length 0
 00:00:22.734199 eth1  Out IP 10.0.29.2.54050 > 10.0.29.3.3784: BFDv1, Control, State Up, Flags: [none], length: 24
 00:00:22.780682 eth1  In  IP 10.0.29.3.40325 > 10.0.29.2.3784: BFDv1, Control, State Up, Flags: [none], length: 24
 00:00:22.818120 eth1  Out IP 10.0.29.2.54050 > 10.0.29.3.3784: BFDv1, Control, State Up, Flags: [none], length: 24
 00:00:22.866403 eth1  In  IP 10.0.29.3.40325 > 10.0.29.2.3784: BFDv1, Control, State Up, Flags: [none], length: 24
 00:00:22.903858 eth1  Out IP 10.0.29.2.54050 > 10.0.29.3.3784: BFDv1, Control, State Up, Flags: [none], length: 24
 00:00:22.945103 eth1  In  IP 10.0.29.3.40325 > 10.0.29.2.3784: BFDv1, Control, State Up, Flags: [none], length: 24
 00:00:22.986467 eth1  Out IP 10.0.29.2.54050 > 10.0.29.3.3784: BFDv1, Control, State Up, Flags: [none], length: 24
 00:00:23.023723 eth1  In  IP 10.0.29.3.40325 > 10.0.29.2.3784: BFDv1, Control, State Up, Flags: [none], length: 24
 00:00:23.064080 eth1  Out IP 10.0.29.2.54050 > 10.0.29.3.3784: BFDv1, Control, State Up, Flags: [none], length: 24
 00:00:23.099384 eth1  In  IP 10.0.29.3.40325 > 10.0.29.2.3784: BFDv1, Control, State Up, Flags: [none], length: 24
 00:00:23.144788 eth1  Out IP 10.0.29.2.54050 > 10.0.29.3.3784: BFDv1, Control, State Up, Flags: [none], length: 24
 00:00:23.184059 eth1  In  IP 10.0.29.3.40325 > 10.0.29.2.3784: BFDv1, Control, State Up, Flags: [none], length: 24
 00:00:23.224457 eth1  Out IP 10.0.29.2.54050 > 10.0.29.3.3784: BFDv1, Control, State Up, Flags: [none], length: 24
 00:00:23.262739 eth1  In  IP 10.0.29.3.40325 > 10.0.29.2.3784: BFDv1, Control, State Up, Flags: [none], length: 24
 00:00:23.307172 eth1  Out IP 10.0.29.2.54050 > 10.0.29.3.3784: BFDv1, Control, State Up, Flags: [none], length: 24
 00:00:23.343497 eth1  In  IP 10.0.29.3.40325 > 10.0.29.2.3784: BFDv1, Control, State Up, Flags: [none], length: 24
 00:00:23.388897 eth1  Out IP 10.0.29.2.54050 > 10.0.29.3.3784: BFDv1, Control, State Up, Flags: [none], length: 24
 00:00:23.418196 eth1  In  IP 10.0.29.3.40325 > 10.0.29.2.3784: BFDv1, Control, State Up, Flags: [none], length: 24
 00:00:23.469574 eth1  Out IP 10.0.29.2.54050 > 10.0.29.3.3784: BFDv1, Control, State Up, Flags: [none], length: 24
 00:00:23.501862 eth1  In  IP 10.0.29.3.40325 > 10.0.29.2.3784: BFDv1, Control, State Up, Flags: [none], length: 24
 00:00:23.559294 eth1  Out IP 10.0.29.2.54050 > 10.0.29.3.3784: BFDv1, Control, State Up, Flags: [none], length: 24
 00:00:23.591663 eth1  In  IP 10.0.29.3.40325 > 10.0.29.2.3784: BFDv1, Control, State Up, Flags: [none], length: 24
 00:00:23.636006 eth1  Out IP 10.0.29.2.54050 > 10.0.29.3.3784: BFDv1, Control, State Up, Flags: [none], length: 24
 00:00:23.679251 eth1  In  IP 10.0.29.3.40325 > 10.0.29.2.3784: BFDv1, Control, State Up, Flags: [none], length: 24
 00:00:23.723602 eth1  Out IP 10.0.29.2.54050 > 10.0.29.3.3784: BFDv1, Control, State Up, Flags: [none], length: 24
 00:00:23.765784 eth1  In  IP 10.0.29.3.40325 > 10.0.29.2.3784: BFDv1, Control, State Up, Flags: [none], length: 24
 00:00:23.807090 eth1  Out IP 10.0.29.2.54050 > 10.0.29.3.3784: BFDv1, Control, State Up, Flags: [none], length: 24
 00:00:23.855375 eth1  In  IP 10.0.29.3.40325 > 10.0.29.2.3784: BFDv1, Control, State Up, Flags: [none], length: 24
 00:00:23.887764 eth1  Out IP 10.0.29.2.54050 > 10.0.29.3.3784: BFDv1, Control, State Up, Flags: [none], length: 24
 00:00:23.938075 eth1  In  IP 10.0.29.3.40325 > 10.0.29.2.3784: BFDv1, Control, State Up, Flags: [none], length: 24
 00:00:23.964511 eth1  Out IP 10.0.29.2.54050 > 10.0.29.3.3784: BFDv1, Control, State Up, Flags: [none], length: 24
 00:00:24.016761 eth1  In  IP 10.0.29.3.40325 > 10.0.29.2.3784: BFDv1, Control, State Up, Flags: [none], length: 24
 00:00:24.054118 eth1  Out IP 10.0.29.2.54050 > 10.0.29.3.3784: BFDv1, Control, State Up, Flags: [none], length: 24
 00:00:24.105421 eth1  In  IP 10.0.29.3.40325 > 10.0.29.2.3784: BFDv1, Control, State Up, Flags: [none], length: 24
 00:00:24.134908 eth1  Out IP 10.0.29.2.54050 > 10.0.29.3.3784: BFDv1, Control, State Up, Flags: [none], length: 24
 00:00:24.190174 eth1  In  IP 10.0.29.3.40325 > 10.0.29.2.3784: BFDv1, Control, State Up, Flags: [none], length: 24
 00:00:24.209627 eth1  Out IP 10.0.29.2.54050 > 10.0.29.3.3784: BFDv1, Control, State Up, Flags: [none], length: 24
 00:00:24.269880 eth1  In  IP 10.0.29.3.40325 > 10.0.29.2.3784: BFDv1, Control, State Up, Flags: [none], length: 24
 00:00:24.296274 eth1  Out IP 10.0.29.2.54050 > 10.0.29.3.3784: BFDv1, Control, State Up, Flags: [none], length: 24
 00:00:24.355542 eth1  In  IP 10.0.29.3.40325 > 10.0.29.2.3784: BFDv1, Control, State Up, Flags: [none], length: 24
 00:00:24.373792 eth1  Out IP 10.0.29.2.54050 > 10.0.29.3.3784: BFDv1, Control, State Up, Flags: [none], length: 24
 00:00:24.438025 eth1  In  IP 10.0.29.3.40325 > 10.0.29.2.3784: BFDv1, Control, State Up, Flags: [none], length: 24
 00:00:24.460329 eth1  Out IP 10.0.29.2.54050 > 10.0.29.3.3784: BFDv1, Control, State Up, Flags: [none], length: 24
 00:00:24.519659 eth1  In  IP 10.0.29.3.40325 > 10.0.29.2.3784: BFDv1, Control, State Up, Flags: [none], length: 24
 00:00:24.547681 eth1  Out IP 10.0.29.2.54050 > 10.0.29.3.3784: BFDv1, Control, State Up, Flags: [none], length: 24
 00:00:24.597944 eth1  In  IP 10.0.29.3.40325 > 10.0.29.2.3784: BFDv1, Control, State Up, Flags: [none], length: 24
 00:00:24.632293 eth1  Out IP 10.0.29.2.54050 > 10.0.29.3.3784: BFDv1, Control, State Up, Flags: [none], length: 24
 00:00:24.676596 eth1  In  IP 10.0.29.3.40325 > 10.0.29.2.3784: BFDv1, Control, State Up, Flags: [none], length: 24
 00:00:24.714969 eth1  Out IP 10.0.29.2.54050 > 10.0.29.3.3784: BFDv1, Control, State Up, Flags: [none], length: 24
 00:00:24.760371 eth1  In  IP 10.0.29.3.40325 > 10.0.29.2.3784: BFDv1, Control, State Up, Flags: [none], length: 24
 00:00:24.790735 eth1  Out IP 10.0.29.2.54050 > 10.0.29.3.3784: BFDv1, Control, State Up, Flags: [none], length: 24
 00:00:24.847969 eth1  In  IP 10.0.29.3.40325 > 10.0.29.2.3784: BFDv1, Control, State Up, Flags: [none], length: 24
 00:00:24.879600 eth1  Out IP 10.0.29.2.54050 > 10.0.29.3.3784: BFDv1, Control, State Up, Flags: [none], length: 24
 00:00:24.923753 eth1  In  IP 10.0.29.3.40325 > 10.0.29.2.3784: BFDv1, Control, State Up, Flags: [none], length: 24
 00:00:24.954074 eth1  Out IP 10.0.29.2.54050 > 10.0.29.3.3784: BFDv1, Control, State Up, Flags: [none], length: 24
 00:00:25.009254 eth1  In  IP 10.0.29.3.40325 > 10.0.29.2.3784: BFDv1, Control, State Up, Flags: [none], length: 24
 00:00:25.034585 eth1  Out IP 10.0.29.2.54050 > 10.0.29.3.3784: BFDv1, Control, State Up, Flags: [none], length: 24
 00:00:25.091921 eth1  In  IP 10.0.29.3.40325 > 10.0.29.2.3784: BFDv1, Control, State Up, Flags: [none], length: 24
 00:00:25.123179 eth1  Out IP 10.0.29.2.54050 > 10.0.29.3.3784: BFDv1, Control, State Up, Flags: [none], length: 24
 00:00:25.180332 eth1  In  IP 10.0.29.3.40325 > 10.0.29.2.3784: BFDv1, Control, State Up, Flags: [none], length: 24
 00:00:25.207558 eth1  Out IP 10.0.29.2.54050 > 10.0.29.3.3784: BFDv1, Control, State Up, Flags: [none], length: 24
 00:00:25.265748 eth1  In  IP 10.0.29.3.40325 > 10.0.29.2.3784: BFDv1, Control, State Up, Flags: [none], length: 24
 00:00:25.285002 eth1  Out IP 10.0.29.2.54050 > 10.0.29.3.3784: BFDv1, Control, State Up, Flags: [none], length: 24
 00:00:25.351450 eth1  In  IP 10.0.29.3.40325 > 10.0.29.2.3784: BFDv1, Control, State Up, Flags: [none], length: 24
 00:00:25.367752 eth1  Out IP 10.0.29.2.54050 > 10.0.29.3.3784: BFDv1, Control, State Up, Flags: [none], length: 24
 00:00:25.426053 eth1  In  IP 10.0.29.3.40325 > 10.0.29.2.3784: BFDv1, Control, State Up, Flags: [none], length: 24
 00:00:25.448440 eth1  Out IP 10.0.29.2.54050 > 10.0.29.3.3784: BFDv1, Control, State Up, Flags: [none], length: 24
 00:00:25.511686 eth1  In  IP 10.0.29.3.40325 > 10.0.29.2.3784: BFDv1, Control, State Up, Flags: [none], length: 24
 00:00:25.533031 eth1  Out IP 10.0.29.2.54050 > 10.0.29.3.3784: BFDv1, Control, State Up, Flags: [none], length: 24
 00:00:25.589234 eth1  In  IP 10.0.29.3.40325 > 10.0.29.2.3784: BFDv1, Control, State Up, Flags: [none], length: 24
 00:00:25.617595 eth1  Out IP 10.0.29.2.54050 > 10.0.29.3.3784: BFDv1, Control, State Up, Flags: [none], length: 24
 00:00:25.673792 eth1  In  IP 10.0.29.3.40325 > 10.0.29.2.3784: BFDv1, Control, State Up, Flags: [none], length: 24
 00:00:25.704092 eth1  Out IP 10.0.29.2.54050 > 10.0.29.3.3784: BFDv1, Control, State Up, Flags: [none], length: 24
 00:00:25.759540 eth1  In  IP 10.0.29.3.40325 > 10.0.29.2.3784: BFDv1, Control, State Up, Flags: [none], length: 24
 00:00:25.792775 eth1  Out IP 10.0.29.2.54050 > 10.0.29.3.3784: BFDv1, Control, State Up, Flags: [none], length: 24
 00:00:25.847904 eth1  In  IP 10.0.29.3.40325 > 10.0.29.2.3784: BFDv1, Control, State Up, Flags: [none], length: 24
 00:00:25.870157 eth1  Out IP 10.0.29.2.54050 > 10.0.29.3.3784: BFDv1, Control, State Up, Flags: [none], length: 24
 00:00:25.933333 eth1  In  IP 10.0.29.3.40325 > 10.0.29.2.3784: BFDv1, Control, State Up, Flags: [none], length: 24
 00:00:25.947542 eth1  Out IP 10.0.29.2.54050 > 10.0.29.3.3784: BFDv1, Control, State Up, Flags: [none], length: 24
 00:00:26.014027 eth1  In  IP 10.0.29.3.40325 > 10.0.29.2.3784: BFDv1, Control, State Up, Flags: [none], length: 24
 00:00:26.027231 eth1  Out IP 10.0.29.2.54050 > 10.0.29.3.3784: BFDv1, Control, State Up, Flags: [none], length: 24
 00:00:26.102876 eth1  In  IP 10.0.29.3.40325 > 10.0.29.2.3784: BFDv1, Control, State Up, Flags: [none], length: 24
 00:00:26.104052 eth1  Out IP 10.0.29.2.54050 > 10.0.29.3.3784: BFDv1, Control, State Up, Flags: [none], length: 24
 00:00:26.184299 eth1  In  IP 10.0.29.3.40325 > 10.0.29.2.3784: BFDv1, Control, State Up, Flags: [none], length: 24
 00:00:26.184323 eth1  Out IP 10.0.29.2.54050 > 10.0.29.3.3784: BFDv1, Control, State Up, Flags: [none], length: 24
 00:00:26.261519 eth1  Out IP 10.0.29.2.54050 > 10.0.29.3.3784: BFDv1, Control, State Up, Flags: [none], length: 24
 00:00:26.267673 eth1  In  IP 10.0.29.3.40325 > 10.0.29.2.3784: BFDv1, Control, State Up, Flags: [none], length: 24
 00:00:26.345897 eth1  Out IP 10.0.29.2.54050 > 10.0.29.3.3784: BFDv1, Control, State Up, Flags: [none], length: 24
 00:00:26.345952 eth1  In  IP 10.0.29.3.40325 > 10.0.29.2.3784: BFDv1, Control, State Up, Flags: [none], length: 24
 00:00:26.421320 eth1  In  IP 10.0.29.3.40325 > 10.0.29.2.3784: BFDv1, Control, State Up, Flags: [none], length: 24
 00:00:26.431564 eth1  Out IP 10.0.29.2.54050 > 10.0.29.3.3784: BFDv1, Control, State Up, Flags: [none], length: 24
 00:00:26.508081 eth1  In  IP 10.0.29.3.40325 > 10.0.29.2.3784: BFDv1, Control, State Up, Flags: [none], length: 24
 00:00:26.509323 eth1  Out IP 10.0.29.2.54050 > 10.0.29.3.3784: BFDv1, Control, State Up, Flags: [none], length: 24
 00:00:26.561834 eth1  Out IP 10.0.29.2.32821 > 10.0.29.3.179: Flags [S], seq 2872391069, win 64240, options [mss 1460,sackOK,TS val 1876765432 ecr 0,nop,wscale 10], length 0
 00:00:26.561883 eth1  In  IP 10.0.29.3.179 > 10.0.29.2.32821: Flags [S.], seq 338138279, ack 2872391070, win 65160, options [mss 1460,sackOK,TS val 3829520406 ecr 1876765432,nop,wscale 10], length 0
 00:00:26.561905 eth1  Out IP 10.0.29.2.32821 > 10.0.29.3.179: Flags [.], ack 1, win 63, options [nop,nop,TS val 1876765432 ecr 3829520406], length 0
 00:00:26.561980 eth1  Out IP 10.0.29.2.32821 > 10.0.29.3.179: Flags [P.], seq 1:65, ack 1, win 63, options [nop,nop,TS val 1876765432 ecr 3829520406], length 64: BGP
 00:00:26.561993 eth1  In  IP 10.0.29.3.179 > 10.0.29.2.32821: Flags [F.], seq 1, ack 1, win 64, options [nop,nop,TS val 3829520406 ecr 1876765432], length 0
 00:00:26.562034 eth1  In  IP 10.0.29.3.179 > 10.0.29.2.32821: Flags [R], seq 338138280, win 0, length 0
 00:00:26.562037 eth1  Out IP 10.0.29.2.32821 > 10.0.29.3.179: Flags [F.], seq 65, ack 2, win 63, options [nop,nop,TS val 1876765432 ecr 3829520406], length 0
 00:00:26.562050 eth1  In  IP 10.0.29.3.179 > 10.0.29.2.32821: Flags [R], seq 338138281, win 0, length 0
 00:00:26.593559 eth1  Out IP 10.0.29.2.54050 > 10.0.29.3.3784: BFDv1, Control, State Up, Flags: [none], length: 24
 00:00:26.596737 eth1  In  IP 10.0.29.3.40325 > 10.0.29.2.3784: BFDv1, Control, State Up, Flags: [none], length: 24
 00:00:26.670998 eth1  Out IP 10.0.29.2.54050 > 10.0.29.3.3784: BFDv1, Control, State Up, Flags: [none], length: 24
 00:00:26.673159 eth1  In  IP 10.0.29.3.40325 > 10.0.29.2.3784: BFDv1, Control, State Up, Flags: [none], length: 24
 00:00:26.760477 eth1  Out IP 10.0.29.2.54050 > 10.0.29.3.3784: BFDv1, Control, State Up, Flags: [none], length: 24
 00:00:26.762674 eth1  In  IP 10.0.29.3.40325 > 10.0.29.2.3784: BFDv1, Control, State Up, Flags: [none], length: 24
 00:00:26.838950 eth1  Out IP 10.0.29.2.54050 > 10.0.29.3.3784: BFDv1, Control, State Up, Flags: [none], length: 24
 00:00:26.843244 eth1  In  IP 10.0.29.3.40325 > 10.0.29.2.3784: BFDv1, Control, State Up, Flags: [none], length: 24
 00:00:26.918723 eth1  In  IP 10.0.29.3.40325 > 10.0.29.2.3784: BFDv1, Control, State Up, Flags: [none], length: 24
 00:00:26.924989 eth1  Out IP 10.0.29.2.54050 > 10.0.29.3.3784: BFDv1, Control, State Up, Flags: [none], length: 24
 00:00:26.994313 eth1  In  IP 10.0.29.3.40325 > 10.0.29.2.3784: BFDv1, Control, State Up, Flags: [none], length: 24
 00:00:27.007586 eth1  Out IP 10.0.29.2.54050 > 10.0.29.3.3784: BFDv1, Control, State Up, Flags: [none], length: 24
 00:00:27.075169 eth1  In  IP 10.0.29.3.40325 > 10.0.29.2.3784: BFDv1, Control, State Up, Flags: [none], length: 24
 00:00:27.085482 eth1  Out IP 10.0.29.2.54050 > 10.0.29.3.3784: BFDv1, Control, State Up, Flags: [none], length: 24
 00:00:27.163800 eth1  In  IP 10.0.29.3.40325 > 10.0.29.2.3784: BFDv1, Control, State Up, Flags: [none], length: 24
 00:00:27.170060 eth1  Out IP 10.0.29.2.54050 > 10.0.29.3.3784: BFDv1, Control, State Up, Flags: [none], length: 24
 00:00:27.239962 eth1  In  IP 10.0.29.3.40325 > 10.0.29.2.3784: BFDv1, Control, State Up, Flags: [none], length: 24
 00:00:27.251315 eth1  Out IP 10.0.29.2.54050 > 10.0.29.3.3784: BFDv1, Control, State Up, Flags: [none], length: 24
 00:00:27.320613 eth1  In  IP 10.0.29.3.40325 > 10.0.29.2.3784: BFDv1, Control, State Up, Flags: [none], length: 24
 00:00:27.335876 eth1  Out IP 10.0.29.2.54050 > 10.0.29.3.3784: BFDv1, Control, State Up, Flags: [none], length: 24
 00:00:27.398298 eth1  In  IP 10.0.29.3.40325 > 10.0.29.2.3784: BFDv1, Control, State Up, Flags: [none], length: 24
 00:00:27.418599 eth1  Out IP 10.0.29.2.54050 > 10.0.29.3.3784: BFDv1, Control, State Up, Flags: [none], length: 24
 00:00:27.483950 eth1  In  IP 10.0.29.3.40325 > 10.0.29.2.3784: BFDv1, Control, State Up, Flags: [none], length: 24
 00:00:27.495203 eth1  Out IP 10.0.29.2.54050 > 10.0.29.3.3784: BFDv1, Control, State Up, Flags: [none], length: 24
 00:00:27.572474 eth1  In  IP 10.0.29.3.40325 > 10.0.29.2.3784: BFDv1, Control, State Up, Flags: [none], length: 24
 00:00:27.581699 eth1  Out IP 10.0.29.2.54050 > 10.0.29.3.3784: BFDv1, Control, State Up, Flags: [none], length: 24
 00:00:27.656913 eth1  Out IP 10.0.29.2.54050 > 10.0.29.3.3784: BFDv1, Control, State Up, Flags: [none], length: 24
 00:00:27.660124 eth1  In  IP 10.0.29.3.40325 > 10.0.29.2.3784: BFDv1, Control, State Up, Flags: [none], length: 24
 00:00:27.736546 eth1  In  IP 10.0.29.3.40325 > 10.0.29.2.3784: BFDv1, Control, State Up, Flags: [none], length: 24
 00:00:27.737818 eth1  Out IP 10.0.29.2.54050 > 10.0.29.3.3784: BFDv1, Control, State Up, Flags: [none], length: 24
 00:00:27.811997 eth1  In  IP 10.0.29.3.40325 > 10.0.29.2.3784: BFDv1, Control, State Up, Flags: [none], length: 24
 00:00:27.819411 eth1  Out IP 10.0.29.2.54050 > 10.0.29.3.3784: BFDv1, Control, State Up, Flags: [none], length: 24
 00:00:27.900491 eth1  In  IP 10.0.29.3.40325 > 10.0.29.2.3784: BFDv1, Control, State Up, Flags: [none], length: 24
 00:00:27.903728 eth1  Out IP 10.0.29.2.54050 > 10.0.29.3.3784: BFDv1, Control, State Up, Flags: [none], length: 24
 00:00:27.978922 eth1  In  IP 10.0.29.3.40325 > 10.0.29.2.3784: BFDv1, Control, State Up, Flags: [none], length: 24
 00:00:27.981274 eth1  Out IP 10.0.29.2.54050 > 10.0.29.3.3784: BFDv1, Control, State Up, Flags: [none], length: 24
 00:00:28.060565 eth1  Out IP 10.0.29.2.54050 > 10.0.29.3.3784: BFDv1, Control, State Up, Flags: [none], length: 24
 00:00:28.061717 eth1  In  IP 10.0.29.3.40325 > 10.0.29.2.3784: BFDv1, Control, State Up, Flags: [none], length: 24
 00:00:28.139792 eth1  In  IP 10.0.29.3.40325 > 10.0.29.2.3784: BFDv1, Control, State Up, Flags: [none], length: 24
 00:00:28.147158 eth1  Out IP 10.0.29.2.54050 > 10.0.29.3.3784: BFDv1, Control, State Up, Flags: [none], length: 24
 00:00:28.221477 eth1  In  IP 10.0.29.3.40325 > 10.0.29.2.3784: BFDv1, Control, State Up, Flags: [none], length: 24
 00:00:28.225712 eth1  Out IP 10.0.29.2.54050 > 10.0.29.3.3784: BFDv1, Control, State Up, Flags: [none], length: 24
 00:00:28.299460 eth1  In  IP 10.0.29.3.40325 > 10.0.29.2.3784: BFDv1, Control, State Up, Flags: [none], length: 24
 00:00:28.309829 eth1  Out IP 10.0.29.2.54050 > 10.0.29.3.3784: BFDv1, Control, State Up, Flags: [none], length: 24
 00:00:28.374955 eth1  In  IP 10.0.29.3.40325 > 10.0.29.2.3784: BFDv1, Control, State Up, Flags: [none], length: 24
 00:00:28.398319 eth1  Out IP 10.0.29.2.54050 > 10.0.29.3.3784: BFDv1, Control, State Up, Flags: [none], length: 24
 00:00:28.456691 eth1  In  IP 10.0.29.3.40325 > 10.0.29.2.3784: BFDv1, Control, State Up, Flags: [none], length: 24
 00:00:28.482159 eth1  Out IP 10.0.29.2.54050 > 10.0.29.3.3784: BFDv1, Control, State Up, Flags: [none], length: 24
 00:00:28.534384 eth1  In  IP 10.0.29.3.40325 > 10.0.29.2.3784: BFDv1, Control, State Up, Flags: [none], length: 24
 00:00:28.567793 eth1  Out IP 10.0.29.2.54050 > 10.0.29.3.3784: BFDv1, Control, State Up, Flags: [none], length: 24
 00:00:28.617121 eth1  In  IP 10.0.29.3.40325 > 10.0.29.2.3784: BFDv1, Control, State Up, Flags: [none], length: 24
 00:00:28.650738 eth1  Out IP 10.0.29.2.54050 > 10.0.29.3.3784: BFDv1, Control, State Up, Flags: [none], length: 24
 00:00:28.705044 eth1  In  IP 10.0.29.3.40325 > 10.0.29.2.3784: BFDv1, Control, State Up, Flags: [none], length: 24
 00:00:28.729433 eth1  Out IP 10.0.29.2.54050 > 10.0.29.3.3784: BFDv1, Control, State Up, Flags: [none], length: 24
 00:00:28.790873 eth1  In  IP 10.0.29.3.40325 > 10.0.29.2.3784: BFDv1, Control, State Up, Flags: [none], length: 24
 00:00:28.818285 eth1  Out IP 10.0.29.2.54050 > 10.0.29.3.3784: BFDv1, Control, State Up, Flags: [none], length: 24
 00:00:28.874405 eth1  In  IP 10.0.29.3.40325 > 10.0.29.2.3784: BFDv1, Control, State Up, Flags: [none], length: 24
 00:00:28.895746 eth1  Out IP 10.0.29.2.54050 > 10.0.29.3.3784: BFDv1, Control, State Up, Flags: [none], length: 24
 00:00:28.950943 eth1  In  IP 10.0.29.3.40325 > 10.0.29.2.3784: BFDv1, Control, State Up, Flags: [none], length: 24
 00:00:28.974374 eth1  Out IP 10.0.29.2.54050 > 10.0.29.3.3784: BFDv1, Control, State Up, Flags: [none], length: 24
 00:00:29.040390 eth1  In  IP 10.0.29.3.40325 > 10.0.29.2.3784: BFDv1, Control, State Up, Flags: [none], length: 24
 00:00:29.051828 eth1  Out IP 10.0.29.2.54050 > 10.0.29.3.3784: BFDv1, Control, State Up, Flags: [none], length: 24
 00:00:29.124998 eth1  In  IP 10.0.29.3.40325 > 10.0.29.2.3784: BFDv1, Control, State Up, Flags: [none], length: 24
 00:00:29.133422 eth1  Out IP 10.0.29.2.54050 > 10.0.29.3.3784: BFDv1, Control, State Up, Flags: [none], length: 24
 00:00:29.203580 eth1  In  IP 10.0.29.3.40325 > 10.0.29.2.3784: BFDv1, Control, State Up, Flags: [none], length: 24
 00:00:29.215069 eth1  Out IP 10.0.29.2.54050 > 10.0.29.3.3784: BFDv1, Control, State Up, Flags: [none], length: 24
 00:00:29.289061 eth1  In  IP 10.0.29.3.40325 > 10.0.29.2.3784: BFDv1, Control, State Up, Flags: [none], length: 24
 00:00:29.291403 eth1  Out IP 10.0.29.2.54050 > 10.0.29.3.3784: BFDv1, Control, State Up, Flags: [none], length: 24
 00:00:29.369387 eth1  In  IP 10.0.29.3.40325 > 10.0.29.2.3784: BFDv1, Control, State Up, Flags: [none], length: 24
 00:00:29.375725 eth1  Out IP 10.0.29.2.54050 > 10.0.29.3.3784: BFDv1, Control, State Up, Flags: [none], length: 24
 00:00:29.452944 eth1  Out IP 10.0.29.2.54050 > 10.0.29.3.3784: BFDv1, Control, State Up, Flags: [none], length: 24
 00:00:29.457128 eth1  In  IP 10.0.29.3.40325 > 10.0.29.2.3784: BFDv1, Control, State Up, Flags: [none], length: 24
 00:00:29.533478 eth1  In  IP 10.0.29.3.40325 > 10.0.29.2.3784: BFDv1, Control, State Up, Flags: [none], length: 24
 00:00:29.535852 eth1  Out IP 10.0.29.2.54050 > 10.0.29.3.3784: BFDv1, Control, State Up, Flags: [none], length: 24
 00:00:29.620056 eth1  In  IP 10.0.29.3.40325 > 10.0.29.2.3784: BFDv1, Control, State Up, Flags: [none], length: 24
 00:00:29.624378 eth1  Out IP 10.0.29.2.54050 > 10.0.29.3.3784: BFDv1, Control, State Up, Flags: [none], length: 24
 00:00:29.697546 eth1  In  IP 10.0.29.3.40325 > 10.0.29.2.3784: BFDv1, Control, State Up, Flags: [none], length: 24
 00:00:29.710919 eth1  Out IP 10.0.29.2.54050 > 10.0.29.3.3784: BFDv1, Control, State Up, Flags: [none], length: 24
 00:00:29.776065 eth1  In  IP 10.0.29.3.40325 > 10.0.29.2.3784: BFDv1, Control, State Up, Flags: [none], length: 24
 00:00:29.800540 eth1  Out IP 10.0.29.2.54050 > 10.0.29.3.3784: BFDv1, Control, State Up, Flags: [none], length: 24
 00:00:29.859600 eth1  In  IP 10.0.29.3.40325 > 10.0.29.2.3784: BFDv1, Control, State Up, Flags: [none], length: 24
 00:00:29.883032 eth1  Out IP 10.0.29.2.54050 > 10.0.29.3.3784: BFDv1, Control, State Up, Flags: [none], length: 24
 00:00:29.945137 eth1  In  IP 10.0.29.3.40325 > 10.0.29.2.3784: BFDv1, Control, State Up, Flags: [none], length: 24
 00:00:29.962521 eth1  Out IP 10.0.29.2.54050 > 10.0.29.3.3784: BFDv1, Control, State Up, Flags: [none], length: 24
 00:00:30.021496 eth1  In  IP 10.0.29.3.40325 > 10.0.29.2.3784: BFDv1, Control, State Up, Flags: [none], length: 24
 00:00:30.037848 eth1  Out IP 10.0.29.2.54050 > 10.0.29.3.3784: BFDv1, Control, State Up, Flags: [none], length: 24
 00:00:30.100417 eth1  In  IP 10.0.29.3.40325 > 10.0.29.2.3784: BFDv1, Control, State Up, Flags: [none], length: 24
 00:00:30.115802 eth1  Out IP 10.0.29.2.54050 > 10.0.29.3.3784: BFDv1, Control, State Up, Flags: [none], length: 24
 00:00:30.184318 eth1  In  IP 10.0.29.3.40325 > 10.0.29.2.3784: BFDv1, Control, State Up, Flags: [none], length: 24
 00:00:30.195853 eth1  Out IP 10.0.29.2.54050 > 10.0.29.3.3784: BFDv1, Control, State Up, Flags: [none], length: 24
 00:00:30.264463 eth1  In  IP 10.0.29.3.40325 > 10.0.29.2.3784: BFDv1, Control, State Up, Flags: [none], length: 24
 00:00:30.276691 eth1  Out IP 10.0.29.2.54050 > 10.0.29.3.3784: BFDv1, Control, State Up, Flags: [none], length: 24
 00:00:30.342124 eth1  In  IP 10.0.29.3.40325 > 10.0.29.2.3784: BFDv1, Control, State Up, Flags: [none], length: 24

570 packets captured
572 packets received by filter
0 packets dropped by kernel
