tcpdump: data link type LINUX_SLL2
tcpdump: verbose output suppressed, use -v[v]... for full protocol decode
listening on any, link-type LINUX_SLL2 (Linux cooked v2), snapshot length 262144 bytes
 00:00:00.000000 eth1  In  IP 10.0.29.3.41275 > 10.0.29.2.3784: BFDv1, Control, State Up, Flags: [none], length: 24
 00:00:00.016340 eth1  Out IP 10.0.29.2.51340 > 10.0.29.3.3784: BFDv1, Control, State Up, Flags: [none], length: 24
 00:00:00.081164 eth1  In  IP 10.0.29.3.41275 > 10.0.29.2.3784: BFDv1, Control, State Up, Flags: [none], length: 24
 00:00:00.096475 eth1  Out IP 10.0.29.2.51340 > 10.0.29.3.3784: BFDv1, Control, State Up, Flags: [none], length: 24
 00:00:00.168470 eth1  In  IP 10.0.29.3.41275 > 10.0.29.2.3784: BFDv1, Control, State Up, Flags: [none], length: 24
 00:00:00.182923 eth1  Out IP 10.0.29.2.51340 > 10.0.29.3.3784: BFDv1, Control, State Up, Flags: [none], length: 24
 00:00:00.250847 eth1  In  IP 10.0.29.3.41275 > 10.0.29.2.3784: BFDv1, Control, State Up, Flags: [none], length: 24
 00:00:00.258223 eth1  Out IP 10.0.29.2.51340 > 10.0.29.3.3784: BFDv1, Control, State Up, Flags: [none], length: 24
 00:00:00.329929 eth1  In  IP 10.0.29.3.41275 > 10.0.29.2.3784: BFDv1, Control, State Up, Flags: [none], length: 24
 00:00:00.342351 eth1  Out IP 10.0.29.2.51340 > 10.0.29.3.3784: BFDv1, Control, State Up, Flags: [none], length: 24
 00:00:00.416120 eth1  In  IP 10.0.29.3.41275 > 10.0.29.2.3784: BFDv1, Control, State Up, Flags: [none], length: 24
 00:00:00.428541 eth1  Out IP 10.0.29.2.51340 > 10.0.29.3.3784: BFDv1, Control, State Up, Flags: [none], length: 24
 00:00:00.496780 eth1  In  IP 10.0.29.3.41275 > 10.0.29.2.3784: BFDv1, Control, State Up, Flags: [none], length: 24
 00:00:00.516297 eth1  Out IP 10.0.29.2.51340 > 10.0.29.3.3784: BFDv1, Control, State Up, Flags: [none], length: 24
 00:00:00.573769 eth1  In  IP 10.0.29.3.41275 > 10.0.29.2.3784: BFDv1, Control, State Up, Flags: [none], length: 24
 00:00:00.595333 eth1  Out IP 10.0.29.2.51340 > 10.0.29.3.3784: BFDv1, Control, State Up, Flags: [none], length: 24
 00:00:00.650100 eth1  In  IP 10.0.29.3.41275 > 10.0.29.2.3784: BFDv1, Control, State Up, Flags: [none], length: 24
 00:00:00.679517 eth1  Out IP 10.0.29.2.51340 > 10.0.29.3.3784: BFDv1, Control, State Up, Flags: [none], length: 24
 00:00:00.733493 eth1  In  IP 10.0.29.3.41275 > 10.0.29.2.3784: BFDv1, Control, State Up, Flags: [none], length: 24
 00:00:00.763892 eth1  Out IP 10.0.29.2.51340 > 10.0.29.3.3784: BFDv1, Control, State Up, Flags: [none], length: 24
 00:00:00.819675 eth1  In  IP 10.0.29.3.41275 > 10.0.29.2.3784: BFDv1, Control, State Up, Flags: [none], length: 24
 00:00:00.849084 eth1  Out IP 10.0.29.2.51340 > 10.0.29.3.3784: BFDv1, Control, State Up, Flags: [none], length: 24
 00:00:00.899993 eth1  In  IP 10.0.29.3.41275 > 10.0.29.2.3784: BFDv1, Control, State Up, Flags: [none], length: 24
 00:00:00.927444 eth1  Out IP 10.0.29.2.51340 > 10.0.29.3.3784: BFDv1, Control, State Up, Flags: [none], length: 24
 00:00:00.988219 eth1  In  IP 10.0.29.3.41275 > 10.0.29.2.3784: BFDv1, Control, State Up, Flags: [none], length: 24
 00:00:01.012696 eth1  Out IP 10.0.29.2.51340 > 10.0.29.3.3784: BFDv1, Control, State Up, Flags: [none], length: 24
 00:00:01.075536 eth1  In  IP 10.0.29.3.41275 > 10.0.29.2.3784: BFDv1, Control, State Up, Flags: [none], length: 24
 00:00:01.091967 eth1  Out IP 10.0.29.2.51340 > 10.0.29.3.3784: BFDv1, Control, State Up, Flags: [none], length: 24
 00:00:01.150719 eth1  In  IP 10.0.29.3.41275 > 10.0.29.2.3784: BFDv1, Control, State Up, Flags: [none], length: 24
 00:00:01.168178 eth1  Out IP 10.0.29.2.51340 > 10.0.29.3.3784: BFDv1, Control, State Up, Flags: [none], length: 24
 00:00:01.232032 eth1  In  IP 10.0.29.3.41275 > 10.0.29.2.3784: BFDv1, Control, State Up, Flags: [none], length: 24
 00:00:01.256427 eth1  Out IP 10.0.29.2.51340 > 10.0.29.3.3784: BFDv1, Control, State Up, Flags: [none], length: 24
 00:00:01.308136 eth1  In  IP 10.0.29.3.41275 > 10.0.29.2.3784: BFDv1, Control, State Up, Flags: [none], length: 24
 00:00:01.337591 eth1  Out IP 10.0.29.2.51340 > 10.0.29.3.3784: BFDv1, Control, State Up, Flags: [none], length: 24
 00:00:01.394528 eth1  In  IP 10.0.29.3.41275 > 10.0.29.2.3784: BFDv1, Control, State Up, Flags: [none], length: 24
 00:00:01.419941 eth1  Out IP 10.0.29.2.51340 > 10.0.29.3.3784: BFDv1, Control, State Up, Flags: [none], length: 24
 00:00:01.477828 eth1  In  IP 10.0.29.3.41275 > 10.0.29.2.3784: BFDv1, Control, State Up, Flags: [none], length: 24
 00:00:01.496206 eth1  Out IP 10.0.29.2.51340 > 10.0.29.3.3784: BFDv1, Control, State Up, Flags: [none], length: 24
 00:00:01.565913 eth1  In  IP 10.0.29.3.41275 > 10.0.29.2.3784: BFDv1, Control, State Up, Flags: [none], length: 24
 00:00:01.585321 eth1  Out IP 10.0.29.2.51340 > 10.0.29.3.3784: BFDv1, Control, State Up, Flags: [none], length: 24
 00:00:01.648361 eth1  In  IP 10.0.29.3.41275 > 10.0.29.2.3784: BFDv1, Control, State Up, Flags: [none], length: 24
 00:00:01.660820 eth1  Out IP 10.0.29.2.51340 > 10.0.29.3.3784: BFDv1, Control, State Up, Flags: [none], length: 24
 00:00:01.724120 eth1  In  IP 10.0.29.3.41275 > 10.0.29.2.3784: BFDv1, Control, State Up, Flags: [none], length: 24
 00:00:01.739590 eth1  Out IP 10.0.29.2.51340 > 10.0.29.3.3784: BFDv1, Control, State Up, Flags: [none], length: 24
 00:00:01.807014 eth1  In  IP 10.0.29.3.41275 > 10.0.29.2.3784: BFDv1, Control, State Up, Flags: [none], length: 24
 00:00:01.814358 eth1  Out IP 10.0.29.2.51340 > 10.0.29.3.3784: BFDv1, Control, State Up, Flags: [none], length: 24
 00:00:01.892455 eth1  In  IP 10.0.29.3.41275 > 10.0.29.2.3784: BFDv1, Control, State Up, Flags: [none], length: 24
 00:00:01.896792 eth1  Out IP 10.0.29.2.51340 > 10.0.29.3.3784: BFDv1, Control, State Up, Flags: [none], length: 24
 00:00:01.978951 eth1  In  IP 10.0.29.3.41275 > 10.0.29.2.3784: BFDv1, Control, State Up, Flags: [none], length: 24
 00:00:01.980252 eth1  Out IP 10.0.29.2.51340 > 10.0.29.3.3784: BFDv1, Control, State Up, Flags: [none], length: 24
 00:00:02.062559 eth1  In  IP 10.0.29.3.41275 > 10.0.29.2.3784: BFDv1, Control, State Up, Flags: [none], length: 24
 00:00:02.068011 eth2  Out IP 10.0.12.3.51192 > 10.0.12.2.179: Flags [P.], seq 221767554:221767589, ack 3568889135, win 63, options [nop,nop,TS val 625683278 ecr 396507341], length 35: BGP
 00:00:02.068072 eth2  In  IP 10.0.12.2.179 > 10.0.12.3.51192: Flags [.], ack 35, win 64, options [nop,nop,TS val 396534634 ecr 625683278], length 0
 00:00:02.068103 eth2  Out IP 10.0.12.3.51192 > 10.0.12.2.179: Flags [P.], seq 35:80, ack 1, win 63, options [nop,nop,TS val 625683278 ecr 396534634], length 45: BGP
 00:00:02.068115 eth2  In  IP 10.0.12.2.179 > 10.0.12.3.51192: Flags [.], ack 80, win 64, options [nop,nop,TS val 396534634 ecr 625683278], length 0
 00:00:02.068668 eth2  In  IP 10.0.12.2.179 > 10.0.12.3.51192: Flags [P.], seq 1:55, ack 80, win 64, options [nop,nop,TS val 396534635 ecr 625683278], length 54: BGP
 00:00:02.068688 eth2  Out IP 10.0.12.3.51192 > 10.0.12.2.179: Flags [.], ack 55, win 63, options [nop,nop,TS val 625683279 ecr 396534635], length 0
 00:00:10.156568 eth1  Out IP 10.0.29.2.44114 > 10.0.29.3.3784: BFDv1, Control, State Down, Flags: [none], length: 24
 00:00:10.156716 eth2  Out IP 10.0.12.3.51192 > 10.0.12.2.179: Flags [P.], seq 80:128, ack 55, win 63, options [nop,nop,TS val 625691367 ecr 396534635], length 48: BGP
 00:00:10.157035 eth2  In  IP 10.0.12.2.179 > 10.0.12.3.51192: Flags [P.], seq 55:82, ack 128, win 64, options [nop,nop,TS val 396542723 ecr 625691367], length 27: BGP
 00:00:10.157056 eth2  Out IP 10.0.12.3.51192 > 10.0.12.2.179: Flags [.], ack 82, win 63, options [nop,nop,TS val 625691367 ecr 396542723], length 0
 00:00:10.157182 eth2  Out IP 10.0.12.3.51192 > 10.0.12.2.179: Flags [P.], seq 128:173, ack 82, win 63, options [nop,nop,TS val 625691367 ecr 396542723], length 45: BGP
 00:00:10.197506 eth2  In  IP 10.0.12.2.179 > 10.0.12.3.51192: Flags [.], ack 173, win 64, options [nop,nop,TS val 396542764 ecr 625691367], length 0
 00:00:10.599022 eth1  In  IP 10.0.29.3.48590 > 10.0.29.2.3784: BFDv1, Control, State Init, Flags: [none], length: 24
 00:00:10.599407 eth1  Out IP 10.0.29.2.44114 > 10.0.29.3.3784: BFDv1, Control, State Up, Flags: [Poll], length: 24
 00:00:10.599559 eth1  In  IP 10.0.29.3.48590 > 10.0.29.2.3784: BFDv1, Control, State Up, Flags: [Final], length: 24
 00:00:10.599608 eth1  In  IP 10.0.29.3.48590 > 10.0.29.2.3784: BFDv1, Control, State Up, Flags: [Poll], length: 24
 00:00:10.599766 eth1  Out IP 10.0.29.2.44114 > 10.0.29.3.3784: BFDv1, Control, State Up, Flags: [Final], length: 24
 00:00:10.678072 eth1  Out IP 10.0.29.2.44114 > 10.0.29.3.3784: BFDv1, Control, State Up, Flags: [none], length: 24
 00:00:10.679351 eth1  In  IP 10.0.29.3.48590 > 10.0.29.2.3784: BFDv1, Control, State Up, Flags: [none], length: 24
 00:00:10.755187 eth1  In  IP 10.0.29.3.48590 > 10.0.29.2.3784: BFDv1, Control, State Up, Flags: [none], length: 24
 00:00:10.755445 eth1  Out IP 10.0.29.2.44114 > 10.0.29.3.3784: BFDv1, Control, State Up, Flags: [none], length: 24
 00:00:10.837870 eth1  Out IP 10.0.29.2.44114 > 10.0.29.3.3784: BFDv1, Control, State Up, Flags: [none], length: 24
 00:00:10.840213 eth1  In  IP 10.0.29.3.48590 > 10.0.29.2.3784: BFDv1, Control, State Up, Flags: [none], length: 24
 00:00:10.917759 eth1  In  IP 10.0.29.3.48590 > 10.0.29.2.3784: BFDv1, Control, State Up, Flags: [none], length: 24
 00:00:10.925181 eth1  Out IP 10.0.29.2.44114 > 10.0.29.3.3784: BFDv1, Control, State Up, Flags: [none], length: 24
 00:00:11.001861 eth1  In  IP 10.0.29.3.48590 > 10.0.29.2.3784: BFDv1, Control, State Up, Flags: [none], length: 24
 00:00:11.011324 eth1  Out IP 10.0.29.2.44114 > 10.0.29.3.3784: BFDv1, Control, State Up, Flags: [none], length: 24
 00:00:11.080122 eth1  In  IP 10.0.29.3.48590 > 10.0.29.2.3784: BFDv1, Control, State Up, Flags: [none], length: 24
 00:00:11.088528 eth1  Out IP 10.0.29.2.44114 > 10.0.29.3.3784: BFDv1, Control, State Up, Flags: [none], length: 24
 00:00:11.156656 eth1  In  IP 10.0.29.3.48590 > 10.0.29.2.3784: BFDv1, Control, State Up, Flags: [none], length: 24
 00:00:11.164082 eth1  Out IP 10.0.29.2.44114 > 10.0.29.3.3784: BFDv1, Control, State Up, Flags: [none], length: 24
 00:00:11.243944 eth1  In  IP 10.0.29.3.48590 > 10.0.29.2.3784: BFDv1, Control, State Up, Flags: [none], length: 24
 00:00:11.245619 eth1  Out IP 10.0.29.2.44114 > 10.0.29.3.3784: BFDv1, Control, State Up, Flags: [none], length: 24
 00:00:11.325936 eth1  Out IP 10.0.29.2.44114 > 10.0.29.3.3784: BFDv1, Control, State Up, Flags: [none], length: 24
 00:00:11.332286 eth1  In  IP 10.0.29.3.48590 > 10.0.29.2.3784: BFDv1, Control, State Up, Flags: [none], length: 24
 00:00:11.402724 eth1  Out IP 10.0.29.2.44114 > 10.0.29.3.3784: BFDv1, Control, State Up, Flags: [none], length: 24
 00:00:11.417961 eth1  In  IP 10.0.29.3.48590 > 10.0.29.2.3784: BFDv1, Control, State Up, Flags: [none], length: 24
 00:00:11.482509 eth1  Out IP 10.0.29.2.44114 > 10.0.29.3.3784: BFDv1, Control, State Up, Flags: [none], length: 24
 00:00:11.498799 eth1  In  IP 10.0.29.3.48590 > 10.0.29.2.3784: BFDv1, Control, State Up, Flags: [none], length: 24
 00:00:11.569178 eth1  Out IP 10.0.29.2.44114 > 10.0.29.3.3784: BFDv1, Control, State Up, Flags: [none], length: 24
 00:00:11.588482 eth1  In  IP 10.0.29.3.48590 > 10.0.29.2.3784: BFDv1, Control, State Up, Flags: [none], length: 24
 00:00:11.652919 eth1  Out IP 10.0.29.2.44114 > 10.0.29.3.3784: BFDv1, Control, State Up, Flags: [none], length: 24
 00:00:11.674253 eth1  In  IP 10.0.29.3.48590 > 10.0.29.2.3784: BFDv1, Control, State Up, Flags: [none], length: 24
 00:00:11.733812 eth1  Out IP 10.0.29.2.44114 > 10.0.29.3.3784: BFDv1, Control, State Up, Flags: [none], length: 24
 00:00:11.749108 eth1  In  IP 10.0.29.3.48590 > 10.0.29.2.3784: BFDv1, Control, State Up, Flags: [none], length: 24
 00:00:11.819643 eth1  Out IP 10.0.29.2.44114 > 10.0.29.3.3784: BFDv1, Control, State Up, Flags: [none], length: 24
 00:00:11.829018 eth1  In  IP 10.0.29.3.48590 > 10.0.29.2.3784: BFDv1, Control, State Up, Flags: [none], length: 24
 00:00:11.903573 eth1  Out IP 10.0.29.2.44114 > 10.0.29.3.3784: BFDv1, Control, State Up, Flags: [none], length: 24
 00:00:11.903752 eth1  In  IP 10.0.29.3.48590 > 10.0.29.2.3784: BFDv1, Control, State Up, Flags: [none], length: 24
 00:00:11.987079 eth1  Out IP 10.0.29.2.44114 > 10.0.29.3.3784: BFDv1, Control, State Up, Flags: [none], length: 24
 00:00:11.994403 eth1  In  IP 10.0.29.3.48590 > 10.0.29.2.3784: BFDv1, Control, State Up, Flags: [none], length: 24
 00:00:12.072809 eth1  Out IP 10.0.29.2.44114 > 10.0.29.3.3784: BFDv1, Control, State Up, Flags: [none], length: 24
 00:00:12.079102 eth1  In  IP 10.0.29.3.48590 > 10.0.29.2.3784: BFDv1, Control, State Up, Flags: [none], length: 24
 00:00:12.148507 eth1  Out IP 10.0.29.2.44114 > 10.0.29.3.3784: BFDv1, Control, State Up, Flags: [none], length: 24
 00:00:12.167794 eth1  In  IP 10.0.29.3.48590 > 10.0.29.2.3784: BFDv1, Control, State Up, Flags: [none], length: 24
 00:00:12.226235 eth1  Out IP 10.0.29.2.44114 > 10.0.29.3.3784: BFDv1, Control, State Up, Flags: [none], length: 24
 00:00:12.244549 eth1  In  IP 10.0.29.3.48590 > 10.0.29.2.3784: BFDv1, Control, State Up, Flags: [none], length: 24
 00:00:12.308010 eth1  Out IP 10.0.29.2.44114 > 10.0.29.3.3784: BFDv1, Control, State Up, Flags: [none], length: 24
 00:00:12.332237 eth1  In  IP 10.0.29.3.48590 > 10.0.29.2.3784: BFDv1, Control, State Up, Flags: [none], length: 24
 00:00:12.386713 eth1  Out IP 10.0.29.2.44114 > 10.0.29.3.3784: BFDv1, Control, State Up, Flags: [none], length: 24
 00:00:12.419056 eth1  In  IP 10.0.29.3.48590 > 10.0.29.2.3784: BFDv1, Control, State Up, Flags: [none], length: 24
 00:00:12.462547 eth1  Out IP 10.0.29.2.44114 > 10.0.29.3.3784: BFDv1, Control, State Up, Flags: [none], length: 24
 00:00:12.503183 eth1  In  IP 10.0.29.3.48590 > 10.0.29.2.3784: BFDv1, Control, State Up, Flags: [none], length: 24
 00:00:12.543679 eth1  Out IP 10.0.29.2.44114 > 10.0.29.3.3784: BFDv1, Control, State Up, Flags: [none], length: 24
 00:00:12.580862 eth1  In  IP 10.0.29.3.48590 > 10.0.29.2.3784: BFDv1, Control, State Up, Flags: [none], length: 24
 00:00:12.627255 eth1  Out IP 10.0.29.2.44114 > 10.0.29.3.3784: BFDv1, Control, State Up, Flags: [none], length: 24
 00:00:12.657554 eth1  In  IP 10.0.29.3.48590 > 10.0.29.2.3784: BFDv1, Control, State Up, Flags: [none], length: 24
 00:00:12.713998 eth1  Out IP 10.0.29.2.44114 > 10.0.29.3.3784: BFDv1, Control, State Up, Flags: [none], length: 24
 00:00:12.746273 eth1  In  IP 10.0.29.3.48590 > 10.0.29.2.3784: BFDv1, Control, State Up, Flags: [none], length: 24
 00:00:12.799691 eth1  Out IP 10.0.29.2.44114 > 10.0.29.3.3784: BFDv1, Control, State Up, Flags: [none], length: 24
 00:00:12.832026 eth1  In  IP 10.0.29.3.48590 > 10.0.29.2.3784: BFDv1, Control, State Up, Flags: [none], length: 24
 00:00:12.877529 eth1  Out IP 10.0.29.2.44114 > 10.0.29.3.3784: BFDv1, Control, State Up, Flags: [none], length: 24
 00:00:12.914814 eth1  In  IP 10.0.29.3.48590 > 10.0.29.2.3784: BFDv1, Control, State Up, Flags: [none], length: 24
 00:00:12.957221 eth1  Out IP 10.0.29.2.44114 > 10.0.29.3.3784: BFDv1, Control, State Up, Flags: [none], length: 24
 00:00:13.003553 eth1  In  IP 10.0.29.3.48590 > 10.0.29.2.3784: BFDv1, Control, State Up, Flags: [none], length: 24
 00:00:13.031949 eth1  Out IP 10.0.29.2.44114 > 10.0.29.3.3784: BFDv1, Control, State Up, Flags: [none], length: 24
 00:00:13.085308 eth1  In  IP 10.0.29.3.48590 > 10.0.29.2.3784: BFDv1, Control, State Up, Flags: [none], length: 24
 00:00:13.113592 eth1  Out IP 10.0.29.2.44114 > 10.0.29.3.3784: BFDv1, Control, State Up, Flags: [none], length: 24
 00:00:13.166043 eth1  In  IP 10.0.29.3.48590 > 10.0.29.2.3784: BFDv1, Control, State Up, Flags: [none], length: 24
 00:00:13.196501 eth1  Out IP 10.0.29.2.44114 > 10.0.29.3.3784: BFDv1, Control, State Up, Flags: [none], length: 24
 00:00:13.251733 eth1  In  IP 10.0.29.3.48590 > 10.0.29.2.3784: BFDv1, Control, State Up, Flags: [none], length: 24
 00:00:13.273321 eth1  Out IP 10.0.29.2.44114 > 10.0.29.3.3784: BFDv1, Control, State Up, Flags: [none], length: 24
 00:00:13.334440 eth1  In  IP 10.0.29.3.48590 > 10.0.29.2.3784: BFDv1, Control, State Up, Flags: [none], length: 24
 00:00:13.362802 eth1  Out IP 10.0.29.2.44114 > 10.0.29.3.3784: BFDv1, Control, State Up, Flags: [none], length: 24
 00:00:13.410199 eth1  In  IP 10.0.29.3.48590 > 10.0.29.2.3784: BFDv1, Control, State Up, Flags: [none], length: 24
 00:00:13.442685 eth1  Out IP 10.0.29.2.44114 > 10.0.29.3.3784: BFDv1, Control, State Up, Flags: [none], length: 24
 00:00:13.487021 eth1  In  IP 10.0.29.3.48590 > 10.0.29.2.3784: BFDv1, Control, State Up, Flags: [none], length: 24
 00:00:13.531399 eth1  Out IP 10.0.29.2.44114 > 10.0.29.3.3784: BFDv1, Control, State Up, Flags: [none], length: 24
 00:00:13.562735 eth1  In  IP 10.0.29.3.48590 > 10.0.29.2.3784: BFDv1, Control, State Up, Flags: [none], length: 24
 00:00:13.608218 eth1  Out IP 10.0.29.2.44114 > 10.0.29.3.3784: BFDv1, Control, State Up, Flags: [none], length: 24
 00:00:13.642490 eth1  In  IP 10.0.29.3.48590 > 10.0.29.2.3784: BFDv1, Control, State Up, Flags: [none], length: 24
 00:00:13.687876 eth1  Out IP 10.0.29.2.44114 > 10.0.29.3.3784: BFDv1, Control, State Up, Flags: [none], length: 24
 00:00:13.732195 eth1  In  IP 10.0.29.3.48590 > 10.0.29.2.3784: BFDv1, Control, State Up, Flags: [none], length: 24
 00:00:13.767659 eth1  Out IP 10.0.29.2.44114 > 10.0.29.3.3784: BFDv1, Control, State Up, Flags: [none], length: 24
 00:00:13.809980 eth1  In  IP 10.0.29.3.48590 > 10.0.29.2.3784: BFDv1, Control, State Up, Flags: [none], length: 24
 00:00:13.849384 eth1  Out IP 10.0.29.2.44114 > 10.0.29.3.3784: BFDv1, Control, State Up, Flags: [none], length: 24
 00:00:13.891667 eth1  In  IP 10.0.29.3.48590 > 10.0.29.2.3784: BFDv1, Control, State Up, Flags: [none], length: 24
 00:00:13.931009 eth1  Out IP 10.0.29.2.44114 > 10.0.29.3.3784: BFDv1, Control, State Up, Flags: [none], length: 24
 00:00:13.979362 eth1  In  IP 10.0.29.3.48590 > 10.0.29.2.3784: BFDv1, Control, State Up, Flags: [none], length: 24
 00:00:14.014749 eth1  Out IP 10.0.29.2.44114 > 10.0.29.3.3784: BFDv1, Control, State Up, Flags: [none], length: 24
 00:00:14.067196 eth1  In  IP 10.0.29.3.48590 > 10.0.29.2.3784: BFDv1, Control, State Up, Flags: [none], length: 24
 00:00:14.093584 eth1  Out IP 10.0.29.2.44114 > 10.0.29.3.3784: BFDv1, Control, State Up, Flags: [none], length: 24
 00:00:14.147139 eth1  In  IP 10.0.29.3.48590 > 10.0.29.2.3784: BFDv1, Control, State Up, Flags: [none], length: 24
 00:00:14.169547 eth1  Out IP 10.0.29.2.44114 > 10.0.29.3.3784: BFDv1, Control, State Up, Flags: [none], length: 24
 00:00:14.223822 eth1  In  IP 10.0.29.3.48590 > 10.0.29.2.3784: BFDv1, Control, State Up, Flags: [none], length: 24
 00:00:14.258144 eth1  Out IP 10.0.29.2.44114 > 10.0.29.3.3784: BFDv1, Control, State Up, Flags: [none], length: 24
 00:00:14.311069 eth1  In  IP 10.0.29.3.48590 > 10.0.29.2.3784: BFDv1, Control, State Up, Flags: [none], length: 24
 00:00:14.346515 eth1  Out IP 10.0.29.2.44114 > 10.0.29.3.3784: BFDv1, Control, State Up, Flags: [none], length: 24
 00:00:14.388820 eth1  In  IP 10.0.29.3.48590 > 10.0.29.2.3784: BFDv1, Control, State Up, Flags: [none], length: 24
 00:00:14.432156 eth1  Out IP 10.0.29.2.44114 > 10.0.29.3.3784: BFDv1, Control, State Up, Flags: [none], length: 24
 00:00:14.477171 eth1  In  IP 10.0.29.3.48590 > 10.0.29.2.3784: BFDv1, Control, State Up, Flags: [none], length: 24
 00:00:14.514662 eth1  Out IP 10.0.29.2.44114 > 10.0.29.3.3784: BFDv1, Control, State Up, Flags: [none], length: 24
 00:00:14.559860 eth1  In  IP 10.0.29.3.48590 > 10.0.29.2.3784: BFDv1, Control, State Up, Flags: [none], length: 24
 00:00:14.598303 eth1  Out IP 10.0.29.2.44114 > 10.0.29.3.3784: BFDv1, Control, State Up, Flags: [none], length: 24
 00:00:14.639707 eth1  In  IP 10.0.29.3.48590 > 10.0.29.2.3784: BFDv1, Control, State Up, Flags: [none], length: 24
 00:00:14.684089 eth1  Out IP 10.0.29.2.44114 > 10.0.29.3.3784: BFDv1, Control, State Up, Flags: [none], length: 24
 00:00:14.726280 eth1  In  IP 10.0.29.3.48590 > 10.0.29.2.3784: BFDv1, Control, State Up, Flags: [none], length: 24
 00:00:14.768674 eth1  Out IP 10.0.29.2.44114 > 10.0.29.3.3784: BFDv1, Control, State Up, Flags: [none], length: 24
 00:00:14.813941 eth1  In  IP 10.0.29.3.48590 > 10.0.29.2.3784: BFDv1, Control, State Up, Flags: [none], length: 24
 00:00:14.844317 eth1  Out IP 10.0.29.2.44114 > 10.0.29.3.3784: BFDv1, Control, State Up, Flags: [none], length: 24
 00:00:14.897097 eth1  Out IP 10.0.29.2.41631 > 10.0.29.3.179: Flags [S], seq 4016436167, win 64240, options [mss 1460,sackOK,TS val 1875338717 ecr 0,nop,wscale 10], length 0
 00:00:14.897158 eth1  In  IP 10.0.29.3.179 > 10.0.29.2.41631: Flags [S.], seq 2965966571, ack 4016436168, win 65160, options [mss 1460,sackOK,TS val 3828093691 ecr 1875338717,nop,wscale 10], length 0
 00:00:14.897185 eth1  Out IP 10.0.29.2.41631 > 10.0.29.3.179: Flags [.], ack 1, win 63, options [nop,nop,TS val 1875338717 ecr 3828093691], length 0
 00:00:14.897261 eth1  Out IP 10.0.29.2.41631 > 10.0.29.3.179: Flags [P.], seq 1:65, ack 1, win 63, options [nop,nop,TS val 1875338717 ecr 3828093691], length 64: BGP
 00:00:14.897276 eth1  In  IP 10.0.29.3.179 > 10.0.29.2.41631: Flags [.], ack 65, win 64, options [nop,nop,TS val 3828093691 ecr 1875338717], length 0
 00:00:14.897306 eth1  In  IP 10.0.29.3.179 > 10.0.29.2.41631: Flags [R.], seq 1, ack 65, win 64, options [nop,nop,TS val 3828093691 ecr 1875338717], length 0
 00:00:14.901401 eth1  In  IP 10.0.29.3.48590 > 10.0.29.2.3784: BFDv1, Control, State Up, Flags: [none], length: 24
 00:00:14.933744 eth1  Out IP 10.0.29.2.44114 > 10.0.29.3.3784: BFDv1, Control, State Up, Flags: [none], length: 24
 00:00:14.981928 eth1  In  IP 10.0.29.3.48590 > 10.0.29.2.3784: BFDv1, Control, State Up, Flags: [none], length: 24
 00:00:15.014266 eth1  Out IP 10.0.29.2.44114 > 10.0.29.3.3784: BFDv1, Control, State Up, Flags: [none], length: 24
 00:00:15.067435 eth1  In  IP 10.0.29.3.48590 > 10.0.29.2.3784: BFDv1, Control, State Up, Flags: [none], length: 24
 00:00:15.091829 eth1  Out IP 10.0.29.2.44114 > 10.0.29.3.3784: BFDv1, Control, State Up, Flags: [none], length: 24
 00:00:15.145914 eth1  In  IP 10.0.29.3.48590 > 10.0.29.2.3784: BFDv1, Control, State Up, Flags: [none], length: 24
 00:00:15.177384 eth1  Out IP 10.0.29.2.44114 > 10.0.29.3.3784: BFDv1, Control, State Up, Flags: [none], length: 24
 00:00:15.226185 eth1  In  IP 10.0.29.3.48590 > 10.0.29.2.3784: BFDv1, Control, State Up, Flags: [none], length: 24
 00:00:15.262557 eth1  Out IP 10.0.29.2.44114 > 10.0.29.3.3784: BFDv1, Control, State Up, Flags: [none], length: 24
 00:00:15.308861 eth1  In  IP 10.0.29.3.48590 > 10.0.29.2.3784: BFDv1, Control, State Up, Flags: [none], length: 24
 00:00:15.339276 eth1  Out IP 10.0.29.2.44114 > 10.0.29.3.3784: BFDv1, Control, State Up, Flags: [none], length: 24
 00:00:15.397572 eth1  In  IP 10.0.29.3.48590 > 10.0.29.2.3784: BFDv1, Control, State Up, Flags: [none], length: 24
 00:00:15.416902 eth1  Out IP 10.0.29.2.44114 > 10.0.29.3.3784: BFDv1, Control, State Up, Flags: [none], length: 24
 00:00:15.474263 eth1  In  IP 10.0.29.3.48590 > 10.0.29.2.3784: BFDv1, Control, State Up, Flags: [none], length: 24
 00:00:15.494557 eth1  Out IP 10.0.29.2.44114 > 10.0.29.3.3784: BFDv1, Control, State Up, Flags: [none], length: 24
 00:00:15.559992 eth1  In  IP 10.0.29.3.48590 > 10.0.29.2.3784: BFDv1, Control, State Up, Flags: [none], length: 24
 00:00:15.573394 eth1  Out IP 10.0.29.2.44114 > 10.0.29.3.3784: BFDv1, Control, State Up, Flags: [none], length: 24
 00:00:15.591459 eth1  Out IP 10.0.29.2.58909 > 10.0.29.3.179: Flags [FP.], seq 2437065227:2437065248, ack 283280242, win 63, options [nop,nop,TS val 1875339412 ecr 3828016344], length 21: BGP
 00:00:15.591496 eth1  In  IP 10.0.29.3.179 > 10.0.29.2.58909: Flags [FP.], seq 1:22, ack 0, win 64, options [nop,nop,TS val 3828094386 ecr 1875261370], length 21: BGP
 00:00:15.591542 eth1  Out IP 10.0.29.2.58909 > 10.0.29.3.179: Flags [R], seq 2437065227, win 0, length 0
 00:00:15.591546 eth1  In  IP 10.0.29.3.179 > 10.0.29.2.58909: Flags [R], seq 283280242, win 0, length 0
 00:00:15.638194 eth1  In  IP 10.0.29.3.48590 > 10.0.29.2.3784: BFDv1, Control, State Up, Flags: [none], length: 24
 00:00:15.649582 eth1  Out IP 10.0.29.2.44114 > 10.0.29.3.3784: BFDv1, Control, State Up, Flags: [none], length: 24
 00:00:15.714438 eth1  In  IP 10.0.29.3.48590 > 10.0.29.2.3784: BFDv1, Control, State Up, Flags: [none], length: 24
 00:00:15.731923 eth1  Out IP 10.0.29.2.44114 > 10.0.29.3.3784: BFDv1, Control, State Up, Flags: [none], length: 24
 00:00:15.802678 eth1  In  IP 10.0.29.3.48590 > 10.0.29.2.3784: BFDv1, Control, State Up, Flags: [none], length: 24
 00:00:15.809040 eth1  Out IP 10.0.29.2.44114 > 10.0.29.3.3784: BFDv1, Control, State Up, Flags: [none], length: 24
 00:00:15.883806 eth1  In  IP 10.0.29.3.48590 > 10.0.29.2.3784: BFDv1, Control, State Up, Flags: [none], length: 24
 00:00:15.886060 eth1  Out IP 10.0.29.2.44114 > 10.0.29.3.3784: BFDv1, Control, State Up, Flags: [none], length: 24
 00:00:15.959746 eth1  In  IP 10.0.29.3.48590 > 10.0.29.2.3784: BFDv1, Control, State Up, Flags: [none], length: 24
 00:00:15.972134 eth1  Out IP 10.0.29.2.44114 > 10.0.29.3.3784: BFDv1, Control, State Up, Flags: [none], length: 24
 00:00:16.044814 eth1  In  IP 10.0.29.3.48590 > 10.0.29.2.3784: BFDv1, Control, State Up, Flags: [none], length: 24
 00:00:16.054150 eth1  Out IP 10.0.29.2.44114 > 10.0.29.3.3784: BFDv1, Control, State Up, Flags: [none], length: 24
 00:00:16.119890 eth1  In  IP 10.0.29.3.48590 > 10.0.29.2.3784: BFDv1, Control, State Up, Flags: [none], length: 24
 00:00:16.138171 eth1  Out IP 10.0.29.2.44114 > 10.0.29.3.3784: BFDv1, Control, State Up, Flags: [none], length: 24
 00:00:16.199932 eth1  In  IP 10.0.29.3.48590 > 10.0.29.2.3784: BFDv1, Control, State Up, Flags: [none], length: 24
 00:00:16.216262 eth1  Out IP 10.0.29.2.44114 > 10.0.29.3.3784: BFDv1, Control, State Up, Flags: [none], length: 24
 00:00:16.282962 eth1  In  IP 10.0.29.3.48590 > 10.0.29.2.3784: BFDv1, Control, State Up, Flags: [none], length: 24
 00:00:16.291282 eth1  Out IP 10.0.29.2.44114 > 10.0.29.3.3784: BFDv1, Control, State Up, Flags: [none], length: 24
 00:00:16.360139 eth1  In  IP 10.0.29.3.48590 > 10.0.29.2.3784: BFDv1, Control, State Up, Flags: [none], length: 24
 00:00:16.378476 eth1  Out IP 10.0.29.2.44114 > 10.0.29.3.3784: BFDv1, Control, State Up, Flags: [none], length: 24
 00:00:16.440229 eth1  In  IP 10.0.29.3.48590 > 10.0.29.2.3784: BFDv1, Control, State Up, Flags: [none], length: 24
 00:00:16.456807 eth1  Out IP 10.0.29.2.44114 > 10.0.29.3.3784: BFDv1, Control, State Up, Flags: [none], length: 24
 00:00:16.519515 eth1  In  IP 10.0.29.3.48590 > 10.0.29.2.3784: BFDv1, Control, State Up, Flags: [none], length: 24
 00:00:16.545800 eth1  Out IP 10.0.29.2.44114 > 10.0.29.3.3784: BFDv1, Control, State Up, Flags: [none], length: 24
 00:00:16.608605 eth1  In  IP 10.0.29.3.48590 > 10.0.29.2.3784: BFDv1, Control, State Up, Flags: [none], length: 24
 00:00:16.631017 eth1  Out IP 10.0.29.2.44114 > 10.0.29.3.3784: BFDv1, Control, State Up, Flags: [none], length: 24
 00:00:16.689846 eth1  In  IP 10.0.29.3.48590 > 10.0.29.2.3784: BFDv1, Control, State Up, Flags: [none], length: 24
 00:00:16.720557 eth1  Out IP 10.0.29.2.44114 > 10.0.29.3.3784: BFDv1, Control, State Up, Flags: [none], length: 24
 00:00:16.779732 eth1  In  IP 10.0.29.3.48590 > 10.0.29.2.3784: BFDv1, Control, State Up, Flags: [none], length: 24
 00:00:16.800194 eth1  Out IP 10.0.29.2.44114 > 10.0.29.3.3784: BFDv1, Control, State Up, Flags: [none], length: 24
 00:00:16.868663 eth1  In  IP 10.0.29.3.48590 > 10.0.29.2.3784: BFDv1, Control, State Up, Flags: [none], length: 24
 00:00:16.880068 eth1  Out IP 10.0.29.2.44114 > 10.0.29.3.3784: BFDv1, Control, State Up, Flags: [none], length: 24
 00:00:16.943924 eth1  In  IP 10.0.29.3.48590 > 10.0.29.2.3784: BFDv1, Control, State Up, Flags: [none], length: 24
 00:00:16.964281 eth1  Out IP 10.0.29.2.44114 > 10.0.29.3.3784: BFDv1, Control, State Up, Flags: [none], length: 24
 00:00:17.021685 eth1  In  IP 10.0.29.3.48590 > 10.0.29.2.3784: BFDv1, Control, State Up, Flags: [none], length: 24
 00:00:17.054076 eth1  Out IP 10.0.29.2.44114 > 10.0.29.3.3784: BFDv1, Control, State Up, Flags: [none], length: 24
 00:00:17.106188 eth1  In  IP 10.0.29.3.48590 > 10.0.29.2.3784: BFDv1, Control, State Up, Flags: [none], length: 24
 00:00:17.133566 eth1  Out IP 10.0.29.2.44114 > 10.0.29.3.3784: BFDv1, Control, State Up, Flags: [none], length: 24
 00:00:17.188791 eth1  In  IP 10.0.29.3.48590 > 10.0.29.2.3784: BFDv1, Control, State Up, Flags: [none], length: 24
 00:00:17.218235 eth1  Out IP 10.0.29.2.44114 > 10.0.29.3.3784: BFDv1, Control, State Up, Flags: [none], length: 24
 00:00:17.277451 eth1  In  IP 10.0.29.3.48590 > 10.0.29.2.3784: BFDv1, Control, State Up, Flags: [none], length: 24
 00:00:17.302006 eth1  Out IP 10.0.29.2.44114 > 10.0.29.3.3784: BFDv1, Control, State Up, Flags: [none], length: 24
 00:00:17.364952 eth1  In  IP 10.0.29.3.48590 > 10.0.29.2.3784: BFDv1, Control, State Up, Flags: [none], length: 24
 00:00:17.387396 eth1  Out IP 10.0.29.2.44114 > 10.0.29.3.3784: BFDv1, Control, State Up, Flags: [none], length: 24
 00:00:17.445498 eth1  In  IP 10.0.29.3.48590 > 10.0.29.2.3784: BFDv1, Control, State Up, Flags: [none], length: 24
 00:00:17.464887 eth1  Out IP 10.0.29.2.44114 > 10.0.29.3.3784: BFDv1, Control, State Up, Flags: [none], length: 24
 00:00:17.527119 eth1  In  IP 10.0.29.3.48590 > 10.0.29.2.3784: BFDv1, Control, State Up, Flags: [none], length: 24
 00:00:17.553658 eth1  Out IP 10.0.29.2.44114 > 10.0.29.3.3784: BFDv1, Control, State Up, Flags: [none], length: 24
 00:00:17.609925 eth1  In  IP 10.0.29.3.48590 > 10.0.29.2.3784: BFDv1, Control, State Up, Flags: [none], length: 24
 00:00:17.641344 eth1  Out IP 10.0.29.2.44114 > 10.0.29.3.3784: BFDv1, Control, State Up, Flags: [none], length: 24
 00:00:17.696431 eth1  In  IP 10.0.29.3.48590 > 10.0.29.2.3784: BFDv1, Control, State Up, Flags: [none], length: 24
 00:00:17.728855 eth1  Out IP 10.0.29.2.44114 > 10.0.29.3.3784: BFDv1, Control, State Up, Flags: [none], length: 24
 00:00:17.781932 eth1  In  IP 10.0.29.3.48590 > 10.0.29.2.3784: BFDv1, Control, State Up, Flags: [none], length: 24
 00:00:17.812348 eth1  Out IP 10.0.29.2.44114 > 10.0.29.3.3784: BFDv1, Control, State Up, Flags: [none], length: 24
 00:00:17.864388 eth1  In  IP 10.0.29.3.48590 > 10.0.29.2.3784: BFDv1, Control, State Up, Flags: [none], length: 24
 00:00:17.902745 eth1  Out IP 10.0.29.2.44114 > 10.0.29.3.3784: BFDv1, Control, State Up, Flags: [none], length: 24
 00:00:17.939536 eth1  In  IP 10.0.29.3.48590 > 10.0.29.2.3784: BFDv1, Control, State Up, Flags: [none], length: 24
 00:00:17.991867 eth1  Out IP 10.0.29.2.44114 > 10.0.29.3.3784: BFDv1, Control, State Up, Flags: [none], length: 24
 00:00:18.025375 eth1  In  IP 10.0.29.3.48590 > 10.0.29.2.3784: BFDv1, Control, State Up, Flags: [none], length: 24
 00:00:18.077750 eth1  Out IP 10.0.29.2.44114 > 10.0.29.3.3784: BFDv1, Control, State Up, Flags: [none], length: 24
 00:00:18.107207 eth1  In  IP 10.0.29.3.48590 > 10.0.29.2.3784: BFDv1, Control, State Up, Flags: [none], length: 24
 00:00:18.156699 eth1  Out IP 10.0.29.2.44114 > 10.0.29.3.3784: BFDv1, Control, State Up, Flags: [none], length: 24
 00:00:18.187381 eth1  In  IP 10.0.29.3.48590 > 10.0.29.2.3784: BFDv1, Control, State Up, Flags: [none], length: 24
 00:00:18.231771 eth1  Out IP 10.0.29.2.44114 > 10.0.29.3.3784: BFDv1, Control, State Up, Flags: [none], length: 24
 00:00:18.263130 eth1  In  IP 10.0.29.3.48590 > 10.0.29.2.3784: BFDv1, Control, State Up, Flags: [none], length: 24
 00:00:18.309722 eth1  Out IP 10.0.29.2.44114 > 10.0.29.3.3784: BFDv1, Control, State Up, Flags: [none], length: 24
 00:00:18.352313 eth1  In  IP 10.0.29.3.48590 > 10.0.29.2.3784: BFDv1, Control, State Up, Flags: [none], length: 24
 00:00:18.391671 eth1  Out IP 10.0.29.2.44114 > 10.0.29.3.3784: BFDv1, Control, State Up, Flags: [none], length: 24
 00:00:18.435079 eth1  In  IP 10.0.29.3.48590 > 10.0.29.2.3784: BFDv1, Control, State Up, Flags: [none], length: 24
 00:00:18.468437 eth1  Out IP 10.0.29.2.44114 > 10.0.29.3.3784: BFDv1, Control, State Up, Flags: [none], length: 24
 00:00:18.516978 eth1  In  IP 10.0.29.3.48590 > 10.0.29.2.3784: BFDv1, Control, State Up, Flags: [none], length: 24
 00:00:18.557356 eth1  Out IP 10.0.29.2.44114 > 10.0.29.3.3784: BFDv1, Control, State Up, Flags: [none], length: 24
 00:00:18.599746 eth1  In  IP 10.0.29.3.48590 > 10.0.29.2.3784: BFDv1, Control, State Up, Flags: [none], length: 24
 00:00:18.645132 eth1  Out IP 10.0.29.2.44114 > 10.0.29.3.3784: BFDv1, Control, State Up, Flags: [none], length: 24
 00:00:18.679646 eth1  In  IP 10.0.29.3.48590 > 10.0.29.2.3784: BFDv1, Control, State Up, Flags: [none], length: 24
 00:00:18.731171 eth1  Out IP 10.0.29.2.44114 > 10.0.29.3.3784: BFDv1, Control, State Up, Flags: [none], length: 24
 00:00:18.764774 eth1  In  IP 10.0.29.3.48590 > 10.0.29.2.3784: BFDv1, Control, State Up, Flags: [none], length: 24
 00:00:18.808198 eth1  Out IP 10.0.29.2.44114 > 10.0.29.3.3784: BFDv1, Control, State Up, Flags: [none], length: 24
 00:00:18.844572 eth1  In  IP 10.0.29.3.48590 > 10.0.29.2.3784: BFDv1, Control, State Up, Flags: [none], length: 24
 00:00:18.879929 eth1  Out IP 10.0.29.2.50287 > 10.0.29.3.179: Flags [S], seq 2392813056, win 64240, options [mss 1460,sackOK,TS val 1875342700 ecr 0,nop,wscale 10], length 0
 00:00:18.879986 eth1  In  IP 10.0.29.3.179 > 10.0.29.2.50287: Flags [S.], seq 1817586119, ack 2392813057, win 65160, options [mss 1460,sackOK,TS val 3828097674 ecr 1875342700,nop,wscale 10], length 0
 00:00:18.880012 eth1  Out IP 10.0.29.2.50287 > 10.0.29.3.179: Flags [.], ack 1, win 63, options [nop,nop,TS val 1875342700 ecr 3828097674], length 0
 00:00:18.880104 eth1  Out IP 10.0.29.2.50287 > 10.0.29.3.179: Flags [P.], seq 1:65, ack 1, win 63, options [nop,nop,TS val 1875342700 ecr 3828097674], length 64: BGP
 00:00:18.880123 eth1  In  IP 10.0.29.3.179 > 10.0.29.2.50287: Flags [.], ack 65, win 64, options [nop,nop,TS val 3828097674 ecr 1875342700], length 0
 00:00:18.880164 eth1  In  IP 10.0.29.3.179 > 10.0.29.2.50287: Flags [R.], seq 1, ack 65, win 64, options [nop,nop,TS val 3828097674 ecr 1875342700], length 0
 00:00:18.894910 eth1  Out IP 10.0.29.2.44114 > 10.0.29.3.3784: BFDv1, Control, State Up, Flags: [none], length: 24
 00:00:18.922348 eth1  In  IP 10.0.29.3.48590 > 10.0.29.2.3784: BFDv1, Control, State Up, Flags: [none], length: 24
 00:00:18.973814 eth1  Out IP 10.0.29.2.44114 > 10.0.29.3.3784: BFDv1, Control, State Up, Flags: [none], length: 24
 00:00:19.006274 eth1  In  IP 10.0.29.3.48590 > 10.0.29.2.3784: BFDv1, Control, State Up, Flags: [none], length: 24
 00:00:19.052687 eth1  Out IP 10.0.29.2.44114 > 10.0.29.3.3784: BFDv1, Control, State Up, Flags: [none], length: 24
 00:00:19.091164 eth1  In  IP 10.0.29.3.48590 > 10.0.29.2.3784: BFDv1, Control, State Up, Flags: [none], length: 24
 00:00:19.142796 eth1  Out IP 10.0.29.2.44114 > 10.0.29.3.3784: BFDv1, Control, State Up, Flags: [none], length: 24
 00:00:19.176634 eth1  In  IP 10.0.29.3.48590 > 10.0.29.2.3784: BFDv1, Control, State Up, Flags: [none], length: 24
 00:00:19.226014 eth1  Out IP 10.0.29.2.44114 > 10.0.29.3.3784: BFDv1, Control, State Up, Flags: [none], length: 24
 00:00:19.260610 eth1  In  IP 10.0.29.3.48590 > 10.0.29.2.3784: BFDv1, Control, State Up, Flags: [none], length: 24
 00:00:19.313988 eth1  Out IP 10.0.29.2.44114 > 10.0.29.3.3784: BFDv1, Control, State Up, Flags: [none], length: 24
 00:00:19.348671 eth1  In  IP 10.0.29.3.48590 > 10.0.29.2.3784: BFDv1, Control, State Up, Flags: [none], length: 24
 00:00:19.403088 eth1  Out IP 10.0.29.2.44114 > 10.0.29.3.3784: BFDv1, Control, State Up, Flags: [none], length: 24
 00:00:19.427362 eth1  In  IP 10.0.29.3.48590 > 10.0.29.2.3784: BFDv1, Control, State Up, Flags: [none], length: 24
 00:00:19.490740 eth1  Out IP 10.0.29.2.44114 > 10.0.29.3.3784: BFDv1, Control, State Up, Flags: [none], length: 24
 00:00:19.510024 eth1  In  IP 10.0.29.3.48590 > 10.0.29.2.3784: BFDv1, Control, State Up, Flags: [none], length: 24
 00:00:19.573153 eth1  Out IP 10.0.29.2.44114 > 10.0.29.3.3784: BFDv1, Control, State Up, Flags: [none], length: 24
 00:00:19.591554 eth1  In  IP 10.0.29.3.48590 > 10.0.29.2.3784: BFDv1, Control, State Up, Flags: [none], length: 24
 00:00:19.654947 eth1  Out IP 10.0.29.2.44114 > 10.0.29.3.3784: BFDv1, Control, State Up, Flags: [none], length: 24
 00:00:19.680212 eth1  In  IP 10.0.29.3.48590 > 10.0.29.2.3784: BFDv1, Control, State Up, Flags: [none], length: 24
 00:00:19.738758 eth1  Out IP 10.0.29.2.44114 > 10.0.29.3.3784: BFDv1, Control, State Up, Flags: [none], length: 24
 00:00:19.769072 eth1  In  IP 10.0.29.3.48590 > 10.0.29.2.3784: BFDv1, Control, State Up, Flags: [none], length: 24
 00:00:19.822587 eth1  Out IP 10.0.29.2.44114 > 10.0.29.3.3784: BFDv1, Control, State Up, Flags: [none], length: 24
 00:00:19.848917 eth1  In  IP 10.0.29.3.48590 > 10.0.29.2.3784: BFDv1, Control, State Up, Flags: [none], length: 24
 00:00:19.903435 eth1  Out IP 10.0.29.2.44114 > 10.0.29.3.3784: BFDv1, Control, State Up, Flags: [none], length: 24
 00:00:19.933730 eth1  In  IP 10.0.29.3.48590 > 10.0.29.2.3784: BFDv1, Control, State Up, Flags: [none], length: 24
 00:00:19.985129 eth1  Out IP 10.0.29.2.44114 > 10.0.29.3.3784: BFDv1, Control, State Up, Flags: [none], length: 24
 00:00:20.012390 eth1  In  IP 10.0.29.3.48590 > 10.0.29.2.3784: BFDv1, Control, State Up, Flags: [none], length: 24
 00:00:20.065806 eth1  Out IP 10.0.29.2.44114 > 10.0.29.3.3784: BFDv1, Control, State Up, Flags: [none], length: 24
 00:00:20.094066 eth1  In  IP 10.0.29.3.48590 > 10.0.29.2.3784: BFDv1, Control, State Up, Flags: [none], length: 24
 00:00:20.155543 eth1  Out IP 10.0.29.2.44114 > 10.0.29.3.3784: BFDv1, Control, State Up, Flags: [none], length: 24
 00:00:20.173853 eth1  In  IP 10.0.29.3.48590 > 10.0.29.2.3784: BFDv1, Control, State Up, Flags: [none], length: 24
 00:00:20.236267 eth1  Out IP 10.0.29.2.44114 > 10.0.29.3.3784: BFDv1, Control, State Up, Flags: [none], length: 24
 00:00:20.258522 eth1  In  IP 10.0.29.3.48590 > 10.0.29.2.3784: BFDv1, Control, State Up, Flags: [none], length: 24
 00:00:20.315960 eth1  Out IP 10.0.29.2.44114 > 10.0.29.3.3784: BFDv1, Control, State Up, Flags: [none], length: 24
 00:00:20.340244 eth1  In  IP 10.0.29.3.48590 > 10.0.29.2.3784: BFDv1, Control, State Up, Flags: [none], length: 24
 00:00:20.402646 eth1  Out IP 10.0.29.2.44114 > 10.0.29.3.3784: BFDv1, Control, State Up, Flags: [none], length: 24
 00:00:20.416026 eth1  In  IP 10.0.29.3.48590 > 10.0.29.2.3784: BFDv1, Control, State Up, Flags: [none], length: 24
 00:00:20.486488 eth1  Out IP 10.0.29.2.44114 > 10.0.29.3.3784: BFDv1, Control, State Up, Flags: [none], length: 24
 00:00:20.503766 eth1  In  IP 10.0.29.3.48590 > 10.0.29.2.3784: BFDv1, Control, State Up, Flags: [none], length: 24
 00:00:20.567166 eth1  Out IP 10.0.29.2.44114 > 10.0.29.3.3784: BFDv1, Control, State Up, Flags: [none], length: 24
 00:00:20.585578 eth1  In  IP 10.0.29.3.48590 > 10.0.29.2.3784: BFDv1, Control, State Up, Flags: [none], length: 24
 00:00:20.656029 eth1  Out IP 10.0.29.2.44114 > 10.0.29.3.3784: BFDv1, Control, State Up, Flags: [none], length: 24
 00:00:20.671257 eth1  In  IP 10.0.29.3.48590 > 10.0.29.2.3784: BFDv1, Control, State Up, Flags: [none], length: 24
 00:00:20.730774 eth1  Out IP 10.0.29.2.44114 > 10.0.29.3.3784: BFDv1, Control, State Up, Flags: [none], length: 24
 00:00:20.759081 eth1  In  IP 10.0.29.3.48590 > 10.0.29.2.3784: BFDv1, Control, State Up, Flags: [none], length: 24
 00:00:20.813550 eth1  Out IP 10.0.29.2.44114 > 10.0.29.3.3784: BFDv1, Control, State Up, Flags: [none], length: 24
 00:00:20.833803 eth1  In  IP 10.0.29.3.48590 > 10.0.29.2.3784: BFDv1, Control, State Up, Flags: [none], length: 24
 00:00:20.901201 eth1  Out IP 10.0.29.2.44114 > 10.0.29.3.3784: BFDv1, Control, State Up, Flags: [none], length: 24
 00:00:20.917532 eth1  In  IP 10.0.29.3.48590 > 10.0.29.2.3784: BFDv1, Control, State Up, Flags: [none], length: 24
 00:00:20.987901 eth1  Out IP 10.0.29.2.44114 > 10.0.29.3.3784: BFDv1, Control, State Up, Flags: [none], length: 24
 00:00:20.995108 eth1  In  IP 10.0.29.3.48590 > 10.0.29.2.3784: BFDv1, Control, State Up, Flags: [none], length: 24
 00:00:21.067512 eth1  Out IP 10.0.29.2.44114 > 10.0.29.3.3784: BFDv1, Control, State Up, Flags: [none], length: 24
 00:00:21.074859 eth1  In  IP 10.0.29.3.48590 > 10.0.29.2.3784: BFDv1, Control, State Up, Flags: [none], length: 24
 00:00:21.155715 eth1  Out IP 10.0.29.2.44114 > 10.0.29.3.3784: BFDv1, Control, State Up, Flags: [none], length: 24
 00:00:21.162496 eth1  In  IP 10.0.29.3.48590 > 10.0.29.2.3784: BFDv1, Control, State Up, Flags: [none], length: 24
 00:00:21.238864 eth1  Out IP 10.0.29.2.44114 > 10.0.29.3.3784: BFDv1, Control, State Up, Flags: [none], length: 24
 00:00:21.238880 eth1  In  IP 10.0.29.3.48590 > 10.0.29.2.3784: BFDv1, Control, State Up, Flags: [none], length: 24
 00:00:21.320812 eth1  In  IP 10.0.29.3.48590 > 10.0.29.2.3784: BFDv1, Control, State Up, Flags: [none], length: 24
 00:00:21.326228 eth1  Out IP 10.0.29.2.44114 > 10.0.29.3.3784: BFDv1, Control, State Up, Flags: [none], length: 24
 00:00:21.404999 eth1  In  IP 10.0.29.3.48590 > 10.0.29.2.3784: BFDv1, Control, State Up, Flags: [none], length: 24
 00:00:21.405145 eth1  Out IP 10.0.29.2.44114 > 10.0.29.3.3784: BFDv1, Control, State Up, Flags: [none], length: 24
 00:00:21.482835 eth1  In  IP 10.0.29.3.48590 > 10.0.29.2.3784: BFDv1, Control, State Up, Flags: [none], length: 24
 00:00:21.483069 eth1  Out IP 10.0.29.2.44114 > 10.0.29.3.3784: BFDv1, Control, State Up, Flags: [none], length: 24
 00:00:21.559537 eth1  Out IP 10.0.29.2.44114 > 10.0.29.3.3784: BFDv1, Control, State Up, Flags: [none], length: 24
 00:00:21.563891 eth1  In  IP 10.0.29.3.48590 > 10.0.29.2.3784: BFDv1, Control, State Up, Flags: [none], length: 24
 00:00:21.641349 eth1  Out IP 10.0.29.2.44114 > 10.0.29.3.3784: BFDv1, Control, State Up, Flags: [none], length: 24
 00:00:21.647647 eth1  In  IP 10.0.29.3.48590 > 10.0.29.2.3784: BFDv1, Control, State Up, Flags: [none], length: 24
 00:00:21.720090 eth1  Out IP 10.0.29.2.44114 > 10.0.29.3.3784: BFDv1, Control, State Up, Flags: [none], length: 24
 00:00:21.728343 eth1  In  IP 10.0.29.3.48590 > 10.0.29.2.3784: BFDv1, Control, State Up, Flags: [none], length: 24
 00:00:21.804698 eth1  Out IP 10.0.29.2.44114 > 10.0.29.3.3784: BFDv1, Control, State Up, Flags: [none], length: 24
 00:00:21.815982 eth1  In  IP 10.0.29.3.48590 > 10.0.29.2.3784: BFDv1, Control, State Up, Flags: [none], length: 24
 00:00:21.884328 eth1  Out IP 10.0.29.2.44114 > 10.0.29.3.3784: BFDv1, Control, State Up, Flags: [none], length: 24
 00:00:21.904640 eth1  In  IP 10.0.29.3.48590 > 10.0.29.2.3784: BFDv1, Control, State Up, Flags: [none], length: 24
 00:00:21.961098 eth1  Out IP 10.0.29.2.44114 > 10.0.29.3.3784: BFDv1, Control, State Up, Flags: [none], length: 24
 00:00:21.994114 eth1  In  IP 10.0.29.3.48590 > 10.0.29.2.3784: BFDv1, Control, State Up, Flags: [none], length: 24
 00:00:22.042583 eth1  Out IP 10.0.29.2.44114 > 10.0.29.3.3784: BFDv1, Control, State Up, Flags: [none], length: 24
 00:00:22.076779 eth1  In  IP 10.0.29.3.48590 > 10.0.29.2.3784: BFDv1, Control, State Up, Flags: [none], length: 24
 00:00:22.130153 eth1  Out IP 10.0.29.2.44114 > 10.0.29.3.3784: BFDv1, Control, State Up, Flags: [none], length: 24
 00:00:22.160404 eth1  In  IP 10.0.29.3.48590 > 10.0.29.2.3784: BFDv1, Control, State Up, Flags: [none], length: 24
 00:00:22.213779 eth1  Out IP 10.0.29.2.44114 > 10.0.29.3.3784: BFDv1, Control, State Up, Flags: [none], length: 24
 00:00:22.242128 eth1  In  IP 10.0.29.3.48590 > 10.0.29.2.3784: BFDv1, Control, State Up, Flags: [none], length: 24
 00:00:22.289532 eth1  Out IP 10.0.29.2.44114 > 10.0.29.3.3784: BFDv1, Control, State Up, Flags: [none], length: 24
 00:00:22.327789 eth1  In  IP 10.0.29.3.48590 > 10.0.29.2.3784: BFDv1, Control, State Up, Flags: [none], length: 24
 00:00:22.370201 eth1  Out IP 10.0.29.2.44114 > 10.0.29.3.3784: BFDv1, Control, State Up, Flags: [none], length: 24
 00:00:22.415407 eth1  In  IP 10.0.29.3.48590 > 10.0.29.2.3784: BFDv1, Control, State Up, Flags: [none], length: 24
 00:00:22.458810 eth1  Out IP 10.0.29.2.44114 > 10.0.29.3.3784: BFDv1, Control, State Up, Flags: [none], length: 24
 00:00:22.506151 eth1  In  IP 10.0.29.3.48590 > 10.0.29.2.3784: BFDv1, Control, State Up, Flags: [none], length: 24
 00:00:22.540598 eth1  Out IP 10.0.29.2.44114 > 10.0.29.3.3784: BFDv1, Control, State Up, Flags: [none], length: 24
 00:00:22.594906 eth1  In  IP 10.0.29.3.48590 > 10.0.29.2.3784: BFDv1, Control, State Up, Flags: [none], length: 24
 00:00:22.626352 eth1  Out IP 10.0.29.2.44114 > 10.0.29.3.3784: BFDv1, Control, State Up, Flags: [none], length: 24
 00:00:22.677656 eth1  In  IP 10.0.29.3.48590 > 10.0.29.2.3784: BFDv1, Control, State Up, Flags: [none], length: 24
 00:00:22.715021 eth1  Out IP 10.0.29.2.44114 > 10.0.29.3.3784: BFDv1, Control, State Up, Flags: [none], length: 24
 00:00:22.758326 eth1  In  IP 10.0.29.3.48590 > 10.0.29.2.3784: BFDv1, Control, State Up, Flags: [none], length: 24
 00:00:22.802752 eth1  Out IP 10.0.29.2.44114 > 10.0.29.3.3784: BFDv1, Control, State Up, Flags: [none], length: 24
 00:00:22.833876 eth1  In  IP 10.0.29.3.48590 > 10.0.29.2.3784: BFDv1, Control, State Up, Flags: [none], length: 24
 00:00:22.879588 eth1  Out IP 10.0.29.2.44114 > 10.0.29.3.3784: BFDv1, Control, State Up, Flags: [none], length: 24
 00:00:22.912898 eth1  In  IP 10.0.29.3.48590 > 10.0.29.2.3784: BFDv1, Control, State Up, Flags: [none], length: 24
 00:00:22.962288 eth1  Out IP 10.0.29.2.44114 > 10.0.29.3.3784: BFDv1, Control, State Up, Flags: [none], length: 24
 00:00:22.988594 eth1  In  IP 10.0.29.3.48590 > 10.0.29.2.3784: BFDv1, Control, State Up, Flags: [none], length: 24
 00:00:23.044031 eth1  Out IP 10.0.29.2.44114 > 10.0.29.3.3784: BFDv1, Control, State Up, Flags: [none], length: 24
 00:00:23.076322 eth1  In  IP 10.0.29.3.48590 > 10.0.29.2.3784: BFDv1, Control, State Up, Flags: [none], length: 24
 00:00:23.124707 eth1  Out IP 10.0.29.2.44114 > 10.0.29.3.3784: BFDv1, Control, State Up, Flags: [none], length: 24
 00:00:23.163033 eth1  In  IP 10.0.29.3.48590 > 10.0.29.2.3784: BFDv1, Control, State Up, Flags: [none], length: 24
 00:00:23.207477 eth1  Out IP 10.0.29.2.44114 > 10.0.29.3.3784: BFDv1, Control, State Up, Flags: [none], length: 24
 00:00:23.243758 eth1  In  IP 10.0.29.3.48590 > 10.0.29.2.3784: BFDv1, Control, State Up, Flags: [none], length: 24
 00:00:23.289129 eth1  Out IP 10.0.29.2.44114 > 10.0.29.3.3784: BFDv1, Control, State Up, Flags: [none], length: 24
 00:00:23.329404 eth1  In  IP 10.0.29.3.48590 > 10.0.29.2.3784: BFDv1, Control, State Up, Flags: [none], length: 24
 00:00:23.377036 eth1  Out IP 10.0.29.2.44114 > 10.0.29.3.3784: BFDv1, Control, State Up, Flags: [none], length: 24
 00:00:23.419323 eth1  In  IP 10.0.29.3.48590 > 10.0.29.2.3784: BFDv1, Control, State Up, Flags: [none], length: 24
 00:00:23.456721 eth1  Out IP 10.0.29.2.44114 > 10.0.29.3.3784: BFDv1, Control, State Up, Flags: [none], length: 24
 00:00:23.497144 eth1  In  IP 10.0.29.3.48590 > 10.0.29.2.3784: BFDv1, Control, State Up, Flags: [none], length: 24
 00:00:23.535746 eth1  Out IP 10.0.29.2.44114 > 10.0.29.3.3784: BFDv1, Control, State Up, Flags: [none], length: 24
 00:00:23.578066 eth1  In  IP 10.0.29.3.48590 > 10.0.29.2.3784: BFDv1, Control, State Up, Flags: [none], length: 24
 00:00:23.612458 eth1  Out IP 10.0.29.2.44114 > 10.0.29.3.3784: BFDv1, Control, State Up, Flags: [none], length: 24
 00:00:23.656981 eth1  In  IP 10.0.29.3.48590 > 10.0.29.2.3784: BFDv1, Control, State Up, Flags: [none], length: 24
 00:00:23.690399 eth1  Out IP 10.0.29.2.44114 > 10.0.29.3.3784: BFDv1, Control, State Up, Flags: [none], length: 24
 00:00:23.740922 eth1  In  IP 10.0.29.3.48590 > 10.0.29.2.3784: BFDv1, Control, State Up, Flags: [none], length: 24
 00:00:23.777343 eth1  Out IP 10.0.29.2.44114 > 10.0.29.3.3784: BFDv1, Control, State Up, Flags: [none], length: 24
 00:00:23.817968 eth1  In  IP 10.0.29.3.48590 > 10.0.29.2.3784: BFDv1, Control, State Up, Flags: [none], length: 24
 00:00:23.866534 eth1  Out IP 10.0.29.2.44114 > 10.0.29.3.3784: BFDv1, Control, State Up, Flags: [none], length: 24
 00:00:23.869679 eth1  Out IP 10.0.29.2.49689 > 10.0.29.3.179: Flags [S], seq 2919125751, win 64240, options [mss 1460,sackOK,TS val 1875347690 ecr 0,nop,wscale 10], length 0
 00:00:23.869750 eth1  In  IP 10.0.29.3.179 > 10.0.29.2.49689: Flags [S.], seq 1801714167, ack 2919125752, win 65160, options [mss 1460,sackOK,TS val 3828102664 ecr 1875347690,nop,wscale 10], length 0
 00:00:23.869777 eth1  Out IP 10.0.29.2.49689 > 10.0.29.3.179: Flags [.], ack 1, win 63, options [nop,nop,TS val 1875347690 ecr 3828102664], length 0
 00:00:23.869865 eth1  Out IP 10.0.29.2.49689 > 10.0.29.3.179: Flags [P.], seq 1:65, ack 1, win 63, options [nop,nop,TS val 1875347690 ecr 3828102664], length 64: BGP
 00:00:23.869880 eth1  In  IP 10.0.29.3.179 > 10.0.29.2.49689: Flags [.], ack 65, win 64, options [nop,nop,TS val 3828102664 ecr 1875347690], length 0
 00:00:23.869938 eth1  In  IP 10.0.29.3.179 > 10.0.29.2.49689: Flags [R.], seq 1, ack 65, win 64, options [nop,nop,TS val 3828102664 ecr 1875347690], length 0
 00:00:23.902799 eth1  In  IP 10.0.29.3.48590 > 10.0.29.2.3784: BFDv1, Control, State Up, Flags: [none], length: 24
 00:00:23.948204 eth1  Out IP 10.0.29.2.44114 > 10.0.29.3.3784: BFDv1, Control, State Up, Flags: [none], length: 24
 00:00:23.977502 eth1  In  IP 10.0.29.3.48590 > 10.0.29.2.3784: BFDv1, Control, State Up, Flags: [none], length: 24
 00:00:24.025950 eth1  Out IP 10.0.29.2.44114 > 10.0.29.3.3784: BFDv1, Control, State Up, Flags: [none], length: 24
 00:00:24.058479 eth1  In  IP 10.0.29.3.48590 > 10.0.29.2.3784: BFDv1, Control, State Up, Flags: [none], length: 24
 00:00:24.110888 eth1  Out IP 10.0.29.2.44114 > 10.0.29.3.3784: BFDv1, Control, State Up, Flags: [none], length: 24
 00:00:24.141422 eth1  In  IP 10.0.29.3.48590 > 10.0.29.2.3784: BFDv1, Control, State Up, Flags: [none], length: 24
 00:00:24.196887 eth1  Out IP 10.0.29.2.44114 > 10.0.29.3.3784: BFDv1, Control, State Up, Flags: [none], length: 24
 00:00:24.227108 eth1  In  IP 10.0.29.3.48590 > 10.0.29.2.3784: BFDv1, Control, State Up, Flags: [none], length: 24
 00:00:24.267485 eth1  Out IP 10.0.29.2.44114 > 10.0.29.3.3784: BFDv1, Control, State Up, Flags: [none], length: 24
 00:00:24.305940 eth1  In  IP 10.0.29.3.48590 > 10.0.29.2.3784: BFDv1, Control, State Up, Flags: [none], length: 24
 00:00:24.344588 eth1  Out IP 10.0.29.2.44114 > 10.0.29.3.3784: BFDv1, Control, State Up, Flags: [none], length: 24
 00:00:24.387133 eth1  In  IP 10.0.29.3.48590 > 10.0.29.2.3784: BFDv1, Control, State Up, Flags: [none], length: 24
 00:00:24.419593 eth1  Out IP 10.0.29.2.44114 > 10.0.29.3.3784: BFDv1, Control, State Up, Flags: [none], length: 24
 00:00:24.467105 eth1  In  IP 10.0.29.3.48590 > 10.0.29.2.3784: BFDv1, Control, State Up, Flags: [none], length: 24
 00:00:24.505519 eth1  Out IP 10.0.29.2.44114 > 10.0.29.3.3784: BFDv1, Control, State Up, Flags: [none], length: 24
 00:00:24.551017 eth1  In  IP 10.0.29.3.48590 > 10.0.29.2.3784: BFDv1, Control, State Up, Flags: [none], length: 24
 00:00:24.582450 eth1  Out IP 10.0.29.2.44114 > 10.0.29.3.3784: BFDv1, Control, State Up, Flags: [none], length: 24
 00:00:24.634920 eth1  In  IP 10.0.29.3.48590 > 10.0.29.2.3784: BFDv1, Control, State Up, Flags: [none], length: 24
 00:00:24.663326 eth1  Out IP 10.0.29.2.44114 > 10.0.29.3.3784: BFDv1, Control, State Up, Flags: [none], length: 24
 00:00:24.715847 eth1  In  IP 10.0.29.3.48590 > 10.0.29.2.3784: BFDv1, Control, State Up, Flags: [none], length: 24
 00:00:24.748236 eth1  Out IP 10.0.29.2.44114 > 10.0.29.3.3784: BFDv1, Control, State Up, Flags: [none], length: 24
 00:00:24.804846 eth1  In  IP 10.0.29.3.48590 > 10.0.29.2.3784: BFDv1, Control, State Up, Flags: [none], length: 24
 00:00:24.832054 eth1  Out IP 10.0.29.2.44114 > 10.0.29.3.3784: BFDv1, Control, State Up, Flags: [none], length: 24
 00:00:24.889639 eth1  In  IP 10.0.29.3.48590 > 10.0.29.2.3784: BFDv1, Control, State Up, Flags: [none], length: 24
 00:00:24.908072 eth1  Out IP 10.0.29.2.44114 > 10.0.29.3.3784: BFDv1, Control, State Up, Flags: [none], length: 24
 00:00:24.978511 eth1  In  IP 10.0.29.3.48590 > 10.0.29.2.3784: BFDv1, Control, State Up, Flags: [none], length: 24
 00:00:24.991868 eth1  Out IP 10.0.29.2.44114 > 10.0.29.3.3784: BFDv1, Control, State Up, Flags: [none], length: 24
 00:00:25.059313 eth1  In  IP 10.0.29.3.48590 > 10.0.29.2.3784: BFDv1, Control, State Up, Flags: [none], length: 24
 00:00:25.071733 eth1  Out IP 10.0.29.2.44114 > 10.0.29.3.3784: BFDv1, Control, State Up, Flags: [none], length: 24
 00:00:25.145527 eth1  In  IP 10.0.29.3.48590 > 10.0.29.2.3784: BFDv1, Control, State Up, Flags: [none], length: 24
 00:00:25.148837 eth1  Out IP 10.0.29.2.44114 > 10.0.29.3.3784: BFDv1, Control, State Up, Flags: [none], length: 24
 00:00:25.226131 eth1  Out IP 10.0.29.2.44114 > 10.0.29.3.3784: BFDv1, Control, State Up, Flags: [none], length: 24
 00:00:25.229369 eth1  In  IP 10.0.29.3.48590 > 10.0.29.2.3784: BFDv1, Control, State Up, Flags: [none], length: 24
 00:00:25.311836 eth1  Out IP 10.0.29.2.44114 > 10.0.29.3.3784: BFDv1, Control, State Up, Flags: [none], length: 24
 00:00:25.318092 eth1  In  IP 10.0.29.3.48590 > 10.0.29.2.3784: BFDv1, Control, State Up, Flags: [none], length: 24
 00:00:25.394531 eth1  Out IP 10.0.29.2.44114 > 10.0.29.3.3784: BFDv1, Control, State Up, Flags: [none], length: 24
 00:00:25.404839 eth1  In  IP 10.0.29.3.48590 > 10.0.29.2.3784: BFDv1, Control, State Up, Flags: [none], length: 24
 00:00:25.479294 eth1  Out IP 10.0.29.2.44114 > 10.0.29.3.3784: BFDv1, Control, State Up, Flags: [none], length: 24
 00:00:25.488544 eth1  In  IP 10.0.29.3.48590 > 10.0.29.2.3784: BFDv1, Control, State Up, Flags: [none], length: 24
 00:00:25.557010 eth1  Out IP 10.0.29.2.44114 > 10.0.29.3.3784: BFDv1, Control, State Up, Flags: [none], length: 24
 00:00:25.565279 eth1  In  IP 10.0.29.3.48590 > 10.0.29.2.3784: BFDv1, Control, State Up, Flags: [none], length: 24
 00:00:25.637742 eth1  Out IP 10.0.29.2.44114 > 10.0.29.3.3784: BFDv1, Control, State Up, Flags: [none], length: 24
 00:00:25.653998 eth1  In  IP 10.0.29.3.48590 > 10.0.29.2.3784: BFDv1, Control, State Up, Flags: [none], length: 24
 00:00:25.727421 eth1  Out IP 10.0.29.2.44114 > 10.0.29.3.3784: BFDv1, Control, State Up, Flags: [none], length: 24
 00:00:25.740686 eth1  In  IP 10.0.29.3.48590 > 10.0.29.2.3784: BFDv1, Control, State Up, Flags: [none], length: 24
 00:00:25.807259 eth1  Out IP 10.0.29.2.44114 > 10.0.29.3.3784: BFDv1, Control, State Up, Flags: [none], length: 24
 00:00:25.819542 eth1  In  IP 10.0.29.3.48590 > 10.0.29.2.3784: BFDv1, Control, State Up, Flags: [none], length: 24
 00:00:25.890050 eth1  Out IP 10.0.29.2.44114 > 10.0.29.3.3784: BFDv1, Control, State Up, Flags: [none], length: 24
 00:00:25.898357 eth1  In  IP 10.0.29.3.48590 > 10.0.29.2.3784: BFDv1, Control, State Up, Flags: [none], length: 24
 00:00:25.966893 eth1  Out IP 10.0.29.2.44114 > 10.0.29.3.3784: BFDv1, Control, State Up, Flags: [none], length: 24
 00:00:25.987243 eth1  In  IP 10.0.29.3.48590 > 10.0.29.2.3784: BFDv1, Control, State Up, Flags: [none], length: 24
 00:00:26.045691 eth1  Out IP 10.0.29.2.44114 > 10.0.29.3.3784: BFDv1, Control, State Up, Flags: [none], length: 24
 00:00:26.069979 eth1  In  IP 10.0.29.3.48590 > 10.0.29.2.3784: BFDv1, Control, State Up, Flags: [none], length: 24
 00:00:26.126455 eth1  Out IP 10.0.29.2.44114 > 10.0.29.3.3784: BFDv1, Control, State Up, Flags: [none], length: 24
 00:00:26.149787 eth1  In  IP 10.0.29.3.48590 > 10.0.29.2.3784: BFDv1, Control, State Up, Flags: [none], length: 24
 00:00:26.209235 eth1  Out IP 10.0.29.2.44114 > 10.0.29.3.3784: BFDv1, Control, State Up, Flags: [none], length: 24
 00:00:26.224700 eth1  In  IP 10.0.29.3.48590 > 10.0.29.2.3784: BFDv1, Control, State Up, Flags: [none], length: 24
 00:00:26.287336 eth1  Out IP 10.0.29.2.44114 > 10.0.29.3.3784: BFDv1, Control, State Up, Flags: [none], length: 24
 00:00:26.306614 eth1  In  IP 10.0.29.3.48590 > 10.0.29.2.3784: BFDv1, Control, State Up, Flags: [none], length: 24
 00:00:26.370017 eth1  Out IP 10.0.29.2.44114 > 10.0.29.3.3784: BFDv1, Control, State Up, Flags: [none], length: 24
 00:00:26.384539 eth1  In  IP 10.0.29.3.48590 > 10.0.29.2.3784: BFDv1, Control, State Up, Flags: [none], length: 24
 00:00:26.450094 eth1  Out IP 10.0.29.2.44114 > 10.0.29.3.3784: BFDv1, Control, State Up, Flags: [none], length: 24
 00:00:26.464351 eth1  In  IP 10.0.29.3.48590 > 10.0.29.2.3784: BFDv1, Control, State Up, Flags: [none], length: 24
 00:00:26.529764 eth1  Out IP 10.0.29.2.44114 > 10.0.29.3.3784: BFDv1, Control, State Up, Flags: [none], length: 24
 00:00:26.554006 eth1  In  IP 10.0.29.3.48590 > 10.0.29.2.3784: BFDv1, Control, State Up, Flags: [none], length: 24
 00:00:26.606400 eth1  Out IP 10.0.29.2.44114 > 10.0.29.3.3784: BFDv1, Control, State Up, Flags: [none], length: 24
 00:00:26.638844 eth1  In  IP 10.0.29.3.48590 > 10.0.29.2.3784: BFDv1, Control, State Up, Flags: [none], length: 24
 00:00:26.690248 eth1  Out IP 10.0.29.2.44114 > 10.0.29.3.3784: BFDv1, Control, State Up, Flags: [none], length: 24
 00:00:26.725539 eth1  In  IP 10.0.29.3.48590 > 10.0.29.2.3784: BFDv1, Control, State Up, Flags: [none], length: 24
 00:00:26.773879 eth1  Out IP 10.0.29.2.44114 > 10.0.29.3.3784: BFDv1, Control, State Up, Flags: [none], length: 24
 00:00:26.802281 eth1  In  IP 10.0.29.3.48590 > 10.0.29.2.3784: BFDv1, Control, State Up, Flags: [none], length: 24
 00:00:26.852797 eth1  Out IP 10.0.29.2.44114 > 10.0.29.3.3784: BFDv1, Control, State Up, Flags: [none], length: 24
 00:00:26.877172 eth1  In  IP 10.0.29.3.48590 > 10.0.29.2.3784: BFDv1, Control, State Up, Flags: [none], length: 24
 00:00:26.935810 eth1  Out IP 10.0.29.2.44114 > 10.0.29.3.3784: BFDv1, Control, State Up, Flags: [none], length: 24
 00:00:26.957136 eth1  In  IP 10.0.29.3.48590 > 10.0.29.2.3784: BFDv1, Control, State Up, Flags: [none], length: 24
 00:00:27.014593 eth1  Out IP 10.0.29.2.44114 > 10.0.29.3.3784: BFDv1, Control, State Up, Flags: [none], length: 24
 00:00:27.036872 eth1  In  IP 10.0.29.3.48590 > 10.0.29.2.3784: BFDv1, Control, State Up, Flags: [none], length: 24
 00:00:27.096329 eth1  Out IP 10.0.29.2.44114 > 10.0.29.3.3784: BFDv1, Control, State Up, Flags: [none], length: 24
 00:00:27.111895 eth1  In  IP 10.0.29.3.48590 > 10.0.29.2.3784: BFDv1, Control, State Up, Flags: [none], length: 24
 00:00:27.184351 eth1  Out IP 10.0.29.2.44114 > 10.0.29.3.3784: BFDv1, Control, State Up, Flags: [none], length: 24
 00:00:27.192646 eth1  In  IP 10.0.29.3.48590 > 10.0.29.2.3784: BFDv1, Control, State Up, Flags: [none], length: 24
 00:00:27.269116 eth1  In  IP 10.0.29.3.48590 > 10.0.29.2.3784: BFDv1, Control, State Up, Flags: [none], length: 24
 00:00:27.273540 eth1  Out IP 10.0.29.2.44114 > 10.0.29.3.3784: BFDv1, Control, State Up, Flags: [none], length: 24
 00:00:27.355509 eth1  In  IP 10.0.29.3.48590 > 10.0.29.2.3784: BFDv1, Control, State Up, Flags: [none], length: 24
 00:00:27.361805 eth1  Out IP 10.0.29.2.44114 > 10.0.29.3.3784: BFDv1, Control, State Up, Flags: [none], length: 24
 00:00:27.435241 eth1  In  IP 10.0.29.3.48590 > 10.0.29.2.3784: BFDv1, Control, State Up, Flags: [none], length: 24
 00:00:27.437639 eth1  Out IP 10.0.29.2.44114 > 10.0.29.3.3784: BFDv1, Control, State Up, Flags: [none], length: 24
 00:00:27.517939 eth1  In  IP 10.0.29.3.48590 > 10.0.29.2.3784: BFDv1, Control, State Up, Flags: [none], length: 24
 00:00:27.519304 eth1  Out IP 10.0.29.2.44114 > 10.0.29.3.3784: BFDv1, Control, State Up, Flags: [none], length: 24
 00:00:27.596562 eth1  Out IP 10.0.29.2.44114 > 10.0.29.3.3784: BFDv1, Control, State Up, Flags: [none], length: 24
 00:00:27.602767 eth1  In  IP 10.0.29.3.48590 > 10.0.29.2.3784: BFDv1, Control, State Up, Flags: [none], length: 24
 00:00:27.675216 eth1  Out IP 10.0.29.2.44114 > 10.0.29.3.3784: BFDv1, Control, State Up, Flags: [none], length: 24
 00:00:27.690852 eth1  In  IP 10.0.29.3.48590 > 10.0.29.2.3784: BFDv1, Control, State Up, Flags: [none], length: 24
 00:00:27.759323 eth1  Out IP 10.0.29.2.44114 > 10.0.29.3.3784: BFDv1, Control, State Up, Flags: [none], length: 24
 00:00:27.771763 eth1  In  IP 10.0.29.3.48590 > 10.0.29.2.3784: BFDv1, Control, State Up, Flags: [none], length: 24
 00:00:27.847169 eth1  Out IP 10.0.29.2.44114 > 10.0.29.3.3784: BFDv1, Control, State Up, Flags: [none], length: 24
 00:00:27.857626 eth1  In  IP 10.0.29.3.48590 > 10.0.29.2.3784: BFDv1, Control, State Up, Flags: [none], length: 24
 00:00:27.933038 eth1  Out IP 10.0.29.2.44114 > 10.0.29.3.3784: BFDv1, Control, State Up, Flags: [none], length: 24
 00:00:27.939284 eth1  In  IP 10.0.29.3.48590 > 10.0.29.2.3784: BFDv1, Control, State Up, Flags: [none], length: 24
 00:00:28.012501 eth1  Out IP 10.0.29.2.44114 > 10.0.29.3.3784: BFDv1, Control, State Up, Flags: [none], length: 24
 00:00:28.018764 eth1  In  IP 10.0.29.3.48590 > 10.0.29.2.3784: BFDv1, Control, State Up, Flags: [none], length: 24
 00:00:28.087208 eth1  Out IP 10.0.29.2.44114 > 10.0.29.3.3784: BFDv1, Control, State Up, Flags: [none], length: 24
 00:00:28.096756 eth1  In  IP 10.0.29.3.48590 > 10.0.29.2.3784: BFDv1, Control, State Up, Flags: [none], length: 24
 00:00:28.163130 eth1  Out IP 10.0.29.2.44114 > 10.0.29.3.3784: BFDv1, Control, State Up, Flags: [none], length: 24
 00:00:28.181631 eth1  In  IP 10.0.29.3.48590 > 10.0.29.2.3784: BFDv1, Control, State Up, Flags: [none], length: 24
 00:00:28.241156 eth1  Out IP 10.0.29.2.44114 > 10.0.29.3.3784: BFDv1, Control, State Up, Flags: [none], length: 24
 00:00:28.256721 eth1  In  IP 10.0.29.3.48590 > 10.0.29.2.3784: BFDv1, Control, State Up, Flags: [none], length: 24
 00:00:28.321126 eth1  Out IP 10.0.29.2.44114 > 10.0.29.3.3784: BFDv1, Control, State Up, Flags: [none], length: 24
 00:00:28.333486 eth1  In  IP 10.0.29.3.48590 > 10.0.29.2.3784: BFDv1, Control, State Up, Flags: [none], length: 24
 00:00:28.404941 eth1  Out IP 10.0.29.2.44114 > 10.0.29.3.3784: BFDv1, Control, State Up, Flags: [none], length: 24
 00:00:28.414239 eth1  In  IP 10.0.29.3.48590 > 10.0.29.2.3784: BFDv1, Control, State Up, Flags: [none], length: 24
 00:00:28.483783 eth1  Out IP 10.0.29.2.44114 > 10.0.29.3.3784: BFDv1, Control, State Up, Flags: [none], length: 24
 00:00:28.503139 eth1  In  IP 10.0.29.3.48590 > 10.0.29.2.3784: BFDv1, Control, State Up, Flags: [none], length: 24
 00:00:28.515620 eth1  Out IP 10.0.29.2.33349 > 10.0.29.3.179: Flags [S], seq 1897296714, win 64240, options [mss 1460,sackOK,TS val 1875352336 ecr 0,nop,wscale 10], length 0
 00:00:28.515681 eth1  In  IP 10.0.29.3.179 > 10.0.29.2.33349: Flags [S.], seq 1944150619, ack 1897296715, win 65160, options [mss 1460,sackOK,TS val 3828107310 ecr 1875352336,nop,wscale 10], length 0
 00:00:28.515712 eth1  Out IP 10.0.29.2.33349 > 10.0.29.3.179: Flags [.], ack 1, win 63, options [nop,nop,TS val 1875352336 ecr 3828107310], length 0
 00:00:28.515819 eth1  Out IP 10.0.29.2.33349 > 10.0.29.3.179: Flags [P.], seq 1:65, ack 1, win 63, options [nop,nop,TS val 1875352336 ecr 3828107310], length 64: BGP
 00:00:28.515835 eth1  In  IP 10.0.29.3.179 > 10.0.29.2.33349: Flags [.], ack 65, win 64, options [nop,nop,TS val 3828107310 ecr 1875352336], length 0
 00:00:28.516004 eth1  In  IP 10.0.29.3.179 > 10.0.29.2.33349: Flags [R.], seq 1, ack 65, win 64, options [nop,nop,TS val 3828107310 ecr 1875352336], length 0
 00:00:28.566734 eth1  Out IP 10.0.29.2.44114 > 10.0.29.3.3784: BFDv1, Control, State Up, Flags: [none], length: 24
 00:00:28.583989 eth1  In  IP 10.0.29.3.48590 > 10.0.29.2.3784: BFDv1, Control, State Up, Flags: [none], length: 24
 00:00:28.649527 eth1  Out IP 10.0.29.2.44114 > 10.0.29.3.3784: BFDv1, Control, State Up, Flags: [none], length: 24
 00:00:28.670800 eth1  In  IP 10.0.29.3.48590 > 10.0.29.2.3784: BFDv1, Control, State Up, Flags: [none], length: 24
 00:00:28.726165 eth1  Out IP 10.0.29.2.44114 > 10.0.29.3.3784: BFDv1, Control, State Up, Flags: [none], length: 24
 00:00:28.752443 eth1  In  IP 10.0.29.3.48590 > 10.0.29.2.3784: BFDv1, Control, State Up, Flags: [none], length: 24
 00:00:28.800784 eth1  Out IP 10.0.29.2.44114 > 10.0.29.3.3784: BFDv1, Control, State Up, Flags: [none], length: 24
 00:00:28.830143 eth1  In  IP 10.0.29.3.48590 > 10.0.29.2.3784: BFDv1, Control, State Up, Flags: [none], length: 24
 00:00:28.885692 eth1  Out IP 10.0.29.2.44114 > 10.0.29.3.3784: BFDv1, Control, State Up, Flags: [none], length: 24
 00:00:28.917998 eth1  In  IP 10.0.29.3.48590 > 10.0.29.2.3784: BFDv1, Control, State Up, Flags: [none], length: 24
 00:00:28.969468 eth1  Out IP 10.0.29.2.44114 > 10.0.29.3.3784: BFDv1, Control, State Up, Flags: [none], length: 24
 00:00:28.993769 eth1  In  IP 10.0.29.3.48590 > 10.0.29.2.3784: BFDv1, Control, State Up, Flags: [none], length: 24
 00:00:29.053199 eth1  Out IP 10.0.29.2.44114 > 10.0.29.3.3784: BFDv1, Control, State Up, Flags: [none], length: 24
 00:00:29.079625 eth1  In  IP 10.0.29.3.48590 > 10.0.29.2.3784: BFDv1, Control, State Up, Flags: [none], length: 24
 00:00:29.141075 eth1  Out IP 10.0.29.2.44114 > 10.0.29.3.3784: BFDv1, Control, State Up, Flags: [none], length: 24
 00:00:29.158379 eth1  In  IP 10.0.29.3.48590 > 10.0.29.2.3784: BFDv1, Control, State Up, Flags: [none], length: 24
 00:00:29.218931 eth1  Out IP 10.0.29.2.44114 > 10.0.29.3.3784: BFDv1, Control, State Up, Flags: [none], length: 24
 00:00:29.236245 eth1  In  IP 10.0.29.3.48590 > 10.0.29.2.3784: BFDv1, Control, State Up, Flags: [none], length: 24
 00:00:29.304701 eth1  Out IP 10.0.29.2.44114 > 10.0.29.3.3784: BFDv1, Control, State Up, Flags: [none], length: 24
 00:00:29.321985 eth1  In  IP 10.0.29.3.48590 > 10.0.29.2.3784: BFDv1, Control, State Up, Flags: [none], length: 24
 00:00:29.383514 eth1  Out IP 10.0.29.2.44114 > 10.0.29.3.3784: BFDv1, Control, State Up, Flags: [none], length: 24
 00:00:29.409900 eth1  In  IP 10.0.29.3.48590 > 10.0.29.2.3784: BFDv1, Control, State Up, Flags: [none], length: 24
 00:00:29.459308 eth1  Out IP 10.0.29.2.44114 > 10.0.29.3.3784: BFDv1, Control, State Up, Flags: [none], length: 24
 00:00:29.498767 eth1  In  IP 10.0.29.3.48590 > 10.0.29.2.3784: BFDv1, Control, State Up, Flags: [none], length: 24
 00:00:29.544238 eth1  Out IP 10.0.29.2.44114 > 10.0.29.3.3784: BFDv1, Control, State Up, Flags: [none], length: 24
 00:00:29.575590 eth1  In  IP 10.0.29.3.48590 > 10.0.29.2.3784: BFDv1, Control, State Up, Flags: [none], length: 24
 00:00:29.620985 eth1  Out IP 10.0.29.2.44114 > 10.0.29.3.3784: BFDv1, Control, State Up, Flags: [none], length: 24
 00:00:29.659337 eth1  In  IP 10.0.29.3.48590 > 10.0.29.2.3784: BFDv1, Control, State Up, Flags: [none], length: 24
 00:00:29.697798 eth1  Out IP 10.0.29.2.44114 > 10.0.29.3.3784: BFDv1, Control, State Up, Flags: [none], length: 24
 00:00:29.741064 eth1  In  IP 10.0.29.3.48590 > 10.0.29.2.3784: BFDv1, Control, State Up, Flags: [none], length: 24
 00:00:29.774433 eth1  Out IP 10.0.29.2.44114 > 10.0.29.3.3784: BFDv1, Control, State Up, Flags: [none], length: 24
 00:00:29.830748 eth1  In  IP 10.0.29.3.48590 > 10.0.29.2.3784: BFDv1, Control, State Up, Flags: [none], length: 24
 00:00:29.852174 eth1  Out IP 10.0.29.2.44114 > 10.0.29.3.3784: BFDv1, Control, State Up, Flags: [none], length: 24
 00:00:29.912478 eth1  In  IP 10.0.29.3.48590 > 10.0.29.2.3784: BFDv1, Control, State Up, Flags: [none], length: 24
 00:00:29.931842 eth1  Out IP 10.0.29.2.44114 > 10.0.29.3.3784: BFDv1, Control, State Up, Flags: [none], length: 24
 00:00:29.993115 eth1  In  IP 10.0.29.3.48590 > 10.0.29.2.3784: BFDv1, Control, State Up, Flags: [none], length: 24
 00:00:30.017552 eth1  Out IP 10.0.29.2.44114 > 10.0.29.3.3784: BFDv1, Control, State Up, Flags: [none], length: 24
 00:00:30.082857 eth1  In  IP 10.0.29.3.48590 > 10.0.29.2.3784: BFDv1, Control, State Up, Flags: [none], length: 24
 00:00:30.093391 eth1  Out IP 10.0.29.2.44114 > 10.0.29.3.3784: BFDv1, Control, State Up, Flags: [none], length: 24
 00:00:30.164478 eth1  In  IP 10.0.29.3.48590 > 10.0.29.2.3784: BFDv1, Control, State Up, Flags: [none], length: 24
 00:00:30.182889 eth1  Out IP 10.0.29.2.44114 > 10.0.29.3.3784: BFDv1, Control, State Up, Flags: [none], length: 24
 00:00:30.245127 eth1  In  IP 10.0.29.3.48590 > 10.0.29.2.3784: BFDv1, Control, State Up, Flags: [none], length: 24
 00:00:30.271529 eth1  Out IP 10.0.29.2.44114 > 10.0.29.3.3784: BFDv1, Control, State Up, Flags: [none], length: 24
 00:00:30.321822 eth1  In  IP 10.0.29.3.48590 > 10.0.29.2.3784: BFDv1, Control, State Up, Flags: [none], length: 24

575 packets captured
576 packets received by filter
0 packets dropped by kernel
