tcpdump: data link type LINUX_SLL2
tcpdump: verbose output suppressed, use -v[v]... for full protocol decode
listening on any, link-type LINUX_SLL2 (Linux cooked v2), snapshot length 262144 bytes
 00:00:00.000000 eth3  In  IP 10.0.35.3.35105 > 10.0.35.2.3784: BFDv1, Control, State Up, Flags: [none], length: 24
 00:00:00.009350 eth1  In  IP 10.0.23.2.57018 > 10.0.23.3.3784: BFDv1, Control, State Up, Flags: [none], length: 24
 00:00:00.014910 eth3  Out IP 10.0.35.2.50865 > 10.0.35.3.3784: BFDv1, Control, State Up, Flags: [none], length: 24
 00:00:00.038224 eth0  Out IP 10.0.13.3.36570 > 10.0.13.2.3784: BFDv1, Control, State Up, Flags: [none], length: 24
 00:00:00.038353 eth0  In  IP 10.0.13.2.37532 > 10.0.13.3.3784: BFDv1, Control, State Up, Flags: [none], length: 24
 00:00:00.048774 eth2  Out IP 10.0.34.2.60320 > 10.0.34.3.3784: BFDv1, Control, State Up, Flags: [none], length: 24
 00:00:00.053016 eth1  Out IP 10.0.23.3.33100 > 10.0.23.2.3784: BFDv1, Control, State Up, Flags: [none], length: 24
 00:00:00.066758 eth2  In  IP 10.0.34.3.36269 > 10.0.34.2.3784: BFDv1, Control, State Up, Flags: [none], length: 24
 00:00:00.089398 eth3  In  IP 10.0.35.3.35105 > 10.0.35.2.3784: BFDv1, Control, State Up, Flags: [none], length: 24
 00:00:00.093785 eth3  Out IP 10.0.35.2.50865 > 10.0.35.3.3784: BFDv1, Control, State Up, Flags: [none], length: 24
 00:00:00.095722 eth1  In  IP 10.0.23.2.57018 > 10.0.23.3.3784: BFDv1, Control, State Up, Flags: [none], length: 24
 00:00:00.113664 eth0  In  IP 10.0.13.2.37532 > 10.0.13.3.3784: BFDv1, Control, State Up, Flags: [none], length: 24
 00:00:00.121981 eth0  Out IP 10.0.13.3.36570 > 10.0.13.2.3784: BFDv1, Control, State Up, Flags: [none], length: 24
 00:00:00.130207 eth1  Out IP 10.0.23.3.33100 > 10.0.23.2.3784: BFDv1, Control, State Up, Flags: [none], length: 24
 00:00:00.135452 eth2  Out IP 10.0.34.2.60320 > 10.0.34.3.3784: BFDv1, Control, State Up, Flags: [none], length: 24
 00:00:00.141969 eth2  In  IP 10.0.34.3.36269 > 10.0.34.2.3784: BFDv1, Control, State Up, Flags: [none], length: 24
 00:00:00.171328 eth3  In  IP 10.0.35.3.35105 > 10.0.35.2.3784: BFDv1, Control, State Up, Flags: [none], length: 24
 00:00:00.175742 eth3  Out IP 10.0.35.2.50865 > 10.0.35.3.3784: BFDv1, Control, State Up, Flags: [none], length: 24
 00:00:00.178240 eth1  In  IP 10.0.23.2.57018 > 10.0.23.3.3784: BFDv1, Control, State Up, Flags: [none], length: 24
 00:00:00.196150 eth0  In  IP 10.0.13.2.37532 > 10.0.13.3.3784: BFDv1, Control, State Up, Flags: [none], length: 24
 00:00:00.200557 eth0  Out IP 10.0.13.3.36570 > 10.0.13.2.3784: BFDv1, Control, State Up, Flags: [none], length: 24
 00:00:00.206748 eth1  Out IP 10.0.23.3.33100 > 10.0.23.2.3784: BFDv1, Control, State Up, Flags: [none], length: 24
 00:00:00.215008 eth2  Out IP 10.0.34.2.60320 > 10.0.34.3.3784: BFDv1, Control, State Up, Flags: [none], length: 24
 00:00:00.220359 eth2  In  IP 10.0.34.3.36269 > 10.0.34.2.3784: BFDv1, Control, State Up, Flags: [none], length: 24
 00:00:00.257749 eth3  Out IP 10.0.35.2.50865 > 10.0.35.3.3784: BFDv1, Control, State Up, Flags: [none], length: 24
 00:00:00.261067 eth3  In  IP 10.0.35.3.35105 > 10.0.35.2.3784: BFDv1, Control, State Up, Flags: [none], length: 24
 00:00:00.265875 eth1  In  IP 10.0.23.2.57018 > 10.0.23.3.3784: BFDv1, Control, State Up, Flags: [none], length: 24
 00:00:00.275925 eth0  In  IP 10.0.13.2.37532 > 10.0.13.3.3784: BFDv1, Control, State Up, Flags: [none], length: 24
 00:00:00.281315 eth0  Out IP 10.0.13.3.36570 > 10.0.13.2.3784: BFDv1, Control, State Up, Flags: [none], length: 24
 00:00:00.284547 eth1  Out IP 10.0.23.3.33100 > 10.0.23.2.3784: BFDv1, Control, State Up, Flags: [none], length: 24
 00:00:00.290786 eth2  Out IP 10.0.34.2.60320 > 10.0.34.3.3784: BFDv1, Control, State Up, Flags: [none], length: 24
 00:00:00.309547 eth2  In  IP 10.0.34.3.36269 > 10.0.34.2.3784: BFDv1, Control, State Up, Flags: [none], length: 24
 00:00:00.348011 eth3  Out IP 10.0.35.2.50865 > 10.0.35.3.3784: BFDv1, Control, State Up, Flags: [none], length: 24
 00:00:00.349211 eth3  In  IP 10.0.35.3.35105 > 10.0.35.2.3784: BFDv1, Control, State Up, Flags: [none], length: 24
 00:00:00.350684 eth0  In  IP 10.0.13.2.37532 > 10.0.13.3.3784: BFDv1, Control, State Up, Flags: [none], length: 24
 00:00:00.350697 eth1  In  IP 10.0.23.2.57018 > 10.0.23.3.3784: BFDv1, Control, State Up, Flags: [none], length: 24
 00:00:00.360996 eth0  Out IP 10.0.13.3.36570 > 10.0.13.2.3784: BFDv1, Control, State Up, Flags: [none], length: 24
 00:00:00.367237 eth1  Out IP 10.0.23.3.33100 > 10.0.23.2.3784: BFDv1, Control, State Up, Flags: [none], length: 24
 00:00:00.380456 eth2  Out IP 10.0.34.2.60320 > 10.0.34.3.3784: BFDv1, Control, State Up, Flags: [none], length: 24
 00:00:00.388999 eth2  In  IP 10.0.34.3.36269 > 10.0.34.2.3784: BFDv1, Control, State Up, Flags: [none], length: 24
 00:00:00.423352 eth3  Out IP 10.0.35.2.50865 > 10.0.35.3.3784: BFDv1, Control, State Up, Flags: [none], length: 24
 00:00:00.431173 eth3  In  IP 10.0.35.3.35105 > 10.0.35.2.3784: BFDv1, Control, State Up, Flags: [none], length: 24
 00:00:00.434303 eth0  In  IP 10.0.13.2.37532 > 10.0.13.3.3784: BFDv1, Control, State Up, Flags: [none], length: 24
 00:00:00.440156 eth1  In  IP 10.0.23.2.57018 > 10.0.23.3.3784: BFDv1, Control, State Up, Flags: [none], length: 24
 00:00:00.443510 eth0  Out IP 10.0.13.3.36570 > 10.0.13.2.3784: BFDv1, Control, State Up, Flags: [none], length: 24
 00:00:00.444714 eth1  Out IP 10.0.23.3.33100 > 10.0.23.2.3784: BFDv1, Control, State Up, Flags: [none], length: 24
 00:00:00.468920 eth2  Out IP 10.0.34.2.60320 > 10.0.34.3.3784: BFDv1, Control, State Up, Flags: [none], length: 24
 00:00:00.477196 eth2  In  IP 10.0.34.3.36269 > 10.0.34.2.3784: BFDv1, Control, State Up, Flags: [none], length: 24
 00:00:00.504808 eth3  Out IP 10.0.35.2.50865 > 10.0.35.3.3784: BFDv1, Control, State Up, Flags: [none], length: 24
 00:00:00.508084 eth3  In  IP 10.0.35.3.35105 > 10.0.35.2.3784: BFDv1, Control, State Up, Flags: [none], length: 24
 00:00:00.517588 eth1  In  IP 10.0.23.2.57018 > 10.0.23.3.3784: BFDv1, Control, State Up, Flags: [none], length: 24
 00:00:00.522785 eth0  In  IP 10.0.13.2.37532 > 10.0.13.3.3784: BFDv1, Control, State Up, Flags: [none], length: 24
 00:00:00.524113 eth0  Out IP 10.0.13.3.36570 > 10.0.13.2.3784: BFDv1, Control, State Up, Flags: [none], length: 24
 00:00:00.530348 eth1  Out IP 10.0.23.3.33100 > 10.0.23.2.3784: BFDv1, Control, State Up, Flags: [none], length: 24
 00:00:00.547640 eth2  Out IP 10.0.34.2.60320 > 10.0.34.3.3784: BFDv1, Control, State Up, Flags: [none], length: 24
 00:00:00.558458 eth2  In  IP 10.0.34.3.36269 > 10.0.34.2.3784: BFDv1, Control, State Up, Flags: [none], length: 24
 00:00:00.591070 eth3  In  IP 10.0.35.3.35105 > 10.0.35.2.3784: BFDv1, Control, State Up, Flags: [none], length: 24
 00:00:00.594404 eth3  Out IP 10.0.35.2.50865 > 10.0.35.3.3784: BFDv1, Control, State Up, Flags: [none], length: 24
 00:00:00.598553 eth1  In  IP 10.0.23.2.57018 > 10.0.23.3.3784: BFDv1, Control, State Up, Flags: [none], length: 24
 00:00:00.598701 eth0  Out IP 10.0.13.3.36570 > 10.0.13.2.3784: BFDv1, Control, State Up, Flags: [none], length: 24
 00:00:00.607974 eth0  In  IP 10.0.13.2.37532 > 10.0.13.3.3784: BFDv1, Control, State Up, Flags: [none], length: 24
 00:00:00.620325 eth1  Out IP 10.0.23.3.33100 > 10.0.23.2.3784: BFDv1, Control, State Up, Flags: [none], length: 24
 00:00:00.627582 eth2  Out IP 10.0.34.2.60320 > 10.0.34.3.3784: BFDv1, Control, State Up, Flags: [none], length: 24
 00:00:00.636012 eth2  In  IP 10.0.34.3.36269 > 10.0.34.2.3784: BFDv1, Control, State Up, Flags: [none], length: 24
 00:00:00.672881 eth3  In  IP 10.0.35.3.35105 > 10.0.35.2.3784: BFDv1, Control, State Up, Flags: [none], length: 24
 00:00:00.673597 eth1  In  IP 10.0.23.2.57018 > 10.0.23.3.3784: BFDv1, Control, State Up, Flags: [none], length: 24
 00:00:00.673818 eth3  Out IP 10.0.35.2.50865 > 10.0.35.3.3784: BFDv1, Control, State Up, Flags: [none], length: 24
 00:00:00.686989 eth0  Out IP 10.0.13.3.36570 > 10.0.13.2.3784: BFDv1, Control, State Up, Flags: [none], length: 24
 00:00:00.690230 eth0  In  IP 10.0.13.2.37532 > 10.0.13.3.3784: BFDv1, Control, State Up, Flags: [none], length: 24
 00:00:00.708673 eth1  Out IP 10.0.23.3.33100 > 10.0.23.2.3784: BFDv1, Control, State Up, Flags: [none], length: 24
 00:00:00.710937 eth2  Out IP 10.0.34.2.60320 > 10.0.34.3.3784: BFDv1, Control, State Up, Flags: [none], length: 24
 00:00:00.719455 eth2  In  IP 10.0.34.3.36269 > 10.0.34.2.3784: BFDv1, Control, State Up, Flags: [none], length: 24
 00:00:00.755316 eth3  In  IP 10.0.35.3.35105 > 10.0.35.2.3784: BFDv1, Control, State Up, Flags: [none], length: 24
 00:00:00.755511 eth3  Out IP 10.0.35.2.50865 > 10.0.35.3.3784: BFDv1, Control, State Up, Flags: [none], length: 24
 00:00:00.756607 eth1  In  IP 10.0.23.2.57018 > 10.0.23.3.3784: BFDv1, Control, State Up, Flags: [none], length: 24
 00:00:00.768656 eth0  In  IP 10.0.13.2.37532 > 10.0.13.3.3784: BFDv1, Control, State Up, Flags: [none], length: 24
 00:00:00.773047 eth0  Out IP 10.0.13.3.36570 > 10.0.13.2.3784: BFDv1, Control, State Up, Flags: [none], length: 24
 00:00:00.794407 eth1  Out IP 10.0.23.3.33100 > 10.0.23.2.3784: BFDv1, Control, State Up, Flags: [none], length: 24
 00:00:00.797261 eth2  In  IP 10.0.34.3.36269 > 10.0.34.2.3784: BFDv1, Control, State Up, Flags: [none], length: 24
 00:00:00.800047 eth2  Out IP 10.0.34.2.60320 > 10.0.34.3.3784: BFDv1, Control, State Up, Flags: [none], length: 24
 00:00:00.831369 eth3  Out IP 10.0.35.2.50865 > 10.0.35.3.3784: BFDv1, Control, State Up, Flags: [none], length: 24
 00:00:00.833627 eth3  In  IP 10.0.35.3.35105 > 10.0.35.2.3784: BFDv1, Control, State Up, Flags: [none], length: 24
 00:00:00.836921 eth1  In  IP 10.0.23.2.57018 > 10.0.23.3.3784: BFDv1, Control, State Up, Flags: [none], length: 24
 00:00:00.857301 eth0  In  IP 10.0.13.2.37532 > 10.0.13.3.3784: BFDv1, Control, State Up, Flags: [none], length: 24
 00:00:00.860684 eth0  Out IP 10.0.13.3.36570 > 10.0.13.2.3784: BFDv1, Control, State Up, Flags: [none], length: 24
 00:00:00.870957 eth1  Out IP 10.0.23.3.33100 > 10.0.23.2.3784: BFDv1, Control, State Up, Flags: [none], length: 24
 00:00:00.880237 eth2  Out IP 10.0.34.2.60320 > 10.0.34.3.3784: BFDv1, Control, State Up, Flags: [none], length: 24
 00:00:00.885448 eth2  In  IP 10.0.34.3.36269 > 10.0.34.2.3784: BFDv1, Control, State Up, Flags: [none], length: 24
 00:00:00.908803 eth3  Out IP 10.0.35.2.50865 > 10.0.35.3.3784: BFDv1, Control, State Up, Flags: [none], length: 24
 00:00:00.908963 eth3  In  IP 10.0.35.3.35105 > 10.0.35.2.3784: BFDv1, Control, State Up, Flags: [none], length: 24
 00:00:00.914577 eth1  In  IP 10.0.23.2.57018 > 10.0.23.3.3784: BFDv1, Control, State Up, Flags: [none], length: 24
 00:00:00.938978 eth0  Out IP 10.0.13.3.36570 > 10.0.13.2.3784: BFDv1, Control, State Up, Flags: [none], length: 24
 00:00:00.947450 eth0  In  IP 10.0.13.2.37532 > 10.0.13.3.3784: BFDv1, Control, State Up, Flags: [none], length: 24
 00:00:00.953822 eth1  Out IP 10.0.23.3.33100 > 10.0.23.2.3784: BFDv1, Control, State Up, Flags: [none], length: 24
 00:00:00.957055 eth2  Out IP 10.0.34.2.60320 > 10.0.34.3.3784: BFDv1, Control, State Up, Flags: [none], length: 24
 00:00:00.963269 eth2  In  IP 10.0.34.3.36269 > 10.0.34.2.3784: BFDv1, Control, State Up, Flags: [none], length: 24
 00:00:00.984724 eth3  In  IP 10.0.35.3.35105 > 10.0.35.2.3784: BFDv1, Control, State Up, Flags: [none], length: 24
 00:00:00.991646 eth3  Out IP 10.0.35.2.50865 > 10.0.35.3.3784: BFDv1, Control, State Up, Flags: [none], length: 24
 00:00:01.003475 eth1  In  IP 10.0.23.2.57018 > 10.0.23.3.3784: BFDv1, Control, State Up, Flags: [none], length: 24
 00:00:01.014879 eth0  Out IP 10.0.13.3.36570 > 10.0.13.2.3784: BFDv1, Control, State Up, Flags: [none], length: 24
 00:00:01.029155 eth1  Out IP 10.0.23.3.33100 > 10.0.23.2.3784: BFDv1, Control, State Up, Flags: [none], length: 24
 00:00:01.033380 eth0  In  IP 10.0.13.2.37532 > 10.0.13.3.3784: BFDv1, Control, State Up, Flags: [none], length: 24
 00:00:01.041770 eth2  Out IP 10.0.34.2.60320 > 10.0.34.3.3784: BFDv1, Control, State Up, Flags: [none], length: 24
 00:00:01.045972 eth2  In  IP 10.0.34.3.36269 > 10.0.34.2.3784: BFDv1, Control, State Up, Flags: [none], length: 24
 00:00:01.068153 eth3  In  IP 10.0.35.3.35105 > 10.0.35.2.3784: BFDv1, Control, State Up, Flags: [none], length: 24
 00:00:01.075438 eth3  Out IP 10.0.35.2.50865 > 10.0.35.3.3784: BFDv1, Control, State Up, Flags: [none], length: 24
 00:00:01.083704 eth1  In  IP 10.0.23.2.57018 > 10.0.23.3.3784: BFDv1, Control, State Up, Flags: [none], length: 24
 00:00:01.093001 eth0  Out IP 10.0.13.3.36570 > 10.0.13.2.3784: BFDv1, Control, State Up, Flags: [none], length: 24
 00:00:01.108982 eth0  In  IP 10.0.13.2.37532 > 10.0.13.3.3784: BFDv1, Control, State Up, Flags: [none], length: 24
 00:00:01.111399 eth1  Out IP 10.0.23.3.33100 > 10.0.23.2.3784: BFDv1, Control, State Up, Flags: [none], length: 24
 00:00:01.130595 eth2  Out IP 10.0.34.2.60320 > 10.0.34.3.3784: BFDv1, Control, State Up, Flags: [none], length: 24
 00:00:01.133836 eth2  In  IP 10.0.34.3.36269 > 10.0.34.2.3784: BFDv1, Control, State Up, Flags: [none], length: 24
 00:00:01.147653 eth3  In  IP 10.0.35.3.35105 > 10.0.35.2.3784: BFDv1, Control, State Up, Flags: [none], length: 24
 00:00:01.158035 eth3  Out IP 10.0.35.2.50865 > 10.0.35.3.3784: BFDv1, Control, State Up, Flags: [none], length: 24
 00:00:01.166265 eth1  In  IP 10.0.23.2.57018 > 10.0.23.3.3784: BFDv1, Control, State Up, Flags: [none], length: 24
 00:00:01.169569 eth0  Out IP 10.0.13.3.36570 > 10.0.13.2.3784: BFDv1, Control, State Up, Flags: [none], length: 24
 00:00:01.185028 eth0  In  IP 10.0.13.2.37532 > 10.0.13.3.3784: BFDv1, Control, State Up, Flags: [none], length: 24
 00:00:01.190315 eth1  Out IP 10.0.23.3.33100 > 10.0.23.2.3784: BFDv1, Control, State Up, Flags: [none], length: 24
 00:00:01.213531 eth2  Out IP 10.0.34.2.60320 > 10.0.34.3.3784: BFDv1, Control, State Up, Flags: [none], length: 24
 00:00:01.221819 eth2  In  IP 10.0.34.3.36269 > 10.0.34.2.3784: BFDv1, Control, State Up, Flags: [none], length: 24
 00:00:01.227329 eth3  In  IP 10.0.35.3.35105 > 10.0.35.2.3784: BFDv1, Control, State Up, Flags: [none], length: 24
 00:00:01.235650 eth3  Out IP 10.0.35.2.50865 > 10.0.35.3.3784: BFDv1, Control, State Up, Flags: [none], length: 24
 00:00:01.243035 eth1  In  IP 10.0.23.2.57018 > 10.0.23.3.3784: BFDv1, Control, State Up, Flags: [none], length: 24
 00:00:01.247377 eth0  Out IP 10.0.13.3.36570 > 10.0.13.2.3784: BFDv1, Control, State Up, Flags: [none], length: 24
 00:00:01.274989 eth0  In  IP 10.0.13.2.37532 > 10.0.13.3.3784: BFDv1, Control, State Up, Flags: [none], length: 24
 00:00:01.276432 eth1  Out IP 10.0.23.3.33100 > 10.0.23.2.3784: BFDv1, Control, State Up, Flags: [none], length: 24
 00:00:01.294734 eth2  Out IP 10.0.34.2.60320 > 10.0.34.3.3784: BFDv1, Control, State Up, Flags: [none], length: 24
 00:00:01.307181 eth2  In  IP 10.0.34.3.36269 > 10.0.34.2.3784: BFDv1, Control, State Up, Flags: [none], length: 24
 00:00:01.311579 eth3  Out IP 10.0.35.2.50865 > 10.0.35.3.3784: BFDv1, Control, State Up, Flags: [none], length: 24
 00:00:01.316427 eth3  In  IP 10.0.35.3.35105 > 10.0.35.2.3784: BFDv1, Control, State Up, Flags: [none], length: 24
 00:00:01.328967 eth1  In  IP 10.0.23.2.57018 > 10.0.23.3.3784: BFDv1, Control, State Up, Flags: [none], length: 24
 00:00:01.331365 eth0  Out IP 10.0.13.3.36570 > 10.0.13.2.3784: BFDv1, Control, State Up, Flags: [none], length: 24
 00:00:01.364095 eth0  In  IP 10.0.13.2.37532 > 10.0.13.3.3784: BFDv1, Control, State Up, Flags: [none], length: 24
 00:00:01.366431 eth1  Out IP 10.0.23.3.33100 > 10.0.23.2.3784: BFDv1, Control, State Up, Flags: [none], length: 24
 00:00:01.376683 eth2  Out IP 10.0.34.2.60320 > 10.0.34.3.3784: BFDv1, Control, State Up, Flags: [none], length: 24
 00:00:01.390929 eth2  In  IP 10.0.34.3.36269 > 10.0.34.2.3784: BFDv1, Control, State Up, Flags: [none], length: 24
 00:00:01.390951 eth3  Out IP 10.0.35.2.50865 > 10.0.35.3.3784: BFDv1, Control, State Up, Flags: [none], length: 24
 00:00:01.401384 eth3  In  IP 10.0.35.3.35105 > 10.0.35.2.3784: BFDv1, Control, State Up, Flags: [none], length: 24
 00:00:01.416807 eth0  Out IP 10.0.13.3.36570 > 10.0.13.2.3784: BFDv1, Control, State Up, Flags: [none], length: 24
 00:00:01.416824 eth1  In  IP 10.0.23.2.57018 > 10.0.23.3.3784: BFDv1, Control, State Up, Flags: [none], length: 24
 00:00:01.443905 eth0  In  IP 10.0.13.2.37532 > 10.0.13.3.3784: BFDv1, Control, State Up, Flags: [none], length: 24
 00:00:01.447322 eth1  Out IP 10.0.23.3.33100 > 10.0.23.2.3784: BFDv1, Control, State Up, Flags: [none], length: 24
 00:00:01.456568 eth2  Out IP 10.0.34.2.60320 > 10.0.34.3.3784: BFDv1, Control, State Up, Flags: [none], length: 24
 00:00:01.473806 eth3  Out IP 10.0.35.2.50865 > 10.0.35.3.3784: BFDv1, Control, State Up, Flags: [none], length: 24
 00:00:01.480133 eth2  In  IP 10.0.34.3.36269 > 10.0.34.2.3784: BFDv1, Control, State Up, Flags: [none], length: 24
 00:00:01.487264 eth3  In  IP 10.0.35.3.35105 > 10.0.35.2.3784: BFDv1, Control, State Up, Flags: [none], length: 24
 00:00:01.491693 eth1  In  IP 10.0.23.2.57018 > 10.0.23.3.3784: BFDv1, Control, State Up, Flags: [none], length: 24
 00:00:01.499924 eth0  Out IP 10.0.13.3.36570 > 10.0.13.2.3784: BFDv1, Control, State Up, Flags: [none], length: 24
 00:00:01.520465 eth0  In  IP 10.0.13.2.37532 > 10.0.13.3.3784: BFDv1, Control, State Up, Flags: [none], length: 24
 00:00:01.533807 eth1  Out IP 10.0.23.3.33100 > 10.0.23.2.3784: BFDv1, Control, State Up, Flags: [none], length: 24
 00:00:01.541011 eth2  Out IP 10.0.34.2.60320 > 10.0.34.3.3784: BFDv1, Control, State Up, Flags: [none], length: 24
 00:00:01.558446 eth2  In  IP 10.0.34.3.36269 > 10.0.34.2.3784: BFDv1, Control, State Up, Flags: [none], length: 24
 00:00:01.560777 eth3  Out IP 10.0.35.2.50865 > 10.0.35.3.3784: BFDv1, Control, State Up, Flags: [none], length: 24
 00:00:01.570051 eth3  In  IP 10.0.35.3.35105 > 10.0.35.2.3784: BFDv1, Control, State Up, Flags: [none], length: 24
 00:00:01.578434 eth0  Out IP 10.0.13.3.36570 > 10.0.13.2.3784: BFDv1, Control, State Up, Flags: [none], length: 24
 00:00:01.581752 eth1  In  IP 10.0.23.2.57018 > 10.0.23.3.3784: BFDv1, Control, State Up, Flags: [none], length: 24
 00:00:01.597867 eth0  In  IP 10.0.13.2.37532 > 10.0.13.3.3784: BFDv1, Control, State Up, Flags: [none], length: 24
 00:00:01.619168 eth1  Out IP 10.0.23.3.33100 > 10.0.23.2.3784: BFDv1, Control, State Up, Flags: [none], length: 24
 00:00:01.620414 eth2  Out IP 10.0.34.2.60320 > 10.0.34.3.3784: BFDv1, Control, State Up, Flags: [none], length: 24
 00:00:01.639698 eth3  Out IP 10.0.35.2.50865 > 10.0.35.3.3784: BFDv1, Control, State Up, Flags: [none], length: 24
 00:00:01.645866 eth2  In  IP 10.0.34.3.36269 > 10.0.34.2.3784: BFDv1, Control, State Up, Flags: [none], length: 24
 00:00:01.646048 eth3  In  IP 10.0.35.3.35105 > 10.0.35.2.3784: BFDv1, Control, State Up, Flags: [none], length: 24
 00:00:01.662622 eth1  In  IP 10.0.23.2.57018 > 10.0.23.3.3784: BFDv1, Control, State Up, Flags: [none], length: 24
 00:00:01.665000 eth0  Out IP 10.0.13.3.36570 > 10.0.13.2.3784: BFDv1, Control, State Up, Flags: [none], length: 24
 00:00:01.675153 eth0  In  IP 10.0.13.2.37532 > 10.0.13.3.3784: BFDv1, Control, State Up, Flags: [none], length: 24
 00:00:01.707539 eth2  Out IP 10.0.34.2.60320 > 10.0.34.3.3784: BFDv1, Control, State Up, Flags: [none], length: 24
 00:00:01.707679 eth1  Out IP 10.0.23.3.33100 > 10.0.23.2.3784: BFDv1, Control, State Up, Flags: [none], length: 24
 00:00:01.722891 eth2  In  IP 10.0.34.3.36269 > 10.0.34.2.3784: BFDv1, Control, State Up, Flags: [none], length: 24
 00:00:01.725257 eth3  In  IP 10.0.35.3.35105 > 10.0.35.2.3784: BFDv1, Control, State Up, Flags: [none], length: 24
 00:00:01.728579 eth3  Out IP 10.0.35.2.50865 > 10.0.35.3.3784: BFDv1, Control, State Up, Flags: [none], length: 24
 00:00:01.737110 eth1  In  IP 10.0.23.2.57018 > 10.0.23.3.3784: BFDv1, Control, State Up, Flags: [none], length: 24
 00:00:01.746433 eth0  Out IP 10.0.13.3.36570 > 10.0.13.2.3784: BFDv1, Control, State Up, Flags: [none], length: 24
 00:00:01.761930 eth0  In  IP 10.0.13.2.37532 > 10.0.13.3.3784: BFDv1, Control, State Up, Flags: [none], length: 24
 00:00:01.790305 eth1  Out IP 10.0.23.3.33100 > 10.0.23.2.3784: BFDv1, Control, State Up, Flags: [none], length: 24
 00:00:01.793674 eth2  Out IP 10.0.34.2.60320 > 10.0.34.3.3784: BFDv1, Control, State Up, Flags: [none], length: 24
 00:00:01.802053 eth3  In  IP 10.0.35.3.35105 > 10.0.35.2.3784: BFDv1, Control, State Up, Flags: [none], length: 24
 00:00:01.804904 eth2  In  IP 10.0.34.3.36269 > 10.0.34.2.3784: BFDv1, Control, State Up, Flags: [none], length: 24
 00:00:01.811267 eth3  Out IP 10.0.35.2.50865 > 10.0.35.3.3784: BFDv1, Control, State Up, Flags: [none], length: 24
 00:00:01.815715 eth1  In  IP 10.0.23.2.57018 > 10.0.23.3.3784: BFDv1, Control, State Up, Flags: [none], length: 24
 00:00:01.835081 eth0  Out IP 10.0.13.3.36570 > 10.0.13.2.3784: BFDv1, Control, State Up, Flags: [none], length: 24
 00:00:01.838684 eth0  In  IP 10.0.13.2.37532 > 10.0.13.3.3784: BFDv1, Control, State Up, Flags: [none], length: 24
 00:00:01.878052 eth2  Out IP 10.0.34.2.60320 > 10.0.34.3.3784: BFDv1, Control, State Up, Flags: [none], length: 24
 00:00:01.879247 eth1  Out IP 10.0.23.3.33100 > 10.0.23.2.3784: BFDv1, Control, State Up, Flags: [none], length: 24
 00:00:01.885274 eth2  In  IP 10.0.34.3.36269 > 10.0.34.2.3784: BFDv1, Control, State Up, Flags: [none], length: 24
 00:00:01.887585 eth3  Out IP 10.0.35.2.50865 > 10.0.35.3.3784: BFDv1, Control, State Up, Flags: [none], length: 24
 00:00:01.888787 eth3  In  IP 10.0.35.3.35105 > 10.0.35.2.3784: BFDv1, Control, State Up, Flags: [none], length: 24
 00:00:01.898695 eth1  In  IP 10.0.23.2.57018 > 10.0.23.3.3784: BFDv1, Control, State Up, Flags: [none], length: 24
 00:00:01.920074 eth0  Out IP 10.0.13.3.36570 > 10.0.13.2.3784: BFDv1, Control, State Up, Flags: [none], length: 24
 00:00:01.926348 eth0  In  IP 10.0.13.2.37532 > 10.0.13.3.3784: BFDv1, Control, State Up, Flags: [none], length: 24
 00:00:01.952761 eth2  Out IP 10.0.34.2.60320 > 10.0.34.3.3784: BFDv1, Control, State Up, Flags: [none], length: 24
 00:00:01.956164 eth1  Out IP 10.0.23.3.33100 > 10.0.23.2.3784: BFDv1, Control, State Up, Flags: [none], length: 24
 00:00:01.965031 eth2  In  IP 10.0.34.3.36269 > 10.0.34.2.3784: BFDv1, Control, State Up, Flags: [none], length: 24
 00:00:01.966333 eth3  Out IP 10.0.35.2.50865 > 10.0.35.3.3784: BFDv1, Control, State Up, Flags: [none], length: 24
 00:00:01.973696 eth1  In  IP 10.0.23.2.57018 > 10.0.23.3.3784: BFDv1, Control, State Up, Flags: [none], length: 24
 00:00:01.979771 eth3  In  IP 10.0.35.3.35105 > 10.0.35.2.3784: BFDv1, Control, State Up, Flags: [none], length: 24
 00:00:02.010154 eth0  Out IP 10.0.13.3.36570 > 10.0.13.2.3784: BFDv1, Control, State Up, Flags: [none], length: 24
 00:00:02.012415 eth0  In  IP 10.0.13.2.37532 > 10.0.13.3.3784: BFDv1, Control, State Up, Flags: [none], length: 24
 00:00:02.036745 eth2  Out IP 10.0.34.2.60320 > 10.0.34.3.3784: BFDv1, Control, State Up, Flags: [none], length: 24
 00:00:02.039994 eth1  Out IP 10.0.23.3.33100 > 10.0.23.2.3784: BFDv1, Control, State Up, Flags: [none], length: 24
 00:00:02.043960 eth2  In  IP 10.0.34.3.36269 > 10.0.34.2.3784: BFDv1, Control, State Up, Flags: [none], length: 24
 00:00:02.050252 eth1  In  IP 10.0.23.2.57018 > 10.0.23.3.3784: BFDv1, Control, State Up, Flags: [none], length: 24
 00:00:02.051743 eth3  Out IP 10.0.35.2.50865 > 10.0.35.3.3784: BFDv1, Control, State Up, Flags: [none], length: 24
 00:00:02.060957 eth3  In  IP 10.0.35.3.35105 > 10.0.35.2.3784: BFDv1, Control, State Up, Flags: [none], length: 24
 00:00:02.084285 eth0  Out IP 10.0.13.3.36570 > 10.0.13.2.3784: BFDv1, Control, State Up, Flags: [none], length: 24
 00:00:02.100527 eth0  In  IP 10.0.13.2.37532 > 10.0.13.3.3784: BFDv1, Control, State Up, Flags: [none], length: 24
 00:00:02.116106 eth1  Out IP 10.0.23.3.33100 > 10.0.23.2.3784: BFDv1, Control, State Up, Flags: [none], length: 24
 00:00:02.125717 eth2  In  IP 10.0.34.3.36269 > 10.0.34.2.3784: BFDv1, Control, State Up, Flags: [none], length: 24
 00:00:02.127347 eth1  In  IP 10.0.23.2.57018 > 10.0.23.3.3784: BFDv1, Control, State Up, Flags: [none], length: 24
 00:00:02.133668 eth3  Out IP 10.0.35.2.50865 > 10.0.35.3.3784: BFDv1, Control, State Up, Flags: [none], length: 24
 00:00:02.147020 eth3  In  IP 10.0.35.3.35105 > 10.0.35.2.3784: BFDv1, Control, State Up, Flags: [none], length: 24
 00:00:02.168329 eth0  Out IP 10.0.13.3.36570 > 10.0.13.2.3784: BFDv1, Control, State Up, Flags: [none], length: 24
 00:00:02.180739 eth0  In  IP 10.0.13.2.37532 > 10.0.13.3.3784: BFDv1, Control, State Up, Flags: [none], length: 24
 00:00:02.201147 eth1  Out IP 10.0.23.3.33100 > 10.0.23.2.3784: BFDv1, Control, State Up, Flags: [none], length: 24
 00:00:02.209407 eth1  In  IP 10.0.23.2.57018 > 10.0.23.3.3784: BFDv1, Control, State Up, Flags: [none], length: 24
 00:00:02.220807 eth3  Out IP 10.0.35.2.50865 > 10.0.35.3.3784: BFDv1, Control, State Up, Flags: [none], length: 24
 00:00:02.237025 eth3  In  IP 10.0.35.3.35105 > 10.0.35.2.3784: BFDv1, Control, State Up, Flags: [none], length: 24
 00:00:02.249384 eth0  Out IP 10.0.13.3.36570 > 10.0.13.2.3784: BFDv1, Control, State Up, Flags: [none], length: 24
 00:00:02.270288 eth0  In  IP 10.0.13.2.37532 > 10.0.13.3.3784: BFDv1, Control, State Up, Flags: [none], length: 24
 00:00:02.285672 eth1  Out IP 10.0.23.3.33100 > 10.0.23.2.3784: BFDv1, Control, State Up, Flags: [none], length: 24
 00:00:02.287911 eth1  In  IP 10.0.23.2.57018 > 10.0.23.3.3784: BFDv1, Control, State Up, Flags: [none], length: 24
 00:00:02.298451 eth3  Out IP 10.0.35.2.50865 > 10.0.35.3.3784: BFDv1, Control, State Up, Flags: [none], length: 24
 00:00:02.322749 eth3  In  IP 10.0.35.3.35105 > 10.0.35.2.3784: BFDv1, Control, State Up, Flags: [none], length: 24
 00:00:02.332103 eth0  Out IP 10.0.13.3.36570 > 10.0.13.2.3784: BFDv1, Control, State Up, Flags: [none], length: 24
 00:00:02.353346 eth0  In  IP 10.0.13.2.37532 > 10.0.13.3.3784: BFDv1, Control, State Up, Flags: [none], length: 24
 00:00:02.369890 eth1  In  IP 10.0.23.2.57018 > 10.0.23.3.3784: BFDv1, Control, State Up, Flags: [none], length: 24
 00:00:02.371307 eth1  Out IP 10.0.23.3.33100 > 10.0.23.2.3784: BFDv1, Control, State Up, Flags: [none], length: 24
 00:00:02.386591 eth3  Out IP 10.0.35.2.50865 > 10.0.35.3.3784: BFDv1, Control, State Up, Flags: [none], length: 24
 00:00:02.403928 eth3  In  IP 10.0.35.3.35105 > 10.0.35.2.3784: BFDv1, Control, State Up, Flags: [none], length: 24
 00:00:02.414295 eth0  Out IP 10.0.13.3.36570 > 10.0.13.2.3784: BFDv1, Control, State Up, Flags: [none], length: 24
 00:00:02.438446 eth0  In  IP 10.0.13.2.37532 > 10.0.13.3.3784: BFDv1, Control, State Up, Flags: [none], length: 24
 00:00:02.451177 eth1  In  IP 10.0.23.2.57018 > 10.0.23.3.3784: BFDv1, Control, State Up, Flags: [none], length: 24
 00:00:02.452479 eth1  Out IP 10.0.23.3.33100 > 10.0.23.2.3784: BFDv1, Control, State Up, Flags: [none], length: 24
 00:00:02.466853 eth3  Out IP 10.0.35.2.50865 > 10.0.35.3.3784: BFDv1, Control, State Up, Flags: [none], length: 24
 00:00:02.491147 eth3  In  IP 10.0.35.3.35105 > 10.0.35.2.3784: BFDv1, Control, State Up, Flags: [none], length: 24
 00:00:02.496563 eth0  Out IP 10.0.13.3.36570 > 10.0.13.2.3784: BFDv1, Control, State Up, Flags: [none], length: 24
 00:00:02.523523 eth0  In  IP 10.0.13.2.37532 > 10.0.13.3.3784: BFDv1, Control, State Up, Flags: [none], length: 24
 00:00:02.540610 eth1  In  IP 10.0.23.2.57018 > 10.0.23.3.3784: BFDv1, Control, State Up, Flags: [none], length: 24
 00:00:02.542024 eth1  Out IP 10.0.23.3.33100 > 10.0.23.2.3784: BFDv1, Control, State Up, Flags: [none], length: 24
 00:00:02.543246 eth3  Out IP 10.0.35.2.50865 > 10.0.35.3.3784: BFDv1, Control, State Up, Flags: [none], length: 24
 00:00:02.573458 eth3  In  IP 10.0.35.3.35105 > 10.0.35.2.3784: BFDv1, Control, State Up, Flags: [none], length: 24
 00:00:02.585743 eth0  Out IP 10.0.13.3.36570 > 10.0.13.2.3784: BFDv1, Control, State Up, Flags: [none], length: 24
 00:00:02.610418 eth0  In  IP 10.0.13.2.37532 > 10.0.13.3.3784: BFDv1, Control, State Up, Flags: [none], length: 24
 00:00:02.622051 eth1  Out IP 10.0.23.3.33100 > 10.0.23.2.3784: BFDv1, Control, State Up, Flags: [none], length: 24
 00:00:02.627354 eth1  In  IP 10.0.23.2.57018 > 10.0.23.3.3784: BFDv1, Control, State Up, Flags: [none], length: 24
 00:00:02.632693 eth3  Out IP 10.0.35.2.50865 > 10.0.35.3.3784: BFDv1, Control, State Up, Flags: [none], length: 24
 00:00:02.660961 eth3  In  IP 10.0.35.3.35105 > 10.0.35.2.3784: BFDv1, Control, State Up, Flags: [none], length: 24
 00:00:02.663299 eth0  Out IP 10.0.13.3.36570 > 10.0.13.2.3784: BFDv1, Control, State Up, Flags: [none], length: 24
 00:00:02.699016 eth0  In  IP 10.0.13.2.37532 > 10.0.13.3.3784: BFDv1, Control, State Up, Flags: [none], length: 24
 00:00:02.705283 eth1  Out IP 10.0.23.3.33100 > 10.0.23.2.3784: BFDv1, Control, State Up, Flags: [none], length: 24
 00:00:02.705471 eth1  In  IP 10.0.23.2.57018 > 10.0.23.3.3784: BFDv1, Control, State Up, Flags: [none], length: 24
 00:00:02.718752 eth3  Out IP 10.0.35.2.50865 > 10.0.35.3.3784: BFDv1, Control, State Up, Flags: [none], length: 24
 00:00:02.739994 eth3  In  IP 10.0.35.3.35105 > 10.0.35.2.3784: BFDv1, Control, State Up, Flags: [none], length: 24
 00:00:02.748370 eth0  Out IP 10.0.13.3.36570 > 10.0.13.2.3784: BFDv1, Control, State Up, Flags: [none], length: 24
 00:00:02.788066 eth0  In  IP 10.0.13.2.37532 > 10.0.13.3.3784: BFDv1, Control, State Up, Flags: [none], length: 24
 00:00:02.791498 eth1  Out IP 10.0.23.3.33100 > 10.0.23.2.3784: BFDv1, Control, State Up, Flags: [none], length: 24
 00:00:02.793753 eth1  In  IP 10.0.23.2.57018 > 10.0.23.3.3784: BFDv1, Control, State Up, Flags: [none], length: 24
 00:00:02.798023 eth3  Out IP 10.0.35.2.50865 > 10.0.35.3.3784: BFDv1, Control, State Up, Flags: [none], length: 24
 00:00:02.827228 eth3  In  IP 10.0.35.3.35105 > 10.0.35.2.3784: BFDv1, Control, State Up, Flags: [none], length: 24
 00:00:02.827244 eth0  Out IP 10.0.13.3.36570 > 10.0.13.2.3784: BFDv1, Control, State Up, Flags: [none], length: 24
 00:00:02.862938 eth0  In  IP 10.0.13.2.37532 > 10.0.13.3.3784: BFDv1, Control, State Up, Flags: [none], length: 24
 00:00:02.866283 eth1  Out IP 10.0.23.3.33100 > 10.0.23.2.3784: BFDv1, Control, State Up, Flags: [none], length: 24
 00:00:02.873573 eth3  Out IP 10.0.35.2.50865 > 10.0.35.3.3784: BFDv1, Control, State Up, Flags: [none], length: 24
 00:00:02.879678 eth1  In  IP 10.0.23.2.57018 > 10.0.23.3.3784: BFDv1, Control, State Up, Flags: [none], length: 24
 00:00:02.906027 eth3  In  IP 10.0.35.3.35105 > 10.0.35.2.3784: BFDv1, Control, State Up, Flags: [none], length: 24
 00:00:02.913430 eth0  Out IP 10.0.13.3.36570 > 10.0.13.2.3784: BFDv1, Control, State Up, Flags: [none], length: 24
 00:00:02.942166 eth0  In  IP 10.0.13.2.37532 > 10.0.13.3.3784: BFDv1, Control, State Up, Flags: [none], length: 24
 00:00:02.950497 eth1  Out IP 10.0.23.3.33100 > 10.0.23.2.3784: BFDv1, Control, State Up, Flags: [none], length: 24
 00:00:02.958753 eth1  In  IP 10.0.23.2.57018 > 10.0.23.3.3784: BFDv1, Control, State Up, Flags: [none], length: 24
 00:00:02.964096 eth3  Out IP 10.0.35.2.50865 > 10.0.35.3.3784: BFDv1, Control, State Up, Flags: [none], length: 24
 00:00:02.991456 eth3  In  IP 10.0.35.3.35105 > 10.0.35.2.3784: BFDv1, Control, State Up, Flags: [none], length: 24
 00:00:03.001836 eth0  Out IP 10.0.13.3.36570 > 10.0.13.2.3784: BFDv1, Control, State Up, Flags: [none], length: 24
 00:00:03.027061 eth1  Out IP 10.0.23.3.33100 > 10.0.23.2.3784: BFDv1, Control, State Up, Flags: [none], length: 24
 00:00:03.027978 eth0  In  IP 10.0.13.2.37532 > 10.0.13.3.3784: BFDv1, Control, State Up, Flags: [none], length: 24
 00:00:03.034303 eth1  In  IP 10.0.23.2.57018 > 10.0.23.3.3784: BFDv1, Control, State Up, Flags: [none], length: 24
 00:00:03.050474 eth3  Out IP 10.0.35.2.50865 > 10.0.35.3.3784: BFDv1, Control, State Up, Flags: [none], length: 24
 00:00:03.081331 eth3  In  IP 10.0.35.3.35105 > 10.0.35.2.3784: BFDv1, Control, State Up, Flags: [none], length: 24
 00:00:03.091681 eth0  Out IP 10.0.13.3.36570 > 10.0.13.2.3784: BFDv1, Control, State Up, Flags: [none], length: 24
 00:00:03.112487 eth0  In  IP 10.0.13.2.37532 > 10.0.13.3.3784: BFDv1, Control, State Up, Flags: [none], length: 24
 00:00:03.114219 eth1  In  IP 10.0.23.2.57018 > 10.0.23.3.3784: BFDv1, Control, State Up, Flags: [none], length: 24
 00:00:03.117503 eth1  Out IP 10.0.23.3.33100 > 10.0.23.2.3784: BFDv1, Control, State Up, Flags: [none], length: 24
 00:00:03.126815 eth3  Out IP 10.0.35.2.50865 > 10.0.35.3.3784: BFDv1, Control, State Up, Flags: [none], length: 24
 00:00:03.160322 eth3  In  IP 10.0.35.3.35105 > 10.0.35.2.3784: BFDv1, Control, State Up, Flags: [none], length: 24
 00:00:03.174721 eth0  Out IP 10.0.13.3.36570 > 10.0.13.2.3784: BFDv1, Control, State Up, Flags: [none], length: 24
 00:00:03.194606 eth0  In  IP 10.0.13.2.37532 > 10.0.13.3.3784: BFDv1, Control, State Up, Flags: [none], length: 24
 00:00:03.196957 eth1  Out IP 10.0.23.3.33100 > 10.0.23.2.3784: BFDv1, Control, State Up, Flags: [none], length: 24
 00:00:03.197079 eth1  In  IP 10.0.23.2.57018 > 10.0.23.3.3784: BFDv1, Control, State Up, Flags: [none], length: 24
 00:00:03.209355 eth3  Out IP 10.0.35.2.50865 > 10.0.35.3.3784: BFDv1, Control, State Up, Flags: [none], length: 24
 00:00:03.238829 eth3  In  IP 10.0.35.3.35105 > 10.0.35.2.3784: BFDv1, Control, State Up, Flags: [none], length: 24
 00:00:03.250091 eth0  Out IP 10.0.13.3.36570 > 10.0.13.2.3784: BFDv1, Control, State Up, Flags: [none], length: 24
 00:00:03.275107 eth0  In  IP 10.0.13.2.37532 > 10.0.13.3.3784: BFDv1, Control, State Up, Flags: [none], length: 24
 00:00:03.275264 eth1  In  IP 10.0.23.2.57018 > 10.0.23.3.3784: BFDv1, Control, State Up, Flags: [none], length: 24
 00:00:03.276471 eth1  Out IP 10.0.23.3.33100 > 10.0.23.2.3784: BFDv1, Control, State Up, Flags: [none], length: 24
 00:00:03.297718 eth3  Out IP 10.0.35.2.50865 > 10.0.35.3.3784: BFDv1, Control, State Up, Flags: [none], length: 24
 00:00:03.319192 eth3  In  IP 10.0.35.3.35105 > 10.0.35.2.3784: BFDv1, Control, State Up, Flags: [none], length: 24
 00:00:03.326545 eth0  Out IP 10.0.13.3.36570 > 10.0.13.2.3784: BFDv1, Control, State Up, Flags: [none], length: 24
 00:00:03.352103 eth0  In  IP 10.0.13.2.37532 > 10.0.13.3.3784: BFDv1, Control, State Up, Flags: [none], length: 24
 00:00:03.354415 eth1  Out IP 10.0.23.3.33100 > 10.0.23.2.3784: BFDv1, Control, State Up, Flags: [none], length: 24
 00:00:03.360645 eth1  In  IP 10.0.23.2.57018 > 10.0.23.3.3784: BFDv1, Control, State Up, Flags: [none], length: 24
 00:00:03.378994 eth3  Out IP 10.0.35.2.50865 > 10.0.35.3.3784: BFDv1, Control, State Up, Flags: [none], length: 24
 00:00:03.403472 eth3  In  IP 10.0.35.3.35105 > 10.0.35.2.3784: BFDv1, Control, State Up, Flags: [none], length: 24
 00:00:03.407783 eth0  Out IP 10.0.13.3.36570 > 10.0.13.2.3784: BFDv1, Control, State Up, Flags: [none], length: 24
 00:00:03.431154 eth0  In  IP 10.0.13.2.37532 > 10.0.13.3.3784: BFDv1, Control, State Up, Flags: [none], length: 24
 00:00:03.431350 eth1  Out IP 10.0.23.3.33100 > 10.0.23.2.3784: BFDv1, Control, State Up, Flags: [none], length: 24
 00:00:03.438561 eth1  In  IP 10.0.23.2.57018 > 10.0.23.3.3784: BFDv1, Control, State Up, Flags: [none], length: 24
 00:00:03.463839 eth3  Out IP 10.0.35.2.50865 > 10.0.35.3.3784: BFDv1, Control, State Up, Flags: [none], length: 24
 00:00:03.484203 eth3  In  IP 10.0.35.3.35105 > 10.0.35.2.3784: BFDv1, Control, State Up, Flags: [none], length: 24
 00:00:03.487434 eth0  Out IP 10.0.13.3.36570 > 10.0.13.2.3784: BFDv1, Control, State Up, Flags: [none], length: 24
 00:00:03.507164 eth0  In  IP 10.0.13.2.37532 > 10.0.13.3.3784: BFDv1, Control, State Up, Flags: [none], length: 24
 00:00:03.515050 eth1  In  IP 10.0.23.2.57018 > 10.0.23.3.3784: BFDv1, Control, State Up, Flags: [none], length: 24
 00:00:03.517305 eth1  Out IP 10.0.23.3.33100 > 10.0.23.2.3784: BFDv1, Control, State Up, Flags: [none], length: 24
 00:00:03.550502 eth3  Out IP 10.0.35.2.50865 > 10.0.35.3.3784: BFDv1, Control, State Up, Flags: [none], length: 24
 00:00:03.563719 eth0  Out IP 10.0.13.3.36570 > 10.0.13.2.3784: BFDv1, Control, State Up, Flags: [none], length: 24
 00:00:03.568830 eth3  In  IP 10.0.35.3.35105 > 10.0.35.2.3784: BFDv1, Control, State Up, Flags: [none], length: 24
 00:00:03.585296 eth0  In  IP 10.0.13.2.37532 > 10.0.13.3.3784: BFDv1, Control, State Up, Flags: [none], length: 24
 00:00:03.594403 eth1  In  IP 10.0.23.2.57018 > 10.0.23.3.3784: BFDv1, Control, State Up, Flags: [none], length: 24
 00:00:03.595619 eth1  Out IP 10.0.23.3.33100 > 10.0.23.2.3784: BFDv1, Control, State Up, Flags: [none], length: 24
 00:00:03.632847 eth3  Out IP 10.0.35.2.50865 > 10.0.35.3.3784: BFDv1, Control, State Up, Flags: [none], length: 24
 00:00:03.644058 eth0  Out IP 10.0.13.3.36570 > 10.0.13.2.3784: BFDv1, Control, State Up, Flags: [none], length: 24
 00:00:03.645048 eth3  In  IP 10.0.35.3.35105 > 10.0.35.2.3784: BFDv1, Control, State Up, Flags: [none], length: 24
 00:00:03.670870 eth0  In  IP 10.0.13.2.37532 > 10.0.13.3.3784: BFDv1, Control, State Up, Flags: [none], length: 24
 00:00:03.679164 eth1  Out IP 10.0.23.3.33100 > 10.0.23.2.3784: BFDv1, Control, State Up, Flags: [none], length: 24
 00:00:03.680309 eth1  In  IP 10.0.23.2.57018 > 10.0.23.3.3784: BFDv1, Control, State Up, Flags: [none], length: 24
 00:00:03.714593 eth3  Out IP 10.0.35.2.50865 > 10.0.35.3.3784: BFDv1, Control, State Up, Flags: [none], length: 24
 00:00:03.724802 eth0  Out IP 10.0.13.3.36570 > 10.0.13.2.3784: BFDv1, Control, State Up, Flags: [none], length: 24
 00:00:03.729827 eth3  In  IP 10.0.35.3.35105 > 10.0.35.2.3784: BFDv1, Control, State Up, Flags: [none], length: 24
 00:00:03.748116 eth0  In  IP 10.0.13.2.37532 > 10.0.13.3.3784: BFDv1, Control, State Up, Flags: [none], length: 24
 00:00:03.758381 eth1  Out IP 10.0.23.3.33100 > 10.0.23.2.3784: BFDv1, Control, State Up, Flags: [none], length: 24
 00:00:03.759650 eth1  In  IP 10.0.23.2.57018 > 10.0.23.3.3784: BFDv1, Control, State Up, Flags: [none], length: 24
 00:00:03.789932 eth3  Out IP 10.0.35.2.50865 > 10.0.35.3.3784: BFDv1, Control, State Up, Flags: [none], length: 24
 00:00:03.805141 eth0  Out IP 10.0.13.3.36570 > 10.0.13.2.3784: BFDv1, Control, State Up, Flags: [none], length: 24
 00:00:03.807275 eth3  In  IP 10.0.35.3.35105 > 10.0.35.2.3784: BFDv1, Control, State Up, Flags: [none], length: 24
 00:00:03.832906 eth0  In  IP 10.0.13.2.37532 > 10.0.13.3.3784: BFDv1, Control, State Up, Flags: [none], length: 24
 00:00:03.835159 eth1  Out IP 10.0.23.3.33100 > 10.0.23.2.3784: BFDv1, Control, State Up, Flags: [none], length: 24
 00:00:03.846576 eth1  In  IP 10.0.23.2.57018 > 10.0.23.3.3784: BFDv1, Control, State Up, Flags: [none], length: 24
 00:00:03.867803 eth3  Out IP 10.0.35.2.50865 > 10.0.35.3.3784: BFDv1, Control, State Up, Flags: [none], length: 24
 00:00:03.881961 eth0  Out IP 10.0.13.3.36570 > 10.0.13.2.3784: BFDv1, Control, State Up, Flags: [none], length: 24
 00:00:03.893165 eth3  In  IP 10.0.35.3.35105 > 10.0.35.2.3784: BFDv1, Control, State Up, Flags: [none], length: 24
 00:00:03.912401 eth1  Out IP 10.0.23.3.33100 > 10.0.23.2.3784: BFDv1, Control, State Up, Flags: [none], length: 24
 00:00:03.916052 eth0  In  IP 10.0.13.2.37532 > 10.0.13.3.3784: BFDv1, Control, State Up, Flags: [none], length: 24
 00:00:03.924596 eth1  In  IP 10.0.23.2.57018 > 10.0.23.3.3784: BFDv1, Control, State Up, Flags: [none], length: 24
 00:00:03.945964 eth3  Out IP 10.0.35.2.50865 > 10.0.35.3.3784: BFDv1, Control, State Up, Flags: [none], length: 24
 00:00:03.960170 eth0  Out IP 10.0.13.3.36570 > 10.0.13.2.3784: BFDv1, Control, State Up, Flags: [none], length: 24
 00:00:03.980307 eth3  In  IP 10.0.35.3.35105 > 10.0.35.2.3784: BFDv1, Control, State Up, Flags: [none], length: 24
