tcpdump: data link type LINUX_SLL2
tcpdump: verbose output suppressed, use -v[v]... for full protocol decode
listening on any, link-type LINUX_SLL2 (Linux cooked v2), snapshot length 262144 bytes
 00:00:00.000000 eth2  In  IP 10.0.23.2.41179 > 10.0.23.3.3784: BFDv1, Control, State Up, Flags: [none], length: 24
 00:00:00.009183 eth1  Out IP 10.0.13.3.42552 > 10.0.13.2.3784: BFDv1, Control, State Up, Flags: [none], length: 24
 00:00:00.018400 eth3  Out IP 10.0.34.2.60805 > 10.0.34.3.3784: BFDv1, Control, State Up, Flags: [none], length: 24
 00:00:00.020536 eth0  Out IP 10.0.35.2.59307 > 10.0.35.3.3784: BFDv1, Control, State Up, Flags: [none], length: 24
 00:00:00.021710 eth0  In  IP 10.0.35.3.48498 > 10.0.35.2.3784: BFDv1, Control, State Up, Flags: [none], length: 24
 00:00:00.025510 eth1  In  IP 10.0.13.2.32837 > 10.0.13.3.3784: BFDv1, Control, State Up, Flags: [none], length: 24
 00:00:00.029672 eth2  Out IP 10.0.23.3.59324 > 10.0.23.2.3784: BFDv1, Control, State Up, Flags: [none], length: 24
 00:00:00.051782 eth3  In  IP 10.0.34.3.60363 > 10.0.34.2.3784: BFDv1, Control, State Up, Flags: [none], length: 24
 00:00:00.076028 eth2  In  IP 10.0.23.2.41179 > 10.0.23.3.3784: BFDv1, Control, State Up, Flags: [none], length: 24
 00:00:00.087214 eth1  Out IP 10.0.13.3.42552 > 10.0.13.2.3784: BFDv1, Control, State Up, Flags: [none], length: 24
 00:00:00.099019 eth0  In  IP 10.0.35.3.48498 > 10.0.35.2.3784: BFDv1, Control, State Up, Flags: [none], length: 24
 00:00:00.099127 eth3  Out IP 10.0.34.2.60805 > 10.0.34.3.3784: BFDv1, Control, State Up, Flags: [none], length: 24
 00:00:00.108302 eth0  Out IP 10.0.35.2.59307 > 10.0.35.3.3784: BFDv1, Control, State Up, Flags: [none], length: 24
 00:00:00.110465 eth2  Out IP 10.0.23.3.59324 > 10.0.23.2.3784: BFDv1, Control, State Up, Flags: [none], length: 24
 00:00:00.112335 eth1  In  IP 10.0.13.2.32837 > 10.0.13.3.3784: BFDv1, Control, State Up, Flags: [none], length: 24
 00:00:00.136436 eth3  In  IP 10.0.34.3.60363 > 10.0.34.2.3784: BFDv1, Control, State Up, Flags: [none], length: 24
 00:00:00.164135 eth2  In  IP 10.0.23.2.41179 > 10.0.23.3.3784: BFDv1, Control, State Up, Flags: [none], length: 24
 00:00:00.165364 eth1  Out IP 10.0.13.3.42552 > 10.0.13.2.3784: BFDv1, Control, State Up, Flags: [none], length: 24
 00:00:00.179329 eth0  In  IP 10.0.35.3.48498 > 10.0.35.2.3784: BFDv1, Control, State Up, Flags: [none], length: 24
 00:00:00.179485 eth3  Out IP 10.0.34.2.60805 > 10.0.34.3.3784: BFDv1, Control, State Up, Flags: [none], length: 24
 00:00:00.185691 eth0  Out IP 10.0.35.2.59307 > 10.0.35.3.3784: BFDv1, Control, State Up, Flags: [none], length: 24
 00:00:00.197512 eth1  In  IP 10.0.13.2.32837 > 10.0.13.3.3784: BFDv1, Control, State Up, Flags: [none], length: 24
 00:00:00.199746 eth2  Out IP 10.0.23.3.59324 > 10.0.23.2.3784: BFDv1, Control, State Up, Flags: [none], length: 24
 00:00:00.212772 eth3  In  IP 10.0.34.3.60363 > 10.0.34.2.3784: BFDv1, Control, State Up, Flags: [none], length: 24
 00:00:00.246518 eth2  In  IP 10.0.23.2.41179 > 10.0.23.3.3784: BFDv1, Control, State Up, Flags: [none], length: 24
 00:00:00.246622 eth1  Out IP 10.0.13.3.42552 > 10.0.13.2.3784: BFDv1, Control, State Up, Flags: [none], length: 24
 00:00:00.266849 eth3  Out IP 10.0.34.2.60805 > 10.0.34.3.3784: BFDv1, Control, State Up, Flags: [none], length: 24
 00:00:00.267699 eth0  In  IP 10.0.35.3.48498 > 10.0.35.2.3784: BFDv1, Control, State Up, Flags: [none], length: 24
 00:00:00.269909 eth0  Out IP 10.0.35.2.59307 > 10.0.35.3.3784: BFDv1, Control, State Up, Flags: [none], length: 24
 00:00:00.281085 eth2  Out IP 10.0.23.3.59324 > 10.0.23.2.3784: BFDv1, Control, State Up, Flags: [none], length: 24
 00:00:00.281803 eth1  In  IP 10.0.13.2.32837 > 10.0.13.3.3784: BFDv1, Control, State Up, Flags: [none], length: 24
 00:00:00.298196 eth3  In  IP 10.0.34.3.60363 > 10.0.34.2.3784: BFDv1, Control, State Up, Flags: [none], length: 24
 00:00:00.328421 eth1  Out IP 10.0.13.3.42552 > 10.0.13.2.3784: BFDv1, Control, State Up, Flags: [none], length: 24
 00:00:00.334596 eth2  In  IP 10.0.23.2.41179 > 10.0.23.3.3784: BFDv1, Control, State Up, Flags: [none], length: 24
 00:00:00.355795 eth3  Out IP 10.0.34.2.60805 > 10.0.34.3.3784: BFDv1, Control, State Up, Flags: [none], length: 24
 00:00:00.355840 eth2  Out IP 10.0.23.3.59324 > 10.0.23.2.3784: BFDv1, Control, State Up, Flags: [none], length: 24
 00:00:00.356114 eth0  In  IP 10.0.35.3.48498 > 10.0.35.2.3784: BFDv1, Control, State Up, Flags: [none], length: 24
 00:00:00.357889 eth1  In  IP 10.0.13.2.32837 > 10.0.13.3.3784: BFDv1, Control, State Up, Flags: [none], length: 24
 00:00:00.359037 eth0  Out IP 10.0.35.2.59307 > 10.0.35.3.3784: BFDv1, Control, State Up, Flags: [none], length: 24
 00:00:00.385600 eth3  In  IP 10.0.34.3.60363 > 10.0.34.2.3784: BFDv1, Control, State Up, Flags: [none], length: 24
 00:00:00.409481 eth2  In  IP 10.0.23.2.41179 > 10.0.23.3.3784: BFDv1, Control, State Up, Flags: [none], length: 24
 00:00:00.415709 eth1  Out IP 10.0.13.3.42552 > 10.0.13.2.3784: BFDv1, Control, State Up, Flags: [none], length: 24
 00:00:00.434965 eth2  Out IP 10.0.23.3.59324 > 10.0.23.2.3784: BFDv1, Control, State Up, Flags: [none], length: 24
 00:00:00.435458 eth0  In  IP 10.0.35.3.48498 > 10.0.35.2.3784: BFDv1, Control, State Up, Flags: [none], length: 24
 00:00:00.437684 eth3  Out IP 10.0.34.2.60805 > 10.0.34.3.3784: BFDv1, Control, State Up, Flags: [none], length: 24
 00:00:00.439822 eth0  Out IP 10.0.35.2.59307 > 10.0.35.3.3784: BFDv1, Control, State Up, Flags: [none], length: 24
 00:00:00.444330 eth1  In  IP 10.0.13.2.32837 > 10.0.13.3.3784: BFDv1, Control, State Up, Flags: [none], length: 24
 00:00:00.469828 eth3  In  IP 10.0.34.3.60363 > 10.0.34.2.3784: BFDv1, Control, State Up, Flags: [none], length: 24
 00:00:00.488775 eth2  In  IP 10.0.23.2.41179 > 10.0.23.3.3784: BFDv1, Control, State Up, Flags: [none], length: 24
 00:00:00.493000 eth1  Out IP 10.0.13.3.42552 > 10.0.13.2.3784: BFDv1, Control, State Up, Flags: [none], length: 24
 00:00:00.510170 eth2  Out IP 10.0.23.3.59324 > 10.0.23.2.3784: BFDv1, Control, State Up, Flags: [none], length: 24
 00:00:00.517349 eth3  Out IP 10.0.34.2.60805 > 10.0.34.3.3784: BFDv1, Control, State Up, Flags: [none], length: 24
 00:00:00.519893 eth0  In  IP 10.0.35.3.48498 > 10.0.35.2.3784: BFDv1, Control, State Up, Flags: [none], length: 24
 00:00:00.526093 eth0  Out IP 10.0.35.2.59307 > 10.0.35.3.3784: BFDv1, Control, State Up, Flags: [none], length: 24
 00:00:00.527456 eth1  In  IP 10.0.13.2.32837 > 10.0.13.3.3784: BFDv1, Control, State Up, Flags: [none], length: 24
 00:00:00.560010 eth3  In  IP 10.0.34.3.60363 > 10.0.34.2.3784: BFDv1, Control, State Up, Flags: [none], length: 24
 00:00:00.575290 eth1  Out IP 10.0.13.3.42552 > 10.0.13.2.3784: BFDv1, Control, State Up, Flags: [none], length: 24
 00:00:00.578435 eth2  In  IP 10.0.23.2.41179 > 10.0.23.3.3784: BFDv1, Control, State Up, Flags: [none], length: 24
 00:00:00.595635 eth2  Out IP 10.0.23.3.59324 > 10.0.23.2.3784: BFDv1, Control, State Up, Flags: [none], length: 24
 00:00:00.596767 eth3  Out IP 10.0.34.2.60805 > 10.0.34.3.3784: BFDv1, Control, State Up, Flags: [none], length: 24
 00:00:00.603936 eth0  Out IP 10.0.35.2.59307 > 10.0.35.3.3784: BFDv1, Control, State Up, Flags: [none], length: 24
 00:00:00.610130 eth0  In  IP 10.0.35.3.48498 > 10.0.35.2.3784: BFDv1, Control, State Up, Flags: [none], length: 24
 00:00:00.610130 eth1  In  IP 10.0.13.2.32837 > 10.0.13.3.3784: BFDv1, Control, State Up, Flags: [none], length: 24
 00:00:00.637630 eth3  In  IP 10.0.34.3.60363 > 10.0.34.2.3784: BFDv1, Control, State Up, Flags: [none], length: 24
 00:00:00.656867 eth1  Out IP 10.0.13.3.42552 > 10.0.13.2.3784: BFDv1, Control, State Up, Flags: [none], length: 24
 00:00:00.659957 eth2  In  IP 10.0.23.2.41179 > 10.0.23.3.3784: BFDv1, Control, State Up, Flags: [none], length: 24
 00:00:00.673211 eth3  Out IP 10.0.34.2.60805 > 10.0.34.3.3784: BFDv1, Control, State Up, Flags: [none], length: 24
 00:00:00.685394 eth2  Out IP 10.0.23.3.59324 > 10.0.23.2.3784: BFDv1, Control, State Up, Flags: [none], length: 24
 00:00:00.685707 eth0  In  IP 10.0.35.3.48498 > 10.0.35.2.3784: BFDv1, Control, State Up, Flags: [none], length: 24
 00:00:00.686853 eth0  Out IP 10.0.35.2.59307 > 10.0.35.3.3784: BFDv1, Control, State Up, Flags: [none], length: 24
 00:00:00.699278 eth1  In  IP 10.0.13.2.32837 > 10.0.13.3.3784: BFDv1, Control, State Up, Flags: [none], length: 24
 00:00:00.725811 eth3  In  IP 10.0.34.3.60363 > 10.0.34.2.3784: BFDv1, Control, State Up, Flags: [none], length: 24
 00:00:00.736105 eth2  In  IP 10.0.23.2.41179 > 10.0.23.3.3784: BFDv1, Control, State Up, Flags: [none], length: 24
 00:00:00.737296 eth1  Out IP 10.0.13.3.42552 > 10.0.13.2.3784: BFDv1, Control, State Up, Flags: [none], length: 24
 00:00:00.761486 eth3  Out IP 10.0.34.2.60805 > 10.0.34.3.3784: BFDv1, Control, State Up, Flags: [none], length: 24
 00:00:00.770625 eth0  Out IP 10.0.35.2.59307 > 10.0.35.3.3784: BFDv1, Control, State Up, Flags: [none], length: 24
 00:00:00.771785 eth0  In  IP 10.0.35.3.48498 > 10.0.35.2.3784: BFDv1, Control, State Up, Flags: [none], length: 24
 00:00:00.774045 eth2  Out IP 10.0.23.3.59324 > 10.0.23.2.3784: BFDv1, Control, State Up, Flags: [none], length: 24
 00:00:00.781386 eth1  In  IP 10.0.13.2.32837 > 10.0.13.3.3784: BFDv1, Control, State Up, Flags: [none], length: 24
 00:00:00.807579 eth3  In  IP 10.0.34.3.60363 > 10.0.34.2.3784: BFDv1, Control, State Up, Flags: [none], length: 24
 00:00:00.815795 eth1  Out IP 10.0.13.3.42552 > 10.0.13.2.3784: BFDv1, Control, State Up, Flags: [none], length: 24
 00:00:00.823939 eth2  In  IP 10.0.23.2.41179 > 10.0.23.3.3784: BFDv1, Control, State Up, Flags: [none], length: 24
 00:00:00.838207 eth3  Out IP 10.0.34.2.60805 > 10.0.34.3.3784: BFDv1, Control, State Up, Flags: [none], length: 24
 00:00:00.853392 eth0  Out IP 10.0.35.2.59307 > 10.0.35.3.3784: BFDv1, Control, State Up, Flags: [none], length: 24
 00:00:00.858568 eth2  Out IP 10.0.23.3.59324 > 10.0.23.2.3784: BFDv1, Control, State Up, Flags: [none], length: 24
 00:00:00.859570 eth0  In  IP 10.0.35.3.48498 > 10.0.35.2.3784: BFDv1, Control, State Up, Flags: [none], length: 24
 00:00:00.866448 eth1  In  IP 10.0.13.2.32837 > 10.0.13.3.3784: BFDv1, Control, State Up, Flags: [none], length: 24
 00:00:00.886933 eth3  In  IP 10.0.34.3.60363 > 10.0.34.2.3784: BFDv1, Control, State Up, Flags: [none], length: 24
 00:00:00.903294 eth2  In  IP 10.0.23.2.41179 > 10.0.23.3.3784: BFDv1, Control, State Up, Flags: [none], length: 24
 00:00:00.904515 eth1  Out IP 10.0.13.3.42552 > 10.0.13.2.3784: BFDv1, Control, State Up, Flags: [none], length: 24
 00:00:00.914682 eth3  Out IP 10.0.34.2.60805 > 10.0.34.3.3784: BFDv1, Control, State Up, Flags: [none], length: 24
 00:00:00.928888 eth0  Out IP 10.0.35.2.59307 > 10.0.35.3.3784: BFDv1, Control, State Up, Flags: [none], length: 24
 00:00:00.935058 eth0  In  IP 10.0.35.3.48498 > 10.0.35.2.3784: BFDv1, Control, State Up, Flags: [none], length: 24
 00:00:00.939283 eth2  Out IP 10.0.23.3.59324 > 10.0.23.2.3784: BFDv1, Control, State Up, Flags: [none], length: 24
 00:00:00.948738 eth1  In  IP 10.0.13.2.32837 > 10.0.13.3.3784: BFDv1, Control, State Up, Flags: [none], length: 24
 00:00:00.965457 eth3  In  IP 10.0.34.3.60363 > 10.0.34.2.3784: BFDv1, Control, State Up, Flags: [none], length: 24
 00:00:00.979635 eth1  Out IP 10.0.13.3.42552 > 10.0.13.2.3784: BFDv1, Control, State Up, Flags: [none], length: 24
 00:00:00.991795 eth2  In  IP 10.0.23.2.41179 > 10.0.23.3.3784: BFDv1, Control, State Up, Flags: [none], length: 24
 00:00:01.003013 eth3  Out IP 10.0.34.2.60805 > 10.0.34.3.3784: BFDv1, Control, State Up, Flags: [none], length: 24
 00:00:01.009188 eth0  Out IP 10.0.35.2.59307 > 10.0.35.3.3784: BFDv1, Control, State Up, Flags: [none], length: 24
 00:00:01.014465 eth0  In  IP 10.0.35.3.48498 > 10.0.35.2.3784: BFDv1, Control, State Up, Flags: [none], length: 24
 00:00:01.026622 eth2  Out IP 10.0.23.3.59324 > 10.0.23.2.3784: BFDv1, Control, State Up, Flags: [none], length: 24
 00:00:01.033215 eth1  In  IP 10.0.13.2.32837 > 10.0.13.3.3784: BFDv1, Control, State Up, Flags: [none], length: 24
 00:00:01.043356 eth3  In  IP 10.0.34.3.60363 > 10.0.34.2.3784: BFDv1, Control, State Up, Flags: [none], length: 24
 00:00:01.060679 eth1  Out IP 10.0.13.3.42552 > 10.0.13.2.3784: BFDv1, Control, State Up, Flags: [none], length: 24
 00:00:01.070045 eth2  In  IP 10.0.23.2.41179 > 10.0.23.3.3784: BFDv1, Control, State Up, Flags: [none], length: 24
 00:00:01.086212 eth3  Out IP 10.0.34.2.60805 > 10.0.34.3.3784: BFDv1, Control, State Up, Flags: [none], length: 24
 00:00:01.088341 eth0  Out IP 10.0.35.2.59307 > 10.0.35.3.3784: BFDv1, Control, State Up, Flags: [none], length: 24
 00:00:01.101498 eth0  In  IP 10.0.35.3.48498 > 10.0.35.2.3784: BFDv1, Control, State Up, Flags: [none], length: 24
 00:00:01.108670 eth2  Out IP 10.0.23.3.59324 > 10.0.23.2.3784: BFDv1, Control, State Up, Flags: [none], length: 24
 00:00:01.112338 eth1  In  IP 10.0.13.2.32837 > 10.0.13.3.3784: BFDv1, Control, State Up, Flags: [none], length: 24
 00:00:01.122586 eth3  In  IP 10.0.34.3.60363 > 10.0.34.2.3784: BFDv1, Control, State Up, Flags: [none], length: 24
 00:00:01.143885 eth1  Out IP 10.0.13.3.42552 > 10.0.13.2.3784: BFDv1, Control, State Up, Flags: [none], length: 24
 00:00:01.145346 eth2  In  IP 10.0.23.2.41179 > 10.0.23.3.3784: BFDv1, Control, State Up, Flags: [none], length: 24
 00:00:01.165721 eth0  Out IP 10.0.35.2.59307 > 10.0.35.3.3784: BFDv1, Control, State Up, Flags: [none], length: 24
 00:00:01.170949 eth3  Out IP 10.0.34.2.60805 > 10.0.34.3.3784: BFDv1, Control, State Up, Flags: [none], length: 24
 00:00:01.185202 eth2  Out IP 10.0.23.3.59324 > 10.0.23.2.3784: BFDv1, Control, State Up, Flags: [none], length: 24
 00:00:01.187898 eth1  In  IP 10.0.13.2.32837 > 10.0.13.3.3784: BFDv1, Control, State Up, Flags: [none], length: 24
 00:00:01.188946 eth0  In  IP 10.0.35.3.48498 > 10.0.35.2.3784: BFDv1, Control, State Up, Flags: [none], length: 24
 00:00:01.211355 eth3  In  IP 10.0.34.3.60363 > 10.0.34.2.3784: BFDv1, Control, State Up, Flags: [none], length: 24
 00:00:01.222550 eth1  Out IP 10.0.13.3.42552 > 10.0.13.2.3784: BFDv1, Control, State Up, Flags: [none], length: 24
 00:00:01.235283 eth2  In  IP 10.0.23.2.41179 > 10.0.23.3.3784: BFDv1, Control, State Up, Flags: [none], length: 24
 00:00:01.246475 eth0  Out IP 10.0.35.2.59307 > 10.0.35.3.3784: BFDv1, Control, State Up, Flags: [none], length: 24
 00:00:01.249619 eth3  Out IP 10.0.34.2.60805 > 10.0.34.3.3784: BFDv1, Control, State Up, Flags: [none], length: 24
 00:00:01.267739 eth0  In  IP 10.0.35.3.48498 > 10.0.35.2.3784: BFDv1, Control, State Up, Flags: [none], length: 24
 00:00:01.269918 eth2  Out IP 10.0.23.3.59324 > 10.0.23.2.3784: BFDv1, Control, State Up, Flags: [none], length: 24
 00:00:01.276475 eth1  In  IP 10.0.13.2.32837 > 10.0.13.3.3784: BFDv1, Control, State Up, Flags: [none], length: 24
 00:00:01.300596 eth3  In  IP 10.0.34.3.60363 > 10.0.34.2.3784: BFDv1, Control, State Up, Flags: [none], length: 24
 00:00:01.302787 eth1  Out IP 10.0.13.3.42552 > 10.0.13.2.3784: BFDv1, Control, State Up, Flags: [none], length: 24
 00:00:01.317781 eth2  In  IP 10.0.23.2.41179 > 10.0.23.3.3784: BFDv1, Control, State Up, Flags: [none], length: 24
 00:00:01.327004 eth0  Out IP 10.0.35.2.59307 > 10.0.35.3.3784: BFDv1, Control, State Up, Flags: [none], length: 24
 00:00:01.328146 eth3  Out IP 10.0.34.2.60805 > 10.0.34.3.3784: BFDv1, Control, State Up, Flags: [none], length: 24
 00:00:01.344412 eth0  In  IP 10.0.35.3.48498 > 10.0.35.2.3784: BFDv1, Control, State Up, Flags: [none], length: 24
 00:00:01.353095 eth1  In  IP 10.0.13.2.32837 > 10.0.13.3.3784: BFDv1, Control, State Up, Flags: [none], length: 24
 00:00:01.355369 eth2  Out IP 10.0.23.3.59324 > 10.0.23.2.3784: BFDv1, Control, State Up, Flags: [none], length: 24
 00:00:01.381482 eth1  Out IP 10.0.13.3.42552 > 10.0.13.2.3784: BFDv1, Control, State Up, Flags: [none], length: 24
 00:00:01.385220 eth3  In  IP 10.0.34.3.60363 > 10.0.34.2.3784: BFDv1, Control, State Up, Flags: [none], length: 24
 00:00:01.395920 eth2  In  IP 10.0.23.2.41179 > 10.0.23.3.3784: BFDv1, Control, State Up, Flags: [none], length: 24
 00:00:01.403157 eth0  Out IP 10.0.35.2.59307 > 10.0.35.3.3784: BFDv1, Control, State Up, Flags: [none], length: 24
 00:00:01.406335 eth3  Out IP 10.0.34.2.60805 > 10.0.34.3.3784: BFDv1, Control, State Up, Flags: [none], length: 24
 00:00:01.428472 eth0  In  IP 10.0.35.3.48498 > 10.0.35.2.3784: BFDv1, Control, State Up, Flags: [none], length: 24
 00:00:01.437703 eth2  Out IP 10.0.23.3.59324 > 10.0.23.2.3784: BFDv1, Control, State Up, Flags: [none], length: 24
 00:00:01.443221 eth1  In  IP 10.0.13.2.32837 > 10.0.13.3.3784: BFDv1, Control, State Up, Flags: [none], length: 24
 00:00:01.459450 eth1  Out IP 10.0.13.3.42552 > 10.0.13.2.3784: BFDv1, Control, State Up, Flags: [none], length: 24
 00:00:01.471240 eth3  In  IP 10.0.34.3.60363 > 10.0.34.2.3784: BFDv1, Control, State Up, Flags: [none], length: 24
 00:00:01.482546 eth3  Out IP 10.0.34.2.60805 > 10.0.34.3.3784: BFDv1, Control, State Up, Flags: [none], length: 24
 00:00:01.485360 eth2  In  IP 10.0.23.2.41179 > 10.0.23.3.3784: BFDv1, Control, State Up, Flags: [none], length: 24
 00:00:01.489606 eth0  Out IP 10.0.35.2.59307 > 10.0.35.3.3784: BFDv1, Control, State Up, Flags: [none], length: 24
 00:00:01.502916 eth0  In  IP 10.0.35.3.48498 > 10.0.35.2.3784: BFDv1, Control, State Up, Flags: [none], length: 24
 00:00:01.513103 eth2  Out IP 10.0.23.3.59324 > 10.0.23.2.3784: BFDv1, Control, State Up, Flags: [none], length: 24
 00:00:01.524343 eth1  In  IP 10.0.13.2.32837 > 10.0.13.3.3784: BFDv1, Control, State Up, Flags: [none], length: 24
 00:00:01.549115 eth1  Out IP 10.0.13.3.42552 > 10.0.13.2.3784: BFDv1, Control, State Up, Flags: [none], length: 24
 00:00:01.549467 eth3  In  IP 10.0.34.3.60363 > 10.0.34.2.3784: BFDv1, Control, State Up, Flags: [none], length: 24
 00:00:01.558664 eth3  Out IP 10.0.34.2.60805 > 10.0.34.3.3784: BFDv1, Control, State Up, Flags: [none], length: 24
 00:00:01.560666 eth2  In  IP 10.0.23.2.41179 > 10.0.23.3.3784: BFDv1, Control, State Up, Flags: [none], length: 24
 00:00:01.570854 eth0  Out IP 10.0.35.2.59307 > 10.0.35.3.3784: BFDv1, Control, State Up, Flags: [none], length: 24
 00:00:01.579203 eth0  In  IP 10.0.35.3.48498 > 10.0.35.2.3784: BFDv1, Control, State Up, Flags: [none], length: 24
 00:00:01.602447 eth2  Out IP 10.0.23.3.59324 > 10.0.23.2.3784: BFDv1, Control, State Up, Flags: [none], length: 24
 00:00:01.610225 eth1  In  IP 10.0.13.2.32837 > 10.0.13.3.3784: BFDv1, Control, State Up, Flags: [none], length: 24
 00:00:01.629490 eth3  In  IP 10.0.34.3.60363 > 10.0.34.2.3784: BFDv1, Control, State Up, Flags: [none], length: 24
 00:00:01.637708 eth1  Out IP 10.0.13.3.42552 > 10.0.13.2.3784: BFDv1, Control, State Up, Flags: [none], length: 24
 00:00:01.644819 eth2  In  IP 10.0.23.2.41179 > 10.0.23.3.3784: BFDv1, Control, State Up, Flags: [none], length: 24
 00:00:01.644864 eth3  Out IP 10.0.34.2.60805 > 10.0.34.3.3784: BFDv1, Control, State Up, Flags: [none], length: 24
 00:00:01.657080 eth0  Out IP 10.0.35.2.59307 > 10.0.35.3.3784: BFDv1, Control, State Up, Flags: [none], length: 24
 00:00:01.659259 eth0  In  IP 10.0.35.3.48498 > 10.0.35.2.3784: BFDv1, Control, State Up, Flags: [none], length: 24
 00:00:01.682499 eth2  Out IP 10.0.23.3.59324 > 10.0.23.2.3784: BFDv1, Control, State Up, Flags: [none], length: 24
 00:00:01.696341 eth1  In  IP 10.0.13.2.32837 > 10.0.13.3.3784: BFDv1, Control, State Up, Flags: [none], length: 24
 00:00:01.715673 eth3  In  IP 10.0.34.3.60363 > 10.0.34.2.3784: BFDv1, Control, State Up, Flags: [none], length: 24
 00:00:01.716832 eth1  Out IP 10.0.13.3.42552 > 10.0.13.2.3784: BFDv1, Control, State Up, Flags: [none], length: 24
 00:00:01.719550 eth2  In  IP 10.0.23.2.41179 > 10.0.23.3.3784: BFDv1, Control, State Up, Flags: [none], length: 24
 00:00:01.734748 eth3  Out IP 10.0.34.2.60805 > 10.0.34.3.3784: BFDv1, Control, State Up, Flags: [none], length: 24
 00:00:01.738816 eth0  In  IP 10.0.35.3.48498 > 10.0.35.2.3784: BFDv1, Control, State Up, Flags: [none], length: 24
 00:00:01.744033 eth0  Out IP 10.0.35.2.59307 > 10.0.35.3.3784: BFDv1, Control, State Up, Flags: [none], length: 24
 00:00:01.770567 eth2  Out IP 10.0.23.3.59324 > 10.0.23.2.3784: BFDv1, Control, State Up, Flags: [none], length: 24
 00:00:01.775265 eth1  In  IP 10.0.13.2.32837 > 10.0.13.3.3784: BFDv1, Control, State Up, Flags: [none], length: 24
 00:00:01.794174 eth3  In  IP 10.0.34.3.60363 > 10.0.34.2.3784: BFDv1, Control, State Up, Flags: [none], length: 24
 00:00:01.795743 eth2  In  IP 10.0.23.2.41179 > 10.0.23.3.3784: BFDv1, Control, State Up, Flags: [none], length: 24
 00:00:01.799970 eth1  Out IP 10.0.13.3.42552 > 10.0.13.2.3784: BFDv1, Control, State Up, Flags: [none], length: 24
 00:00:01.823149 eth3  Out IP 10.0.34.2.60805 > 10.0.34.3.3784: BFDv1, Control, State Up, Flags: [none], length: 24
 00:00:01.828421 eth0  In  IP 10.0.35.3.48498 > 10.0.35.2.3784: BFDv1, Control, State Up, Flags: [none], length: 24
 00:00:01.832670 eth0  Out IP 10.0.35.2.59307 > 10.0.35.3.3784: BFDv1, Control, State Up, Flags: [none], length: 24
 00:00:01.850613 eth1  In  IP 10.0.13.2.32837 > 10.0.13.3.3784: BFDv1, Control, State Up, Flags: [none], length: 24
 00:00:01.856834 eth2  Out IP 10.0.23.3.59324 > 10.0.23.2.3784: BFDv1, Control, State Up, Flags: [none], length: 24
 00:00:01.877175 eth2  In  IP 10.0.23.2.41179 > 10.0.23.3.3784: BFDv1, Control, State Up, Flags: [none], length: 24
 00:00:01.879389 eth1  Out IP 10.0.13.3.42552 > 10.0.13.2.3784: BFDv1, Control, State Up, Flags: [none], length: 24
 00:00:01.883251 eth3  In  IP 10.0.34.3.60363 > 10.0.34.2.3784: BFDv1, Control, State Up, Flags: [none], length: 24
 00:00:01.900520 eth3  Out IP 10.0.34.2.60805 > 10.0.34.3.3784: BFDv1, Control, State Up, Flags: [none], length: 24
 00:00:01.913664 eth0  Out IP 10.0.35.2.59307 > 10.0.35.3.3784: BFDv1, Control, State Up, Flags: [none], length: 24
 00:00:01.916820 eth0  In  IP 10.0.35.3.48498 > 10.0.35.2.3784: BFDv1, Control, State Up, Flags: [none], length: 24
 00:00:01.927283 eth1  In  IP 10.0.13.2.32837 > 10.0.13.3.3784: BFDv1, Control, State Up, Flags: [none], length: 24
 00:00:01.941519 eth2  Out IP 10.0.23.3.59324 > 10.0.23.2.3784: BFDv1, Control, State Up, Flags: [none], length: 24
 00:00:01.959890 eth2  In  IP 10.0.23.2.41179 > 10.0.23.3.3784: BFDv1, Control, State Up, Flags: [none], length: 24
 00:00:01.962127 eth1  Out IP 10.0.13.3.42552 > 10.0.13.2.3784: BFDv1, Control, State Up, Flags: [none], length: 24
 00:00:01.965965 eth3  In  IP 10.0.34.3.60363 > 10.0.34.2.3784: BFDv1, Control, State Up, Flags: [none], length: 24
 00:00:01.985178 eth3  Out IP 10.0.34.2.60805 > 10.0.34.3.3784: BFDv1, Control, State Up, Flags: [none], length: 24
 00:00:01.994347 eth0  Out IP 10.0.35.2.59307 > 10.0.35.3.3784: BFDv1, Control, State Up, Flags: [none], length: 24
 00:00:02.003541 eth0  In  IP 10.0.35.3.48498 > 10.0.35.2.3784: BFDv1, Control, State Up, Flags: [none], length: 24
 00:00:02.016591 eth1  In  IP 10.0.13.2.32837 > 10.0.13.3.3784: BFDv1, Control, State Up, Flags: [none], length: 24
 00:00:02.026761 eth2  Out IP 10.0.23.3.59324 > 10.0.23.2.3784: BFDv1, Control, State Up, Flags: [none], length: 24
 00:00:02.045112 eth2  In  IP 10.0.23.2.41179 > 10.0.23.3.3784: BFDv1, Control, State Up, Flags: [none], length: 24
 00:00:02.048284 eth1  Out IP 10.0.13.3.42552 > 10.0.13.2.3784: BFDv1, Control, State Up, Flags: [none], length: 24
 00:00:02.055177 eth3  In  IP 10.0.34.3.60363 > 10.0.34.2.3784: BFDv1, Control, State Up, Flags: [none], length: 24
 00:00:02.070581 eth0  Out IP 10.0.35.2.59307 > 10.0.35.3.3784: BFDv1, Control, State Up, Flags: [none], length: 24
 00:00:02.090828 eth0  In  IP 10.0.35.3.48498 > 10.0.35.2.3784: BFDv1, Control, State Up, Flags: [none], length: 24
 00:00:02.092288 eth1  In  IP 10.0.13.2.32837 > 10.0.13.3.3784: BFDv1, Control, State Up, Flags: [none], length: 24
 00:00:02.116484 eth2  Out IP 10.0.23.3.59324 > 10.0.23.2.3784: BFDv1, Control, State Up, Flags: [none], length: 24
 00:00:02.127652 eth2  In  IP 10.0.23.2.41179 > 10.0.23.3.3784: BFDv1, Control, State Up, Flags: [none], length: 24
 00:00:02.127677 eth1  Out IP 10.0.13.3.42552 > 10.0.13.2.3784: BFDv1, Control, State Up, Flags: [none], length: 24
 00:00:02.145918 eth0  Out IP 10.0.35.2.59307 > 10.0.35.3.3784: BFDv1, Control, State Up, Flags: [none], length: 24
 00:00:02.168132 eth1  In  IP 10.0.13.2.32837 > 10.0.13.3.3784: BFDv1, Control, State Up, Flags: [none], length: 24
 00:00:02.169092 eth0  In  IP 10.0.35.3.48498 > 10.0.35.2.3784: BFDv1, Control, State Up, Flags: [none], length: 24
 00:00:02.194325 eth2  Out IP 10.0.23.3.59324 > 10.0.23.2.3784: BFDv1, Control, State Up, Flags: [none], length: 24
 00:00:02.206506 eth1  Out IP 10.0.13.3.42552 > 10.0.13.2.3784: BFDv1, Control, State Up, Flags: [none], length: 24
 00:00:02.213169 eth2  In  IP 10.0.23.2.41179 > 10.0.23.3.3784: BFDv1, Control, State Up, Flags: [none], length: 24
 00:00:02.227487 eth0  Out IP 10.0.35.2.59307 > 10.0.35.3.3784: BFDv1, Control, State Up, Flags: [none], length: 24
 00:00:02.245461 eth1  In  IP 10.0.13.2.32837 > 10.0.13.3.3784: BFDv1, Control, State Up, Flags: [none], length: 24
 00:00:02.254766 eth0  In  IP 10.0.35.3.48498 > 10.0.35.2.3784: BFDv1, Control, State Up, Flags: [none], length: 24
 00:00:02.270953 eth2  Out IP 10.0.23.3.59324 > 10.0.23.2.3784: BFDv1, Control, State Up, Flags: [none], length: 24
 00:00:02.283100 eth1  Out IP 10.0.13.3.42552 > 10.0.13.2.3784: BFDv1, Control, State Up, Flags: [none], length: 24
 00:00:02.293134 eth2  In  IP 10.0.23.2.41179 > 10.0.23.3.3784: BFDv1, Control, State Up, Flags: [none], length: 24
 00:00:02.309422 eth0  Out IP 10.0.35.2.59307 > 10.0.35.3.3784: BFDv1, Control, State Up, Flags: [none], length: 24
 00:00:02.324170 eth1  In  IP 10.0.13.2.32837 > 10.0.13.3.3784: BFDv1, Control, State Up, Flags: [none], length: 24
 00:00:02.339736 eth0  In  IP 10.0.35.3.48498 > 10.0.35.2.3784: BFDv1, Control, State Up, Flags: [none], length: 24
 00:00:02.353055 eth2  Out IP 10.0.23.3.59324 > 10.0.23.2.3784: BFDv1, Control, State Up, Flags: [none], length: 24
 00:00:02.370227 eth1  Out IP 10.0.13.3.42552 > 10.0.13.2.3784: BFDv1, Control, State Up, Flags: [none], length: 24
 00:00:02.370235 eth2  In  IP 10.0.23.2.41179 > 10.0.23.3.3784: BFDv1, Control, State Up, Flags: [none], length: 24
 00:00:02.388451 eth0  Out IP 10.0.35.2.59307 > 10.0.35.3.3784: BFDv1, Control, State Up, Flags: [none], length: 24
 00:00:02.399714 eth1  In  IP 10.0.13.2.32837 > 10.0.13.3.3784: BFDv1, Control, State Up, Flags: [none], length: 24
 00:00:02.423027 eth0  In  IP 10.0.35.3.48498 > 10.0.35.2.3784: BFDv1, Control, State Up, Flags: [none], length: 24
 00:00:02.432241 eth2  Out IP 10.0.23.3.59324 > 10.0.23.2.3784: BFDv1, Control, State Up, Flags: [none], length: 24
 00:00:02.446434 eth1  Out IP 10.0.13.3.42552 > 10.0.13.2.3784: BFDv1, Control, State Up, Flags: [none], length: 24
 00:00:02.449188 eth2  In  IP 10.0.23.2.41179 > 10.0.23.3.3784: BFDv1, Control, State Up, Flags: [none], length: 24
 00:00:02.464419 eth0  Out IP 10.0.35.2.59307 > 10.0.35.3.3784: BFDv1, Control, State Up, Flags: [none], length: 24
 00:00:02.478361 eth1  In  IP 10.0.13.2.32837 > 10.0.13.3.3784: BFDv1, Control, State Up, Flags: [none], length: 24
 00:00:02.501726 eth0  In  IP 10.0.35.3.48498 > 10.0.35.2.3784: BFDv1, Control, State Up, Flags: [none], length: 24
 00:00:02.512991 eth2  Out IP 10.0.23.3.59324 > 10.0.23.2.3784: BFDv1, Control, State Up, Flags: [none], length: 24
 00:00:02.525155 eth1  Out IP 10.0.13.3.42552 > 10.0.13.2.3784: BFDv1, Control, State Up, Flags: [none], length: 24
 00:00:02.538471 eth2  In  IP 10.0.23.2.41179 > 10.0.23.3.3784: BFDv1, Control, State Up, Flags: [none], length: 24
 00:00:02.539648 eth0  Out IP 10.0.35.2.59307 > 10.0.35.3.3784: BFDv1, Control, State Up, Flags: [none], length: 24
 00:00:02.561932 eth1  In  IP 10.0.13.2.32837 > 10.0.13.3.3784: BFDv1, Control, State Up, Flags: [none], length: 24
 00:00:02.581996 eth0  In  IP 10.0.35.3.48498 > 10.0.35.2.3784: BFDv1, Control, State Up, Flags: [none], length: 24
 00:00:02.599218 eth2  Out IP 10.0.23.3.59324 > 10.0.23.2.3784: BFDv1, Control, State Up, Flags: [none], length: 24
 00:00:02.602398 eth1  Out IP 10.0.13.3.42552 > 10.0.13.2.3784: BFDv1, Control, State Up, Flags: [none], length: 24
 00:00:02.614983 eth2  In  IP 10.0.23.2.41179 > 10.0.23.3.3784: BFDv1, Control, State Up, Flags: [none], length: 24
 00:00:02.619227 eth0  Out IP 10.0.35.2.59307 > 10.0.35.3.3784: BFDv1, Control, State Up, Flags: [none], length: 24
 00:00:02.651328 eth1  In  IP 10.0.13.2.32837 > 10.0.13.3.3784: BFDv1, Control, State Up, Flags: [none], length: 24
 00:00:02.658560 eth0  In  IP 10.0.35.3.48498 > 10.0.35.2.3784: BFDv1, Control, State Up, Flags: [none], length: 24
 00:00:02.684784 eth1  Out IP 10.0.13.3.42552 > 10.0.13.2.3784: BFDv1, Control, State Up, Flags: [none], length: 24
 00:00:02.686960 eth2  Out IP 10.0.23.3.59324 > 10.0.23.2.3784: BFDv1, Control, State Up, Flags: [none], length: 24
 00:00:02.691186 eth2  In  IP 10.0.23.2.41179 > 10.0.23.3.3784: BFDv1, Control, State Up, Flags: [none], length: 24
 00:00:02.707443 eth0  Out IP 10.0.35.2.59307 > 10.0.35.3.3784: BFDv1, Control, State Up, Flags: [none], length: 24
 00:00:02.735926 eth1  In  IP 10.0.13.2.32837 > 10.0.13.3.3784: BFDv1, Control, State Up, Flags: [none], length: 24
 00:00:02.744790 eth0  In  IP 10.0.35.3.48498 > 10.0.35.2.3784: BFDv1, Control, State Up, Flags: [none], length: 24
 00:00:02.761983 eth1  Out IP 10.0.13.3.42552 > 10.0.13.2.3784: BFDv1, Control, State Up, Flags: [none], length: 24
 00:00:02.772144 eth2  Out IP 10.0.23.3.59324 > 10.0.23.2.3784: BFDv1, Control, State Up, Flags: [none], length: 24
 00:00:02.777316 eth2  In  IP 10.0.23.2.41179 > 10.0.23.3.3784: BFDv1, Control, State Up, Flags: [none], length: 24
 00:00:02.795492 eth0  Out IP 10.0.35.2.59307 > 10.0.35.3.3784: BFDv1, Control, State Up, Flags: [none], length: 24
 00:00:02.818891 eth1  In  IP 10.0.13.2.32837 > 10.0.13.3.3784: BFDv1, Control, State Up, Flags: [none], length: 24
 00:00:02.825798 eth0  In  IP 10.0.35.3.48498 > 10.0.35.2.3784: BFDv1, Control, State Up, Flags: [none], length: 24
 00:00:02.841024 eth1  Out IP 10.0.13.3.42552 > 10.0.13.2.3784: BFDv1, Control, State Up, Flags: [none], length: 24
 00:00:02.855252 eth2  In  IP 10.0.23.2.41179 > 10.0.23.3.3784: BFDv1, Control, State Up, Flags: [none], length: 24
 00:00:02.860473 eth2  Out IP 10.0.23.3.59324 > 10.0.23.2.3784: BFDv1, Control, State Up, Flags: [none], length: 24
 00:00:02.874635 eth0  Out IP 10.0.35.2.59307 > 10.0.35.3.3784: BFDv1, Control, State Up, Flags: [none], length: 24
 00:00:02.900946 eth0  In  IP 10.0.35.3.48498 > 10.0.35.2.3784: BFDv1, Control, State Up, Flags: [none], length: 24
 00:00:02.908384 eth1  In  IP 10.0.13.2.32837 > 10.0.13.3.3784: BFDv1, Control, State Up, Flags: [none], length: 24
 00:00:02.921609 eth1  Out IP 10.0.13.3.42552 > 10.0.13.2.3784: BFDv1, Control, State Up, Flags: [none], length: 24
 00:00:02.931929 eth2  In  IP 10.0.23.2.41179 > 10.0.23.3.3784: BFDv1, Control, State Up, Flags: [none], length: 24
 00:00:02.936146 eth2  Out IP 10.0.23.3.59324 > 10.0.23.2.3784: BFDv1, Control, State Up, Flags: [none], length: 24
 00:00:02.955314 eth0  Out IP 10.0.35.2.59307 > 10.0.35.3.3784: BFDv1, Control, State Up, Flags: [none], length: 24
 00:00:02.977497 eth0  In  IP 10.0.35.3.48498 > 10.0.35.2.3784: BFDv1, Control, State Up, Flags: [none], length: 24
 00:00:02.995674 eth1  In  IP 10.0.13.2.32837 > 10.0.13.3.3784: BFDv1, Control, State Up, Flags: [none], length: 24
 00:00:02.999491 eth1  Out IP 10.0.13.3.42552 > 10.0.13.2.3784: BFDv1, Control, State Up, Flags: [none], length: 24
 00:00:03.010626 eth2  In  IP 10.0.23.2.41179 > 10.0.23.3.3784: BFDv1, Control, State Up, Flags: [none], length: 24
 00:00:03.017889 eth2  Out IP 10.0.23.3.59324 > 10.0.23.2.3784: BFDv1, Control, State Up, Flags: [none], length: 24
 00:00:03.042089 eth0  Out IP 10.0.35.2.59307 > 10.0.35.3.3784: BFDv1, Control, State Up, Flags: [none], length: 24
 00:00:03.057297 eth0  In  IP 10.0.35.3.48498 > 10.0.35.2.3784: BFDv1, Control, State Up, Flags: [none], length: 24
 00:00:03.077487 eth1  In  IP 10.0.13.2.32837 > 10.0.13.3.3784: BFDv1, Control, State Up, Flags: [none], length: 24
 00:00:03.087713 eth1  Out IP 10.0.13.3.42552 > 10.0.13.2.3784: BFDv1, Control, State Up, Flags: [none], length: 24
 00:00:03.095925 eth2  In  IP 10.0.23.2.41179 > 10.0.23.3.3784: BFDv1, Control, State Up, Flags: [none], length: 24
 00:00:03.103158 eth2  Out IP 10.0.23.3.59324 > 10.0.23.2.3784: BFDv1, Control, State Up, Flags: [none], length: 24
 00:00:03.117341 eth0  Out IP 10.0.35.2.59307 > 10.0.35.3.3784: BFDv1, Control, State Up, Flags: [none], length: 24
 00:00:03.133519 eth0  In  IP 10.0.35.3.48498 > 10.0.35.2.3784: BFDv1, Control, State Up, Flags: [none], length: 24
 00:00:03.164616 eth1  In  IP 10.0.13.2.32837 > 10.0.13.3.3784: BFDv1, Control, State Up, Flags: [none], length: 24
 00:00:03.165778 eth1  Out IP 10.0.13.3.42552 > 10.0.13.2.3784: BFDv1, Control, State Up, Flags: [none], length: 24
 00:00:03.176775 eth2  In  IP 10.0.23.2.41179 > 10.0.23.3.3784: BFDv1, Control, State Up, Flags: [none], length: 24
 00:00:03.189017 eth2  Out IP 10.0.23.3.59324 > 10.0.23.2.3784: BFDv1, Control, State Up, Flags: [none], length: 24
 00:00:03.194181 eth0  Out IP 10.0.35.2.59307 > 10.0.35.3.3784: BFDv1, Control, State Up, Flags: [none], length: 24
 00:00:03.216351 eth0  In  IP 10.0.35.3.48498 > 10.0.35.2.3784: BFDv1, Control, State Up, Flags: [none], length: 24
 00:00:03.244622 eth1  Out IP 10.0.13.3.42552 > 10.0.13.2.3784: BFDv1, Control, State Up, Flags: [none], length: 24
 00:00:03.252806 eth1  In  IP 10.0.13.2.32837 > 10.0.13.3.3784: BFDv1, Control, State Up, Flags: [none], length: 24
 00:00:03.260120 eth2  In  IP 10.0.23.2.41179 > 10.0.23.3.3784: BFDv1, Control, State Up, Flags: [none], length: 24
 00:00:03.264413 eth2  Out IP 10.0.23.3.59324 > 10.0.23.2.3784: BFDv1, Control, State Up, Flags: [none], length: 24
 00:00:03.273627 eth0  Out IP 10.0.35.2.59307 > 10.0.35.3.3784: BFDv1, Control, State Up, Flags: [none], length: 24
 00:00:03.296818 eth0  In  IP 10.0.35.3.48498 > 10.0.35.2.3784: BFDv1, Control, State Up, Flags: [none], length: 24
 00:00:03.331008 eth1  Out IP 10.0.13.3.42552 > 10.0.13.2.3784: BFDv1, Control, State Up, Flags: [none], length: 24
 00:00:03.334188 eth1  In  IP 10.0.13.2.32837 > 10.0.13.3.3784: BFDv1, Control, State Up, Flags: [none], length: 24
 00:00:03.341373 eth2  Out IP 10.0.23.3.59324 > 10.0.23.2.3784: BFDv1, Control, State Up, Flags: [none], length: 24
 00:00:03.345561 eth2  In  IP 10.0.23.2.41179 > 10.0.23.3.3784: BFDv1, Control, State Up, Flags: [none], length: 24
 00:00:03.348762 eth0  Out IP 10.0.35.2.59307 > 10.0.35.3.3784: BFDv1, Control, State Up, Flags: [none], length: 24
 00:00:03.385998 eth0  In  IP 10.0.35.3.48498 > 10.0.35.2.3784: BFDv1, Control, State Up, Flags: [none], length: 24
 00:00:03.419306 eth1  Out IP 10.0.13.3.42552 > 10.0.13.2.3784: BFDv1, Control, State Up, Flags: [none], length: 24
 00:00:03.421525 eth2  Out IP 10.0.23.3.59324 > 10.0.23.2.3784: BFDv1, Control, State Up, Flags: [none], length: 24
 00:00:03.421547 eth1  In  IP 10.0.13.2.32837 > 10.0.13.3.3784: BFDv1, Control, State Up, Flags: [none], length: 24
 00:00:03.427788 eth2  In  IP 10.0.23.2.41179 > 10.0.23.3.3784: BFDv1, Control, State Up, Flags: [none], length: 24
 00:00:03.430030 eth0  Out IP 10.0.35.2.59307 > 10.0.35.3.3784: BFDv1, Control, State Up, Flags: [none], length: 24
 00:00:03.466218 eth0  In  IP 10.0.35.3.48498 > 10.0.35.2.3784: BFDv1, Control, State Up, Flags: [none], length: 24
 00:00:03.497319 eth1  In  IP 10.0.13.2.32837 > 10.0.13.3.3784: BFDv1, Control, State Up, Flags: [none], length: 24
 00:00:03.499626 eth2  Out IP 10.0.23.3.59324 > 10.0.23.2.3784: BFDv1, Control, State Up, Flags: [none], length: 24
 00:00:03.505835 eth1  Out IP 10.0.13.3.42552 > 10.0.13.2.3784: BFDv1, Control, State Up, Flags: [none], length: 24
 00:00:03.511517 eth2  In  IP 10.0.23.2.41179 > 10.0.23.3.3784: BFDv1, Control, State Up, Flags: [none], length: 24
 00:00:03.518780 eth0  Out IP 10.0.35.2.59307 > 10.0.35.3.3784: BFDv1, Control, State Up, Flags: [none], length: 24
 00:00:03.551944 eth0  In  IP 10.0.35.3.48498 > 10.0.35.2.3784: BFDv1, Control, State Up, Flags: [none], length: 24
 00:00:03.582387 eth1  In  IP 10.0.13.2.32837 > 10.0.13.3.3784: BFDv1, Control, State Up, Flags: [none], length: 24
 00:00:03.584649 eth2  Out IP 10.0.23.3.59324 > 10.0.23.2.3784: BFDv1, Control, State Up, Flags: [none], length: 24
 00:00:03.586825 eth1  Out IP 10.0.13.3.42552 > 10.0.13.2.3784: BFDv1, Control, State Up, Flags: [none], length: 24
 00:00:03.586841 eth2  In  IP 10.0.23.2.41179 > 10.0.23.3.3784: BFDv1, Control, State Up, Flags: [none], length: 24
 00:00:03.602016 eth0  Out IP 10.0.35.2.59307 > 10.0.35.3.3784: BFDv1, Control, State Up, Flags: [none], length: 24
 00:00:03.631194 eth0  In  IP 10.0.35.3.48498 > 10.0.35.2.3784: BFDv1, Control, State Up, Flags: [none], length: 24
 00:00:03.659917 eth1  In  IP 10.0.13.2.32837 > 10.0.13.3.3784: BFDv1, Control, State Up, Flags: [none], length: 24
 00:00:03.666194 eth2  Out IP 10.0.23.3.59324 > 10.0.23.2.3784: BFDv1, Control, State Up, Flags: [none], length: 24
 00:00:03.670392 eth1  Out IP 10.0.13.3.42552 > 10.0.13.2.3784: BFDv1, Control, State Up, Flags: [none], length: 24
 00:00:03.672328 eth2  In  IP 10.0.23.2.41179 > 10.0.23.3.3784: BFDv1, Control, State Up, Flags: [none], length: 24
 00:00:03.683548 eth0  Out IP 10.0.35.2.59307 > 10.0.35.3.3784: BFDv1, Control, State Up, Flags: [none], length: 24
 00:00:03.712732 eth0  In  IP 10.0.35.3.48498 > 10.0.35.2.3784: BFDv1, Control, State Up, Flags: [none], length: 24
 00:00:03.741562 eth1  In  IP 10.0.13.2.32837 > 10.0.13.3.3784: BFDv1, Control, State Up, Flags: [none], length: 24
 00:00:03.751799 eth2  Out IP 10.0.23.3.59324 > 10.0.23.2.3784: BFDv1, Control, State Up, Flags: [none], length: 24
 00:00:03.756618 eth2  In  IP 10.0.23.2.41179 > 10.0.23.3.3784: BFDv1, Control, State Up, Flags: [none], length: 24
 00:00:03.759780 eth1  Out IP 10.0.13.3.42552 > 10.0.13.2.3784: BFDv1, Control, State Up, Flags: [none], length: 24
 00:00:03.764949 eth0  Out IP 10.0.35.2.59307 > 10.0.35.3.3784: BFDv1, Control, State Up, Flags: [none], length: 24
 00:00:03.793150 eth0  In  IP 10.0.35.3.48498 > 10.0.35.2.3784: BFDv1, Control, State Up, Flags: [none], length: 24
 00:00:03.825980 eth1  In  IP 10.0.13.2.32837 > 10.0.13.3.3784: BFDv1, Control, State Up, Flags: [none], length: 24
 00:00:03.828136 eth2  Out IP 10.0.23.3.59324 > 10.0.23.2.3784: BFDv1, Control, State Up, Flags: [none], length: 24
 00:00:03.832251 eth2  In  IP 10.0.23.2.41179 > 10.0.23.3.3784: BFDv1, Control, State Up, Flags: [none], length: 24
 00:00:03.837444 eth1  Out IP 10.0.13.3.42552 > 10.0.13.2.3784: BFDv1, Control, State Up, Flags: [none], length: 24
 00:00:03.853567 eth0  Out IP 10.0.35.2.59307 > 10.0.35.3.3784: BFDv1, Control, State Up, Flags: [none], length: 24
 00:00:03.869844 eth0  In  IP 10.0.35.3.48498 > 10.0.35.2.3784: BFDv1, Control, State Up, Flags: [none], length: 24
 00:00:03.912038 eth1  Out IP 10.0.13.3.42552 > 10.0.13.2.3784: BFDv1, Control, State Up, Flags: [none], length: 24
 00:00:03.915926 eth1  In  IP 10.0.13.2.32837 > 10.0.13.3.3784: BFDv1, Control, State Up, Flags: [none], length: 24
 00:00:03.916044 eth2  Out IP 10.0.23.3.59324 > 10.0.23.2.3784: BFDv1, Control, State Up, Flags: [none], length: 24
 00:00:03.922233 eth2  In  IP 10.0.23.2.41179 > 10.0.23.3.3784: BFDv1, Control, State Up, Flags: [none], length: 24
 00:00:03.936468 eth0  Out IP 10.0.35.2.59307 > 10.0.35.3.3784: BFDv1, Control, State Up, Flags: [none], length: 24
 00:00:03.949634 eth0  In  IP 10.0.35.3.48498 > 10.0.35.2.3784: BFDv1, Control, State Up, Flags: [none], length: 24
 00:00:03.993834 eth2  Out IP 10.0.23.3.59324 > 10.0.23.2.3784: BFDv1, Control, State Up, Flags: [none], length: 24
