tcpdump: data link type LINUX_SLL2
tcpdump: verbose output suppressed, use -v[v]... for full protocol decode
listening on any, link-type LINUX_SLL2 (Linux cooked v2), snapshot length 262144 bytes
 00:00:00.000000 eth1  Out IP 10.0.29.2.59999 > 10.0.29.3.3784: BFDv1, Control, State Up, Flags: [none], length: 24
 00:00:00.030231 eth1  In  IP 10.0.29.3.51259 > 10.0.29.2.3784: BFDv1, Control, State Up, Flags: [none], length: 24
 00:00:00.080665 eth1  Out IP 10.0.29.2.59999 > 10.0.29.3.3784: BFDv1, Control, State Up, Flags: [none], length: 24
 00:00:00.119097 eth1  In  IP 10.0.29.3.51259 > 10.0.29.2.3784: BFDv1, Control, State Up, Flags: [none], length: 24
 00:00:00.157510 eth1  Out IP 10.0.29.2.59999 > 10.0.29.3.3784: BFDv1, Control, State Up, Flags: [none], length: 24
 00:00:00.195192 eth1  In  IP 10.0.29.3.51259 > 10.0.29.2.3784: BFDv1, Control, State Up, Flags: [none], length: 24
 00:00:00.236599 eth1  Out IP 10.0.29.2.59999 > 10.0.29.3.3784: BFDv1, Control, State Up, Flags: [none], length: 24
 00:00:00.272058 eth1  In  IP 10.0.29.3.51259 > 10.0.29.2.3784: BFDv1, Control, State Up, Flags: [none], length: 24
 00:00:00.311450 eth1  Out IP 10.0.29.2.59999 > 10.0.29.3.3784: BFDv1, Control, State Up, Flags: [none], length: 24
 00:00:00.351925 eth1  In  IP 10.0.29.3.51259 > 10.0.29.2.3784: BFDv1, Control, State Up, Flags: [none], length: 24
 00:00:00.397449 eth1  Out IP 10.0.29.2.59999 > 10.0.29.3.3784: BFDv1, Control, State Up, Flags: [none], length: 24
 00:00:00.441434 eth1  In  IP 10.0.29.3.51259 > 10.0.29.2.3784: BFDv1, Control, State Up, Flags: [none], length: 24
 00:00:00.477890 eth1  Out IP 10.0.29.2.59999 > 10.0.29.3.3784: BFDv1, Control, State Up, Flags: [none], length: 24
 00:00:00.520397 eth1  In  IP 10.0.29.3.51259 > 10.0.29.2.3784: BFDv1, Control, State Up, Flags: [none], length: 24
 00:00:00.553012 eth1  Out IP 10.0.29.2.59999 > 10.0.29.3.3784: BFDv1, Control, State Up, Flags: [none], length: 24
 00:00:00.606097 eth1  In  IP 10.0.29.3.51259 > 10.0.29.2.3784: BFDv1, Control, State Up, Flags: [none], length: 24
 00:00:00.630510 eth1  Out IP 10.0.29.2.59999 > 10.0.29.3.3784: BFDv1, Control, State Up, Flags: [none], length: 24
 00:00:00.682312 eth1  In  IP 10.0.29.3.51259 > 10.0.29.2.3784: BFDv1, Control, State Up, Flags: [none], length: 24
 00:00:00.717732 eth1  Out IP 10.0.29.2.59999 > 10.0.29.3.3784: BFDv1, Control, State Up, Flags: [none], length: 24
 00:00:00.761109 eth1  In  IP 10.0.29.3.51259 > 10.0.29.2.3784: BFDv1, Control, State Up, Flags: [none], length: 24
 00:00:00.803451 eth1  Out IP 10.0.29.2.59999 > 10.0.29.3.3784: BFDv1, Control, State Up, Flags: [none], length: 24
 00:00:00.837760 eth1  In  IP 10.0.29.3.51259 > 10.0.29.2.3784: BFDv1, Control, State Up, Flags: [none], length: 24
 00:00:00.883183 eth1  Out IP 10.0.29.2.59999 > 10.0.29.3.3784: BFDv1, Control, State Up, Flags: [none], length: 24
 00:00:00.924495 eth1  In  IP 10.0.29.3.51259 > 10.0.29.2.3784: BFDv1, Control, State Up, Flags: [none], length: 24
 00:00:00.968868 eth1  Out IP 10.0.29.2.59999 > 10.0.29.3.3784: BFDv1, Control, State Up, Flags: [none], length: 24
 00:00:01.005156 eth1  In  IP 10.0.29.3.51259 > 10.0.29.2.3784: BFDv1, Control, State Up, Flags: [none], length: 24
 00:00:01.044834 eth1  Out IP 10.0.29.2.59999 > 10.0.29.3.3784: BFDv1, Control, State Up, Flags: [none], length: 24
 00:00:01.082075 eth1  In  IP 10.0.29.3.51259 > 10.0.29.2.3784: BFDv1, Control, State Up, Flags: [none], length: 24
 00:00:01.130424 eth1  Out IP 10.0.29.2.59999 > 10.0.29.3.3784: BFDv1, Control, State Up, Flags: [none], length: 24
 00:00:01.163651 eth1  In  IP 10.0.29.3.51259 > 10.0.29.2.3784: BFDv1, Control, State Up, Flags: [none], length: 24
 00:00:01.211085 eth1  Out IP 10.0.29.2.59999 > 10.0.29.3.3784: BFDv1, Control, State Up, Flags: [none], length: 24
 00:00:01.240322 eth1  In  IP 10.0.29.3.51259 > 10.0.29.2.3784: BFDv1, Control, State Up, Flags: [none], length: 24
 00:00:01.297763 eth1  Out IP 10.0.29.2.59999 > 10.0.29.3.3784: BFDv1, Control, State Up, Flags: [none], length: 24
 00:00:01.315190 eth1  In  IP 10.0.29.3.51259 > 10.0.29.2.3784: BFDv1, Control, State Up, Flags: [none], length: 24
 00:00:01.380535 eth1  Out IP 10.0.29.2.59999 > 10.0.29.3.3784: BFDv1, Control, State Up, Flags: [none], length: 24
 00:00:01.396863 eth1  In  IP 10.0.29.3.51259 > 10.0.29.2.3784: BFDv1, Control, State Up, Flags: [none], length: 24
 00:00:01.464249 eth1  Out IP 10.0.29.2.59999 > 10.0.29.3.3784: BFDv1, Control, State Up, Flags: [none], length: 24
 00:00:01.472431 eth1  In  IP 10.0.29.3.51259 > 10.0.29.2.3784: BFDv1, Control, State Up, Flags: [none], length: 24
 00:00:01.549813 eth1  In  IP 10.0.29.3.51259 > 10.0.29.2.3784: BFDv1, Control, State Up, Flags: [none], length: 24
 00:00:01.552148 eth1  Out IP 10.0.29.2.59999 > 10.0.29.3.3784: BFDv1, Control, State Up, Flags: [none], length: 24
 00:00:01.625739 eth1  In  IP 10.0.29.3.51259 > 10.0.29.2.3784: BFDv1, Control, State Up, Flags: [none], length: 24
 00:00:01.638074 eth1  Out IP 10.0.29.2.59999 > 10.0.29.3.3784: BFDv1, Control, State Up, Flags: [none], length: 24
 00:00:01.708530 eth1  In  IP 10.0.29.3.51259 > 10.0.29.2.3784: BFDv1, Control, State Up, Flags: [none], length: 24
 00:00:01.719044 eth1  Out IP 10.0.29.2.59999 > 10.0.29.3.3784: BFDv1, Control, State Up, Flags: [none], length: 24
 00:00:01.795329 eth1  Out IP 10.0.29.2.59999 > 10.0.29.3.3784: BFDv1, Control, State Up, Flags: [none], length: 24
 00:00:01.795452 eth1  In  IP 10.0.29.3.51259 > 10.0.29.2.3784: BFDv1, Control, State Up, Flags: [none], length: 24
 00:00:01.874796 eth1  In  IP 10.0.29.3.51259 > 10.0.29.2.3784: BFDv1, Control, State Up, Flags: [none], length: 24
 00:00:01.883218 eth1  Out IP 10.0.29.2.59999 > 10.0.29.3.3784: BFDv1, Control, State Up, Flags: [none], length: 24
 00:00:01.958238 eth1  In  IP 10.0.29.3.51259 > 10.0.29.2.3784: BFDv1, Control, State Up, Flags: [none], length: 24
 00:00:01.966807 eth1  Out IP 10.0.29.2.59999 > 10.0.29.3.3784: BFDv1, Control, State Up, Flags: [none], length: 24
 00:00:02.029620 eth2  Out IP 10.0.29.2.179 > 10.0.29.3.34127: Flags [P.], seq 205671735:205671756, ack 945576077, win 64, options [nop,nop,TS val 1876848312 ecr 3829587653], length 21: BGP
 00:00:02.029750 eth2  Out IP 10.0.29.2.179 > 10.0.29.3.34127: Flags [F.], seq 21, ack 1, win 64, options [nop,nop,TS val 1876848312 ecr 3829587653], length 0
 00:00:02.029802 eth2  Out IP 10.0.12.3.51192 > 10.0.12.2.179: Flags [P.], seq 221768932:221768967, ack 3568889796, win 63, options [nop,nop,TS val 627205702 ecr 398049793], length 35: BGP
 00:00:02.029854 eth2  In  IP 10.0.12.2.179 > 10.0.12.3.51192: Flags [.], ack 35, win 64, options [nop,nop,TS val 398057058 ecr 627205702], length 0
 00:00:02.029885 eth2  Out IP 10.0.12.3.51192 > 10.0.12.2.179: Flags [P.], seq 35:80, ack 1, win 63, options [nop,nop,TS val 627205703 ecr 398057058], length 45: BGP
 00:00:02.029897 eth2  In  IP 10.0.12.2.179 > 10.0.12.3.51192: Flags [.], ack 80, win 64, options [nop,nop,TS val 398057059 ecr 627205703], length 0
 00:00:02.030289 eth2  In  IP 10.0.12.2.179 > 10.0.12.3.51192: Flags [P.], seq 1:55, ack 80, win 64, options [nop,nop,TS val 398057059 ecr 627205703], length 54: BGP
 00:00:02.030299 eth2  Out IP 10.0.12.3.51192 > 10.0.12.2.179: Flags [.], ack 55, win 63, options [nop,nop,TS val 627205703 ecr 398057059], length 0
 00:00:02.038870 eth2  Out IP 10.0.29.2.179 > 10.0.29.3.34127: Flags [F.], seq 21, ack 1, win 64, options [nop,nop,TS val 1876848322 ecr 3829587653], length 0
 00:00:02.248873 eth2  Out IP 10.0.29.2.179 > 10.0.29.3.34127: Flags [FP.], seq 0:21, ack 1, win 64, options [nop,nop,TS val 1876848532 ecr 3829587653], length 21: BGP
 00:00:02.663875 eth2  Out IP 10.0.29.2.179 > 10.0.29.3.34127: Flags [FP.], seq 0:21, ack 1, win 64, options [nop,nop,TS val 1876848947 ecr 3829587653], length 21: BGP
 00:00:03.527900 eth2  Out IP 10.0.29.2.179 > 10.0.29.3.34127: Flags [FP.], seq 0:21, ack 1, win 64, options [nop,nop,TS val 1876849811 ecr 3829587653], length 21: BGP
 00:00:05.191857 eth2  Out IP 10.0.29.2.179 > 10.0.29.3.34127: Flags [FP.], seq 0:21, ack 1, win 64, options [nop,nop,TS val 1876851475 ecr 3829587653], length 21: BGP
 00:00:08.519891 eth2  Out IP 10.0.29.2.179 > 10.0.29.3.34127: Flags [FP.], seq 0:21, ack 1, win 64, options [nop,nop,TS val 1876854803 ecr 3829587653], length 21: BGP
 00:00:10.117583 eth2  Out IP 10.0.12.3.51192 > 10.0.12.2.179: Flags [P.], seq 80:128, ack 55, win 63, options [nop,nop,TS val 627213790 ecr 398057059], length 48: BGP
 00:00:10.118093 eth1  Out IP 10.0.29.2.34587 > 10.0.29.3.3784: BFDv1, Control, State Down, Flags: [none], length: 24
 00:00:10.118547 eth2  In  IP 10.0.12.2.179 > 10.0.12.3.51192: Flags [P.], seq 55:82, ack 128, win 64, options [nop,nop,TS val 398065147 ecr 627213790], length 27: BGP
 00:00:10.118572 eth2  Out IP 10.0.12.3.51192 > 10.0.12.2.179: Flags [.], ack 82, win 63, options [nop,nop,TS val 627213791 ecr 398065147], length 0
 00:00:10.119260 eth2  Out IP 10.0.12.3.51192 > 10.0.12.2.179: Flags [P.], seq 128:173, ack 82, win 63, options [nop,nop,TS val 627213792 ecr 398065147], length 45: BGP
 00:00:10.160899 eth2  In  IP 10.0.12.2.179 > 10.0.12.3.51192: Flags [.], ack 173, win 64, options [nop,nop,TS val 398065190 ecr 627213792], length 0
 00:00:10.470899 eth1  In  IP 10.0.29.3.53368 > 10.0.29.2.3784: BFDv1, Control, State Init, Flags: [none], length: 24
 00:00:10.471030 eth1  Out IP 10.0.29.2.34587 > 10.0.29.3.3784: BFDv1, Control, State Up, Flags: [Poll], length: 24
 00:00:10.471072 eth1  In  IP 10.0.29.3.53368 > 10.0.29.2.3784: BFDv1, Control, State Up, Flags: [Final], length: 24
 00:00:10.471086 eth1  In  IP 10.0.29.3.53368 > 10.0.29.2.3784: BFDv1, Control, State Up, Flags: [Poll], length: 24
 00:00:10.471114 eth1  Out IP 10.0.29.2.34587 > 10.0.29.3.3784: BFDv1, Control, State Up, Flags: [Final], length: 24
 00:00:10.547345 eth1  Out IP 10.0.29.2.34587 > 10.0.29.3.3784: BFDv1, Control, State Up, Flags: [none], length: 24
 00:00:10.557584 eth1  In  IP 10.0.29.3.53368 > 10.0.29.2.3784: BFDv1, Control, State Up, Flags: [none], length: 24
 00:00:10.635182 eth1  In  IP 10.0.29.3.53368 > 10.0.29.2.3784: BFDv1, Control, State Up, Flags: [none], length: 24
 00:00:10.635363 eth1  Out IP 10.0.29.2.34587 > 10.0.29.3.3784: BFDv1, Control, State Up, Flags: [none], length: 24
 00:00:10.712997 eth1  In  IP 10.0.29.3.53368 > 10.0.29.2.3784: BFDv1, Control, State Up, Flags: [none], length: 24
 00:00:10.721240 eth1  Out IP 10.0.29.2.34587 > 10.0.29.3.3784: BFDv1, Control, State Up, Flags: [none], length: 24
 00:00:10.789845 eth1  In  IP 10.0.29.3.53368 > 10.0.29.2.3784: BFDv1, Control, State Up, Flags: [none], length: 24
 00:00:10.797210 eth1  Out IP 10.0.29.2.34587 > 10.0.29.3.3784: BFDv1, Control, State Up, Flags: [none], length: 24
 00:00:10.878804 eth1  In  IP 10.0.29.3.53368 > 10.0.29.2.3784: BFDv1, Control, State Up, Flags: [none], length: 24
 00:00:10.887123 eth1  Out IP 10.0.29.2.34587 > 10.0.29.3.3784: BFDv1, Control, State Up, Flags: [none], length: 24
 00:00:10.968841 eth1  In  IP 10.0.29.3.53368 > 10.0.29.2.3784: BFDv1, Control, State Up, Flags: [none], length: 24
 00:00:10.970078 eth1  Out IP 10.0.29.2.34587 > 10.0.29.3.3784: BFDv1, Control, State Up, Flags: [none], length: 24
 00:00:11.050621 eth1  In  IP 10.0.29.3.53368 > 10.0.29.2.3784: BFDv1, Control, State Up, Flags: [none], length: 24
 00:00:11.057944 eth1  Out IP 10.0.29.2.34587 > 10.0.29.3.3784: BFDv1, Control, State Up, Flags: [none], length: 24
 00:00:11.134598 eth1  In  IP 10.0.29.3.53368 > 10.0.29.2.3784: BFDv1, Control, State Up, Flags: [none], length: 24
 00:00:11.135875 eth1  Out IP 10.0.29.2.34587 > 10.0.29.3.3784: BFDv1, Control, State Up, Flags: [none], length: 24
 00:00:11.215121 eth1  Out IP 10.0.29.2.34587 > 10.0.29.3.3784: BFDv1, Control, State Up, Flags: [none], length: 24
 00:00:11.220306 eth1  In  IP 10.0.29.3.53368 > 10.0.29.2.3784: BFDv1, Control, State Up, Flags: [none], length: 24
 00:00:11.303588 eth1  Out IP 10.0.29.2.34587 > 10.0.29.3.3784: BFDv1, Control, State Up, Flags: [none], length: 24
 00:00:11.304848 eth1  In  IP 10.0.29.3.53368 > 10.0.29.2.3784: BFDv1, Control, State Up, Flags: [none], length: 24
 00:00:11.391492 eth1  In  IP 10.0.29.3.53368 > 10.0.29.2.3784: BFDv1, Control, State Up, Flags: [none], length: 24
 00:00:11.391608 eth1  Out IP 10.0.29.2.34587 > 10.0.29.3.3784: BFDv1, Control, State Up, Flags: [none], length: 24
 00:00:11.468117 eth1  In  IP 10.0.29.3.53368 > 10.0.29.2.3784: BFDv1, Control, State Up, Flags: [none], length: 24
 00:00:11.476104 eth1  Out IP 10.0.29.2.34587 > 10.0.29.3.3784: BFDv1, Control, State Up, Flags: [none], length: 24
 00:00:11.556001 eth1  In  IP 10.0.29.3.53368 > 10.0.29.2.3784: BFDv1, Control, State Up, Flags: [none], length: 24
 00:00:11.561375 eth1  Out IP 10.0.29.2.34587 > 10.0.29.3.3784: BFDv1, Control, State Up, Flags: [none], length: 24
 00:00:11.637122 eth1  In  IP 10.0.29.3.53368 > 10.0.29.2.3784: BFDv1, Control, State Up, Flags: [none], length: 24
 00:00:11.642379 eth1  Out IP 10.0.29.2.34587 > 10.0.29.3.3784: BFDv1, Control, State Up, Flags: [none], length: 24
 00:00:11.717037 eth1  In  IP 10.0.29.3.53368 > 10.0.29.2.3784: BFDv1, Control, State Up, Flags: [none], length: 24
 00:00:11.720338 eth1  Out IP 10.0.29.2.34587 > 10.0.29.3.3784: BFDv1, Control, State Up, Flags: [none], length: 24
 00:00:11.802573 eth1  Out IP 10.0.29.2.34587 > 10.0.29.3.3784: BFDv1, Control, State Up, Flags: [none], length: 24
 00:00:11.802667 eth1  In  IP 10.0.29.3.53368 > 10.0.29.2.3784: BFDv1, Control, State Up, Flags: [none], length: 24
 00:00:11.879917 eth1  Out IP 10.0.29.2.34587 > 10.0.29.3.3784: BFDv1, Control, State Up, Flags: [none], length: 24
 00:00:11.886067 eth1  In  IP 10.0.29.3.53368 > 10.0.29.2.3784: BFDv1, Control, State Up, Flags: [none], length: 24
 00:00:11.962328 eth1  Out IP 10.0.29.2.34587 > 10.0.29.3.3784: BFDv1, Control, State Up, Flags: [none], length: 24
 00:00:11.974507 eth1  In  IP 10.0.29.3.53368 > 10.0.29.2.3784: BFDv1, Control, State Up, Flags: [none], length: 24
 00:00:12.044763 eth1  Out IP 10.0.29.2.34587 > 10.0.29.3.3784: BFDv1, Control, State Up, Flags: [none], length: 24
 00:00:12.059035 eth1  In  IP 10.0.29.3.53368 > 10.0.29.2.3784: BFDv1, Control, State Up, Flags: [none], length: 24
 00:00:12.120264 eth1  Out IP 10.0.29.2.34587 > 10.0.29.3.3784: BFDv1, Control, State Up, Flags: [none], length: 24
 00:00:12.133460 eth1  In  IP 10.0.29.3.53368 > 10.0.29.2.3784: BFDv1, Control, State Up, Flags: [none], length: 24
 00:00:12.209750 eth1  Out IP 10.0.29.2.34587 > 10.0.29.3.3784: BFDv1, Control, State Up, Flags: [none], length: 24
 00:00:12.221892 eth1  In  IP 10.0.29.3.53368 > 10.0.29.2.3784: BFDv1, Control, State Up, Flags: [none], length: 24
 00:00:12.299145 eth1  Out IP 10.0.29.2.34587 > 10.0.29.3.3784: BFDv1, Control, State Up, Flags: [none], length: 24
 00:00:12.299216 eth1  In  IP 10.0.29.3.53368 > 10.0.29.2.3784: BFDv1, Control, State Up, Flags: [none], length: 24
 00:00:12.375684 eth1  In  IP 10.0.29.3.53368 > 10.0.29.2.3784: BFDv1, Control, State Up, Flags: [none], length: 24
 00:00:12.376951 eth1  Out IP 10.0.29.2.34587 > 10.0.29.3.3784: BFDv1, Control, State Up, Flags: [none], length: 24
 00:00:12.455159 eth1  Out IP 10.0.29.2.34587 > 10.0.29.3.3784: BFDv1, Control, State Up, Flags: [none], length: 24
 00:00:12.456325 eth1  In  IP 10.0.29.3.53368 > 10.0.29.2.3784: BFDv1, Control, State Up, Flags: [none], length: 24
 00:00:12.544379 eth1  In  IP 10.0.29.3.53368 > 10.0.29.2.3784: BFDv1, Control, State Up, Flags: [none], length: 24
 00:00:12.545565 eth1  Out IP 10.0.29.2.34587 > 10.0.29.3.3784: BFDv1, Control, State Up, Flags: [none], length: 24
 00:00:12.629814 eth1  In  IP 10.0.29.3.53368 > 10.0.29.2.3784: BFDv1, Control, State Up, Flags: [none], length: 24
 00:00:12.632108 eth1  Out IP 10.0.29.2.34587 > 10.0.29.3.3784: BFDv1, Control, State Up, Flags: [none], length: 24
 00:00:12.711312 eth1  Out IP 10.0.29.2.34587 > 10.0.29.3.3784: BFDv1, Control, State Up, Flags: [none], length: 24
 00:00:12.713497 eth1  In  IP 10.0.29.3.53368 > 10.0.29.2.3784: BFDv1, Control, State Up, Flags: [none], length: 24
 00:00:12.787773 eth1  Out IP 10.0.29.2.34587 > 10.0.29.3.3784: BFDv1, Control, State Up, Flags: [none], length: 24
 00:00:12.796962 eth1  In  IP 10.0.29.3.53368 > 10.0.29.2.3784: BFDv1, Control, State Up, Flags: [none], length: 24
 00:00:12.873944 eth1  In  IP 10.0.29.3.53368 > 10.0.29.2.3784: BFDv1, Control, State Up, Flags: [none], length: 24
 00:00:12.874070 eth1  Out IP 10.0.29.2.34587 > 10.0.29.3.3784: BFDv1, Control, State Up, Flags: [none], length: 24
 00:00:12.950228 eth1  In  IP 10.0.29.3.53368 > 10.0.29.2.3784: BFDv1, Control, State Up, Flags: [none], length: 24
 00:00:12.956583 eth1  Out IP 10.0.29.2.34587 > 10.0.29.3.3784: BFDv1, Control, State Up, Flags: [none], length: 24
 00:00:13.036814 eth1  Out IP 10.0.29.2.34587 > 10.0.29.3.3784: BFDv1, Control, State Up, Flags: [none], length: 24
 00:00:13.038972 eth1  In  IP 10.0.29.3.53368 > 10.0.29.2.3784: BFDv1, Control, State Up, Flags: [none], length: 24
 00:00:13.119005 eth1  In  IP 10.0.29.3.53368 > 10.0.29.2.3784: BFDv1, Control, State Up, Flags: [none], length: 24
 00:00:13.123280 eth1  Out IP 10.0.29.2.34587 > 10.0.29.3.3784: BFDv1, Control, State Up, Flags: [none], length: 24
 00:00:13.203516 eth1  Out IP 10.0.29.2.34587 > 10.0.29.3.3784: BFDv1, Control, State Up, Flags: [none], length: 24
 00:00:13.206669 eth1  In  IP 10.0.29.3.53368 > 10.0.29.2.3784: BFDv1, Control, State Up, Flags: [none], length: 24
 00:00:13.278900 eth1  Out IP 10.0.29.2.34587 > 10.0.29.3.3784: BFDv1, Control, State Up, Flags: [none], length: 24
 00:00:13.282027 eth1  In  IP 10.0.29.3.53368 > 10.0.29.2.3784: BFDv1, Control, State Up, Flags: [none], length: 24
 00:00:13.361061 eth1  In  IP 10.0.29.3.53368 > 10.0.29.2.3784: BFDv1, Control, State Up, Flags: [none], length: 24
 00:00:13.367305 eth1  Out IP 10.0.29.2.34587 > 10.0.29.3.3784: BFDv1, Control, State Up, Flags: [none], length: 24
 00:00:13.446547 eth1  Out IP 10.0.29.2.34587 > 10.0.29.3.3784: BFDv1, Control, State Up, Flags: [none], length: 24
 00:00:13.449807 eth1  In  IP 10.0.29.3.53368 > 10.0.29.2.3784: BFDv1, Control, State Up, Flags: [none], length: 24
 00:00:13.524231 eth1  In  IP 10.0.29.3.53368 > 10.0.29.2.3784: BFDv1, Control, State Up, Flags: [none], length: 24
 00:00:13.530494 eth1  Out IP 10.0.29.2.34587 > 10.0.29.3.3784: BFDv1, Control, State Up, Flags: [none], length: 24
 00:00:13.607097 eth1  In  IP 10.0.29.3.53368 > 10.0.29.2.3784: BFDv1, Control, State Up, Flags: [none], length: 24
 00:00:13.615382 eth1  Out IP 10.0.29.2.34587 > 10.0.29.3.3784: BFDv1, Control, State Up, Flags: [none], length: 24
 00:00:13.693955 eth1  In  IP 10.0.29.3.53368 > 10.0.29.2.3784: BFDv1, Control, State Up, Flags: [none], length: 24
 00:00:13.699209 eth1  Out IP 10.0.29.2.34587 > 10.0.29.3.3784: BFDv1, Control, State Up, Flags: [none], length: 24
 00:00:13.780684 eth1  In  IP 10.0.29.3.53368 > 10.0.29.2.3784: BFDv1, Control, State Up, Flags: [none], length: 24
 00:00:13.785938 eth1  Out IP 10.0.29.2.34587 > 10.0.29.3.3784: BFDv1, Control, State Up, Flags: [none], length: 24
 00:00:13.868392 eth1  In  IP 10.0.29.3.53368 > 10.0.29.2.3784: BFDv1, Control, State Up, Flags: [none], length: 24
 00:00:13.868507 eth1  Out IP 10.0.29.2.34587 > 10.0.29.3.3784: BFDv1, Control, State Up, Flags: [none], length: 24
 00:00:13.945999 eth1  In  IP 10.0.29.3.53368 > 10.0.29.2.3784: BFDv1, Control, State Up, Flags: [none], length: 24
 00:00:13.950182 eth1  Out IP 10.0.29.2.34587 > 10.0.29.3.3784: BFDv1, Control, State Up, Flags: [none], length: 24
 00:00:14.025723 eth1  In  IP 10.0.29.3.53368 > 10.0.29.2.3784: BFDv1, Control, State Up, Flags: [none], length: 24
 00:00:14.030989 eth1  Out IP 10.0.29.2.34587 > 10.0.29.3.3784: BFDv1, Control, State Up, Flags: [none], length: 24
 00:00:14.108221 eth1  Out IP 10.0.29.2.34587 > 10.0.29.3.3784: BFDv1, Control, State Up, Flags: [none], length: 24
 00:00:14.111392 eth1  In  IP 10.0.29.3.53368 > 10.0.29.2.3784: BFDv1, Control, State Up, Flags: [none], length: 24
 00:00:14.194680 eth1  Out IP 10.0.29.2.34587 > 10.0.29.3.3784: BFDv1, Control, State Up, Flags: [none], length: 24
 00:00:14.197859 eth1  In  IP 10.0.29.3.53368 > 10.0.29.2.3784: BFDv1, Control, State Up, Flags: [none], length: 24
 00:00:14.279110 eth1  Out IP 10.0.29.2.34587 > 10.0.29.3.3784: BFDv1, Control, State Up, Flags: [none], length: 24
 00:00:14.285306 eth1  In  IP 10.0.29.3.53368 > 10.0.29.2.3784: BFDv1, Control, State Up, Flags: [none], length: 24
 00:00:14.362634 eth1  Out IP 10.0.29.2.34587 > 10.0.29.3.3784: BFDv1, Control, State Up, Flags: [none], length: 24
 00:00:14.369802 eth1  In  IP 10.0.29.3.53368 > 10.0.29.2.3784: BFDv1, Control, State Up, Flags: [none], length: 24
 00:00:14.413562 eth1  Out IP 10.0.29.2.60409 > 10.0.29.3.179: Flags [S], seq 203607002, win 64240, options [mss 1460,sackOK,TS val 1876860696 ecr 0,nop,wscale 10], length 0
 00:00:14.413602 eth1  In  IP 10.0.29.3.179 > 10.0.29.2.60409: Flags [S.], seq 4098815573, ack 203607003, win 65160, options [mss 1460,sackOK,TS val 3829615670 ecr 1876860696,nop,wscale 10], length 0
 00:00:14.413618 eth1  Out IP 10.0.29.2.60409 > 10.0.29.3.179: Flags [.], ack 1, win 63, options [nop,nop,TS val 1876860696 ecr 3829615670], length 0
 00:00:14.414892 eth1  In  IP 10.0.29.3.179 > 10.0.29.2.60409: Flags [F.], seq 1, ack 1, win 64, options [nop,nop,TS val 3829615672 ecr 1876860696], length 0
 00:00:14.414984 eth1  Out IP 10.0.29.2.60409 > 10.0.29.3.179: Flags [P.], seq 1:65, ack 2, win 63, options [nop,nop,TS val 1876860698 ecr 3829615672], length 64: BGP
 00:00:14.415005 eth1  In  IP 10.0.29.3.179 > 10.0.29.2.60409: Flags [R], seq 4098815575, win 0, length 0
 00:00:14.445820 eth1  In  IP 10.0.29.3.53368 > 10.0.29.2.3784: BFDv1, Control, State Up, Flags: [none], length: 24
 00:00:14.452080 eth1  Out IP 10.0.29.2.34587 > 10.0.29.3.3784: BFDv1, Control, State Up, Flags: [none], length: 24
 00:00:14.527266 eth1  Out IP 10.0.29.2.34587 > 10.0.29.3.3784: BFDv1, Control, State Up, Flags: [none], length: 24
 00:00:14.527276 eth1  In  IP 10.0.29.3.53368 > 10.0.29.2.3784: BFDv1, Control, State Up, Flags: [none], length: 24
 00:00:14.602503 eth1  Out IP 10.0.29.2.34587 > 10.0.29.3.3784: BFDv1, Control, State Up, Flags: [none], length: 24
 00:00:14.613734 eth1  In  IP 10.0.29.3.53368 > 10.0.29.2.3784: BFDv1, Control, State Up, Flags: [none], length: 24
 00:00:14.679009 eth1  Out IP 10.0.29.2.34587 > 10.0.29.3.3784: BFDv1, Control, State Up, Flags: [none], length: 24
 00:00:14.691250 eth1  In  IP 10.0.29.3.53368 > 10.0.29.2.3784: BFDv1, Control, State Up, Flags: [none], length: 24
 00:00:14.757569 eth1  Out IP 10.0.29.2.34587 > 10.0.29.3.3784: BFDv1, Control, State Up, Flags: [none], length: 24
 00:00:14.777762 eth1  In  IP 10.0.29.3.53368 > 10.0.29.2.3784: BFDv1, Control, State Up, Flags: [none], length: 24
 00:00:14.833050 eth1  Out IP 10.0.29.2.34587 > 10.0.29.3.3784: BFDv1, Control, State Up, Flags: [none], length: 24
 00:00:14.864239 eth1  In  IP 10.0.29.3.53368 > 10.0.29.2.3784: BFDv1, Control, State Up, Flags: [none], length: 24
 00:00:14.921484 eth1  Out IP 10.0.29.2.34587 > 10.0.29.3.3784: BFDv1, Control, State Up, Flags: [none], length: 24
 00:00:14.941663 eth1  In  IP 10.0.29.3.53368 > 10.0.29.2.3784: BFDv1, Control, State Up, Flags: [none], length: 24
 00:00:15.004013 eth1  Out IP 10.0.29.2.34587 > 10.0.29.3.3784: BFDv1, Control, State Up, Flags: [none], length: 24
 00:00:15.017156 eth1  In  IP 10.0.29.3.53368 > 10.0.29.2.3784: BFDv1, Control, State Up, Flags: [none], length: 24
 00:00:15.079462 eth1  Out IP 10.0.29.2.34587 > 10.0.29.3.3784: BFDv1, Control, State Up, Flags: [none], length: 24
 00:00:15.093958 eth1  In  IP 10.0.29.3.53368 > 10.0.29.2.3784: BFDv1, Control, State Up, Flags: [none], length: 24
 00:00:15.164246 eth1  Out IP 10.0.29.2.34587 > 10.0.29.3.3784: BFDv1, Control, State Up, Flags: [none], length: 24
 00:00:15.176511 eth1  In  IP 10.0.29.3.53368 > 10.0.29.2.3784: BFDv1, Control, State Up, Flags: [none], length: 24
 00:00:15.253786 eth1  Out IP 10.0.29.2.34587 > 10.0.29.3.3784: BFDv1, Control, State Up, Flags: [none], length: 24
 00:00:15.253911 eth1  In  IP 10.0.29.3.53368 > 10.0.29.2.3784: BFDv1, Control, State Up, Flags: [none], length: 24
 00:00:15.303890 eth1  Out IP 10.0.29.2.179 > 10.0.29.3.34127: Flags [FP.], seq 0:21, ack 1, win 64, options [nop,nop,TS val 1876861587 ecr 3829587653], length 21: BGP
 00:00:15.304000 eth1  In  IP 10.0.29.3.34127 > 10.0.29.2.179: Flags [R], seq 945576077, win 0, length 0
 00:00:15.330445 eth1  In  IP 10.0.29.3.53368 > 10.0.29.2.3784: BFDv1, Control, State Up, Flags: [none], length: 24
 00:00:15.334744 eth1  Out IP 10.0.29.2.34587 > 10.0.29.3.3784: BFDv1, Control, State Up, Flags: [none], length: 24
 00:00:15.407915 eth1  In  IP 10.0.29.3.53368 > 10.0.29.2.3784: BFDv1, Control, State Up, Flags: [none], length: 24
 00:00:15.417235 eth1  Out IP 10.0.29.2.34587 > 10.0.29.3.3784: BFDv1, Control, State Up, Flags: [none], length: 24
 00:00:15.492280 eth1  In  IP 10.0.29.3.53368 > 10.0.29.2.3784: BFDv1, Control, State Up, Flags: [none], length: 24
 00:00:15.495698 eth1  Out IP 10.0.29.2.34587 > 10.0.29.3.3784: BFDv1, Control, State Up, Flags: [none], length: 24
 00:00:15.573519 eth1  In  IP 10.0.29.3.53368 > 10.0.29.2.3784: BFDv1, Control, State Up, Flags: [none], length: 24
 00:00:15.577844 eth1  Out IP 10.0.29.2.34587 > 10.0.29.3.3784: BFDv1, Control, State Up, Flags: [none], length: 24
 00:00:15.652117 eth1  In  IP 10.0.29.3.53368 > 10.0.29.2.3784: BFDv1, Control, State Up, Flags: [none], length: 24
 00:00:15.657374 eth1  Out IP 10.0.29.2.34587 > 10.0.29.3.3784: BFDv1, Control, State Up, Flags: [none], length: 24
 00:00:15.737717 eth1  In  IP 10.0.29.3.53368 > 10.0.29.2.3784: BFDv1, Control, State Up, Flags: [none], length: 24
 00:00:15.741062 eth1  Out IP 10.0.29.2.34587 > 10.0.29.3.3784: BFDv1, Control, State Up, Flags: [none], length: 24
 00:00:15.816293 eth1  Out IP 10.0.29.2.34587 > 10.0.29.3.3784: BFDv1, Control, State Up, Flags: [none], length: 24
 00:00:15.819731 eth1  In  IP 10.0.29.3.53368 > 10.0.29.2.3784: BFDv1, Control, State Up, Flags: [none], length: 24
 00:00:15.899155 eth1  In  IP 10.0.29.3.53368 > 10.0.29.2.3784: BFDv1, Control, State Up, Flags: [none], length: 24
 00:00:15.905463 eth1  Out IP 10.0.29.2.34587 > 10.0.29.3.3784: BFDv1, Control, State Up, Flags: [none], length: 24
 00:00:15.980729 eth1  Out IP 10.0.29.2.34587 > 10.0.29.3.3784: BFDv1, Control, State Up, Flags: [none], length: 24
 00:00:15.982932 eth1  In  IP 10.0.29.3.53368 > 10.0.29.2.3784: BFDv1, Control, State Up, Flags: [none], length: 24
 00:00:16.068230 eth1  Out IP 10.0.29.2.34587 > 10.0.29.3.3784: BFDv1, Control, State Up, Flags: [none], length: 24
 00:00:16.069438 eth1  In  IP 10.0.29.3.53368 > 10.0.29.2.3784: BFDv1, Control, State Up, Flags: [none], length: 24
 00:00:16.149043 eth1  In  IP 10.0.29.3.53368 > 10.0.29.2.3784: BFDv1, Control, State Up, Flags: [none], length: 24
 00:00:16.150327 eth1  Out IP 10.0.29.2.34587 > 10.0.29.3.3784: BFDv1, Control, State Up, Flags: [none], length: 24
 00:00:16.227667 eth1  In  IP 10.0.29.3.53368 > 10.0.29.2.3784: BFDv1, Control, State Up, Flags: [none], length: 24
 00:00:16.231931 eth1  Out IP 10.0.29.2.34587 > 10.0.29.3.3784: BFDv1, Control, State Up, Flags: [none], length: 24
 00:00:16.310149 eth1  Out IP 10.0.29.2.34587 > 10.0.29.3.3784: BFDv1, Control, State Up, Flags: [none], length: 24
 00:00:16.315326 eth1  In  IP 10.0.29.3.53368 > 10.0.29.2.3784: BFDv1, Control, State Up, Flags: [none], length: 24
 00:00:16.393849 eth1  In  IP 10.0.29.3.53368 > 10.0.29.2.3784: BFDv1, Control, State Up, Flags: [none], length: 24
 00:00:16.395151 eth1  Out IP 10.0.29.2.34587 > 10.0.29.3.3784: BFDv1, Control, State Up, Flags: [none], length: 24
 00:00:16.473424 eth1  Out IP 10.0.29.2.34587 > 10.0.29.3.3784: BFDv1, Control, State Up, Flags: [none], length: 24
 00:00:16.477673 eth1  In  IP 10.0.29.3.53368 > 10.0.29.2.3784: BFDv1, Control, State Up, Flags: [none], length: 24
 00:00:16.552813 eth1  In  IP 10.0.29.3.53368 > 10.0.29.2.3784: BFDv1, Control, State Up, Flags: [none], length: 24
 00:00:16.560176 eth1  Out IP 10.0.29.2.34587 > 10.0.29.3.3784: BFDv1, Control, State Up, Flags: [none], length: 24
 00:00:16.632197 eth1  In  IP 10.0.29.3.53368 > 10.0.29.2.3784: BFDv1, Control, State Up, Flags: [none], length: 24
 00:00:16.638465 eth1  Out IP 10.0.29.2.34587 > 10.0.29.3.3784: BFDv1, Control, State Up, Flags: [none], length: 24
 00:00:16.712671 eth1  In  IP 10.0.29.3.53368 > 10.0.29.2.3784: BFDv1, Control, State Up, Flags: [none], length: 24
 00:00:16.715029 eth1  Out IP 10.0.29.2.34587 > 10.0.29.3.3784: BFDv1, Control, State Up, Flags: [none], length: 24
 00:00:16.789979 eth1  In  IP 10.0.29.3.53368 > 10.0.29.2.3784: BFDv1, Control, State Up, Flags: [none], length: 24
 00:00:16.802309 eth1  Out IP 10.0.29.2.34587 > 10.0.29.3.3784: BFDv1, Control, State Up, Flags: [none], length: 24
 00:00:16.875649 eth1  In  IP 10.0.29.3.53368 > 10.0.29.2.3784: BFDv1, Control, State Up, Flags: [none], length: 24
 00:00:16.881944 eth1  Out IP 10.0.29.2.34587 > 10.0.29.3.3784: BFDv1, Control, State Up, Flags: [none], length: 24
 00:00:16.954246 eth1  In  IP 10.0.29.3.53368 > 10.0.29.2.3784: BFDv1, Control, State Up, Flags: [none], length: 24
 00:00:16.957585 eth1  Out IP 10.0.29.2.34587 > 10.0.29.3.3784: BFDv1, Control, State Up, Flags: [none], length: 24
 00:00:17.041665 eth1  In  IP 10.0.29.3.53368 > 10.0.29.2.3784: BFDv1, Control, State Up, Flags: [none], length: 24
 00:00:17.044948 eth1  Out IP 10.0.29.2.34587 > 10.0.29.3.3784: BFDv1, Control, State Up, Flags: [none], length: 24
 00:00:17.120007 eth1  In  IP 10.0.29.3.53368 > 10.0.29.2.3784: BFDv1, Control, State Up, Flags: [none], length: 24
 00:00:17.125333 eth1  Out IP 10.0.29.2.34587 > 10.0.29.3.3784: BFDv1, Control, State Up, Flags: [none], length: 24
 00:00:17.195598 eth1  In  IP 10.0.29.3.53368 > 10.0.29.2.3784: BFDv1, Control, State Up, Flags: [none], length: 24
 00:00:17.202013 eth1  Out IP 10.0.29.2.34587 > 10.0.29.3.3784: BFDv1, Control, State Up, Flags: [none], length: 24
 00:00:17.274477 eth1  In  IP 10.0.29.3.53368 > 10.0.29.2.3784: BFDv1, Control, State Up, Flags: [none], length: 24
 00:00:17.277747 eth1  Out IP 10.0.29.2.34587 > 10.0.29.3.3784: BFDv1, Control, State Up, Flags: [none], length: 24
 00:00:17.358105 eth1  Out IP 10.0.29.2.34587 > 10.0.29.3.3784: BFDv1, Control, State Up, Flags: [none], length: 24
 00:00:17.364343 eth1  In  IP 10.0.29.3.53368 > 10.0.29.2.3784: BFDv1, Control, State Up, Flags: [none], length: 24
 00:00:17.433636 eth1  Out IP 10.0.29.2.34587 > 10.0.29.3.3784: BFDv1, Control, State Up, Flags: [none], length: 24
 00:00:17.444934 eth1  In  IP 10.0.29.3.53368 > 10.0.29.2.3784: BFDv1, Control, State Up, Flags: [none], length: 24
 00:00:17.516261 eth1  Out IP 10.0.29.2.34587 > 10.0.29.3.3784: BFDv1, Control, State Up, Flags: [none], length: 24
 00:00:17.522428 eth1  In  IP 10.0.29.3.53368 > 10.0.29.2.3784: BFDv1, Control, State Up, Flags: [none], length: 24
 00:00:17.597767 eth1  Out IP 10.0.29.2.34587 > 10.0.29.3.3784: BFDv1, Control, State Up, Flags: [none], length: 24
 00:00:17.609046 eth1  In  IP 10.0.29.3.53368 > 10.0.29.2.3784: BFDv1, Control, State Up, Flags: [none], length: 24
 00:00:17.682404 eth1  Out IP 10.0.29.2.34587 > 10.0.29.3.3784: BFDv1, Control, State Up, Flags: [none], length: 24
 00:00:17.697647 eth1  In  IP 10.0.29.3.53368 > 10.0.29.2.3784: BFDv1, Control, State Up, Flags: [none], length: 24
 00:00:17.763967 eth1  Out IP 10.0.29.2.34587 > 10.0.29.3.3784: BFDv1, Control, State Up, Flags: [none], length: 24
 00:00:17.774162 eth1  In  IP 10.0.29.3.53368 > 10.0.29.2.3784: BFDv1, Control, State Up, Flags: [none], length: 24
 00:00:17.849690 eth1  In  IP 10.0.29.3.53368 > 10.0.29.2.3784: BFDv1, Control, State Up, Flags: [none], length: 24
 00:00:17.851941 eth1  Out IP 10.0.29.2.34587 > 10.0.29.3.3784: BFDv1, Control, State Up, Flags: [none], length: 24
 00:00:17.928186 eth1  Out IP 10.0.29.2.34587 > 10.0.29.3.3784: BFDv1, Control, State Up, Flags: [none], length: 24
 00:00:17.932492 eth1  In  IP 10.0.29.3.53368 > 10.0.29.2.3784: BFDv1, Control, State Up, Flags: [none], length: 24
 00:00:18.010153 eth1  In  IP 10.0.29.3.53368 > 10.0.29.2.3784: BFDv1, Control, State Up, Flags: [none], length: 24
 00:00:18.013482 eth1  Out IP 10.0.29.2.34587 > 10.0.29.3.3784: BFDv1, Control, State Up, Flags: [none], length: 24
 00:00:18.088064 eth1  In  IP 10.0.29.3.53368 > 10.0.29.2.3784: BFDv1, Control, State Up, Flags: [none], length: 24
 00:00:18.093381 eth1  Out IP 10.0.29.2.34587 > 10.0.29.3.3784: BFDv1, Control, State Up, Flags: [none], length: 24
 00:00:18.171909 eth1  In  IP 10.0.29.3.53368 > 10.0.29.2.3784: BFDv1, Control, State Up, Flags: [none], length: 24
 00:00:18.174228 eth1  Out IP 10.0.29.2.34587 > 10.0.29.3.3784: BFDv1, Control, State Up, Flags: [none], length: 24
 00:00:18.248258 eth1  In  IP 10.0.29.3.53368 > 10.0.29.2.3784: BFDv1, Control, State Up, Flags: [none], length: 24
 00:00:18.252497 eth1  Out IP 10.0.29.2.34587 > 10.0.29.3.3784: BFDv1, Control, State Up, Flags: [none], length: 24
 00:00:18.327737 eth1  In  IP 10.0.29.3.53368 > 10.0.29.2.3784: BFDv1, Control, State Up, Flags: [none], length: 24
 00:00:18.332083 eth1  Out IP 10.0.29.2.34587 > 10.0.29.3.3784: BFDv1, Control, State Up, Flags: [none], length: 24
 00:00:18.412220 eth1  In  IP 10.0.29.3.53368 > 10.0.29.2.3784: BFDv1, Control, State Up, Flags: [none], length: 24
 00:00:18.412394 eth1  Out IP 10.0.29.2.34587 > 10.0.29.3.3784: BFDv1, Control, State Up, Flags: [none], length: 24
 00:00:18.491645 eth1  Out IP 10.0.29.2.34587 > 10.0.29.3.3784: BFDv1, Control, State Up, Flags: [none], length: 24
 00:00:18.501712 eth1  In  IP 10.0.29.3.53368 > 10.0.29.2.3784: BFDv1, Control, State Up, Flags: [none], length: 24
 00:00:18.569014 eth1  Out IP 10.0.29.2.34587 > 10.0.29.3.3784: BFDv1, Control, State Up, Flags: [none], length: 24
 00:00:18.584246 eth1  In  IP 10.0.29.3.53368 > 10.0.29.2.3784: BFDv1, Control, State Up, Flags: [none], length: 24
 00:00:18.616190 eth1  Out IP 10.0.29.2.52067 > 10.0.29.3.179: Flags [S], seq 1878941413, win 64240, options [mss 1460,sackOK,TS val 1876864899 ecr 0,nop,wscale 10], length 0
 00:00:18.616262 eth1  In  IP 10.0.29.3.179 > 10.0.29.2.52067: Flags [S.], seq 3641878009, ack 1878941414, win 65160, options [mss 1460,sackOK,TS val 3829619873 ecr 1876864899,nop,wscale 10], length 0
 00:00:18.616292 eth1  Out IP 10.0.29.2.52067 > 10.0.29.3.179: Flags [.], ack 1, win 63, options [nop,nop,TS val 1876864899 ecr 3829619873], length 0
 00:00:18.616406 eth1  Out IP 10.0.29.2.52067 > 10.0.29.3.179: Flags [P.], seq 1:65, ack 1, win 63, options [nop,nop,TS val 1876864899 ecr 3829619873], length 64: BGP
 00:00:18.616413 eth1  In  IP 10.0.29.3.179 > 10.0.29.2.52067: Flags [F.], seq 1, ack 1, win 64, options [nop,nop,TS val 3829619873 ecr 1876864899], length 0
 00:00:18.616474 eth1  In  IP 10.0.29.3.179 > 10.0.29.2.52067: Flags [R], seq 3641878010, win 0, length 0
 00:00:18.616483 eth1  Out IP 10.0.29.2.52067 > 10.0.29.3.179: Flags [F.], seq 65, ack 2, win 63, options [nop,nop,TS val 1876864899 ecr 3829619873], length 0
 00:00:18.616504 eth1  In  IP 10.0.29.3.179 > 10.0.29.2.52067: Flags [R], seq 3641878011, win 0, length 0
 00:00:18.655661 eth1  Out IP 10.0.29.2.34587 > 10.0.29.3.3784: BFDv1, Control, State Up, Flags: [none], length: 24
 00:00:18.670948 eth1  In  IP 10.0.29.3.53368 > 10.0.29.2.3784: BFDv1, Control, State Up, Flags: [none], length: 24
 00:00:18.744373 eth1  Out IP 10.0.29.2.34587 > 10.0.29.3.3784: BFDv1, Control, State Up, Flags: [none], length: 24
 00:00:18.758129 eth1  In  IP 10.0.29.3.53368 > 10.0.29.2.3784: BFDv1, Control, State Up, Flags: [none], length: 24
 00:00:18.821501 eth1  Out IP 10.0.29.2.34587 > 10.0.29.3.3784: BFDv1, Control, State Up, Flags: [none], length: 24
 00:00:18.841789 eth1  In  IP 10.0.29.3.53368 > 10.0.29.2.3784: BFDv1, Control, State Up, Flags: [none], length: 24
 00:00:18.905126 eth1  Out IP 10.0.29.2.34587 > 10.0.29.3.3784: BFDv1, Control, State Up, Flags: [none], length: 24
 00:00:18.923424 eth1  In  IP 10.0.29.3.53368 > 10.0.29.2.3784: BFDv1, Control, State Up, Flags: [none], length: 24
 00:00:18.980854 eth1  Out IP 10.0.29.2.34587 > 10.0.29.3.3784: BFDv1, Control, State Up, Flags: [none], length: 24
 00:00:19.007065 eth1  In  IP 10.0.29.3.53368 > 10.0.29.2.3784: BFDv1, Control, State Up, Flags: [none], length: 24
 00:00:19.069391 eth1  Out IP 10.0.29.2.34587 > 10.0.29.3.3784: BFDv1, Control, State Up, Flags: [none], length: 24
 00:00:19.093664 eth1  In  IP 10.0.29.3.53368 > 10.0.29.2.3784: BFDv1, Control, State Up, Flags: [none], length: 24
 00:00:19.156978 eth1  Out IP 10.0.29.2.34587 > 10.0.29.3.3784: BFDv1, Control, State Up, Flags: [none], length: 24
 00:00:19.172268 eth1  In  IP 10.0.29.3.53368 > 10.0.29.2.3784: BFDv1, Control, State Up, Flags: [none], length: 24
 00:00:19.232573 eth1  Out IP 10.0.29.2.34587 > 10.0.29.3.3784: BFDv1, Control, State Up, Flags: [none], length: 24
 00:00:19.256927 eth1  In  IP 10.0.29.3.53368 > 10.0.29.2.3784: BFDv1, Control, State Up, Flags: [none], length: 24
 00:00:19.318280 eth1  Out IP 10.0.29.2.34587 > 10.0.29.3.3784: BFDv1, Control, State Up, Flags: [none], length: 24
 00:00:19.342610 eth1  In  IP 10.0.29.3.53368 > 10.0.29.2.3784: BFDv1, Control, State Up, Flags: [none], length: 24
 00:00:19.396895 eth1  Out IP 10.0.29.2.34587 > 10.0.29.3.3784: BFDv1, Control, State Up, Flags: [none], length: 24
 00:00:19.421105 eth1  In  IP 10.0.29.3.53368 > 10.0.29.2.3784: BFDv1, Control, State Up, Flags: [none], length: 24
 00:00:19.474461 eth1  Out IP 10.0.29.2.34587 > 10.0.29.3.3784: BFDv1, Control, State Up, Flags: [none], length: 24
 00:00:19.500681 eth1  In  IP 10.0.29.3.53368 > 10.0.29.2.3784: BFDv1, Control, State Up, Flags: [none], length: 24
 00:00:19.560971 eth1  Out IP 10.0.29.2.34587 > 10.0.29.3.3784: BFDv1, Control, State Up, Flags: [none], length: 24
 00:00:19.586268 eth1  In  IP 10.0.29.3.53368 > 10.0.29.2.3784: BFDv1, Control, State Up, Flags: [none], length: 24
 00:00:19.644616 eth1  Out IP 10.0.29.2.34587 > 10.0.29.3.3784: BFDv1, Control, State Up, Flags: [none], length: 24
 00:00:19.660915 eth1  In  IP 10.0.29.3.53368 > 10.0.29.2.3784: BFDv1, Control, State Up, Flags: [none], length: 24
 00:00:19.722282 eth1  Out IP 10.0.29.2.34587 > 10.0.29.3.3784: BFDv1, Control, State Up, Flags: [none], length: 24
 00:00:19.750545 eth1  In  IP 10.0.29.3.53368 > 10.0.29.2.3784: BFDv1, Control, State Up, Flags: [none], length: 24
 00:00:19.799876 eth1  Out IP 10.0.29.2.34587 > 10.0.29.3.3784: BFDv1, Control, State Up, Flags: [none], length: 24
 00:00:19.826157 eth1  In  IP 10.0.29.3.53368 > 10.0.29.2.3784: BFDv1, Control, State Up, Flags: [none], length: 24
 00:00:19.876554 eth1  Out IP 10.0.29.2.34587 > 10.0.29.3.3784: BFDv1, Control, State Up, Flags: [none], length: 24
 00:00:19.915761 eth1  In  IP 10.0.29.3.53368 > 10.0.29.2.3784: BFDv1, Control, State Up, Flags: [none], length: 24
 00:00:19.964171 eth1  Out IP 10.0.29.2.34587 > 10.0.29.3.3784: BFDv1, Control, State Up, Flags: [none], length: 24
 00:00:19.994356 eth1  In  IP 10.0.29.3.53368 > 10.0.29.2.3784: BFDv1, Control, State Up, Flags: [none], length: 24
 00:00:20.047711 eth1  Out IP 10.0.29.2.34587 > 10.0.29.3.3784: BFDv1, Control, State Up, Flags: [none], length: 24
 00:00:20.081035 eth1  In  IP 10.0.29.3.53368 > 10.0.29.2.3784: BFDv1, Control, State Up, Flags: [none], length: 24
 00:00:20.136340 eth1  Out IP 10.0.29.2.34587 > 10.0.29.3.3784: BFDv1, Control, State Up, Flags: [none], length: 24
 00:00:20.160534 eth1  In  IP 10.0.29.3.53368 > 10.0.29.2.3784: BFDv1, Control, State Up, Flags: [none], length: 24
 00:00:20.225818 eth1  Out IP 10.0.29.2.34587 > 10.0.29.3.3784: BFDv1, Control, State Up, Flags: [none], length: 24
 00:00:20.239015 eth1  In  IP 10.0.29.3.53368 > 10.0.29.2.3784: BFDv1, Control, State Up, Flags: [none], length: 24
 00:00:20.304331 eth1  Out IP 10.0.29.2.34587 > 10.0.29.3.3784: BFDv1, Control, State Up, Flags: [none], length: 24
 00:00:20.324694 eth1  In  IP 10.0.29.3.53368 > 10.0.29.2.3784: BFDv1, Control, State Up, Flags: [none], length: 24
 00:00:20.382023 eth1  Out IP 10.0.29.2.34587 > 10.0.29.3.3784: BFDv1, Control, State Up, Flags: [none], length: 24
 00:00:20.404215 eth1  In  IP 10.0.29.3.53368 > 10.0.29.2.3784: BFDv1, Control, State Up, Flags: [none], length: 24
 00:00:20.462529 eth1  Out IP 10.0.29.2.34587 > 10.0.29.3.3784: BFDv1, Control, State Up, Flags: [none], length: 24
 00:00:20.483816 eth1  In  IP 10.0.29.3.53368 > 10.0.29.2.3784: BFDv1, Control, State Up, Flags: [none], length: 24
 00:00:20.545226 eth1  Out IP 10.0.29.2.34587 > 10.0.29.3.3784: BFDv1, Control, State Up, Flags: [none], length: 24
 00:00:20.562239 eth1  In  IP 10.0.29.3.53368 > 10.0.29.2.3784: BFDv1, Control, State Up, Flags: [none], length: 24
 00:00:20.626607 eth1  Out IP 10.0.29.2.34587 > 10.0.29.3.3784: BFDv1, Control, State Up, Flags: [none], length: 24
 00:00:20.649722 eth1  In  IP 10.0.29.3.53368 > 10.0.29.2.3784: BFDv1, Control, State Up, Flags: [none], length: 24
 00:00:20.712097 eth1  Out IP 10.0.29.2.34587 > 10.0.29.3.3784: BFDv1, Control, State Up, Flags: [none], length: 24
 00:00:20.728228 eth1  In  IP 10.0.29.3.53368 > 10.0.29.2.3784: BFDv1, Control, State Up, Flags: [none], length: 24
 00:00:20.797590 eth1  Out IP 10.0.29.2.34587 > 10.0.29.3.3784: BFDv1, Control, State Up, Flags: [none], length: 24
 00:00:20.814922 eth1  In  IP 10.0.29.3.53368 > 10.0.29.2.3784: BFDv1, Control, State Up, Flags: [none], length: 24
 00:00:20.882226 eth1  Out IP 10.0.29.2.34587 > 10.0.29.3.3784: BFDv1, Control, State Up, Flags: [none], length: 24
 00:00:20.900620 eth1  In  IP 10.0.29.3.53368 > 10.0.29.2.3784: BFDv1, Control, State Up, Flags: [none], length: 24
 00:00:20.962962 eth1  Out IP 10.0.29.2.34587 > 10.0.29.3.3784: BFDv1, Control, State Up, Flags: [none], length: 24
 00:00:20.978037 eth1  In  IP 10.0.29.3.53368 > 10.0.29.2.3784: BFDv1, Control, State Up, Flags: [none], length: 24
 00:00:21.045398 eth1  Out IP 10.0.29.2.34587 > 10.0.29.3.3784: BFDv1, Control, State Up, Flags: [none], length: 24
 00:00:21.063420 eth1  In  IP 10.0.29.3.53368 > 10.0.29.2.3784: BFDv1, Control, State Up, Flags: [none], length: 24
 00:00:21.134749 eth1  Out IP 10.0.29.2.34587 > 10.0.29.3.3784: BFDv1, Control, State Up, Flags: [none], length: 24
 00:00:21.154181 eth1  In  IP 10.0.29.3.53368 > 10.0.29.2.3784: BFDv1, Control, State Up, Flags: [none], length: 24
 00:00:21.221567 eth1  Out IP 10.0.29.2.34587 > 10.0.29.3.3784: BFDv1, Control, State Up, Flags: [none], length: 24
 00:00:21.229935 eth1  In  IP 10.0.29.3.53368 > 10.0.29.2.3784: BFDv1, Control, State Up, Flags: [none], length: 24
 00:00:21.302244 eth1  Out IP 10.0.29.2.34587 > 10.0.29.3.3784: BFDv1, Control, State Up, Flags: [none], length: 24
 00:00:21.310455 eth1  In  IP 10.0.29.3.53368 > 10.0.29.2.3784: BFDv1, Control, State Up, Flags: [none], length: 24
 00:00:21.391744 eth1  Out IP 10.0.29.2.34587 > 10.0.29.3.3784: BFDv1, Control, State Up, Flags: [none], length: 24
 00:00:21.399890 eth1  In  IP 10.0.29.3.53368 > 10.0.29.2.3784: BFDv1, Control, State Up, Flags: [none], length: 24
 00:00:21.472139 eth1  Out IP 10.0.29.2.34587 > 10.0.29.3.3784: BFDv1, Control, State Up, Flags: [none], length: 24
 00:00:21.489428 eth1  In  IP 10.0.29.3.53368 > 10.0.29.2.3784: BFDv1, Control, State Up, Flags: [none], length: 24
 00:00:21.553693 eth1  Out IP 10.0.29.2.34587 > 10.0.29.3.3784: BFDv1, Control, State Up, Flags: [none], length: 24
 00:00:21.571825 eth1  In  IP 10.0.29.3.53368 > 10.0.29.2.3784: BFDv1, Control, State Up, Flags: [none], length: 24
 00:00:21.642046 eth1  Out IP 10.0.29.2.34587 > 10.0.29.3.3784: BFDv1, Control, State Up, Flags: [none], length: 24
 00:00:21.650190 eth1  In  IP 10.0.29.3.53368 > 10.0.29.2.3784: BFDv1, Control, State Up, Flags: [none], length: 24
 00:00:21.719449 eth1  Out IP 10.0.29.2.34587 > 10.0.29.3.3784: BFDv1, Control, State Up, Flags: [none], length: 24
 00:00:21.732738 eth1  In  IP 10.0.29.3.53368 > 10.0.29.2.3784: BFDv1, Control, State Up, Flags: [none], length: 24
 00:00:21.802609 eth1  Out IP 10.0.29.2.34587 > 10.0.29.3.3784: BFDv1, Control, State Up, Flags: [none], length: 24
 00:00:21.819892 eth1  In  IP 10.0.29.3.53368 > 10.0.29.2.3784: BFDv1, Control, State Up, Flags: [none], length: 24
 00:00:21.886124 eth1  Out IP 10.0.29.2.34587 > 10.0.29.3.3784: BFDv1, Control, State Up, Flags: [none], length: 24
 00:00:21.902491 eth1  In  IP 10.0.29.3.53368 > 10.0.29.2.3784: BFDv1, Control, State Up, Flags: [none], length: 24
 00:00:21.967738 eth1  Out IP 10.0.29.2.34587 > 10.0.29.3.3784: BFDv1, Control, State Up, Flags: [none], length: 24
 00:00:21.980031 eth1  In  IP 10.0.29.3.53368 > 10.0.29.2.3784: BFDv1, Control, State Up, Flags: [none], length: 24
 00:00:22.052254 eth1  Out IP 10.0.29.2.34587 > 10.0.29.3.3784: BFDv1, Control, State Up, Flags: [none], length: 24
 00:00:22.064548 eth1  In  IP 10.0.29.3.53368 > 10.0.29.2.3784: BFDv1, Control, State Up, Flags: [none], length: 24
 00:00:22.130795 eth1  Out IP 10.0.29.2.34587 > 10.0.29.3.3784: BFDv1, Control, State Up, Flags: [none], length: 24
 00:00:22.149971 eth1  In  IP 10.0.29.3.53368 > 10.0.29.2.3784: BFDv1, Control, State Up, Flags: [none], length: 24
 00:00:22.207206 eth1  Out IP 10.0.29.2.34587 > 10.0.29.3.3784: BFDv1, Control, State Up, Flags: [none], length: 24
 00:00:22.229391 eth1  In  IP 10.0.29.3.53368 > 10.0.29.2.3784: BFDv1, Control, State Up, Flags: [none], length: 24
 00:00:22.293659 eth1  Out IP 10.0.29.2.34587 > 10.0.29.3.3784: BFDv1, Control, State Up, Flags: [none], length: 24
 00:00:22.316849 eth1  In  IP 10.0.29.3.53368 > 10.0.29.2.3784: BFDv1, Control, State Up, Flags: [none], length: 24
 00:00:22.376090 eth1  Out IP 10.0.29.2.34587 > 10.0.29.3.3784: BFDv1, Control, State Up, Flags: [none], length: 24
 00:00:22.398340 eth1  In  IP 10.0.29.3.53368 > 10.0.29.2.3784: BFDv1, Control, State Up, Flags: [none], length: 24
 00:00:22.451657 eth1  Out IP 10.0.29.2.34587 > 10.0.29.3.3784: BFDv1, Control, State Up, Flags: [none], length: 24
 00:00:22.486093 eth1  In  IP 10.0.29.3.53368 > 10.0.29.2.3784: BFDv1, Control, State Up, Flags: [none], length: 24
 00:00:22.535408 eth1  Out IP 10.0.29.2.34587 > 10.0.29.3.3784: BFDv1, Control, State Up, Flags: [none], length: 24
 00:00:22.561723 eth1  In  IP 10.0.29.3.53368 > 10.0.29.2.3784: BFDv1, Control, State Up, Flags: [none], length: 24
 00:00:22.611022 eth1  Out IP 10.0.29.2.34587 > 10.0.29.3.3784: BFDv1, Control, State Up, Flags: [none], length: 24
 00:00:22.650331 eth1  In  IP 10.0.29.3.53368 > 10.0.29.2.3784: BFDv1, Control, State Up, Flags: [none], length: 24
 00:00:22.700549 eth1  Out IP 10.0.29.2.34587 > 10.0.29.3.3784: BFDv1, Control, State Up, Flags: [none], length: 24
 00:00:22.727843 eth1  In  IP 10.0.29.3.53368 > 10.0.29.2.3784: BFDv1, Control, State Up, Flags: [none], length: 24
 00:00:22.783097 eth1  Out IP 10.0.29.2.34587 > 10.0.29.3.3784: BFDv1, Control, State Up, Flags: [none], length: 24
 00:00:22.805318 eth1  In  IP 10.0.29.3.53368 > 10.0.29.2.3784: BFDv1, Control, State Up, Flags: [none], length: 24
 00:00:22.863583 eth1  Out IP 10.0.29.2.34587 > 10.0.29.3.3784: BFDv1, Control, State Up, Flags: [none], length: 24
 00:00:22.889881 eth1  In  IP 10.0.29.3.53368 > 10.0.29.2.3784: BFDv1, Control, State Up, Flags: [none], length: 24
 00:00:22.940191 eth1  Out IP 10.0.29.2.34587 > 10.0.29.3.3784: BFDv1, Control, State Up, Flags: [none], length: 24
 00:00:22.971453 eth1  In  IP 10.0.29.3.53368 > 10.0.29.2.3784: BFDv1, Control, State Up, Flags: [none], length: 24
 00:00:22.974494 eth1  Out IP 10.0.29.2.52719 > 10.0.29.3.179: Flags [S], seq 1490911326, win 64240, options [mss 1460,sackOK,TS val 1876869257 ecr 0,nop,wscale 10], length 0
 00:00:22.974573 eth1  In  IP 10.0.29.3.179 > 10.0.29.2.52719: Flags [S.], seq 1854168482, ack 1490911327, win 65160, options [mss 1460,sackOK,TS val 3829624231 ecr 1876869257,nop,wscale 10], length 0
 00:00:22.974608 eth1  Out IP 10.0.29.2.52719 > 10.0.29.3.179: Flags [.], ack 1, win 63, options [nop,nop,TS val 1876869257 ecr 3829624231], length 0
 00:00:22.974766 eth1  Out IP 10.0.29.2.52719 > 10.0.29.3.179: Flags [P.], seq 1:65, ack 1, win 63, options [nop,nop,TS val 1876869257 ecr 3829624231], length 64: BGP
 00:00:22.974793 eth1  In  IP 10.0.29.3.179 > 10.0.29.2.52719: Flags [.], ack 65, win 64, options [nop,nop,TS val 3829624231 ecr 1876869257], length 0
 00:00:22.974999 eth1  In  IP 10.0.29.3.179 > 10.0.29.2.52719: Flags [R.], seq 1, ack 65, win 64, options [nop,nop,TS val 3829624232 ecr 1876869257], length 0
 00:00:23.026865 eth1  Out IP 10.0.29.2.34587 > 10.0.29.3.3784: BFDv1, Control, State Up, Flags: [none], length: 24
 00:00:23.060110 eth1  In  IP 10.0.29.3.53368 > 10.0.29.2.3784: BFDv1, Control, State Up, Flags: [none], length: 24
 00:00:23.110381 eth1  Out IP 10.0.29.2.34587 > 10.0.29.3.3784: BFDv1, Control, State Up, Flags: [none], length: 24
 00:00:23.138570 eth1  In  IP 10.0.29.3.53368 > 10.0.29.2.3784: BFDv1, Control, State Up, Flags: [none], length: 24
 00:00:23.187840 eth1  Out IP 10.0.29.2.34587 > 10.0.29.3.3784: BFDv1, Control, State Up, Flags: [none], length: 24
 00:00:23.220248 eth1  In  IP 10.0.29.3.53368 > 10.0.29.2.3784: BFDv1, Control, State Up, Flags: [none], length: 24
 00:00:23.275550 eth1  Out IP 10.0.29.2.34587 > 10.0.29.3.3784: BFDv1, Control, State Up, Flags: [none], length: 24
 00:00:23.307734 eth1  In  IP 10.0.29.3.53368 > 10.0.29.2.3784: BFDv1, Control, State Up, Flags: [none], length: 24
 00:00:23.351010 eth1  Out IP 10.0.29.2.34587 > 10.0.29.3.3784: BFDv1, Control, State Up, Flags: [none], length: 24
 00:00:23.388246 eth1  In  IP 10.0.29.3.53368 > 10.0.29.2.3784: BFDv1, Control, State Up, Flags: [none], length: 24
 00:00:23.427501 eth1  Out IP 10.0.29.2.34587 > 10.0.29.3.3784: BFDv1, Control, State Up, Flags: [none], length: 24
 00:00:23.475731 eth1  In  IP 10.0.29.3.53368 > 10.0.29.2.3784: BFDv1, Control, State Up, Flags: [none], length: 24
 00:00:23.511981 eth1  Out IP 10.0.29.2.34587 > 10.0.29.3.3784: BFDv1, Control, State Up, Flags: [none], length: 24
 00:00:23.558302 eth1  In  IP 10.0.29.3.53368 > 10.0.29.2.3784: BFDv1, Control, State Up, Flags: [none], length: 24
 00:00:23.592551 eth1  Out IP 10.0.29.2.34587 > 10.0.29.3.3784: BFDv1, Control, State Up, Flags: [none], length: 24
 00:00:23.640945 eth1  In  IP 10.0.29.3.53368 > 10.0.29.2.3784: BFDv1, Control, State Up, Flags: [none], length: 24
 00:00:23.668246 eth1  Out IP 10.0.29.2.34587 > 10.0.29.3.3784: BFDv1, Control, State Up, Flags: [none], length: 24
 00:00:23.724417 eth1  In  IP 10.0.29.3.53368 > 10.0.29.2.3784: BFDv1, Control, State Up, Flags: [none], length: 24
 00:00:23.757684 eth1  Out IP 10.0.29.2.34587 > 10.0.29.3.3784: BFDv1, Control, State Up, Flags: [none], length: 24
 00:00:23.800015 eth1  In  IP 10.0.29.3.53368 > 10.0.29.2.3784: BFDv1, Control, State Up, Flags: [none], length: 24
 00:00:23.844333 eth1  Out IP 10.0.29.2.34587 > 10.0.29.3.3784: BFDv1, Control, State Up, Flags: [none], length: 24
 00:00:23.880506 eth1  In  IP 10.0.29.3.53368 > 10.0.29.2.3784: BFDv1, Control, State Up, Flags: [none], length: 24
 00:00:23.933765 eth1  Out IP 10.0.29.2.34587 > 10.0.29.3.3784: BFDv1, Control, State Up, Flags: [none], length: 24
 00:00:23.964003 eth1  In  IP 10.0.29.3.53368 > 10.0.29.2.3784: BFDv1, Control, State Up, Flags: [none], length: 24
 00:00:24.010317 eth1  Out IP 10.0.29.2.34587 > 10.0.29.3.3784: BFDv1, Control, State Up, Flags: [none], length: 24
 00:00:24.048468 eth1  In  IP 10.0.29.3.53368 > 10.0.29.2.3784: BFDv1, Control, State Up, Flags: [none], length: 24
 00:00:24.089048 eth1  Out IP 10.0.29.2.34587 > 10.0.29.3.3784: BFDv1, Control, State Up, Flags: [none], length: 24
 00:00:24.131210 eth1  In  IP 10.0.29.3.53368 > 10.0.29.2.3784: BFDv1, Control, State Up, Flags: [none], length: 24
 00:00:24.171499 eth1  Out IP 10.0.29.2.34587 > 10.0.29.3.3784: BFDv1, Control, State Up, Flags: [none], length: 24
 00:00:24.218786 eth1  In  IP 10.0.29.3.53368 > 10.0.29.2.3784: BFDv1, Control, State Up, Flags: [none], length: 24
 00:00:24.255151 eth1  Out IP 10.0.29.2.34587 > 10.0.29.3.3784: BFDv1, Control, State Up, Flags: [none], length: 24
 00:00:24.303258 eth1  In  IP 10.0.29.3.53368 > 10.0.29.2.3784: BFDv1, Control, State Up, Flags: [none], length: 24
 00:00:24.342486 eth1  Out IP 10.0.29.2.34587 > 10.0.29.3.3784: BFDv1, Control, State Up, Flags: [none], length: 24
 00:00:24.391805 eth1  In  IP 10.0.29.3.53368 > 10.0.29.2.3784: BFDv1, Control, State Up, Flags: [none], length: 24
 00:00:24.430046 eth1  Out IP 10.0.29.2.34587 > 10.0.29.3.3784: BFDv1, Control, State Up, Flags: [none], length: 24
 00:00:24.472291 eth1  In  IP 10.0.29.3.53368 > 10.0.29.2.3784: BFDv1, Control, State Up, Flags: [none], length: 24
 00:00:24.513544 eth1  Out IP 10.0.29.2.34587 > 10.0.29.3.3784: BFDv1, Control, State Up, Flags: [none], length: 24
 00:00:24.555109 eth1  In  IP 10.0.29.3.53368 > 10.0.29.2.3784: BFDv1, Control, State Up, Flags: [none], length: 24
 00:00:24.596314 eth1  Out IP 10.0.29.2.34587 > 10.0.29.3.3784: BFDv1, Control, State Up, Flags: [none], length: 24
 00:00:24.636532 eth1  In  IP 10.0.29.3.53368 > 10.0.29.2.3784: BFDv1, Control, State Up, Flags: [none], length: 24
 00:00:24.675740 eth1  Out IP 10.0.29.2.34587 > 10.0.29.3.3784: BFDv1, Control, State Up, Flags: [none], length: 24
 00:00:24.711986 eth1  In  IP 10.0.29.3.53368 > 10.0.29.2.3784: BFDv1, Control, State Up, Flags: [none], length: 24
 00:00:24.760231 eth1  Out IP 10.0.29.2.34587 > 10.0.29.3.3784: BFDv1, Control, State Up, Flags: [none], length: 24
 00:00:24.795447 eth1  In  IP 10.0.29.3.53368 > 10.0.29.2.3784: BFDv1, Control, State Up, Flags: [none], length: 24
 00:00:24.837767 eth1  Out IP 10.0.29.2.34587 > 10.0.29.3.3784: BFDv1, Control, State Up, Flags: [none], length: 24
 00:00:24.881985 eth1  In  IP 10.0.29.3.53368 > 10.0.29.2.3784: BFDv1, Control, State Up, Flags: [none], length: 24
 00:00:24.917216 eth1  Out IP 10.0.29.2.34587 > 10.0.29.3.3784: BFDv1, Control, State Up, Flags: [none], length: 24
 00:00:24.964629 eth1  In  IP 10.0.29.3.53368 > 10.0.29.2.3784: BFDv1, Control, State Up, Flags: [none], length: 24
 00:00:25.000858 eth1  Out IP 10.0.29.2.34587 > 10.0.29.3.3784: BFDv1, Control, State Up, Flags: [none], length: 24
 00:00:25.044041 eth1  In  IP 10.0.29.3.53368 > 10.0.29.2.3784: BFDv1, Control, State Up, Flags: [none], length: 24
 00:00:25.084278 eth1  Out IP 10.0.29.2.34587 > 10.0.29.3.3784: BFDv1, Control, State Up, Flags: [none], length: 24
 00:00:25.120560 eth1  In  IP 10.0.29.3.53368 > 10.0.29.2.3784: BFDv1, Control, State Up, Flags: [none], length: 24
 00:00:25.168875 eth1  Out IP 10.0.29.2.34587 > 10.0.29.3.3784: BFDv1, Control, State Up, Flags: [none], length: 24
 00:00:25.209074 eth1  In  IP 10.0.29.3.53368 > 10.0.29.2.3784: BFDv1, Control, State Up, Flags: [none], length: 24
 00:00:25.254895 eth1  Out IP 10.0.29.2.34587 > 10.0.29.3.3784: BFDv1, Control, State Up, Flags: [none], length: 24
 00:00:25.298688 eth1  In  IP 10.0.29.3.53368 > 10.0.29.2.3784: BFDv1, Control, State Up, Flags: [none], length: 24
 00:00:25.334966 eth1  Out IP 10.0.29.2.34587 > 10.0.29.3.3784: BFDv1, Control, State Up, Flags: [none], length: 24
 00:00:25.375300 eth1  In  IP 10.0.29.3.53368 > 10.0.29.2.3784: BFDv1, Control, State Up, Flags: [none], length: 24
 00:00:25.416589 eth1  Out IP 10.0.29.2.34587 > 10.0.29.3.3784: BFDv1, Control, State Up, Flags: [none], length: 24
 00:00:25.460057 eth1  In  IP 10.0.29.3.53368 > 10.0.29.2.3784: BFDv1, Control, State Up, Flags: [none], length: 24
 00:00:25.495446 eth1  Out IP 10.0.29.2.34587 > 10.0.29.3.3784: BFDv1, Control, State Up, Flags: [none], length: 24
 00:00:25.541715 eth1  In  IP 10.0.29.3.53368 > 10.0.29.2.3784: BFDv1, Control, State Up, Flags: [none], length: 24
 00:00:25.583090 eth1  Out IP 10.0.29.2.34587 > 10.0.29.3.3784: BFDv1, Control, State Up, Flags: [none], length: 24
 00:00:25.626332 eth1  In  IP 10.0.29.3.53368 > 10.0.29.2.3784: BFDv1, Control, State Up, Flags: [none], length: 24
 00:00:25.671680 eth1  Out IP 10.0.29.2.34587 > 10.0.29.3.3784: BFDv1, Control, State Up, Flags: [none], length: 24
 00:00:25.701975 eth1  In  IP 10.0.29.3.53368 > 10.0.29.2.3784: BFDv1, Control, State Up, Flags: [none], length: 24
 00:00:25.753370 eth1  Out IP 10.0.29.2.34587 > 10.0.29.3.3784: BFDv1, Control, State Up, Flags: [none], length: 24
 00:00:25.785755 eth1  In  IP 10.0.29.3.53368 > 10.0.29.2.3784: BFDv1, Control, State Up, Flags: [none], length: 24
 00:00:25.838190 eth1  Out IP 10.0.29.2.34587 > 10.0.29.3.3784: BFDv1, Control, State Up, Flags: [none], length: 24
 00:00:25.864546 eth1  In  IP 10.0.29.3.53368 > 10.0.29.2.3784: BFDv1, Control, State Up, Flags: [none], length: 24
 00:00:25.926988 eth1  Out IP 10.0.29.2.34587 > 10.0.29.3.3784: BFDv1, Control, State Up, Flags: [none], length: 24
 00:00:25.946517 eth1  In  IP 10.0.29.3.53368 > 10.0.29.2.3784: BFDv1, Control, State Up, Flags: [none], length: 24
 00:00:26.010015 eth1  Out IP 10.0.29.2.34587 > 10.0.29.3.3784: BFDv1, Control, State Up, Flags: [none], length: 24
 00:00:26.025295 eth1  In  IP 10.0.29.3.53368 > 10.0.29.2.3784: BFDv1, Control, State Up, Flags: [none], length: 24
 00:00:26.088692 eth1  Out IP 10.0.29.2.34587 > 10.0.29.3.3784: BFDv1, Control, State Up, Flags: [none], length: 24
 00:00:26.111945 eth1  In  IP 10.0.29.3.53368 > 10.0.29.2.3784: BFDv1, Control, State Up, Flags: [none], length: 24
 00:00:26.169004 eth1  Out IP 10.0.29.2.34587 > 10.0.29.3.3784: BFDv1, Control, State Up, Flags: [none], length: 24
 00:00:26.200641 eth1  In  IP 10.0.29.3.53368 > 10.0.29.2.3784: BFDv1, Control, State Up, Flags: [none], length: 24
 00:00:26.250968 eth1  Out IP 10.0.29.2.34587 > 10.0.29.3.3784: BFDv1, Control, State Up, Flags: [none], length: 24
 00:00:26.282217 eth1  In  IP 10.0.29.3.53368 > 10.0.29.2.3784: BFDv1, Control, State Up, Flags: [none], length: 24
 00:00:26.328663 eth1  Out IP 10.0.29.2.34587 > 10.0.29.3.3784: BFDv1, Control, State Up, Flags: [none], length: 24
 00:00:26.367458 eth1  In  IP 10.0.29.3.53368 > 10.0.29.2.3784: BFDv1, Control, State Up, Flags: [none], length: 24
 00:00:26.404932 eth1  Out IP 10.0.29.2.34587 > 10.0.29.3.3784: BFDv1, Control, State Up, Flags: [none], length: 24
 00:00:26.455750 eth1  In  IP 10.0.29.3.53368 > 10.0.29.2.3784: BFDv1, Control, State Up, Flags: [none], length: 24
 00:00:26.488100 eth1  Out IP 10.0.29.2.34587 > 10.0.29.3.3784: BFDv1, Control, State Up, Flags: [none], length: 24
 00:00:26.543638 eth1  In  IP 10.0.29.3.53368 > 10.0.29.2.3784: BFDv1, Control, State Up, Flags: [none], length: 24
 00:00:26.566994 eth1  Out IP 10.0.29.2.34587 > 10.0.29.3.3784: BFDv1, Control, State Up, Flags: [none], length: 24
 00:00:26.622006 eth1  In  IP 10.0.29.3.53368 > 10.0.29.2.3784: BFDv1, Control, State Up, Flags: [none], length: 24
 00:00:26.645281 eth1  Out IP 10.0.29.2.34587 > 10.0.29.3.3784: BFDv1, Control, State Up, Flags: [none], length: 24
 00:00:26.706577 eth1  In  IP 10.0.29.3.53368 > 10.0.29.2.3784: BFDv1, Control, State Up, Flags: [none], length: 24
 00:00:26.720933 eth1  Out IP 10.0.29.2.34587 > 10.0.29.3.3784: BFDv1, Control, State Up, Flags: [none], length: 24
 00:00:26.785929 eth1  Out IP 10.0.29.2.39723 > 10.0.29.3.179: Flags [S], seq 1039687628, win 64240, options [mss 1460,sackOK,TS val 1876873069 ecr 0,nop,wscale 10], length 0
 00:00:26.785993 eth1  In  IP 10.0.29.3.179 > 10.0.29.2.39723: Flags [S.], seq 2183415800, ack 1039687629, win 65160, options [mss 1460,sackOK,TS val 3829628043 ecr 1876873069,nop,wscale 10], length 0
 00:00:26.786021 eth1  Out IP 10.0.29.2.39723 > 10.0.29.3.179: Flags [.], ack 1, win 63, options [nop,nop,TS val 1876873069 ecr 3829628043], length 0
 00:00:26.786119 eth1  Out IP 10.0.29.2.39723 > 10.0.29.3.179: Flags [P.], seq 1:65, ack 1, win 63, options [nop,nop,TS val 1876873069 ecr 3829628043], length 64: BGP
 00:00:26.786166 eth1  In  IP 10.0.29.3.179 > 10.0.29.2.39723: Flags [.], ack 65, win 64, options [nop,nop,TS val 3829628043 ecr 1876873069], length 0
 00:00:26.786217 eth1  In  IP 10.0.29.3.179 > 10.0.29.2.39723: Flags [R.], seq 1, ack 65, win 64, options [nop,nop,TS val 3829628043 ecr 1876873069], length 0
 00:00:26.793044 eth1  In  IP 10.0.29.3.53368 > 10.0.29.2.3784: BFDv1, Control, State Up, Flags: [none], length: 24
 00:00:26.807365 eth1  Out IP 10.0.29.2.34587 > 10.0.29.3.3784: BFDv1, Control, State Up, Flags: [none], length: 24
 00:00:26.879438 eth1  In  IP 10.0.29.3.53368 > 10.0.29.2.3784: BFDv1, Control, State Up, Flags: [none], length: 24
 00:00:26.890708 eth1  Out IP 10.0.29.2.34587 > 10.0.29.3.3784: BFDv1, Control, State Up, Flags: [none], length: 24
 00:00:26.968009 eth1  Out IP 10.0.29.2.34587 > 10.0.29.3.3784: BFDv1, Control, State Up, Flags: [none], length: 24
 00:00:26.968184 eth1  In  IP 10.0.29.3.53368 > 10.0.29.2.3784: BFDv1, Control, State Up, Flags: [none], length: 24
 00:00:27.053530 eth1  In  IP 10.0.29.3.53368 > 10.0.29.2.3784: BFDv1, Control, State Up, Flags: [none], length: 24
 00:00:27.056897 eth1  Out IP 10.0.29.2.34587 > 10.0.29.3.3784: BFDv1, Control, State Up, Flags: [none], length: 24
 00:00:27.128551 eth1  In  IP 10.0.29.3.53368 > 10.0.29.2.3784: BFDv1, Control, State Up, Flags: [none], length: 24
 00:00:27.141988 eth1  Out IP 10.0.29.2.34587 > 10.0.29.3.3784: BFDv1, Control, State Up, Flags: [none], length: 24
 00:00:27.217438 eth1  In  IP 10.0.29.3.53368 > 10.0.29.2.3784: BFDv1, Control, State Up, Flags: [none], length: 24
 00:00:27.222795 eth1  Out IP 10.0.29.2.34587 > 10.0.29.3.3784: BFDv1, Control, State Up, Flags: [none], length: 24
 00:00:27.305723 eth1  In  IP 10.0.29.3.53368 > 10.0.29.2.3784: BFDv1, Control, State Up, Flags: [none], length: 24
 00:00:27.305963 eth1  Out IP 10.0.29.2.34587 > 10.0.29.3.3784: BFDv1, Control, State Up, Flags: [none], length: 24
 00:00:27.381778 eth1  In  IP 10.0.29.3.53368 > 10.0.29.2.3784: BFDv1, Control, State Up, Flags: [none], length: 24
 00:00:27.384062 eth1  Out IP 10.0.29.2.34587 > 10.0.29.3.3784: BFDv1, Control, State Up, Flags: [none], length: 24
 00:00:27.459327 eth1  Out IP 10.0.29.2.34587 > 10.0.29.3.3784: BFDv1, Control, State Up, Flags: [none], length: 24
 00:00:27.468568 eth1  In  IP 10.0.29.3.53368 > 10.0.29.2.3784: BFDv1, Control, State Up, Flags: [none], length: 24
 00:00:27.538076 eth1  Out IP 10.0.29.2.34587 > 10.0.29.3.3784: BFDv1, Control, State Up, Flags: [none], length: 24
 00:00:27.547141 eth1  In  IP 10.0.29.3.53368 > 10.0.29.2.3784: BFDv1, Control, State Up, Flags: [none], length: 24
 00:00:27.621458 eth1  Out IP 10.0.29.2.34587 > 10.0.29.3.3784: BFDv1, Control, State Up, Flags: [none], length: 24
 00:00:27.636070 eth1  In  IP 10.0.29.3.53368 > 10.0.29.2.3784: BFDv1, Control, State Up, Flags: [none], length: 24
 00:00:27.703450 eth1  Out IP 10.0.29.2.34587 > 10.0.29.3.3784: BFDv1, Control, State Up, Flags: [none], length: 24
 00:00:27.724988 eth1  In  IP 10.0.29.3.53368 > 10.0.29.2.3784: BFDv1, Control, State Up, Flags: [none], length: 24
 00:00:27.785304 eth1  Out IP 10.0.29.2.34587 > 10.0.29.3.3784: BFDv1, Control, State Up, Flags: [none], length: 24
 00:00:27.813907 eth1  In  IP 10.0.29.3.53368 > 10.0.29.2.3784: BFDv1, Control, State Up, Flags: [none], length: 24
 00:00:27.865240 eth1  Out IP 10.0.29.2.34587 > 10.0.29.3.3784: BFDv1, Control, State Up, Flags: [none], length: 24
 00:00:27.896192 eth1  In  IP 10.0.29.3.53368 > 10.0.29.2.3784: BFDv1, Control, State Up, Flags: [none], length: 24
 00:00:27.946503 eth1  Out IP 10.0.29.2.34587 > 10.0.29.3.3784: BFDv1, Control, State Up, Flags: [none], length: 24
 00:00:27.973032 eth1  In  IP 10.0.29.3.53368 > 10.0.29.2.3784: BFDv1, Control, State Up, Flags: [none], length: 24
 00:00:28.034400 eth1  Out IP 10.0.29.2.34587 > 10.0.29.3.3784: BFDv1, Control, State Up, Flags: [none], length: 24
 00:00:28.050646 eth1  In  IP 10.0.29.3.53368 > 10.0.29.2.3784: BFDv1, Control, State Up, Flags: [none], length: 24
 00:00:28.124989 eth1  Out IP 10.0.29.2.34587 > 10.0.29.3.3784: BFDv1, Control, State Up, Flags: [none], length: 24
 00:00:28.139210 eth1  In  IP 10.0.29.3.53368 > 10.0.29.2.3784: BFDv1, Control, State Up, Flags: [none], length: 24
 00:00:28.204547 eth1  Out IP 10.0.29.2.34587 > 10.0.29.3.3784: BFDv1, Control, State Up, Flags: [none], length: 24
 00:00:28.228131 eth1  In  IP 10.0.29.3.53368 > 10.0.29.2.3784: BFDv1, Control, State Up, Flags: [none], length: 24
 00:00:28.285514 eth1  Out IP 10.0.29.2.34587 > 10.0.29.3.3784: BFDv1, Control, State Up, Flags: [none], length: 24
 00:00:28.314103 eth1  In  IP 10.0.29.3.53368 > 10.0.29.2.3784: BFDv1, Control, State Up, Flags: [none], length: 24
 00:00:28.362423 eth1  Out IP 10.0.29.2.34587 > 10.0.29.3.3784: BFDv1, Control, State Up, Flags: [none], length: 24
 00:00:28.394472 eth1  In  IP 10.0.29.3.53368 > 10.0.29.2.3784: BFDv1, Control, State Up, Flags: [none], length: 24
 00:00:28.446782 eth1  Out IP 10.0.29.2.34587 > 10.0.29.3.3784: BFDv1, Control, State Up, Flags: [none], length: 24
 00:00:28.472014 eth1  In  IP 10.0.29.3.53368 > 10.0.29.2.3784: BFDv1, Control, State Up, Flags: [none], length: 24
 00:00:28.535400 eth1  Out IP 10.0.29.2.34587 > 10.0.29.3.3784: BFDv1, Control, State Up, Flags: [none], length: 24
 00:00:28.546913 eth1  In  IP 10.0.29.3.53368 > 10.0.29.2.3784: BFDv1, Control, State Up, Flags: [none], length: 24
 00:00:28.616257 eth1  Out IP 10.0.29.2.34587 > 10.0.29.3.3784: BFDv1, Control, State Up, Flags: [none], length: 24
 00:00:28.624492 eth1  In  IP 10.0.29.3.53368 > 10.0.29.2.3784: BFDv1, Control, State Up, Flags: [none], length: 24
 00:00:28.700275 eth1  In  IP 10.0.29.3.53368 > 10.0.29.2.3784: BFDv1, Control, State Up, Flags: [none], length: 24
 00:00:28.700434 eth1  Out IP 10.0.29.2.34587 > 10.0.29.3.3784: BFDv1, Control, State Up, Flags: [none], length: 24
 00:00:28.781672 eth1  Out IP 10.0.29.2.34587 > 10.0.29.3.3784: BFDv1, Control, State Up, Flags: [none], length: 24
 00:00:28.789021 eth1  In  IP 10.0.29.3.53368 > 10.0.29.2.3784: BFDv1, Control, State Up, Flags: [none], length: 24
 00:00:28.865365 eth1  Out IP 10.0.29.2.34587 > 10.0.29.3.3784: BFDv1, Control, State Up, Flags: [none], length: 24
 00:00:28.865469 eth1  In  IP 10.0.29.3.53368 > 10.0.29.2.3784: BFDv1, Control, State Up, Flags: [none], length: 24
 00:00:28.944789 eth1  In  IP 10.0.29.3.53368 > 10.0.29.2.3784: BFDv1, Control, State Up, Flags: [none], length: 24
 00:00:28.953080 eth1  Out IP 10.0.29.2.34587 > 10.0.29.3.3784: BFDv1, Control, State Up, Flags: [none], length: 24
 00:00:29.029721 eth1  In  IP 10.0.29.3.53368 > 10.0.29.2.3784: BFDv1, Control, State Up, Flags: [none], length: 24
 00:00:29.035083 eth1  Out IP 10.0.29.2.34587 > 10.0.29.3.3784: BFDv1, Control, State Up, Flags: [none], length: 24
 00:00:29.115355 eth1  Out IP 10.0.29.2.34587 > 10.0.29.3.3784: BFDv1, Control, State Up, Flags: [none], length: 24
 00:00:29.117590 eth1  In  IP 10.0.29.3.53368 > 10.0.29.2.3784: BFDv1, Control, State Up, Flags: [none], length: 24
 00:00:29.196265 eth1  In  IP 10.0.29.3.53368 > 10.0.29.2.3784: BFDv1, Control, State Up, Flags: [none], length: 24
 00:00:29.203582 eth1  Out IP 10.0.29.2.34587 > 10.0.29.3.3784: BFDv1, Control, State Up, Flags: [none], length: 24
 00:00:29.277089 eth1  In  IP 10.0.29.3.53368 > 10.0.29.2.3784: BFDv1, Control, State Up, Flags: [none], length: 24
 00:00:29.282358 eth1  Out IP 10.0.29.2.34587 > 10.0.29.3.3784: BFDv1, Control, State Up, Flags: [none], length: 24
 00:00:29.356723 eth1  In  IP 10.0.29.3.53368 > 10.0.29.2.3784: BFDv1, Control, State Up, Flags: [none], length: 24
 00:00:29.368121 eth1  Out IP 10.0.29.2.34587 > 10.0.29.3.3784: BFDv1, Control, State Up, Flags: [none], length: 24
 00:00:29.433624 eth1  In  IP 10.0.29.3.53368 > 10.0.29.2.3784: BFDv1, Control, State Up, Flags: [none], length: 24
 00:00:29.449021 eth1  Out IP 10.0.29.2.34587 > 10.0.29.3.3784: BFDv1, Control, State Up, Flags: [none], length: 24
 00:00:29.510436 eth1  In  IP 10.0.29.3.53368 > 10.0.29.2.3784: BFDv1, Control, State Up, Flags: [none], length: 24
 00:00:29.529765 eth1  Out IP 10.0.29.2.34587 > 10.0.29.3.3784: BFDv1, Control, State Up, Flags: [none], length: 24
 00:00:29.600127 eth1  In  IP 10.0.29.3.53368 > 10.0.29.2.3784: BFDv1, Control, State Up, Flags: [none], length: 24
 00:00:29.614470 eth1  Out IP 10.0.29.2.34587 > 10.0.29.3.3784: BFDv1, Control, State Up, Flags: [none], length: 24
 00:00:29.680720 eth1  In  IP 10.0.29.3.53368 > 10.0.29.2.3784: BFDv1, Control, State Up, Flags: [none], length: 24
 00:00:29.691074 eth1  Out IP 10.0.29.2.34587 > 10.0.29.3.3784: BFDv1, Control, State Up, Flags: [none], length: 24
 00:00:29.767476 eth1  In  IP 10.0.29.3.53368 > 10.0.29.2.3784: BFDv1, Control, State Up, Flags: [none], length: 24
 00:00:29.776811 eth1  Out IP 10.0.29.2.34587 > 10.0.29.3.3784: BFDv1, Control, State Up, Flags: [none], length: 24
 00:00:29.853239 eth1  In  IP 10.0.29.3.53368 > 10.0.29.2.3784: BFDv1, Control, State Up, Flags: [none], length: 24
 00:00:29.854534 eth1  Out IP 10.0.29.2.34587 > 10.0.29.3.3784: BFDv1, Control, State Up, Flags: [none], length: 24
 00:00:29.933800 eth1  Out IP 10.0.29.2.34587 > 10.0.29.3.3784: BFDv1, Control, State Up, Flags: [none], length: 24
 00:00:29.938776 eth1  In  IP 10.0.29.3.53368 > 10.0.29.2.3784: BFDv1, Control, State Up, Flags: [none], length: 24
 00:00:30.020121 eth1  Out IP 10.0.29.2.34587 > 10.0.29.3.3784: BFDv1, Control, State Up, Flags: [none], length: 24
 00:00:30.023308 eth1  In  IP 10.0.29.3.53368 > 10.0.29.2.3784: BFDv1, Control, State Up, Flags: [none], length: 24
 00:00:30.099669 eth1  In  IP 10.0.29.3.53368 > 10.0.29.2.3784: BFDv1, Control, State Up, Flags: [none], length: 24
 00:00:30.100915 eth1  Out IP 10.0.29.2.34587 > 10.0.29.3.3784: BFDv1, Control, State Up, Flags: [none], length: 24
 00:00:30.181069 eth1  In  IP 10.0.29.3.53368 > 10.0.29.2.3784: BFDv1, Control, State Up, Flags: [none], length: 24
 00:00:30.188414 eth1  Out IP 10.0.29.2.34587 > 10.0.29.3.3784: BFDv1, Control, State Up, Flags: [none], length: 24

582 packets captured
585 packets received by filter
0 packets dropped by kernel
