tcpdump: data link type LINUX_SLL2
tcpdump: verbose output suppressed, use -v[v]... for full protocol decode
listening on any, link-type LINUX_SLL2 (Linux cooked v2), snapshot length 262144 bytes
 00:00:00.000000 eth1  Out IP 10.0.23.3.33100 > 10.0.23.2.3784: BFDv1, Control, State Up, Flags: [none], length: 24
 00:00:00.017223 eth0  Out IP 10.0.13.3.36570 > 10.0.13.2.3784: BFDv1, Control, State Up, Flags: [none], length: 24
 00:00:00.017496 eth2  In  IP 10.0.34.3.47228 > 10.0.34.2.3784: BFDv1, Control, State Up, Flags: [none], length: 24
 00:00:00.040498 eth3  In  IP 10.0.35.3.35105 > 10.0.35.2.3784: BFDv1, Control, State Up, Flags: [none], length: 24
 00:00:00.054893 eth0  In  IP 10.0.13.2.37532 > 10.0.13.3.3784: BFDv1, Control, State Up, Flags: [none], length: 24
 00:00:00.056822 eth1  In  IP 10.0.23.2.57018 > 10.0.23.3.3784: BFDv1, Control, State Up, Flags: [none], length: 24
 00:00:00.081793 eth3  Out IP 10.0.35.2.50865 > 10.0.35.3.3784: BFDv1, Control, State Up, Flags: [none], length: 24
 00:00:00.081872 eth2  Out IP 10.0.34.2.42255 > 10.0.34.3.3784: BFDv1, Control, State Up, Flags: [none], length: 24
 00:00:00.081908 eth1  Out IP 10.0.23.3.33100 > 10.0.23.2.3784: BFDv1, Control, State Up, Flags: [none], length: 24
 00:00:00.096100 eth2  In  IP 10.0.34.3.47228 > 10.0.34.2.3784: BFDv1, Control, State Up, Flags: [none], length: 24
 00:00:00.096108 eth0  Out IP 10.0.13.3.36570 > 10.0.13.2.3784: BFDv1, Control, State Up, Flags: [none], length: 24
 00:00:00.125093 eth3  In  IP 10.0.35.3.35105 > 10.0.35.2.3784: BFDv1, Control, State Up, Flags: [none], length: 24
 00:00:00.132016 eth0  In  IP 10.0.13.2.37532 > 10.0.13.3.3784: BFDv1, Control, State Up, Flags: [none], length: 24
 00:00:00.137377 eth3  Out IP 10.0.35.2.50865 > 10.0.35.3.3784: BFDv1, Control, State Up, Flags: [none], length: 24
 00:00:00.144302 eth1  In  IP 10.0.23.2.57018 > 10.0.23.3.3784: BFDv1, Control, State Up, Flags: [none], length: 24
 00:00:00.150690 eth2  Out IP 10.0.34.2.42255 > 10.0.34.3.3784: BFDv1, Control, State Up, Flags: [none], length: 24
 00:00:00.158881 eth1  Out IP 10.0.23.3.33100 > 10.0.23.2.3784: BFDv1, Control, State Up, Flags: [none], length: 24
 00:00:00.178485 eth2  In  IP 10.0.34.3.47228 > 10.0.34.2.3784: BFDv1, Control, State Up, Flags: [none], length: 24
 00:00:00.180838 eth0  Out IP 10.0.13.3.36570 > 10.0.13.2.3784: BFDv1, Control, State Up, Flags: [none], length: 24
 00:00:00.202616 eth3  In  IP 10.0.35.3.35105 > 10.0.35.2.3784: BFDv1, Control, State Up, Flags: [none], length: 24
 00:00:00.209432 eth0  In  IP 10.0.13.2.37532 > 10.0.13.3.3784: BFDv1, Control, State Up, Flags: [none], length: 24
 00:00:00.220837 eth3  Out IP 10.0.35.2.50865 > 10.0.35.3.3784: BFDv1, Control, State Up, Flags: [none], length: 24
 00:00:00.232702 eth1  In  IP 10.0.23.2.57018 > 10.0.23.3.3784: BFDv1, Control, State Up, Flags: [none], length: 24
 00:00:00.235991 eth2  Out IP 10.0.34.2.42255 > 10.0.34.3.3784: BFDv1, Control, State Up, Flags: [none], length: 24
 00:00:00.243201 eth1  Out IP 10.0.23.3.33100 > 10.0.23.2.3784: BFDv1, Control, State Up, Flags: [none], length: 24
 00:00:00.261763 eth2  In  IP 10.0.34.3.47228 > 10.0.34.2.3784: BFDv1, Control, State Up, Flags: [none], length: 24
 00:00:00.263126 eth0  Out IP 10.0.13.3.36570 > 10.0.13.2.3784: BFDv1, Control, State Up, Flags: [none], length: 24
 00:00:00.286833 eth0  In  IP 10.0.13.2.37532 > 10.0.13.3.3784: BFDv1, Control, State Up, Flags: [none], length: 24
 00:00:00.291364 eth3  In  IP 10.0.35.3.35105 > 10.0.35.2.3784: BFDv1, Control, State Up, Flags: [none], length: 24
 00:00:00.302944 eth3  Out IP 10.0.35.2.50865 > 10.0.35.3.3784: BFDv1, Control, State Up, Flags: [none], length: 24
 00:00:00.313415 eth1  In  IP 10.0.23.2.57018 > 10.0.23.3.3784: BFDv1, Control, State Up, Flags: [none], length: 24
 00:00:00.318776 eth1  Out IP 10.0.23.3.33100 > 10.0.23.2.3784: BFDv1, Control, State Up, Flags: [none], length: 24
 00:00:00.325040 eth2  Out IP 10.0.34.2.42255 > 10.0.34.3.3784: BFDv1, Control, State Up, Flags: [none], length: 24
 00:00:00.337286 eth2  In  IP 10.0.34.3.47228 > 10.0.34.2.3784: BFDv1, Control, State Up, Flags: [none], length: 24
 00:00:00.345675 eth0  Out IP 10.0.13.3.36570 > 10.0.13.2.3784: BFDv1, Control, State Up, Flags: [none], length: 24
 00:00:00.372915 eth0  In  IP 10.0.13.2.37532 > 10.0.13.3.3784: BFDv1, Control, State Up, Flags: [none], length: 24
 00:00:00.375352 eth3  In  IP 10.0.35.3.35105 > 10.0.35.2.3784: BFDv1, Control, State Up, Flags: [none], length: 24
 00:00:00.387724 eth3  Out IP 10.0.35.2.50865 > 10.0.35.3.3784: BFDv1, Control, State Up, Flags: [none], length: 24
 00:00:00.397725 eth1  In  IP 10.0.23.2.57018 > 10.0.23.3.3784: BFDv1, Control, State Up, Flags: [none], length: 24
 00:00:00.406081 eth2  Out IP 10.0.34.2.42255 > 10.0.34.3.3784: BFDv1, Control, State Up, Flags: [none], length: 24
 00:00:00.406157 eth1  Out IP 10.0.23.3.33100 > 10.0.23.2.3784: BFDv1, Control, State Up, Flags: [none], length: 24
 00:00:00.424387 eth0  Out IP 10.0.13.3.36570 > 10.0.13.2.3784: BFDv1, Control, State Up, Flags: [none], length: 24
 00:00:00.424734 eth2  In  IP 10.0.34.3.47228 > 10.0.34.2.3784: BFDv1, Control, State Up, Flags: [none], length: 24
 00:00:00.456832 eth3  In  IP 10.0.35.3.35105 > 10.0.35.2.3784: BFDv1, Control, State Up, Flags: [none], length: 24
 00:00:00.460042 eth0  In  IP 10.0.13.2.37532 > 10.0.13.3.3784: BFDv1, Control, State Up, Flags: [none], length: 24
 00:00:00.477387 eth3  Out IP 10.0.35.2.50865 > 10.0.35.3.3784: BFDv1, Control, State Up, Flags: [none], length: 24
 00:00:00.478206 eth1  In  IP 10.0.23.2.57018 > 10.0.23.3.3784: BFDv1, Control, State Up, Flags: [none], length: 24
 00:00:00.490640 eth2  Out IP 10.0.34.2.42255 > 10.0.34.3.3784: BFDv1, Control, State Up, Flags: [none], length: 24
 00:00:00.491981 eth1  Out IP 10.0.23.3.33100 > 10.0.23.2.3784: BFDv1, Control, State Up, Flags: [none], length: 24
 00:00:00.505822 eth2  In  IP 10.0.34.3.47228 > 10.0.34.2.3784: BFDv1, Control, State Up, Flags: [none], length: 24
 00:00:00.507057 eth0  Out IP 10.0.13.3.36570 > 10.0.13.2.3784: BFDv1, Control, State Up, Flags: [none], length: 24
 00:00:00.543054 eth3  In  IP 10.0.35.3.35105 > 10.0.35.2.3784: BFDv1, Control, State Up, Flags: [none], length: 24
 00:00:00.549682 eth0  In  IP 10.0.13.2.37532 > 10.0.13.3.3784: BFDv1, Control, State Up, Flags: [none], length: 24
 00:00:00.562203 eth3  Out IP 10.0.35.2.50865 > 10.0.35.3.3784: BFDv1, Control, State Up, Flags: [none], length: 24
 00:00:00.564852 eth1  In  IP 10.0.23.2.57018 > 10.0.23.3.3784: BFDv1, Control, State Up, Flags: [none], length: 24
 00:00:00.571230 eth2  Out IP 10.0.34.2.42255 > 10.0.34.3.3784: BFDv1, Control, State Up, Flags: [none], length: 24
 00:00:00.571318 eth1  Out IP 10.0.23.3.33100 > 10.0.23.2.3784: BFDv1, Control, State Up, Flags: [none], length: 24
 00:00:00.583024 eth2  In  IP 10.0.34.3.47228 > 10.0.34.2.3784: BFDv1, Control, State Up, Flags: [none], length: 24
 00:00:00.597389 eth0  Out IP 10.0.13.3.36570 > 10.0.13.2.3784: BFDv1, Control, State Up, Flags: [none], length: 24
 00:00:00.627739 eth3  In  IP 10.0.35.3.35105 > 10.0.35.2.3784: BFDv1, Control, State Up, Flags: [none], length: 24
 00:00:00.637643 eth0  In  IP 10.0.13.2.37532 > 10.0.13.3.3784: BFDv1, Control, State Up, Flags: [none], length: 24
 00:00:00.648013 eth3  Out IP 10.0.35.2.50865 > 10.0.35.3.3784: BFDv1, Control, State Up, Flags: [none], length: 24
 00:00:00.649705 eth1  Out IP 10.0.23.3.33100 > 10.0.23.2.3784: BFDv1, Control, State Up, Flags: [none], length: 24
 00:00:00.649778 eth1  In  IP 10.0.23.2.57018 > 10.0.23.3.3784: BFDv1, Control, State Up, Flags: [none], length: 24
 00:00:00.652041 eth2  Out IP 10.0.34.2.42255 > 10.0.34.3.3784: BFDv1, Control, State Up, Flags: [none], length: 24
 00:00:00.667261 eth2  In  IP 10.0.34.3.47228 > 10.0.34.2.3784: BFDv1, Control, State Up, Flags: [none], length: 24
 00:00:00.674709 eth0  Out IP 10.0.13.3.36570 > 10.0.13.2.3784: BFDv1, Control, State Up, Flags: [none], length: 24
 00:00:00.706478 eth3  In  IP 10.0.35.3.35105 > 10.0.35.2.3784: BFDv1, Control, State Up, Flags: [none], length: 24
 00:00:00.722841 eth3  Out IP 10.0.35.2.50865 > 10.0.35.3.3784: BFDv1, Control, State Up, Flags: [none], length: 24
 00:00:00.722912 eth0  In  IP 10.0.13.2.37532 > 10.0.13.3.3784: BFDv1, Control, State Up, Flags: [none], length: 24
 00:00:00.729206 eth1  Out IP 10.0.23.3.33100 > 10.0.23.2.3784: BFDv1, Control, State Up, Flags: [none], length: 24
 00:00:00.731322 eth1  In  IP 10.0.23.2.57018 > 10.0.23.3.3784: BFDv1, Control, State Up, Flags: [none], length: 24
 00:00:00.733627 eth2  Out IP 10.0.34.2.42255 > 10.0.34.3.3784: BFDv1, Control, State Up, Flags: [none], length: 24
 00:00:00.743834 eth2  In  IP 10.0.34.3.47228 > 10.0.34.2.3784: BFDv1, Control, State Up, Flags: [none], length: 24
 00:00:00.754213 eth0  Out IP 10.0.13.3.36570 > 10.0.13.2.3784: BFDv1, Control, State Up, Flags: [none], length: 24
 00:00:00.788240 eth3  In  IP 10.0.35.3.35105 > 10.0.35.2.3784: BFDv1, Control, State Up, Flags: [none], length: 24
 00:00:00.805818 eth0  In  IP 10.0.13.2.37532 > 10.0.13.3.3784: BFDv1, Control, State Up, Flags: [none], length: 24
 00:00:00.809314 eth1  In  IP 10.0.23.2.57018 > 10.0.23.3.3784: BFDv1, Control, State Up, Flags: [none], length: 24
 00:00:00.812684 eth3  Out IP 10.0.35.2.50865 > 10.0.35.3.3784: BFDv1, Control, State Up, Flags: [none], length: 24
 00:00:00.817881 eth1  Out IP 10.0.23.3.33100 > 10.0.23.2.3784: BFDv1, Control, State Up, Flags: [none], length: 24
 00:00:00.822074 eth2  Out IP 10.0.34.2.42255 > 10.0.34.3.3784: BFDv1, Control, State Up, Flags: [none], length: 24
 00:00:00.829262 eth2  In  IP 10.0.34.3.47228 > 10.0.34.2.3784: BFDv1, Control, State Up, Flags: [none], length: 24
 00:00:00.836623 eth0  Out IP 10.0.13.3.36570 > 10.0.13.2.3784: BFDv1, Control, State Up, Flags: [none], length: 24
 00:00:00.872103 eth3  In  IP 10.0.35.3.35105 > 10.0.35.2.3784: BFDv1, Control, State Up, Flags: [none], length: 24
 00:00:00.887375 eth1  In  IP 10.0.23.2.57018 > 10.0.23.3.3784: BFDv1, Control, State Up, Flags: [none], length: 24
 00:00:00.893353 eth0  In  IP 10.0.13.2.37532 > 10.0.13.3.3784: BFDv1, Control, State Up, Flags: [none], length: 24
 00:00:00.895672 eth3  Out IP 10.0.35.2.50865 > 10.0.35.3.3784: BFDv1, Control, State Up, Flags: [none], length: 24
 00:00:00.899911 eth1  Out IP 10.0.23.3.33100 > 10.0.23.2.3784: BFDv1, Control, State Up, Flags: [none], length: 24
 00:00:00.905243 eth2  In  IP 10.0.34.3.47228 > 10.0.34.2.3784: BFDv1, Control, State Up, Flags: [none], length: 24
 00:00:00.911658 eth2  Out IP 10.0.34.2.42255 > 10.0.34.3.3784: BFDv1, Control, State Up, Flags: [none], length: 24
 00:00:00.925952 eth0  Out IP 10.0.13.3.36570 > 10.0.13.2.3784: BFDv1, Control, State Up, Flags: [none], length: 24
 00:00:00.957111 eth3  In  IP 10.0.35.3.35105 > 10.0.35.2.3784: BFDv1, Control, State Up, Flags: [none], length: 24
 00:00:00.963526 eth1  In  IP 10.0.23.2.57018 > 10.0.23.3.3784: BFDv1, Control, State Up, Flags: [none], length: 24
 00:00:00.973599 eth0  In  IP 10.0.13.2.37532 > 10.0.13.3.3784: BFDv1, Control, State Up, Flags: [none], length: 24
 00:00:00.975900 eth1  Out IP 10.0.23.3.33100 > 10.0.23.2.3784: BFDv1, Control, State Up, Flags: [none], length: 24
 00:00:00.975948 eth3  Out IP 10.0.35.2.50865 > 10.0.35.3.3784: BFDv1, Control, State Up, Flags: [none], length: 24
 00:00:00.985618 eth2  In  IP 10.0.34.3.47228 > 10.0.34.2.3784: BFDv1, Control, State Up, Flags: [none], length: 24
 00:00:00.994039 eth2  Out IP 10.0.34.2.42255 > 10.0.34.3.3784: BFDv1, Control, State Up, Flags: [none], length: 24
 00:00:01.002317 eth0  Out IP 10.0.13.3.36570 > 10.0.13.2.3784: BFDv1, Control, State Up, Flags: [none], length: 24
 00:00:01.041494 eth1  In  IP 10.0.23.2.57018 > 10.0.23.3.3784: BFDv1, Control, State Up, Flags: [none], length: 24
 00:00:01.042370 eth3  In  IP 10.0.35.3.35105 > 10.0.35.2.3784: BFDv1, Control, State Up, Flags: [none], length: 24
 00:00:01.057146 eth0  In  IP 10.0.13.2.37532 > 10.0.13.3.3784: BFDv1, Control, State Up, Flags: [none], length: 24
 00:00:01.064014 eth3  Out IP 10.0.35.2.50865 > 10.0.35.3.3784: BFDv1, Control, State Up, Flags: [none], length: 24
 00:00:01.064253 eth1  Out IP 10.0.23.3.33100 > 10.0.23.2.3784: BFDv1, Control, State Up, Flags: [none], length: 24
 00:00:01.072644 eth2  In  IP 10.0.34.3.47228 > 10.0.34.2.3784: BFDv1, Control, State Up, Flags: [none], length: 24
 00:00:01.074330 eth2  Out IP 10.0.34.2.42255 > 10.0.34.3.3784: BFDv1, Control, State Up, Flags: [none], length: 24
 00:00:01.089786 eth0  Out IP 10.0.13.3.36570 > 10.0.13.2.3784: BFDv1, Control, State Up, Flags: [none], length: 24
 00:00:01.119469 eth3  In  IP 10.0.35.3.35105 > 10.0.35.2.3784: BFDv1, Control, State Up, Flags: [none], length: 24
 00:00:01.124183 eth1  In  IP 10.0.23.2.57018 > 10.0.23.3.3784: BFDv1, Control, State Up, Flags: [none], length: 24
 00:00:01.139490 eth1  Out IP 10.0.23.3.33100 > 10.0.23.2.3784: BFDv1, Control, State Up, Flags: [none], length: 24
 00:00:01.140584 eth0  In  IP 10.0.13.2.37532 > 10.0.13.3.3784: BFDv1, Control, State Up, Flags: [none], length: 24
 00:00:01.145857 eth3  Out IP 10.0.35.2.50865 > 10.0.35.3.3784: BFDv1, Control, State Up, Flags: [none], length: 24
 00:00:01.154094 eth2  Out IP 10.0.34.2.42255 > 10.0.34.3.3784: BFDv1, Control, State Up, Flags: [none], length: 24
 00:00:01.161506 eth2  In  IP 10.0.34.3.47228 > 10.0.34.2.3784: BFDv1, Control, State Up, Flags: [none], length: 24
 00:00:01.166836 eth0  Out IP 10.0.13.3.36570 > 10.0.13.2.3784: BFDv1, Control, State Up, Flags: [none], length: 24
 00:00:01.204277 eth3  In  IP 10.0.35.3.35105 > 10.0.35.2.3784: BFDv1, Control, State Up, Flags: [none], length: 24
 00:00:01.211153 eth1  In  IP 10.0.23.2.57018 > 10.0.23.3.3784: BFDv1, Control, State Up, Flags: [none], length: 24
 00:00:01.220447 eth1  Out IP 10.0.23.3.33100 > 10.0.23.2.3784: BFDv1, Control, State Up, Flags: [none], length: 24
 00:00:01.229022 eth0  In  IP 10.0.13.2.37532 > 10.0.13.3.3784: BFDv1, Control, State Up, Flags: [none], length: 24
 00:00:01.230324 eth2  Out IP 10.0.34.2.42255 > 10.0.34.3.3784: BFDv1, Control, State Up, Flags: [none], length: 24
 00:00:01.231591 eth3  Out IP 10.0.35.2.50865 > 10.0.35.3.3784: BFDv1, Control, State Up, Flags: [none], length: 24
 00:00:01.242793 eth0  Out IP 10.0.13.3.36570 > 10.0.13.2.3784: BFDv1, Control, State Up, Flags: [none], length: 24
 00:00:01.243886 eth2  In  IP 10.0.34.3.47228 > 10.0.34.2.3784: BFDv1, Control, State Up, Flags: [none], length: 24
 00:00:01.287037 eth3  In  IP 10.0.35.3.35105 > 10.0.35.2.3784: BFDv1, Control, State Up, Flags: [none], length: 24
 00:00:01.295396 eth1  Out IP 10.0.23.3.33100 > 10.0.23.2.3784: BFDv1, Control, State Up, Flags: [none], length: 24
 00:00:01.296629 eth1  In  IP 10.0.23.2.57018 > 10.0.23.3.3784: BFDv1, Control, State Up, Flags: [none], length: 24
 00:00:01.309876 eth0  In  IP 10.0.13.2.37532 > 10.0.13.3.3784: BFDv1, Control, State Up, Flags: [none], length: 24
 00:00:01.309927 eth2  Out IP 10.0.34.2.42255 > 10.0.34.3.3784: BFDv1, Control, State Up, Flags: [none], length: 24
 00:00:01.310044 eth3  Out IP 10.0.35.2.50865 > 10.0.35.3.3784: BFDv1, Control, State Up, Flags: [none], length: 24
 00:00:01.318316 eth0  Out IP 10.0.13.3.36570 > 10.0.13.2.3784: BFDv1, Control, State Up, Flags: [none], length: 24
 00:00:01.327844 eth2  In  IP 10.0.34.3.47228 > 10.0.34.2.3784: BFDv1, Control, State Up, Flags: [none], length: 24
 00:00:01.365471 eth3  In  IP 10.0.35.3.35105 > 10.0.35.2.3784: BFDv1, Control, State Up, Flags: [none], length: 24
 00:00:01.378037 eth1  In  IP 10.0.23.2.57018 > 10.0.23.3.3784: BFDv1, Control, State Up, Flags: [none], length: 24
 00:00:01.379328 eth1  Out IP 10.0.23.3.33100 > 10.0.23.2.3784: BFDv1, Control, State Up, Flags: [none], length: 24
 00:00:01.388052 eth0  In  IP 10.0.13.2.37532 > 10.0.13.3.3784: BFDv1, Control, State Up, Flags: [none], length: 24
 00:00:01.389375 eth3  Out IP 10.0.35.2.50865 > 10.0.35.3.3784: BFDv1, Control, State Up, Flags: [none], length: 24
 00:00:01.395653 eth2  Out IP 10.0.34.2.42255 > 10.0.34.3.3784: BFDv1, Control, State Up, Flags: [none], length: 24
 00:00:01.400942 eth0  Out IP 10.0.13.3.36570 > 10.0.13.2.3784: BFDv1, Control, State Up, Flags: [none], length: 24
 00:00:01.409508 eth2  In  IP 10.0.34.3.47228 > 10.0.34.2.3784: BFDv1, Control, State Up, Flags: [none], length: 24
 00:00:01.444877 eth3  In  IP 10.0.35.3.35105 > 10.0.35.2.3784: BFDv1, Control, State Up, Flags: [none], length: 24
 00:00:01.459664 eth1  In  IP 10.0.23.2.57018 > 10.0.23.3.3784: BFDv1, Control, State Up, Flags: [none], length: 24
 00:00:01.463146 eth1  Out IP 10.0.23.3.33100 > 10.0.23.2.3784: BFDv1, Control, State Up, Flags: [none], length: 24
 00:00:01.463936 eth0  In  IP 10.0.13.2.37532 > 10.0.13.3.3784: BFDv1, Control, State Up, Flags: [none], length: 24
 00:00:01.465234 eth3  Out IP 10.0.35.2.50865 > 10.0.35.3.3784: BFDv1, Control, State Up, Flags: [none], length: 24
 00:00:01.470471 eth2  Out IP 10.0.34.2.42255 > 10.0.34.3.3784: BFDv1, Control, State Up, Flags: [none], length: 24
 00:00:01.477842 eth0  Out IP 10.0.13.3.36570 > 10.0.13.2.3784: BFDv1, Control, State Up, Flags: [none], length: 24
 00:00:01.487046 eth2  In  IP 10.0.34.3.47228 > 10.0.34.2.3784: BFDv1, Control, State Up, Flags: [none], length: 24
 00:00:01.527641 eth3  In  IP 10.0.35.3.35105 > 10.0.35.2.3784: BFDv1, Control, State Up, Flags: [none], length: 24
 00:00:01.542527 eth1  In  IP 10.0.23.2.57018 > 10.0.23.3.3784: BFDv1, Control, State Up, Flags: [none], length: 24
 00:00:01.543546 eth0  In  IP 10.0.13.2.37532 > 10.0.13.3.3784: BFDv1, Control, State Up, Flags: [none], length: 24
 00:00:01.546820 eth2  Out IP 10.0.34.2.42255 > 10.0.34.3.3784: BFDv1, Control, State Up, Flags: [none], length: 24
 00:00:01.546883 eth1  Out IP 10.0.23.3.33100 > 10.0.23.2.3784: BFDv1, Control, State Up, Flags: [none], length: 24
 00:00:01.555156 eth3  Out IP 10.0.35.2.50865 > 10.0.35.3.3784: BFDv1, Control, State Up, Flags: [none], length: 24
 00:00:01.567454 eth0  Out IP 10.0.13.3.36570 > 10.0.13.2.3784: BFDv1, Control, State Up, Flags: [none], length: 24
 00:00:01.571445 eth2  In  IP 10.0.34.3.47228 > 10.0.34.2.3784: BFDv1, Control, State Up, Flags: [none], length: 24
 00:00:01.604712 eth3  In  IP 10.0.35.3.35105 > 10.0.35.2.3784: BFDv1, Control, State Up, Flags: [none], length: 24
 00:00:01.622075 eth2  Out IP 10.0.34.2.42255 > 10.0.34.3.3784: BFDv1, Control, State Up, Flags: [none], length: 24
 00:00:01.625953 eth1  In  IP 10.0.23.2.57018 > 10.0.23.3.3784: BFDv1, Control, State Up, Flags: [none], length: 24
 00:00:01.630204 eth1  Out IP 10.0.23.3.33100 > 10.0.23.2.3784: BFDv1, Control, State Up, Flags: [none], length: 24
 00:00:01.631258 eth0  In  IP 10.0.13.2.37532 > 10.0.13.3.3784: BFDv1, Control, State Up, Flags: [none], length: 24
 00:00:01.631374 eth3  Out IP 10.0.35.2.50865 > 10.0.35.3.3784: BFDv1, Control, State Up, Flags: [none], length: 24
 00:00:01.655549 eth0  Out IP 10.0.13.3.36570 > 10.0.13.2.3784: BFDv1, Control, State Up, Flags: [none], length: 24
 00:00:01.660072 eth2  In  IP 10.0.34.3.47228 > 10.0.34.2.3784: BFDv1, Control, State Up, Flags: [none], length: 24
 00:00:01.687790 eth3  In  IP 10.0.35.3.35105 > 10.0.35.2.3784: BFDv1, Control, State Up, Flags: [none], length: 24
 00:00:01.702224 eth2  Out IP 10.0.34.2.42255 > 10.0.34.3.3784: BFDv1, Control, State Up, Flags: [none], length: 24
 00:00:01.703024 eth1  In  IP 10.0.23.2.57018 > 10.0.23.3.3784: BFDv1, Control, State Up, Flags: [none], length: 24
 00:00:01.710403 eth1  Out IP 10.0.23.3.33100 > 10.0.23.2.3784: BFDv1, Control, State Up, Flags: [none], length: 24
 00:00:01.713432 eth0  In  IP 10.0.13.2.37532 > 10.0.13.3.3784: BFDv1, Control, State Up, Flags: [none], length: 24
 00:00:01.716809 eth3  Out IP 10.0.35.2.50865 > 10.0.35.3.3784: BFDv1, Control, State Up, Flags: [none], length: 24
 00:00:01.741782 eth2  In  IP 10.0.34.3.47228 > 10.0.34.2.3784: BFDv1, Control, State Up, Flags: [none], length: 24
 00:00:01.742013 eth0  Out IP 10.0.13.3.36570 > 10.0.13.2.3784: BFDv1, Control, State Up, Flags: [none], length: 24
 00:00:01.767265 eth3  In  IP 10.0.35.3.35105 > 10.0.35.2.3784: BFDv1, Control, State Up, Flags: [none], length: 24
 00:00:01.782663 eth2  Out IP 10.0.34.2.42255 > 10.0.34.3.3784: BFDv1, Control, State Up, Flags: [none], length: 24
 00:00:01.784755 eth1  In  IP 10.0.23.2.57018 > 10.0.23.3.3784: BFDv1, Control, State Up, Flags: [none], length: 24
 00:00:01.785985 eth1  Out IP 10.0.23.3.33100 > 10.0.23.2.3784: BFDv1, Control, State Up, Flags: [none], length: 24
 00:00:01.800376 eth0  In  IP 10.0.13.2.37532 > 10.0.13.3.3784: BFDv1, Control, State Up, Flags: [none], length: 24
 00:00:01.804695 eth3  Out IP 10.0.35.2.50865 > 10.0.35.3.3784: BFDv1, Control, State Up, Flags: [none], length: 24
 00:00:01.827670 eth2  In  IP 10.0.34.3.47228 > 10.0.34.2.3784: BFDv1, Control, State Up, Flags: [none], length: 24
 00:00:01.827956 eth0  Out IP 10.0.13.3.36570 > 10.0.13.2.3784: BFDv1, Control, State Up, Flags: [none], length: 24
 00:00:01.853137 eth3  In  IP 10.0.35.3.35105 > 10.0.35.2.3784: BFDv1, Control, State Up, Flags: [none], length: 24
 00:00:01.866695 eth1  In  IP 10.0.23.2.57018 > 10.0.23.3.3784: BFDv1, Control, State Up, Flags: [none], length: 24
 00:00:01.866864 eth2  Out IP 10.0.34.2.42255 > 10.0.34.3.3784: BFDv1, Control, State Up, Flags: [none], length: 24
 00:00:01.875075 eth1  Out IP 10.0.23.3.33100 > 10.0.23.2.3784: BFDv1, Control, State Up, Flags: [none], length: 24
 00:00:01.882092 eth0  In  IP 10.0.13.2.37532 > 10.0.13.3.3784: BFDv1, Control, State Up, Flags: [none], length: 24
 00:00:01.892423 eth3  Out IP 10.0.35.2.50865 > 10.0.35.3.3784: BFDv1, Control, State Up, Flags: [none], length: 24
 00:00:01.912666 eth0  Out IP 10.0.13.3.36570 > 10.0.13.2.3784: BFDv1, Control, State Up, Flags: [none], length: 24
 00:00:01.915841 eth2  In  IP 10.0.34.3.47228 > 10.0.34.2.3784: BFDv1, Control, State Up, Flags: [none], length: 24
 00:00:01.936862 eth3  In  IP 10.0.35.3.35105 > 10.0.35.2.3784: BFDv1, Control, State Up, Flags: [none], length: 24
 00:00:01.946229 eth2  Out IP 10.0.34.2.42255 > 10.0.34.3.3784: BFDv1, Control, State Up, Flags: [none], length: 24
 00:00:01.947287 eth1  In  IP 10.0.23.2.57018 > 10.0.23.3.3784: BFDv1, Control, State Up, Flags: [none], length: 24
 00:00:01.951544 eth1  Out IP 10.0.23.3.33100 > 10.0.23.2.3784: BFDv1, Control, State Up, Flags: [none], length: 24
 00:00:01.960704 eth0  In  IP 10.0.13.2.37532 > 10.0.13.3.3784: BFDv1, Control, State Up, Flags: [none], length: 24
 00:00:01.976046 eth3  Out IP 10.0.35.2.50865 > 10.0.35.3.3784: BFDv1, Control, State Up, Flags: [none], length: 24
 00:00:01.999299 eth0  Out IP 10.0.13.3.36570 > 10.0.13.2.3784: BFDv1, Control, State Up, Flags: [none], length: 24
 00:00:02.004163 eth2  In  IP 10.0.34.3.47228 > 10.0.34.2.3784: BFDv1, Control, State Up, Flags: [none], length: 24
 00:00:02.013292 eth3  In  IP 10.0.35.3.35105 > 10.0.35.2.3784: BFDv1, Control, State Up, Flags: [none], length: 24
 00:00:02.029271 eth1  In  IP 10.0.23.2.57018 > 10.0.23.3.3784: BFDv1, Control, State Up, Flags: [none], length: 24
 00:00:02.032519 eth2  Out IP 10.0.34.2.42255 > 10.0.34.3.3784: BFDv1, Control, State Up, Flags: [none], length: 24
 00:00:02.039777 eth1  Out IP 10.0.23.3.33100 > 10.0.23.2.3784: BFDv1, Control, State Up, Flags: [none], length: 24
 00:00:02.041652 eth0  In  IP 10.0.13.2.37532 > 10.0.13.3.3784: BFDv1, Control, State Up, Flags: [none], length: 24
 00:00:02.055955 eth3  Out IP 10.0.35.2.50865 > 10.0.35.3.3784: BFDv1, Control, State Up, Flags: [none], length: 24
 00:00:02.079188 eth0  Out IP 10.0.13.3.36570 > 10.0.13.2.3784: BFDv1, Control, State Up, Flags: [none], length: 24
 00:00:02.088530 eth3  In  IP 10.0.35.3.35105 > 10.0.35.2.3784: BFDv1, Control, State Up, Flags: [none], length: 24
 00:00:02.088936 eth2  In  IP 10.0.34.3.47228 > 10.0.34.2.3784: BFDv1, Control, State Up, Flags: [none], length: 24
 00:00:02.106105 eth1  In  IP 10.0.23.2.57018 > 10.0.23.3.3784: BFDv1, Control, State Up, Flags: [none], length: 24
 00:00:02.119443 eth1  Out IP 10.0.23.3.33100 > 10.0.23.2.3784: BFDv1, Control, State Up, Flags: [none], length: 24
 00:00:02.126351 eth0  In  IP 10.0.13.2.37532 > 10.0.13.3.3784: BFDv1, Control, State Up, Flags: [none], length: 24
 00:00:02.137921 eth3  Out IP 10.0.35.2.50865 > 10.0.35.3.3784: BFDv1, Control, State Up, Flags: [none], length: 24
 00:00:02.162180 eth0  Out IP 10.0.13.3.36570 > 10.0.13.2.3784: BFDv1, Control, State Up, Flags: [none], length: 24
 00:00:02.174142 eth3  In  IP 10.0.35.3.35105 > 10.0.35.2.3784: BFDv1, Control, State Up, Flags: [none], length: 24
 00:00:02.174179 eth2  In  IP 10.0.34.3.47228 > 10.0.34.2.3784: BFDv1, Control, State Up, Flags: [none], length: 24
 00:00:02.188015 eth1  In  IP 10.0.23.2.57018 > 10.0.23.3.3784: BFDv1, Control, State Up, Flags: [none], length: 24
 00:00:02.198352 eth1  Out IP 10.0.23.3.33100 > 10.0.23.2.3784: BFDv1, Control, State Up, Flags: [none], length: 24
 00:00:02.211883 eth0  In  IP 10.0.13.2.37532 > 10.0.13.3.3784: BFDv1, Control, State Up, Flags: [none], length: 24
 00:00:02.219214 eth3  Out IP 10.0.35.2.50865 > 10.0.35.3.3784: BFDv1, Control, State Up, Flags: [none], length: 24
 00:00:02.241445 eth0  Out IP 10.0.13.3.36570 > 10.0.13.2.3784: BFDv1, Control, State Up, Flags: [none], length: 24
 00:00:02.261765 eth3  In  IP 10.0.35.3.35105 > 10.0.35.2.3784: BFDv1, Control, State Up, Flags: [none], length: 24
 00:00:02.273645 eth1  In  IP 10.0.23.2.57018 > 10.0.23.3.3784: BFDv1, Control, State Up, Flags: [none], length: 24
 00:00:02.287261 eth0  In  IP 10.0.13.2.37532 > 10.0.13.3.3784: BFDv1, Control, State Up, Flags: [none], length: 24
 00:00:02.288512 eth1  Out IP 10.0.23.3.33100 > 10.0.23.2.3784: BFDv1, Control, State Up, Flags: [none], length: 24
 00:00:02.297795 eth3  Out IP 10.0.35.2.50865 > 10.0.35.3.3784: BFDv1, Control, State Up, Flags: [none], length: 24
 00:00:02.321101 eth0  Out IP 10.0.13.3.36570 > 10.0.13.2.3784: BFDv1, Control, State Up, Flags: [none], length: 24
 00:00:02.343039 eth3  In  IP 10.0.35.3.35105 > 10.0.35.2.3784: BFDv1, Control, State Up, Flags: [none], length: 24
 00:00:02.349314 eth1  In  IP 10.0.23.2.57018 > 10.0.23.3.3784: BFDv1, Control, State Up, Flags: [none], length: 24
 00:00:02.366350 eth0  In  IP 10.0.13.2.37532 > 10.0.13.3.3784: BFDv1, Control, State Up, Flags: [none], length: 24
 00:00:02.374775 eth3  Out IP 10.0.35.2.50865 > 10.0.35.3.3784: BFDv1, Control, State Up, Flags: [none], length: 24
 00:00:02.376076 eth1  Out IP 10.0.23.3.33100 > 10.0.23.2.3784: BFDv1, Control, State Up, Flags: [none], length: 24
 00:00:02.399395 eth0  Out IP 10.0.13.3.36570 > 10.0.13.2.3784: BFDv1, Control, State Up, Flags: [none], length: 24
 00:00:02.426015 eth3  In  IP 10.0.35.3.35105 > 10.0.35.2.3784: BFDv1, Control, State Up, Flags: [none], length: 24
 00:00:02.436579 eth1  In  IP 10.0.23.2.57018 > 10.0.23.3.3784: BFDv1, Control, State Up, Flags: [none], length: 24
 00:00:02.441903 eth0  In  IP 10.0.13.2.37532 > 10.0.13.3.3784: BFDv1, Control, State Up, Flags: [none], length: 24
 00:00:02.461487 eth3  Out IP 10.0.35.2.50865 > 10.0.35.3.3784: BFDv1, Control, State Up, Flags: [none], length: 24
 00:00:02.464746 eth1  Out IP 10.0.23.3.33100 > 10.0.23.2.3784: BFDv1, Control, State Up, Flags: [none], length: 24
 00:00:02.481029 eth0  Out IP 10.0.13.3.36570 > 10.0.13.2.3784: BFDv1, Control, State Up, Flags: [none], length: 24
 00:00:02.502779 eth3  In  IP 10.0.35.3.35105 > 10.0.35.2.3784: BFDv1, Control, State Up, Flags: [none], length: 24
 00:00:02.521909 eth1  In  IP 10.0.23.2.57018 > 10.0.23.3.3784: BFDv1, Control, State Up, Flags: [none], length: 24
 00:00:02.523543 eth0  In  IP 10.0.13.2.37532 > 10.0.13.3.3784: BFDv1, Control, State Up, Flags: [none], length: 24
 00:00:02.539639 eth1  Out IP 10.0.23.3.33100 > 10.0.23.2.3784: BFDv1, Control, State Up, Flags: [none], length: 24
 00:00:02.546842 eth3  Out IP 10.0.35.2.50865 > 10.0.35.3.3784: BFDv1, Control, State Up, Flags: [none], length: 24
 00:00:02.559058 eth0  Out IP 10.0.13.3.36570 > 10.0.13.2.3784: BFDv1, Control, State Up, Flags: [none], length: 24
 00:00:02.581025 eth3  In  IP 10.0.35.3.35105 > 10.0.35.2.3784: BFDv1, Control, State Up, Flags: [none], length: 24
 00:00:02.601670 eth0  In  IP 10.0.13.2.37532 > 10.0.13.3.3784: BFDv1, Control, State Up, Flags: [none], length: 24
 00:00:02.607452 eth1  In  IP 10.0.23.2.57018 > 10.0.23.3.3784: BFDv1, Control, State Up, Flags: [none], length: 24
 00:00:02.624870 eth1  Out IP 10.0.23.3.33100 > 10.0.23.2.3784: BFDv1, Control, State Up, Flags: [none], length: 24
 00:00:02.637371 eth3  Out IP 10.0.35.2.50865 > 10.0.35.3.3784: BFDv1, Control, State Up, Flags: [none], length: 24
 00:00:02.641702 eth0  Out IP 10.0.13.3.36570 > 10.0.13.2.3784: BFDv1, Control, State Up, Flags: [none], length: 24
 00:00:02.659660 eth3  In  IP 10.0.35.3.35105 > 10.0.35.2.3784: BFDv1, Control, State Up, Flags: [none], length: 24
 00:00:02.687119 eth0  In  IP 10.0.13.2.37532 > 10.0.13.3.3784: BFDv1, Control, State Up, Flags: [none], length: 24
 00:00:02.688445 eth1  In  IP 10.0.23.2.57018 > 10.0.23.3.3784: BFDv1, Control, State Up, Flags: [none], length: 24
 00:00:02.706779 eth1  Out IP 10.0.23.3.33100 > 10.0.23.2.3784: BFDv1, Control, State Up, Flags: [none], length: 24
 00:00:02.722989 eth0  Out IP 10.0.13.3.36570 > 10.0.13.2.3784: BFDv1, Control, State Up, Flags: [none], length: 24
 00:00:02.724135 eth3  Out IP 10.0.35.2.50865 > 10.0.35.3.3784: BFDv1, Control, State Up, Flags: [none], length: 24
 00:00:02.742348 eth3  In  IP 10.0.35.3.35105 > 10.0.35.2.3784: BFDv1, Control, State Up, Flags: [none], length: 24
 00:00:02.770078 eth0  In  IP 10.0.13.2.37532 > 10.0.13.3.3784: BFDv1, Control, State Up, Flags: [none], length: 24
 00:00:02.777234 eth1  In  IP 10.0.23.2.57018 > 10.0.23.3.3784: BFDv1, Control, State Up, Flags: [none], length: 24
 00:00:02.785705 eth1  Out IP 10.0.23.3.33100 > 10.0.23.2.3784: BFDv1, Control, State Up, Flags: [none], length: 24
 00:00:02.812076 eth0  Out IP 10.0.13.3.36570 > 10.0.13.2.3784: BFDv1, Control, State Up, Flags: [none], length: 24
 00:00:02.812183 eth3  Out IP 10.0.35.2.50865 > 10.0.35.3.3784: BFDv1, Control, State Up, Flags: [none], length: 24
 00:00:02.821417 eth3  In  IP 10.0.35.3.35105 > 10.0.35.2.3784: BFDv1, Control, State Up, Flags: [none], length: 24
 00:00:02.855868 eth0  In  IP 10.0.13.2.37532 > 10.0.13.3.3784: BFDv1, Control, State Up, Flags: [none], length: 24
 00:00:02.861372 eth1  In  IP 10.0.23.2.57018 > 10.0.23.3.3784: BFDv1, Control, State Up, Flags: [none], length: 24
 00:00:02.871759 eth1  Out IP 10.0.23.3.33100 > 10.0.23.2.3784: BFDv1, Control, State Up, Flags: [none], length: 24
 00:00:02.889017 eth3  Out IP 10.0.35.2.50865 > 10.0.35.3.3784: BFDv1, Control, State Up, Flags: [none], length: 24
 00:00:02.892274 eth0  Out IP 10.0.13.3.36570 > 10.0.13.2.3784: BFDv1, Control, State Up, Flags: [none], length: 24
 00:00:02.909283 eth3  In  IP 10.0.35.3.35105 > 10.0.35.2.3784: BFDv1, Control, State Up, Flags: [none], length: 24
 00:00:02.935701 eth0  In  IP 10.0.13.2.37532 > 10.0.13.3.3784: BFDv1, Control, State Up, Flags: [none], length: 24
 00:00:02.942796 eth1  In  IP 10.0.23.2.57018 > 10.0.23.3.3784: BFDv1, Control, State Up, Flags: [none], length: 24
 00:00:02.958172 eth1  Out IP 10.0.23.3.33100 > 10.0.23.2.3784: BFDv1, Control, State Up, Flags: [none], length: 24
 00:00:02.971453 eth0  Out IP 10.0.13.3.36570 > 10.0.13.2.3784: BFDv1, Control, State Up, Flags: [none], length: 24
 00:00:02.976678 eth3  Out IP 10.0.35.2.50865 > 10.0.35.3.3784: BFDv1, Control, State Up, Flags: [none], length: 24
 00:00:02.985915 eth3  In  IP 10.0.35.3.35105 > 10.0.35.2.3784: BFDv1, Control, State Up, Flags: [none], length: 24
 00:00:03.018234 eth0  In  IP 10.0.13.2.37532 > 10.0.13.3.3784: BFDv1, Control, State Up, Flags: [none], length: 24
 00:00:03.029025 eth1  In  IP 10.0.23.2.57018 > 10.0.23.3.3784: BFDv1, Control, State Up, Flags: [none], length: 24
 00:00:03.034394 eth1  Out IP 10.0.23.3.33100 > 10.0.23.2.3784: BFDv1, Control, State Up, Flags: [none], length: 24
 00:00:03.053710 eth3  Out IP 10.0.35.2.50865 > 10.0.35.3.3784: BFDv1, Control, State Up, Flags: [none], length: 24
 00:00:03.055965 eth0  Out IP 10.0.13.3.36570 > 10.0.13.2.3784: BFDv1, Control, State Up, Flags: [none], length: 24
 00:00:03.064005 eth3  In  IP 10.0.35.3.35105 > 10.0.35.2.3784: BFDv1, Control, State Up, Flags: [none], length: 24
 00:00:03.102813 eth0  In  IP 10.0.13.2.37532 > 10.0.13.3.3784: BFDv1, Control, State Up, Flags: [none], length: 24
 00:00:03.110882 eth1  In  IP 10.0.23.2.57018 > 10.0.23.3.3784: BFDv1, Control, State Up, Flags: [none], length: 24
 00:00:03.112185 eth1  Out IP 10.0.23.3.33100 > 10.0.23.2.3784: BFDv1, Control, State Up, Flags: [none], length: 24
 00:00:03.141373 eth3  Out IP 10.0.35.2.50865 > 10.0.35.3.3784: BFDv1, Control, State Up, Flags: [none], length: 24
 00:00:03.145594 eth0  Out IP 10.0.13.3.36570 > 10.0.13.2.3784: BFDv1, Control, State Up, Flags: [none], length: 24
 00:00:03.147564 eth3  In  IP 10.0.35.3.35105 > 10.0.35.2.3784: BFDv1, Control, State Up, Flags: [none], length: 24
 00:00:03.187399 eth0  In  IP 10.0.13.2.37532 > 10.0.13.3.3784: BFDv1, Control, State Up, Flags: [none], length: 24
 00:00:03.188360 eth1  In  IP 10.0.23.2.57018 > 10.0.23.3.3784: BFDv1, Control, State Up, Flags: [none], length: 24
 00:00:03.189642 eth1  Out IP 10.0.23.3.33100 > 10.0.23.2.3784: BFDv1, Control, State Up, Flags: [none], length: 24
 00:00:03.224828 eth0  Out IP 10.0.13.3.36570 > 10.0.13.2.3784: BFDv1, Control, State Up, Flags: [none], length: 24
 00:00:03.225204 eth3  In  IP 10.0.35.3.35105 > 10.0.35.2.3784: BFDv1, Control, State Up, Flags: [none], length: 24
 00:00:03.227390 eth3  Out IP 10.0.35.2.50865 > 10.0.35.3.3784: BFDv1, Control, State Up, Flags: [none], length: 24
 00:00:03.266634 eth1  Out IP 10.0.23.3.33100 > 10.0.23.2.3784: BFDv1, Control, State Up, Flags: [none], length: 24
 00:00:03.268294 eth0  In  IP 10.0.13.2.37532 > 10.0.13.3.3784: BFDv1, Control, State Up, Flags: [none], length: 24
 00:00:03.269890 eth1  In  IP 10.0.23.2.57018 > 10.0.23.3.3784: BFDv1, Control, State Up, Flags: [none], length: 24
 00:00:03.302650 eth3  In  IP 10.0.35.3.35105 > 10.0.35.2.3784: BFDv1, Control, State Up, Flags: [none], length: 24
 00:00:03.305960 eth0  Out IP 10.0.13.3.36570 > 10.0.13.2.3784: BFDv1, Control, State Up, Flags: [none], length: 24
 00:00:03.307154 eth3  Out IP 10.0.35.2.50865 > 10.0.35.3.3784: BFDv1, Control, State Up, Flags: [none], length: 24
 00:00:03.347381 eth1  Out IP 10.0.23.3.33100 > 10.0.23.2.3784: BFDv1, Control, State Up, Flags: [none], length: 24
 00:00:03.351589 eth0  In  IP 10.0.13.2.37532 > 10.0.13.3.3784: BFDv1, Control, State Up, Flags: [none], length: 24
 00:00:03.352634 eth1  In  IP 10.0.23.2.57018 > 10.0.23.3.3784: BFDv1, Control, State Up, Flags: [none], length: 24
 00:00:03.384009 eth0  Out IP 10.0.13.3.36570 > 10.0.13.2.3784: BFDv1, Control, State Up, Flags: [none], length: 24
 00:00:03.388131 eth3  In  IP 10.0.35.3.35105 > 10.0.35.2.3784: BFDv1, Control, State Up, Flags: [none], length: 24
 00:00:03.396449 eth3  Out IP 10.0.35.2.50865 > 10.0.35.3.3784: BFDv1, Control, State Up, Flags: [none], length: 24
 00:00:03.427744 eth1  Out IP 10.0.23.3.33100 > 10.0.23.2.3784: BFDv1, Control, State Up, Flags: [none], length: 24
 00:00:03.429770 eth0  In  IP 10.0.13.2.37532 > 10.0.13.3.3784: BFDv1, Control, State Up, Flags: [none], length: 24
 00:00:03.429958 eth1  In  IP 10.0.23.2.57018 > 10.0.23.3.3784: BFDv1, Control, State Up, Flags: [none], length: 24
 00:00:03.468479 eth0  Out IP 10.0.13.3.36570 > 10.0.13.2.3784: BFDv1, Control, State Up, Flags: [none], length: 24
 00:00:03.468559 eth3  In  IP 10.0.35.3.35105 > 10.0.35.2.3784: BFDv1, Control, State Up, Flags: [none], length: 24
 00:00:03.477896 eth3  Out IP 10.0.35.2.50865 > 10.0.35.3.3784: BFDv1, Control, State Up, Flags: [none], length: 24
 00:00:03.507954 eth0  In  IP 10.0.13.2.37532 > 10.0.13.3.3784: BFDv1, Control, State Up, Flags: [none], length: 24
 00:00:03.511205 eth1  Out IP 10.0.23.3.33100 > 10.0.23.2.3784: BFDv1, Control, State Up, Flags: [none], length: 24
 00:00:03.512390 eth1  In  IP 10.0.23.2.57018 > 10.0.23.3.3784: BFDv1, Control, State Up, Flags: [none], length: 24
 00:00:03.547963 eth3  In  IP 10.0.35.3.35105 > 10.0.35.2.3784: BFDv1, Control, State Up, Flags: [none], length: 24
 00:00:03.551219 eth0  Out IP 10.0.13.3.36570 > 10.0.13.2.3784: BFDv1, Control, State Up, Flags: [none], length: 24
 00:00:03.564415 eth3  Out IP 10.0.35.2.50865 > 10.0.35.3.3784: BFDv1, Control, State Up, Flags: [none], length: 24
 00:00:03.582299 eth0  In  IP 10.0.13.2.37532 > 10.0.13.3.3784: BFDv1, Control, State Up, Flags: [none], length: 24
 00:00:03.587624 eth1  Out IP 10.0.23.3.33100 > 10.0.23.2.3784: BFDv1, Control, State Up, Flags: [none], length: 24
 00:00:03.597854 eth1  In  IP 10.0.23.2.57018 > 10.0.23.3.3784: BFDv1, Control, State Up, Flags: [none], length: 24
 00:00:03.636426 eth3  In  IP 10.0.35.3.35105 > 10.0.35.2.3784: BFDv1, Control, State Up, Flags: [none], length: 24
 00:00:03.637687 eth0  Out IP 10.0.13.3.36570 > 10.0.13.2.3784: BFDv1, Control, State Up, Flags: [none], length: 24
 00:00:03.648878 eth3  Out IP 10.0.35.2.50865 > 10.0.35.3.3784: BFDv1, Control, State Up, Flags: [none], length: 24
 00:00:03.667311 eth0  In  IP 10.0.13.2.37532 > 10.0.13.3.3784: BFDv1, Control, State Up, Flags: [none], length: 24
 00:00:03.674614 eth1  In  IP 10.0.23.2.57018 > 10.0.23.3.3784: BFDv1, Control, State Up, Flags: [none], length: 24
 00:00:03.676892 eth1  Out IP 10.0.23.3.33100 > 10.0.23.2.3784: BFDv1, Control, State Up, Flags: [none], length: 24
 00:00:03.720276 eth0  Out IP 10.0.13.3.36570 > 10.0.13.2.3784: BFDv1, Control, State Up, Flags: [none], length: 24
 00:00:03.724548 eth3  Out IP 10.0.35.2.50865 > 10.0.35.3.3784: BFDv1, Control, State Up, Flags: [none], length: 24
 00:00:03.726826 eth3  In  IP 10.0.35.3.35105 > 10.0.35.2.3784: BFDv1, Control, State Up, Flags: [none], length: 24
 00:00:03.748543 eth0  In  IP 10.0.13.2.37532 > 10.0.13.3.3784: BFDv1, Control, State Up, Flags: [none], length: 24
 00:00:03.752894 eth1  Out IP 10.0.23.3.33100 > 10.0.23.2.3784: BFDv1, Control, State Up, Flags: [none], length: 24
 00:00:03.754109 eth1  In  IP 10.0.23.2.57018 > 10.0.23.3.3784: BFDv1, Control, State Up, Flags: [none], length: 24
 00:00:03.799453 eth0  Out IP 10.0.13.3.36570 > 10.0.13.2.3784: BFDv1, Control, State Up, Flags: [none], length: 24
 00:00:03.811654 eth3  Out IP 10.0.35.2.50865 > 10.0.35.3.3784: BFDv1, Control, State Up, Flags: [none], length: 24
 00:00:03.812849 eth3  In  IP 10.0.35.3.35105 > 10.0.35.2.3784: BFDv1, Control, State Up, Flags: [none], length: 24
 00:00:03.829909 eth0  In  IP 10.0.13.2.37532 > 10.0.13.3.3784: BFDv1, Control, State Up, Flags: [none], length: 24
 00:00:03.833221 eth1  Out IP 10.0.23.3.33100 > 10.0.23.2.3784: BFDv1, Control, State Up, Flags: [none], length: 24
 00:00:03.841450 eth1  In  IP 10.0.23.2.57018 > 10.0.23.3.3784: BFDv1, Control, State Up, Flags: [none], length: 24
 00:00:03.878790 eth0  Out IP 10.0.13.3.36570 > 10.0.13.2.3784: BFDv1, Control, State Up, Flags: [none], length: 24
 00:00:03.890474 eth3  In  IP 10.0.35.3.35105 > 10.0.35.2.3784: BFDv1, Control, State Up, Flags: [none], length: 24
 00:00:03.893806 eth3  Out IP 10.0.35.2.50865 > 10.0.35.3.3784: BFDv1, Control, State Up, Flags: [none], length: 24
 00:00:03.908596 eth0  In  IP 10.0.13.2.37532 > 10.0.13.3.3784: BFDv1, Control, State Up, Flags: [none], length: 24
 00:00:03.913789 eth1  Out IP 10.0.23.3.33100 > 10.0.23.2.3784: BFDv1, Control, State Up, Flags: [none], length: 24
 00:00:03.917969 eth1  In  IP 10.0.23.2.57018 > 10.0.23.3.3784: BFDv1, Control, State Up, Flags: [none], length: 24
 00:00:03.960186 eth0  Out IP 10.0.13.3.36570 > 10.0.13.2.3784: BFDv1, Control, State Up, Flags: [none], length: 24
 00:00:03.966818 eth3  In  IP 10.0.35.3.35105 > 10.0.35.2.3784: BFDv1, Control, State Up, Flags: [none], length: 24
 00:00:03.973176 eth3  Out IP 10.0.35.2.50865 > 10.0.35.3.3784: BFDv1, Control, State Up, Flags: [none], length: 24
