tcpdump: data link type LINUX_SLL2
tcpdump: verbose output suppressed, use -v[v]... for full protocol decode
listening on any, link-type LINUX_SLL2 (Linux cooked v2), snapshot length 262144 bytes
 00:00:00.000000 eth2  In  IP 10.0.29.3.57930 > 10.0.29.2.3784: BFDv1, Control, State Up, Flags: [none], length: 24
 00:00:00.024281 eth2  Out IP 10.0.29.2.49228 > 10.0.29.3.3784: BFDv1, Control, State Up, Flags: [none], length: 24
 00:00:00.074615 eth2  In  IP 10.0.29.3.57930 > 10.0.29.2.3784: BFDv1, Control, State Up, Flags: [none], length: 24
 00:00:00.100922 eth2  Out IP 10.0.29.2.49228 > 10.0.29.3.3784: BFDv1, Control, State Up, Flags: [none], length: 24
 00:00:00.159237 eth2  In  IP 10.0.29.3.57930 > 10.0.29.2.3784: BFDv1, Control, State Up, Flags: [none], length: 24
 00:00:00.187687 eth2  Out IP 10.0.29.2.49228 > 10.0.29.3.3784: BFDv1, Control, State Up, Flags: [none], length: 24
 00:00:00.237034 eth2  In  IP 10.0.29.3.57930 > 10.0.29.2.3784: BFDv1, Control, State Up, Flags: [none], length: 24
 00:00:00.268312 eth2  Out IP 10.0.29.2.49228 > 10.0.29.3.3784: BFDv1, Control, State Up, Flags: [none], length: 24
 00:00:00.318669 eth2  In  IP 10.0.29.3.57930 > 10.0.29.2.3784: BFDv1, Control, State Up, Flags: [none], length: 24
 00:00:00.356131 eth2  Out IP 10.0.29.2.49228 > 10.0.29.3.3784: BFDv1, Control, State Up, Flags: [none], length: 24
 00:00:00.394403 eth2  In  IP 10.0.29.3.57930 > 10.0.29.2.3784: BFDv1, Control, State Up, Flags: [none], length: 24
 00:00:00.442715 eth2  Out IP 10.0.29.2.49228 > 10.0.29.3.3784: BFDv1, Control, State Up, Flags: [none], length: 24
 00:00:00.476077 eth2  In  IP 10.0.29.3.57930 > 10.0.29.2.3784: BFDv1, Control, State Up, Flags: [none], length: 24
 00:00:00.530380 eth2  Out IP 10.0.29.2.49228 > 10.0.29.3.3784: BFDv1, Control, State Up, Flags: [none], length: 24
 00:00:00.558635 eth2  In  IP 10.0.29.3.57930 > 10.0.29.2.3784: BFDv1, Control, State Up, Flags: [none], length: 24
 00:00:00.617937 eth2  Out IP 10.0.29.2.49228 > 10.0.29.3.3784: BFDv1, Control, State Up, Flags: [none], length: 24
 00:00:00.640241 eth2  In  IP 10.0.29.3.57930 > 10.0.29.2.3784: BFDv1, Control, State Up, Flags: [none], length: 24
 00:00:00.702638 eth2  Out IP 10.0.29.2.49228 > 10.0.29.3.3784: BFDv1, Control, State Up, Flags: [none], length: 24
 00:00:00.725180 eth2  In  IP 10.0.29.3.57930 > 10.0.29.2.3784: BFDv1, Control, State Up, Flags: [none], length: 24
 00:00:00.784564 eth2  Out IP 10.0.29.2.49228 > 10.0.29.3.3784: BFDv1, Control, State Up, Flags: [none], length: 24
 00:00:00.801905 eth2  In  IP 10.0.29.3.57930 > 10.0.29.2.3784: BFDv1, Control, State Up, Flags: [none], length: 24
 00:00:00.864272 eth2  Out IP 10.0.29.2.49228 > 10.0.29.3.3784: BFDv1, Control, State Up, Flags: [none], length: 24
 00:00:00.890595 eth2  In  IP 10.0.29.3.57930 > 10.0.29.2.3784: BFDv1, Control, State Up, Flags: [none], length: 24
 00:00:00.940959 eth2  Out IP 10.0.29.2.49228 > 10.0.29.3.3784: BFDv1, Control, State Up, Flags: [none], length: 24
 00:00:00.970259 eth2  In  IP 10.0.29.3.57930 > 10.0.29.2.3784: BFDv1, Control, State Up, Flags: [none], length: 24
 00:00:01.015761 eth2  Out IP 10.0.29.2.49228 > 10.0.29.3.3784: BFDv1, Control, State Up, Flags: [none], length: 24
 00:00:01.049114 eth2  In  IP 10.0.29.3.57930 > 10.0.29.2.3784: BFDv1, Control, State Up, Flags: [none], length: 24
 00:00:01.102492 eth2  Out IP 10.0.29.2.49228 > 10.0.29.3.3784: BFDv1, Control, State Up, Flags: [none], length: 24
 00:00:01.130013 eth2  In  IP 10.0.29.3.57930 > 10.0.29.2.3784: BFDv1, Control, State Up, Flags: [none], length: 24
 00:00:01.185430 eth2  Out IP 10.0.29.2.49228 > 10.0.29.3.3784: BFDv1, Control, State Up, Flags: [none], length: 24
 00:00:01.210709 eth2  In  IP 10.0.29.3.57930 > 10.0.29.2.3784: BFDv1, Control, State Up, Flags: [none], length: 24
 00:00:01.273204 eth2  Out IP 10.0.29.2.49228 > 10.0.29.3.3784: BFDv1, Control, State Up, Flags: [none], length: 24
 00:00:01.297568 eth2  In  IP 10.0.29.3.57930 > 10.0.29.2.3784: BFDv1, Control, State Up, Flags: [none], length: 24
 00:00:01.352889 eth2  Out IP 10.0.29.2.49228 > 10.0.29.3.3784: BFDv1, Control, State Up, Flags: [none], length: 24
 00:00:01.377149 eth2  In  IP 10.0.29.3.57930 > 10.0.29.2.3784: BFDv1, Control, State Up, Flags: [none], length: 24
 00:00:01.430636 eth2  Out IP 10.0.29.2.49228 > 10.0.29.3.3784: BFDv1, Control, State Up, Flags: [none], length: 24
 00:00:01.466012 eth2  In  IP 10.0.29.3.57930 > 10.0.29.2.3784: BFDv1, Control, State Up, Flags: [none], length: 24
 00:00:01.507348 eth2  Out IP 10.0.29.2.49228 > 10.0.29.3.3784: BFDv1, Control, State Up, Flags: [none], length: 24
 00:00:01.547713 eth2  In  IP 10.0.29.3.57930 > 10.0.29.2.3784: BFDv1, Control, State Up, Flags: [none], length: 24
 00:00:01.594197 eth2  Out IP 10.0.29.2.49228 > 10.0.29.3.3784: BFDv1, Control, State Up, Flags: [none], length: 24
 00:00:01.637646 eth2  In  IP 10.0.29.3.57930 > 10.0.29.2.3784: BFDv1, Control, State Up, Flags: [none], length: 24
 00:00:01.670110 eth2  Out IP 10.0.29.2.49228 > 10.0.29.3.3784: BFDv1, Control, State Up, Flags: [none], length: 24
 00:00:01.719562 eth2  In  IP 10.0.29.3.57930 > 10.0.29.2.3784: BFDv1, Control, State Up, Flags: [none], length: 24
 00:00:01.758851 eth2  Out IP 10.0.29.2.49228 > 10.0.29.3.3784: BFDv1, Control, State Up, Flags: [none], length: 24
 00:00:01.795149 eth2  In  IP 10.0.29.3.57930 > 10.0.29.2.3784: BFDv1, Control, State Up, Flags: [none], length: 24
 00:00:01.837586 eth2  Out IP 10.0.29.2.49228 > 10.0.29.3.3784: BFDv1, Control, State Up, Flags: [none], length: 24
 00:00:01.878912 eth2  In  IP 10.0.29.3.57930 > 10.0.29.2.3784: BFDv1, Control, State Up, Flags: [none], length: 24
 00:00:01.919235 eth2  Out IP 10.0.29.2.49228 > 10.0.29.3.3784: BFDv1, Control, State Up, Flags: [none], length: 24
 00:00:01.958539 eth2  In  IP 10.0.29.3.57930 > 10.0.29.2.3784: BFDv1, Control, State Up, Flags: [none], length: 24
 00:00:02.001969 eth2  Out IP 10.0.29.2.49228 > 10.0.29.3.3784: BFDv1, Control, State Up, Flags: [none], length: 24
 00:00:02.039286 eth2  In  IP 10.0.29.3.57930 > 10.0.29.2.3784: BFDv1, Control, State Up, Flags: [none], length: 24
 00:00:02.086617 eth2  Out IP 10.0.29.2.49228 > 10.0.29.3.3784: BFDv1, Control, State Up, Flags: [none], length: 24
 00:00:02.093120 eth3  Out IP 10.0.29.2.179 > 10.0.29.3.54171: Flags [P.], seq 2639187682:2639187703, ack 3990065237, win 64, options [nop,nop,TS val 2352538896 ecr 562822516], length 21: BGP
 00:00:02.093410 eth3  Out IP 10.0.29.2.179 > 10.0.29.3.54171: Flags [F.], seq 21, ack 1, win 64, options [nop,nop,TS val 2352538896 ecr 562822516], length 0
 00:00:02.093505 eth3  Out IP 10.0.12.3.179 > 10.0.12.2.45004: Flags [P.], seq 3222603109:3222603144, ack 3815833437, win 64, options [nop,nop,TS val 4271195114 ecr 2663346153], length 35: BGP
 00:00:02.093545 eth3  In  IP 10.0.12.2.45004 > 10.0.12.3.179: Flags [.], ack 35, win 63, options [nop,nop,TS val 2663362269 ecr 4271195114], length 0
 00:00:02.093573 eth3  Out IP 10.0.12.3.179 > 10.0.12.2.45004: Flags [P.], seq 35:80, ack 1, win 64, options [nop,nop,TS val 4271195114 ecr 2663362269], length 45: BGP
 00:00:02.093605 eth3  In  IP 10.0.12.2.45004 > 10.0.12.3.179: Flags [.], ack 80, win 63, options [nop,nop,TS val 2663362269 ecr 4271195114], length 0
 00:00:02.093740 eth3  In  IP 10.0.12.2.45004 > 10.0.12.3.179: Flags [P.], seq 1:55, ack 80, win 63, options [nop,nop,TS val 2663362269 ecr 4271195114], length 54: BGP
 00:00:02.093752 eth3  Out IP 10.0.12.3.179 > 10.0.12.2.45004: Flags [.], ack 55, win 64, options [nop,nop,TS val 4271195114 ecr 2663362269], length 0
 00:00:02.096872 eth3  Out IP 10.0.29.2.179 > 10.0.29.3.54171: Flags [F.], seq 21, ack 1, win 64, options [nop,nop,TS val 2352538900 ecr 562822516], length 0
 00:00:02.301871 eth3  Out IP 10.0.29.2.179 > 10.0.29.3.54171: Flags [FP.], seq 0:21, ack 1, win 64, options [nop,nop,TS val 2352539105 ecr 562822516], length 21: BGP
 00:00:02.709876 eth3  Out IP 10.0.29.2.179 > 10.0.29.3.54171: Flags [FP.], seq 0:21, ack 1, win 64, options [nop,nop,TS val 2352539513 ecr 562822516], length 21: BGP
 00:00:03.565853 eth3  Out IP 10.0.29.2.179 > 10.0.29.3.54171: Flags [FP.], seq 0:21, ack 1, win 64, options [nop,nop,TS val 2352540369 ecr 562822516], length 21: BGP
 00:00:05.230862 eth3  Out IP 10.0.29.2.179 > 10.0.29.3.54171: Flags [FP.], seq 0:21, ack 1, win 64, options [nop,nop,TS val 2352542034 ecr 562822516], length 21: BGP
 00:00:08.493866 eth3  Out IP 10.0.29.2.179 > 10.0.29.3.54171: Flags [FP.], seq 0:21, ack 1, win 64, options [nop,nop,TS val 2352545297 ecr 562822516], length 21: BGP
 00:00:10.193714 eth3  Out IP 10.0.12.3.179 > 10.0.12.2.45004: Flags [P.], seq 80:128, ack 55, win 64, options [nop,nop,TS val 4271203214 ecr 2663362269], length 48: BGP
 00:00:10.193875 eth2  Out IP 10.0.29.2.39903 > 10.0.29.3.3784: BFDv1, Control, State Down, Flags: [none], length: 24
 00:00:10.194180 eth3  In  IP 10.0.12.2.45004 > 10.0.12.3.179: Flags [P.], seq 55:82, ack 128, win 63, options [nop,nop,TS val 2663370370 ecr 4271203214], length 27: BGP
 00:00:10.194209 eth3  Out IP 10.0.12.3.179 > 10.0.12.2.45004: Flags [.], ack 82, win 64, options [nop,nop,TS val 4271203215 ecr 2663370370], length 0
 00:00:10.194833 eth3  Out IP 10.0.12.3.179 > 10.0.12.2.45004: Flags [P.], seq 128:173, ack 82, win 64, options [nop,nop,TS val 4271203216 ecr 2663370370], length 45: BGP
 00:00:10.236876 eth3  In  IP 10.0.12.2.45004 > 10.0.12.3.179: Flags [.], ack 173, win 63, options [nop,nop,TS val 2663370413 ecr 4271203216], length 0
 00:00:10.678069 eth2  In  IP 10.0.29.3.46888 > 10.0.29.2.3784: BFDv1, Control, State Init, Flags: [none], length: 24
 00:00:10.678254 eth2  Out IP 10.0.29.2.39903 > 10.0.29.3.3784: BFDv1, Control, State Up, Flags: [Poll], length: 24
 00:00:10.678371 eth2  In  IP 10.0.29.3.46888 > 10.0.29.2.3784: BFDv1, Control, State Up, Flags: [Final], length: 24
 00:00:10.678404 eth2  In  IP 10.0.29.3.46888 > 10.0.29.2.3784: BFDv1, Control, State Up, Flags: [Poll], length: 24
 00:00:10.678497 eth2  Out IP 10.0.29.2.39903 > 10.0.29.3.3784: BFDv1, Control, State Up, Flags: [Final], length: 24
 00:00:10.753795 eth2  Out IP 10.0.29.2.39903 > 10.0.29.3.3784: BFDv1, Control, State Up, Flags: [none], length: 24
 00:00:10.763245 eth2  In  IP 10.0.29.3.46888 > 10.0.29.2.3784: BFDv1, Control, State Up, Flags: [none], length: 24
 00:00:10.840680 eth2  Out IP 10.0.29.2.39903 > 10.0.29.3.3784: BFDv1, Control, State Up, Flags: [none], length: 24
 00:00:10.847006 eth2  In  IP 10.0.29.3.46888 > 10.0.29.2.3784: BFDv1, Control, State Up, Flags: [none], length: 24
 00:00:10.922324 eth2  Out IP 10.0.29.2.39903 > 10.0.29.3.3784: BFDv1, Control, State Up, Flags: [none], length: 24
 00:00:10.931890 eth2  In  IP 10.0.29.3.46888 > 10.0.29.2.3784: BFDv1, Control, State Up, Flags: [none], length: 24
 00:00:11.007328 eth2  Out IP 10.0.29.2.39903 > 10.0.29.3.3784: BFDv1, Control, State Up, Flags: [none], length: 24
 00:00:11.015561 eth2  In  IP 10.0.29.3.46888 > 10.0.29.2.3784: BFDv1, Control, State Up, Flags: [none], length: 24
 00:00:11.084922 eth2  Out IP 10.0.29.2.39903 > 10.0.29.3.3784: BFDv1, Control, State Up, Flags: [none], length: 24
 00:00:11.101387 eth2  In  IP 10.0.29.3.46888 > 10.0.29.2.3784: BFDv1, Control, State Up, Flags: [none], length: 24
 00:00:11.171989 eth2  Out IP 10.0.29.2.39903 > 10.0.29.3.3784: BFDv1, Control, State Up, Flags: [none], length: 24
 00:00:11.176336 eth2  In  IP 10.0.29.3.46888 > 10.0.29.2.3784: BFDv1, Control, State Up, Flags: [none], length: 24
 00:00:11.257725 eth2  Out IP 10.0.29.2.39903 > 10.0.29.3.3784: BFDv1, Control, State Up, Flags: [none], length: 24
 00:00:11.264034 eth2  In  IP 10.0.29.3.46888 > 10.0.29.2.3784: BFDv1, Control, State Up, Flags: [none], length: 24
 00:00:11.336393 eth2  Out IP 10.0.29.2.39903 > 10.0.29.3.3784: BFDv1, Control, State Up, Flags: [none], length: 24
 00:00:11.349677 eth2  In  IP 10.0.29.3.46888 > 10.0.29.2.3784: BFDv1, Control, State Up, Flags: [none], length: 24
 00:00:11.418939 eth2  Out IP 10.0.29.2.39903 > 10.0.29.3.3784: BFDv1, Control, State Up, Flags: [none], length: 24
 00:00:11.438227 eth2  In  IP 10.0.29.3.46888 > 10.0.29.2.3784: BFDv1, Control, State Up, Flags: [none], length: 24
 00:00:11.497789 eth2  Out IP 10.0.29.2.39903 > 10.0.29.3.3784: BFDv1, Control, State Up, Flags: [none], length: 24
 00:00:11.525050 eth2  In  IP 10.0.29.3.46888 > 10.0.29.2.3784: BFDv1, Control, State Up, Flags: [none], length: 24
 00:00:11.572357 eth2  Out IP 10.0.29.2.39903 > 10.0.29.3.3784: BFDv1, Control, State Up, Flags: [none], length: 24
 00:00:11.612158 eth2  In  IP 10.0.29.3.46888 > 10.0.29.2.3784: BFDv1, Control, State Up, Flags: [none], length: 24
 00:00:11.660524 eth2  Out IP 10.0.29.2.39903 > 10.0.29.3.3784: BFDv1, Control, State Up, Flags: [none], length: 24
 00:00:11.700807 eth2  In  IP 10.0.29.3.46888 > 10.0.29.2.3784: BFDv1, Control, State Up, Flags: [none], length: 24
 00:00:11.741145 eth2  Out IP 10.0.29.2.39903 > 10.0.29.3.3784: BFDv1, Control, State Up, Flags: [none], length: 24
 00:00:11.776436 eth2  In  IP 10.0.29.3.46888 > 10.0.29.2.3784: BFDv1, Control, State Up, Flags: [none], length: 24
 00:00:11.818711 eth2  Out IP 10.0.29.2.39903 > 10.0.29.3.3784: BFDv1, Control, State Up, Flags: [none], length: 24
 00:00:11.855141 eth2  In  IP 10.0.29.3.46888 > 10.0.29.2.3784: BFDv1, Control, State Up, Flags: [none], length: 24
 00:00:11.903564 eth2  Out IP 10.0.29.2.39903 > 10.0.29.3.3784: BFDv1, Control, State Up, Flags: [none], length: 24
 00:00:11.943848 eth2  In  IP 10.0.29.3.46888 > 10.0.29.2.3784: BFDv1, Control, State Up, Flags: [none], length: 24
 00:00:11.984169 eth2  Out IP 10.0.29.2.39903 > 10.0.29.3.3784: BFDv1, Control, State Up, Flags: [none], length: 24
 00:00:12.030411 eth2  In  IP 10.0.29.3.46888 > 10.0.29.2.3784: BFDv1, Control, State Up, Flags: [none], length: 24
 00:00:12.074671 eth2  Out IP 10.0.29.2.39903 > 10.0.29.3.3784: BFDv1, Control, State Up, Flags: [none], length: 24
 00:00:12.116088 eth2  In  IP 10.0.29.3.46888 > 10.0.29.2.3784: BFDv1, Control, State Up, Flags: [none], length: 24
 00:00:12.162351 eth2  Out IP 10.0.29.2.39903 > 10.0.29.3.3784: BFDv1, Control, State Up, Flags: [none], length: 24
 00:00:12.204884 eth2  In  IP 10.0.29.3.46888 > 10.0.29.2.3784: BFDv1, Control, State Up, Flags: [none], length: 24
 00:00:12.251220 eth2  Out IP 10.0.29.2.39903 > 10.0.29.3.3784: BFDv1, Control, State Up, Flags: [none], length: 24
 00:00:12.290569 eth2  In  IP 10.0.29.3.46888 > 10.0.29.2.3784: BFDv1, Control, State Up, Flags: [none], length: 24
 00:00:12.332878 eth2  Out IP 10.0.29.2.39903 > 10.0.29.3.3784: BFDv1, Control, State Up, Flags: [none], length: 24
 00:00:12.369232 eth2  In  IP 10.0.29.3.46888 > 10.0.29.2.3784: BFDv1, Control, State Up, Flags: [none], length: 24
 00:00:12.415542 eth2  Out IP 10.0.29.2.39903 > 10.0.29.3.3784: BFDv1, Control, State Up, Flags: [none], length: 24
 00:00:12.444913 eth2  In  IP 10.0.29.3.46888 > 10.0.29.2.3784: BFDv1, Control, State Up, Flags: [none], length: 24
 00:00:12.498535 eth2  Out IP 10.0.29.2.39903 > 10.0.29.3.3784: BFDv1, Control, State Up, Flags: [none], length: 24
 00:00:12.529566 eth2  In  IP 10.0.29.3.46888 > 10.0.29.2.3784: BFDv1, Control, State Up, Flags: [none], length: 24
 00:00:12.582889 eth2  Out IP 10.0.29.2.39903 > 10.0.29.3.3784: BFDv1, Control, State Up, Flags: [none], length: 24
 00:00:12.615164 eth2  In  IP 10.0.29.3.46888 > 10.0.29.2.3784: BFDv1, Control, State Up, Flags: [none], length: 24
 00:00:12.670516 eth2  Out IP 10.0.29.2.39903 > 10.0.29.3.3784: BFDv1, Control, State Up, Flags: [none], length: 24
 00:00:12.693800 eth2  In  IP 10.0.29.3.46888 > 10.0.29.2.3784: BFDv1, Control, State Up, Flags: [none], length: 24
 00:00:12.749159 eth2  Out IP 10.0.29.2.39903 > 10.0.29.3.3784: BFDv1, Control, State Up, Flags: [none], length: 24
 00:00:12.779432 eth2  In  IP 10.0.29.3.46888 > 10.0.29.2.3784: BFDv1, Control, State Up, Flags: [none], length: 24
 00:00:12.825710 eth2  Out IP 10.0.29.2.39903 > 10.0.29.3.3784: BFDv1, Control, State Up, Flags: [none], length: 24
 00:00:12.867965 eth2  In  IP 10.0.29.3.46888 > 10.0.29.2.3784: BFDv1, Control, State Up, Flags: [none], length: 24
 00:00:12.907235 eth2  Out IP 10.0.29.2.39903 > 10.0.29.3.3784: BFDv1, Control, State Up, Flags: [none], length: 24
 00:00:12.945504 eth2  In  IP 10.0.29.3.46888 > 10.0.29.2.3784: BFDv1, Control, State Up, Flags: [none], length: 24
 00:00:12.982805 eth2  Out IP 10.0.29.2.39903 > 10.0.29.3.3784: BFDv1, Control, State Up, Flags: [none], length: 24
 00:00:13.025081 eth2  In  IP 10.0.29.3.46888 > 10.0.29.2.3784: BFDv1, Control, State Up, Flags: [none], length: 24
 00:00:13.063409 eth2  Out IP 10.0.29.2.39903 > 10.0.29.3.3784: BFDv1, Control, State Up, Flags: [none], length: 24
 00:00:13.102685 eth2  In  IP 10.0.29.3.46888 > 10.0.29.2.3784: BFDv1, Control, State Up, Flags: [none], length: 24
 00:00:13.142996 eth2  Out IP 10.0.29.2.39903 > 10.0.29.3.3784: BFDv1, Control, State Up, Flags: [none], length: 24
 00:00:13.182253 eth2  In  IP 10.0.29.3.46888 > 10.0.29.2.3784: BFDv1, Control, State Up, Flags: [none], length: 24
 00:00:13.229536 eth2  Out IP 10.0.29.2.39903 > 10.0.29.3.3784: BFDv1, Control, State Up, Flags: [none], length: 24
 00:00:13.269897 eth2  In  IP 10.0.29.3.46888 > 10.0.29.2.3784: BFDv1, Control, State Up, Flags: [none], length: 24
 00:00:13.309319 eth2  Out IP 10.0.29.2.39903 > 10.0.29.3.3784: BFDv1, Control, State Up, Flags: [none], length: 24
 00:00:13.349622 eth2  In  IP 10.0.29.3.46888 > 10.0.29.2.3784: BFDv1, Control, State Up, Flags: [none], length: 24
 00:00:13.385991 eth2  Out IP 10.0.29.2.39903 > 10.0.29.3.3784: BFDv1, Control, State Up, Flags: [none], length: 24
 00:00:13.430273 eth2  In  IP 10.0.29.3.46888 > 10.0.29.2.3784: BFDv1, Control, State Up, Flags: [none], length: 24
 00:00:13.463674 eth2  Out IP 10.0.29.2.39903 > 10.0.29.3.3784: BFDv1, Control, State Up, Flags: [none], length: 24
 00:00:13.511890 eth2  In  IP 10.0.29.3.46888 > 10.0.29.2.3784: BFDv1, Control, State Up, Flags: [none], length: 24
 00:00:13.553130 eth2  Out IP 10.0.29.2.39903 > 10.0.29.3.3784: BFDv1, Control, State Up, Flags: [none], length: 24
 00:00:13.597394 eth2  In  IP 10.0.29.3.46888 > 10.0.29.2.3784: BFDv1, Control, State Up, Flags: [none], length: 24
 00:00:13.631797 eth2  Out IP 10.0.29.2.39903 > 10.0.29.3.3784: BFDv1, Control, State Up, Flags: [none], length: 24
 00:00:13.678302 eth2  In  IP 10.0.29.3.46888 > 10.0.29.2.3784: BFDv1, Control, State Up, Flags: [none], length: 24
 00:00:13.707597 eth2  Out IP 10.0.29.2.39903 > 10.0.29.3.3784: BFDv1, Control, State Up, Flags: [none], length: 24
 00:00:13.767082 eth2  In  IP 10.0.29.3.46888 > 10.0.29.2.3784: BFDv1, Control, State Up, Flags: [none], length: 24
 00:00:13.792398 eth2  Out IP 10.0.29.2.39903 > 10.0.29.3.3784: BFDv1, Control, State Up, Flags: [none], length: 24
 00:00:13.849693 eth2  In  IP 10.0.29.3.46888 > 10.0.29.2.3784: BFDv1, Control, State Up, Flags: [none], length: 24
 00:00:13.874132 eth2  Out IP 10.0.29.2.39903 > 10.0.29.3.3784: BFDv1, Control, State Up, Flags: [none], length: 24
 00:00:13.931624 eth2  In  IP 10.0.29.3.46888 > 10.0.29.2.3784: BFDv1, Control, State Up, Flags: [none], length: 24
 00:00:13.956942 eth2  Out IP 10.0.29.2.39903 > 10.0.29.3.3784: BFDv1, Control, State Up, Flags: [none], length: 24
 00:00:14.008508 eth2  In  IP 10.0.29.3.46888 > 10.0.29.2.3784: BFDv1, Control, State Up, Flags: [none], length: 24
 00:00:14.044004 eth2  Out IP 10.0.29.2.39903 > 10.0.29.3.3784: BFDv1, Control, State Up, Flags: [none], length: 24
 00:00:14.094299 eth2  In  IP 10.0.29.3.46888 > 10.0.29.2.3784: BFDv1, Control, State Up, Flags: [none], length: 24
 00:00:14.126644 eth2  Out IP 10.0.29.2.39903 > 10.0.29.3.3784: BFDv1, Control, State Up, Flags: [none], length: 24
 00:00:14.179930 eth2  In  IP 10.0.29.3.46888 > 10.0.29.2.3784: BFDv1, Control, State Up, Flags: [none], length: 24
 00:00:14.207207 eth2  Out IP 10.0.29.2.39903 > 10.0.29.3.3784: BFDv1, Control, State Up, Flags: [none], length: 24
 00:00:14.264511 eth2  In  IP 10.0.29.3.46888 > 10.0.29.2.3784: BFDv1, Control, State Up, Flags: [none], length: 24
 00:00:14.285065 eth2  Out IP 10.0.29.2.39903 > 10.0.29.3.3784: BFDv1, Control, State Up, Flags: [none], length: 24
 00:00:14.339412 eth2  Out IP 10.0.29.2.53407 > 10.0.29.3.179: Flags [S], seq 2121822820, win 64240, options [mss 1460,sackOK,TS val 2352551142 ecr 0,nop,wscale 10], length 0
 00:00:14.339501 eth2  In  IP 10.0.29.3.179 > 10.0.29.2.53407: Flags [S.], seq 3657175022, ack 2121822821, win 65160, options [mss 1460,sackOK,TS val 562850878 ecr 2352551142,nop,wscale 10], length 0
 00:00:14.339538 eth2  Out IP 10.0.29.2.53407 > 10.0.29.3.179: Flags [.], ack 1, win 63, options [nop,nop,TS val 2352551142 ecr 562850878], length 0
 00:00:14.339643 eth2  Out IP 10.0.29.2.53407 > 10.0.29.3.179: Flags [P.], seq 1:65, ack 1, win 63, options [nop,nop,TS val 2352551142 ecr 562850878], length 64: BGP
 00:00:14.339665 eth2  In  IP 10.0.29.3.179 > 10.0.29.2.53407: Flags [.], ack 65, win 64, options [nop,nop,TS val 562850878 ecr 2352551142], length 0
 00:00:14.339708 eth2  In  IP 10.0.29.3.179 > 10.0.29.2.53407: Flags [R.], seq 1, ack 65, win 64, options [nop,nop,TS val 562850878 ecr 2352551142], length 0
 00:00:14.340394 eth2  In  IP 10.0.29.3.46888 > 10.0.29.2.3784: BFDv1, Control, State Up, Flags: [none], length: 24
 00:00:14.368648 eth2  Out IP 10.0.29.2.39903 > 10.0.29.3.3784: BFDv1, Control, State Up, Flags: [none], length: 24
 00:00:14.423066 eth2  In  IP 10.0.29.3.46888 > 10.0.29.2.3784: BFDv1, Control, State Up, Flags: [none], length: 24
 00:00:14.457485 eth2  Out IP 10.0.29.2.39903 > 10.0.29.3.3784: BFDv1, Control, State Up, Flags: [none], length: 24
 00:00:14.512603 eth2  In  IP 10.0.29.3.46888 > 10.0.29.2.3784: BFDv1, Control, State Up, Flags: [none], length: 24
 00:00:14.538980 eth2  Out IP 10.0.29.2.39903 > 10.0.29.3.3784: BFDv1, Control, State Up, Flags: [none], length: 24
 00:00:14.593298 eth2  In  IP 10.0.29.3.46888 > 10.0.29.2.3784: BFDv1, Control, State Up, Flags: [none], length: 24
 00:00:14.614618 eth2  Out IP 10.0.29.2.39903 > 10.0.29.3.3784: BFDv1, Control, State Up, Flags: [none], length: 24
 00:00:14.680344 eth2  In  IP 10.0.29.3.46888 > 10.0.29.2.3784: BFDv1, Control, State Up, Flags: [none], length: 24
 00:00:14.696983 eth2  Out IP 10.0.29.2.39903 > 10.0.29.3.3784: BFDv1, Control, State Up, Flags: [none], length: 24
 00:00:14.763290 eth2  In  IP 10.0.29.3.46888 > 10.0.29.2.3784: BFDv1, Control, State Up, Flags: [none], length: 24
 00:00:14.784572 eth2  Out IP 10.0.29.2.39903 > 10.0.29.3.3784: BFDv1, Control, State Up, Flags: [none], length: 24
 00:00:14.850561 eth2  In  IP 10.0.29.3.46888 > 10.0.29.2.3784: BFDv1, Control, State Up, Flags: [none], length: 24
 00:00:14.869970 eth2  Out IP 10.0.29.2.39903 > 10.0.29.3.3784: BFDv1, Control, State Up, Flags: [none], length: 24
 00:00:14.927258 eth2  In  IP 10.0.29.3.46888 > 10.0.29.2.3784: BFDv1, Control, State Up, Flags: [none], length: 24
 00:00:14.948591 eth2  Out IP 10.0.29.2.39903 > 10.0.29.3.3784: BFDv1, Control, State Up, Flags: [none], length: 24
 00:00:15.016646 eth2  In  IP 10.0.29.3.46888 > 10.0.29.2.3784: BFDv1, Control, State Up, Flags: [none], length: 24
 00:00:15.024952 eth2  Out IP 10.0.29.2.39903 > 10.0.29.3.3784: BFDv1, Control, State Up, Flags: [none], length: 24
 00:00:15.094309 eth2  In  IP 10.0.29.3.46888 > 10.0.29.2.3784: BFDv1, Control, State Up, Flags: [none], length: 24
 00:00:15.111679 eth2  Out IP 10.0.29.2.39903 > 10.0.29.3.3784: BFDv1, Control, State Up, Flags: [none], length: 24
 00:00:15.176086 eth2  In  IP 10.0.29.3.46888 > 10.0.29.2.3784: BFDv1, Control, State Up, Flags: [none], length: 24
 00:00:15.196417 eth2  Out IP 10.0.29.2.39903 > 10.0.29.3.3784: BFDv1, Control, State Up, Flags: [none], length: 24
 00:00:15.253842 eth2  In  IP 10.0.29.3.46888 > 10.0.29.2.3784: BFDv1, Control, State Up, Flags: [none], length: 24
 00:00:15.274131 eth2  Out IP 10.0.29.2.39903 > 10.0.29.3.3784: BFDv1, Control, State Up, Flags: [none], length: 24
 00:00:15.340380 eth2  In  IP 10.0.29.3.46888 > 10.0.29.2.3784: BFDv1, Control, State Up, Flags: [none], length: 24
 00:00:15.341890 eth2  Out IP 10.0.29.2.179 > 10.0.29.3.54171: Flags [FP.], seq 0:21, ack 1, win 64, options [nop,nop,TS val 2352552145 ecr 562822516], length 21: BGP
 00:00:15.342054 eth2  In  IP 10.0.29.3.54171 > 10.0.29.2.179: Flags [R], seq 3990065237, win 0, length 0
 00:00:15.350676 eth2  Out IP 10.0.29.2.39903 > 10.0.29.3.3784: BFDv1, Control, State Up, Flags: [none], length: 24
 00:00:15.422404 eth2  In  IP 10.0.29.3.46888 > 10.0.29.2.3784: BFDv1, Control, State Up, Flags: [none], length: 24
 00:00:15.439726 eth2  Out IP 10.0.29.2.39903 > 10.0.29.3.3784: BFDv1, Control, State Up, Flags: [none], length: 24
 00:00:15.507635 eth2  In  IP 10.0.29.3.46888 > 10.0.29.2.3784: BFDv1, Control, State Up, Flags: [none], length: 24
 00:00:15.529172 eth2  Out IP 10.0.29.2.39903 > 10.0.29.3.3784: BFDv1, Control, State Up, Flags: [none], length: 24
 00:00:15.589338 eth2  In  IP 10.0.29.3.46888 > 10.0.29.2.3784: BFDv1, Control, State Up, Flags: [none], length: 24
 00:00:15.609672 eth2  Out IP 10.0.29.2.39903 > 10.0.29.3.3784: BFDv1, Control, State Up, Flags: [none], length: 24
 00:00:15.664227 eth2  In  IP 10.0.29.3.46888 > 10.0.29.2.3784: BFDv1, Control, State Up, Flags: [none], length: 24
 00:00:15.685590 eth2  Out IP 10.0.29.2.39903 > 10.0.29.3.3784: BFDv1, Control, State Up, Flags: [none], length: 24
 00:00:15.754361 eth2  In  IP 10.0.29.3.46888 > 10.0.29.2.3784: BFDv1, Control, State Up, Flags: [none], length: 24
 00:00:15.762650 eth2  Out IP 10.0.29.2.39903 > 10.0.29.3.3784: BFDv1, Control, State Up, Flags: [none], length: 24
 00:00:15.833368 eth2  In  IP 10.0.29.3.46888 > 10.0.29.2.3784: BFDv1, Control, State Up, Flags: [none], length: 24
 00:00:15.842649 eth2  Out IP 10.0.29.2.39903 > 10.0.29.3.3784: BFDv1, Control, State Up, Flags: [none], length: 24
 00:00:15.912534 eth2  In  IP 10.0.29.3.46888 > 10.0.29.2.3784: BFDv1, Control, State Up, Flags: [none], length: 24
 00:00:15.921866 eth2  Out IP 10.0.29.2.39903 > 10.0.29.3.3784: BFDv1, Control, State Up, Flags: [none], length: 24
 00:00:15.988683 eth2  In  IP 10.0.29.3.46888 > 10.0.29.2.3784: BFDv1, Control, State Up, Flags: [none], length: 24
 00:00:15.998948 eth2  Out IP 10.0.29.2.39903 > 10.0.29.3.3784: BFDv1, Control, State Up, Flags: [none], length: 24
 00:00:16.067430 eth2  In  IP 10.0.29.3.46888 > 10.0.29.2.3784: BFDv1, Control, State Up, Flags: [none], length: 24
 00:00:16.088722 eth2  Out IP 10.0.29.2.39903 > 10.0.29.3.3784: BFDv1, Control, State Up, Flags: [none], length: 24
 00:00:16.142158 eth2  In  IP 10.0.29.3.46888 > 10.0.29.2.3784: BFDv1, Control, State Up, Flags: [none], length: 24
 00:00:16.174482 eth2  Out IP 10.0.29.2.39903 > 10.0.29.3.3784: BFDv1, Control, State Up, Flags: [none], length: 24
 00:00:16.232928 eth2  In  IP 10.0.29.3.46888 > 10.0.29.2.3784: BFDv1, Control, State Up, Flags: [none], length: 24
 00:00:16.259216 eth2  Out IP 10.0.29.2.39903 > 10.0.29.3.3784: BFDv1, Control, State Up, Flags: [none], length: 24
 00:00:16.321672 eth2  In  IP 10.0.29.3.46888 > 10.0.29.2.3784: BFDv1, Control, State Up, Flags: [none], length: 24
 00:00:16.345959 eth2  Out IP 10.0.29.2.39903 > 10.0.29.3.3784: BFDv1, Control, State Up, Flags: [none], length: 24
 00:00:16.402455 eth2  In  IP 10.0.29.3.46888 > 10.0.29.2.3784: BFDv1, Control, State Up, Flags: [none], length: 24
 00:00:16.423746 eth2  Out IP 10.0.29.2.39903 > 10.0.29.3.3784: BFDv1, Control, State Up, Flags: [none], length: 24
 00:00:16.490162 eth2  In  IP 10.0.29.3.46888 > 10.0.29.2.3784: BFDv1, Control, State Up, Flags: [none], length: 24
 00:00:16.499399 eth2  Out IP 10.0.29.2.39903 > 10.0.29.3.3784: BFDv1, Control, State Up, Flags: [none], length: 24
 00:00:16.578807 eth2  In  IP 10.0.29.3.46888 > 10.0.29.2.3784: BFDv1, Control, State Up, Flags: [none], length: 24
 00:00:16.587123 eth2  Out IP 10.0.29.2.39903 > 10.0.29.3.3784: BFDv1, Control, State Up, Flags: [none], length: 24
 00:00:16.658555 eth2  In  IP 10.0.29.3.46888 > 10.0.29.2.3784: BFDv1, Control, State Up, Flags: [none], length: 24
 00:00:16.674845 eth2  Out IP 10.0.29.2.39903 > 10.0.29.3.3784: BFDv1, Control, State Up, Flags: [none], length: 24
 00:00:16.735322 eth2  In  IP 10.0.29.3.46888 > 10.0.29.2.3784: BFDv1, Control, State Up, Flags: [none], length: 24
 00:00:16.750626 eth2  Out IP 10.0.29.2.39903 > 10.0.29.3.3784: BFDv1, Control, State Up, Flags: [none], length: 24
 00:00:16.818124 eth2  In  IP 10.0.29.3.46888 > 10.0.29.2.3784: BFDv1, Control, State Up, Flags: [none], length: 24
 00:00:16.832424 eth2  Out IP 10.0.29.2.39903 > 10.0.29.3.3784: BFDv1, Control, State Up, Flags: [none], length: 24
 00:00:16.902596 eth2  In  IP 10.0.29.3.46888 > 10.0.29.2.3784: BFDv1, Control, State Up, Flags: [none], length: 24
 00:00:16.913890 eth2  Out IP 10.0.29.2.39903 > 10.0.29.3.3784: BFDv1, Control, State Up, Flags: [none], length: 24
 00:00:16.984992 eth2  In  IP 10.0.29.3.46888 > 10.0.29.2.3784: BFDv1, Control, State Up, Flags: [none], length: 24
 00:00:16.988249 eth2  Out IP 10.0.29.2.39903 > 10.0.29.3.3784: BFDv1, Control, State Up, Flags: [none], length: 24
 00:00:17.067409 eth2  In  IP 10.0.29.3.46888 > 10.0.29.2.3784: BFDv1, Control, State Up, Flags: [none], length: 24
 00:00:17.074688 eth2  Out IP 10.0.29.2.39903 > 10.0.29.3.3784: BFDv1, Control, State Up, Flags: [none], length: 24
 00:00:17.156431 eth2  In  IP 10.0.29.3.46888 > 10.0.29.2.3784: BFDv1, Control, State Up, Flags: [none], length: 24
 00:00:17.157710 eth2  Out IP 10.0.29.2.39903 > 10.0.29.3.3784: BFDv1, Control, State Up, Flags: [none], length: 24
 00:00:17.238924 eth2  Out IP 10.0.29.2.39903 > 10.0.29.3.3784: BFDv1, Control, State Up, Flags: [none], length: 24
 00:00:17.243189 eth2  In  IP 10.0.29.3.46888 > 10.0.29.2.3784: BFDv1, Control, State Up, Flags: [none], length: 24
 00:00:17.322507 eth2  Out IP 10.0.29.2.39903 > 10.0.29.3.3784: BFDv1, Control, State Up, Flags: [none], length: 24
 00:00:17.326775 eth2  In  IP 10.0.29.3.46888 > 10.0.29.2.3784: BFDv1, Control, State Up, Flags: [none], length: 24
 00:00:17.400102 eth2  Out IP 10.0.29.2.39903 > 10.0.29.3.3784: BFDv1, Control, State Up, Flags: [none], length: 24
 00:00:17.413507 eth2  In  IP 10.0.29.3.46888 > 10.0.29.2.3784: BFDv1, Control, State Up, Flags: [none], length: 24
 00:00:17.486028 eth2  Out IP 10.0.29.2.39903 > 10.0.29.3.3784: BFDv1, Control, State Up, Flags: [none], length: 24
 00:00:17.490378 eth2  In  IP 10.0.29.3.46888 > 10.0.29.2.3784: BFDv1, Control, State Up, Flags: [none], length: 24
 00:00:17.570753 eth2  Out IP 10.0.29.2.39903 > 10.0.29.3.3784: BFDv1, Control, State Up, Flags: [none], length: 24
 00:00:17.572991 eth2  In  IP 10.0.29.3.46888 > 10.0.29.2.3784: BFDv1, Control, State Up, Flags: [none], length: 24
 00:00:17.659267 eth2  Out IP 10.0.29.2.39903 > 10.0.29.3.3784: BFDv1, Control, State Up, Flags: [none], length: 24
 00:00:17.661487 eth2  In  IP 10.0.29.3.46888 > 10.0.29.2.3784: BFDv1, Control, State Up, Flags: [none], length: 24
 00:00:17.739794 eth2  Out IP 10.0.29.2.39903 > 10.0.29.3.3784: BFDv1, Control, State Up, Flags: [none], length: 24
 00:00:17.743047 eth2  In  IP 10.0.29.3.46888 > 10.0.29.2.3784: BFDv1, Control, State Up, Flags: [none], length: 24
 00:00:17.824428 eth2  In  IP 10.0.29.3.46888 > 10.0.29.2.3784: BFDv1, Control, State Up, Flags: [none], length: 24
 00:00:17.827938 eth2  Out IP 10.0.29.2.39903 > 10.0.29.3.3784: BFDv1, Control, State Up, Flags: [none], length: 24
 00:00:17.904360 eth2  In  IP 10.0.29.3.46888 > 10.0.29.2.3784: BFDv1, Control, State Up, Flags: [none], length: 24
 00:00:17.917763 eth2  Out IP 10.0.29.2.39903 > 10.0.29.3.3784: BFDv1, Control, State Up, Flags: [none], length: 24
 00:00:17.989110 eth2  In  IP 10.0.29.3.46888 > 10.0.29.2.3784: BFDv1, Control, State Up, Flags: [none], length: 24
 00:00:17.997441 eth2  Out IP 10.0.29.2.39903 > 10.0.29.3.3784: BFDv1, Control, State Up, Flags: [none], length: 24
 00:00:18.074923 eth2  In  IP 10.0.29.3.46888 > 10.0.29.2.3784: BFDv1, Control, State Up, Flags: [none], length: 24
 00:00:18.083207 eth2  Out IP 10.0.29.2.39903 > 10.0.29.3.3784: BFDv1, Control, State Up, Flags: [none], length: 24
 00:00:18.163079 eth2  In  IP 10.0.29.3.46888 > 10.0.29.2.3784: BFDv1, Control, State Up, Flags: [none], length: 24
 00:00:18.163260 eth2  Out IP 10.0.29.2.39903 > 10.0.29.3.3784: BFDv1, Control, State Up, Flags: [none], length: 24
 00:00:18.244525 eth2  Out IP 10.0.29.2.39903 > 10.0.29.3.3784: BFDv1, Control, State Up, Flags: [none], length: 24
 00:00:18.247776 eth2  In  IP 10.0.29.3.46888 > 10.0.29.2.3784: BFDv1, Control, State Up, Flags: [none], length: 24
 00:00:18.332198 eth2  Out IP 10.0.29.2.39903 > 10.0.29.3.3784: BFDv1, Control, State Up, Flags: [none], length: 24
 00:00:18.336565 eth2  In  IP 10.0.29.3.46888 > 10.0.29.2.3784: BFDv1, Control, State Up, Flags: [none], length: 24
 00:00:18.413148 eth2  In  IP 10.0.29.3.46888 > 10.0.29.2.3784: BFDv1, Control, State Up, Flags: [none], length: 24
 00:00:18.417436 eth2  Out IP 10.0.29.2.39903 > 10.0.29.3.3784: BFDv1, Control, State Up, Flags: [none], length: 24
 00:00:18.501697 eth2  Out IP 10.0.29.2.39903 > 10.0.29.3.3784: BFDv1, Control, State Up, Flags: [none], length: 24
 00:00:18.501850 eth2  In  IP 10.0.29.3.46888 > 10.0.29.2.3784: BFDv1, Control, State Up, Flags: [none], length: 24
 00:00:18.588519 eth2  In  IP 10.0.29.3.46888 > 10.0.29.2.3784: BFDv1, Control, State Up, Flags: [none], length: 24
 00:00:18.590775 eth2  Out IP 10.0.29.2.39903 > 10.0.29.3.3784: BFDv1, Control, State Up, Flags: [none], length: 24
 00:00:18.675041 eth2  Out IP 10.0.29.2.39903 > 10.0.29.3.3784: BFDv1, Control, State Up, Flags: [none], length: 24
 00:00:18.676301 eth2  In  IP 10.0.29.3.46888 > 10.0.29.2.3784: BFDv1, Control, State Up, Flags: [none], length: 24
 00:00:18.751997 eth2  In  IP 10.0.29.3.46888 > 10.0.29.2.3784: BFDv1, Control, State Up, Flags: [none], length: 24
 00:00:18.755298 eth2  Out IP 10.0.29.2.39903 > 10.0.29.3.3784: BFDv1, Control, State Up, Flags: [none], length: 24
 00:00:18.829032 eth2  In  IP 10.0.29.3.46888 > 10.0.29.2.3784: BFDv1, Control, State Up, Flags: [none], length: 24
 00:00:18.839338 eth2  Out IP 10.0.29.2.39903 > 10.0.29.3.3784: BFDv1, Control, State Up, Flags: [none], length: 24
 00:00:18.905127 eth2  In  IP 10.0.29.3.46888 > 10.0.29.2.3784: BFDv1, Control, State Up, Flags: [none], length: 24
 00:00:18.920389 eth2  Out IP 10.0.29.2.39903 > 10.0.29.3.3784: BFDv1, Control, State Up, Flags: [none], length: 24
 00:00:18.963914 eth2  Out IP 10.0.29.2.49819 > 10.0.29.3.179: Flags [S], seq 861171631, win 64240, options [mss 1460,sackOK,TS val 2352555767 ecr 0,nop,wscale 10], length 0
 00:00:18.963974 eth2  In  IP 10.0.29.3.179 > 10.0.29.2.49819: Flags [S.], seq 474084880, ack 861171632, win 65160, options [mss 1460,sackOK,TS val 562855503 ecr 2352555767,nop,wscale 10], length 0
 00:00:18.963998 eth2  Out IP 10.0.29.2.49819 > 10.0.29.3.179: Flags [.], ack 1, win 63, options [nop,nop,TS val 2352555767 ecr 562855503], length 0
 00:00:18.964065 eth2  Out IP 10.0.29.2.49819 > 10.0.29.3.179: Flags [P.], seq 1:65, ack 1, win 63, options [nop,nop,TS val 2352555767 ecr 562855503], length 64: BGP
 00:00:18.964077 eth2  In  IP 10.0.29.3.179 > 10.0.29.2.49819: Flags [.], ack 65, win 64, options [nop,nop,TS val 562855503 ecr 2352555767], length 0
 00:00:18.964169 eth2  In  IP 10.0.29.3.179 > 10.0.29.2.49819: Flags [R.], seq 1, ack 65, win 64, options [nop,nop,TS val 562855503 ecr 2352555767], length 0
 00:00:18.986248 eth2  In  IP 10.0.29.3.46888 > 10.0.29.2.3784: BFDv1, Control, State Up, Flags: [none], length: 24
 00:00:19.002542 eth2  Out IP 10.0.29.2.39903 > 10.0.29.3.3784: BFDv1, Control, State Up, Flags: [none], length: 24
 00:00:19.072326 eth2  In  IP 10.0.29.3.46888 > 10.0.29.2.3784: BFDv1, Control, State Up, Flags: [none], length: 24
 00:00:19.087670 eth2  Out IP 10.0.29.2.39903 > 10.0.29.3.3784: BFDv1, Control, State Up, Flags: [none], length: 24
 00:00:19.159334 eth2  In  IP 10.0.29.3.46888 > 10.0.29.2.3784: BFDv1, Control, State Up, Flags: [none], length: 24
 00:00:19.172603 eth2  Out IP 10.0.29.2.39903 > 10.0.29.3.3784: BFDv1, Control, State Up, Flags: [none], length: 24
 00:00:19.242127 eth2  In  IP 10.0.29.3.46888 > 10.0.29.2.3784: BFDv1, Control, State Up, Flags: [none], length: 24
 00:00:19.258458 eth2  Out IP 10.0.29.2.39903 > 10.0.29.3.3784: BFDv1, Control, State Up, Flags: [none], length: 24
 00:00:19.322983 eth2  In  IP 10.0.29.3.46888 > 10.0.29.2.3784: BFDv1, Control, State Up, Flags: [none], length: 24
 00:00:19.344401 eth2  Out IP 10.0.29.2.39903 > 10.0.29.3.3784: BFDv1, Control, State Up, Flags: [none], length: 24
 00:00:19.406971 eth2  In  IP 10.0.29.3.46888 > 10.0.29.2.3784: BFDv1, Control, State Up, Flags: [none], length: 24
 00:00:19.424298 eth2  Out IP 10.0.29.2.39903 > 10.0.29.3.3784: BFDv1, Control, State Up, Flags: [none], length: 24
 00:00:19.488827 eth2  In  IP 10.0.29.3.46888 > 10.0.29.2.3784: BFDv1, Control, State Up, Flags: [none], length: 24
 00:00:19.503125 eth2  Out IP 10.0.29.2.39903 > 10.0.29.3.3784: BFDv1, Control, State Up, Flags: [none], length: 24
 00:00:19.573498 eth2  In  IP 10.0.29.3.46888 > 10.0.29.2.3784: BFDv1, Control, State Up, Flags: [none], length: 24
 00:00:19.578735 eth2  Out IP 10.0.29.2.39903 > 10.0.29.3.3784: BFDv1, Control, State Up, Flags: [none], length: 24
 00:00:19.655068 eth2  In  IP 10.0.29.3.46888 > 10.0.29.2.3784: BFDv1, Control, State Up, Flags: [none], length: 24
 00:00:19.668413 eth2  Out IP 10.0.29.2.39903 > 10.0.29.3.3784: BFDv1, Control, State Up, Flags: [none], length: 24
 00:00:19.732877 eth2  In  IP 10.0.29.3.46888 > 10.0.29.2.3784: BFDv1, Control, State Up, Flags: [none], length: 24
 00:00:19.748169 eth2  Out IP 10.0.29.2.39903 > 10.0.29.3.3784: BFDv1, Control, State Up, Flags: [none], length: 24
 00:00:19.816926 eth2  In  IP 10.0.29.3.46888 > 10.0.29.2.3784: BFDv1, Control, State Up, Flags: [none], length: 24
 00:00:19.835239 eth2  Out IP 10.0.29.2.39903 > 10.0.29.3.3784: BFDv1, Control, State Up, Flags: [none], length: 24
 00:00:19.903109 eth2  In  IP 10.0.29.3.46888 > 10.0.29.2.3784: BFDv1, Control, State Up, Flags: [none], length: 24
 00:00:19.919414 eth2  Out IP 10.0.29.2.39903 > 10.0.29.3.3784: BFDv1, Control, State Up, Flags: [none], length: 24
 00:00:19.982924 eth2  In  IP 10.0.29.3.46888 > 10.0.29.2.3784: BFDv1, Control, State Up, Flags: [none], length: 24
 00:00:19.997223 eth2  Out IP 10.0.29.2.39903 > 10.0.29.3.3784: BFDv1, Control, State Up, Flags: [none], length: 24
 00:00:20.064663 eth2  In  IP 10.0.29.3.46888 > 10.0.29.2.3784: BFDv1, Control, State Up, Flags: [none], length: 24
 00:00:20.073933 eth2  Out IP 10.0.29.2.39903 > 10.0.29.3.3784: BFDv1, Control, State Up, Flags: [none], length: 24
 00:00:20.144368 eth2  In  IP 10.0.29.3.46888 > 10.0.29.2.3784: BFDv1, Control, State Up, Flags: [none], length: 24
 00:00:20.155653 eth2  Out IP 10.0.29.2.39903 > 10.0.29.3.3784: BFDv1, Control, State Up, Flags: [none], length: 24
 00:00:20.227107 eth2  In  IP 10.0.29.3.46888 > 10.0.29.2.3784: BFDv1, Control, State Up, Flags: [none], length: 24
 00:00:20.233374 eth2  Out IP 10.0.29.2.39903 > 10.0.29.3.3784: BFDv1, Control, State Up, Flags: [none], length: 24
 00:00:20.314637 eth2  Out IP 10.0.29.2.39903 > 10.0.29.3.3784: BFDv1, Control, State Up, Flags: [none], length: 24
 00:00:20.315855 eth2  In  IP 10.0.29.3.46888 > 10.0.29.2.3784: BFDv1, Control, State Up, Flags: [none], length: 24
 00:00:20.392135 eth2  Out IP 10.0.29.2.39903 > 10.0.29.3.3784: BFDv1, Control, State Up, Flags: [none], length: 24
 00:00:20.399518 eth2  In  IP 10.0.29.3.46888 > 10.0.29.2.3784: BFDv1, Control, State Up, Flags: [none], length: 24
 00:00:20.474761 eth2  Out IP 10.0.29.2.39903 > 10.0.29.3.3784: BFDv1, Control, State Up, Flags: [none], length: 24
 00:00:20.477984 eth2  In  IP 10.0.29.3.46888 > 10.0.29.2.3784: BFDv1, Control, State Up, Flags: [none], length: 24
 00:00:20.555412 eth2  In  IP 10.0.29.3.46888 > 10.0.29.2.3784: BFDv1, Control, State Up, Flags: [none], length: 24
 00:00:20.561669 eth2  Out IP 10.0.29.2.39903 > 10.0.29.3.3784: BFDv1, Control, State Up, Flags: [none], length: 24
 00:00:20.633895 eth2  In  IP 10.0.29.3.46888 > 10.0.29.2.3784: BFDv1, Control, State Up, Flags: [none], length: 24
 00:00:20.651148 eth2  Out IP 10.0.29.2.39903 > 10.0.29.3.3784: BFDv1, Control, State Up, Flags: [none], length: 24
 00:00:20.723244 eth2  In  IP 10.0.29.3.46888 > 10.0.29.2.3784: BFDv1, Control, State Up, Flags: [none], length: 24
 00:00:20.729478 eth2  Out IP 10.0.29.2.39903 > 10.0.29.3.3784: BFDv1, Control, State Up, Flags: [none], length: 24
 00:00:20.810713 eth2  Out IP 10.0.29.2.39903 > 10.0.29.3.3784: BFDv1, Control, State Up, Flags: [none], length: 24
 00:00:20.811950 eth2  In  IP 10.0.29.3.46888 > 10.0.29.2.3784: BFDv1, Control, State Up, Flags: [none], length: 24
 00:00:20.888166 eth2  In  IP 10.0.29.3.46888 > 10.0.29.2.3784: BFDv1, Control, State Up, Flags: [none], length: 24
 00:00:20.899452 eth2  Out IP 10.0.29.2.39903 > 10.0.29.3.3784: BFDv1, Control, State Up, Flags: [none], length: 24
 00:00:20.967870 eth2  In  IP 10.0.29.3.46888 > 10.0.29.2.3784: BFDv1, Control, State Up, Flags: [none], length: 24
 00:00:20.987068 eth2  Out IP 10.0.29.2.39903 > 10.0.29.3.3784: BFDv1, Control, State Up, Flags: [none], length: 24
 00:00:21.051696 eth2  In  IP 10.0.29.3.46888 > 10.0.29.2.3784: BFDv1, Control, State Up, Flags: [none], length: 24
 00:00:21.073026 eth2  Out IP 10.0.29.2.39903 > 10.0.29.3.3784: BFDv1, Control, State Up, Flags: [none], length: 24
 00:00:21.128496 eth2  In  IP 10.0.29.3.46888 > 10.0.29.2.3784: BFDv1, Control, State Up, Flags: [none], length: 24
 00:00:21.155880 eth2  Out IP 10.0.29.2.39903 > 10.0.29.3.3784: BFDv1, Control, State Up, Flags: [none], length: 24
 00:00:21.209320 eth2  In  IP 10.0.29.3.46888 > 10.0.29.2.3784: BFDv1, Control, State Up, Flags: [none], length: 24
 00:00:21.233664 eth2  Out IP 10.0.29.2.39903 > 10.0.29.3.3784: BFDv1, Control, State Up, Flags: [none], length: 24
 00:00:21.285146 eth2  In  IP 10.0.29.3.46888 > 10.0.29.2.3784: BFDv1, Control, State Up, Flags: [none], length: 24
 00:00:21.311524 eth2  Out IP 10.0.29.2.39903 > 10.0.29.3.3784: BFDv1, Control, State Up, Flags: [none], length: 24
 00:00:21.374018 eth2  In  IP 10.0.29.3.46888 > 10.0.29.2.3784: BFDv1, Control, State Up, Flags: [none], length: 24
 00:00:21.388329 eth2  Out IP 10.0.29.2.39903 > 10.0.29.3.3784: BFDv1, Control, State Up, Flags: [none], length: 24
 00:00:21.452943 eth2  In  IP 10.0.29.3.46888 > 10.0.29.2.3784: BFDv1, Control, State Up, Flags: [none], length: 24
 00:00:21.470302 eth2  Out IP 10.0.29.2.39903 > 10.0.29.3.3784: BFDv1, Control, State Up, Flags: [none], length: 24
 00:00:21.529545 eth2  In  IP 10.0.29.3.46888 > 10.0.29.2.3784: BFDv1, Control, State Up, Flags: [none], length: 24
 00:00:21.553033 eth2  Out IP 10.0.29.2.39903 > 10.0.29.3.3784: BFDv1, Control, State Up, Flags: [none], length: 24
 00:00:21.614217 eth2  In  IP 10.0.29.3.46888 > 10.0.29.2.3784: BFDv1, Control, State Up, Flags: [none], length: 24
 00:00:21.639516 eth2  Out IP 10.0.29.2.39903 > 10.0.29.3.3784: BFDv1, Control, State Up, Flags: [none], length: 24
 00:00:21.700923 eth2  In  IP 10.0.29.3.46888 > 10.0.29.2.3784: BFDv1, Control, State Up, Flags: [none], length: 24
 00:00:21.716238 eth2  Out IP 10.0.29.2.39903 > 10.0.29.3.3784: BFDv1, Control, State Up, Flags: [none], length: 24
 00:00:21.788394 eth2  In  IP 10.0.29.3.46888 > 10.0.29.2.3784: BFDv1, Control, State Up, Flags: [none], length: 24
 00:00:21.794689 eth2  Out IP 10.0.29.2.39903 > 10.0.29.3.3784: BFDv1, Control, State Up, Flags: [none], length: 24
 00:00:21.870088 eth2  In  IP 10.0.29.3.46888 > 10.0.29.2.3784: BFDv1, Control, State Up, Flags: [none], length: 24
 00:00:21.876437 eth2  Out IP 10.0.29.2.39903 > 10.0.29.3.3784: BFDv1, Control, State Up, Flags: [none], length: 24
 00:00:21.953759 eth2  In  IP 10.0.29.3.46888 > 10.0.29.2.3784: BFDv1, Control, State Up, Flags: [none], length: 24
 00:00:21.958066 eth2  Out IP 10.0.29.2.39903 > 10.0.29.3.3784: BFDv1, Control, State Up, Flags: [none], length: 24
 00:00:22.039349 eth2  Out IP 10.0.29.2.39903 > 10.0.29.3.3784: BFDv1, Control, State Up, Flags: [none], length: 24
 00:00:22.039502 eth2  In  IP 10.0.29.3.46888 > 10.0.29.2.3784: BFDv1, Control, State Up, Flags: [none], length: 24
 00:00:22.122038 eth2  Out IP 10.0.29.2.39903 > 10.0.29.3.3784: BFDv1, Control, State Up, Flags: [none], length: 24
 00:00:22.129453 eth2  In  IP 10.0.29.3.46888 > 10.0.29.2.3784: BFDv1, Control, State Up, Flags: [none], length: 24
 00:00:22.201897 eth2  Out IP 10.0.29.2.39903 > 10.0.29.3.3784: BFDv1, Control, State Up, Flags: [none], length: 24
 00:00:22.215264 eth2  In  IP 10.0.29.3.46888 > 10.0.29.2.3784: BFDv1, Control, State Up, Flags: [none], length: 24
 00:00:22.288601 eth2  Out IP 10.0.29.2.39903 > 10.0.29.3.3784: BFDv1, Control, State Up, Flags: [none], length: 24
 00:00:22.290926 eth2  In  IP 10.0.29.3.46888 > 10.0.29.2.3784: BFDv1, Control, State Up, Flags: [none], length: 24
 00:00:22.367306 eth2  Out IP 10.0.29.2.39903 > 10.0.29.3.3784: BFDv1, Control, State Up, Flags: [none], length: 24
 00:00:22.368558 eth2  In  IP 10.0.29.3.46888 > 10.0.29.2.3784: BFDv1, Control, State Up, Flags: [none], length: 24
 00:00:22.451607 eth2  In  IP 10.0.29.3.46888 > 10.0.29.2.3784: BFDv1, Control, State Up, Flags: [none], length: 24
 00:00:22.456935 eth2  Out IP 10.0.29.2.39903 > 10.0.29.3.3784: BFDv1, Control, State Up, Flags: [none], length: 24
 00:00:22.536248 eth2  In  IP 10.0.29.3.46888 > 10.0.29.2.3784: BFDv1, Control, State Up, Flags: [none], length: 24
 00:00:22.546669 eth2  Out IP 10.0.29.2.39903 > 10.0.29.3.3784: BFDv1, Control, State Up, Flags: [none], length: 24
 00:00:22.615879 eth2  In  IP 10.0.29.3.46888 > 10.0.29.2.3784: BFDv1, Control, State Up, Flags: [none], length: 24
 00:00:22.626241 eth2  Out IP 10.0.29.2.39903 > 10.0.29.3.3784: BFDv1, Control, State Up, Flags: [none], length: 24
 00:00:22.705455 eth2  In  IP 10.0.29.3.46888 > 10.0.29.2.3784: BFDv1, Control, State Up, Flags: [none], length: 24
 00:00:22.706736 eth2  Out IP 10.0.29.2.39903 > 10.0.29.3.3784: BFDv1, Control, State Up, Flags: [none], length: 24
 00:00:22.783976 eth2  Out IP 10.0.29.2.39903 > 10.0.29.3.3784: BFDv1, Control, State Up, Flags: [none], length: 24
 00:00:22.795228 eth2  In  IP 10.0.29.3.46888 > 10.0.29.2.3784: BFDv1, Control, State Up, Flags: [none], length: 24
 00:00:22.870538 eth2  Out IP 10.0.29.2.39903 > 10.0.29.3.3784: BFDv1, Control, State Up, Flags: [none], length: 24
 00:00:22.879844 eth2  In  IP 10.0.29.3.46888 > 10.0.29.2.3784: BFDv1, Control, State Up, Flags: [none], length: 24
 00:00:22.952186 eth2  Out IP 10.0.29.2.39903 > 10.0.29.3.3784: BFDv1, Control, State Up, Flags: [none], length: 24
 00:00:22.967490 eth2  In  IP 10.0.29.3.46888 > 10.0.29.2.3784: BFDv1, Control, State Up, Flags: [none], length: 24
 00:00:23.038962 eth2  Out IP 10.0.29.2.39903 > 10.0.29.3.3784: BFDv1, Control, State Up, Flags: [none], length: 24
 00:00:23.048247 eth2  In  IP 10.0.29.3.46888 > 10.0.29.2.3784: BFDv1, Control, State Up, Flags: [none], length: 24
 00:00:23.121661 eth2  Out IP 10.0.29.2.39903 > 10.0.29.3.3784: BFDv1, Control, State Up, Flags: [none], length: 24
 00:00:23.127971 eth2  In  IP 10.0.29.3.46888 > 10.0.29.2.3784: BFDv1, Control, State Up, Flags: [none], length: 24
 00:00:23.202308 eth2  Out IP 10.0.29.2.39903 > 10.0.29.3.3784: BFDv1, Control, State Up, Flags: [none], length: 24
 00:00:23.211587 eth2  In  IP 10.0.29.3.46888 > 10.0.29.2.3784: BFDv1, Control, State Up, Flags: [none], length: 24
 00:00:23.290800 eth2  In  IP 10.0.29.3.46888 > 10.0.29.2.3784: BFDv1, Control, State Up, Flags: [none], length: 24
 00:00:23.290946 eth2  Out IP 10.0.29.2.39903 > 10.0.29.3.3784: BFDv1, Control, State Up, Flags: [none], length: 24
 00:00:23.368791 eth2  In  IP 10.0.29.3.46888 > 10.0.29.2.3784: BFDv1, Control, State Up, Flags: [none], length: 24
 00:00:23.380259 eth2  Out IP 10.0.29.2.39903 > 10.0.29.3.3784: BFDv1, Control, State Up, Flags: [none], length: 24
 00:00:23.446136 eth2  In  IP 10.0.29.3.46888 > 10.0.29.2.3784: BFDv1, Control, State Up, Flags: [none], length: 24
 00:00:23.458608 eth2  Out IP 10.0.29.2.39903 > 10.0.29.3.3784: BFDv1, Control, State Up, Flags: [none], length: 24
 00:00:23.527588 eth2  In  IP 10.0.29.3.46888 > 10.0.29.2.3784: BFDv1, Control, State Up, Flags: [none], length: 24
 00:00:23.545939 eth2  Out IP 10.0.29.2.39903 > 10.0.29.3.3784: BFDv1, Control, State Up, Flags: [none], length: 24
 00:00:23.605024 eth2  In  IP 10.0.29.3.46888 > 10.0.29.2.3784: BFDv1, Control, State Up, Flags: [none], length: 24
 00:00:23.630358 eth2  Out IP 10.0.29.2.39903 > 10.0.29.3.3784: BFDv1, Control, State Up, Flags: [none], length: 24
 00:00:23.686710 eth2  In  IP 10.0.29.3.46888 > 10.0.29.2.3784: BFDv1, Control, State Up, Flags: [none], length: 24
 00:00:23.716037 eth2  Out IP 10.0.29.2.39903 > 10.0.29.3.3784: BFDv1, Control, State Up, Flags: [none], length: 24
 00:00:23.763178 eth2  In  IP 10.0.29.3.46888 > 10.0.29.2.3784: BFDv1, Control, State Up, Flags: [none], length: 24
 00:00:23.805545 eth2  Out IP 10.0.29.2.39903 > 10.0.29.3.3784: BFDv1, Control, State Up, Flags: [none], length: 24
 00:00:23.842488 eth2  In  IP 10.0.29.3.46888 > 10.0.29.2.3784: BFDv1, Control, State Up, Flags: [none], length: 24
 00:00:23.893785 eth2  Out IP 10.0.29.2.39903 > 10.0.29.3.3784: BFDv1, Control, State Up, Flags: [none], length: 24
 00:00:23.913570 eth2  Out IP 10.0.29.2.44601 > 10.0.29.3.179: Flags [S], seq 2796175637, win 64240, options [mss 1460,sackOK,TS val 2352560716 ecr 0,nop,wscale 10], length 0
 00:00:23.913628 eth2  In  IP 10.0.29.3.179 > 10.0.29.2.44601: Flags [S.], seq 2157335211, ack 2796175638, win 65160, options [mss 1460,sackOK,TS val 562860452 ecr 2352560716,nop,wscale 10], length 0
 00:00:23.913650 eth2  Out IP 10.0.29.2.44601 > 10.0.29.3.179: Flags [.], ack 1, win 63, options [nop,nop,TS val 2352560716 ecr 562860452], length 0
 00:00:23.913718 eth2  Out IP 10.0.29.2.44601 > 10.0.29.3.179: Flags [P.], seq 1:65, ack 1, win 63, options [nop,nop,TS val 2352560716 ecr 562860452], length 64: BGP
 00:00:23.913730 eth2  In  IP 10.0.29.3.179 > 10.0.29.2.44601: Flags [.], ack 65, win 64, options [nop,nop,TS val 562860452 ecr 2352560716], length 0
 00:00:23.913895 eth2  In  IP 10.0.29.3.179 > 10.0.29.2.44601: Flags [R.], seq 1, ack 65, win 64, options [nop,nop,TS val 562860453 ecr 2352560716], length 0
 00:00:23.927241 eth2  In  IP 10.0.29.3.46888 > 10.0.29.2.3784: BFDv1, Control, State Up, Flags: [none], length: 24
 00:00:23.980592 eth2  Out IP 10.0.29.2.39903 > 10.0.29.3.3784: BFDv1, Control, State Up, Flags: [none], length: 24
 00:00:24.015932 eth2  In  IP 10.0.29.3.46888 > 10.0.29.2.3784: BFDv1, Control, State Up, Flags: [none], length: 24
 00:00:24.062326 eth2  Out IP 10.0.29.2.39903 > 10.0.29.3.3784: BFDv1, Control, State Up, Flags: [none], length: 24
 00:00:24.096658 eth2  In  IP 10.0.29.3.46888 > 10.0.29.2.3784: BFDv1, Control, State Up, Flags: [none], length: 24
 00:00:24.147011 eth2  Out IP 10.0.29.2.39903 > 10.0.29.3.3784: BFDv1, Control, State Up, Flags: [none], length: 24
 00:00:24.173393 eth2  In  IP 10.0.29.3.46888 > 10.0.29.2.3784: BFDv1, Control, State Up, Flags: [none], length: 24
 00:00:24.236785 eth2  Out IP 10.0.29.2.39903 > 10.0.29.3.3784: BFDv1, Control, State Up, Flags: [none], length: 24
 00:00:24.256110 eth2  In  IP 10.0.29.3.46888 > 10.0.29.2.3784: BFDv1, Control, State Up, Flags: [none], length: 24
 00:00:24.325467 eth2  Out IP 10.0.29.2.39903 > 10.0.29.3.3784: BFDv1, Control, State Up, Flags: [none], length: 24
 00:00:24.333769 eth2  In  IP 10.0.29.3.46888 > 10.0.29.2.3784: BFDv1, Control, State Up, Flags: [none], length: 24
 00:00:24.401063 eth2  Out IP 10.0.29.2.39903 > 10.0.29.3.3784: BFDv1, Control, State Up, Flags: [none], length: 24
 00:00:24.415426 eth2  In  IP 10.0.29.3.46888 > 10.0.29.2.3784: BFDv1, Control, State Up, Flags: [none], length: 24
 00:00:24.482896 eth2  Out IP 10.0.29.2.39903 > 10.0.29.3.3784: BFDv1, Control, State Up, Flags: [none], length: 24
 00:00:24.499097 eth2  In  IP 10.0.29.3.46888 > 10.0.29.2.3784: BFDv1, Control, State Up, Flags: [none], length: 24
 00:00:24.561853 eth2  Out IP 10.0.29.2.39903 > 10.0.29.3.3784: BFDv1, Control, State Up, Flags: [none], length: 24
 00:00:24.577141 eth2  In  IP 10.0.29.3.46888 > 10.0.29.2.3784: BFDv1, Control, State Up, Flags: [none], length: 24
 00:00:24.648469 eth2  Out IP 10.0.29.2.39903 > 10.0.29.3.3784: BFDv1, Control, State Up, Flags: [none], length: 24
 00:00:24.665279 eth2  In  IP 10.0.29.3.46888 > 10.0.29.2.3784: BFDv1, Control, State Up, Flags: [none], length: 24
 00:00:24.733602 eth2  Out IP 10.0.29.2.39903 > 10.0.29.3.3784: BFDv1, Control, State Up, Flags: [none], length: 24
 00:00:24.742909 eth2  In  IP 10.0.29.3.46888 > 10.0.29.2.3784: BFDv1, Control, State Up, Flags: [none], length: 24
 00:00:24.811195 eth2  Out IP 10.0.29.2.39903 > 10.0.29.3.3784: BFDv1, Control, State Up, Flags: [none], length: 24
 00:00:24.820457 eth2  In  IP 10.0.29.3.46888 > 10.0.29.2.3784: BFDv1, Control, State Up, Flags: [none], length: 24
 00:00:24.898955 eth2  Out IP 10.0.29.2.39903 > 10.0.29.3.3784: BFDv1, Control, State Up, Flags: [none], length: 24
 00:00:24.904240 eth2  In  IP 10.0.29.3.46888 > 10.0.29.2.3784: BFDv1, Control, State Up, Flags: [none], length: 24
 00:00:24.988601 eth2  Out IP 10.0.29.2.39903 > 10.0.29.3.3784: BFDv1, Control, State Up, Flags: [none], length: 24
 00:00:24.991900 eth2  In  IP 10.0.29.3.46888 > 10.0.29.2.3784: BFDv1, Control, State Up, Flags: [none], length: 24
 00:00:25.067874 eth2  In  IP 10.0.29.3.46888 > 10.0.29.2.3784: BFDv1, Control, State Up, Flags: [none], length: 24
 00:00:25.071182 eth2  Out IP 10.0.29.2.39903 > 10.0.29.3.3784: BFDv1, Control, State Up, Flags: [none], length: 24
 00:00:25.146446 eth2  Out IP 10.0.29.2.39903 > 10.0.29.3.3784: BFDv1, Control, State Up, Flags: [none], length: 24
 00:00:25.147901 eth2  In  IP 10.0.29.3.46888 > 10.0.29.2.3784: BFDv1, Control, State Up, Flags: [none], length: 24
 00:00:25.223831 eth2  In  IP 10.0.29.3.46888 > 10.0.29.2.3784: BFDv1, Control, State Up, Flags: [none], length: 24
 00:00:25.231126 eth2  Out IP 10.0.29.2.39903 > 10.0.29.3.3784: BFDv1, Control, State Up, Flags: [none], length: 24
 00:00:25.308345 eth2  In  IP 10.0.29.3.46888 > 10.0.29.2.3784: BFDv1, Control, State Up, Flags: [none], length: 24
 00:00:25.320675 eth2  Out IP 10.0.29.2.39903 > 10.0.29.3.3784: BFDv1, Control, State Up, Flags: [none], length: 24
 00:00:25.382907 eth2  In  IP 10.0.29.3.46888 > 10.0.29.2.3784: BFDv1, Control, State Up, Flags: [none], length: 24
 00:00:25.406199 eth2  Out IP 10.0.29.2.39903 > 10.0.29.3.3784: BFDv1, Control, State Up, Flags: [none], length: 24
 00:00:25.465239 eth2  In  IP 10.0.29.3.46888 > 10.0.29.2.3784: BFDv1, Control, State Up, Flags: [none], length: 24
 00:00:25.484622 eth2  Out IP 10.0.29.2.39903 > 10.0.29.3.3784: BFDv1, Control, State Up, Flags: [none], length: 24
 00:00:25.547922 eth2  In  IP 10.0.29.3.46888 > 10.0.29.2.3784: BFDv1, Control, State Up, Flags: [none], length: 24
 00:00:25.564221 eth2  Out IP 10.0.29.2.39903 > 10.0.29.3.3784: BFDv1, Control, State Up, Flags: [none], length: 24
 00:00:25.631545 eth2  In  IP 10.0.29.3.46888 > 10.0.29.2.3784: BFDv1, Control, State Up, Flags: [none], length: 24
 00:00:25.648847 eth2  Out IP 10.0.29.2.39903 > 10.0.29.3.3784: BFDv1, Control, State Up, Flags: [none], length: 24
 00:00:25.706361 eth2  In  IP 10.0.29.3.46888 > 10.0.29.2.3784: BFDv1, Control, State Up, Flags: [none], length: 24
 00:00:25.725662 eth2  Out IP 10.0.29.2.39903 > 10.0.29.3.3784: BFDv1, Control, State Up, Flags: [none], length: 24
 00:00:25.787997 eth2  In  IP 10.0.29.3.46888 > 10.0.29.2.3784: BFDv1, Control, State Up, Flags: [none], length: 24
 00:00:25.808215 eth2  Out IP 10.0.29.2.39903 > 10.0.29.3.3784: BFDv1, Control, State Up, Flags: [none], length: 24
 00:00:25.872968 eth2  In  IP 10.0.29.3.46888 > 10.0.29.2.3784: BFDv1, Control, State Up, Flags: [none], length: 24
 00:00:25.889347 eth2  Out IP 10.0.29.2.39903 > 10.0.29.3.3784: BFDv1, Control, State Up, Flags: [none], length: 24
 00:00:25.957670 eth2  In  IP 10.0.29.3.46888 > 10.0.29.2.3784: BFDv1, Control, State Up, Flags: [none], length: 24
 00:00:25.975907 eth2  Out IP 10.0.29.2.39903 > 10.0.29.3.3784: BFDv1, Control, State Up, Flags: [none], length: 24
 00:00:26.038365 eth2  In  IP 10.0.29.3.46888 > 10.0.29.2.3784: BFDv1, Control, State Up, Flags: [none], length: 24
 00:00:26.054645 eth2  Out IP 10.0.29.2.39903 > 10.0.29.3.3784: BFDv1, Control, State Up, Flags: [none], length: 24
 00:00:26.125345 eth2  In  IP 10.0.29.3.46888 > 10.0.29.2.3784: BFDv1, Control, State Up, Flags: [none], length: 24
 00:00:26.134658 eth2  Out IP 10.0.29.2.39903 > 10.0.29.3.3784: BFDv1, Control, State Up, Flags: [none], length: 24
 00:00:26.206364 eth2  In  IP 10.0.29.3.46888 > 10.0.29.2.3784: BFDv1, Control, State Up, Flags: [none], length: 24
 00:00:26.218705 eth2  Out IP 10.0.29.2.39903 > 10.0.29.3.3784: BFDv1, Control, State Up, Flags: [none], length: 24
 00:00:26.293943 eth2  Out IP 10.0.29.2.39903 > 10.0.29.3.3784: BFDv1, Control, State Up, Flags: [none], length: 24
 00:00:26.295167 eth2  In  IP 10.0.29.3.46888 > 10.0.29.2.3784: BFDv1, Control, State Up, Flags: [none], length: 24
 00:00:26.379519 eth2  Out IP 10.0.29.2.39903 > 10.0.29.3.3784: BFDv1, Control, State Up, Flags: [none], length: 24
 00:00:26.379686 eth2  In  IP 10.0.29.3.46888 > 10.0.29.2.3784: BFDv1, Control, State Up, Flags: [none], length: 24
 00:00:26.467490 eth2  In  IP 10.0.29.3.46888 > 10.0.29.2.3784: BFDv1, Control, State Up, Flags: [none], length: 24
 00:00:26.469752 eth2  Out IP 10.0.29.2.39903 > 10.0.29.3.3784: BFDv1, Control, State Up, Flags: [none], length: 24
 00:00:26.544894 eth2  In  IP 10.0.29.3.46888 > 10.0.29.2.3784: BFDv1, Control, State Up, Flags: [none], length: 24
 00:00:26.553192 eth2  Out IP 10.0.29.2.39903 > 10.0.29.3.3784: BFDv1, Control, State Up, Flags: [none], length: 24
 00:00:26.631332 eth2  In  IP 10.0.29.3.46888 > 10.0.29.2.3784: BFDv1, Control, State Up, Flags: [none], length: 24
 00:00:26.631420 eth2  Out IP 10.0.29.2.39903 > 10.0.29.3.3784: BFDv1, Control, State Up, Flags: [none], length: 24
 00:00:26.710792 eth2  In  IP 10.0.29.3.46888 > 10.0.29.2.3784: BFDv1, Control, State Up, Flags: [none], length: 24
 00:00:26.715072 eth2  Out IP 10.0.29.2.39903 > 10.0.29.3.3784: BFDv1, Control, State Up, Flags: [none], length: 24
 00:00:26.795320 eth2  In  IP 10.0.29.3.46888 > 10.0.29.2.3784: BFDv1, Control, State Up, Flags: [none], length: 24
 00:00:26.797578 eth2  Out IP 10.0.29.2.39903 > 10.0.29.3.3784: BFDv1, Control, State Up, Flags: [none], length: 24
 00:00:26.873801 eth2  Out IP 10.0.29.2.39903 > 10.0.29.3.3784: BFDv1, Control, State Up, Flags: [none], length: 24
 00:00:26.881092 eth2  In  IP 10.0.29.3.46888 > 10.0.29.2.3784: BFDv1, Control, State Up, Flags: [none], length: 24
 00:00:26.957436 eth2  Out IP 10.0.29.2.39903 > 10.0.29.3.3784: BFDv1, Control, State Up, Flags: [none], length: 24
 00:00:26.969602 eth2  In  IP 10.0.29.3.46888 > 10.0.29.2.3784: BFDv1, Control, State Up, Flags: [none], length: 24
 00:00:27.048001 eth2  Out IP 10.0.29.2.39903 > 10.0.29.3.3784: BFDv1, Control, State Up, Flags: [none], length: 24
 00:00:27.059262 eth2  In  IP 10.0.29.3.46888 > 10.0.29.2.3784: BFDv1, Control, State Up, Flags: [none], length: 24
 00:00:27.126963 eth2  Out IP 10.0.29.2.39903 > 10.0.29.3.3784: BFDv1, Control, State Up, Flags: [none], length: 24
 00:00:27.147017 eth2  In  IP 10.0.29.3.46888 > 10.0.29.2.3784: BFDv1, Control, State Up, Flags: [none], length: 24
 00:00:27.208263 eth2  Out IP 10.0.29.2.39903 > 10.0.29.3.3784: BFDv1, Control, State Up, Flags: [none], length: 24
 00:00:27.225451 eth2  In  IP 10.0.29.3.46888 > 10.0.29.2.3784: BFDv1, Control, State Up, Flags: [none], length: 24
 00:00:27.292664 eth2  Out IP 10.0.29.2.39903 > 10.0.29.3.3784: BFDv1, Control, State Up, Flags: [none], length: 24
 00:00:27.310007 eth2  In  IP 10.0.29.3.46888 > 10.0.29.2.3784: BFDv1, Control, State Up, Flags: [none], length: 24
 00:00:27.374251 eth2  Out IP 10.0.29.2.39903 > 10.0.29.3.3784: BFDv1, Control, State Up, Flags: [none], length: 24
 00:00:27.388466 eth2  In  IP 10.0.29.3.46888 > 10.0.29.2.3784: BFDv1, Control, State Up, Flags: [none], length: 24
 00:00:27.452740 eth2  Out IP 10.0.29.2.39903 > 10.0.29.3.3784: BFDv1, Control, State Up, Flags: [none], length: 24
 00:00:27.468040 eth2  In  IP 10.0.29.3.46888 > 10.0.29.2.3784: BFDv1, Control, State Up, Flags: [none], length: 24
 00:00:27.536302 eth2  Out IP 10.0.29.2.39903 > 10.0.29.3.3784: BFDv1, Control, State Up, Flags: [none], length: 24
 00:00:27.553521 eth2  In  IP 10.0.29.3.46888 > 10.0.29.2.3784: BFDv1, Control, State Up, Flags: [none], length: 24
 00:00:27.624756 eth2  Out IP 10.0.29.2.39903 > 10.0.29.3.3784: BFDv1, Control, State Up, Flags: [none], length: 24
 00:00:27.634990 eth2  In  IP 10.0.29.3.46888 > 10.0.29.2.3784: BFDv1, Control, State Up, Flags: [none], length: 24
 00:00:27.703254 eth2  Out IP 10.0.29.2.39903 > 10.0.29.3.3784: BFDv1, Control, State Up, Flags: [none], length: 24
 00:00:27.717601 eth2  In  IP 10.0.29.3.46888 > 10.0.29.2.3784: BFDv1, Control, State Up, Flags: [none], length: 24
 00:00:27.759591 eth2  Out IP 10.0.29.2.56589 > 10.0.29.3.179: Flags [S], seq 936285839, win 64240, options [mss 1460,sackOK,TS val 2352564562 ecr 0,nop,wscale 10], length 0
 00:00:27.759658 eth2  In  IP 10.0.29.3.179 > 10.0.29.2.56589: Flags [S.], seq 3956937607, ack 936285840, win 65160, options [mss 1460,sackOK,TS val 562864298 ecr 2352564562,nop,wscale 10], length 0
 00:00:27.759688 eth2  Out IP 10.0.29.2.56589 > 10.0.29.3.179: Flags [.], ack 1, win 63, options [nop,nop,TS val 2352564562 ecr 562864298], length 0
 00:00:27.759833 eth2  In  IP 10.0.29.3.179 > 10.0.29.2.56589: Flags [F.], seq 1, ack 1, win 64, options [nop,nop,TS val 562864298 ecr 2352564562], length 0
 00:00:27.759864 eth2  Out IP 10.0.29.2.56589 > 10.0.29.3.179: Flags [P.], seq 1:65, ack 1, win 63, options [nop,nop,TS val 2352564563 ecr 562864298], length 64: BGP
 00:00:27.759926 eth2  In  IP 10.0.29.3.179 > 10.0.29.2.56589: Flags [R], seq 3956937608, win 0, length 0
 00:00:27.783218 eth2  Out IP 10.0.29.2.39903 > 10.0.29.3.3784: BFDv1, Control, State Up, Flags: [none], length: 24
 00:00:27.807444 eth2  In  IP 10.0.29.3.46888 > 10.0.29.2.3784: BFDv1, Control, State Up, Flags: [none], length: 24
 00:00:27.858675 eth2  Out IP 10.0.29.2.39903 > 10.0.29.3.3784: BFDv1, Control, State Up, Flags: [none], length: 24
 00:00:27.893997 eth2  In  IP 10.0.29.3.46888 > 10.0.29.2.3784: BFDv1, Control, State Up, Flags: [none], length: 24
 00:00:27.943283 eth2  Out IP 10.0.29.2.39903 > 10.0.29.3.3784: BFDv1, Control, State Up, Flags: [none], length: 24
 00:00:27.980540 eth2  In  IP 10.0.29.3.46888 > 10.0.29.2.3784: BFDv1, Control, State Up, Flags: [none], length: 24
 00:00:28.026856 eth2  Out IP 10.0.29.2.39903 > 10.0.29.3.3784: BFDv1, Control, State Up, Flags: [none], length: 24
 00:00:28.067152 eth2  In  IP 10.0.29.3.46888 > 10.0.29.2.3784: BFDv1, Control, State Up, Flags: [none], length: 24
 00:00:28.110430 eth2  Out IP 10.0.29.2.39903 > 10.0.29.3.3784: BFDv1, Control, State Up, Flags: [none], length: 24
 00:00:28.142653 eth2  In  IP 10.0.29.3.46888 > 10.0.29.2.3784: BFDv1, Control, State Up, Flags: [none], length: 24
 00:00:28.185929 eth2  Out IP 10.0.29.2.39903 > 10.0.29.3.3784: BFDv1, Control, State Up, Flags: [none], length: 24
 00:00:28.232197 eth2  In  IP 10.0.29.3.46888 > 10.0.29.2.3784: BFDv1, Control, State Up, Flags: [none], length: 24
 00:00:28.265530 eth2  Out IP 10.0.29.2.39903 > 10.0.29.3.3784: BFDv1, Control, State Up, Flags: [none], length: 24
 00:00:28.316914 eth2  In  IP 10.0.29.3.46888 > 10.0.29.2.3784: BFDv1, Control, State Up, Flags: [none], length: 24
 00:00:28.352155 eth2  Out IP 10.0.29.2.39903 > 10.0.29.3.3784: BFDv1, Control, State Up, Flags: [none], length: 24
 00:00:28.400518 eth2  In  IP 10.0.29.3.46888 > 10.0.29.2.3784: BFDv1, Control, State Up, Flags: [none], length: 24
 00:00:28.432755 eth2  Out IP 10.0.29.2.39903 > 10.0.29.3.3784: BFDv1, Control, State Up, Flags: [none], length: 24
 00:00:28.476139 eth2  In  IP 10.0.29.3.46888 > 10.0.29.2.3784: BFDv1, Control, State Up, Flags: [none], length: 24
 00:00:28.521408 eth2  Out IP 10.0.29.2.39903 > 10.0.29.3.3784: BFDv1, Control, State Up, Flags: [none], length: 24
 00:00:28.564831 eth2  In  IP 10.0.29.3.46888 > 10.0.29.2.3784: BFDv1, Control, State Up, Flags: [none], length: 24
 00:00:28.608077 eth2  Out IP 10.0.29.2.39903 > 10.0.29.3.3784: BFDv1, Control, State Up, Flags: [none], length: 24
 00:00:28.651457 eth2  In  IP 10.0.29.3.46888 > 10.0.29.2.3784: BFDv1, Control, State Up, Flags: [none], length: 24
 00:00:28.684743 eth2  Out IP 10.0.29.2.39903 > 10.0.29.3.3784: BFDv1, Control, State Up, Flags: [none], length: 24
 00:00:28.731118 eth2  In  IP 10.0.29.3.46888 > 10.0.29.2.3784: BFDv1, Control, State Up, Flags: [none], length: 24
 00:00:28.771342 eth2  Out IP 10.0.29.2.39903 > 10.0.29.3.3784: BFDv1, Control, State Up, Flags: [none], length: 24
 00:00:28.820620 eth2  In  IP 10.0.29.3.46888 > 10.0.29.2.3784: BFDv1, Control, State Up, Flags: [none], length: 24
 00:00:28.852056 eth2  Out IP 10.0.29.2.39903 > 10.0.29.3.3784: BFDv1, Control, State Up, Flags: [none], length: 24
 00:00:28.900252 eth2  In  IP 10.0.29.3.46888 > 10.0.29.2.3784: BFDv1, Control, State Up, Flags: [none], length: 24
 00:00:28.931633 eth2  Out IP 10.0.29.2.39903 > 10.0.29.3.3784: BFDv1, Control, State Up, Flags: [none], length: 24
 00:00:28.986070 eth2  In  IP 10.0.29.3.46888 > 10.0.29.2.3784: BFDv1, Control, State Up, Flags: [none], length: 24
 00:00:29.012374 eth2  Out IP 10.0.29.2.39903 > 10.0.29.3.3784: BFDv1, Control, State Up, Flags: [none], length: 24
 00:00:29.071796 eth2  In  IP 10.0.29.3.46888 > 10.0.29.2.3784: BFDv1, Control, State Up, Flags: [none], length: 24
 00:00:29.100177 eth2  Out IP 10.0.29.2.39903 > 10.0.29.3.3784: BFDv1, Control, State Up, Flags: [none], length: 24
 00:00:29.154680 eth2  In  IP 10.0.29.3.46888 > 10.0.29.2.3784: BFDv1, Control, State Up, Flags: [none], length: 24
 00:00:29.179961 eth2  Out IP 10.0.29.2.39903 > 10.0.29.3.3784: BFDv1, Control, State Up, Flags: [none], length: 24
 00:00:29.234389 eth2  In  IP 10.0.29.3.46888 > 10.0.29.2.3784: BFDv1, Control, State Up, Flags: [none], length: 24
 00:00:29.255697 eth2  Out IP 10.0.29.2.39903 > 10.0.29.3.3784: BFDv1, Control, State Up, Flags: [none], length: 24
 00:00:29.317122 eth2  In  IP 10.0.29.3.46888 > 10.0.29.2.3784: BFDv1, Control, State Up, Flags: [none], length: 24
 00:00:29.343414 eth2  Out IP 10.0.29.2.39903 > 10.0.29.3.3784: BFDv1, Control, State Up, Flags: [none], length: 24
 00:00:29.403672 eth2  In  IP 10.0.29.3.46888 > 10.0.29.2.3784: BFDv1, Control, State Up, Flags: [none], length: 24
 00:00:29.426925 eth2  Out IP 10.0.29.2.39903 > 10.0.29.3.3784: BFDv1, Control, State Up, Flags: [none], length: 24
 00:00:29.486132 eth2  In  IP 10.0.29.3.46888 > 10.0.29.2.3784: BFDv1, Control, State Up, Flags: [none], length: 24
 00:00:29.508310 eth2  Out IP 10.0.29.2.39903 > 10.0.29.3.3784: BFDv1, Control, State Up, Flags: [none], length: 24
 00:00:29.567538 eth2  In  IP 10.0.29.3.46888 > 10.0.29.2.3784: BFDv1, Control, State Up, Flags: [none], length: 24
 00:00:29.590768 eth2  Out IP 10.0.29.2.39903 > 10.0.29.3.3784: BFDv1, Control, State Up, Flags: [none], length: 24
 00:00:29.651309 eth2  In  IP 10.0.29.3.46888 > 10.0.29.2.3784: BFDv1, Control, State Up, Flags: [none], length: 24
 00:00:29.679595 eth2  Out IP 10.0.29.2.39903 > 10.0.29.3.3784: BFDv1, Control, State Up, Flags: [none], length: 24
 00:00:29.734869 eth2  In  IP 10.0.29.3.46888 > 10.0.29.2.3784: BFDv1, Control, State Up, Flags: [none], length: 24
 00:00:29.765124 eth2  Out IP 10.0.29.2.39903 > 10.0.29.3.3784: BFDv1, Control, State Up, Flags: [none], length: 24
 00:00:29.821326 eth2  In  IP 10.0.29.3.46888 > 10.0.29.2.3784: BFDv1, Control, State Up, Flags: [none], length: 24
 00:00:29.840610 eth2  Out IP 10.0.29.2.39903 > 10.0.29.3.3784: BFDv1, Control, State Up, Flags: [none], length: 24
 00:00:29.899993 eth2  In  IP 10.0.29.3.46888 > 10.0.29.2.3784: BFDv1, Control, State Up, Flags: [none], length: 24
 00:00:29.927214 eth2  Out IP 10.0.29.2.39903 > 10.0.29.3.3784: BFDv1, Control, State Up, Flags: [none], length: 24
 00:00:29.984393 eth2  In  IP 10.0.29.3.46888 > 10.0.29.2.3784: BFDv1, Control, State Up, Flags: [none], length: 24
 00:00:30.016618 eth2  Out IP 10.0.29.2.39903 > 10.0.29.3.3784: BFDv1, Control, State Up, Flags: [none], length: 24
 00:00:30.068950 eth2  In  IP 10.0.29.3.46888 > 10.0.29.2.3784: BFDv1, Control, State Up, Flags: [none], length: 24
 00:00:30.096213 eth2  Out IP 10.0.29.2.39903 > 10.0.29.3.3784: BFDv1, Control, State Up, Flags: [none], length: 24
 00:00:30.150416 eth2  In  IP 10.0.29.3.46888 > 10.0.29.2.3784: BFDv1, Control, State Up, Flags: [none], length: 24
 00:00:30.179662 eth2  Out IP 10.0.29.2.39903 > 10.0.29.3.3784: BFDv1, Control, State Up, Flags: [none], length: 24
 00:00:30.239916 eth2  In  IP 10.0.29.3.46888 > 10.0.29.2.3784: BFDv1, Control, State Up, Flags: [none], length: 24
 00:00:30.268181 eth2  Out IP 10.0.29.2.39903 > 10.0.29.3.3784: BFDv1, Control, State Up, Flags: [none], length: 24
 00:00:30.327440 eth2  In  IP 10.0.29.3.46888 > 10.0.29.2.3784: BFDv1, Control, State Up, Flags: [none], length: 24
 00:00:30.354683 eth2  Out IP 10.0.29.2.39903 > 10.0.29.3.3784: BFDv1, Control, State Up, Flags: [none], length: 24
578 packets captured
578 packets received by filter
0 packets dropped by kernel

