tcpdump: data link type LINUX_SLL2
tcpdump: verbose output suppressed, use -v[v]... for full protocol decode
listening on any, link-type LINUX_SLL2 (Linux cooked v2), snapshot length 262144 bytes
 00:00:00.000000 eth3  Out IP 10.0.34.2.60078 > 10.0.34.3.3784: BFDv1, Control, State Up, Flags: [none], length: 24
 00:00:00.005209 eth3  In  IP 10.0.34.3.44980 > 10.0.34.2.3784: BFDv1, Control, State Up, Flags: [none], length: 24
 00:00:00.007930 eth2  In  IP 10.0.23.2.41179 > 10.0.23.3.3784: BFDv1, Control, State Up, Flags: [none], length: 24
 00:00:00.009145 eth2  Out IP 10.0.23.3.59324 > 10.0.23.2.3784: BFDv1, Control, State Up, Flags: [none], length: 24
 00:00:00.016310 eth0  Out IP 10.0.35.2.59307 > 10.0.35.3.3784: BFDv1, Control, State Up, Flags: [none], length: 24
 00:00:00.037761 eth0  In  IP 10.0.35.3.48498 > 10.0.35.2.3784: BFDv1, Control, State Up, Flags: [none], length: 24
 00:00:00.060943 eth1  Out IP 10.0.13.3.42552 > 10.0.13.2.3784: BFDv1, Control, State Up, Flags: [none], length: 24
 00:00:00.068150 eth1  In  IP 10.0.13.2.32837 > 10.0.13.3.3784: BFDv1, Control, State Up, Flags: [none], length: 24
 00:00:00.082817 eth3  In  IP 10.0.34.3.44980 > 10.0.34.2.3784: BFDv1, Control, State Up, Flags: [none], length: 24
 00:00:00.085010 eth3  Out IP 10.0.34.2.60078 > 10.0.34.3.3784: BFDv1, Control, State Up, Flags: [none], length: 24
 00:00:00.091168 eth2  Out IP 10.0.23.3.59324 > 10.0.23.2.3784: BFDv1, Control, State Up, Flags: [none], length: 24
 00:00:00.094321 eth0  Out IP 10.0.35.2.59307 > 10.0.35.3.3784: BFDv1, Control, State Up, Flags: [none], length: 24
 00:00:00.096329 eth2  In  IP 10.0.23.2.41179 > 10.0.23.3.3784: BFDv1, Control, State Up, Flags: [none], length: 24
 00:00:00.114212 eth0  In  IP 10.0.35.3.48498 > 10.0.35.2.3784: BFDv1, Control, State Up, Flags: [none], length: 24
 00:00:00.149506 eth1  Out IP 10.0.13.3.42552 > 10.0.13.2.3784: BFDv1, Control, State Up, Flags: [none], length: 24
 00:00:00.150731 eth1  In  IP 10.0.13.2.32837 > 10.0.13.3.3784: BFDv1, Control, State Up, Flags: [none], length: 24
 00:00:00.165068 eth3  In  IP 10.0.34.3.44980 > 10.0.34.2.3784: BFDv1, Control, State Up, Flags: [none], length: 24
 00:00:00.169305 eth2  Out IP 10.0.23.3.59324 > 10.0.23.2.3784: BFDv1, Control, State Up, Flags: [none], length: 24
 00:00:00.175436 eth3  Out IP 10.0.34.2.60078 > 10.0.34.3.3784: BFDv1, Control, State Up, Flags: [none], length: 24
 00:00:00.180582 eth0  Out IP 10.0.35.2.59307 > 10.0.35.3.3784: BFDv1, Control, State Up, Flags: [none], length: 24
 00:00:00.182584 eth2  In  IP 10.0.23.2.41179 > 10.0.23.3.3784: BFDv1, Control, State Up, Flags: [none], length: 24
 00:00:00.203623 eth0  In  IP 10.0.35.3.48498 > 10.0.35.2.3784: BFDv1, Control, State Up, Flags: [none], length: 24
 00:00:00.232861 eth1  In  IP 10.0.13.2.32837 > 10.0.13.3.3784: BFDv1, Control, State Up, Flags: [none], length: 24
 00:00:00.238984 eth1  Out IP 10.0.13.3.42552 > 10.0.13.2.3784: BFDv1, Control, State Up, Flags: [none], length: 24
 00:00:00.245109 eth2  Out IP 10.0.23.3.59324 > 10.0.23.2.3784: BFDv1, Control, State Up, Flags: [none], length: 24
 00:00:00.252273 eth3  In  IP 10.0.34.3.44980 > 10.0.34.2.3784: BFDv1, Control, State Up, Flags: [none], length: 24
 00:00:00.253445 eth3  Out IP 10.0.34.2.60078 > 10.0.34.3.3784: BFDv1, Control, State Up, Flags: [none], length: 24
 00:00:00.262594 eth0  Out IP 10.0.35.2.59307 > 10.0.35.3.3784: BFDv1, Control, State Up, Flags: [none], length: 24
 00:00:00.271495 eth2  In  IP 10.0.23.2.41179 > 10.0.23.3.3784: BFDv1, Control, State Up, Flags: [none], length: 24
 00:00:00.290086 eth0  In  IP 10.0.35.3.48498 > 10.0.35.2.3784: BFDv1, Control, State Up, Flags: [none], length: 24
 00:00:00.314310 eth1  Out IP 10.0.13.3.42552 > 10.0.13.2.3784: BFDv1, Control, State Up, Flags: [none], length: 24
 00:00:00.315473 eth1  In  IP 10.0.13.2.32837 > 10.0.13.3.3784: BFDv1, Control, State Up, Flags: [none], length: 24
 00:00:00.321685 eth2  Out IP 10.0.23.3.59324 > 10.0.23.2.3784: BFDv1, Control, State Up, Flags: [none], length: 24
 00:00:00.331055 eth3  In  IP 10.0.34.3.44980 > 10.0.34.2.3784: BFDv1, Control, State Up, Flags: [none], length: 24
 00:00:00.338283 eth3  Out IP 10.0.34.2.60078 > 10.0.34.3.3784: BFDv1, Control, State Up, Flags: [none], length: 24
 00:00:00.347041 eth2  In  IP 10.0.23.2.41179 > 10.0.23.3.3784: BFDv1, Control, State Up, Flags: [none], length: 24
 00:00:00.352363 eth0  Out IP 10.0.35.2.59307 > 10.0.35.3.3784: BFDv1, Control, State Up, Flags: [none], length: 24
 00:00:00.373568 eth0  In  IP 10.0.35.3.48498 > 10.0.35.2.3784: BFDv1, Control, State Up, Flags: [none], length: 24
 00:00:00.390971 eth1  In  IP 10.0.13.2.32837 > 10.0.13.3.3784: BFDv1, Control, State Up, Flags: [none], length: 24
 00:00:00.395234 eth1  Out IP 10.0.13.3.42552 > 10.0.13.2.3784: BFDv1, Control, State Up, Flags: [none], length: 24
 00:00:00.400416 eth2  Out IP 10.0.23.3.59324 > 10.0.23.2.3784: BFDv1, Control, State Up, Flags: [none], length: 24
 00:00:00.413739 eth3  In  IP 10.0.34.3.44980 > 10.0.34.2.3784: BFDv1, Control, State Up, Flags: [none], length: 24
 00:00:00.414972 eth3  Out IP 10.0.34.2.60078 > 10.0.34.3.3784: BFDv1, Control, State Up, Flags: [none], length: 24
 00:00:00.426325 eth2  In  IP 10.0.23.2.41179 > 10.0.23.3.3784: BFDv1, Control, State Up, Flags: [none], length: 24
 00:00:00.428526 eth0  Out IP 10.0.35.2.59307 > 10.0.35.3.3784: BFDv1, Control, State Up, Flags: [none], length: 24
 00:00:00.452092 eth0  In  IP 10.0.35.3.48498 > 10.0.35.2.3784: BFDv1, Control, State Up, Flags: [none], length: 24
 00:00:00.475318 eth1  Out IP 10.0.13.3.42552 > 10.0.13.2.3784: BFDv1, Control, State Up, Flags: [none], length: 24
 00:00:00.479495 eth1  In  IP 10.0.13.2.32837 > 10.0.13.3.3784: BFDv1, Control, State Up, Flags: [none], length: 24
 00:00:00.481687 eth2  Out IP 10.0.23.3.59324 > 10.0.23.2.3784: BFDv1, Control, State Up, Flags: [none], length: 24
 00:00:00.491860 eth3  Out IP 10.0.34.2.60078 > 10.0.34.3.3784: BFDv1, Control, State Up, Flags: [none], length: 24
 00:00:00.491886 eth3  In  IP 10.0.34.3.44980 > 10.0.34.2.3784: BFDv1, Control, State Up, Flags: [none], length: 24
 00:00:00.505007 eth2  In  IP 10.0.23.2.41179 > 10.0.23.3.3784: BFDv1, Control, State Up, Flags: [none], length: 24
 00:00:00.514261 eth0  Out IP 10.0.35.2.59307 > 10.0.35.3.3784: BFDv1, Control, State Up, Flags: [none], length: 24
 00:00:00.531424 eth0  In  IP 10.0.35.3.48498 > 10.0.35.2.3784: BFDv1, Control, State Up, Flags: [none], length: 24
 00:00:00.552630 eth1  Out IP 10.0.13.3.42552 > 10.0.13.2.3784: BFDv1, Control, State Up, Flags: [none], length: 24
 00:00:00.559792 eth2  Out IP 10.0.23.3.59324 > 10.0.23.2.3784: BFDv1, Control, State Up, Flags: [none], length: 24
 00:00:00.567134 eth3  In  IP 10.0.34.3.44980 > 10.0.34.2.3784: BFDv1, Control, State Up, Flags: [none], length: 24
 00:00:00.567810 eth1  In  IP 10.0.13.2.32837 > 10.0.13.3.3784: BFDv1, Control, State Up, Flags: [none], length: 24
 00:00:00.579977 eth3  Out IP 10.0.34.2.60078 > 10.0.34.3.3784: BFDv1, Control, State Up, Flags: [none], length: 24
 00:00:00.590184 eth2  In  IP 10.0.23.2.41179 > 10.0.23.3.3784: BFDv1, Control, State Up, Flags: [none], length: 24
 00:00:00.600421 eth0  Out IP 10.0.35.2.59307 > 10.0.35.3.3784: BFDv1, Control, State Up, Flags: [none], length: 24
 00:00:00.608625 eth0  In  IP 10.0.35.3.48498 > 10.0.35.2.3784: BFDv1, Control, State Up, Flags: [none], length: 24
 00:00:00.629937 eth1  Out IP 10.0.13.3.42552 > 10.0.13.2.3784: BFDv1, Control, State Up, Flags: [none], length: 24
 00:00:00.646108 eth2  Out IP 10.0.23.3.59324 > 10.0.23.2.3784: BFDv1, Control, State Up, Flags: [none], length: 24
 00:00:00.652370 eth3  In  IP 10.0.34.3.44980 > 10.0.34.2.3784: BFDv1, Control, State Up, Flags: [none], length: 24
 00:00:00.656547 eth3  Out IP 10.0.34.2.60078 > 10.0.34.3.3784: BFDv1, Control, State Up, Flags: [none], length: 24
 00:00:00.657367 eth1  In  IP 10.0.13.2.32837 > 10.0.13.3.3784: BFDv1, Control, State Up, Flags: [none], length: 24
 00:00:00.670584 eth2  In  IP 10.0.23.2.41179 > 10.0.23.3.3784: BFDv1, Control, State Up, Flags: [none], length: 24
 00:00:00.686785 eth0  Out IP 10.0.35.2.59307 > 10.0.35.3.3784: BFDv1, Control, State Up, Flags: [none], length: 24
 00:00:00.687923 eth0  In  IP 10.0.35.3.48498 > 10.0.35.2.3784: BFDv1, Control, State Up, Flags: [none], length: 24
 00:00:00.711125 eth1  Out IP 10.0.13.3.42552 > 10.0.13.2.3784: BFDv1, Control, State Up, Flags: [none], length: 24
 00:00:00.729563 eth3  In  IP 10.0.34.3.44980 > 10.0.34.2.3784: BFDv1, Control, State Up, Flags: [none], length: 24
 00:00:00.730774 eth2  Out IP 10.0.23.3.59324 > 10.0.23.2.3784: BFDv1, Control, State Up, Flags: [none], length: 24
 00:00:00.745970 eth3  Out IP 10.0.34.2.60078 > 10.0.34.3.3784: BFDv1, Control, State Up, Flags: [none], length: 24
 00:00:00.746250 eth1  In  IP 10.0.13.2.32837 > 10.0.13.3.3784: BFDv1, Control, State Up, Flags: [none], length: 24
 00:00:00.746251 eth2  In  IP 10.0.23.2.41179 > 10.0.23.3.3784: BFDv1, Control, State Up, Flags: [none], length: 24
 00:00:00.767155 eth0  In  IP 10.0.35.3.48498 > 10.0.35.2.3784: BFDv1, Control, State Up, Flags: [none], length: 24
 00:00:00.767221 eth0  Out IP 10.0.35.2.59307 > 10.0.35.3.3784: BFDv1, Control, State Up, Flags: [none], length: 24
 00:00:00.795357 eth1  Out IP 10.0.13.3.42552 > 10.0.13.2.3784: BFDv1, Control, State Up, Flags: [none], length: 24
 00:00:00.806892 eth3  In  IP 10.0.34.3.44980 > 10.0.34.2.3784: BFDv1, Control, State Up, Flags: [none], length: 24
 00:00:00.808088 eth2  Out IP 10.0.23.3.59324 > 10.0.23.2.3784: BFDv1, Control, State Up, Flags: [none], length: 24
 00:00:00.822265 eth3  Out IP 10.0.34.2.60078 > 10.0.34.3.3784: BFDv1, Control, State Up, Flags: [none], length: 24
 00:00:00.832061 eth2  In  IP 10.0.23.2.41179 > 10.0.23.3.3784: BFDv1, Control, State Up, Flags: [none], length: 24
 00:00:00.836082 eth1  In  IP 10.0.13.2.32837 > 10.0.13.3.3784: BFDv1, Control, State Up, Flags: [none], length: 24
 00:00:00.850283 eth0  Out IP 10.0.35.2.59307 > 10.0.35.3.3784: BFDv1, Control, State Up, Flags: [none], length: 24
 00:00:00.854711 eth0  In  IP 10.0.35.3.48498 > 10.0.35.2.3784: BFDv1, Control, State Up, Flags: [none], length: 24
 00:00:00.872934 eth1  Out IP 10.0.13.3.42552 > 10.0.13.2.3784: BFDv1, Control, State Up, Flags: [none], length: 24
 00:00:00.886273 eth3  In  IP 10.0.34.3.44980 > 10.0.34.2.3784: BFDv1, Control, State Up, Flags: [none], length: 24
 00:00:00.887501 eth2  Out IP 10.0.23.3.59324 > 10.0.23.2.3784: BFDv1, Control, State Up, Flags: [none], length: 24
 00:00:00.912370 eth1  In  IP 10.0.13.2.32837 > 10.0.13.3.3784: BFDv1, Control, State Up, Flags: [none], length: 24
 00:00:00.912470 eth3  Out IP 10.0.34.2.60078 > 10.0.34.3.3784: BFDv1, Control, State Up, Flags: [none], length: 24
 00:00:00.916637 eth2  In  IP 10.0.23.2.41179 > 10.0.23.3.3784: BFDv1, Control, State Up, Flags: [none], length: 24
 00:00:00.928001 eth0  Out IP 10.0.35.2.59307 > 10.0.35.3.3784: BFDv1, Control, State Up, Flags: [none], length: 24
 00:00:00.943189 eth0  In  IP 10.0.35.3.48498 > 10.0.35.2.3784: BFDv1, Control, State Up, Flags: [none], length: 24
 00:00:00.953415 eth1  Out IP 10.0.13.3.42552 > 10.0.13.2.3784: BFDv1, Control, State Up, Flags: [none], length: 24
 00:00:00.972553 eth2  Out IP 10.0.23.3.59324 > 10.0.23.2.3784: BFDv1, Control, State Up, Flags: [none], length: 24
 00:00:00.973742 eth3  In  IP 10.0.34.3.44980 > 10.0.34.2.3784: BFDv1, Control, State Up, Flags: [none], length: 24
 00:00:00.989940 eth3  Out IP 10.0.34.2.60078 > 10.0.34.3.3784: BFDv1, Control, State Up, Flags: [none], length: 24
 00:00:00.997862 eth1  In  IP 10.0.13.2.32837 > 10.0.13.3.3784: BFDv1, Control, State Up, Flags: [none], length: 24
 00:00:01.001411 eth2  In  IP 10.0.23.2.41179 > 10.0.23.3.3784: BFDv1, Control, State Up, Flags: [none], length: 24
 00:00:01.014625 eth0  Out IP 10.0.35.2.59307 > 10.0.35.3.3784: BFDv1, Control, State Up, Flags: [none], length: 24
 00:00:01.018629 eth0  In  IP 10.0.35.3.48498 > 10.0.35.2.3784: BFDv1, Control, State Up, Flags: [none], length: 24
 00:00:01.042855 eth1  Out IP 10.0.13.3.42552 > 10.0.13.2.3784: BFDv1, Control, State Up, Flags: [none], length: 24
 00:00:01.049975 eth3  In  IP 10.0.34.3.44980 > 10.0.34.2.3784: BFDv1, Control, State Up, Flags: [none], length: 24
 00:00:01.051205 eth2  Out IP 10.0.23.3.59324 > 10.0.23.2.3784: BFDv1, Control, State Up, Flags: [none], length: 24
 00:00:01.076320 eth3  Out IP 10.0.34.2.60078 > 10.0.34.3.3784: BFDv1, Control, State Up, Flags: [none], length: 24
 00:00:01.076791 eth2  In  IP 10.0.23.2.41179 > 10.0.23.3.3784: BFDv1, Control, State Up, Flags: [none], length: 24
 00:00:01.078455 eth1  In  IP 10.0.13.2.32837 > 10.0.13.3.3784: BFDv1, Control, State Up, Flags: [none], length: 24
 00:00:01.093740 eth0  Out IP 10.0.35.2.59307 > 10.0.35.3.3784: BFDv1, Control, State Up, Flags: [none], length: 24
 00:00:01.107226 eth0  In  IP 10.0.35.3.48498 > 10.0.35.2.3784: BFDv1, Control, State Up, Flags: [none], length: 24
 00:00:01.127443 eth1  Out IP 10.0.13.3.42552 > 10.0.13.2.3784: BFDv1, Control, State Up, Flags: [none], length: 24
 00:00:01.134869 eth3  In  IP 10.0.34.3.44980 > 10.0.34.2.3784: BFDv1, Control, State Up, Flags: [none], length: 24
 00:00:01.140095 eth2  Out IP 10.0.23.3.59324 > 10.0.23.2.3784: BFDv1, Control, State Up, Flags: [none], length: 24
 00:00:01.156296 eth2  In  IP 10.0.23.2.41179 > 10.0.23.3.3784: BFDv1, Control, State Up, Flags: [none], length: 24
 00:00:01.161916 eth1  In  IP 10.0.13.2.32837 > 10.0.13.3.3784: BFDv1, Control, State Up, Flags: [none], length: 24
 00:00:01.165266 eth3  Out IP 10.0.34.2.60078 > 10.0.34.3.3784: BFDv1, Control, State Up, Flags: [none], length: 24
 00:00:01.179411 eth0  Out IP 10.0.35.2.59307 > 10.0.35.3.3784: BFDv1, Control, State Up, Flags: [none], length: 24
 00:00:01.187732 eth0  In  IP 10.0.35.3.48498 > 10.0.35.2.3784: BFDv1, Control, State Up, Flags: [none], length: 24
 00:00:01.202965 eth1  Out IP 10.0.13.3.42552 > 10.0.13.2.3784: BFDv1, Control, State Up, Flags: [none], length: 24
 00:00:01.223666 eth3  In  IP 10.0.34.3.44980 > 10.0.34.2.3784: BFDv1, Control, State Up, Flags: [none], length: 24
 00:00:01.227360 eth2  Out IP 10.0.23.3.59324 > 10.0.23.2.3784: BFDv1, Control, State Up, Flags: [none], length: 24
 00:00:01.237709 eth1  In  IP 10.0.13.2.32837 > 10.0.13.3.3784: BFDv1, Control, State Up, Flags: [none], length: 24
 00:00:01.245139 eth2  In  IP 10.0.23.2.41179 > 10.0.23.3.3784: BFDv1, Control, State Up, Flags: [none], length: 24
 00:00:01.247373 eth3  Out IP 10.0.34.2.60078 > 10.0.34.3.3784: BFDv1, Control, State Up, Flags: [none], length: 24
 00:00:01.257557 eth0  Out IP 10.0.35.2.59307 > 10.0.35.3.3784: BFDv1, Control, State Up, Flags: [none], length: 24
 00:00:01.264144 eth0  In  IP 10.0.35.3.48498 > 10.0.35.2.3784: BFDv1, Control, State Up, Flags: [none], length: 24
 00:00:01.286424 eth1  Out IP 10.0.13.3.42552 > 10.0.13.2.3784: BFDv1, Control, State Up, Flags: [none], length: 24
 00:00:01.304172 eth3  In  IP 10.0.34.3.44980 > 10.0.34.2.3784: BFDv1, Control, State Up, Flags: [none], length: 24
 00:00:01.310389 eth2  Out IP 10.0.23.3.59324 > 10.0.23.2.3784: BFDv1, Control, State Up, Flags: [none], length: 24
 00:00:01.325619 eth1  In  IP 10.0.13.2.32837 > 10.0.13.3.3784: BFDv1, Control, State Up, Flags: [none], length: 24
 00:00:01.332753 eth2  In  IP 10.0.23.2.41179 > 10.0.23.3.3784: BFDv1, Control, State Up, Flags: [none], length: 24
 00:00:01.332869 eth0  Out IP 10.0.35.2.59307 > 10.0.35.3.3784: BFDv1, Control, State Up, Flags: [none], length: 24
 00:00:01.336075 eth3  Out IP 10.0.34.2.60078 > 10.0.34.3.3784: BFDv1, Control, State Up, Flags: [none], length: 24
 00:00:01.349069 eth0  In  IP 10.0.35.3.48498 > 10.0.35.2.3784: BFDv1, Control, State Up, Flags: [none], length: 24
 00:00:01.364291 eth1  Out IP 10.0.13.3.42552 > 10.0.13.2.3784: BFDv1, Control, State Up, Flags: [none], length: 24
 00:00:01.390580 eth3  In  IP 10.0.34.3.44980 > 10.0.34.2.3784: BFDv1, Control, State Up, Flags: [none], length: 24
 00:00:01.397790 eth2  Out IP 10.0.23.3.59324 > 10.0.23.2.3784: BFDv1, Control, State Up, Flags: [none], length: 24
 00:00:01.407081 eth1  In  IP 10.0.13.2.32837 > 10.0.13.3.3784: BFDv1, Control, State Up, Flags: [none], length: 24
 00:00:01.413299 eth0  Out IP 10.0.35.2.59307 > 10.0.35.3.3784: BFDv1, Control, State Up, Flags: [none], length: 24
 00:00:01.415768 eth2  In  IP 10.0.23.2.41179 > 10.0.23.3.3784: BFDv1, Control, State Up, Flags: [none], length: 24
 00:00:01.422094 eth3  Out IP 10.0.34.2.60078 > 10.0.34.3.3784: BFDv1, Control, State Up, Flags: [none], length: 24
 00:00:01.424531 eth0  In  IP 10.0.35.3.48498 > 10.0.35.2.3784: BFDv1, Control, State Up, Flags: [none], length: 24
 00:00:01.453787 eth1  Out IP 10.0.13.3.42552 > 10.0.13.2.3784: BFDv1, Control, State Up, Flags: [none], length: 24
 00:00:01.479972 eth2  Out IP 10.0.23.3.59324 > 10.0.23.2.3784: BFDv1, Control, State Up, Flags: [none], length: 24
 00:00:01.481215 eth3  In  IP 10.0.34.3.44980 > 10.0.34.2.3784: BFDv1, Control, State Up, Flags: [none], length: 24
 00:00:01.483315 eth1  In  IP 10.0.13.2.32837 > 10.0.13.3.3784: BFDv1, Control, State Up, Flags: [none], length: 24
 00:00:01.491495 eth0  Out IP 10.0.35.2.59307 > 10.0.35.3.3784: BFDv1, Control, State Up, Flags: [none], length: 24
 00:00:01.499630 eth3  Out IP 10.0.34.2.60078 > 10.0.34.3.3784: BFDv1, Control, State Up, Flags: [none], length: 24
 00:00:01.500663 eth2  In  IP 10.0.23.2.41179 > 10.0.23.3.3784: BFDv1, Control, State Up, Flags: [none], length: 24
 00:00:01.501694 eth0  In  IP 10.0.35.3.48498 > 10.0.35.2.3784: BFDv1, Control, State Up, Flags: [none], length: 24
 00:00:01.540911 eth1  Out IP 10.0.13.3.42552 > 10.0.13.2.3784: BFDv1, Control, State Up, Flags: [none], length: 24
 00:00:01.559095 eth2  Out IP 10.0.23.3.59324 > 10.0.23.2.3784: BFDv1, Control, State Up, Flags: [none], length: 24
 00:00:01.561477 eth1  In  IP 10.0.13.2.32837 > 10.0.13.3.3784: BFDv1, Control, State Up, Flags: [none], length: 24
 00:00:01.569392 eth3  In  IP 10.0.34.3.44980 > 10.0.34.2.3784: BFDv1, Control, State Up, Flags: [none], length: 24
 00:00:01.572634 eth0  Out IP 10.0.35.2.59307 > 10.0.35.3.3784: BFDv1, Control, State Up, Flags: [none], length: 24
 00:00:01.576816 eth3  Out IP 10.0.34.2.60078 > 10.0.34.3.3784: BFDv1, Control, State Up, Flags: [none], length: 24
 00:00:01.580817 eth0  In  IP 10.0.35.3.48498 > 10.0.35.2.3784: BFDv1, Control, State Up, Flags: [none], length: 24
 00:00:01.582775 eth2  In  IP 10.0.23.2.41179 > 10.0.23.3.3784: BFDv1, Control, State Up, Flags: [none], length: 24
 00:00:01.628966 eth1  Out IP 10.0.13.3.42552 > 10.0.13.2.3784: BFDv1, Control, State Up, Flags: [none], length: 24
 00:00:01.641222 eth2  Out IP 10.0.23.3.59324 > 10.0.23.2.3784: BFDv1, Control, State Up, Flags: [none], length: 24
 00:00:01.648289 eth1  In  IP 10.0.13.2.32837 > 10.0.13.3.3784: BFDv1, Control, State Up, Flags: [none], length: 24
 00:00:01.650342 eth3  In  IP 10.0.34.3.44980 > 10.0.34.2.3784: BFDv1, Control, State Up, Flags: [none], length: 24
 00:00:01.660548 eth0  Out IP 10.0.35.2.59307 > 10.0.35.3.3784: BFDv1, Control, State Up, Flags: [none], length: 24
 00:00:01.660730 eth2  In  IP 10.0.23.2.41179 > 10.0.23.3.3784: BFDv1, Control, State Up, Flags: [none], length: 24
 00:00:01.663920 eth3  Out IP 10.0.34.2.60078 > 10.0.34.3.3784: BFDv1, Control, State Up, Flags: [none], length: 24
 00:00:01.668715 eth0  In  IP 10.0.35.3.48498 > 10.0.35.2.3784: BFDv1, Control, State Up, Flags: [none], length: 24
 00:00:01.714905 eth1  Out IP 10.0.13.3.42552 > 10.0.13.2.3784: BFDv1, Control, State Up, Flags: [none], length: 24
 00:00:01.725273 eth1  In  IP 10.0.13.2.32837 > 10.0.13.3.3784: BFDv1, Control, State Up, Flags: [none], length: 24
 00:00:01.726428 eth2  Out IP 10.0.23.3.59324 > 10.0.23.2.3784: BFDv1, Control, State Up, Flags: [none], length: 24
 00:00:01.728352 eth3  In  IP 10.0.34.3.44980 > 10.0.34.2.3784: BFDv1, Control, State Up, Flags: [none], length: 24
 00:00:01.735513 eth0  Out IP 10.0.35.2.59307 > 10.0.35.3.3784: BFDv1, Control, State Up, Flags: [none], length: 24
 00:00:01.744680 eth3  Out IP 10.0.34.2.60078 > 10.0.34.3.3784: BFDv1, Control, State Up, Flags: [none], length: 24
 00:00:01.747838 eth2  In  IP 10.0.23.2.41179 > 10.0.23.3.3784: BFDv1, Control, State Up, Flags: [none], length: 24
 00:00:01.748689 eth0  In  IP 10.0.35.3.48498 > 10.0.35.2.3784: BFDv1, Control, State Up, Flags: [none], length: 24
 00:00:01.798878 eth1  Out IP 10.0.13.3.42552 > 10.0.13.2.3784: BFDv1, Control, State Up, Flags: [none], length: 24
 00:00:01.804999 eth3  In  IP 10.0.34.3.44980 > 10.0.34.2.3784: BFDv1, Control, State Up, Flags: [none], length: 24
 00:00:01.812248 eth0  Out IP 10.0.35.2.59307 > 10.0.35.3.3784: BFDv1, Control, State Up, Flags: [none], length: 24
 00:00:01.812485 eth1  In  IP 10.0.13.2.32837 > 10.0.13.3.3784: BFDv1, Control, State Up, Flags: [none], length: 24
 00:00:01.815667 eth2  Out IP 10.0.23.3.59324 > 10.0.23.2.3784: BFDv1, Control, State Up, Flags: [none], length: 24
 00:00:01.827847 eth3  Out IP 10.0.34.2.60078 > 10.0.34.3.3784: BFDv1, Control, State Up, Flags: [none], length: 24
 00:00:01.833313 eth2  In  IP 10.0.23.2.41179 > 10.0.23.3.3784: BFDv1, Control, State Up, Flags: [none], length: 24
 00:00:01.836537 eth0  In  IP 10.0.35.3.48498 > 10.0.35.2.3784: BFDv1, Control, State Up, Flags: [none], length: 24
 00:00:01.884834 eth1  Out IP 10.0.13.3.42552 > 10.0.13.2.3784: BFDv1, Control, State Up, Flags: [none], length: 24
 00:00:01.885400 eth3  In  IP 10.0.34.3.44980 > 10.0.34.2.3784: BFDv1, Control, State Up, Flags: [none], length: 24
 00:00:01.895212 eth1  In  IP 10.0.13.2.32837 > 10.0.13.3.3784: BFDv1, Control, State Up, Flags: [none], length: 24
 00:00:01.896509 eth0  Out IP 10.0.35.2.59307 > 10.0.35.3.3784: BFDv1, Control, State Up, Flags: [none], length: 24
 00:00:01.900727 eth2  Out IP 10.0.23.3.59324 > 10.0.23.2.3784: BFDv1, Control, State Up, Flags: [none], length: 24
 00:00:01.907890 eth3  Out IP 10.0.34.2.60078 > 10.0.34.3.3784: BFDv1, Control, State Up, Flags: [none], length: 24
 00:00:01.911806 eth0  In  IP 10.0.35.3.48498 > 10.0.35.2.3784: BFDv1, Control, State Up, Flags: [none], length: 24
 00:00:01.919301 eth2  In  IP 10.0.23.2.41179 > 10.0.23.3.3784: BFDv1, Control, State Up, Flags: [none], length: 24
 00:00:01.961461 eth1  Out IP 10.0.13.3.42552 > 10.0.13.2.3784: BFDv1, Control, State Up, Flags: [none], length: 24
 00:00:01.970614 eth1  In  IP 10.0.13.2.32837 > 10.0.13.3.3784: BFDv1, Control, State Up, Flags: [none], length: 24
 00:00:01.971459 eth3  In  IP 10.0.34.3.44980 > 10.0.34.2.3784: BFDv1, Control, State Up, Flags: [none], length: 24
 00:00:01.979614 eth0  Out IP 10.0.35.2.59307 > 10.0.35.3.3784: BFDv1, Control, State Up, Flags: [none], length: 24
 00:00:01.980705 eth2  Out IP 10.0.23.3.59324 > 10.0.23.2.3784: BFDv1, Control, State Up, Flags: [none], length: 24
 00:00:01.987799 eth0  In  IP 10.0.35.3.48498 > 10.0.35.2.3784: BFDv1, Control, State Up, Flags: [none], length: 24
 00:00:01.987817 eth3  Out IP 10.0.34.2.60078 > 10.0.34.3.3784: BFDv1, Control, State Up, Flags: [none], length: 24
 00:00:01.999784 eth2  In  IP 10.0.23.2.41179 > 10.0.23.3.3784: BFDv1, Control, State Up, Flags: [none], length: 24
 00:00:02.043557 eth1  Out IP 10.0.13.3.42552 > 10.0.13.2.3784: BFDv1, Control, State Up, Flags: [none], length: 24
 00:00:02.053322 eth3  In  IP 10.0.34.3.44980 > 10.0.34.2.3784: BFDv1, Control, State Up, Flags: [none], length: 24
 00:00:02.053724 eth1  In  IP 10.0.13.2.32837 > 10.0.13.3.3784: BFDv1, Control, State Up, Flags: [none], length: 24
 00:00:02.064916 eth0  Out IP 10.0.35.2.59307 > 10.0.35.3.3784: BFDv1, Control, State Up, Flags: [none], length: 24
 00:00:02.068082 eth0  In  IP 10.0.35.3.48498 > 10.0.35.2.3784: BFDv1, Control, State Up, Flags: [none], length: 24
 00:00:02.070217 eth2  Out IP 10.0.23.3.59324 > 10.0.23.2.3784: BFDv1, Control, State Up, Flags: [none], length: 24
 00:00:02.089693 eth2  In  IP 10.0.23.2.41179 > 10.0.23.3.3784: BFDv1, Control, State Up, Flags: [none], length: 24
 00:00:02.119969 eth1  Out IP 10.0.13.3.42552 > 10.0.13.2.3784: BFDv1, Control, State Up, Flags: [none], length: 24
 00:00:02.138409 eth1  In  IP 10.0.13.2.32837 > 10.0.13.3.3784: BFDv1, Control, State Up, Flags: [none], length: 24
 00:00:02.140042 eth3  In  IP 10.0.34.3.44980 > 10.0.34.2.3784: BFDv1, Control, State Up, Flags: [none], length: 24
 00:00:02.143270 eth0  Out IP 10.0.35.2.59307 > 10.0.35.3.3784: BFDv1, Control, State Up, Flags: [none], length: 24
 00:00:02.152451 eth0  In  IP 10.0.35.3.48498 > 10.0.35.2.3784: BFDv1, Control, State Up, Flags: [none], length: 24
 00:00:02.159658 eth2  Out IP 10.0.23.3.59324 > 10.0.23.2.3784: BFDv1, Control, State Up, Flags: [none], length: 24
 00:00:02.168097 eth2  In  IP 10.0.23.2.41179 > 10.0.23.3.3784: BFDv1, Control, State Up, Flags: [none], length: 24
 00:00:02.202401 eth1  Out IP 10.0.13.3.42552 > 10.0.13.2.3784: BFDv1, Control, State Up, Flags: [none], length: 24
 00:00:02.227792 eth1  In  IP 10.0.13.2.32837 > 10.0.13.3.3784: BFDv1, Control, State Up, Flags: [none], length: 24
 00:00:02.232014 eth0  Out IP 10.0.35.2.59307 > 10.0.35.3.3784: BFDv1, Control, State Up, Flags: [none], length: 24
 00:00:02.239235 eth2  Out IP 10.0.23.3.59324 > 10.0.23.2.3784: BFDv1, Control, State Up, Flags: [none], length: 24
 00:00:02.241223 eth0  In  IP 10.0.35.3.48498 > 10.0.35.2.3784: BFDv1, Control, State Up, Flags: [none], length: 24
 00:00:02.245608 eth2  In  IP 10.0.23.2.41179 > 10.0.23.3.3784: BFDv1, Control, State Up, Flags: [none], length: 24
 00:00:02.282844 eth1  Out IP 10.0.13.3.42552 > 10.0.13.2.3784: BFDv1, Control, State Up, Flags: [none], length: 24
 00:00:02.309025 eth0  Out IP 10.0.35.2.59307 > 10.0.35.3.3784: BFDv1, Control, State Up, Flags: [none], length: 24
 00:00:02.315315 eth2  Out IP 10.0.23.3.59324 > 10.0.23.2.3784: BFDv1, Control, State Up, Flags: [none], length: 24
 00:00:02.317260 eth1  In  IP 10.0.13.2.32837 > 10.0.13.3.3784: BFDv1, Control, State Up, Flags: [none], length: 24
 00:00:02.330305 eth0  In  IP 10.0.35.3.48498 > 10.0.35.2.3784: BFDv1, Control, State Up, Flags: [none], length: 24
 00:00:02.331724 eth2  In  IP 10.0.23.2.41179 > 10.0.23.3.3784: BFDv1, Control, State Up, Flags: [none], length: 24
 00:00:02.367929 eth1  Out IP 10.0.13.3.42552 > 10.0.13.2.3784: BFDv1, Control, State Up, Flags: [none], length: 24
 00:00:02.386114 eth0  Out IP 10.0.35.2.59307 > 10.0.35.3.3784: BFDv1, Control, State Up, Flags: [none], length: 24
 00:00:02.396381 eth2  Out IP 10.0.23.3.59324 > 10.0.23.2.3784: BFDv1, Control, State Up, Flags: [none], length: 24
 00:00:02.402451 eth1  In  IP 10.0.13.2.32837 > 10.0.13.3.3784: BFDv1, Control, State Up, Flags: [none], length: 24
 00:00:02.410327 eth0  In  IP 10.0.35.3.48498 > 10.0.35.2.3784: BFDv1, Control, State Up, Flags: [none], length: 24
 00:00:02.414718 eth2  In  IP 10.0.23.2.41179 > 10.0.23.3.3784: BFDv1, Control, State Up, Flags: [none], length: 24
 00:00:02.442934 eth1  Out IP 10.0.13.3.42552 > 10.0.13.2.3784: BFDv1, Control, State Up, Flags: [none], length: 24
 00:00:02.469119 eth0  Out IP 10.0.35.2.59307 > 10.0.35.3.3784: BFDv1, Control, State Up, Flags: [none], length: 24
 00:00:02.483498 eth2  Out IP 10.0.23.3.59324 > 10.0.23.2.3784: BFDv1, Control, State Up, Flags: [none], length: 24
 00:00:02.488113 eth1  In  IP 10.0.13.2.32837 > 10.0.13.3.3784: BFDv1, Control, State Up, Flags: [none], length: 24
 00:00:02.498344 eth0  In  IP 10.0.35.3.48498 > 10.0.35.2.3784: BFDv1, Control, State Up, Flags: [none], length: 24
 00:00:02.500680 eth2  In  IP 10.0.23.2.41179 > 10.0.23.3.3784: BFDv1, Control, State Up, Flags: [none], length: 24
 00:00:02.518869 eth1  Out IP 10.0.13.3.42552 > 10.0.13.2.3784: BFDv1, Control, State Up, Flags: [none], length: 24
 00:00:02.549081 eth0  Out IP 10.0.35.2.59307 > 10.0.35.3.3784: BFDv1, Control, State Up, Flags: [none], length: 24
 00:00:02.561435 eth2  Out IP 10.0.23.3.59324 > 10.0.23.2.3784: BFDv1, Control, State Up, Flags: [none], length: 24
 00:00:02.566831 eth1  In  IP 10.0.13.2.32837 > 10.0.13.3.3784: BFDv1, Control, State Up, Flags: [none], length: 24
 00:00:02.577763 eth2  In  IP 10.0.23.2.41179 > 10.0.23.3.3784: BFDv1, Control, State Up, Flags: [none], length: 24
 00:00:02.584285 eth0  In  IP 10.0.35.3.48498 > 10.0.35.2.3784: BFDv1, Control, State Up, Flags: [none], length: 24
 00:00:02.608582 eth1  Out IP 10.0.13.3.42552 > 10.0.13.2.3784: BFDv1, Control, State Up, Flags: [none], length: 24
 00:00:02.629750 eth0  Out IP 10.0.35.2.59307 > 10.0.35.3.3784: BFDv1, Control, State Up, Flags: [none], length: 24
 00:00:02.642231 eth2  Out IP 10.0.23.3.59324 > 10.0.23.2.3784: BFDv1, Control, State Up, Flags: [none], length: 24
 00:00:02.644030 eth1  In  IP 10.0.13.2.32837 > 10.0.13.3.3784: BFDv1, Control, State Up, Flags: [none], length: 24
 00:00:02.657611 eth2  In  IP 10.0.23.2.41179 > 10.0.23.3.3784: BFDv1, Control, State Up, Flags: [none], length: 24
 00:00:02.668974 eth0  In  IP 10.0.35.3.48498 > 10.0.35.2.3784: BFDv1, Control, State Up, Flags: [none], length: 24
 00:00:02.684231 eth1  Out IP 10.0.13.3.42552 > 10.0.13.2.3784: BFDv1, Control, State Up, Flags: [none], length: 24
 00:00:02.711411 eth0  Out IP 10.0.35.2.59307 > 10.0.35.3.3784: BFDv1, Control, State Up, Flags: [none], length: 24
 00:00:02.727001 eth1  In  IP 10.0.13.2.32837 > 10.0.13.3.3784: BFDv1, Control, State Up, Flags: [none], length: 24
 00:00:02.727092 eth2  Out IP 10.0.23.3.59324 > 10.0.23.2.3784: BFDv1, Control, State Up, Flags: [none], length: 24
 00:00:02.743292 eth2  In  IP 10.0.23.2.41179 > 10.0.23.3.3784: BFDv1, Control, State Up, Flags: [none], length: 24
 00:00:02.744590 eth0  In  IP 10.0.35.3.48498 > 10.0.35.2.3784: BFDv1, Control, State Up, Flags: [none], length: 24
 00:00:02.763803 eth1  Out IP 10.0.13.3.42552 > 10.0.13.2.3784: BFDv1, Control, State Up, Flags: [none], length: 24
 00:00:02.787971 eth0  Out IP 10.0.35.2.59307 > 10.0.35.3.3784: BFDv1, Control, State Up, Flags: [none], length: 24
 00:00:02.804150 eth2  Out IP 10.0.23.3.59324 > 10.0.23.2.3784: BFDv1, Control, State Up, Flags: [none], length: 24
 00:00:02.812628 eth1  In  IP 10.0.13.2.32837 > 10.0.13.3.3784: BFDv1, Control, State Up, Flags: [none], length: 24
 00:00:02.819640 eth2  In  IP 10.0.23.2.41179 > 10.0.23.3.3784: BFDv1, Control, State Up, Flags: [none], length: 24
 00:00:02.827450 eth0  In  IP 10.0.35.3.48498 > 10.0.35.2.3784: BFDv1, Control, State Up, Flags: [none], length: 24
 00:00:02.841656 eth1  Out IP 10.0.13.3.42552 > 10.0.13.2.3784: BFDv1, Control, State Up, Flags: [none], length: 24
 00:00:02.864823 eth0  Out IP 10.0.35.2.59307 > 10.0.35.3.3784: BFDv1, Control, State Up, Flags: [none], length: 24
 00:00:02.886011 eth2  Out IP 10.0.23.3.59324 > 10.0.23.2.3784: BFDv1, Control, State Up, Flags: [none], length: 24
 00:00:02.900668 eth1  In  IP 10.0.13.2.32837 > 10.0.13.3.3784: BFDv1, Control, State Up, Flags: [none], length: 24
 00:00:02.905620 eth2  In  IP 10.0.23.2.41179 > 10.0.23.3.3784: BFDv1, Control, State Up, Flags: [none], length: 24
 00:00:02.910189 eth0  In  IP 10.0.35.3.48498 > 10.0.35.2.3784: BFDv1, Control, State Up, Flags: [none], length: 24
 00:00:02.924457 eth1  Out IP 10.0.13.3.42552 > 10.0.13.2.3784: BFDv1, Control, State Up, Flags: [none], length: 24
 00:00:02.941644 eth0  Out IP 10.0.35.2.59307 > 10.0.35.3.3784: BFDv1, Control, State Up, Flags: [none], length: 24
 00:00:02.969796 eth2  Out IP 10.0.23.3.59324 > 10.0.23.2.3784: BFDv1, Control, State Up, Flags: [none], length: 24
 00:00:02.987414 eth1  In  IP 10.0.13.2.32837 > 10.0.13.3.3784: BFDv1, Control, State Up, Flags: [none], length: 24
 00:00:02.988272 eth2  In  IP 10.0.23.2.41179 > 10.0.23.3.3784: BFDv1, Control, State Up, Flags: [none], length: 24
 00:00:02.995979 eth0  In  IP 10.0.35.3.48498 > 10.0.35.2.3784: BFDv1, Control, State Up, Flags: [none], length: 24
 00:00:03.008216 eth1  Out IP 10.0.13.3.42552 > 10.0.13.2.3784: BFDv1, Control, State Up, Flags: [none], length: 24
 00:00:03.027441 eth0  Out IP 10.0.35.2.59307 > 10.0.35.3.3784: BFDv1, Control, State Up, Flags: [none], length: 24
 00:00:03.054636 eth2  Out IP 10.0.23.3.59324 > 10.0.23.2.3784: BFDv1, Control, State Up, Flags: [none], length: 24
 00:00:03.072827 eth2  In  IP 10.0.23.2.41179 > 10.0.23.3.3784: BFDv1, Control, State Up, Flags: [none], length: 24
 00:00:03.076262 eth1  In  IP 10.0.13.2.32837 > 10.0.13.3.3784: BFDv1, Control, State Up, Flags: [none], length: 24
 00:00:03.076800 eth0  In  IP 10.0.35.3.48498 > 10.0.35.2.3784: BFDv1, Control, State Up, Flags: [none], length: 24
 00:00:03.097998 eth1  Out IP 10.0.13.3.42552 > 10.0.13.2.3784: BFDv1, Control, State Up, Flags: [none], length: 24
 00:00:03.114194 eth0  Out IP 10.0.35.2.59307 > 10.0.35.3.3784: BFDv1, Control, State Up, Flags: [none], length: 24
 00:00:03.139343 eth2  Out IP 10.0.23.3.59324 > 10.0.23.2.3784: BFDv1, Control, State Up, Flags: [none], length: 24
 00:00:03.152556 eth2  In  IP 10.0.23.2.41179 > 10.0.23.3.3784: BFDv1, Control, State Up, Flags: [none], length: 24
 00:00:03.155513 eth0  In  IP 10.0.35.3.48498 > 10.0.35.2.3784: BFDv1, Control, State Up, Flags: [none], length: 24
 00:00:03.160824 eth1  In  IP 10.0.13.2.32837 > 10.0.13.3.3784: BFDv1, Control, State Up, Flags: [none], length: 24
 00:00:03.181006 eth1  Out IP 10.0.13.3.42552 > 10.0.13.2.3784: BFDv1, Control, State Up, Flags: [none], length: 24
 00:00:03.197150 eth0  Out IP 10.0.35.2.59307 > 10.0.35.3.3784: BFDv1, Control, State Up, Flags: [none], length: 24
 00:00:03.221306 eth2  Out IP 10.0.23.3.59324 > 10.0.23.2.3784: BFDv1, Control, State Up, Flags: [none], length: 24
 00:00:03.236495 eth2  In  IP 10.0.23.2.41179 > 10.0.23.3.3784: BFDv1, Control, State Up, Flags: [none], length: 24
 00:00:03.242536 eth0  In  IP 10.0.35.3.48498 > 10.0.35.2.3784: BFDv1, Control, State Up, Flags: [none], length: 24
 00:00:03.245318 eth1  In  IP 10.0.13.2.32837 > 10.0.13.3.3784: BFDv1, Control, State Up, Flags: [none], length: 24
 00:00:03.263580 eth1  Out IP 10.0.13.3.42552 > 10.0.13.2.3784: BFDv1, Control, State Up, Flags: [none], length: 24
 00:00:03.285746 eth0  Out IP 10.0.35.2.59307 > 10.0.35.3.3784: BFDv1, Control, State Up, Flags: [none], length: 24
 00:00:03.302915 eth2  Out IP 10.0.23.3.59324 > 10.0.23.2.3784: BFDv1, Control, State Up, Flags: [none], length: 24
 00:00:03.320106 eth2  In  IP 10.0.23.2.41179 > 10.0.23.3.3784: BFDv1, Control, State Up, Flags: [none], length: 24
 00:00:03.327960 eth0  In  IP 10.0.35.3.48498 > 10.0.35.2.3784: BFDv1, Control, State Up, Flags: [none], length: 24
 00:00:03.332066 eth1  In  IP 10.0.13.2.32837 > 10.0.13.3.3784: BFDv1, Control, State Up, Flags: [none], length: 24
 00:00:03.350263 eth1  Out IP 10.0.13.3.42552 > 10.0.13.2.3784: BFDv1, Control, State Up, Flags: [none], length: 24
 00:00:03.373439 eth0  Out IP 10.0.35.2.59307 > 10.0.35.3.3784: BFDv1, Control, State Up, Flags: [none], length: 24
 00:00:03.389620 eth2  Out IP 10.0.23.3.59324 > 10.0.23.2.3784: BFDv1, Control, State Up, Flags: [none], length: 24
 00:00:03.404873 eth2  In  IP 10.0.23.2.41179 > 10.0.23.3.3784: BFDv1, Control, State Up, Flags: [none], length: 24
 00:00:03.405641 eth0  In  IP 10.0.35.3.48498 > 10.0.35.2.3784: BFDv1, Control, State Up, Flags: [none], length: 24
 00:00:03.420728 eth1  In  IP 10.0.13.2.32837 > 10.0.13.3.3784: BFDv1, Control, State Up, Flags: [none], length: 24
 00:00:03.428919 eth1  Out IP 10.0.13.3.42552 > 10.0.13.2.3784: BFDv1, Control, State Up, Flags: [none], length: 24
 00:00:03.452105 eth0  Out IP 10.0.35.2.59307 > 10.0.35.3.3784: BFDv1, Control, State Up, Flags: [none], length: 24
 00:00:03.477358 eth2  Out IP 10.0.23.3.59324 > 10.0.23.2.3784: BFDv1, Control, State Up, Flags: [none], length: 24
 00:00:03.482526 eth2  In  IP 10.0.23.2.41179 > 10.0.23.3.3784: BFDv1, Control, State Up, Flags: [none], length: 24
 00:00:03.486362 eth0  In  IP 10.0.35.3.48498 > 10.0.35.2.3784: BFDv1, Control, State Up, Flags: [none], length: 24
 00:00:03.508644 eth1  In  IP 10.0.13.2.32837 > 10.0.13.3.3784: BFDv1, Control, State Up, Flags: [none], length: 24
 00:00:03.513857 eth1  Out IP 10.0.13.3.42552 > 10.0.13.2.3784: BFDv1, Control, State Up, Flags: [none], length: 24
 00:00:03.541034 eth0  Out IP 10.0.35.2.59307 > 10.0.35.3.3784: BFDv1, Control, State Up, Flags: [none], length: 24
 00:00:03.566390 eth2  In  IP 10.0.23.2.41179 > 10.0.23.3.3784: BFDv1, Control, State Up, Flags: [none], length: 24
 00:00:03.567550 eth2  Out IP 10.0.23.3.59324 > 10.0.23.2.3784: BFDv1, Control, State Up, Flags: [none], length: 24
 00:00:03.574405 eth0  In  IP 10.0.35.3.48498 > 10.0.35.2.3784: BFDv1, Control, State Up, Flags: [none], length: 24
 00:00:03.594618 eth1  Out IP 10.0.13.3.42552 > 10.0.13.2.3784: BFDv1, Control, State Up, Flags: [none], length: 24
 00:00:03.595874 eth1  In  IP 10.0.13.2.32837 > 10.0.13.3.3784: BFDv1, Control, State Up, Flags: [none], length: 24
 00:00:03.619102 eth0  Out IP 10.0.35.2.59307 > 10.0.35.3.3784: BFDv1, Control, State Up, Flags: [none], length: 24
 00:00:03.643311 eth2  Out IP 10.0.23.3.59324 > 10.0.23.2.3784: BFDv1, Control, State Up, Flags: [none], length: 24
 00:00:03.646478 eth2  In  IP 10.0.23.2.41179 > 10.0.23.3.3784: BFDv1, Control, State Up, Flags: [none], length: 24
 00:00:03.663934 eth0  In  IP 10.0.35.3.48498 > 10.0.35.2.3784: BFDv1, Control, State Up, Flags: [none], length: 24
 00:00:03.676523 eth1  In  IP 10.0.13.2.32837 > 10.0.13.3.3784: BFDv1, Control, State Up, Flags: [none], length: 24
 00:00:03.676591 eth1  Out IP 10.0.13.3.42552 > 10.0.13.2.3784: BFDv1, Control, State Up, Flags: [none], length: 24
 00:00:03.699743 eth0  Out IP 10.0.35.2.59307 > 10.0.35.3.3784: BFDv1, Control, State Up, Flags: [none], length: 24
 00:00:03.721898 eth2  Out IP 10.0.23.3.59324 > 10.0.23.2.3784: BFDv1, Control, State Up, Flags: [none], length: 24
 00:00:03.734096 eth2  In  IP 10.0.23.2.41179 > 10.0.23.3.3784: BFDv1, Control, State Up, Flags: [none], length: 24
 00:00:03.746537 eth0  In  IP 10.0.35.3.48498 > 10.0.35.2.3784: BFDv1, Control, State Up, Flags: [none], length: 24
 00:00:03.762294 eth1  In  IP 10.0.13.2.32837 > 10.0.13.3.3784: BFDv1, Control, State Up, Flags: [none], length: 24
 00:00:03.766545 eth1  Out IP 10.0.13.3.42552 > 10.0.13.2.3784: BFDv1, Control, State Up, Flags: [none], length: 24
 00:00:03.787744 eth0  Out IP 10.0.35.2.59307 > 10.0.35.3.3784: BFDv1, Control, State Up, Flags: [none], length: 24
 00:00:03.800907 eth2  Out IP 10.0.23.3.59324 > 10.0.23.2.3784: BFDv1, Control, State Up, Flags: [none], length: 24
 00:00:03.820313 eth2  In  IP 10.0.23.2.41179 > 10.0.23.3.3784: BFDv1, Control, State Up, Flags: [none], length: 24
 00:00:03.831022 eth0  In  IP 10.0.35.3.48498 > 10.0.35.2.3784: BFDv1, Control, State Up, Flags: [none], length: 24
 00:00:03.848299 eth1  Out IP 10.0.13.3.42552 > 10.0.13.2.3784: BFDv1, Control, State Up, Flags: [none], length: 24
 00:00:03.849489 eth1  In  IP 10.0.13.2.32837 > 10.0.13.3.3784: BFDv1, Control, State Up, Flags: [none], length: 24
 00:00:03.869701 eth0  Out IP 10.0.35.2.59307 > 10.0.35.3.3784: BFDv1, Control, State Up, Flags: [none], length: 24
 00:00:03.890883 eth2  Out IP 10.0.23.3.59324 > 10.0.23.2.3784: BFDv1, Control, State Up, Flags: [none], length: 24
 00:00:03.903089 eth2  In  IP 10.0.23.2.41179 > 10.0.23.3.3784: BFDv1, Control, State Up, Flags: [none], length: 24
 00:00:03.910588 eth0  In  IP 10.0.35.3.48498 > 10.0.35.2.3784: BFDv1, Control, State Up, Flags: [none], length: 24
 00:00:03.924788 eth1  Out IP 10.0.13.3.42552 > 10.0.13.2.3784: BFDv1, Control, State Up, Flags: [none], length: 24
 00:00:03.933935 eth1  In  IP 10.0.13.2.32837 > 10.0.13.3.3784: BFDv1, Control, State Up, Flags: [none], length: 24
 00:00:03.951126 eth0  Out IP 10.0.35.2.59307 > 10.0.35.3.3784: BFDv1, Control, State Up, Flags: [none], length: 24
 00:00:03.978302 eth2  Out IP 10.0.23.3.59324 > 10.0.23.2.3784: BFDv1, Control, State Up, Flags: [none], length: 24
 00:00:03.988497 eth2  In  IP 10.0.23.2.41179 > 10.0.23.3.3784: BFDv1, Control, State Up, Flags: [none], length: 24
 00:00:03.999213 eth0  In  IP 10.0.35.3.48498 > 10.0.35.2.3784: BFDv1, Control, State Up, Flags: [none], length: 24
