tcpdump: data link type LINUX_SLL2
tcpdump: verbose output suppressed, use -v[v]... for full protocol decode
listening on any, link-type LINUX_SLL2 (Linux cooked v2), snapshot length 262144 bytes
 00:00:00.000000 eth1  Out IP 10.0.29.2.44114 > 10.0.29.3.3784: BFDv1, Control, State Up, Flags: [none], length: 24
 00:00:00.021246 eth1  In  IP 10.0.29.3.48590 > 10.0.29.2.3784: BFDv1, Control, State Up, Flags: [none], length: 24
 00:00:00.089580 eth1  Out IP 10.0.29.2.44114 > 10.0.29.3.3784: BFDv1, Control, State Up, Flags: [none], length: 24
 00:00:00.097822 eth1  In  IP 10.0.29.3.48590 > 10.0.29.2.3784: BFDv1, Control, State Up, Flags: [none], length: 24
 00:00:00.173228 eth1  Out IP 10.0.29.2.44114 > 10.0.29.3.3784: BFDv1, Control, State Up, Flags: [none], length: 24
 00:00:00.176516 eth1  In  IP 10.0.29.3.48590 > 10.0.29.2.3784: BFDv1, Control, State Up, Flags: [none], length: 24
 00:00:00.256254 eth1  In  IP 10.0.29.3.48590 > 10.0.29.2.3784: BFDv1, Control, State Up, Flags: [none], length: 24
 00:00:00.260533 eth1  Out IP 10.0.29.2.44114 > 10.0.29.3.3784: BFDv1, Control, State Up, Flags: [none], length: 24
 00:00:00.333006 eth1  In  IP 10.0.29.3.48590 > 10.0.29.2.3784: BFDv1, Control, State Up, Flags: [none], length: 24
 00:00:00.349428 eth1  Out IP 10.0.29.2.44114 > 10.0.29.3.3784: BFDv1, Control, State Up, Flags: [none], length: 24
 00:00:00.416176 eth1  In  IP 10.0.29.3.48590 > 10.0.29.2.3784: BFDv1, Control, State Up, Flags: [none], length: 24
 00:00:00.434617 eth1  Out IP 10.0.29.2.44114 > 10.0.29.3.3784: BFDv1, Control, State Up, Flags: [none], length: 24
 00:00:00.498471 eth1  In  IP 10.0.29.3.48590 > 10.0.29.2.3784: BFDv1, Control, State Up, Flags: [none], length: 24
 00:00:00.518850 eth1  Out IP 10.0.29.2.44114 > 10.0.29.3.3784: BFDv1, Control, State Up, Flags: [none], length: 24
 00:00:00.587802 eth1  In  IP 10.0.29.3.48590 > 10.0.29.2.3784: BFDv1, Control, State Up, Flags: [none], length: 24
 00:00:00.598100 eth1  Out IP 10.0.29.2.44114 > 10.0.29.3.3784: BFDv1, Control, State Up, Flags: [none], length: 24
 00:00:00.676821 eth1  In  IP 10.0.29.3.48590 > 10.0.29.2.3784: BFDv1, Control, State Up, Flags: [none], length: 24
 00:00:00.683214 eth1  Out IP 10.0.29.2.44114 > 10.0.29.3.3784: BFDv1, Control, State Up, Flags: [none], length: 24
 00:00:00.763065 eth1  In  IP 10.0.29.3.48590 > 10.0.29.2.3784: BFDv1, Control, State Up, Flags: [none], length: 24
 00:00:00.767434 eth1  Out IP 10.0.29.2.44114 > 10.0.29.3.3784: BFDv1, Control, State Up, Flags: [none], length: 24
 00:00:00.841438 eth1  In  IP 10.0.29.3.48590 > 10.0.29.2.3784: BFDv1, Control, State Up, Flags: [none], length: 24
 00:00:00.845831 eth1  Out IP 10.0.29.2.44114 > 10.0.29.3.3784: BFDv1, Control, State Up, Flags: [none], length: 24
 00:00:00.919772 eth1  In  IP 10.0.29.3.48590 > 10.0.29.2.3784: BFDv1, Control, State Up, Flags: [none], length: 24
 00:00:00.930806 eth1  Out IP 10.0.29.2.44114 > 10.0.29.3.3784: BFDv1, Control, State Up, Flags: [none], length: 24
 00:00:01.006156 eth1  In  IP 10.0.29.3.48590 > 10.0.29.2.3784: BFDv1, Control, State Up, Flags: [none], length: 24
 00:00:01.008504 eth1  Out IP 10.0.29.2.44114 > 10.0.29.3.3784: BFDv1, Control, State Up, Flags: [none], length: 24
 00:00:01.085345 eth1  In  IP 10.0.29.3.48590 > 10.0.29.2.3784: BFDv1, Control, State Up, Flags: [none], length: 24
 00:00:01.094880 eth1  Out IP 10.0.29.2.44114 > 10.0.29.3.3784: BFDv1, Control, State Up, Flags: [none], length: 24
 00:00:01.160722 eth1  In  IP 10.0.29.3.48590 > 10.0.29.2.3784: BFDv1, Control, State Up, Flags: [none], length: 24
 00:00:01.181148 eth1  Out IP 10.0.29.2.44114 > 10.0.29.3.3784: BFDv1, Control, State Up, Flags: [none], length: 24
 00:00:01.242959 eth1  In  IP 10.0.29.3.48590 > 10.0.29.2.3784: BFDv1, Control, State Up, Flags: [none], length: 24
 00:00:01.268524 eth1  Out IP 10.0.29.2.44114 > 10.0.29.3.3784: BFDv1, Control, State Up, Flags: [none], length: 24
 00:00:01.325514 eth1  In  IP 10.0.29.3.48590 > 10.0.29.2.3784: BFDv1, Control, State Up, Flags: [none], length: 24
 00:00:01.344251 eth1  Out IP 10.0.29.2.44114 > 10.0.29.3.3784: BFDv1, Control, State Up, Flags: [none], length: 24
 00:00:01.406220 eth1  In  IP 10.0.29.3.48590 > 10.0.29.2.3784: BFDv1, Control, State Up, Flags: [none], length: 24
 00:00:01.433770 eth1  Out IP 10.0.29.2.44114 > 10.0.29.3.3784: BFDv1, Control, State Up, Flags: [none], length: 24
 00:00:01.489627 eth1  In  IP 10.0.29.3.48590 > 10.0.29.2.3784: BFDv1, Control, State Up, Flags: [none], length: 24
 00:00:01.510074 eth1  Out IP 10.0.29.2.44114 > 10.0.29.3.3784: BFDv1, Control, State Up, Flags: [none], length: 24
 00:00:01.571392 eth1  In  IP 10.0.29.3.48590 > 10.0.29.2.3784: BFDv1, Control, State Up, Flags: [none], length: 24
 00:00:01.591821 eth1  Out IP 10.0.29.2.44114 > 10.0.29.3.3784: BFDv1, Control, State Up, Flags: [none], length: 24
 00:00:01.651695 eth1  In  IP 10.0.29.3.48590 > 10.0.29.2.3784: BFDv1, Control, State Up, Flags: [none], length: 24
 00:00:01.677129 eth1  Out IP 10.0.29.2.44114 > 10.0.29.3.3784: BFDv1, Control, State Up, Flags: [none], length: 24
 00:00:01.729907 eth1  In  IP 10.0.29.3.48590 > 10.0.29.2.3784: BFDv1, Control, State Up, Flags: [none], length: 24
 00:00:01.760273 eth1  Out IP 10.0.29.2.44114 > 10.0.29.3.3784: BFDv1, Control, State Up, Flags: [none], length: 24
 00:00:01.805739 eth1  In  IP 10.0.29.3.48590 > 10.0.29.2.3784: BFDv1, Control, State Up, Flags: [none], length: 24
 00:00:01.846191 eth1  Out IP 10.0.29.2.44114 > 10.0.29.3.3784: BFDv1, Control, State Up, Flags: [none], length: 24
 00:00:01.886715 eth1  In  IP 10.0.29.3.48590 > 10.0.29.2.3784: BFDv1, Control, State Up, Flags: [none], length: 24
 00:00:01.924199 eth1  Out IP 10.0.29.2.44114 > 10.0.29.3.3784: BFDv1, Control, State Up, Flags: [none], length: 24
 00:00:01.970632 eth1  In  IP 10.0.29.3.48590 > 10.0.29.2.3784: BFDv1, Control, State Up, Flags: [none], length: 24
 00:00:02.010083 eth1  Out IP 10.0.29.2.44114 > 10.0.29.3.3784: BFDv1, Control, State Up, Flags: [none], length: 24
 00:00:02.052700 eth1  In  IP 10.0.29.3.48590 > 10.0.29.2.3784: BFDv1, Control, State Up, Flags: [none], length: 24
 00:00:02.063991 eth2  Out IP 10.0.12.3.51192 > 10.0.12.2.179: Flags [P.], seq 221767804:221767839, ack 3568889235, win 63, options [nop,nop,TS val 625785570 ecr 396586812], length 35: BGP
 00:00:02.064065 eth2  In  IP 10.0.12.2.179 > 10.0.12.3.51192: Flags [.], ack 35, win 64, options [nop,nop,TS val 396636926 ecr 625785570], length 0
 00:00:02.064103 eth2  Out IP 10.0.12.3.51192 > 10.0.12.2.179: Flags [P.], seq 35:80, ack 1, win 63, options [nop,nop,TS val 625785570 ecr 396636926], length 45: BGP
 00:00:02.064169 eth2  In  IP 10.0.12.2.179 > 10.0.12.3.51192: Flags [.], ack 80, win 64, options [nop,nop,TS val 396636926 ecr 625785570], length 0
 00:00:02.065383 eth2  In  IP 10.0.12.2.179 > 10.0.12.3.51192: Flags [P.], seq 1:55, ack 80, win 64, options [nop,nop,TS val 396636928 ecr 625785570], length 54: BGP
 00:00:02.065422 eth2  Out IP 10.0.12.3.51192 > 10.0.12.2.179: Flags [.], ack 55, win 63, options [nop,nop,TS val 625785572 ecr 396636928], length 0
 00:00:04.418813 eth2  In  IP 10.0.12.2.179 > 10.0.12.3.51192: Flags [P.], seq 55:74, ack 80, win 64, options [nop,nop,TS val 396639281 ecr 625785572], length 19: BGP
 00:00:04.418875 eth2  Out IP 10.0.12.3.51192 > 10.0.12.2.179: Flags [.], ack 74, win 63, options [nop,nop,TS val 625787925 ecr 396639281], length 0
 00:00:05.093676 eth2  Out IP 10.0.12.3.51192 > 10.0.12.2.179: Flags [P.], seq 80:99, ack 74, win 63, options [nop,nop,TS val 625788600 ecr 396639281], length 19: BGP
 00:00:05.135381 eth2  In  IP 10.0.12.2.179 > 10.0.12.3.51192: Flags [.], ack 99, win 64, options [nop,nop,TS val 396639998 ecr 625788600], length 0
 00:00:10.160397 eth1  Out IP 10.0.29.2.48429 > 10.0.29.3.3784: BFDv1, Control, State Down, Flags: [none], length: 24
 00:00:10.160686 eth2  Out IP 10.0.12.3.51192 > 10.0.12.2.179: Flags [P.], seq 99:147, ack 74, win 63, options [nop,nop,TS val 625793667 ecr 396639998], length 48: BGP
 00:00:10.160736 eth2  In  IP 10.0.12.2.179 > 10.0.12.3.51192: Flags [.], ack 147, win 64, options [nop,nop,TS val 396645023 ecr 625793667], length 0
 00:00:10.161022 eth2  In  IP 10.0.12.2.179 > 10.0.12.3.51192: Flags [P.], seq 74:101, ack 147, win 64, options [nop,nop,TS val 396645023 ecr 625793667], length 27: BGP
 00:00:10.161038 eth2  Out IP 10.0.12.3.51192 > 10.0.12.2.179: Flags [.], ack 101, win 63, options [nop,nop,TS val 625793667 ecr 396645023], length 0
 00:00:10.161398 eth2  Out IP 10.0.12.3.51192 > 10.0.12.2.179: Flags [P.], seq 147:192, ack 101, win 63, options [nop,nop,TS val 625793668 ecr 396645023], length 45: BGP
 00:00:10.203335 eth2  In  IP 10.0.12.2.179 > 10.0.12.3.51192: Flags [.], ack 192, win 64, options [nop,nop,TS val 396645066 ecr 625793668], length 0
 00:00:10.811228 eth1  In  IP 10.0.29.3.47824 > 10.0.29.2.3784: BFDv1, Control, State Init, Flags: [none], length: 24
 00:00:10.811526 eth1  Out IP 10.0.29.2.48429 > 10.0.29.3.3784: BFDv1, Control, State Up, Flags: [Poll], length: 24
 00:00:10.811662 eth1  In  IP 10.0.29.3.47824 > 10.0.29.2.3784: BFDv1, Control, State Up, Flags: [Final], length: 24
 00:00:10.811702 eth1  In  IP 10.0.29.3.47824 > 10.0.29.2.3784: BFDv1, Control, State Up, Flags: [Poll], length: 24
 00:00:10.811841 eth1  Out IP 10.0.29.2.48429 > 10.0.29.3.3784: BFDv1, Control, State Up, Flags: [Final], length: 24
 00:00:10.892905 eth1  In  IP 10.0.29.3.47824 > 10.0.29.2.3784: BFDv1, Control, State Up, Flags: [none], length: 24
 00:00:10.898623 eth1  Out IP 10.0.29.2.48429 > 10.0.29.3.3784: BFDv1, Control, State Up, Flags: [none], length: 24
 00:00:10.974577 eth1  In  IP 10.0.29.3.47824 > 10.0.29.2.3784: BFDv1, Control, State Up, Flags: [none], length: 24
 00:00:10.986974 eth1  Out IP 10.0.29.2.48429 > 10.0.29.3.3784: BFDv1, Control, State Up, Flags: [none], length: 24
 00:00:11.050617 eth1  In  IP 10.0.29.3.47824 > 10.0.29.2.3784: BFDv1, Control, State Up, Flags: [none], length: 24
 00:00:11.064172 eth1  Out IP 10.0.29.2.48429 > 10.0.29.3.3784: BFDv1, Control, State Up, Flags: [none], length: 24
 00:00:11.138733 eth1  In  IP 10.0.29.3.47824 > 10.0.29.2.3784: BFDv1, Control, State Up, Flags: [none], length: 24
 00:00:11.144142 eth1  Out IP 10.0.29.2.48429 > 10.0.29.3.3784: BFDv1, Control, State Up, Flags: [none], length: 24
 00:00:11.220525 eth1  Out IP 10.0.29.2.48429 > 10.0.29.3.3784: BFDv1, Control, State Up, Flags: [none], length: 24
 00:00:11.225494 eth1  In  IP 10.0.29.3.47824 > 10.0.29.2.3784: BFDv1, Control, State Up, Flags: [none], length: 24
 00:00:11.306766 eth1  In  IP 10.0.29.3.47824 > 10.0.29.2.3784: BFDv1, Control, State Up, Flags: [none], length: 24
 00:00:11.306861 eth1  Out IP 10.0.29.2.48429 > 10.0.29.3.3784: BFDv1, Control, State Up, Flags: [none], length: 24
 00:00:11.389342 eth1  Out IP 10.0.29.2.48429 > 10.0.29.3.3784: BFDv1, Control, State Up, Flags: [none], length: 24
 00:00:11.392626 eth1  In  IP 10.0.29.3.47824 > 10.0.29.2.3784: BFDv1, Control, State Up, Flags: [none], length: 24
 00:00:11.473379 eth1  In  IP 10.0.29.3.47824 > 10.0.29.2.3784: BFDv1, Control, State Up, Flags: [none], length: 24
 00:00:11.475830 eth1  Out IP 10.0.29.2.48429 > 10.0.29.3.3784: BFDv1, Control, State Up, Flags: [none], length: 24
 00:00:11.551589 eth1  In  IP 10.0.29.3.47824 > 10.0.29.2.3784: BFDv1, Control, State Up, Flags: [none], length: 24
 00:00:11.558928 eth1  Out IP 10.0.29.2.48429 > 10.0.29.3.3784: BFDv1, Control, State Up, Flags: [none], length: 24
 00:00:11.632817 eth1  In  IP 10.0.29.3.47824 > 10.0.29.2.3784: BFDv1, Control, State Up, Flags: [none], length: 24
 00:00:11.639344 eth1  Out IP 10.0.29.2.48429 > 10.0.29.3.3784: BFDv1, Control, State Up, Flags: [none], length: 24
 00:00:11.715172 eth1  In  IP 10.0.29.3.47824 > 10.0.29.2.3784: BFDv1, Control, State Up, Flags: [none], length: 24
 00:00:11.726525 eth1  Out IP 10.0.29.2.48429 > 10.0.29.3.3784: BFDv1, Control, State Up, Flags: [none], length: 24
 00:00:11.793665 eth1  In  IP 10.0.29.3.47824 > 10.0.29.2.3784: BFDv1, Control, State Up, Flags: [none], length: 24
 00:00:11.809034 eth1  Out IP 10.0.29.2.48429 > 10.0.29.3.3784: BFDv1, Control, State Up, Flags: [none], length: 24
 00:00:11.879337 eth1  In  IP 10.0.29.3.47824 > 10.0.29.2.3784: BFDv1, Control, State Up, Flags: [none], length: 24
 00:00:11.889789 eth1  Out IP 10.0.29.2.48429 > 10.0.29.3.3784: BFDv1, Control, State Up, Flags: [none], length: 24
 00:00:11.954645 eth1  In  IP 10.0.29.3.47824 > 10.0.29.2.3784: BFDv1, Control, State Up, Flags: [none], length: 24
 00:00:11.969032 eth1  Out IP 10.0.29.2.48429 > 10.0.29.3.3784: BFDv1, Control, State Up, Flags: [none], length: 24
 00:00:12.040836 eth1  In  IP 10.0.29.3.47824 > 10.0.29.2.3784: BFDv1, Control, State Up, Flags: [none], length: 24
 00:00:12.047185 eth1  Out IP 10.0.29.2.48429 > 10.0.29.3.3784: BFDv1, Control, State Up, Flags: [none], length: 24
 00:00:12.116919 eth1  In  IP 10.0.29.3.47824 > 10.0.29.2.3784: BFDv1, Control, State Up, Flags: [none], length: 24
 00:00:12.135353 eth1  Out IP 10.0.29.2.48429 > 10.0.29.3.3784: BFDv1, Control, State Up, Flags: [none], length: 24
 00:00:12.195991 eth1  In  IP 10.0.29.3.47824 > 10.0.29.2.3784: BFDv1, Control, State Up, Flags: [none], length: 24
 00:00:12.225485 eth1  Out IP 10.0.29.2.48429 > 10.0.29.3.3784: BFDv1, Control, State Up, Flags: [none], length: 24
 00:00:12.284765 eth1  In  IP 10.0.29.3.47824 > 10.0.29.2.3784: BFDv1, Control, State Up, Flags: [none], length: 24
 00:00:12.306128 eth1  Out IP 10.0.29.2.48429 > 10.0.29.3.3784: BFDv1, Control, State Up, Flags: [none], length: 24
 00:00:12.361496 eth1  In  IP 10.0.29.3.47824 > 10.0.29.2.3784: BFDv1, Control, State Up, Flags: [none], length: 24
 00:00:12.390858 eth1  Out IP 10.0.29.2.48429 > 10.0.29.3.3784: BFDv1, Control, State Up, Flags: [none], length: 24
 00:00:12.450145 eth1  In  IP 10.0.29.3.47824 > 10.0.29.2.3784: BFDv1, Control, State Up, Flags: [none], length: 24
 00:00:12.472547 eth1  Out IP 10.0.29.2.48429 > 10.0.29.3.3784: BFDv1, Control, State Up, Flags: [none], length: 24
 00:00:12.534210 eth1  In  IP 10.0.29.3.47824 > 10.0.29.2.3784: BFDv1, Control, State Up, Flags: [none], length: 24
 00:00:12.549637 eth1  Out IP 10.0.29.2.48429 > 10.0.29.3.3784: BFDv1, Control, State Up, Flags: [none], length: 24
 00:00:12.622589 eth1  In  IP 10.0.29.3.47824 > 10.0.29.2.3784: BFDv1, Control, State Up, Flags: [none], length: 24
 00:00:12.636982 eth1  Out IP 10.0.29.2.48429 > 10.0.29.3.3784: BFDv1, Control, State Up, Flags: [none], length: 24
 00:00:12.711286 eth1  In  IP 10.0.29.3.47824 > 10.0.29.2.3784: BFDv1, Control, State Up, Flags: [none], length: 24
 00:00:12.725714 eth1  Out IP 10.0.29.2.48429 > 10.0.29.3.3784: BFDv1, Control, State Up, Flags: [none], length: 24
 00:00:12.794113 eth1  In  IP 10.0.29.3.47824 > 10.0.29.2.3784: BFDv1, Control, State Up, Flags: [none], length: 24
 00:00:12.814855 eth1  Out IP 10.0.29.2.48429 > 10.0.29.3.3784: BFDv1, Control, State Up, Flags: [none], length: 24
 00:00:12.882382 eth1  In  IP 10.0.29.3.47824 > 10.0.29.2.3784: BFDv1, Control, State Up, Flags: [none], length: 24
 00:00:12.890718 eth1  Out IP 10.0.29.2.48429 > 10.0.29.3.3784: BFDv1, Control, State Up, Flags: [none], length: 24
 00:00:12.960716 eth1  In  IP 10.0.29.3.47824 > 10.0.29.2.3784: BFDv1, Control, State Up, Flags: [none], length: 24
 00:00:12.969108 eth1  Out IP 10.0.29.2.48429 > 10.0.29.3.3784: BFDv1, Control, State Up, Flags: [none], length: 24
 00:00:13.044621 eth1  In  IP 10.0.29.3.47824 > 10.0.29.2.3784: BFDv1, Control, State Up, Flags: [none], length: 24
 00:00:13.052048 eth1  Out IP 10.0.29.2.48429 > 10.0.29.3.3784: BFDv1, Control, State Up, Flags: [none], length: 24
 00:00:13.122938 eth1  In  IP 10.0.29.3.47824 > 10.0.29.2.3784: BFDv1, Control, State Up, Flags: [none], length: 24
 00:00:13.141557 eth1  Out IP 10.0.29.2.48429 > 10.0.29.3.3784: BFDv1, Control, State Up, Flags: [none], length: 24
 00:00:13.209830 eth1  In  IP 10.0.29.3.47824 > 10.0.29.2.3784: BFDv1, Control, State Up, Flags: [none], length: 24
 00:00:13.221194 eth1  Out IP 10.0.29.2.48429 > 10.0.29.3.3784: BFDv1, Control, State Up, Flags: [none], length: 24
 00:00:13.287479 eth1  In  IP 10.0.29.3.47824 > 10.0.29.2.3784: BFDv1, Control, State Up, Flags: [none], length: 24
 00:00:13.297805 eth1  Out IP 10.0.29.2.48429 > 10.0.29.3.3784: BFDv1, Control, State Up, Flags: [none], length: 24
 00:00:13.375442 eth1  In  IP 10.0.29.3.47824 > 10.0.29.2.3784: BFDv1, Control, State Up, Flags: [none], length: 24
 00:00:13.378862 eth1  Out IP 10.0.29.2.48429 > 10.0.29.3.3784: BFDv1, Control, State Up, Flags: [none], length: 24
 00:00:13.451820 eth1  In  IP 10.0.29.3.47824 > 10.0.29.2.3784: BFDv1, Control, State Up, Flags: [none], length: 24
 00:00:13.455227 eth1  Out IP 10.0.29.2.48429 > 10.0.29.3.3784: BFDv1, Control, State Up, Flags: [none], length: 24
 00:00:13.538373 eth1  In  IP 10.0.29.3.47824 > 10.0.29.2.3784: BFDv1, Control, State Up, Flags: [none], length: 24
 00:00:13.544760 eth1  Out IP 10.0.29.2.48429 > 10.0.29.3.3784: BFDv1, Control, State Up, Flags: [none], length: 24
 00:00:13.618965 eth1  In  IP 10.0.29.3.47824 > 10.0.29.2.3784: BFDv1, Control, State Up, Flags: [none], length: 24
 00:00:13.627342 eth1  Out IP 10.0.29.2.48429 > 10.0.29.3.3784: BFDv1, Control, State Up, Flags: [none], length: 24
 00:00:13.697775 eth1  In  IP 10.0.29.3.47824 > 10.0.29.2.3784: BFDv1, Control, State Up, Flags: [none], length: 24
 00:00:13.708117 eth1  Out IP 10.0.29.2.48429 > 10.0.29.3.3784: BFDv1, Control, State Up, Flags: [none], length: 24
 00:00:13.783593 eth1  In  IP 10.0.29.3.47824 > 10.0.29.2.3784: BFDv1, Control, State Up, Flags: [none], length: 24
 00:00:13.783778 eth1  Out IP 10.0.29.2.48429 > 10.0.29.3.3784: BFDv1, Control, State Up, Flags: [none], length: 24
 00:00:13.864065 eth1  Out IP 10.0.29.2.48429 > 10.0.29.3.3784: BFDv1, Control, State Up, Flags: [none], length: 24
 00:00:13.868439 eth1  In  IP 10.0.29.3.47824 > 10.0.29.2.3784: BFDv1, Control, State Up, Flags: [none], length: 24
 00:00:13.945386 eth1  In  IP 10.0.29.3.47824 > 10.0.29.2.3784: BFDv1, Control, State Up, Flags: [none], length: 24
 00:00:13.951741 eth1  Out IP 10.0.29.2.48429 > 10.0.29.3.3784: BFDv1, Control, State Up, Flags: [none], length: 24
 00:00:14.033681 eth1  In  IP 10.0.29.3.47824 > 10.0.29.2.3784: BFDv1, Control, State Up, Flags: [none], length: 24
 00:00:14.039103 eth1  Out IP 10.0.29.2.48429 > 10.0.29.3.3784: BFDv1, Control, State Up, Flags: [none], length: 24
 00:00:14.117631 eth1  In  IP 10.0.29.3.47824 > 10.0.29.2.3784: BFDv1, Control, State Up, Flags: [none], length: 24
 00:00:14.126998 eth1  Out IP 10.0.29.2.48429 > 10.0.29.3.3784: BFDv1, Control, State Up, Flags: [none], length: 24
 00:00:14.200669 eth1  In  IP 10.0.29.3.47824 > 10.0.29.2.3784: BFDv1, Control, State Up, Flags: [none], length: 24
 00:00:14.205105 eth1  Out IP 10.0.29.2.48429 > 10.0.29.3.3784: BFDv1, Control, State Up, Flags: [none], length: 24
 00:00:14.288284 eth1  In  IP 10.0.29.3.47824 > 10.0.29.2.3784: BFDv1, Control, State Up, Flags: [none], length: 24
 00:00:14.288541 eth1  Out IP 10.0.29.2.48429 > 10.0.29.3.3784: BFDv1, Control, State Up, Flags: [none], length: 24
 00:00:14.369074 eth1  Out IP 10.0.29.2.48429 > 10.0.29.3.3784: BFDv1, Control, State Up, Flags: [none], length: 24
 00:00:14.372421 eth1  In  IP 10.0.29.3.47824 > 10.0.29.2.3784: BFDv1, Control, State Up, Flags: [none], length: 24
 00:00:14.448610 eth1  In  IP 10.0.29.3.47824 > 10.0.29.2.3784: BFDv1, Control, State Up, Flags: [none], length: 24
 00:00:14.452957 eth1  Out IP 10.0.29.2.48429 > 10.0.29.3.3784: BFDv1, Control, State Up, Flags: [none], length: 24
 00:00:14.531752 eth1  In  IP 10.0.29.3.47824 > 10.0.29.2.3784: BFDv1, Control, State Up, Flags: [none], length: 24
 00:00:14.541066 eth1  Out IP 10.0.29.2.48429 > 10.0.29.3.3784: BFDv1, Control, State Up, Flags: [none], length: 24
 00:00:14.610514 eth1  In  IP 10.0.29.3.47824 > 10.0.29.2.3784: BFDv1, Control, State Up, Flags: [none], length: 24
 00:00:14.623896 eth1  Out IP 10.0.29.2.48429 > 10.0.29.3.3784: BFDv1, Control, State Up, Flags: [none], length: 24
 00:00:14.685181 eth1  In  IP 10.0.29.3.47824 > 10.0.29.2.3784: BFDv1, Control, State Up, Flags: [none], length: 24
 00:00:14.706577 eth1  Out IP 10.0.29.2.48429 > 10.0.29.3.3784: BFDv1, Control, State Up, Flags: [none], length: 24
 00:00:14.765912 eth1  In  IP 10.0.29.3.47824 > 10.0.29.2.3784: BFDv1, Control, State Up, Flags: [none], length: 24
 00:00:14.793344 eth1  Out IP 10.0.29.2.48429 > 10.0.29.3.3784: BFDv1, Control, State Up, Flags: [none], length: 24
 00:00:14.846621 eth1  In  IP 10.0.29.3.47824 > 10.0.29.2.3784: BFDv1, Control, State Up, Flags: [none], length: 24
 00:00:14.882054 eth1  Out IP 10.0.29.2.48429 > 10.0.29.3.3784: BFDv1, Control, State Up, Flags: [none], length: 24
 00:00:14.928402 eth1  In  IP 10.0.29.3.47824 > 10.0.29.2.3784: BFDv1, Control, State Up, Flags: [none], length: 24
 00:00:14.958827 eth1  Out IP 10.0.29.2.48429 > 10.0.29.3.3784: BFDv1, Control, State Up, Flags: [none], length: 24
 00:00:14.996868 eth1  Out IP 10.0.29.2.58389 > 10.0.29.3.179: Flags [S], seq 3922181986, win 64240, options [mss 1460,sackOK,TS val 1875441113 ecr 0,nop,wscale 10], length 0
 00:00:14.996925 eth1  In  IP 10.0.29.3.179 > 10.0.29.2.58389: Flags [S.], seq 433066661, ack 3922181987, win 65160, options [mss 1460,sackOK,TS val 3828196087 ecr 1875441113,nop,wscale 10], length 0
 00:00:14.996948 eth1  Out IP 10.0.29.2.58389 > 10.0.29.3.179: Flags [.], ack 1, win 63, options [nop,nop,TS val 1875441113 ecr 3828196087], length 0
 00:00:14.997021 eth1  Out IP 10.0.29.2.58389 > 10.0.29.3.179: Flags [P.], seq 1:65, ack 1, win 63, options [nop,nop,TS val 1875441113 ecr 3828196087], length 64: BGP
 00:00:14.997031 eth1  In  IP 10.0.29.3.179 > 10.0.29.2.58389: Flags [.], ack 65, win 64, options [nop,nop,TS val 3828196087 ecr 1875441113], length 0
 00:00:14.997087 eth1  In  IP 10.0.29.3.179 > 10.0.29.2.58389: Flags [R.], seq 1, ack 65, win 64, options [nop,nop,TS val 3828196087 ecr 1875441113], length 0
 00:00:15.003118 eth1  In  IP 10.0.29.3.47824 > 10.0.29.2.3784: BFDv1, Control, State Up, Flags: [none], length: 24
 00:00:15.036479 eth1  Out IP 10.0.29.2.48429 > 10.0.29.3.3784: BFDv1, Control, State Up, Flags: [none], length: 24
 00:00:15.085760 eth1  In  IP 10.0.29.3.47824 > 10.0.29.2.3784: BFDv1, Control, State Up, Flags: [none], length: 24
 00:00:15.125129 eth1  Out IP 10.0.29.2.48429 > 10.0.29.3.3784: BFDv1, Control, State Up, Flags: [none], length: 24
 00:00:15.171405 eth1  In  IP 10.0.29.3.47824 > 10.0.29.2.3784: BFDv1, Control, State Up, Flags: [none], length: 24
 00:00:15.182351 eth1  Out IP 10.0.29.2.52231 > 10.0.29.3.179: Flags [FP.], seq 3626044973:3626044994, ack 1639878298, win 63, options [nop,nop,TS val 1875441299 ecr 3828133040], length 21: BGP
 00:00:15.182454 eth1  In  IP 10.0.29.3.179 > 10.0.29.2.52231: Flags [R], seq 1639878298, win 0, length 0
 00:00:15.200809 eth1  Out IP 10.0.29.2.48429 > 10.0.29.3.3784: BFDv1, Control, State Up, Flags: [none], length: 24
 00:00:15.248098 eth1  In  IP 10.0.29.3.47824 > 10.0.29.2.3784: BFDv1, Control, State Up, Flags: [none], length: 24
 00:00:15.280488 eth1  Out IP 10.0.29.2.48429 > 10.0.29.3.3784: BFDv1, Control, State Up, Flags: [none], length: 24
 00:00:15.326705 eth1  In  IP 10.0.29.3.47824 > 10.0.29.2.3784: BFDv1, Control, State Up, Flags: [none], length: 24
 00:00:15.362092 eth1  Out IP 10.0.29.2.48429 > 10.0.29.3.3784: BFDv1, Control, State Up, Flags: [none], length: 24
 00:00:15.404972 eth1  In  IP 10.0.29.3.47824 > 10.0.29.2.3784: BFDv1, Control, State Up, Flags: [none], length: 24
 00:00:15.451383 eth1  Out IP 10.0.29.2.48429 > 10.0.29.3.3784: BFDv1, Control, State Up, Flags: [none], length: 24
 00:00:15.494762 eth1  In  IP 10.0.29.3.47824 > 10.0.29.2.3784: BFDv1, Control, State Up, Flags: [none], length: 24
 00:00:15.536177 eth1  Out IP 10.0.29.2.48429 > 10.0.29.3.3784: BFDv1, Control, State Up, Flags: [none], length: 24
 00:00:15.582475 eth1  In  IP 10.0.29.3.47824 > 10.0.29.2.3784: BFDv1, Control, State Up, Flags: [none], length: 24
 00:00:15.619772 eth1  Out IP 10.0.29.2.48429 > 10.0.29.3.3784: BFDv1, Control, State Up, Flags: [none], length: 24
 00:00:15.668036 eth1  In  IP 10.0.29.3.47824 > 10.0.29.2.3784: BFDv1, Control, State Up, Flags: [none], length: 24
 00:00:15.699493 eth1  Out IP 10.0.29.2.48429 > 10.0.29.3.3784: BFDv1, Control, State Up, Flags: [none], length: 24
 00:00:15.748764 eth1  In  IP 10.0.29.3.47824 > 10.0.29.2.3784: BFDv1, Control, State Up, Flags: [none], length: 24
 00:00:15.786176 eth1  Out IP 10.0.29.2.48429 > 10.0.29.3.3784: BFDv1, Control, State Up, Flags: [none], length: 24
 00:00:15.832508 eth1  In  IP 10.0.29.3.47824 > 10.0.29.2.3784: BFDv1, Control, State Up, Flags: [none], length: 24
 00:00:15.868960 eth1  Out IP 10.0.29.2.48429 > 10.0.29.3.3784: BFDv1, Control, State Up, Flags: [none], length: 24
 00:00:15.913363 eth1  In  IP 10.0.29.3.47824 > 10.0.29.2.3784: BFDv1, Control, State Up, Flags: [none], length: 24
 00:00:15.956843 eth1  Out IP 10.0.29.2.48429 > 10.0.29.3.3784: BFDv1, Control, State Up, Flags: [none], length: 24
 00:00:16.001207 eth1  In  IP 10.0.29.3.47824 > 10.0.29.2.3784: BFDv1, Control, State Up, Flags: [none], length: 24
 00:00:16.033640 eth1  Out IP 10.0.29.2.48429 > 10.0.29.3.3784: BFDv1, Control, State Up, Flags: [none], length: 24
 00:00:16.090528 eth1  In  IP 10.0.29.3.47824 > 10.0.29.2.3784: BFDv1, Control, State Up, Flags: [none], length: 24
 00:00:16.116961 eth1  Out IP 10.0.29.2.48429 > 10.0.29.3.3784: BFDv1, Control, State Up, Flags: [none], length: 24
 00:00:16.171278 eth1  In  IP 10.0.29.3.47824 > 10.0.29.2.3784: BFDv1, Control, State Up, Flags: [none], length: 24
 00:00:16.193641 eth1  Out IP 10.0.29.2.48429 > 10.0.29.3.3784: BFDv1, Control, State Up, Flags: [none], length: 24
 00:00:16.259225 eth1  In  IP 10.0.29.3.47824 > 10.0.29.2.3784: BFDv1, Control, State Up, Flags: [none], length: 24
 00:00:16.268591 eth1  Out IP 10.0.29.2.48429 > 10.0.29.3.3784: BFDv1, Control, State Up, Flags: [none], length: 24
 00:00:16.338731 eth1  In  IP 10.0.29.3.47824 > 10.0.29.2.3784: BFDv1, Control, State Up, Flags: [none], length: 24
 00:00:16.350120 eth1  Out IP 10.0.29.2.48429 > 10.0.29.3.3784: BFDv1, Control, State Up, Flags: [none], length: 24
 00:00:16.417061 eth1  In  IP 10.0.29.3.47824 > 10.0.29.2.3784: BFDv1, Control, State Up, Flags: [none], length: 24
 00:00:16.438558 eth1  Out IP 10.0.29.2.48429 > 10.0.29.3.3784: BFDv1, Control, State Up, Flags: [none], length: 24
 00:00:16.507415 eth1  In  IP 10.0.29.3.47824 > 10.0.29.2.3784: BFDv1, Control, State Up, Flags: [none], length: 24
 00:00:16.516754 eth1  Out IP 10.0.29.2.48429 > 10.0.29.3.3784: BFDv1, Control, State Up, Flags: [none], length: 24
 00:00:16.592346 eth1  In  IP 10.0.29.3.47824 > 10.0.29.2.3784: BFDv1, Control, State Up, Flags: [none], length: 24
 00:00:16.606773 eth1  Out IP 10.0.29.2.48429 > 10.0.29.3.3784: BFDv1, Control, State Up, Flags: [none], length: 24
 00:00:16.677109 eth1  In  IP 10.0.29.3.47824 > 10.0.29.2.3784: BFDv1, Control, State Up, Flags: [none], length: 24
 00:00:16.685491 eth1  Out IP 10.0.29.2.48429 > 10.0.29.3.3784: BFDv1, Control, State Up, Flags: [none], length: 24
 00:00:16.760627 eth1  In  IP 10.0.29.3.47824 > 10.0.29.2.3784: BFDv1, Control, State Up, Flags: [none], length: 24
 00:00:16.772008 eth1  Out IP 10.0.29.2.48429 > 10.0.29.3.3784: BFDv1, Control, State Up, Flags: [none], length: 24
 00:00:16.846094 eth1  In  IP 10.0.29.3.47824 > 10.0.29.2.3784: BFDv1, Control, State Up, Flags: [none], length: 24
 00:00:16.859470 eth1  Out IP 10.0.29.2.48429 > 10.0.29.3.3784: BFDv1, Control, State Up, Flags: [none], length: 24
 00:00:16.933600 eth1  In  IP 10.0.29.3.47824 > 10.0.29.2.3784: BFDv1, Control, State Up, Flags: [none], length: 24
 00:00:16.946941 eth1  Out IP 10.0.29.2.48429 > 10.0.29.3.3784: BFDv1, Control, State Up, Flags: [none], length: 24
 00:00:17.011075 eth1  In  IP 10.0.29.3.47824 > 10.0.29.2.3784: BFDv1, Control, State Up, Flags: [none], length: 24
 00:00:17.024468 eth1  Out IP 10.0.29.2.48429 > 10.0.29.3.3784: BFDv1, Control, State Up, Flags: [none], length: 24
 00:00:17.091391 eth1  In  IP 10.0.29.3.47824 > 10.0.29.2.3784: BFDv1, Control, State Up, Flags: [none], length: 24
 00:00:17.108743 eth1  Out IP 10.0.29.2.48429 > 10.0.29.3.3784: BFDv1, Control, State Up, Flags: [none], length: 24
 00:00:17.166916 eth1  In  IP 10.0.29.3.47824 > 10.0.29.2.3784: BFDv1, Control, State Up, Flags: [none], length: 24
 00:00:17.194276 eth1  Out IP 10.0.29.2.48429 > 10.0.29.3.3784: BFDv1, Control, State Up, Flags: [none], length: 24
 00:00:17.252602 eth1  In  IP 10.0.29.3.47824 > 10.0.29.2.3784: BFDv1, Control, State Up, Flags: [none], length: 24
 00:00:17.274048 eth1  Out IP 10.0.29.2.48429 > 10.0.29.3.3784: BFDv1, Control, State Up, Flags: [none], length: 24
 00:00:17.342227 eth1  In  IP 10.0.29.3.47824 > 10.0.29.2.3784: BFDv1, Control, State Up, Flags: [none], length: 24
 00:00:17.361644 eth1  Out IP 10.0.29.2.48429 > 10.0.29.3.3784: BFDv1, Control, State Up, Flags: [none], length: 24
 00:00:17.417950 eth1  In  IP 10.0.29.3.47824 > 10.0.29.2.3784: BFDv1, Control, State Up, Flags: [none], length: 24
 00:00:17.447350 eth1  Out IP 10.0.29.2.48429 > 10.0.29.3.3784: BFDv1, Control, State Up, Flags: [none], length: 24
 00:00:17.508556 eth1  In  IP 10.0.29.3.47824 > 10.0.29.2.3784: BFDv1, Control, State Up, Flags: [none], length: 24
 00:00:17.526083 eth1  Out IP 10.0.29.2.48429 > 10.0.29.3.3784: BFDv1, Control, State Up, Flags: [none], length: 24
 00:00:17.594250 eth1  In  IP 10.0.29.3.47824 > 10.0.29.2.3784: BFDv1, Control, State Up, Flags: [none], length: 24
 00:00:17.614614 eth1  Out IP 10.0.29.2.48429 > 10.0.29.3.3784: BFDv1, Control, State Up, Flags: [none], length: 24
 00:00:17.672015 eth1  In  IP 10.0.29.3.47824 > 10.0.29.2.3784: BFDv1, Control, State Up, Flags: [none], length: 24
 00:00:17.699410 eth1  Out IP 10.0.29.2.48429 > 10.0.29.3.3784: BFDv1, Control, State Up, Flags: [none], length: 24
 00:00:17.756788 eth1  In  IP 10.0.29.3.47824 > 10.0.29.2.3784: BFDv1, Control, State Up, Flags: [none], length: 24
 00:00:17.778230 eth1  Out IP 10.0.29.2.48429 > 10.0.29.3.3784: BFDv1, Control, State Up, Flags: [none], length: 24
 00:00:17.841510 eth1  In  IP 10.0.29.3.47824 > 10.0.29.2.3784: BFDv1, Control, State Up, Flags: [none], length: 24
 00:00:17.856916 eth1  Out IP 10.0.29.2.48429 > 10.0.29.3.3784: BFDv1, Control, State Up, Flags: [none], length: 24
 00:00:17.920212 eth1  In  IP 10.0.29.3.47824 > 10.0.29.2.3784: BFDv1, Control, State Up, Flags: [none], length: 24
 00:00:17.932598 eth1  Out IP 10.0.29.2.48429 > 10.0.29.3.3784: BFDv1, Control, State Up, Flags: [none], length: 24
 00:00:18.002096 eth1  In  IP 10.0.29.3.47824 > 10.0.29.2.3784: BFDv1, Control, State Up, Flags: [none], length: 24
 00:00:18.010422 eth1  Out IP 10.0.29.2.48429 > 10.0.29.3.3784: BFDv1, Control, State Up, Flags: [none], length: 24
 00:00:18.085385 eth1  In  IP 10.0.29.3.47824 > 10.0.29.2.3784: BFDv1, Control, State Up, Flags: [none], length: 24
 00:00:18.097791 eth1  Out IP 10.0.29.2.48429 > 10.0.29.3.3784: BFDv1, Control, State Up, Flags: [none], length: 24
 00:00:18.171155 eth1  In  IP 10.0.29.3.47824 > 10.0.29.2.3784: BFDv1, Control, State Up, Flags: [none], length: 24
 00:00:18.182581 eth1  Out IP 10.0.29.2.48429 > 10.0.29.3.3784: BFDv1, Control, State Up, Flags: [none], length: 24
 00:00:18.254693 eth1  In  IP 10.0.29.3.47824 > 10.0.29.2.3784: BFDv1, Control, State Up, Flags: [none], length: 24
 00:00:18.264038 eth1  Out IP 10.0.29.2.48429 > 10.0.29.3.3784: BFDv1, Control, State Up, Flags: [none], length: 24
 00:00:18.333966 eth1  In  IP 10.0.29.3.47824 > 10.0.29.2.3784: BFDv1, Control, State Up, Flags: [none], length: 24
 00:00:18.348382 eth1  Out IP 10.0.29.2.48429 > 10.0.29.3.3784: BFDv1, Control, State Up, Flags: [none], length: 24
 00:00:18.421671 eth1  In  IP 10.0.29.3.47824 > 10.0.29.2.3784: BFDv1, Control, State Up, Flags: [none], length: 24
 00:00:18.426007 eth1  Out IP 10.0.29.2.48429 > 10.0.29.3.3784: BFDv1, Control, State Up, Flags: [none], length: 24
 00:00:18.504312 eth1  Out IP 10.0.29.2.48429 > 10.0.29.3.3784: BFDv1, Control, State Up, Flags: [none], length: 24
 00:00:18.505532 eth1  In  IP 10.0.29.3.47824 > 10.0.29.2.3784: BFDv1, Control, State Up, Flags: [none], length: 24
 00:00:18.589190 eth1  In  IP 10.0.29.3.47824 > 10.0.29.2.3784: BFDv1, Control, State Up, Flags: [none], length: 24
 00:00:18.590684 eth1  Out IP 10.0.29.2.48429 > 10.0.29.3.3784: BFDv1, Control, State Up, Flags: [none], length: 24
 00:00:18.668387 eth1  In  IP 10.0.29.3.47824 > 10.0.29.2.3784: BFDv1, Control, State Up, Flags: [none], length: 24
 00:00:18.675810 eth1  Out IP 10.0.29.2.48429 > 10.0.29.3.3784: BFDv1, Control, State Up, Flags: [none], length: 24
 00:00:18.756115 eth1  Out IP 10.0.29.2.48429 > 10.0.29.3.3784: BFDv1, Control, State Up, Flags: [none], length: 24
 00:00:18.756248 eth1  In  IP 10.0.29.3.47824 > 10.0.29.2.3784: BFDv1, Control, State Up, Flags: [none], length: 24
 00:00:18.841221 eth1  In  IP 10.0.29.3.47824 > 10.0.29.2.3784: BFDv1, Control, State Up, Flags: [none], length: 24
 00:00:18.842551 eth1  Out IP 10.0.29.2.48429 > 10.0.29.3.3784: BFDv1, Control, State Up, Flags: [none], length: 24
 00:00:18.918860 eth1  Out IP 10.0.29.2.48429 > 10.0.29.3.3784: BFDv1, Control, State Up, Flags: [none], length: 24
 00:00:18.926344 eth1  In  IP 10.0.29.3.47824 > 10.0.29.2.3784: BFDv1, Control, State Up, Flags: [none], length: 24
 00:00:18.997693 eth1  Out IP 10.0.29.2.48429 > 10.0.29.3.3784: BFDv1, Control, State Up, Flags: [none], length: 24
 00:00:19.005214 eth1  In  IP 10.0.29.3.47824 > 10.0.29.2.3784: BFDv1, Control, State Up, Flags: [none], length: 24
 00:00:19.086662 eth1  Out IP 10.0.29.2.48429 > 10.0.29.3.3784: BFDv1, Control, State Up, Flags: [none], length: 24
 00:00:19.094043 eth1  In  IP 10.0.29.3.47824 > 10.0.29.2.3784: BFDv1, Control, State Up, Flags: [none], length: 24
 00:00:19.162428 eth1  Out IP 10.0.29.2.48429 > 10.0.29.3.3784: BFDv1, Control, State Up, Flags: [none], length: 24
 00:00:19.182802 eth1  In  IP 10.0.29.3.47824 > 10.0.29.2.3784: BFDv1, Control, State Up, Flags: [none], length: 24
 00:00:19.245191 eth1  Out IP 10.0.29.2.48429 > 10.0.29.3.3784: BFDv1, Control, State Up, Flags: [none], length: 24
 00:00:19.259603 eth1  In  IP 10.0.29.3.47824 > 10.0.29.2.3784: BFDv1, Control, State Up, Flags: [none], length: 24
 00:00:19.329909 eth1  Out IP 10.0.29.2.48429 > 10.0.29.3.3784: BFDv1, Control, State Up, Flags: [none], length: 24
 00:00:19.335159 eth1  In  IP 10.0.29.3.47824 > 10.0.29.2.3784: BFDv1, Control, State Up, Flags: [none], length: 24
 00:00:19.418693 eth1  Out IP 10.0.29.2.48429 > 10.0.29.3.3784: BFDv1, Control, State Up, Flags: [none], length: 24
 00:00:19.419982 eth1  In  IP 10.0.29.3.47824 > 10.0.29.2.3784: BFDv1, Control, State Up, Flags: [none], length: 24
 00:00:19.494040 eth1  Out IP 10.0.29.2.58309 > 10.0.29.3.179: Flags [S], seq 519376742, win 64240, options [mss 1460,sackOK,TS val 1875445610 ecr 0,nop,wscale 10], length 0
 00:00:19.494116 eth1  In  IP 10.0.29.3.179 > 10.0.29.2.58309: Flags [S.], seq 580435107, ack 519376743, win 65160, options [mss 1460,sackOK,TS val 3828200584 ecr 1875445610,nop,wscale 10], length 0
 00:00:19.494146 eth1  Out IP 10.0.29.2.58309 > 10.0.29.3.179: Flags [.], ack 1, win 63, options [nop,nop,TS val 1875445610 ecr 3828200584], length 0
 00:00:19.494318 eth1  Out IP 10.0.29.2.58309 > 10.0.29.3.179: Flags [P.], seq 1:65, ack 1, win 63, options [nop,nop,TS val 1875445611 ecr 3828200584], length 64: BGP
 00:00:19.494344 eth1  In  IP 10.0.29.3.179 > 10.0.29.2.58309: Flags [.], ack 65, win 64, options [nop,nop,TS val 3828200585 ecr 1875445611], length 0
 00:00:19.494367 eth1  In  IP 10.0.29.3.179 > 10.0.29.2.58309: Flags [R.], seq 1, ack 65, win 64, options [nop,nop,TS val 3828200585 ecr 1875445611], length 0
 00:00:19.498376 eth1  Out IP 10.0.29.2.48429 > 10.0.29.3.3784: BFDv1, Control, State Up, Flags: [none], length: 24
 00:00:19.505605 eth1  In  IP 10.0.29.3.47824 > 10.0.29.2.3784: BFDv1, Control, State Up, Flags: [none], length: 24
 00:00:19.576029 eth1  Out IP 10.0.29.2.48429 > 10.0.29.3.3784: BFDv1, Control, State Up, Flags: [none], length: 24
 00:00:19.583283 eth1  In  IP 10.0.29.3.47824 > 10.0.29.2.3784: BFDv1, Control, State Up, Flags: [none], length: 24
 00:00:19.654588 eth1  Out IP 10.0.29.2.48429 > 10.0.29.3.3784: BFDv1, Control, State Up, Flags: [none], length: 24
 00:00:19.661870 eth1  In  IP 10.0.29.3.47824 > 10.0.29.2.3784: BFDv1, Control, State Up, Flags: [none], length: 24
 00:00:19.739314 eth1  Out IP 10.0.29.2.48429 > 10.0.29.3.3784: BFDv1, Control, State Up, Flags: [none], length: 24
 00:00:19.741589 eth1  In  IP 10.0.29.3.47824 > 10.0.29.2.3784: BFDv1, Control, State Up, Flags: [none], length: 24
 00:00:19.821106 eth1  Out IP 10.0.29.2.48429 > 10.0.29.3.3784: BFDv1, Control, State Up, Flags: [none], length: 24
 00:00:19.826584 eth1  In  IP 10.0.29.3.47824 > 10.0.29.2.3784: BFDv1, Control, State Up, Flags: [none], length: 24
 00:00:19.899053 eth1  Out IP 10.0.29.2.48429 > 10.0.29.3.3784: BFDv1, Control, State Up, Flags: [none], length: 24
 00:00:19.906452 eth1  In  IP 10.0.29.3.47824 > 10.0.29.2.3784: BFDv1, Control, State Up, Flags: [none], length: 24
 00:00:19.977834 eth1  Out IP 10.0.29.2.48429 > 10.0.29.3.3784: BFDv1, Control, State Up, Flags: [none], length: 24
 00:00:19.988159 eth1  In  IP 10.0.29.3.47824 > 10.0.29.2.3784: BFDv1, Control, State Up, Flags: [none], length: 24
 00:00:20.063717 eth1  Out IP 10.0.29.2.48429 > 10.0.29.3.3784: BFDv1, Control, State Up, Flags: [none], length: 24
 00:00:20.064665 eth1  In  IP 10.0.29.3.47824 > 10.0.29.2.3784: BFDv1, Control, State Up, Flags: [none], length: 24
 00:00:20.143063 eth1  Out IP 10.0.29.2.48429 > 10.0.29.3.3784: BFDv1, Control, State Up, Flags: [none], length: 24
 00:00:20.152199 eth1  In  IP 10.0.29.3.47824 > 10.0.29.2.3784: BFDv1, Control, State Up, Flags: [none], length: 24
 00:00:20.225089 eth1  Out IP 10.0.29.2.48429 > 10.0.29.3.3784: BFDv1, Control, State Up, Flags: [none], length: 24
 00:00:20.235857 eth1  In  IP 10.0.29.3.47824 > 10.0.29.2.3784: BFDv1, Control, State Up, Flags: [none], length: 24
 00:00:20.311666 eth1  In  IP 10.0.29.3.47824 > 10.0.29.2.3784: BFDv1, Control, State Up, Flags: [none], length: 24
 00:00:20.311877 eth1  Out IP 10.0.29.2.48429 > 10.0.29.3.3784: BFDv1, Control, State Up, Flags: [none], length: 24
 00:00:20.387332 eth1  In  IP 10.0.29.3.47824 > 10.0.29.2.3784: BFDv1, Control, State Up, Flags: [none], length: 24
 00:00:20.389688 eth1  Out IP 10.0.29.2.48429 > 10.0.29.3.3784: BFDv1, Control, State Up, Flags: [none], length: 24
 00:00:20.463187 eth1  In  IP 10.0.29.3.47824 > 10.0.29.2.3784: BFDv1, Control, State Up, Flags: [none], length: 24
 00:00:20.479629 eth1  Out IP 10.0.29.2.48429 > 10.0.29.3.3784: BFDv1, Control, State Up, Flags: [none], length: 24
 00:00:20.550408 eth1  In  IP 10.0.29.3.47824 > 10.0.29.2.3784: BFDv1, Control, State Up, Flags: [none], length: 24
 00:00:20.559009 eth1  Out IP 10.0.29.2.48429 > 10.0.29.3.3784: BFDv1, Control, State Up, Flags: [none], length: 24
 00:00:20.629584 eth1  In  IP 10.0.29.3.47824 > 10.0.29.2.3784: BFDv1, Control, State Up, Flags: [none], length: 24
 00:00:20.646452 eth1  Out IP 10.0.29.2.48429 > 10.0.29.3.3784: BFDv1, Control, State Up, Flags: [none], length: 24
 00:00:20.715914 eth1  In  IP 10.0.29.3.47824 > 10.0.29.2.3784: BFDv1, Control, State Up, Flags: [none], length: 24
 00:00:20.722334 eth1  Out IP 10.0.29.2.48429 > 10.0.29.3.3784: BFDv1, Control, State Up, Flags: [none], length: 24
 00:00:20.797117 eth1  In  IP 10.0.29.3.47824 > 10.0.29.2.3784: BFDv1, Control, State Up, Flags: [none], length: 24
 00:00:20.804614 eth1  Out IP 10.0.29.2.48429 > 10.0.29.3.3784: BFDv1, Control, State Up, Flags: [none], length: 24
 00:00:20.877529 eth1  In  IP 10.0.29.3.47824 > 10.0.29.2.3784: BFDv1, Control, State Up, Flags: [none], length: 24
 00:00:20.887881 eth1  Out IP 10.0.29.2.48429 > 10.0.29.3.3784: BFDv1, Control, State Up, Flags: [none], length: 24
 00:00:20.953410 eth1  In  IP 10.0.29.3.47824 > 10.0.29.2.3784: BFDv1, Control, State Up, Flags: [none], length: 24
 00:00:20.973947 eth1  Out IP 10.0.29.2.48429 > 10.0.29.3.3784: BFDv1, Control, State Up, Flags: [none], length: 24
 00:00:21.033592 eth1  In  IP 10.0.29.3.47824 > 10.0.29.2.3784: BFDv1, Control, State Up, Flags: [none], length: 24
 00:00:21.062000 eth1  Out IP 10.0.29.2.48429 > 10.0.29.3.3784: BFDv1, Control, State Up, Flags: [none], length: 24
 00:00:21.117147 eth1  In  IP 10.0.29.3.47824 > 10.0.29.2.3784: BFDv1, Control, State Up, Flags: [none], length: 24
 00:00:21.140751 eth1  Out IP 10.0.29.2.48429 > 10.0.29.3.3784: BFDv1, Control, State Up, Flags: [none], length: 24
 00:00:21.201949 eth1  In  IP 10.0.29.3.47824 > 10.0.29.2.3784: BFDv1, Control, State Up, Flags: [none], length: 24
 00:00:21.228304 eth1  Out IP 10.0.29.2.48429 > 10.0.29.3.3784: BFDv1, Control, State Up, Flags: [none], length: 24
 00:00:21.288563 eth1  In  IP 10.0.29.3.47824 > 10.0.29.2.3784: BFDv1, Control, State Up, Flags: [none], length: 24
 00:00:21.305055 eth1  Out IP 10.0.29.2.48429 > 10.0.29.3.3784: BFDv1, Control, State Up, Flags: [none], length: 24
 00:00:21.375323 eth1  In  IP 10.0.29.3.47824 > 10.0.29.2.3784: BFDv1, Control, State Up, Flags: [none], length: 24
 00:00:21.382738 eth1  Out IP 10.0.29.2.48429 > 10.0.29.3.3784: BFDv1, Control, State Up, Flags: [none], length: 24
 00:00:21.458586 eth1  In  IP 10.0.29.3.47824 > 10.0.29.2.3784: BFDv1, Control, State Up, Flags: [none], length: 24
 00:00:21.470985 eth1  Out IP 10.0.29.2.48429 > 10.0.29.3.3784: BFDv1, Control, State Up, Flags: [none], length: 24
 00:00:21.539854 eth1  In  IP 10.0.29.3.47824 > 10.0.29.2.3784: BFDv1, Control, State Up, Flags: [none], length: 24
 00:00:21.555160 eth1  Out IP 10.0.29.2.48429 > 10.0.29.3.3784: BFDv1, Control, State Up, Flags: [none], length: 24
 00:00:21.622656 eth1  In  IP 10.0.29.3.47824 > 10.0.29.2.3784: BFDv1, Control, State Up, Flags: [none], length: 24
 00:00:21.642028 eth1  Out IP 10.0.29.2.48429 > 10.0.29.3.3784: BFDv1, Control, State Up, Flags: [none], length: 24
 00:00:21.709315 eth1  In  IP 10.0.29.3.47824 > 10.0.29.2.3784: BFDv1, Control, State Up, Flags: [none], length: 24
 00:00:21.728674 eth1  Out IP 10.0.29.2.48429 > 10.0.29.3.3784: BFDv1, Control, State Up, Flags: [none], length: 24
 00:00:21.793859 eth1  In  IP 10.0.29.3.47824 > 10.0.29.2.3784: BFDv1, Control, State Up, Flags: [none], length: 24
 00:00:21.816496 eth1  Out IP 10.0.29.2.48429 > 10.0.29.3.3784: BFDv1, Control, State Up, Flags: [none], length: 24
 00:00:21.868849 eth1  In  IP 10.0.29.3.47824 > 10.0.29.2.3784: BFDv1, Control, State Up, Flags: [none], length: 24
 00:00:21.902320 eth1  Out IP 10.0.29.2.48429 > 10.0.29.3.3784: BFDv1, Control, State Up, Flags: [none], length: 24
 00:00:21.947535 eth1  In  IP 10.0.29.3.47824 > 10.0.29.2.3784: BFDv1, Control, State Up, Flags: [none], length: 24
 00:00:21.979842 eth1  Out IP 10.0.29.2.48429 > 10.0.29.3.3784: BFDv1, Control, State Up, Flags: [none], length: 24
 00:00:22.027353 eth1  In  IP 10.0.29.3.47824 > 10.0.29.2.3784: BFDv1, Control, State Up, Flags: [none], length: 24
 00:00:22.067769 eth1  Out IP 10.0.29.2.48429 > 10.0.29.3.3784: BFDv1, Control, State Up, Flags: [none], length: 24
 00:00:22.115096 eth1  In  IP 10.0.29.3.47824 > 10.0.29.2.3784: BFDv1, Control, State Up, Flags: [none], length: 24
 00:00:22.155609 eth1  Out IP 10.0.29.2.48429 > 10.0.29.3.3784: BFDv1, Control, State Up, Flags: [none], length: 24
 00:00:22.198094 eth1  In  IP 10.0.29.3.47824 > 10.0.29.2.3784: BFDv1, Control, State Up, Flags: [none], length: 24
 00:00:22.236560 eth1  Out IP 10.0.29.2.48429 > 10.0.29.3.3784: BFDv1, Control, State Up, Flags: [none], length: 24
 00:00:22.277946 eth1  In  IP 10.0.29.3.47824 > 10.0.29.2.3784: BFDv1, Control, State Up, Flags: [none], length: 24
 00:00:22.319509 eth1  Out IP 10.0.29.2.48429 > 10.0.29.3.3784: BFDv1, Control, State Up, Flags: [none], length: 24
 00:00:22.364973 eth1  In  IP 10.0.29.3.47824 > 10.0.29.2.3784: BFDv1, Control, State Up, Flags: [none], length: 24
 00:00:22.398368 eth1  Out IP 10.0.29.2.48429 > 10.0.29.3.3784: BFDv1, Control, State Up, Flags: [none], length: 24
 00:00:22.450683 eth1  In  IP 10.0.29.3.47824 > 10.0.29.2.3784: BFDv1, Control, State Up, Flags: [none], length: 24
 00:00:22.482041 eth1  Out IP 10.0.29.2.48429 > 10.0.29.3.3784: BFDv1, Control, State Up, Flags: [none], length: 24
 00:00:22.534387 eth1  In  IP 10.0.29.3.47824 > 10.0.29.2.3784: BFDv1, Control, State Up, Flags: [none], length: 24
 00:00:22.568781 eth1  Out IP 10.0.29.2.48429 > 10.0.29.3.3784: BFDv1, Control, State Up, Flags: [none], length: 24
 00:00:22.612030 eth1  In  IP 10.0.29.3.47824 > 10.0.29.2.3784: BFDv1, Control, State Up, Flags: [none], length: 24
 00:00:22.658420 eth1  Out IP 10.0.29.2.48429 > 10.0.29.3.3784: BFDv1, Control, State Up, Flags: [none], length: 24
 00:00:22.695705 eth1  In  IP 10.0.29.3.47824 > 10.0.29.2.3784: BFDv1, Control, State Up, Flags: [none], length: 24
 00:00:22.746188 eth1  Out IP 10.0.29.2.48429 > 10.0.29.3.3784: BFDv1, Control, State Up, Flags: [none], length: 24
 00:00:22.783335 eth1  In  IP 10.0.29.3.47824 > 10.0.29.2.3784: BFDv1, Control, State Up, Flags: [none], length: 24
 00:00:22.823626 eth1  Out IP 10.0.29.2.48429 > 10.0.29.3.3784: BFDv1, Control, State Up, Flags: [none], length: 24
 00:00:22.865322 eth1  In  IP 10.0.29.3.47824 > 10.0.29.2.3784: BFDv1, Control, State Up, Flags: [none], length: 24
 00:00:22.910752 eth1  Out IP 10.0.29.2.48429 > 10.0.29.3.3784: BFDv1, Control, State Up, Flags: [none], length: 24
 00:00:22.948075 eth1  In  IP 10.0.29.3.47824 > 10.0.29.2.3784: BFDv1, Control, State Up, Flags: [none], length: 24
 00:00:22.986495 eth1  Out IP 10.0.29.2.48429 > 10.0.29.3.3784: BFDv1, Control, State Up, Flags: [none], length: 24
 00:00:23.030880 eth1  In  IP 10.0.29.3.47824 > 10.0.29.2.3784: BFDv1, Control, State Up, Flags: [none], length: 24
 00:00:23.063342 eth1  Out IP 10.0.29.2.48429 > 10.0.29.3.3784: BFDv1, Control, State Up, Flags: [none], length: 24
 00:00:23.114514 eth1  In  IP 10.0.29.3.47824 > 10.0.29.2.3784: BFDv1, Control, State Up, Flags: [none], length: 24
 00:00:23.139930 eth1  Out IP 10.0.29.2.48429 > 10.0.29.3.3784: BFDv1, Control, State Up, Flags: [none], length: 24
 00:00:23.194946 eth1  In  IP 10.0.29.3.47824 > 10.0.29.2.3784: BFDv1, Control, State Up, Flags: [none], length: 24
 00:00:23.227423 eth1  Out IP 10.0.29.2.48429 > 10.0.29.3.3784: BFDv1, Control, State Up, Flags: [none], length: 24
 00:00:23.271427 eth1  In  IP 10.0.29.3.47824 > 10.0.29.2.3784: BFDv1, Control, State Up, Flags: [none], length: 24
 00:00:23.304842 eth1  Out IP 10.0.29.2.48429 > 10.0.29.3.3784: BFDv1, Control, State Up, Flags: [none], length: 24
 00:00:23.358874 eth1  In  IP 10.0.29.3.47824 > 10.0.29.2.3784: BFDv1, Control, State Up, Flags: [none], length: 24
 00:00:23.388390 eth1  Out IP 10.0.29.2.48429 > 10.0.29.3.3784: BFDv1, Control, State Up, Flags: [none], length: 24
 00:00:23.434343 eth1  In  IP 10.0.29.3.47824 > 10.0.29.2.3784: BFDv1, Control, State Up, Flags: [none], length: 24
 00:00:23.468724 eth1  Out IP 10.0.29.2.48429 > 10.0.29.3.3784: BFDv1, Control, State Up, Flags: [none], length: 24
 00:00:23.518954 eth1  In  IP 10.0.29.3.47824 > 10.0.29.2.3784: BFDv1, Control, State Up, Flags: [none], length: 24
 00:00:23.557324 eth1  Out IP 10.0.29.2.48429 > 10.0.29.3.3784: BFDv1, Control, State Up, Flags: [none], length: 24
 00:00:23.593774 eth1  In  IP 10.0.29.3.47824 > 10.0.29.2.3784: BFDv1, Control, State Up, Flags: [none], length: 24
 00:00:23.638184 eth1  Out IP 10.0.29.2.48429 > 10.0.29.3.3784: BFDv1, Control, State Up, Flags: [none], length: 24
 00:00:23.683252 eth1  In  IP 10.0.29.3.47824 > 10.0.29.2.3784: BFDv1, Control, State Up, Flags: [none], length: 24
 00:00:23.722614 eth1  Out IP 10.0.29.2.48429 > 10.0.29.3.3784: BFDv1, Control, State Up, Flags: [none], length: 24
 00:00:23.760816 eth1  In  IP 10.0.29.3.47824 > 10.0.29.2.3784: BFDv1, Control, State Up, Flags: [none], length: 24
 00:00:23.809249 eth1  Out IP 10.0.29.2.48429 > 10.0.29.3.3784: BFDv1, Control, State Up, Flags: [none], length: 24
 00:00:23.844708 eth1  In  IP 10.0.29.3.47824 > 10.0.29.2.3784: BFDv1, Control, State Up, Flags: [none], length: 24
 00:00:23.858433 eth1  Out IP 10.0.29.2.42819 > 10.0.29.3.179: Flags [S], seq 1528926615, win 64240, options [mss 1460,sackOK,TS val 1875449975 ecr 0,nop,wscale 10], length 0
 00:00:23.858506 eth1  In  IP 10.0.29.3.179 > 10.0.29.2.42819: Flags [S.], seq 1396959436, ack 1528926616, win 65160, options [mss 1460,sackOK,TS val 3828204949 ecr 1875449975,nop,wscale 10], length 0
 00:00:23.858538 eth1  Out IP 10.0.29.2.42819 > 10.0.29.3.179: Flags [.], ack 1, win 63, options [nop,nop,TS val 1875449975 ecr 3828204949], length 0
 00:00:23.858678 eth1  In  IP 10.0.29.3.179 > 10.0.29.2.42819: Flags [F.], seq 1, ack 1, win 64, options [nop,nop,TS val 3828204949 ecr 1875449975], length 0
 00:00:23.858835 eth1  Out IP 10.0.29.2.42819 > 10.0.29.3.179: Flags [P.], seq 1:65, ack 2, win 63, options [nop,nop,TS val 1875449975 ecr 3828204949], length 64: BGP
 00:00:23.858878 eth1  In  IP 10.0.29.3.179 > 10.0.29.2.42819: Flags [R], seq 1396959438, win 0, length 0
 00:00:23.891084 eth1  Out IP 10.0.29.2.48429 > 10.0.29.3.3784: BFDv1, Control, State Up, Flags: [none], length: 24
 00:00:23.921631 eth1  In  IP 10.0.29.3.47824 > 10.0.29.2.3784: BFDv1, Control, State Up, Flags: [none], length: 24
 00:00:23.974016 eth1  Out IP 10.0.29.2.48429 > 10.0.29.3.3784: BFDv1, Control, State Up, Flags: [none], length: 24
 00:00:24.001472 eth1  In  IP 10.0.29.3.47824 > 10.0.29.2.3784: BFDv1, Control, State Up, Flags: [none], length: 24
 00:00:24.053870 eth1  Out IP 10.0.29.2.48429 > 10.0.29.3.3784: BFDv1, Control, State Up, Flags: [none], length: 24
 00:00:24.088282 eth1  In  IP 10.0.29.3.47824 > 10.0.29.2.3784: BFDv1, Control, State Up, Flags: [none], length: 24
 00:00:24.143654 eth1  Out IP 10.0.29.2.48429 > 10.0.29.3.3784: BFDv1, Control, State Up, Flags: [none], length: 24
 00:00:24.171103 eth1  In  IP 10.0.29.3.47824 > 10.0.29.2.3784: BFDv1, Control, State Up, Flags: [none], length: 24
 00:00:24.221669 eth1  Out IP 10.0.29.2.48429 > 10.0.29.3.3784: BFDv1, Control, State Up, Flags: [none], length: 24
 00:00:24.248992 eth1  In  IP 10.0.29.3.47824 > 10.0.29.2.3784: BFDv1, Control, State Up, Flags: [none], length: 24
 00:00:24.304342 eth1  Out IP 10.0.29.2.48429 > 10.0.29.3.3784: BFDv1, Control, State Up, Flags: [none], length: 24
 00:00:24.325615 eth1  In  IP 10.0.29.3.47824 > 10.0.29.2.3784: BFDv1, Control, State Up, Flags: [none], length: 24
 00:00:24.391044 eth1  Out IP 10.0.29.2.48429 > 10.0.29.3.3784: BFDv1, Control, State Up, Flags: [none], length: 24
 00:00:24.412345 eth1  In  IP 10.0.29.3.47824 > 10.0.29.2.3784: BFDv1, Control, State Up, Flags: [none], length: 24
 00:00:24.466705 eth1  Out IP 10.0.29.2.48429 > 10.0.29.3.3784: BFDv1, Control, State Up, Flags: [none], length: 24
 00:00:24.493885 eth1  In  IP 10.0.29.3.47824 > 10.0.29.2.3784: BFDv1, Control, State Up, Flags: [none], length: 24
 00:00:24.555268 eth1  Out IP 10.0.29.2.48429 > 10.0.29.3.3784: BFDv1, Control, State Up, Flags: [none], length: 24
 00:00:24.575616 eth1  In  IP 10.0.29.3.47824 > 10.0.29.2.3784: BFDv1, Control, State Up, Flags: [none], length: 24
 00:00:24.633980 eth1  Out IP 10.0.29.2.48429 > 10.0.29.3.3784: BFDv1, Control, State Up, Flags: [none], length: 24
 00:00:24.659259 eth1  In  IP 10.0.29.3.47824 > 10.0.29.2.3784: BFDv1, Control, State Up, Flags: [none], length: 24
 00:00:24.713798 eth1  Out IP 10.0.29.2.48429 > 10.0.29.3.3784: BFDv1, Control, State Up, Flags: [none], length: 24
 00:00:24.747897 eth1  In  IP 10.0.29.3.47824 > 10.0.29.2.3784: BFDv1, Control, State Up, Flags: [none], length: 24
 00:00:24.795298 eth1  Out IP 10.0.29.2.48429 > 10.0.29.3.3784: BFDv1, Control, State Up, Flags: [none], length: 24
 00:00:24.829593 eth1  In  IP 10.0.29.3.47824 > 10.0.29.2.3784: BFDv1, Control, State Up, Flags: [none], length: 24
 00:00:24.871964 eth1  Out IP 10.0.29.2.48429 > 10.0.29.3.3784: BFDv1, Control, State Up, Flags: [none], length: 24
 00:00:24.916227 eth1  In  IP 10.0.29.3.47824 > 10.0.29.2.3784: BFDv1, Control, State Up, Flags: [none], length: 24
 00:00:24.951666 eth1  Out IP 10.0.29.2.48429 > 10.0.29.3.3784: BFDv1, Control, State Up, Flags: [none], length: 24
 00:00:24.992034 eth1  In  IP 10.0.29.3.47824 > 10.0.29.2.3784: BFDv1, Control, State Up, Flags: [none], length: 24
 00:00:25.030398 eth1  Out IP 10.0.29.2.48429 > 10.0.29.3.3784: BFDv1, Control, State Up, Flags: [none], length: 24
 00:00:25.068729 eth1  In  IP 10.0.29.3.47824 > 10.0.29.2.3784: BFDv1, Control, State Up, Flags: [none], length: 24
 00:00:25.109136 eth1  Out IP 10.0.29.2.48429 > 10.0.29.3.3784: BFDv1, Control, State Up, Flags: [none], length: 24
 00:00:25.156269 eth1  In  IP 10.0.29.3.47824 > 10.0.29.2.3784: BFDv1, Control, State Up, Flags: [none], length: 24
 00:00:25.184635 eth1  Out IP 10.0.29.2.48429 > 10.0.29.3.3784: BFDv1, Control, State Up, Flags: [none], length: 24
 00:00:25.241912 eth1  In  IP 10.0.29.3.47824 > 10.0.29.2.3784: BFDv1, Control, State Up, Flags: [none], length: 24
 00:00:25.265418 eth1  Out IP 10.0.29.2.48429 > 10.0.29.3.3784: BFDv1, Control, State Up, Flags: [none], length: 24
 00:00:25.329524 eth1  In  IP 10.0.29.3.47824 > 10.0.29.2.3784: BFDv1, Control, State Up, Flags: [none], length: 24
 00:00:25.344804 eth1  Out IP 10.0.29.2.48429 > 10.0.29.3.3784: BFDv1, Control, State Up, Flags: [none], length: 24
 00:00:25.419064 eth1  In  IP 10.0.29.3.47824 > 10.0.29.2.3784: BFDv1, Control, State Up, Flags: [none], length: 24
 00:00:25.421327 eth1  Out IP 10.0.29.2.48429 > 10.0.29.3.3784: BFDv1, Control, State Up, Flags: [none], length: 24
 00:00:25.497952 eth1  In  IP 10.0.29.3.47824 > 10.0.29.2.3784: BFDv1, Control, State Up, Flags: [none], length: 24
 00:00:25.498150 eth1  Out IP 10.0.29.2.48429 > 10.0.29.3.3784: BFDv1, Control, State Up, Flags: [none], length: 24
 00:00:25.581456 eth1  Out IP 10.0.29.2.48429 > 10.0.29.3.3784: BFDv1, Control, State Up, Flags: [none], length: 24
 00:00:25.583693 eth1  In  IP 10.0.29.3.47824 > 10.0.29.2.3784: BFDv1, Control, State Up, Flags: [none], length: 24
 00:00:25.667057 eth1  Out IP 10.0.29.2.48429 > 10.0.29.3.3784: BFDv1, Control, State Up, Flags: [none], length: 24
 00:00:25.673277 eth1  In  IP 10.0.29.3.47824 > 10.0.29.2.3784: BFDv1, Control, State Up, Flags: [none], length: 24
 00:00:25.748541 eth1  Out IP 10.0.29.2.48429 > 10.0.29.3.3784: BFDv1, Control, State Up, Flags: [none], length: 24
 00:00:25.752695 eth1  In  IP 10.0.29.3.47824 > 10.0.29.2.3784: BFDv1, Control, State Up, Flags: [none], length: 24
 00:00:25.830943 eth1  Out IP 10.0.29.2.48429 > 10.0.29.3.3784: BFDv1, Control, State Up, Flags: [none], length: 24
 00:00:25.831073 eth1  In  IP 10.0.29.3.47824 > 10.0.29.2.3784: BFDv1, Control, State Up, Flags: [none], length: 24
 00:00:25.906428 eth1  Out IP 10.0.29.2.48429 > 10.0.29.3.3784: BFDv1, Control, State Up, Flags: [none], length: 24
 00:00:25.910652 eth1  In  IP 10.0.29.3.47824 > 10.0.29.2.3784: BFDv1, Control, State Up, Flags: [none], length: 24
 00:00:25.981985 eth1  Out IP 10.0.29.2.48429 > 10.0.29.3.3784: BFDv1, Control, State Up, Flags: [none], length: 24
 00:00:25.993202 eth1  In  IP 10.0.29.3.47824 > 10.0.29.2.3784: BFDv1, Control, State Up, Flags: [none], length: 24
 00:00:26.060523 eth1  Out IP 10.0.29.2.48429 > 10.0.29.3.3784: BFDv1, Control, State Up, Flags: [none], length: 24
 00:00:26.077728 eth1  In  IP 10.0.29.3.47824 > 10.0.29.2.3784: BFDv1, Control, State Up, Flags: [none], length: 24
 00:00:26.143048 eth1  Out IP 10.0.29.2.48429 > 10.0.29.3.3784: BFDv1, Control, State Up, Flags: [none], length: 24
 00:00:26.158318 eth1  In  IP 10.0.29.3.47824 > 10.0.29.2.3784: BFDv1, Control, State Up, Flags: [none], length: 24
 00:00:26.228711 eth1  Out IP 10.0.29.2.48429 > 10.0.29.3.3784: BFDv1, Control, State Up, Flags: [none], length: 24
 00:00:26.244963 eth1  In  IP 10.0.29.3.47824 > 10.0.29.2.3784: BFDv1, Control, State Up, Flags: [none], length: 24
 00:00:26.317565 eth1  Out IP 10.0.29.2.48429 > 10.0.29.3.3784: BFDv1, Control, State Up, Flags: [none], length: 24
 00:00:26.329802 eth1  In  IP 10.0.29.3.47824 > 10.0.29.2.3784: BFDv1, Control, State Up, Flags: [none], length: 24
 00:00:26.400098 eth1  Out IP 10.0.29.2.48429 > 10.0.29.3.3784: BFDv1, Control, State Up, Flags: [none], length: 24
 00:00:26.405259 eth1  In  IP 10.0.29.3.47824 > 10.0.29.2.3784: BFDv1, Control, State Up, Flags: [none], length: 24
 00:00:26.479555 eth1  Out IP 10.0.29.2.48429 > 10.0.29.3.3784: BFDv1, Control, State Up, Flags: [none], length: 24
 00:00:26.485794 eth1  In  IP 10.0.29.3.47824 > 10.0.29.2.3784: BFDv1, Control, State Up, Flags: [none], length: 24
 00:00:26.558234 eth1  Out IP 10.0.29.2.48429 > 10.0.29.3.3784: BFDv1, Control, State Up, Flags: [none], length: 24
 00:00:26.570538 eth1  In  IP 10.0.29.3.47824 > 10.0.29.2.3784: BFDv1, Control, State Up, Flags: [none], length: 24
 00:00:26.639895 eth1  Out IP 10.0.29.2.48429 > 10.0.29.3.3784: BFDv1, Control, State Up, Flags: [none], length: 24
 00:00:26.653134 eth1  In  IP 10.0.29.3.47824 > 10.0.29.2.3784: BFDv1, Control, State Up, Flags: [none], length: 24
 00:00:26.721423 eth1  Out IP 10.0.29.2.48429 > 10.0.29.3.3784: BFDv1, Control, State Up, Flags: [none], length: 24
 00:00:26.737669 eth1  In  IP 10.0.29.3.47824 > 10.0.29.2.3784: BFDv1, Control, State Up, Flags: [none], length: 24
 00:00:26.807031 eth1  Out IP 10.0.29.2.48429 > 10.0.29.3.3784: BFDv1, Control, State Up, Flags: [none], length: 24
 00:00:26.822365 eth1  In  IP 10.0.29.3.47824 > 10.0.29.2.3784: BFDv1, Control, State Up, Flags: [none], length: 24
 00:00:26.886786 eth1  Out IP 10.0.29.2.48429 > 10.0.29.3.3784: BFDv1, Control, State Up, Flags: [none], length: 24
 00:00:26.906021 eth1  In  IP 10.0.29.3.47824 > 10.0.29.2.3784: BFDv1, Control, State Up, Flags: [none], length: 24
 00:00:26.968422 eth1  Out IP 10.0.29.2.48429 > 10.0.29.3.3784: BFDv1, Control, State Up, Flags: [none], length: 24
 00:00:26.994404 eth1  In  IP 10.0.29.3.47824 > 10.0.29.2.3784: BFDv1, Control, State Up, Flags: [none], length: 24
 00:00:27.051684 eth1  Out IP 10.0.29.2.48429 > 10.0.29.3.3784: BFDv1, Control, State Up, Flags: [none], length: 24
 00:00:27.082657 eth1  In  IP 10.0.29.3.47824 > 10.0.29.2.3784: BFDv1, Control, State Up, Flags: [none], length: 24
 00:00:27.135976 eth1  Out IP 10.0.29.2.48429 > 10.0.29.3.3784: BFDv1, Control, State Up, Flags: [none], length: 24
 00:00:27.165322 eth1  In  IP 10.0.29.3.47824 > 10.0.29.2.3784: BFDv1, Control, State Up, Flags: [none], length: 24
 00:00:27.221751 eth1  Out IP 10.0.29.2.48429 > 10.0.29.3.3784: BFDv1, Control, State Up, Flags: [none], length: 24
 00:00:27.253002 eth1  In  IP 10.0.29.3.47824 > 10.0.29.2.3784: BFDv1, Control, State Up, Flags: [none], length: 24
 00:00:27.297357 eth1  Out IP 10.0.29.2.48429 > 10.0.29.3.3784: BFDv1, Control, State Up, Flags: [none], length: 24
 00:00:27.335647 eth1  In  IP 10.0.29.3.47824 > 10.0.29.2.3784: BFDv1, Control, State Up, Flags: [none], length: 24
 00:00:27.381932 eth1  Out IP 10.0.29.2.48429 > 10.0.29.3.3784: BFDv1, Control, State Up, Flags: [none], length: 24
 00:00:27.423286 eth1  In  IP 10.0.29.3.47824 > 10.0.29.2.3784: BFDv1, Control, State Up, Flags: [none], length: 24
 00:00:27.457611 eth1  Out IP 10.0.29.2.48429 > 10.0.29.3.3784: BFDv1, Control, State Up, Flags: [none], length: 24
 00:00:27.511988 eth1  In  IP 10.0.29.3.47824 > 10.0.29.2.3784: BFDv1, Control, State Up, Flags: [none], length: 24
 00:00:27.559438 eth1  Out IP 10.0.29.2.48429 > 10.0.29.3.3784: BFDv1, Control, State Up, Flags: [none], length: 24
 00:00:27.589583 eth1  In  IP 10.0.29.3.47824 > 10.0.29.2.3784: BFDv1, Control, State Up, Flags: [none], length: 24
 00:00:27.625886 eth1  Out IP 10.0.29.2.48429 > 10.0.29.3.3784: BFDv1, Control, State Up, Flags: [none], length: 24
 00:00:27.670161 eth1  In  IP 10.0.29.3.47824 > 10.0.29.2.3784: BFDv1, Control, State Up, Flags: [none], length: 24
 00:00:27.701511 eth1  Out IP 10.0.29.2.48429 > 10.0.29.3.3784: BFDv1, Control, State Up, Flags: [none], length: 24
 00:00:27.746805 eth1  In  IP 10.0.29.3.47824 > 10.0.29.2.3784: BFDv1, Control, State Up, Flags: [none], length: 24
 00:00:27.786109 eth1  Out IP 10.0.29.2.48429 > 10.0.29.3.3784: BFDv1, Control, State Up, Flags: [none], length: 24
 00:00:27.835503 eth1  In  IP 10.0.29.3.47824 > 10.0.29.2.3784: BFDv1, Control, State Up, Flags: [none], length: 24
 00:00:27.863845 eth1  Out IP 10.0.29.2.48429 > 10.0.29.3.3784: BFDv1, Control, State Up, Flags: [none], length: 24
 00:00:27.923086 eth1  In  IP 10.0.29.3.47824 > 10.0.29.2.3784: BFDv1, Control, State Up, Flags: [none], length: 24
 00:00:27.940505 eth1  Out IP 10.0.29.2.48429 > 10.0.29.3.3784: BFDv1, Control, State Up, Flags: [none], length: 24
 00:00:28.004632 eth1  In  IP 10.0.29.3.47824 > 10.0.29.2.3784: BFDv1, Control, State Up, Flags: [none], length: 24
 00:00:28.026874 eth1  Out IP 10.0.29.2.48429 > 10.0.29.3.3784: BFDv1, Control, State Up, Flags: [none], length: 24
 00:00:28.081187 eth1  In  IP 10.0.29.3.47824 > 10.0.29.2.3784: BFDv1, Control, State Up, Flags: [none], length: 24
 00:00:28.112473 eth1  Out IP 10.0.29.2.48429 > 10.0.29.3.3784: BFDv1, Control, State Up, Flags: [none], length: 24
 00:00:28.167788 eth1  In  IP 10.0.29.3.47824 > 10.0.29.2.3784: BFDv1, Control, State Up, Flags: [none], length: 24
 00:00:28.199119 eth1  Out IP 10.0.29.2.48429 > 10.0.29.3.3784: BFDv1, Control, State Up, Flags: [none], length: 24
 00:00:28.252384 eth1  In  IP 10.0.29.3.47824 > 10.0.29.2.3784: BFDv1, Control, State Up, Flags: [none], length: 24
 00:00:28.276699 eth1  Out IP 10.0.29.2.48429 > 10.0.29.3.3784: BFDv1, Control, State Up, Flags: [none], length: 24
 00:00:28.334957 eth1  In  IP 10.0.29.3.47824 > 10.0.29.2.3784: BFDv1, Control, State Up, Flags: [none], length: 24
 00:00:28.355267 eth1  Out IP 10.0.29.2.48429 > 10.0.29.3.3784: BFDv1, Control, State Up, Flags: [none], length: 24
 00:00:28.418608 eth1  In  IP 10.0.29.3.47824 > 10.0.29.2.3784: BFDv1, Control, State Up, Flags: [none], length: 24
 00:00:28.441911 eth1  Out IP 10.0.29.2.48429 > 10.0.29.3.3784: BFDv1, Control, State Up, Flags: [none], length: 24
 00:00:28.498989 eth1  In  IP 10.0.29.3.47824 > 10.0.29.2.3784: BFDv1, Control, State Up, Flags: [none], length: 24
 00:00:28.508135 eth1  Out IP 10.0.29.2.43713 > 10.0.29.3.179: Flags [S], seq 519253888, win 64240, options [mss 1460,sackOK,TS val 1875454624 ecr 0,nop,wscale 10], length 0
 00:00:28.508187 eth1  In  IP 10.0.29.3.179 > 10.0.29.2.43713: Flags [S.], seq 1612510497, ack 519253889, win 65160, options [mss 1460,sackOK,TS val 3828209598 ecr 1875454624,nop,wscale 10], length 0
 00:00:28.508208 eth1  Out IP 10.0.29.2.43713 > 10.0.29.3.179: Flags [.], ack 1, win 63, options [nop,nop,TS val 1875454624 ecr 3828209598], length 0
 00:00:28.508282 eth1  Out IP 10.0.29.2.43713 > 10.0.29.3.179: Flags [P.], seq 1:65, ack 1, win 63, options [nop,nop,TS val 1875454624 ecr 3828209598], length 64: BGP
 00:00:28.508305 eth1  In  IP 10.0.29.3.179 > 10.0.29.2.43713: Flags [.], ack 65, win 64, options [nop,nop,TS val 3828209598 ecr 1875454624], length 0
 00:00:28.508380 eth1  In  IP 10.0.29.3.179 > 10.0.29.2.43713: Flags [R.], seq 1, ack 65, win 64, options [nop,nop,TS val 3828209599 ecr 1875454624], length 0
 00:00:28.519278 eth1  Out IP 10.0.29.2.48429 > 10.0.29.3.3784: BFDv1, Control, State Up, Flags: [none], length: 24
 00:00:28.574611 eth1  In  IP 10.0.29.3.47824 > 10.0.29.2.3784: BFDv1, Control, State Up, Flags: [none], length: 24
 00:00:28.598958 eth1  Out IP 10.0.29.2.48429 > 10.0.29.3.3784: BFDv1, Control, State Up, Flags: [none], length: 24
 00:00:28.662356 eth1  In  IP 10.0.29.3.47824 > 10.0.29.2.3784: BFDv1, Control, State Up, Flags: [none], length: 24
 00:00:28.685655 eth1  Out IP 10.0.29.2.48429 > 10.0.29.3.3784: BFDv1, Control, State Up, Flags: [none], length: 24
 00:00:28.738946 eth1  In  IP 10.0.29.3.47824 > 10.0.29.2.3784: BFDv1, Control, State Up, Flags: [none], length: 24
 00:00:28.763320 eth1  Out IP 10.0.29.2.48429 > 10.0.29.3.3784: BFDv1, Control, State Up, Flags: [none], length: 24
 00:00:28.819622 eth1  In  IP 10.0.29.3.47824 > 10.0.29.2.3784: BFDv1, Control, State Up, Flags: [none], length: 24
 00:00:28.846867 eth1  Out IP 10.0.29.2.48429 > 10.0.29.3.3784: BFDv1, Control, State Up, Flags: [none], length: 24
 00:00:28.899096 eth1  In  IP 10.0.29.3.47824 > 10.0.29.2.3784: BFDv1, Control, State Up, Flags: [none], length: 24
 00:00:28.925488 eth1  Out IP 10.0.29.2.48429 > 10.0.29.3.3784: BFDv1, Control, State Up, Flags: [none], length: 24
 00:00:28.981684 eth1  In  IP 10.0.29.3.47824 > 10.0.29.2.3784: BFDv1, Control, State Up, Flags: [none], length: 24
 00:00:29.009069 eth1  Out IP 10.0.29.2.48429 > 10.0.29.3.3784: BFDv1, Control, State Up, Flags: [none], length: 24
 00:00:29.062397 eth1  In  IP 10.0.29.3.47824 > 10.0.29.2.3784: BFDv1, Control, State Up, Flags: [none], length: 24
 00:00:29.087716 eth1  Out IP 10.0.29.2.48429 > 10.0.29.3.3784: BFDv1, Control, State Up, Flags: [none], length: 24
 00:00:29.140016 eth1  In  IP 10.0.29.3.47824 > 10.0.29.2.3784: BFDv1, Control, State Up, Flags: [none], length: 24
 00:00:29.170358 eth1  Out IP 10.0.29.2.48429 > 10.0.29.3.3784: BFDv1, Control, State Up, Flags: [none], length: 24
 00:00:29.226610 eth1  In  IP 10.0.29.3.47824 > 10.0.29.2.3784: BFDv1, Control, State Up, Flags: [none], length: 24
 00:00:29.245922 eth1  Out IP 10.0.29.2.48429 > 10.0.29.3.3784: BFDv1, Control, State Up, Flags: [none], length: 24
 00:00:29.312512 eth1  In  IP 10.0.29.3.47824 > 10.0.29.2.3784: BFDv1, Control, State Up, Flags: [none], length: 24
 00:00:29.332816 eth1  Out IP 10.0.29.2.48429 > 10.0.29.3.3784: BFDv1, Control, State Up, Flags: [none], length: 24
 00:00:29.395431 eth1  In  IP 10.0.29.3.47824 > 10.0.29.2.3784: BFDv1, Control, State Up, Flags: [none], length: 24
 00:00:29.408654 eth1  Out IP 10.0.29.2.48429 > 10.0.29.3.3784: BFDv1, Control, State Up, Flags: [none], length: 24
 00:00:29.479283 eth1  In  IP 10.0.29.3.47824 > 10.0.29.2.3784: BFDv1, Control, State Up, Flags: [none], length: 24
 00:00:29.495621 eth1  Out IP 10.0.29.2.48429 > 10.0.29.3.3784: BFDv1, Control, State Up, Flags: [none], length: 24
 00:00:29.568896 eth1  In  IP 10.0.29.3.47824 > 10.0.29.2.3784: BFDv1, Control, State Up, Flags: [none], length: 24
 00:00:29.582165 eth1  Out IP 10.0.29.2.48429 > 10.0.29.3.3784: BFDv1, Control, State Up, Flags: [none], length: 24
 00:00:29.654503 eth1  In  IP 10.0.29.3.47824 > 10.0.29.2.3784: BFDv1, Control, State Up, Flags: [none], length: 24
 00:00:29.668766 eth1  Out IP 10.0.29.2.48429 > 10.0.29.3.3784: BFDv1, Control, State Up, Flags: [none], length: 24
 00:00:29.731020 eth1  In  IP 10.0.29.3.47824 > 10.0.29.2.3784: BFDv1, Control, State Up, Flags: [none], length: 24
 00:00:29.754377 eth1  Out IP 10.0.29.2.48429 > 10.0.29.3.3784: BFDv1, Control, State Up, Flags: [none], length: 24
 00:00:29.819955 eth1  In  IP 10.0.29.3.47824 > 10.0.29.2.3784: BFDv1, Control, State Up, Flags: [none], length: 24
 00:00:29.831360 eth1  Out IP 10.0.29.2.48429 > 10.0.29.3.3784: BFDv1, Control, State Up, Flags: [none], length: 24
 00:00:29.906365 eth1  In  IP 10.0.29.3.47824 > 10.0.29.2.3784: BFDv1, Control, State Up, Flags: [none], length: 24
 00:00:29.914652 eth1  Out IP 10.0.29.2.48429 > 10.0.29.3.3784: BFDv1, Control, State Up, Flags: [none], length: 24
 00:00:29.993679 eth1  In  IP 10.0.29.3.47824 > 10.0.29.2.3784: BFDv1, Control, State Up, Flags: [none], length: 24
 00:00:30.000940 eth1  Out IP 10.0.29.2.48429 > 10.0.29.3.3784: BFDv1, Control, State Up, Flags: [none], length: 24
 00:00:30.073057 eth1  In  IP 10.0.29.3.47824 > 10.0.29.2.3784: BFDv1, Control, State Up, Flags: [none], length: 24
 00:00:30.087436 eth1  Out IP 10.0.29.2.48429 > 10.0.29.3.3784: BFDv1, Control, State Up, Flags: [none], length: 24
 00:00:30.161625 eth1  In  IP 10.0.29.3.47824 > 10.0.29.2.3784: BFDv1, Control, State Up, Flags: [none], length: 24
 00:00:30.173879 eth1  Out IP 10.0.29.2.48429 > 10.0.29.3.3784: BFDv1, Control, State Up, Flags: [none], length: 24
568 packets captured
571 packets received by filter
0 packets dropped by kernel

