tcpdump: data link type LINUX_SLL2
tcpdump: verbose output suppressed, use -v[v]... for full protocol decode
listening on any, link-type LINUX_SLL2 (Linux cooked v2), snapshot length 262144 bytes
 00:00:00.000000 eth2  Out IP 10.0.29.2.60904 > 10.0.29.3.3784: BFDv1, Control, State Up, Flags: [none], length: 24
 00:00:00.007289 eth2  In  IP 10.0.29.3.39239 > 10.0.29.2.3784: BFDv1, Control, State Up, Flags: [none], length: 24
 00:00:00.078658 eth2  Out IP 10.0.29.2.60904 > 10.0.29.3.3784: BFDv1, Control, State Up, Flags: [none], length: 24
 00:00:00.095945 eth2  In  IP 10.0.29.3.39239 > 10.0.29.2.3784: BFDv1, Control, State Up, Flags: [none], length: 24
 00:00:00.162482 eth2  Out IP 10.0.29.2.60904 > 10.0.29.3.3784: BFDv1, Control, State Up, Flags: [none], length: 24
 00:00:00.185519 eth2  In  IP 10.0.29.3.39239 > 10.0.29.2.3784: BFDv1, Control, State Up, Flags: [none], length: 24
 00:00:00.238926 eth2  Out IP 10.0.29.2.60904 > 10.0.29.3.3784: BFDv1, Control, State Up, Flags: [none], length: 24
 00:00:00.265356 eth2  In  IP 10.0.29.3.39239 > 10.0.29.2.3784: BFDv1, Control, State Up, Flags: [none], length: 24
 00:00:00.313721 eth2  Out IP 10.0.29.2.60904 > 10.0.29.3.3784: BFDv1, Control, State Up, Flags: [none], length: 24
 00:00:00.347407 eth2  In  IP 10.0.29.3.39239 > 10.0.29.2.3784: BFDv1, Control, State Up, Flags: [none], length: 24
 00:00:00.396760 eth2  Out IP 10.0.29.2.60904 > 10.0.29.3.3784: BFDv1, Control, State Up, Flags: [none], length: 24
 00:00:00.424147 eth2  In  IP 10.0.29.3.39239 > 10.0.29.2.3784: BFDv1, Control, State Up, Flags: [none], length: 24
 00:00:00.477580 eth2  Out IP 10.0.29.2.60904 > 10.0.29.3.3784: BFDv1, Control, State Up, Flags: [none], length: 24
 00:00:00.511092 eth2  In  IP 10.0.29.3.39239 > 10.0.29.2.3784: BFDv1, Control, State Up, Flags: [none], length: 24
 00:00:00.556432 eth2  Out IP 10.0.29.2.60904 > 10.0.29.3.3784: BFDv1, Control, State Up, Flags: [none], length: 24
 00:00:00.597884 eth2  In  IP 10.0.29.3.39239 > 10.0.29.2.3784: BFDv1, Control, State Up, Flags: [none], length: 24
 00:00:00.641323 eth2  Out IP 10.0.29.2.60904 > 10.0.29.3.3784: BFDv1, Control, State Up, Flags: [none], length: 24
 00:00:00.674717 eth2  In  IP 10.0.29.3.39239 > 10.0.29.2.3784: BFDv1, Control, State Up, Flags: [none], length: 24
 00:00:00.728043 eth2  Out IP 10.0.29.2.60904 > 10.0.29.3.3784: BFDv1, Control, State Up, Flags: [none], length: 24
 00:00:00.763771 eth2  In  IP 10.0.29.3.39239 > 10.0.29.2.3784: BFDv1, Control, State Up, Flags: [none], length: 24
 00:00:00.813059 eth2  Out IP 10.0.29.2.60904 > 10.0.29.3.3784: BFDv1, Control, State Up, Flags: [none], length: 24
 00:00:00.846554 eth2  In  IP 10.0.29.3.39239 > 10.0.29.2.3784: BFDv1, Control, State Up, Flags: [none], length: 24
 00:00:00.891115 eth2  Out IP 10.0.29.2.60904 > 10.0.29.3.3784: BFDv1, Control, State Up, Flags: [none], length: 24
 00:00:00.929291 eth2  In  IP 10.0.29.3.39239 > 10.0.29.2.3784: BFDv1, Control, State Up, Flags: [none], length: 24
 00:00:00.973623 eth2  Out IP 10.0.29.2.60904 > 10.0.29.3.3784: BFDv1, Control, State Up, Flags: [none], length: 24
 00:00:01.006778 eth2  In  IP 10.0.29.3.39239 > 10.0.29.2.3784: BFDv1, Control, State Up, Flags: [none], length: 24
 00:00:01.060228 eth2  Out IP 10.0.29.2.60904 > 10.0.29.3.3784: BFDv1, Control, State Up, Flags: [none], length: 24
 00:00:01.082529 eth2  In  IP 10.0.29.3.39239 > 10.0.29.2.3784: BFDv1, Control, State Up, Flags: [none], length: 24
 00:00:01.146895 eth2  Out IP 10.0.29.2.60904 > 10.0.29.3.3784: BFDv1, Control, State Up, Flags: [none], length: 24
 00:00:01.169579 eth2  In  IP 10.0.29.3.39239 > 10.0.29.2.3784: BFDv1, Control, State Up, Flags: [none], length: 24
 00:00:01.228946 eth2  Out IP 10.0.29.2.60904 > 10.0.29.3.3784: BFDv1, Control, State Up, Flags: [none], length: 24
 00:00:01.252597 eth2  In  IP 10.0.29.3.39239 > 10.0.29.2.3784: BFDv1, Control, State Up, Flags: [none], length: 24
 00:00:01.306942 eth2  Out IP 10.0.29.2.60904 > 10.0.29.3.3784: BFDv1, Control, State Up, Flags: [none], length: 24
 00:00:01.328407 eth2  In  IP 10.0.29.3.39239 > 10.0.29.2.3784: BFDv1, Control, State Up, Flags: [none], length: 24
 00:00:01.390742 eth2  Out IP 10.0.29.2.60904 > 10.0.29.3.3784: BFDv1, Control, State Up, Flags: [none], length: 24
 00:00:01.409457 eth2  In  IP 10.0.29.3.39239 > 10.0.29.2.3784: BFDv1, Control, State Up, Flags: [none], length: 24
 00:00:01.471846 eth2  Out IP 10.0.29.2.60904 > 10.0.29.3.3784: BFDv1, Control, State Up, Flags: [none], length: 24
 00:00:01.491640 eth2  In  IP 10.0.29.3.39239 > 10.0.29.2.3784: BFDv1, Control, State Up, Flags: [none], length: 24
 00:00:01.552991 eth2  Out IP 10.0.29.2.60904 > 10.0.29.3.3784: BFDv1, Control, State Up, Flags: [none], length: 24
 00:00:01.579370 eth2  In  IP 10.0.29.3.39239 > 10.0.29.2.3784: BFDv1, Control, State Up, Flags: [none], length: 24
 00:00:01.640764 eth2  Out IP 10.0.29.2.60904 > 10.0.29.3.3784: BFDv1, Control, State Up, Flags: [none], length: 24
 00:00:01.665495 eth2  In  IP 10.0.29.3.39239 > 10.0.29.2.3784: BFDv1, Control, State Up, Flags: [none], length: 24
 00:00:01.720923 eth2  Out IP 10.0.29.2.60904 > 10.0.29.3.3784: BFDv1, Control, State Up, Flags: [none], length: 24
 00:00:01.747062 eth2  In  IP 10.0.29.3.39239 > 10.0.29.2.3784: BFDv1, Control, State Up, Flags: [none], length: 24
 00:00:01.798448 eth2  Out IP 10.0.29.2.60904 > 10.0.29.3.3784: BFDv1, Control, State Up, Flags: [none], length: 24
 00:00:01.823472 eth2  In  IP 10.0.29.3.39239 > 10.0.29.2.3784: BFDv1, Control, State Up, Flags: [none], length: 24
 00:00:01.880868 eth2  Out IP 10.0.29.2.60904 > 10.0.29.3.3784: BFDv1, Control, State Up, Flags: [none], length: 24
 00:00:01.902076 eth2  In  IP 10.0.29.3.39239 > 10.0.29.2.3784: BFDv1, Control, State Up, Flags: [none], length: 24
 00:00:01.964533 eth2  Out IP 10.0.29.2.60904 > 10.0.29.3.3784: BFDv1, Control, State Up, Flags: [none], length: 24
 00:00:01.979906 eth2  In  IP 10.0.29.3.39239 > 10.0.29.2.3784: BFDv1, Control, State Up, Flags: [none], length: 24
 00:00:02.051251 eth2  Out IP 10.0.29.2.60904 > 10.0.29.3.3784: BFDv1, Control, State Up, Flags: [none], length: 24
 00:00:02.058856 eth2  In  IP 10.0.29.3.39239 > 10.0.29.2.3784: BFDv1, Control, State Up, Flags: [none], length: 24
 00:00:02.070858 eth3  Out IP 10.0.12.3.179 > 10.0.12.2.45004: Flags [P.], seq 3222602751:3222602786, ack 3815833318, win 64, options [nop,nop,TS val 4271087657 ecr 2663238652], length 35: BGP
 00:00:02.070933 eth3  In  IP 10.0.12.2.45004 > 10.0.12.3.179: Flags [.], ack 35, win 63, options [nop,nop,TS val 2663254812 ecr 4271087657], length 0
 00:00:02.071186 eth3  In  IP 10.0.12.2.45004 > 10.0.12.3.179: Flags [P.], seq 1:55, ack 35, win 63, options [nop,nop,TS val 2663254812 ecr 4271087657], length 54: BGP
 00:00:02.071207 eth3  Out IP 10.0.12.3.179 > 10.0.12.2.45004: Flags [.], ack 55, win 64, options [nop,nop,TS val 4271087658 ecr 2663254812], length 0
 00:00:02.071436 eth3  Out IP 10.0.12.3.179 > 10.0.12.2.45004: Flags [P.], seq 35:80, ack 55, win 64, options [nop,nop,TS val 4271087658 ecr 2663254812], length 45: BGP
 00:00:02.112432 eth3  In  IP 10.0.12.2.45004 > 10.0.12.3.179: Flags [.], ack 80, win 63, options [nop,nop,TS val 2663254854 ecr 4271087658], length 0
 00:00:08.550138 eth3  Out IP 10.0.12.3.179 > 10.0.12.2.45004: Flags [P.], seq 80:99, ack 55, win 64, options [nop,nop,TS val 4271094136 ecr 2663254854], length 19: BGP
 00:00:08.550196 eth3  In  IP 10.0.12.2.45004 > 10.0.12.3.179: Flags [.], ack 99, win 63, options [nop,nop,TS val 2663261291 ecr 4271094136], length 0
 00:00:10.167078 eth3  Out IP 10.0.12.3.179 > 10.0.12.2.45004: Flags [P.], seq 99:147, ack 55, win 64, options [nop,nop,TS val 4271095753 ecr 2663261291], length 48: BGP
 00:00:10.167146 eth3  In  IP 10.0.12.2.45004 > 10.0.12.3.179: Flags [.], ack 147, win 63, options [nop,nop,TS val 2663262908 ecr 4271095753], length 0
 00:00:10.167180 eth2  Out IP 10.0.29.2.50572 > 10.0.29.3.3784: BFDv1, Control, State Down, Flags: [none], length: 24
 00:00:10.167382 eth3  In  IP 10.0.12.2.45004 > 10.0.12.3.179: Flags [P.], seq 55:82, ack 147, win 63, options [nop,nop,TS val 2663262909 ecr 4271095753], length 27: BGP
 00:00:10.168143 eth3  Out IP 10.0.12.3.179 > 10.0.12.2.45004: Flags [P.], seq 147:192, ack 82, win 64, options [nop,nop,TS val 4271095754 ecr 2663262909], length 45: BGP
 00:00:10.208263 eth3  In  IP 10.0.12.2.45004 > 10.0.12.3.179: Flags [.], ack 192, win 63, options [nop,nop,TS val 2663262950 ecr 4271095754], length 0
 00:00:10.886872 eth2  In  IP 10.0.29.3.53139 > 10.0.29.2.3784: BFDv1, Control, State Init, Flags: [none], length: 24
 00:00:10.887022 eth2  Out IP 10.0.29.2.50572 > 10.0.29.3.3784: BFDv1, Control, State Up, Flags: [Poll], length: 24
 00:00:10.887081 eth2  In  IP 10.0.29.3.53139 > 10.0.29.2.3784: BFDv1, Control, State Up, Flags: [Final], length: 24
 00:00:10.887102 eth2  In  IP 10.0.29.3.53139 > 10.0.29.2.3784: BFDv1, Control, State Up, Flags: [Poll], length: 24
 00:00:10.887165 eth2  Out IP 10.0.29.2.50572 > 10.0.29.3.3784: BFDv1, Control, State Up, Flags: [Final], length: 24
 00:00:10.969337 eth2  Out IP 10.0.29.2.50572 > 10.0.29.3.3784: BFDv1, Control, State Up, Flags: [none], length: 24
 00:00:10.971552 eth2  In  IP 10.0.29.3.53139 > 10.0.29.2.3784: BFDv1, Control, State Up, Flags: [none], length: 24
 00:00:11.049101 eth2  In  IP 10.0.29.3.53139 > 10.0.29.2.3784: BFDv1, Control, State Up, Flags: [none], length: 24
 00:00:11.057337 eth2  Out IP 10.0.29.2.50572 > 10.0.29.3.3784: BFDv1, Control, State Up, Flags: [none], length: 24
 00:00:11.136978 eth2  In  IP 10.0.29.3.53139 > 10.0.29.2.3784: BFDv1, Control, State Up, Flags: [none], length: 24
 00:00:11.138464 eth2  Out IP 10.0.29.2.50572 > 10.0.29.3.3784: BFDv1, Control, State Up, Flags: [none], length: 24
 00:00:11.216718 eth2  Out IP 10.0.29.2.50572 > 10.0.29.3.3784: BFDv1, Control, State Up, Flags: [none], length: 24
 00:00:11.216868 eth2  In  IP 10.0.29.3.53139 > 10.0.29.2.3784: BFDv1, Control, State Up, Flags: [none], length: 24
 00:00:11.300097 eth2  Out IP 10.0.29.2.50572 > 10.0.29.3.3784: BFDv1, Control, State Up, Flags: [none], length: 24
 00:00:11.301308 eth2  In  IP 10.0.29.3.53139 > 10.0.29.2.3784: BFDv1, Control, State Up, Flags: [none], length: 24
 00:00:11.375878 eth2  In  IP 10.0.29.3.53139 > 10.0.29.2.3784: BFDv1, Control, State Up, Flags: [none], length: 24
 00:00:11.384155 eth2  Out IP 10.0.29.2.50572 > 10.0.29.3.3784: BFDv1, Control, State Up, Flags: [none], length: 24
 00:00:11.463936 eth2  In  IP 10.0.29.3.53139 > 10.0.29.2.3784: BFDv1, Control, State Up, Flags: [none], length: 24
 00:00:11.469207 eth2  Out IP 10.0.29.2.50572 > 10.0.29.3.3784: BFDv1, Control, State Up, Flags: [none], length: 24
 00:00:11.543882 eth2  In  IP 10.0.29.3.53139 > 10.0.29.2.3784: BFDv1, Control, State Up, Flags: [none], length: 24
 00:00:11.549142 eth2  Out IP 10.0.29.2.50572 > 10.0.29.3.3784: BFDv1, Control, State Up, Flags: [none], length: 24
 00:00:11.628365 eth2  Out IP 10.0.29.2.50572 > 10.0.29.3.3784: BFDv1, Control, State Up, Flags: [none], length: 24
 00:00:11.633566 eth2  In  IP 10.0.29.3.53139 > 10.0.29.2.3784: BFDv1, Control, State Up, Flags: [none], length: 24
 00:00:11.648146 eth3  In  IP 10.0.12.2.45004 > 10.0.12.3.179: Flags [P.], seq 82:101, ack 192, win 63, options [nop,nop,TS val 2663264389 ecr 4271095754], length 19: BGP
 00:00:11.689254 eth3  Out IP 10.0.12.3.179 > 10.0.12.2.45004: Flags [.], ack 101, win 64, options [nop,nop,TS val 4271097276 ecr 2663264389], length 0
 00:00:11.706854 eth2  Out IP 10.0.29.2.50572 > 10.0.29.3.3784: BFDv1, Control, State Up, Flags: [none], length: 24
 00:00:11.713086 eth2  In  IP 10.0.29.3.53139 > 10.0.29.2.3784: BFDv1, Control, State Up, Flags: [none], length: 24
 00:00:11.791740 eth2  In  IP 10.0.29.3.53139 > 10.0.29.2.3784: BFDv1, Control, State Up, Flags: [none], length: 24
 00:00:11.794932 eth2  Out IP 10.0.29.2.50572 > 10.0.29.3.3784: BFDv1, Control, State Up, Flags: [none], length: 24
 00:00:11.870078 eth2  In  IP 10.0.29.3.53139 > 10.0.29.2.3784: BFDv1, Control, State Up, Flags: [none], length: 24
 00:00:11.879300 eth2  Out IP 10.0.29.2.50572 > 10.0.29.3.3784: BFDv1, Control, State Up, Flags: [none], length: 24
 00:00:11.960715 eth2  In  IP 10.0.29.3.53139 > 10.0.29.2.3784: BFDv1, Control, State Up, Flags: [none], length: 24
 00:00:11.966961 eth2  Out IP 10.0.29.2.50572 > 10.0.29.3.3784: BFDv1, Control, State Up, Flags: [none], length: 24
 00:00:12.041638 eth2  In  IP 10.0.29.3.53139 > 10.0.29.2.3784: BFDv1, Control, State Up, Flags: [none], length: 24
 00:00:12.052868 eth2  Out IP 10.0.29.2.50572 > 10.0.29.3.3784: BFDv1, Control, State Up, Flags: [none], length: 24
 00:00:12.123567 eth2  In  IP 10.0.29.3.53139 > 10.0.29.2.3784: BFDv1, Control, State Up, Flags: [none], length: 24
 00:00:12.141881 eth2  Out IP 10.0.29.2.50572 > 10.0.29.3.3784: BFDv1, Control, State Up, Flags: [none], length: 24
 00:00:12.198891 eth2  In  IP 10.0.29.3.53139 > 10.0.29.2.3784: BFDv1, Control, State Up, Flags: [none], length: 24
 00:00:12.231135 eth2  Out IP 10.0.29.2.50572 > 10.0.29.3.3784: BFDv1, Control, State Up, Flags: [none], length: 24
 00:00:12.284261 eth2  In  IP 10.0.29.3.53139 > 10.0.29.2.3784: BFDv1, Control, State Up, Flags: [none], length: 24
 00:00:12.309530 eth2  Out IP 10.0.29.2.50572 > 10.0.29.3.3784: BFDv1, Control, State Up, Flags: [none], length: 24
 00:00:12.366601 eth2  In  IP 10.0.29.3.53139 > 10.0.29.2.3784: BFDv1, Control, State Up, Flags: [none], length: 24
 00:00:12.391881 eth2  Out IP 10.0.29.2.50572 > 10.0.29.3.3784: BFDv1, Control, State Up, Flags: [none], length: 24
 00:00:12.456162 eth2  In  IP 10.0.29.3.53139 > 10.0.29.2.3784: BFDv1, Control, State Up, Flags: [none], length: 24
 00:00:12.477393 eth2  Out IP 10.0.29.2.50572 > 10.0.29.3.3784: BFDv1, Control, State Up, Flags: [none], length: 24
 00:00:12.545532 eth2  In  IP 10.0.29.3.53139 > 10.0.29.2.3784: BFDv1, Control, State Up, Flags: [none], length: 24
 00:00:12.553782 eth2  Out IP 10.0.29.2.50572 > 10.0.29.3.3784: BFDv1, Control, State Up, Flags: [none], length: 24
 00:00:12.624969 eth2  In  IP 10.0.29.3.53139 > 10.0.29.2.3784: BFDv1, Control, State Up, Flags: [none], length: 24
 00:00:12.631258 eth2  Out IP 10.0.29.2.50572 > 10.0.29.3.3784: BFDv1, Control, State Up, Flags: [none], length: 24
 00:00:12.706416 eth2  In  IP 10.0.29.3.53139 > 10.0.29.2.3784: BFDv1, Control, State Up, Flags: [none], length: 24
 00:00:12.716665 eth2  Out IP 10.0.29.2.50572 > 10.0.29.3.3784: BFDv1, Control, State Up, Flags: [none], length: 24
 00:00:12.785335 eth2  In  IP 10.0.29.3.53139 > 10.0.29.2.3784: BFDv1, Control, State Up, Flags: [none], length: 24
 00:00:12.798541 eth2  Out IP 10.0.29.2.50572 > 10.0.29.3.3784: BFDv1, Control, State Up, Flags: [none], length: 24
 00:00:12.862761 eth2  In  IP 10.0.29.3.53139 > 10.0.29.2.3784: BFDv1, Control, State Up, Flags: [none], length: 24
 00:00:12.885016 eth2  Out IP 10.0.29.2.50572 > 10.0.29.3.3784: BFDv1, Control, State Up, Flags: [none], length: 24
 00:00:12.948433 eth2  In  IP 10.0.29.3.53139 > 10.0.29.2.3784: BFDv1, Control, State Up, Flags: [none], length: 24
 00:00:12.971717 eth2  Out IP 10.0.29.2.50572 > 10.0.29.3.3784: BFDv1, Control, State Up, Flags: [none], length: 24
 00:00:13.037163 eth2  In  IP 10.0.29.3.53139 > 10.0.29.2.3784: BFDv1, Control, State Up, Flags: [none], length: 24
 00:00:13.047436 eth2  Out IP 10.0.29.2.50572 > 10.0.29.3.3784: BFDv1, Control, State Up, Flags: [none], length: 24
 00:00:13.118199 eth2  In  IP 10.0.29.3.53139 > 10.0.29.2.3784: BFDv1, Control, State Up, Flags: [none], length: 24
 00:00:13.122472 eth2  Out IP 10.0.29.2.50572 > 10.0.29.3.3784: BFDv1, Control, State Up, Flags: [none], length: 24
 00:00:13.197912 eth2  In  IP 10.0.29.3.53139 > 10.0.29.2.3784: BFDv1, Control, State Up, Flags: [none], length: 24
 00:00:13.210203 eth2  Out IP 10.0.29.2.50572 > 10.0.29.3.3784: BFDv1, Control, State Up, Flags: [none], length: 24
 00:00:13.280016 eth2  In  IP 10.0.29.3.53139 > 10.0.29.2.3784: BFDv1, Control, State Up, Flags: [none], length: 24
 00:00:13.295331 eth2  Out IP 10.0.29.2.50572 > 10.0.29.3.3784: BFDv1, Control, State Up, Flags: [none], length: 24
 00:00:13.370131 eth2  In  IP 10.0.29.3.53139 > 10.0.29.2.3784: BFDv1, Control, State Up, Flags: [none], length: 24
 00:00:13.381468 eth2  Out IP 10.0.29.2.50572 > 10.0.29.3.3784: BFDv1, Control, State Up, Flags: [none], length: 24
 00:00:13.448441 eth2  In  IP 10.0.29.3.53139 > 10.0.29.2.3784: BFDv1, Control, State Up, Flags: [none], length: 24
 00:00:13.460660 eth2  Out IP 10.0.29.2.50572 > 10.0.29.3.3784: BFDv1, Control, State Up, Flags: [none], length: 24
 00:00:13.531802 eth2  In  IP 10.0.29.3.53139 > 10.0.29.2.3784: BFDv1, Control, State Up, Flags: [none], length: 24
 00:00:13.543057 eth2  Out IP 10.0.29.2.50572 > 10.0.29.3.3784: BFDv1, Control, State Up, Flags: [none], length: 24
 00:00:13.617241 eth2  In  IP 10.0.29.3.53139 > 10.0.29.2.3784: BFDv1, Control, State Up, Flags: [none], length: 24
 00:00:13.620452 eth2  Out IP 10.0.29.2.50572 > 10.0.29.3.3784: BFDv1, Control, State Up, Flags: [none], length: 24
 00:00:13.695820 eth2  In  IP 10.0.29.3.53139 > 10.0.29.2.3784: BFDv1, Control, State Up, Flags: [none], length: 24
 00:00:13.703101 eth2  Out IP 10.0.29.2.50572 > 10.0.29.3.3784: BFDv1, Control, State Up, Flags: [none], length: 24
 00:00:13.775243 eth2  In  IP 10.0.29.3.53139 > 10.0.29.2.3784: BFDv1, Control, State Up, Flags: [none], length: 24
 00:00:13.793449 eth2  Out IP 10.0.29.2.50572 > 10.0.29.3.3784: BFDv1, Control, State Up, Flags: [none], length: 24
 00:00:13.853522 eth2  In  IP 10.0.29.3.53139 > 10.0.29.2.3784: BFDv1, Control, State Up, Flags: [none], length: 24
 00:00:13.878819 eth2  Out IP 10.0.29.2.50572 > 10.0.29.3.3784: BFDv1, Control, State Up, Flags: [none], length: 24
 00:00:13.929103 eth2  In  IP 10.0.29.3.53139 > 10.0.29.2.3784: BFDv1, Control, State Up, Flags: [none], length: 24
 00:00:13.957383 eth2  Out IP 10.0.29.2.50572 > 10.0.29.3.3784: BFDv1, Control, State Up, Flags: [none], length: 24
 00:00:14.013626 eth2  In  IP 10.0.29.3.53139 > 10.0.29.2.3784: BFDv1, Control, State Up, Flags: [none], length: 24
 00:00:14.036897 eth2  Out IP 10.0.29.2.50572 > 10.0.29.3.3784: BFDv1, Control, State Up, Flags: [none], length: 24
 00:00:14.093162 eth2  In  IP 10.0.29.3.53139 > 10.0.29.2.3784: BFDv1, Control, State Up, Flags: [none], length: 24
 00:00:14.126447 eth2  Out IP 10.0.29.2.50572 > 10.0.29.3.3784: BFDv1, Control, State Up, Flags: [none], length: 24
 00:00:14.169683 eth2  In  IP 10.0.29.3.53139 > 10.0.29.2.3784: BFDv1, Control, State Up, Flags: [none], length: 24
 00:00:14.207963 eth2  Out IP 10.0.29.2.50572 > 10.0.29.3.3784: BFDv1, Control, State Up, Flags: [none], length: 24
 00:00:14.253271 eth2  In  IP 10.0.29.3.53139 > 10.0.29.2.3784: BFDv1, Control, State Up, Flags: [none], length: 24
 00:00:14.293561 eth2  Out IP 10.0.29.2.50572 > 10.0.29.3.3784: BFDv1, Control, State Up, Flags: [none], length: 24
 00:00:14.340746 eth2  In  IP 10.0.29.3.53139 > 10.0.29.2.3784: BFDv1, Control, State Up, Flags: [none], length: 24
 00:00:14.381032 eth2  Out IP 10.0.29.2.50572 > 10.0.29.3.3784: BFDv1, Control, State Up, Flags: [none], length: 24
 00:00:14.426471 eth2  In  IP 10.0.29.3.53139 > 10.0.29.2.3784: BFDv1, Control, State Up, Flags: [none], length: 24
 00:00:14.456734 eth2  Out IP 10.0.29.2.50572 > 10.0.29.3.3784: BFDv1, Control, State Up, Flags: [none], length: 24
 00:00:14.503948 eth2  In  IP 10.0.29.3.53139 > 10.0.29.2.3784: BFDv1, Control, State Up, Flags: [none], length: 24
 00:00:14.539227 eth2  Out IP 10.0.29.2.50572 > 10.0.29.3.3784: BFDv1, Control, State Up, Flags: [none], length: 24
 00:00:14.584452 eth2  In  IP 10.0.29.3.53139 > 10.0.29.2.3784: BFDv1, Control, State Up, Flags: [none], length: 24
 00:00:14.621733 eth2  Out IP 10.0.29.2.50572 > 10.0.29.3.3784: BFDv1, Control, State Up, Flags: [none], length: 24
 00:00:14.661994 eth2  In  IP 10.0.29.3.53139 > 10.0.29.2.3784: BFDv1, Control, State Up, Flags: [none], length: 24
 00:00:14.697238 eth2  Out IP 10.0.29.2.50572 > 10.0.29.3.3784: BFDv1, Control, State Up, Flags: [none], length: 24
 00:00:14.738490 eth2  In  IP 10.0.29.3.53139 > 10.0.29.2.3784: BFDv1, Control, State Up, Flags: [none], length: 24
 00:00:14.777726 eth2  Out IP 10.0.29.2.50572 > 10.0.29.3.3784: BFDv1, Control, State Up, Flags: [none], length: 24
 00:00:14.815379 eth2  Out IP 10.0.29.2.41599 > 10.0.29.3.179: Flags [S], seq 987673689, win 64240, options [mss 1460,sackOK,TS val 2352444184 ecr 0,nop,wscale 10], length 0
 00:00:14.815448 eth2  In  IP 10.0.29.3.179 > 10.0.29.2.41599: Flags [S.], seq 3139874433, ack 987673690, win 65160, options [mss 1460,sackOK,TS val 562743920 ecr 2352444184,nop,wscale 10], length 0
 00:00:14.815475 eth2  Out IP 10.0.29.2.41599 > 10.0.29.3.179: Flags [.], ack 1, win 63, options [nop,nop,TS val 2352444184 ecr 562743920], length 0
 00:00:14.815595 eth2  In  IP 10.0.29.3.179 > 10.0.29.2.41599: Flags [F.], seq 1, ack 1, win 64, options [nop,nop,TS val 562743920 ecr 2352444184], length 0
 00:00:14.815626 eth2  Out IP 10.0.29.2.41599 > 10.0.29.3.179: Flags [P.], seq 1:65, ack 1, win 63, options [nop,nop,TS val 2352444184 ecr 562743920], length 64: BGP
 00:00:14.815693 eth2  In  IP 10.0.29.3.179 > 10.0.29.2.41599: Flags [R], seq 3139874434, win 0, length 0
 00:00:14.825913 eth2  In  IP 10.0.29.3.53139 > 10.0.29.2.3784: BFDv1, Control, State Up, Flags: [none], length: 24
 00:00:14.864141 eth2  Out IP 10.0.29.2.50572 > 10.0.29.3.3784: BFDv1, Control, State Up, Flags: [none], length: 24
 00:00:14.912430 eth2  In  IP 10.0.29.3.53139 > 10.0.29.2.3784: BFDv1, Control, State Up, Flags: [none], length: 24
 00:00:14.949680 eth2  Out IP 10.0.29.2.50572 > 10.0.29.3.3784: BFDv1, Control, State Up, Flags: [none], length: 24
 00:00:14.990902 eth2  In  IP 10.0.29.3.53139 > 10.0.29.2.3784: BFDv1, Control, State Up, Flags: [none], length: 24
 00:00:15.035142 eth2  Out IP 10.0.29.2.50572 > 10.0.29.3.3784: BFDv1, Control, State Up, Flags: [none], length: 24
 00:00:15.067376 eth2  In  IP 10.0.29.3.53139 > 10.0.29.2.3784: BFDv1, Control, State Up, Flags: [none], length: 24
 00:00:15.115705 eth2  Out IP 10.0.29.2.50572 > 10.0.29.3.3784: BFDv1, Control, State Up, Flags: [none], length: 24
 00:00:15.151900 eth2  In  IP 10.0.29.3.53139 > 10.0.29.2.3784: BFDv1, Control, State Up, Flags: [none], length: 24
 00:00:15.197108 eth2  Out IP 10.0.29.2.50572 > 10.0.29.3.3784: BFDv1, Control, State Up, Flags: [none], length: 24
 00:00:15.232343 eth2  In  IP 10.0.29.3.53139 > 10.0.29.2.3784: BFDv1, Control, State Up, Flags: [none], length: 24
 00:00:15.278609 eth2  Out IP 10.0.29.2.50572 > 10.0.29.3.3784: BFDv1, Control, State Up, Flags: [none], length: 24
 00:00:15.316923 eth2  In  IP 10.0.29.3.53139 > 10.0.29.2.3784: BFDv1, Control, State Up, Flags: [none], length: 24
 00:00:15.359209 eth2  Out IP 10.0.29.2.50572 > 10.0.29.3.3784: BFDv1, Control, State Up, Flags: [none], length: 24
 00:00:15.400422 eth2  In  IP 10.0.29.3.53139 > 10.0.29.2.3784: BFDv1, Control, State Up, Flags: [none], length: 24
 00:00:15.441715 eth2  Out IP 10.0.29.2.50572 > 10.0.29.3.3784: BFDv1, Control, State Up, Flags: [none], length: 24
 00:00:15.484106 eth2  In  IP 10.0.29.3.53139 > 10.0.29.2.3784: BFDv1, Control, State Up, Flags: [none], length: 24
 00:00:15.520358 eth2  Out IP 10.0.29.2.50572 > 10.0.29.3.3784: BFDv1, Control, State Up, Flags: [none], length: 24
 00:00:15.573536 eth2  In  IP 10.0.29.3.53139 > 10.0.29.2.3784: BFDv1, Control, State Up, Flags: [none], length: 24
 00:00:15.609763 eth2  Out IP 10.0.29.2.50572 > 10.0.29.3.3784: BFDv1, Control, State Up, Flags: [none], length: 24
 00:00:15.648975 eth2  In  IP 10.0.29.3.53139 > 10.0.29.2.3784: BFDv1, Control, State Up, Flags: [none], length: 24
 00:00:15.688313 eth2  Out IP 10.0.29.2.50572 > 10.0.29.3.3784: BFDv1, Control, State Up, Flags: [none], length: 24
 00:00:15.728494 eth2  In  IP 10.0.29.3.53139 > 10.0.29.2.3784: BFDv1, Control, State Up, Flags: [none], length: 24
 00:00:15.768251 eth2  Out IP 10.0.29.2.45725 > 10.0.29.3.179: Flags [FP.], seq 3143830198:3143830219, ack 3545701021, win 63, options [nop,nop,TS val 2352445137 ecr 562715057], length 21: BGP
 00:00:15.768328 eth2  In  IP 10.0.29.3.179 > 10.0.29.2.45725: Flags [R], seq 3545701021, win 0, length 0
 00:00:15.768955 eth2  In  IP 10.0.29.3.179 > 10.0.29.2.45725: Flags [FP.], seq 1:22, ack 0, win 64, options [nop,nop,TS val 562744873 ecr 2352415279], length 21: BGP
 00:00:15.768978 eth2  Out IP 10.0.29.2.45725 > 10.0.29.3.179: Flags [R], seq 3143830198, win 0, length 0
 00:00:15.771712 eth2  Out IP 10.0.29.2.50572 > 10.0.29.3.3784: BFDv1, Control, State Up, Flags: [none], length: 24
 00:00:15.814919 eth2  In  IP 10.0.29.3.53139 > 10.0.29.2.3784: BFDv1, Control, State Up, Flags: [none], length: 24
 00:00:15.853173 eth2  Out IP 10.0.29.2.50572 > 10.0.29.3.3784: BFDv1, Control, State Up, Flags: [none], length: 24
 00:00:15.891715 eth2  In  IP 10.0.29.3.53139 > 10.0.29.2.3784: BFDv1, Control, State Up, Flags: [none], length: 24
 00:00:15.933950 eth2  Out IP 10.0.29.2.50572 > 10.0.29.3.3784: BFDv1, Control, State Up, Flags: [none], length: 24
 00:00:15.980282 eth2  In  IP 10.0.29.3.53139 > 10.0.29.2.3784: BFDv1, Control, State Up, Flags: [none], length: 24
 00:00:16.010533 eth2  Out IP 10.0.29.2.50572 > 10.0.29.3.3784: BFDv1, Control, State Up, Flags: [none], length: 24
 00:00:16.056527 eth2  In  IP 10.0.29.3.53139 > 10.0.29.2.3784: BFDv1, Control, State Up, Flags: [none], length: 24
 00:00:16.090802 eth2  Out IP 10.0.29.2.50572 > 10.0.29.3.3784: BFDv1, Control, State Up, Flags: [none], length: 24
 00:00:16.134460 eth2  In  IP 10.0.29.3.53139 > 10.0.29.2.3784: BFDv1, Control, State Up, Flags: [none], length: 24
 00:00:16.166687 eth2  Out IP 10.0.29.2.50572 > 10.0.29.3.3784: BFDv1, Control, State Up, Flags: [none], length: 24
 00:00:16.216275 eth2  In  IP 10.0.29.3.53139 > 10.0.29.2.3784: BFDv1, Control, State Up, Flags: [none], length: 24
 00:00:16.246514 eth2  Out IP 10.0.29.2.50572 > 10.0.29.3.3784: BFDv1, Control, State Up, Flags: [none], length: 24
 00:00:16.294048 eth2  In  IP 10.0.29.3.53139 > 10.0.29.2.3784: BFDv1, Control, State Up, Flags: [none], length: 24
 00:00:16.331276 eth2  Out IP 10.0.29.2.50572 > 10.0.29.3.3784: BFDv1, Control, State Up, Flags: [none], length: 24
 00:00:16.379846 eth2  In  IP 10.0.29.3.53139 > 10.0.29.2.3784: BFDv1, Control, State Up, Flags: [none], length: 24
 00:00:16.406167 eth2  Out IP 10.0.29.2.50572 > 10.0.29.3.3784: BFDv1, Control, State Up, Flags: [none], length: 24
 00:00:16.460137 eth2  In  IP 10.0.29.3.53139 > 10.0.29.2.3784: BFDv1, Control, State Up, Flags: [none], length: 24
 00:00:16.493408 eth2  Out IP 10.0.29.2.50572 > 10.0.29.3.3784: BFDv1, Control, State Up, Flags: [none], length: 24
 00:00:16.548982 eth2  In  IP 10.0.29.3.53139 > 10.0.29.2.3784: BFDv1, Control, State Up, Flags: [none], length: 24
 00:00:16.572270 eth2  Out IP 10.0.29.2.50572 > 10.0.29.3.3784: BFDv1, Control, State Up, Flags: [none], length: 24
 00:00:16.634587 eth2  In  IP 10.0.29.3.53139 > 10.0.29.2.3784: BFDv1, Control, State Up, Flags: [none], length: 24
 00:00:16.659821 eth2  Out IP 10.0.29.2.50572 > 10.0.29.3.3784: BFDv1, Control, State Up, Flags: [none], length: 24
 00:00:16.718021 eth2  In  IP 10.0.29.3.53139 > 10.0.29.2.3784: BFDv1, Control, State Up, Flags: [none], length: 24
 00:00:16.748323 eth2  Out IP 10.0.29.2.50572 > 10.0.29.3.3784: BFDv1, Control, State Up, Flags: [none], length: 24
 00:00:16.802493 eth2  In  IP 10.0.29.3.53139 > 10.0.29.2.3784: BFDv1, Control, State Up, Flags: [none], length: 24
 00:00:16.833132 eth2  Out IP 10.0.29.2.50572 > 10.0.29.3.3784: BFDv1, Control, State Up, Flags: [none], length: 24
 00:00:16.887744 eth2  In  IP 10.0.29.3.53139 > 10.0.29.2.3784: BFDv1, Control, State Up, Flags: [none], length: 24
 00:00:16.914007 eth2  Out IP 10.0.29.2.50572 > 10.0.29.3.3784: BFDv1, Control, State Up, Flags: [none], length: 24
 00:00:16.963642 eth2  In  IP 10.0.29.3.53139 > 10.0.29.2.3784: BFDv1, Control, State Up, Flags: [none], length: 24
 00:00:17.001884 eth2  Out IP 10.0.29.2.50572 > 10.0.29.3.3784: BFDv1, Control, State Up, Flags: [none], length: 24
 00:00:17.052598 eth2  In  IP 10.0.29.3.53139 > 10.0.29.2.3784: BFDv1, Control, State Up, Flags: [none], length: 24
 00:00:17.077895 eth2  Out IP 10.0.29.2.50572 > 10.0.29.3.3784: BFDv1, Control, State Up, Flags: [none], length: 24
 00:00:17.135553 eth2  In  IP 10.0.29.3.53139 > 10.0.29.2.3784: BFDv1, Control, State Up, Flags: [none], length: 24
 00:00:17.154806 eth2  Out IP 10.0.29.2.50572 > 10.0.29.3.3784: BFDv1, Control, State Up, Flags: [none], length: 24
 00:00:17.222591 eth2  In  IP 10.0.29.3.53139 > 10.0.29.2.3784: BFDv1, Control, State Up, Flags: [none], length: 24
 00:00:17.234877 eth2  Out IP 10.0.29.2.50572 > 10.0.29.3.3784: BFDv1, Control, State Up, Flags: [none], length: 24
 00:00:17.300598 eth2  In  IP 10.0.29.3.53139 > 10.0.29.2.3784: BFDv1, Control, State Up, Flags: [none], length: 24
 00:00:17.311852 eth2  Out IP 10.0.29.2.50572 > 10.0.29.3.3784: BFDv1, Control, State Up, Flags: [none], length: 24
 00:00:17.387060 eth2  Out IP 10.0.29.2.50572 > 10.0.29.3.3784: BFDv1, Control, State Up, Flags: [none], length: 24
 00:00:17.389285 eth2  In  IP 10.0.29.3.53139 > 10.0.29.2.3784: BFDv1, Control, State Up, Flags: [none], length: 24
 00:00:17.473921 eth2  In  IP 10.0.29.3.53139 > 10.0.29.2.3784: BFDv1, Control, State Up, Flags: [none], length: 24
 00:00:17.477160 eth2  Out IP 10.0.29.2.50572 > 10.0.29.3.3784: BFDv1, Control, State Up, Flags: [none], length: 24
 00:00:17.559877 eth2  In  IP 10.0.29.3.53139 > 10.0.29.2.3784: BFDv1, Control, State Up, Flags: [none], length: 24
 00:00:17.563110 eth2  Out IP 10.0.29.2.50572 > 10.0.29.3.3784: BFDv1, Control, State Up, Flags: [none], length: 24
 00:00:17.642298 eth2  Out IP 10.0.29.2.50572 > 10.0.29.3.3784: BFDv1, Control, State Up, Flags: [none], length: 24
 00:00:17.649515 eth2  In  IP 10.0.29.3.53139 > 10.0.29.2.3784: BFDv1, Control, State Up, Flags: [none], length: 24
 00:00:17.724760 eth2  Out IP 10.0.29.2.50572 > 10.0.29.3.3784: BFDv1, Control, State Up, Flags: [none], length: 24
 00:00:17.733990 eth2  In  IP 10.0.29.3.53139 > 10.0.29.2.3784: BFDv1, Control, State Up, Flags: [none], length: 24
 00:00:17.802340 eth2  Out IP 10.0.29.2.50572 > 10.0.29.3.3784: BFDv1, Control, State Up, Flags: [none], length: 24
 00:00:17.815516 eth2  In  IP 10.0.29.3.53139 > 10.0.29.2.3784: BFDv1, Control, State Up, Flags: [none], length: 24
 00:00:17.887768 eth2  Out IP 10.0.29.2.50572 > 10.0.29.3.3784: BFDv1, Control, State Up, Flags: [none], length: 24
 00:00:17.894048 eth2  In  IP 10.0.29.3.53139 > 10.0.29.2.3784: BFDv1, Control, State Up, Flags: [none], length: 24
 00:00:17.969604 eth2  In  IP 10.0.29.3.53139 > 10.0.29.2.3784: BFDv1, Control, State Up, Flags: [none], length: 24
 00:00:17.975855 eth2  Out IP 10.0.29.2.50572 > 10.0.29.3.3784: BFDv1, Control, State Up, Flags: [none], length: 24
 00:00:18.050551 eth2  In  IP 10.0.29.3.53139 > 10.0.29.2.3784: BFDv1, Control, State Up, Flags: [none], length: 24
 00:00:18.057810 eth2  Out IP 10.0.29.2.50572 > 10.0.29.3.3784: BFDv1, Control, State Up, Flags: [none], length: 24
 00:00:18.129478 eth2  In  IP 10.0.29.3.53139 > 10.0.29.2.3784: BFDv1, Control, State Up, Flags: [none], length: 24
 00:00:18.142736 eth2  Out IP 10.0.29.2.50572 > 10.0.29.3.3784: BFDv1, Control, State Up, Flags: [none], length: 24
 00:00:18.209332 eth2  In  IP 10.0.29.3.53139 > 10.0.29.2.3784: BFDv1, Control, State Up, Flags: [none], length: 24
 00:00:18.218519 eth2  Out IP 10.0.29.2.50572 > 10.0.29.3.3784: BFDv1, Control, State Up, Flags: [none], length: 24
 00:00:18.294744 eth2  Out IP 10.0.29.2.50572 > 10.0.29.3.3784: BFDv1, Control, State Up, Flags: [none], length: 24
 00:00:18.297988 eth2  In  IP 10.0.29.3.53139 > 10.0.29.2.3784: BFDv1, Control, State Up, Flags: [none], length: 24
 00:00:18.369292 eth2  Out IP 10.0.29.2.50572 > 10.0.29.3.3784: BFDv1, Control, State Up, Flags: [none], length: 24
 00:00:18.375511 eth2  In  IP 10.0.29.3.53139 > 10.0.29.2.3784: BFDv1, Control, State Up, Flags: [none], length: 24
 00:00:18.450783 eth2  Out IP 10.0.29.2.50572 > 10.0.29.3.3784: BFDv1, Control, State Up, Flags: [none], length: 24
 00:00:18.454101 eth2  In  IP 10.0.29.3.53139 > 10.0.29.2.3784: BFDv1, Control, State Up, Flags: [none], length: 24
 00:00:18.527447 eth2  Out IP 10.0.29.2.50572 > 10.0.29.3.3784: BFDv1, Control, State Up, Flags: [none], length: 24
 00:00:18.539677 eth2  In  IP 10.0.29.3.53139 > 10.0.29.2.3784: BFDv1, Control, State Up, Flags: [none], length: 24
 00:00:18.608927 eth2  Out IP 10.0.29.2.50572 > 10.0.29.3.3784: BFDv1, Control, State Up, Flags: [none], length: 24
 00:00:18.625348 eth2  In  IP 10.0.29.3.53139 > 10.0.29.2.3784: BFDv1, Control, State Up, Flags: [none], length: 24
 00:00:18.689606 eth2  Out IP 10.0.29.2.50572 > 10.0.29.3.3784: BFDv1, Control, State Up, Flags: [none], length: 24
 00:00:18.712908 eth2  In  IP 10.0.29.3.53139 > 10.0.29.2.3784: BFDv1, Control, State Up, Flags: [none], length: 24
 00:00:18.771280 eth2  Out IP 10.0.29.2.50572 > 10.0.29.3.3784: BFDv1, Control, State Up, Flags: [none], length: 24
 00:00:18.788434 eth2  In  IP 10.0.29.3.53139 > 10.0.29.2.3784: BFDv1, Control, State Up, Flags: [none], length: 24
 00:00:18.846669 eth2  Out IP 10.0.29.2.50572 > 10.0.29.3.3784: BFDv1, Control, State Up, Flags: [none], length: 24
 00:00:18.864884 eth2  In  IP 10.0.29.3.53139 > 10.0.29.2.3784: BFDv1, Control, State Up, Flags: [none], length: 24
 00:00:18.928291 eth2  Out IP 10.0.29.2.50572 > 10.0.29.3.3784: BFDv1, Control, State Up, Flags: [none], length: 24
 00:00:18.954395 eth2  In  IP 10.0.29.3.53139 > 10.0.29.2.3784: BFDv1, Control, State Up, Flags: [none], length: 24
 00:00:19.006633 eth2  Out IP 10.0.29.2.50572 > 10.0.29.3.3784: BFDv1, Control, State Up, Flags: [none], length: 24
 00:00:19.033941 eth2  In  IP 10.0.29.3.53139 > 10.0.29.2.3784: BFDv1, Control, State Up, Flags: [none], length: 24
 00:00:19.086213 eth2  Out IP 10.0.29.2.50572 > 10.0.29.3.3784: BFDv1, Control, State Up, Flags: [none], length: 24
 00:00:19.111582 eth2  In  IP 10.0.29.3.53139 > 10.0.29.2.3784: BFDv1, Control, State Up, Flags: [none], length: 24
 00:00:19.164838 eth2  Out IP 10.0.29.2.50572 > 10.0.29.3.3784: BFDv1, Control, State Up, Flags: [none], length: 24
 00:00:19.177318 eth2  Out IP 10.0.29.2.35727 > 10.0.29.3.179: Flags [S], seq 2593484721, win 64240, options [mss 1460,sackOK,TS val 2352448546 ecr 0,nop,wscale 10], length 0
 00:00:19.177377 eth2  In  IP 10.0.29.3.179 > 10.0.29.2.35727: Flags [S.], seq 3755738808, ack 2593484722, win 65160, options [mss 1460,sackOK,TS val 562748282 ecr 2352448546,nop,wscale 10], length 0
 00:00:19.177408 eth2  Out IP 10.0.29.2.35727 > 10.0.29.3.179: Flags [.], ack 1, win 63, options [nop,nop,TS val 2352448546 ecr 562748282], length 0
 00:00:19.177490 eth2  Out IP 10.0.29.2.35727 > 10.0.29.3.179: Flags [P.], seq 1:65, ack 1, win 63, options [nop,nop,TS val 2352448546 ecr 562748282], length 64: BGP
 00:00:19.177509 eth2  In  IP 10.0.29.3.179 > 10.0.29.2.35727: Flags [.], ack 65, win 64, options [nop,nop,TS val 562748282 ecr 2352448546], length 0
 00:00:19.177566 eth2  In  IP 10.0.29.3.179 > 10.0.29.2.35727: Flags [R.], seq 1, ack 65, win 64, options [nop,nop,TS val 562748282 ecr 2352448546], length 0
 00:00:19.195162 eth2  In  IP 10.0.29.3.53139 > 10.0.29.2.3784: BFDv1, Control, State Up, Flags: [none], length: 24
 00:00:19.239536 eth2  Out IP 10.0.29.2.50572 > 10.0.29.3.3784: BFDv1, Control, State Up, Flags: [none], length: 24
 00:00:19.273843 eth2  In  IP 10.0.29.3.53139 > 10.0.29.2.3784: BFDv1, Control, State Up, Flags: [none], length: 24
 00:00:19.315120 eth2  Out IP 10.0.29.2.50572 > 10.0.29.3.3784: BFDv1, Control, State Up, Flags: [none], length: 24
 00:00:19.360268 eth2  In  IP 10.0.29.3.53139 > 10.0.29.2.3784: BFDv1, Control, State Up, Flags: [none], length: 24
 00:00:19.401512 eth2  Out IP 10.0.29.2.50572 > 10.0.29.3.3784: BFDv1, Control, State Up, Flags: [none], length: 24
 00:00:19.435848 eth2  In  IP 10.0.29.3.53139 > 10.0.29.2.3784: BFDv1, Control, State Up, Flags: [none], length: 24
 00:00:19.479125 eth2  Out IP 10.0.29.2.50572 > 10.0.29.3.3784: BFDv1, Control, State Up, Flags: [none], length: 24
 00:00:19.521554 eth2  In  IP 10.0.29.3.53139 > 10.0.29.2.3784: BFDv1, Control, State Up, Flags: [none], length: 24
 00:00:19.555812 eth2  Out IP 10.0.29.2.50572 > 10.0.29.3.3784: BFDv1, Control, State Up, Flags: [none], length: 24
 00:00:19.602091 eth2  In  IP 10.0.29.3.53139 > 10.0.29.2.3784: BFDv1, Control, State Up, Flags: [none], length: 24
 00:00:19.641291 eth2  Out IP 10.0.29.2.50572 > 10.0.29.3.3784: BFDv1, Control, State Up, Flags: [none], length: 24
 00:00:19.680511 eth2  In  IP 10.0.29.3.53139 > 10.0.29.2.3784: BFDv1, Control, State Up, Flags: [none], length: 24
 00:00:19.718750 eth2  Out IP 10.0.29.2.50572 > 10.0.29.3.3784: BFDv1, Control, State Up, Flags: [none], length: 24
 00:00:19.766413 eth2  In  IP 10.0.29.3.53139 > 10.0.29.2.3784: BFDv1, Control, State Up, Flags: [none], length: 24
 00:00:19.806649 eth2  Out IP 10.0.29.2.50572 > 10.0.29.3.3784: BFDv1, Control, State Up, Flags: [none], length: 24
 00:00:19.841289 eth2  In  IP 10.0.29.3.53139 > 10.0.29.2.3784: BFDv1, Control, State Up, Flags: [none], length: 24
 00:00:19.882559 eth2  Out IP 10.0.29.2.50572 > 10.0.29.3.3784: BFDv1, Control, State Up, Flags: [none], length: 24
 00:00:19.925270 eth2  In  IP 10.0.29.3.53139 > 10.0.29.2.3784: BFDv1, Control, State Up, Flags: [none], length: 24
 00:00:19.966561 eth2  Out IP 10.0.29.2.50572 > 10.0.29.3.3784: BFDv1, Control, State Up, Flags: [none], length: 24
 00:00:20.010148 eth2  In  IP 10.0.29.3.53139 > 10.0.29.2.3784: BFDv1, Control, State Up, Flags: [none], length: 24
 00:00:20.041386 eth2  Out IP 10.0.29.2.50572 > 10.0.29.3.3784: BFDv1, Control, State Up, Flags: [none], length: 24
 00:00:20.090054 eth2  In  IP 10.0.29.3.53139 > 10.0.29.2.3784: BFDv1, Control, State Up, Flags: [none], length: 24
 00:00:20.127383 eth2  Out IP 10.0.29.2.50572 > 10.0.29.3.3784: BFDv1, Control, State Up, Flags: [none], length: 24
 00:00:20.175047 eth2  In  IP 10.0.29.3.53139 > 10.0.29.2.3784: BFDv1, Control, State Up, Flags: [none], length: 24
 00:00:20.209359 eth2  Out IP 10.0.29.2.50572 > 10.0.29.3.3784: BFDv1, Control, State Up, Flags: [none], length: 24
 00:00:20.255988 eth2  In  IP 10.0.29.3.53139 > 10.0.29.2.3784: BFDv1, Control, State Up, Flags: [none], length: 24
 00:00:20.291328 eth2  Out IP 10.0.29.2.50572 > 10.0.29.3.3784: BFDv1, Control, State Up, Flags: [none], length: 24
 00:00:20.340975 eth2  In  IP 10.0.29.3.53139 > 10.0.29.2.3784: BFDv1, Control, State Up, Flags: [none], length: 24
 00:00:20.371259 eth2  Out IP 10.0.29.2.50572 > 10.0.29.3.3784: BFDv1, Control, State Up, Flags: [none], length: 24
 00:00:20.422915 eth2  In  IP 10.0.29.3.53139 > 10.0.29.2.3784: BFDv1, Control, State Up, Flags: [none], length: 24
 00:00:20.454166 eth2  Out IP 10.0.29.2.50572 > 10.0.29.3.3784: BFDv1, Control, State Up, Flags: [none], length: 24
 00:00:20.507779 eth2  In  IP 10.0.29.3.53139 > 10.0.29.2.3784: BFDv1, Control, State Up, Flags: [none], length: 24
 00:00:20.537034 eth2  Out IP 10.0.29.2.50572 > 10.0.29.3.3784: BFDv1, Control, State Up, Flags: [none], length: 24
 00:00:20.586691 eth2  In  IP 10.0.29.3.53139 > 10.0.29.2.3784: BFDv1, Control, State Up, Flags: [none], length: 24
 00:00:20.616942 eth2  Out IP 10.0.29.2.50572 > 10.0.29.3.3784: BFDv1, Control, State Up, Flags: [none], length: 24
 00:00:20.663573 eth2  In  IP 10.0.29.3.53139 > 10.0.29.2.3784: BFDv1, Control, State Up, Flags: [none], length: 24
 00:00:20.705869 eth2  Out IP 10.0.29.2.50572 > 10.0.29.3.3784: BFDv1, Control, State Up, Flags: [none], length: 24
 00:00:20.744272 eth2  In  IP 10.0.29.3.53139 > 10.0.29.2.3784: BFDv1, Control, State Up, Flags: [none], length: 24
 00:00:20.789527 eth2  Out IP 10.0.29.2.50572 > 10.0.29.3.3784: BFDv1, Control, State Up, Flags: [none], length: 24
 00:00:20.821905 eth2  In  IP 10.0.29.3.53139 > 10.0.29.2.3784: BFDv1, Control, State Up, Flags: [none], length: 24
 00:00:20.875147 eth2  Out IP 10.0.29.2.50572 > 10.0.29.3.3784: BFDv1, Control, State Up, Flags: [none], length: 24
 00:00:20.906505 eth2  In  IP 10.0.29.3.53139 > 10.0.29.2.3784: BFDv1, Control, State Up, Flags: [none], length: 24
 00:00:20.954764 eth2  Out IP 10.0.29.2.50572 > 10.0.29.3.3784: BFDv1, Control, State Up, Flags: [none], length: 24
 00:00:20.986252 eth2  In  IP 10.0.29.3.53139 > 10.0.29.2.3784: BFDv1, Control, State Up, Flags: [none], length: 24
 00:00:21.030575 eth2  Out IP 10.0.29.2.50572 > 10.0.29.3.3784: BFDv1, Control, State Up, Flags: [none], length: 24
 00:00:21.066030 eth2  In  IP 10.0.29.3.53139 > 10.0.29.2.3784: BFDv1, Control, State Up, Flags: [none], length: 24
 00:00:21.116367 eth2  Out IP 10.0.29.2.50572 > 10.0.29.3.3784: BFDv1, Control, State Up, Flags: [none], length: 24
 00:00:21.151848 eth2  In  IP 10.0.29.3.53139 > 10.0.29.2.3784: BFDv1, Control, State Up, Flags: [none], length: 24
 00:00:21.202103 eth2  Out IP 10.0.29.2.50572 > 10.0.29.3.3784: BFDv1, Control, State Up, Flags: [none], length: 24
 00:00:21.228496 eth2  In  IP 10.0.29.3.53139 > 10.0.29.2.3784: BFDv1, Control, State Up, Flags: [none], length: 24
 00:00:21.280755 eth2  Out IP 10.0.29.2.50572 > 10.0.29.3.3784: BFDv1, Control, State Up, Flags: [none], length: 24
 00:00:21.311207 eth2  In  IP 10.0.29.3.53139 > 10.0.29.2.3784: BFDv1, Control, State Up, Flags: [none], length: 24
 00:00:21.369468 eth2  Out IP 10.0.29.2.50572 > 10.0.29.3.3784: BFDv1, Control, State Up, Flags: [none], length: 24
 00:00:21.388714 eth2  In  IP 10.0.29.3.53139 > 10.0.29.2.3784: BFDv1, Control, State Up, Flags: [none], length: 24
 00:00:21.460373 eth2  Out IP 10.0.29.2.50572 > 10.0.29.3.3784: BFDv1, Control, State Up, Flags: [none], length: 24
 00:00:21.466595 eth2  In  IP 10.0.29.3.53139 > 10.0.29.2.3784: BFDv1, Control, State Up, Flags: [none], length: 24
 00:00:21.537858 eth2  Out IP 10.0.29.2.50572 > 10.0.29.3.3784: BFDv1, Control, State Up, Flags: [none], length: 24
 00:00:21.549248 eth2  In  IP 10.0.29.3.53139 > 10.0.29.2.3784: BFDv1, Control, State Up, Flags: [none], length: 24
 00:00:21.627540 eth2  Out IP 10.0.29.2.50572 > 10.0.29.3.3784: BFDv1, Control, State Up, Flags: [none], length: 24
 00:00:21.627697 eth2  In  IP 10.0.29.3.53139 > 10.0.29.2.3784: BFDv1, Control, State Up, Flags: [none], length: 24
 00:00:21.710885 eth2  Out IP 10.0.29.2.50572 > 10.0.29.3.3784: BFDv1, Control, State Up, Flags: [none], length: 24
 00:00:21.710982 eth2  In  IP 10.0.29.3.53139 > 10.0.29.2.3784: BFDv1, Control, State Up, Flags: [none], length: 24
 00:00:21.786232 eth2  Out IP 10.0.29.2.50572 > 10.0.29.3.3784: BFDv1, Control, State Up, Flags: [none], length: 24
 00:00:21.790421 eth2  In  IP 10.0.29.3.53139 > 10.0.29.2.3784: BFDv1, Control, State Up, Flags: [none], length: 24
 00:00:21.876690 eth2  Out IP 10.0.29.2.50572 > 10.0.29.3.3784: BFDv1, Control, State Up, Flags: [none], length: 24
 00:00:21.876910 eth2  In  IP 10.0.29.3.53139 > 10.0.29.2.3784: BFDv1, Control, State Up, Flags: [none], length: 24
 00:00:21.956144 eth2  Out IP 10.0.29.2.50572 > 10.0.29.3.3784: BFDv1, Control, State Up, Flags: [none], length: 24
 00:00:21.957464 eth2  In  IP 10.0.29.3.53139 > 10.0.29.2.3784: BFDv1, Control, State Up, Flags: [none], length: 24
 00:00:22.033694 eth2  Out IP 10.0.29.2.50572 > 10.0.29.3.3784: BFDv1, Control, State Up, Flags: [none], length: 24
 00:00:22.035886 eth2  In  IP 10.0.29.3.53139 > 10.0.29.2.3784: BFDv1, Control, State Up, Flags: [none], length: 24
 00:00:22.110098 eth2  Out IP 10.0.29.2.50572 > 10.0.29.3.3784: BFDv1, Control, State Up, Flags: [none], length: 24
 00:00:22.113366 eth2  In  IP 10.0.29.3.53139 > 10.0.29.2.3784: BFDv1, Control, State Up, Flags: [none], length: 24
 00:00:22.184634 eth2  Out IP 10.0.29.2.50572 > 10.0.29.3.3784: BFDv1, Control, State Up, Flags: [none], length: 24
 00:00:22.200846 eth2  In  IP 10.0.29.3.53139 > 10.0.29.2.3784: BFDv1, Control, State Up, Flags: [none], length: 24
 00:00:22.265152 eth2  Out IP 10.0.29.2.50572 > 10.0.29.3.3784: BFDv1, Control, State Up, Flags: [none], length: 24
 00:00:22.280390 eth2  In  IP 10.0.29.3.53139 > 10.0.29.2.3784: BFDv1, Control, State Up, Flags: [none], length: 24
 00:00:22.353706 eth2  Out IP 10.0.29.2.50572 > 10.0.29.3.3784: BFDv1, Control, State Up, Flags: [none], length: 24
 00:00:22.368930 eth2  In  IP 10.0.29.3.53139 > 10.0.29.2.3784: BFDv1, Control, State Up, Flags: [none], length: 24
 00:00:22.429208 eth2  Out IP 10.0.29.2.50572 > 10.0.29.3.3784: BFDv1, Control, State Up, Flags: [none], length: 24
 00:00:22.455392 eth2  In  IP 10.0.29.3.53139 > 10.0.29.2.3784: BFDv1, Control, State Up, Flags: [none], length: 24
 00:00:22.517657 eth2  Out IP 10.0.29.2.50572 > 10.0.29.3.3784: BFDv1, Control, State Up, Flags: [none], length: 24
 00:00:22.542001 eth2  In  IP 10.0.29.3.53139 > 10.0.29.2.3784: BFDv1, Control, State Up, Flags: [none], length: 24
 00:00:22.607364 eth2  Out IP 10.0.29.2.50572 > 10.0.29.3.3784: BFDv1, Control, State Up, Flags: [none], length: 24
 00:00:22.618776 eth2  In  IP 10.0.29.3.53139 > 10.0.29.2.3784: BFDv1, Control, State Up, Flags: [none], length: 24
 00:00:22.693075 eth2  Out IP 10.0.29.2.50572 > 10.0.29.3.3784: BFDv1, Control, State Up, Flags: [none], length: 24
 00:00:22.700288 eth2  In  IP 10.0.29.3.53139 > 10.0.29.2.3784: BFDv1, Control, State Up, Flags: [none], length: 24
 00:00:22.772575 eth2  Out IP 10.0.29.2.50572 > 10.0.29.3.3784: BFDv1, Control, State Up, Flags: [none], length: 24
 00:00:22.787005 eth2  In  IP 10.0.29.3.53139 > 10.0.29.2.3784: BFDv1, Control, State Up, Flags: [none], length: 24
 00:00:22.854248 eth2  Out IP 10.0.29.2.50572 > 10.0.29.3.3784: BFDv1, Control, State Up, Flags: [none], length: 24
 00:00:22.862485 eth2  In  IP 10.0.29.3.53139 > 10.0.29.2.3784: BFDv1, Control, State Up, Flags: [none], length: 24
 00:00:22.943712 eth2  Out IP 10.0.29.2.50572 > 10.0.29.3.3784: BFDv1, Control, State Up, Flags: [none], length: 24
 00:00:22.948932 eth2  In  IP 10.0.29.3.53139 > 10.0.29.2.3784: BFDv1, Control, State Up, Flags: [none], length: 24
 00:00:23.028562 eth2  In  IP 10.0.29.3.53139 > 10.0.29.2.3784: BFDv1, Control, State Up, Flags: [none], length: 24
 00:00:23.031736 eth2  Out IP 10.0.29.2.50572 > 10.0.29.3.3784: BFDv1, Control, State Up, Flags: [none], length: 24
 00:00:23.106861 eth2  In  IP 10.0.29.3.53139 > 10.0.29.2.3784: BFDv1, Control, State Up, Flags: [none], length: 24
 00:00:23.120438 eth2  Out IP 10.0.29.2.50572 > 10.0.29.3.3784: BFDv1, Control, State Up, Flags: [none], length: 24
 00:00:23.173242 eth2  Out IP 10.0.29.2.48681 > 10.0.29.3.179: Flags [S], seq 2061035034, win 64240, options [mss 1460,sackOK,TS val 2352452542 ecr 0,nop,wscale 10], length 0
 00:00:23.173296 eth2  In  IP 10.0.29.3.179 > 10.0.29.2.48681: Flags [S.], seq 4105683979, ack 2061035035, win 65160, options [mss 1460,sackOK,TS val 562752278 ecr 2352452542,nop,wscale 10], length 0
 00:00:23.173317 eth2  Out IP 10.0.29.2.48681 > 10.0.29.3.179: Flags [.], ack 1, win 63, options [nop,nop,TS val 2352452542 ecr 562752278], length 0
 00:00:23.173387 eth2  Out IP 10.0.29.2.48681 > 10.0.29.3.179: Flags [P.], seq 1:65, ack 1, win 63, options [nop,nop,TS val 2352452542 ecr 562752278], length 64: BGP
 00:00:23.173403 eth2  In  IP 10.0.29.3.179 > 10.0.29.2.48681: Flags [.], ack 65, win 64, options [nop,nop,TS val 562752278 ecr 2352452542], length 0
 00:00:23.173450 eth2  In  IP 10.0.29.3.179 > 10.0.29.2.48681: Flags [R.], seq 1, ack 65, win 64, options [nop,nop,TS val 562752278 ecr 2352452542], length 0
 00:00:23.184355 eth2  In  IP 10.0.29.3.53139 > 10.0.29.2.3784: BFDv1, Control, State Up, Flags: [none], length: 24
 00:00:23.199587 eth2  Out IP 10.0.29.2.50572 > 10.0.29.3.3784: BFDv1, Control, State Up, Flags: [none], length: 24
 00:00:23.262949 eth2  In  IP 10.0.29.3.53139 > 10.0.29.2.3784: BFDv1, Control, State Up, Flags: [none], length: 24
 00:00:23.276270 eth2  Out IP 10.0.29.2.50572 > 10.0.29.3.3784: BFDv1, Control, State Up, Flags: [none], length: 24
 00:00:23.339905 eth2  In  IP 10.0.29.3.53139 > 10.0.29.2.3784: BFDv1, Control, State Up, Flags: [none], length: 24
 00:00:23.358155 eth2  Out IP 10.0.29.2.50572 > 10.0.29.3.3784: BFDv1, Control, State Up, Flags: [none], length: 24
 00:00:23.420488 eth2  In  IP 10.0.29.3.53139 > 10.0.29.2.3784: BFDv1, Control, State Up, Flags: [none], length: 24
 00:00:23.443699 eth2  Out IP 10.0.29.2.50572 > 10.0.29.3.3784: BFDv1, Control, State Up, Flags: [none], length: 24
 00:00:23.509328 eth2  In  IP 10.0.29.3.53139 > 10.0.29.2.3784: BFDv1, Control, State Up, Flags: [none], length: 24
 00:00:23.530537 eth2  Out IP 10.0.29.2.50572 > 10.0.29.3.3784: BFDv1, Control, State Up, Flags: [none], length: 24
 00:00:23.585320 eth2  In  IP 10.0.29.3.53139 > 10.0.29.2.3784: BFDv1, Control, State Up, Flags: [none], length: 24
 00:00:23.615516 eth2  Out IP 10.0.29.2.50572 > 10.0.29.3.3784: BFDv1, Control, State Up, Flags: [none], length: 24
 00:00:23.664174 eth2  In  IP 10.0.29.3.53139 > 10.0.29.2.3784: BFDv1, Control, State Up, Flags: [none], length: 24
 00:00:23.700425 eth2  Out IP 10.0.29.2.50572 > 10.0.29.3.3784: BFDv1, Control, State Up, Flags: [none], length: 24
 00:00:23.747134 eth2  In  IP 10.0.29.3.53139 > 10.0.29.2.3784: BFDv1, Control, State Up, Flags: [none], length: 24
 00:00:23.786408 eth2  Out IP 10.0.29.2.50572 > 10.0.29.3.3784: BFDv1, Control, State Up, Flags: [none], length: 24
 00:00:23.837357 eth2  In  IP 10.0.29.3.53139 > 10.0.29.2.3784: BFDv1, Control, State Up, Flags: [none], length: 24
 00:00:23.874606 eth2  Out IP 10.0.29.2.50572 > 10.0.29.3.3784: BFDv1, Control, State Up, Flags: [none], length: 24
 00:00:23.912811 eth2  In  IP 10.0.29.3.53139 > 10.0.29.2.3784: BFDv1, Control, State Up, Flags: [none], length: 24
 00:00:23.958053 eth2  Out IP 10.0.29.2.50572 > 10.0.29.3.3784: BFDv1, Control, State Up, Flags: [none], length: 24
 00:00:23.991425 eth2  In  IP 10.0.29.3.53139 > 10.0.29.2.3784: BFDv1, Control, State Up, Flags: [none], length: 24
 00:00:24.037664 eth2  Out IP 10.0.29.2.50572 > 10.0.29.3.3784: BFDv1, Control, State Up, Flags: [none], length: 24
 00:00:24.081054 eth2  In  IP 10.0.29.3.53139 > 10.0.29.2.3784: BFDv1, Control, State Up, Flags: [none], length: 24
 00:00:24.127314 eth2  Out IP 10.0.29.2.50572 > 10.0.29.3.3784: BFDv1, Control, State Up, Flags: [none], length: 24
 00:00:24.168698 eth2  In  IP 10.0.29.3.53139 > 10.0.29.2.3784: BFDv1, Control, State Up, Flags: [none], length: 24
 00:00:24.209996 eth2  Out IP 10.0.29.2.50572 > 10.0.29.3.3784: BFDv1, Control, State Up, Flags: [none], length: 24
 00:00:24.244470 eth2  In  IP 10.0.29.3.53139 > 10.0.29.2.3784: BFDv1, Control, State Up, Flags: [none], length: 24
 00:00:24.293712 eth2  Out IP 10.0.29.2.50572 > 10.0.29.3.3784: BFDv1, Control, State Up, Flags: [none], length: 24
 00:00:24.334084 eth2  In  IP 10.0.29.3.53139 > 10.0.29.2.3784: BFDv1, Control, State Up, Flags: [none], length: 24
 00:00:24.369353 eth2  Out IP 10.0.29.2.50572 > 10.0.29.3.3784: BFDv1, Control, State Up, Flags: [none], length: 24
 00:00:24.417682 eth2  In  IP 10.0.29.3.53139 > 10.0.29.2.3784: BFDv1, Control, State Up, Flags: [none], length: 24
 00:00:24.453885 eth2  Out IP 10.0.29.2.50572 > 10.0.29.3.3784: BFDv1, Control, State Up, Flags: [none], length: 24
 00:00:24.499145 eth2  In  IP 10.0.29.3.53139 > 10.0.29.2.3784: BFDv1, Control, State Up, Flags: [none], length: 24
 00:00:24.537370 eth2  Out IP 10.0.29.2.50572 > 10.0.29.3.3784: BFDv1, Control, State Up, Flags: [none], length: 24
 00:00:24.581692 eth2  In  IP 10.0.29.3.53139 > 10.0.29.2.3784: BFDv1, Control, State Up, Flags: [none], length: 24
 00:00:24.618907 eth2  Out IP 10.0.29.2.50572 > 10.0.29.3.3784: BFDv1, Control, State Up, Flags: [none], length: 24
 00:00:24.660117 eth2  In  IP 10.0.29.3.53139 > 10.0.29.2.3784: BFDv1, Control, State Up, Flags: [none], length: 24
 00:00:24.701438 eth2  Out IP 10.0.29.2.50572 > 10.0.29.3.3784: BFDv1, Control, State Up, Flags: [none], length: 24
 00:00:24.741559 eth2  In  IP 10.0.29.3.53139 > 10.0.29.2.3784: BFDv1, Control, State Up, Flags: [none], length: 24
 00:00:24.784803 eth2  Out IP 10.0.29.2.50572 > 10.0.29.3.3784: BFDv1, Control, State Up, Flags: [none], length: 24
 00:00:24.824933 eth2  In  IP 10.0.29.3.53139 > 10.0.29.2.3784: BFDv1, Control, State Up, Flags: [none], length: 24
 00:00:24.864194 eth2  Out IP 10.0.29.2.50572 > 10.0.29.3.3784: BFDv1, Control, State Up, Flags: [none], length: 24
 00:00:24.912749 eth2  In  IP 10.0.29.3.53139 > 10.0.29.2.3784: BFDv1, Control, State Up, Flags: [none], length: 24
 00:00:24.945982 eth2  Out IP 10.0.29.2.50572 > 10.0.29.3.3784: BFDv1, Control, State Up, Flags: [none], length: 24
 00:00:24.992228 eth2  In  IP 10.0.29.3.53139 > 10.0.29.2.3784: BFDv1, Control, State Up, Flags: [none], length: 24
 00:00:25.025516 eth2  Out IP 10.0.29.2.50572 > 10.0.29.3.3784: BFDv1, Control, State Up, Flags: [none], length: 24
 00:00:25.078661 eth2  In  IP 10.0.29.3.53139 > 10.0.29.2.3784: BFDv1, Control, State Up, Flags: [none], length: 24
 00:00:25.108929 eth2  Out IP 10.0.29.2.50572 > 10.0.29.3.3784: BFDv1, Control, State Up, Flags: [none], length: 24
 00:00:25.155060 eth2  In  IP 10.0.29.3.53139 > 10.0.29.2.3784: BFDv1, Control, State Up, Flags: [none], length: 24
 00:00:25.197279 eth2  Out IP 10.0.29.2.50572 > 10.0.29.3.3784: BFDv1, Control, State Up, Flags: [none], length: 24
 00:00:25.237640 eth2  In  IP 10.0.29.3.53139 > 10.0.29.2.3784: BFDv1, Control, State Up, Flags: [none], length: 24
 00:00:25.275957 eth2  Out IP 10.0.29.2.50572 > 10.0.29.3.3784: BFDv1, Control, State Up, Flags: [none], length: 24
 00:00:25.323155 eth2  In  IP 10.0.29.3.53139 > 10.0.29.2.3784: BFDv1, Control, State Up, Flags: [none], length: 24
 00:00:25.357391 eth2  Out IP 10.0.29.2.50572 > 10.0.29.3.3784: BFDv1, Control, State Up, Flags: [none], length: 24
 00:00:25.400694 eth2  In  IP 10.0.29.3.53139 > 10.0.29.2.3784: BFDv1, Control, State Up, Flags: [none], length: 24
 00:00:25.443916 eth2  Out IP 10.0.29.2.50572 > 10.0.29.3.3784: BFDv1, Control, State Up, Flags: [none], length: 24
 00:00:25.477374 eth2  In  IP 10.0.29.3.53139 > 10.0.29.2.3784: BFDv1, Control, State Up, Flags: [none], length: 24
 00:00:25.527647 eth2  Out IP 10.0.29.2.50572 > 10.0.29.3.3784: BFDv1, Control, State Up, Flags: [none], length: 24
 00:00:25.565008 eth2  In  IP 10.0.29.3.53139 > 10.0.29.2.3784: BFDv1, Control, State Up, Flags: [none], length: 24
 00:00:25.604264 eth2  Out IP 10.0.29.2.50572 > 10.0.29.3.3784: BFDv1, Control, State Up, Flags: [none], length: 24
 00:00:25.649637 eth2  In  IP 10.0.29.3.53139 > 10.0.29.2.3784: BFDv1, Control, State Up, Flags: [none], length: 24
 00:00:25.683881 eth2  Out IP 10.0.29.2.50572 > 10.0.29.3.3784: BFDv1, Control, State Up, Flags: [none], length: 24
 00:00:25.727288 eth2  In  IP 10.0.29.3.53139 > 10.0.29.2.3784: BFDv1, Control, State Up, Flags: [none], length: 24
 00:00:25.766491 eth2  Out IP 10.0.29.2.50572 > 10.0.29.3.3784: BFDv1, Control, State Up, Flags: [none], length: 24
 00:00:25.806814 eth2  In  IP 10.0.29.3.53139 > 10.0.29.2.3784: BFDv1, Control, State Up, Flags: [none], length: 24
 00:00:25.844067 eth2  Out IP 10.0.29.2.50572 > 10.0.29.3.3784: BFDv1, Control, State Up, Flags: [none], length: 24
 00:00:25.889411 eth2  In  IP 10.0.29.3.53139 > 10.0.29.2.3784: BFDv1, Control, State Up, Flags: [none], length: 24
 00:00:25.931657 eth2  Out IP 10.0.29.2.50572 > 10.0.29.3.3784: BFDv1, Control, State Up, Flags: [none], length: 24
 00:00:25.974030 eth2  In  IP 10.0.29.3.53139 > 10.0.29.2.3784: BFDv1, Control, State Up, Flags: [none], length: 24
 00:00:26.009352 eth2  Out IP 10.0.29.2.50572 > 10.0.29.3.3784: BFDv1, Control, State Up, Flags: [none], length: 24
 00:00:26.055702 eth2  In  IP 10.0.29.3.53139 > 10.0.29.2.3784: BFDv1, Control, State Up, Flags: [none], length: 24
 00:00:26.097974 eth2  Out IP 10.0.29.2.50572 > 10.0.29.3.3784: BFDv1, Control, State Up, Flags: [none], length: 24
 00:00:26.136489 eth2  In  IP 10.0.29.3.53139 > 10.0.29.2.3784: BFDv1, Control, State Up, Flags: [none], length: 24
 00:00:26.180742 eth2  Out IP 10.0.29.2.50572 > 10.0.29.3.3784: BFDv1, Control, State Up, Flags: [none], length: 24
 00:00:26.211930 eth2  In  IP 10.0.29.3.53139 > 10.0.29.2.3784: BFDv1, Control, State Up, Flags: [none], length: 24
 00:00:26.267198 eth2  Out IP 10.0.29.2.50572 > 10.0.29.3.3784: BFDv1, Control, State Up, Flags: [none], length: 24
 00:00:26.295404 eth2  In  IP 10.0.29.3.53139 > 10.0.29.2.3784: BFDv1, Control, State Up, Flags: [none], length: 24
 00:00:26.352669 eth2  Out IP 10.0.29.2.50572 > 10.0.29.3.3784: BFDv1, Control, State Up, Flags: [none], length: 24
 00:00:26.384996 eth2  In  IP 10.0.29.3.53139 > 10.0.29.2.3784: BFDv1, Control, State Up, Flags: [none], length: 24
 00:00:26.434254 eth2  Out IP 10.0.29.2.50572 > 10.0.29.3.3784: BFDv1, Control, State Up, Flags: [none], length: 24
 00:00:26.469590 eth2  In  IP 10.0.29.3.53139 > 10.0.29.2.3784: BFDv1, Control, State Up, Flags: [none], length: 24
 00:00:26.512887 eth2  Out IP 10.0.29.2.50572 > 10.0.29.3.3784: BFDv1, Control, State Up, Flags: [none], length: 24
 00:00:26.560288 eth2  In  IP 10.0.29.3.53139 > 10.0.29.2.3784: BFDv1, Control, State Up, Flags: [none], length: 24
 00:00:26.603563 eth2  Out IP 10.0.29.2.50572 > 10.0.29.3.3784: BFDv1, Control, State Up, Flags: [none], length: 24
 00:00:26.648823 eth2  In  IP 10.0.29.3.53139 > 10.0.29.2.3784: BFDv1, Control, State Up, Flags: [none], length: 24
 00:00:26.682124 eth2  Out IP 10.0.29.2.50572 > 10.0.29.3.3784: BFDv1, Control, State Up, Flags: [none], length: 24
 00:00:26.734318 eth2  In  IP 10.0.29.3.53139 > 10.0.29.2.3784: BFDv1, Control, State Up, Flags: [none], length: 24
 00:00:26.769541 eth2  Out IP 10.0.29.2.50572 > 10.0.29.3.3784: BFDv1, Control, State Up, Flags: [none], length: 24
 00:00:26.813772 eth2  In  IP 10.0.29.3.53139 > 10.0.29.2.3784: BFDv1, Control, State Up, Flags: [none], length: 24
 00:00:26.853073 eth2  Out IP 10.0.29.2.50572 > 10.0.29.3.3784: BFDv1, Control, State Up, Flags: [none], length: 24
 00:00:26.890277 eth2  In  IP 10.0.29.3.53139 > 10.0.29.2.3784: BFDv1, Control, State Up, Flags: [none], length: 24
 00:00:26.933517 eth2  Out IP 10.0.29.2.50572 > 10.0.29.3.3784: BFDv1, Control, State Up, Flags: [none], length: 24
 00:00:26.979759 eth2  In  IP 10.0.29.3.53139 > 10.0.29.2.3784: BFDv1, Control, State Up, Flags: [none], length: 24
 00:00:27.014016 eth2  Out IP 10.0.29.2.50572 > 10.0.29.3.3784: BFDv1, Control, State Up, Flags: [none], length: 24
 00:00:27.068233 eth2  In  IP 10.0.29.3.53139 > 10.0.29.2.3784: BFDv1, Control, State Up, Flags: [none], length: 24
 00:00:27.091471 eth2  Out IP 10.0.29.2.50572 > 10.0.29.3.3784: BFDv1, Control, State Up, Flags: [none], length: 24
 00:00:27.143676 eth2  In  IP 10.0.29.3.53139 > 10.0.29.2.3784: BFDv1, Control, State Up, Flags: [none], length: 24
 00:00:27.177911 eth2  Out IP 10.0.29.2.50572 > 10.0.29.3.3784: BFDv1, Control, State Up, Flags: [none], length: 24
 00:00:27.227125 eth2  In  IP 10.0.29.3.53139 > 10.0.29.2.3784: BFDv1, Control, State Up, Flags: [none], length: 24
 00:00:27.265394 eth2  Out IP 10.0.29.2.50572 > 10.0.29.3.3784: BFDv1, Control, State Up, Flags: [none], length: 24
 00:00:27.306650 eth2  In  IP 10.0.29.3.53139 > 10.0.29.2.3784: BFDv1, Control, State Up, Flags: [none], length: 24
 00:00:27.351914 eth2  Out IP 10.0.29.2.50572 > 10.0.29.3.3784: BFDv1, Control, State Up, Flags: [none], length: 24
 00:00:27.394212 eth2  In  IP 10.0.29.3.53139 > 10.0.29.2.3784: BFDv1, Control, State Up, Flags: [none], length: 24
 00:00:27.441425 eth2  Out IP 10.0.29.2.50572 > 10.0.29.3.3784: BFDv1, Control, State Up, Flags: [none], length: 24
 00:00:27.473647 eth2  In  IP 10.0.29.3.53139 > 10.0.29.2.3784: BFDv1, Control, State Up, Flags: [none], length: 24
 00:00:27.520896 eth2  Out IP 10.0.29.2.50572 > 10.0.29.3.3784: BFDv1, Control, State Up, Flags: [none], length: 24
 00:00:27.555062 eth2  In  IP 10.0.29.3.53139 > 10.0.29.2.3784: BFDv1, Control, State Up, Flags: [none], length: 24
 00:00:27.596307 eth2  Out IP 10.0.29.2.50572 > 10.0.29.3.3784: BFDv1, Control, State Up, Flags: [none], length: 24
 00:00:27.620360 eth2  Out IP 10.0.29.2.59047 > 10.0.29.3.179: Flags [S], seq 1776228496, win 64240, options [mss 1460,sackOK,TS val 2352456989 ecr 0,nop,wscale 10], length 0
 00:00:27.620422 eth2  In  IP 10.0.29.3.179 > 10.0.29.2.59047: Flags [S.], seq 1019369552, ack 1776228497, win 65160, options [mss 1460,sackOK,TS val 562756725 ecr 2352456989,nop,wscale 10], length 0
 00:00:27.620450 eth2  Out IP 10.0.29.2.59047 > 10.0.29.3.179: Flags [.], ack 1, win 63, options [nop,nop,TS val 2352456989 ecr 562756725], length 0
 00:00:27.620530 eth2  Out IP 10.0.29.2.59047 > 10.0.29.3.179: Flags [P.], seq 1:65, ack 1, win 63, options [nop,nop,TS val 2352456989 ecr 562756725], length 64: BGP
 00:00:27.620547 eth2  In  IP 10.0.29.3.179 > 10.0.29.2.59047: Flags [.], ack 65, win 64, options [nop,nop,TS val 562756725 ecr 2352456989], length 0
 00:00:27.620593 eth2  In  IP 10.0.29.3.179 > 10.0.29.2.59047: Flags [R.], seq 1, ack 65, win 64, options [nop,nop,TS val 562756725 ecr 2352456989], length 0
 00:00:27.638498 eth2  In  IP 10.0.29.3.53139 > 10.0.29.2.3784: BFDv1, Control, State Up, Flags: [none], length: 24
 00:00:27.679738 eth2  Out IP 10.0.29.2.50572 > 10.0.29.3.3784: BFDv1, Control, State Up, Flags: [none], length: 24
 00:00:27.719960 eth2  In  IP 10.0.29.3.53139 > 10.0.29.2.3784: BFDv1, Control, State Up, Flags: [none], length: 24
 00:00:27.770236 eth2  Out IP 10.0.29.2.50572 > 10.0.29.3.3784: BFDv1, Control, State Up, Flags: [none], length: 24
 00:00:27.807452 eth2  In  IP 10.0.29.3.53139 > 10.0.29.2.3784: BFDv1, Control, State Up, Flags: [none], length: 24
 00:00:27.856664 eth2  Out IP 10.0.29.2.50572 > 10.0.29.3.3784: BFDv1, Control, State Up, Flags: [none], length: 24
 00:00:27.889856 eth2  In  IP 10.0.29.3.53139 > 10.0.29.2.3784: BFDv1, Control, State Up, Flags: [none], length: 24
 00:00:27.932112 eth2  Out IP 10.0.29.2.50572 > 10.0.29.3.3784: BFDv1, Control, State Up, Flags: [none], length: 24
 00:00:27.972372 eth2  In  IP 10.0.29.3.53139 > 10.0.29.2.3784: BFDv1, Control, State Up, Flags: [none], length: 24
 00:00:28.011614 eth2  Out IP 10.0.29.2.50572 > 10.0.29.3.3784: BFDv1, Control, State Up, Flags: [none], length: 24
 00:00:28.058818 eth2  In  IP 10.0.29.3.53139 > 10.0.29.2.3784: BFDv1, Control, State Up, Flags: [none], length: 24
 00:00:28.091067 eth2  Out IP 10.0.29.2.50572 > 10.0.29.3.3784: BFDv1, Control, State Up, Flags: [none], length: 24
 00:00:28.144279 eth2  In  IP 10.0.29.3.53139 > 10.0.29.2.3784: BFDv1, Control, State Up, Flags: [none], length: 24
 00:00:28.168525 eth2  Out IP 10.0.29.2.50572 > 10.0.29.3.3784: BFDv1, Control, State Up, Flags: [none], length: 24
 00:00:28.228743 eth2  In  IP 10.0.29.3.53139 > 10.0.29.2.3784: BFDv1, Control, State Up, Flags: [none], length: 24
 00:00:28.244997 eth2  Out IP 10.0.29.2.50572 > 10.0.29.3.3784: BFDv1, Control, State Up, Flags: [none], length: 24
 00:00:28.305239 eth2  In  IP 10.0.29.3.53139 > 10.0.29.2.3784: BFDv1, Control, State Up, Flags: [none], length: 24
 00:00:28.326485 eth2  Out IP 10.0.29.2.50572 > 10.0.29.3.3784: BFDv1, Control, State Up, Flags: [none], length: 24
 00:00:28.392710 eth2  In  IP 10.0.29.3.53139 > 10.0.29.2.3784: BFDv1, Control, State Up, Flags: [none], length: 24
 00:00:28.402917 eth2  Out IP 10.0.29.2.50572 > 10.0.29.3.3784: BFDv1, Control, State Up, Flags: [none], length: 24
 00:00:28.481264 eth2  In  IP 10.0.29.3.53139 > 10.0.29.2.3784: BFDv1, Control, State Up, Flags: [none], length: 24
 00:00:28.487504 eth2  Out IP 10.0.29.2.50572 > 10.0.29.3.3784: BFDv1, Control, State Up, Flags: [none], length: 24
 00:00:28.564684 eth2  Out IP 10.0.29.2.50572 > 10.0.29.3.3784: BFDv1, Control, State Up, Flags: [none], length: 24
 00:00:28.566899 eth2  In  IP 10.0.29.3.53139 > 10.0.29.2.3784: BFDv1, Control, State Up, Flags: [none], length: 24
 00:00:28.649245 eth2  In  IP 10.0.29.3.53139 > 10.0.29.2.3784: BFDv1, Control, State Up, Flags: [none], length: 24
 00:00:28.652477 eth2  Out IP 10.0.29.2.50572 > 10.0.29.3.3784: BFDv1, Control, State Up, Flags: [none], length: 24
 00:00:28.735013 eth2  In  IP 10.0.29.3.53139 > 10.0.29.2.3784: BFDv1, Control, State Up, Flags: [none], length: 24
 00:00:28.742298 eth2  Out IP 10.0.29.2.50572 > 10.0.29.3.3784: BFDv1, Control, State Up, Flags: [none], length: 24
 00:00:28.813680 eth2  In  IP 10.0.29.3.53139 > 10.0.29.2.3784: BFDv1, Control, State Up, Flags: [none], length: 24
 00:00:28.822928 eth2  Out IP 10.0.29.2.50572 > 10.0.29.3.3784: BFDv1, Control, State Up, Flags: [none], length: 24
 00:00:28.902390 eth2  In  IP 10.0.29.3.53139 > 10.0.29.2.3784: BFDv1, Control, State Up, Flags: [none], length: 24
 00:00:28.910638 eth2  Out IP 10.0.29.2.50572 > 10.0.29.3.3784: BFDv1, Control, State Up, Flags: [none], length: 24
 00:00:28.989879 eth2  Out IP 10.0.29.2.50572 > 10.0.29.3.3784: BFDv1, Control, State Up, Flags: [none], length: 24
 00:00:28.991122 eth2  In  IP 10.0.29.3.53139 > 10.0.29.2.3784: BFDv1, Control, State Up, Flags: [none], length: 24
 00:00:29.067400 eth2  Out IP 10.0.29.2.50572 > 10.0.29.3.3784: BFDv1, Control, State Up, Flags: [none], length: 24
 00:00:29.072688 eth2  In  IP 10.0.29.3.53139 > 10.0.29.2.3784: BFDv1, Control, State Up, Flags: [none], length: 24
 00:00:29.147947 eth2  Out IP 10.0.29.2.50572 > 10.0.29.3.3784: BFDv1, Control, State Up, Flags: [none], length: 24
 00:00:29.155268 eth2  In  IP 10.0.29.3.53139 > 10.0.29.2.3784: BFDv1, Control, State Up, Flags: [none], length: 24
 00:00:29.233557 eth2  Out IP 10.0.29.2.50572 > 10.0.29.3.3784: BFDv1, Control, State Up, Flags: [none], length: 24
 00:00:29.242810 eth2  In  IP 10.0.29.3.53139 > 10.0.29.2.3784: BFDv1, Control, State Up, Flags: [none], length: 24
 00:00:29.316057 eth2  Out IP 10.0.29.2.50572 > 10.0.29.3.3784: BFDv1, Control, State Up, Flags: [none], length: 24
 00:00:29.331442 eth2  In  IP 10.0.29.3.53139 > 10.0.29.2.3784: BFDv1, Control, State Up, Flags: [none], length: 24
 00:00:29.399746 eth2  Out IP 10.0.29.2.50572 > 10.0.29.3.3784: BFDv1, Control, State Up, Flags: [none], length: 24
 00:00:29.412124 eth2  In  IP 10.0.29.3.53139 > 10.0.29.2.3784: BFDv1, Control, State Up, Flags: [none], length: 24
 00:00:29.479484 eth2  Out IP 10.0.29.2.50572 > 10.0.29.3.3784: BFDv1, Control, State Up, Flags: [none], length: 24
 00:00:29.490714 eth2  In  IP 10.0.29.3.53139 > 10.0.29.2.3784: BFDv1, Control, State Up, Flags: [none], length: 24
 00:00:29.560021 eth2  Out IP 10.0.29.2.50572 > 10.0.29.3.3784: BFDv1, Control, State Up, Flags: [none], length: 24
 00:00:29.576358 eth2  In  IP 10.0.29.3.53139 > 10.0.29.2.3784: BFDv1, Control, State Up, Flags: [none], length: 24
 00:00:29.639616 eth2  Out IP 10.0.29.2.50572 > 10.0.29.3.3784: BFDv1, Control, State Up, Flags: [none], length: 24
 00:00:29.665070 eth2  In  IP 10.0.29.3.53139 > 10.0.29.2.3784: BFDv1, Control, State Up, Flags: [none], length: 24
 00:00:29.719444 eth2  Out IP 10.0.29.2.50572 > 10.0.29.3.3784: BFDv1, Control, State Up, Flags: [none], length: 24
 00:00:29.748419 eth2  In  IP 10.0.29.3.53139 > 10.0.29.2.3784: BFDv1, Control, State Up, Flags: [none], length: 24
 00:00:29.803765 eth2  Out IP 10.0.29.2.50572 > 10.0.29.3.3784: BFDv1, Control, State Up, Flags: [none], length: 24
 00:00:29.831209 eth2  In  IP 10.0.29.3.53139 > 10.0.29.2.3784: BFDv1, Control, State Up, Flags: [none], length: 24
 00:00:29.883510 eth2  Out IP 10.0.29.2.50572 > 10.0.29.3.3784: BFDv1, Control, State Up, Flags: [none], length: 24
 00:00:29.917885 eth2  In  IP 10.0.29.3.53139 > 10.0.29.2.3784: BFDv1, Control, State Up, Flags: [none], length: 24
 00:00:29.971175 eth2  Out IP 10.0.29.2.50572 > 10.0.29.3.3784: BFDv1, Control, State Up, Flags: [none], length: 24
 00:00:30.000509 eth2  In  IP 10.0.29.3.53139 > 10.0.29.2.3784: BFDv1, Control, State Up, Flags: [none], length: 24
 00:00:30.057835 eth2  Out IP 10.0.29.2.50572 > 10.0.29.3.3784: BFDv1, Control, State Up, Flags: [none], length: 24
 00:00:30.080152 eth2  In  IP 10.0.29.3.53139 > 10.0.29.2.3784: BFDv1, Control, State Up, Flags: [none], length: 24
 00:00:30.141527 eth2  Out IP 10.0.29.2.50572 > 10.0.29.3.3784: BFDv1, Control, State Up, Flags: [none], length: 24
 00:00:30.168842 eth2  In  IP 10.0.29.3.53139 > 10.0.29.2.3784: BFDv1, Control, State Up, Flags: [none], length: 24
 00:00:30.228165 eth2  Out IP 10.0.29.2.50572 > 10.0.29.3.3784: BFDv1, Control, State Up, Flags: [none], length: 24
 00:00:30.250490 eth2  In  IP 10.0.29.3.53139 > 10.0.29.2.3784: BFDv1, Control, State Up, Flags: [none], length: 24
 00:00:30.314799 eth2  Out IP 10.0.29.2.50572 > 10.0.29.3.3784: BFDv1, Control, State Up, Flags: [none], length: 24
 00:00:30.329034 eth2  In  IP 10.0.29.3.53139 > 10.0.29.2.3784: BFDv1, Control, State Up, Flags: [none], length: 24

573 packets captured
575 packets received by filter
0 packets dropped by kernel
