tcpdump: data link type LINUX_SLL2
tcpdump: verbose output suppressed, use -v[v]... for full protocol decode
listening on any, link-type LINUX_SLL2 (Linux cooked v2), snapshot length 262144 bytes
 00:00:00.000000 eth1  In  IP 10.0.29.3.54084 > 10.0.29.2.3784: BFDv1, Control, State Up, Flags: [none], length: 24
 00:00:00.015235 eth1  Out IP 10.0.29.2.44783 > 10.0.29.3.3784: BFDv1, Control, State Up, Flags: [none], length: 24
 00:00:00.081404 eth1  In  IP 10.0.29.3.54084 > 10.0.29.2.3784: BFDv1, Control, State Up, Flags: [none], length: 24
 00:00:00.100750 eth1  Out IP 10.0.29.2.44783 > 10.0.29.3.3784: BFDv1, Control, State Up, Flags: [none], length: 24
 00:00:00.170800 eth1  In  IP 10.0.29.3.54084 > 10.0.29.2.3784: BFDv1, Control, State Up, Flags: [none], length: 24
 00:00:00.179043 eth1  Out IP 10.0.29.2.44783 > 10.0.29.3.3784: BFDv1, Control, State Up, Flags: [none], length: 24
 00:00:00.257323 eth1  In  IP 10.0.29.3.54084 > 10.0.29.2.3784: BFDv1, Control, State Up, Flags: [none], length: 24
 00:00:00.257417 eth1  Out IP 10.0.29.2.44783 > 10.0.29.3.3784: BFDv1, Control, State Up, Flags: [none], length: 24
 00:00:00.339764 eth1  In  IP 10.0.29.3.54084 > 10.0.29.2.3784: BFDv1, Control, State Up, Flags: [none], length: 24
 00:00:00.346222 eth1  Out IP 10.0.29.2.44783 > 10.0.29.3.3784: BFDv1, Control, State Up, Flags: [none], length: 24
 00:00:00.424526 eth1  Out IP 10.0.29.2.44783 > 10.0.29.3.3784: BFDv1, Control, State Up, Flags: [none], length: 24
 00:00:00.427791 eth1  In  IP 10.0.29.3.54084 > 10.0.29.2.3784: BFDv1, Control, State Up, Flags: [none], length: 24
 00:00:00.501197 eth1  Out IP 10.0.29.2.44783 > 10.0.29.3.3784: BFDv1, Control, State Up, Flags: [none], length: 24
 00:00:00.517247 eth1  In  IP 10.0.29.3.54084 > 10.0.29.2.3784: BFDv1, Control, State Up, Flags: [none], length: 24
 00:00:00.583631 eth1  Out IP 10.0.29.2.44783 > 10.0.29.3.3784: BFDv1, Control, State Up, Flags: [none], length: 24
 00:00:00.605936 eth1  In  IP 10.0.29.3.54084 > 10.0.29.2.3784: BFDv1, Control, State Up, Flags: [none], length: 24
 00:00:00.662234 eth1  Out IP 10.0.29.2.44783 > 10.0.29.3.3784: BFDv1, Control, State Up, Flags: [none], length: 24
 00:00:00.693658 eth1  In  IP 10.0.29.3.54084 > 10.0.29.2.3784: BFDv1, Control, State Up, Flags: [none], length: 24
 00:00:00.746006 eth1  Out IP 10.0.29.2.44783 > 10.0.29.3.3784: BFDv1, Control, State Up, Flags: [none], length: 24
 00:00:00.773384 eth1  In  IP 10.0.29.3.54084 > 10.0.29.2.3784: BFDv1, Control, State Up, Flags: [none], length: 24
 00:00:00.833811 eth1  Out IP 10.0.29.2.44783 > 10.0.29.3.3784: BFDv1, Control, State Up, Flags: [none], length: 24
 00:00:00.850142 eth1  In  IP 10.0.29.3.54084 > 10.0.29.2.3784: BFDv1, Control, State Up, Flags: [none], length: 24
 00:00:00.922510 eth1  Out IP 10.0.29.2.44783 > 10.0.29.3.3784: BFDv1, Control, State Up, Flags: [none], length: 24
 00:00:00.928748 eth1  In  IP 10.0.29.3.54084 > 10.0.29.2.3784: BFDv1, Control, State Up, Flags: [none], length: 24
 00:00:00.999153 eth1  Out IP 10.0.29.2.44783 > 10.0.29.3.3784: BFDv1, Control, State Up, Flags: [none], length: 24
 00:00:01.013889 eth1  In  IP 10.0.29.3.54084 > 10.0.29.2.3784: BFDv1, Control, State Up, Flags: [none], length: 24
 00:00:01.084342 eth1  Out IP 10.0.29.2.44783 > 10.0.29.3.3784: BFDv1, Control, State Up, Flags: [none], length: 24
 00:00:01.102556 eth1  In  IP 10.0.29.3.54084 > 10.0.29.2.3784: BFDv1, Control, State Up, Flags: [none], length: 24
 00:00:01.173979 eth1  Out IP 10.0.29.2.44783 > 10.0.29.3.3784: BFDv1, Control, State Up, Flags: [none], length: 24
 00:00:01.190419 eth1  In  IP 10.0.29.3.54084 > 10.0.29.2.3784: BFDv1, Control, State Up, Flags: [none], length: 24
 00:00:01.270813 eth1  Out IP 10.0.29.2.44783 > 10.0.29.3.3784: BFDv1, Control, State Up, Flags: [none], length: 24
 00:00:01.280230 eth1  In  IP 10.0.29.3.54084 > 10.0.29.2.3784: BFDv1, Control, State Up, Flags: [none], length: 24
 00:00:01.339657 eth1  Out IP 10.0.29.2.44783 > 10.0.29.3.3784: BFDv1, Control, State Up, Flags: [none], length: 24
 00:00:01.358940 eth1  In  IP 10.0.29.3.54084 > 10.0.29.2.3784: BFDv1, Control, State Up, Flags: [none], length: 24
 00:00:01.428332 eth1  Out IP 10.0.29.2.44783 > 10.0.29.3.3784: BFDv1, Control, State Up, Flags: [none], length: 24
 00:00:01.443626 eth1  In  IP 10.0.29.3.54084 > 10.0.29.2.3784: BFDv1, Control, State Up, Flags: [none], length: 24
 00:00:01.508090 eth1  Out IP 10.0.29.2.44783 > 10.0.29.3.3784: BFDv1, Control, State Up, Flags: [none], length: 24
 00:00:01.528398 eth1  In  IP 10.0.29.3.54084 > 10.0.29.2.3784: BFDv1, Control, State Up, Flags: [none], length: 24
 00:00:01.595792 eth1  Out IP 10.0.29.2.44783 > 10.0.29.3.3784: BFDv1, Control, State Up, Flags: [none], length: 24
 00:00:01.614258 eth1  In  IP 10.0.29.3.54084 > 10.0.29.2.3784: BFDv1, Control, State Up, Flags: [none], length: 24
 00:00:01.676248 eth1  Out IP 10.0.29.2.44783 > 10.0.29.3.3784: BFDv1, Control, State Up, Flags: [none], length: 24
 00:00:01.696728 eth1  In  IP 10.0.29.3.54084 > 10.0.29.2.3784: BFDv1, Control, State Up, Flags: [none], length: 24
 00:00:01.754117 eth1  Out IP 10.0.29.2.44783 > 10.0.29.3.3784: BFDv1, Control, State Up, Flags: [none], length: 24
 00:00:01.775520 eth1  In  IP 10.0.29.3.54084 > 10.0.29.2.3784: BFDv1, Control, State Up, Flags: [none], length: 24
 00:00:01.838924 eth1  Out IP 10.0.29.2.44783 > 10.0.29.3.3784: BFDv1, Control, State Up, Flags: [none], length: 24
 00:00:01.856479 eth1  In  IP 10.0.29.3.54084 > 10.0.29.2.3784: BFDv1, Control, State Up, Flags: [none], length: 24
 00:00:01.922953 eth1  Out IP 10.0.29.2.44783 > 10.0.29.3.3784: BFDv1, Control, State Up, Flags: [none], length: 24
 00:00:01.943432 eth1  In  IP 10.0.29.3.54084 > 10.0.29.2.3784: BFDv1, Control, State Up, Flags: [none], length: 24
 00:00:02.008079 eth1  Out IP 10.0.29.2.44783 > 10.0.29.3.3784: BFDv1, Control, State Up, Flags: [none], length: 24
 00:00:02.026290 eth2  Out IP 10.0.29.2.179 > 10.0.29.3.53285: Flags [P.], seq 2803253295:2803253316, ack 1298210847, win 64, options [nop,nop,TS val 1877169496 ecr 3829908524], length 21: BGP
 00:00:02.026424 eth2  Out IP 10.0.29.2.179 > 10.0.29.3.53285: Flags [F.], seq 21, ack 1, win 64, options [nop,nop,TS val 1877169496 ecr 3829908524], length 0
 00:00:02.026468 eth2  Out IP 10.0.12.3.51192 > 10.0.12.2.179: Flags [P.], seq 221769968:221770003, ack 3568890115, win 63, options [nop,nop,TS val 627526886 ecr 398362296], length 35: BGP
 00:00:02.026501 eth2  In  IP 10.0.12.2.179 > 10.0.12.3.51192: Flags [.], ack 35, win 64, options [nop,nop,TS val 398378242 ecr 627526886], length 0
 00:00:02.026527 eth2  Out IP 10.0.12.3.51192 > 10.0.12.2.179: Flags [P.], seq 35:80, ack 1, win 63, options [nop,nop,TS val 627526886 ecr 398378242], length 45: BGP
 00:00:02.026538 eth2  In  IP 10.0.12.2.179 > 10.0.12.3.51192: Flags [.], ack 80, win 64, options [nop,nop,TS val 398378242 ecr 627526886], length 0
 00:00:02.026826 eth2  In  IP 10.0.12.2.179 > 10.0.12.3.51192: Flags [P.], seq 1:55, ack 80, win 64, options [nop,nop,TS val 398378242 ecr 627526886], length 54: BGP
 00:00:02.026841 eth2  Out IP 10.0.12.3.51192 > 10.0.12.2.179: Flags [.], ack 55, win 63, options [nop,nop,TS val 627526886 ecr 398378242], length 0
 00:00:02.030181 eth2  Out IP 10.0.29.2.179 > 10.0.29.3.53285: Flags [F.], seq 21, ack 1, win 64, options [nop,nop,TS val 1877169500 ecr 3829908524], length 0
 00:00:02.237206 eth2  Out IP 10.0.29.2.179 > 10.0.29.3.53285: Flags [FP.], seq 0:21, ack 1, win 64, options [nop,nop,TS val 1877169707 ecr 3829908524], length 21: BGP
 00:00:02.645178 eth2  Out IP 10.0.29.2.179 > 10.0.29.3.53285: Flags [FP.], seq 0:21, ack 1, win 64, options [nop,nop,TS val 1877170115 ecr 3829908524], length 21: BGP
 00:00:03.494168 eth2  Out IP 10.0.29.2.179 > 10.0.29.3.53285: Flags [FP.], seq 0:21, ack 1, win 64, options [nop,nop,TS val 1877170964 ecr 3829908524], length 21: BGP
 00:00:05.157181 eth2  Out IP 10.0.29.2.179 > 10.0.29.3.53285: Flags [FP.], seq 0:21, ack 1, win 64, options [nop,nop,TS val 1877172627 ecr 3829908524], length 21: BGP
 00:00:08.421266 eth2  Out IP 10.0.29.2.179 > 10.0.29.3.53285: Flags [FP.], seq 0:21, ack 1, win 64, options [nop,nop,TS val 1877175891 ecr 3829908524], length 21: BGP
 00:00:10.112645 eth2  Out IP 10.0.12.3.51192 > 10.0.12.2.179: Flags [P.], seq 80:128, ack 55, win 63, options [nop,nop,TS val 627534972 ecr 398378242], length 48: BGP
 00:00:10.113022 eth1  Out IP 10.0.29.2.37234 > 10.0.29.3.3784: BFDv1, Control, State Down, Flags: [none], length: 24
 00:00:10.113729 eth2  In  IP 10.0.12.2.179 > 10.0.12.3.51192: Flags [P.], seq 55:82, ack 128, win 64, options [nop,nop,TS val 398386329 ecr 627534972], length 27: BGP
 00:00:10.113751 eth2  Out IP 10.0.12.3.51192 > 10.0.12.2.179: Flags [.], ack 82, win 63, options [nop,nop,TS val 627534973 ecr 398386329], length 0
 00:00:10.114325 eth2  Out IP 10.0.12.3.51192 > 10.0.12.2.179: Flags [P.], seq 128:173, ack 82, win 63, options [nop,nop,TS val 627534974 ecr 398386329], length 45: BGP
 00:00:10.155174 eth2  In  IP 10.0.12.2.179 > 10.0.12.3.51192: Flags [.], ack 173, win 64, options [nop,nop,TS val 398386371 ecr 627534974], length 0
 00:00:10.761336 eth1  In  IP 10.0.29.3.35408 > 10.0.29.2.3784: BFDv1, Control, State Init, Flags: [none], length: 24
 00:00:10.761599 eth1  Out IP 10.0.29.2.37234 > 10.0.29.3.3784: BFDv1, Control, State Up, Flags: [Poll], length: 24
 00:00:10.761851 eth1  In  IP 10.0.29.3.35408 > 10.0.29.2.3784: BFDv1, Control, State Up, Flags: [Final], length: 24
 00:00:10.761892 eth1  In  IP 10.0.29.3.35408 > 10.0.29.2.3784: BFDv1, Control, State Up, Flags: [Poll], length: 24
 00:00:10.761943 eth1  Out IP 10.0.29.2.37234 > 10.0.29.3.3784: BFDv1, Control, State Up, Flags: [Final], length: 24
 00:00:10.842212 eth1  Out IP 10.0.29.2.37234 > 10.0.29.3.3784: BFDv1, Control, State Up, Flags: [none], length: 24
 00:00:10.845413 eth1  In  IP 10.0.29.3.35408 > 10.0.29.2.3784: BFDv1, Control, State Up, Flags: [none], length: 24
 00:00:10.920762 eth1  Out IP 10.0.29.2.37234 > 10.0.29.3.3784: BFDv1, Control, State Up, Flags: [none], length: 24
 00:00:10.935016 eth1  In  IP 10.0.29.3.35408 > 10.0.29.2.3784: BFDv1, Control, State Up, Flags: [none], length: 24
 00:00:11.004444 eth1  Out IP 10.0.29.2.37234 > 10.0.29.3.3784: BFDv1, Control, State Up, Flags: [none], length: 24
 00:00:11.021720 eth1  In  IP 10.0.29.3.35408 > 10.0.29.2.3784: BFDv1, Control, State Up, Flags: [none], length: 24
 00:00:11.090411 eth1  Out IP 10.0.29.2.37234 > 10.0.29.3.3784: BFDv1, Control, State Up, Flags: [none], length: 24
 00:00:11.110018 eth1  In  IP 10.0.29.3.35408 > 10.0.29.2.3784: BFDv1, Control, State Up, Flags: [none], length: 24
 00:00:11.173885 eth1  Out IP 10.0.29.2.37234 > 10.0.29.3.3784: BFDv1, Control, State Up, Flags: [none], length: 24
 00:00:11.198392 eth1  In  IP 10.0.29.3.35408 > 10.0.29.2.3784: BFDv1, Control, State Up, Flags: [none], length: 24
 00:00:11.249819 eth1  Out IP 10.0.29.2.37234 > 10.0.29.3.3784: BFDv1, Control, State Up, Flags: [none], length: 24
 00:00:11.278328 eth1  In  IP 10.0.29.3.35408 > 10.0.29.2.3784: BFDv1, Control, State Up, Flags: [none], length: 24
 00:00:11.333776 eth1  Out IP 10.0.29.2.37234 > 10.0.29.3.3784: BFDv1, Control, State Up, Flags: [none], length: 24
 00:00:11.365960 eth1  In  IP 10.0.29.3.35408 > 10.0.29.2.3784: BFDv1, Control, State Up, Flags: [none], length: 24
 00:00:11.415337 eth1  Out IP 10.0.29.2.37234 > 10.0.29.3.3784: BFDv1, Control, State Up, Flags: [none], length: 24
 00:00:11.443349 eth1  In  IP 10.0.29.3.35408 > 10.0.29.2.3784: BFDv1, Control, State Up, Flags: [none], length: 24
 00:00:11.493707 eth1  Out IP 10.0.29.2.37234 > 10.0.29.3.3784: BFDv1, Control, State Up, Flags: [none], length: 24
 00:00:11.524143 eth1  In  IP 10.0.29.3.35408 > 10.0.29.2.3784: BFDv1, Control, State Up, Flags: [none], length: 24
 00:00:11.571532 eth1  Out IP 10.0.29.2.37234 > 10.0.29.3.3784: BFDv1, Control, State Up, Flags: [none], length: 24
 00:00:11.607765 eth1  In  IP 10.0.29.3.35408 > 10.0.29.2.3784: BFDv1, Control, State Up, Flags: [none], length: 24
 00:00:11.653232 eth1  Out IP 10.0.29.2.37234 > 10.0.29.3.3784: BFDv1, Control, State Up, Flags: [none], length: 24
 00:00:11.693941 eth1  In  IP 10.0.29.3.35408 > 10.0.29.2.3784: BFDv1, Control, State Up, Flags: [none], length: 24
 00:00:11.737320 eth1  Out IP 10.0.29.2.37234 > 10.0.29.3.3784: BFDv1, Control, State Up, Flags: [none], length: 24
 00:00:11.780379 eth1  In  IP 10.0.29.3.35408 > 10.0.29.2.3784: BFDv1, Control, State Up, Flags: [none], length: 24
 00:00:11.824756 eth1  Out IP 10.0.29.2.37234 > 10.0.29.3.3784: BFDv1, Control, State Up, Flags: [none], length: 24
 00:00:11.857095 eth1  In  IP 10.0.29.3.35408 > 10.0.29.2.3784: BFDv1, Control, State Up, Flags: [none], length: 24
 00:00:11.904517 eth1  Out IP 10.0.29.2.37234 > 10.0.29.3.3784: BFDv1, Control, State Up, Flags: [none], length: 24
 00:00:11.944633 eth1  In  IP 10.0.29.3.35408 > 10.0.29.2.3784: BFDv1, Control, State Up, Flags: [none], length: 24
 00:00:11.992024 eth1  Out IP 10.0.29.2.37234 > 10.0.29.3.3784: BFDv1, Control, State Up, Flags: [none], length: 24
 00:00:12.027386 eth1  In  IP 10.0.29.3.35408 > 10.0.29.2.3784: BFDv1, Control, State Up, Flags: [none], length: 24
 00:00:12.077823 eth1  Out IP 10.0.29.2.37234 > 10.0.29.3.3784: BFDv1, Control, State Up, Flags: [none], length: 24
 00:00:12.103005 eth1  In  IP 10.0.29.3.35408 > 10.0.29.2.3784: BFDv1, Control, State Up, Flags: [none], length: 24
 00:00:12.162407 eth1  Out IP 10.0.29.2.37234 > 10.0.29.3.3784: BFDv1, Control, State Up, Flags: [none], length: 24
 00:00:12.178774 eth1  In  IP 10.0.29.3.35408 > 10.0.29.2.3784: BFDv1, Control, State Up, Flags: [none], length: 24
 00:00:12.238225 eth1  Out IP 10.0.29.2.37234 > 10.0.29.3.3784: BFDv1, Control, State Up, Flags: [none], length: 24
 00:00:12.263434 eth1  In  IP 10.0.29.3.35408 > 10.0.29.2.3784: BFDv1, Control, State Up, Flags: [none], length: 24
 00:00:12.318537 eth1  Out IP 10.0.29.2.37234 > 10.0.29.3.3784: BFDv1, Control, State Up, Flags: [none], length: 24
 00:00:12.349336 eth1  In  IP 10.0.29.3.35408 > 10.0.29.2.3784: BFDv1, Control, State Up, Flags: [none], length: 24
 00:00:12.395729 eth1  Out IP 10.0.29.2.37234 > 10.0.29.3.3784: BFDv1, Control, State Up, Flags: [none], length: 24
 00:00:12.428013 eth1  In  IP 10.0.29.3.35408 > 10.0.29.2.3784: BFDv1, Control, State Up, Flags: [none], length: 24
 00:00:12.481492 eth1  Out IP 10.0.29.2.37234 > 10.0.29.3.3784: BFDv1, Control, State Up, Flags: [none], length: 24
 00:00:12.507761 eth1  In  IP 10.0.29.3.35408 > 10.0.29.2.3784: BFDv1, Control, State Up, Flags: [none], length: 24
 00:00:12.571165 eth1  Out IP 10.0.29.2.37234 > 10.0.29.3.3784: BFDv1, Control, State Up, Flags: [none], length: 24
 00:00:12.586441 eth1  In  IP 10.0.29.3.35408 > 10.0.29.2.3784: BFDv1, Control, State Up, Flags: [none], length: 24
 00:00:12.648848 eth1  Out IP 10.0.29.2.37234 > 10.0.29.3.3784: BFDv1, Control, State Up, Flags: [none], length: 24
 00:00:12.663202 eth1  In  IP 10.0.29.3.35408 > 10.0.29.2.3784: BFDv1, Control, State Up, Flags: [none], length: 24
 00:00:12.732621 eth1  Out IP 10.0.29.2.37234 > 10.0.29.3.3784: BFDv1, Control, State Up, Flags: [none], length: 24
 00:00:12.739955 eth1  In  IP 10.0.29.3.35408 > 10.0.29.2.3784: BFDv1, Control, State Up, Flags: [none], length: 24
 00:00:12.816599 eth1  In  IP 10.0.29.3.35408 > 10.0.29.2.3784: BFDv1, Control, State Up, Flags: [none], length: 24
 00:00:12.816825 eth1  Out IP 10.0.29.2.37234 > 10.0.29.3.3784: BFDv1, Control, State Up, Flags: [none], length: 24
 00:00:12.892455 eth1  In  IP 10.0.29.3.35408 > 10.0.29.2.3784: BFDv1, Control, State Up, Flags: [none], length: 24
 00:00:12.906212 eth1  Out IP 10.0.29.2.37234 > 10.0.29.3.3784: BFDv1, Control, State Up, Flags: [none], length: 24
 00:00:12.973974 eth1  In  IP 10.0.29.3.35408 > 10.0.29.2.3784: BFDv1, Control, State Up, Flags: [none], length: 24
 00:00:12.987419 eth1  Out IP 10.0.29.2.37234 > 10.0.29.3.3784: BFDv1, Control, State Up, Flags: [none], length: 24
 00:00:13.057521 eth1  In  IP 10.0.29.3.35408 > 10.0.29.2.3784: BFDv1, Control, State Up, Flags: [none], length: 24
 00:00:13.074988 eth1  Out IP 10.0.29.2.37234 > 10.0.29.3.3784: BFDv1, Control, State Up, Flags: [none], length: 24
 00:00:13.138959 eth1  In  IP 10.0.29.3.35408 > 10.0.29.2.3784: BFDv1, Control, State Up, Flags: [none], length: 24
 00:00:13.153471 eth1  Out IP 10.0.29.2.37234 > 10.0.29.3.3784: BFDv1, Control, State Up, Flags: [none], length: 24
 00:00:13.214225 eth1  In  IP 10.0.29.3.35408 > 10.0.29.2.3784: BFDv1, Control, State Up, Flags: [none], length: 24
 00:00:13.236621 eth1  Out IP 10.0.29.2.37234 > 10.0.29.3.3784: BFDv1, Control, State Up, Flags: [none], length: 24
 00:00:13.303177 eth1  In  IP 10.0.29.3.35408 > 10.0.29.2.3784: BFDv1, Control, State Up, Flags: [none], length: 24
 00:00:13.315586 eth1  Out IP 10.0.29.2.37234 > 10.0.29.3.3784: BFDv1, Control, State Up, Flags: [none], length: 24
 00:00:13.392885 eth1  In  IP 10.0.29.3.35408 > 10.0.29.2.3784: BFDv1, Control, State Up, Flags: [none], length: 24
 00:00:13.398505 eth1  Out IP 10.0.29.2.37234 > 10.0.29.3.3784: BFDv1, Control, State Up, Flags: [none], length: 24
 00:00:13.480321 eth1  In  IP 10.0.29.3.35408 > 10.0.29.2.3784: BFDv1, Control, State Up, Flags: [none], length: 24
 00:00:13.485725 eth1  Out IP 10.0.29.2.37234 > 10.0.29.3.3784: BFDv1, Control, State Up, Flags: [none], length: 24
 00:00:13.562898 eth1  In  IP 10.0.29.3.35408 > 10.0.29.2.3784: BFDv1, Control, State Up, Flags: [none], length: 24
 00:00:13.572342 eth1  Out IP 10.0.29.2.37234 > 10.0.29.3.3784: BFDv1, Control, State Up, Flags: [none], length: 24
 00:00:13.639440 eth1  In  IP 10.0.29.3.35408 > 10.0.29.2.3784: BFDv1, Control, State Up, Flags: [none], length: 24
 00:00:13.651826 eth1  Out IP 10.0.29.2.37234 > 10.0.29.3.3784: BFDv1, Control, State Up, Flags: [none], length: 24
 00:00:13.717814 eth1  In  IP 10.0.29.3.35408 > 10.0.29.2.3784: BFDv1, Control, State Up, Flags: [none], length: 24
 00:00:13.731243 eth1  Out IP 10.0.29.2.37234 > 10.0.29.3.3784: BFDv1, Control, State Up, Flags: [none], length: 24
 00:00:13.799611 eth1  In  IP 10.0.29.3.35408 > 10.0.29.2.3784: BFDv1, Control, State Up, Flags: [none], length: 24
 00:00:13.819943 eth1  Out IP 10.0.29.2.37234 > 10.0.29.3.3784: BFDv1, Control, State Up, Flags: [none], length: 24
 00:00:13.881314 eth1  In  IP 10.0.29.3.35408 > 10.0.29.2.3784: BFDv1, Control, State Up, Flags: [none], length: 24
 00:00:13.896428 eth1  Out IP 10.0.29.2.56815 > 10.0.29.3.179: Flags [S], seq 76061768, win 64240, options [mss 1460,sackOK,TS val 1877181366 ecr 0,nop,wscale 10], length 0
 00:00:13.896522 eth1  In  IP 10.0.29.3.179 > 10.0.29.2.56815: Flags [S.], seq 2682965586, ack 76061769, win 65160, options [mss 1460,sackOK,TS val 3829936340 ecr 1877181366,nop,wscale 10], length 0
 00:00:13.896559 eth1  Out IP 10.0.29.2.56815 > 10.0.29.3.179: Flags [.], ack 1, win 63, options [nop,nop,TS val 1877181366 ecr 3829936340], length 0
 00:00:13.896734 eth1  Out IP 10.0.29.2.56815 > 10.0.29.3.179: Flags [P.], seq 1:65, ack 1, win 63, options [nop,nop,TS val 1877181366 ecr 3829936340], length 64: BGP
 00:00:13.896764 eth1  In  IP 10.0.29.3.179 > 10.0.29.2.56815: Flags [.], ack 65, win 64, options [nop,nop,TS val 3829936340 ecr 1877181366], length 0
 00:00:13.896894 eth1  In  IP 10.0.29.3.179 > 10.0.29.2.56815: Flags [R.], seq 1, ack 65, win 64, options [nop,nop,TS val 3829936340 ecr 1877181366], length 0
 00:00:13.906675 eth1  Out IP 10.0.29.2.37234 > 10.0.29.3.3784: BFDv1, Control, State Up, Flags: [none], length: 24
 00:00:13.960015 eth1  In  IP 10.0.29.3.35408 > 10.0.29.2.3784: BFDv1, Control, State Up, Flags: [none], length: 24
 00:00:13.983436 eth1  Out IP 10.0.29.2.37234 > 10.0.29.3.3784: BFDv1, Control, State Up, Flags: [none], length: 24
 00:00:14.043477 eth1  In  IP 10.0.29.3.35408 > 10.0.29.2.3784: BFDv1, Control, State Up, Flags: [none], length: 24
 00:00:14.069904 eth1  Out IP 10.0.29.2.37234 > 10.0.29.3.3784: BFDv1, Control, State Up, Flags: [none], length: 24
 00:00:14.125872 eth1  In  IP 10.0.29.3.35408 > 10.0.29.2.3784: BFDv1, Control, State Up, Flags: [none], length: 24
 00:00:14.156283 eth1  Out IP 10.0.29.2.37234 > 10.0.29.3.3784: BFDv1, Control, State Up, Flags: [none], length: 24
 00:00:14.211571 eth1  In  IP 10.0.29.3.35408 > 10.0.29.2.3784: BFDv1, Control, State Up, Flags: [none], length: 24
 00:00:14.237999 eth1  Out IP 10.0.29.2.37234 > 10.0.29.3.3784: BFDv1, Control, State Up, Flags: [none], length: 24
 00:00:14.299637 eth1  In  IP 10.0.29.3.35408 > 10.0.29.2.3784: BFDv1, Control, State Up, Flags: [none], length: 24
 00:00:14.322146 eth1  Out IP 10.0.29.2.37234 > 10.0.29.3.3784: BFDv1, Control, State Up, Flags: [none], length: 24
 00:00:14.379934 eth1  In  IP 10.0.29.3.35408 > 10.0.29.2.3784: BFDv1, Control, State Up, Flags: [none], length: 24
 00:00:14.403477 eth1  Out IP 10.0.29.2.37234 > 10.0.29.3.3784: BFDv1, Control, State Up, Flags: [none], length: 24
 00:00:14.469104 eth1  In  IP 10.0.29.3.35408 > 10.0.29.2.3784: BFDv1, Control, State Up, Flags: [none], length: 24
 00:00:14.493470 eth1  Out IP 10.0.29.2.37234 > 10.0.29.3.3784: BFDv1, Control, State Up, Flags: [none], length: 24
 00:00:14.557522 eth1  In  IP 10.0.29.3.35408 > 10.0.29.2.3784: BFDv1, Control, State Up, Flags: [none], length: 24
 00:00:14.578931 eth1  Out IP 10.0.29.2.37234 > 10.0.29.3.3784: BFDv1, Control, State Up, Flags: [none], length: 24
 00:00:14.637829 eth1  In  IP 10.0.29.3.35408 > 10.0.29.2.3784: BFDv1, Control, State Up, Flags: [none], length: 24
 00:00:14.665192 eth1  Out IP 10.0.29.2.37234 > 10.0.29.3.3784: BFDv1, Control, State Up, Flags: [none], length: 24
 00:00:14.720732 eth1  In  IP 10.0.29.3.35408 > 10.0.29.2.3784: BFDv1, Control, State Up, Flags: [none], length: 24
 00:00:14.742211 eth1  Out IP 10.0.29.2.37234 > 10.0.29.3.3784: BFDv1, Control, State Up, Flags: [none], length: 24
 00:00:14.801539 eth1  In  IP 10.0.29.3.35408 > 10.0.29.2.3784: BFDv1, Control, State Up, Flags: [none], length: 24
 00:00:14.822909 eth1  Out IP 10.0.29.2.37234 > 10.0.29.3.3784: BFDv1, Control, State Up, Flags: [none], length: 24
 00:00:14.883077 eth1  In  IP 10.0.29.3.35408 > 10.0.29.2.3784: BFDv1, Control, State Up, Flags: [none], length: 24
 00:00:14.908501 eth1  Out IP 10.0.29.2.37234 > 10.0.29.3.3784: BFDv1, Control, State Up, Flags: [none], length: 24
 00:00:14.971658 eth1  In  IP 10.0.29.3.35408 > 10.0.29.2.3784: BFDv1, Control, State Up, Flags: [none], length: 24
 00:00:14.988022 eth1  Out IP 10.0.29.2.37234 > 10.0.29.3.3784: BFDv1, Control, State Up, Flags: [none], length: 24
 00:00:15.061267 eth1  In  IP 10.0.29.3.35408 > 10.0.29.2.3784: BFDv1, Control, State Up, Flags: [none], length: 24
 00:00:15.077713 eth1  Out IP 10.0.29.2.37234 > 10.0.29.3.3784: BFDv1, Control, State Up, Flags: [none], length: 24
 00:00:15.136839 eth1  In  IP 10.0.29.3.35408 > 10.0.29.2.3784: BFDv1, Control, State Up, Flags: [none], length: 24
 00:00:15.141184 eth1  Out IP 10.0.29.2.179 > 10.0.29.3.53285: Flags [FP.], seq 0:21, ack 1, win 64, options [nop,nop,TS val 1877182611 ecr 3829908524], length 21: BGP
 00:00:15.141323 eth1  In  IP 10.0.29.3.53285 > 10.0.29.2.179: Flags [R], seq 1298210847, win 0, length 0
 00:00:15.157336 eth1  Out IP 10.0.29.2.37234 > 10.0.29.3.3784: BFDv1, Control, State Up, Flags: [none], length: 24
 00:00:15.217448 eth1  In  IP 10.0.29.3.35408 > 10.0.29.2.3784: BFDv1, Control, State Up, Flags: [none], length: 24
 00:00:15.235868 eth1  Out IP 10.0.29.2.37234 > 10.0.29.3.3784: BFDv1, Control, State Up, Flags: [none], length: 24
 00:00:15.305019 eth1  In  IP 10.0.29.3.35408 > 10.0.29.2.3784: BFDv1, Control, State Up, Flags: [none], length: 24
 00:00:15.317468 eth1  Out IP 10.0.29.2.37234 > 10.0.29.3.3784: BFDv1, Control, State Up, Flags: [none], length: 24
 00:00:15.394238 eth1  In  IP 10.0.29.3.35408 > 10.0.29.2.3784: BFDv1, Control, State Up, Flags: [none], length: 24
 00:00:15.394488 eth1  Out IP 10.0.29.2.37234 > 10.0.29.3.3784: BFDv1, Control, State Up, Flags: [none], length: 24
 00:00:15.476795 eth1  Out IP 10.0.29.2.37234 > 10.0.29.3.3784: BFDv1, Control, State Up, Flags: [none], length: 24
 00:00:15.480853 eth1  In  IP 10.0.29.3.35408 > 10.0.29.2.3784: BFDv1, Control, State Up, Flags: [none], length: 24
 00:00:15.555242 eth1  In  IP 10.0.29.3.35408 > 10.0.29.2.3784: BFDv1, Control, State Up, Flags: [none], length: 24
 00:00:15.565648 eth1  Out IP 10.0.29.2.37234 > 10.0.29.3.3784: BFDv1, Control, State Up, Flags: [none], length: 24
 00:00:15.632121 eth1  In  IP 10.0.29.3.35408 > 10.0.29.2.3784: BFDv1, Control, State Up, Flags: [none], length: 24
 00:00:15.646496 eth1  Out IP 10.0.29.2.37234 > 10.0.29.3.3784: BFDv1, Control, State Up, Flags: [none], length: 24
 00:00:15.709936 eth1  In  IP 10.0.29.3.35408 > 10.0.29.2.3784: BFDv1, Control, State Up, Flags: [none], length: 24
 00:00:15.736342 eth1  Out IP 10.0.29.2.37234 > 10.0.29.3.3784: BFDv1, Control, State Up, Flags: [none], length: 24
 00:00:15.797854 eth1  In  IP 10.0.29.3.35408 > 10.0.29.2.3784: BFDv1, Control, State Up, Flags: [none], length: 24
 00:00:15.822311 eth1  Out IP 10.0.29.2.37234 > 10.0.29.3.3784: BFDv1, Control, State Up, Flags: [none], length: 24
 00:00:15.872619 eth1  In  IP 10.0.29.3.35408 > 10.0.29.2.3784: BFDv1, Control, State Up, Flags: [none], length: 24
 00:00:15.900007 eth1  Out IP 10.0.29.2.37234 > 10.0.29.3.3784: BFDv1, Control, State Up, Flags: [none], length: 24
 00:00:15.961263 eth1  In  IP 10.0.29.3.35408 > 10.0.29.2.3784: BFDv1, Control, State Up, Flags: [none], length: 24
 00:00:15.978630 eth1  Out IP 10.0.29.2.37234 > 10.0.29.3.3784: BFDv1, Control, State Up, Flags: [none], length: 24
 00:00:16.040368 eth1  In  IP 10.0.29.3.35408 > 10.0.29.2.3784: BFDv1, Control, State Up, Flags: [none], length: 24
 00:00:16.068782 eth1  Out IP 10.0.29.2.37234 > 10.0.29.3.3784: BFDv1, Control, State Up, Flags: [none], length: 24
 00:00:16.122241 eth1  In  IP 10.0.29.3.35408 > 10.0.29.2.3784: BFDv1, Control, State Up, Flags: [none], length: 24
 00:00:16.145659 eth1  Out IP 10.0.29.2.37234 > 10.0.29.3.3784: BFDv1, Control, State Up, Flags: [none], length: 24
 00:00:16.208009 eth1  In  IP 10.0.29.3.35408 > 10.0.29.2.3784: BFDv1, Control, State Up, Flags: [none], length: 24
 00:00:16.235812 eth1  Out IP 10.0.29.2.37234 > 10.0.29.3.3784: BFDv1, Control, State Up, Flags: [none], length: 24
 00:00:16.289093 eth1  In  IP 10.0.29.3.35408 > 10.0.29.2.3784: BFDv1, Control, State Up, Flags: [none], length: 24
 00:00:16.320525 eth1  Out IP 10.0.29.2.37234 > 10.0.29.3.3784: BFDv1, Control, State Up, Flags: [none], length: 24
 00:00:16.369840 eth1  In  IP 10.0.29.3.35408 > 10.0.29.2.3784: BFDv1, Control, State Up, Flags: [none], length: 24
 00:00:16.399210 eth1  Out IP 10.0.29.2.37234 > 10.0.29.3.3784: BFDv1, Control, State Up, Flags: [none], length: 24
 00:00:16.445486 eth1  In  IP 10.0.29.3.35408 > 10.0.29.2.3784: BFDv1, Control, State Up, Flags: [none], length: 24
 00:00:16.488954 eth1  Out IP 10.0.29.2.37234 > 10.0.29.3.3784: BFDv1, Control, State Up, Flags: [none], length: 24
 00:00:16.533221 eth1  In  IP 10.0.29.3.35408 > 10.0.29.2.3784: BFDv1, Control, State Up, Flags: [none], length: 24
 00:00:16.575618 eth1  Out IP 10.0.29.2.37234 > 10.0.29.3.3784: BFDv1, Control, State Up, Flags: [none], length: 24
 00:00:16.619913 eth1  In  IP 10.0.29.3.35408 > 10.0.29.2.3784: BFDv1, Control, State Up, Flags: [none], length: 24
 00:00:16.665594 eth1  Out IP 10.0.29.2.37234 > 10.0.29.3.3784: BFDv1, Control, State Up, Flags: [none], length: 24
 00:00:16.695902 eth1  In  IP 10.0.29.3.35408 > 10.0.29.2.3784: BFDv1, Control, State Up, Flags: [none], length: 24
 00:00:16.752314 eth1  Out IP 10.0.29.2.37234 > 10.0.29.3.3784: BFDv1, Control, State Up, Flags: [none], length: 24
 00:00:16.772655 eth1  In  IP 10.0.29.3.35408 > 10.0.29.2.3784: BFDv1, Control, State Up, Flags: [none], length: 24
 00:00:16.830114 eth1  Out IP 10.0.29.2.37234 > 10.0.29.3.3784: BFDv1, Control, State Up, Flags: [none], length: 24
 00:00:16.858431 eth1  In  IP 10.0.29.3.35408 > 10.0.29.2.3784: BFDv1, Control, State Up, Flags: [none], length: 24
 00:00:16.912749 eth1  Out IP 10.0.29.2.37234 > 10.0.29.3.3784: BFDv1, Control, State Up, Flags: [none], length: 24
 00:00:16.939011 eth1  In  IP 10.0.29.3.35408 > 10.0.29.2.3784: BFDv1, Control, State Up, Flags: [none], length: 24
 00:00:16.991510 eth1  Out IP 10.0.29.2.37234 > 10.0.29.3.3784: BFDv1, Control, State Up, Flags: [none], length: 24
 00:00:17.020709 eth1  In  IP 10.0.29.3.35408 > 10.0.29.2.3784: BFDv1, Control, State Up, Flags: [none], length: 24
 00:00:17.067988 eth1  Out IP 10.0.29.2.37234 > 10.0.29.3.3784: BFDv1, Control, State Up, Flags: [none], length: 24
 00:00:17.109220 eth1  In  IP 10.0.29.3.35408 > 10.0.29.2.3784: BFDv1, Control, State Up, Flags: [none], length: 24
 00:00:17.145506 eth1  Out IP 10.0.29.2.37234 > 10.0.29.3.3784: BFDv1, Control, State Up, Flags: [none], length: 24
 00:00:17.188762 eth1  In  IP 10.0.29.3.35408 > 10.0.29.2.3784: BFDv1, Control, State Up, Flags: [none], length: 24
 00:00:17.236398 eth1  Out IP 10.0.29.2.37234 > 10.0.29.3.3784: BFDv1, Control, State Up, Flags: [none], length: 24
 00:00:17.277663 eth1  In  IP 10.0.29.3.35408 > 10.0.29.2.3784: BFDv1, Control, State Up, Flags: [none], length: 24
 00:00:17.315009 eth1  Out IP 10.0.29.2.37234 > 10.0.29.3.3784: BFDv1, Control, State Up, Flags: [none], length: 24
 00:00:17.367233 eth1  In  IP 10.0.29.3.35408 > 10.0.29.2.3784: BFDv1, Control, State Up, Flags: [none], length: 24
 00:00:17.398469 eth1  Out IP 10.0.29.2.37234 > 10.0.29.3.3784: BFDv1, Control, State Up, Flags: [none], length: 24
 00:00:17.446665 eth1  In  IP 10.0.29.3.35408 > 10.0.29.2.3784: BFDv1, Control, State Up, Flags: [none], length: 24
 00:00:17.484334 eth1  Out IP 10.0.29.2.37234 > 10.0.29.3.3784: BFDv1, Control, State Up, Flags: [none], length: 24
 00:00:17.533319 eth1  In  IP 10.0.29.3.35408 > 10.0.29.2.3784: BFDv1, Control, State Up, Flags: [none], length: 24
 00:00:17.568640 eth1  Out IP 10.0.29.2.37234 > 10.0.29.3.3784: BFDv1, Control, State Up, Flags: [none], length: 24
 00:00:17.613848 eth1  In  IP 10.0.29.3.35408 > 10.0.29.2.3784: BFDv1, Control, State Up, Flags: [none], length: 24
 00:00:17.650192 eth1  Out IP 10.0.29.2.37234 > 10.0.29.3.3784: BFDv1, Control, State Up, Flags: [none], length: 24
 00:00:17.689431 eth1  In  IP 10.0.29.3.35408 > 10.0.29.2.3784: BFDv1, Control, State Up, Flags: [none], length: 24
 00:00:17.739750 eth1  Out IP 10.0.29.2.37234 > 10.0.29.3.3784: BFDv1, Control, State Up, Flags: [none], length: 24
 00:00:17.778007 eth1  In  IP 10.0.29.3.35408 > 10.0.29.2.3784: BFDv1, Control, State Up, Flags: [none], length: 24
 00:00:17.827380 eth1  Out IP 10.0.29.2.37234 > 10.0.29.3.3784: BFDv1, Control, State Up, Flags: [none], length: 24
 00:00:17.856615 eth1  In  IP 10.0.29.3.35408 > 10.0.29.2.3784: BFDv1, Control, State Up, Flags: [none], length: 24
 00:00:17.915930 eth1  Out IP 10.0.29.2.37234 > 10.0.29.3.3784: BFDv1, Control, State Up, Flags: [none], length: 24
 00:00:17.942224 eth1  In  IP 10.0.29.3.35408 > 10.0.29.2.3784: BFDv1, Control, State Up, Flags: [none], length: 24
 00:00:17.952551 eth1  Out IP 10.0.29.2.49149 > 10.0.29.3.179: Flags [S], seq 4229109567, win 64240, options [mss 1460,sackOK,TS val 1877185422 ecr 0,nop,wscale 10], length 0
 00:00:17.952625 eth1  In  IP 10.0.29.3.179 > 10.0.29.2.49149: Flags [S.], seq 97869543, ack 4229109568, win 65160, options [mss 1460,sackOK,TS val 3829940396 ecr 1877185422,nop,wscale 10], length 0
 00:00:17.952657 eth1  Out IP 10.0.29.2.49149 > 10.0.29.3.179: Flags [.], ack 1, win 63, options [nop,nop,TS val 1877185422 ecr 3829940396], length 0
 00:00:17.952764 eth1  Out IP 10.0.29.2.49149 > 10.0.29.3.179: Flags [P.], seq 1:65, ack 1, win 63, options [nop,nop,TS val 1877185422 ecr 3829940396], length 64: BGP
 00:00:17.952795 eth1  In  IP 10.0.29.3.179 > 10.0.29.2.49149: Flags [F.], seq 1, ack 1, win 64, options [nop,nop,TS val 3829940396 ecr 1877185422], length 0
 00:00:17.952864 eth1  In  IP 10.0.29.3.179 > 10.0.29.2.49149: Flags [R], seq 97869544, win 0, length 0
 00:00:17.992502 eth1  Out IP 10.0.29.2.37234 > 10.0.29.3.3784: BFDv1, Control, State Up, Flags: [none], length: 24
 00:00:18.018715 eth1  In  IP 10.0.29.3.35408 > 10.0.29.2.3784: BFDv1, Control, State Up, Flags: [none], length: 24
 00:00:18.071986 eth1  Out IP 10.0.29.2.37234 > 10.0.29.3.3784: BFDv1, Control, State Up, Flags: [none], length: 24
 00:00:18.098204 eth1  In  IP 10.0.29.3.35408 > 10.0.29.2.3784: BFDv1, Control, State Up, Flags: [none], length: 24
 00:00:18.153504 eth1  Out IP 10.0.29.2.37234 > 10.0.29.3.3784: BFDv1, Control, State Up, Flags: [none], length: 24
 00:00:18.173730 eth1  In  IP 10.0.29.3.35408 > 10.0.29.2.3784: BFDv1, Control, State Up, Flags: [none], length: 24
 00:00:18.222480 eth2  Out IP 10.0.12.3.51192 > 10.0.12.2.179: Flags [P.], seq 173:192, ack 82, win 63, options [nop,nop,TS val 627543082 ecr 398386371], length 19: BGP
 00:00:18.222561 eth2  In  IP 10.0.12.2.179 > 10.0.12.3.51192: Flags [.], ack 192, win 64, options [nop,nop,TS val 398394438 ecr 627543082], length 0
 00:00:18.239185 eth1  Out IP 10.0.29.2.37234 > 10.0.29.3.3784: BFDv1, Control, State Up, Flags: [none], length: 24
 00:00:18.258318 eth1  In  IP 10.0.29.3.35408 > 10.0.29.2.3784: BFDv1, Control, State Up, Flags: [none], length: 24
 00:00:18.320678 eth1  Out IP 10.0.29.2.37234 > 10.0.29.3.3784: BFDv1, Control, State Up, Flags: [none], length: 24
 00:00:18.345932 eth1  In  IP 10.0.29.3.35408 > 10.0.29.2.3784: BFDv1, Control, State Up, Flags: [none], length: 24
 00:00:18.408234 eth1  Out IP 10.0.29.2.37234 > 10.0.29.3.3784: BFDv1, Control, State Up, Flags: [none], length: 24
 00:00:18.434413 eth1  In  IP 10.0.29.3.35408 > 10.0.29.2.3784: BFDv1, Control, State Up, Flags: [none], length: 24
 00:00:18.490654 eth1  Out IP 10.0.29.2.37234 > 10.0.29.3.3784: BFDv1, Control, State Up, Flags: [none], length: 24
 00:00:18.513819 eth1  In  IP 10.0.29.3.35408 > 10.0.29.2.3784: BFDv1, Control, State Up, Flags: [none], length: 24
 00:00:18.566081 eth1  Out IP 10.0.29.2.37234 > 10.0.29.3.3784: BFDv1, Control, State Up, Flags: [none], length: 24
 00:00:18.600258 eth1  In  IP 10.0.29.3.35408 > 10.0.29.2.3784: BFDv1, Control, State Up, Flags: [none], length: 24
 00:00:18.642509 eth1  Out IP 10.0.29.2.37234 > 10.0.29.3.3784: BFDv1, Control, State Up, Flags: [none], length: 24
 00:00:18.676686 eth1  In  IP 10.0.29.3.35408 > 10.0.29.2.3784: BFDv1, Control, State Up, Flags: [none], length: 24
 00:00:18.723979 eth1  Out IP 10.0.29.2.37234 > 10.0.29.3.3784: BFDv1, Control, State Up, Flags: [none], length: 24
 00:00:18.752122 eth1  In  IP 10.0.29.3.35408 > 10.0.29.2.3784: BFDv1, Control, State Up, Flags: [none], length: 24
 00:00:18.811397 eth1  Out IP 10.0.29.2.37234 > 10.0.29.3.3784: BFDv1, Control, State Up, Flags: [none], length: 24
 00:00:18.837512 eth1  In  IP 10.0.29.3.35408 > 10.0.29.2.3784: BFDv1, Control, State Up, Flags: [none], length: 24
 00:00:18.886702 eth1  Out IP 10.0.29.2.37234 > 10.0.29.3.3784: BFDv1, Control, State Up, Flags: [none], length: 24
 00:00:18.925769 eth1  In  IP 10.0.29.3.35408 > 10.0.29.2.3784: BFDv1, Control, State Up, Flags: [none], length: 24
 00:00:18.965011 eth1  Out IP 10.0.29.2.37234 > 10.0.29.3.3784: BFDv1, Control, State Up, Flags: [none], length: 24
 00:00:19.012559 eth1  In  IP 10.0.29.3.35408 > 10.0.29.2.3784: BFDv1, Control, State Up, Flags: [none], length: 24
 00:00:19.053832 eth1  Out IP 10.0.29.2.37234 > 10.0.29.3.3784: BFDv1, Control, State Up, Flags: [none], length: 24
 00:00:19.096001 eth1  In  IP 10.0.29.3.35408 > 10.0.29.2.3784: BFDv1, Control, State Up, Flags: [none], length: 24
 00:00:19.137273 eth1  Out IP 10.0.29.2.37234 > 10.0.29.3.3784: BFDv1, Control, State Up, Flags: [none], length: 24
 00:00:19.176457 eth1  In  IP 10.0.29.3.35408 > 10.0.29.2.3784: BFDv1, Control, State Up, Flags: [none], length: 24
 00:00:19.219805 eth1  Out IP 10.0.29.2.37234 > 10.0.29.3.3784: BFDv1, Control, State Up, Flags: [none], length: 24
 00:00:19.256039 eth1  In  IP 10.0.29.3.35408 > 10.0.29.2.3784: BFDv1, Control, State Up, Flags: [none], length: 24
 00:00:19.294325 eth1  Out IP 10.0.29.2.37234 > 10.0.29.3.3784: BFDv1, Control, State Up, Flags: [none], length: 24
 00:00:19.332563 eth1  In  IP 10.0.29.3.35408 > 10.0.29.2.3784: BFDv1, Control, State Up, Flags: [none], length: 24
 00:00:19.380804 eth1  Out IP 10.0.29.2.37234 > 10.0.29.3.3784: BFDv1, Control, State Up, Flags: [none], length: 24
 00:00:19.411068 eth1  In  IP 10.0.29.3.35408 > 10.0.29.2.3784: BFDv1, Control, State Up, Flags: [none], length: 24
 00:00:19.462308 eth1  Out IP 10.0.29.2.37234 > 10.0.29.3.3784: BFDv1, Control, State Up, Flags: [none], length: 24
 00:00:19.490525 eth1  In  IP 10.0.29.3.35408 > 10.0.29.2.3784: BFDv1, Control, State Up, Flags: [none], length: 24
 00:00:19.541836 eth1  Out IP 10.0.29.2.37234 > 10.0.29.3.3784: BFDv1, Control, State Up, Flags: [none], length: 24
 00:00:19.572099 eth1  In  IP 10.0.29.3.35408 > 10.0.29.2.3784: BFDv1, Control, State Up, Flags: [none], length: 24
 00:00:19.620290 eth1  Out IP 10.0.29.2.37234 > 10.0.29.3.3784: BFDv1, Control, State Up, Flags: [none], length: 24
 00:00:19.654434 eth1  In  IP 10.0.29.3.35408 > 10.0.29.2.3784: BFDv1, Control, State Up, Flags: [none], length: 24
 00:00:19.696713 eth1  Out IP 10.0.29.2.37234 > 10.0.29.3.3784: BFDv1, Control, State Up, Flags: [none], length: 24
 00:00:19.732906 eth1  In  IP 10.0.29.3.35408 > 10.0.29.2.3784: BFDv1, Control, State Up, Flags: [none], length: 24
 00:00:19.785189 eth1  Out IP 10.0.29.2.37234 > 10.0.29.3.3784: BFDv1, Control, State Up, Flags: [none], length: 24
 00:00:19.823378 eth1  In  IP 10.0.29.3.35408 > 10.0.29.2.3784: BFDv1, Control, State Up, Flags: [none], length: 24
 00:00:19.870601 eth1  Out IP 10.0.29.2.37234 > 10.0.29.3.3784: BFDv1, Control, State Up, Flags: [none], length: 24
 00:00:19.898782 eth1  In  IP 10.0.29.3.35408 > 10.0.29.2.3784: BFDv1, Control, State Up, Flags: [none], length: 24
 00:00:19.946992 eth1  Out IP 10.0.29.2.37234 > 10.0.29.3.3784: BFDv1, Control, State Up, Flags: [none], length: 24
 00:00:19.975176 eth1  In  IP 10.0.29.3.35408 > 10.0.29.2.3784: BFDv1, Control, State Up, Flags: [none], length: 24
 00:00:20.033386 eth1  Out IP 10.0.29.2.37234 > 10.0.29.3.3784: BFDv1, Control, State Up, Flags: [none], length: 24
 00:00:20.062578 eth1  In  IP 10.0.29.3.35408 > 10.0.29.2.3784: BFDv1, Control, State Up, Flags: [none], length: 24
 00:00:20.116846 eth1  Out IP 10.0.29.2.37234 > 10.0.29.3.3784: BFDv1, Control, State Up, Flags: [none], length: 24
 00:00:20.145116 eth1  In  IP 10.0.29.3.35408 > 10.0.29.2.3784: BFDv1, Control, State Up, Flags: [none], length: 24
 00:00:20.195390 eth1  Out IP 10.0.29.2.37234 > 10.0.29.3.3784: BFDv1, Control, State Up, Flags: [none], length: 24
 00:00:20.225569 eth1  In  IP 10.0.29.3.35408 > 10.0.29.2.3784: BFDv1, Control, State Up, Flags: [none], length: 24
 00:00:20.270865 eth1  Out IP 10.0.29.2.37234 > 10.0.29.3.3784: BFDv1, Control, State Up, Flags: [none], length: 24
 00:00:20.307309 eth1  In  IP 10.0.29.3.35408 > 10.0.29.2.3784: BFDv1, Control, State Up, Flags: [none], length: 24
 00:00:20.350564 eth1  Out IP 10.0.29.2.37234 > 10.0.29.3.3784: BFDv1, Control, State Up, Flags: [none], length: 24
 00:00:20.387715 eth1  In  IP 10.0.29.3.35408 > 10.0.29.2.3784: BFDv1, Control, State Up, Flags: [none], length: 24
 00:00:20.436035 eth1  Out IP 10.0.29.2.37234 > 10.0.29.3.3784: BFDv1, Control, State Up, Flags: [none], length: 24
 00:00:20.464246 eth1  In  IP 10.0.29.3.35408 > 10.0.29.2.3784: BFDv1, Control, State Up, Flags: [none], length: 24
 00:00:20.514514 eth1  Out IP 10.0.29.2.37234 > 10.0.29.3.3784: BFDv1, Control, State Up, Flags: [none], length: 24
 00:00:20.542815 eth1  In  IP 10.0.29.3.35408 > 10.0.29.2.3784: BFDv1, Control, State Up, Flags: [none], length: 24
 00:00:20.601794 eth1  Out IP 10.0.29.2.37234 > 10.0.29.3.3784: BFDv1, Control, State Up, Flags: [none], length: 24
 00:00:20.621964 eth1  In  IP 10.0.29.3.35408 > 10.0.29.2.3784: BFDv1, Control, State Up, Flags: [none], length: 24
 00:00:20.682284 eth1  Out IP 10.0.29.2.37234 > 10.0.29.3.3784: BFDv1, Control, State Up, Flags: [none], length: 24
 00:00:20.700431 eth1  In  IP 10.0.29.3.35408 > 10.0.29.2.3784: BFDv1, Control, State Up, Flags: [none], length: 24
 00:00:20.767692 eth1  Out IP 10.0.29.2.37234 > 10.0.29.3.3784: BFDv1, Control, State Up, Flags: [none], length: 24
 00:00:20.780883 eth1  In  IP 10.0.29.3.35408 > 10.0.29.2.3784: BFDv1, Control, State Up, Flags: [none], length: 24
 00:00:20.844256 eth1  Out IP 10.0.29.2.37234 > 10.0.29.3.3784: BFDv1, Control, State Up, Flags: [none], length: 24
 00:00:20.864690 eth1  In  IP 10.0.29.3.35408 > 10.0.29.2.3784: BFDv1, Control, State Up, Flags: [none], length: 24
 00:00:20.923979 eth1  Out IP 10.0.29.2.37234 > 10.0.29.3.3784: BFDv1, Control, State Up, Flags: [none], length: 24
 00:00:20.953314 eth1  In  IP 10.0.29.3.35408 > 10.0.29.2.3784: BFDv1, Control, State Up, Flags: [none], length: 24
 00:00:21.000567 eth1  Out IP 10.0.29.2.37234 > 10.0.29.3.3784: BFDv1, Control, State Up, Flags: [none], length: 24
 00:00:21.037076 eth1  In  IP 10.0.29.3.35408 > 10.0.29.2.3784: BFDv1, Control, State Up, Flags: [none], length: 24
 00:00:21.077442 eth1  Out IP 10.0.29.2.37234 > 10.0.29.3.3784: BFDv1, Control, State Up, Flags: [none], length: 24
 00:00:21.124920 eth1  In  IP 10.0.29.3.35408 > 10.0.29.2.3784: BFDv1, Control, State Up, Flags: [none], length: 24
 00:00:21.159284 eth1  Out IP 10.0.29.2.37234 > 10.0.29.3.3784: BFDv1, Control, State Up, Flags: [none], length: 24
 00:00:21.213710 eth1  In  IP 10.0.29.3.35408 > 10.0.29.2.3784: BFDv1, Control, State Up, Flags: [none], length: 24
 00:00:21.242116 eth1  Out IP 10.0.29.2.37234 > 10.0.29.3.3784: BFDv1, Control, State Up, Flags: [none], length: 24
 00:00:21.299180 eth1  In  IP 10.0.29.3.35408 > 10.0.29.2.3784: BFDv1, Control, State Up, Flags: [none], length: 24
 00:00:21.330527 eth1  Out IP 10.0.29.2.37234 > 10.0.29.3.3784: BFDv1, Control, State Up, Flags: [none], length: 24
 00:00:21.383110 eth1  In  IP 10.0.29.3.35408 > 10.0.29.2.3784: BFDv1, Control, State Up, Flags: [none], length: 24
 00:00:21.412437 eth1  Out IP 10.0.29.2.37234 > 10.0.29.3.3784: BFDv1, Control, State Up, Flags: [none], length: 24
 00:00:21.463833 eth1  In  IP 10.0.29.3.35408 > 10.0.29.2.3784: BFDv1, Control, State Up, Flags: [none], length: 24
 00:00:21.498228 eth1  Out IP 10.0.29.2.37234 > 10.0.29.3.3784: BFDv1, Control, State Up, Flags: [none], length: 24
 00:00:21.546599 eth1  In  IP 10.0.29.3.35408 > 10.0.29.2.3784: BFDv1, Control, State Up, Flags: [none], length: 24
 00:00:21.585997 eth1  Out IP 10.0.29.2.37234 > 10.0.29.3.3784: BFDv1, Control, State Up, Flags: [none], length: 24
 00:00:21.634735 eth1  In  IP 10.0.29.3.35408 > 10.0.29.2.3784: BFDv1, Control, State Up, Flags: [none], length: 24
 00:00:21.675073 eth1  Out IP 10.0.29.2.37234 > 10.0.29.3.3784: BFDv1, Control, State Up, Flags: [none], length: 24
 00:00:21.717437 eth1  In  IP 10.0.29.3.35408 > 10.0.29.2.3784: BFDv1, Control, State Up, Flags: [none], length: 24
 00:00:21.752779 eth1  Out IP 10.0.29.2.37234 > 10.0.29.3.3784: BFDv1, Control, State Up, Flags: [none], length: 24
 00:00:21.801025 eth1  In  IP 10.0.29.3.35408 > 10.0.29.2.3784: BFDv1, Control, State Up, Flags: [none], length: 24
 00:00:21.840494 eth1  Out IP 10.0.29.2.37234 > 10.0.29.3.3784: BFDv1, Control, State Up, Flags: [none], length: 24
 00:00:21.841114 eth1  Out IP 10.0.29.2.52355 > 10.0.29.3.179: Flags [S], seq 2087723648, win 64240, options [mss 1460,sackOK,TS val 1877189310 ecr 0,nop,wscale 10], length 0
 00:00:21.841160 eth1  In  IP 10.0.29.3.179 > 10.0.29.2.52355: Flags [S.], seq 1472478763, ack 2087723649, win 65160, options [mss 1460,sackOK,TS val 3829944285 ecr 1877189310,nop,wscale 10], length 0
 00:00:21.841180 eth1  Out IP 10.0.29.2.52355 > 10.0.29.3.179: Flags [.], ack 1, win 63, options [nop,nop,TS val 1877189311 ecr 3829944285], length 0
 00:00:21.841259 eth1  Out IP 10.0.29.2.52355 > 10.0.29.3.179: Flags [P.], seq 1:65, ack 1, win 63, options [nop,nop,TS val 1877189311 ecr 3829944285], length 64: BGP
 00:00:21.841268 eth1  In  IP 10.0.29.3.179 > 10.0.29.2.52355: Flags [F.], seq 1, ack 1, win 64, options [nop,nop,TS val 3829944285 ecr 1877189311], length 0
 00:00:21.841307 eth1  In  IP 10.0.29.3.179 > 10.0.29.2.52355: Flags [R], seq 1472478764, win 0, length 0
 00:00:21.841310 eth1  Out IP 10.0.29.2.52355 > 10.0.29.3.179: Flags [F.], seq 65, ack 2, win 63, options [nop,nop,TS val 1877189311 ecr 3829944285], length 0
 00:00:21.841322 eth1  In  IP 10.0.29.3.179 > 10.0.29.2.52355: Flags [R], seq 1472478765, win 0, length 0
 00:00:21.886982 eth1  In  IP 10.0.29.3.35408 > 10.0.29.2.3784: BFDv1, Control, State Up, Flags: [none], length: 24
 00:00:21.926342 eth1  Out IP 10.0.29.2.37234 > 10.0.29.3.3784: BFDv1, Control, State Up, Flags: [none], length: 24
 00:00:21.964602 eth1  In  IP 10.0.29.3.35408 > 10.0.29.2.3784: BFDv1, Control, State Up, Flags: [none], length: 24
 00:00:22.011907 eth1  Out IP 10.0.29.2.37234 > 10.0.29.3.3784: BFDv1, Control, State Up, Flags: [none], length: 24
 00:00:22.045466 eth1  In  IP 10.0.29.3.35408 > 10.0.29.2.3784: BFDv1, Control, State Up, Flags: [none], length: 24
 00:00:22.087777 eth1  Out IP 10.0.29.2.37234 > 10.0.29.3.3784: BFDv1, Control, State Up, Flags: [none], length: 24
 00:00:22.126982 eth1  In  IP 10.0.29.3.35408 > 10.0.29.2.3784: BFDv1, Control, State Up, Flags: [none], length: 24
 00:00:22.172361 eth1  Out IP 10.0.29.2.37234 > 10.0.29.3.3784: BFDv1, Control, State Up, Flags: [none], length: 24
 00:00:22.216346 eth1  In  IP 10.0.29.3.35408 > 10.0.29.2.3784: BFDv1, Control, State Up, Flags: [none], length: 24
 00:00:22.258736 eth1  Out IP 10.0.29.2.37234 > 10.0.29.3.3784: BFDv1, Control, State Up, Flags: [none], length: 24
 00:00:22.301660 eth1  In  IP 10.0.29.3.35408 > 10.0.29.2.3784: BFDv1, Control, State Up, Flags: [none], length: 24
 00:00:22.345055 eth1  Out IP 10.0.29.2.37234 > 10.0.29.3.3784: BFDv1, Control, State Up, Flags: [none], length: 24
 00:00:22.389497 eth1  In  IP 10.0.29.3.35408 > 10.0.29.2.3784: BFDv1, Control, State Up, Flags: [none], length: 24
 00:00:22.422951 eth1  Out IP 10.0.29.2.37234 > 10.0.29.3.3784: BFDv1, Control, State Up, Flags: [none], length: 24
 00:00:22.472251 eth1  In  IP 10.0.29.3.35408 > 10.0.29.2.3784: BFDv1, Control, State Up, Flags: [none], length: 24
 00:00:22.497613 eth1  Out IP 10.0.29.2.37234 > 10.0.29.3.3784: BFDv1, Control, State Up, Flags: [none], length: 24
 00:00:22.558207 eth1  In  IP 10.0.29.3.35408 > 10.0.29.2.3784: BFDv1, Control, State Up, Flags: [none], length: 24
 00:00:22.583611 eth1  Out IP 10.0.29.2.37234 > 10.0.29.3.3784: BFDv1, Control, State Up, Flags: [none], length: 24
 00:00:22.639687 eth1  In  IP 10.0.29.3.35408 > 10.0.29.2.3784: BFDv1, Control, State Up, Flags: [none], length: 24
 00:00:22.665220 eth1  Out IP 10.0.29.2.37234 > 10.0.29.3.3784: BFDv1, Control, State Up, Flags: [none], length: 24
 00:00:22.720329 eth1  In  IP 10.0.29.3.35408 > 10.0.29.2.3784: BFDv1, Control, State Up, Flags: [none], length: 24
 00:00:22.752368 eth1  Out IP 10.0.29.2.37234 > 10.0.29.3.3784: BFDv1, Control, State Up, Flags: [none], length: 24
 00:00:22.809726 eth1  In  IP 10.0.29.3.35408 > 10.0.29.2.3784: BFDv1, Control, State Up, Flags: [none], length: 24
 00:00:22.841207 eth1  Out IP 10.0.29.2.37234 > 10.0.29.3.3784: BFDv1, Control, State Up, Flags: [none], length: 24
 00:00:22.892692 eth1  In  IP 10.0.29.3.35408 > 10.0.29.2.3784: BFDv1, Control, State Up, Flags: [none], length: 24
 00:00:22.918050 eth1  Out IP 10.0.29.2.37234 > 10.0.29.3.3784: BFDv1, Control, State Up, Flags: [none], length: 24
 00:00:22.979253 eth1  In  IP 10.0.29.3.35408 > 10.0.29.2.3784: BFDv1, Control, State Up, Flags: [none], length: 24
 00:00:22.995680 eth1  Out IP 10.0.29.2.37234 > 10.0.29.3.3784: BFDv1, Control, State Up, Flags: [none], length: 24
 00:00:23.065636 eth1  In  IP 10.0.29.3.35408 > 10.0.29.2.3784: BFDv1, Control, State Up, Flags: [none], length: 24
 00:00:23.080983 eth1  Out IP 10.0.29.2.37234 > 10.0.29.3.3784: BFDv1, Control, State Up, Flags: [none], length: 24
 00:00:23.152376 eth1  In  IP 10.0.29.3.35408 > 10.0.29.2.3784: BFDv1, Control, State Up, Flags: [none], length: 24
 00:00:23.158711 eth1  Out IP 10.0.29.2.37234 > 10.0.29.3.3784: BFDv1, Control, State Up, Flags: [none], length: 24
 00:00:23.228802 eth1  In  IP 10.0.29.3.35408 > 10.0.29.2.3784: BFDv1, Control, State Up, Flags: [none], length: 24
 00:00:23.241424 eth1  Out IP 10.0.29.2.37234 > 10.0.29.3.3784: BFDv1, Control, State Up, Flags: [none], length: 24
 00:00:23.308253 eth1  In  IP 10.0.29.3.35408 > 10.0.29.2.3784: BFDv1, Control, State Up, Flags: [none], length: 24
 00:00:23.327983 eth1  Out IP 10.0.29.2.37234 > 10.0.29.3.3784: BFDv1, Control, State Up, Flags: [none], length: 24
 00:00:23.390049 eth1  In  IP 10.0.29.3.35408 > 10.0.29.2.3784: BFDv1, Control, State Up, Flags: [none], length: 24
 00:00:23.407571 eth1  Out IP 10.0.29.2.37234 > 10.0.29.3.3784: BFDv1, Control, State Up, Flags: [none], length: 24
 00:00:23.469011 eth1  In  IP 10.0.29.3.35408 > 10.0.29.2.3784: BFDv1, Control, State Up, Flags: [none], length: 24
 00:00:23.496464 eth1  Out IP 10.0.29.2.37234 > 10.0.29.3.3784: BFDv1, Control, State Up, Flags: [none], length: 24
 00:00:23.552901 eth1  In  IP 10.0.29.3.35408 > 10.0.29.2.3784: BFDv1, Control, State Up, Flags: [none], length: 24
 00:00:23.575331 eth1  Out IP 10.0.29.2.37234 > 10.0.29.3.3784: BFDv1, Control, State Up, Flags: [none], length: 24
 00:00:23.628486 eth1  In  IP 10.0.29.3.35408 > 10.0.29.2.3784: BFDv1, Control, State Up, Flags: [none], length: 24
 00:00:23.653789 eth1  Out IP 10.0.29.2.37234 > 10.0.29.3.3784: BFDv1, Control, State Up, Flags: [none], length: 24
 00:00:23.717202 eth1  In  IP 10.0.29.3.35408 > 10.0.29.2.3784: BFDv1, Control, State Up, Flags: [none], length: 24
 00:00:23.733604 eth1  Out IP 10.0.29.2.37234 > 10.0.29.3.3784: BFDv1, Control, State Up, Flags: [none], length: 24
 00:00:23.806013 eth1  In  IP 10.0.29.3.35408 > 10.0.29.2.3784: BFDv1, Control, State Up, Flags: [none], length: 24
 00:00:23.823352 eth1  Out IP 10.0.29.2.37234 > 10.0.29.3.3784: BFDv1, Control, State Up, Flags: [none], length: 24
 00:00:23.881558 eth1  In  IP 10.0.29.3.35408 > 10.0.29.2.3784: BFDv1, Control, State Up, Flags: [none], length: 24
 00:00:23.898949 eth1  Out IP 10.0.29.2.37234 > 10.0.29.3.3784: BFDv1, Control, State Up, Flags: [none], length: 24
 00:00:23.957200 eth1  In  IP 10.0.29.3.35408 > 10.0.29.2.3784: BFDv1, Control, State Up, Flags: [none], length: 24
 00:00:23.977534 eth1  Out IP 10.0.29.2.37234 > 10.0.29.3.3784: BFDv1, Control, State Up, Flags: [none], length: 24
 00:00:24.042638 eth1  In  IP 10.0.29.3.35408 > 10.0.29.2.3784: BFDv1, Control, State Up, Flags: [none], length: 24
 00:00:24.055003 eth1  Out IP 10.0.29.2.37234 > 10.0.29.3.3784: BFDv1, Control, State Up, Flags: [none], length: 24
 00:00:24.122235 eth1  In  IP 10.0.29.3.35408 > 10.0.29.2.3784: BFDv1, Control, State Up, Flags: [none], length: 24
 00:00:24.143613 eth1  Out IP 10.0.29.2.37234 > 10.0.29.3.3784: BFDv1, Control, State Up, Flags: [none], length: 24
 00:00:24.210326 eth1  In  IP 10.0.29.3.35408 > 10.0.29.2.3784: BFDv1, Control, State Up, Flags: [none], length: 24
 00:00:24.232671 eth1  Out IP 10.0.29.2.37234 > 10.0.29.3.3784: BFDv1, Control, State Up, Flags: [none], length: 24
 00:00:24.287847 eth1  In  IP 10.0.29.3.35408 > 10.0.29.2.3784: BFDv1, Control, State Up, Flags: [none], length: 24
 00:00:24.319275 eth1  Out IP 10.0.29.2.37234 > 10.0.29.3.3784: BFDv1, Control, State Up, Flags: [none], length: 24
 00:00:24.367903 eth1  In  IP 10.0.29.3.35408 > 10.0.29.2.3784: BFDv1, Control, State Up, Flags: [none], length: 24
 00:00:24.394232 eth1  Out IP 10.0.29.2.37234 > 10.0.29.3.3784: BFDv1, Control, State Up, Flags: [none], length: 24
 00:00:24.450927 eth1  In  IP 10.0.29.3.35408 > 10.0.29.2.3784: BFDv1, Control, State Up, Flags: [none], length: 24
 00:00:24.481485 eth1  Out IP 10.0.29.2.37234 > 10.0.29.3.3784: BFDv1, Control, State Up, Flags: [none], length: 24
 00:00:24.537190 eth1  In  IP 10.0.29.3.35408 > 10.0.29.2.3784: BFDv1, Control, State Up, Flags: [none], length: 24
 00:00:24.564487 eth1  Out IP 10.0.29.2.37234 > 10.0.29.3.3784: BFDv1, Control, State Up, Flags: [none], length: 24
 00:00:24.626586 eth1  In  IP 10.0.29.3.35408 > 10.0.29.2.3784: BFDv1, Control, State Up, Flags: [none], length: 24
 00:00:24.638916 eth1  Out IP 10.0.29.2.37234 > 10.0.29.3.3784: BFDv1, Control, State Up, Flags: [none], length: 24
 00:00:24.716572 eth1  In  IP 10.0.29.3.35408 > 10.0.29.2.3784: BFDv1, Control, State Up, Flags: [none], length: 24
 00:00:24.720912 eth1  Out IP 10.0.29.2.37234 > 10.0.29.3.3784: BFDv1, Control, State Up, Flags: [none], length: 24
 00:00:24.800367 eth1  Out IP 10.0.29.2.37234 > 10.0.29.3.3784: BFDv1, Control, State Up, Flags: [none], length: 24
 00:00:24.801609 eth1  In  IP 10.0.29.3.35408 > 10.0.29.2.3784: BFDv1, Control, State Up, Flags: [none], length: 24
 00:00:24.880351 eth1  In  IP 10.0.29.3.35408 > 10.0.29.2.3784: BFDv1, Control, State Up, Flags: [none], length: 24
 00:00:24.886712 eth1  Out IP 10.0.29.2.37234 > 10.0.29.3.3784: BFDv1, Control, State Up, Flags: [none], length: 24
 00:00:24.955504 eth1  In  IP 10.0.29.3.35408 > 10.0.29.2.3784: BFDv1, Control, State Up, Flags: [none], length: 24
 00:00:24.970917 eth1  Out IP 10.0.29.2.37234 > 10.0.29.3.3784: BFDv1, Control, State Up, Flags: [none], length: 24
 00:00:25.031648 eth1  In  IP 10.0.29.3.35408 > 10.0.29.2.3784: BFDv1, Control, State Up, Flags: [none], length: 24
 00:00:25.051097 eth1  Out IP 10.0.29.2.37234 > 10.0.29.3.3784: BFDv1, Control, State Up, Flags: [none], length: 24
 00:00:25.117861 eth1  In  IP 10.0.29.3.35408 > 10.0.29.2.3784: BFDv1, Control, State Up, Flags: [none], length: 24
 00:00:25.132223 eth1  Out IP 10.0.29.2.37234 > 10.0.29.3.3784: BFDv1, Control, State Up, Flags: [none], length: 24
 00:00:25.201970 eth1  In  IP 10.0.29.3.35408 > 10.0.29.2.3784: BFDv1, Control, State Up, Flags: [none], length: 24
 00:00:25.222372 eth1  Out IP 10.0.29.2.37234 > 10.0.29.3.3784: BFDv1, Control, State Up, Flags: [none], length: 24
 00:00:25.284106 eth1  In  IP 10.0.29.3.35408 > 10.0.29.2.3784: BFDv1, Control, State Up, Flags: [none], length: 24
 00:00:25.298511 eth1  Out IP 10.0.29.2.37234 > 10.0.29.3.3784: BFDv1, Control, State Up, Flags: [none], length: 24
 00:00:25.371706 eth1  In  IP 10.0.29.3.35408 > 10.0.29.2.3784: BFDv1, Control, State Up, Flags: [none], length: 24
 00:00:25.379254 eth1  Out IP 10.0.29.2.37234 > 10.0.29.3.3784: BFDv1, Control, State Up, Flags: [none], length: 24
 00:00:25.455027 eth1  In  IP 10.0.29.3.35408 > 10.0.29.2.3784: BFDv1, Control, State Up, Flags: [none], length: 24
 00:00:25.456350 eth1  Out IP 10.0.29.2.37234 > 10.0.29.3.3784: BFDv1, Control, State Up, Flags: [none], length: 24
 00:00:25.534600 eth1  Out IP 10.0.29.2.37234 > 10.0.29.3.3784: BFDv1, Control, State Up, Flags: [none], length: 24
 00:00:25.539835 eth1  In  IP 10.0.29.3.35408 > 10.0.29.2.3784: BFDv1, Control, State Up, Flags: [none], length: 24
 00:00:25.611211 eth1  Out IP 10.0.29.2.37234 > 10.0.29.3.3784: BFDv1, Control, State Up, Flags: [none], length: 24
 00:00:25.618494 eth1  In  IP 10.0.29.3.35408 > 10.0.29.2.3784: BFDv1, Control, State Up, Flags: [none], length: 24
 00:00:25.689872 eth1  Out IP 10.0.29.2.37234 > 10.0.29.3.3784: BFDv1, Control, State Up, Flags: [none], length: 24
 00:00:25.703119 eth1  In  IP 10.0.29.3.35408 > 10.0.29.2.3784: BFDv1, Control, State Up, Flags: [none], length: 24
 00:00:25.776531 eth1  Out IP 10.0.29.2.37234 > 10.0.29.3.3784: BFDv1, Control, State Up, Flags: [none], length: 24
 00:00:25.784796 eth1  In  IP 10.0.29.3.35408 > 10.0.29.2.3784: BFDv1, Control, State Up, Flags: [none], length: 24
 00:00:25.863279 eth1  Out IP 10.0.29.2.37234 > 10.0.29.3.3784: BFDv1, Control, State Up, Flags: [none], length: 24
 00:00:25.867531 eth1  In  IP 10.0.29.3.35408 > 10.0.29.2.3784: BFDv1, Control, State Up, Flags: [none], length: 24
 00:00:25.947911 eth1  Out IP 10.0.29.2.37234 > 10.0.29.3.3784: BFDv1, Control, State Up, Flags: [none], length: 24
 00:00:25.949179 eth1  In  IP 10.0.29.3.35408 > 10.0.29.2.3784: BFDv1, Control, State Up, Flags: [none], length: 24
 00:00:26.030636 eth1  Out IP 10.0.29.2.37234 > 10.0.29.3.3784: BFDv1, Control, State Up, Flags: [none], length: 24
 00:00:26.033926 eth1  In  IP 10.0.29.3.35408 > 10.0.29.2.3784: BFDv1, Control, State Up, Flags: [none], length: 24
 00:00:26.107290 eth1  Out IP 10.0.29.2.37234 > 10.0.29.3.3784: BFDv1, Control, State Up, Flags: [none], length: 24
 00:00:26.117559 eth1  In  IP 10.0.29.3.35408 > 10.0.29.2.3784: BFDv1, Control, State Up, Flags: [none], length: 24
 00:00:26.194927 eth1  Out IP 10.0.29.2.37234 > 10.0.29.3.3784: BFDv1, Control, State Up, Flags: [none], length: 24
 00:00:26.197144 eth1  In  IP 10.0.29.3.35408 > 10.0.29.2.3784: BFDv1, Control, State Up, Flags: [none], length: 24
 00:00:26.281775 eth1  In  IP 10.0.29.3.35408 > 10.0.29.2.3784: BFDv1, Control, State Up, Flags: [none], length: 24
 00:00:26.283049 eth1  Out IP 10.0.29.2.37234 > 10.0.29.3.3784: BFDv1, Control, State Up, Flags: [none], length: 24
 00:00:26.358268 eth1  Out IP 10.0.29.2.37234 > 10.0.29.3.3784: BFDv1, Control, State Up, Flags: [none], length: 24
 00:00:26.359466 eth1  In  IP 10.0.29.3.35408 > 10.0.29.2.3784: BFDv1, Control, State Up, Flags: [none], length: 24
 00:00:26.376603 eth1  Out IP 10.0.29.2.56811 > 10.0.29.3.179: Flags [S], seq 1368159437, win 64240, options [mss 1460,sackOK,TS val 1877193846 ecr 0,nop,wscale 10], length 0
 00:00:26.376662 eth1  In  IP 10.0.29.3.179 > 10.0.29.2.56811: Flags [S.], seq 591909310, ack 1368159438, win 65160, options [mss 1460,sackOK,TS val 3829948820 ecr 1877193846,nop,wscale 10], length 0
 00:00:26.376688 eth1  Out IP 10.0.29.2.56811 > 10.0.29.3.179: Flags [.], ack 1, win 63, options [nop,nop,TS val 1877193846 ecr 3829948820], length 0
 00:00:26.376797 eth1  In  IP 10.0.29.3.179 > 10.0.29.2.56811: Flags [F.], seq 1, ack 1, win 64, options [nop,nop,TS val 3829948820 ecr 1877193846], length 0
 00:00:26.376809 eth1  Out IP 10.0.29.2.56811 > 10.0.29.3.179: Flags [P.], seq 1:65, ack 1, win 63, options [nop,nop,TS val 1877193846 ecr 3829948820], length 64: BGP
 00:00:26.376842 eth1  In  IP 10.0.29.3.179 > 10.0.29.2.56811: Flags [R], seq 591909311, win 0, length 0
 00:00:26.439016 eth1  In  IP 10.0.29.3.35408 > 10.0.29.2.3784: BFDv1, Control, State Up, Flags: [none], length: 24
 00:00:26.447518 eth1  Out IP 10.0.29.2.37234 > 10.0.29.3.3784: BFDv1, Control, State Up, Flags: [none], length: 24
 00:00:26.517206 eth1  In  IP 10.0.29.3.35408 > 10.0.29.2.3784: BFDv1, Control, State Up, Flags: [none], length: 24
 00:00:26.536519 eth1  Out IP 10.0.29.2.37234 > 10.0.29.3.3784: BFDv1, Control, State Up, Flags: [none], length: 24
 00:00:26.594226 eth1  In  IP 10.0.29.3.35408 > 10.0.29.2.3784: BFDv1, Control, State Up, Flags: [none], length: 24
 00:00:26.625568 eth1  Out IP 10.0.29.2.37234 > 10.0.29.3.3784: BFDv1, Control, State Up, Flags: [none], length: 24
 00:00:26.676637 eth1  In  IP 10.0.29.3.35408 > 10.0.29.2.3784: BFDv1, Control, State Up, Flags: [none], length: 24
 00:00:26.713012 eth1  Out IP 10.0.29.2.37234 > 10.0.29.3.3784: BFDv1, Control, State Up, Flags: [none], length: 24
 00:00:26.760037 eth1  In  IP 10.0.29.3.35408 > 10.0.29.2.3784: BFDv1, Control, State Up, Flags: [none], length: 24
 00:00:26.799391 eth1  Out IP 10.0.29.2.37234 > 10.0.29.3.3784: BFDv1, Control, State Up, Flags: [none], length: 24
 00:00:26.842442 eth1  In  IP 10.0.29.3.35408 > 10.0.29.2.3784: BFDv1, Control, State Up, Flags: [none], length: 24
 00:00:26.880821 eth1  Out IP 10.0.29.2.37234 > 10.0.29.3.3784: BFDv1, Control, State Up, Flags: [none], length: 24
 00:00:26.918867 eth1  In  IP 10.0.29.3.35408 > 10.0.29.2.3784: BFDv1, Control, State Up, Flags: [none], length: 24
 00:00:26.969303 eth1  Out IP 10.0.29.2.37234 > 10.0.29.3.3784: BFDv1, Control, State Up, Flags: [none], length: 24
 00:00:27.002483 eth1  In  IP 10.0.29.3.35408 > 10.0.29.2.3784: BFDv1, Control, State Up, Flags: [none], length: 24
 00:00:27.046789 eth1  Out IP 10.0.29.2.37234 > 10.0.29.3.3784: BFDv1, Control, State Up, Flags: [none], length: 24
 00:00:27.083934 eth1  In  IP 10.0.29.3.35408 > 10.0.29.2.3784: BFDv1, Control, State Up, Flags: [none], length: 24
 00:00:27.133244 eth1  Out IP 10.0.29.2.37234 > 10.0.29.3.3784: BFDv1, Control, State Up, Flags: [none], length: 24
 00:00:27.158852 eth1  In  IP 10.0.29.3.35408 > 10.0.29.2.3784: BFDv1, Control, State Up, Flags: [none], length: 24
 00:00:27.216211 eth1  Out IP 10.0.29.2.37234 > 10.0.29.3.3784: BFDv1, Control, State Up, Flags: [none], length: 24
 00:00:27.242416 eth1  In  IP 10.0.29.3.35408 > 10.0.29.2.3784: BFDv1, Control, State Up, Flags: [none], length: 24
 00:00:27.302825 eth1  Out IP 10.0.29.2.37234 > 10.0.29.3.3784: BFDv1, Control, State Up, Flags: [none], length: 24
 00:00:27.331691 eth1  In  IP 10.0.29.3.35408 > 10.0.29.2.3784: BFDv1, Control, State Up, Flags: [none], length: 24
 00:00:27.377955 eth1  Out IP 10.0.29.2.37234 > 10.0.29.3.3784: BFDv1, Control, State Up, Flags: [none], length: 24
 00:00:27.413192 eth1  In  IP 10.0.29.3.35408 > 10.0.29.2.3784: BFDv1, Control, State Up, Flags: [none], length: 24
 00:00:27.453513 eth1  Out IP 10.0.29.2.37234 > 10.0.29.3.3784: BFDv1, Control, State Up, Flags: [none], length: 24
 00:00:27.499143 eth1  In  IP 10.0.29.3.35408 > 10.0.29.2.3784: BFDv1, Control, State Up, Flags: [none], length: 24
 00:00:27.539539 eth1  Out IP 10.0.29.2.37234 > 10.0.29.3.3784: BFDv1, Control, State Up, Flags: [none], length: 24
 00:00:27.581708 eth1  In  IP 10.0.29.3.35408 > 10.0.29.2.3784: BFDv1, Control, State Up, Flags: [none], length: 24
 00:00:27.615990 eth1  Out IP 10.0.29.2.37234 > 10.0.29.3.3784: BFDv1, Control, State Up, Flags: [none], length: 24
 00:00:27.663478 eth1  In  IP 10.0.29.3.35408 > 10.0.29.2.3784: BFDv1, Control, State Up, Flags: [none], length: 24
 00:00:27.697709 eth1  Out IP 10.0.29.2.37234 > 10.0.29.3.3784: BFDv1, Control, State Up, Flags: [none], length: 24
 00:00:27.749220 eth1  In  IP 10.0.29.3.35408 > 10.0.29.2.3784: BFDv1, Control, State Up, Flags: [none], length: 24
 00:00:27.784464 eth1  Out IP 10.0.29.2.37234 > 10.0.29.3.3784: BFDv1, Control, State Up, Flags: [none], length: 24
 00:00:27.833075 eth1  In  IP 10.0.29.3.35408 > 10.0.29.2.3784: BFDv1, Control, State Up, Flags: [none], length: 24
 00:00:27.863360 eth1  Out IP 10.0.29.2.37234 > 10.0.29.3.3784: BFDv1, Control, State Up, Flags: [none], length: 24
 00:00:27.916972 eth1  In  IP 10.0.29.3.35408 > 10.0.29.2.3784: BFDv1, Control, State Up, Flags: [none], length: 24
 00:00:27.946395 eth1  Out IP 10.0.29.2.37234 > 10.0.29.3.3784: BFDv1, Control, State Up, Flags: [none], length: 24
 00:00:28.000977 eth1  In  IP 10.0.29.3.35408 > 10.0.29.2.3784: BFDv1, Control, State Up, Flags: [none], length: 24
 00:00:28.023237 eth1  Out IP 10.0.29.2.37234 > 10.0.29.3.3784: BFDv1, Control, State Up, Flags: [none], length: 24
 00:00:28.077762 eth1  In  IP 10.0.29.3.35408 > 10.0.29.2.3784: BFDv1, Control, State Up, Flags: [none], length: 24
 00:00:28.112011 eth1  Out IP 10.0.29.2.37234 > 10.0.29.3.3784: BFDv1, Control, State Up, Flags: [none], length: 24
 00:00:28.166481 eth1  In  IP 10.0.29.3.35408 > 10.0.29.2.3784: BFDv1, Control, State Up, Flags: [none], length: 24
 00:00:28.192741 eth1  Out IP 10.0.29.2.37234 > 10.0.29.3.3784: BFDv1, Control, State Up, Flags: [none], length: 24
 00:00:28.243282 eth1  In  IP 10.0.29.3.35408 > 10.0.29.2.3784: BFDv1, Control, State Up, Flags: [none], length: 24
 00:00:28.277519 eth1  Out IP 10.0.29.2.37234 > 10.0.29.3.3784: BFDv1, Control, State Up, Flags: [none], length: 24
 00:00:28.331048 eth1  In  IP 10.0.29.3.35408 > 10.0.29.2.3784: BFDv1, Control, State Up, Flags: [none], length: 24
 00:00:28.360304 eth1  Out IP 10.0.29.2.37234 > 10.0.29.3.3784: BFDv1, Control, State Up, Flags: [none], length: 24
 00:00:28.413801 eth1  In  IP 10.0.29.3.35408 > 10.0.29.2.3784: BFDv1, Control, State Up, Flags: [none], length: 24
 00:00:28.442032 eth1  Out IP 10.0.29.2.37234 > 10.0.29.3.3784: BFDv1, Control, State Up, Flags: [none], length: 24
 00:00:28.494544 eth1  In  IP 10.0.29.3.35408 > 10.0.29.2.3784: BFDv1, Control, State Up, Flags: [none], length: 24
 00:00:28.523867 eth1  Out IP 10.0.29.2.37234 > 10.0.29.3.3784: BFDv1, Control, State Up, Flags: [none], length: 24
 00:00:28.575404 eth1  In  IP 10.0.29.3.35408 > 10.0.29.2.3784: BFDv1, Control, State Up, Flags: [none], length: 24
 00:00:28.604653 eth1  Out IP 10.0.29.2.37234 > 10.0.29.3.3784: BFDv1, Control, State Up, Flags: [none], length: 24
 00:00:28.652241 eth1  In  IP 10.0.29.3.35408 > 10.0.29.2.3784: BFDv1, Control, State Up, Flags: [none], length: 24
 00:00:28.686624 eth1  Out IP 10.0.29.2.37234 > 10.0.29.3.3784: BFDv1, Control, State Up, Flags: [none], length: 24
 00:00:28.736270 eth1  In  IP 10.0.29.3.35408 > 10.0.29.2.3784: BFDv1, Control, State Up, Flags: [none], length: 24
 00:00:28.767579 eth1  Out IP 10.0.29.2.37234 > 10.0.29.3.3784: BFDv1, Control, State Up, Flags: [none], length: 24
 00:00:28.824277 eth1  In  IP 10.0.29.3.35408 > 10.0.29.2.3784: BFDv1, Control, State Up, Flags: [none], length: 24
 00:00:28.848558 eth1  Out IP 10.0.29.2.37234 > 10.0.29.3.3784: BFDv1, Control, State Up, Flags: [none], length: 24
 00:00:28.910100 eth1  In  IP 10.0.29.3.35408 > 10.0.29.2.3784: BFDv1, Control, State Up, Flags: [none], length: 24
 00:00:28.933367 eth1  Out IP 10.0.29.2.37234 > 10.0.29.3.3784: BFDv1, Control, State Up, Flags: [none], length: 24
 00:00:28.999316 eth1  In  IP 10.0.29.3.35408 > 10.0.29.2.3784: BFDv1, Control, State Up, Flags: [none], length: 24
 00:00:29.011610 eth1  Out IP 10.0.29.2.37234 > 10.0.29.3.3784: BFDv1, Control, State Up, Flags: [none], length: 24
 00:00:29.086196 eth1  In  IP 10.0.29.3.35408 > 10.0.29.2.3784: BFDv1, Control, State Up, Flags: [none], length: 24
 00:00:29.091412 eth1  Out IP 10.0.29.2.37234 > 10.0.29.3.3784: BFDv1, Control, State Up, Flags: [none], length: 24
 00:00:29.165906 eth1  In  IP 10.0.29.3.35408 > 10.0.29.2.3784: BFDv1, Control, State Up, Flags: [none], length: 24
 00:00:29.175158 eth1  Out IP 10.0.29.2.37234 > 10.0.29.3.3784: BFDv1, Control, State Up, Flags: [none], length: 24
 00:00:29.248653 eth1  In  IP 10.0.29.3.35408 > 10.0.29.2.3784: BFDv1, Control, State Up, Flags: [none], length: 24
 00:00:29.264915 eth1  Out IP 10.0.29.2.37234 > 10.0.29.3.3784: BFDv1, Control, State Up, Flags: [none], length: 24
 00:00:29.332135 eth1  In  IP 10.0.29.3.35408 > 10.0.29.2.3784: BFDv1, Control, State Up, Flags: [none], length: 24
 00:00:29.341441 eth1  Out IP 10.0.29.2.37234 > 10.0.29.3.3784: BFDv1, Control, State Up, Flags: [none], length: 24
 00:00:29.416663 eth1  Out IP 10.0.29.2.37234 > 10.0.29.3.3784: BFDv1, Control, State Up, Flags: [none], length: 24
 00:00:29.419828 eth1  In  IP 10.0.29.3.35408 > 10.0.29.2.3784: BFDv1, Control, State Up, Flags: [none], length: 24
 00:00:29.504134 eth1  Out IP 10.0.29.2.37234 > 10.0.29.3.3784: BFDv1, Control, State Up, Flags: [none], length: 24
 00:00:29.508302 eth1  In  IP 10.0.29.3.35408 > 10.0.29.2.3784: BFDv1, Control, State Up, Flags: [none], length: 24
 00:00:29.583564 eth1  Out IP 10.0.29.2.37234 > 10.0.29.3.3784: BFDv1, Control, State Up, Flags: [none], length: 24
 00:00:29.594796 eth1  In  IP 10.0.29.3.35408 > 10.0.29.2.3784: BFDv1, Control, State Up, Flags: [none], length: 24
 00:00:29.669062 eth1  Out IP 10.0.29.2.37234 > 10.0.29.3.3784: BFDv1, Control, State Up, Flags: [none], length: 24
 00:00:29.676204 eth1  In  IP 10.0.29.3.35408 > 10.0.29.2.3784: BFDv1, Control, State Up, Flags: [none], length: 24
 00:00:29.749484 eth1  Out IP 10.0.29.2.37234 > 10.0.29.3.3784: BFDv1, Control, State Up, Flags: [none], length: 24
 00:00:29.760660 eth1  In  IP 10.0.29.3.35408 > 10.0.29.2.3784: BFDv1, Control, State Up, Flags: [none], length: 24
 00:00:29.824936 eth1  Out IP 10.0.29.2.37234 > 10.0.29.3.3784: BFDv1, Control, State Up, Flags: [none], length: 24
 00:00:29.841115 eth1  In  IP 10.0.29.3.35408 > 10.0.29.2.3784: BFDv1, Control, State Up, Flags: [none], length: 24
 00:00:29.911367 eth1  Out IP 10.0.29.2.37234 > 10.0.29.3.3784: BFDv1, Control, State Up, Flags: [none], length: 24
 00:00:29.916557 eth1  In  IP 10.0.29.3.35408 > 10.0.29.2.3784: BFDv1, Control, State Up, Flags: [none], length: 24
 00:00:29.990881 eth1  Out IP 10.0.29.2.37234 > 10.0.29.3.3784: BFDv1, Control, State Up, Flags: [none], length: 24
 00:00:30.005065 eth1  In  IP 10.0.29.3.35408 > 10.0.29.2.3784: BFDv1, Control, State Up, Flags: [none], length: 24
 00:00:30.078333 eth1  Out IP 10.0.29.2.37234 > 10.0.29.3.3784: BFDv1, Control, State Up, Flags: [none], length: 24
 00:00:30.083480 eth1  In  IP 10.0.29.3.35408 > 10.0.29.2.3784: BFDv1, Control, State Up, Flags: [none], length: 24
 00:00:30.163758 eth1  Out IP 10.0.29.2.37234 > 10.0.29.3.3784: BFDv1, Control, State Up, Flags: [none], length: 24
 00:00:30.168914 eth1  In  IP 10.0.29.3.35408 > 10.0.29.2.3784: BFDv1, Control, State Up, Flags: [none], length: 24

574 packets captured
576 packets received by filter
0 packets dropped by kernel
