tcpdump: data link type LINUX_SLL2
tcpdump: verbose output suppressed, use -v[v]... for full protocol decode
listening on any, link-type LINUX_SLL2 (Linux cooked v2), snapshot length 262144 bytes
 00:00:00.000000 eth3  In  IP 10.0.35.3.35105 > 10.0.35.2.3784: BFDv1, Control, State Up, Flags: [none], length: 24
 00:00:00.008478 eth1  In  IP 10.0.23.2.57018 > 10.0.23.3.3784: BFDv1, Control, State Up, Flags: [none], length: 24
 00:00:00.009527 eth2  In  IP 10.0.34.3.37148 > 10.0.34.2.3784: BFDv1, Control, State Up, Flags: [none], length: 24
 00:00:00.026031 eth0  In  IP 10.0.13.2.37532 > 10.0.13.3.3784: BFDv1, Control, State Up, Flags: [none], length: 24
 00:00:00.030403 eth3  Out IP 10.0.35.2.50865 > 10.0.35.3.3784: BFDv1, Control, State Up, Flags: [none], length: 24
 00:00:00.038765 eth1  Out IP 10.0.23.3.33100 > 10.0.23.2.3784: BFDv1, Control, State Up, Flags: [none], length: 24
 00:00:00.039954 eth0  Out IP 10.0.13.3.36570 > 10.0.13.2.3784: BFDv1, Control, State Up, Flags: [none], length: 24
 00:00:00.045222 eth2  Out IP 10.0.34.2.43203 > 10.0.34.3.3784: BFDv1, Control, State Up, Flags: [none], length: 24
 00:00:00.079618 eth3  In  IP 10.0.35.3.35105 > 10.0.35.2.3784: BFDv1, Control, State Up, Flags: [none], length: 24
 00:00:00.092054 eth1  In  IP 10.0.23.2.57018 > 10.0.23.3.3784: BFDv1, Control, State Up, Flags: [none], length: 24
 00:00:00.094139 eth2  In  IP 10.0.34.3.37148 > 10.0.34.2.3784: BFDv1, Control, State Up, Flags: [none], length: 24
 00:00:00.104701 eth0  In  IP 10.0.13.2.37532 > 10.0.13.3.3784: BFDv1, Control, State Up, Flags: [none], length: 24
 00:00:00.111084 eth3  Out IP 10.0.35.2.50865 > 10.0.35.3.3784: BFDv1, Control, State Up, Flags: [none], length: 24
 00:00:00.119365 eth1  Out IP 10.0.23.3.33100 > 10.0.23.2.3784: BFDv1, Control, State Up, Flags: [none], length: 24
 00:00:00.120644 eth0  Out IP 10.0.13.3.36570 > 10.0.13.2.3784: BFDv1, Control, State Up, Flags: [none], length: 24
 00:00:00.123910 eth2  Out IP 10.0.34.2.43203 > 10.0.34.3.3784: BFDv1, Control, State Up, Flags: [none], length: 24
 00:00:00.165393 eth3  In  IP 10.0.35.3.35105 > 10.0.35.2.3784: BFDv1, Control, State Up, Flags: [none], length: 24
 00:00:00.170443 eth2  In  IP 10.0.34.3.37148 > 10.0.34.2.3784: BFDv1, Control, State Up, Flags: [none], length: 24
 00:00:00.175323 eth1  In  IP 10.0.23.2.57018 > 10.0.23.3.3784: BFDv1, Control, State Up, Flags: [none], length: 24
 00:00:00.187739 eth3  Out IP 10.0.35.2.50865 > 10.0.35.3.3784: BFDv1, Control, State Up, Flags: [none], length: 24
 00:00:00.193560 eth0  In  IP 10.0.13.2.37532 > 10.0.13.3.3784: BFDv1, Control, State Up, Flags: [none], length: 24
 00:00:00.202937 eth0  Out IP 10.0.13.3.36570 > 10.0.13.2.3784: BFDv1, Control, State Up, Flags: [none], length: 24
 00:00:00.207169 eth2  Out IP 10.0.34.2.43203 > 10.0.34.3.3784: BFDv1, Control, State Up, Flags: [none], length: 24
 00:00:00.208332 eth1  Out IP 10.0.23.3.33100 > 10.0.23.2.3784: BFDv1, Control, State Up, Flags: [none], length: 24
 00:00:00.254461 eth3  In  IP 10.0.35.3.35105 > 10.0.35.2.3784: BFDv1, Control, State Up, Flags: [none], length: 24
 00:00:00.256788 eth2  In  IP 10.0.34.3.37148 > 10.0.34.2.3784: BFDv1, Control, State Up, Flags: [none], length: 24
 00:00:00.263821 eth1  In  IP 10.0.23.2.57018 > 10.0.23.3.3784: BFDv1, Control, State Up, Flags: [none], length: 24
 00:00:00.268643 eth0  In  IP 10.0.13.2.37532 > 10.0.13.3.3784: BFDv1, Control, State Up, Flags: [none], length: 24
 00:00:00.274995 eth3  Out IP 10.0.35.2.50865 > 10.0.35.3.3784: BFDv1, Control, State Up, Flags: [none], length: 24
 00:00:00.287260 eth0  Out IP 10.0.13.3.36570 > 10.0.13.2.3784: BFDv1, Control, State Up, Flags: [none], length: 24
 00:00:00.291513 eth2  Out IP 10.0.34.2.43203 > 10.0.34.3.3784: BFDv1, Control, State Up, Flags: [none], length: 24
 00:00:00.297755 eth1  Out IP 10.0.23.3.33100 > 10.0.23.2.3784: BFDv1, Control, State Up, Flags: [none], length: 24
 00:00:00.330659 eth3  In  IP 10.0.35.3.35105 > 10.0.35.2.3784: BFDv1, Control, State Up, Flags: [none], length: 24
 00:00:00.341484 eth1  In  IP 10.0.23.2.57018 > 10.0.23.3.3784: BFDv1, Control, State Up, Flags: [none], length: 24
 00:00:00.344484 eth2  In  IP 10.0.34.3.37148 > 10.0.34.2.3784: BFDv1, Control, State Up, Flags: [none], length: 24
 00:00:00.351126 eth0  In  IP 10.0.13.2.37532 > 10.0.13.3.3784: BFDv1, Control, State Up, Flags: [none], length: 24
 00:00:00.354406 eth3  Out IP 10.0.35.2.50865 > 10.0.35.3.3784: BFDv1, Control, State Up, Flags: [none], length: 24
 00:00:00.376632 eth0  Out IP 10.0.13.3.36570 > 10.0.13.2.3784: BFDv1, Control, State Up, Flags: [none], length: 24
 00:00:00.379795 eth2  Out IP 10.0.34.2.43203 > 10.0.34.3.3784: BFDv1, Control, State Up, Flags: [none], length: 24
 00:00:00.383944 eth1  Out IP 10.0.23.3.33100 > 10.0.23.2.3784: BFDv1, Control, State Up, Flags: [none], length: 24
 00:00:00.415184 eth3  In  IP 10.0.35.3.35105 > 10.0.35.2.3784: BFDv1, Control, State Up, Flags: [none], length: 24
 00:00:00.420327 eth1  In  IP 10.0.23.2.57018 > 10.0.23.3.3784: BFDv1, Control, State Up, Flags: [none], length: 24
 00:00:00.422551 eth2  In  IP 10.0.34.3.37148 > 10.0.34.2.3784: BFDv1, Control, State Up, Flags: [none], length: 24
 00:00:00.427532 eth0  In  IP 10.0.13.2.37532 > 10.0.13.3.3784: BFDv1, Control, State Up, Flags: [none], length: 24
 00:00:00.435887 eth3  Out IP 10.0.35.2.50865 > 10.0.35.3.3784: BFDv1, Control, State Up, Flags: [none], length: 24
 00:00:00.463156 eth0  Out IP 10.0.13.3.36570 > 10.0.13.2.3784: BFDv1, Control, State Up, Flags: [none], length: 24
 00:00:00.467332 eth2  Out IP 10.0.34.2.43203 > 10.0.34.3.3784: BFDv1, Control, State Up, Flags: [none], length: 24
 00:00:00.469472 eth1  Out IP 10.0.23.3.33100 > 10.0.23.2.3784: BFDv1, Control, State Up, Flags: [none], length: 24
 00:00:00.493781 eth3  In  IP 10.0.35.3.35105 > 10.0.35.2.3784: BFDv1, Control, State Up, Flags: [none], length: 24
 00:00:00.502875 eth1  In  IP 10.0.23.2.57018 > 10.0.23.3.3784: BFDv1, Control, State Up, Flags: [none], length: 24
 00:00:00.507353 eth0  In  IP 10.0.13.2.37532 > 10.0.13.3.3784: BFDv1, Control, State Up, Flags: [none], length: 24
 00:00:00.509707 eth2  In  IP 10.0.34.3.37148 > 10.0.34.2.3784: BFDv1, Control, State Up, Flags: [none], length: 24
 00:00:00.522050 eth3  Out IP 10.0.35.2.50865 > 10.0.35.3.3784: BFDv1, Control, State Up, Flags: [none], length: 24
 00:00:00.545356 eth0  Out IP 10.0.13.3.36570 > 10.0.13.2.3784: BFDv1, Control, State Up, Flags: [none], length: 24
 00:00:00.547553 eth1  Out IP 10.0.23.3.33100 > 10.0.23.2.3784: BFDv1, Control, State Up, Flags: [none], length: 24
 00:00:00.554860 eth2  Out IP 10.0.34.2.43203 > 10.0.34.3.3784: BFDv1, Control, State Up, Flags: [none], length: 24
 00:00:00.575144 eth3  In  IP 10.0.35.3.35105 > 10.0.35.2.3784: BFDv1, Control, State Up, Flags: [none], length: 24
 00:00:00.579941 eth1  In  IP 10.0.23.2.57018 > 10.0.23.3.3784: BFDv1, Control, State Up, Flags: [none], length: 24
 00:00:00.592830 eth0  In  IP 10.0.13.2.37532 > 10.0.13.3.3784: BFDv1, Control, State Up, Flags: [none], length: 24
 00:00:00.595938 eth2  In  IP 10.0.34.3.37148 > 10.0.34.2.3784: BFDv1, Control, State Up, Flags: [none], length: 24
 00:00:00.606345 eth3  Out IP 10.0.35.2.50865 > 10.0.35.3.3784: BFDv1, Control, State Up, Flags: [none], length: 24
 00:00:00.627772 eth0  Out IP 10.0.13.3.36570 > 10.0.13.2.3784: BFDv1, Control, State Up, Flags: [none], length: 24
 00:00:00.631110 eth1  Out IP 10.0.23.3.33100 > 10.0.23.2.3784: BFDv1, Control, State Up, Flags: [none], length: 24
 00:00:00.634791 eth2  Out IP 10.0.34.2.43203 > 10.0.34.3.3784: BFDv1, Control, State Up, Flags: [none], length: 24
 00:00:00.650811 eth3  In  IP 10.0.35.3.35105 > 10.0.35.2.3784: BFDv1, Control, State Up, Flags: [none], length: 24
 00:00:00.662260 eth1  In  IP 10.0.23.2.57018 > 10.0.23.3.3784: BFDv1, Control, State Up, Flags: [none], length: 24
 00:00:00.668517 eth0  In  IP 10.0.13.2.37532 > 10.0.13.3.3784: BFDv1, Control, State Up, Flags: [none], length: 24
 00:00:00.676946 eth2  In  IP 10.0.34.3.37148 > 10.0.34.2.3784: BFDv1, Control, State Up, Flags: [none], length: 24
 00:00:00.684281 eth3  Out IP 10.0.35.2.50865 > 10.0.35.3.3784: BFDv1, Control, State Up, Flags: [none], length: 24
 00:00:00.711559 eth0  Out IP 10.0.13.3.36570 > 10.0.13.2.3784: BFDv1, Control, State Up, Flags: [none], length: 24
 00:00:00.716061 eth1  Out IP 10.0.23.3.33100 > 10.0.23.2.3784: BFDv1, Control, State Up, Flags: [none], length: 24
 00:00:00.718018 eth2  Out IP 10.0.34.2.43203 > 10.0.34.3.3784: BFDv1, Control, State Up, Flags: [none], length: 24
 00:00:00.735023 eth3  In  IP 10.0.35.3.35105 > 10.0.35.2.3784: BFDv1, Control, State Up, Flags: [none], length: 24
 00:00:00.746500 eth0  In  IP 10.0.13.2.37532 > 10.0.13.3.3784: BFDv1, Control, State Up, Flags: [none], length: 24
 00:00:00.751575 eth1  In  IP 10.0.23.2.57018 > 10.0.23.3.3784: BFDv1, Control, State Up, Flags: [none], length: 24
 00:00:00.764516 eth2  In  IP 10.0.34.3.37148 > 10.0.34.2.3784: BFDv1, Control, State Up, Flags: [none], length: 24
 00:00:00.773883 eth3  Out IP 10.0.35.2.50865 > 10.0.35.3.3784: BFDv1, Control, State Up, Flags: [none], length: 24
 00:00:00.794188 eth2  Out IP 10.0.34.2.43203 > 10.0.34.3.3784: BFDv1, Control, State Up, Flags: [none], length: 24
 00:00:00.801418 eth0  Out IP 10.0.13.3.36570 > 10.0.13.2.3784: BFDv1, Control, State Up, Flags: [none], length: 24
 00:00:00.801500 eth1  Out IP 10.0.23.3.33100 > 10.0.23.2.3784: BFDv1, Control, State Up, Flags: [none], length: 24
 00:00:00.817614 eth3  In  IP 10.0.35.3.35105 > 10.0.35.2.3784: BFDv1, Control, State Up, Flags: [none], length: 24
 00:00:00.830922 eth1  In  IP 10.0.23.2.57018 > 10.0.23.3.3784: BFDv1, Control, State Up, Flags: [none], length: 24
 00:00:00.833678 eth0  In  IP 10.0.13.2.37532 > 10.0.13.3.3784: BFDv1, Control, State Up, Flags: [none], length: 24
 00:00:00.853254 eth2  In  IP 10.0.34.3.37148 > 10.0.34.2.3784: BFDv1, Control, State Up, Flags: [none], length: 24
 00:00:00.862643 eth3  Out IP 10.0.35.2.50865 > 10.0.35.3.3784: BFDv1, Control, State Up, Flags: [none], length: 24
 00:00:00.872943 eth2  Out IP 10.0.34.2.43203 > 10.0.34.3.3784: BFDv1, Control, State Up, Flags: [none], length: 24
 00:00:00.886246 eth0  Out IP 10.0.13.3.36570 > 10.0.13.2.3784: BFDv1, Control, State Up, Flags: [none], length: 24
 00:00:00.887484 eth1  Out IP 10.0.23.3.33100 > 10.0.23.2.3784: BFDv1, Control, State Up, Flags: [none], length: 24
 00:00:00.893307 eth3  In  IP 10.0.35.3.35105 > 10.0.35.2.3784: BFDv1, Control, State Up, Flags: [none], length: 24
 00:00:00.906457 eth1  In  IP 10.0.23.2.57018 > 10.0.23.3.3784: BFDv1, Control, State Up, Flags: [none], length: 24
 00:00:00.914566 eth0  In  IP 10.0.13.2.37532 > 10.0.13.3.3784: BFDv1, Control, State Up, Flags: [none], length: 24
 00:00:00.941163 eth2  In  IP 10.0.34.3.37148 > 10.0.34.2.3784: BFDv1, Control, State Up, Flags: [none], length: 24
 00:00:00.950630 eth3  Out IP 10.0.35.2.50865 > 10.0.35.3.3784: BFDv1, Control, State Up, Flags: [none], length: 24
 00:00:00.950687 eth2  Out IP 10.0.34.2.43203 > 10.0.34.3.3784: BFDv1, Control, State Up, Flags: [none], length: 24
 00:00:00.965810 eth1  Out IP 10.0.23.3.33100 > 10.0.23.2.3784: BFDv1, Control, State Up, Flags: [none], length: 24
 00:00:00.968860 eth3  In  IP 10.0.35.3.35105 > 10.0.35.2.3784: BFDv1, Control, State Up, Flags: [none], length: 24
 00:00:00.970153 eth0  Out IP 10.0.13.3.36570 > 10.0.13.2.3784: BFDv1, Control, State Up, Flags: [none], length: 24
 00:00:00.990198 eth1  In  IP 10.0.23.2.57018 > 10.0.23.3.3784: BFDv1, Control, State Up, Flags: [none], length: 24
 00:00:01.002721 eth0  In  IP 10.0.13.2.37532 > 10.0.13.3.3784: BFDv1, Control, State Up, Flags: [none], length: 24
 00:00:01.021160 eth2  In  IP 10.0.34.3.37148 > 10.0.34.2.3784: BFDv1, Control, State Up, Flags: [none], length: 24
 00:00:01.027659 eth3  Out IP 10.0.35.2.50865 > 10.0.35.3.3784: BFDv1, Control, State Up, Flags: [none], length: 24
 00:00:01.032952 eth2  Out IP 10.0.34.2.43203 > 10.0.34.3.3784: BFDv1, Control, State Up, Flags: [none], length: 24
 00:00:01.053781 eth0  Out IP 10.0.13.3.36570 > 10.0.13.2.3784: BFDv1, Control, State Up, Flags: [none], length: 24
 00:00:01.055128 eth1  Out IP 10.0.23.3.33100 > 10.0.23.2.3784: BFDv1, Control, State Up, Flags: [none], length: 24
 00:00:01.055907 eth3  In  IP 10.0.35.3.35105 > 10.0.35.2.3784: BFDv1, Control, State Up, Flags: [none], length: 24
 00:00:01.067639 eth1  In  IP 10.0.23.2.57018 > 10.0.23.3.3784: BFDv1, Control, State Up, Flags: [none], length: 24
 00:00:01.092768 eth0  In  IP 10.0.13.2.37532 > 10.0.13.3.3784: BFDv1, Control, State Up, Flags: [none], length: 24
 00:00:01.106161 eth3  Out IP 10.0.35.2.50865 > 10.0.35.3.3784: BFDv1, Control, State Up, Flags: [none], length: 24
 00:00:01.109108 eth2  In  IP 10.0.34.3.37148 > 10.0.34.2.3784: BFDv1, Control, State Up, Flags: [none], length: 24
 00:00:01.120388 eth2  Out IP 10.0.34.2.43203 > 10.0.34.3.3784: BFDv1, Control, State Up, Flags: [none], length: 24
 00:00:01.129691 eth1  Out IP 10.0.23.3.33100 > 10.0.23.2.3784: BFDv1, Control, State Up, Flags: [none], length: 24
 00:00:01.130923 eth0  Out IP 10.0.13.3.36570 > 10.0.13.2.3784: BFDv1, Control, State Up, Flags: [none], length: 24
 00:00:01.144531 eth3  In  IP 10.0.35.3.35105 > 10.0.35.2.3784: BFDv1, Control, State Up, Flags: [none], length: 24
 00:00:01.145996 eth1  In  IP 10.0.23.2.57018 > 10.0.23.3.3784: BFDv1, Control, State Up, Flags: [none], length: 24
 00:00:01.181148 eth0  In  IP 10.0.13.2.37532 > 10.0.13.3.3784: BFDv1, Control, State Up, Flags: [none], length: 24
 00:00:01.185419 eth3  Out IP 10.0.35.2.50865 > 10.0.35.3.3784: BFDv1, Control, State Up, Flags: [none], length: 24
 00:00:01.192219 eth2  In  IP 10.0.34.3.37148 > 10.0.34.2.3784: BFDv1, Control, State Up, Flags: [none], length: 24
 00:00:01.208521 eth1  Out IP 10.0.23.3.33100 > 10.0.23.2.3784: BFDv1, Control, State Up, Flags: [none], length: 24
 00:00:01.209812 eth2  Out IP 10.0.34.2.43203 > 10.0.34.3.3784: BFDv1, Control, State Up, Flags: [none], length: 24
 00:00:01.217994 eth0  Out IP 10.0.13.3.36570 > 10.0.13.2.3784: BFDv1, Control, State Up, Flags: [none], length: 24
 00:00:01.224926 eth1  In  IP 10.0.23.2.57018 > 10.0.23.3.3784: BFDv1, Control, State Up, Flags: [none], length: 24
 00:00:01.234095 eth3  In  IP 10.0.35.3.35105 > 10.0.35.2.3784: BFDv1, Control, State Up, Flags: [none], length: 24
 00:00:01.260218 eth0  In  IP 10.0.13.2.37532 > 10.0.13.3.3784: BFDv1, Control, State Up, Flags: [none], length: 24
 00:00:01.265543 eth3  Out IP 10.0.35.2.50865 > 10.0.35.3.3784: BFDv1, Control, State Up, Flags: [none], length: 24
 00:00:01.268447 eth2  In  IP 10.0.34.3.37148 > 10.0.34.2.3784: BFDv1, Control, State Up, Flags: [none], length: 24
 00:00:01.287839 eth2  Out IP 10.0.34.2.43203 > 10.0.34.3.3784: BFDv1, Control, State Up, Flags: [none], length: 24
 00:00:01.294161 eth1  Out IP 10.0.23.3.33100 > 10.0.23.2.3784: BFDv1, Control, State Up, Flags: [none], length: 24
 00:00:01.300454 eth1  In  IP 10.0.23.2.57018 > 10.0.23.3.3784: BFDv1, Control, State Up, Flags: [none], length: 24
 00:00:01.302823 eth0  Out IP 10.0.13.3.36570 > 10.0.13.2.3784: BFDv1, Control, State Up, Flags: [none], length: 24
 00:00:01.309937 eth3  In  IP 10.0.35.3.35105 > 10.0.35.2.3784: BFDv1, Control, State Up, Flags: [none], length: 24
 00:00:01.337358 eth0  In  IP 10.0.13.2.37532 > 10.0.13.3.3784: BFDv1, Control, State Up, Flags: [none], length: 24
 00:00:01.346676 eth3  Out IP 10.0.35.2.50865 > 10.0.35.3.3784: BFDv1, Control, State Up, Flags: [none], length: 24
 00:00:01.356544 eth2  In  IP 10.0.34.3.37148 > 10.0.34.2.3784: BFDv1, Control, State Up, Flags: [none], length: 24
 00:00:01.371878 eth1  Out IP 10.0.23.3.33100 > 10.0.23.2.3784: BFDv1, Control, State Up, Flags: [none], length: 24
 00:00:01.374116 eth2  Out IP 10.0.34.2.43203 > 10.0.34.3.3784: BFDv1, Control, State Up, Flags: [none], length: 24
 00:00:01.382372 eth0  Out IP 10.0.13.3.36570 > 10.0.13.2.3784: BFDv1, Control, State Up, Flags: [none], length: 24
 00:00:01.389157 eth1  In  IP 10.0.23.2.57018 > 10.0.23.3.3784: BFDv1, Control, State Up, Flags: [none], length: 24
 00:00:01.399648 eth3  In  IP 10.0.35.3.35105 > 10.0.35.2.3784: BFDv1, Control, State Up, Flags: [none], length: 24
 00:00:01.415660 eth0  In  IP 10.0.13.2.37532 > 10.0.13.3.3784: BFDv1, Control, State Up, Flags: [none], length: 24
 00:00:01.433033 eth3  Out IP 10.0.35.2.50865 > 10.0.35.3.3784: BFDv1, Control, State Up, Flags: [none], length: 24
 00:00:01.442888 eth2  In  IP 10.0.34.3.37148 > 10.0.34.2.3784: BFDv1, Control, State Up, Flags: [none], length: 24
 00:00:01.455215 eth2  Out IP 10.0.34.2.43203 > 10.0.34.3.3784: BFDv1, Control, State Up, Flags: [none], length: 24
 00:00:01.459433 eth1  Out IP 10.0.23.3.33100 > 10.0.23.2.3784: BFDv1, Control, State Up, Flags: [none], length: 24
 00:00:01.466721 eth0  Out IP 10.0.13.3.36570 > 10.0.13.2.3784: BFDv1, Control, State Up, Flags: [none], length: 24
 00:00:01.477488 eth3  In  IP 10.0.35.3.35105 > 10.0.35.2.3784: BFDv1, Control, State Up, Flags: [none], length: 24
 00:00:01.478693 eth1  In  IP 10.0.23.2.57018 > 10.0.23.3.3784: BFDv1, Control, State Up, Flags: [none], length: 24
 00:00:01.499109 eth0  In  IP 10.0.13.2.37532 > 10.0.13.3.3784: BFDv1, Control, State Up, Flags: [none], length: 24
 00:00:01.509377 eth3  Out IP 10.0.35.2.50865 > 10.0.35.3.3784: BFDv1, Control, State Up, Flags: [none], length: 24
 00:00:01.523374 eth2  In  IP 10.0.34.3.37148 > 10.0.34.2.3784: BFDv1, Control, State Up, Flags: [none], length: 24
 00:00:01.539686 eth1  Out IP 10.0.23.3.33100 > 10.0.23.2.3784: BFDv1, Control, State Up, Flags: [none], length: 24
 00:00:01.544911 eth2  Out IP 10.0.34.2.43203 > 10.0.34.3.3784: BFDv1, Control, State Up, Flags: [none], length: 24
 00:00:01.557184 eth0  Out IP 10.0.13.3.36570 > 10.0.13.2.3784: BFDv1, Control, State Up, Flags: [none], length: 24
 00:00:01.558276 eth3  In  IP 10.0.35.3.35105 > 10.0.35.2.3784: BFDv1, Control, State Up, Flags: [none], length: 24
 00:00:01.568800 eth1  In  IP 10.0.23.2.57018 > 10.0.23.3.3784: BFDv1, Control, State Up, Flags: [none], length: 24
 00:00:01.580858 eth0  In  IP 10.0.13.2.37532 > 10.0.13.3.3784: BFDv1, Control, State Up, Flags: [none], length: 24
 00:00:01.587213 eth3  Out IP 10.0.35.2.50865 > 10.0.35.3.3784: BFDv1, Control, State Up, Flags: [none], length: 24
 00:00:01.608182 eth2  In  IP 10.0.34.3.37148 > 10.0.34.2.3784: BFDv1, Control, State Up, Flags: [none], length: 24
 00:00:01.622703 eth2  Out IP 10.0.34.2.43203 > 10.0.34.3.3784: BFDv1, Control, State Up, Flags: [none], length: 24
 00:00:01.629006 eth1  Out IP 10.0.23.3.33100 > 10.0.23.2.3784: BFDv1, Control, State Up, Flags: [none], length: 24
 00:00:01.633997 eth3  In  IP 10.0.35.3.35105 > 10.0.35.2.3784: BFDv1, Control, State Up, Flags: [none], length: 24
 00:00:01.636327 eth0  Out IP 10.0.13.3.36570 > 10.0.13.2.3784: BFDv1, Control, State Up, Flags: [none], length: 24
 00:00:01.649455 eth1  In  IP 10.0.23.2.57018 > 10.0.23.3.3784: BFDv1, Control, State Up, Flags: [none], length: 24
 00:00:01.661900 eth0  In  IP 10.0.13.2.37532 > 10.0.13.3.3784: BFDv1, Control, State Up, Flags: [none], length: 24
 00:00:01.668308 eth3  Out IP 10.0.35.2.50865 > 10.0.35.3.3784: BFDv1, Control, State Up, Flags: [none], length: 24
 00:00:01.686182 eth2  In  IP 10.0.34.3.37148 > 10.0.34.2.3784: BFDv1, Control, State Up, Flags: [none], length: 24
 00:00:01.700608 eth2  Out IP 10.0.34.2.43203 > 10.0.34.3.3784: BFDv1, Control, State Up, Flags: [none], length: 24
 00:00:01.714985 eth1  Out IP 10.0.23.3.33100 > 10.0.23.2.3784: BFDv1, Control, State Up, Flags: [none], length: 24
 00:00:01.717880 eth3  In  IP 10.0.35.3.35105 > 10.0.35.2.3784: BFDv1, Control, State Up, Flags: [none], length: 24
 00:00:01.720276 eth0  Out IP 10.0.13.3.36570 > 10.0.13.2.3784: BFDv1, Control, State Up, Flags: [none], length: 24
 00:00:01.731480 eth1  In  IP 10.0.23.2.57018 > 10.0.23.3.3784: BFDv1, Control, State Up, Flags: [none], length: 24
 00:00:01.737518 eth0  In  IP 10.0.13.2.37532 > 10.0.13.3.3784: BFDv1, Control, State Up, Flags: [none], length: 24
 00:00:01.756866 eth3  Out IP 10.0.35.2.50865 > 10.0.35.3.3784: BFDv1, Control, State Up, Flags: [none], length: 24
 00:00:01.767725 eth2  In  IP 10.0.34.3.37148 > 10.0.34.2.3784: BFDv1, Control, State Up, Flags: [none], length: 24
 00:00:01.789001 eth2  Out IP 10.0.34.2.43203 > 10.0.34.3.3784: BFDv1, Control, State Up, Flags: [none], length: 24
 00:00:01.798227 eth0  Out IP 10.0.13.3.36570 > 10.0.13.2.3784: BFDv1, Control, State Up, Flags: [none], length: 24
 00:00:01.798302 eth1  Out IP 10.0.23.3.33100 > 10.0.23.2.3784: BFDv1, Control, State Up, Flags: [none], length: 24
 00:00:01.803498 eth3  In  IP 10.0.35.3.35105 > 10.0.35.2.3784: BFDv1, Control, State Up, Flags: [none], length: 24
 00:00:01.819357 eth1  In  IP 10.0.23.2.57018 > 10.0.23.3.3784: BFDv1, Control, State Up, Flags: [none], length: 24
 00:00:01.819442 eth0  In  IP 10.0.13.2.37532 > 10.0.13.3.3784: BFDv1, Control, State Up, Flags: [none], length: 24
 00:00:01.844703 eth3  Out IP 10.0.35.2.50865 > 10.0.35.3.3784: BFDv1, Control, State Up, Flags: [none], length: 24
 00:00:01.844946 eth2  In  IP 10.0.34.3.37148 > 10.0.34.2.3784: BFDv1, Control, State Up, Flags: [none], length: 24
 00:00:01.874159 eth0  Out IP 10.0.13.3.36570 > 10.0.13.2.3784: BFDv1, Control, State Up, Flags: [none], length: 24
 00:00:01.875351 eth2  Out IP 10.0.34.2.43203 > 10.0.34.3.3784: BFDv1, Control, State Up, Flags: [none], length: 24
 00:00:01.877537 eth1  Out IP 10.0.23.3.33100 > 10.0.23.2.3784: BFDv1, Control, State Up, Flags: [none], length: 24
 00:00:01.891993 eth3  In  IP 10.0.35.3.35105 > 10.0.35.2.3784: BFDv1, Control, State Up, Flags: [none], length: 24
 00:00:01.898829 eth0  In  IP 10.0.13.2.37532 > 10.0.13.3.3784: BFDv1, Control, State Up, Flags: [none], length: 24
 00:00:01.906204 eth1  In  IP 10.0.23.2.57018 > 10.0.23.3.3784: BFDv1, Control, State Up, Flags: [none], length: 24
 00:00:01.921479 eth2  In  IP 10.0.34.3.37148 > 10.0.34.2.3784: BFDv1, Control, State Up, Flags: [none], length: 24
 00:00:01.927847 eth3  Out IP 10.0.35.2.50865 > 10.0.35.3.3784: BFDv1, Control, State Up, Flags: [none], length: 24
 00:00:01.952140 eth0  Out IP 10.0.13.3.36570 > 10.0.13.2.3784: BFDv1, Control, State Up, Flags: [none], length: 24
 00:00:01.963444 eth2  Out IP 10.0.34.2.43203 > 10.0.34.3.3784: BFDv1, Control, State Up, Flags: [none], length: 24
 00:00:01.964740 eth1  Out IP 10.0.23.3.33100 > 10.0.23.2.3784: BFDv1, Control, State Up, Flags: [none], length: 24
 00:00:01.974595 eth3  In  IP 10.0.35.3.35105 > 10.0.35.2.3784: BFDv1, Control, State Up, Flags: [none], length: 24
 00:00:01.987198 eth0  In  IP 10.0.13.2.37532 > 10.0.13.3.3784: BFDv1, Control, State Up, Flags: [none], length: 24
 00:00:01.992838 eth1  In  IP 10.0.23.2.57018 > 10.0.23.3.3784: BFDv1, Control, State Up, Flags: [none], length: 24
 00:00:01.999970 eth2  In  IP 10.0.34.3.37148 > 10.0.34.2.3784: BFDv1, Control, State Up, Flags: [none], length: 24
 00:00:02.017378 eth3  Out IP 10.0.35.2.50865 > 10.0.35.3.3784: BFDv1, Control, State Up, Flags: [none], length: 24
 00:00:02.041875 eth0  Out IP 10.0.13.3.36570 > 10.0.13.2.3784: BFDv1, Control, State Up, Flags: [none], length: 24
 00:00:02.051166 eth1  Out IP 10.0.23.3.33100 > 10.0.23.2.3784: BFDv1, Control, State Up, Flags: [none], length: 24
 00:00:02.060660 eth3  In  IP 10.0.35.3.35105 > 10.0.35.2.3784: BFDv1, Control, State Up, Flags: [none], length: 24
 00:00:02.069661 eth1  In  IP 10.0.23.2.57018 > 10.0.23.3.3784: BFDv1, Control, State Up, Flags: [none], length: 24
 00:00:02.069881 eth0  In  IP 10.0.13.2.37532 > 10.0.13.3.3784: BFDv1, Control, State Up, Flags: [none], length: 24
 00:00:02.075848 eth2  In  IP 10.0.34.3.37148 > 10.0.34.2.3784: BFDv1, Control, State Up, Flags: [none], length: 24
 00:00:02.105166 eth3  Out IP 10.0.35.2.50865 > 10.0.35.3.3784: BFDv1, Control, State Up, Flags: [none], length: 24
 00:00:02.122436 eth0  Out IP 10.0.13.3.36570 > 10.0.13.2.3784: BFDv1, Control, State Up, Flags: [none], length: 24
 00:00:02.137461 eth3  In  IP 10.0.35.3.35105 > 10.0.35.2.3784: BFDv1, Control, State Up, Flags: [none], length: 24
 00:00:02.139998 eth1  Out IP 10.0.23.3.33100 > 10.0.23.2.3784: BFDv1, Control, State Up, Flags: [none], length: 24
 00:00:02.147985 eth0  In  IP 10.0.13.2.37532 > 10.0.13.3.3784: BFDv1, Control, State Up, Flags: [none], length: 24
 00:00:02.151356 eth1  In  IP 10.0.23.2.57018 > 10.0.23.3.3784: BFDv1, Control, State Up, Flags: [none], length: 24
 00:00:02.155397 eth2  In  IP 10.0.34.3.37148 > 10.0.34.2.3784: BFDv1, Control, State Up, Flags: [none], length: 24
 00:00:02.186949 eth3  Out IP 10.0.35.2.50865 > 10.0.35.3.3784: BFDv1, Control, State Up, Flags: [none], length: 24
 00:00:02.211360 eth0  Out IP 10.0.13.3.36570 > 10.0.13.2.3784: BFDv1, Control, State Up, Flags: [none], length: 24
 00:00:02.215197 eth3  In  IP 10.0.35.3.35105 > 10.0.35.2.3784: BFDv1, Control, State Up, Flags: [none], length: 24
 00:00:02.223287 eth0  In  IP 10.0.13.2.37532 > 10.0.13.3.3784: BFDv1, Control, State Up, Flags: [none], length: 24
 00:00:02.224577 eth1  Out IP 10.0.23.3.33100 > 10.0.23.2.3784: BFDv1, Control, State Up, Flags: [none], length: 24
 00:00:02.234666 eth1  In  IP 10.0.23.2.57018 > 10.0.23.3.3784: BFDv1, Control, State Up, Flags: [none], length: 24
 00:00:02.271080 eth3  Out IP 10.0.35.2.50865 > 10.0.35.3.3784: BFDv1, Control, State Up, Flags: [none], length: 24
 00:00:02.297362 eth3  In  IP 10.0.35.3.35105 > 10.0.35.2.3784: BFDv1, Control, State Up, Flags: [none], length: 24
 00:00:02.299748 eth0  Out IP 10.0.13.3.36570 > 10.0.13.2.3784: BFDv1, Control, State Up, Flags: [none], length: 24
 00:00:02.306779 eth0  In  IP 10.0.13.2.37532 > 10.0.13.3.3784: BFDv1, Control, State Up, Flags: [none], length: 24
 00:00:02.314013 eth1  Out IP 10.0.23.3.33100 > 10.0.23.2.3784: BFDv1, Control, State Up, Flags: [none], length: 24
 00:00:02.317007 eth1  In  IP 10.0.23.2.57018 > 10.0.23.3.3784: BFDv1, Control, State Up, Flags: [none], length: 24
 00:00:02.350269 eth3  Out IP 10.0.35.2.50865 > 10.0.35.3.3784: BFDv1, Control, State Up, Flags: [none], length: 24
 00:00:02.375559 eth3  In  IP 10.0.35.3.35105 > 10.0.35.2.3784: BFDv1, Control, State Up, Flags: [none], length: 24
 00:00:02.383019 eth0  Out IP 10.0.13.3.36570 > 10.0.13.2.3784: BFDv1, Control, State Up, Flags: [none], length: 24
 00:00:02.385289 eth0  In  IP 10.0.13.2.37532 > 10.0.13.3.3784: BFDv1, Control, State Up, Flags: [none], length: 24
 00:00:02.391663 eth1  Out IP 10.0.23.3.33100 > 10.0.23.2.3784: BFDv1, Control, State Up, Flags: [none], length: 24
 00:00:02.405096 eth1  In  IP 10.0.23.2.57018 > 10.0.23.3.3784: BFDv1, Control, State Up, Flags: [none], length: 24
 00:00:02.432549 eth3  Out IP 10.0.35.2.50865 > 10.0.35.3.3784: BFDv1, Control, State Up, Flags: [none], length: 24
 00:00:02.453207 eth3  In  IP 10.0.35.3.35105 > 10.0.35.2.3784: BFDv1, Control, State Up, Flags: [none], length: 24
 00:00:02.463252 eth0  In  IP 10.0.13.2.37532 > 10.0.13.3.3784: BFDv1, Control, State Up, Flags: [none], length: 24
 00:00:02.464493 eth0  Out IP 10.0.13.3.36570 > 10.0.13.2.3784: BFDv1, Control, State Up, Flags: [none], length: 24
 00:00:02.472700 eth1  Out IP 10.0.23.3.33100 > 10.0.23.2.3784: BFDv1, Control, State Up, Flags: [none], length: 24
 00:00:02.490190 eth1  In  IP 10.0.23.2.57018 > 10.0.23.3.3784: BFDv1, Control, State Up, Flags: [none], length: 24
 00:00:02.520507 eth3  Out IP 10.0.35.2.50865 > 10.0.35.3.3784: BFDv1, Control, State Up, Flags: [none], length: 24
 00:00:02.538816 eth3  In  IP 10.0.35.3.35105 > 10.0.35.2.3784: BFDv1, Control, State Up, Flags: [none], length: 24
 00:00:02.548231 eth0  Out IP 10.0.13.3.36570 > 10.0.13.2.3784: BFDv1, Control, State Up, Flags: [none], length: 24
 00:00:02.549411 eth0  In  IP 10.0.13.2.37532 > 10.0.13.3.3784: BFDv1, Control, State Up, Flags: [none], length: 24
 00:00:02.553697 eth1  Out IP 10.0.23.3.33100 > 10.0.23.2.3784: BFDv1, Control, State Up, Flags: [none], length: 24
 00:00:02.567019 eth1  In  IP 10.0.23.2.57018 > 10.0.23.3.3784: BFDv1, Control, State Up, Flags: [none], length: 24
 00:00:02.605380 eth3  Out IP 10.0.35.2.50865 > 10.0.35.3.3784: BFDv1, Control, State Up, Flags: [none], length: 24
 00:00:02.619642 eth3  In  IP 10.0.35.3.35105 > 10.0.35.2.3784: BFDv1, Control, State Up, Flags: [none], length: 24
 00:00:02.626960 eth0  Out IP 10.0.13.3.36570 > 10.0.13.2.3784: BFDv1, Control, State Up, Flags: [none], length: 24
 00:00:02.635256 eth0  In  IP 10.0.13.2.37532 > 10.0.13.3.3784: BFDv1, Control, State Up, Flags: [none], length: 24
 00:00:02.637653 eth1  Out IP 10.0.23.3.33100 > 10.0.23.2.3784: BFDv1, Control, State Up, Flags: [none], length: 24
 00:00:02.646818 eth1  In  IP 10.0.23.2.57018 > 10.0.23.3.3784: BFDv1, Control, State Up, Flags: [none], length: 24
 00:00:02.685571 eth3  Out IP 10.0.35.2.50865 > 10.0.35.3.3784: BFDv1, Control, State Up, Flags: [none], length: 24
 00:00:02.695869 eth3  In  IP 10.0.35.3.35105 > 10.0.35.2.3784: BFDv1, Control, State Up, Flags: [none], length: 24
 00:00:02.706245 eth0  Out IP 10.0.13.3.36570 > 10.0.13.2.3784: BFDv1, Control, State Up, Flags: [none], length: 24
 00:00:02.711535 eth0  In  IP 10.0.13.2.37532 > 10.0.13.3.3784: BFDv1, Control, State Up, Flags: [none], length: 24
 00:00:02.716004 eth1  Out IP 10.0.23.3.33100 > 10.0.23.2.3784: BFDv1, Control, State Up, Flags: [none], length: 24
 00:00:02.728208 eth1  In  IP 10.0.23.2.57018 > 10.0.23.3.3784: BFDv1, Control, State Up, Flags: [none], length: 24
 00:00:02.770592 eth3  Out IP 10.0.35.2.50865 > 10.0.35.3.3784: BFDv1, Control, State Up, Flags: [none], length: 24
 00:00:02.778835 eth3  In  IP 10.0.35.3.35105 > 10.0.35.2.3784: BFDv1, Control, State Up, Flags: [none], length: 24
 00:00:02.782153 eth0  Out IP 10.0.13.3.36570 > 10.0.13.2.3784: BFDv1, Control, State Up, Flags: [none], length: 24
 00:00:02.793025 eth0  In  IP 10.0.13.2.37532 > 10.0.13.3.3784: BFDv1, Control, State Up, Flags: [none], length: 24
 00:00:02.793206 eth1  Out IP 10.0.23.3.33100 > 10.0.23.2.3784: BFDv1, Control, State Up, Flags: [none], length: 24
 00:00:02.808488 eth1  In  IP 10.0.23.2.57018 > 10.0.23.3.3784: BFDv1, Control, State Up, Flags: [none], length: 24
 00:00:02.850971 eth3  Out IP 10.0.35.2.50865 > 10.0.35.3.3784: BFDv1, Control, State Up, Flags: [none], length: 24
 00:00:02.867211 eth3  In  IP 10.0.35.3.35105 > 10.0.35.2.3784: BFDv1, Control, State Up, Flags: [none], length: 24
 00:00:02.871518 eth0  Out IP 10.0.13.3.36570 > 10.0.13.2.3784: BFDv1, Control, State Up, Flags: [none], length: 24
 00:00:02.879835 eth1  Out IP 10.0.23.3.33100 > 10.0.23.2.3784: BFDv1, Control, State Up, Flags: [none], length: 24
 00:00:02.879910 eth0  In  IP 10.0.13.2.37532 > 10.0.13.3.3784: BFDv1, Control, State Up, Flags: [none], length: 24
 00:00:02.887298 eth1  In  IP 10.0.23.2.57018 > 10.0.23.3.3784: BFDv1, Control, State Up, Flags: [none], length: 24
 00:00:02.926703 eth3  Out IP 10.0.35.2.50865 > 10.0.35.3.3784: BFDv1, Control, State Up, Flags: [none], length: 24
 00:00:02.947980 eth0  Out IP 10.0.13.3.36570 > 10.0.13.2.3784: BFDv1, Control, State Up, Flags: [none], length: 24
 00:00:02.948870 eth3  In  IP 10.0.35.3.35105 > 10.0.35.2.3784: BFDv1, Control, State Up, Flags: [none], length: 24
 00:00:02.962649 eth0  In  IP 10.0.13.2.37532 > 10.0.13.3.3784: BFDv1, Control, State Up, Flags: [none], length: 24
 00:00:02.962834 eth1  In  IP 10.0.23.2.57018 > 10.0.23.3.3784: BFDv1, Control, State Up, Flags: [none], length: 24
 00:00:02.966035 eth1  Out IP 10.0.23.3.33100 > 10.0.23.2.3784: BFDv1, Control, State Up, Flags: [none], length: 24
 00:00:03.015249 eth3  Out IP 10.0.35.2.50865 > 10.0.35.3.3784: BFDv1, Control, State Up, Flags: [none], length: 24
 00:00:03.027484 eth0  Out IP 10.0.13.3.36570 > 10.0.13.2.3784: BFDv1, Control, State Up, Flags: [none], length: 24
 00:00:03.035556 eth3  In  IP 10.0.35.3.35105 > 10.0.35.2.3784: BFDv1, Control, State Up, Flags: [none], length: 24
 00:00:03.038388 eth0  In  IP 10.0.13.2.37532 > 10.0.13.3.3784: BFDv1, Control, State Up, Flags: [none], length: 24
 00:00:03.039350 eth1  In  IP 10.0.23.2.57018 > 10.0.23.3.3784: BFDv1, Control, State Up, Flags: [none], length: 24
 00:00:03.043630 eth1  Out IP 10.0.23.3.33100 > 10.0.23.2.3784: BFDv1, Control, State Up, Flags: [none], length: 24
 00:00:03.097836 eth3  Out IP 10.0.35.2.50865 > 10.0.35.3.3784: BFDv1, Control, State Up, Flags: [none], length: 24
 00:00:03.110372 eth0  Out IP 10.0.13.3.36570 > 10.0.13.2.3784: BFDv1, Control, State Up, Flags: [none], length: 24
 00:00:03.116118 eth3  In  IP 10.0.35.3.35105 > 10.0.35.2.3784: BFDv1, Control, State Up, Flags: [none], length: 24
 00:00:03.128005 eth1  In  IP 10.0.23.2.57018 > 10.0.23.3.3784: BFDv1, Control, State Up, Flags: [none], length: 24
 00:00:03.128143 eth0  In  IP 10.0.13.2.37532 > 10.0.13.3.3784: BFDv1, Control, State Up, Flags: [none], length: 24
 00:00:03.130328 eth1  Out IP 10.0.23.3.33100 > 10.0.23.2.3784: BFDv1, Control, State Up, Flags: [none], length: 24
 00:00:03.182554 eth3  Out IP 10.0.35.2.50865 > 10.0.35.3.3784: BFDv1, Control, State Up, Flags: [none], length: 24
 00:00:03.198919 eth0  Out IP 10.0.13.3.36570 > 10.0.13.2.3784: BFDv1, Control, State Up, Flags: [none], length: 24
 00:00:03.204378 eth1  In  IP 10.0.23.2.57018 > 10.0.23.3.3784: BFDv1, Control, State Up, Flags: [none], length: 24
 00:00:03.205664 eth3  In  IP 10.0.35.3.35105 > 10.0.35.2.3784: BFDv1, Control, State Up, Flags: [none], length: 24
 00:00:03.205678 eth1  Out IP 10.0.23.3.33100 > 10.0.23.2.3784: BFDv1, Control, State Up, Flags: [none], length: 24
 00:00:03.207134 eth0  In  IP 10.0.13.2.37532 > 10.0.13.3.3784: BFDv1, Control, State Up, Flags: [none], length: 24
 00:00:03.265385 eth3  Out IP 10.0.35.2.50865 > 10.0.35.3.3784: BFDv1, Control, State Up, Flags: [none], length: 24
 00:00:03.278559 eth0  Out IP 10.0.13.3.36570 > 10.0.13.2.3784: BFDv1, Control, State Up, Flags: [none], length: 24
 00:00:03.281080 eth3  In  IP 10.0.35.3.35105 > 10.0.35.2.3784: BFDv1, Control, State Up, Flags: [none], length: 24
 00:00:03.281988 eth1  In  IP 10.0.23.2.57018 > 10.0.23.3.3784: BFDv1, Control, State Up, Flags: [none], length: 24
 00:00:03.290139 eth1  Out IP 10.0.23.3.33100 > 10.0.23.2.3784: BFDv1, Control, State Up, Flags: [none], length: 24
 00:00:03.293197 eth0  In  IP 10.0.13.2.37532 > 10.0.13.3.3784: BFDv1, Control, State Up, Flags: [none], length: 24
 00:00:03.353552 eth3  Out IP 10.0.35.2.50865 > 10.0.35.3.3784: BFDv1, Control, State Up, Flags: [none], length: 24
 00:00:03.359221 eth1  In  IP 10.0.23.2.57018 > 10.0.23.3.3784: BFDv1, Control, State Up, Flags: [none], length: 24
 00:00:03.365734 eth1  Out IP 10.0.23.3.33100 > 10.0.23.2.3784: BFDv1, Control, State Up, Flags: [none], length: 24
 00:00:03.368031 eth0  Out IP 10.0.13.3.36570 > 10.0.13.2.3784: BFDv1, Control, State Up, Flags: [none], length: 24
 00:00:03.370601 eth3  In  IP 10.0.35.3.35105 > 10.0.35.2.3784: BFDv1, Control, State Up, Flags: [none], length: 24
 00:00:03.379690 eth0  In  IP 10.0.13.2.37532 > 10.0.13.3.3784: BFDv1, Control, State Up, Flags: [none], length: 24
 00:00:03.431012 eth3  Out IP 10.0.35.2.50865 > 10.0.35.3.3784: BFDv1, Control, State Up, Flags: [none], length: 24
 00:00:03.442910 eth1  In  IP 10.0.23.2.57018 > 10.0.23.3.3784: BFDv1, Control, State Up, Flags: [none], length: 24
 00:00:03.448206 eth0  Out IP 10.0.13.3.36570 > 10.0.13.2.3784: BFDv1, Control, State Up, Flags: [none], length: 24
 00:00:03.448272 eth1  Out IP 10.0.23.3.33100 > 10.0.23.2.3784: BFDv1, Control, State Up, Flags: [none], length: 24
 00:00:03.451279 eth3  In  IP 10.0.35.3.35105 > 10.0.35.2.3784: BFDv1, Control, State Up, Flags: [none], length: 24
 00:00:03.467694 eth0  In  IP 10.0.13.2.37532 > 10.0.13.3.3784: BFDv1, Control, State Up, Flags: [none], length: 24
 00:00:03.512018 eth3  Out IP 10.0.35.2.50865 > 10.0.35.3.3784: BFDv1, Control, State Up, Flags: [none], length: 24
 00:00:03.529838 eth3  In  IP 10.0.35.3.35105 > 10.0.35.2.3784: BFDv1, Control, State Up, Flags: [none], length: 24
 00:00:03.531096 eth1  Out IP 10.0.23.3.33100 > 10.0.23.2.3784: BFDv1, Control, State Up, Flags: [none], length: 24
 00:00:03.532276 eth1  In  IP 10.0.23.2.57018 > 10.0.23.3.3784: BFDv1, Control, State Up, Flags: [none], length: 24
 00:00:03.535516 eth0  Out IP 10.0.13.3.36570 > 10.0.13.2.3784: BFDv1, Control, State Up, Flags: [none], length: 24
 00:00:03.556774 eth0  In  IP 10.0.13.2.37532 > 10.0.13.3.3784: BFDv1, Control, State Up, Flags: [none], length: 24
 00:00:03.590129 eth3  Out IP 10.0.35.2.50865 > 10.0.35.3.3784: BFDv1, Control, State Up, Flags: [none], length: 24
 00:00:03.605411 eth3  In  IP 10.0.35.3.35105 > 10.0.35.2.3784: BFDv1, Control, State Up, Flags: [none], length: 24
 00:00:03.613740 eth1  Out IP 10.0.23.3.33100 > 10.0.23.2.3784: BFDv1, Control, State Up, Flags: [none], length: 24
 00:00:03.617952 eth1  In  IP 10.0.23.2.57018 > 10.0.23.3.3784: BFDv1, Control, State Up, Flags: [none], length: 24
 00:00:03.617983 eth0  Out IP 10.0.13.3.36570 > 10.0.13.2.3784: BFDv1, Control, State Up, Flags: [none], length: 24
 00:00:03.635419 eth0  In  IP 10.0.13.2.37532 > 10.0.13.3.3784: BFDv1, Control, State Up, Flags: [none], length: 24
 00:00:03.671795 eth3  Out IP 10.0.35.2.50865 > 10.0.35.3.3784: BFDv1, Control, State Up, Flags: [none], length: 24
 00:00:03.684031 eth3  In  IP 10.0.35.3.35105 > 10.0.35.2.3784: BFDv1, Control, State Up, Flags: [none], length: 24
 00:00:03.700304 eth0  Out IP 10.0.13.3.36570 > 10.0.13.2.3784: BFDv1, Control, State Up, Flags: [none], length: 24
 00:00:03.701480 eth1  Out IP 10.0.23.3.33100 > 10.0.23.2.3784: BFDv1, Control, State Up, Flags: [none], length: 24
 00:00:03.707261 eth1  In  IP 10.0.23.2.57018 > 10.0.23.3.3784: BFDv1, Control, State Up, Flags: [none], length: 24
 00:00:03.720429 eth0  In  IP 10.0.13.2.37532 > 10.0.13.3.3784: BFDv1, Control, State Up, Flags: [none], length: 24
 00:00:03.748686 eth3  Out IP 10.0.35.2.50865 > 10.0.35.3.3784: BFDv1, Control, State Up, Flags: [none], length: 24
 00:00:03.767544 eth3  In  IP 10.0.35.3.35105 > 10.0.35.2.3784: BFDv1, Control, State Up, Flags: [none], length: 24
 00:00:03.784704 eth1  Out IP 10.0.23.3.33100 > 10.0.23.2.3784: BFDv1, Control, State Up, Flags: [none], length: 24
 00:00:03.787918 eth0  Out IP 10.0.13.3.36570 > 10.0.13.2.3784: BFDv1, Control, State Up, Flags: [none], length: 24
 00:00:03.792858 eth1  In  IP 10.0.23.2.57018 > 10.0.23.3.3784: BFDv1, Control, State Up, Flags: [none], length: 24
 00:00:03.797258 eth0  In  IP 10.0.13.2.37532 > 10.0.13.3.3784: BFDv1, Control, State Up, Flags: [none], length: 24
 00:00:03.836524 eth3  Out IP 10.0.35.2.50865 > 10.0.35.3.3784: BFDv1, Control, State Up, Flags: [none], length: 24
 00:00:03.851060 eth3  In  IP 10.0.35.3.35105 > 10.0.35.2.3784: BFDv1, Control, State Up, Flags: [none], length: 24
 00:00:03.871195 eth1  In  IP 10.0.23.2.57018 > 10.0.23.3.3784: BFDv1, Control, State Up, Flags: [none], length: 24
 00:00:03.871313 eth1  Out IP 10.0.23.3.33100 > 10.0.23.2.3784: BFDv1, Control, State Up, Flags: [none], length: 24
 00:00:03.874476 eth0  Out IP 10.0.13.3.36570 > 10.0.13.2.3784: BFDv1, Control, State Up, Flags: [none], length: 24
 00:00:03.882040 eth0  In  IP 10.0.13.2.37532 > 10.0.13.3.3784: BFDv1, Control, State Up, Flags: [none], length: 24
 00:00:03.912333 eth3  Out IP 10.0.35.2.50865 > 10.0.35.3.3784: BFDv1, Control, State Up, Flags: [none], length: 24
 00:00:03.934592 eth3  In  IP 10.0.35.3.35105 > 10.0.35.2.3784: BFDv1, Control, State Up, Flags: [none], length: 24
 00:00:03.950869 eth1  Out IP 10.0.23.3.33100 > 10.0.23.2.3784: BFDv1, Control, State Up, Flags: [none], length: 24
 00:00:03.954078 eth0  Out IP 10.0.13.3.36570 > 10.0.13.2.3784: BFDv1, Control, State Up, Flags: [none], length: 24
 00:00:03.957075 eth1  In  IP 10.0.23.2.57018 > 10.0.23.3.3784: BFDv1, Control, State Up, Flags: [none], length: 24
 00:00:03.960446 eth0  In  IP 10.0.13.2.37532 > 10.0.13.3.3784: BFDv1, Control, State Up, Flags: [none], length: 24
 00:00:03.998781 eth3  Out IP 10.0.35.2.50865 > 10.0.35.3.3784: BFDv1, Control, State Up, Flags: [none], length: 24
