tcpdump: data link type LINUX_SLL2
tcpdump: verbose output suppressed, use -v[v]... for full protocol decode
listening on any, link-type LINUX_SLL2 (Linux cooked v2), snapshot length 262144 bytes
 00:00:00.000000 eth2  In  IP 10.0.29.3.51220 > 10.0.29.2.3784: BFDv1, Control, State Up, Flags: [none], length: 24
 00:00:00.039281 eth2  Out IP 10.0.29.2.40921 > 10.0.29.3.3784: BFDv1, Control, State Up, Flags: [none], length: 24
 00:00:00.077734 eth2  In  IP 10.0.29.3.51220 > 10.0.29.2.3784: BFDv1, Control, State Up, Flags: [none], length: 24
 00:00:00.115137 eth2  Out IP 10.0.29.2.40921 > 10.0.29.3.3784: BFDv1, Control, State Up, Flags: [none], length: 24
 00:00:00.162741 eth2  In  IP 10.0.29.3.51220 > 10.0.29.2.3784: BFDv1, Control, State Up, Flags: [none], length: 24
 00:00:00.194240 eth2  Out IP 10.0.29.2.40921 > 10.0.29.3.3784: BFDv1, Control, State Up, Flags: [none], length: 24
 00:00:00.238728 eth2  In  IP 10.0.29.3.51220 > 10.0.29.2.3784: BFDv1, Control, State Up, Flags: [none], length: 24
 00:00:00.275139 eth2  Out IP 10.0.29.2.40921 > 10.0.29.3.3784: BFDv1, Control, State Up, Flags: [none], length: 24
 00:00:00.316696 eth2  In  IP 10.0.29.3.51220 > 10.0.29.2.3784: BFDv1, Control, State Up, Flags: [none], length: 24
 00:00:00.354032 eth2  Out IP 10.0.29.2.40921 > 10.0.29.3.3784: BFDv1, Control, State Up, Flags: [none], length: 24
 00:00:00.400423 eth2  In  IP 10.0.29.3.51220 > 10.0.29.2.3784: BFDv1, Control, State Up, Flags: [none], length: 24
 00:00:00.441790 eth2  Out IP 10.0.29.2.40921 > 10.0.29.3.3784: BFDv1, Control, State Up, Flags: [none], length: 24
 00:00:00.486269 eth2  In  IP 10.0.29.3.51220 > 10.0.29.2.3784: BFDv1, Control, State Up, Flags: [none], length: 24
 00:00:00.526559 eth2  Out IP 10.0.29.2.40921 > 10.0.29.3.3784: BFDv1, Control, State Up, Flags: [none], length: 24
 00:00:00.571367 eth2  In  IP 10.0.29.3.51220 > 10.0.29.2.3784: BFDv1, Control, State Up, Flags: [none], length: 24
 00:00:00.604839 eth2  Out IP 10.0.29.2.40921 > 10.0.29.3.3784: BFDv1, Control, State Up, Flags: [none], length: 24
 00:00:00.656625 eth2  In  IP 10.0.29.3.51220 > 10.0.29.2.3784: BFDv1, Control, State Up, Flags: [none], length: 24
 00:00:00.679956 eth2  Out IP 10.0.29.2.40921 > 10.0.29.3.3784: BFDv1, Control, State Up, Flags: [none], length: 24
 00:00:00.738256 eth2  In  IP 10.0.29.3.51220 > 10.0.29.2.3784: BFDv1, Control, State Up, Flags: [none], length: 24
 00:00:00.756656 eth2  Out IP 10.0.29.2.40921 > 10.0.29.3.3784: BFDv1, Control, State Up, Flags: [none], length: 24
 00:00:00.823743 eth2  In  IP 10.0.29.3.51220 > 10.0.29.2.3784: BFDv1, Control, State Up, Flags: [none], length: 24
 00:00:00.834074 eth2  Out IP 10.0.29.2.40921 > 10.0.29.3.3784: BFDv1, Control, State Up, Flags: [none], length: 24
 00:00:00.903599 eth2  In  IP 10.0.29.3.51220 > 10.0.29.2.3784: BFDv1, Control, State Up, Flags: [none], length: 24
 00:00:00.922941 eth2  Out IP 10.0.29.2.40921 > 10.0.29.3.3784: BFDv1, Control, State Up, Flags: [none], length: 24
 00:00:00.988356 eth2  In  IP 10.0.29.3.51220 > 10.0.29.2.3784: BFDv1, Control, State Up, Flags: [none], length: 24
 00:00:01.012770 eth2  Out IP 10.0.29.2.40921 > 10.0.29.3.3784: BFDv1, Control, State Up, Flags: [none], length: 24
 00:00:01.075560 eth2  In  IP 10.0.29.3.51220 > 10.0.29.2.3784: BFDv1, Control, State Up, Flags: [none], length: 24
 00:00:01.091935 eth2  Out IP 10.0.29.2.40921 > 10.0.29.3.3784: BFDv1, Control, State Up, Flags: [none], length: 24
 00:00:01.164737 eth2  In  IP 10.0.29.3.51220 > 10.0.29.2.3784: BFDv1, Control, State Up, Flags: [none], length: 24
 00:00:01.178148 eth2  Out IP 10.0.29.2.40921 > 10.0.29.3.3784: BFDv1, Control, State Up, Flags: [none], length: 24
 00:00:01.245292 eth2  In  IP 10.0.29.3.51220 > 10.0.29.2.3784: BFDv1, Control, State Up, Flags: [none], length: 24
 00:00:01.259724 eth2  Out IP 10.0.29.2.40921 > 10.0.29.3.3784: BFDv1, Control, State Up, Flags: [none], length: 24
 00:00:01.324905 eth2  In  IP 10.0.29.3.51220 > 10.0.29.2.3784: BFDv1, Control, State Up, Flags: [none], length: 24
 00:00:01.336256 eth2  Out IP 10.0.29.2.40921 > 10.0.29.3.3784: BFDv1, Control, State Up, Flags: [none], length: 24
 00:00:01.414122 eth2  In  IP 10.0.29.3.51220 > 10.0.29.2.3784: BFDv1, Control, State Up, Flags: [none], length: 24
 00:00:01.425470 eth2  Out IP 10.0.29.2.40921 > 10.0.29.3.3784: BFDv1, Control, State Up, Flags: [none], length: 24
 00:00:01.502292 eth2  In  IP 10.0.29.3.51220 > 10.0.29.2.3784: BFDv1, Control, State Up, Flags: [none], length: 24
 00:00:01.504601 eth2  Out IP 10.0.29.2.40921 > 10.0.29.3.3784: BFDv1, Control, State Up, Flags: [none], length: 24
 00:00:01.584683 eth2  In  IP 10.0.29.3.51220 > 10.0.29.2.3784: BFDv1, Control, State Up, Flags: [none], length: 24
 00:00:01.592027 eth2  Out IP 10.0.29.2.40921 > 10.0.29.3.3784: BFDv1, Control, State Up, Flags: [none], length: 24
 00:00:01.667863 eth2  In  IP 10.0.29.3.51220 > 10.0.29.2.3784: BFDv1, Control, State Up, Flags: [none], length: 24
 00:00:01.680279 eth2  Out IP 10.0.29.2.40921 > 10.0.29.3.3784: BFDv1, Control, State Up, Flags: [none], length: 24
 00:00:01.746618 eth2  In  IP 10.0.29.3.51220 > 10.0.29.2.3784: BFDv1, Control, State Up, Flags: [none], length: 24
 00:00:01.767925 eth2  Out IP 10.0.29.2.40921 > 10.0.29.3.3784: BFDv1, Control, State Up, Flags: [none], length: 24
 00:00:01.831892 eth2  In  IP 10.0.29.3.51220 > 10.0.29.2.3784: BFDv1, Control, State Up, Flags: [none], length: 24
 00:00:01.844284 eth2  Out IP 10.0.29.2.40921 > 10.0.29.3.3784: BFDv1, Control, State Up, Flags: [none], length: 24
 00:00:01.916030 eth2  In  IP 10.0.29.3.51220 > 10.0.29.2.3784: BFDv1, Control, State Up, Flags: [none], length: 24
 00:00:01.929361 eth2  Out IP 10.0.29.2.40921 > 10.0.29.3.3784: BFDv1, Control, State Up, Flags: [none], length: 24
 00:00:02.003619 eth2  In  IP 10.0.29.3.51220 > 10.0.29.2.3784: BFDv1, Control, State Up, Flags: [none], length: 24
 00:00:02.006976 eth2  Out IP 10.0.29.2.40921 > 10.0.29.3.3784: BFDv1, Control, State Up, Flags: [none], length: 24
 00:00:02.074659 eth3  Out IP 10.0.12.3.179 > 10.0.12.2.45004: Flags [P.], seq 3222602412:3222602447, ack 3815833218, win 64, options [nop,nop,TS val 4270979988 ecr 2663132782], length 35: BGP
 00:00:02.074720 eth3  In  IP 10.0.12.2.45004 > 10.0.12.3.179: Flags [.], ack 35, win 63, options [nop,nop,TS val 2663147143 ecr 4270979988], length 0
 00:00:02.074754 eth3  Out IP 10.0.12.3.179 > 10.0.12.2.45004: Flags [P.], seq 35:80, ack 1, win 64, options [nop,nop,TS val 4270979988 ecr 2663147143], length 45: BGP
 00:00:02.074767 eth3  In  IP 10.0.12.2.45004 > 10.0.12.3.179: Flags [.], ack 80, win 63, options [nop,nop,TS val 2663147143 ecr 4270979988], length 0
 00:00:02.074847 eth3  In  IP 10.0.12.2.45004 > 10.0.12.3.179: Flags [P.], seq 1:55, ack 80, win 63, options [nop,nop,TS val 2663147143 ecr 4270979988], length 54: BGP
 00:00:02.074870 eth3  Out IP 10.0.12.3.179 > 10.0.12.2.45004: Flags [.], ack 55, win 64, options [nop,nop,TS val 4270979988 ecr 2663147143], length 0
 00:00:10.142871 eth3  Out IP 10.0.12.3.179 > 10.0.12.2.45004: Flags [P.], seq 80:128, ack 55, win 64, options [nop,nop,TS val 4270988056 ecr 2663147143], length 48: BGP
 00:00:10.142971 eth2  Out IP 10.0.29.2.60333 > 10.0.29.3.3784: BFDv1, Control, State Down, Flags: [none], length: 24
 00:00:10.143159 eth3  In  IP 10.0.12.2.45004 > 10.0.12.3.179: Flags [P.], seq 55:82, ack 128, win 63, options [nop,nop,TS val 2663155212 ecr 4270988056], length 27: BGP
 00:00:10.143180 eth3  Out IP 10.0.12.3.179 > 10.0.12.2.45004: Flags [.], ack 82, win 64, options [nop,nop,TS val 4270988057 ecr 2663155212], length 0
 00:00:10.143713 eth3  Out IP 10.0.12.3.179 > 10.0.12.2.45004: Flags [P.], seq 128:173, ack 82, win 64, options [nop,nop,TS val 4270988057 ecr 2663155212], length 45: BGP
 00:00:10.184171 eth3  In  IP 10.0.12.2.45004 > 10.0.12.3.179: Flags [.], ack 173, win 63, options [nop,nop,TS val 2663155253 ecr 4270988057], length 0
 00:00:10.627794 eth2  In  IP 10.0.29.3.56905 > 10.0.29.2.3784: BFDv1, Control, State Init, Flags: [none], length: 24
 00:00:10.627936 eth2  Out IP 10.0.29.2.60333 > 10.0.29.3.3784: BFDv1, Control, State Up, Flags: [Poll], length: 24
 00:00:10.627983 eth2  In  IP 10.0.29.3.56905 > 10.0.29.2.3784: BFDv1, Control, State Up, Flags: [Final], length: 24
 00:00:10.627992 eth2  In  IP 10.0.29.3.56905 > 10.0.29.2.3784: BFDv1, Control, State Up, Flags: [Poll], length: 24
 00:00:10.628023 eth2  Out IP 10.0.29.2.60333 > 10.0.29.3.3784: BFDv1, Control, State Up, Flags: [Final], length: 24
 00:00:10.713255 eth2  In  IP 10.0.29.3.56905 > 10.0.29.2.3784: BFDv1, Control, State Up, Flags: [none], length: 24
 00:00:10.714544 eth2  Out IP 10.0.29.2.60333 > 10.0.29.3.3784: BFDv1, Control, State Up, Flags: [none], length: 24
 00:00:10.789744 eth2  In  IP 10.0.29.3.56905 > 10.0.29.2.3784: BFDv1, Control, State Up, Flags: [none], length: 24
 00:00:10.793989 eth2  Out IP 10.0.29.2.60333 > 10.0.29.3.3784: BFDv1, Control, State Up, Flags: [none], length: 24
 00:00:10.874284 eth2  In  IP 10.0.29.3.56905 > 10.0.29.2.3784: BFDv1, Control, State Up, Flags: [none], length: 24
 00:00:10.880313 eth2  Out IP 10.0.29.2.60333 > 10.0.29.3.3784: BFDv1, Control, State Up, Flags: [none], length: 24
 00:00:10.948816 eth2  In  IP 10.0.29.3.56905 > 10.0.29.2.3784: BFDv1, Control, State Up, Flags: [none], length: 24
 00:00:10.970137 eth2  Out IP 10.0.29.2.60333 > 10.0.29.3.3784: BFDv1, Control, State Up, Flags: [none], length: 24
 00:00:11.026337 eth2  In  IP 10.0.29.3.56905 > 10.0.29.2.3784: BFDv1, Control, State Up, Flags: [none], length: 24
 00:00:11.049645 eth2  Out IP 10.0.29.2.60333 > 10.0.29.3.3784: BFDv1, Control, State Up, Flags: [none], length: 24
 00:00:11.102803 eth2  In  IP 10.0.29.3.56905 > 10.0.29.2.3784: BFDv1, Control, State Up, Flags: [none], length: 24
 00:00:11.137137 eth2  Out IP 10.0.29.2.60333 > 10.0.29.3.3784: BFDv1, Control, State Up, Flags: [none], length: 24
 00:00:11.191425 eth2  In  IP 10.0.29.3.56905 > 10.0.29.2.3784: BFDv1, Control, State Up, Flags: [none], length: 24
 00:00:11.214690 eth2  Out IP 10.0.29.2.60333 > 10.0.29.3.3784: BFDv1, Control, State Up, Flags: [none], length: 24
 00:00:11.272922 eth2  In  IP 10.0.29.3.56905 > 10.0.29.2.3784: BFDv1, Control, State Up, Flags: [none], length: 24
 00:00:11.294185 eth2  Out IP 10.0.29.2.60333 > 10.0.29.3.3784: BFDv1, Control, State Up, Flags: [none], length: 24
 00:00:11.355390 eth2  In  IP 10.0.29.3.56905 > 10.0.29.2.3784: BFDv1, Control, State Up, Flags: [none], length: 24
 00:00:11.380664 eth2  Out IP 10.0.29.2.60333 > 10.0.29.3.3784: BFDv1, Control, State Up, Flags: [none], length: 24
 00:00:11.437208 eth2  In  IP 10.0.29.3.56905 > 10.0.29.2.3784: BFDv1, Control, State Up, Flags: [none], length: 24
 00:00:11.460508 eth2  Out IP 10.0.29.2.60333 > 10.0.29.3.3784: BFDv1, Control, State Up, Flags: [none], length: 24
 00:00:11.518415 eth2  In  IP 10.0.29.3.56905 > 10.0.29.2.3784: BFDv1, Control, State Up, Flags: [none], length: 24
 00:00:11.550702 eth2  Out IP 10.0.29.2.60333 > 10.0.29.3.3784: BFDv1, Control, State Up, Flags: [none], length: 24
 00:00:11.603985 eth2  In  IP 10.0.29.3.56905 > 10.0.29.2.3784: BFDv1, Control, State Up, Flags: [none], length: 24
 00:00:11.629294 eth2  Out IP 10.0.29.2.60333 > 10.0.29.3.3784: BFDv1, Control, State Up, Flags: [none], length: 24
 00:00:11.684491 eth2  In  IP 10.0.29.3.56905 > 10.0.29.2.3784: BFDv1, Control, State Up, Flags: [none], length: 24
 00:00:11.710743 eth2  Out IP 10.0.29.2.60333 > 10.0.29.3.3784: BFDv1, Control, State Up, Flags: [none], length: 24
 00:00:11.769082 eth2  In  IP 10.0.29.3.56905 > 10.0.29.2.3784: BFDv1, Control, State Up, Flags: [none], length: 24
 00:00:11.799399 eth2  Out IP 10.0.29.2.60333 > 10.0.29.3.3784: BFDv1, Control, State Up, Flags: [none], length: 24
 00:00:11.848657 eth2  In  IP 10.0.29.3.56905 > 10.0.29.2.3784: BFDv1, Control, State Up, Flags: [none], length: 24
 00:00:11.881959 eth2  Out IP 10.0.29.2.60333 > 10.0.29.3.3784: BFDv1, Control, State Up, Flags: [none], length: 24
 00:00:11.923118 eth2  In  IP 10.0.29.3.56905 > 10.0.29.2.3784: BFDv1, Control, State Up, Flags: [none], length: 24
 00:00:11.960436 eth2  Out IP 10.0.29.2.60333 > 10.0.29.3.3784: BFDv1, Control, State Up, Flags: [none], length: 24
 00:00:12.001597 eth2  In  IP 10.0.29.3.56905 > 10.0.29.2.3784: BFDv1, Control, State Up, Flags: [none], length: 24
 00:00:12.047887 eth2  Out IP 10.0.29.2.60333 > 10.0.29.3.3784: BFDv1, Control, State Up, Flags: [none], length: 24
 00:00:12.088057 eth2  In  IP 10.0.29.3.56905 > 10.0.29.2.3784: BFDv1, Control, State Up, Flags: [none], length: 24
 00:00:12.127361 eth2  Out IP 10.0.29.2.60333 > 10.0.29.3.3784: BFDv1, Control, State Up, Flags: [none], length: 24
 00:00:12.165613 eth2  In  IP 10.0.29.3.56905 > 10.0.29.2.3784: BFDv1, Control, State Up, Flags: [none], length: 24
 00:00:12.206911 eth2  Out IP 10.0.29.2.60333 > 10.0.29.3.3784: BFDv1, Control, State Up, Flags: [none], length: 24
 00:00:12.247087 eth2  In  IP 10.0.29.3.56905 > 10.0.29.2.3784: BFDv1, Control, State Up, Flags: [none], length: 24
 00:00:12.289448 eth2  Out IP 10.0.29.2.60333 > 10.0.29.3.3784: BFDv1, Control, State Up, Flags: [none], length: 24
 00:00:12.335553 eth2  In  IP 10.0.29.3.56905 > 10.0.29.2.3784: BFDv1, Control, State Up, Flags: [none], length: 24
 00:00:12.371856 eth2  Out IP 10.0.29.2.60333 > 10.0.29.3.3784: BFDv1, Control, State Up, Flags: [none], length: 24
 00:00:12.421009 eth2  In  IP 10.0.29.3.56905 > 10.0.29.2.3784: BFDv1, Control, State Up, Flags: [none], length: 24
 00:00:12.456361 eth2  Out IP 10.0.29.2.60333 > 10.0.29.3.3784: BFDv1, Control, State Up, Flags: [none], length: 24
 00:00:12.496211 eth2  In  IP 10.0.29.3.56905 > 10.0.29.2.3784: BFDv1, Control, State Up, Flags: [none], length: 24
 00:00:12.536425 eth2  Out IP 10.0.29.2.60333 > 10.0.29.3.3784: BFDv1, Control, State Up, Flags: [none], length: 24
 00:00:12.574120 eth2  In  IP 10.0.29.3.56905 > 10.0.29.2.3784: BFDv1, Control, State Up, Flags: [none], length: 24
 00:00:12.620402 eth2  Out IP 10.0.29.2.60333 > 10.0.29.3.3784: BFDv1, Control, State Up, Flags: [none], length: 24
 00:00:12.663953 eth2  In  IP 10.0.29.3.56905 > 10.0.29.2.3784: BFDv1, Control, State Up, Flags: [none], length: 24
 00:00:12.697316 eth2  Out IP 10.0.29.2.60333 > 10.0.29.3.3784: BFDv1, Control, State Up, Flags: [none], length: 24
 00:00:12.743467 eth2  In  IP 10.0.29.3.56905 > 10.0.29.2.3784: BFDv1, Control, State Up, Flags: [none], length: 24
 00:00:12.783751 eth2  Out IP 10.0.29.2.60333 > 10.0.29.3.3784: BFDv1, Control, State Up, Flags: [none], length: 24
 00:00:12.819637 eth2  In  IP 10.0.29.3.56905 > 10.0.29.2.3784: BFDv1, Control, State Up, Flags: [none], length: 24
 00:00:12.870905 eth2  Out IP 10.0.29.2.60333 > 10.0.29.3.3784: BFDv1, Control, State Up, Flags: [none], length: 24
 00:00:12.894989 eth2  In  IP 10.0.29.3.56905 > 10.0.29.2.3784: BFDv1, Control, State Up, Flags: [none], length: 24
 00:00:12.959360 eth2  Out IP 10.0.29.2.60333 > 10.0.29.3.3784: BFDv1, Control, State Up, Flags: [none], length: 24
 00:00:12.976724 eth2  In  IP 10.0.29.3.56905 > 10.0.29.2.3784: BFDv1, Control, State Up, Flags: [none], length: 24
 00:00:13.038166 eth2  Out IP 10.0.29.2.60333 > 10.0.29.3.3784: BFDv1, Control, State Up, Flags: [none], length: 24
 00:00:13.061360 eth2  In  IP 10.0.29.3.56905 > 10.0.29.2.3784: BFDv1, Control, State Up, Flags: [none], length: 24
 00:00:13.116616 eth2  Out IP 10.0.29.2.60333 > 10.0.29.3.3784: BFDv1, Control, State Up, Flags: [none], length: 24
 00:00:13.144878 eth2  In  IP 10.0.29.3.56905 > 10.0.29.2.3784: BFDv1, Control, State Up, Flags: [none], length: 24
 00:00:13.192199 eth2  Out IP 10.0.29.2.60333 > 10.0.29.3.3784: BFDv1, Control, State Up, Flags: [none], length: 24
 00:00:13.232725 eth2  In  IP 10.0.29.3.56905 > 10.0.29.2.3784: BFDv1, Control, State Up, Flags: [none], length: 24
 00:00:13.281993 eth2  Out IP 10.0.29.2.60333 > 10.0.29.3.3784: BFDv1, Control, State Up, Flags: [none], length: 24
 00:00:13.307975 eth2  In  IP 10.0.29.3.56905 > 10.0.29.2.3784: BFDv1, Control, State Up, Flags: [none], length: 24
 00:00:13.365233 eth2  Out IP 10.0.29.2.60333 > 10.0.29.3.3784: BFDv1, Control, State Up, Flags: [none], length: 24
 00:00:13.386479 eth2  In  IP 10.0.29.3.56905 > 10.0.29.2.3784: BFDv1, Control, State Up, Flags: [none], length: 24
 00:00:13.451750 eth2  Out IP 10.0.29.2.60333 > 10.0.29.3.3784: BFDv1, Control, State Up, Flags: [none], length: 24
 00:00:13.465041 eth2  In  IP 10.0.29.3.56905 > 10.0.29.2.3784: BFDv1, Control, State Up, Flags: [none], length: 24
 00:00:13.540362 eth2  Out IP 10.0.29.2.60333 > 10.0.29.3.3784: BFDv1, Control, State Up, Flags: [none], length: 24
 00:00:13.547613 eth2  In  IP 10.0.29.3.56905 > 10.0.29.2.3784: BFDv1, Control, State Up, Flags: [none], length: 24
 00:00:13.627890 eth2  Out IP 10.0.29.2.60333 > 10.0.29.3.3784: BFDv1, Control, State Up, Flags: [none], length: 24
 00:00:13.635161 eth2  In  IP 10.0.29.3.56905 > 10.0.29.2.3784: BFDv1, Control, State Up, Flags: [none], length: 24
 00:00:13.712471 eth2  Out IP 10.0.29.2.60333 > 10.0.29.3.3784: BFDv1, Control, State Up, Flags: [none], length: 24
 00:00:13.712610 eth2  In  IP 10.0.29.3.56905 > 10.0.29.2.3784: BFDv1, Control, State Up, Flags: [none], length: 24
 00:00:13.787988 eth2  Out IP 10.0.29.2.60333 > 10.0.29.3.3784: BFDv1, Control, State Up, Flags: [none], length: 24
 00:00:13.788103 eth2  In  IP 10.0.29.3.56905 > 10.0.29.2.3784: BFDv1, Control, State Up, Flags: [none], length: 24
 00:00:13.863323 eth2  Out IP 10.0.29.2.60333 > 10.0.29.3.3784: BFDv1, Control, State Up, Flags: [none], length: 24
 00:00:13.874565 eth2  In  IP 10.0.29.3.56905 > 10.0.29.2.3784: BFDv1, Control, State Up, Flags: [none], length: 24
 00:00:13.944877 eth2  Out IP 10.0.29.2.60333 > 10.0.29.3.3784: BFDv1, Control, State Up, Flags: [none], length: 24
 00:00:13.954208 eth2  In  IP 10.0.29.3.56905 > 10.0.29.2.3784: BFDv1, Control, State Up, Flags: [none], length: 24
 00:00:14.025475 eth2  Out IP 10.0.29.2.60333 > 10.0.29.3.3784: BFDv1, Control, State Up, Flags: [none], length: 24
 00:00:14.041802 eth2  In  IP 10.0.29.3.56905 > 10.0.29.2.3784: BFDv1, Control, State Up, Flags: [none], length: 24
 00:00:14.101081 eth2  Out IP 10.0.29.2.60333 > 10.0.29.3.3784: BFDv1, Control, State Up, Flags: [none], length: 24
 00:00:14.122412 eth2  In  IP 10.0.29.3.56905 > 10.0.29.2.3784: BFDv1, Control, State Up, Flags: [none], length: 24
 00:00:14.185696 eth2  Out IP 10.0.29.2.60333 > 10.0.29.3.3784: BFDv1, Control, State Up, Flags: [none], length: 24
 00:00:14.208353 eth2  In  IP 10.0.29.3.56905 > 10.0.29.2.3784: BFDv1, Control, State Up, Flags: [none], length: 24
 00:00:14.272642 eth2  Out IP 10.0.29.2.60333 > 10.0.29.3.3784: BFDv1, Control, State Up, Flags: [none], length: 24
 00:00:14.297987 eth2  In  IP 10.0.29.3.56905 > 10.0.29.2.3784: BFDv1, Control, State Up, Flags: [none], length: 24
 00:00:14.362293 eth2  Out IP 10.0.29.2.60333 > 10.0.29.3.3784: BFDv1, Control, State Up, Flags: [none], length: 24
 00:00:14.382538 eth2  In  IP 10.0.29.3.56905 > 10.0.29.2.3784: BFDv1, Control, State Up, Flags: [none], length: 24
 00:00:14.440791 eth2  Out IP 10.0.29.2.60333 > 10.0.29.3.3784: BFDv1, Control, State Up, Flags: [none], length: 24
 00:00:14.465084 eth2  In  IP 10.0.29.3.56905 > 10.0.29.2.3784: BFDv1, Control, State Up, Flags: [none], length: 24
 00:00:14.529374 eth2  Out IP 10.0.29.2.60333 > 10.0.29.3.3784: BFDv1, Control, State Up, Flags: [none], length: 24
 00:00:14.540601 eth2  In  IP 10.0.29.3.56905 > 10.0.29.2.3784: BFDv1, Control, State Up, Flags: [none], length: 24
 00:00:14.615908 eth2  Out IP 10.0.29.2.60333 > 10.0.29.3.3784: BFDv1, Control, State Up, Flags: [none], length: 24
 00:00:14.623164 eth2  In  IP 10.0.29.3.56905 > 10.0.29.2.3784: BFDv1, Control, State Up, Flags: [none], length: 24
 00:00:14.660175 eth2  Out IP 10.0.29.2.59921 > 10.0.29.3.179: Flags [S], seq 3553928948, win 64240, options [mss 1460,sackOK,TS val 2352336356 ecr 0,nop,wscale 10], length 0
 00:00:14.660232 eth2  In  IP 10.0.29.3.179 > 10.0.29.2.59921: Flags [S.], seq 1184619243, ack 3553928949, win 65160, options [mss 1460,sackOK,TS val 562636092 ecr 2352336356,nop,wscale 10], length 0
 00:00:14.660255 eth2  Out IP 10.0.29.2.59921 > 10.0.29.3.179: Flags [.], ack 1, win 63, options [nop,nop,TS val 2352336356 ecr 562636092], length 0
 00:00:14.660321 eth2  Out IP 10.0.29.2.59921 > 10.0.29.3.179: Flags [P.], seq 1:65, ack 1, win 63, options [nop,nop,TS val 2352336356 ecr 562636092], length 64: BGP
 00:00:14.660339 eth2  In  IP 10.0.29.3.179 > 10.0.29.2.59921: Flags [.], ack 65, win 64, options [nop,nop,TS val 562636092 ecr 2352336356], length 0
 00:00:14.660390 eth2  In  IP 10.0.29.3.179 > 10.0.29.2.59921: Flags [R.], seq 1, ack 65, win 64, options [nop,nop,TS val 562636092 ecr 2352336356], length 0
 00:00:14.698433 eth2  Out IP 10.0.29.2.60333 > 10.0.29.3.3784: BFDv1, Control, State Up, Flags: [none], length: 24
 00:00:14.712639 eth2  In  IP 10.0.29.3.56905 > 10.0.29.2.3784: BFDv1, Control, State Up, Flags: [none], length: 24
 00:00:14.784948 eth2  Out IP 10.0.29.2.60333 > 10.0.29.3.3784: BFDv1, Control, State Up, Flags: [none], length: 24
 00:00:14.791148 eth2  In  IP 10.0.29.3.56905 > 10.0.29.2.3784: BFDv1, Control, State Up, Flags: [none], length: 24
 00:00:14.867807 eth2  In  IP 10.0.29.3.56905 > 10.0.29.2.3784: BFDv1, Control, State Up, Flags: [none], length: 24
 00:00:14.869066 eth2  Out IP 10.0.29.2.60333 > 10.0.29.3.3784: BFDv1, Control, State Up, Flags: [none], length: 24
 00:00:14.949701 eth2  In  IP 10.0.29.3.56905 > 10.0.29.2.3784: BFDv1, Control, State Up, Flags: [none], length: 24
 00:00:14.952936 eth2  Out IP 10.0.29.2.60333 > 10.0.29.3.3784: BFDv1, Control, State Up, Flags: [none], length: 24
 00:00:15.035489 eth2  In  IP 10.0.29.3.56905 > 10.0.29.2.3784: BFDv1, Control, State Up, Flags: [none], length: 24
 00:00:15.040713 eth2  Out IP 10.0.29.2.60333 > 10.0.29.3.3784: BFDv1, Control, State Up, Flags: [none], length: 24
 00:00:15.117961 eth2  In  IP 10.0.29.3.56905 > 10.0.29.2.3784: BFDv1, Control, State Up, Flags: [none], length: 24
 00:00:15.120287 eth2  Out IP 10.0.29.2.60333 > 10.0.29.3.3784: BFDv1, Control, State Up, Flags: [none], length: 24
 00:00:15.193518 eth2  In  IP 10.0.29.3.56905 > 10.0.29.2.3784: BFDv1, Control, State Up, Flags: [none], length: 24
 00:00:15.202716 eth2  Out IP 10.0.29.2.60333 > 10.0.29.3.3784: BFDv1, Control, State Up, Flags: [none], length: 24
 00:00:15.279256 eth2  In  IP 10.0.29.3.56905 > 10.0.29.2.3784: BFDv1, Control, State Up, Flags: [none], length: 24
 00:00:15.287451 eth2  Out IP 10.0.29.2.60333 > 10.0.29.3.3784: BFDv1, Control, State Up, Flags: [none], length: 24
 00:00:15.361799 eth2  In  IP 10.0.29.3.56905 > 10.0.29.2.3784: BFDv1, Control, State Up, Flags: [none], length: 24
 00:00:15.371094 eth2  Out IP 10.0.29.2.60333 > 10.0.29.3.3784: BFDv1, Control, State Up, Flags: [none], length: 24
 00:00:15.410066 eth2  Out IP 10.0.29.2.48367 > 10.0.29.3.179: Flags [FP.], seq 4104255183:4104255204, ack 3976604320, win 63, options [nop,nop,TS val 2352337106 ecr 562607516], length 21: BGP
 00:00:15.410137 eth2  In  IP 10.0.29.3.179 > 10.0.29.2.48367: Flags [R], seq 3976604320, win 0, length 0
 00:00:15.444307 eth2  In  IP 10.0.29.3.56905 > 10.0.29.2.3784: BFDv1, Control, State Up, Flags: [none], length: 24
 00:00:15.457163 eth2  Out IP 10.0.29.2.60333 > 10.0.29.3.3784: BFDv1, Control, State Up, Flags: [none], length: 24
 00:00:15.532605 eth2  In  IP 10.0.29.3.56905 > 10.0.29.2.3784: BFDv1, Control, State Up, Flags: [none], length: 24
 00:00:15.542043 eth2  Out IP 10.0.29.2.60333 > 10.0.29.3.3784: BFDv1, Control, State Up, Flags: [none], length: 24
 00:00:15.614462 eth2  In  IP 10.0.29.3.56905 > 10.0.29.2.3784: BFDv1, Control, State Up, Flags: [none], length: 24
 00:00:15.624815 eth2  Out IP 10.0.29.2.60333 > 10.0.29.3.3784: BFDv1, Control, State Up, Flags: [none], length: 24
 00:00:15.690233 eth2  In  IP 10.0.29.3.56905 > 10.0.29.2.3784: BFDv1, Control, State Up, Flags: [none], length: 24
 00:00:15.703576 eth2  Out IP 10.0.29.2.60333 > 10.0.29.3.3784: BFDv1, Control, State Up, Flags: [none], length: 24
 00:00:15.765949 eth2  In  IP 10.0.29.3.56905 > 10.0.29.2.3784: BFDv1, Control, State Up, Flags: [none], length: 24
 00:00:15.785279 eth2  Out IP 10.0.29.2.60333 > 10.0.29.3.3784: BFDv1, Control, State Up, Flags: [none], length: 24
 00:00:15.848552 eth2  In  IP 10.0.29.3.56905 > 10.0.29.2.3784: BFDv1, Control, State Up, Flags: [none], length: 24
 00:00:15.866858 eth2  Out IP 10.0.29.2.60333 > 10.0.29.3.3784: BFDv1, Control, State Up, Flags: [none], length: 24
 00:00:15.928153 eth2  In  IP 10.0.29.3.56905 > 10.0.29.2.3784: BFDv1, Control, State Up, Flags: [none], length: 24
 00:00:15.942550 eth2  Out IP 10.0.29.2.60333 > 10.0.29.3.3784: BFDv1, Control, State Up, Flags: [none], length: 24
 00:00:16.004907 eth2  In  IP 10.0.29.3.56905 > 10.0.29.2.3784: BFDv1, Control, State Up, Flags: [none], length: 24
 00:00:16.018268 eth2  Out IP 10.0.29.2.60333 > 10.0.29.3.3784: BFDv1, Control, State Up, Flags: [none], length: 24
 00:00:16.084115 eth2  In  IP 10.0.29.3.56905 > 10.0.29.2.3784: BFDv1, Control, State Up, Flags: [none], length: 24
 00:00:16.100451 eth2  Out IP 10.0.29.2.60333 > 10.0.29.3.3784: BFDv1, Control, State Up, Flags: [none], length: 24
 00:00:16.167068 eth2  In  IP 10.0.29.3.56905 > 10.0.29.2.3784: BFDv1, Control, State Up, Flags: [none], length: 24
 00:00:16.176327 eth2  Out IP 10.0.29.2.60333 > 10.0.29.3.3784: BFDv1, Control, State Up, Flags: [none], length: 24
 00:00:16.250162 eth2  In  IP 10.0.29.3.56905 > 10.0.29.2.3784: BFDv1, Control, State Up, Flags: [none], length: 24
 00:00:16.258463 eth2  Out IP 10.0.29.2.60333 > 10.0.29.3.3784: BFDv1, Control, State Up, Flags: [none], length: 24
 00:00:16.327224 eth2  In  IP 10.0.29.3.56905 > 10.0.29.2.3784: BFDv1, Control, State Up, Flags: [none], length: 24
 00:00:16.345491 eth2  Out IP 10.0.29.2.60333 > 10.0.29.3.3784: BFDv1, Control, State Up, Flags: [none], length: 24
 00:00:16.410870 eth2  In  IP 10.0.29.3.56905 > 10.0.29.2.3784: BFDv1, Control, State Up, Flags: [none], length: 24
 00:00:16.423134 eth2  Out IP 10.0.29.2.60333 > 10.0.29.3.3784: BFDv1, Control, State Up, Flags: [none], length: 24
 00:00:16.498736 eth2  In  IP 10.0.29.3.56905 > 10.0.29.2.3784: BFDv1, Control, State Up, Flags: [none], length: 24
 00:00:16.500061 eth2  Out IP 10.0.29.2.60333 > 10.0.29.3.3784: BFDv1, Control, State Up, Flags: [none], length: 24
 00:00:16.579213 eth2  In  IP 10.0.29.3.56905 > 10.0.29.2.3784: BFDv1, Control, State Up, Flags: [none], length: 24
 00:00:16.582526 eth2  Out IP 10.0.29.2.60333 > 10.0.29.3.3784: BFDv1, Control, State Up, Flags: [none], length: 24
 00:00:16.658803 eth2  Out IP 10.0.29.2.60333 > 10.0.29.3.3784: BFDv1, Control, State Up, Flags: [none], length: 24
 00:00:16.658978 eth2  In  IP 10.0.29.3.56905 > 10.0.29.2.3784: BFDv1, Control, State Up, Flags: [none], length: 24
 00:00:16.738262 eth2  Out IP 10.0.29.2.60333 > 10.0.29.3.3784: BFDv1, Control, State Up, Flags: [none], length: 24
 00:00:16.741518 eth2  In  IP 10.0.29.3.56905 > 10.0.29.2.3784: BFDv1, Control, State Up, Flags: [none], length: 24
 00:00:16.819887 eth2  Out IP 10.0.29.2.60333 > 10.0.29.3.3784: BFDv1, Control, State Up, Flags: [none], length: 24
 00:00:16.831466 eth2  In  IP 10.0.29.3.56905 > 10.0.29.2.3784: BFDv1, Control, State Up, Flags: [none], length: 24
 00:00:16.906751 eth2  Out IP 10.0.29.2.60333 > 10.0.29.3.3784: BFDv1, Control, State Up, Flags: [none], length: 24
 00:00:16.921119 eth2  In  IP 10.0.29.3.56905 > 10.0.29.2.3784: BFDv1, Control, State Up, Flags: [none], length: 24
 00:00:16.995415 eth2  Out IP 10.0.29.2.60333 > 10.0.29.3.3784: BFDv1, Control, State Up, Flags: [none], length: 24
 00:00:17.005621 eth2  In  IP 10.0.29.3.56905 > 10.0.29.2.3784: BFDv1, Control, State Up, Flags: [none], length: 24
 00:00:17.077938 eth2  Out IP 10.0.29.2.60333 > 10.0.29.3.3784: BFDv1, Control, State Up, Flags: [none], length: 24
 00:00:17.093310 eth2  In  IP 10.0.29.3.56905 > 10.0.29.2.3784: BFDv1, Control, State Up, Flags: [none], length: 24
 00:00:17.153602 eth2  Out IP 10.0.29.2.60333 > 10.0.29.3.3784: BFDv1, Control, State Up, Flags: [none], length: 24
 00:00:17.172962 eth2  In  IP 10.0.29.3.56905 > 10.0.29.2.3784: BFDv1, Control, State Up, Flags: [none], length: 24
 00:00:17.241263 eth2  Out IP 10.0.29.2.60333 > 10.0.29.3.3784: BFDv1, Control, State Up, Flags: [none], length: 24
 00:00:17.252718 eth2  In  IP 10.0.29.3.56905 > 10.0.29.2.3784: BFDv1, Control, State Up, Flags: [none], length: 24
 00:00:17.320003 eth2  Out IP 10.0.29.2.60333 > 10.0.29.3.3784: BFDv1, Control, State Up, Flags: [none], length: 24
 00:00:17.339442 eth2  In  IP 10.0.29.3.56905 > 10.0.29.2.3784: BFDv1, Control, State Up, Flags: [none], length: 24
 00:00:17.404748 eth2  Out IP 10.0.29.2.60333 > 10.0.29.3.3784: BFDv1, Control, State Up, Flags: [none], length: 24
 00:00:17.419008 eth2  In  IP 10.0.29.3.56905 > 10.0.29.2.3784: BFDv1, Control, State Up, Flags: [none], length: 24
 00:00:17.486278 eth2  Out IP 10.0.29.2.60333 > 10.0.29.3.3784: BFDv1, Control, State Up, Flags: [none], length: 24
 00:00:17.494512 eth2  In  IP 10.0.29.3.56905 > 10.0.29.2.3784: BFDv1, Control, State Up, Flags: [none], length: 24
 00:00:17.561790 eth2  Out IP 10.0.29.2.60333 > 10.0.29.3.3784: BFDv1, Control, State Up, Flags: [none], length: 24
 00:00:17.579078 eth2  In  IP 10.0.29.3.56905 > 10.0.29.2.3784: BFDv1, Control, State Up, Flags: [none], length: 24
 00:00:17.651462 eth2  Out IP 10.0.29.2.60333 > 10.0.29.3.3784: BFDv1, Control, State Up, Flags: [none], length: 24
 00:00:17.654741 eth2  In  IP 10.0.29.3.56905 > 10.0.29.2.3784: BFDv1, Control, State Up, Flags: [none], length: 24
 00:00:17.739097 eth2  Out IP 10.0.29.2.60333 > 10.0.29.3.3784: BFDv1, Control, State Up, Flags: [none], length: 24
 00:00:17.744426 eth2  In  IP 10.0.29.3.56905 > 10.0.29.2.3784: BFDv1, Control, State Up, Flags: [none], length: 24
 00:00:17.824785 eth2  Out IP 10.0.29.2.60333 > 10.0.29.3.3784: BFDv1, Control, State Up, Flags: [none], length: 24
 00:00:17.829066 eth2  In  IP 10.0.29.3.56905 > 10.0.29.2.3784: BFDv1, Control, State Up, Flags: [none], length: 24
 00:00:17.907361 eth2  Out IP 10.0.29.2.60333 > 10.0.29.3.3784: BFDv1, Control, State Up, Flags: [none], length: 24
 00:00:17.914724 eth2  In  IP 10.0.29.3.56905 > 10.0.29.2.3784: BFDv1, Control, State Up, Flags: [none], length: 24
 00:00:17.991063 eth2  Out IP 10.0.29.2.60333 > 10.0.29.3.3784: BFDv1, Control, State Up, Flags: [none], length: 24
 00:00:18.001309 eth2  In  IP 10.0.29.3.56905 > 10.0.29.2.3784: BFDv1, Control, State Up, Flags: [none], length: 24
 00:00:18.071590 eth2  Out IP 10.0.29.2.60333 > 10.0.29.3.3784: BFDv1, Control, State Up, Flags: [none], length: 24
 00:00:18.077839 eth2  In  IP 10.0.29.3.56905 > 10.0.29.2.3784: BFDv1, Control, State Up, Flags: [none], length: 24
 00:00:18.147208 eth2  Out IP 10.0.29.2.60333 > 10.0.29.3.3784: BFDv1, Control, State Up, Flags: [none], length: 24
 00:00:18.161426 eth2  In  IP 10.0.29.3.56905 > 10.0.29.2.3784: BFDv1, Control, State Up, Flags: [none], length: 24
 00:00:18.233726 eth2  Out IP 10.0.29.2.60333 > 10.0.29.3.3784: BFDv1, Control, State Up, Flags: [none], length: 24
 00:00:18.248920 eth2  In  IP 10.0.29.3.56905 > 10.0.29.2.3784: BFDv1, Control, State Up, Flags: [none], length: 24
 00:00:18.320181 eth2  Out IP 10.0.29.2.60333 > 10.0.29.3.3784: BFDv1, Control, State Up, Flags: [none], length: 24
 00:00:18.338348 eth2  In  IP 10.0.29.3.56905 > 10.0.29.2.3784: BFDv1, Control, State Up, Flags: [none], length: 24
 00:00:18.402657 eth2  Out IP 10.0.29.2.60333 > 10.0.29.3.3784: BFDv1, Control, State Up, Flags: [none], length: 24
 00:00:18.419944 eth2  In  IP 10.0.29.3.56905 > 10.0.29.2.3784: BFDv1, Control, State Up, Flags: [none], length: 24
 00:00:18.490224 eth2  Out IP 10.0.29.2.60333 > 10.0.29.3.3784: BFDv1, Control, State Up, Flags: [none], length: 24
 00:00:18.497403 eth2  In  IP 10.0.29.3.56905 > 10.0.29.2.3784: BFDv1, Control, State Up, Flags: [none], length: 24
 00:00:18.573635 eth2  In  IP 10.0.29.3.56905 > 10.0.29.2.3784: BFDv1, Control, State Up, Flags: [none], length: 24
 00:00:18.576941 eth2  Out IP 10.0.29.2.60333 > 10.0.29.3.3784: BFDv1, Control, State Up, Flags: [none], length: 24
 00:00:18.652061 eth2  In  IP 10.0.29.3.56905 > 10.0.29.2.3784: BFDv1, Control, State Up, Flags: [none], length: 24
 00:00:18.666325 eth2  Out IP 10.0.29.2.60333 > 10.0.29.3.3784: BFDv1, Control, State Up, Flags: [none], length: 24
 00:00:18.732713 eth2  In  IP 10.0.29.3.56905 > 10.0.29.2.3784: BFDv1, Control, State Up, Flags: [none], length: 24
 00:00:18.755132 eth2  Out IP 10.0.29.2.60333 > 10.0.29.3.3784: BFDv1, Control, State Up, Flags: [none], length: 24
 00:00:18.818807 eth2  In  IP 10.0.29.3.56905 > 10.0.29.2.3784: BFDv1, Control, State Up, Flags: [none], length: 24
 00:00:18.834165 eth2  Out IP 10.0.29.2.60333 > 10.0.29.3.3784: BFDv1, Control, State Up, Flags: [none], length: 24
 00:00:18.899636 eth2  In  IP 10.0.29.3.56905 > 10.0.29.2.3784: BFDv1, Control, State Up, Flags: [none], length: 24
 00:00:18.920977 eth2  Out IP 10.0.29.2.60333 > 10.0.29.3.3784: BFDv1, Control, State Up, Flags: [none], length: 24
 00:00:18.985876 eth2  In  IP 10.0.29.3.56905 > 10.0.29.2.3784: BFDv1, Control, State Up, Flags: [none], length: 24
 00:00:19.010253 eth2  Out IP 10.0.29.2.60333 > 10.0.29.3.3784: BFDv1, Control, State Up, Flags: [none], length: 24
 00:00:19.062008 eth2  In  IP 10.0.29.3.56905 > 10.0.29.2.3784: BFDv1, Control, State Up, Flags: [none], length: 24
 00:00:19.090322 eth2  Out IP 10.0.29.2.60333 > 10.0.29.3.3784: BFDv1, Control, State Up, Flags: [none], length: 24
 00:00:19.145833 eth2  In  IP 10.0.29.3.56905 > 10.0.29.2.3784: BFDv1, Control, State Up, Flags: [none], length: 24
 00:00:19.170296 eth2  Out IP 10.0.29.2.60333 > 10.0.29.3.3784: BFDv1, Control, State Up, Flags: [none], length: 24
 00:00:19.228895 eth2  In  IP 10.0.29.3.56905 > 10.0.29.2.3784: BFDv1, Control, State Up, Flags: [none], length: 24
 00:00:19.245203 eth2  Out IP 10.0.29.2.60333 > 10.0.29.3.3784: BFDv1, Control, State Up, Flags: [none], length: 24
 00:00:19.313340 eth2  In  IP 10.0.29.3.56905 > 10.0.29.2.3784: BFDv1, Control, State Up, Flags: [none], length: 24
 00:00:19.330709 eth2  Out IP 10.0.29.2.60333 > 10.0.29.3.3784: BFDv1, Control, State Up, Flags: [none], length: 24
 00:00:19.391470 eth2  In  IP 10.0.29.3.56905 > 10.0.29.2.3784: BFDv1, Control, State Up, Flags: [none], length: 24
 00:00:19.415793 eth2  Out IP 10.0.29.2.60333 > 10.0.29.3.3784: BFDv1, Control, State Up, Flags: [none], length: 24
 00:00:19.431399 eth2  Out IP 10.0.29.2.33827 > 10.0.29.3.179: Flags [S], seq 1428766849, win 64240, options [mss 1460,sackOK,TS val 2352341127 ecr 0,nop,wscale 10], length 0
 00:00:19.431478 eth2  In  IP 10.0.29.3.179 > 10.0.29.2.33827: Flags [S.], seq 3454512604, ack 1428766850, win 65160, options [mss 1460,sackOK,TS val 562640863 ecr 2352341127,nop,wscale 10], length 0
 00:00:19.431508 eth2  Out IP 10.0.29.2.33827 > 10.0.29.3.179: Flags [.], ack 1, win 63, options [nop,nop,TS val 2352341127 ecr 562640863], length 0
 00:00:19.431599 eth2  Out IP 10.0.29.2.33827 > 10.0.29.3.179: Flags [P.], seq 1:65, ack 1, win 63, options [nop,nop,TS val 2352341127 ecr 562640863], length 64: BGP
 00:00:19.431615 eth2  In  IP 10.0.29.3.179 > 10.0.29.2.33827: Flags [.], ack 65, win 64, options [nop,nop,TS val 562640863 ecr 2352341127], length 0
 00:00:19.431775 eth2  In  IP 10.0.29.3.179 > 10.0.29.2.33827: Flags [R.], seq 1, ack 65, win 64, options [nop,nop,TS val 562640863 ecr 2352341127], length 0
 00:00:19.474356 eth2  In  IP 10.0.29.3.56905 > 10.0.29.2.3784: BFDv1, Control, State Up, Flags: [none], length: 24
 00:00:19.502772 eth2  Out IP 10.0.29.2.60333 > 10.0.29.3.3784: BFDv1, Control, State Up, Flags: [none], length: 24
 00:00:19.556300 eth2  In  IP 10.0.29.3.56905 > 10.0.29.2.3784: BFDv1, Control, State Up, Flags: [none], length: 24
 00:00:19.583628 eth2  Out IP 10.0.29.2.60333 > 10.0.29.3.3784: BFDv1, Control, State Up, Flags: [none], length: 24
 00:00:19.640129 eth2  In  IP 10.0.29.3.56905 > 10.0.29.2.3784: BFDv1, Control, State Up, Flags: [none], length: 24
 00:00:19.665445 eth2  Out IP 10.0.29.2.60333 > 10.0.29.3.3784: BFDv1, Control, State Up, Flags: [none], length: 24
 00:00:19.728147 eth2  In  IP 10.0.29.3.56905 > 10.0.29.2.3784: BFDv1, Control, State Up, Flags: [none], length: 24
 00:00:19.746501 eth2  Out IP 10.0.29.2.60333 > 10.0.29.3.3784: BFDv1, Control, State Up, Flags: [none], length: 24
 00:00:19.810081 eth2  In  IP 10.0.29.3.56905 > 10.0.29.2.3784: BFDv1, Control, State Up, Flags: [none], length: 24
 00:00:19.833412 eth2  Out IP 10.0.29.2.60333 > 10.0.29.3.3784: BFDv1, Control, State Up, Flags: [none], length: 24
 00:00:19.895400 eth2  In  IP 10.0.29.3.56905 > 10.0.29.2.3784: BFDv1, Control, State Up, Flags: [none], length: 24
 00:00:19.915673 eth2  Out IP 10.0.29.2.60333 > 10.0.29.3.3784: BFDv1, Control, State Up, Flags: [none], length: 24
 00:00:19.973195 eth2  In  IP 10.0.29.3.56905 > 10.0.29.2.3784: BFDv1, Control, State Up, Flags: [none], length: 24
 00:00:19.996512 eth2  Out IP 10.0.29.2.60333 > 10.0.29.3.3784: BFDv1, Control, State Up, Flags: [none], length: 24
 00:00:20.062325 eth2  In  IP 10.0.29.3.56905 > 10.0.29.2.3784: BFDv1, Control, State Up, Flags: [none], length: 24
 00:00:20.081648 eth2  Out IP 10.0.29.2.60333 > 10.0.29.3.3784: BFDv1, Control, State Up, Flags: [none], length: 24
 00:00:20.138174 eth2  In  IP 10.0.29.3.56905 > 10.0.29.2.3784: BFDv1, Control, State Up, Flags: [none], length: 24
 00:00:20.158509 eth2  Out IP 10.0.29.2.60333 > 10.0.29.3.3784: BFDv1, Control, State Up, Flags: [none], length: 24
 00:00:20.223228 eth2  In  IP 10.0.29.3.56905 > 10.0.29.2.3784: BFDv1, Control, State Up, Flags: [none], length: 24
 00:00:20.247510 eth2  Out IP 10.0.29.2.60333 > 10.0.29.3.3784: BFDv1, Control, State Up, Flags: [none], length: 24
 00:00:20.308105 eth2  In  IP 10.0.29.3.56905 > 10.0.29.2.3784: BFDv1, Control, State Up, Flags: [none], length: 24
 00:00:20.326382 eth2  Out IP 10.0.29.2.60333 > 10.0.29.3.3784: BFDv1, Control, State Up, Flags: [none], length: 24
 00:00:20.384508 eth2  In  IP 10.0.29.3.56905 > 10.0.29.2.3784: BFDv1, Control, State Up, Flags: [none], length: 24
 00:00:20.407811 eth2  Out IP 10.0.29.2.60333 > 10.0.29.3.3784: BFDv1, Control, State Up, Flags: [none], length: 24
 00:00:20.468025 eth2  In  IP 10.0.29.3.56905 > 10.0.29.2.3784: BFDv1, Control, State Up, Flags: [none], length: 24
 00:00:20.496232 eth2  Out IP 10.0.29.2.60333 > 10.0.29.3.3784: BFDv1, Control, State Up, Flags: [none], length: 24
 00:00:20.551779 eth2  In  IP 10.0.29.3.56905 > 10.0.29.2.3784: BFDv1, Control, State Up, Flags: [none], length: 24
 00:00:20.572078 eth2  Out IP 10.0.29.2.60333 > 10.0.29.3.3784: BFDv1, Control, State Up, Flags: [none], length: 24
 00:00:20.629227 eth2  In  IP 10.0.29.3.56905 > 10.0.29.2.3784: BFDv1, Control, State Up, Flags: [none], length: 24
 00:00:20.650583 eth2  Out IP 10.0.29.2.60333 > 10.0.29.3.3784: BFDv1, Control, State Up, Flags: [none], length: 24
 00:00:20.709686 eth2  In  IP 10.0.29.3.56905 > 10.0.29.2.3784: BFDv1, Control, State Up, Flags: [none], length: 24
 00:00:20.731689 eth2  Out IP 10.0.29.2.60333 > 10.0.29.3.3784: BFDv1, Control, State Up, Flags: [none], length: 24
 00:00:20.796146 eth2  In  IP 10.0.29.3.56905 > 10.0.29.2.3784: BFDv1, Control, State Up, Flags: [none], length: 24
 00:00:20.818458 eth2  Out IP 10.0.29.2.60333 > 10.0.29.3.3784: BFDv1, Control, State Up, Flags: [none], length: 24
 00:00:20.875508 eth2  In  IP 10.0.29.3.56905 > 10.0.29.2.3784: BFDv1, Control, State Up, Flags: [none], length: 24
 00:00:20.893805 eth2  Out IP 10.0.29.2.60333 > 10.0.29.3.3784: BFDv1, Control, State Up, Flags: [none], length: 24
 00:00:20.954346 eth2  In  IP 10.0.29.3.56905 > 10.0.29.2.3784: BFDv1, Control, State Up, Flags: [none], length: 24
 00:00:20.973638 eth2  Out IP 10.0.29.2.60333 > 10.0.29.3.3784: BFDv1, Control, State Up, Flags: [none], length: 24
 00:00:21.031964 eth2  In  IP 10.0.29.3.56905 > 10.0.29.2.3784: BFDv1, Control, State Up, Flags: [none], length: 24
 00:00:21.059287 eth2  Out IP 10.0.29.2.60333 > 10.0.29.3.3784: BFDv1, Control, State Up, Flags: [none], length: 24
 00:00:21.107598 eth2  In  IP 10.0.29.3.56905 > 10.0.29.2.3784: BFDv1, Control, State Up, Flags: [none], length: 24
 00:00:21.138909 eth2  Out IP 10.0.29.2.60333 > 10.0.29.3.3784: BFDv1, Control, State Up, Flags: [none], length: 24
 00:00:21.194214 eth2  In  IP 10.0.29.3.56905 > 10.0.29.2.3784: BFDv1, Control, State Up, Flags: [none], length: 24
 00:00:21.214532 eth2  Out IP 10.0.29.2.60333 > 10.0.29.3.3784: BFDv1, Control, State Up, Flags: [none], length: 24
 00:00:21.270971 eth2  In  IP 10.0.29.3.56905 > 10.0.29.2.3784: BFDv1, Control, State Up, Flags: [none], length: 24
 00:00:21.299290 eth2  Out IP 10.0.29.2.60333 > 10.0.29.3.3784: BFDv1, Control, State Up, Flags: [none], length: 24
 00:00:21.355719 eth2  In  IP 10.0.29.3.56905 > 10.0.29.2.3784: BFDv1, Control, State Up, Flags: [none], length: 24
 00:00:21.384111 eth2  Out IP 10.0.29.2.60333 > 10.0.29.3.3784: BFDv1, Control, State Up, Flags: [none], length: 24
 00:00:21.444486 eth2  In  IP 10.0.29.3.56905 > 10.0.29.2.3784: BFDv1, Control, State Up, Flags: [none], length: 24
 00:00:21.463731 eth2  Out IP 10.0.29.2.60333 > 10.0.29.3.3784: BFDv1, Control, State Up, Flags: [none], length: 24
 00:00:21.529460 eth2  In  IP 10.0.29.3.56905 > 10.0.29.2.3784: BFDv1, Control, State Up, Flags: [none], length: 24
 00:00:21.548760 eth2  Out IP 10.0.29.2.60333 > 10.0.29.3.3784: BFDv1, Control, State Up, Flags: [none], length: 24
 00:00:21.612447 eth2  In  IP 10.0.29.3.56905 > 10.0.29.2.3784: BFDv1, Control, State Up, Flags: [none], length: 24
 00:00:21.628767 eth2  Out IP 10.0.29.2.60333 > 10.0.29.3.3784: BFDv1, Control, State Up, Flags: [none], length: 24
 00:00:21.699683 eth2  In  IP 10.0.29.3.56905 > 10.0.29.2.3784: BFDv1, Control, State Up, Flags: [none], length: 24
 00:00:21.704014 eth2  Out IP 10.0.29.2.60333 > 10.0.29.3.3784: BFDv1, Control, State Up, Flags: [none], length: 24
 00:00:21.786278 eth2  Out IP 10.0.29.2.60333 > 10.0.29.3.3784: BFDv1, Control, State Up, Flags: [none], length: 24
 00:00:21.788563 eth2  In  IP 10.0.29.3.56905 > 10.0.29.2.3784: BFDv1, Control, State Up, Flags: [none], length: 24
 00:00:21.868175 eth2  In  IP 10.0.29.3.56905 > 10.0.29.2.3784: BFDv1, Control, State Up, Flags: [none], length: 24
 00:00:21.873088 eth2  Out IP 10.0.29.2.60333 > 10.0.29.3.3784: BFDv1, Control, State Up, Flags: [none], length: 24
 00:00:21.950824 eth2  In  IP 10.0.29.3.56905 > 10.0.29.2.3784: BFDv1, Control, State Up, Flags: [none], length: 24
 00:00:21.950969 eth2  Out IP 10.0.29.2.60333 > 10.0.29.3.3784: BFDv1, Control, State Up, Flags: [none], length: 24
 00:00:22.030218 eth2  Out IP 10.0.29.2.60333 > 10.0.29.3.3784: BFDv1, Control, State Up, Flags: [none], length: 24
 00:00:22.033542 eth2  In  IP 10.0.29.3.56905 > 10.0.29.2.3784: BFDv1, Control, State Up, Flags: [none], length: 24
 00:00:22.105765 eth2  Out IP 10.0.29.2.60333 > 10.0.29.3.3784: BFDv1, Control, State Up, Flags: [none], length: 24
 00:00:22.111102 eth2  In  IP 10.0.29.3.56905 > 10.0.29.2.3784: BFDv1, Control, State Up, Flags: [none], length: 24
 00:00:22.191496 eth2  Out IP 10.0.29.2.60333 > 10.0.29.3.3784: BFDv1, Control, State Up, Flags: [none], length: 24
 00:00:22.194764 eth2  In  IP 10.0.29.3.56905 > 10.0.29.2.3784: BFDv1, Control, State Up, Flags: [none], length: 24
 00:00:22.277136 eth2  Out IP 10.0.29.2.60333 > 10.0.29.3.3784: BFDv1, Control, State Up, Flags: [none], length: 24
 00:00:22.281520 eth2  In  IP 10.0.29.3.56905 > 10.0.29.2.3784: BFDv1, Control, State Up, Flags: [none], length: 24
 00:00:22.364880 eth2  Out IP 10.0.29.2.60333 > 10.0.29.3.3784: BFDv1, Control, State Up, Flags: [none], length: 24
 00:00:22.369097 eth2  In  IP 10.0.29.3.56905 > 10.0.29.2.3784: BFDv1, Control, State Up, Flags: [none], length: 24
 00:00:22.442338 eth2  Out IP 10.0.29.2.60333 > 10.0.29.3.3784: BFDv1, Control, State Up, Flags: [none], length: 24
 00:00:22.456558 eth2  In  IP 10.0.29.3.56905 > 10.0.29.2.3784: BFDv1, Control, State Up, Flags: [none], length: 24
 00:00:22.517863 eth2  Out IP 10.0.29.2.60333 > 10.0.29.3.3784: BFDv1, Control, State Up, Flags: [none], length: 24
 00:00:22.542342 eth2  In  IP 10.0.29.3.56905 > 10.0.29.2.3784: BFDv1, Control, State Up, Flags: [none], length: 24
 00:00:22.600634 eth2  Out IP 10.0.29.2.60333 > 10.0.29.3.3784: BFDv1, Control, State Up, Flags: [none], length: 24
 00:00:22.619113 eth2  In  IP 10.0.29.3.56905 > 10.0.29.2.3784: BFDv1, Control, State Up, Flags: [none], length: 24
 00:00:22.680450 eth2  Out IP 10.0.29.2.60333 > 10.0.29.3.3784: BFDv1, Control, State Up, Flags: [none], length: 24
 00:00:22.703917 eth2  In  IP 10.0.29.3.56905 > 10.0.29.2.3784: BFDv1, Control, State Up, Flags: [none], length: 24
 00:00:22.769198 eth2  Out IP 10.0.29.2.60333 > 10.0.29.3.3784: BFDv1, Control, State Up, Flags: [none], length: 24
 00:00:22.784441 eth2  In  IP 10.0.29.3.56905 > 10.0.29.2.3784: BFDv1, Control, State Up, Flags: [none], length: 24
 00:00:22.855697 eth2  Out IP 10.0.29.2.60333 > 10.0.29.3.3784: BFDv1, Control, State Up, Flags: [none], length: 24
 00:00:22.867068 eth2  In  IP 10.0.29.3.56905 > 10.0.29.2.3784: BFDv1, Control, State Up, Flags: [none], length: 24
 00:00:22.942290 eth2  Out IP 10.0.29.2.60333 > 10.0.29.3.3784: BFDv1, Control, State Up, Flags: [none], length: 24
 00:00:22.944481 eth2  In  IP 10.0.29.3.56905 > 10.0.29.2.3784: BFDv1, Control, State Up, Flags: [none], length: 24
 00:00:23.022045 eth2  In  IP 10.0.29.3.56905 > 10.0.29.2.3784: BFDv1, Control, State Up, Flags: [none], length: 24
 00:00:23.029291 eth2  Out IP 10.0.29.2.60333 > 10.0.29.3.3784: BFDv1, Control, State Up, Flags: [none], length: 24
 00:00:23.104929 eth2  In  IP 10.0.29.3.56905 > 10.0.29.2.3784: BFDv1, Control, State Up, Flags: [none], length: 24
 00:00:23.116187 eth2  Out IP 10.0.29.2.60333 > 10.0.29.3.3784: BFDv1, Control, State Up, Flags: [none], length: 24
 00:00:23.190782 eth2  In  IP 10.0.29.3.56905 > 10.0.29.2.3784: BFDv1, Control, State Up, Flags: [none], length: 24
 00:00:23.205037 eth2  Out IP 10.0.29.2.60333 > 10.0.29.3.3784: BFDv1, Control, State Up, Flags: [none], length: 24
 00:00:23.274596 eth2  In  IP 10.0.29.3.56905 > 10.0.29.2.3784: BFDv1, Control, State Up, Flags: [none], length: 24
 00:00:23.282888 eth2  Out IP 10.0.29.2.60333 > 10.0.29.3.3784: BFDv1, Control, State Up, Flags: [none], length: 24
 00:00:23.285623 eth2  Out IP 10.0.29.2.60457 > 10.0.29.3.179: Flags [S], seq 2340746459, win 64240, options [mss 1460,sackOK,TS val 2352344981 ecr 0,nop,wscale 10], length 0
 00:00:23.285665 eth2  In  IP 10.0.29.3.179 > 10.0.29.2.60457: Flags [S.], seq 1641384260, ack 2340746460, win 65160, options [mss 1460,sackOK,TS val 562644717 ecr 2352344981,nop,wscale 10], length 0
 00:00:23.285685 eth2  Out IP 10.0.29.2.60457 > 10.0.29.3.179: Flags [.], ack 1, win 63, options [nop,nop,TS val 2352344981 ecr 562644717], length 0
 00:00:23.285753 eth2  Out IP 10.0.29.2.60457 > 10.0.29.3.179: Flags [P.], seq 1:65, ack 1, win 63, options [nop,nop,TS val 2352344981 ecr 562644717], length 64: BGP
 00:00:23.285769 eth2  In  IP 10.0.29.3.179 > 10.0.29.2.60457: Flags [.], ack 65, win 64, options [nop,nop,TS val 562644717 ecr 2352344981], length 0
 00:00:23.285806 eth2  In  IP 10.0.29.3.179 > 10.0.29.2.60457: Flags [R.], seq 1, ack 65, win 64, options [nop,nop,TS val 562644717 ecr 2352344981], length 0
 00:00:23.354042 eth2  In  IP 10.0.29.3.56905 > 10.0.29.2.3784: BFDv1, Control, State Up, Flags: [none], length: 24
 00:00:23.366250 eth2  Out IP 10.0.29.2.60333 > 10.0.29.3.3784: BFDv1, Control, State Up, Flags: [none], length: 24
 00:00:23.441343 eth2  In  IP 10.0.29.3.56905 > 10.0.29.2.3784: BFDv1, Control, State Up, Flags: [none], length: 24
 00:00:23.444550 eth2  Out IP 10.0.29.2.60333 > 10.0.29.3.3784: BFDv1, Control, State Up, Flags: [none], length: 24
 00:00:23.518873 eth2  In  IP 10.0.29.3.56905 > 10.0.29.2.3784: BFDv1, Control, State Up, Flags: [none], length: 24
 00:00:23.528168 eth2  Out IP 10.0.29.2.60333 > 10.0.29.3.3784: BFDv1, Control, State Up, Flags: [none], length: 24
 00:00:23.600331 eth2  In  IP 10.0.29.3.56905 > 10.0.29.2.3784: BFDv1, Control, State Up, Flags: [none], length: 24
 00:00:23.616616 eth2  Out IP 10.0.29.2.60333 > 10.0.29.3.3784: BFDv1, Control, State Up, Flags: [none], length: 24
 00:00:23.676598 eth2  In  IP 10.0.29.3.56905 > 10.0.29.2.3784: BFDv1, Control, State Up, Flags: [none], length: 24
 00:00:23.702933 eth2  Out IP 10.0.29.2.60333 > 10.0.29.3.3784: BFDv1, Control, State Up, Flags: [none], length: 24
 00:00:23.755149 eth2  In  IP 10.0.29.3.56905 > 10.0.29.2.3784: BFDv1, Control, State Up, Flags: [none], length: 24
 00:00:23.792348 eth2  Out IP 10.0.29.2.60333 > 10.0.29.3.3784: BFDv1, Control, State Up, Flags: [none], length: 24
 00:00:23.842663 eth2  In  IP 10.0.29.3.56905 > 10.0.29.2.3784: BFDv1, Control, State Up, Flags: [none], length: 24
 00:00:23.874946 eth2  Out IP 10.0.29.2.60333 > 10.0.29.3.3784: BFDv1, Control, State Up, Flags: [none], length: 24
 00:00:23.925289 eth2  In  IP 10.0.29.3.56905 > 10.0.29.2.3784: BFDv1, Control, State Up, Flags: [none], length: 24
 00:00:23.951525 eth2  Out IP 10.0.29.2.60333 > 10.0.29.3.3784: BFDv1, Control, State Up, Flags: [none], length: 24
 00:00:24.008859 eth2  In  IP 10.0.29.3.56905 > 10.0.29.2.3784: BFDv1, Control, State Up, Flags: [none], length: 24
 00:00:24.040103 eth2  Out IP 10.0.29.2.60333 > 10.0.29.3.3784: BFDv1, Control, State Up, Flags: [none], length: 24
 00:00:24.098446 eth2  In  IP 10.0.29.3.56905 > 10.0.29.2.3784: BFDv1, Control, State Up, Flags: [none], length: 24
 00:00:24.129695 eth2  Out IP 10.0.29.2.60333 > 10.0.29.3.3784: BFDv1, Control, State Up, Flags: [none], length: 24
 00:00:24.186982 eth2  In  IP 10.0.29.3.56905 > 10.0.29.2.3784: BFDv1, Control, State Up, Flags: [none], length: 24
 00:00:24.216248 eth2  Out IP 10.0.29.2.60333 > 10.0.29.3.3784: BFDv1, Control, State Up, Flags: [none], length: 24
 00:00:24.261630 eth2  In  IP 10.0.29.3.56905 > 10.0.29.2.3784: BFDv1, Control, State Up, Flags: [none], length: 24
 00:00:24.294877 eth2  Out IP 10.0.29.2.60333 > 10.0.29.3.3784: BFDv1, Control, State Up, Flags: [none], length: 24
 00:00:24.343228 eth2  In  IP 10.0.29.3.56905 > 10.0.29.2.3784: BFDv1, Control, State Up, Flags: [none], length: 24
 00:00:24.372468 eth2  Out IP 10.0.29.2.60333 > 10.0.29.3.3784: BFDv1, Control, State Up, Flags: [none], length: 24
 00:00:24.425794 eth2  In  IP 10.0.29.3.56905 > 10.0.29.2.3784: BFDv1, Control, State Up, Flags: [none], length: 24
 00:00:24.460043 eth2  Out IP 10.0.29.2.60333 > 10.0.29.3.3784: BFDv1, Control, State Up, Flags: [none], length: 24
 00:00:24.509365 eth2  In  IP 10.0.29.3.56905 > 10.0.29.2.3784: BFDv1, Control, State Up, Flags: [none], length: 24
 00:00:24.549600 eth2  Out IP 10.0.29.2.60333 > 10.0.29.3.3784: BFDv1, Control, State Up, Flags: [none], length: 24
 00:00:24.597108 eth2  In  IP 10.0.29.3.56905 > 10.0.29.2.3784: BFDv1, Control, State Up, Flags: [none], length: 24
 00:00:24.636351 eth2  Out IP 10.0.29.2.60333 > 10.0.29.3.3784: BFDv1, Control, State Up, Flags: [none], length: 24
 00:00:24.681673 eth2  In  IP 10.0.29.3.56905 > 10.0.29.2.3784: BFDv1, Control, State Up, Flags: [none], length: 24
 00:00:24.724241 eth2  Out IP 10.0.29.2.60333 > 10.0.29.3.3784: BFDv1, Control, State Up, Flags: [none], length: 24
 00:00:24.767650 eth2  In  IP 10.0.29.3.56905 > 10.0.29.2.3784: BFDv1, Control, State Up, Flags: [none], length: 24
 00:00:24.797940 eth2  Out IP 10.0.29.2.60333 > 10.0.29.3.3784: BFDv1, Control, State Up, Flags: [none], length: 24
 00:00:24.844393 eth2  In  IP 10.0.29.3.56905 > 10.0.29.2.3784: BFDv1, Control, State Up, Flags: [none], length: 24
 00:00:24.886663 eth2  Out IP 10.0.29.2.60333 > 10.0.29.3.3784: BFDv1, Control, State Up, Flags: [none], length: 24
 00:00:24.931100 eth2  In  IP 10.0.29.3.56905 > 10.0.29.2.3784: BFDv1, Control, State Up, Flags: [none], length: 24
 00:00:24.964328 eth2  Out IP 10.0.29.2.60333 > 10.0.29.3.3784: BFDv1, Control, State Up, Flags: [none], length: 24
 00:00:25.010672 eth2  In  IP 10.0.29.3.56905 > 10.0.29.2.3784: BFDv1, Control, State Up, Flags: [none], length: 24
 00:00:25.044924 eth2  Out IP 10.0.29.2.60333 > 10.0.29.3.3784: BFDv1, Control, State Up, Flags: [none], length: 24
 00:00:25.086171 eth2  In  IP 10.0.29.3.56905 > 10.0.29.2.3784: BFDv1, Control, State Up, Flags: [none], length: 24
 00:00:25.131383 eth2  Out IP 10.0.29.2.60333 > 10.0.29.3.3784: BFDv1, Control, State Up, Flags: [none], length: 24
 00:00:25.171759 eth2  In  IP 10.0.29.3.56905 > 10.0.29.2.3784: BFDv1, Control, State Up, Flags: [none], length: 24
 00:00:25.206003 eth2  Out IP 10.0.29.2.60333 > 10.0.29.3.3784: BFDv1, Control, State Up, Flags: [none], length: 24
 00:00:25.259171 eth2  In  IP 10.0.29.3.56905 > 10.0.29.2.3784: BFDv1, Control, State Up, Flags: [none], length: 24
 00:00:25.281436 eth2  Out IP 10.0.29.2.60333 > 10.0.29.3.3784: BFDv1, Control, State Up, Flags: [none], length: 24
 00:00:25.342609 eth2  In  IP 10.0.29.3.56905 > 10.0.29.2.3784: BFDv1, Control, State Up, Flags: [none], length: 24
 00:00:25.366059 eth2  Out IP 10.0.29.2.60333 > 10.0.29.3.3784: BFDv1, Control, State Up, Flags: [none], length: 24
 00:00:25.418008 eth2  In  IP 10.0.29.3.56905 > 10.0.29.2.3784: BFDv1, Control, State Up, Flags: [none], length: 24
 00:00:25.452304 eth2  Out IP 10.0.29.2.60333 > 10.0.29.3.3784: BFDv1, Control, State Up, Flags: [none], length: 24
 00:00:25.501825 eth2  In  IP 10.0.29.3.56905 > 10.0.29.2.3784: BFDv1, Control, State Up, Flags: [none], length: 24
 00:00:25.541260 eth2  Out IP 10.0.29.2.60333 > 10.0.29.3.3784: BFDv1, Control, State Up, Flags: [none], length: 24
 00:00:25.586730 eth2  In  IP 10.0.29.3.56905 > 10.0.29.2.3784: BFDv1, Control, State Up, Flags: [none], length: 24
 00:00:25.628030 eth2  Out IP 10.0.29.2.60333 > 10.0.29.3.3784: BFDv1, Control, State Up, Flags: [none], length: 24
 00:00:25.671477 eth2  In  IP 10.0.29.3.56905 > 10.0.29.2.3784: BFDv1, Control, State Up, Flags: [none], length: 24
 00:00:25.707758 eth2  Out IP 10.0.29.2.60333 > 10.0.29.3.3784: BFDv1, Control, State Up, Flags: [none], length: 24
 00:00:25.755178 eth2  In  IP 10.0.29.3.56905 > 10.0.29.2.3784: BFDv1, Control, State Up, Flags: [none], length: 24
 00:00:25.795447 eth2  Out IP 10.0.29.2.60333 > 10.0.29.3.3784: BFDv1, Control, State Up, Flags: [none], length: 24
 00:00:25.830853 eth2  In  IP 10.0.29.3.56905 > 10.0.29.2.3784: BFDv1, Control, State Up, Flags: [none], length: 24
 00:00:25.875106 eth2  Out IP 10.0.29.2.60333 > 10.0.29.3.3784: BFDv1, Control, State Up, Flags: [none], length: 24
 00:00:25.906490 eth2  In  IP 10.0.29.3.56905 > 10.0.29.2.3784: BFDv1, Control, State Up, Flags: [none], length: 24
 00:00:25.958761 eth2  Out IP 10.0.29.2.60333 > 10.0.29.3.3784: BFDv1, Control, State Up, Flags: [none], length: 24
 00:00:25.982217 eth2  In  IP 10.0.29.3.56905 > 10.0.29.2.3784: BFDv1, Control, State Up, Flags: [none], length: 24
 00:00:26.034551 eth2  Out IP 10.0.29.2.60333 > 10.0.29.3.3784: BFDv1, Control, State Up, Flags: [none], length: 24
 00:00:26.065925 eth2  In  IP 10.0.29.3.56905 > 10.0.29.2.3784: BFDv1, Control, State Up, Flags: [none], length: 24
 00:00:26.122203 eth2  Out IP 10.0.29.2.60333 > 10.0.29.3.3784: BFDv1, Control, State Up, Flags: [none], length: 24
 00:00:26.153608 eth2  In  IP 10.0.29.3.56905 > 10.0.29.2.3784: BFDv1, Control, State Up, Flags: [none], length: 24
 00:00:26.203958 eth2  Out IP 10.0.29.2.60333 > 10.0.29.3.3784: BFDv1, Control, State Up, Flags: [none], length: 24
 00:00:26.233346 eth2  In  IP 10.0.29.3.56905 > 10.0.29.2.3784: BFDv1, Control, State Up, Flags: [none], length: 24
 00:00:26.290598 eth2  Out IP 10.0.29.2.60333 > 10.0.29.3.3784: BFDv1, Control, State Up, Flags: [none], length: 24
 00:00:26.316827 eth2  In  IP 10.0.29.3.56905 > 10.0.29.2.3784: BFDv1, Control, State Up, Flags: [none], length: 24
 00:00:26.377106 eth2  Out IP 10.0.29.2.60333 > 10.0.29.3.3784: BFDv1, Control, State Up, Flags: [none], length: 24
 00:00:26.396351 eth2  In  IP 10.0.29.3.56905 > 10.0.29.2.3784: BFDv1, Control, State Up, Flags: [none], length: 24
 00:00:26.466685 eth2  Out IP 10.0.29.2.60333 > 10.0.29.3.3784: BFDv1, Control, State Up, Flags: [none], length: 24
 00:00:26.486940 eth2  In  IP 10.0.29.3.56905 > 10.0.29.2.3784: BFDv1, Control, State Up, Flags: [none], length: 24
 00:00:26.554295 eth2  Out IP 10.0.29.2.60333 > 10.0.29.3.3784: BFDv1, Control, State Up, Flags: [none], length: 24
 00:00:26.566509 eth2  In  IP 10.0.29.3.56905 > 10.0.29.2.3784: BFDv1, Control, State Up, Flags: [none], length: 24
 00:00:26.638806 eth2  Out IP 10.0.29.2.60333 > 10.0.29.3.3784: BFDv1, Control, State Up, Flags: [none], length: 24
 00:00:26.652159 eth2  In  IP 10.0.29.3.56905 > 10.0.29.2.3784: BFDv1, Control, State Up, Flags: [none], length: 24
 00:00:26.727402 eth2  Out IP 10.0.29.2.60333 > 10.0.29.3.3784: BFDv1, Control, State Up, Flags: [none], length: 24
 00:00:26.739633 eth2  In  IP 10.0.29.3.56905 > 10.0.29.2.3784: BFDv1, Control, State Up, Flags: [none], length: 24
 00:00:26.811902 eth2  Out IP 10.0.29.2.60333 > 10.0.29.3.3784: BFDv1, Control, State Up, Flags: [none], length: 24
 00:00:26.821076 eth2  In  IP 10.0.29.3.56905 > 10.0.29.2.3784: BFDv1, Control, State Up, Flags: [none], length: 24
 00:00:26.900355 eth2  Out IP 10.0.29.2.60333 > 10.0.29.3.3784: BFDv1, Control, State Up, Flags: [none], length: 24
 00:00:26.900565 eth2  In  IP 10.0.29.3.56905 > 10.0.29.2.3784: BFDv1, Control, State Up, Flags: [none], length: 24
 00:00:26.975839 eth2  Out IP 10.0.29.2.60333 > 10.0.29.3.3784: BFDv1, Control, State Up, Flags: [none], length: 24
 00:00:26.980067 eth2  In  IP 10.0.29.3.56905 > 10.0.29.2.3784: BFDv1, Control, State Up, Flags: [none], length: 24
 00:00:27.058385 eth2  Out IP 10.0.29.2.60333 > 10.0.29.3.3784: BFDv1, Control, State Up, Flags: [none], length: 24
 00:00:27.064741 eth2  In  IP 10.0.29.3.56905 > 10.0.29.2.3784: BFDv1, Control, State Up, Flags: [none], length: 24
 00:00:27.125079 eth2  Out IP 10.0.29.2.42193 > 10.0.29.3.179: Flags [S], seq 2379404629, win 64240, options [mss 1460,sackOK,TS val 2352348821 ecr 0,nop,wscale 10], length 0
 00:00:27.125150 eth2  In  IP 10.0.29.3.179 > 10.0.29.2.42193: Flags [S.], seq 2184511699, ack 2379404630, win 65160, options [mss 1460,sackOK,TS val 562648557 ecr 2352348821,nop,wscale 10], length 0
 00:00:27.125177 eth2  Out IP 10.0.29.2.42193 > 10.0.29.3.179: Flags [.], ack 1, win 63, options [nop,nop,TS val 2352348821 ecr 562648557], length 0
 00:00:27.125267 eth2  Out IP 10.0.29.2.42193 > 10.0.29.3.179: Flags [P.], seq 1:65, ack 1, win 63, options [nop,nop,TS val 2352348821 ecr 562648557], length 64: BGP
 00:00:27.125287 eth2  In  IP 10.0.29.3.179 > 10.0.29.2.42193: Flags [.], ack 65, win 64, options [nop,nop,TS val 562648557 ecr 2352348821], length 0
 00:00:27.125350 eth2  In  IP 10.0.29.3.179 > 10.0.29.2.42193: Flags [R.], seq 1, ack 65, win 64, options [nop,nop,TS val 562648557 ecr 2352348821], length 0
 00:00:27.144115 eth2  Out IP 10.0.29.2.60333 > 10.0.29.3.3784: BFDv1, Control, State Up, Flags: [none], length: 24
 00:00:27.145300 eth2  In  IP 10.0.29.3.56905 > 10.0.29.2.3784: BFDv1, Control, State Up, Flags: [none], length: 24
 00:00:27.231581 eth2  Out IP 10.0.29.2.60333 > 10.0.29.3.3784: BFDv1, Control, State Up, Flags: [none], length: 24
 00:00:27.234816 eth2  In  IP 10.0.29.3.56905 > 10.0.29.2.3784: BFDv1, Control, State Up, Flags: [none], length: 24
 00:00:27.312218 eth2  Out IP 10.0.29.2.60333 > 10.0.29.3.3784: BFDv1, Control, State Up, Flags: [none], length: 24
 00:00:27.316472 eth2  In  IP 10.0.29.3.56905 > 10.0.29.2.3784: BFDv1, Control, State Up, Flags: [none], length: 24
 00:00:27.387723 eth2  Out IP 10.0.29.2.60333 > 10.0.29.3.3784: BFDv1, Control, State Up, Flags: [none], length: 24
 00:00:27.399975 eth2  In  IP 10.0.29.3.56905 > 10.0.29.2.3784: BFDv1, Control, State Up, Flags: [none], length: 24
 00:00:27.471332 eth2  Out IP 10.0.29.2.60333 > 10.0.29.3.3784: BFDv1, Control, State Up, Flags: [none], length: 24
 00:00:27.487541 eth2  In  IP 10.0.29.3.56905 > 10.0.29.2.3784: BFDv1, Control, State Up, Flags: [none], length: 24
 00:00:27.551796 eth2  Out IP 10.0.29.2.60333 > 10.0.29.3.3784: BFDv1, Control, State Up, Flags: [none], length: 24
 00:00:27.569169 eth2  In  IP 10.0.29.3.56905 > 10.0.29.2.3784: BFDv1, Control, State Up, Flags: [none], length: 24
 00:00:27.628460 eth2  Out IP 10.0.29.2.60333 > 10.0.29.3.3784: BFDv1, Control, State Up, Flags: [none], length: 24
 00:00:27.647707 eth2  In  IP 10.0.29.3.56905 > 10.0.29.2.3784: BFDv1, Control, State Up, Flags: [none], length: 24
 00:00:27.704975 eth2  Out IP 10.0.29.2.60333 > 10.0.29.3.3784: BFDv1, Control, State Up, Flags: [none], length: 24
 00:00:27.729203 eth2  In  IP 10.0.29.3.56905 > 10.0.29.2.3784: BFDv1, Control, State Up, Flags: [none], length: 24
 00:00:27.781474 eth2  Out IP 10.0.29.2.60333 > 10.0.29.3.3784: BFDv1, Control, State Up, Flags: [none], length: 24
 00:00:27.816721 eth2  In  IP 10.0.29.3.56905 > 10.0.29.2.3784: BFDv1, Control, State Up, Flags: [none], length: 24
 00:00:27.857005 eth2  Out IP 10.0.29.2.60333 > 10.0.29.3.3784: BFDv1, Control, State Up, Flags: [none], length: 24
 00:00:27.903248 eth2  In  IP 10.0.29.3.56905 > 10.0.29.2.3784: BFDv1, Control, State Up, Flags: [none], length: 24
 00:00:27.944493 eth2  Out IP 10.0.29.2.60333 > 10.0.29.3.3784: BFDv1, Control, State Up, Flags: [none], length: 24
 00:00:27.979687 eth2  In  IP 10.0.29.3.56905 > 10.0.29.2.3784: BFDv1, Control, State Up, Flags: [none], length: 24
 00:00:28.026950 eth2  Out IP 10.0.29.2.60333 > 10.0.29.3.3784: BFDv1, Control, State Up, Flags: [none], length: 24
 00:00:28.065261 eth2  In  IP 10.0.29.3.56905 > 10.0.29.2.3784: BFDv1, Control, State Up, Flags: [none], length: 24
 00:00:28.114513 eth2  Out IP 10.0.29.2.60333 > 10.0.29.3.3784: BFDv1, Control, State Up, Flags: [none], length: 24
 00:00:28.141771 eth2  In  IP 10.0.29.3.56905 > 10.0.29.2.3784: BFDv1, Control, State Up, Flags: [none], length: 24
 00:00:28.191068 eth2  Out IP 10.0.29.2.60333 > 10.0.29.3.3784: BFDv1, Control, State Up, Flags: [none], length: 24
 00:00:28.224294 eth2  In  IP 10.0.29.3.56905 > 10.0.29.2.3784: BFDv1, Control, State Up, Flags: [none], length: 24
 00:00:28.266578 eth2  Out IP 10.0.29.2.60333 > 10.0.29.3.3784: BFDv1, Control, State Up, Flags: [none], length: 24
 00:00:28.299811 eth2  In  IP 10.0.29.3.56905 > 10.0.29.2.3784: BFDv1, Control, State Up, Flags: [none], length: 24
 00:00:28.354100 eth2  Out IP 10.0.29.2.60333 > 10.0.29.3.3784: BFDv1, Control, State Up, Flags: [none], length: 24
 00:00:28.383343 eth2  In  IP 10.0.29.3.56905 > 10.0.29.2.3784: BFDv1, Control, State Up, Flags: [none], length: 24
 00:00:28.443574 eth2  Out IP 10.0.29.2.60333 > 10.0.29.3.3784: BFDv1, Control, State Up, Flags: [none], length: 24
 00:00:28.465820 eth2  In  IP 10.0.29.3.56905 > 10.0.29.2.3784: BFDv1, Control, State Up, Flags: [none], length: 24
 00:00:28.525092 eth2  Out IP 10.0.29.2.60333 > 10.0.29.3.3784: BFDv1, Control, State Up, Flags: [none], length: 24
 00:00:28.546297 eth2  In  IP 10.0.29.3.56905 > 10.0.29.2.3784: BFDv1, Control, State Up, Flags: [none], length: 24
 00:00:28.610578 eth2  Out IP 10.0.29.2.60333 > 10.0.29.3.3784: BFDv1, Control, State Up, Flags: [none], length: 24
 00:00:28.625819 eth2  In  IP 10.0.29.3.56905 > 10.0.29.2.3784: BFDv1, Control, State Up, Flags: [none], length: 24
 00:00:28.695111 eth2  Out IP 10.0.29.2.60333 > 10.0.29.3.3784: BFDv1, Control, State Up, Flags: [none], length: 24
 00:00:28.712292 eth2  In  IP 10.0.29.3.56905 > 10.0.29.2.3784: BFDv1, Control, State Up, Flags: [none], length: 24
 00:00:28.775538 eth2  Out IP 10.0.29.2.60333 > 10.0.29.3.3784: BFDv1, Control, State Up, Flags: [none], length: 24
 00:00:28.787712 eth2  In  IP 10.0.29.3.56905 > 10.0.29.2.3784: BFDv1, Control, State Up, Flags: [none], length: 24
 00:00:28.858061 eth2  Out IP 10.0.29.2.60333 > 10.0.29.3.3784: BFDv1, Control, State Up, Flags: [none], length: 24
 00:00:28.869258 eth2  In  IP 10.0.29.3.56905 > 10.0.29.2.3784: BFDv1, Control, State Up, Flags: [none], length: 24
 00:00:28.938548 eth2  Out IP 10.0.29.2.60333 > 10.0.29.3.3784: BFDv1, Control, State Up, Flags: [none], length: 24
 00:00:28.950866 eth2  In  IP 10.0.29.3.56905 > 10.0.29.2.3784: BFDv1, Control, State Up, Flags: [none], length: 24
 00:00:29.017223 eth2  Out IP 10.0.29.2.60333 > 10.0.29.3.3784: BFDv1, Control, State Up, Flags: [none], length: 24
 00:00:29.034455 eth2  In  IP 10.0.29.3.56905 > 10.0.29.2.3784: BFDv1, Control, State Up, Flags: [none], length: 24
 00:00:29.094715 eth2  Out IP 10.0.29.2.60333 > 10.0.29.3.3784: BFDv1, Control, State Up, Flags: [none], length: 24
 00:00:29.114901 eth2  In  IP 10.0.29.3.56905 > 10.0.29.2.3784: BFDv1, Control, State Up, Flags: [none], length: 24
 00:00:29.172314 eth2  Out IP 10.0.29.2.60333 > 10.0.29.3.3784: BFDv1, Control, State Up, Flags: [none], length: 24
 00:00:29.195539 eth2  In  IP 10.0.29.3.56905 > 10.0.29.2.3784: BFDv1, Control, State Up, Flags: [none], length: 24
 00:00:29.251882 eth2  Out IP 10.0.29.2.60333 > 10.0.29.3.3784: BFDv1, Control, State Up, Flags: [none], length: 24
 00:00:29.281094 eth2  In  IP 10.0.29.3.56905 > 10.0.29.2.3784: BFDv1, Control, State Up, Flags: [none], length: 24
 00:00:29.335398 eth2  Out IP 10.0.29.2.60333 > 10.0.29.3.3784: BFDv1, Control, State Up, Flags: [none], length: 24
 00:00:29.370588 eth2  In  IP 10.0.29.3.56905 > 10.0.29.2.3784: BFDv1, Control, State Up, Flags: [none], length: 24
 00:00:29.423934 eth2  Out IP 10.0.29.2.60333 > 10.0.29.3.3784: BFDv1, Control, State Up, Flags: [none], length: 24
 00:00:29.451184 eth2  In  IP 10.0.29.3.56905 > 10.0.29.2.3784: BFDv1, Control, State Up, Flags: [none], length: 24
 00:00:29.501437 eth2  Out IP 10.0.29.2.60333 > 10.0.29.3.3784: BFDv1, Control, State Up, Flags: [none], length: 24
 00:00:29.538600 eth2  In  IP 10.0.29.3.56905 > 10.0.29.2.3784: BFDv1, Control, State Up, Flags: [none], length: 24
 00:00:29.587858 eth2  Out IP 10.0.29.2.60333 > 10.0.29.3.3784: BFDv1, Control, State Up, Flags: [none], length: 24
 00:00:29.625100 eth2  In  IP 10.0.29.3.56905 > 10.0.29.2.3784: BFDv1, Control, State Up, Flags: [none], length: 24
 00:00:29.672358 eth2  Out IP 10.0.29.2.60333 > 10.0.29.3.3784: BFDv1, Control, State Up, Flags: [none], length: 24
 00:00:29.706622 eth2  In  IP 10.0.29.3.56905 > 10.0.29.2.3784: BFDv1, Control, State Up, Flags: [none], length: 24
 00:00:29.761883 eth2  Out IP 10.0.29.2.60333 > 10.0.29.3.3784: BFDv1, Control, State Up, Flags: [none], length: 24
 00:00:29.795107 eth2  In  IP 10.0.29.3.56905 > 10.0.29.2.3784: BFDv1, Control, State Up, Flags: [none], length: 24
 00:00:29.838451 eth2  Out IP 10.0.29.2.60333 > 10.0.29.3.3784: BFDv1, Control, State Up, Flags: [none], length: 24
 00:00:29.873707 eth2  In  IP 10.0.29.3.56905 > 10.0.29.2.3784: BFDv1, Control, State Up, Flags: [none], length: 24
 00:00:29.922971 eth2  Out IP 10.0.29.2.60333 > 10.0.29.3.3784: BFDv1, Control, State Up, Flags: [none], length: 24
 00:00:29.955238 eth2  In  IP 10.0.29.3.56905 > 10.0.29.2.3784: BFDv1, Control, State Up, Flags: [none], length: 24
 00:00:30.006115 eth2  Out IP 10.0.29.2.60333 > 10.0.29.3.3784: BFDv1, Control, State Up, Flags: [none], length: 24
 00:00:30.035382 eth2  In  IP 10.0.29.3.56905 > 10.0.29.2.3784: BFDv1, Control, State Up, Flags: [none], length: 24
 00:00:30.087696 eth2  Out IP 10.0.29.2.60333 > 10.0.29.3.3784: BFDv1, Control, State Up, Flags: [none], length: 24
 00:00:30.110909 eth2  In  IP 10.0.29.3.56905 > 10.0.29.2.3784: BFDv1, Control, State Up, Flags: [none], length: 24
 00:00:30.174134 eth2  Out IP 10.0.29.2.60333 > 10.0.29.3.3784: BFDv1, Control, State Up, Flags: [none], length: 24
 00:00:30.188403 eth2  In  IP 10.0.29.3.56905 > 10.0.29.2.3784: BFDv1, Control, State Up, Flags: [none], length: 24
 00:00:30.257691 eth2  Out IP 10.0.29.2.60333 > 10.0.29.3.3784: BFDv1, Control, State Up, Flags: [none], length: 24
 00:00:30.267918 eth2  In  IP 10.0.29.3.56905 > 10.0.29.2.3784: BFDv1, Control, State Up, Flags: [none], length: 24
 00:00:30.341249 eth2  Out IP 10.0.29.2.60333 > 10.0.29.3.3784: BFDv1, Control, State Up, Flags: [none], length: 24
570 packets captured
571 packets received by filter
0 packets dropped by kernel

