tcpdump: data link type LINUX_SLL2
tcpdump: verbose output suppressed, use -v[v]... for full protocol decode
listening on any, link-type LINUX_SLL2 (Linux cooked v2), snapshot length 262144 bytes
 00:00:00.000000 eth2  Out IP 10.0.23.3.59324 > 10.0.23.2.3784: BFDv1, Control, State Up, Flags: [none], length: 24
 00:00:00.002160 eth1  Out IP 10.0.13.3.42552 > 10.0.13.2.3784: BFDv1, Control, State Up, Flags: [none], length: 24
 00:00:00.032330 eth3  Out IP 10.0.34.2.53716 > 10.0.34.3.3784: BFDv1, Control, State Up, Flags: [none], length: 24
 00:00:00.044449 eth1  In  IP 10.0.13.2.32837 > 10.0.13.3.3784: BFDv1, Control, State Up, Flags: [none], length: 24
 00:00:00.048687 eth0  Out IP 10.0.35.2.59307 > 10.0.35.3.3784: BFDv1, Control, State Up, Flags: [none], length: 24
 00:00:00.058890 eth0  In  IP 10.0.35.3.48498 > 10.0.35.2.3784: BFDv1, Control, State Up, Flags: [none], length: 24
 00:00:00.073103 eth2  In  IP 10.0.23.2.41179 > 10.0.23.3.3784: BFDv1, Control, State Up, Flags: [none], length: 24
 00:00:00.077340 eth2  Out IP 10.0.23.3.59324 > 10.0.23.2.3784: BFDv1, Control, State Up, Flags: [none], length: 24
 00:00:00.083191 eth3  In  IP 10.0.34.3.59763 > 10.0.34.2.3784: BFDv1, Control, State Up, Flags: [none], length: 24
 00:00:00.089372 eth1  Out IP 10.0.13.3.42552 > 10.0.13.2.3784: BFDv1, Control, State Up, Flags: [none], length: 24
 00:00:00.116534 eth3  Out IP 10.0.34.2.53716 > 10.0.34.3.3784: BFDv1, Control, State Up, Flags: [none], length: 24
 00:00:00.131688 eth0  Out IP 10.0.35.2.59307 > 10.0.35.3.3784: BFDv1, Control, State Up, Flags: [none], length: 24
 00:00:00.132744 eth1  In  IP 10.0.13.2.32837 > 10.0.13.3.3784: BFDv1, Control, State Up, Flags: [none], length: 24
 00:00:00.141999 eth0  In  IP 10.0.35.3.48498 > 10.0.35.2.3784: BFDv1, Control, State Up, Flags: [none], length: 24
 00:00:00.153175 eth2  Out IP 10.0.23.3.59324 > 10.0.23.2.3784: BFDv1, Control, State Up, Flags: [none], length: 24
 00:00:00.162578 eth2  In  IP 10.0.23.2.41179 > 10.0.23.3.3784: BFDv1, Control, State Up, Flags: [none], length: 24
 00:00:00.168947 eth3  In  IP 10.0.34.3.59763 > 10.0.34.2.3784: BFDv1, Control, State Up, Flags: [none], length: 24
 00:00:00.172167 eth1  Out IP 10.0.13.3.42552 > 10.0.13.2.3784: BFDv1, Control, State Up, Flags: [none], length: 24
 00:00:00.201445 eth3  Out IP 10.0.34.2.53716 > 10.0.34.3.3784: BFDv1, Control, State Up, Flags: [none], length: 24
 00:00:00.209449 eth1  In  IP 10.0.13.2.32837 > 10.0.13.3.3784: BFDv1, Control, State Up, Flags: [none], length: 24
 00:00:00.212635 eth0  Out IP 10.0.35.2.59307 > 10.0.35.3.3784: BFDv1, Control, State Up, Flags: [none], length: 24
 00:00:00.224831 eth0  In  IP 10.0.35.3.48498 > 10.0.35.2.3784: BFDv1, Control, State Up, Flags: [none], length: 24
 00:00:00.235060 eth2  Out IP 10.0.23.3.59324 > 10.0.23.2.3784: BFDv1, Control, State Up, Flags: [none], length: 24
 00:00:00.245673 eth2  In  IP 10.0.23.2.41179 > 10.0.23.3.3784: BFDv1, Control, State Up, Flags: [none], length: 24
 00:00:00.253957 eth3  In  IP 10.0.34.3.59763 > 10.0.34.2.3784: BFDv1, Control, State Up, Flags: [none], length: 24
 00:00:00.256108 eth1  Out IP 10.0.13.3.42552 > 10.0.13.2.3784: BFDv1, Control, State Up, Flags: [none], length: 24
 00:00:00.278258 eth3  Out IP 10.0.34.2.53716 > 10.0.34.3.3784: BFDv1, Control, State Up, Flags: [none], length: 24
 00:00:00.295312 eth1  In  IP 10.0.13.2.32837 > 10.0.13.3.3784: BFDv1, Control, State Up, Flags: [none], length: 24
 00:00:00.300572 eth0  Out IP 10.0.35.2.59307 > 10.0.35.3.3784: BFDv1, Control, State Up, Flags: [none], length: 24
 00:00:00.306766 eth0  In  IP 10.0.35.3.48498 > 10.0.35.2.3784: BFDv1, Control, State Up, Flags: [none], length: 24
 00:00:00.321993 eth2  Out IP 10.0.23.3.59324 > 10.0.23.2.3784: BFDv1, Control, State Up, Flags: [none], length: 24
 00:00:00.331169 eth1  Out IP 10.0.13.3.42552 > 10.0.13.2.3784: BFDv1, Control, State Up, Flags: [none], length: 24
 00:00:00.333674 eth2  In  IP 10.0.23.2.41179 > 10.0.23.3.3784: BFDv1, Control, State Up, Flags: [none], length: 24
 00:00:00.337509 eth3  In  IP 10.0.34.3.59763 > 10.0.34.2.3784: BFDv1, Control, State Up, Flags: [none], length: 24
 00:00:00.358801 eth3  Out IP 10.0.34.2.53716 > 10.0.34.3.3784: BFDv1, Control, State Up, Flags: [none], length: 24
 00:00:00.383949 eth1  In  IP 10.0.13.2.32837 > 10.0.13.3.3784: BFDv1, Control, State Up, Flags: [none], length: 24
 00:00:00.387234 eth0  Out IP 10.0.35.2.59307 > 10.0.35.3.3784: BFDv1, Control, State Up, Flags: [none], length: 24
 00:00:00.395417 eth0  In  IP 10.0.35.3.48498 > 10.0.35.2.3784: BFDv1, Control, State Up, Flags: [none], length: 24
 00:00:00.401630 eth2  Out IP 10.0.23.3.59324 > 10.0.23.2.3784: BFDv1, Control, State Up, Flags: [none], length: 24
 00:00:00.410796 eth1  Out IP 10.0.13.3.42552 > 10.0.13.2.3784: BFDv1, Control, State Up, Flags: [none], length: 24
 00:00:00.417131 eth3  In  IP 10.0.34.3.59763 > 10.0.34.2.3784: BFDv1, Control, State Up, Flags: [none], length: 24
 00:00:00.418576 eth2  In  IP 10.0.23.2.41179 > 10.0.23.3.3784: BFDv1, Control, State Up, Flags: [none], length: 24
 00:00:00.433766 eth3  Out IP 10.0.34.2.53716 > 10.0.34.3.3784: BFDv1, Control, State Up, Flags: [none], length: 24
 00:00:00.471299 eth1  In  IP 10.0.13.2.32837 > 10.0.13.3.3784: BFDv1, Control, State Up, Flags: [none], length: 24
 00:00:00.472581 eth0  Out IP 10.0.35.2.59307 > 10.0.35.3.3784: BFDv1, Control, State Up, Flags: [none], length: 24
 00:00:00.484763 eth0  In  IP 10.0.35.3.48498 > 10.0.35.2.3784: BFDv1, Control, State Up, Flags: [none], length: 24
 00:00:00.485999 eth1  Out IP 10.0.13.3.42552 > 10.0.13.2.3784: BFDv1, Control, State Up, Flags: [none], length: 24
 00:00:00.487097 eth2  Out IP 10.0.23.3.59324 > 10.0.23.2.3784: BFDv1, Control, State Up, Flags: [none], length: 24
 00:00:00.501246 eth2  In  IP 10.0.23.2.41179 > 10.0.23.3.3784: BFDv1, Control, State Up, Flags: [none], length: 24
 00:00:00.502241 eth3  In  IP 10.0.34.3.59763 > 10.0.34.2.3784: BFDv1, Control, State Up, Flags: [none], length: 24
 00:00:00.522443 eth3  Out IP 10.0.34.2.53716 > 10.0.34.3.3784: BFDv1, Control, State Up, Flags: [none], length: 24
 00:00:00.554682 eth1  In  IP 10.0.13.2.32837 > 10.0.13.3.3784: BFDv1, Control, State Up, Flags: [none], length: 24
 00:00:00.554785 eth0  Out IP 10.0.35.2.59307 > 10.0.35.3.3784: BFDv1, Control, State Up, Flags: [none], length: 24
 00:00:00.564201 eth0  In  IP 10.0.35.3.48498 > 10.0.35.2.3784: BFDv1, Control, State Up, Flags: [none], length: 24
 00:00:00.571391 eth1  Out IP 10.0.13.3.42552 > 10.0.13.2.3784: BFDv1, Control, State Up, Flags: [none], length: 24
 00:00:00.573523 eth2  Out IP 10.0.23.3.59324 > 10.0.23.2.3784: BFDv1, Control, State Up, Flags: [none], length: 24
 00:00:00.581712 eth2  In  IP 10.0.23.2.41179 > 10.0.23.3.3784: BFDv1, Control, State Up, Flags: [none], length: 24
 00:00:00.583839 eth3  In  IP 10.0.34.3.59763 > 10.0.34.2.3784: BFDv1, Control, State Up, Flags: [none], length: 24
 00:00:00.599051 eth3  Out IP 10.0.34.2.53716 > 10.0.34.3.3784: BFDv1, Control, State Up, Flags: [none], length: 24
 00:00:00.632105 eth1  In  IP 10.0.13.2.32837 > 10.0.13.3.3784: BFDv1, Control, State Up, Flags: [none], length: 24
 00:00:00.645277 eth0  Out IP 10.0.35.2.59307 > 10.0.35.3.3784: BFDv1, Control, State Up, Flags: [none], length: 24
 00:00:00.647426 eth1  Out IP 10.0.13.3.42552 > 10.0.13.2.3784: BFDv1, Control, State Up, Flags: [none], length: 24
 00:00:00.651472 eth0  In  IP 10.0.35.3.48498 > 10.0.35.2.3784: BFDv1, Control, State Up, Flags: [none], length: 24
 00:00:00.652687 eth2  Out IP 10.0.23.3.59324 > 10.0.23.2.3784: BFDv1, Control, State Up, Flags: [none], length: 24
 00:00:00.671652 eth2  In  IP 10.0.23.2.41179 > 10.0.23.3.3784: BFDv1, Control, State Up, Flags: [none], length: 24
 00:00:00.672587 eth3  In  IP 10.0.34.3.59763 > 10.0.34.2.3784: BFDv1, Control, State Up, Flags: [none], length: 24
 00:00:00.687781 eth3  Out IP 10.0.34.2.53716 > 10.0.34.3.3784: BFDv1, Control, State Up, Flags: [none], length: 24
 00:00:00.713604 eth1  In  IP 10.0.13.2.32837 > 10.0.13.3.3784: BFDv1, Control, State Up, Flags: [none], length: 24
 00:00:00.723834 eth0  Out IP 10.0.35.2.59307 > 10.0.35.3.3784: BFDv1, Control, State Up, Flags: [none], length: 24
 00:00:00.723935 eth1  Out IP 10.0.13.3.42552 > 10.0.13.2.3784: BFDv1, Control, State Up, Flags: [none], length: 24
 00:00:00.735087 eth2  Out IP 10.0.23.3.59324 > 10.0.23.2.3784: BFDv1, Control, State Up, Flags: [none], length: 24
 00:00:00.737065 eth0  In  IP 10.0.35.3.48498 > 10.0.35.2.3784: BFDv1, Control, State Up, Flags: [none], length: 24
 00:00:00.752553 eth2  In  IP 10.0.23.2.41179 > 10.0.23.3.3784: BFDv1, Control, State Up, Flags: [none], length: 24
 00:00:00.761718 eth3  In  IP 10.0.34.3.59763 > 10.0.34.2.3784: BFDv1, Control, State Up, Flags: [none], length: 24
 00:00:00.772937 eth3  Out IP 10.0.34.2.53716 > 10.0.34.3.3784: BFDv1, Control, State Up, Flags: [none], length: 24
 00:00:00.799091 eth1  Out IP 10.0.13.3.42552 > 10.0.13.2.3784: BFDv1, Control, State Up, Flags: [none], length: 24
 00:00:00.800221 eth0  Out IP 10.0.35.2.59307 > 10.0.35.3.3784: BFDv1, Control, State Up, Flags: [none], length: 24
 00:00:00.800270 eth1  In  IP 10.0.13.2.32837 > 10.0.13.3.3784: BFDv1, Control, State Up, Flags: [none], length: 24
 00:00:00.816464 eth2  Out IP 10.0.23.3.59324 > 10.0.23.2.3784: BFDv1, Control, State Up, Flags: [none], length: 24
 00:00:00.824575 eth0  In  IP 10.0.35.3.48498 > 10.0.35.2.3784: BFDv1, Control, State Up, Flags: [none], length: 24
 00:00:00.834492 eth2  In  IP 10.0.23.2.41179 > 10.0.23.3.3784: BFDv1, Control, State Up, Flags: [none], length: 24
 00:00:00.844370 eth3  In  IP 10.0.34.3.59763 > 10.0.34.2.3784: BFDv1, Control, State Up, Flags: [none], length: 24
 00:00:00.854586 eth3  Out IP 10.0.34.2.53716 > 10.0.34.3.3784: BFDv1, Control, State Up, Flags: [none], length: 24
 00:00:00.881752 eth1  Out IP 10.0.13.3.42552 > 10.0.13.2.3784: BFDv1, Control, State Up, Flags: [none], length: 24
 00:00:00.885921 eth1  In  IP 10.0.13.2.32837 > 10.0.13.3.3784: BFDv1, Control, State Up, Flags: [none], length: 24
 00:00:00.888100 eth0  Out IP 10.0.35.2.59307 > 10.0.35.3.3784: BFDv1, Control, State Up, Flags: [none], length: 24
 00:00:00.899265 eth2  Out IP 10.0.23.3.59324 > 10.0.23.2.3784: BFDv1, Control, State Up, Flags: [none], length: 24
 00:00:00.903198 eth0  In  IP 10.0.35.3.48498 > 10.0.35.2.3784: BFDv1, Control, State Up, Flags: [none], length: 24
 00:00:00.924158 eth2  In  IP 10.0.23.2.41179 > 10.0.23.3.3784: BFDv1, Control, State Up, Flags: [none], length: 24
 00:00:00.928158 eth3  In  IP 10.0.34.3.59763 > 10.0.34.2.3784: BFDv1, Control, State Up, Flags: [none], length: 24
 00:00:00.935396 eth3  Out IP 10.0.34.2.53716 > 10.0.34.3.3784: BFDv1, Control, State Up, Flags: [none], length: 24
 00:00:00.965080 eth1  In  IP 10.0.13.2.32837 > 10.0.13.3.3784: BFDv1, Control, State Up, Flags: [none], length: 24
 00:00:00.967275 eth1  Out IP 10.0.13.3.42552 > 10.0.13.2.3784: BFDv1, Control, State Up, Flags: [none], length: 24
 00:00:00.972456 eth0  Out IP 10.0.35.2.59307 > 10.0.35.3.3784: BFDv1, Control, State Up, Flags: [none], length: 24
 00:00:00.984664 eth0  In  IP 10.0.35.3.48498 > 10.0.35.2.3784: BFDv1, Control, State Up, Flags: [none], length: 24
 00:00:00.985059 eth2  Out IP 10.0.23.3.59324 > 10.0.23.2.3784: BFDv1, Control, State Up, Flags: [none], length: 24
 00:00:01.009795 eth2  In  IP 10.0.23.2.41179 > 10.0.23.3.3784: BFDv1, Control, State Up, Flags: [none], length: 24
 00:00:01.016036 eth3  In  IP 10.0.34.3.59763 > 10.0.34.2.3784: BFDv1, Control, State Up, Flags: [none], length: 24
 00:00:01.016117 eth3  Out IP 10.0.34.2.53716 > 10.0.34.3.3784: BFDv1, Control, State Up, Flags: [none], length: 24
 00:00:01.040643 eth1  In  IP 10.0.13.2.32837 > 10.0.13.3.3784: BFDv1, Control, State Up, Flags: [none], length: 24
 00:00:01.054881 eth1  Out IP 10.0.13.3.42552 > 10.0.13.2.3784: BFDv1, Control, State Up, Flags: [none], length: 24
 00:00:01.061038 eth0  Out IP 10.0.35.2.59307 > 10.0.35.3.3784: BFDv1, Control, State Up, Flags: [none], length: 24
 00:00:01.064242 eth0  In  IP 10.0.35.3.48498 > 10.0.35.2.3784: BFDv1, Control, State Up, Flags: [none], length: 24
 00:00:01.065483 eth2  Out IP 10.0.23.3.59324 > 10.0.23.2.3784: BFDv1, Control, State Up, Flags: [none], length: 24
 00:00:01.092970 eth2  In  IP 10.0.23.2.41179 > 10.0.23.3.3784: BFDv1, Control, State Up, Flags: [none], length: 24
 00:00:01.094220 eth3  In  IP 10.0.34.3.59763 > 10.0.34.2.3784: BFDv1, Control, State Up, Flags: [none], length: 24
 00:00:01.099381 eth3  Out IP 10.0.34.2.53716 > 10.0.34.3.3784: BFDv1, Control, State Up, Flags: [none], length: 24
 00:00:01.121436 eth1  In  IP 10.0.13.2.32837 > 10.0.13.3.3784: BFDv1, Control, State Up, Flags: [none], length: 24
 00:00:01.139677 eth1  Out IP 10.0.13.3.42552 > 10.0.13.2.3784: BFDv1, Control, State Up, Flags: [none], length: 24
 00:00:01.142924 eth0  Out IP 10.0.35.2.59307 > 10.0.35.3.3784: BFDv1, Control, State Up, Flags: [none], length: 24
 00:00:01.147108 eth2  Out IP 10.0.23.3.59324 > 10.0.23.2.3784: BFDv1, Control, State Up, Flags: [none], length: 24
 00:00:01.147124 eth0  In  IP 10.0.35.3.48498 > 10.0.35.2.3784: BFDv1, Control, State Up, Flags: [none], length: 24
 00:00:01.176269 eth3  Out IP 10.0.34.2.53716 > 10.0.34.3.3784: BFDv1, Control, State Up, Flags: [none], length: 24
 00:00:01.177618 eth2  In  IP 10.0.23.2.41179 > 10.0.23.3.3784: BFDv1, Control, State Up, Flags: [none], length: 24
 00:00:01.178448 eth3  In  IP 10.0.34.3.59763 > 10.0.34.2.3784: BFDv1, Control, State Up, Flags: [none], length: 24
 00:00:01.205893 eth1  In  IP 10.0.13.2.32837 > 10.0.13.3.3784: BFDv1, Control, State Up, Flags: [none], length: 24
 00:00:01.216084 eth1  Out IP 10.0.13.3.42552 > 10.0.13.2.3784: BFDv1, Control, State Up, Flags: [none], length: 24
 00:00:01.220234 eth0  Out IP 10.0.35.2.59307 > 10.0.35.3.3784: BFDv1, Control, State Up, Flags: [none], length: 24
 00:00:01.225360 eth2  Out IP 10.0.23.3.59324 > 10.0.23.2.3784: BFDv1, Control, State Up, Flags: [none], length: 24
 00:00:01.230458 eth0  In  IP 10.0.35.3.48498 > 10.0.35.2.3784: BFDv1, Control, State Up, Flags: [none], length: 24
 00:00:01.252641 eth3  Out IP 10.0.34.2.53716 > 10.0.34.3.3784: BFDv1, Control, State Up, Flags: [none], length: 24
 00:00:01.256192 eth2  In  IP 10.0.23.2.41179 > 10.0.23.3.3784: BFDv1, Control, State Up, Flags: [none], length: 24
 00:00:01.265934 eth3  In  IP 10.0.34.3.59763 > 10.0.34.2.3784: BFDv1, Control, State Up, Flags: [none], length: 24
 00:00:01.291653 eth1  In  IP 10.0.13.2.32837 > 10.0.13.3.3784: BFDv1, Control, State Up, Flags: [none], length: 24
 00:00:01.294904 eth1  Out IP 10.0.13.3.42552 > 10.0.13.2.3784: BFDv1, Control, State Up, Flags: [none], length: 24
 00:00:01.303097 eth0  Out IP 10.0.35.2.59307 > 10.0.35.3.3784: BFDv1, Control, State Up, Flags: [none], length: 24
 00:00:01.313430 eth0  In  IP 10.0.35.3.48498 > 10.0.35.2.3784: BFDv1, Control, State Up, Flags: [none], length: 24
 00:00:01.315607 eth2  Out IP 10.0.23.3.59324 > 10.0.23.2.3784: BFDv1, Control, State Up, Flags: [none], length: 24
 00:00:01.333832 eth3  Out IP 10.0.34.2.53716 > 10.0.34.3.3784: BFDv1, Control, State Up, Flags: [none], length: 24
 00:00:01.341270 eth2  In  IP 10.0.23.2.41179 > 10.0.23.3.3784: BFDv1, Control, State Up, Flags: [none], length: 24
 00:00:01.353369 eth3  In  IP 10.0.34.3.59763 > 10.0.34.2.3784: BFDv1, Control, State Up, Flags: [none], length: 24
 00:00:01.378573 eth1  Out IP 10.0.13.3.42552 > 10.0.13.2.3784: BFDv1, Control, State Up, Flags: [none], length: 24
 00:00:01.378683 eth1  In  IP 10.0.13.2.32837 > 10.0.13.3.3784: BFDv1, Control, State Up, Flags: [none], length: 24
 00:00:01.384861 eth0  Out IP 10.0.35.2.59307 > 10.0.35.3.3784: BFDv1, Control, State Up, Flags: [none], length: 24
 00:00:01.389089 eth0  In  IP 10.0.35.3.48498 > 10.0.35.2.3784: BFDv1, Control, State Up, Flags: [none], length: 24
 00:00:01.392347 eth2  Out IP 10.0.23.3.59324 > 10.0.23.2.3784: BFDv1, Control, State Up, Flags: [none], length: 24
 00:00:01.419495 eth3  Out IP 10.0.34.2.53716 > 10.0.34.3.3784: BFDv1, Control, State Up, Flags: [none], length: 24
 00:00:01.429824 eth2  In  IP 10.0.23.2.41179 > 10.0.23.3.3784: BFDv1, Control, State Up, Flags: [none], length: 24
 00:00:01.440777 eth3  In  IP 10.0.34.3.59763 > 10.0.34.2.3784: BFDv1, Control, State Up, Flags: [none], length: 24
 00:00:01.458265 eth1  In  IP 10.0.13.2.32837 > 10.0.13.3.3784: BFDv1, Control, State Up, Flags: [none], length: 24
 00:00:01.460443 eth1  Out IP 10.0.13.3.42552 > 10.0.13.2.3784: BFDv1, Control, State Up, Flags: [none], length: 24
 00:00:01.467602 eth0  Out IP 10.0.35.2.59307 > 10.0.35.3.3784: BFDv1, Control, State Up, Flags: [none], length: 24
 00:00:01.469818 eth0  In  IP 10.0.35.3.48498 > 10.0.35.2.3784: BFDv1, Control, State Up, Flags: [none], length: 24
 00:00:01.469823 eth2  Out IP 10.0.23.3.59324 > 10.0.23.2.3784: BFDv1, Control, State Up, Flags: [none], length: 24
 00:00:01.508028 eth3  Out IP 10.0.34.2.53716 > 10.0.34.3.3784: BFDv1, Control, State Up, Flags: [none], length: 24
 00:00:01.517452 eth2  In  IP 10.0.23.2.41179 > 10.0.23.3.3784: BFDv1, Control, State Up, Flags: [none], length: 24
 00:00:01.525857 eth3  In  IP 10.0.34.3.59763 > 10.0.34.2.3784: BFDv1, Control, State Up, Flags: [none], length: 24
 00:00:01.542077 eth1  Out IP 10.0.13.3.42552 > 10.0.13.2.3784: BFDv1, Control, State Up, Flags: [none], length: 24
 00:00:01.543262 eth1  In  IP 10.0.13.2.32837 > 10.0.13.3.3784: BFDv1, Control, State Up, Flags: [none], length: 24
 00:00:01.545051 eth0  In  IP 10.0.35.3.48498 > 10.0.35.2.3784: BFDv1, Control, State Up, Flags: [none], length: 24
 00:00:01.548240 eth2  Out IP 10.0.23.3.59324 > 10.0.23.2.3784: BFDv1, Control, State Up, Flags: [none], length: 24
 00:00:01.553405 eth0  Out IP 10.0.35.2.59307 > 10.0.35.3.3784: BFDv1, Control, State Up, Flags: [none], length: 24
 00:00:01.584573 eth3  Out IP 10.0.34.2.53716 > 10.0.34.3.3784: BFDv1, Control, State Up, Flags: [none], length: 24
 00:00:01.597865 eth2  In  IP 10.0.23.2.41179 > 10.0.23.3.3784: BFDv1, Control, State Up, Flags: [none], length: 24
 00:00:01.601922 eth3  In  IP 10.0.34.3.59763 > 10.0.34.2.3784: BFDv1, Control, State Up, Flags: [none], length: 24
 00:00:01.621137 eth1  Out IP 10.0.13.3.42552 > 10.0.13.2.3784: BFDv1, Control, State Up, Flags: [none], length: 24
 00:00:01.623367 eth1  In  IP 10.0.13.2.32837 > 10.0.13.3.3784: BFDv1, Control, State Up, Flags: [none], length: 24
 00:00:01.634969 eth0  In  IP 10.0.35.3.48498 > 10.0.35.2.3784: BFDv1, Control, State Up, Flags: [none], length: 24
 00:00:01.635055 eth0  Out IP 10.0.35.2.59307 > 10.0.35.3.3784: BFDv1, Control, State Up, Flags: [none], length: 24
 00:00:01.637178 eth2  Out IP 10.0.23.3.59324 > 10.0.23.2.3784: BFDv1, Control, State Up, Flags: [none], length: 24
 00:00:01.661324 eth3  Out IP 10.0.34.2.53716 > 10.0.34.3.3784: BFDv1, Control, State Up, Flags: [none], length: 24
 00:00:01.676664 eth2  In  IP 10.0.23.2.41179 > 10.0.23.3.3784: BFDv1, Control, State Up, Flags: [none], length: 24
 00:00:01.678452 eth3  In  IP 10.0.34.3.59763 > 10.0.34.2.3784: BFDv1, Control, State Up, Flags: [none], length: 24
 00:00:01.707682 eth1  Out IP 10.0.13.3.42552 > 10.0.13.2.3784: BFDv1, Control, State Up, Flags: [none], length: 24
 00:00:01.710859 eth1  In  IP 10.0.13.2.32837 > 10.0.13.3.3784: BFDv1, Control, State Up, Flags: [none], length: 24
 00:00:01.720727 eth0  In  IP 10.0.35.3.48498 > 10.0.35.2.3784: BFDv1, Control, State Up, Flags: [none], length: 24
 00:00:01.720877 eth2  Out IP 10.0.23.3.59324 > 10.0.23.2.3784: BFDv1, Control, State Up, Flags: [none], length: 24
 00:00:01.723031 eth0  Out IP 10.0.35.2.59307 > 10.0.35.3.3784: BFDv1, Control, State Up, Flags: [none], length: 24
 00:00:01.742209 eth3  Out IP 10.0.34.2.53716 > 10.0.34.3.3784: BFDv1, Control, State Up, Flags: [none], length: 24
 00:00:01.754042 eth2  In  IP 10.0.23.2.41179 > 10.0.23.3.3784: BFDv1, Control, State Up, Flags: [none], length: 24
 00:00:01.756068 eth3  In  IP 10.0.34.3.59763 > 10.0.34.2.3784: BFDv1, Control, State Up, Flags: [none], length: 24
 00:00:01.787231 eth1  Out IP 10.0.13.3.42552 > 10.0.13.2.3784: BFDv1, Control, State Up, Flags: [none], length: 24
 00:00:01.795402 eth1  In  IP 10.0.13.2.32837 > 10.0.13.3.3784: BFDv1, Control, State Up, Flags: [none], length: 24
 00:00:01.797614 eth2  Out IP 10.0.23.3.59324 > 10.0.23.2.3784: BFDv1, Control, State Up, Flags: [none], length: 24
 00:00:01.804584 eth0  In  IP 10.0.35.3.48498 > 10.0.35.2.3784: BFDv1, Control, State Up, Flags: [none], length: 24
 00:00:01.806814 eth0  Out IP 10.0.35.2.59307 > 10.0.35.3.3784: BFDv1, Control, State Up, Flags: [none], length: 24
 00:00:01.824022 eth3  Out IP 10.0.34.2.53716 > 10.0.34.3.3784: BFDv1, Control, State Up, Flags: [none], length: 24
 00:00:01.833566 eth2  In  IP 10.0.23.2.41179 > 10.0.23.3.3784: BFDv1, Control, State Up, Flags: [none], length: 24
 00:00:01.837552 eth3  In  IP 10.0.34.3.59763 > 10.0.34.2.3784: BFDv1, Control, State Up, Flags: [none], length: 24
 00:00:01.865771 eth1  Out IP 10.0.13.3.42552 > 10.0.13.2.3784: BFDv1, Control, State Up, Flags: [none], length: 24
 00:00:01.883012 eth2  Out IP 10.0.23.3.59324 > 10.0.23.2.3784: BFDv1, Control, State Up, Flags: [none], length: 24
 00:00:01.885258 eth1  In  IP 10.0.13.2.32837 > 10.0.13.3.3784: BFDv1, Control, State Up, Flags: [none], length: 24
 00:00:01.888454 eth0  Out IP 10.0.35.2.59307 > 10.0.35.3.3784: BFDv1, Control, State Up, Flags: [none], length: 24
 00:00:01.890624 eth0  In  IP 10.0.35.3.48498 > 10.0.35.2.3784: BFDv1, Control, State Up, Flags: [none], length: 24
 00:00:01.904802 eth3  Out IP 10.0.34.2.53716 > 10.0.34.3.3784: BFDv1, Control, State Up, Flags: [none], length: 24
 00:00:01.915530 eth2  In  IP 10.0.23.2.41179 > 10.0.23.3.3784: BFDv1, Control, State Up, Flags: [none], length: 24
 00:00:01.916128 eth3  In  IP 10.0.34.3.59763 > 10.0.34.2.3784: BFDv1, Control, State Up, Flags: [none], length: 24
 00:00:01.944321 eth1  Out IP 10.0.13.3.42552 > 10.0.13.2.3784: BFDv1, Control, State Up, Flags: [none], length: 24
 00:00:01.964472 eth2  Out IP 10.0.23.3.59324 > 10.0.23.2.3784: BFDv1, Control, State Up, Flags: [none], length: 24
 00:00:01.964803 eth1  In  IP 10.0.13.2.32837 > 10.0.13.3.3784: BFDv1, Control, State Up, Flags: [none], length: 24
 00:00:01.970106 eth0  In  IP 10.0.35.3.48498 > 10.0.35.2.3784: BFDv1, Control, State Up, Flags: [none], length: 24
 00:00:01.976385 eth0  Out IP 10.0.35.2.59307 > 10.0.35.3.3784: BFDv1, Control, State Up, Flags: [none], length: 24
 00:00:01.991578 eth3  Out IP 10.0.34.2.53716 > 10.0.34.3.3784: BFDv1, Control, State Up, Flags: [none], length: 24
 00:00:01.996006 eth2  In  IP 10.0.23.2.41179 > 10.0.23.3.3784: BFDv1, Control, State Up, Flags: [none], length: 24
 00:00:02.005012 eth3  In  IP 10.0.34.3.59763 > 10.0.34.2.3784: BFDv1, Control, State Up, Flags: [none], length: 24
 00:00:02.032153 eth1  Out IP 10.0.13.3.42552 > 10.0.13.2.3784: BFDv1, Control, State Up, Flags: [none], length: 24
 00:00:02.049315 eth1  In  IP 10.0.13.2.32837 > 10.0.13.3.3784: BFDv1, Control, State Up, Flags: [none], length: 24
 00:00:02.049712 eth0  In  IP 10.0.35.3.48498 > 10.0.35.2.3784: BFDv1, Control, State Up, Flags: [none], length: 24
 00:00:02.053921 eth2  Out IP 10.0.23.3.59324 > 10.0.23.2.3784: BFDv1, Control, State Up, Flags: [none], length: 24
 00:00:02.058097 eth0  Out IP 10.0.35.2.59307 > 10.0.35.3.3784: BFDv1, Control, State Up, Flags: [none], length: 24
 00:00:02.075312 eth2  In  IP 10.0.23.2.41179 > 10.0.23.3.3784: BFDv1, Control, State Up, Flags: [none], length: 24
 00:00:02.094741 eth3  In  IP 10.0.34.3.59763 > 10.0.34.2.3784: BFDv1, Control, State Up, Flags: [none], length: 24
 00:00:02.113931 eth1  Out IP 10.0.13.3.42552 > 10.0.13.2.3784: BFDv1, Control, State Up, Flags: [none], length: 24
 00:00:02.126459 eth0  In  IP 10.0.35.3.48498 > 10.0.35.2.3784: BFDv1, Control, State Up, Flags: [none], length: 24
 00:00:02.129102 eth1  In  IP 10.0.13.2.32837 > 10.0.13.3.3784: BFDv1, Control, State Up, Flags: [none], length: 24
 00:00:02.137302 eth0  Out IP 10.0.35.2.59307 > 10.0.35.3.3784: BFDv1, Control, State Up, Flags: [none], length: 24
 00:00:02.137354 eth2  Out IP 10.0.23.3.59324 > 10.0.23.2.3784: BFDv1, Control, State Up, Flags: [none], length: 24
 00:00:02.160249 eth2  In  IP 10.0.23.2.41179 > 10.0.23.3.3784: BFDv1, Control, State Up, Flags: [none], length: 24
 00:00:02.192465 eth1  Out IP 10.0.13.3.42552 > 10.0.13.2.3784: BFDv1, Control, State Up, Flags: [none], length: 24
 00:00:02.204650 eth0  In  IP 10.0.35.3.48498 > 10.0.35.2.3784: BFDv1, Control, State Up, Flags: [none], length: 24
 00:00:02.208827 eth1  In  IP 10.0.13.2.32837 > 10.0.13.3.3784: BFDv1, Control, State Up, Flags: [none], length: 24
 00:00:02.219070 eth0  Out IP 10.0.35.2.59307 > 10.0.35.3.3784: BFDv1, Control, State Up, Flags: [none], length: 24
 00:00:02.226232 eth2  Out IP 10.0.23.3.59324 > 10.0.23.2.3784: BFDv1, Control, State Up, Flags: [none], length: 24
 00:00:02.241953 eth2  In  IP 10.0.23.2.41179 > 10.0.23.3.3784: BFDv1, Control, State Up, Flags: [none], length: 24
 00:00:02.273195 eth1  Out IP 10.0.13.3.42552 > 10.0.13.2.3784: BFDv1, Control, State Up, Flags: [none], length: 24
 00:00:02.284014 eth0  In  IP 10.0.35.3.48498 > 10.0.35.2.3784: BFDv1, Control, State Up, Flags: [none], length: 24
 00:00:02.285605 eth1  In  IP 10.0.13.2.32837 > 10.0.13.3.3784: BFDv1, Control, State Up, Flags: [none], length: 24
 00:00:02.298871 eth0  Out IP 10.0.35.2.59307 > 10.0.35.3.3784: BFDv1, Control, State Up, Flags: [none], length: 24
 00:00:02.310096 eth2  Out IP 10.0.23.3.59324 > 10.0.23.2.3784: BFDv1, Control, State Up, Flags: [none], length: 24
 00:00:02.320315 eth2  In  IP 10.0.23.2.41179 > 10.0.23.3.3784: BFDv1, Control, State Up, Flags: [none], length: 24
 00:00:02.350547 eth1  Out IP 10.0.13.3.42552 > 10.0.13.2.3784: BFDv1, Control, State Up, Flags: [none], length: 24
 00:00:02.362455 eth0  In  IP 10.0.35.3.48498 > 10.0.35.2.3784: BFDv1, Control, State Up, Flags: [none], length: 24
 00:00:02.364969 eth1  In  IP 10.0.13.2.32837 > 10.0.13.3.3784: BFDv1, Control, State Up, Flags: [none], length: 24
 00:00:02.378161 eth0  Out IP 10.0.35.2.59307 > 10.0.35.3.3784: BFDv1, Control, State Up, Flags: [none], length: 24
 00:00:02.393379 eth2  Out IP 10.0.23.3.59324 > 10.0.23.2.3784: BFDv1, Control, State Up, Flags: [none], length: 24
 00:00:02.399714 eth2  In  IP 10.0.23.2.41179 > 10.0.23.3.3784: BFDv1, Control, State Up, Flags: [none], length: 24
 00:00:02.430955 eth1  Out IP 10.0.13.3.42552 > 10.0.13.2.3784: BFDv1, Control, State Up, Flags: [none], length: 24
 00:00:02.441763 eth0  In  IP 10.0.35.3.48498 > 10.0.35.2.3784: BFDv1, Control, State Up, Flags: [none], length: 24
 00:00:02.446303 eth1  In  IP 10.0.13.2.32837 > 10.0.13.3.3784: BFDv1, Control, State Up, Flags: [none], length: 24
 00:00:02.467540 eth0  Out IP 10.0.35.2.59307 > 10.0.35.3.3784: BFDv1, Control, State Up, Flags: [none], length: 24
 00:00:02.480692 eth2  Out IP 10.0.23.3.59324 > 10.0.23.2.3784: BFDv1, Control, State Up, Flags: [none], length: 24
 00:00:02.486024 eth2  In  IP 10.0.23.2.41179 > 10.0.23.3.3784: BFDv1, Control, State Up, Flags: [none], length: 24
 00:00:02.516288 eth1  Out IP 10.0.13.3.42552 > 10.0.13.2.3784: BFDv1, Control, State Up, Flags: [none], length: 24
 00:00:02.528150 eth0  In  IP 10.0.35.3.48498 > 10.0.35.2.3784: BFDv1, Control, State Up, Flags: [none], length: 24
 00:00:02.528689 eth1  In  IP 10.0.13.2.32837 > 10.0.13.3.3784: BFDv1, Control, State Up, Flags: [none], length: 24
 00:00:02.547924 eth0  Out IP 10.0.35.2.59307 > 10.0.35.3.3784: BFDv1, Control, State Up, Flags: [none], length: 24
 00:00:02.566897 eth2  In  IP 10.0.23.2.41179 > 10.0.23.3.3784: BFDv1, Control, State Up, Flags: [none], length: 24
 00:00:02.570082 eth2  Out IP 10.0.23.3.59324 > 10.0.23.2.3784: BFDv1, Control, State Up, Flags: [none], length: 24
 00:00:02.602544 eth1  Out IP 10.0.13.3.42552 > 10.0.13.2.3784: BFDv1, Control, State Up, Flags: [none], length: 24
 00:00:02.615910 eth0  In  IP 10.0.35.3.48498 > 10.0.35.2.3784: BFDv1, Control, State Up, Flags: [none], length: 24
 00:00:02.617180 eth1  In  IP 10.0.13.2.32837 > 10.0.13.3.3784: BFDv1, Control, State Up, Flags: [none], length: 24
 00:00:02.633387 eth0  Out IP 10.0.35.2.59307 > 10.0.35.3.3784: BFDv1, Control, State Up, Flags: [none], length: 24
 00:00:02.642117 eth2  In  IP 10.0.23.2.41179 > 10.0.23.3.3784: BFDv1, Control, State Up, Flags: [none], length: 24
 00:00:02.655349 eth2  Out IP 10.0.23.3.59324 > 10.0.23.2.3784: BFDv1, Control, State Up, Flags: [none], length: 24
 00:00:02.679527 eth1  Out IP 10.0.13.3.42552 > 10.0.13.2.3784: BFDv1, Control, State Up, Flags: [none], length: 24
 00:00:02.703719 eth0  In  IP 10.0.35.3.48498 > 10.0.35.2.3784: BFDv1, Control, State Up, Flags: [none], length: 24
 00:00:02.707042 eth1  In  IP 10.0.13.2.32837 > 10.0.13.3.3784: BFDv1, Control, State Up, Flags: [none], length: 24
 00:00:02.720896 eth2  In  IP 10.0.23.2.41179 > 10.0.23.3.3784: BFDv1, Control, State Up, Flags: [none], length: 24
 00:00:02.722118 eth0  Out IP 10.0.35.2.59307 > 10.0.35.3.3784: BFDv1, Control, State Up, Flags: [none], length: 24
 00:00:02.731279 eth2  Out IP 10.0.23.3.59324 > 10.0.23.2.3784: BFDv1, Control, State Up, Flags: [none], length: 24
 00:00:02.766439 eth1  Out IP 10.0.13.3.42552 > 10.0.13.2.3784: BFDv1, Control, State Up, Flags: [none], length: 24
 00:00:02.783411 eth0  In  IP 10.0.35.3.48498 > 10.0.35.2.3784: BFDv1, Control, State Up, Flags: [none], length: 24
 00:00:02.788783 eth1  In  IP 10.0.13.2.32837 > 10.0.13.3.3784: BFDv1, Control, State Up, Flags: [none], length: 24
 00:00:02.797987 eth0  Out IP 10.0.35.2.59307 > 10.0.35.3.3784: BFDv1, Control, State Up, Flags: [none], length: 24
 00:00:02.809916 eth2  In  IP 10.0.23.2.41179 > 10.0.23.3.3784: BFDv1, Control, State Up, Flags: [none], length: 24
 00:00:02.820142 eth2  Out IP 10.0.23.3.59324 > 10.0.23.2.3784: BFDv1, Control, State Up, Flags: [none], length: 24
 00:00:02.841313 eth1  Out IP 10.0.13.3.42552 > 10.0.13.2.3784: BFDv1, Control, State Up, Flags: [none], length: 24
 00:00:02.861744 eth0  In  IP 10.0.35.3.48498 > 10.0.35.2.3784: BFDv1, Control, State Up, Flags: [none], length: 24
 00:00:02.869810 eth1  In  IP 10.0.13.2.32837 > 10.0.13.3.3784: BFDv1, Control, State Up, Flags: [none], length: 24
 00:00:02.881020 eth0  Out IP 10.0.35.2.59307 > 10.0.35.3.3784: BFDv1, Control, State Up, Flags: [none], length: 24
 00:00:02.896066 eth2  In  IP 10.0.23.2.41179 > 10.0.23.3.3784: BFDv1, Control, State Up, Flags: [none], length: 24
 00:00:02.907271 eth2  Out IP 10.0.23.3.59324 > 10.0.23.2.3784: BFDv1, Control, State Up, Flags: [none], length: 24
 00:00:02.924439 eth1  Out IP 10.0.13.3.42552 > 10.0.13.2.3784: BFDv1, Control, State Up, Flags: [none], length: 24
 00:00:02.941214 eth0  In  IP 10.0.35.3.48498 > 10.0.35.2.3784: BFDv1, Control, State Up, Flags: [none], length: 24
 00:00:02.956121 eth1  In  IP 10.0.13.2.32837 > 10.0.13.3.3784: BFDv1, Control, State Up, Flags: [none], length: 24
 00:00:02.969336 eth0  Out IP 10.0.35.2.59307 > 10.0.35.3.3784: BFDv1, Control, State Up, Flags: [none], length: 24
 00:00:02.973904 eth2  In  IP 10.0.23.2.41179 > 10.0.23.3.3784: BFDv1, Control, State Up, Flags: [none], length: 24
 00:00:02.984092 eth2  Out IP 10.0.23.3.59324 > 10.0.23.2.3784: BFDv1, Control, State Up, Flags: [none], length: 24
 00:00:03.002241 eth1  Out IP 10.0.13.3.42552 > 10.0.13.2.3784: BFDv1, Control, State Up, Flags: [none], length: 24
 00:00:03.029648 eth0  In  IP 10.0.35.3.48498 > 10.0.35.2.3784: BFDv1, Control, State Up, Flags: [none], length: 24
 00:00:03.031721 eth1  In  IP 10.0.13.2.32837 > 10.0.13.3.3784: BFDv1, Control, State Up, Flags: [none], length: 24
 00:00:03.051829 eth2  In  IP 10.0.23.2.41179 > 10.0.23.3.3784: BFDv1, Control, State Up, Flags: [none], length: 24
 00:00:03.059093 eth0  Out IP 10.0.35.2.59307 > 10.0.35.3.3784: BFDv1, Control, State Up, Flags: [none], length: 24
 00:00:03.063266 eth2  Out IP 10.0.23.3.59324 > 10.0.23.2.3784: BFDv1, Control, State Up, Flags: [none], length: 24
 00:00:03.083446 eth1  Out IP 10.0.13.3.42552 > 10.0.13.2.3784: BFDv1, Control, State Up, Flags: [none], length: 24
 00:00:03.115353 eth1  In  IP 10.0.13.2.32837 > 10.0.13.3.3784: BFDv1, Control, State Up, Flags: [none], length: 24
 00:00:03.120343 eth0  In  IP 10.0.35.3.48498 > 10.0.35.2.3784: BFDv1, Control, State Up, Flags: [none], length: 24
 00:00:03.129216 eth2  In  IP 10.0.23.2.41179 > 10.0.23.3.3784: BFDv1, Control, State Up, Flags: [none], length: 24
 00:00:03.140424 eth0  Out IP 10.0.35.2.59307 > 10.0.35.3.3784: BFDv1, Control, State Up, Flags: [none], length: 24
 00:00:03.149594 eth2  Out IP 10.0.23.3.59324 > 10.0.23.2.3784: BFDv1, Control, State Up, Flags: [none], length: 24
 00:00:03.168887 eth1  Out IP 10.0.13.3.42552 > 10.0.13.2.3784: BFDv1, Control, State Up, Flags: [none], length: 24
 00:00:03.199407 eth1  In  IP 10.0.13.2.32837 > 10.0.13.3.3784: BFDv1, Control, State Up, Flags: [none], length: 24
 00:00:03.207732 eth0  In  IP 10.0.35.3.48498 > 10.0.35.2.3784: BFDv1, Control, State Up, Flags: [none], length: 24
 00:00:03.212206 eth2  In  IP 10.0.23.2.41179 > 10.0.23.3.3784: BFDv1, Control, State Up, Flags: [none], length: 24
 00:00:03.222434 eth0  Out IP 10.0.35.2.59307 > 10.0.35.3.3784: BFDv1, Control, State Up, Flags: [none], length: 24
 00:00:03.234608 eth2  Out IP 10.0.23.3.59324 > 10.0.23.2.3784: BFDv1, Control, State Up, Flags: [none], length: 24
 00:00:03.246796 eth1  Out IP 10.0.13.3.42552 > 10.0.13.2.3784: BFDv1, Control, State Up, Flags: [none], length: 24
 00:00:03.277092 eth1  In  IP 10.0.13.2.32837 > 10.0.13.3.3784: BFDv1, Control, State Up, Flags: [none], length: 24
 00:00:03.286255 eth0  In  IP 10.0.35.3.48498 > 10.0.35.2.3784: BFDv1, Control, State Up, Flags: [none], length: 24
 00:00:03.290202 eth2  In  IP 10.0.23.2.41179 > 10.0.23.3.3784: BFDv1, Control, State Up, Flags: [none], length: 24
 00:00:03.299449 eth0  Out IP 10.0.35.2.59307 > 10.0.35.3.3784: BFDv1, Control, State Up, Flags: [none], length: 24
 00:00:03.321637 eth1  Out IP 10.0.13.3.42552 > 10.0.13.2.3784: BFDv1, Control, State Up, Flags: [none], length: 24
 00:00:03.323834 eth2  Out IP 10.0.23.3.59324 > 10.0.23.2.3784: BFDv1, Control, State Up, Flags: [none], length: 24
 00:00:03.354204 eth1  In  IP 10.0.13.2.32837 > 10.0.13.3.3784: BFDv1, Control, State Up, Flags: [none], length: 24
 00:00:03.366499 eth0  In  IP 10.0.35.3.48498 > 10.0.35.2.3784: BFDv1, Control, State Up, Flags: [none], length: 24
 00:00:03.374708 eth0  Out IP 10.0.35.2.59307 > 10.0.35.3.3784: BFDv1, Control, State Up, Flags: [none], length: 24
 00:00:03.375459 eth2  In  IP 10.0.23.2.41179 > 10.0.23.3.3784: BFDv1, Control, State Up, Flags: [none], length: 24
 00:00:03.407673 eth1  Out IP 10.0.13.3.42552 > 10.0.13.2.3784: BFDv1, Control, State Up, Flags: [none], length: 24
 00:00:03.409837 eth2  Out IP 10.0.23.3.59324 > 10.0.23.2.3784: BFDv1, Control, State Up, Flags: [none], length: 24
 00:00:03.443534 eth1  In  IP 10.0.13.2.32837 > 10.0.13.3.3784: BFDv1, Control, State Up, Flags: [none], length: 24
 00:00:03.452321 eth0  In  IP 10.0.35.3.48498 > 10.0.35.2.3784: BFDv1, Control, State Up, Flags: [none], length: 24
 00:00:03.455253 eth2  In  IP 10.0.23.2.41179 > 10.0.23.3.3784: BFDv1, Control, State Up, Flags: [none], length: 24
 00:00:03.460474 eth0  Out IP 10.0.35.2.59307 > 10.0.35.3.3784: BFDv1, Control, State Up, Flags: [none], length: 24
 00:00:03.486669 eth1  Out IP 10.0.13.3.42552 > 10.0.13.2.3784: BFDv1, Control, State Up, Flags: [none], length: 24
 00:00:03.491910 eth2  Out IP 10.0.23.3.59324 > 10.0.23.2.3784: BFDv1, Control, State Up, Flags: [none], length: 24
 00:00:03.521212 eth1  In  IP 10.0.13.2.32837 > 10.0.13.3.3784: BFDv1, Control, State Up, Flags: [none], length: 24
 00:00:03.540090 eth0  In  IP 10.0.35.3.48498 > 10.0.35.2.3784: BFDv1, Control, State Up, Flags: [none], length: 24
 00:00:03.541239 eth2  In  IP 10.0.23.2.41179 > 10.0.23.3.3784: BFDv1, Control, State Up, Flags: [none], length: 24
 00:00:03.548486 eth0  Out IP 10.0.35.2.59307 > 10.0.35.3.3784: BFDv1, Control, State Up, Flags: [none], length: 24
 00:00:03.563671 eth1  Out IP 10.0.13.3.42552 > 10.0.13.2.3784: BFDv1, Control, State Up, Flags: [none], length: 24
 00:00:03.573887 eth2  Out IP 10.0.23.3.59324 > 10.0.23.2.3784: BFDv1, Control, State Up, Flags: [none], length: 24
 00:00:03.597551 eth1  In  IP 10.0.13.2.32837 > 10.0.13.3.3784: BFDv1, Control, State Up, Flags: [none], length: 24
 00:00:03.623142 eth2  In  IP 10.0.23.2.41179 > 10.0.23.3.3784: BFDv1, Control, State Up, Flags: [none], length: 24
 00:00:03.630329 eth0  In  IP 10.0.35.3.48498 > 10.0.35.2.3784: BFDv1, Control, State Up, Flags: [none], length: 24
 00:00:03.632529 eth0  Out IP 10.0.35.2.59307 > 10.0.35.3.3784: BFDv1, Control, State Up, Flags: [none], length: 24
 00:00:03.641651 eth1  Out IP 10.0.13.3.42552 > 10.0.13.2.3784: BFDv1, Control, State Up, Flags: [none], length: 24
 00:00:03.654815 eth2  Out IP 10.0.23.3.59324 > 10.0.23.2.3784: BFDv1, Control, State Up, Flags: [none], length: 24
 00:00:03.678045 eth1  In  IP 10.0.13.2.32837 > 10.0.13.3.3784: BFDv1, Control, State Up, Flags: [none], length: 24
 00:00:03.702063 eth2  In  IP 10.0.23.2.41179 > 10.0.23.3.3784: BFDv1, Control, State Up, Flags: [none], length: 24
 00:00:03.714781 eth0  In  IP 10.0.35.3.48498 > 10.0.35.2.3784: BFDv1, Control, State Up, Flags: [none], length: 24
 00:00:03.716963 eth0  Out IP 10.0.35.2.59307 > 10.0.35.3.3784: BFDv1, Control, State Up, Flags: [none], length: 24
 00:00:03.727109 eth1  Out IP 10.0.13.3.42552 > 10.0.13.2.3784: BFDv1, Control, State Up, Flags: [none], length: 24
 00:00:03.732266 eth2  Out IP 10.0.23.3.59324 > 10.0.23.2.3784: BFDv1, Control, State Up, Flags: [none], length: 24
 00:00:03.758923 eth1  In  IP 10.0.13.2.32837 > 10.0.13.3.3784: BFDv1, Control, State Up, Flags: [none], length: 24
 00:00:03.782151 eth2  In  IP 10.0.23.2.41179 > 10.0.23.3.3784: BFDv1, Control, State Up, Flags: [none], length: 24
 00:00:03.793371 eth0  Out IP 10.0.35.2.59307 > 10.0.35.3.3784: BFDv1, Control, State Up, Flags: [none], length: 24
 00:00:03.803574 eth0  In  IP 10.0.35.3.48498 > 10.0.35.2.3784: BFDv1, Control, State Up, Flags: [none], length: 24
 00:00:03.810770 eth2  Out IP 10.0.23.3.59324 > 10.0.23.2.3784: BFDv1, Control, State Up, Flags: [none], length: 24
 00:00:03.810814 eth1  Out IP 10.0.13.3.42552 > 10.0.13.2.3784: BFDv1, Control, State Up, Flags: [none], length: 24
 00:00:03.848294 eth1  In  IP 10.0.13.2.32837 > 10.0.13.3.3784: BFDv1, Control, State Up, Flags: [none], length: 24
 00:00:03.859337 eth2  In  IP 10.0.23.2.41179 > 10.0.23.3.3784: BFDv1, Control, State Up, Flags: [none], length: 24
 00:00:03.872533 eth0  Out IP 10.0.35.2.59307 > 10.0.35.3.3784: BFDv1, Control, State Up, Flags: [none], length: 24
 00:00:03.879745 eth0  In  IP 10.0.35.3.48498 > 10.0.35.2.3784: BFDv1, Control, State Up, Flags: [none], length: 24
 00:00:03.893015 eth2  Out IP 10.0.23.3.59324 > 10.0.23.2.3784: BFDv1, Control, State Up, Flags: [none], length: 24
 00:00:03.894173 eth1  Out IP 10.0.13.3.42552 > 10.0.13.2.3784: BFDv1, Control, State Up, Flags: [none], length: 24
 00:00:03.932121 eth1  In  IP 10.0.13.2.32837 > 10.0.13.3.3784: BFDv1, Control, State Up, Flags: [none], length: 24
 00:00:03.943004 eth2  In  IP 10.0.23.2.41179 > 10.0.23.3.3784: BFDv1, Control, State Up, Flags: [none], length: 24
 00:00:03.957235 eth0  Out IP 10.0.35.2.59307 > 10.0.35.3.3784: BFDv1, Control, State Up, Flags: [none], length: 24
 00:00:03.957245 eth0  In  IP 10.0.35.3.48498 > 10.0.35.2.3784: BFDv1, Control, State Up, Flags: [none], length: 24
 00:00:03.973409 eth1  Out IP 10.0.13.3.42552 > 10.0.13.2.3784: BFDv1, Control, State Up, Flags: [none], length: 24
 00:00:03.983572 eth2  Out IP 10.0.23.3.59324 > 10.0.23.2.3784: BFDv1, Control, State Up, Flags: [none], length: 24
 00:00:04.019776 eth1  In  IP 10.0.13.2.32837 > 10.0.13.3.3784: BFDv1, Control, State Up, Flags: [none], length: 24
 00:00:04.024691 eth2  In  IP 10.0.23.2.41179 > 10.0.23.3.3784: BFDv1, Control, State Up, Flags: [none], length: 24
