tcpdump: data link type LINUX_SLL2
tcpdump: verbose output suppressed, use -v[v]... for full protocol decode
listening on any, link-type LINUX_SLL2 (Linux cooked v2), snapshot length 262144 bytes
 00:00:00.000000 eth2  Out IP 10.0.34.2.38291 > 10.0.34.3.3784: BFDv1, Control, State Up, Flags: [none], length: 24
 00:00:00.001330 eth0  Out IP 10.0.13.3.41618 > 10.0.13.2.3784: BFDv1, Control, State Up, Flags: [none], length: 24
 00:00:00.011631 eth3  In  IP 10.0.35.3.46520 > 10.0.35.2.3784: BFDv1, Control, State Up, Flags: [none], length: 24
 00:00:00.014693 eth1  In  IP 10.0.23.2.57325 > 10.0.23.3.3784: BFDv1, Control, State Up, Flags: [none], length: 24
 00:00:00.019838 eth2  In  IP 10.0.34.3.57520 > 10.0.34.2.3784: BFDv1, Control, State Up, Flags: [none], length: 24
 00:00:00.023194 eth3  Out IP 10.0.35.2.60297 > 10.0.35.3.3784: BFDv1, Control, State Up, Flags: [none], length: 24
 00:00:00.026495 eth0  In  IP 10.0.13.2.57029 > 10.0.13.3.3784: BFDv1, Control, State Up, Flags: [none], length: 24
 00:00:00.028815 eth1  Out IP 10.0.23.3.33242 > 10.0.23.2.3784: BFDv1, Control, State Up, Flags: [none], length: 24
 00:00:00.077105 eth0  Out IP 10.0.13.3.41618 > 10.0.13.2.3784: BFDv1, Control, State Up, Flags: [none], length: 24
 00:00:00.086379 eth2  Out IP 10.0.34.2.38291 > 10.0.34.3.3784: BFDv1, Control, State Up, Flags: [none], length: 24
 00:00:00.098948 eth3  In  IP 10.0.35.3.46520 > 10.0.35.2.3784: BFDv1, Control, State Up, Flags: [none], length: 24
 00:00:00.103524 eth1  In  IP 10.0.23.2.57325 > 10.0.23.3.3784: BFDv1, Control, State Up, Flags: [none], length: 24
 00:00:00.106836 eth3  Out IP 10.0.35.2.60297 > 10.0.35.3.3784: BFDv1, Control, State Up, Flags: [none], length: 24
 00:00:00.107821 eth2  In  IP 10.0.34.3.57520 > 10.0.34.2.3784: BFDv1, Control, State Up, Flags: [none], length: 24
 00:00:00.110693 eth0  In  IP 10.0.13.2.57029 > 10.0.13.3.3784: BFDv1, Control, State Up, Flags: [none], length: 24
 00:00:00.115042 eth1  Out IP 10.0.23.3.33242 > 10.0.23.2.3784: BFDv1, Control, State Up, Flags: [none], length: 24
 00:00:00.155306 eth0  Out IP 10.0.13.3.41618 > 10.0.13.2.3784: BFDv1, Control, State Up, Flags: [none], length: 24
 00:00:00.173595 eth2  Out IP 10.0.34.2.38291 > 10.0.34.3.3784: BFDv1, Control, State Up, Flags: [none], length: 24
 00:00:00.182633 eth3  In  IP 10.0.35.3.46520 > 10.0.35.2.3784: BFDv1, Control, State Up, Flags: [none], length: 24
 00:00:00.184499 eth1  In  IP 10.0.23.2.57325 > 10.0.23.3.3784: BFDv1, Control, State Up, Flags: [none], length: 24
 00:00:00.193208 eth2  In  IP 10.0.34.3.57520 > 10.0.34.2.3784: BFDv1, Control, State Up, Flags: [none], length: 24
 00:00:00.195429 eth3  Out IP 10.0.35.2.60297 > 10.0.35.3.3784: BFDv1, Control, State Up, Flags: [none], length: 24
 00:00:00.199197 eth0  In  IP 10.0.13.2.57029 > 10.0.13.3.3784: BFDv1, Control, State Up, Flags: [none], length: 24
 00:00:00.200373 eth1  Out IP 10.0.23.3.33242 > 10.0.23.2.3784: BFDv1, Control, State Up, Flags: [none], length: 24
 00:00:00.233599 eth0  Out IP 10.0.13.3.41618 > 10.0.13.2.3784: BFDv1, Control, State Up, Flags: [none], length: 24
 00:00:00.257825 eth2  Out IP 10.0.34.2.38291 > 10.0.34.3.3784: BFDv1, Control, State Up, Flags: [none], length: 24
 00:00:00.267478 eth3  In  IP 10.0.35.3.46520 > 10.0.35.2.3784: BFDv1, Control, State Up, Flags: [none], length: 24
 00:00:00.270516 eth1  In  IP 10.0.23.2.57325 > 10.0.23.3.3784: BFDv1, Control, State Up, Flags: [none], length: 24
 00:00:00.275695 eth0  In  IP 10.0.13.2.57029 > 10.0.13.3.3784: BFDv1, Control, State Up, Flags: [none], length: 24
 00:00:00.275959 eth2  In  IP 10.0.34.3.57520 > 10.0.34.2.3784: BFDv1, Control, State Up, Flags: [none], length: 24
 00:00:00.280338 eth3  Out IP 10.0.35.2.60297 > 10.0.35.3.3784: BFDv1, Control, State Up, Flags: [none], length: 24
 00:00:00.289662 eth1  Out IP 10.0.23.3.33242 > 10.0.23.2.3784: BFDv1, Control, State Up, Flags: [none], length: 24
 00:00:00.310899 eth0  Out IP 10.0.13.3.41618 > 10.0.13.2.3784: BFDv1, Control, State Up, Flags: [none], length: 24
 00:00:00.341344 eth2  Out IP 10.0.34.2.38291 > 10.0.34.3.3784: BFDv1, Control, State Up, Flags: [none], length: 24
 00:00:00.343169 eth3  In  IP 10.0.35.3.46520 > 10.0.35.2.3784: BFDv1, Control, State Up, Flags: [none], length: 24
 00:00:00.352743 eth0  In  IP 10.0.13.2.57029 > 10.0.13.3.3784: BFDv1, Control, State Up, Flags: [none], length: 24
 00:00:00.352935 eth2  In  IP 10.0.34.3.57520 > 10.0.34.2.3784: BFDv1, Control, State Up, Flags: [none], length: 24
 00:00:00.358335 eth1  In  IP 10.0.23.2.57325 > 10.0.23.3.3784: BFDv1, Control, State Up, Flags: [none], length: 24
 00:00:00.363614 eth3  Out IP 10.0.35.2.60297 > 10.0.35.3.3784: BFDv1, Control, State Up, Flags: [none], length: 24
 00:00:00.376833 eth1  Out IP 10.0.23.3.33242 > 10.0.23.2.3784: BFDv1, Control, State Up, Flags: [none], length: 24
 00:00:00.396049 eth0  Out IP 10.0.13.3.41618 > 10.0.13.2.3784: BFDv1, Control, State Up, Flags: [none], length: 24
 00:00:00.425286 eth2  Out IP 10.0.34.2.38291 > 10.0.34.3.3784: BFDv1, Control, State Up, Flags: [none], length: 24
 00:00:00.428757 eth3  In  IP 10.0.35.3.46520 > 10.0.35.2.3784: BFDv1, Control, State Up, Flags: [none], length: 24
 00:00:00.433525 eth1  In  IP 10.0.23.2.57325 > 10.0.23.3.3784: BFDv1, Control, State Up, Flags: [none], length: 24
 00:00:00.437152 eth0  In  IP 10.0.13.2.57029 > 10.0.13.3.3784: BFDv1, Control, State Up, Flags: [none], length: 24
 00:00:00.438491 eth3  Out IP 10.0.35.2.60297 > 10.0.35.3.3784: BFDv1, Control, State Up, Flags: [none], length: 24
 00:00:00.438653 eth2  In  IP 10.0.34.3.57520 > 10.0.34.2.3784: BFDv1, Control, State Up, Flags: [none], length: 24
 00:00:00.463995 eth1  Out IP 10.0.23.3.33242 > 10.0.23.2.3784: BFDv1, Control, State Up, Flags: [none], length: 24
 00:00:00.475387 eth0  Out IP 10.0.13.3.41618 > 10.0.13.2.3784: BFDv1, Control, State Up, Flags: [none], length: 24
 00:00:00.505709 eth2  Out IP 10.0.34.2.38291 > 10.0.34.3.3784: BFDv1, Control, State Up, Flags: [none], length: 24
 00:00:00.509749 eth3  In  IP 10.0.35.3.46520 > 10.0.35.2.3784: BFDv1, Control, State Up, Flags: [none], length: 24
 00:00:00.513901 eth2  In  IP 10.0.34.3.57520 > 10.0.34.2.3784: BFDv1, Control, State Up, Flags: [none], length: 24
 00:00:00.516193 eth3  Out IP 10.0.35.2.60297 > 10.0.35.3.3784: BFDv1, Control, State Up, Flags: [none], length: 24
 00:00:00.518250 eth0  In  IP 10.0.13.2.57029 > 10.0.13.3.3784: BFDv1, Control, State Up, Flags: [none], length: 24
 00:00:00.522560 eth1  In  IP 10.0.23.2.57325 > 10.0.23.3.3784: BFDv1, Control, State Up, Flags: [none], length: 24
 00:00:00.548042 eth1  Out IP 10.0.23.3.33242 > 10.0.23.2.3784: BFDv1, Control, State Up, Flags: [none], length: 24
 00:00:00.556327 eth0  Out IP 10.0.13.3.41618 > 10.0.13.2.3784: BFDv1, Control, State Up, Flags: [none], length: 24
 00:00:00.581659 eth2  Out IP 10.0.34.2.38291 > 10.0.34.3.3784: BFDv1, Control, State Up, Flags: [none], length: 24
 00:00:00.589044 eth2  In  IP 10.0.34.3.57520 > 10.0.34.2.3784: BFDv1, Control, State Up, Flags: [none], length: 24
 00:00:00.597418 eth3  In  IP 10.0.35.3.46520 > 10.0.35.2.3784: BFDv1, Control, State Up, Flags: [none], length: 24
 00:00:00.598694 eth3  Out IP 10.0.35.2.60297 > 10.0.35.3.3784: BFDv1, Control, State Up, Flags: [none], length: 24
 00:00:00.602217 eth0  In  IP 10.0.13.2.57029 > 10.0.13.3.3784: BFDv1, Control, State Up, Flags: [none], length: 24
 00:00:00.602880 eth1  In  IP 10.0.23.2.57325 > 10.0.23.3.3784: BFDv1, Control, State Up, Flags: [none], length: 24
 00:00:00.624150 eth1  Out IP 10.0.23.3.33242 > 10.0.23.2.3784: BFDv1, Control, State Up, Flags: [none], length: 24
 00:00:00.635416 eth0  Out IP 10.0.13.3.41618 > 10.0.13.2.3784: BFDv1, Control, State Up, Flags: [none], length: 24
 00:00:00.663699 eth2  Out IP 10.0.34.2.38291 > 10.0.34.3.3784: BFDv1, Control, State Up, Flags: [none], length: 24
 00:00:00.672302 eth2  In  IP 10.0.34.3.57520 > 10.0.34.2.3784: BFDv1, Control, State Up, Flags: [none], length: 24
 00:00:00.677842 eth3  Out IP 10.0.35.2.60297 > 10.0.35.3.3784: BFDv1, Control, State Up, Flags: [none], length: 24
 00:00:00.687274 eth3  In  IP 10.0.35.3.46520 > 10.0.35.2.3784: BFDv1, Control, State Up, Flags: [none], length: 24
 00:00:00.689038 eth1  In  IP 10.0.23.2.57325 > 10.0.23.3.3784: BFDv1, Control, State Up, Flags: [none], length: 24
 00:00:00.690712 eth0  In  IP 10.0.13.2.57029 > 10.0.13.3.3784: BFDv1, Control, State Up, Flags: [none], length: 24
 00:00:00.699246 eth1  Out IP 10.0.23.3.33242 > 10.0.23.2.3784: BFDv1, Control, State Up, Flags: [none], length: 24
 00:00:00.718593 eth0  Out IP 10.0.13.3.41618 > 10.0.13.2.3784: BFDv1, Control, State Up, Flags: [none], length: 24
 00:00:00.751837 eth2  Out IP 10.0.34.2.38291 > 10.0.34.3.3784: BFDv1, Control, State Up, Flags: [none], length: 24
 00:00:00.761536 eth2  In  IP 10.0.34.3.57520 > 10.0.34.2.3784: BFDv1, Control, State Up, Flags: [none], length: 24
 00:00:00.764865 eth3  Out IP 10.0.35.2.60297 > 10.0.35.3.3784: BFDv1, Control, State Up, Flags: [none], length: 24
 00:00:00.766376 eth1  In  IP 10.0.23.2.57325 > 10.0.23.3.3784: BFDv1, Control, State Up, Flags: [none], length: 24
 00:00:00.770099 eth3  In  IP 10.0.35.3.46520 > 10.0.35.2.3784: BFDv1, Control, State Up, Flags: [none], length: 24
 00:00:00.775450 eth0  In  IP 10.0.13.2.57029 > 10.0.13.3.3784: BFDv1, Control, State Up, Flags: [none], length: 24
 00:00:00.785820 eth1  Out IP 10.0.23.3.33242 > 10.0.23.2.3784: BFDv1, Control, State Up, Flags: [none], length: 24
 00:00:00.803103 eth0  Out IP 10.0.13.3.41618 > 10.0.13.2.3784: BFDv1, Control, State Up, Flags: [none], length: 24
 00:00:00.836315 eth2  Out IP 10.0.34.2.38291 > 10.0.34.3.3784: BFDv1, Control, State Up, Flags: [none], length: 24
 00:00:00.844083 eth2  In  IP 10.0.34.3.57520 > 10.0.34.2.3784: BFDv1, Control, State Up, Flags: [none], length: 24
 00:00:00.846512 eth3  Out IP 10.0.35.2.60297 > 10.0.35.3.3784: BFDv1, Control, State Up, Flags: [none], length: 24
 00:00:00.855248 eth1  In  IP 10.0.23.2.57325 > 10.0.23.3.3784: BFDv1, Control, State Up, Flags: [none], length: 24
 00:00:00.858823 eth3  In  IP 10.0.35.3.46520 > 10.0.35.2.3784: BFDv1, Control, State Up, Flags: [none], length: 24
 00:00:00.859009 eth0  In  IP 10.0.13.2.57029 > 10.0.13.3.3784: BFDv1, Control, State Up, Flags: [none], length: 24
 00:00:00.873350 eth1  Out IP 10.0.23.3.33242 > 10.0.23.2.3784: BFDv1, Control, State Up, Flags: [none], length: 24
 00:00:00.881724 eth0  Out IP 10.0.13.3.41618 > 10.0.13.2.3784: BFDv1, Control, State Up, Flags: [none], length: 24
 00:00:00.913021 eth2  Out IP 10.0.34.2.38291 > 10.0.34.3.3784: BFDv1, Control, State Up, Flags: [none], length: 24
 00:00:00.932534 eth3  Out IP 10.0.35.2.60297 > 10.0.35.3.3784: BFDv1, Control, State Up, Flags: [none], length: 24
 00:00:00.932910 eth2  In  IP 10.0.34.3.57520 > 10.0.34.2.3784: BFDv1, Control, State Up, Flags: [none], length: 24
 00:00:00.940614 eth1  In  IP 10.0.23.2.57325 > 10.0.23.3.3784: BFDv1, Control, State Up, Flags: [none], length: 24
 00:00:00.942343 eth3  In  IP 10.0.35.3.46520 > 10.0.35.2.3784: BFDv1, Control, State Up, Flags: [none], length: 24
 00:00:00.946727 eth0  In  IP 10.0.13.2.57029 > 10.0.13.3.3784: BFDv1, Control, State Up, Flags: [none], length: 24
 00:00:00.953136 eth1  Out IP 10.0.23.3.33242 > 10.0.23.2.3784: BFDv1, Control, State Up, Flags: [none], length: 24
 00:00:00.966428 eth0  Out IP 10.0.13.3.41618 > 10.0.13.2.3784: BFDv1, Control, State Up, Flags: [none], length: 24
 00:00:00.991715 eth2  Out IP 10.0.34.2.38291 > 10.0.34.3.3784: BFDv1, Control, State Up, Flags: [none], length: 24
 00:00:01.009983 eth3  Out IP 10.0.35.2.60297 > 10.0.35.3.3784: BFDv1, Control, State Up, Flags: [none], length: 24
 00:00:01.017149 eth1  In  IP 10.0.23.2.57325 > 10.0.23.3.3784: BFDv1, Control, State Up, Flags: [none], length: 24
 00:00:01.022063 eth2  In  IP 10.0.34.3.57520 > 10.0.34.2.3784: BFDv1, Control, State Up, Flags: [none], length: 24
 00:00:01.024431 eth3  In  IP 10.0.35.3.46520 > 10.0.35.2.3784: BFDv1, Control, State Up, Flags: [none], length: 24
 00:00:01.032791 eth1  Out IP 10.0.23.3.33242 > 10.0.23.2.3784: BFDv1, Control, State Up, Flags: [none], length: 24
 00:00:01.033048 eth0  In  IP 10.0.13.2.57029 > 10.0.13.3.3784: BFDv1, Control, State Up, Flags: [none], length: 24
 00:00:01.054371 eth0  Out IP 10.0.13.3.41618 > 10.0.13.2.3784: BFDv1, Control, State Up, Flags: [none], length: 24
 00:00:01.069624 eth2  Out IP 10.0.34.2.38291 > 10.0.34.3.3784: BFDv1, Control, State Up, Flags: [none], length: 24
 00:00:01.085880 eth3  Out IP 10.0.35.2.60297 > 10.0.35.3.3784: BFDv1, Control, State Up, Flags: [none], length: 24
 00:00:01.092483 eth1  In  IP 10.0.23.2.57325 > 10.0.23.3.3784: BFDv1, Control, State Up, Flags: [none], length: 24
 00:00:01.109031 eth2  In  IP 10.0.34.3.57520 > 10.0.34.2.3784: BFDv1, Control, State Up, Flags: [none], length: 24
 00:00:01.110417 eth1  Out IP 10.0.23.3.33242 > 10.0.23.2.3784: BFDv1, Control, State Up, Flags: [none], length: 24
 00:00:01.114493 eth3  In  IP 10.0.35.3.46520 > 10.0.35.2.3784: BFDv1, Control, State Up, Flags: [none], length: 24
 00:00:01.121376 eth0  In  IP 10.0.13.2.57029 > 10.0.13.3.3784: BFDv1, Control, State Up, Flags: [none], length: 24
 00:00:01.136772 eth0  Out IP 10.0.13.3.41618 > 10.0.13.2.3784: BFDv1, Control, State Up, Flags: [none], length: 24
 00:00:01.149041 eth2  Out IP 10.0.34.2.38291 > 10.0.34.3.3784: BFDv1, Control, State Up, Flags: [none], length: 24
 00:00:01.172316 eth3  Out IP 10.0.35.2.60297 > 10.0.35.3.3784: BFDv1, Control, State Up, Flags: [none], length: 24
 00:00:01.173740 eth1  In  IP 10.0.23.2.57325 > 10.0.23.3.3784: BFDv1, Control, State Up, Flags: [none], length: 24
 00:00:01.192750 eth3  In  IP 10.0.35.3.46520 > 10.0.35.2.3784: BFDv1, Control, State Up, Flags: [none], length: 24
 00:00:01.196641 eth2  In  IP 10.0.34.3.57520 > 10.0.34.2.3784: BFDv1, Control, State Up, Flags: [none], length: 24
 00:00:01.197885 eth1  Out IP 10.0.23.3.33242 > 10.0.23.2.3784: BFDv1, Control, State Up, Flags: [none], length: 24
 00:00:01.202466 eth0  In  IP 10.0.13.2.57029 > 10.0.13.3.3784: BFDv1, Control, State Up, Flags: [none], length: 24
 00:00:01.216774 eth0  Out IP 10.0.13.3.41618 > 10.0.13.2.3784: BFDv1, Control, State Up, Flags: [none], length: 24
 00:00:01.227008 eth2  Out IP 10.0.34.2.38291 > 10.0.34.3.3784: BFDv1, Control, State Up, Flags: [none], length: 24
 00:00:01.257951 eth1  In  IP 10.0.23.2.57325 > 10.0.23.3.3784: BFDv1, Control, State Up, Flags: [none], length: 24
 00:00:01.261322 eth3  Out IP 10.0.35.2.60297 > 10.0.35.3.3784: BFDv1, Control, State Up, Flags: [none], length: 24
 00:00:01.272578 eth3  In  IP 10.0.35.3.46520 > 10.0.35.2.3784: BFDv1, Control, State Up, Flags: [none], length: 24
 00:00:01.281888 eth1  Out IP 10.0.23.3.33242 > 10.0.23.2.3784: BFDv1, Control, State Up, Flags: [none], length: 24
 00:00:01.282173 eth2  In  IP 10.0.34.3.57520 > 10.0.34.2.3784: BFDv1, Control, State Up, Flags: [none], length: 24
 00:00:01.287185 eth0  In  IP 10.0.13.2.57029 > 10.0.13.3.3784: BFDv1, Control, State Up, Flags: [none], length: 24
 00:00:01.302420 eth0  Out IP 10.0.13.3.41618 > 10.0.13.2.3784: BFDv1, Control, State Up, Flags: [none], length: 24
 00:00:01.304600 eth2  Out IP 10.0.34.2.38291 > 10.0.34.3.3784: BFDv1, Control, State Up, Flags: [none], length: 24
 00:00:01.342190 eth1  In  IP 10.0.23.2.57325 > 10.0.23.3.3784: BFDv1, Control, State Up, Flags: [none], length: 24
 00:00:01.345666 eth3  Out IP 10.0.35.2.60297 > 10.0.35.3.3784: BFDv1, Control, State Up, Flags: [none], length: 24
 00:00:01.348191 eth3  In  IP 10.0.35.3.46520 > 10.0.35.2.3784: BFDv1, Control, State Up, Flags: [none], length: 24
 00:00:01.359603 eth1  Out IP 10.0.23.3.33242 > 10.0.23.2.3784: BFDv1, Control, State Up, Flags: [none], length: 24
 00:00:01.364649 eth0  In  IP 10.0.13.2.57029 > 10.0.13.3.3784: BFDv1, Control, State Up, Flags: [none], length: 24
 00:00:01.369214 eth2  In  IP 10.0.34.3.57520 > 10.0.34.2.3784: BFDv1, Control, State Up, Flags: [none], length: 24
 00:00:01.377515 eth0  Out IP 10.0.13.3.41618 > 10.0.13.2.3784: BFDv1, Control, State Up, Flags: [none], length: 24
 00:00:01.385756 eth2  Out IP 10.0.34.2.38291 > 10.0.34.3.3784: BFDv1, Control, State Up, Flags: [none], length: 24
 00:00:01.416407 eth1  In  IP 10.0.23.2.57325 > 10.0.23.3.3784: BFDv1, Control, State Up, Flags: [none], length: 24
 00:00:01.434798 eth3  Out IP 10.0.35.2.60297 > 10.0.35.3.3784: BFDv1, Control, State Up, Flags: [none], length: 24
 00:00:01.434972 eth3  In  IP 10.0.35.3.46520 > 10.0.35.2.3784: BFDv1, Control, State Up, Flags: [none], length: 24
 00:00:01.444217 eth1  Out IP 10.0.23.3.33242 > 10.0.23.2.3784: BFDv1, Control, State Up, Flags: [none], length: 24
 00:00:01.448562 eth2  In  IP 10.0.34.3.57520 > 10.0.34.2.3784: BFDv1, Control, State Up, Flags: [none], length: 24
 00:00:01.453605 eth0  In  IP 10.0.13.2.57029 > 10.0.13.3.3784: BFDv1, Control, State Up, Flags: [none], length: 24
 00:00:01.464906 eth2  Out IP 10.0.34.2.38291 > 10.0.34.3.3784: BFDv1, Control, State Up, Flags: [none], length: 24
 00:00:01.468116 eth0  Out IP 10.0.13.3.41618 > 10.0.13.2.3784: BFDv1, Control, State Up, Flags: [none], length: 24
 00:00:01.494492 eth1  In  IP 10.0.23.2.57325 > 10.0.23.3.3784: BFDv1, Control, State Up, Flags: [none], length: 24
 00:00:01.516890 eth3  Out IP 10.0.35.2.60297 > 10.0.35.3.3784: BFDv1, Control, State Up, Flags: [none], length: 24
 00:00:01.521182 eth3  In  IP 10.0.35.3.46520 > 10.0.35.2.3784: BFDv1, Control, State Up, Flags: [none], length: 24
 00:00:01.522477 eth1  Out IP 10.0.23.3.33242 > 10.0.23.2.3784: BFDv1, Control, State Up, Flags: [none], length: 24
 00:00:01.526041 eth2  In  IP 10.0.34.3.57520 > 10.0.34.2.3784: BFDv1, Control, State Up, Flags: [none], length: 24
 00:00:01.529345 eth0  In  IP 10.0.13.2.57029 > 10.0.13.3.3784: BFDv1, Control, State Up, Flags: [none], length: 24
 00:00:01.545733 eth2  Out IP 10.0.34.2.38291 > 10.0.34.3.3784: BFDv1, Control, State Up, Flags: [none], length: 24
 00:00:01.545818 eth0  Out IP 10.0.13.3.41618 > 10.0.13.2.3784: BFDv1, Control, State Up, Flags: [none], length: 24
 00:00:01.583382 eth1  In  IP 10.0.23.2.57325 > 10.0.23.3.3784: BFDv1, Control, State Up, Flags: [none], length: 24
 00:00:01.596865 eth3  In  IP 10.0.35.3.46520 > 10.0.35.2.3784: BFDv1, Control, State Up, Flags: [none], length: 24
 00:00:01.598214 eth1  Out IP 10.0.23.3.33242 > 10.0.23.2.3784: BFDv1, Control, State Up, Flags: [none], length: 24
 00:00:01.599361 eth3  Out IP 10.0.35.2.60297 > 10.0.35.3.3784: BFDv1, Control, State Up, Flags: [none], length: 24
 00:00:01.604027 eth0  In  IP 10.0.13.2.57029 > 10.0.13.3.3784: BFDv1, Control, State Up, Flags: [none], length: 24
 00:00:01.604530 eth2  In  IP 10.0.34.3.57520 > 10.0.34.2.3784: BFDv1, Control, State Up, Flags: [none], length: 24
 00:00:01.628884 eth2  Out IP 10.0.34.2.38291 > 10.0.34.3.3784: BFDv1, Control, State Up, Flags: [none], length: 24
 00:00:01.631309 eth0  Out IP 10.0.13.3.41618 > 10.0.13.2.3784: BFDv1, Control, State Up, Flags: [none], length: 24
 00:00:01.669434 eth1  In  IP 10.0.23.2.57325 > 10.0.23.3.3784: BFDv1, Control, State Up, Flags: [none], length: 24
 00:00:01.677872 eth1  Out IP 10.0.23.3.33242 > 10.0.23.2.3784: BFDv1, Control, State Up, Flags: [none], length: 24
 00:00:01.680086 eth3  Out IP 10.0.35.2.60297 > 10.0.35.3.3784: BFDv1, Control, State Up, Flags: [none], length: 24
 00:00:01.683210 eth0  In  IP 10.0.13.2.57029 > 10.0.13.3.3784: BFDv1, Control, State Up, Flags: [none], length: 24
 00:00:01.686296 eth3  In  IP 10.0.35.3.46520 > 10.0.35.2.3784: BFDv1, Control, State Up, Flags: [none], length: 24
 00:00:01.686456 eth2  In  IP 10.0.34.3.57520 > 10.0.34.2.3784: BFDv1, Control, State Up, Flags: [none], length: 24
 00:00:01.711747 eth0  Out IP 10.0.13.3.41618 > 10.0.13.2.3784: BFDv1, Control, State Up, Flags: [none], length: 24
 00:00:01.715991 eth2  Out IP 10.0.34.2.38291 > 10.0.34.3.3784: BFDv1, Control, State Up, Flags: [none], length: 24
 00:00:01.755627 eth1  In  IP 10.0.23.2.57325 > 10.0.23.3.3784: BFDv1, Control, State Up, Flags: [none], length: 24
 00:00:01.757480 eth0  In  IP 10.0.13.2.57029 > 10.0.13.3.3784: BFDv1, Control, State Up, Flags: [none], length: 24
 00:00:01.758747 eth3  Out IP 10.0.35.2.60297 > 10.0.35.3.3784: BFDv1, Control, State Up, Flags: [none], length: 24
 00:00:01.761967 eth1  Out IP 10.0.23.3.33242 > 10.0.23.2.3784: BFDv1, Control, State Up, Flags: [none], length: 24
 00:00:01.771973 eth3  In  IP 10.0.35.3.46520 > 10.0.35.2.3784: BFDv1, Control, State Up, Flags: [none], length: 24
 00:00:01.775906 eth2  In  IP 10.0.34.3.57520 > 10.0.34.2.3784: BFDv1, Control, State Up, Flags: [none], length: 24
 00:00:01.796322 eth2  Out IP 10.0.34.2.38291 > 10.0.34.3.3784: BFDv1, Control, State Up, Flags: [none], length: 24
 00:00:01.796435 eth0  Out IP 10.0.13.3.41618 > 10.0.13.2.3784: BFDv1, Control, State Up, Flags: [none], length: 24
 00:00:01.834708 eth3  Out IP 10.0.35.2.60297 > 10.0.35.3.3784: BFDv1, Control, State Up, Flags: [none], length: 24
 00:00:01.836813 eth0  In  IP 10.0.13.2.57029 > 10.0.13.3.3784: BFDv1, Control, State Up, Flags: [none], length: 24
 00:00:01.841542 eth1  In  IP 10.0.23.2.57325 > 10.0.23.3.3784: BFDv1, Control, State Up, Flags: [none], length: 24
 00:00:01.849861 eth1  Out IP 10.0.23.3.33242 > 10.0.23.2.3784: BFDv1, Control, State Up, Flags: [none], length: 24
 00:00:01.850965 eth3  In  IP 10.0.35.3.46520 > 10.0.35.2.3784: BFDv1, Control, State Up, Flags: [none], length: 24
 00:00:01.862427 eth2  In  IP 10.0.34.3.57520 > 10.0.34.2.3784: BFDv1, Control, State Up, Flags: [none], length: 24
 00:00:01.879905 eth2  Out IP 10.0.34.2.38291 > 10.0.34.3.3784: BFDv1, Control, State Up, Flags: [none], length: 24
 00:00:01.886097 eth0  Out IP 10.0.13.3.41618 > 10.0.13.2.3784: BFDv1, Control, State Up, Flags: [none], length: 24
 00:00:01.914497 eth0  In  IP 10.0.13.2.57029 > 10.0.13.3.3784: BFDv1, Control, State Up, Flags: [none], length: 24
 00:00:01.917880 eth3  Out IP 10.0.35.2.60297 > 10.0.35.3.3784: BFDv1, Control, State Up, Flags: [none], length: 24
 00:00:01.925544 eth1  In  IP 10.0.23.2.57325 > 10.0.23.3.3784: BFDv1, Control, State Up, Flags: [none], length: 24
 00:00:01.928934 eth1  Out IP 10.0.23.3.33242 > 10.0.23.2.3784: BFDv1, Control, State Up, Flags: [none], length: 24
 00:00:01.929134 eth3  In  IP 10.0.35.3.46520 > 10.0.35.2.3784: BFDv1, Control, State Up, Flags: [none], length: 24
 00:00:01.962718 eth0  Out IP 10.0.13.3.41618 > 10.0.13.2.3784: BFDv1, Control, State Up, Flags: [none], length: 24
 00:00:01.998986 eth3  Out IP 10.0.35.2.60297 > 10.0.35.3.3784: BFDv1, Control, State Up, Flags: [none], length: 24
 00:00:02.001935 eth1  In  IP 10.0.23.2.57325 > 10.0.23.3.3784: BFDv1, Control, State Up, Flags: [none], length: 24
 00:00:02.003247 eth0  In  IP 10.0.13.2.57029 > 10.0.13.3.3784: BFDv1, Control, State Up, Flags: [none], length: 24
 00:00:02.005510 eth1  Out IP 10.0.23.3.33242 > 10.0.23.2.3784: BFDv1, Control, State Up, Flags: [none], length: 24
 00:00:02.010334 eth3  In  IP 10.0.35.3.46520 > 10.0.35.2.3784: BFDv1, Control, State Up, Flags: [none], length: 24
 00:00:02.044669 eth0  Out IP 10.0.13.3.41618 > 10.0.13.2.3784: BFDv1, Control, State Up, Flags: [none], length: 24
 00:00:02.077949 eth3  Out IP 10.0.35.2.60297 > 10.0.35.3.3784: BFDv1, Control, State Up, Flags: [none], length: 24
 00:00:02.082285 eth0  In  IP 10.0.13.2.57029 > 10.0.13.3.3784: BFDv1, Control, State Up, Flags: [none], length: 24
 00:00:02.085030 eth1  In  IP 10.0.23.2.57325 > 10.0.23.3.3784: BFDv1, Control, State Up, Flags: [none], length: 24
 00:00:02.091969 eth1  Out IP 10.0.23.3.33242 > 10.0.23.2.3784: BFDv1, Control, State Up, Flags: [none], length: 24
 00:00:02.097233 eth3  In  IP 10.0.35.3.46520 > 10.0.35.2.3784: BFDv1, Control, State Up, Flags: [none], length: 24
 00:00:02.126550 eth0  Out IP 10.0.13.3.41618 > 10.0.13.2.3784: BFDv1, Control, State Up, Flags: [none], length: 24
 00:00:02.161432 eth1  In  IP 10.0.23.2.57325 > 10.0.23.3.3784: BFDv1, Control, State Up, Flags: [none], length: 24
 00:00:02.161577 eth3  Out IP 10.0.35.2.60297 > 10.0.35.3.3784: BFDv1, Control, State Up, Flags: [none], length: 24
 00:00:02.169832 eth1  Out IP 10.0.23.3.33242 > 10.0.23.2.3784: BFDv1, Control, State Up, Flags: [none], length: 24
 00:00:02.171777 eth0  In  IP 10.0.13.2.57029 > 10.0.13.3.3784: BFDv1, Control, State Up, Flags: [none], length: 24
 00:00:02.175827 eth3  In  IP 10.0.35.3.46520 > 10.0.35.2.3784: BFDv1, Control, State Up, Flags: [none], length: 24
 00:00:02.211236 eth0  Out IP 10.0.13.3.41618 > 10.0.13.2.3784: BFDv1, Control, State Up, Flags: [none], length: 24
 00:00:02.236507 eth1  In  IP 10.0.23.2.57325 > 10.0.23.3.3784: BFDv1, Control, State Up, Flags: [none], length: 24
 00:00:02.251041 eth3  Out IP 10.0.35.2.60297 > 10.0.35.3.3784: BFDv1, Control, State Up, Flags: [none], length: 24
 00:00:02.251181 eth1  Out IP 10.0.23.3.33242 > 10.0.23.2.3784: BFDv1, Control, State Up, Flags: [none], length: 24
 00:00:02.251959 eth0  In  IP 10.0.13.2.57029 > 10.0.13.3.3784: BFDv1, Control, State Up, Flags: [none], length: 24
 00:00:02.263357 eth3  In  IP 10.0.35.3.46520 > 10.0.35.2.3784: BFDv1, Control, State Up, Flags: [none], length: 24
 00:00:02.288635 eth0  Out IP 10.0.13.3.41618 > 10.0.13.2.3784: BFDv1, Control, State Up, Flags: [none], length: 24
 00:00:02.315752 eth1  In  IP 10.0.23.2.57325 > 10.0.23.3.3784: BFDv1, Control, State Up, Flags: [none], length: 24
 00:00:02.329254 eth0  In  IP 10.0.13.2.57029 > 10.0.13.3.3784: BFDv1, Control, State Up, Flags: [none], length: 24
 00:00:02.339658 eth1  Out IP 10.0.23.3.33242 > 10.0.23.2.3784: BFDv1, Control, State Up, Flags: [none], length: 24
 00:00:02.341349 eth3  Out IP 10.0.35.2.60297 > 10.0.35.3.3784: BFDv1, Control, State Up, Flags: [none], length: 24
 00:00:02.346628 eth3  In  IP 10.0.35.3.46520 > 10.0.35.2.3784: BFDv1, Control, State Up, Flags: [none], length: 24
 00:00:02.375062 eth0  Out IP 10.0.13.3.41618 > 10.0.13.2.3784: BFDv1, Control, State Up, Flags: [none], length: 24
 00:00:02.402231 eth1  In  IP 10.0.23.2.57325 > 10.0.23.3.3784: BFDv1, Control, State Up, Flags: [none], length: 24
 00:00:02.405657 eth0  In  IP 10.0.13.2.57029 > 10.0.13.3.3784: BFDv1, Control, State Up, Flags: [none], length: 24
 00:00:02.418993 eth3  Out IP 10.0.35.2.60297 > 10.0.35.3.3784: BFDv1, Control, State Up, Flags: [none], length: 24
 00:00:02.419071 eth1  Out IP 10.0.23.3.33242 > 10.0.23.2.3784: BFDv1, Control, State Up, Flags: [none], length: 24
 00:00:02.432271 eth3  In  IP 10.0.35.3.46520 > 10.0.35.2.3784: BFDv1, Control, State Up, Flags: [none], length: 24
 00:00:02.458690 eth0  Out IP 10.0.13.3.41618 > 10.0.13.2.3784: BFDv1, Control, State Up, Flags: [none], length: 24
 00:00:02.484779 eth1  In  IP 10.0.23.2.57325 > 10.0.23.3.3784: BFDv1, Control, State Up, Flags: [none], length: 24
 00:00:02.489767 eth0  In  IP 10.0.13.2.57029 > 10.0.13.3.3784: BFDv1, Control, State Up, Flags: [none], length: 24
 00:00:02.504126 eth3  Out IP 10.0.35.2.60297 > 10.0.35.3.3784: BFDv1, Control, State Up, Flags: [none], length: 24
 00:00:02.506513 eth1  Out IP 10.0.23.3.33242 > 10.0.23.2.3784: BFDv1, Control, State Up, Flags: [none], length: 24
 00:00:02.519889 eth3  In  IP 10.0.35.3.46520 > 10.0.35.2.3784: BFDv1, Control, State Up, Flags: [none], length: 24
 00:00:02.546301 eth0  Out IP 10.0.13.3.41618 > 10.0.13.2.3784: BFDv1, Control, State Up, Flags: [none], length: 24
 00:00:02.560130 eth1  In  IP 10.0.23.2.57325 > 10.0.23.3.3784: BFDv1, Control, State Up, Flags: [none], length: 24
 00:00:02.577213 eth0  In  IP 10.0.13.2.57029 > 10.0.13.3.3784: BFDv1, Control, State Up, Flags: [none], length: 24
 00:00:02.582483 eth3  Out IP 10.0.35.2.60297 > 10.0.35.3.3784: BFDv1, Control, State Up, Flags: [none], length: 24
 00:00:02.582530 eth1  Out IP 10.0.23.3.33242 > 10.0.23.2.3784: BFDv1, Control, State Up, Flags: [none], length: 24
 00:00:02.597822 eth3  In  IP 10.0.35.3.46520 > 10.0.35.2.3784: BFDv1, Control, State Up, Flags: [none], length: 24
 00:00:02.634308 eth0  Out IP 10.0.13.3.41618 > 10.0.13.2.3784: BFDv1, Control, State Up, Flags: [none], length: 24
 00:00:02.638487 eth1  In  IP 10.0.23.2.57325 > 10.0.23.3.3784: BFDv1, Control, State Up, Flags: [none], length: 24
 00:00:02.659838 eth3  Out IP 10.0.35.2.60297 > 10.0.35.3.3784: BFDv1, Control, State Up, Flags: [none], length: 24
 00:00:02.665800 eth0  In  IP 10.0.13.2.57029 > 10.0.13.3.3784: BFDv1, Control, State Up, Flags: [none], length: 24
 00:00:02.668128 eth1  Out IP 10.0.23.3.33242 > 10.0.23.2.3784: BFDv1, Control, State Up, Flags: [none], length: 24
 00:00:02.673110 eth3  In  IP 10.0.35.3.46520 > 10.0.35.2.3784: BFDv1, Control, State Up, Flags: [none], length: 24
 00:00:02.717934 eth1  In  IP 10.0.23.2.57325 > 10.0.23.3.3784: BFDv1, Control, State Up, Flags: [none], length: 24
 00:00:02.721607 eth0  Out IP 10.0.13.3.41618 > 10.0.13.2.3784: BFDv1, Control, State Up, Flags: [none], length: 24
 00:00:02.743023 eth0  In  IP 10.0.13.2.57029 > 10.0.13.3.3784: BFDv1, Control, State Up, Flags: [none], length: 24
 00:00:02.744415 eth3  Out IP 10.0.35.2.60297 > 10.0.35.3.3784: BFDv1, Control, State Up, Flags: [none], length: 24
 00:00:02.753694 eth3  In  IP 10.0.35.3.46520 > 10.0.35.2.3784: BFDv1, Control, State Up, Flags: [none], length: 24
 00:00:02.755994 eth1  Out IP 10.0.23.3.33242 > 10.0.23.2.3784: BFDv1, Control, State Up, Flags: [none], length: 24
 00:00:02.796867 eth1  In  IP 10.0.23.2.57325 > 10.0.23.3.3784: BFDv1, Control, State Up, Flags: [none], length: 24
 00:00:02.810185 eth0  Out IP 10.0.13.3.41618 > 10.0.13.2.3784: BFDv1, Control, State Up, Flags: [none], length: 24
 00:00:02.825726 eth0  In  IP 10.0.13.2.57029 > 10.0.13.3.3784: BFDv1, Control, State Up, Flags: [none], length: 24
 00:00:02.830111 eth3  Out IP 10.0.35.2.60297 > 10.0.35.3.3784: BFDv1, Control, State Up, Flags: [none], length: 24
 00:00:02.835399 eth1  Out IP 10.0.23.3.33242 > 10.0.23.2.3784: BFDv1, Control, State Up, Flags: [none], length: 24
 00:00:02.836510 eth3  In  IP 10.0.35.3.46520 > 10.0.35.2.3784: BFDv1, Control, State Up, Flags: [none], length: 24
 00:00:02.885179 eth1  In  IP 10.0.23.2.57325 > 10.0.23.3.3784: BFDv1, Control, State Up, Flags: [none], length: 24
 00:00:02.899591 eth0  Out IP 10.0.13.3.41618 > 10.0.13.2.3784: BFDv1, Control, State Up, Flags: [none], length: 24
 00:00:02.901787 eth0  In  IP 10.0.13.2.57029 > 10.0.13.3.3784: BFDv1, Control, State Up, Flags: [none], length: 24
 00:00:02.907155 eth3  Out IP 10.0.35.2.60297 > 10.0.35.3.3784: BFDv1, Control, State Up, Flags: [none], length: 24
 00:00:02.917393 eth3  In  IP 10.0.35.3.46520 > 10.0.35.2.3784: BFDv1, Control, State Up, Flags: [none], length: 24
 00:00:02.918724 eth1  Out IP 10.0.23.3.33242 > 10.0.23.2.3784: BFDv1, Control, State Up, Flags: [none], length: 24
 00:00:02.967383 eth1  In  IP 10.0.23.2.57325 > 10.0.23.3.3784: BFDv1, Control, State Up, Flags: [none], length: 24
 00:00:02.981707 eth0  In  IP 10.0.13.2.57029 > 10.0.13.3.3784: BFDv1, Control, State Up, Flags: [none], length: 24
 00:00:02.984183 eth0  Out IP 10.0.13.3.41618 > 10.0.13.2.3784: BFDv1, Control, State Up, Flags: [none], length: 24
 00:00:02.991360 eth3  Out IP 10.0.35.2.60297 > 10.0.35.3.3784: BFDv1, Control, State Up, Flags: [none], length: 24
 00:00:02.995537 eth1  Out IP 10.0.23.3.33242 > 10.0.23.2.3784: BFDv1, Control, State Up, Flags: [none], length: 24
 00:00:02.996576 eth3  In  IP 10.0.35.3.46520 > 10.0.35.2.3784: BFDv1, Control, State Up, Flags: [none], length: 24
 00:00:03.048614 eth1  In  IP 10.0.23.2.57325 > 10.0.23.3.3784: BFDv1, Control, State Up, Flags: [none], length: 24
 00:00:03.057546 eth0  In  IP 10.0.13.2.57029 > 10.0.13.3.3784: BFDv1, Control, State Up, Flags: [none], length: 24
 00:00:03.069978 eth3  Out IP 10.0.35.2.60297 > 10.0.35.3.3784: BFDv1, Control, State Up, Flags: [none], length: 24
 00:00:03.072201 eth0  Out IP 10.0.13.3.41618 > 10.0.13.2.3784: BFDv1, Control, State Up, Flags: [none], length: 24
 00:00:03.072293 eth1  Out IP 10.0.23.3.33242 > 10.0.23.2.3784: BFDv1, Control, State Up, Flags: [none], length: 24
 00:00:03.084258 eth3  In  IP 10.0.35.3.46520 > 10.0.35.2.3784: BFDv1, Control, State Up, Flags: [none], length: 24
 00:00:03.133909 eth1  In  IP 10.0.23.2.57325 > 10.0.23.3.3784: BFDv1, Control, State Up, Flags: [none], length: 24
 00:00:03.139883 eth0  In  IP 10.0.13.2.57029 > 10.0.13.3.3784: BFDv1, Control, State Up, Flags: [none], length: 24
 00:00:03.148245 eth1  Out IP 10.0.23.3.33242 > 10.0.23.2.3784: BFDv1, Control, State Up, Flags: [none], length: 24
 00:00:03.148334 eth3  Out IP 10.0.35.2.60297 > 10.0.35.3.3784: BFDv1, Control, State Up, Flags: [none], length: 24
 00:00:03.152557 eth0  Out IP 10.0.13.3.41618 > 10.0.13.2.3784: BFDv1, Control, State Up, Flags: [none], length: 24
 00:00:03.166565 eth3  In  IP 10.0.35.3.46520 > 10.0.35.2.3784: BFDv1, Control, State Up, Flags: [none], length: 24
 00:00:03.221722 eth1  In  IP 10.0.23.2.57325 > 10.0.23.3.3784: BFDv1, Control, State Up, Flags: [none], length: 24
 00:00:03.226062 eth1  Out IP 10.0.23.3.33242 > 10.0.23.2.3784: BFDv1, Control, State Up, Flags: [none], length: 24
 00:00:03.226167 eth3  Out IP 10.0.35.2.60297 > 10.0.35.3.3784: BFDv1, Control, State Up, Flags: [none], length: 24
 00:00:03.229439 eth0  In  IP 10.0.13.2.57029 > 10.0.13.3.3784: BFDv1, Control, State Up, Flags: [none], length: 24
 00:00:03.232803 eth0  Out IP 10.0.13.3.41618 > 10.0.13.2.3784: BFDv1, Control, State Up, Flags: [none], length: 24
 00:00:03.252378 eth3  In  IP 10.0.35.3.46520 > 10.0.35.2.3784: BFDv1, Control, State Up, Flags: [none], length: 24
 00:00:03.306724 eth1  Out IP 10.0.23.3.33242 > 10.0.23.2.3784: BFDv1, Control, State Up, Flags: [none], length: 24
 00:00:03.310047 eth1  In  IP 10.0.23.2.57325 > 10.0.23.3.3784: BFDv1, Control, State Up, Flags: [none], length: 24
 00:00:03.311107 eth0  In  IP 10.0.13.2.57029 > 10.0.13.3.3784: BFDv1, Control, State Up, Flags: [none], length: 24
 00:00:03.311325 eth3  Out IP 10.0.35.2.60297 > 10.0.35.3.3784: BFDv1, Control, State Up, Flags: [none], length: 24
 00:00:03.322585 eth0  Out IP 10.0.13.3.41618 > 10.0.13.2.3784: BFDv1, Control, State Up, Flags: [none], length: 24
 00:00:03.338583 eth3  In  IP 10.0.35.3.46520 > 10.0.35.2.3784: BFDv1, Control, State Up, Flags: [none], length: 24
 00:00:03.383951 eth1  Out IP 10.0.23.3.33242 > 10.0.23.2.3784: BFDv1, Control, State Up, Flags: [none], length: 24
 00:00:03.388313 eth1  In  IP 10.0.23.2.57325 > 10.0.23.3.3784: BFDv1, Control, State Up, Flags: [none], length: 24
 00:00:03.393662 eth3  Out IP 10.0.35.2.60297 > 10.0.35.3.3784: BFDv1, Control, State Up, Flags: [none], length: 24
 00:00:03.395683 eth0  In  IP 10.0.13.2.57029 > 10.0.13.3.3784: BFDv1, Control, State Up, Flags: [none], length: 24
 00:00:03.400956 eth0  Out IP 10.0.13.3.41618 > 10.0.13.2.3784: BFDv1, Control, State Up, Flags: [none], length: 24
 00:00:03.416870 eth3  In  IP 10.0.35.3.46520 > 10.0.35.2.3784: BFDv1, Control, State Up, Flags: [none], length: 24
 00:00:03.463172 eth1  Out IP 10.0.23.3.33242 > 10.0.23.2.3784: BFDv1, Control, State Up, Flags: [none], length: 24
 00:00:03.464438 eth1  In  IP 10.0.23.2.57325 > 10.0.23.3.3784: BFDv1, Control, State Up, Flags: [none], length: 24
 00:00:03.474712 eth3  Out IP 10.0.35.2.60297 > 10.0.35.3.3784: BFDv1, Control, State Up, Flags: [none], length: 24
 00:00:03.479211 eth0  In  IP 10.0.13.2.57029 > 10.0.13.3.3784: BFDv1, Control, State Up, Flags: [none], length: 24
 00:00:03.481650 eth0  Out IP 10.0.13.3.41618 > 10.0.13.2.3784: BFDv1, Control, State Up, Flags: [none], length: 24
 00:00:03.500985 eth3  In  IP 10.0.35.3.46520 > 10.0.35.2.3784: BFDv1, Control, State Up, Flags: [none], length: 24
 00:00:03.545578 eth1  In  IP 10.0.23.2.57325 > 10.0.23.3.3784: BFDv1, Control, State Up, Flags: [none], length: 24
 00:00:03.551920 eth1  Out IP 10.0.23.3.33242 > 10.0.23.2.3784: BFDv1, Control, State Up, Flags: [none], length: 24
 00:00:03.551984 eth3  Out IP 10.0.35.2.60297 > 10.0.35.3.3784: BFDv1, Control, State Up, Flags: [none], length: 24
 00:00:03.557953 eth0  In  IP 10.0.13.2.57029 > 10.0.13.3.3784: BFDv1, Control, State Up, Flags: [none], length: 24
 00:00:03.570306 eth0  Out IP 10.0.13.3.41618 > 10.0.13.2.3784: BFDv1, Control, State Up, Flags: [none], length: 24
 00:00:03.585875 eth3  In  IP 10.0.35.3.46520 > 10.0.35.2.3784: BFDv1, Control, State Up, Flags: [none], length: 24
 00:00:03.628244 eth3  Out IP 10.0.35.2.60297 > 10.0.35.3.3784: BFDv1, Control, State Up, Flags: [none], length: 24
 00:00:03.634060 eth1  In  IP 10.0.23.2.57325 > 10.0.23.3.3784: BFDv1, Control, State Up, Flags: [none], length: 24
 00:00:03.638288 eth0  In  IP 10.0.13.2.57029 > 10.0.13.3.3784: BFDv1, Control, State Up, Flags: [none], length: 24
 00:00:03.638356 eth1  Out IP 10.0.23.3.33242 > 10.0.23.2.3784: BFDv1, Control, State Up, Flags: [none], length: 24
 00:00:03.655626 eth0  Out IP 10.0.13.3.41618 > 10.0.13.2.3784: BFDv1, Control, State Up, Flags: [none], length: 24
 00:00:03.665109 eth3  In  IP 10.0.35.3.46520 > 10.0.35.2.3784: BFDv1, Control, State Up, Flags: [none], length: 24
 00:00:03.703448 eth3  Out IP 10.0.35.2.60297 > 10.0.35.3.3784: BFDv1, Control, State Up, Flags: [none], length: 24
 00:00:03.717783 eth0  In  IP 10.0.13.2.57029 > 10.0.13.3.3784: BFDv1, Control, State Up, Flags: [none], length: 24
 00:00:03.719872 eth1  In  IP 10.0.23.2.57325 > 10.0.23.3.3784: BFDv1, Control, State Up, Flags: [none], length: 24
 00:00:03.728227 eth1  Out IP 10.0.23.3.33242 > 10.0.23.2.3784: BFDv1, Control, State Up, Flags: [none], length: 24
 00:00:03.740853 eth3  In  IP 10.0.35.3.46520 > 10.0.35.2.3784: BFDv1, Control, State Up, Flags: [none], length: 24
 00:00:03.742202 eth0  Out IP 10.0.13.3.41618 > 10.0.13.2.3784: BFDv1, Control, State Up, Flags: [none], length: 24
 00:00:03.788437 eth3  Out IP 10.0.35.2.60297 > 10.0.35.3.3784: BFDv1, Control, State Up, Flags: [none], length: 24
 00:00:03.796832 eth1  In  IP 10.0.23.2.57325 > 10.0.23.3.3784: BFDv1, Control, State Up, Flags: [none], length: 24
 00:00:03.806224 eth0  In  IP 10.0.13.2.57029 > 10.0.13.3.3784: BFDv1, Control, State Up, Flags: [none], length: 24
 00:00:03.812511 eth1  Out IP 10.0.23.3.33242 > 10.0.23.2.3784: BFDv1, Control, State Up, Flags: [none], length: 24
 00:00:03.823779 eth0  Out IP 10.0.13.3.41618 > 10.0.13.2.3784: BFDv1, Control, State Up, Flags: [none], length: 24
 00:00:03.827593 eth3  In  IP 10.0.35.3.46520 > 10.0.35.2.3784: BFDv1, Control, State Up, Flags: [none], length: 24
 00:00:03.873906 eth3  Out IP 10.0.35.2.60297 > 10.0.35.3.3784: BFDv1, Control, State Up, Flags: [none], length: 24
 00:00:03.881734 eth1  In  IP 10.0.23.2.57325 > 10.0.23.3.3784: BFDv1, Control, State Up, Flags: [none], length: 24
 00:00:03.890468 eth0  In  IP 10.0.13.2.57029 > 10.0.13.3.3784: BFDv1, Control, State Up, Flags: [none], length: 24
 00:00:03.894767 eth1  Out IP 10.0.23.3.33242 > 10.0.23.2.3784: BFDv1, Control, State Up, Flags: [none], length: 24
 00:00:03.906981 eth0  Out IP 10.0.13.3.41618 > 10.0.13.2.3784: BFDv1, Control, State Up, Flags: [none], length: 24
 00:00:03.907214 eth3  In  IP 10.0.35.3.46520 > 10.0.35.2.3784: BFDv1, Control, State Up, Flags: [none], length: 24
 00:00:03.961437 eth3  Out IP 10.0.35.2.60297 > 10.0.35.3.3784: BFDv1, Control, State Up, Flags: [none], length: 24
 00:00:03.965828 eth1  In  IP 10.0.23.2.57325 > 10.0.23.3.3784: BFDv1, Control, State Up, Flags: [none], length: 24
 00:00:03.975588 eth0  In  IP 10.0.13.2.57029 > 10.0.13.3.3784: BFDv1, Control, State Up, Flags: [none], length: 24
 00:00:03.980923 eth1  Out IP 10.0.23.3.33242 > 10.0.23.2.3784: BFDv1, Control, State Up, Flags: [none], length: 24
 00:00:03.985775 eth3  In  IP 10.0.35.3.46520 > 10.0.35.2.3784: BFDv1, Control, State Up, Flags: [none], length: 24
 00:00:03.996076 eth0  Out IP 10.0.13.3.41618 > 10.0.13.2.3784: BFDv1, Control, State Up, Flags: [none], length: 24
 00:00:04.049293 eth3  Out IP 10.0.35.2.60297 > 10.0.35.3.3784: BFDv1, Control, State Up, Flags: [none], length: 24
 00:00:04.051099 eth1  In  IP 10.0.23.2.57325 > 10.0.23.3.3784: BFDv1, Control, State Up, Flags: [none], length: 24
