tcpdump: data link type LINUX_SLL2
tcpdump: verbose output suppressed, use -v[v]... for full protocol decode
listening on any, link-type LINUX_SLL2 (Linux cooked v2), snapshot length 262144 bytes
 00:00:00.000000 eth2  Out IP 10.0.34.2.46365 > 10.0.34.3.3784: BFDv1, Control, State Up, Flags: [none], length: 24
 00:00:00.001471 eth1  In  IP 10.0.23.2.57325 > 10.0.23.3.3784: BFDv1, Control, State Up, Flags: [none], length: 24
 00:00:00.011448 eth2  In  IP 10.0.34.3.41969 > 10.0.34.2.3784: BFDv1, Control, State Up, Flags: [none], length: 24
 00:00:00.018146 eth0  In  IP 10.0.13.2.57029 > 10.0.13.3.3784: BFDv1, Control, State Up, Flags: [none], length: 24
 00:00:00.034835 eth0  Out IP 10.0.13.3.41618 > 10.0.13.2.3784: BFDv1, Control, State Up, Flags: [none], length: 24
 00:00:00.035170 eth3  In  IP 10.0.35.3.46520 > 10.0.35.2.3784: BFDv1, Control, State Up, Flags: [none], length: 24
 00:00:00.045775 eth3  Out IP 10.0.35.2.60297 > 10.0.35.3.3784: BFDv1, Control, State Up, Flags: [none], length: 24
 00:00:00.053099 eth1  Out IP 10.0.23.3.33242 > 10.0.23.2.3784: BFDv1, Control, State Up, Flags: [none], length: 24
 00:00:00.075512 eth2  Out IP 10.0.34.2.46365 > 10.0.34.3.3784: BFDv1, Control, State Up, Flags: [none], length: 24
 00:00:00.079020 eth1  In  IP 10.0.23.2.57325 > 10.0.23.3.3784: BFDv1, Control, State Up, Flags: [none], length: 24
 00:00:00.096330 eth2  In  IP 10.0.34.3.41969 > 10.0.34.2.3784: BFDv1, Control, State Up, Flags: [none], length: 24
 00:00:00.097123 eth0  In  IP 10.0.13.2.57029 > 10.0.13.3.3784: BFDv1, Control, State Up, Flags: [none], length: 24
 00:00:00.118186 eth3  In  IP 10.0.35.3.46520 > 10.0.35.2.3784: BFDv1, Control, State Up, Flags: [none], length: 24
 00:00:00.118373 eth0  Out IP 10.0.13.3.41618 > 10.0.13.2.3784: BFDv1, Control, State Up, Flags: [none], length: 24
 00:00:00.127588 eth3  Out IP 10.0.35.2.60297 > 10.0.35.3.3784: BFDv1, Control, State Up, Flags: [none], length: 24
 00:00:00.138963 eth1  Out IP 10.0.23.3.33242 > 10.0.23.2.3784: BFDv1, Control, State Up, Flags: [none], length: 24
 00:00:00.155179 eth2  Out IP 10.0.34.2.46365 > 10.0.34.3.3784: BFDv1, Control, State Up, Flags: [none], length: 24
 00:00:00.155679 eth1  In  IP 10.0.23.2.57325 > 10.0.23.3.3784: BFDv1, Control, State Up, Flags: [none], length: 24
 00:00:00.173644 eth0  In  IP 10.0.13.2.57029 > 10.0.13.3.3784: BFDv1, Control, State Up, Flags: [none], length: 24
 00:00:00.184836 eth2  In  IP 10.0.34.3.41969 > 10.0.34.2.3784: BFDv1, Control, State Up, Flags: [none], length: 24
 00:00:00.194204 eth0  Out IP 10.0.13.3.41618 > 10.0.13.2.3784: BFDv1, Control, State Up, Flags: [none], length: 24
 00:00:00.199453 eth3  In  IP 10.0.35.3.46520 > 10.0.35.2.3784: BFDv1, Control, State Up, Flags: [none], length: 24
 00:00:00.213790 eth3  Out IP 10.0.35.2.60297 > 10.0.35.3.3784: BFDv1, Control, State Up, Flags: [none], length: 24
 00:00:00.227017 eth1  Out IP 10.0.23.3.33242 > 10.0.23.2.3784: BFDv1, Control, State Up, Flags: [none], length: 24
 00:00:00.233367 eth1  In  IP 10.0.23.2.57325 > 10.0.23.3.3784: BFDv1, Control, State Up, Flags: [none], length: 24
 00:00:00.240611 eth2  Out IP 10.0.34.2.46365 > 10.0.34.3.3784: BFDv1, Control, State Up, Flags: [none], length: 24
 00:00:00.260936 eth0  In  IP 10.0.13.2.57029 > 10.0.13.3.3784: BFDv1, Control, State Up, Flags: [none], length: 24
 00:00:00.264083 eth2  In  IP 10.0.34.3.41969 > 10.0.34.2.3784: BFDv1, Control, State Up, Flags: [none], length: 24
 00:00:00.275381 eth0  Out IP 10.0.13.3.41618 > 10.0.13.2.3784: BFDv1, Control, State Up, Flags: [none], length: 24
 00:00:00.286090 eth3  In  IP 10.0.35.3.46520 > 10.0.35.2.3784: BFDv1, Control, State Up, Flags: [none], length: 24
 00:00:00.289530 eth3  Out IP 10.0.35.2.60297 > 10.0.35.3.3784: BFDv1, Control, State Up, Flags: [none], length: 24
 00:00:00.308804 eth1  Out IP 10.0.23.3.33242 > 10.0.23.2.3784: BFDv1, Control, State Up, Flags: [none], length: 24
 00:00:00.314415 eth1  In  IP 10.0.23.2.57325 > 10.0.23.3.3784: BFDv1, Control, State Up, Flags: [none], length: 24
 00:00:00.321880 eth2  Out IP 10.0.34.2.46365 > 10.0.34.3.3784: BFDv1, Control, State Up, Flags: [none], length: 24
 00:00:00.341353 eth2  In  IP 10.0.34.3.41969 > 10.0.34.2.3784: BFDv1, Control, State Up, Flags: [none], length: 24
 00:00:00.346985 eth0  In  IP 10.0.13.2.57029 > 10.0.13.3.3784: BFDv1, Control, State Up, Flags: [none], length: 24
 00:00:00.357301 eth0  Out IP 10.0.13.3.41618 > 10.0.13.2.3784: BFDv1, Control, State Up, Flags: [none], length: 24
 00:00:00.361633 eth3  In  IP 10.0.35.3.46520 > 10.0.35.2.3784: BFDv1, Control, State Up, Flags: [none], length: 24
 00:00:00.364959 eth3  Out IP 10.0.35.2.60297 > 10.0.35.3.3784: BFDv1, Control, State Up, Flags: [none], length: 24
 00:00:00.390177 eth1  Out IP 10.0.23.3.33242 > 10.0.23.2.3784: BFDv1, Control, State Up, Flags: [none], length: 24
 00:00:00.390302 eth1  In  IP 10.0.23.2.57325 > 10.0.23.3.3784: BFDv1, Control, State Up, Flags: [none], length: 24
 00:00:00.401508 eth2  Out IP 10.0.34.2.46365 > 10.0.34.3.3784: BFDv1, Control, State Up, Flags: [none], length: 24
 00:00:00.426263 eth2  In  IP 10.0.34.3.41969 > 10.0.34.2.3784: BFDv1, Control, State Up, Flags: [none], length: 24
 00:00:00.427366 eth0  In  IP 10.0.13.2.57029 > 10.0.13.3.3784: BFDv1, Control, State Up, Flags: [none], length: 24
 00:00:00.439665 eth3  In  IP 10.0.35.3.46520 > 10.0.35.2.3784: BFDv1, Control, State Up, Flags: [none], length: 24
 00:00:00.439903 eth0  Out IP 10.0.13.3.41618 > 10.0.13.2.3784: BFDv1, Control, State Up, Flags: [none], length: 24
 00:00:00.447153 eth3  Out IP 10.0.35.2.60297 > 10.0.35.3.3784: BFDv1, Control, State Up, Flags: [none], length: 24
 00:00:00.472428 eth1  Out IP 10.0.23.3.33242 > 10.0.23.2.3784: BFDv1, Control, State Up, Flags: [none], length: 24
 00:00:00.478763 eth1  In  IP 10.0.23.2.57325 > 10.0.23.3.3784: BFDv1, Control, State Up, Flags: [none], length: 24
 00:00:00.488093 eth2  Out IP 10.0.34.2.46365 > 10.0.34.3.3784: BFDv1, Control, State Up, Flags: [none], length: 24
 00:00:00.503462 eth2  In  IP 10.0.34.3.41969 > 10.0.34.2.3784: BFDv1, Control, State Up, Flags: [none], length: 24
 00:00:00.511770 eth0  In  IP 10.0.13.2.57029 > 10.0.13.3.3784: BFDv1, Control, State Up, Flags: [none], length: 24
 00:00:00.516049 eth0  Out IP 10.0.13.3.41618 > 10.0.13.2.3784: BFDv1, Control, State Up, Flags: [none], length: 24
 00:00:00.521348 eth3  In  IP 10.0.35.3.46520 > 10.0.35.2.3784: BFDv1, Control, State Up, Flags: [none], length: 24
 00:00:00.526777 eth3  Out IP 10.0.35.2.60297 > 10.0.35.3.3784: BFDv1, Control, State Up, Flags: [none], length: 24
 00:00:00.557105 eth1  Out IP 10.0.23.3.33242 > 10.0.23.2.3784: BFDv1, Control, State Up, Flags: [none], length: 24
 00:00:00.562870 eth1  In  IP 10.0.23.2.57325 > 10.0.23.3.3784: BFDv1, Control, State Up, Flags: [none], length: 24
 00:00:00.569393 eth2  Out IP 10.0.34.2.46365 > 10.0.34.3.3784: BFDv1, Control, State Up, Flags: [none], length: 24
 00:00:00.581905 eth2  In  IP 10.0.34.3.41969 > 10.0.34.2.3784: BFDv1, Control, State Up, Flags: [none], length: 24
 00:00:00.592306 eth0  Out IP 10.0.13.3.41618 > 10.0.13.2.3784: BFDv1, Control, State Up, Flags: [none], length: 24
 00:00:00.595654 eth0  In  IP 10.0.13.2.57029 > 10.0.13.3.3784: BFDv1, Control, State Up, Flags: [none], length: 24
 00:00:00.603060 eth3  Out IP 10.0.35.2.60297 > 10.0.35.3.3784: BFDv1, Control, State Up, Flags: [none], length: 24
 00:00:00.609414 eth3  In  IP 10.0.35.3.46520 > 10.0.35.2.3784: BFDv1, Control, State Up, Flags: [none], length: 24
 00:00:00.642109 eth1  In  IP 10.0.23.2.57325 > 10.0.23.3.3784: BFDv1, Control, State Up, Flags: [none], length: 24
 00:00:00.646513 eth1  Out IP 10.0.23.3.33242 > 10.0.23.2.3784: BFDv1, Control, State Up, Flags: [none], length: 24
 00:00:00.652807 eth2  Out IP 10.0.34.2.46365 > 10.0.34.3.3784: BFDv1, Control, State Up, Flags: [none], length: 24
 00:00:00.661147 eth2  In  IP 10.0.34.3.41969 > 10.0.34.2.3784: BFDv1, Control, State Up, Flags: [none], length: 24
 00:00:00.669487 eth0  Out IP 10.0.13.3.41618 > 10.0.13.2.3784: BFDv1, Control, State Up, Flags: [none], length: 24
 00:00:00.673855 eth0  In  IP 10.0.13.2.57029 > 10.0.13.3.3784: BFDv1, Control, State Up, Flags: [none], length: 24
 00:00:00.682159 eth3  Out IP 10.0.35.2.60297 > 10.0.35.3.3784: BFDv1, Control, State Up, Flags: [none], length: 24
 00:00:00.694658 eth3  In  IP 10.0.35.3.46520 > 10.0.35.2.3784: BFDv1, Control, State Up, Flags: [none], length: 24
 00:00:00.727344 eth1  In  IP 10.0.23.2.57325 > 10.0.23.3.3784: BFDv1, Control, State Up, Flags: [none], length: 24
 00:00:00.729707 eth1  Out IP 10.0.23.3.33242 > 10.0.23.2.3784: BFDv1, Control, State Up, Flags: [none], length: 24
 00:00:00.738136 eth2  In  IP 10.0.34.3.41969 > 10.0.34.2.3784: BFDv1, Control, State Up, Flags: [none], length: 24
 00:00:00.739517 eth2  Out IP 10.0.34.2.46365 > 10.0.34.3.3784: BFDv1, Control, State Up, Flags: [none], length: 24
 00:00:00.755499 eth0  In  IP 10.0.13.2.57029 > 10.0.13.3.3784: BFDv1, Control, State Up, Flags: [none], length: 24
 00:00:00.756813 eth0  Out IP 10.0.13.3.41618 > 10.0.13.2.3784: BFDv1, Control, State Up, Flags: [none], length: 24
 00:00:00.761046 eth3  Out IP 10.0.35.2.60297 > 10.0.35.3.3784: BFDv1, Control, State Up, Flags: [none], length: 24
 00:00:00.777517 eth3  In  IP 10.0.35.3.46520 > 10.0.35.2.3784: BFDv1, Control, State Up, Flags: [none], length: 24
 00:00:00.803953 eth1  In  IP 10.0.23.2.57325 > 10.0.23.3.3784: BFDv1, Control, State Up, Flags: [none], length: 24
 00:00:00.813886 eth2  In  IP 10.0.34.3.41969 > 10.0.34.2.3784: BFDv1, Control, State Up, Flags: [none], length: 24
 00:00:00.819334 eth1  Out IP 10.0.23.3.33242 > 10.0.23.2.3784: BFDv1, Control, State Up, Flags: [none], length: 24
 00:00:00.826638 eth2  Out IP 10.0.34.2.46365 > 10.0.34.3.3784: BFDv1, Control, State Up, Flags: [none], length: 24
 00:00:00.842553 eth0  In  IP 10.0.13.2.57029 > 10.0.13.3.3784: BFDv1, Control, State Up, Flags: [none], length: 24
 00:00:00.846857 eth0  Out IP 10.0.13.3.41618 > 10.0.13.2.3784: BFDv1, Control, State Up, Flags: [none], length: 24
 00:00:00.849082 eth3  Out IP 10.0.35.2.60297 > 10.0.35.3.3784: BFDv1, Control, State Up, Flags: [none], length: 24
 00:00:00.857393 eth3  In  IP 10.0.35.3.46520 > 10.0.35.2.3784: BFDv1, Control, State Up, Flags: [none], length: 24
 00:00:00.882814 eth1  In  IP 10.0.23.2.57325 > 10.0.23.3.3784: BFDv1, Control, State Up, Flags: [none], length: 24
 00:00:00.890121 eth2  In  IP 10.0.34.3.41969 > 10.0.34.2.3784: BFDv1, Control, State Up, Flags: [none], length: 24
 00:00:00.901421 eth1  Out IP 10.0.23.3.33242 > 10.0.23.2.3784: BFDv1, Control, State Up, Flags: [none], length: 24
 00:00:00.907677 eth2  Out IP 10.0.34.2.46365 > 10.0.34.3.3784: BFDv1, Control, State Up, Flags: [none], length: 24
 00:00:00.926354 eth0  In  IP 10.0.13.2.57029 > 10.0.13.3.3784: BFDv1, Control, State Up, Flags: [none], length: 24
 00:00:00.935054 eth0  Out IP 10.0.13.3.41618 > 10.0.13.2.3784: BFDv1, Control, State Up, Flags: [none], length: 24
 00:00:00.937313 eth3  Out IP 10.0.35.2.60297 > 10.0.35.3.3784: BFDv1, Control, State Up, Flags: [none], length: 24
 00:00:00.939617 eth3  In  IP 10.0.35.3.46520 > 10.0.35.2.3784: BFDv1, Control, State Up, Flags: [none], length: 24
 00:00:00.959104 eth1  In  IP 10.0.23.2.57325 > 10.0.23.3.3784: BFDv1, Control, State Up, Flags: [none], length: 24
 00:00:00.971367 eth2  In  IP 10.0.34.3.41969 > 10.0.34.2.3784: BFDv1, Control, State Up, Flags: [none], length: 24
 00:00:00.986751 eth2  Out IP 10.0.34.2.46365 > 10.0.34.3.3784: BFDv1, Control, State Up, Flags: [none], length: 24
 00:00:00.988920 eth1  Out IP 10.0.23.3.33242 > 10.0.23.2.3784: BFDv1, Control, State Up, Flags: [none], length: 24
 00:00:01.007238 eth0  In  IP 10.0.13.2.57029 > 10.0.13.3.3784: BFDv1, Control, State Up, Flags: [none], length: 24
 00:00:01.015624 eth3  Out IP 10.0.35.2.60297 > 10.0.35.3.3784: BFDv1, Control, State Up, Flags: [none], length: 24
 00:00:01.017904 eth3  In  IP 10.0.35.3.46520 > 10.0.35.2.3784: BFDv1, Control, State Up, Flags: [none], length: 24
 00:00:01.024282 eth0  Out IP 10.0.13.3.41618 > 10.0.13.2.3784: BFDv1, Control, State Up, Flags: [none], length: 24
 00:00:01.036361 eth1  In  IP 10.0.23.2.57325 > 10.0.23.3.3784: BFDv1, Control, State Up, Flags: [none], length: 24
 00:00:01.057837 eth2  In  IP 10.0.34.3.41969 > 10.0.34.2.3784: BFDv1, Control, State Up, Flags: [none], length: 24
 00:00:01.071171 eth2  Out IP 10.0.34.2.46365 > 10.0.34.3.3784: BFDv1, Control, State Up, Flags: [none], length: 24
 00:00:01.071233 eth1  Out IP 10.0.23.3.33242 > 10.0.23.2.3784: BFDv1, Control, State Up, Flags: [none], length: 24
 00:00:01.084772 eth0  In  IP 10.0.13.2.57029 > 10.0.13.3.3784: BFDv1, Control, State Up, Flags: [none], length: 24
 00:00:01.100138 eth3  Out IP 10.0.35.2.60297 > 10.0.35.3.3784: BFDv1, Control, State Up, Flags: [none], length: 24
 00:00:01.100232 eth0  Out IP 10.0.13.3.41618 > 10.0.13.2.3784: BFDv1, Control, State Up, Flags: [none], length: 24
 00:00:01.108430 eth3  In  IP 10.0.35.3.46520 > 10.0.35.2.3784: BFDv1, Control, State Up, Flags: [none], length: 24
 00:00:01.118609 eth1  In  IP 10.0.23.2.57325 > 10.0.23.3.3784: BFDv1, Control, State Up, Flags: [none], length: 24
 00:00:01.144273 eth2  In  IP 10.0.34.3.41969 > 10.0.34.2.3784: BFDv1, Control, State Up, Flags: [none], length: 24
 00:00:01.149587 eth2  Out IP 10.0.34.2.46365 > 10.0.34.3.3784: BFDv1, Control, State Up, Flags: [none], length: 24
 00:00:01.155894 eth1  Out IP 10.0.23.3.33242 > 10.0.23.2.3784: BFDv1, Control, State Up, Flags: [none], length: 24
 00:00:01.171164 eth0  In  IP 10.0.13.2.57029 > 10.0.13.3.3784: BFDv1, Control, State Up, Flags: [none], length: 24
 00:00:01.181535 eth3  Out IP 10.0.35.2.60297 > 10.0.35.3.3784: BFDv1, Control, State Up, Flags: [none], length: 24
 00:00:01.186822 eth0  Out IP 10.0.13.3.41618 > 10.0.13.2.3784: BFDv1, Control, State Up, Flags: [none], length: 24
 00:00:01.189770 eth3  In  IP 10.0.35.3.46520 > 10.0.35.2.3784: BFDv1, Control, State Up, Flags: [none], length: 24
 00:00:01.202311 eth1  In  IP 10.0.23.2.57325 > 10.0.23.3.3784: BFDv1, Control, State Up, Flags: [none], length: 24
 00:00:01.221714 eth2  In  IP 10.0.34.3.41969 > 10.0.34.2.3784: BFDv1, Control, State Up, Flags: [none], length: 24
 00:00:01.225110 eth2  Out IP 10.0.34.2.46365 > 10.0.34.3.3784: BFDv1, Control, State Up, Flags: [none], length: 24
 00:00:01.237374 eth1  Out IP 10.0.23.3.33242 > 10.0.23.2.3784: BFDv1, Control, State Up, Flags: [none], length: 24
 00:00:01.248781 eth0  In  IP 10.0.13.2.57029 > 10.0.13.3.3784: BFDv1, Control, State Up, Flags: [none], length: 24
 00:00:01.262120 eth0  Out IP 10.0.13.3.41618 > 10.0.13.2.3784: BFDv1, Control, State Up, Flags: [none], length: 24
 00:00:01.268380 eth3  Out IP 10.0.35.2.60297 > 10.0.35.3.3784: BFDv1, Control, State Up, Flags: [none], length: 24
 00:00:01.269617 eth3  In  IP 10.0.35.3.46520 > 10.0.35.2.3784: BFDv1, Control, State Up, Flags: [none], length: 24
 00:00:01.288244 eth1  In  IP 10.0.23.2.57325 > 10.0.23.3.3784: BFDv1, Control, State Up, Flags: [none], length: 24
 00:00:01.300580 eth2  Out IP 10.0.34.2.46365 > 10.0.34.3.3784: BFDv1, Control, State Up, Flags: [none], length: 24
 00:00:01.302845 eth2  In  IP 10.0.34.3.41969 > 10.0.34.2.3784: BFDv1, Control, State Up, Flags: [none], length: 24
 00:00:01.327284 eth1  Out IP 10.0.23.3.33242 > 10.0.23.2.3784: BFDv1, Control, State Up, Flags: [none], length: 24
 00:00:01.334660 eth0  In  IP 10.0.13.2.57029 > 10.0.13.3.3784: BFDv1, Control, State Up, Flags: [none], length: 24
 00:00:01.342343 eth0  Out IP 10.0.13.3.41618 > 10.0.13.2.3784: BFDv1, Control, State Up, Flags: [none], length: 24
 00:00:01.346998 eth3  In  IP 10.0.35.3.46520 > 10.0.35.2.3784: BFDv1, Control, State Up, Flags: [none], length: 24
 00:00:01.352358 eth3  Out IP 10.0.35.2.60297 > 10.0.35.3.3784: BFDv1, Control, State Up, Flags: [none], length: 24
 00:00:01.375783 eth1  In  IP 10.0.23.2.57325 > 10.0.23.3.3784: BFDv1, Control, State Up, Flags: [none], length: 24
 00:00:01.386127 eth2  Out IP 10.0.34.2.46365 > 10.0.34.3.3784: BFDv1, Control, State Up, Flags: [none], length: 24
 00:00:01.390387 eth2  In  IP 10.0.34.3.41969 > 10.0.34.2.3784: BFDv1, Control, State Up, Flags: [none], length: 24
 00:00:01.403787 eth1  Out IP 10.0.23.3.33242 > 10.0.23.2.3784: BFDv1, Control, State Up, Flags: [none], length: 24
 00:00:01.411996 eth0  In  IP 10.0.13.2.57029 > 10.0.13.3.3784: BFDv1, Control, State Up, Flags: [none], length: 24
 00:00:01.427449 eth3  In  IP 10.0.35.3.46520 > 10.0.35.2.3784: BFDv1, Control, State Up, Flags: [none], length: 24
 00:00:01.428760 eth0  Out IP 10.0.13.3.41618 > 10.0.13.2.3784: BFDv1, Control, State Up, Flags: [none], length: 24
 00:00:01.437018 eth3  Out IP 10.0.35.2.60297 > 10.0.35.3.3784: BFDv1, Control, State Up, Flags: [none], length: 24
 00:00:01.455438 eth1  In  IP 10.0.23.2.57325 > 10.0.23.3.3784: BFDv1, Control, State Up, Flags: [none], length: 24
 00:00:01.470616 eth2  In  IP 10.0.34.3.41969 > 10.0.34.2.3784: BFDv1, Control, State Up, Flags: [none], length: 24
 00:00:01.473314 eth2  Out IP 10.0.34.2.46365 > 10.0.34.3.3784: BFDv1, Control, State Up, Flags: [none], length: 24
 00:00:01.487842 eth0  In  IP 10.0.13.2.57029 > 10.0.13.3.3784: BFDv1, Control, State Up, Flags: [none], length: 24
 00:00:01.489133 eth1  Out IP 10.0.23.3.33242 > 10.0.23.2.3784: BFDv1, Control, State Up, Flags: [none], length: 24
 00:00:01.505255 eth3  In  IP 10.0.35.3.46520 > 10.0.35.2.3784: BFDv1, Control, State Up, Flags: [none], length: 24
 00:00:01.511656 eth0  Out IP 10.0.13.3.41618 > 10.0.13.2.3784: BFDv1, Control, State Up, Flags: [none], length: 24
 00:00:01.516883 eth3  Out IP 10.0.35.2.60297 > 10.0.35.3.3784: BFDv1, Control, State Up, Flags: [none], length: 24
 00:00:01.534511 eth1  In  IP 10.0.23.2.57325 > 10.0.23.3.3784: BFDv1, Control, State Up, Flags: [none], length: 24
 00:00:01.551816 eth2  Out IP 10.0.34.2.46365 > 10.0.34.3.3784: BFDv1, Control, State Up, Flags: [none], length: 24
 00:00:01.555042 eth2  In  IP 10.0.34.3.41969 > 10.0.34.2.3784: BFDv1, Control, State Up, Flags: [none], length: 24
 00:00:01.563893 eth0  In  IP 10.0.13.2.57029 > 10.0.13.3.3784: BFDv1, Control, State Up, Flags: [none], length: 24
 00:00:01.569384 eth1  Out IP 10.0.23.3.33242 > 10.0.23.2.3784: BFDv1, Control, State Up, Flags: [none], length: 24
 00:00:01.589767 eth0  Out IP 10.0.13.3.41618 > 10.0.13.2.3784: BFDv1, Control, State Up, Flags: [none], length: 24
 00:00:01.591017 eth3  In  IP 10.0.35.3.46520 > 10.0.35.2.3784: BFDv1, Control, State Up, Flags: [none], length: 24
 00:00:01.606575 eth3  Out IP 10.0.35.2.60297 > 10.0.35.3.3784: BFDv1, Control, State Up, Flags: [none], length: 24
 00:00:01.615108 eth1  In  IP 10.0.23.2.57325 > 10.0.23.3.3784: BFDv1, Control, State Up, Flags: [none], length: 24
 00:00:01.635525 eth2  Out IP 10.0.34.2.46365 > 10.0.34.3.3784: BFDv1, Control, State Up, Flags: [none], length: 24
 00:00:01.636740 eth2  In  IP 10.0.34.3.41969 > 10.0.34.2.3784: BFDv1, Control, State Up, Flags: [none], length: 24
 00:00:01.644173 eth0  In  IP 10.0.13.2.57029 > 10.0.13.3.3784: BFDv1, Control, State Up, Flags: [none], length: 24
 00:00:01.646495 eth1  Out IP 10.0.23.3.33242 > 10.0.23.2.3784: BFDv1, Control, State Up, Flags: [none], length: 24
 00:00:01.666736 eth0  Out IP 10.0.13.3.41618 > 10.0.13.2.3784: BFDv1, Control, State Up, Flags: [none], length: 24
 00:00:01.672220 eth3  In  IP 10.0.35.3.46520 > 10.0.35.2.3784: BFDv1, Control, State Up, Flags: [none], length: 24
 00:00:01.684543 eth3  Out IP 10.0.35.2.60297 > 10.0.35.3.3784: BFDv1, Control, State Up, Flags: [none], length: 24
 00:00:01.695360 eth1  In  IP 10.0.23.2.57325 > 10.0.23.3.3784: BFDv1, Control, State Up, Flags: [none], length: 24
 00:00:01.719786 eth2  Out IP 10.0.34.2.46365 > 10.0.34.3.3784: BFDv1, Control, State Up, Flags: [none], length: 24
 00:00:01.719941 eth2  In  IP 10.0.34.3.41969 > 10.0.34.2.3784: BFDv1, Control, State Up, Flags: [none], length: 24
 00:00:01.721819 eth0  In  IP 10.0.13.2.57029 > 10.0.13.3.3784: BFDv1, Control, State Up, Flags: [none], length: 24
 00:00:01.734058 eth1  Out IP 10.0.23.3.33242 > 10.0.23.2.3784: BFDv1, Control, State Up, Flags: [none], length: 24
 00:00:01.745250 eth0  Out IP 10.0.13.3.41618 > 10.0.13.2.3784: BFDv1, Control, State Up, Flags: [none], length: 24
 00:00:01.750554 eth3  In  IP 10.0.35.3.46520 > 10.0.35.2.3784: BFDv1, Control, State Up, Flags: [none], length: 24
 00:00:01.770912 eth3  Out IP 10.0.35.2.60297 > 10.0.35.3.3784: BFDv1, Control, State Up, Flags: [none], length: 24
 00:00:01.773467 eth1  In  IP 10.0.23.2.57325 > 10.0.23.3.3784: BFDv1, Control, State Up, Flags: [none], length: 24
 00:00:01.797374 eth2  In  IP 10.0.34.3.41969 > 10.0.34.2.3784: BFDv1, Control, State Up, Flags: [none], length: 24
 00:00:01.799832 eth0  In  IP 10.0.13.2.57029 > 10.0.13.3.3784: BFDv1, Control, State Up, Flags: [none], length: 24
 00:00:01.801033 eth2  Out IP 10.0.34.2.46365 > 10.0.34.3.3784: BFDv1, Control, State Up, Flags: [none], length: 24
 00:00:01.818238 eth1  Out IP 10.0.23.3.33242 > 10.0.23.2.3784: BFDv1, Control, State Up, Flags: [none], length: 24
 00:00:01.829467 eth0  Out IP 10.0.13.3.41618 > 10.0.13.2.3784: BFDv1, Control, State Up, Flags: [none], length: 24
 00:00:01.831066 eth3  In  IP 10.0.35.3.46520 > 10.0.35.2.3784: BFDv1, Control, State Up, Flags: [none], length: 24
 00:00:01.850407 eth1  In  IP 10.0.23.2.57325 > 10.0.23.3.3784: BFDv1, Control, State Up, Flags: [none], length: 24
 00:00:01.853744 eth3  Out IP 10.0.35.2.60297 > 10.0.35.3.3784: BFDv1, Control, State Up, Flags: [none], length: 24
 00:00:01.876130 eth0  In  IP 10.0.13.2.57029 > 10.0.13.3.3784: BFDv1, Control, State Up, Flags: [none], length: 24
 00:00:01.877463 eth2  Out IP 10.0.34.2.46365 > 10.0.34.3.3784: BFDv1, Control, State Up, Flags: [none], length: 24
 00:00:01.884832 eth2  In  IP 10.0.34.3.41969 > 10.0.34.2.3784: BFDv1, Control, State Up, Flags: [none], length: 24
 00:00:01.899272 eth1  Out IP 10.0.23.3.33242 > 10.0.23.2.3784: BFDv1, Control, State Up, Flags: [none], length: 24
 00:00:01.907743 eth3  In  IP 10.0.35.3.46520 > 10.0.35.2.3784: BFDv1, Control, State Up, Flags: [none], length: 24
 00:00:01.911153 eth0  Out IP 10.0.13.3.41618 > 10.0.13.2.3784: BFDv1, Control, State Up, Flags: [none], length: 24
 00:00:01.930429 eth3  Out IP 10.0.35.2.60297 > 10.0.35.3.3784: BFDv1, Control, State Up, Flags: [none], length: 24
 00:00:01.938641 eth1  In  IP 10.0.23.2.57325 > 10.0.23.3.3784: BFDv1, Control, State Up, Flags: [none], length: 24
 00:00:01.958045 eth2  Out IP 10.0.34.2.46365 > 10.0.34.3.3784: BFDv1, Control, State Up, Flags: [none], length: 24
 00:00:01.960181 eth2  In  IP 10.0.34.3.41969 > 10.0.34.2.3784: BFDv1, Control, State Up, Flags: [none], length: 24
 00:00:01.963970 eth0  In  IP 10.0.13.2.57029 > 10.0.13.3.3784: BFDv1, Control, State Up, Flags: [none], length: 24
 00:00:01.985596 eth1  Out IP 10.0.23.3.33242 > 10.0.23.2.3784: BFDv1, Control, State Up, Flags: [none], length: 24
 00:00:01.994206 eth3  In  IP 10.0.35.3.46520 > 10.0.35.2.3784: BFDv1, Control, State Up, Flags: [none], length: 24
 00:00:01.996623 eth0  Out IP 10.0.13.3.41618 > 10.0.13.2.3784: BFDv1, Control, State Up, Flags: [none], length: 24
 00:00:02.006018 eth3  Out IP 10.0.35.2.60297 > 10.0.35.3.3784: BFDv1, Control, State Up, Flags: [none], length: 24
 00:00:02.027070 eth1  In  IP 10.0.23.2.57325 > 10.0.23.3.3784: BFDv1, Control, State Up, Flags: [none], length: 24
 00:00:02.049258 eth0  In  IP 10.0.13.2.57029 > 10.0.13.3.3784: BFDv1, Control, State Up, Flags: [none], length: 24
 00:00:02.067700 eth1  Out IP 10.0.23.3.33242 > 10.0.23.2.3784: BFDv1, Control, State Up, Flags: [none], length: 24
 00:00:02.071537 eth3  In  IP 10.0.35.3.46520 > 10.0.35.2.3784: BFDv1, Control, State Up, Flags: [none], length: 24
 00:00:02.081919 eth0  Out IP 10.0.13.3.41618 > 10.0.13.2.3784: BFDv1, Control, State Up, Flags: [none], length: 24
 00:00:02.091231 eth3  Out IP 10.0.35.2.60297 > 10.0.35.3.3784: BFDv1, Control, State Up, Flags: [none], length: 24
 00:00:02.117112 eth1  In  IP 10.0.23.2.57325 > 10.0.23.3.3784: BFDv1, Control, State Up, Flags: [none], length: 24
 00:00:02.130337 eth0  In  IP 10.0.13.2.57029 > 10.0.13.3.3784: BFDv1, Control, State Up, Flags: [none], length: 24
 00:00:02.145737 eth1  Out IP 10.0.23.3.33242 > 10.0.23.2.3784: BFDv1, Control, State Up, Flags: [none], length: 24
 00:00:02.151047 eth3  In  IP 10.0.35.3.46520 > 10.0.35.2.3784: BFDv1, Control, State Up, Flags: [none], length: 24
 00:00:02.158435 eth0  Out IP 10.0.13.3.41618 > 10.0.13.2.3784: BFDv1, Control, State Up, Flags: [none], length: 24
 00:00:02.165719 eth3  Out IP 10.0.35.2.60297 > 10.0.35.3.3784: BFDv1, Control, State Up, Flags: [none], length: 24
 00:00:02.199401 eth1  In  IP 10.0.23.2.57325 > 10.0.23.3.3784: BFDv1, Control, State Up, Flags: [none], length: 24
 00:00:02.215698 eth0  In  IP 10.0.13.2.57029 > 10.0.13.3.3784: BFDv1, Control, State Up, Flags: [none], length: 24
 00:00:02.226187 eth1  Out IP 10.0.23.3.33242 > 10.0.23.2.3784: BFDv1, Control, State Up, Flags: [none], length: 24
 00:00:02.236541 eth3  In  IP 10.0.35.3.46520 > 10.0.35.2.3784: BFDv1, Control, State Up, Flags: [none], length: 24
 00:00:02.240898 eth0  Out IP 10.0.13.3.41618 > 10.0.13.2.3784: BFDv1, Control, State Up, Flags: [none], length: 24
 00:00:02.244119 eth3  Out IP 10.0.35.2.60297 > 10.0.35.3.3784: BFDv1, Control, State Up, Flags: [none], length: 24
 00:00:02.277952 eth1  In  IP 10.0.23.2.57325 > 10.0.23.3.3784: BFDv1, Control, State Up, Flags: [none], length: 24
 00:00:02.301427 eth0  In  IP 10.0.13.2.57029 > 10.0.13.3.3784: BFDv1, Control, State Up, Flags: [none], length: 24
 00:00:02.305878 eth1  Out IP 10.0.23.3.33242 > 10.0.23.2.3784: BFDv1, Control, State Up, Flags: [none], length: 24
 00:00:02.316175 eth0  Out IP 10.0.13.3.41618 > 10.0.13.2.3784: BFDv1, Control, State Up, Flags: [none], length: 24
 00:00:02.321827 eth3  In  IP 10.0.35.3.46520 > 10.0.35.2.3784: BFDv1, Control, State Up, Flags: [none], length: 24
 00:00:02.324138 eth3  Out IP 10.0.35.2.60297 > 10.0.35.3.3784: BFDv1, Control, State Up, Flags: [none], length: 24
 00:00:02.364541 eth1  In  IP 10.0.23.2.57325 > 10.0.23.3.3784: BFDv1, Control, State Up, Flags: [none], length: 24
 00:00:02.376803 eth0  In  IP 10.0.13.2.57029 > 10.0.13.3.3784: BFDv1, Control, State Up, Flags: [none], length: 24
 00:00:02.388254 eth1  Out IP 10.0.23.3.33242 > 10.0.23.2.3784: BFDv1, Control, State Up, Flags: [none], length: 24
 00:00:02.394618 eth0  Out IP 10.0.13.3.41618 > 10.0.13.2.3784: BFDv1, Control, State Up, Flags: [none], length: 24
 00:00:02.399057 eth3  In  IP 10.0.35.3.46520 > 10.0.35.2.3784: BFDv1, Control, State Up, Flags: [none], length: 24
 00:00:02.413509 eth3  Out IP 10.0.35.2.60297 > 10.0.35.3.3784: BFDv1, Control, State Up, Flags: [none], length: 24
 00:00:02.444651 eth1  In  IP 10.0.23.2.57325 > 10.0.23.3.3784: BFDv1, Control, State Up, Flags: [none], length: 24
 00:00:02.463398 eth0  In  IP 10.0.13.2.57029 > 10.0.13.3.3784: BFDv1, Control, State Up, Flags: [none], length: 24
 00:00:02.466700 eth1  Out IP 10.0.23.3.33242 > 10.0.23.2.3784: BFDv1, Control, State Up, Flags: [none], length: 24
 00:00:02.475956 eth0  Out IP 10.0.13.3.41618 > 10.0.13.2.3784: BFDv1, Control, State Up, Flags: [none], length: 24
 00:00:02.483280 eth3  In  IP 10.0.35.3.46520 > 10.0.35.2.3784: BFDv1, Control, State Up, Flags: [none], length: 24
 00:00:02.500596 eth3  Out IP 10.0.35.2.60297 > 10.0.35.3.3784: BFDv1, Control, State Up, Flags: [none], length: 24
 00:00:02.523672 eth1  In  IP 10.0.23.2.57325 > 10.0.23.3.3784: BFDv1, Control, State Up, Flags: [none], length: 24
 00:00:02.550313 eth0  In  IP 10.0.13.2.57029 > 10.0.13.3.3784: BFDv1, Control, State Up, Flags: [none], length: 24
 00:00:02.551584 eth1  Out IP 10.0.23.3.33242 > 10.0.23.2.3784: BFDv1, Control, State Up, Flags: [none], length: 24
 00:00:02.551641 eth0  Out IP 10.0.13.3.41618 > 10.0.13.2.3784: BFDv1, Control, State Up, Flags: [none], length: 24
 00:00:02.562511 eth3  In  IP 10.0.35.3.46520 > 10.0.35.2.3784: BFDv1, Control, State Up, Flags: [none], length: 24
 00:00:02.579916 eth3  Out IP 10.0.35.2.60297 > 10.0.35.3.3784: BFDv1, Control, State Up, Flags: [none], length: 24
 00:00:02.612898 eth1  In  IP 10.0.23.2.57325 > 10.0.23.3.3784: BFDv1, Control, State Up, Flags: [none], length: 24
 00:00:02.626323 eth0  In  IP 10.0.13.2.57029 > 10.0.13.3.3784: BFDv1, Control, State Up, Flags: [none], length: 24
 00:00:02.627627 eth1  Out IP 10.0.23.3.33242 > 10.0.23.2.3784: BFDv1, Control, State Up, Flags: [none], length: 24
 00:00:02.628894 eth0  Out IP 10.0.13.3.41618 > 10.0.13.2.3784: BFDv1, Control, State Up, Flags: [none], length: 24
 00:00:02.639560 eth3  In  IP 10.0.35.3.46520 > 10.0.35.2.3784: BFDv1, Control, State Up, Flags: [none], length: 24
 00:00:02.665962 eth3  Out IP 10.0.35.2.60297 > 10.0.35.3.3784: BFDv1, Control, State Up, Flags: [none], length: 24
 00:00:02.702831 eth1  In  IP 10.0.23.2.57325 > 10.0.23.3.3784: BFDv1, Control, State Up, Flags: [none], length: 24
 00:00:02.704123 eth0  In  IP 10.0.13.2.57029 > 10.0.13.3.3784: BFDv1, Control, State Up, Flags: [none], length: 24
 00:00:02.706455 eth0  Out IP 10.0.13.3.41618 > 10.0.13.2.3784: BFDv1, Control, State Up, Flags: [none], length: 24
 00:00:02.710687 eth1  Out IP 10.0.23.3.33242 > 10.0.23.2.3784: BFDv1, Control, State Up, Flags: [none], length: 24
 00:00:02.721748 eth3  In  IP 10.0.35.3.46520 > 10.0.35.2.3784: BFDv1, Control, State Up, Flags: [none], length: 24
 00:00:02.741029 eth3  Out IP 10.0.35.2.60297 > 10.0.35.3.3784: BFDv1, Control, State Up, Flags: [none], length: 24
 00:00:02.778365 eth1  In  IP 10.0.23.2.57325 > 10.0.23.3.3784: BFDv1, Control, State Up, Flags: [none], length: 24
 00:00:02.786393 eth0  In  IP 10.0.13.2.57029 > 10.0.13.3.3784: BFDv1, Control, State Up, Flags: [none], length: 24
 00:00:02.786615 eth0  Out IP 10.0.13.3.41618 > 10.0.13.2.3784: BFDv1, Control, State Up, Flags: [none], length: 24
 00:00:02.798899 eth1  Out IP 10.0.23.3.33242 > 10.0.23.2.3784: BFDv1, Control, State Up, Flags: [none], length: 24
 00:00:02.807797 eth3  In  IP 10.0.35.3.46520 > 10.0.35.2.3784: BFDv1, Control, State Up, Flags: [none], length: 24
 00:00:02.818090 eth3  Out IP 10.0.35.2.60297 > 10.0.35.3.3784: BFDv1, Control, State Up, Flags: [none], length: 24
 00:00:02.858564 eth1  In  IP 10.0.23.2.57325 > 10.0.23.3.3784: BFDv1, Control, State Up, Flags: [none], length: 24
 00:00:02.863871 eth0  Out IP 10.0.13.3.41618 > 10.0.13.2.3784: BFDv1, Control, State Up, Flags: [none], length: 24
 00:00:02.873096 eth0  In  IP 10.0.13.2.57029 > 10.0.13.3.3784: BFDv1, Control, State Up, Flags: [none], length: 24
 00:00:02.877497 eth1  Out IP 10.0.23.3.33242 > 10.0.23.2.3784: BFDv1, Control, State Up, Flags: [none], length: 24
 00:00:02.891793 eth3  In  IP 10.0.35.3.46520 > 10.0.35.2.3784: BFDv1, Control, State Up, Flags: [none], length: 24
 00:00:02.904184 eth3  Out IP 10.0.35.2.60297 > 10.0.35.3.3784: BFDv1, Control, State Up, Flags: [none], length: 24
 00:00:02.943519 eth1  In  IP 10.0.23.2.57325 > 10.0.23.3.3784: BFDv1, Control, State Up, Flags: [none], length: 24
 00:00:02.951907 eth0  Out IP 10.0.13.3.41618 > 10.0.13.2.3784: BFDv1, Control, State Up, Flags: [none], length: 24
 00:00:02.952049 eth0  In  IP 10.0.13.2.57029 > 10.0.13.3.3784: BFDv1, Control, State Up, Flags: [none], length: 24
 00:00:02.959358 eth1  Out IP 10.0.23.3.33242 > 10.0.23.2.3784: BFDv1, Control, State Up, Flags: [none], length: 24
 00:00:02.981992 eth3  In  IP 10.0.35.3.46520 > 10.0.35.2.3784: BFDv1, Control, State Up, Flags: [none], length: 24
 00:00:02.992502 eth3  Out IP 10.0.35.2.60297 > 10.0.35.3.3784: BFDv1, Control, State Up, Flags: [none], length: 24
 00:00:03.028612 eth0  In  IP 10.0.13.2.57029 > 10.0.13.3.3784: BFDv1, Control, State Up, Flags: [none], length: 24
 00:00:03.030391 eth1  In  IP 10.0.23.2.57325 > 10.0.23.3.3784: BFDv1, Control, State Up, Flags: [none], length: 24
 00:00:03.040124 eth0  Out IP 10.0.13.3.41618 > 10.0.13.2.3784: BFDv1, Control, State Up, Flags: [none], length: 24
 00:00:03.046372 eth1  Out IP 10.0.23.3.33242 > 10.0.23.2.3784: BFDv1, Control, State Up, Flags: [none], length: 24
 00:00:03.070272 eth3  In  IP 10.0.35.3.46520 > 10.0.35.2.3784: BFDv1, Control, State Up, Flags: [none], length: 24
 00:00:03.072626 eth3  Out IP 10.0.35.2.60297 > 10.0.35.3.3784: BFDv1, Control, State Up, Flags: [none], length: 24
 00:00:03.107185 eth0  In  IP 10.0.13.2.57029 > 10.0.13.3.3784: BFDv1, Control, State Up, Flags: [none], length: 24
 00:00:03.107277 eth1  In  IP 10.0.23.2.57325 > 10.0.23.3.3784: BFDv1, Control, State Up, Flags: [none], length: 24
 00:00:03.115518 eth0  Out IP 10.0.13.3.41618 > 10.0.13.2.3784: BFDv1, Control, State Up, Flags: [none], length: 24
 00:00:03.122756 eth1  Out IP 10.0.23.3.33242 > 10.0.23.2.3784: BFDv1, Control, State Up, Flags: [none], length: 24
 00:00:03.153005 eth3  Out IP 10.0.35.2.60297 > 10.0.35.3.3784: BFDv1, Control, State Up, Flags: [none], length: 24
 00:00:03.159249 eth3  In  IP 10.0.35.3.46520 > 10.0.35.2.3784: BFDv1, Control, State Up, Flags: [none], length: 24
 00:00:03.182768 eth1  In  IP 10.0.23.2.57325 > 10.0.23.3.3784: BFDv1, Control, State Up, Flags: [none], length: 24
 00:00:03.196046 eth0  In  IP 10.0.13.2.57029 > 10.0.13.3.3784: BFDv1, Control, State Up, Flags: [none], length: 24
 00:00:03.196162 eth0  Out IP 10.0.13.3.41618 > 10.0.13.2.3784: BFDv1, Control, State Up, Flags: [none], length: 24
 00:00:03.206393 eth1  Out IP 10.0.23.3.33242 > 10.0.23.2.3784: BFDv1, Control, State Up, Flags: [none], length: 24
 00:00:03.237640 eth3  Out IP 10.0.35.2.60297 > 10.0.35.3.3784: BFDv1, Control, State Up, Flags: [none], length: 24
 00:00:03.248891 eth3  In  IP 10.0.35.3.46520 > 10.0.35.2.3784: BFDv1, Control, State Up, Flags: [none], length: 24
 00:00:03.262231 eth1  In  IP 10.0.23.2.57325 > 10.0.23.3.3784: BFDv1, Control, State Up, Flags: [none], length: 24
 00:00:03.275610 eth0  Out IP 10.0.13.3.41618 > 10.0.13.2.3784: BFDv1, Control, State Up, Flags: [none], length: 24
 00:00:03.276862 eth0  In  IP 10.0.13.2.57029 > 10.0.13.3.3784: BFDv1, Control, State Up, Flags: [none], length: 24
 00:00:03.293212 eth1  Out IP 10.0.23.3.33242 > 10.0.23.2.3784: BFDv1, Control, State Up, Flags: [none], length: 24
 00:00:03.312490 eth3  Out IP 10.0.35.2.60297 > 10.0.35.3.3784: BFDv1, Control, State Up, Flags: [none], length: 24
 00:00:03.337754 eth3  In  IP 10.0.35.3.46520 > 10.0.35.2.3784: BFDv1, Control, State Up, Flags: [none], length: 24
 00:00:03.340283 eth1  In  IP 10.0.23.2.57325 > 10.0.23.3.3784: BFDv1, Control, State Up, Flags: [none], length: 24
 00:00:03.350633 eth0  Out IP 10.0.13.3.41618 > 10.0.13.2.3784: BFDv1, Control, State Up, Flags: [none], length: 24
 00:00:03.356866 eth0  In  IP 10.0.13.2.57029 > 10.0.13.3.3784: BFDv1, Control, State Up, Flags: [none], length: 24
 00:00:03.375155 eth1  Out IP 10.0.23.3.33242 > 10.0.23.2.3784: BFDv1, Control, State Up, Flags: [none], length: 24
 00:00:03.388425 eth3  Out IP 10.0.35.2.60297 > 10.0.35.3.3784: BFDv1, Control, State Up, Flags: [none], length: 24
 00:00:03.425660 eth1  In  IP 10.0.23.2.57325 > 10.0.23.3.3784: BFDv1, Control, State Up, Flags: [none], length: 24
 00:00:03.426782 eth3  In  IP 10.0.35.3.46520 > 10.0.35.2.3784: BFDv1, Control, State Up, Flags: [none], length: 24
 00:00:03.431104 eth0  Out IP 10.0.13.3.41618 > 10.0.13.2.3784: BFDv1, Control, State Up, Flags: [none], length: 24
 00:00:03.437988 eth0  In  IP 10.0.13.2.57029 > 10.0.13.3.3784: BFDv1, Control, State Up, Flags: [none], length: 24
 00:00:03.457327 eth1  Out IP 10.0.23.3.33242 > 10.0.23.2.3784: BFDv1, Control, State Up, Flags: [none], length: 24
 00:00:03.465573 eth3  Out IP 10.0.35.2.60297 > 10.0.35.3.3784: BFDv1, Control, State Up, Flags: [none], length: 24
 00:00:03.506797 eth0  Out IP 10.0.13.3.41618 > 10.0.13.2.3784: BFDv1, Control, State Up, Flags: [none], length: 24
 00:00:03.509954 eth3  In  IP 10.0.35.3.46520 > 10.0.35.2.3784: BFDv1, Control, State Up, Flags: [none], length: 24
 00:00:03.511149 eth1  In  IP 10.0.23.2.57325 > 10.0.23.3.3784: BFDv1, Control, State Up, Flags: [none], length: 24
 00:00:03.515058 eth0  In  IP 10.0.13.2.57029 > 10.0.13.3.3784: BFDv1, Control, State Up, Flags: [none], length: 24
 00:00:03.533425 eth1  Out IP 10.0.23.3.33242 > 10.0.23.2.3784: BFDv1, Control, State Up, Flags: [none], length: 24
 00:00:03.545708 eth3  Out IP 10.0.35.2.60297 > 10.0.35.3.3784: BFDv1, Control, State Up, Flags: [none], length: 24
 00:00:03.583952 eth0  Out IP 10.0.13.3.41618 > 10.0.13.2.3784: BFDv1, Control, State Up, Flags: [none], length: 24
 00:00:03.588939 eth3  In  IP 10.0.35.3.46520 > 10.0.35.2.3784: BFDv1, Control, State Up, Flags: [none], length: 24
 00:00:03.597347 eth0  In  IP 10.0.13.2.57029 > 10.0.13.3.3784: BFDv1, Control, State Up, Flags: [none], length: 24
 00:00:03.599935 eth1  In  IP 10.0.23.2.57325 > 10.0.23.3.3784: BFDv1, Control, State Up, Flags: [none], length: 24
 00:00:03.613290 eth1  Out IP 10.0.23.3.33242 > 10.0.23.2.3784: BFDv1, Control, State Up, Flags: [none], length: 24
 00:00:03.623533 eth3  Out IP 10.0.35.2.60297 > 10.0.35.3.3784: BFDv1, Control, State Up, Flags: [none], length: 24
 00:00:03.661762 eth0  Out IP 10.0.13.3.41618 > 10.0.13.2.3784: BFDv1, Control, State Up, Flags: [none], length: 24
 00:00:03.666777 eth3  In  IP 10.0.35.3.46520 > 10.0.35.2.3784: BFDv1, Control, State Up, Flags: [none], length: 24
 00:00:03.673007 eth0  In  IP 10.0.13.2.57029 > 10.0.13.3.3784: BFDv1, Control, State Up, Flags: [none], length: 24
 00:00:03.681856 eth1  In  IP 10.0.23.2.57325 > 10.0.23.3.3784: BFDv1, Control, State Up, Flags: [none], length: 24
 00:00:03.695275 eth1  Out IP 10.0.23.3.33242 > 10.0.23.2.3784: BFDv1, Control, State Up, Flags: [none], length: 24
 00:00:03.704529 eth3  Out IP 10.0.35.2.60297 > 10.0.35.3.3784: BFDv1, Control, State Up, Flags: [none], length: 24
 00:00:03.746788 eth3  In  IP 10.0.35.3.46520 > 10.0.35.2.3784: BFDv1, Control, State Up, Flags: [none], length: 24
 00:00:03.750110 eth0  Out IP 10.0.13.3.41618 > 10.0.13.2.3784: BFDv1, Control, State Up, Flags: [none], length: 24
 00:00:03.753326 eth0  In  IP 10.0.13.2.57029 > 10.0.13.3.3784: BFDv1, Control, State Up, Flags: [none], length: 24
 00:00:03.766935 eth1  In  IP 10.0.23.2.57325 > 10.0.23.3.3784: BFDv1, Control, State Up, Flags: [none], length: 24
 00:00:03.775272 eth1  Out IP 10.0.23.3.33242 > 10.0.23.2.3784: BFDv1, Control, State Up, Flags: [none], length: 24
 00:00:03.792543 eth3  Out IP 10.0.35.2.60297 > 10.0.35.3.3784: BFDv1, Control, State Up, Flags: [none], length: 24
 00:00:03.822829 eth3  In  IP 10.0.35.3.46520 > 10.0.35.2.3784: BFDv1, Control, State Up, Flags: [none], length: 24
 00:00:03.831557 eth0  In  IP 10.0.13.2.57029 > 10.0.13.3.3784: BFDv1, Control, State Up, Flags: [none], length: 24
 00:00:03.837903 eth0  Out IP 10.0.13.3.41618 > 10.0.13.2.3784: BFDv1, Control, State Up, Flags: [none], length: 24
 00:00:03.848506 eth1  In  IP 10.0.23.2.57325 > 10.0.23.3.3784: BFDv1, Control, State Up, Flags: [none], length: 24
 00:00:03.852797 eth1  Out IP 10.0.23.3.33242 > 10.0.23.2.3784: BFDv1, Control, State Up, Flags: [none], length: 24
 00:00:03.876075 eth3  Out IP 10.0.35.2.60297 > 10.0.35.3.3784: BFDv1, Control, State Up, Flags: [none], length: 24
 00:00:03.906304 eth3  In  IP 10.0.35.3.46520 > 10.0.35.2.3784: BFDv1, Control, State Up, Flags: [none], length: 24
 00:00:03.914699 eth0  Out IP 10.0.13.3.41618 > 10.0.13.2.3784: BFDv1, Control, State Up, Flags: [none], length: 24
 00:00:03.919988 eth0  In  IP 10.0.13.2.57029 > 10.0.13.3.3784: BFDv1, Control, State Up, Flags: [none], length: 24
 00:00:03.923198 eth1  In  IP 10.0.23.2.57325 > 10.0.23.3.3784: BFDv1, Control, State Up, Flags: [none], length: 24
 00:00:03.929591 eth1  Out IP 10.0.23.3.33242 > 10.0.23.2.3784: BFDv1, Control, State Up, Flags: [none], length: 24
 00:00:03.961872 eth3  Out IP 10.0.35.2.60297 > 10.0.35.3.3784: BFDv1, Control, State Up, Flags: [none], length: 24
 00:00:03.984140 eth3  In  IP 10.0.35.3.46520 > 10.0.35.2.3784: BFDv1, Control, State Up, Flags: [none], length: 24
